code,title,size,image_url,torrent_url,tags,actresses,date,page_url
FC2PPV4916119,FC2-PPV-4916119 ♀222 ぷちはめ！かわいいかおのこに騎乗位で中出し！ ★特典で無修正,1.9 GB,https://contents-thumbnail2.fc2.com/w1280/storage106000.contents.fc2.com/file/376/37547480/1780651610.48.jpg,https://onejav.com/torrent/fc2ppv4916119/download/54888071/onejav.com_fc2ppv4916119.torrent,"Amateur, Creampie, FC2, Petite, Uncensored",,2026-06-07,https://onejav.com/torrent/fc2ppv4916119
FC2PPV4916122,FC2-PPV-4916122 む〇この彼女と温泉へ不倫旅行に行ってきましたぁ！　老舗旅館で小作りセックスしてきましたｗｗ,1.7 GB,https://contents-thumbnail2.fc2.com/w1280/storage106000.contents.fc2.com/file/358/35716993/1780652415.01.jpg,https://onejav.com/torrent/fc2ppv4916122/download/38927717/onejav.com_fc2ppv4916122.torrent,"Amateur, FC2",,2026-06-07,https://onejav.com/torrent/fc2ppv4916122
FC2PPV4916267,FC2-PPV-4916267 ※オホ声【純白美女】くすみ1つない超美肌田舎教師の完全メス堕ち。濁音喘ぎで子宮が震え着床を懇願し2度生中出し。。,3.9 GB,https://contents-thumbnail2.fc2.com/w1280/storage201000.contents.fc2.com/file/404/40364366/1780686921.78.jpg,https://onejav.com/torrent/fc2ppv4916267/download/95116565/onejav.com_fc2ppv4916267.torrent,"Amateur, Conceived, Creampie, FC2, POV, Slender, SM, Squirting, Uncensored",,2026-06-07,https://onejav.com/torrent/fc2ppv4916267
FC2PPV4916281,FC2-PPV-4916281 ※14日まで初回限定58％OFF※【顔出し】喘いでしまうのをじっとこらえて**するも激しいピストン運動されると不覚にも漏れ出してしまう人妻,3.1 GB,https://contents-thumbnail2.fc2.com/w1280/storage201000.contents.fc2.com/file/377/37682362/1780700020.6.jpg,https://onejav.com/torrent/fc2ppv4916281/download/64079425/onejav.com_fc2ppv4916281.torrent,"Affair, Amateur, Blow, Creampie, FC2, Married Woman, POV, Slender",,2026-06-07,https://onejav.com/torrent/fc2ppv4916281
FC2PPV4916375,FC2-PPV-4916375 【爆乳OL】高学歴しごでき不動産OL潮吹きオイルまみれ生中出し,5.9 GB,https://contents-thumbnail2.fc2.com/w1280/storage200000.contents.fc2.com/file/367/36631962/1780714971.76.jpg,https://onejav.com/torrent/fc2ppv4916375/download/53232596/onejav.com_fc2ppv4916375.torrent,"4K, Amateur, Big Tits, Breasts, Creampie, Documentary, FC2, Nasty, Hardcore, OL, Petite, Sexy, Squirting",,2026-06-07,https://onejav.com/torrent/fc2ppv4916375
FC2PPV4916476,FC2-PPV-4916476 めっちゃ恥ずかしい…(/ω＼)初めてのP活体験で中出し懇願！笑顔の眩しい露離婚歓喜の童顔美ショ.ウ女がヲジの生チンでトロける**厳禁の秘蔵映像,5.0 GB,https://contents-thumbnail2.fc2.com/w1280/storage200000.contents.fc2.com/file/388/38703450/1780727676.29.jpg,https://onejav.com/torrent/fc2ppv4916476/download/83134968/onejav.com_fc2ppv4916476.torrent,"Amateur, Creampie, FC2, Female College Student, POV, Uncensored",,2026-06-07,https://onejav.com/torrent/fc2ppv4916476
FC2PPV4916633,FC2-PPV-4916633 題名　本-/物. /し./ろ.◯/. と♡清./楚.可愛い♡看護師を夢見る.学./生.ゆずちゃん♡お./◯./ね.に困./り撮影に♡色白軟体body♡激イキ♡無./◯./か.中.出しエッチ♡,7.7 GB,https://contents-thumbnail2.fc2.com/w1280/storage200000.contents.fc2.com/file/373/37250122/1780740372.87.jpg,https://onejav.com/torrent/fc2ppv4916633/download/71615043/onejav.com_fc2ppv4916633.torrent,"Amateur, Beautiful legs, Breasts, Butt, Creampie, FC2, POV",,2026-06-07,https://onejav.com/torrent/fc2ppv4916633
FC2PPV4915033,FC2-PPV-4915033 【5日間限定販売・薄顔モザイク・セット販売】金融屋に頼まれて風俗に落とす前の人妻を調教**　前編・後編　薄顔モザ完全版,1.9 GB,https://contents-thumbnail2.fc2.com/w1280/storage201000.contents.fc2.com/file/335/33465695/1780554437.66.jpg,https://onejav.com/torrent/fc2ppv4915033/download/21997840/onejav.com_fc2ppv4915033.torrent,"Amateur, FC2, Married Woman, Uncensored",,2026-06-07,https://onejav.com/torrent/fc2ppv4915033
FC2PPV4916236,FC2-PPV-4916236 A big-breasted Izakaya waitress gives a tits-out blowjob in an accessible restroom right after work! → In-mouth ejaculation!,6.3 GB,https://contents-thumbnail2.fc2.com/w1280/storage200000.contents.fc2.com/file/410/40988562/1780677738.03.jpg,https://onejav.com/torrent/fc2ppv4916236/download/63641519/onejav.com_fc2ppv4916236.torrent,"Amateur, Big Tits, Blow, Deep Throating, FC2",,2026-06-07,https://onejav.com/torrent/fc2ppv4916236
FC2PPV4916305,FC2-PPV-4916305 【無/本数限定価格】喉奥まで咥え込むドロドロのフェラが気持ちよすぎる激カワ本物レイヤーちゃん、ロキ○ーコスでイキ狂う！イクイク早漏雑魚まんレイヤーの大量中出しハメ撮り！,2.1 GB,https://contents-thumbnail2.fc2.com/w1280/storage201000.contents.fc2.com/file/399/39824904/1780706484.12.jpg,https://onejav.com/torrent/fc2ppv4916305/download/66724041/onejav.com_fc2ppv4916305.torrent,"Amateur, Big Tits, Blow, Cosplay, Creampie, FC2, POV",,2026-06-07,https://onejav.com/torrent/fc2ppv4916305
