code,title,size,image_url,torrent_url,tags,actresses,date,page_url
FC2PPV4933634,FC2-PPV-4933634 みほ(24)きれいなアパレル店員のお*さんに、吸うやつ使ったり、イラマしたりして中出ししました,5.2 GB,https://contents-thumbnail2.fc2.com/w1280/storage201000.contents.fc2.com/file/261/26076760/1783180675.61.jpg,https://onejav.com/torrent/fc2ppv4933634/download/97778244/onejav.com_fc2ppv4933634.torrent,"Amateur, Blow, Creampie, Deep Throating, Electric Massager, FC2, Slender, Toy, Uncensored",,2026-07-06,https://onejav.com/torrent/fc2ppv4933634
FC2PPV4933985,FC2-PPV-4933985 ホテルでフェラ抜き(JD18歳アヤネちゃん),3.2 GB,https://contents-thumbnail2.fc2.com/w1280/storage201000.contents.fc2.com/file/404/40347725/1783251026.45.jpg,https://onejav.com/torrent/fc2ppv4933985/download/18485617/onejav.com_fc2ppv4933985.torrent,"Amateur, FC2",,2026-07-06,https://onejav.com/torrent/fc2ppv4933985
FC2PPV4930662,FC2-PPV-4930662 ★SSS級★下町育ちの「江戸っ子」美人（２２）と萌え萌え浴衣で乱れまくりの生交尾⇒ピンクのおまんこに連続中出し,3.9 GB,https://contents-thumbnail2.fc2.com/w1280/storage200000.contents.fc2.com/file/389/38893931/1782732620.16.jpg,https://onejav.com/torrent/fc2ppv4930662/download/30004851/onejav.com_fc2ppv4930662.torrent,"Amateur, Beautiful Girl, Blow, Breasts, Butt, Creampie, Electric Massager, FC2, Handjob, OL, Petite, Slender, Squirting",,2026-07-06,https://onejav.com/torrent/fc2ppv4930662
FC2PPV4933419,FC2-PPV-4933419 敏感すぎるスーツ学.生21歳。膣奥を責めると痙攣が終始止まらなくなり生チ●ポぶち込まれるとト.んで屈服→大量中出し。,3.6 GB,https://contents-thumbnail2.fc2.com/w1280/storage201000.contents.fc2.com/file/373/37231718/1783139134.21.png,https://onejav.com/torrent/fc2ppv4933419/download/10136905/onejav.com_fc2ppv4933419.torrent,"Amateur, Beautiful Girl, Blow, Breasts, Creampie, FC2, POV",,2026-07-06,https://onejav.com/torrent/fc2ppv4933419
FC2PPV4932455,FC2-PPV-4932455 【緊急7/12期限セール】【1900→1400】【デカチンに〇落した週刊漫画誌グラドル】極小ワレメに巨チン喰らってマン〇ブリブリこいて〇〇イキして首〇めイラマビ〇タ喰いながら激ピストンにマ〇発情し着床,4.1 GB,https://contents-thumbnail2.fc2.com/w1280/storage200000.contents.fc2.com/file/324/32305252/1782982919.88.jpg,https://onejav.com/torrent/fc2ppv4932455/download/18919456/onejav.com_fc2ppv4932455.torrent,"Amateur, FC2",,2026-07-05,https://onejav.com/torrent/fc2ppv4932455
FC2PPV4933189,FC2-PPV-4933189 【顔/中】「やっぱりチンコが好き♡」地味目な総務部女子なのに、超絶淫乱！淫語連発で思わず口内射精・・・。,4.4 GB,https://contents-thumbnail2.fc2.com/w1280/storage201000.contents.fc2.com/file/408/40702218/1783081333.17.png,https://onejav.com/torrent/fc2ppv4933189/download/55579795/onejav.com_fc2ppv4933189.torrent,"Amateur, Blow, Cowgirl, Creampie, FC2, Handjob",,2026-07-05,https://onejav.com/torrent/fc2ppv4933189
FC2PPV4933359,FC2-PPV-4933359 絶頂回数30回超え⁉️男性経験少ないメンエス嬢がハメ撮り体験で本能覚醒！モニター越しに自分の痴態を見ながらガチイキする黒髪美**のヤバいやつ,5.4 GB,https://contents-thumbnail2.fc2.com/w1280/storage201000.contents.fc2.com/file/388/38703450/1783130999.06.jpg,https://onejav.com/torrent/fc2ppv4933359/download/01596853/onejav.com_fc2ppv4933359.torrent,"Amateur, Black Hair, Creampie, FC2, POV, Uncensored",,2026-07-05,https://onejav.com/torrent/fc2ppv4933359
300MIUM1395,スケベ顔で迫る変態ジト目ま◯こww本人はSに見られるって言ってるけど、目がもうドMの瞳してるんよね。「挿れて…くれるよね？」期待でいっぱいのイヤらしい目つきで御法度チ◯ポおねだりww待望の挿入でグネグネと止まらない腰。。ドMの女って騎乗位慣れてるよなww ：file.43,3.6 GB,https://image.mgstage.com/images/prestigepremium/300mium/1395/pb_e_300mium-1395.jpg,https://onejav.com/torrent/300mium1395/download/67875363/onejav.com_300mium1395.torrent,"Amateur, Big Tits, Butt, Electric Massager, Lotion, Voyeur",,2026-07-05,https://onejav.com/torrent/300mium1395
SIRO5702,守りたいこの笑顔。ピュアな笑顔が魅力的！【なぎさ 20歳 学生】 シコリみマックスどすけべピッチピチボディに夢中！！ 【初撮り】ネットでAV応募→AV体験撮影 2583,2.6 GB,https://image.mgstage.com/images/shirouto/siro/5702/pb_e_siro-5702.jpg,https://onejav.com/torrent/siro5702/download/78266177/onejav.com_siro5702.torrent,"Amateur, Debut Production, Female College Student, POV, Shaved",,2026-07-04,https://onejav.com/torrent/siro5702
FC2PPV4933052,FC2-PPV-4933052 【無修正・中出し・顔出し・特典あり】毎日中出し浮気三昧の人妻ビッチ「**は誰の子か分かりません」,1.5 GB,https://contents-thumbnail2.fc2.com/w1280/storage201000.contents.fc2.com/file/401/40016833/1783066549.37.jpg,https://onejav.com/torrent/fc2ppv4933052/download/46701397/onejav.com_fc2ppv4933052.torrent,"Amateur, Creampie, FC2, Married Woman, Mature Woman, POV, Pregnant, Uncensored",,2026-07-04,https://onejav.com/torrent/fc2ppv4933052
