code,title,size,image_url,torrent_url,tags,actresses,date,page_url
FC2PPV4923719,FC2-PPV-4923719 趣味の乗馬が大好きな上流セレブ人妻 乗馬で鍛えた激しすぎる騎乗位テクで男を翻弄するヤリマン熟女,6.0 GB,https://contents-thumbnail2.fc2.com/w1280/storage201000.contents.fc2.com/file/297/29683723/1781849351.15.jpg,https://onejav.com/torrent/fc2ppv4923719/download/22635294/onejav.com_fc2ppv4923719.torrent,"Amateur, Creampie, FC2, Married Woman, POV",,2026-06-23,https://onejav.com/torrent/fc2ppv4923719
FC2PPV4924344,FC2-PPV-4924344 【初回70%オフ・初撮り♡】 0419_001 まやちゃん18歳 2026年大注目の色白Fカップ元アイドルが満を持して孕ませオジサンとのハメ撮りに登場！が、不完全燃焼となったのでお安くバラマキ販売（爆,4.5 GB,https://contents-thumbnail2.fc2.com/w1280/storage200000.contents.fc2.com/file/383/38288919/1781934256.49.jpg,https://onejav.com/torrent/fc2ppv4924344/download/94982009/onejav.com_fc2ppv4924344.torrent,"69, Amateur, Beautiful Girl, Big Tits, Black Hair, Blow, Breasts, FC2, Handjob, Masturbation, POV",,2026-06-23,https://onejav.com/torrent/fc2ppv4924344
FC2PPV4924800,FC2-PPV-4924800 【無】清楚な看護士の色白Fカップ素人ボティ☆ロケット乳がブルンッブルン。そのまま濃厚膣内射精。,980.6 MB,https://contents-thumbnail2.fc2.com/w1280/storage200000.contents.fc2.com/file/411/41024993/1782023028.97.jpg,https://onejav.com/torrent/fc2ppv4924800/download/61399727/onejav.com_fc2ppv4924800.torrent,"Amateur, FC2, POV, Uncensored",,2026-06-23,https://onejav.com/torrent/fc2ppv4924800
FC2PPV4922731,FC2-PPV-4922731 欲求不満で浮気しにやってきた普通の奥さんがリアルで超エロい  ※長編〈ハメ撮り〉〈素人〉※レビュー特典あり,6.7 GB,https://contents-thumbnail2.fc2.com/w1280/storage200000.contents.fc2.com/file/376/37591116/1781678161.65.jpg,https://onejav.com/torrent/fc2ppv4922731/download/90679932/onejav.com_fc2ppv4922731.torrent,"Affair, Amateur, Beautiful Girl, Blow, Date, FC2, Married Woman, POV",,2026-06-22,https://onejav.com/torrent/fc2ppv4922731
FC2PPV4923958,FC2-PPV-4923958 経験人数少!中出しNG!ウブでまじめなDカップOLにイヤイヤチンポ責めさせて最後はピュアマンコにチンポねじこむ！,4.4 GB,https://contents-thumbnail2.fc2.com/w1280/storage200000.contents.fc2.com/file/408/40702218/1781870654.05.png,https://onejav.com/torrent/fc2ppv4923958/download/82546334/onejav.com_fc2ppv4923958.torrent,"Amateur, Blow, Breasts, FC2, Handjob, Petite, Vibe",,2026-06-22,https://onejav.com/torrent/fc2ppv4923958
FC2PPV4924919,FC2-PPV-4924919 みり◯ゃ似のスレンダーラウンジ嬢さんと浴衣をきて背徳感MAXの中出しプレイ,4.0 GB,https://contents-thumbnail2.fc2.com/w1280/storage200000.contents.fc2.com/file/382/38167029/1782044985.49.png,https://onejav.com/torrent/fc2ppv4924919/download/41954656/onejav.com_fc2ppv4924919.torrent,"Amateur, Beautiful Girl, Creampie, FC2, POV, Slender",,2026-06-22,https://onejav.com/torrent/fc2ppv4924919
NGHJ064,童貞君のオナニーのお手伝いしてくれませんか？超絶かわいい心優しいチアガールが童貞君の敏感チ〇ポを励まし互いに何度も気持ちよくなる筆おろしSEX！！,8.5 GB,https://pics.dmm.co.jp/mono/movie/adult/nghj064/nghj064pl.jpg,https://onejav.com/torrent/nghj064/download/37320915/onejav.com_nghj064.torrent,"Amateur, Cheerleader, Creampie, Nampa, Virgin Man",,2026-06-22,https://onejav.com/torrent/nghj064
476MLA278,【本編顔出し】気持ち良すぎて潮が止まらない！？～巨乳で可愛すぎる高学歴ミスコン女子大生が快楽堕ちするまで～,3.6 GB,https://image.mgstage.com/images/manmanland/476mla/278/pb_e_476mla-278.jpg,https://onejav.com/torrent/476mla278/download/84757110/onejav.com_476mla278.torrent,"Amateur, Big Tits, Creampie, Deep Throating, Female College Student, Nasty, Hardcore, POV, Squirting",さら,2026-06-21,https://onejav.com/torrent/476mla278
PETS066,ボクがオナホ覚醒マゾ男の娘になるまで…,4.0 GB,https://pics.dmm.co.jp/mono/movie/adult/pets066/pets066pl.jpg,https://onejav.com/torrent/pets066/download/52726761/onejav.com_pets066.torrent,"Amateur, Cross Dressing, Rolling Back Eyes, Fainting, Transsexual",,2026-06-21,https://onejav.com/torrent/pets066
WA588,素人妻ナンパ全員生中出し5時間セレブDX 105,9.7 GB,https://pics.dmm.co.jp/mono/movie/adult/h_047wa588/h_047wa588pl.jpg,https://onejav.com/torrent/wa588/download/42806454/onejav.com_wa588.torrent,"4HR+, Amateur, Big Tits, Creampie, Married Woman, Nampa",,2026-06-21,https://onejav.com/torrent/wa588
