code,title,size,image_url,torrent_url,tags,actresses,date,page_url
FC2PPV4922731,FC2-PPV-4922731 欲求不満で浮気しにやってきた普通の奥さんがリアルで超エロい  ※長編〈ハメ撮り〉〈素人〉※レビュー特典あり,6.7 GB,https://contents-thumbnail2.fc2.com/w1280/storage200000.contents.fc2.com/file/376/37591116/1781678161.65.jpg,https://onejav.com/torrent/fc2ppv4922731/download/47221519/onejav.com_fc2ppv4922731.torrent,"Affair, Amateur, Beautiful Girl, Blow, Date, FC2, Married Woman, POV",,2026-06-22,https://onejav.com/torrent/fc2ppv4922731
FC2PPV4923958,FC2-PPV-4923958 経験人数少!中出しNG!ウブでまじめなDカップOLにイヤイヤチンポ責めさせて最後はピュアマンコにチンポねじこむ！,4.4 GB,https://contents-thumbnail2.fc2.com/w1280/storage200000.contents.fc2.com/file/408/40702218/1781870654.05.png,https://onejav.com/torrent/fc2ppv4923958/download/00322511/onejav.com_fc2ppv4923958.torrent,"Amateur, Blow, Breasts, FC2, Handjob, Petite, Vibe",,2026-06-22,https://onejav.com/torrent/fc2ppv4923958
FC2PPV4924919,FC2-PPV-4924919 みり◯ゃ似のスレンダーラウンジ嬢さんと浴衣をきて背徳感MAXの中出しプレイ,4.0 GB,https://contents-thumbnail2.fc2.com/w1280/storage200000.contents.fc2.com/file/382/38167029/1782044985.49.png,https://onejav.com/torrent/fc2ppv4924919/download/68491593/onejav.com_fc2ppv4924919.torrent,"Amateur, Beautiful Girl, Creampie, FC2, POV, Slender",,2026-06-22,https://onejav.com/torrent/fc2ppv4924919
NGHJ064,童貞君のオナニーのお手伝いしてくれませんか？超絶かわいい心優しいチアガールが童貞君の敏感チ〇ポを励まし互いに何度も気持ちよくなる筆おろしSEX！！,8.5 GB,https://pics.dmm.co.jp/mono/movie/adult/nghj064/nghj064pl.jpg,https://onejav.com/torrent/nghj064/download/17104520/onejav.com_nghj064.torrent,"Amateur, Cheerleader, Creampie, Nampa, Virgin Man",,2026-06-22,https://onejav.com/torrent/nghj064
476MLA278,【本編顔出し】気持ち良すぎて潮が止まらない！？～巨乳で可愛すぎる高学歴ミスコン女子大生が快楽堕ちするまで～,3.6 GB,https://image.mgstage.com/images/manmanland/476mla/278/pb_e_476mla-278.jpg,https://onejav.com/torrent/476mla278/download/87544926/onejav.com_476mla278.torrent,"Amateur, Big Tits, Creampie, Deep Throating, Female College Student, Nasty, Hardcore, POV, Squirting",さら,2026-06-21,https://onejav.com/torrent/476mla278
PETS066,ボクがオナホ覚醒マゾ男の娘になるまで…,4.0 GB,https://pics.dmm.co.jp/mono/movie/adult/pets066/pets066pl.jpg,https://onejav.com/torrent/pets066/download/26696839/onejav.com_pets066.torrent,"Amateur, Cross Dressing, Rolling Back Eyes, Fainting, Transsexual",,2026-06-21,https://onejav.com/torrent/pets066
WA588,素人妻ナンパ全員生中出し5時間セレブDX 105,9.7 GB,https://pics.dmm.co.jp/mono/movie/adult/h_047wa588/h_047wa588pl.jpg,https://onejav.com/torrent/wa588/download/37710849/onejav.com_wa588.torrent,"4HR+, Amateur, Big Tits, Creampie, Married Woman, Nampa",,2026-06-21,https://onejav.com/torrent/wa588
857OMG032,相席ラウンジで出会った彼氏持ち女子がエロがってくるから、思いっきりハメ潮吹かせてビシャビシャに。欲しがり過ぎの浮気パイパンま○こに、遠慮なく快楽のまま中出しNTRしました、、、,3.3 GB,https://image.mgstage.com/images/creampie/857omg/032/pb_e_857omg-032.jpg,https://onejav.com/torrent/857omg032/download/80590077/onejav.com_857omg032.torrent,"Amateur, Creampie, POV, Shaved, Squirting",,2026-06-21,https://onejav.com/torrent/857omg032
FC2PPV4924404,FC2-PPV-4924404 リアルガチ　友達の奥さん29歳の保育士とNTR 超エロい人妻,1.1 GB,https://contents-thumbnail2.fc2.com/w1280/storage201000.contents.fc2.com/file/274/27324139/1781939903.63.PNG,https://onejav.com/torrent/fc2ppv4924404/download/57892023/onejav.com_fc2ppv4924404.torrent,"Amateur, Blow, Cunnilingus, FC2, Married Woman, POV",,2026-06-21,https://onejav.com/torrent/fc2ppv4924404
FC2PPV4924467,FC2-PPV-4924467 ※神作【お宝発見】超照れ屋で初心佐賀の残るｱｲﾄﾞﾙの原石。不安からｶﾞﾁ恋中出しまでの生々しい貴重な映像。。,4.7 GB,https://contents-thumbnail2.fc2.com/w1280/storage200000.contents.fc2.com/file/404/40364366/1781950296.73.jpg,https://onejav.com/torrent/fc2ppv4924467/download/68880965/onejav.com_fc2ppv4924467.torrent,"Amateur, Beautiful Girl, Creampie, FC2, POV, Slender, Uncensored",,2026-06-21,https://onejav.com/torrent/fc2ppv4924467
