code,title,size,image_url,torrent_url,tags,actresses,date,page_url
FC2PPV4916119,FC2-PPV-4916119 ♀222 ぷちはめ！かわいいかおのこに騎乗位で中出し！ ★特典で無修正,1.9 GB,https://contents-thumbnail2.fc2.com/w1280/storage106000.contents.fc2.com/file/376/37547480/1780651610.48.jpg,https://onejav.com/torrent/fc2ppv4916119/download/54888071/onejav.com_fc2ppv4916119.torrent,"Amateur, Creampie, FC2, Petite, Uncensored",,2026-06-07,https://onejav.com/torrent/fc2ppv4916119
FC2PPV4916267,FC2-PPV-4916267 ※オホ声【純白美女】くすみ1つない超美肌田舎教師の完全メス堕ち。濁音喘ぎで子宮が震え着床を懇願し2度生中出し。。,3.9 GB,https://contents-thumbnail2.fc2.com/w1280/storage201000.contents.fc2.com/file/404/40364366/1780686921.78.jpg,https://onejav.com/torrent/fc2ppv4916267/download/95116565/onejav.com_fc2ppv4916267.torrent,"Amateur, Conceived, Creampie, FC2, POV, Slender, SM, Squirting, Uncensored",,2026-06-07,https://onejav.com/torrent/fc2ppv4916267
FC2PPV4916281,FC2-PPV-4916281 ※14日まで初回限定58％OFF※【顔出し】喘いでしまうのをじっとこらえて**するも激しいピストン運動されると不覚にも漏れ出してしまう人妻,3.1 GB,https://contents-thumbnail2.fc2.com/w1280/storage201000.contents.fc2.com/file/377/37682362/1780700020.6.jpg,https://onejav.com/torrent/fc2ppv4916281/download/64079425/onejav.com_fc2ppv4916281.torrent,"Affair, Amateur, Blow, Creampie, FC2, Married Woman, POV, Slender",,2026-06-07,https://onejav.com/torrent/fc2ppv4916281
FC2PPV4916375,FC2-PPV-4916375 【爆乳OL】高学歴しごでき不動産OL潮吹きオイルまみれ生中出し,5.9 GB,https://contents-thumbnail2.fc2.com/w1280/storage200000.contents.fc2.com/file/367/36631962/1780714971.76.jpg,https://onejav.com/torrent/fc2ppv4916375/download/53232596/onejav.com_fc2ppv4916375.torrent,"4K, Amateur, Big Tits, Breasts, Creampie, Documentary, FC2, Nasty, Hardcore, OL, Petite, Sexy, Squirting",,2026-06-07,https://onejav.com/torrent/fc2ppv4916375
FC2PPV4916476,FC2-PPV-4916476 めっちゃ恥ずかしい…(/ω＼)初めてのP活体験で中出し懇願！笑顔の眩しい露離婚歓喜の童顔美ショ.ウ女がヲジの生チンでトロける**厳禁の秘蔵映像,5.0 GB,https://contents-thumbnail2.fc2.com/w1280/storage200000.contents.fc2.com/file/388/38703450/1780727676.29.jpg,https://onejav.com/torrent/fc2ppv4916476/download/83134968/onejav.com_fc2ppv4916476.torrent,"Amateur, Creampie, FC2, Female College Student, POV, Uncensored",,2026-06-07,https://onejav.com/torrent/fc2ppv4916476
FC2PPV4916633,FC2-PPV-4916633 題名　本-/物. /し./ろ.◯/. と♡清./楚.可愛い♡看護師を夢見る.学./生.ゆずちゃん♡お./◯./ね.に困./り撮影に♡色白軟体body♡激イキ♡無./◯./か.中.出しエッチ♡,7.7 GB,https://contents-thumbnail2.fc2.com/w1280/storage200000.contents.fc2.com/file/373/37250122/1780740372.87.jpg,https://onejav.com/torrent/fc2ppv4916633/download/71615043/onejav.com_fc2ppv4916633.torrent,"Amateur, Beautiful legs, Breasts, Butt, Creampie, FC2, POV",,2026-06-07,https://onejav.com/torrent/fc2ppv4916633
FC2PPV4916305,FC2-PPV-4916305 【無/本数限定価格】喉奥まで咥え込むドロドロのフェラが気持ちよすぎる激カワ本物レイヤーちゃん、ロキ○ーコスでイキ狂う！イクイク早漏雑魚まんレイヤーの大量中出しハメ撮り！,2.1 GB,https://contents-thumbnail2.fc2.com/w1280/storage201000.contents.fc2.com/file/399/39824904/1780706484.12.jpg,https://onejav.com/torrent/fc2ppv4916305/download/66724041/onejav.com_fc2ppv4916305.torrent,"Amateur, Big Tits, Blow, Cosplay, Creampie, FC2, POV",,2026-06-07,https://onejav.com/torrent/fc2ppv4916305
FC2PPV4916453,FC2-PPV-4916453 【初回70%オフ】 0202_011 みさちゃん19歳 ミニスカ制服＋ツインテールの美女JDセフレのドスケベ騎乗位 VS 孕ませオジサンの鬼ピストン！種付け中出しノックトアップ試合決定で！（爆）,4.3 GB,https://contents-thumbnail2.fc2.com/w1280/storage201000.contents.fc2.com/file/383/38288919/1780724994.96.jpg,https://onejav.com/torrent/fc2ppv4916453/download/58037975/onejav.com_fc2ppv4916453.torrent,"Amateur, Beautiful Girl, Butt, Conceived, Creampie, FC2, Female College Student, POV, Uniform",,2026-06-07,https://onejav.com/torrent/fc2ppv4916453
FC2PPV4916648,FC2-PPV-4916648 【無】豊満なＨカップ爆乳♪和菓子屋さんで働く美女に濃厚クリームをたっぷり生中出し☆,1.3 GB,https://contents-thumbnail2.fc2.com/w1280/storage201000.contents.fc2.com/file/411/41024993/1780744102.87.jpg,https://onejav.com/torrent/fc2ppv4916648/download/62310925/onejav.com_fc2ppv4916648.torrent,"Amateur, Beautiful Girl, Big Tits, Creampie, FC2, POV, Uncensored",,2026-06-07,https://onejav.com/torrent/fc2ppv4916648
FC2PPV4861998,FC2-PPV-4861998 【個人撮影】清楚系グラマラス美巨乳OLあやのちゃん前後編セット【高画質リマスター版】,12.0 GB,https://contents-thumbnail2.fc2.com/w1280/storage201000.contents.fc2.com/file/315/31464497/1773195050.29.jpg,https://onejav.com/torrent/fc2ppv4861998/download/51279953/onejav.com_fc2ppv4861998.torrent,"Amateur, Beautiful Girl, Creampie, FC2, POV, Uncensored",,2026-06-07,https://onejav.com/torrent/fc2ppv4861998
