code,title,size,image_url,torrent_url,tags,actresses,date,page_url
FC2PPV4921044,FC2-PPV-4921044 【7/6まで特別価格】すべてを手に入れた爆乳女社長の超絶フェラテクに悶絶。,1.0 GB,https://contents-thumbnail2.fc2.com/w1280/storage200000.contents.fc2.com/file/355/35406629/1781433675.26.jpg,https://onejav.com/torrent/fc2ppv4921044/download/96442475/onejav.com_fc2ppv4921044.torrent,"Amateur, Beautiful Girl, Big Tits, Blow, Cosplay, Creampie, FC2, Nasty, Hardcore, No Bra, POV, Secretary",,2026-06-20,https://onejav.com/torrent/fc2ppv4921044
FC2PPV4923025,FC2-PPV-4923025 ※25日まで初回限定60％OFF※【初どり貴重・天然パイパン】*のTシャツを着てきてしまった天然のティーンエイジの若妻に中出し性教育,3.9 GB,https://contents-thumbnail2.fc2.com/w1280/storage201000.contents.fc2.com/file/377/37682362/1781731170.92.jpg,https://onejav.com/torrent/fc2ppv4923025/download/36911166/onejav.com_fc2ppv4923025.torrent,"Affair, Amateur, Creampie, Electric Massager, FC2, Married Woman, POV, Shaved",,2026-06-20,https://onejav.com/torrent/fc2ppv4923025
FC2PPV4923516,FC2-PPV-4923516 【5日間限定50%オフ・中出し】固い肉棒を言葉でも態度でも求めてきた痴女妻　言葉責めに寸止めと好き放題で男の体を甚振り続けました・・・,967.4 MB,https://contents-thumbnail2.fc2.com/w1280/storage200000.contents.fc2.com/file/335/33465695/1781807719.99.jpg,https://onejav.com/torrent/fc2ppv4923516/download/91672332/onejav.com_fc2ppv4923516.torrent,"Amateur, Creampie, FC2, Married Woman, Slut, Uncensored",,2026-06-20,https://onejav.com/torrent/fc2ppv4923516
CEAD753,Kカップ癒し系美熟女‘塚田しおり’～爆乳エステ・裏垢・デカ尻家政婦で堕ちる中出し3連発！！,4.9 GB,https://pics.dmm.co.jp/mono/movie/adult/cead753/cead753pl.jpg,https://onejav.com/torrent/cead753/download/85142330/onejav.com_cead753.torrent,"Big Tits, Creampie, Mature Woman, Nasty, Hardcore, Solowork, Ultra-Huge Tits",塚田しおり,2026-06-20,https://onejav.com/torrent/cead753
CEMD856,演技演出一切なし！照れて惚れるハメ撮り丸一日デート11 谷あづさ,5.8 GB,https://pics.dmm.co.jp/mono/movie/adult/cemd856/cemd856pl.jpg,https://onejav.com/torrent/cemd856/download/08756856/onejav.com_cemd856.torrent,"Acme · Orgasm, Big Tits, Creampie, Nasty, Hardcore, Solowork, Ultra-Huge Tits",谷あづさ,2026-06-20,https://onejav.com/torrent/cemd856
EKDV822,童貞は幼なじみに奪われました…初めて彼女のできた童貞のボクのためセックスの練習相手になってくれたいつもご機嫌な幼なじみ 花守夏歩,4.9 GB,https://pics.dmm.co.jp/mono/movie/adult/ekdv822/ekdv822pl.jpg,https://onejav.com/torrent/ekdv822/download/14588940/onejav.com_ekdv822.torrent,"Butt, Childhood Friend, Creampie, Cuckold, Footjob, Masturbation, Shaved, Skirt, Solowork, Uniform, Virgin Man",花守夏歩,2026-06-20,https://onejav.com/torrent/ekdv822
MIST517,オバショット おばさんの、おばさんによる、おばさんマニアのための、おばさんセックス まどかおばさん35歳,8.3 GB,https://pics.dmm.co.jp/mono/movie/adult/1mist517/1mist517pl.jpg,https://onejav.com/torrent/mist517/download/18600334/onejav.com_mist517.torrent,"3P, 4P, Creampie, Masturbation, Mature Woman, Nasty, Hardcore, POV, Urination",,2026-06-20,https://onejav.com/torrent/mist517
DLDSS518,人妻秘書 机の下の密かなクンニ情事―。 小沢菜穂,5.4 GB,https://pics.dmm.co.jp/mono/movie/adult/1dldss518/1dldss518pl.jpg,https://onejav.com/torrent/dldss518/download/58389344/onejav.com_dldss518.torrent,"Creampie, Cunnilingus, Married Woman, Mature Woman, Secretary, Solowork",小沢菜穂,2026-06-20,https://onejav.com/torrent/dldss518
HUNTC504,ビッチとの遭遇 深夜のオフィス、放課後の部室…誰もいない空間で開放的になり全裸になる変態女子と変態男子が奇跡の遭遇！！普段は決して交わらない2人だけど、この日ばかりはお互い惹かれ合い…,5.2 GB,https://pics.dmm.co.jp/mono/movie/adult/huntc504/huntc504pl.jpg,https://onejav.com/torrent/huntc504/download/31790966/onejav.com_huntc504.torrent,"Back, Blow, Cowgirl, Creampie, Nasty, Hardcore",,2026-06-20,https://onejav.com/torrent/huntc504
HUNTC534,無断外泊NTR 親友の彼女が喧嘩したと言ってボクの家にやってきた。愚痴を聞くだけのはずが、それだけで収まるはずもなく、流されるままセックスに…。翌朝、彼氏が部屋に迎えにやってきたが彼女は帰らず、何度もイカせてくれる他人チ○ポを選んでしまう。,9.2 GB,https://pics.dmm.co.jp/mono/movie/adult/huntc534/huntc534pl.jpg,https://onejav.com/torrent/huntc534/download/45407710/onejav.com_huntc534.torrent,"4HR+, Back, Blow, Cowgirl, Creampie, Nasty, Hardcore",,2026-06-20,https://onejav.com/torrent/huntc534
