code,title,size,image_url,torrent_url,tags,actresses,date,page_url
FC2PPV4930603,FC2-PPV-4930603 イクイクっ！ミニマム150cm大学１回生♪！至高のくびれ腰Ｇカップちゃん！艦これ浜風やってもらいました！パイズリ中出しエッチ編２,1.2 GB,https://contents-thumbnail2.fc2.com/w1280/storage201000.contents.fc2.com/file/391/39020690/1782725753.09.jpg,https://onejav.com/torrent/fc2ppv4930603/download/67220060/onejav.com_fc2ppv4930603.torrent,"Amateur, Big Tits, Breasts, Butt, Cosplay, Creampie, FC2, Female College Student, POV, Shaved, Titty Fuck, Uncensored",,2026-07-01,https://onejav.com/torrent/fc2ppv4930603
FC2PPV4930844,FC2-PPV-4930844 【中出し・顔出し・特典あり】デリヘル呼んだら隣に住んでる奥さんが体やってきた,1.7 GB,https://contents-thumbnail2.fc2.com/w1280/storage201000.contents.fc2.com/file/401/40016833/1782777040.09.jpg,https://onejav.com/torrent/fc2ppv4930844/download/78605124/onejav.com_fc2ppv4930844.torrent,"Amateur, Creampie, FC2, POV, Uncensored",,2026-07-01,https://onejav.com/torrent/fc2ppv4930844
KAM277,【個別指導】既婚の家庭教師と、巨根の受験生の、密室淫交盗撮記録【禁断の10カメ盗撮】（3）,4.6 GB,https://pics.dmm.co.jp/mono/movie/adult/kam277/kam277pl.jpg,https://onejav.com/torrent/kam277/download/77772119/onejav.com_kam277.torrent,"Big Tits, Creampie, Married Woman, Solowork, Tutor, Voyeur",椿りか,2026-07-01,https://onejav.com/torrent/kam277
FC2PPV4921616,FC2-PPV-4921616 70％OFF【コスプレ】ぴちぴちの１９歳で弄ぶ。初めての経験にエロコスでイキった女もカラダをゾクゾクさせて快楽の果てへ。。しめつけキツくなったおまんこに中出ししまくり！！クセになってまた来ちゃったりし,4.8 GB,https://contents-thumbnail2.fc2.com/w1280/storage200000.contents.fc2.com/file/385/38454154/1781528433.45.jpg,https://onejav.com/torrent/fc2ppv4921616/download/45631046/onejav.com_fc2ppv4921616.torrent,"Amateur, Breasts, Butt, Cosplay, Creampie, FC2, POV, Squirting, Toy, Uncensored",,2026-06-30,https://onejav.com/torrent/fc2ppv4921616
FC2PPV4925304,FC2-PPV-4925304 ★経験人数１人★ショートカットがかわいい「Eカップ」むちむち女子大生（２０）を変態彼氏のデカ太ペニスでまんこをガン突き,5.3 GB,https://contents-thumbnail2.fc2.com/w1280/storage201000.contents.fc2.com/file/389/38821312/1782116458.4.jpg,https://onejav.com/torrent/fc2ppv4925304/download/71311888/onejav.com_fc2ppv4925304.torrent,"Amateur, Big Tits, Blow, Breasts, Butt, Creampie, Facials, FC2, Female College Student, Petite, POV, Toy",,2026-06-29,https://onejav.com/torrent/fc2ppv4925304
FC2PPV4929849,FC2-PPV-4929849 【初撮り/18歳世代】経験人数1人の清純なリアル看護学校生（ギリ合法３年生）！特別実習で純粋無垢な女のコにオトコを教え込む！「看護師目指してるのに逆にお注射されちゃいましたっ」,8.4 GB,https://contents-thumbnail2.fc2.com/w1280/storage200000.contents.fc2.com/file/286/28519270/1782665303.53.jpg,https://onejav.com/torrent/fc2ppv4929849/download/49725245/onejav.com_fc2ppv4929849.torrent,"Amateur, Breasts, Butt, Creampie, FC2, POV, Slender",,2026-06-29,https://onejav.com/torrent/fc2ppv4929849
FC2PPV4929881,FC2-PPV-4929881 【完全シークレット版】【顔出し】【清楚系】某事務所所属モデル「はずき」さん２０歳、男性経験２人、おもちゃ・クリ攻め・中出しすべてが初体験,7.4 GB,https://contents-thumbnail2.fc2.com/w1280/storage201000.contents.fc2.com/file/377/37664104/1782637014.82.png,https://onejav.com/torrent/fc2ppv4929881/download/61614655/onejav.com_fc2ppv4929881.torrent,"Amateur, Creampie, FC2, Model, Uncensored",,2026-06-29,https://onejav.com/torrent/fc2ppv4929881
DLDSS522,「盗んでないなら脱いでみろ。」隅から角まで探られた万引き妻 角奈保,5.0 GB,https://pics.dmm.co.jp/mono/movie/adult/1dldss522/1dldss522pl.jpg,https://onejav.com/torrent/dldss522/download/01695543/onejav.com_dldss522.torrent,"Big Tits, Creampie, Cuckold, Married Woman, Mature Woman, Solowork",角奈保,2026-06-29,https://onejav.com/torrent/dldss522
348NTR104,【NTR】たゆんたゆんの色白おっぱいが最高すぎて毎日揉みたくなるんだよね～、早く来いよ笑,2.5 GB,https://image.mgstage.com/images/ntrnet/348ntr/104/pb_e_348ntr-104.jpg,https://onejav.com/torrent/348ntr104/download/05355632/onejav.com_348ntr104.torrent,"Amateur, Big Tits, Creampie, Deep Throating, Shaved, Squirting",,2026-06-28,https://onejav.com/torrent/348ntr104
FC2PPV4927741,FC2-PPV-4927741 【7/17迄1490pt】【初撮】神すぎる美巨乳＆クジラ体質ムスメ。超敏感美ボディが久しぶりのデカチンに膣奥まで鬼ピストンされ「ダメ、奥に当たる...！」と連続絶頂大洪水。感度抜群マンコに熱い精液注入,3.8 GB,https://contents-thumbnail2.fc2.com/w1280/storage201000.contents.fc2.com/file/370/36940995/1782464704.75.png,https://onejav.com/torrent/fc2ppv4927741/download/04492026/onejav.com_fc2ppv4927741.torrent,"Amateur, Creampie, FC2, POV, Slender, Uncensored",,2026-06-28,https://onejav.com/torrent/fc2ppv4927741
