code,title,size,image_url,torrent_url,tags,actresses,date,page_url
FC2PPV4933189,FC2-PPV-4933189 【顔/中】「やっぱりチンコが好き♡」地味目な総務部女子なのに、超絶淫乱！淫語連発で思わず口内射精・・・。,4.4 GB,https://contents-thumbnail2.fc2.com/w1280/storage201000.contents.fc2.com/file/408/40702218/1783081333.17.png,https://onejav.com/torrent/fc2ppv4933189/download/38221260/onejav.com_fc2ppv4933189.torrent,"Amateur, Blow, Cowgirl, Creampie, FC2, Handjob",,2026-07-05,https://onejav.com/torrent/fc2ppv4933189
FC2PPV4933359,FC2-PPV-4933359 絶頂回数30回超え⁉️男性経験少ないメンエス嬢がハメ撮り体験で本能覚醒！モニター越しに自分の痴態を見ながらガチイキする黒髪美**のヤバいやつ,5.4 GB,https://contents-thumbnail2.fc2.com/w1280/storage201000.contents.fc2.com/file/388/38703450/1783130999.06.jpg,https://onejav.com/torrent/fc2ppv4933359/download/51433382/onejav.com_fc2ppv4933359.torrent,"Amateur, Black Hair, Creampie, FC2, POV, Uncensored",,2026-07-05,https://onejav.com/torrent/fc2ppv4933359
OPKT037,禁断の妊娠OK中出しバイト 彩海23歳 本堂彩海,5.8 GB,https://pics.dmm.co.jp/mono/movie/adult/opkt037/opkt037pl.jpg,https://onejav.com/torrent/opkt037/download/66014559/onejav.com_opkt037.torrent,"Big Tits, Bitch, Creampie, Cum, Nasty, Hardcore, Solowork",本堂彩海,2026-07-05,https://onejav.com/torrent/opkt037
FC2PPV4933052,FC2-PPV-4933052 【無修正・中出し・顔出し・特典あり】毎日中出し浮気三昧の人妻ビッチ「**は誰の子か分かりません」,1.5 GB,https://contents-thumbnail2.fc2.com/w1280/storage201000.contents.fc2.com/file/401/40016833/1783066549.37.jpg,https://onejav.com/torrent/fc2ppv4933052/download/84801988/onejav.com_fc2ppv4933052.torrent,"Amateur, Creampie, FC2, Married Woman, Mature Woman, POV, Pregnant, Uncensored",,2026-07-04,https://onejav.com/torrent/fc2ppv4933052
FC2PPV4933155,FC2-PPV-4933155 レス2.5年の幸薄奥さん。浮気大好き貢ぎまくりで、返済不能状態へ。嫌なはずなのにあそこは大洪水,3.2 GB,https://contents-thumbnail2.fc2.com/w1280/storage200000.contents.fc2.com/file/350/34973626/1783076572.68.png,https://onejav.com/torrent/fc2ppv4933155/download/91731957/onejav.com_fc2ppv4933155.torrent,"Amateur, Black Hair, Blow, Creampie, FC2, Nasty, Hardcore, Shaved, Slender, Small Tits",,2026-07-04,https://onejav.com/torrent/fc2ppv4933155
FC2PPV4923490,FC2-PPV-4923490 【7/16迄 1132pt迄】めちゃ可愛♡癒し系彼女に部屋までリモバ入れっぱなし♡マンコ大洪水！エロモード全開で欲しがるから濃厚種付けしたよ【顔出し/無修正/中出し】,5.0 GB,https://contents-thumbnail2.fc2.com/w1280/storage201000.contents.fc2.com/file/379/37807540/1781795384.83.jpg,https://onejav.com/torrent/fc2ppv4923490/download/01782798/onejav.com_fc2ppv4923490.torrent,"Amateur, Beautiful Girl, Blow, Breasts, Creampie, FC2, Uncensored",,2026-07-04,https://onejav.com/torrent/fc2ppv4923490
FC2PPV4931887,FC2-PPV-4931887 某北区コスプレカフェの裏コース♥ランキング上位清楚嬢がイベント後のプライベートオフショットで生マンコ晒し＆イキ狂う淫乱撮影会,4.1 GB,https://contents-thumbnail2.fc2.com/w1280/storage201000.contents.fc2.com/file/388/38703450/1782924037.4.jpg,https://onejav.com/torrent/fc2ppv4931887/download/47776350/onejav.com_fc2ppv4931887.torrent,"Amateur, Creampie, FC2, POV, Uncensored",,2026-07-04,https://onejav.com/torrent/fc2ppv4931887
FC2PPV4932368,FC2-PPV-4932368 [期間限定で大放出!15000pt➡1980pt]無修正＜経験人数たった1人。青森出身　音大生18☆読者モデルスぺ値115 １６０ｃｍ45kgEカップ＞処女喪失からわずか半年で生チンポ挿入⇒中出し,4.8 GB,https://contents-thumbnail2.fc2.com/w1280/storage201000.contents.fc2.com/file/373/37232976/1782974423.09.jpg,https://onejav.com/torrent/fc2ppv4932368/download/06794406/onejav.com_fc2ppv4932368.torrent,"Amateur, Big Tits, Blow, Creampie, FC2, Nasty, Hardcore, POV, Slender, Uncensored, Uniform",,2026-07-04,https://onejav.com/torrent/fc2ppv4932368
FJIN149,じんかくきょうせいVR洗脳 学校で一番可愛かった性悪糞女を催●VRゴーグルで肉便器人生に再設計したなり 胡桃さくら,3.4 GB,https://pics.dmm.co.jp/mono/movie/adult/fjin149/fjin149pl.jpg,https://onejav.com/torrent/fjin149/download/43702159/onejav.com_fjin149.torrent,"Breasts, Creampie, Drama, Shame, Slender, Solowork",胡桃さくら,2026-07-04,https://onejav.com/torrent/fjin149
SMOK040,【太ももセクハラ】残業中のオフィスで二人きり、オキニの若手ち○ぽを連れ回し何度もムチムチ大根脚で挟みヌキするミニスカ太はり人妻女上司 九井スナオ,5.4 GB,https://pics.dmm.co.jp/mono/movie/adult/smok040/smok040pl.jpg,https://onejav.com/torrent/smok040/download/65517678/onejav.com_smok040.torrent,"Creampie, Huge Butt, Married Woman, OL, Solowork",九井スナオ,2026-07-04,https://onejav.com/torrent/smok040
