code,title,size,image_url,torrent_url,tags,actresses,date,page_url
FC2PPV4918885,FC2-PPV-4918885 【10日間限定セール】指、口、マ〇コ、19歳美女メンエス嬢のすべてを使用した極上エステ体験♡中出ししなけりゃもはや失礼！ 【無修正・中出し】,5.5 GB,https://contents-thumbnail2.fc2.com/w1280/storage201000.contents.fc2.com/file/381/38031442/1781090031.51.png,https://onejav.com/torrent/fc2ppv4918885/download/18217716/onejav.com_fc2ppv4918885.torrent,"Amateur, Beautiful Girl, Blow, Breasts, Butt, Creampie, FC2, POV, Uncensored",,2026-06-24,https://onejav.com/torrent/fc2ppv4918885
FC2PPV4924027,FC2-PPV-4924027 【初撮り】色白美巨乳１./０だい。推し活も良いけど、ホテルで固いチンポの押し活もスキ♡♡ 色白美巨乳１./０だいのマンコに特濃精液を注ぎ込む。,11.4 GB,https://contents-thumbnail2.fc2.com/w1280/storage201000.contents.fc2.com/file/286/28519270/1781880169.23.jpg,https://onejav.com/torrent/fc2ppv4924027/download/06863585/onejav.com_fc2ppv4924027.torrent,"Amateur, Breasts, Butt, Creampie, FC2, POV, Slender",,2026-06-24,https://onejav.com/torrent/fc2ppv4924027
FC2PPV4924999,FC2-PPV-4924999 【無】童顔黒髪で小柄で美乳すべてが良いです⤴さらに天然ヘアーがエロい！見た目に反して性には積極的でこんな女性に中だし二連発！　※特典高画質,2.7 GB,https://contents-thumbnail2.fc2.com/w1280/storage200000.contents.fc2.com/file/381/38003297/1782087727.88.jpg,https://onejav.com/torrent/fc2ppv4924999/download/62264198/onejav.com_fc2ppv4924999.torrent,"Amateur, Beautiful Girl, Big Tits, Blow, Creampie, FC2, POV, Uncensored",,2026-06-24,https://onejav.com/torrent/fc2ppv4924999
FC2PPV4925855,FC2-PPV-4925855 【7/14迄1290pt】【初撮】笑顔もカラダも圧倒的透明感ムスメ。激ピストンで色白Gカップ美乳を揺らしながら「気持ちいい、イクゥ…！」 と絶頂を繰り返す感度抜群なボディ。理性を忘れて喘ぎ散らすコ作り,5.7 GB,https://contents-thumbnail2.fc2.com/w1280/storage201000.contents.fc2.com/file/370/36940995/1782205272.42.png,https://onejav.com/torrent/fc2ppv4925855/download/02367237/onejav.com_fc2ppv4925855.torrent,"Amateur, Beautiful Girl, Breasts, Creampie, FC2, Pregnant, Uncensored",,2026-06-24,https://onejav.com/torrent/fc2ppv4925855
FC2PPV4926103,FC2-PPV-4926103 【駅弁・顔出し】【期間限定公開】【60%OFF】美乳・美尻の美女2人と生中出し孕ませ分からせ逆3Pしてきた！,3.4 GB,https://contents-thumbnail2.fc2.com/w1280/storage200000.contents.fc2.com/file/372/37151217/1782263503.77.jpg,https://onejav.com/torrent/fc2ppv4926103/download/37264329/onejav.com_fc2ppv4926103.torrent,"Amateur, Beautiful Girl, Breasts, Butt, Conceived, Creampie, FC2, POV",,2026-06-24,https://onejav.com/torrent/fc2ppv4926103
FC2PPV4923719,FC2-PPV-4923719 趣味の乗馬が大好きな上流セレブ人妻 乗馬で鍛えた激しすぎる騎乗位テクで男を翻弄するヤリマン熟女,6.0 GB,https://contents-thumbnail2.fc2.com/w1280/storage201000.contents.fc2.com/file/297/29683723/1781849351.15.jpg,https://onejav.com/torrent/fc2ppv4923719/download/88820527/onejav.com_fc2ppv4923719.torrent,"Amateur, Creampie, FC2, Married Woman, POV",,2026-06-23,https://onejav.com/torrent/fc2ppv4923719
FC2PPV4924919,FC2-PPV-4924919 みり◯ゃ似のスレンダーラウンジ嬢さんと浴衣をきて背徳感MAXの中出しプレイ,4.0 GB,https://contents-thumbnail2.fc2.com/w1280/storage200000.contents.fc2.com/file/382/38167029/1782044985.49.png,https://onejav.com/torrent/fc2ppv4924919/download/74266508/onejav.com_fc2ppv4924919.torrent,"Amateur, Beautiful Girl, Creampie, FC2, POV, Slender",,2026-06-22,https://onejav.com/torrent/fc2ppv4924919
NGHJ064,童貞君のオナニーのお手伝いしてくれませんか？超絶かわいい心優しいチアガールが童貞君の敏感チ〇ポを励まし互いに何度も気持ちよくなる筆おろしSEX！！,8.5 GB,https://pics.dmm.co.jp/mono/movie/adult/nghj064/nghj064pl.jpg,https://onejav.com/torrent/nghj064/download/44829816/onejav.com_nghj064.torrent,"Amateur, Cheerleader, Creampie, Nampa, Virgin Man",,2026-06-22,https://onejav.com/torrent/nghj064
476MLA278,【本編顔出し】気持ち良すぎて潮が止まらない！？～巨乳で可愛すぎる高学歴ミスコン女子大生が快楽堕ちするまで～,3.6 GB,https://image.mgstage.com/images/manmanland/476mla/278/pb_e_476mla-278.jpg,https://onejav.com/torrent/476mla278/download/34887582/onejav.com_476mla278.torrent,"Amateur, Big Tits, Creampie, Deep Throating, Female College Student, Nasty, Hardcore, POV, Squirting",さら,2026-06-21,https://onejav.com/torrent/476mla278
EMBZ343,誘ゥせぇるすウーまん 美原すみれ,5.4 GB,https://pics.dmm.co.jp/mono/movie/adult/embz343/embz343pl.jpg,https://onejav.com/torrent/embz343/download/28565165/onejav.com_embz343.torrent,"Big Tits, Creampie, Drama, Mature Woman, Slut, Solowork",美原すみれ,2026-06-21,https://onejav.com/torrent/embz343
