code,title,size,image_url,torrent_url,tags,actresses,date,page_url
SDAM173,普段実家で半日かけて連続イキしてるオナ狂いスイーツ販売員 オホ声・白目の大満足セックス AVデビュー 朝比奈柚羽,10.6 GB,https://pics.dmm.co.jp/mono/movie/adult/1sdam173/1sdam173pl.jpg,https://onejav.com/torrent/sdam173/download/15008866/onejav.com_sdam173.torrent,"4HR+, Debut Production, Documentary, Masturbation, Shaved, Solowork",朝比奈柚羽,2026-06-09,https://onejav.com/torrent/sdam173
390JNT120,【止められない欲求と溢れ出す潮】【デカ尻ショート妻×中出し×3P】【大人の背徳ランジェリー性交】年齢を重ねるごとに高まる性欲、旦那がいるのにどれだけヤってもヤリ足りない…そんな人妻が人生初の3Pで理性崩壊！！！欲求と共に溢れ出す潮、潮、潮！！！ハメ狂って、イキ乱れて、ぐしょ濡れ中出し性交。【結婚3年目 あきねさん 30歳】 #37,4.6 GB,https://image.mgstage.com/images/jackson/390jnt/120/pb_e_390jnt-120.jpg,https://onejav.com/torrent/390jnt120/download/51828255/onejav.com_390jnt120.torrent,"3P, 4P, Amateur, Creampie, Documentary, Lingerie, Married Woman, Squirting",,2026-06-08,https://onejav.com/torrent/390jnt120
AVSA439,【真正中出しドキュメント】現役看護師さんの孕みたがりマ●コに本物ザーメン注入8発（妊娠確定） 湊波流,6.4 GB,https://pics.dmm.co.jp/mono/movie/adult/avsa439/avsa439pl.jpg,https://onejav.com/torrent/avsa439/download/68890182/onejav.com_avsa439.torrent,"3P, 4P, Butt, Creampie, Cunnilingus, Documentary, Solowork",湊波流,2026-06-08,https://onejav.com/torrent/avsa439
NSODN020,性欲が抑えられない爆乳家政婦に密着取材ドキュメント。お代はAV男優2名とのSEXでいいですか？,5.5 GB,https://pics.dmm.co.jp/mono/movie/adult/nsodn020/nsodn020pl.jpg,https://onejav.com/torrent/nsodn020/download/52630634/onejav.com_nsodn020.torrent,"Amateur, Big Tits, Creampie, Documentary, Mature Woman",,2026-06-08,https://onejav.com/torrent/nsodn020
FC2PPV4916375,FC2-PPV-4916375 【爆乳OL】高学歴しごでき不動産OL潮吹きオイルまみれ生中出し,5.9 GB,https://contents-thumbnail2.fc2.com/w1280/storage200000.contents.fc2.com/file/367/36631962/1780714971.76.jpg,https://onejav.com/torrent/fc2ppv4916375/download/52282157/onejav.com_fc2ppv4916375.torrent,"4K, Amateur, Big Tits, Breasts, Creampie, Documentary, FC2, Nasty, Hardcore, OL, Petite, Sexy, Squirting",,2026-06-07,https://onejav.com/torrent/fc2ppv4916375
JRZE303,初撮り五十路妻ドキュメント 八尋智香,4.3 GB,https://pics.dmm.co.jp/mono/movie/adult/h_086jrze303/h_086jrze303pl.jpg,https://onejav.com/torrent/jrze303/download/87441503/onejav.com_jrze303.torrent,"Creampie, Debut Production, Documentary, Married Woman, Mature Woman, Solowork",八尋智香,2026-06-06,https://onejav.com/torrent/jrze303
JRZE304,初撮り六十路妻ドキュメント 和泉絹江,3.8 GB,https://pics.dmm.co.jp/mono/movie/adult/h_086jrze304/h_086jrze304pl.jpg,https://onejav.com/torrent/jrze304/download/39205056/onejav.com_jrze304.torrent,"Debut Production, Documentary, Married Woman, Mature Woman, Solowork, Tall",和泉絹江,2026-06-06,https://onejav.com/torrent/jrze304
NSODN018,噂のザーメンぼったくりガールズバーに潜入。超過激なザーメン搾取の実態、一部始終。,4.9 GB,https://pics.dmm.co.jp/mono/movie/adult/nsodn018/nsodn018pl.jpg,https://onejav.com/torrent/nsodn018/download/97524873/onejav.com_nsodn018.torrent,"Amateur, Creampie, Documentary, Orgy, Slut",,2026-06-06,https://onejav.com/torrent/nsodn018
TCD330,小悪魔系美人オトコノ娘と酒飲み●っぱらい‘逆アナ’デート 来栖らいら,5.2 GB,https://pics.dmm.co.jp/mono/movie/adult/tcd330/tcd330pl.jpg,https://onejav.com/torrent/tcd330/download/53824998/onejav.com_tcd330.torrent,"Cross Dressing, Documentary, M男, Solowork, Transsexual",来栖らいら,2026-06-06,https://onejav.com/torrent/tcd330
CEMD854,恥辱、陵●、とびっこ装着・繁華街デート！41 ももの真利奈,4.9 GB,https://pics.dmm.co.jp/mono/movie/adult/cemd854/cemd854pl.jpg,https://onejav.com/torrent/cemd854/download/30333298/onejav.com_cemd854.torrent,"Big Tits, Documentary, Mature Woman, Outdoors, Shame, Solowork",ももの真利奈,2026-06-06,https://onejav.com/torrent/cemd854
