code,title,image_url,page_url,views,date_scraped
FC2PPV-4912092,Creampie into E-breasted nurse who squirts too much and drools from cock,https://pic.javct.net/poster/05192026/a03e4be057.jpg,https://javct.net/v/fc2ppv-4912092,59,2026-06-14
CEMD-854,"Humiliation, Sexual Assault, Wearing A Tobikko (fish Roe) And Going On A Date In The Entertainment District! 41 Momono Marina",https://pic.javct.net/poster/05192026/e486169f85.jpg,https://javct.net/v/cemd-854,132,2026-06-14
CEMD-851,No-bra Mature Big-breasted Voluptuous Titty Date ~Drunk Drinking Edition Yui Hatano,https://pic.javct.net/poster/05192026/3d3e4bab45.jpg,https://javct.net/v/cemd-851,180,2026-06-14
HTMS-131-RM,[AI remastered version] Directed by Henry Tsukamoto A powerful video of public r**e [Uncensored L**ked],https://pic.javct.net/poster/05192026/06f084a2d7.jpg,https://javct.net/v/htms-131-rm,75,2026-06-14
YMDS-283-RM,The slut wagon is on its way! ! Happening A Go Go! ! Riho Shishido and Liz's unusual journey is out of control! Super-accelerated amateurs' reverse Nan parade with overflowing horny luggage Exposure unblocked edition [Uncensored L**ked],https://pic.javct.net/poster/05192026/fd33b27cd2.jpg,https://javct.net/v/ymds-283-rm,122,2026-06-14
EBOD-228-SUB,[Uncensored] Dutiful Mother Tia [English Subtitle],https://static.javct.net/poster/ebod-228.jpg,https://javct.net/v/ebod-228-sub,119,2026-06-14
GVG-781-RM,A Man Wants His Mother-In-Law's Obscene Tits. Eri Takigawa [Uncensored L**ked],https://pic.javct.net/poster/20212709/1632995722.jpg,https://javct.net/v/gvg-781-rm,120,2026-06-14
XVSR-153-RM,"Erotic Novel, Stepmom Is 19-Year-Old Widow, Ecstatic Tears Of Joy, Suzu Harumiya [Uncensored L**ked]",https://pic.javct.net/poster/20220406/1655917797.jpg,https://javct.net/v/xvsr-153-rm,116,2026-06-14
OBA-381-RM,Cougar Hunter Vol. 2!! My Stepson is Amazing in Bed... Ayaka Makimura [Uncensored L**ked],https://pic.javct.net/poster/20221202/1646614728.jpg,https://javct.net/v/oba-381-rm,141,2026-06-14
SPRD-870-RM,Surrogate Mama Shihori Endo [Uncensored L**ked],https://pic.javct.net/poster/20212011/1641000918.jpg,https://javct.net/v/sprd-870-rm,116,2026-06-14
SPRD-1242-RM,The Surrogate Mother Mio Morishita [Uncensored L**ked],https://pic.javct.net/poster/20212011/1640918548.jpg,https://javct.net/v/sprd-1242-rm,123,2026-06-14
SPRD-1260-SUB,"Dear Stepmom, I, I Like You Better Than My Wife... Iroha Fukuyama [English Subtitle]",https://pic.javct.net/poster/20212011/1637801865.jpg,https://javct.net/v/sprd-1260-sub,106,2026-06-14
VENU-740-RM,This Stepmother And Son Will Start Fucking 2 Seconds After Stepdaddy Leaves For Work Kana Morisawa [Uncensored L**ked],https://pic.javct.net/poster/20221202/1645061130.jpg,https://javct.net/v/venu-740-rm,113,2026-06-14
AUKG-511-RM,"A Wife And Her Mother-In-Law Became Lesbian Lovers - This Horny Stepmom Fucked Her Daughter-In-Law After Watching Her Prancing Around With Her Guard Down, Flashing Panty Shot Action At Her Alice Otsu Shuri Yamaguchi [Uncensored L**ked]",https://static.javct.net/poster/aukg-511.jpg,https://javct.net/v/aukg-511-rm,121,2026-06-14
SPRD-1392-RM,Creampie Relations With My Kind Step Mother... Emi Toda [Uncensored L**ked],https://pic.javct.net/poster/20212011/1637462437.jpg,https://javct.net/v/sprd-1392-rm,108,2026-06-14
JUL-705-RM,After The Graduation Ceremony ... Your Stepmom Is Giving You A Gift To Celebrate Your Entry Into Adulthood ... A Madonna Label Exclusive Beautiful Mature Woman Actress Is Celebrating Your Launch Into The Real World With Her Alluring Eroticism. Maki Hojo [Uncensored L**ked],https://pic.javct.net/poster/20212308/1631256467.jpg,https://javct.net/v/jul-705-rm,124,2026-06-14
GVH-364-RM,"Son-In-Law Aiming For His Mother-In-Law's Too-Sexy Big Titties, With Kyoko Ichikawa [Uncensored L**ked]",https://pic.javct.net/poster/20212011/1644641824.jpg,https://javct.net/v/gvh-364-rm,120,2026-06-14
VENU-088-RM,Magic Mother: Taking Advantage Of Mom's Body While Daddy Is Not Home Asuka Yuki [Uncensored L**ked],https://pic.javct.net/poster/20220406/1656526601.jpg,https://javct.net/v/venu-088-rm,82,2026-06-14
JUL-673-RM,I Was Forbidden To Masturbate When My Wife Was Pregnant So I had Sex With My Mother-In-Law Maki Hojo [Uncensored L**ked],https://static.javct.net/poster/jul-673.jpg,https://javct.net/v/jul-673-rm,120,2026-06-14
ADN-165-US,"Forbidden Immoral Sex 3 An Excessively Young Mother-In-Law Saeko Matsushita [English Subtitle, Reducing Mosaic]",https://pic.javct.net/poster/20221202/1646177501.jpg,https://javct.net/v/adn-165-us,114,2026-06-14
SDMU-673-RM,SOD Romance x French Publishing Living Together I'm A Spoiled Brat Living With My Stepmom Sumire Shiraishi [Uncensored L**ked],https://pic.javct.net/poster/20221202/1648868830.jpg,https://javct.net/v/sdmu-673-rm,129,2026-06-14
SPRD-644-RM,"My Stepmother, Is Way Better Than My Wife... Mari Yonezaki [Uncensored L**ked]",https://pic.javct.net/poster/20212011/1641519219.jpg,https://javct.net/v/sprd-644-rm,115,2026-06-14
SPRD-1484-RM,"Step-mother-in-law, You're Much Better Than My Wife... Iori Nanase [Uncensored L**ked]",https://pic.javct.net/poster/20212011/1637815526.jpg,https://javct.net/v/sprd-1484-rm,139,2026-06-14
JUL-645-RM,Horny Pregnant Stepmom Rides My Cock For A Creampie Behind The Old Man's Back Ai Mukai [Uncensored L**ked],https://static.javct.net/poster/jul-645.jpg,https://javct.net/v/jul-645-rm,124,2026-06-14
SPRD-993-RM,"Dear Stepmom, You're Much Better Than My Wife... Azusa Yagi [Uncensored L**ked]",https://pic.javct.net/poster/20212011/1640980073.jpg,https://javct.net/v/sprd-993-rm,124,2026-06-14
JUY-418-RM,This Stepmom Has Been Hungering For Her Son-In-Law's Big Cock 24 Hours A Day And Tempting Him To Taste Her Pussy Momoko Isshiki [Uncensored L**ked],https://pic.javct.net/poster/20221202/1647328046.jpg,https://javct.net/v/juy-418-rm,145,2026-06-14
JUY-751-RM,"Day And Night, I Crave My Daughter's Husband's Giant Cock Seduced By The Mother-In-Law Yuko Shiraki [Uncensored L**ked]",https://pic.javct.net/poster/20212709/1632936029.jpg,https://javct.net/v/juy-751-rm,168,2026-06-14
MIDA-663-RM,Acme Awakening Intensive Training 4 Main Events: Gorgeous And Cute Young Lady Imprisoned In A Dick Training Camp Nonstop 24-Hour FUCK - Mayu Misaki [Uncensored L**ked],https://pic.javct.net/poster/05192026/1af747fa3f.jpg,https://javct.net/v/mida-663-rm,170,2026-06-14
MIDA-676-RM,"Arching Back Like A Shrimp! 703 Orgasms, 8215 Convulsions, 5809cc Of Cum, Orgasm Special, Abstinence Orgasm, Teased For A Month, 24 Hours Straight Of Big Dick FUCK, Chiharu Okui [Uncensored L**ked]",https://pic.javct.net/poster/05192026/a644bd2434.jpg,https://javct.net/v/mida-676-rm,120,2026-06-14
MIDA-670-RM,"""I'll Let You Off If You Show Me Your Pussy,"" The Perverted Convenience Store Manager Threatened A Terrified Shoplifting Girl, Relentlessly Fondling Her Genitals And Raping Her. From That Day On, I Became A Sex Worker, A Toilet Girl... Miyashita Reina [Uncensored L**ked]",https://pic.javct.net/poster/05192026/8caf163b2b.jpg,https://javct.net/v/mida-670-rm,120,2026-06-14
BGN-042-RM,Rookie Prestige Exclusive Debut Mio Hinata [Uncensored L**ked],https://pic.javct.net/poster/05192026/a7c7ac4564.jpg,https://javct.net/v/bgn-042-rm,210,2026-06-14
MIDA-670,"""I'll Let You Off If You Show Me Your Pussy,"" The Perverted Convenience Store Manager Threatened A Terrified Shoplifting Girl, Relentlessly Fondling Her Genitals And Raping Her. From That Day On, I Became A Sex Worker, A Toilet Girl... Miyashita Reina",https://pic.javct.net/poster/05192026/8caf163b2b.jpg,https://javct.net/v/mida-670,120,2026-06-14
MIDA-710,"During Company Training, I Ended Up Sharing A Room With A Colleague I Disliked. I Was Unexpectedly Aroused By His Womanizing Sk**ls.",https://pic.javct.net/poster/05192026/3c147b77d8.jpg,https://javct.net/v/mida-710,120,2026-06-14
MIDA-676,"Arching Back Like A Shrimp! 703 Orgasms, 8215 Convulsions, 5809cc Of Cum, Orgasm Special, Abstinence Orgasm, Teased For A Month, 24 Hours Straight Of Big Dick FUCK, Chiharu Okui",https://pic.javct.net/poster/05192026/a644bd2434.jpg,https://javct.net/v/mida-676,120,2026-06-14
MIDA-663,Acme Awakening Intensive Training 4 Main Events: Gorgeous And Cute Young Lady Imprisoned In A Dick Training Camp Nonstop 24-Hour FUCK - Mayu Misaki,https://pic.javct.net/poster/05192026/1af747fa3f.jpg,https://javct.net/v/mida-663,170,2026-06-14
FOCS-077-RM,Everything Is My First Experience ... I'm On A Graduation Trip With My Teacher Today. Secret Sexual Intercourse Between A Teacher And A Student Whose Ethics Have Collapsed Nana Kisaki [Uncensored L**ked],https://pic.javct.net/poster/20220707/1657870384.jpg,https://javct.net/v/focs-077-rm,120,2026-06-14
XBS-006-RM,Masochist Beast Vomit Training 5th Person [Uncensored L**ked],https://pic.javct.net/poster/20230206/1687756451.jpg,https://javct.net/v/xbs-006-rm,115,2026-06-14
APNS-314-RM,Daughter Training 30 Days Of Hell Until Pregnancy Miu Wakui [Uncensored L**ked],https://pic.javct.net/poster/20230206/1686370195.jpg,https://javct.net/v/apns-314-rm,109,2026-06-14
APAK-255-RM,Extreme Carnal Affair Healing Beautiful Wife's Tokuno Service And Nasty Climax SEX Yu Hironaka [Uncensored L**ked],https://pic.javct.net/poster/20230206/1686370256.jpg,https://javct.net/v/apak-255-rm,133,2026-06-14
RBD-250,Asuka Sawamoto Cruel Humiliation Of Celebrities Industry Special Story ...,https://pic.javct.net/poster/05192026/14b5aef29d.jpg,https://javct.net/v/rbd-250,110,2026-06-14
SDZS-003-RM,Soft Body Pregnant Cheerleader Sweat Smell Edition Mariko Aoyama [Uncensored L**ked],https://pic.javct.net/poster/20230206/1687496600.jpg,https://javct.net/v/sdzs-003-rm,122,2026-06-14
STARS-197,"I Will Not Allow My Colleague Tina To Get Married, I Will Do What I Want With A Brainwashing Esthetic! Nanami Tina",https://pic.javct.net/poster/05192026/f5d60c2ecb.jpg,https://javct.net/v/stars-197,115,2026-06-14
DFE-070-RM,I Have My Daughter Feed Me. Kozue Fujita [Uncensored L**ked],https://pic.javct.net/poster/20230207/1690516715.jpg,https://javct.net/v/dfe-070-rm,118,2026-06-14
FOCS-074-RM,A Talented Whitening Girl Debuts In 10 Years As A Newcomer. [Uncensored L**ked],https://pic.javct.net/poster/20220707/1657263397.jpg,https://javct.net/v/focs-074-rm,120,2026-06-14
CPZ-69010-RM,That Kimese Mouth Doll (Love Doll) Does Intense XXX [Uncensored L**ked],https://pic.javct.net/poster/05192026/5927b40fc5.jpg,https://javct.net/v/cpz-69010-rm,134,2026-06-14
URKK-085-RM,The Perverted Landlord Next Door Makes Me Cum With Her Nipples And Fucks Me Every Day Nana Kisaki [Uncensored L**ked],https://pic.javct.net/poster/20230207/1688790423.jpg,https://javct.net/v/urkk-085-rm,133,2026-06-14
MUKD-577-RM,"We're Totally Hooked On Feeling Good! One Day's Casual Group Sex With Cumming Inside Akana Ito, Goba, Nijimura Yumi, Futaba Emma [Uncensored L**ked]",https://pic.javct.net/poster/05192026/bc1135ce4c.jpg,https://javct.net/v/mukd-577-rm,170,2026-06-14
DFE-078-RM,My Daughter Eats It. Rin Ikuta [Uncensored L**ked],https://pic.javct.net/poster/20241703/1711682908.jpg,https://javct.net/v/dfe-078-rm,133,2026-06-14
DORI-092-RM,"Paco Shooting No.92 ""I'm Going To Be A Good Wife!"" [Uncensored L**ked]",https://pic.javct.net/poster/20230206/1686540241.jpg,https://javct.net/v/dori-092-rm,75,2026-06-14
DANDY-282-RM,"President's Secretary / Housewife / Nurse / School Girls In Japan That Was Allowed To Erect A Special Edition ""DANDY Now?Ya Want To Be There Again! "" VOL.1 [Uncensored L**ked]",https://pic.javct.net/poster/05192026/4e97de74a9.jpg,https://javct.net/v/dandy-282-rm,240,2026-06-14
NHDTB-775-RM,School Girl **dnapped Confinement Gangimari Meat Urinal [Uncensored L**ked],https://pic.javct.net/poster/20230205/1683257130.jpg,https://javct.net/v/nhdtb-775-rm,190,2026-06-14
NHDTB-773-RM,Nipple Development Slut Small Breasts Girls ○ Raw Limited Ver. [Uncensored L**ked],https://pic.javct.net/poster/20230205/1683257192.jpg,https://javct.net/v/nhdtb-773-rm,200,2026-06-14
HUNTB-579-RM,"Even Had A Kind C**ldhood Friend And A Virgin Graduation Ceremony Who Held My Own Graduation Ceremony! I Was Bullied As A Virgin, And I Decided To Go To School! Just Absent On The Day Of The Graduation Ceremony! [Uncensored L**ked]",https://pic.javct.net/poster/20230206/1686286472.jpg,https://javct.net/v/huntb-579-rm,240,2026-06-14
PKPD-122-RM,[Unauthorized facial appearance] Amateur J Raw 3P Good friend circle classmate W circle female dating [Uncensored L**ked],https://pic.javct.net/poster/04112026/1776664718645.jpg,https://javct.net/v/pkpd-122-rm,114,2026-06-14
DVEH-007-RM,J○'s Temptation Sex Kozue Fujita Who Falls In Love With A Pathetic Old Man [Uncensored L**ked],https://pic.javct.net/poster/20230205/1685681775.jpg,https://javct.net/v/dveh-007-rm,155,2026-06-14
BONY-190,"""I Want To Do It With You, Uncle."" Innocent And Serious Schoolgirl In Uniform Receives Secret Home Sex Instruction. - Kawakita Ema",https://pic.javct.net/poster/05192026/af7d6afa79.jpg,https://javct.net/v/bony-190,150,2026-06-14
SDAB-142-RM,"During The Summer Vacation, I Trained And Fixed The Human Body At School So That No One Would Notice It. Elena Takeda [Uncensored L**ked]",https://pic.javct.net/poster/05192026/c0175a44df.jpg,https://javct.net/v/sdab-142-rm,110,2026-06-14
SUJI-311,"""He's Underestimating Me, So He's Doomed."" Unconscious Giant Cock Inserted Without Consent, Humiliating Pleasure, Drug-fueled Sex, Falling Into Depravity, Making A Sassy, Cold Girl Understand, Fo**ed Pussy Fucking, Cumming Inside, Apology, Shaved Pussy, Student Kaho Hanamori Natsuho",https://pic.javct.net/poster/05192026/c3c600ed7c.jpg,https://javct.net/v/suji-311,115,2026-06-14
GVH-853,Forbidden Caregiving - Nagisa Tanimura,https://pic.javct.net/poster/05192026/8e1d861660.jpg,https://javct.net/v/gvh-853,120,2026-06-14
MNGS-059-RM,"As A Rookie Teacher, I Was Taught A Lesson By A Sassy Gal Who Gave Me A Face Ride. - Haruhi Moka [Uncensored L**ked]",https://pic.javct.net/poster/05192026/6b3da8fc78.jpg,https://javct.net/v/mngs-059-rm,120,2026-06-14
MIGD-637,School Girls Love Vagina Back Out In The Back! Sato Airi,https://pic.javct.net/poster/05192026/cd52d02bd4.jpg,https://javct.net/v/migd-637,160,2026-06-14
MIST-247,J ○ Special Service Of The Visiting Club 5 Minori Kodani,https://pic.javct.net/poster/05192026/1fac4c45d1.jpg,https://javct.net/v/mist-247,160,2026-06-14
HONB-490-RM,36 Gals Who Flirt With Girls Working Part-Time In Aphrodisiac Clinical Trials [Uncensored L**ked],https://pic.javct.net/poster/05192026/de9bdce9a5.jpg,https://javct.net/v/honb-490-rm,50,2026-06-14
NACR-926-SUB,"The Doorbell Rings While She's Masturbating! She Seduces The Delivery Man And Has Sex With Him Live!? The Super Popular Slutty Live Streamer, Aya Nanjo [English Subtitle]",https://pic.javct.net/poster/20253001/1741108060.jpg,https://javct.net/v/nacr-926-sub,126,2026-06-14
GVH-854-RM,"The Mentally Unstable Ex-girlfriend Of An Escaped Convict Has Arrived! With Her Hands Still On While Still Handcuffed, She Performs A No-hands, Instant Tornado-style Fellatio, Causing Multiple Ejaculations And Swallowing As She Helps Him Escape. Kohaku Yaya [Uncensored L**ked]",https://pic.javct.net/poster/05192026/f245124410.jpg,https://javct.net/v/gvh-854-rm,145,2026-06-14
MANX-032-RM,"Kikuno Ran, The Girl Who Loves Pacifiers [Uncensored L**ked]",https://pic.javct.net/poster/05192026/7560dc27a9.jpg,https://javct.net/v/manx-032-rm,110,2026-06-14
YMDS-136-RM,Amateur Observation Monitoring-Nene Tanaka's Back Op Negotiation Extreme Null Picha Adhesion Service For Amateur Opponents-Men's Sneak Infiltration Edition [Uncensored L**ked],https://pic.javct.net/poster/20230205/1685681685.jpg,https://javct.net/v/ymds-136-rm,111,2026-06-14
HUNTA-867-RM,"""Give Me More"" ""Isn't It Still Going On? 』 Reverse Sexual Harassment Home Drinking With Two Frustrated Busty Bosses. I Was Made To Ejaculate Many Times Until Morning With A Big Tits Sandwich. [Uncensored L**ked]",https://pic.javct.net/poster/20231011/1698663145.jpg,https://javct.net/v/hunta-867-rm,240,2026-06-14
MNGS-060-RM,"My Arrogant Female Boss Is Getting Married, So I Trained Her With A Super-intense, 1000x-sensitivity Aphrodisiac Remote Vibrator And Turned Her Wedding Into A Hellish, Near-orgasm-induced, Incontinent Wedding. - Misono Waka [Uncensored L**ked]",https://pic.javct.net/poster/05192026/f7c2b8f445.jpg,https://javct.net/v/mngs-060-rm,180,2026-06-14
BACJ-059-RM,Nao Yuki [Uncensored L**ked],https://pic.javct.net/poster/20230206/1686369763.jpg,https://javct.net/v/bacj-059-rm,122,2026-06-14
MNGS-060,"My Arrogant Female Boss Is Getting Married, So I Trained Her With A Super-intense, 1000x-sensitivity Aphrodisiac Remote Vibrator And Turned Her Wedding Into A Hellish, Near-orgasm-induced, Incontinent Wedding. - Misono Waka",https://pic.javct.net/poster/05192026/f7c2b8f445.jpg,https://javct.net/v/mngs-060,180,2026-06-14
ROYD-090-RM,"Has She Fallen In Love At First Sight With My Business Suits!? Outside, She's My C**ldhood Friend, But In The Office, She's My Strict Tsundere Lady Boss, And Now We're Having Office Creampie Sex Sumire Kuramoto [Uncensored L**ked]",https://pic.javct.net/poster/20221904/1650610078.jpg,https://javct.net/v/royd-090-rm,159,2026-06-14
MEYD-588,I Was Always Taken A Mount By A Female Boss Who Was Looking At Me From The Top Even When I Was On A Business Trip And Looked Down At Her And Made Me Cum Many Times At The Woman On Top Posture. Kawakami Nanami,https://pic.javct.net/poster/05192026/44fe2a106b.jpg,https://javct.net/v/meyd-588,120,2026-06-14
FBOS-005-RM,"On A Stormy Night, Alone With Her Female Boss, Miki Yoshii [Uncensored L**ked]",https://pic.javct.net/poster/20230206/1687580377.jpg,https://javct.net/v/fbos-005-rm,120,2026-06-14
BACJ-181-RM,"The Diary Of A Stunning, Leggy, Sadistic Senior Office Lady Training Her Junior Colleague: Sumire Kurokawa [Uncensored L**ked]",https://pic.javct.net/poster/05192026/1b200daa66.jpg,https://javct.net/v/bacj-181-rm,129,2026-06-14
BACJ-181,"The Diary Of A Stunning, Leggy, Sadistic Senior Office Lady Training Her Junior Colleague: Sumire Kurokawa",https://pic.javct.net/poster/05192026/1b200daa66.jpg,https://javct.net/v/bacj-181,129,2026-06-14
MOND-249-RM,Longing Female Boss And Yuri Sasahara [Uncensored L**ked],https://pic.javct.net/poster/20230206/1687579155.jpg,https://javct.net/v/mond-249-rm,130,2026-06-14
FNS-211-RM,"""I'm going home because there's no last train!"" After a drinking party, two big-breasted bosses push me into the house and have close-up sandwich sex until morning Rin Yamitsu Jun Goddess [Uncensored L**ked]",https://pic.javct.net/poster/05192026/9936f3c10b.jpg,https://javct.net/v/fns-211-rm,229,2026-06-14
JUR-686-RM,"The Hidden True Nature Of Department Head Nanba, Who Always Belittles Her Subordinates. Revenge Training To Demote The Power-abusing Female Boss To My Personal Masochistic Slave. Nanba Akika [Uncensored L**ked]",https://pic.javct.net/poster/04112026/1776965948.jpg,https://javct.net/v/jur-686-rm,110,2026-06-14
FWTR-030-RM,"I Called A High-class Escort Service And Unexpectedly Ran Into My Female Boss! I Had Something On Her, So I Broke The No-condom Rule And Had Unprotected Sex With Her As Much As I Wanted! I Was Seriously Turned On By The Sight Of Her Biting Her Lower Lip And With Tears In Her Eyes As She Took My Thick Semen Into Her Vagina! Yuki Chitose [Uncensored L**ked]",https://pic.javct.net/poster/05192026/b4f53c4171.jpg,https://javct.net/v/fwtr-030-rm,119,2026-06-14
LULU-197-RM,"During Overtime, I Cummed Many Times Until I Got Addicted To The Marriage Boob Trap Of The Unequaled Arasa Busty Boss In The Suits Suit In The Company Alone With Two People. Takarada Monami [Uncensored L**ked]",https://pic.javct.net/poster/20230302/1679109716.jpg,https://javct.net/v/lulu-197-rm,160,2026-06-14
FNS-211,"""I'm going home because there's no last train!"" After a drinking party, two big-breasted bosses push me into the house and have close-up sandwich sex until morning Rin Yamitsu Jun Goddess",https://pic.javct.net/poster/05192026/9936f3c10b.jpg,https://javct.net/v/fns-211,229,2026-06-14
LULU-438-RM,"Having Missed The Last Train, I Was Invited To The Home Of My Usually Cool, Big-buttocked Female Boss. Unable To Resist Her Tipsy, Melting Face, I Unexpectedly Kissed Her, And She Returned The Favor With Such Intense Kissing Technique That She Thrust Her Tongue Into My Mouth. We Passionately Kissed And Had Unprotected Sex All Night Long, Burning With Passion Again And Again. [Uncensored L**ked]",https://pic.javct.net/poster/05192026/24fb5eedd7.jpg,https://javct.net/v/lulu-438-rm,155,2026-06-14
FWTR-030,"I Called A High-class Escort Service And Unexpectedly Ran Into My Female Boss! I Had Something On Her, So I Broke The No-condom Rule And Had Unprotected Sex With Her As Much As I Wanted! I Was Seriously Turned On By The Sight Of Her Biting Her Lower Lip And With Tears In Her Eyes As She Took My Thick Semen Into Her Vagina! Yuki Chitose",https://pic.javct.net/poster/05192026/b4f53c4171.jpg,https://javct.net/v/fwtr-030,119,2026-06-14
FNS-205-RM,"My boss, a moronic female boss who insulted her subordinates by calling them ""small fry,"" was a small fry, so I kept making her ejaculate until she stopped squirting. Mai Tsubasa [Uncensored L**ked]",https://pic.javct.net/poster/05192026/47095ebe8b.jpg,https://javct.net/v/fns-205-rm,125,2026-06-14
LULU-438,"Having Missed The Last Train, I Was Invited To The Home Of My Usually Cool, Big-buttocked Female Boss. Unable To Resist Her Tipsy, Melting Face, I Unexpectedly Kissed Her, And She Returned The Favor With Such Intense Kissing Technique That She Thrust Her Tongue Into My Mouth. We Passionately Kissed And Had Unprotected Sex All Night Long, Burning With Passion Again And Again.",https://pic.javct.net/poster/05192026/24fb5eedd7.jpg,https://javct.net/v/lulu-438,155,2026-06-14
FNS-205,"My boss, a moronic female boss who insulted her subordinates by calling them ""small fry,"" was a small fry, so I kept making her ejaculate until she stopped squirting. Mai Tsubasa",https://pic.javct.net/poster/05192026/47095ebe8b.jpg,https://javct.net/v/fns-205,125,2026-06-14
BBAN-506-RM,"A Cheeky New Graduate And A Lesbian Who Missed The Last Train And Shared A Room - Shiori Hamabe, Ema Futaba [Uncensored L**ked]",https://pic.javct.net/poster/20241115/1733454749.jpg,https://javct.net/v/bban-506-rm,140,2026-06-14
START-578-RM,"I met my female boss, who I hate, at a delivery health service...so I booked her for 5 days and had Polynesian sex to turn the tables on her. Mana Sakura [Uncensored L**ked]",https://pic.javct.net/poster/05192026/70287e7ca2.jpg,https://javct.net/v/start-578-rm,127,2026-06-14
START-578,"I met my female boss, who I hate, at a delivery health service...so I booked her for 5 days and had Polynesian sex to turn the tables on her. Mana Sakura",https://pic.javct.net/poster/05192026/70287e7ca2.jpg,https://javct.net/v/start-578,127,2026-06-14
FC2PPV-4884888,[No *High quality Yui 22 years old Nogi◯ beauty's anal licking] Nogi◯ beauty tries anal licking The cute girl licks the anus so much that she gives a blowjob and releases a large amount of the old man's sperm ♡ Anal licking feels so good that the sperm splattered on her face lol,https://pic.javct.net/poster/04112026/1776755796.jpg,https://javct.net/v/fc2ppv-4884888,60,2026-06-14
FC2PPV-4884649,"[Uncensored] Gravure idol Aiko, 24 years old, the distance is too close to show off her beautiful breasts, and on nights when she can't say anything",https://pic.javct.net/poster/04112026/1776755525.jpg,https://javct.net/v/fc2ppv-4884649,25,2026-06-14
PA-042126-100,What If Your Dream Wife Wearing an Apron Naked? : Sakura Sakurai,https://pic.javct.net/poster/04112026/1776755661.jpg,https://javct.net/v/pa-042126-100,55,2026-06-14
10-042126-01,Collects the cum that was sprayed on her face and tastes every drop,https://pic.javct.net/poster/04112026/1776755750.jpg,https://javct.net/v/10-042126-01,09,2026-06-14
HZ-3829,Beauty Collection Vol.117 - Meirin,https://pic.javct.net/poster/04112026/1776755601.jpg,https://javct.net/v/hz-3829,59,2026-06-14
CR-042126-001,The tragedy of a wife who repays her husband's debts with her body,https://pic.javct.net/poster/04112026/1776755732.jpg,https://javct.net/v/cr-042126-001,61,2026-06-14
1P-042126-001,Happy Around in School! : Luxury Spa Club,https://pic.javct.net/poster/04112026/1776755765.jpg,https://javct.net/v/1p-042126-001,60,2026-06-14
FC2PPV-4884772,[Uncensored/Complete amateur/Creampie/Squirting] Neat and innocent 149cm short girl in uniform She's so cute that she inserts herself into a vagina that tightens so tight that you push her back and gives her a rich creampie ♡,https://pic.javct.net/poster/04112026/1776755692.jpg,https://javct.net/v/fc2ppv-4884772,14,2026-06-14
FC2PPV-4884691,"[Uncensored] Big-breasted receptionist Sayaka, 25 years old, her response is not a job, but a sex video record that is destroyed by a too polite distance",https://pic.javct.net/poster/04112026/1776755717.jpg,https://javct.net/v/fc2ppv-4884691,18,2026-06-14
FC2PPV-4884935,[Amateur's first shot] Sumire (18) 163 cm 47 kg D cup and the cutest shooting data was collected from the forehead camera's first person perspective video,https://pic.javct.net/poster/04112026/1776733868.jpg,https://javct.net/v/fc2ppv-4884935,66,2026-06-14
FC2PPV-4884375,"[Slender] A Kansai guy woke up after having sex for the first time in 2 years. He wanted more. He couldn't help but squirt at the overflowing moans. Two consecutive creampies, and a strong squirting finish.",https://pic.javct.net/poster/04112026/1776733779.jpg,https://javct.net/v/fc2ppv-4884375,63,2026-06-14
10-041926-01,Treasured Pussy Selection: Ai Nakano,https://pic.javct.net/poster/04112026/1776669419.jpg,https://javct.net/v/10-041926-01,14,2026-06-14
