code,title,image_url,page_url,views,date_scraped
SDMM-231,"Magic Mirror No. Couples can come together! I called out and experienced the popular quick massage for the first time! The more I try to hold back my beloved husband's voice through the mirror, the more I feel it... A real married woman can't hold back and has sex in her skirt.",https://pic.javct.net/poster/04112026/e9af509e50.jpg,https://javct.net/v/sdmm-231,180,2026-06-14
SGKI-086,Popular AV actress takes on the challenge! Peeing and squirting acme bicycle makes me cum! Miyu Aizawa Hinako Matsui,https://pic.javct.net/poster/04112026/1898107e63.jpg,https://javct.net/v/sgki-086,196,2026-06-14
MIST-407-RM,YAPPA Yurika Aoi A High-Career Actress Wants To Show Her The Most Eros Dosukebe Slut Older Sister Sex With All Her Sk**ls [Uncensored L**ked],https://pic.javct.net/poster/20230207/1688618233.jpg,https://javct.net/v/mist-407-rm,136,2026-06-14
KDJE-024-RM,[4K remaster version] Masochistic semen trance Azusa Nagasawa [Uncensored L**ked],https://pic.javct.net/poster/04112026/45f08754eb.jpg,https://javct.net/v/kdje-024-rm,127,2026-06-14
STAR-231-RM,"Cho Cho Unexpected Unexpected Net Re Goro Pond × Saori Hara Entertainer, Puss Writhes In Nechikkoi Caress Of My Father. [Uncensored L**ked]",https://pic.javct.net/poster/05192026/ca6a0fafcd.jpg,https://javct.net/v/star-231-rm,115,2026-06-14
MARR-010,Yurara Yume / Hatsumi Nanoka,https://pic.javct.net/poster/05192026/ffec19e8ae.jpg,https://javct.net/v/marr-010,80,2026-06-14
SABA-832-RM,Exposure Video Membership Refre Where Celebrities Go Incognito 02 [Uncensored L**ked],https://pic.javct.net/poster/20230206/1686372679.jpg,https://javct.net/v/saba-832-rm,120,2026-06-14
JUY-315-RM,Former Celebrities Kaori Mizusawa 38 Years Old AV Debut! ! [Uncensored L**ked],https://pic.javct.net/poster/05192026/8730043cc0.jpg,https://javct.net/v/juy-315-rm,160,2026-06-14
STAR-209-RM,"Hostesses Will Be Loved Saori Hara Entertainer, When Take Off The Dress.When Will The Lingular. [Uncensored L**ked]",https://pic.javct.net/poster/05192026/d175d69004.jpg,https://javct.net/v/star-209-rm,130,2026-06-14
HMN-846,"A Plan To Connect With A Front-row Otaku Managing A Secret Fan Event After A Live Performance, To Make The Scandalous Idol Understand And Gangbang Her, And To Have Unprotected Sex With Her - Nishimoto Meisa",https://pic.javct.net/poster/05192026/ec4218adc2.jpg,https://javct.net/v/hmn-846,120,2026-06-14
STARS-181,"Slut Goddess ""I'll Commit You Enough To Die"" Tina Nanami",https://pic.javct.net/poster/05192026/bd69830c52.jpg,https://javct.net/v/stars-181,120,2026-06-14
URMT-006-RM,Petit Idol @ Momo-chan: L**ked Underground Video From Entertainment Production Company - Aspiring Idol Falls Into Darkness And Engages In Unlicensed Group Sex - Shinomiya Momo [Uncensored L**ked],https://pic.javct.net/poster/05192026/9c55a5dbca.jpg,https://javct.net/v/urmt-006-rm,105,2026-06-14
FC2PPV-4915930,"My first experience was with my seniors in the basketball club, and I made it without permission. ""I'm going to get pregnant by injecting my special secret technique, Sison.''",https://pic.javct.net/poster/05192026/442b5111e0.jpg,https://javct.net/v/fc2ppv-4915930,51,2026-06-14
857OMG-031-RM,"Maybe I was filled with sexual desire for a secret meeting with an idol who sent me a DM, and from the moment I inserted her, I felt like I was melting and went crazy, and I didn't hesitate to cum all over her cute sparkling face... [Uncensored L**ked]",https://pic.javct.net/poster/05192026/0d27c7a620.jpg,https://javct.net/v/857omg-031-rm,84,2026-06-14
857OMG-031,"Maybe I was filled with sexual desire for a secret meeting with an idol who sent me a DM, and from the moment I inserted her, I felt like I was melting and went crazy, and I didn't hesitate to cum all over her cute sparkling face...",https://pic.javct.net/poster/05192026/0d27c7a620.jpg,https://javct.net/v/857omg-031,84,2026-06-14
PGD-620-RM,Survive The Industry!Sexual Harassment 24 Results Night When Idle Active Contact [Uncensored L**ked],https://pic.javct.net/poster/04112026/1775972757.jpg,https://javct.net/v/pgd-620-rm,160,2026-06-14
SNOS-172-RM,"New Generation Gravure Idol: Raw, Honest, And Real 4 Sex Scenes - Hakata Iroha [Uncensored L**ked]",https://pic.javct.net/poster/05192026/87ede018fd.jpg,https://javct.net/v/snos-172-rm,200,2026-06-14
SNOS-232-RM,"Sueho Kinmatsu Is Stripped Naked In Seconds! Sex In Seconds! ""What?! This Is Really Impossible!!!"" Surprise Instant Thong GP! [Uncensored L**ked]",https://pic.javct.net/poster/05192026/d9b3eddb68.jpg,https://javct.net/v/snos-232-rm,150,2026-06-14
FC2PPV-4915947,"*Resale revised version [Limited revival] Sleepover date at a luxury hotel with idol-class beauty Yumi-chan. She has a gentle personality, a superb smile, and every casual gesture brings healing. She is the highest-class beauty. She can't help but ejaculate in large amounts due to her artistic slender body.",https://pic.javct.net/poster/05192026/d0e7895625.jpg,https://javct.net/v/fc2ppv-4915947,135,2026-06-14
NAAC-042B,Best Naked 04/Reina Momozono (Blu-ray Disc),https://pic.javct.net/poster/05192026/d7c4d004bc.jpg,https://javct.net/v/naac-042b,0,2026-06-14
URMT-006,Petit Idol @ Momo-chan: L**ked Underground Video From Entertainment Production Company - Aspiring Idol Falls Into Darkness And Engages In Unlicensed Group Sex - Shinomiya Momo,https://pic.javct.net/poster/05192026/9c55a5dbca.jpg,https://javct.net/v/urmt-006,105,2026-06-14
SNOS-234-RM,The Revealing Swimsuits Of Gravure Idols Arouse The R**e Desires Of The Photography Staff - Rui Shido [Uncensored L**ked],https://pic.javct.net/poster/05192026/410a859aff.jpg,https://javct.net/v/snos-234-rm,120,2026-06-14
KSBJ-037-RM,Barefoot Wife Aoki Kuroki [Uncensored L**ked],https://pic.javct.net/poster/20240807/1724029969.jpg,https://javct.net/v/ksbj-037-rm,113,2026-06-14
BOBB-379-RM,"Mcup Dirty Little Devil Advent! Squeezing Semen With Transcendence Milk Slutty Sex Activity Boin ""Yuria Yoshine"" Box2 [Uncensored L**ked]",https://pic.javct.net/poster/20230205/1685678661.jpg,https://javct.net/v/bobb-379-rm,120,2026-06-14
CHCH-036-RM,A One-time Mistake Made By A Full-time Housewife With I-cup Breasts. A Full-time Housewife Who Had An Affair With A Young Man She Met On Social Media And Was Blackmailed By A Stolen Video Made Her Head To A Designated Apartment In The Suburbs Of Tokyo... [Uncensored L**ked],https://pic.javct.net/poster/20230206/1686974202.jpg,https://javct.net/v/chch-036-rm,125,2026-06-14
KRS-299-RM,"This is it! Amateur PREMIUM She's such a plain lady, but she's amazing. [Uncensored L**ked]",https://pic.javct.net/poster/05192026/7773658f07.jpg,https://javct.net/v/krs-299-rm,60,2026-06-14
NINE-072-RM,[Super A5 Rank Highest Grade Aged Meat Arrives] A Sexless Married Woman With Colossal J-Cup Breasts Frustration Accumulates And Fulfills Her Perverted Delusions. Reiko (48 Years Old) [Uncensored L**ked],https://pic.javct.net/poster/20230205/1685159927.jpg,https://javct.net/v/nine-072-rm,130,2026-06-14
NINE-073-RM,[Individual Shooting] I Called A Plump Office Lady Who Works In Shimbashi During Her Lunch Break At Work And Tried To Have Hidd** Camera Sex [Uncensored L**ked],https://pic.javct.net/poster/20230206/1686539811.jpg,https://javct.net/v/nine-073-rm,134,2026-06-14
DIVAS-092,"So, It’s Huge! ! Great Excavation! 115cmJ Cup! Blonde German Beauty With Big Breasts And More. The Weight Of The Breasts Is Over 3KG! !",https://pic.javct.net/poster/05192026/ed9d0033e5.jpg,https://javct.net/v/divas-092,187,2026-06-14
PAIS-045-RM,"An Active Civil Servant With Colossal Tits While Working, I-cup Is A Fierce Moody Who Masturbates In The Toilet At Work (City Hall) [Uncensored L**ked]",https://pic.javct.net/poster/20230206/1687839344.jpg,https://javct.net/v/pais-045-rm,129,2026-06-14
DIVAS-077,With Huge Breasts! All 100cm Over H Cup Or More! Blonde Beauty Super Best 10 People 4 Hours,https://pic.javct.net/poster/05192026/ff4fe008bc.jpg,https://javct.net/v/divas-077,240,2026-06-14
DIVAS-085,National Treasure-class Beauty Has Sex With Japanese People In A Thick Raw! Japanese People Make Full Use Of Very Naughty Erotic Busty Patsukin Beauties! !,https://pic.javct.net/poster/05192026/541c02541d.jpg,https://javct.net/v/divas-085,130,2026-06-14
DIVAS-087,Overseas Beautiful Mature Woman Has Sex With Japanese And Thick Raw! Eroboin Big Breasts And Style Is Too Dangerous! Japanese People Make The Most Of Beautiful Witches With The Strongest Libido! !,https://pic.javct.net/poster/05192026/406b2bee7c.jpg,https://javct.net/v/divas-087,228,2026-06-14
DIVAS-079,"Sounds Like A Lie, Right? 45 Years Old Now! Colossal Tits Butt I Cup Tiffany Russo",https://pic.javct.net/poster/05192026/8ca823c33e.jpg,https://javct.net/v/divas-079,117,2026-06-14
YSN-602-RM,Fragrance Of Immature And Heavy Fruit Fuuka Minamihata [Uncensored L**ked],https://pic.javct.net/poster/20230206/1687495120.jpg,https://javct.net/v/ysn-602-rm,103,2026-06-14
GAS-216-RM,"Wife To Dinner ""Big Rental?Fucking You? "" Hana Uehara Variants Aikawa [Uncensored L**ked]",https://pic.javct.net/poster/05192026/4adf1454ee.jpg,https://javct.net/v/gas-216-rm,120,2026-06-14
HTMS-130-RM,[AI Remastered Version] Directed by Henry Tsukamoto: Huge breasts that drive men crazy [Uncensored L**ked],https://pic.javct.net/poster/05192026/3f3ae83624.jpg,https://javct.net/v/htms-130-rm,55,2026-06-14
BBTU-072-RM,Healing Big Tits Titty Fuck Mama Esthetic Marina Yuzuki [Uncensored L**ked],https://pic.javct.net/poster/20231711/1702698328.jpg,https://javct.net/v/bbtu-072-rm,128,2026-06-14
AVSA-289-RM,"Super Close-up Shot, Obscene Erotic Areolas, Huge Breasts, And Sex-obsessed Rimu Yumino [Uncensored L**ked]",https://pic.javct.net/poster/20231912/1704511009.jpg,https://javct.net/v/avsa-289-rm,137,2026-06-14
GAS-136-RM,Big Mama And You Want To 117K H Hana Uehara Dekabura MANIAX [Uncensored L**ked],https://pic.javct.net/poster/20230206/1685979326.jpg,https://javct.net/v/gas-136-rm,125,2026-06-14
FC2PPV-4912141,"[Complete secret version] [Squirting] [Slutty] [Volume warning] [First appearance in FC2] Mina, a 24-year-old I-cup office lady, can't stop squirting while half-crying. Her abominable behavior is exposed to the point where her brain is shaking. [Chapter 5]",https://pic.javct.net/poster/05192026/2a40738e18.jpg,https://javct.net/v/fc2ppv-4912141,94,2026-06-14
PKPD-109-RM,Carnal Debut Document 103cm I Cup Super Milk Babumi Full Open Girls Nao Kikuchi [Uncensored L**ked],https://pic.javct.net/poster/20240807/1722830856.jpg,https://javct.net/v/pkpd-109-rm,140,2026-06-14
BOBB-381-RM,"Big Breasts Icup Angel In A White Coat Secret Breast Nursing That Starts With A Nurse Call Boin ""Monami Takarada"" Box [Uncensored L**ked]",https://pic.javct.net/poster/20230206/1687491000.jpg,https://javct.net/v/bobb-381-rm,120,2026-06-14
AGR-040-RM,The Wife Next Door Is An I-Cup Colossal Tits Wife Maya Kikuchi [Uncensored L**ked],https://pic.javct.net/poster/20230206/1688187192.jpg,https://javct.net/v/agr-040-rm,115,2026-06-14
MKD-213-RM,AV Debut With A Huge 124 Cm Breast 50-year-old Wife Leaving Her Squirting Yukari Nozawa [Uncensored L**ked],https://pic.javct.net/poster/05192026/ab680855d7.jpg,https://javct.net/v/mkd-213-rm,113,2026-06-14
HIKR-259-RM,A big game of sex with the house studio manager in Los Angeles! Hello West (24) [Uncensored L**ked],https://pic.javct.net/poster/05192026/97e52c2046.jpg,https://javct.net/v/hikr-259-rm,83,2026-06-14
HZ-3867,Bonus Special Vol.11 - Misaki Nanbara - Ryu Enami - Mari Onodera,https://pic.javct.net/poster/05192026/dfe48a9ef8.jpg,https://javct.net/v/hz-3867,53,2026-06-14
ABF-358-RM,The Ultimate Slippery Orgasm: Remu Suzumori [Uncensored L**ked],https://pic.javct.net/poster/05192026/8d04a2685b.jpg,https://javct.net/v/abf-358-rm,130,2026-06-14
ABF-358,The Ultimate Slippery Orgasm: Remu Suzumori,https://pic.javct.net/poster/05192026/8d04a2685b.jpg,https://javct.net/v/abf-358,130,2026-06-14
CR-061126-001,Pussy Encyclopedia: Miko Sakura,https://pic.javct.net/poster/05192026/273a9ca022.jpg,https://javct.net/v/cr-061126-001,19,2026-06-14
RMDB-350-RM,Job change file l**ked from the human resources department 4 4 hours [Uncensored L**ked],https://pic.javct.net/poster/05192026/097601d56c.jpg,https://javct.net/v/rmdb-350-rm,231,2026-06-14
SDNM-100,"SOD ""Please Look At My Nature"" Married Label Biggest Ever Gap Married Misaki Enomoto 28-year-old AV Debut",https://pic.javct.net/poster/05192026/d82e1a23b2.jpg,https://javct.net/v/sdnm-100,160,2026-06-14
NHDTC-208-RM,"Simultaneous Remote Control Vibrator Development For Two Holes, Shameful, Beautiful-assed Part-timer Girl Unable To Move Due To Remote Double Orgasm, Gushing Profusely In Ecstasy. [Uncensored L**ked]",https://pic.javct.net/poster/05192026/7ed7e53aae.jpg,https://javct.net/v/nhdtc-208-rm,265,2026-06-14
HIKR-259,A big game of sex with the house studio manager in Los Angeles! Hello West (24),https://pic.javct.net/poster/05192026/97e52c2046.jpg,https://javct.net/v/hikr-259,83,2026-06-14
IZM-017-RM,A Girl Who Wants To Be Bullied By An Amateur Mr. Nakata's Cream Pie Cake Shop Soka 21 Years Old Perverted Masochist Who Wants To Be A Lustful Meat Urinal! J Cup 120cm Colossal Breasts Obscene Powerful Body Serious Sexual Desire Of A Popular Poster Girl At A Certain Cake Shop Soka Minamihata [Uncensored L**ked],https://pic.javct.net/poster/20230207/1688268188.jpg,https://javct.net/v/izm-017-rm,140,2026-06-14
SYK-008-RM,[Libido/Appetite/Sleep Desire] 8 Nice Ba~D Love Yuina Chuwa~N 173cm Opa~i G70 Constriction 59~Nostalgia 102 [Big Ass Amateur] Taki Yuina [Uncensored L**ked],https://pic.javct.net/poster/20230207/1688267401.jpg,https://javct.net/v/syk-008-rm,140,2026-06-14
NNPJ-383-RM,"""Today, I'd Like To Cum 100 Times..."" Rina (23 Years Old) Is A Big Tits Young Wife With F-Cup Tits Her Body Is So Sensual That Her Husband Can't Handle Her, And She's At Her Limit Because She's Been Deprived Of Sex For So Long This Fucked Wife Will Immediately Cum And Release Her Pent Up Frustrations In Lust-Baring Orgasmic Desire [Uncensored L**ked]",https://pic.javct.net/poster/20212709/1633935545.jpg,https://javct.net/v/nnpj-383-rm,114,2026-06-14
HMRK-043-RM,"[New series] [Women with convulsions and explosive glasses] A highly educated intellectual JD who attends the University of Tokyo.His inquisitiveness towards the erotic hidden behind her intellect is unstoppable, such as spanking, deep throating... Squirting all the time in the exciting play you desire. Shrimp warping climax. Because she is a genius, this perverted gap is irresistible. [Today I'm going to cum with this girl] [Rei] [Uncensored L**ked]",https://pic.javct.net/poster/05192026/389437eeed.jpg,https://javct.net/v/hmrk-043-rm,85,2026-06-14
NACR-920-SUB,Cuckold Video Letter: Watch Me Being Held By Another Man Maho Fujiwara [English Subtitle],https://pic.javct.net/poster/20253001/1739985527.jpg,https://javct.net/v/nacr-920-sub,111,2026-06-14
CR-060926-001,Centurion Soap: Sanae Hosoda,https://pic.javct.net/poster/05192026/1daf905ee1.jpg,https://javct.net/v/cr-060926-001,61,2026-06-14
MRSS-188-RM,"In This Corrupt Village, Unable To Bear A C**ld For My Beloved Wife, I Could Not Resist The Corrupt Customs Of The Village And Could Only Watch In Silence As She Was Impregnated By Men. - Shiori Imoto [Uncensored L**ked]",https://pic.javct.net/poster/05192026/403469f8cd.jpg,https://javct.net/v/mrss-188-rm,129,2026-06-14
SDDE-494-RM,I'm The Only Girl In This Family Full Of Men I'm Busy Every Day With All The Housework In Addition To Getting Banged In The Mornings By My 10 Stepbrothers And My Stepdad Noa(The Eldest Daughter) [Uncensored L**ked],https://pic.javct.net/poster/20221108/1661443817.jpg,https://javct.net/v/sdde-494-rm,127,2026-06-14
DVMM-411-RM,The Ultimate Raw Girl! Vol. 3 Yui Hina A Gentle Beauty With Soft And Voluptuous G-cup Breasts In A 60-minute Completely Uncut 12P Orgy & Hard 12P Gangbang With A Total Of 23 Real Cumshots [Uncensored L**ked],https://pic.javct.net/poster/05192026/73b3565310.jpg,https://javct.net/v/dvmm-411-rm,145,2026-06-14
FC2PPV-4918998,"Reverse 3P fuck with two tight beautiful wives with big black cocks and beautiful breasts and nice butts, making them understand NTR, impregnating them raw, and having sex with them.",https://pic.javct.net/poster/05192026/b354470661.jpg,https://javct.net/v/fc2ppv-4918998,76,2026-06-14
FC2PPV-4906316,[5 Ejaculation/Full sexual desire] Video of a secret meeting of a slender beauty from the upper part of the Japanese continent where her sexual desire is violently disturbed by two hard cocks that no one can stop,https://pic.javct.net/poster/05192026/6b88d0add1.jpg,https://javct.net/v/fc2ppv-4906316,85,2026-06-14
VOD-017-RM,"Real Amateur Wife Document 2nd Beautiful Platinum K Cup Colossal Tits Wife, First Continuous Creampie 3P Sex Mana Kawahara [Uncensored L**ked]",https://pic.javct.net/poster/20230206/1685683376.jpg,https://javct.net/v/vod-017-rm,120,2026-06-14
FOCS-080-RM,The Smallest In AV History! An AV Actress With An Industry Shock Of 138 Cm! Super Rare Minimum Beautiful Girl Debut Riri Minase [Uncensored L**ked],https://pic.javct.net/poster/20220707/1659679061.jpg,https://javct.net/v/focs-080-rm,120,2026-06-14
FC2PPV-4903172,"[Uncensored x Personal Shooting] Kerberos Special Edition When I asked for a rental girlfriend who was OK with sex, a F-cup beauty with a great figure appeared and she was in no condition to flirt with me.",https://pic.javct.net/poster/04112026/6c34681552.jpg,https://javct.net/v/fc2ppv-4903172,46,2026-06-14
FC2PPV-4899692,"Case #132 where an amateur came to do naughty things with her face exposed Miku-chan (20), a beautiful, fair-skinned and cute girl with an outstanding figure transforms.",https://pic.javct.net/poster/04112026/3f1f029f4e.jpg,https://javct.net/v/fc2ppv-4899692,58,2026-06-14
FC2PPV-4870849,"[Complete amateur] A refreshing and cute 32-year-old single woman sucks a middle-aged man's thick dick, and after making him cum, she licks his pussy and loves to have intense sex. Her enchanted expression is irresistible.",https://pic.javct.net/poster/06032026/1774847642.jpg,https://javct.net/v/fc2ppv-4870849,58,2026-06-14
FC2PPV-4865386,"As a graduation gift, I made a grown-up promise with an 18-year-old... I secretly became friends with my friend Imo⚫︎to.In my last uniform, I had my first creampie in my life, swallowed, and had a cleaning blow job.",https://pic.javct.net/poster/06032026/1773982176.jpg,https://javct.net/v/fc2ppv-4865386,70,2026-06-14
FC2PPV-4855213,"[Complete amateur] Beautiful, cute and wonderful single person, her pussy is thoroughly attacked and she screams with electric massager, finger pussy splash, thick dick piston",https://pic.javct.net/poster/01202026/1772253991.jpg,https://javct.net/v/fc2ppv-4855213,57,2026-06-14
FC2PPV-4846835,[Super close-up pussy cuppa~] Neat and clean black hair long uniform Fair skin and smooth long limbs ♡ Obedient de M natural pussy hair pussy anal open up natural pubic hair / small clitoris / beautiful butt / labia without dark spots / super close-up view,https://pic.javct.net/poster/01202026/1770784948.jpg,https://javct.net/v/fc2ppv-4846835,15,2026-06-14
FC2PPV-4837194,"[Complete amateur] A single user with a naughty body and a cute face seems to like being fucked violently, so he stirs it with his fingers, gets drenched with a large amount of splash, and screams with the piston of the old man's thick penis.",https://pic.javct.net/poster/01202026/1769318339.jpg,https://javct.net/v/fc2ppv-4837194,64,2026-06-14
FC2PPV-4825574,"[Uncensored/Creampie] Photo session Sexual harassment of cosplayers, humiliating photo session, massive creampie cum on beautiful pussy",https://pic.javct.net/poster/12082025/1767588899.jpg,https://javct.net/v/fc2ppv-4825574,64,2026-06-14
FC2PPV-4819991,[Complete Amateur] A very cute single mother with an elegant and naughty technique that makes the old man's dick go crazy. The atmosphere like a married couple is erotic.,https://pic.javct.net/poster/12082025/1766807904.jpg,https://javct.net/v/fc2ppv-4819991,47,2026-06-14
FC2PPV-4820724,CP0443 Masturbation showing off the slimy beauty of a fair-skinned pussy,https://pic.javct.net/poster/12082025/1766724426.jpg,https://javct.net/v/fc2ppv-4820724,31,2026-06-14
FC2PPV-4810880,"[Real amateur] A god-style beauty with a marshmallow, slender body, F-cup, beautiful breasts, beautiful butt, beautiful legs, and a beautiful pussy, with a strong desire for approval, is begged for a serious creampie, and is released in half, half, and inside.",https://pic.javct.net/poster/12082025/1765342972.jpg,https://javct.net/v/fc2ppv-4810880,63,2026-06-14
FC2PPV-4798264,Sakamichi idol type 150cm size everyone's I. Mo./U. and Nagisa-chan\! A plump single lined. Tight/. Lo./ Beautiful pussy ♡ Is there anyone who doesn't like it?,https://pic.javct.net/poster/10232025/1763182415.jpg,https://javct.net/v/fc2ppv-4798264,129,2026-06-14
FC2PPV-4792623,"[Complete amateur] A cute and beautiful 32-year-old single girl whose nervousness and wariness gradually disappear, and she is made to cum by a standing thick dick.",https://pic.javct.net/poster/10232025/1762583561.jpg,https://javct.net/v/fc2ppv-4792623,59,2026-06-14
FC2PPV-4791714,"[First shoot] [Sensitive] Yes, if you open your mouth, you can talk machine guns or give a vacuum blowjob. An office lady with a nice butt and a unique world view is in agony with a seven-colored moaning voice.",https://pic.javct.net/poster/10232025/1762402658.jpg,https://javct.net/v/fc2ppv-4791714,78,2026-06-14
PT-207,Cheer Fuck : Shizuku Hatano,https://pic.javct.net/poster/09052025/1759364394.jpg,https://javct.net/v/pt-207,120,2026-06-14
HEY-223,Sexy Massage Make He manly : Kanna Kitayama,https://pic.javct.net/poster/09052025/1759363877.jpg,https://javct.net/v/hey-223,120,2026-06-14
HEY-222,"Bichi-jo -Dirty Private Lesson- : Miyu Shiina, Ayaka Haruyama",https://pic.javct.net/poster/09052025/1759364028.jpg,https://javct.net/v/hey-222,120,2026-06-14
HEY-224,Office Lady Loves Washroom Masturbation : Kanon Sugiura,https://pic.javct.net/poster/09052025/1759363993.jpg,https://javct.net/v/hey-224,120,2026-06-14
HEY-219,Koukotsu : Maki Hojo,https://pic.javct.net/poster/09052025/1759277995.jpg,https://javct.net/v/hey-219,150,2026-06-14
PT-206,Girl Gets Creampied By Fake Fortune-Teller : Mika Kirishima,https://pic.javct.net/poster/09052025/1759277930.jpg,https://javct.net/v/pt-206,100,2026-06-14
HEY-220,The Best View Of Yuuna Himekawa : Yuuna Himekawa,https://pic.javct.net/poster/09052025/1759277963.jpg,https://javct.net/v/hey-220,120,2026-06-14
HEY-221,Naked Widow Works For Debt : Shino Aoi,https://pic.javct.net/poster/09052025/1759278021.jpg,https://javct.net/v/hey-221,120,2026-06-14
HEY-216,Plunged Into Wild And Crazy Orgy : Mio Futaba,https://pic.javct.net/poster/09052025/1759192458.jpg,https://javct.net/v/hey-216,140,2026-06-14
YSN-599-RM,"My New Mother-in-law Is A Devilish Person, But My Erection Does Not Go Away. Umino Firefly [Uncensored L**ked]",https://pic.javct.net/poster/20230205/1685072445.jpg,https://javct.net/v/ysn-599-rm,102,2026-06-14
KSBJ-434,I Can't Help But Adore My Son! - Yuhi Satoumi,https://pic.javct.net/poster/05192026/8f73aa48ed.jpg,https://javct.net/v/ksbj-434,105,2026-06-14
VENX-373-RM,"Mom, A Cum-filled Sex Toy Anytime. A Mother Who Has Become A Sex Toy For Her Son Who Is Desperate For Female Companionship, Pretends Not To Feel Anything Despite Enjoying It, And Eagerly Awaits The Next Time They Have Sex. - Kana Morisawa [Uncensored L**ked]",https://pic.javct.net/poster/05192026/7111ff0f72.jpg,https://javct.net/v/venx-373-rm,100,2026-06-14
KSBJ-103,Very Kind My Mom,https://pic.javct.net/poster/05192026/0ce9581409.jpg,https://javct.net/v/ksbj-103,242,2026-06-14
T28-525,"On My Parents' Free Day, I Snapped All Day Long Until My Sister And Sperm Died. Mari Takasugi",https://pic.javct.net/poster/05192026/ccd4c538c6.jpg,https://javct.net/v/t28-525,130,2026-06-14
ROE-107-SUB,Days Of Incest With My Mother At My Parents' House Where The Whole Family Left The Nest. Natsuko Kayama [English Subtitle],https://pic.javct.net/poster/20222109/1665120317.jpg,https://javct.net/v/roe-107-sub,130,2026-06-14
NXGS-018-RM,"Fifty-year-old Mother, Forbidden Immoral Mother-son Incest [Uncensored L**ked]",https://pic.javct.net/poster/05192026/b6d08c372b.jpg,https://javct.net/v/nxgs-018-rm,120,2026-06-14
IENFA-06603-RM,"My big-breasted older sister, who felt pity for me for not having sex, asked me to intercrural sex with her, promising that I would just rub her, and we both felt so good that our pussies were soaking wet! Insert it raw! ""What!? Is it inside?"" But I can't stop and cum! Hatori Kosaki [Uncensored L**ked]",https://pic.javct.net/poster/05192026/7b6cfd1505.jpg,https://javct.net/v/ienfa-06603-rm,42,2026-06-14
IENFA-06102-RM,"My breasts belong to my brother.My sister is concerned about her breasts, which are growing bigger and bigger. I can't help but be curious about her boobs being played around with each other in defenseless poses! Yui Tomita [Uncensored L**ked]",https://pic.javct.net/poster/05192026/58e9bdc91f.jpg,https://javct.net/v/ienfa-06102-rm,44,2026-06-14
ROE-073-SUB,"A Dear Mother, Even Her Rebellious Son, Accepts Her Days As A Meat Guy. Rieko Hiraoka [English Subtitle]",https://pic.javct.net/poster/20220406/1654842012.jpg,https://javct.net/v/roe-073-sub,120,2026-06-14
IENFA-06203-RM,"When I was playing a trick on my sister, a sleeping schoolgirl, she asked me to fuck her raw, and even though I was about to cum, she was locked with crab scissors and I couldn't escape, so I cum inside her! Yui Nagase [Uncensored L**ked]",https://pic.javct.net/poster/05192026/088667e824.jpg,https://javct.net/v/ienfa-06203-rm,38,2026-06-14
