code,title,image_url,page_url,views,date_scraped
MIDD-897-RM,Miku cute peeing pleasure than the first [Uncensored L**ked],https://pic.javct.net/poster/06032026/1775210925.jpg,https://javct.net/v/midd-897-rm,120,2026-07-08
MMRAA-377,Dream Of A Glimpse/Shimizu Renka,https://pic.javct.net/poster/05192026/1c1fa13a99.jpg,https://javct.net/v/mmraa-377,70,2026-07-08
MBRAA-342,Are You Going To Do It This Far?! / Hinano Uchida,https://pic.javct.net/poster/05192026/7d84a6ad32.jpg,https://javct.net/v/mbraa-342,70,2026-07-08
MBRAA-344,Chicksp! / Mizushima Yuzuki,https://pic.javct.net/poster/05192026/08cb9152a3.jpg,https://javct.net/v/mbraa-344,70,2026-07-08
SONE-675-SUB,"Abstinence, Breast Development, Teasing, Aphrodisiac, Chase Piston, Hanging Orgasm, Massive Toy To**ure, All On Top! Sex On The Other Side Of Orgasm That Goes Beyond The Downer State That Goes Beyond The Climax. Yu Tano [English Subtitle]",https://pic.javct.net/poster/20250903/1743704325.jpg,https://javct.net/v/sone-675-sub,150,2026-07-08
BBTU-099-RM,Super-Dreadnought Mega Pie Nishimura Nina [Uncensored L**ked],https://pic.javct.net/poster/20250903/1741972803.jpg,https://javct.net/v/bbtu-099-rm,124,2026-07-08
BOBB-371-RM,"White Coat Breasts Mcup Angel Secret Breast Nursing That Begins With A Nurse Call Boin ""Yuria Yoshine"" Box [Uncensored L**ked]",https://pic.javct.net/poster/20230302/1679628591.jpg,https://javct.net/v/bobb-371-rm,120,2026-07-08
ONSG-051-RM,Big Tits Delivery Call Girl Ena Koume [Uncensored L**ked],https://pic.javct.net/poster/20221904/1653114334.jpg,https://javct.net/v/onsg-051-rm,130,2026-07-08
BBTU-096-RM,Big Tits Human Bullet FUCK Nishimura Nina [Uncensored L**ked],https://pic.javct.net/poster/20242012/1737169616.jpg,https://javct.net/v/bbtu-096-rm,123,2026-07-08
BOBB-369-RM,"Boobs Alien Warrant! Wrapped In A J Cup And Full Of Love! Visit Boob Service Service Adhesion Document Boin ""Chitose Yuuki"" Box [Uncensored L**ked]",https://pic.javct.net/poster/20230302/1679030674.jpg,https://javct.net/v/bobb-369-rm,120,2026-07-08
ONSG-062-RM,Busty Deriheru Seiri Toa [Uncensored L**ked],https://pic.javct.net/poster/20230302/1679719154.jpg,https://javct.net/v/onsg-062-rm,130,2026-07-08
MIRD-286,"An Unprecedented, Unparalleled, Super-sized Giant Breast Monster Orgy SPECIAL: Gojo Ren, Himari, Maria Valentine",https://pic.javct.net/poster/05192026/10d43d9af9.jpg,https://javct.net/v/mird-286,160,2026-07-08
NKKD-200-RM,My Wife And Colleagues Were On The Emergency Stairs Of The Company! !! [Uncensored L**ked],https://pic.javct.net/poster/05192026/724b0f3646.jpg,https://javct.net/v/nkkd-200-rm,190,2026-07-08
SAN-471Z-RM,"Prices Are So High I Can't Make Ends Meet! Even A Single Rice Ball At The Convenience Store Costs About 200 Yen, It's Just Impossible. 002 Marina, Riku [Uncensored L**ked]",https://pic.javct.net/poster/05192026/69c2cd8c96.jpg,https://javct.net/v/san-471z-rm,93,2026-07-08
BOBB-366-RM,"Huge Breasts Sex 6 Tour! Hospitality With Milk! Highest Class Boobs Service Full Course Milk Play Palace Boin ""Seiri Toa"" Box5 [Uncensored L**ked]",https://pic.javct.net/poster/20230302/1678423358.jpg,https://javct.net/v/bobb-366-rm,120,2026-07-08
GAS-543-RM,Only The Unconventional Can Be Loved: Mikepo's Shocking Performance!! The Pinnacle Of Physical Combat / Shiho Fukuoka [Uncensored L**ked],https://pic.javct.net/poster/05192026/36c4af3cb3.jpg,https://javct.net/v/gas-543-rm,128,2026-07-08
FC2PPV-4913477,[Limited Quantity] Titty Fuck Fucking vol.151 of Nipple Fan Club,https://pic.javct.net/poster/05192026/3f83ad4c90.jpg,https://javct.net/v/fc2ppv-4913477,35,2026-07-08
GAS-541,R cup shock Ui Watanabe best,https://pic.javct.net/poster/05192026/a070406288.jpg,https://javct.net/v/gas-541,176,2026-07-08
GAS-540,Titty fuck shop with long lines Everyone's Meat Doll Momona Himeno,https://pic.javct.net/poster/05192026/e1ab5f4659.jpg,https://javct.net/v/gas-540,114,2026-07-08
71GAS-541,R cup shock Ui Watanabe best,https://pic.javct.net/poster/05192026/a79582769e.jpg,https://javct.net/v/71gas-541,176,2026-07-08
71GAS-540,Titty fuck shop with long lines Everyone's Meat Doll Momona Himeno,https://pic.javct.net/poster/05192026/c8f52d7c6a.jpg,https://javct.net/v/71gas-540,114,2026-07-08
BOBB-372-RM,"Double Colossal Tits Harem Of Jcup Dream Your Desires Will Be Granted! Great Ascension With Erotic Cosplay & Healing Milk Fetish Play! Boin ""Suwon Misono & Seiri Toa"" Box [Uncensored L**ked]",https://pic.javct.net/poster/20230104/1680843320.jpg,https://javct.net/v/bobb-372-rm,120,2026-07-08
SAN-471Z,"Prices Are So High I Can't Make Ends Meet! Even A Single Rice Ball At The Convenience Store Costs About 200 Yen, It's Just Impossible. 002 Marina, Riku",https://pic.javct.net/poster/05192026/69c2cd8c96.jpg,https://javct.net/v/san-471z,93,2026-07-08
GAS-543,Only The Unconventional Can Be Loved: Mikepo's Shocking Performance!! The Pinnacle Of Physical Combat / Shiho Fukuoka,https://pic.javct.net/poster/05192026/36c4af3cb3.jpg,https://javct.net/v/gas-543,128,2026-07-08
HBAD-556-RM,Frustrated Wife With Big Tits That Can Not Be Exhausted Ena Koume [Uncensored L**ked],https://pic.javct.net/poster/05192026/159ad97393.jpg,https://javct.net/v/hbad-556-rm,137,2026-07-08
LOCK-005,LOCK-ON@Kotone I'll Lend You My Obedient Masochistic Wife. A Shy Wife Sold By Her Husband Is Trained As A Human Toilet. Kotone Umekawa,https://pic.javct.net/poster/07052026/cc8c134f04.jpg,https://javct.net/v/lock-005,133,2026-07-08
770RABI-069-RM,Anal affair explosive orgasm face [Uncensored L**ked],https://pic.javct.net/poster/07052026/955962a62b.jpg,https://javct.net/v/770rabi-069-rm,51,2026-07-08
DDH-425-RM,Rio [Uncensored L**ked],https://pic.javct.net/poster/07052026/2f1dada99a.jpg,https://javct.net/v/ddh-425-rm,54,2026-07-08
DDH-426-RM,Miyu [Uncensored L**ked],https://pic.javct.net/poster/07052026/9afbdeb2fd.jpg,https://javct.net/v/ddh-426-rm,53,2026-07-08
770RABI-071-RM,Anal affair gal wife's pre-cut ass gets messy [Uncensored L**ked],https://pic.javct.net/poster/07052026/e3fedea007.jpg,https://javct.net/v/770rabi-071-rm,54,2026-07-08
259LUXU-124,Luxury TV 118,https://pic.javct.net/poster/07052026/849a6707ab.jpg,https://javct.net/v/259luxu-124,59,2026-07-08
259LUXU-119,Luxury TV 158,https://pic.javct.net/poster/07052026/5659115c76.jpg,https://javct.net/v/259luxu-119,54,2026-07-08
259LUXU-132,Luxury TV 117,https://pic.javct.net/poster/07052026/e1e03b1a84.jpg,https://javct.net/v/259luxu-132,59,2026-07-08
259LUXU-120,Luxury TV 109,https://pic.javct.net/poster/07052026/454c4de65c.jpg,https://javct.net/v/259luxu-120,58,2026-07-08
259LUXU-125,Luxury TV 120,https://pic.javct.net/poster/07052026/971fe8c308.jpg,https://javct.net/v/259luxu-125,58,2026-07-08
259LUXU-123,Luxury TV 116,https://pic.javct.net/poster/07052026/59698d9521.jpg,https://javct.net/v/259luxu-123,56,2026-07-08
259LUXU-114,Luxury TV 113,https://pic.javct.net/poster/07052026/69d7b2e45d.jpg,https://javct.net/v/259luxu-114,52,2026-07-08
259LUXU-121,Luxury TV 114,https://pic.javct.net/poster/07052026/54c027d1fe.jpg,https://javct.net/v/259luxu-121,58,2026-07-08
259LUXU-116,Luxury TV 103,https://pic.javct.net/poster/07052026/7c0a969c16.jpg,https://javct.net/v/259luxu-116,59,2026-07-08
YMDS-132-RM,The Day Alice Became Her [Uncensored L**ked],https://pic.javct.net/poster/20230302/1680323051.jpg,https://javct.net/v/ymds-132-rm,130,2026-07-08
PKPD-149-RM,"A Fresh Face Home Party Documentary This Girl Looks Like An Idol And Has A Dripping Wet Pink Pussy Enjoy Home Cooking Sex With Aoi Naruse In Her Room, Half-In, Half-Out, And No Condoms [Uncensored L**ked]",https://static.javct.net/poster/pkpd-149.jpg,https://javct.net/v/pkpd-149-rm,140,2026-07-08
SGA-078-RM,Too Exciting De Perverted Married Woman Yoko Mitsushima 29 Years Old AV Debut A Wife Who Is Not Satisfied With Normal Sex With Her Husband Asks For Abnormal 45 [Uncensored L**ked],https://pic.javct.net/poster/20220406/1656352174.jpg,https://javct.net/v/sga-078-rm,130,2026-07-08
259LUXU-099,Luxury TV 092,https://pic.javct.net/poster/07052026/a9a80657dc.jpg,https://javct.net/v/259luxu-099,50,2026-07-08
259LUXU-094,Luxury TV 084,https://pic.javct.net/poster/07052026/51f2384743.jpg,https://javct.net/v/259luxu-094,59,2026-07-08
IZM-016-RM,"A Girl Who Wants To Be Bullied By An Amateur Mr. Nakata Works For A Creampie Consulting Company Arisa 25 Years Old An Erotic C**ld Who Gets Her Perverted Pussy Juice Dripping! Once You Hold It, You Will Be Addicted To The F-cup Horny Body Basic No Bra + Sometimes No Panties Perverted Woman! Arisa Tomioka [Uncensored L**ked]",https://pic.javct.net/poster/20230205/1683348992.jpg,https://javct.net/v/izm-016-rm,120,2026-06-24
EMBM-010-RM,A Serious Bride Who Has Sex In Front Of Her Masochist Husband Mio Ichijo [Uncensored L**ked],https://pic.javct.net/poster/20230104/1681962929.jpg,https://javct.net/v/embm-010-rm,89,2026-06-24
FMDL-001-RM,"Once I've Got A Cock In My Mouth, I Won't Let It Go Until I Ejaculate Ultimate Penis Love Mitsuki Yuina [Uncensored L**ked]",https://pic.javct.net/poster/05192026/c8964d223c.jpg,https://javct.net/v/fmdl-001-rm,127,2026-06-24
DFE-102-RM,Sexual Sensation Explosion Shrimp Arching Acme Salon Morisawa Kana [Uncensored L**ked],https://pic.javct.net/poster/20250606/1751044377.jpg,https://javct.net/v/dfe-102-rm,123,2026-06-24
BGN-067-RM,Rookie Prestige Exclusive Debut New Heroine Raised As An Idol Moe Tokita [Uncensored L**ked],https://static.javct.net/poster/bgn-067.jpg,https://javct.net/v/bgn-067-rm,195,2026-06-24
SRS-081-RM,Yariman Document Lily Nan (21) Working In Tokyo Metropolitan Government File.18 Aiming Three ○ Poko Meister ★ [Uncensored L**ked],https://pic.javct.net/poster/05192026/bd7a2382ae.jpg,https://javct.net/v/srs-081-rm,135,2026-06-24
BAGR-089-RM,"Two Maids Accompany A Young Lady On Her Wedding Night, Helping Her Practice. [Uncensored L**ked]",https://pic.javct.net/poster/05192026/4b28b57898.jpg,https://javct.net/v/bagr-089-rm,139,2026-06-24
IESM-080-RM,Kurosakika lifted the ban on bondage [Uncensored L**ked],https://pic.javct.net/poster/05192026/3ca9db7082.jpg,https://javct.net/v/iesm-080-rm,126,2026-06-24
MIST-517-RM,"Auntie Shot: Auntie Sex By Aunties, For Auntie Enthusiasts, Auntie Madoka, 35 Years Old [Uncensored L**ked]",https://pic.javct.net/poster/05192026/2943621c93.jpg,https://javct.net/v/mist-517-rm,176,2026-06-24
HUNTA-983-RM,"Things Get Wild During A Sleepover Sports' Training Camp - 1 Night, 2 Days Of Each Male Member Of The Team Passing Around Their Female Manager. [Uncensored L**ked]",https://static.javct.net/poster/hunta-983.jpg,https://javct.net/v/hunta-983-rm,192,2026-06-24
1P-062326-001,An orgy paradise where reason goes out the window!,https://pic.javct.net/poster/05192026/200a5463af.jpg,https://javct.net/v/1p-062326-001,49,2026-06-24
REAL-668,Slutty King's Frenzy Man Squirting & Dry Orgasm Culmination Full Course Haruna Hanana,https://pic.javct.net/poster/05192026/7cac004fa0.jpg,https://javct.net/v/real-668,120,2026-06-24
SRS-080-RM,Yariman Document Saya-chan (21) Hairdresser Assistant File.17 I Have A Lot Of Sex And I Am Aiming For Opo-sommelier. [Uncensored L**ked],https://pic.javct.net/poster/05192026/61c5ddd469.jpg,https://javct.net/v/srs-080-rm,135,2026-06-24
SGKI-097,"With Her Juices Dripping, Her Body Flushed And Sweating Profusely, And Her Body Squirting Profusely, She Secretly Orgasms Repeatedly During The Company Presentation Without The Job Seekers Noticing! A Company Presentation Of Ultimate Ecstasy.",https://pic.javct.net/poster/05192026/7df09f9d5c.jpg,https://javct.net/v/sgki-097,160,2026-06-24
MIJPS-0005-RM,Second Virgin Rookie Announcer Real BS!Exclusive Live Coverage Of Sex The First Time In Five Years! [Uncensored L**ked],https://pic.javct.net/poster/05192026/53f775a139.jpg,https://javct.net/v/mijps-0005-rm,130,2026-06-24
DASS-225-RM,A Humiliating Chain Of R**e Marina Ikeda Was Fucked By A Boss From Another Department And Was Fucked By My Boss Who Was So Disgusting To Death [Uncensored L**ked],https://pic.javct.net/poster/20230908/1694145646.jpg,https://javct.net/v/dass-225-rm,120,2026-06-24
HUNBL-112-RM,The Manager Of Club Activities Is The Club Member's Sex Slave [Uncensored L**ked],https://pic.javct.net/poster/20222109/1665119372.jpg,https://javct.net/v/hunbl-112-rm,170,2026-06-24
SGKI-097-RM,"With Her Juices Dripping, Her Body Flushed And Sweating Profusely, And Her Body Squirting Profusely, She Secretly Orgasms Repeatedly During The Company Presentation Without The Job Seekers Noticing! A Company Presentation Of Ultimate Ecstasy. [Uncensored L**ked]",https://pic.javct.net/poster/05192026/7df09f9d5c.jpg,https://javct.net/v/sgki-097-rm,160,2026-06-24
BAGR-089,"Two Maids Accompany A Young Lady On Her Wedding Night, Helping Her Practice.",https://pic.javct.net/poster/05192026/4b28b57898.jpg,https://javct.net/v/bagr-089,139,2026-06-24
DAVK-081-RM,[Miracle J Cup Beautiful Big Tits] Perverted Boyfriend's NTR Hobby Lent To A Gross Man And A Uniform Beautiful Girl's 100cm Super Soft Colossal Tits Titty Fuck Ejaculation Pai Pamma Co First Seen Man's Sperm 10 Or More Bukkake Creampie Body Fluid Pickled Super Orgy [Uncensored L**ked],https://pic.javct.net/poster/20230205/1683349114.jpg,https://javct.net/v/davk-081-rm,120,2026-06-24
FC2PPV-4924767,"[No] Two black guys with big dicks, a cool beauty with long black hair and a princess cut, violently fucked, and a sweaty hardcore 3P with two consecutive vaginal cum shots at the end [Overseas version] Bonus included",https://pic.javct.net/poster/05192026/bf612b18b1.jpg,https://javct.net/v/fc2ppv-4924767,45,2026-06-24
AKDL-056-RM,[Off-paco video] A bitch layer who is as cute as an idol but gets naughty when she drinks: Kanon Kanon Kanon [Uncensored L**ked],https://pic.javct.net/poster/04112026/13d931ee98.jpg,https://javct.net/v/akdl-056-rm,60,2026-06-24
BBTU-082-RM,Big Tits Bullying Club Hazuki Aoi [Uncensored L**ked],https://pic.javct.net/poster/20243105/1718419220.jpg,https://javct.net/v/bbtu-082-rm,111,2026-06-24
FC2PPV-4926047,"Face Showing Case #138 where an amateur came to do naughty things. To be honest, she was so much of the type that she almost orgasmed on the way...w In the case of fair-skinned beauty Yuka-chan (20)",https://pic.javct.net/poster/05192026/2691eb7d5b.jpg,https://javct.net/v/fc2ppv-4926047,67,2026-07-08
FC2PPV-4915538,"Case #136 where an amateur came to do naughty things with her face exposed. The case of Miku-chan (20), a cute fairy who was given a toy and a lot of mouth fuck.",https://pic.javct.net/poster/05192026/2e031dc88c.jpg,https://javct.net/v/fc2ppv-4915538,56,2026-07-08
FC2PPV-4903172,"[Uncensored x Personal Shooting] Kerberos Special Edition When I asked for a rental girlfriend who was OK with sex, a F-cup beauty with a great figure appeared and she was in no condition to flirt with me.",https://pic.javct.net/poster/04112026/6c34681552.jpg,https://javct.net/v/fc2ppv-4903172,46,2026-07-08
FC2PPV-4899692,"Case #132 where an amateur came to do naughty things with her face exposed Miku-chan (20), a beautiful, fair-skinned and cute girl with an outstanding figure transforms.",https://pic.javct.net/poster/04112026/3f1f029f4e.jpg,https://javct.net/v/fc2ppv-4899692,58,2026-07-08
FC2PPV-4870849,"[Complete amateur] A refreshing and cute 32-year-old single woman sucks a middle-aged man's thick dick, and after making him cum, she licks his pussy and loves to have intense sex. Her enchanted expression is irresistible.",https://pic.javct.net/poster/06032026/1774847642.jpg,https://javct.net/v/fc2ppv-4870849,58,2026-07-08
FC2PPV-4865386,"As a graduation gift, I made a grown-up promise with an 18-year-old... I secretly became friends with my friend Imo⚫︎to.In my last uniform, I had my first creampie in my life, swallowed, and had a cleaning blow job.",https://pic.javct.net/poster/06032026/1773982176.jpg,https://javct.net/v/fc2ppv-4865386,70,2026-07-08
FC2PPV-4855213,"[Complete amateur] Beautiful, cute and wonderful single person, her pussy is thoroughly attacked and she screams with electric massager, finger pussy splash, thick dick piston",https://pic.javct.net/poster/01202026/1772253991.jpg,https://javct.net/v/fc2ppv-4855213,57,2026-07-08
FC2PPV-4846835,[Super close-up pussy cuppa~] Neat and clean black hair long uniform Fair skin and smooth long limbs ♡ Obedient de M natural pussy hair pussy anal open up natural pubic hair / small clitoris / beautiful butt / labia without dark spots / super close-up view,https://pic.javct.net/poster/01202026/1770784948.jpg,https://javct.net/v/fc2ppv-4846835,15,2026-07-08
FC2PPV-4837194,"[Complete amateur] A single user with a naughty body and a cute face seems to like being fucked violently, so he stirs it with his fingers, gets drenched with a large amount of splash, and screams with the piston of the old man's thick penis.",https://pic.javct.net/poster/01202026/1769318339.jpg,https://javct.net/v/fc2ppv-4837194,64,2026-07-08
FC2PPV-4825574,"[Uncensored/Creampie] Photo session Sexual harassment of cosplayers, humiliating photo session, massive creampie cum on beautiful pussy",https://pic.javct.net/poster/12082025/1767588899.jpg,https://javct.net/v/fc2ppv-4825574,64,2026-07-08
FC2PPV-4819991,[Complete Amateur] A very cute single mother with an elegant and naughty technique that makes the old man's dick go crazy. The atmosphere like a married couple is erotic.,https://pic.javct.net/poster/12082025/1766807904.jpg,https://javct.net/v/fc2ppv-4819991,47,2026-07-08
FC2PPV-4820724,CP0443 Masturbation showing off the slimy beauty of a fair-skinned pussy,https://pic.javct.net/poster/12082025/1766724426.jpg,https://javct.net/v/fc2ppv-4820724,31,2026-07-08
FC2PPV-4810880,"[Real amateur] A god-style beauty with a marshmallow, slender body, F-cup, beautiful breasts, beautiful butt, beautiful legs, and a beautiful pussy, with a strong desire for approval, is begged for a serious creampie, and is released in half, half, and inside.",https://pic.javct.net/poster/12082025/1765342972.jpg,https://javct.net/v/fc2ppv-4810880,63,2026-07-08
FC2PPV-4798264,Sakamichi idol type 150cm size everyone's I. Mo./U. and Nagisa-chan\! A plump single lined. Tight/. Lo./ Beautiful pussy ♡ Is there anyone who doesn't like it?,https://pic.javct.net/poster/10232025/1763182415.jpg,https://javct.net/v/fc2ppv-4798264,129,2026-07-08
FC2PPV-4792623,"[Complete amateur] A cute and beautiful 32-year-old single girl whose nervousness and wariness gradually disappear, and she is made to cum by a standing thick dick.",https://pic.javct.net/poster/10232025/1762583561.jpg,https://javct.net/v/fc2ppv-4792623,59,2026-07-08
FC2PPV-4791714,"[First shoot] [Sensitive] Yes, if you open your mouth, you can talk machine guns or give a vacuum blowjob. An office lady with a nice butt and a unique world view is in agony with a seven-colored moaning voice.",https://pic.javct.net/poster/10232025/1762402658.jpg,https://javct.net/v/fc2ppv-4791714,78,2026-07-08
PT-207,Cheer Fuck : Shizuku Hatano,https://pic.javct.net/poster/09052025/1759364394.jpg,https://javct.net/v/pt-207,120,2026-07-08
HEY-223,Sexy Massage Make He manly : Kanna Kitayama,https://pic.javct.net/poster/09052025/1759363877.jpg,https://javct.net/v/hey-223,120,2026-07-08
HEY-222,"Bichi-jo -Dirty Private Lesson- : Miyu Shiina, Ayaka Haruyama",https://pic.javct.net/poster/09052025/1759364028.jpg,https://javct.net/v/hey-222,120,2026-07-08
HEY-224,Office Lady Loves Washroom Masturbation : Kanon Sugiura,https://pic.javct.net/poster/09052025/1759363993.jpg,https://javct.net/v/hey-224,120,2026-07-08
HEY-219,Koukotsu : Maki Hojo,https://pic.javct.net/poster/09052025/1759277995.jpg,https://javct.net/v/hey-219,150,2026-07-08
PT-206,Girl Gets Creampied By Fake Fortune-Teller : Mika Kirishima,https://pic.javct.net/poster/09052025/1759277930.jpg,https://javct.net/v/pt-206,100,2026-07-08
HEY-220,The Best View Of Yuuna Himekawa : Yuuna Himekawa,https://pic.javct.net/poster/09052025/1759277963.jpg,https://javct.net/v/hey-220,120,2026-07-08
HEY-221,Naked Widow Works For Debt : Shino Aoi,https://pic.javct.net/poster/09052025/1759278021.jpg,https://javct.net/v/hey-221,120,2026-07-08
T28-471-RM,"Day Absent Parents, I Was Unreasonable SEX And Two Older Sisters. Yuu Kawakami & Kan'no Flower [Uncensored L**ked]",https://pic.javct.net/poster/04112026/3658aa979c.jpg,https://javct.net/v/t28-471-rm,180,2026-07-08
IENF-452,Sister Harem,https://pic.javct.net/poster/07052026/d1f4dd5984.jpg,https://javct.net/v/ienf-452,123,2026-07-08
JUTA-028-RM,Mother-to-c**ld Love Yonezaki Truth Ru Immediate Family Incest Wet Bathing Grandmother [Uncensored L**ked],https://pic.javct.net/poster/07052026/b89448ef9f.jpg,https://javct.net/v/juta-028-rm,95,2026-07-08
KAAD-68-RM,Beautiful Mother-in-law Of Our House Yukino Ueda [Uncensored L**ked],https://pic.javct.net/poster/20233001/1677121199.jpg,https://javct.net/v/kaad-68-rm,90,2026-07-08
HUNTB-512-RM,"""Wearing My Shirt Again... What Happened To Your Bra And Pants?"" My Sister, Who Always Wears My Clothes Without Permission, Looked At My Shirt Again... And When I Saw It Twice, I Had No Bra! [Uncensored L**ked]",https://pic.javct.net/poster/20230302/1678424398.jpg,https://javct.net/v/huntb-512-rm,170,2026-07-08
SONE-664-SUB,"Even After 30 Years Of Marriage, My Wife, Saki Okuda, Is Still Like A Monkey, Hugging My Mother Every Night. She's Started To Get Horny For Her Father's Insatiable Cock. [English Subtitle]",https://pic.javct.net/poster/20250903/1743705047.jpg,https://javct.net/v/sone-664-sub,120,2026-07-08
TEND-034,My New Husband's Stepc**ld Was A Masochist...and Asked Me To Str**gle Him... Yuno Makikawa,https://pic.javct.net/poster/07052026/81ba451a8f.jpg,https://javct.net/v/tend-034,148,2026-07-08
T28-561,Incest Image Of The Devil Father Who Continues To Commit Love Daughter Kato Momo,https://pic.javct.net/poster/07052026/d803d17b4c.jpg,https://javct.net/v/t28-561,140,2026-07-08
FSKT-017,Ripe Huge Peach And Green Apple Unprotected Aiimoto Is Muchimuchi I Cup Busty Half-assed Star,https://pic.javct.net/poster/07052026/175c57a58a.jpg,https://javct.net/v/fskt-017,130,2026-07-08
SUJI-303,Adolescent Sexuality Leads To Lust. Forbidden Brother And Sister Creampie Incest Shaved Sister Oto Misaki Sound,https://pic.javct.net/poster/07052026/50d61af558.jpg,https://javct.net/v/suji-303,95,2026-07-08
IBW-908Z-RM,"""I Came To See My Uncle..."" Kana Yura, A Niece Who Loves Her Uncle Who Lives In The Countryside [Uncensored L**ked]",https://pic.javct.net/poster/20233001/1677207659.jpg,https://javct.net/v/ibw-908z-rm,120,2026-07-08
VENX-203-RM,"My Son Is A Carnivore With Troubles. Mother Ayano Kato Who Falls Completely Female With Strangulation, Irama, And Fixed Vibrator [Uncensored L**ked]",https://pic.javct.net/poster/20230302/1680238793.jpg,https://javct.net/v/venx-203-rm,95,2026-07-08
VENU-608-RM,"Mother And Son Of Affection Starting From The Kiss, Adhesion, Thick Sex Saya Niiyama [Uncensored L**ked]",https://pic.javct.net/poster/20230206/1687303450.jpg,https://javct.net/v/venu-608-rm,90,2026-07-08
BKD-180,Maternal And C**ld Mating - Tenryu River Road - Ashikawa Ishikawa,https://pic.javct.net/poster/07052026/de44544ab4.jpg,https://javct.net/v/bkd-180,110,2026-07-08
T28-560,"On A Day When My Parents Were Not There, I Was Scared All Day Long Until My Sister And Sperm Died.Ichiro Mio",https://pic.javct.net/poster/07052026/0069ebc116.jpg,https://javct.net/v/t28-560,130,2026-07-08
SCOP-640,The Night That I Got Horny In The Figure Of The Elder Sister Who Fell Asleep While Inserting The Vibs Toy In Masturbation And Gently Pulled Out The Vib And Made Incest,https://pic.javct.net/poster/07052026/9f4e88db66.jpg,https://javct.net/v/scop-640,145,2026-07-08
PKPD-148-RM,"Amateur Fuck Buddy Documentary - Kinda Sorta Almost My Girlfriend - Record Of A Creampie Fuck With My Fuck Buddy Riku, An Office Lady With Colossal I-Cup Tits - Riku Serina [Uncensored L**ked]",https://static.javct.net/poster/pkpd-148.jpg,https://javct.net/v/pkpd-148-rm,140,2026-07-08
APAK-208-RM,(Lewd Masochist! Twitching With Pleasure!) Model Tier Gorgeous Office Worker Works On Day Off To End Up Getting Pounded And Face-fucked Like Crazy For Intense Creampie Sex Caught On Camera. Riona Hirose [Uncensored L**ked],https://pic.javct.net/poster/20212011/1639198108.jpg,https://javct.net/v/apak-208-rm,131,2026-07-08
SAME-227-RM,The Person My Subordinate Assaulted Was The Woman I Loved. [Uncensored L**ked],https://pic.javct.net/poster/05192026/e7611f74e1.jpg,https://javct.net/v/same-227-rm,130,2026-07-08
PKPD-145-RM,Amateur Fuck Buddy Documentary - Lightly Buzzed Creampie Sex With Fragrant Pretty Office Lady In Pantyhose - Hana Shirato [Uncensored L**ked],https://static.javct.net/poster/pkpd-145.jpg,https://javct.net/v/pkpd-145-rm,123,2026-07-08
SAME-227,The Person My Subordinate Assaulted Was The Woman I Loved.,https://pic.javct.net/poster/05192026/e7611f74e1.jpg,https://javct.net/v/same-227,130,2026-07-08
ADN-789,A Married Woman Who Hadn't Had Sex Even Once In Four Years Of Marriage Was Embraced By Her Boss One Night.,https://pic.javct.net/poster/05192026/9699e2c512.jpg,https://javct.net/v/adn-789,120,2026-07-08
MDBK-216-RM,I Will Be Taking Care Of You Today  Hot And Steamy Sexual Service By A Delivery Service Secretary In A Miniskirt [Uncensored L**ked],https://pic.javct.net/poster/20212011/1641638778.jpg,https://javct.net/v/mdbk-216-rm,143,2026-07-08
FCDC-113-RM,A Slutty Female Boss Seduces Her Workers With Her Erect Nipples And Her Big Ass - Honoka Takigawa [Uncensored L**ked],https://pic.javct.net/poster/20221904/1652841165.jpg,https://javct.net/v/fcdc-113-rm,142,2026-07-08
ROYD-227-SUB,"When I Woke Up In The Morning, I Found My Fellow Female Co-worker In Her Underwear In Her Room! She's Always Being Rude And Rude To Me, But I've Been Relying On Her... Hina Nitori [English Subtitle]",https://pic.javct.net/poster/20250903/1742494326.jpg,https://javct.net/v/royd-227-sub,130,2026-07-08
