code,title,image_url,page_url,views,date_scraped
FC2PPV-4933527,"[Facial sample included] Ultra elite new graduate bombshell G cup office lady Total of 6 shots, including 4 creampies, 4K high resolution, over 75 minutes of private serious sex shooting * Only a few left",https://pic.javct.net/poster/07052026/90d5361047.jpg,https://javct.net/v/fc2ppv-4933527,21,2026-07-08
FC2PPV-4931572,"*Ends while supplies last *19-year-old M cup Spanish x Japanese half-gravure idol Unavoidable titflash rush due to her size that exceeds the standard Shocking mass creampie video *Original video will be sent on a first-come, first-served basis",https://pic.javct.net/poster/07052026/1811d7a20c.jpg,https://javct.net/v/fc2ppv-4931572,66,2026-07-08
10-070726-01,Appointment Secured: Yuki Sakura,https://pic.javct.net/poster/07052026/11504d5e03.jpg,https://javct.net/v/10-070726-01,59,2026-07-08
PA-070726-100,"Cum inside me, please!  ~A Lustful Mature Woman Begging for Intense, Cum-Filled Sex~",https://pic.javct.net/poster/07052026/4a4f448ded.jpg,https://javct.net/v/pa-070726-100,58,2026-07-08
CR-070726-001,"The Ecstasy: A passionate, intense kissing and sex session between adults",https://pic.javct.net/poster/07052026/b4c72bf5b3.jpg,https://javct.net/v/cr-070726-001,58,2026-07-08
SDAB-352-RM,"""Today, I'm quitting my job as a good girl."" I live in a housing complex in Mitaka, Tokyo, and I want to get dirty and have sex! Airi Minami 18 years old AV debut [Uncensored L**ked]",https://pic.javct.net/poster/07052026/1ab69fe483.jpg,https://javct.net/v/sdab-352-rm,187,2026-07-08
200GANA-3408,"[The beautiful thing I picked up on a matching app that wasn't beautiful at all] I loved being blamed so much that I couldn't stop until the morning when I decided on the course lol All the details of how it turned out to be an onapet lol In the sex room of a seasoned pick-up artist, I was taken in and secretly filmed having sex 443",https://pic.javct.net/poster/07052026/7ca9feb03d.jpg,https://javct.net/v/200gana-3408,60,2026-07-08
DOCD-036-RM,"[Dick Flash] Meaning: The Act Of Exposing And Showing Off Your Dick In A Public Place Amaharuno Ai, Miyamoto Satomi, Amasawa Rin [Uncensored L**ked]",https://pic.javct.net/poster/20241115/1731645605.jpg,https://javct.net/v/docd-036-rm,180,2026-07-08
FC2PPV-4932658,"[First shot] A boyish 19-year-old with only one experience and a part-time job at a bakery, aspiring to study at Waseda, pours thick cream into his plump skin.",https://pic.javct.net/poster/07052026/a4d2aa32a1.jpg,https://javct.net/v/fc2ppv-4932658,89,2026-07-08
AKDL-076-RM,"[Big-breasted amateur] Ayase, a first-year working dental assistant who has extremely sensitive H-cup breasts and nipples orgasms many times [Uncensored L**ked]",https://pic.javct.net/poster/05192026/72ed9a6ae5.jpg,https://javct.net/v/akdl-076-rm,117,2026-07-08
MISM-152-RM,Irama Nadeshiko [Uncensored L**ked],https://pic.javct.net/poster/07052026/00d02ab02c.jpg,https://javct.net/v/mism-152-rm,190,2026-07-08
YMRK-071-RM,Brutal Manager Creampie R**e Victim Room 901 Active Gravure Idol Hana [Uncensored L**ked],https://pic.javct.net/poster/07052026/ed254364fa.jpg,https://javct.net/v/ymrk-071-rm,69,2026-07-08
ANAV-005,Deep Throat Penetrating Geromasio Ichika Kasagi,https://pic.javct.net/poster/07052026/79457ac623.jpg,https://javct.net/v/anav-005,200,2026-07-08
MIGD-667,"Deep Throating Last, Throat Morphism Nagomi",https://pic.javct.net/poster/07052026/1115c3a18b.jpg,https://javct.net/v/migd-667,180,2026-07-08
CEMD-330-RM,Strong Mating With A Stranger ~ Les Pu → Fallen Female → Sex Slave Erika Ozaki [Uncensored L**ked],https://pic.javct.net/poster/20230205/1683347652.jpg,https://javct.net/v/cemd-330-rm,127,2026-07-08
PGD-674-RM,Wife ~ Ray Perpetrated In Front Of Gangbang R**e-husband [Uncensored L**ked],https://pic.javct.net/poster/20252204/1746805481.jpg,https://javct.net/v/pgd-674-rm,120,2026-07-08
KIMR-005-RM,NTR (Netorare) - A Despicable Affair! A Shocking Video Letter From The Wife: A Record Of The Wife Being Turned Into A Semen Toilet With An Ecstatic Expression On Her Face While Apologizing To Her Husband. [Uncensored L**ked],https://pic.javct.net/poster/05192026/f5432eb863.jpg,https://javct.net/v/kimr-005-rm,104,2026-07-08
BONY-057-RM,Throat Ma Co Creampie Beautiful Girl Training Deep Throating Natsuhana [Uncensored L**ked],https://pic.javct.net/poster/20230804/1692330130.jpg,https://javct.net/v/bony-057-rm,225,2026-07-08
BONY-087-RM,Throat Pussy Intense Pissing Deep Throat Throat Climax Maki Toyama [Uncensored L**ked],https://pic.javct.net/poster/20241902/1708655638.jpg,https://javct.net/v/bony-087-rm,210,2026-07-08
REAL-691,Double Demon Ikase Mochizuki Risa · Konno Hikaru,https://pic.javct.net/poster/07052026/9e6443666d.jpg,https://javct.net/v/real-691,135,2026-07-08
BDD-007-RM,24-year-old Former Gravure Idol Azusa Nagasawa Mara Huge Black VS [Uncensored L**ked],https://pic.javct.net/poster/07052026/8574551048.jpg,https://javct.net/v/bdd-007-rm,120,2026-07-08
BAB-194-RM,"Rei-chan, A Fair-skinned, Slender, Beautiful Girl From The Prefectural Industrial High School. [Uncensored L**ked]",https://pic.javct.net/poster/05192026/948be7fd52.jpg,https://javct.net/v/bab-194-rm,146,2026-07-08
XRW-759-RM,Aphrodisiac And Drill Endless Splash Mitsuru Kamiya [Uncensored L**ked],https://pic.javct.net/poster/07052026/7017571390.jpg,https://javct.net/v/xrw-759-rm,112,2026-07-08
FC2PPV-4933634,"Miho (24) I used a sucking device on a beautiful apparel store clerk, and I fucked her and creampied her.",https://pic.javct.net/poster/07052026/8a6319fe20.jpg,https://javct.net/v/fc2ppv-4933634,72,2026-07-08
MIAA-143-RM,"I've Been R**ed By An Intruder For 5 Days, And On The Third Day I Saw A Sister Who Fell Womb Easily And Got A Full Erection. Airi Mitani [Uncensored L**ked]",https://pic.javct.net/poster/07052026/fa553fb6cb.jpg,https://javct.net/v/miaa-143-rm,120,2026-07-08
AP-369-RM,Runaway Girl Face Slapping R**e! !And Slap A Runaway Girl That Dwell Constraining Home!Deepthroat To!And Slapped Ass!Makutsu Saddle!Pies!Absolutely We Diversion Performance Does Not Increase. [Uncensored L**ked],https://pic.javct.net/poster/07052026/072dc3ba35.jpg,https://javct.net/v/ap-369-rm,220,2026-07-08
FC2PPV-4932358,"Really nice girl, ""Do it all you want to the limit'' for the first time completely showing her face. 8 years old with a good personality peels the whites of her eyes and cums, cries, tears, 549th person to shoot individually.",https://pic.javct.net/poster/07052026/9402d10045.jpg,https://javct.net/v/fc2ppv-4932358,130,2026-07-08
YMRK-072,Brutal Manager Creampie R**e Victim Room 801 Office Lady Ao●,https://pic.javct.net/poster/07052026/71d26572b4.jpg,https://javct.net/v/ymrk-072,66,2026-07-08
YMRK-071,Brutal Manager Creampie R**e Victim Room 901 Active Gravure Idol Hana,https://pic.javct.net/poster/07052026/ed254364fa.jpg,https://javct.net/v/ymrk-071,69,2026-07-08
LULU-444-RM,"""Eh... So Deep..."" Adachi Yuri, A Pale, Slender Aunt Who Can't Hide Her Masochistic Tendencies, Reluctantly Gives Her Nephew A Deep Throat Blowjob At His Request. [Uncensored L**ked]",https://pic.javct.net/poster/05192026/5536b8cbe1.jpg,https://javct.net/v/lulu-444-rm,160,2026-07-08
HALT-024-RM,New Employee Hachioji Sales Office Assignment Commemorative 4P Remi-chan [Uncensored L**ked],https://pic.javct.net/poster/20230302/1679113196.jpg,https://javct.net/v/halt-024-rm,106,2026-07-08
CAWD-991-RM,"Masochists, Go Wild! Asami Honma's Masochistic Side Is Truly Awakened As Her Masochistic Desires Are Stimulated By Virile Old Men. [Uncensored L**ked]",https://pic.javct.net/poster/05192026/2a0a135ac9.jpg,https://javct.net/v/cawd-991-rm,150,2026-07-08
REAL-626-RM,Very Blow Cum Heaven Kururuki Oranges [Uncensored L**ked],https://pic.javct.net/poster/05192026/09d8cd326a.jpg,https://javct.net/v/real-626-rm,115,2026-07-08
FOCS-109-RM,Busty De M Daughter Who Comes As Soon As You Call! The Climax Of Joy With Immediate Irama Immediate Saddle! Obedient Creampie SEX In Dirty Underwear Yukari Noka [Uncensored L**ked],https://pic.javct.net/poster/20222612/1674185777.jpg,https://javct.net/v/focs-109-rm,120,2026-07-08
ZMAR-163-RM,Completely! AIKA3 [Uncensored L**ked],https://pic.javct.net/poster/07052026/34cf5d0f4a.jpg,https://javct.net/v/zmar-163-rm,242,2026-07-08
PGD-676-RM,"Thick, Sticky Sex. Yuki Jin [Uncensored L**ked]",https://pic.javct.net/poster/20221202/1647523259.jpg,https://javct.net/v/pgd-676-rm,145,2026-07-08
XRW-761-RM,A Big Ass Celebrity Wife Who Got Peeped By Her Housecleaner Hikari Sakuraba [Uncensored L**ked],https://pic.javct.net/poster/20220406/1656955249.jpg,https://javct.net/v/xrw-761-rm,127,2026-07-08
HODV-21639-RM,A Couple In Love Shall We Have Sex Again After Having Our Morning Coffee? Rika Aimi [Uncensored L**ked],https://pic.javct.net/poster/20212011/1642148545.jpg,https://javct.net/v/hodv-21639-rm,149,2026-07-08
SDAB-178-RM,"Ultra Perky H-Cup - Her Tits Don't Deflate Even When She's Lying Down - I Told You I Didn't Want My Box Licked, Didn't I? Riho Takahashi Age 19 SOD-Exclusive Porn Debut [Uncensored L**ked]",https://static.javct.net/poster/1621308780.jpeg,https://javct.net/v/sdab-178-rm,133,2026-07-08
PKPD-154-RM,Creampie Debut Document: Tall SSS Style Insurance Lady - Yuno Kamikari [Uncensored L**ked],https://static.javct.net/poster/pkpd-154.jpg,https://javct.net/v/pkpd-154-rm,141,2026-07-08
HND-487-RM,"I Was Supporting When My Creepy Fat C**ldhood Friend Suddenly Had An Adolescent Growth Spurt And Was Trying To Impregnate Me From Behind, But It Actually Felt Good Mikako Abe [Uncensored L**ked]",https://pic.javct.net/poster/20221202/1648182847.jpg,https://javct.net/v/hnd-487-rm,115,2026-07-08
NITR-322-RM,Magical Boys Go Big Tits Housewife Hunting 18 Chitose Yura [Uncensored L**ked],https://pic.javct.net/poster/20221202/1648354545.jpg,https://javct.net/v/nitr-322-rm,150,2026-07-08
JIMMY-004,I Was Having Sex With A Man For A Long Time Because I Was Lonely And Couldn't Bear It Without Telling My Husband... Nanami Kurosawa,https://pic.javct.net/poster/07052026/9d9931bb45.jpg,https://javct.net/v/jimmy-004,115,2026-07-08
FNS-231-RM,"The 30 Minutes I Was In The Bath Was The Time I Had To Endure It.While I Was Taking A Bath, My Growing Body Was Defiled By My Pervert Stepfather. Beach Yayoi [Uncensored L**ked]",https://pic.javct.net/poster/07052026/742f0cf9dc.jpg,https://javct.net/v/fns-231-rm,120,2026-07-08
JUNY-035-RM,My Old Friend's Got Thick Thighs - Grinding Them Together To Wring Out Every Last Drop Of Cum Reo Fujisawa [Uncensored L**ked],https://static.javct.net/poster/juny-035.jpg,https://javct.net/v/juny-035-rm,126,2026-07-08
JUNY-056-RM,The Temptation Of Voluptuous Flesh: The Hot Slut Next Door Seduced Me With Her Naughty Exposed Curves Reo Fujisawa [Uncensored L**ked],https://pic.javct.net/poster/20212011/1644561180.jpg,https://javct.net/v/juny-056-rm,148,2026-07-08
FNS-231,"The 30 Minutes I Was In The Bath Was The Time I Had To Endure It.While I Was Taking A Bath, My Growing Body Was Defiled By My Pervert Stepfather. Beach Yayoi",https://pic.javct.net/poster/07052026/742f0cf9dc.jpg,https://javct.net/v/fns-231,120,2026-07-08
EUMD-008-RM,What is adultery? H Cup Kinky Layer Private Tutor Rika Aimi Seduces The Father Of A Tejeless Student With A Sexy Costume And Plays With Crimps With Her Tits [Uncensored L**ked],https://pic.javct.net/poster/07052026/53ba4a1dc5.jpg,https://javct.net/v/eumd-008-rm,122,2026-07-08
PKPD-152-RM,Sugar Baby Creampie Job Search Rui Sucks Cock With Her Plump Lips In Return For Money Rui Komatsu [Uncensored L**ked],https://static.javct.net/poster/pkpd-152.jpg,https://javct.net/v/pkpd-152-rm,140,2026-07-08
PGD-673-RM,3D Divine Ass - Yuki Jin [Uncensored L**ked],https://pic.javct.net/poster/20220406/1656486781.jpg,https://javct.net/v/pgd-673-rm,149,2026-07-08
SDAB-176-RM,Filming Being Fucked Raw For The First Time At A City Brothel Youthful Days Amu Ohara 18 Years Old [Uncensored L**ked],https://static.javct.net/poster/1620710516.jpg,https://javct.net/v/sdab-176-rm,141,2026-07-08
HIKB-020,Coco BEST [2 years] Beautiful fairy girl and our miracle,https://pic.javct.net/poster/07052026/c49fd49362.jpg,https://javct.net/v/hikb-020,206,2026-07-08
NHDTB-736-RM,Ekiben Creampie J  Slut 6 [Uncensored L**ked],https://pic.javct.net/poster/20230302/1678333456.jpg,https://javct.net/v/nhdtb-736-rm,150,2026-07-08
XVSR-281-RM,Asama Namase Interviewed The First Time After Amateur 's Pretending Shop Interview! ! [Uncensored L**ked],https://pic.javct.net/poster/10232025/1761778620.jpg,https://javct.net/v/xvsr-281-rm,120,2026-07-08
NOSKN-023-RM,"Former Celebrity F Cup 29 Years Old, SSS Personality, Strongest Model With Beautiful Legs Sakura Misaki @ North Skins! [Creampie Document] [Uncensored L**ked]",https://pic.javct.net/poster/20231711/1700454959.jpg,https://javct.net/v/noskn-023-rm,130,2026-07-08
MIST-518-RM,"Grotesque Masturbation ~The Grotesquer The Masturbation, The Better~ Kana Shiokawa, Sumire Mihara, Kazuna Tsukihara, Mizuki Narazaki [Uncensored L**ked]",https://pic.javct.net/poster/07052026/4e7bdf9b9c.jpg,https://javct.net/v/mist-518-rm,154,2026-07-08
PGD-675-RM,3D Masturbation Support Ray [Uncensored L**ked],https://pic.javct.net/poster/05192026/3d7a2ce486.jpg,https://javct.net/v/pgd-675-rm,240,2026-07-08
259LUXU-154,Luxury TV 160,https://pic.javct.net/poster/07052026/ff9c07e983.jpg,https://javct.net/v/259luxu-154,56,2026-07-08
259LUXU-139,Luxury TV 132,https://pic.javct.net/poster/07052026/88037f3eef.jpg,https://javct.net/v/259luxu-139,56,2026-07-08
259LUXU-142,Luxury TV 145,https://pic.javct.net/poster/07052026/fee9683c68.jpg,https://javct.net/v/259luxu-142,58,2026-07-08
MIDE-706-RM,That C**ld Who Was A Popular C**ld Grew Up In The H Cup And AV Debut Nakayama Fumika [Uncensored L**ked],https://pic.javct.net/poster/20253001/1740415712.jpg,https://javct.net/v/mide-706-rm,180,2026-07-08
FC2PPV-2186505,[Tobi Ushio Instructor] **pyjpx*jsps <4K shooting> Shiny super shiny pantyhose & leotard stockings! Fully clothed and blowing all the time! Lewd big tits cumming again and again and begging for creampie!!,https://pic.javct.net/poster/07052026/87d8e92c2e.jpg,https://javct.net/v/fc2ppv-2186505,67,2026-07-08
FC2PPV-2866029,"[Squirting Instructor] **pyjpx*jsps It's been a long time since I've been begging for creampie (4K shooting) I've been having sex for the first time in about 6 months, and I'm squirting from the beginning, and I'm wearing super glossy pantyhose with shiny erotic breasts, and I'm in continuous climax! My vagina hole is left wide open!!",https://pic.javct.net/poster/07052026/9fbcf792eb.jpg,https://javct.net/v/fc2ppv-2866029,38,2026-07-08
FC2PPV-1913526,"[Squirting climax] **pyjpx*jsps (Super glossy pantyhose) She is fo**ed to abstain for a month and goes crazy! Sensitivity doubled! Her whole body is in twitching state! Fully clothed, semen is injected deep into her vagina!!",https://pic.javct.net/poster/07052026/7a9c03c0a1.jpg,https://javct.net/v/fc2ppv-1913526,62,2026-07-08
SVDVD-751,"AV To Stop Time!However, A Sensitive Actress Who Can't Stand The Pant Voice And Squealing Is ""What Is It For Shooting!""And Unplanned Vaginal Cum Shot R**e!",https://pic.javct.net/poster/07052026/1e56d1afbb.jpg,https://javct.net/v/svdvd-751,152,2026-07-08
FC2PPV-1981147,[Squirting Flood]**pyjpx*jsps <4K shooting> Super high leg and glossy pantyhose naughty big breasts instructor's perfect position! Super orgasm! Convulsions! Orgasm squirt! Creampie inside the vagina with a loop!! Recommended with an erotic level of 200%,https://pic.javct.net/poster/07052026/d8b13c416c.jpg,https://javct.net/v/fc2ppv-1981147,45,2026-07-08
SDJS-378V,12 SOD female employees Specialized female genital health checkup 545 minutes of careful douching on pussies,https://pic.javct.net/poster/07052026/31b34e26ad.jpg,https://javct.net/v/sdjs-378v,546,2026-07-08
YMDD-498,"Little Sister Catering Service: Her Voice And Body Are All Mine! Legal, Intimate, And Passionate Sex With My G-cup Little Sister! Sakura Yuno",https://pic.javct.net/poster/07052026/2826f0f68c.jpg,https://javct.net/v/ymdd-498,190,2026-07-08
JRZE-299-RM,First Shooting Married Woman Document Aoi Momoi [Uncensored L**ked],https://pic.javct.net/poster/04112026/83aa7104f1.jpg,https://javct.net/v/jrze-299-rm,131,2026-07-08
BIJN-239-RM,THE Document Instinct Bare Climax SEX A Beautiful Married Woman Who Wants To Be A Meat Urinal Breaks The Limit Incontinence Orgy Climax Wakamiya Hazuki [Uncensored L**ked],https://pic.javct.net/poster/20230302/1677898864.jpg,https://javct.net/v/bijn-239-rm,128,2026-07-08
NINE-067-RM,[Highest Grade Super Aged Meat Mature Woman] Kayo (50 Years Old) Carnivorous Colossal Breasts J-cup Mother Who Overprotects Her Doting Son Sexually [Uncensored L**ked],https://pic.javct.net/poster/20233001/1677466895.jpg,https://javct.net/v/nine-067-rm,111,2026-07-08
JRZE-136-RM,First Shooting Married Woman Documentary Noriko Miyamoto [Uncensored L**ked],https://pic.javct.net/poster/20233001/1677725160.jpg,https://javct.net/v/jrze-136-rm,125,2026-07-08
NUKA-62-RM,Six Shots Without Pulling Out Incest Close Copulation Yuko Shiraki [Uncensored L**ked],https://pic.javct.net/poster/20233001/1677725030.jpg,https://javct.net/v/nuka-62-rm,95,2026-07-08
BJD-050-RM,Mature Full Moon Yuzawa Onsen Trip Miyuki Tsubasa [Uncensored L**ked],https://pic.javct.net/poster/20230302/1677898802.jpg,https://javct.net/v/bjd-050-rm,107,2026-07-08
MYBA-068-RM,Married Woman's Petal Turning Kanna Misaki [Uncensored L**ked],https://pic.javct.net/poster/20241902/1710557982.jpg,https://javct.net/v/myba-068-rm,107,2026-07-08
JURA-190-RM,First Shooting Married Woman Document Chapter 2 Yuki Kasuga [Uncensored L**ked],https://pic.javct.net/poster/04112026/ba849bace0.jpg,https://javct.net/v/jura-190-rm,139,2026-07-08
MYBA-069-RM,Married Woman's Petal Turning An Komatsu [Uncensored L**ked],https://pic.javct.net/poster/20241703/1712980373.jpg,https://javct.net/v/myba-069-rm,122,2026-07-08
OIGS-049-RM,Rope Sickness Married Woman Masochistic Confession Of A Busty Married Woman Falling Into A Rope Slave Hazuki Wakamiya [Uncensored L**ked],https://pic.javct.net/poster/20230302/1678508507.jpg,https://javct.net/v/oigs-049-rm,103,2026-07-08
JUY-347-RM,First Shot Genuine Married Woman AV Appearance Document Original Back Dancer Of A Certain Big Singer Ryoko Fukuda 36 Years Old AV Debut! ! [Uncensored L**ked],https://pic.javct.net/poster/20243105/1718924310.jpg,https://javct.net/v/juy-347-rm,150,2026-07-08
GBSA-097-RM,Close-up Documentary: Adultery Syndrome 001 [Uncensored L**ked],https://pic.javct.net/poster/07052026/c1a6aa30bf.jpg,https://javct.net/v/gbsa-097-rm,140,2026-07-08
VEC-329-RM,Friend's Mother Hachino Tsubasa [Uncensored L**ked],https://pic.javct.net/poster/07052026/00e654540e.jpg,https://javct.net/v/vec-329-rm,105,2026-07-08
JYMA-101-RM,"A Man She Met On Social Media Urged Her To Appear In An Adult Video, And A Young Wife With Big Breasts Was Filmed In An AV Interview. Her Voluptuous Body Was Toyed With, Revealing Her Masochistic Nature. [Uncensored L**ked]",https://pic.javct.net/poster/07052026/dae4345126.jpg,https://javct.net/v/jyma-101-rm,120,2026-07-08
JURA-191-RM,First Shooting Married Woman Document Chapter 2 Mako Haneda [Uncensored L**ked],https://pic.javct.net/poster/04112026/86c558f67d.jpg,https://javct.net/v/jura-191-rm,126,2026-07-08
259LUXU-151,Luxury TV 144,https://pic.javct.net/poster/07052026/95df7d246b.jpg,https://javct.net/v/259luxu-151,58,2026-07-08
259LUXU-137,Luxury TV 133,https://pic.javct.net/poster/07052026/6791df2d53.jpg,https://javct.net/v/259luxu-137,55,2026-07-08
FNEO-016,Fiery Yaba!Dorareko Voyeur! !And All 240 Minutes Of Shocking Female Students!,https://pic.javct.net/poster/07052026/96b190c20e.jpg,https://javct.net/v/fneo-016,240,2026-07-08
AWAW-018-RM,"I Had A 2-day, 1-night NTR With My Best Friend's Girlfriend. My Best Friend's Girlfriend Came Over To My House Saying She Had A Fight With Her Boyfriend (my Best Friend) Who She Lives With, And We Had Sex Until The Morning! [Uncensored L**ked]",https://pic.javct.net/poster/07052026/10d4fb08b7.jpg,https://javct.net/v/awaw-018-rm,165,2026-07-08
CLUB-086-RM,Married Woman To Be Allowed To Sex Cheated In Front Of The Video Voyeur Husband Of Este Not Netorare To Real Meguro [Uncensored L**ked],https://pic.javct.net/poster/07052026/a07280f733.jpg,https://javct.net/v/club-086-rm,180,2026-07-08
GEBB-050,[Epic Episode] Unscrupulous Multi-level Marketing Members Targeting The Uninformed Are Lured In And Punished With A Penis Instead Of Being Recruited.,https://pic.javct.net/poster/07052026/c38037e260.jpg,https://javct.net/v/gebb-050,181,2026-07-08
GVG-829-RM,Full Record Of What A Tutor Made As A Big Tits Student Renu Akabuchi [Uncensored L**ked],https://pic.javct.net/poster/07052026/d17218be8e.jpg,https://javct.net/v/gvg-829-rm,120,2026-07-08
AWAW-018,"I Had A 2-day, 1-night NTR With My Best Friend's Girlfriend. My Best Friend's Girlfriend Came Over To My House Saying She Had A Fight With Her Boyfriend (my Best Friend) Who She Lives With, And We Had Sex Until The Morning!",https://pic.javct.net/poster/07052026/10d4fb08b7.jpg,https://javct.net/v/awaw-018,165,2026-07-08
DRPT-117-RM,"No Matter How Many Times She's Told, The Volleyball Team Captain, Minato Haru, Still Comes To School Without A Bra. [Uncensored L**ked]",https://pic.javct.net/poster/05192026/13d5a19060.jpg,https://javct.net/v/drpt-117-rm,150,2026-07-08
AOZ-297Z-RM,Obscene Recorded Video Of A Younger Brother Who Sleeps A Big Sister With Sleeping Pills And Repeats Vaginal Cum Shot Until She Gets Pregnant [Uncensored L**ked],https://pic.javct.net/poster/20222311/1670172828.jpg,https://javct.net/v/aoz-297z-rm,140,2026-07-08
JUFE-624-RM,"Yukimura Izumi, A Beautiful Wife With A Delicate, Erotic Body, Falls Prey To A Wicked Chiropractor. [Uncensored L**ked]",https://pic.javct.net/poster/05192026/49505642c0.jpg,https://javct.net/v/jufe-624-rm,190,2026-07-08
HODV-21635-RM,This Is The First Time I've Ever Seen A Celebrity Wife With A Huge Erect Penis In A Closed Room. [Uncensored L**ked],https://pic.javct.net/poster/20212011/1638530905.jpg,https://javct.net/v/hodv-21635-rm,166,2026-07-08
JUY-341-RM,Document! !Exclusive Actress Verification Plan Does A Married Wife Yuka Kana Who Is A Talented Guy Gets Urged By A Chara Man And Sexed? [Uncensored L**ked],https://pic.javct.net/poster/20220707/1659926271.jpg,https://javct.net/v/juy-341-rm,150,2026-07-08
GEBB-049-RM,"Delivery Staff Member Stalked, R**ed While Asleep, Dr**ged, And Impregnated. 2 [Uncensored L**ked]",https://pic.javct.net/poster/05192026/92dbdb9855.jpg,https://javct.net/v/gebb-049-rm,146,2026-07-08
300MIUM-1395-RM,"This pervert who approaches with a lewd face has eyes wide ◯ lol She herself says that she can be seen by S, but her eyes are already de masochist's eyes ""I'll insert it...'' She has a nasty look full of expectations and begs for a forbidden dick lol A masochistic woman with a waist that won't stop pounding during the long-awaited insertion is used to the cowgirl position lol :file.43 [Uncensored L**ked]",https://pic.javct.net/poster/07052026/7f69708b9e.jpg,https://javct.net/v/300mium-1395-rm,119,2026-07-08
300MIUM-1395,"This pervert who approaches with a lewd face has eyes wide ◯ lol She herself says that she can be seen by S, but her eyes are already de masochist's eyes ""I'll insert it...'' She has a nasty look full of expectations and begs for a forbidden dick lol A masochistic woman with a waist that won't stop pounding during the long-awaited insertion is used to the cowgirl position lol :file.43",https://pic.javct.net/poster/07052026/7f69708b9e.jpg,https://javct.net/v/300mium-1395,119,2026-07-08
JJEE-017-RM,[First Time Completely Free] [Completely Private Room] [Creampie] [Hidd** Camera Footage L**ked] A Handsome Pistol Will Surely Bring Down A Married Woman At The Resort Beauty Salon 017 [Uncensored L**ked],https://pic.javct.net/poster/05192026/a2a47946c2.jpg,https://javct.net/v/jjee-017-rm,115,2026-07-08
REAL-629-RM,Fast Pleasure Handjob Dirty Blame M Man K**ling Of The Strongest Slut Technician M Erogenous Nishinippori Bizarre Clinic Active Enrolled Miss Matsushima Nami [Uncensored L**ked],https://pic.javct.net/poster/05192026/1fd18bbee9.jpg,https://javct.net/v/real-629-rm,125,2026-07-08
MOPG-036,I Want You To Commit.Which Masochism? Bondage Mirou Ann,https://pic.javct.net/poster/07052026/fc3313148d.jpg,https://javct.net/v/mopg-036,123,2026-07-08
GTJ-093-RM,Rough Play/Meat Ball Aya Shiomi [Uncensored L**ked],https://static.javct.net/poster/gtj-093.jpg,https://javct.net/v/gtj-093-rm,123,2026-07-08
FC2PPV-4927200,"[Fntia freezes because it's too extreme] **pyjpx*jsps An I-cup idol with divine breasts is exposed by the window and exposed! ""Absolutely not! People will see it! Two consecutive creampies in a sense of immorality!'' It's a video that can never be published as it was featured in a weekly magazine",https://pic.javct.net/poster/05192026/afff6d8bd6.jpg,https://javct.net/v/fc2ppv-4927200,34,2026-07-08
MUDR-120-RM,"From That Day Onward... The Beautiful Young Girl in Uniform Underwent S&M, Breaking In And Creampies - Mitsuki Nagisa [Uncensored L**ked]",https://pic.javct.net/poster/20221202/1644728286.jpg,https://javct.net/v/mudr-120-rm,115,2026-07-08
CEMD-858-RM,A lewd and masochistic mature woman - First anal release & 2-hole 3P sex - Saki Aikawa [Uncensored L**ked],https://pic.javct.net/poster/05192026/e5b960fa64.jpg,https://javct.net/v/cemd-858-rm,154,2026-07-08
CEMD-858,A lewd and masochistic mature woman - First anal release & 2-hole 3P sex - Saki Aikawa,https://pic.javct.net/poster/05192026/e5b960fa64.jpg,https://javct.net/v/cemd-858,154,2026-07-08
BRV-159-RM,The Science of Agony - Masochistic Woman's Encyclopedia NEO 9 [Uncensored L**ked],https://pic.javct.net/poster/05192026/2be3d1ab04.jpg,https://javct.net/v/brv-159-rm,118,2026-07-08
