code,title,image_url,page_url,views,date_scraped
FC2PPV-4910714,"Shino (19\) Amateur in the countryside's 3rd shoot. I put a thick vibrator in his anus, and with a piledriver, I shoved vegetables into his vagina and anus.",https://pic.javct.net/poster/05192026/214d9560ef.jpg,https://javct.net/v/fc2ppv-4910714,123,2026-06-03
DLIS-025,Erotic Zone Development Circle Where Women With Insensitivity Worry Gather Koshi Hoshinaka,https://pic.javct.net/poster/05192026/56eb48b50f.jpg,https://javct.net/v/dlis-025,122,2026-06-03
FC2PPV-4907764,"[So cute that you can't believe she's 42 years old] **pyjpx*jsps A naive beautiful witch with little sex experience came to make her last memories before getting married, and I made her do it with her mouth.",https://pic.javct.net/poster/05192026/0c7b4a596f.jpg,https://javct.net/v/fc2ppv-4907764,77,2026-06-03
HUNTB-599-RM,"If You Continue Teasing A Paper Bread Protruding Erection Ji Po Against A Co ○ Ma Through Panties, Will You Ask Himself For A Weak Beauty Esthetician? [Uncensored L**ked]",https://pic.javct.net/poster/20230207/1688705448.jpg,https://javct.net/v/huntb-599-rm,220,2026-06-03
348NTR-007-RM,"An unannounced 3P with a serious office lady. Watching her depressed boyfriend, the quiet, serious office lady takes turns with her hard pistons, and the sweet cries of a lewd female that suddenly echoes in the room with her two male dicks. Her sensitive body trembles little by little as she shyly cums... The finish is with a large amount of semen being sprayed on her dignified face. NTR.net case7 [Uncensored L**ked]",https://pic.javct.net/poster/05192026/c4b28d2380.jpg,https://javct.net/v/348ntr-007-rm,86,2026-06-03
MIDD-918-RM,[Reducing Mosaic] Sexual Healing Men's Massage Parlor - Miku Ohashi [Uncensored L**ked],https://static.javct.net/poster/midd-918.jpg,https://javct.net/v/midd-918-rm,118,2026-06-03
RDT-181-RM,"Rookie Female Teacher To Relieve Stress Painful Not Tell Anyone The Trouble In The Workplace, To Seduce Therapist In Bodywork Salon After Work [Uncensored L**ked]",https://pic.javct.net/poster/05192026/ba7b457215.jpg,https://javct.net/v/rdt-181-rm,120,2026-06-03
MDTM-363-RM,Shin New Zealand Bishoujo Spring Reflexology + Vol.012 Aya Sasami [Uncensored L**ked],https://pic.javct.net/poster/05192026/a486bd1594.jpg,https://javct.net/v/mdtm-363-rm,120,2026-06-03
PA-053026-100,Natural Beauty : Ms. Hironaka's Real Face,https://pic.javct.net/poster/05192026/25b43628eb.jpg,https://javct.net/v/pa-053026-100,27,2026-06-03
PA-052826-100,What If Your Dream Wife Wearing an Apron Naked? : Mirei Imada,https://pic.javct.net/poster/05192026/1710bf2e31.jpg,https://javct.net/v/pa-052826-100,27,2026-06-03
1P-052826-001,Devouring Men!,https://pic.javct.net/poster/05192026/30fce924df.jpg,https://javct.net/v/1p-052826-001,58,2026-06-03
SPRD-801-RM,Ultra Authentic Carnal Fakecest Illustrated - Mother Massaged By Her Own Son Yoshie Mizuno [Uncensored L**ked],https://pic.javct.net/poster/20221108/1662965131.jpg,https://javct.net/v/sprd-801-rm,120,2026-06-03
OBA-054-RM,"Mom, Now the Dehumidifier is Broken. - Chiaki Takeshita [Uncensored L**ked]",https://pic.javct.net/poster/20212011/1640936904.jpg,https://javct.net/v/oba-054-rm,117,2026-06-03
1P-070525-001,Aika Hoshino's Yoga Sex,https://pic.javct.net/poster/05192026/b0588dda75.jpg,https://javct.net/v/1p-070525-001,61,2026-06-03
PA-052626-100,The Temptation of My Unbelievably Sexy Sister-in-Law,https://pic.javct.net/poster/05192026/e272c44859.jpg,https://javct.net/v/pa-052626-100,57,2026-06-03
PA-052326-100,It's Hawaii! A Bikini wife in high spirits! : Ways to End a Sexless Marriage,https://pic.javct.net/poster/05192026/6c8dc8e374.jpg,https://javct.net/v/pa-052326-100,60,2026-06-03
PA-052126-100,A mix of saliva and love juice! A married woman's intense PtoM sex!  : Sara Suzukake,https://pic.javct.net/poster/05192026/9a9e87e82f.jpg,https://javct.net/v/pa-052126-100,60,2026-06-03
GVG-014-RM,Mama's Real Sex Education Kanako Ioka [Uncensored L**ked],https://pic.javct.net/poster/20221904/1651452891.jpg,https://javct.net/v/gvg-014-rm,117,2026-06-03
PA-051926-100,The Temptation of My Busty Boss,https://pic.javct.net/poster/04112026/f80ffcd8f9.jpg,https://javct.net/v/pa-051926-100,60,2026-06-03
PA-051626-100,Working mothers in rural areas : Salesperson for probiotic beverages,https://pic.javct.net/poster/04112026/b686261e70.jpg,https://javct.net/v/pa-051626-100,80,2026-06-03
1P-051626-001,Yui Shinjo: Brought to a Genuine Climax by a Perverted Old Guy,https://pic.javct.net/poster/04112026/0ed16d373b.jpg,https://javct.net/v/1p-051626-001,57,2026-06-03
GVG-785-RM,Stepmother And Offspring Fucking Hitomi Enjoji [Uncensored L**ked],https://pic.javct.net/poster/20212011/1641519705.jpg,https://javct.net/v/gvg-785-rm,131,2026-06-03
NHDTA-898-RM,C**ldhood Friend - Her Little Sister - Her Older Sister - And Even Her Mom! Busty Family Gets Fucked By A Virgin Boy 2 [Uncensored L**ked],https://pic.javct.net/poster/20220707/1660013084.jpg,https://javct.net/v/nhdta-898-rm,142,2026-06-03
PA-051426-100,A Horny Mom Who Gets Forcibly Fucked by Her Son's Friend but Can't Help But Enjoy It,https://pic.javct.net/poster/04112026/0f0d04fc49.jpg,https://javct.net/v/pa-051426-100,54,2026-06-03
1P-051426-001,The Professional Sexy Actress's Style: Eri Saeki,https://pic.javct.net/poster/04112026/7009d842af.jpg,https://javct.net/v/1p-051426-001,56,2026-06-03
GVG-782-RM,Mom's Real Sex Education Kanako Maeda [Uncensored L**ked],https://pic.javct.net/poster/20212011/1644199528.jpg,https://javct.net/v/gvg-782-rm,120,2026-06-03
PA-051226-100,"Mature Woman Special Movie 19 ~ 30s,40s and 50s ~",https://pic.javct.net/poster/04112026/e8d54f3afa.jpg,https://javct.net/v/pa-051226-100,72,2026-06-03
1P-051226-001,PtoM SEX: Sakura Aoi,https://pic.javct.net/poster/04112026/5f64e95de8.jpg,https://javct.net/v/1p-051226-001,61,2026-06-03
PIYO-171-RM,"When I Woke Up, The Schoolgirl Next Door Gently Blowed My Tired Mara. [Uncensored L**ked]",https://pic.javct.net/poster/20230206/1687405006.jpg,https://javct.net/v/piyo-171-rm,120,2026-06-03
EBOD-457-RM,Soggy Concentrated Kiss And Estrus Berokisu Intercourse Mayu Suzuki [Uncensored L**ked],https://pic.javct.net/poster/06032026/1775711202.jpg,https://javct.net/v/ebod-457-rm,150,2026-06-03
STARS-627-RM,"My C**ld, J , Who Was About To Eat, Came To My House, So I Grew Up With My (father-in-law) Exclusive Masochist Daughter. Yura Kudo [Uncensored L**ked]",https://pic.javct.net/poster/20220406/1656398548.jpg,https://javct.net/v/stars-627-rm,130,2026-06-03
BANK-236-RM,"A Mischievous Hot Spring Trip With A Pure, Short-haired Girl With Black Hair. [Uncensored L**ked]",https://pic.javct.net/poster/04112026/f7ce94d676.jpg,https://javct.net/v/bank-236-rm,190,2026-06-03
SMJJ-065-RM,International student T [Uncensored L**ked],https://pic.javct.net/poster/05192026/f01113a2c2.jpg,https://javct.net/v/smjj-065-rm,38,2026-06-03
FONE-158-RM,Temporary Taitoru Underground Idol Kurumi Pillow Sales Frenzy [Uncensored L**ked],https://pic.javct.net/poster/20230207/1689131336.jpg,https://javct.net/v/fone-158-rm,128,2026-06-03
PKPD-107-RM,Yen Woman Dating Creampie OK 18 Years Old Kansai Black Hair Short Pink Nipple Big Breasts Daughter Ishihara Hope [Uncensored L**ked],https://pic.javct.net/poster/06032026/1775366140.jpg,https://javct.net/v/pkpd-107-rm,140,2026-06-03
TEAM-090,Dasa Called After Flight Rookie Cabin Attendant An Tsujimoto Undergoing A Nasty Training Behind Closed Doors,https://pic.javct.net/poster/05192026/210118c5bf.jpg,https://javct.net/v/team-090,150,2026-06-03
APAA-411-RM,The Smell Of Chestnut Flowers And The Love Juice Are Smeared In The Cage Sex. Yuki Hiiragi [Uncensored L**ked],https://pic.javct.net/poster/20230206/1687578849.jpg,https://javct.net/v/apaa-411-rm,170,2026-06-03
BIJN-246-RM,THE DOCUMENT Climax SEX With Instinct Barely Exposed Celebrity Wife With Strong Sexual Desire Orgy Fuck An Komatsu [Uncensored L**ked],https://pic.javct.net/poster/20230206/1688186759.jpg,https://javct.net/v/bijn-246-rm,124,2026-06-03
HONB-303-RM,"While On The Phone With Her Boyfriend, She Went To Tokyo And Became A Long Distance Okinawan Boyfriend And A Live Call NTR Gonzo Age: Early 20s Origin: Okinawa [Uncensored L**ked]",https://pic.javct.net/poster/20230207/1689131958.jpg,https://javct.net/v/honb-303-rm,65,2026-06-03
HZGD-123-RM,Pies Jealousy Of The Wife Of The Boss Pies Les  Pu Ayane Touka [Uncensored L**ked],https://pic.javct.net/poster/20222311/1671848380.jpg,https://javct.net/v/hzgd-123-rm,117,2026-06-03
HMGL-148-RM,Embarrassing Body Ignorance Ignorance Sex Beauty Miori Matsushita [Uncensored L**ked],https://pic.javct.net/poster/06032026/1775621812.jpg,https://javct.net/v/hmgl-148-rm,120,2026-06-03
PKPD-108-RM,New Face Debut Document Erotic Natural Bitch Girl First Shot Yui Satonaka 20 Years Old From Face [Uncensored L**ked],https://pic.javct.net/poster/06032026/1775524453.jpg,https://javct.net/v/pkpd-108-rm,135,2026-06-03
HONB-302-RM,Speaking Of Drinking And Fucking... Akari-chan [Uncensored L**ked],https://pic.javct.net/poster/20230207/1689132022.jpg,https://javct.net/v/honb-302-rm,69,2026-06-03
567BEAF-202-RM,"Maria-chan, a 20-year-old pervert who can't refuse and is the type of person who lacks self-confidence and ends up putting on a good face for others, is the type of person who loses out on showing off to others. Maria-chan, 20 years old [Uncensored L**ked]",https://pic.javct.net/poster/05192026/05322af63b.jpg,https://javct.net/v/567beaf-202-rm,85,2026-06-03
FC2PPV-4909701,"[6 shots in a row] A slender beautiful music college student gets horny by sucking multiple big cocks with plenty of saliva, and climaxes with continuous raw sex and facial cumshots immediately after creampie",https://pic.javct.net/poster/05192026/4ba933dc39.jpg,https://javct.net/v/fc2ppv-4909701,57,2026-06-03
BBAN-065-RM,"Lesbian Athlete -The Glamorous, Hot-B**oded Female Volleyball Player! Non-Stop!! Lesbian!!!- [Uncensored L**ked]",https://pic.javct.net/poster/20221108/1663482407.jpg,https://javct.net/v/bban-065-rm,144,2026-06-03
MBRK-007-RM,"A Double Slut Teases You Until You Go Crazy, A Hell Of Pleasure, A Men's Esthetician To Improve Premature Ejaculation [Uncensored L**ked]",https://pic.javct.net/poster/20240807/1722317011.jpg,https://javct.net/v/mbrk-007-rm,127,2026-06-03
FC2PPV-4909801,A pair of senior and junior office ladies who are best friends get so excited at a group date that they miss the last train and have a creampie bukkake orgy at a hotel until morning.,https://pic.javct.net/poster/05192026/1cc4086002.jpg,https://javct.net/v/fc2ppv-4909801,52,2026-06-03
FC2PPV-4909641,"[3P] It seems that even after training, it is difficult to get used to it.It will be training in 3P.It will be a sex video and a physical examination.",https://pic.javct.net/poster/05192026/01aa860ea8.jpg,https://javct.net/v/fc2ppv-4909641,51,2026-06-03
SON-527,Transformation De M Tits Amateur Woman Thorough To**ure,https://pic.javct.net/poster/05192026/ab9a4f4ccd.jpg,https://javct.net/v/son-527,140,2026-06-03
FOCS-058-RM,Innocent Female College Student Ends Up In University Sex Club And Recorded On Video. Female College Student Gets Really Obsessed With A Boyfriend Who Can't Get Enough Of Big Orgies. Maina Miura. [Uncensored L**ked],https://pic.javct.net/poster/20221202/1646979320.jpg,https://javct.net/v/focs-058-rm,124,2026-06-03
MDE-303-RM,Sexual President's Lewd Plan One Man's Cock Reigned Over By Female Supremacy [Uncensored L**ked],https://pic.javct.net/poster/05192026/a029aa2ae4.jpg,https://javct.net/v/mde-303-rm,236,2026-06-03
ABP-998-RM,My Sister Atsushi Nonoura Shares Sex With Everyone Mako No. 3 Creampie Group 11 Ejaculations [+15 Minutes With Bonus Footage Only Available At MGS] [Uncensored L**ked],https://pic.javct.net/poster/20231711/1701129246.jpg,https://javct.net/v/abp-998-rm,145,2026-06-03
STAR-578-SUB,R**e Pies Woman Of Furukawa Iori Mob [English Subtitle],https://pic.javct.net/poster/06032026/1775115152.jpg,https://javct.net/v/star-578-sub,180,2026-06-03
STARS-084-RM,Squid Want Wanted Compliant To**ure Ika Sedanjon Honjo Rin [Uncensored L**ked],https://pic.javct.net/poster/20243105/1719749763.jpg,https://javct.net/v/stars-084-rm,205,2026-06-03
SOE-703-RM,Drinken Lecher - Golden Shower - Gulping - Large Orgies - Ruri Saijo [Uncensored L**ked],https://pic.javct.net/poster/20212011/1640748499.jpg,https://javct.net/v/soe-703-rm,167,2026-06-03
MIGD-559-RM,Anal Bukkake FUCK NOW! Amber Uta [Uncensored L**ked],https://pic.javct.net/poster/20242012/1735172986.jpg,https://javct.net/v/migd-559-rm,120,2026-06-03
SDJS-375-RM,"When I gave a girl from the human resources department a large amount of beer, she started cumming lol Hikage Yoda (22) [Uncensored L**ked]",https://pic.javct.net/poster/05192026/b976ae52ed.jpg,https://javct.net/v/sdjs-375-rm,120,2026-06-03
FAX-376-RM,FA In The 1990s One Army Blue Film [Uncensored L**ked],https://pic.javct.net/poster/05192026/e006ef3ec2.jpg,https://javct.net/v/fax-376-rm,135,2026-06-03
NITR-266,J Cup Breasts Out In The Cosplayers Orgy Shooting Sayaka Kujo,https://pic.javct.net/poster/05192026/e2f930665f.jpg,https://javct.net/v/nitr-266,130,2026-06-03
SDJS-375,"When I gave a girl from the human resources department a large amount of beer, she started cumming lol Hikage Yoda (22)",https://pic.javct.net/poster/05192026/b976ae52ed.jpg,https://javct.net/v/sdjs-375,120,2026-06-03
DTKM-045-RM,"Fakecest Stepmother And Son Swap, You Can Fuck My Stepmom, So Let Me Fuck Yours. Shinobu Oshima Yukie Mizukami [Uncensored L**ked]",https://pic.javct.net/poster/20220707/1660119590.jpg,https://javct.net/v/dtkm-045-rm,200,2026-06-03
SON-519,Ignorance Ignorant 19-year-old Erotic Length Tongue & Tits Ass Whore Juri Maino,https://pic.javct.net/poster/05192026/9fc7093f6b.jpg,https://javct.net/v/son-519,140,2026-06-03
GVG-803-RM,Metamorphosis Do M Chuu Series Bitch Miyamura Nanako [Uncensored L**ked],https://pic.javct.net/poster/05192026/87c5bd5b57.jpg,https://javct.net/v/gvg-803-rm,130,2026-06-03
APNS-315-RM,Nymphomaniac Stamp Despair Live Streaming Mitsuki Nagisa [Uncensored L**ked],https://pic.javct.net/poster/20230206/1687578726.jpg,https://javct.net/v/apns-315-rm,113,2026-06-03
SDGY-002-RM,"This Beautiful Woman Is A Feminine Man [unbounded By Gender, Limitless Perverted Possibilities], A Super-aggressive, Masochistic Slut Begging For Immediate Sex, Saying ""Hey, Let's Have Sex,"" Offering A Parade Of Pleasure-focused Service That Would Be Absolutely Impossible With The Opposite Sex. [Uncensored L**ked]",https://pic.javct.net/poster/05192026/1e58688dd5.jpg,https://javct.net/v/sdgy-002-rm,130,2026-06-03
TAMM-026-RM,I Will Let You Be A Trained Female Teacher Do M Transformation Woman [Uncensored L**ked],https://pic.javct.net/poster/05192026/9a0f1d7161.jpg,https://javct.net/v/tamm-026-rm,125,2026-06-03
WHX-029,I Have Been A Teacher Of Infirmary!I Decided AV Debut Because I Wanted Try To Play Are Many!22-year-old Teacher And Nursing Riko Manabe ◆ I Want To Experience The 3P That Blame From Two Men,https://pic.javct.net/poster/05192026/7f9ff978fa.jpg,https://javct.net/v/whx-029,120,2026-06-03
BBTU-066-RM,Pai Masochist Black Gal Screaming! Semen Fuck Rumina Sena [Uncensored L**ked],https://pic.javct.net/poster/20230908/1694835236.jpg,https://javct.net/v/bbtu-066-rm,112,2026-06-03
PGD-611-RM,Angers female teacher wearing no underwear bra bombshell [Uncensored L**ked],https://pic.javct.net/poster/06032026/1775621524.jpg,https://javct.net/v/pgd-611-rm,150,2026-06-03
328CNSTV-009-RM,Please be my lewd pussy. [Uncensored L**ked],https://pic.javct.net/poster/05192026/32559b679f.jpg,https://javct.net/v/328cnstv-009-rm,140,2026-06-03
HND-751-SUB,19-year-old Natural-aged Woman Attending A Prestigious Private University [English Subtitle],https://pic.javct.net/poster/06032026/1775635613.jpg,https://javct.net/v/hnd-751-sub,150,2026-06-03
KIMR-004-RM,[Sad News] My Beloved Girlfriend... I Kept Filming Her Being Fucked And Turned Into A Cum Receptacle By Handsome Traveling Cocks On My Phone. [Uncensored L**ked],https://pic.javct.net/poster/05192026/076c7f97c6.jpg,https://javct.net/v/kimr-004-rm,125,2026-06-03
CEMD-275-RM,Extreme Development! Black Gal Who Was Taught Anal Climax Runa Shimotsuki [Uncensored L**ked],https://pic.javct.net/poster/20222311/1671854672.jpg,https://javct.net/v/cemd-275-rm,131,2026-06-03
AGAV-089-RM,A Sensitive Masochistic Woman Brainwashed With A Low-Speed Caress That Will Never Stop Until She Begs Misaki Misaki Okina [Uncensored L**ked],https://pic.javct.net/poster/20230206/1687577374.jpg,https://javct.net/v/agav-089-rm,118,2026-06-03
HZ-3861,Asi-Hame!! Vol.27 - Chen,https://pic.javct.net/poster/05192026/1dcc75eb0e.jpg,https://javct.net/v/hz-3861,61,2026-06-03
HZ-3860,Naughty Bitches Having Sex At The Entrance Vol.2 - Satomi - Kurumi Kokoro,https://pic.javct.net/poster/05192026/37ce0c8972.jpg,https://javct.net/v/hz-3860,60,2026-06-03
FC2PPV-4907806,"Sumire (18) Anyway, this is a first-person angle video of the second shooting of cute Sumire-chan, creampie, anal penetration ATM, and cosplay creampie.",https://pic.javct.net/poster/05192026/9e7d438c0d.jpg,https://javct.net/v/fc2ppv-4907806,58,2026-06-03
HZ-3858,Beauty Collection Vol.122 - Hitomi Tanmura,https://pic.javct.net/poster/05192026/ef10044e0b.jpg,https://javct.net/v/hz-3858,61,2026-06-03
ROYD-065-RM,"The School Idol That Moved Next Door Saw My Boner, And Though She Was Embarassed, She Turned Out To Be A Massive Slut. Mone Kouno [Uncensored L**ked]",https://static.javct.net/poster/royd-065.jpg,https://javct.net/v/royd-065-rm,140,2026-06-03
HZ-3853,Having Sex With A Quiet-Looking Amateur Girl - Miharu Azumi,https://pic.javct.net/poster/05192026/7b2e230564.jpg,https://javct.net/v/hz-3853,51,2026-06-03
HZ-3852,Slender MILF Gets Fucked in a Threesome! - Momoko Akasaka,https://pic.javct.net/poster/05192026/1fcc87afe8.jpg,https://javct.net/v/hz-3852,59,2026-06-03
ROYD-060-RM,"When I Got My First Girlfriend, We Used This Camera To Film So Many Wonderful Memories ... And Now, I'm Using It To Film My Scary Friend While He Fucks Her ... And All The While, I Have A Melancholy Erection, That Just Won't Stop ... Rio Matsumoto [Uncensored L**ked]",https://static.javct.net/poster/royd-060.jpg,https://javct.net/v/royd-060-rm,134,2026-06-03
HZ-3850,Beauty Collection Vol.121 - Yui Nanase,https://pic.javct.net/poster/04112026/9d1f690735.jpg,https://javct.net/v/hz-3850,61,2026-06-03
HZ-3849,I Do Whatever I Want With A Busty MILF!! Vol.3 - Ayumi Fujiwara,https://pic.javct.net/poster/04112026/6a0e180676.jpg,https://javct.net/v/hz-3849,61,2026-06-03
HZ-3848,Erotic Multiple Creampies Vol.8 - Hina Sakurai,https://pic.javct.net/poster/04112026/1c5297f308.jpg,https://javct.net/v/hz-3848,55,2026-06-03
HZ-3846,Beauty Collection Vol.120 - Ami Ogura,https://pic.javct.net/poster/04112026/6df9806905.jpg,https://javct.net/v/hz-3846,61,2026-06-03
FC2PPV-4898377,"Sumire (18) The cutest girl in the second shoot, has a video of different angles of view, creampie, electric masturbation, anal penetration ATM, piston machine, and finally cosplay and creampie.",https://pic.javct.net/poster/04112026/3e21ffb8cd.jpg,https://javct.net/v/fc2ppv-4898377,174,2026-06-03
HZ-3844,Slut Amateur Girl Gets Fucked in a Threesome! - Maho Hoshijima,https://pic.javct.net/poster/04112026/f63afbff7e.jpg,https://javct.net/v/hz-3844,60,2026-06-03
HZ-3843,Slender MILF Stays Nude in Her Home - Hina Kusakabe,https://pic.javct.net/poster/04112026/03748f7c25.jpg,https://javct.net/v/hz-3843,55,2026-06-03
HZ-3837,Beauty Collection Vol.119 - Rion,https://pic.javct.net/poster/04112026/cbe3dbfa19.jpg,https://javct.net/v/hz-3837,61,2026-06-03
HZ-3828,A frustrated wife gets threesome with continuous creampies! - Sara Suzukake,https://pic.javct.net/poster/04112026/bc469fc5b4.jpg,https://javct.net/v/hz-3828,60,2026-06-03
HZ-3836,Beautiful Porcelain Skinned Nurse's Special Treatment - Yui Kisaragi,https://pic.javct.net/poster/04112026/2caa046390.jpg,https://javct.net/v/hz-3836,54,2026-06-03
FC2PPV-4890847,"Sumire (18) This was the second shoot for this super cute girl. Even though she should have known what was going to be done to her, she started to cum again, so I gave her an electric massage, put it in her anus, and used a piston machine.",https://pic.javct.net/poster/04112026/0b23e4cec7.jpg,https://javct.net/v/fc2ppv-4890847,120,2026-06-03
HZ-3835,Cheating woman has her exquisite breasts played with by her FWB - Mirina Nozomi,https://pic.javct.net/poster/04112026/7bfc2f2ed1.jpg,https://javct.net/v/hz-3835,62,2026-06-03
ROYD-056-RM,The Dorm Mom's Daughter Was Completely Defenseless When She Came In To Help With The Sex-starved Male Dorm. Airi Momose [Uncensored L**ked],https://static.javct.net/poster/royd-056.jpg,https://javct.net/v/royd-056-rm,141,2026-06-03
HZ-3834,Beauty Collection Vol.118 - Shiho Sakatani,https://pic.javct.net/poster/04112026/c5a5c9361f.jpg,https://javct.net/v/hz-3834,61,2026-06-03
HZ-3833,Pretty Amateur Girl I Picked up on the Street - Karen Hanatani,https://pic.javct.net/poster/04112026/0972add19a.jpg,https://javct.net/v/hz-3833,64,2026-06-03
NVH-080-RM,"My Best Friend At The All-boys School Is Actually A Girl!? A Transsexual, Flat-chested, Boyish Lesbian: Kondo Mumu / Monami Suzu [Uncensored L**ked]",https://pic.javct.net/poster/05192026/bb1603b261.jpg,https://javct.net/v/nvh-080-rm,160,2026-06-03
MOOC-021-RM,"""You Can Do Whatever You Want With My Ass..."" After My Girlfriend Dumped Me, The Big-assed Cross-dressing Manager Of The Baseball Team Became My Always-available Ass-fucking Junior And Comforted Me With Anal Sex And Cumming Inside. Nanako [Uncensored L**ked]",https://pic.javct.net/poster/05192026/5bc3e90fd8.jpg,https://javct.net/v/mooc-021-rm,160,2026-06-03
MOOC-022-RM,"I Captivated The Frustrated Penis Of The Fair-skinned Trans Woman Who Lives Nearby And Whom I Admired, By Restraining Her And Training Her With A Sex Toy Machine, Leaving Her To Orgasm And Ejaculate Repeatedly, Making Her Fall In Love With Me. (Shirakawa Miyuki) [Uncensored L**ked]",https://pic.javct.net/poster/05192026/7eac031669.jpg,https://javct.net/v/mooc-022-rm,150,2026-06-03
NVH-080,"My Best Friend At The All-boys School Is Actually A Girl!? A Transsexual, Flat-chested, Boyish Lesbian: Kondo Mumu / Monami Suzu",https://pic.javct.net/poster/05192026/bb1603b261.jpg,https://javct.net/v/nvh-080,160,2026-06-03
MOOC-021,"""You Can Do Whatever You Want With My Ass..."" After My Girlfriend Dumped Me, The Big-assed Cross-dressing Manager Of The Baseball Team Became My Always-available Ass-fucking Junior And Comforted Me With Anal Sex And Cumming Inside. Nanako",https://pic.javct.net/poster/05192026/5bc3e90fd8.jpg,https://javct.net/v/mooc-021,160,2026-06-03
SDGY-002,"This Beautiful Woman Is A Feminine Man [unbounded By Gender, Limitless Perverted Possibilities], A Super-aggressive, Masochistic Slut Begging For Immediate Sex, Saying ""Hey, Let's Have Sex,"" Offering A Parade Of Pleasure-focused Service That Would Be Absolutely Impossible With The Opposite Sex.",https://pic.javct.net/poster/05192026/1e58688dd5.jpg,https://javct.net/v/sdgy-002,130,2026-06-03
MOOC-022,"I Captivated The Frustrated Penis Of The Fair-skinned Trans Woman Who Lives Nearby And Whom I Admired, By Restraining Her And Training Her With A Sex Toy Machine, Leaving Her To Orgasm And Ejaculate Repeatedly, Making Her Fall In Love With Me. (Shirakawa Miyuki)",https://pic.javct.net/poster/05192026/7eac031669.jpg,https://javct.net/v/mooc-022,150,2026-06-03
HUSR-230,"I Want To See It Once! 13 Beautiful Transsexuals Senzuri Masturbation Penikuri, Anani, Iki Rolling Special",https://pic.javct.net/poster/05192026/c3c12349e6.jpg,https://javct.net/v/husr-230,120,2026-06-03
UBUG-013-RM,Found An Exceptionally Beautiful Cross-dressing Boy Who Ejaculates 15 Times In His First Anal Debut. [Uncensored L**ked],https://pic.javct.net/poster/05192026/6dabc18bad.jpg,https://javct.net/v/ubug-013-rm,120,2026-06-03
BOKD-315-RM,"Believe It Or Not, I Have A Penis. Aise Marisa [Uncensored L**ked]",https://pic.javct.net/poster/05192026/1929e1b66c.jpg,https://javct.net/v/bokd-315-rm,160,2026-06-03
TOTK-021-RM,Massive Amounts Of Sperm Squirted And Swallowed! Perverted Mania Orgy Training Club Hifumi Yuuri [Uncensored L**ked],https://pic.javct.net/poster/05192026/f48e72ff95.jpg,https://javct.net/v/totk-021-rm,129,2026-06-03
HERY-169-RM,"Crossdressing Boys, Complete Feminization Collection 56: Sana Hayami [Uncensored L**ked]",https://pic.javct.net/poster/05192026/8129f2ea2e.jpg,https://javct.net/v/hery-169-rm,111,2026-06-03
BOKD-198,Transsexual Lesbian Lifting! It Looks Like This And We Follow. Virgin Loss Special 4 Hours,https://pic.javct.net/poster/05192026/cffc89ad63.jpg,https://javct.net/v/bokd-198,240,2026-06-03
NVH-079-RM,"Oryo/Suzuka Kurumi/Minato Haru/Sugiura Minami/Wakatsuki Yui, Masochistic Transsexuals Who Experienced Sexual Lesbian Bullying At An All-girls School. [Uncensored L**ked]",https://pic.javct.net/poster/05192026/b25b383117.jpg,https://javct.net/v/nvh-079-rm,155,2026-06-03
TOTK-021,Massive Amounts Of Sperm Squirted And Swallowed! Perverted Mania Orgy Training Club Hifumi Yuuri,https://pic.javct.net/poster/05192026/f48e72ff95.jpg,https://javct.net/v/totk-021,129,2026-06-03
UBUG-013,Found An Exceptionally Beautiful Cross-dressing Boy Who Ejaculates 15 Times In His First Anal Debut.,https://pic.javct.net/poster/05192026/6dabc18bad.jpg,https://javct.net/v/ubug-013,120,2026-06-03
XRW-733,Do You Like A Beautiful Older Brother?My Older Brother Is A Transsexual!,https://pic.javct.net/poster/05192026/08a6eddd26.jpg,https://javct.net/v/xrw-733,180,2026-06-03
XRW-684,Mother-in-law!The Bride Is!Transsexual! !Incest Stories Under The Roof Of One Of My Sister And Mother-in-law,https://pic.javct.net/poster/05192026/a8d296c084.jpg,https://javct.net/v/xrw-684,240,2026-06-03
