code,title,image_url,page_url,views,date_scraped
JUE-007-RM,"Showa. Female Medic Goes Out Looking For Her Lover On The Battlefield. A Sad And Ephemeral Wartime Story About Ongoing Struggles, Sex With Those In Power, Fucking A Father In Law. Ai Mukai. [Uncensored L**ked]",https://pic.javct.net/poster/20221202/1647760447.jpg,https://javct.net/v/jue-007-rm,120,2026-06-03
HDKA-246-RM,Nude Maid. Nude Maid Referral Office. Ena Satsuki [Uncensored L**ked],https://pic.javct.net/poster/20212011/1638335334.jpg,https://javct.net/v/hdka-246-rm,120,2026-06-03
JUL-489-RM,"A Madonna Label Exclusive Kana Mito She's Lifting Her Lesbian Ban!! While On A Business Trip, To Her Surprise, She Was Booked Into The Same Room At The Business Hotel With Her Cute Colleague, Whom She Discovered, To Her Further Surprise, That She Was A Lesbian. [Uncensored L**ked]",https://pic.javct.net/poster/20212709/1636394681.jpg,https://javct.net/v/jul-489-rm,166,2026-06-03
JUL-537-RM,On A Two Night Three Day Trip I Was Ordered To Stay In The Hotel And Ended Up Seducing The Hot Receptionist... Aoi Mukai [Uncensored L**ked],https://static.javct.net/poster/jul-537.jpg,https://javct.net/v/jul-537-rm,119,2026-06-03
JUY-917-RM,"I Got A New Job, And Now I'm The Fresh Face In The Office, And My Lady Boss Is Always Toying With Me During Work Hours Yuka Oshima [Uncensored L**ked]",https://pic.javct.net/poster/20221904/1652889883.jpg,https://javct.net/v/juy-917-rm,119,2026-06-03
JUY-932-RM,Do You Have A Thing For Older Women? My Female Boss Is Dripping With Sex Appeal At Our Secret Rendezvous Yuko Shiraki [Uncensored L**ked],https://pic.javct.net/poster/20221202/1645520332.jpg,https://javct.net/v/juy-932-rm,120,2026-06-03
JUY-861-RM,I'm The New Guy At Work And My Female Boss Keeps Toying With Me During Work Eriko Miura [Uncensored L**ked],https://pic.javct.net/poster/20221202/1646702161.jpg,https://javct.net/v/juy-861-rm,120,2026-06-03
PFES-029-SUB,The Wet Pantyhose Of The Cooking Expert. Honoka Tsuji [English Subtitle],https://pic.javct.net/poster/20221202/1648190355.jpg,https://javct.net/v/pfes-029-sub,133,2026-06-03
JUL-659-RM,"31 After A Long String Of Work Days, Office Sex That Destroys Reason. Men And Women On The Brink While Working For An Exploitative Company. Marika Kobayashi. [Uncensored L**ked]",https://static.javct.net/poster/jul-659.jpg,https://javct.net/v/jul-659-rm,120,2026-06-03
SCD-198-RM,She's Good At Getting Fucked A Bus Tour Guide In A Miniskirt Arisa Hanyu [Uncensored L**ked],https://pic.javct.net/poster/20212709/1634400573.jpg,https://javct.net/v/scd-198-rm,122,2026-06-03
SPRD-1027-RM,Voluptuous Married Librarian Azusa Yagi [Uncensored L**ked],https://pic.javct.net/poster/20221108/1663689205.jpg,https://javct.net/v/sprd-1027-rm,105,2026-06-03
JUX-854-RM,Married 32-Year-Old Real Life Swimming Instructor At A Famous Fitness Gym's Porn Debut! Tomomi Satonaka [Uncensored L**ked],https://pic.javct.net/poster/20220406/1654583306.jpg,https://javct.net/v/jux-854-rm,119,2026-06-03
JUFD-380-RM,Loads of Glamorous Sticky Juice -A Lady Dripping With Pheromones- Aoi Aoyama [Uncensored L**ked],https://pic.javct.net/poster/20220707/1658245459.jpg,https://javct.net/v/jufd-380-rm,175,2026-06-03
CRC-075-RM,"I Read On The Bulletin Boards About A Business Hotel With A Big Titty Guest Services Clerk In Glasses So I Made A Reservation. It Was True You Could Clearly Tell She Had Colossal Tits Underneath Her Clothes And In My Room The Bed... I Thought I Would Only Get To Look At Her, But Then Those Glasses, Those Big Tits...! Big Titty Guest Services Clerk In Glasses Makes A Blunder! Rie Tachikawa . [Uncensored L**ked]",https://pic.javct.net/poster/20220707/1658429622.jpg,https://javct.net/v/crc-075-rm,118,2026-06-03
LULU-137-RM,This Big Tits Nursery School Teacher Is Unleashing All Of Her Baby Talk Sk**ls To Get The Guardian Of One Of Her Students Rock Hard And Erect Through Baby Dirty Talk And Giving Him A Sweet And Spoiled Titty Fuck Ejaculation Miu Arioka [Uncensored L**ked],https://pic.javct.net/poster/20221904/1651296625.jpg,https://javct.net/v/lulu-137-rm,160,2026-06-03
NHDTA-965-RM,Ikasero In Piston Homestretch Caught Busty Woman Escaping From The Mixed Bathing Molester Molester Teacher! ! [Uncensored L**ked],https://pic.javct.net/poster/20240807/1722986453.jpg,https://javct.net/v/nhdta-965-rm,170,2026-06-03
SHKD-551-SUB,R**e Document Ai Uehara [English Subtitle],https://pic.javct.net/poster/04112026/1776330377.jpg,https://javct.net/v/shkd-551-sub,90,2026-06-03
DV-426-RM,Kaede Matsushima CLUB GAL SEX [Uncensored L**ked],https://pic.javct.net/poster/05192026/a45ea076cd.jpg,https://javct.net/v/dv-426-rm,120,2026-06-03
MIDE-876-RM,Female Teacher Les X Puwa ● ~ Devil Irama / Group Humiliation ~ Nana Yagi [Uncensored L**ked],https://pic.javct.net/poster/20230206/1686641650.jpg,https://javct.net/v/mide-876-rm,150,2026-06-03
ATID-212-RM,"Yu Summer Kaize Truth Investigator Woman, And Was Buried In The Darkness - Drowning In Tentacles [Uncensored L**ked]",https://pic.javct.net/poster/05192026/c1e0db8f31.jpg,https://javct.net/v/atid-212-rm,120,2026-06-03
SVDVD-395-RM,R**e! Man Good Country 2 Even If R**e Pie Only Twice In My Life Anyone [Uncensored L**ked],https://pic.javct.net/poster/05192026/8c35a17924.jpg,https://javct.net/v/svdvd-395-rm,120,2026-06-03
APAK-162-RM,"This Woman, I'll Commit .... R**e Hell That Struck A Beautiful OL.Wet In The Cloudy Liquid, Continuous Meat Rod Insertion!Tragedy That Does Not End Until The Domazo Flowering Broken. Hikaru Konno [Uncensored L**ked]",https://pic.javct.net/poster/05192026/5cfbba9cfe.jpg,https://javct.net/v/apak-162-rm,106,2026-06-03
APAK-102-RM,Tails Mania Nagomi [Uncensored L**ked],https://pic.javct.net/poster/05192026/ce8467ba38.jpg,https://javct.net/v/apak-102-rm,145,2026-06-03
SCOP-600,The Devil Store Manager's Video File L**ked! !Breastfeed R**e Using The Store Manager's Standpoint To Big Tits Employees Suspected Of Being Allegedly In Store After Closing! !A Record Of All That! !2,https://pic.javct.net/poster/05192026/6920a5973c.jpg,https://javct.net/v/scop-600,130,2026-06-03
XV-690-RM,Jack In Ria Sakurai Bus School Girls Confinement [Uncensored L**ked],https://pic.javct.net/poster/05192026/6620a920dd.jpg,https://javct.net/v/xv-690-rm,120,2026-06-03
MDYD-728-RM,Leila Aizaki Slave Mother-in-law [Uncensored L**ked],https://pic.javct.net/poster/20220406/1656433133.jpg,https://javct.net/v/mdyd-728-rm,150,2026-06-03
DV-480-RM,Kaede Matsushima Adult Fairy Tale Snow White [Uncensored L**ked],https://pic.javct.net/poster/20250903/1744212206.jpg,https://javct.net/v/dv-480-rm,120,2026-06-03
XVSR-190-RM,"Even Though It Is Violent, Why Chau Say? [Uncensored L**ked]",https://pic.javct.net/poster/06032026/1772961853.jpg,https://javct.net/v/xvsr-190-rm,240,2026-06-03
FAX-388-RM,Male Sexual Instinct Distorted Want To Do It! Commit The Woman Who Had A Sleep! [Uncensored L**ked],https://pic.javct.net/poster/20230205/1684340864.jpg,https://javct.net/v/fax-388-rm,120,2026-06-03
RTP-104-RM,"I Live Alone, And My Little Sister Came Over To Spend The Night We Hadn't Slept Next To Each Other In 10 Years, But When She Turned Over, I Could See Her Plump Titties! I Couldn't Resist, So I Secretly Started Masturbation, But When She Came Up From Behind And Whispered, ""You Were Jacking Off To My Tits, Weren't You...?"" And Then She Grabbed My Cock... [Uncensored L**ked]",https://pic.javct.net/poster/20212709/1635834935.jpg,https://javct.net/v/rtp-104-rm,125,2026-06-03
SOLE-004-RM,This Big Brother Wants To Be Babied By His Little Sister So He Transformed Himself Into A Girl To Get Her Love Marie Konishi x Miu Akemi [Uncensored L**ked],https://pic.javct.net/poster/20221904/1653959617.jpg,https://javct.net/v/sole-004-rm,108,2026-06-03
HIMA-97-RM,My Beloved Stepmom Got Remarried Chisato Shoda [Uncensored L**ked],https://pic.javct.net/poster/20212011/1640234267.jpg,https://javct.net/v/hima-97-rm,85,2026-06-03
SSIS-314-SUB,"""My New Mama's Tits Are Soft And Huge"". Daily First Time Lessons With Saki-San My New Stepmother. Saki Okuda [English Subtitle]",https://pic.javct.net/poster/20212011/1643951917.jpg,https://javct.net/v/ssis-314-sub,121,2026-06-03
VENX-027-RM,Step Mother And Step Son Have Sex 2 Seconds After Father Leaves The House Nanao Nakano [Uncensored L**ked],https://pic.javct.net/poster/20212308/1632137377.jpg,https://javct.net/v/venx-027-rm,116,2026-06-03
MDVHJ-041-RM,"""Forgive This MILF..."" Her Step-daughter Has A Husband With A Huge Dick That This MILF Just Can't Get Enough Off. Marika Kobayashi [Uncensored L**ked]",https://pic.javct.net/poster/20212709/1635380135.jpg,https://javct.net/v/mdvhj-041-rm,99,2026-06-03
SW-807-RM,Step-brother Has A Super Lovable Step-sister With No Bra And A Panty Shot For Lewd Temptation! It's Going To Be Way Too Hard To Resist. Isn't Her Body Just So Hot Looking These Days?! Ena Satsuki [Uncensored L**ked],https://pic.javct.net/poster/20212709/1634823535.jpg,https://javct.net/v/sw-807-rm,198,2026-06-03
VOSS-065-RM,"My Mom Felt Sorry For Me When I Got Dumped By My Girlfriend, And Said That I Could Have Sex With Her If I Made A Promise To Wear A Condom! But When She Didn't Seem To Feel It, I Secretly Took Off That Rubber And Started Fucking Her Raw Until She Started To Spasm And Orgasm Over And Over Again At First She Said ""You'll Find Another Good Girl Right Away,"" But Then Her Attitude Flipped And She Turned Into A Perverted Bitch And Started Saying, ""I'll Never Let Anyone Else Have You"" 3 Mao Kurata [Uncensored L**ked]",https://pic.javct.net/poster/20221904/1651657920.jpg,https://javct.net/v/voss-065-rm,110,2026-06-03
MIAA-300-RM,This Cherry Boy Little Stepbrother Took His Big Stepsister's Taunts Seriously And Didn't Realize She Had Already Cum When He Went On An Out-Of-Control Piston-Pumping Fuck Fest Rampage Erina Oka [Uncensored L**ked],https://pic.javct.net/poster/20221202/1647660093.jpg,https://javct.net/v/miaa-300-rm,118,2026-06-03
MDTM-105-RM,I Want to Be Tied Up and My Little Sis Does What I Say Kotone Suzumiya [Uncensored L**ked],https://pic.javct.net/poster/20221202/1649230400.jpg,https://javct.net/v/mdtm-105-rm,114,2026-06-03
GVH-273-RM,Mother's Real Education Yui Hatano () [Uncensored L**ked],https://static.javct.net/poster/gvh-273.jpg,https://javct.net/v/gvh-273-rm,120,2026-06-03
HALE-027-RM,Mom Eating Infinite Loop Vol.22 Asami Tall Beautiful Skin Serious Sex Covered With Sweat And Juice [Uncensored L**ked],https://pic.javct.net/poster/20230207/1689395408.jpg,https://javct.net/v/hale-027-rm,128,2026-06-03
SOE-243-RM,Risa Kasumi NO.1STYLE × Esuwan Special Risky Mosaic [Uncensored L**ked],https://pic.javct.net/poster/05192026/252f6b2024.jpg,https://javct.net/v/soe-243-rm,230,2026-06-03
PBD-517,100 Consecutive Blowjobs Right Before Ejaculation,https://pic.javct.net/poster/05192026/0b26a06e77.jpg,https://javct.net/v/pbd-517,240,2026-06-03
JBJB-025,A Fashionable Girl Who Was An Idol In Her School Days Experiences A Soggy Copulation With Her Uncle Asuka Momose,https://pic.javct.net/poster/05192026/27da2cab5c.jpg,https://javct.net/v/jbjb-025,120,2026-06-03
MBG-002-RM,Demon Chi Po Addiction De M Spear Man Black Bitch Gal Creampie Meat Urinal [Uncensored L**ked],https://pic.javct.net/poster/20230207/1689477682.jpg,https://javct.net/v/mbg-002-rm,121,2026-06-03
DIC-093-RM,18 Years And 5 Months 19 F Breasts Big Breasts Pre-Ass Anal Licking Life's First 3P Mayuki Dogami [Uncensored L**ked],https://pic.javct.net/poster/20212011/1639181754.jpg,https://javct.net/v/dic-093-rm,150,2026-06-03
CAWD-993-RM,The Dick Of The Old Man She Hates Is Right Up Her Alley!? The Girl Who Thought She Was Going To Have A Classic Debut Ends Up Having Sex With A Perverted Old Man. 144cm Petite And Cute Girl Makes Her AV Debut: Chizaki Nodoka [Uncensored L**ked],https://pic.javct.net/poster/05192026/119434d471.jpg,https://javct.net/v/cawd-993-rm,150,2026-06-03
MIDA-664-RM,"Newcomer, Is It Okay If She's A Girl Who Likes Both Cooking And Sex? A Three-star Beauty Makes Her AV Debut With The Most Erotic Sex Ever!! Yuuki Nozomi [Uncensored L**ked]",https://pic.javct.net/poster/05192026/518353d1f7.jpg,https://javct.net/v/mida-664-rm,190,2026-06-03
NHDTC-058-RM,"Short-haired Innocent Girl Gets Her Hair Grabbed And Fucked Hard From Behind, Cumming With An Ahegao Face 2 [Uncensored L**ked]",https://pic.javct.net/poster/20252204/1746636653.jpg,https://javct.net/v/nhdtc-058-rm,145,2026-06-03
MIKR-099-RM,[Do○y Project] Beautiful Companion Girl Loved By The Wealthy Around The World Makes Her AV Debut! Takamine Emma [Uncensored L**ked],https://pic.javct.net/poster/05192026/46938acc25.jpg,https://javct.net/v/mikr-099-rm,120,2026-06-03
APAK-235-RM,Slope-style Beautiful Girl Akari-chan [Extreme Sex With A Schoolgirl] Her Hairless Pussy Cums Awkwardly! # Off Paco Girl And Hotel Cage Nasty Climax SEX Akari Minase [Uncensored L**ked],https://pic.javct.net/poster/20221108/1660973484.jpg,https://javct.net/v/apak-235-rm,139,2026-06-03
MIDA-651-RM,"For Three Days While Our Parents Were Away, I Punished My Younger Sister, Who Had A Premature Ejaculation, By Turning Her Into My Personal Orgasm-controlling Maid. (Inoue Momo) [Uncensored L**ked]",https://pic.javct.net/poster/05192026/594587bd97.jpg,https://javct.net/v/mida-651-rm,120,2026-06-03
MIDA-642-RM,"An Unfairly Sexy Body. A Regular Office Worker, She Makes Her AV Debut As A Side Job. Limited Edition, One Release Only: Mari Morishita. [Uncensored L**ked]",https://pic.javct.net/poster/05192026/835a96da89.jpg,https://javct.net/v/mida-642-rm,140,2026-06-03
WHX-025,I'm A Boxed!The Boyfriend Can Not Be Because There Curfew So Sooo Nervous Because It Is AV Shooting For The First Time ◇ I Want To Adventure!20-year-old Cosmetics Sales I Was Crying Because It Is Etched For The First Time In Three Years Or Even ◇,https://pic.javct.net/poster/05192026/dd701f79e4.jpg,https://javct.net/v/whx-025,120,2026-06-03
DANDY-866-RM,"A Girl Who Got Wet In The Rain ○ A See-through Bra Is Too Erotic! ! I Will Unconsciously Tempt You, So I Will Start Fir Tree Immediately [Uncensored L**ked]",https://pic.javct.net/poster/20230207/1689826465.jpg,https://javct.net/v/dandy-866-rm,170,2026-06-03
EBOD-449-RM,Peak 111 Times! !Super Breath Active Gravure!First Experience Sex 4 Hours SP Suzuki Mayu [Uncensored L**ked],https://pic.javct.net/poster/06032026/1775014947.jpg,https://javct.net/v/ebod-449-rm,240,2026-06-03
T28-514,My Younger Sister Who Has A Reputation As A Beautiful Girl In The Class Is Just A Funny Girlfriend. Azumakako,https://pic.javct.net/poster/05192026/d138ee9731.jpg,https://javct.net/v/t28-514,150,2026-06-03
SY-223,"Dear Mrs. Kumiko, 30 Years Old, Living In A Four-and-a-half Tatami Mat Room ● Amateur Four-and-a-half Tatami Mat Room Raw Sex Series Fujikawa Nozomi",https://pic.javct.net/poster/05192026/6cca4acc7b.jpg,https://javct.net/v/sy-223,120,2026-06-03
YMDS-284,The slut wagon is on its way! ! Happening A Go Go! ! Riho Shishido and Liz's unusual journey is out of control! Super-accelerated amateurs' reverse Nan parade with bulging horny luggage - Sexy happenings edition,https://pic.javct.net/poster/05192026/35ced54e4d.jpg,https://javct.net/v/ymds-284,105,2026-06-03
PS-129,"New B-grade Amateur First Shoot 129 ""Sorry, Daddy."" Rio, 25 Years Old, Lives In Osaka, Beer Vendor At The Baseball Stadium, A Seductive Kansai Woman, Sweating Profusely During Orgasm ""No, Stop... I'm Getting Turned On... I'm Getting Turned On!"" ""She Sucks The Cock With Her Moist, Plump Mouth!"" ""Her Smooth Kansai Accent Is So Hot..."" Oikawa Rio",https://pic.javct.net/poster/05192026/0178f32d95.jpg,https://javct.net/v/ps-129,100,2026-06-03
JYMA-036-RM,Frustrated Beautiful Busty Ass Wife Eats Men Sexual Desire Monster Flesh Feeling Body Nasty M Wife Masochist Slut Wife With Sex And Body Is Accused And Cums Hana Himesaki [Uncensored L**ked],https://pic.javct.net/poster/20230206/1687494696.jpg,https://javct.net/v/jyma-036-rm,120,2026-06-03
MIST-089-RM,Rear Charge And College Students Have Been Put In After This Mess [Uncensored L**ked],https://pic.javct.net/poster/05192026/3227d14cc9.jpg,https://javct.net/v/mist-089-rm,160,2026-06-03
KTRA-201E-RM,Secret To Mom! Forbidden Father And Daughter Incest Winter Love [Uncensored L**ked],https://pic.javct.net/poster/20250903/1744152927.jpg,https://javct.net/v/ktra-201e-rm,119,2026-06-03
SW-520-RM,"Dream Incest Incompatibility ◆ ""Mama Is Bad As He Invites Me With Boyne!""My Mother Grasped Her Son's Hardened C**ld And Taught Her A Woman's Body Even Though My Father Was Around. [Uncensored L**ked]",https://pic.javct.net/poster/20242108/1725009517.jpg,https://javct.net/v/sw-520-rm,180,2026-06-03
IBW-491Z-RM,And Sister Incest Trip Secret To Parent Mizuki 1 ● Talent [Uncensored L**ked],https://pic.javct.net/poster/20243105/1717890440.jpg,https://javct.net/v/ibw-491z-rm,140,2026-06-03
XRW-673-RM,Train One Girl Of A Single Mother Carefully And Convert It To A Female ● Raw Meat Urinal And 4 Hours Special [Uncensored L**ked],https://pic.javct.net/poster/05192026/82ec7c10f6.jpg,https://javct.net/v/xrw-673-rm,240,2026-06-03
SIS-008-RM,Post Video Home Voyeur Video Of Brother To Commit The Sister Came Back With Dead Drunk [Uncensored L**ked],https://pic.javct.net/poster/05192026/a7c4a4086e.jpg,https://javct.net/v/sis-008-rm,100,2026-06-03
IBW-476Z-RM,Incest Video Recording Tin Daughter Continued To Be Committed To The Father [Uncensored L**ked],https://pic.javct.net/poster/20222612/1674963006.jpg,https://javct.net/v/ibw-476z-rm,120,2026-06-03
KSBJ-096,My Mother-in-law Who Was Looted Chisato Shoda,https://pic.javct.net/poster/05192026/c5931d5e8e.jpg,https://javct.net/v/ksbj-096,120,2026-06-03
BKD-142,Maternal Copulation [whistling Path] Hitomi Enjo,https://pic.javct.net/poster/05192026/430fe5049f.jpg,https://javct.net/v/bkd-142,120,2026-06-03
BKD-367,Mother And C**ld Copulation ~Okukomagatakeji~ Chisato Shoda,https://pic.javct.net/poster/05192026/745a6caa78.jpg,https://javct.net/v/bkd-367,118,2026-06-03
GVH-849-RM,Mother-son R**e Honami Hazuki [Uncensored L**ked],https://pic.javct.net/poster/05192026/cb3076f09f.jpg,https://javct.net/v/gvh-849-rm,120,2026-06-03
VENU-090-RM,Yuki Sakurai Want To Prank The Mother Of My Mother Too Huge Boobs Phantom [Uncensored L**ked],https://pic.javct.net/poster/05192026/21129b2e89.jpg,https://javct.net/v/venu-090-rm,80,2026-06-03
VENU-016-RM,Hikaru Wakabayashi Sin And Anger And Maternal And Sexual Desire INCEST Incest Mother Phantom [Uncensored L**ked],https://pic.javct.net/poster/05192026/bd67fe7d2e.jpg,https://javct.net/v/venu-016-rm,80,2026-06-03
ALDN-187-RM,Mother R**e Creampie Mother Rin Okae Who Was Cummed Out For The First Time By Her Son [Uncensored L**ked],https://pic.javct.net/poster/20230207/1688788740.jpg,https://javct.net/v/aldn-187-rm,110,2026-06-03
CHCH-037-RM,Colossal Tits Mama Who Loves Her Son ~8 Ejaculations In One Night To Cheer Up Her Son Before Exams~ [Uncensored L**ked],https://pic.javct.net/poster/20230207/1689391061.jpg,https://javct.net/v/chch-037-rm,125,2026-06-03
HHH-412-RM,"The Moment Of Incest... Oh, I Wish I Hadn't Seen It... My Grown-up Son's Dick Is Bigger And More Attractive Than My Husband's... [Uncensored L**ked]",https://pic.javct.net/poster/05192026/de7b61d2cb.jpg,https://javct.net/v/hhh-412-rm,239,2026-06-03
AVSA-263-RM,A Perverted Beautiful Girl Who Was Addicted To A Face Orgasm Kozue Fujita [Uncensored L**ked],https://pic.javct.net/poster/20230908/1694233227.jpg,https://javct.net/v/avsa-263-rm,105,2026-06-03
GVH-849,Mother-son R**e Honami Hazuki,https://pic.javct.net/poster/05192026/cb3076f09f.jpg,https://javct.net/v/gvh-849,120,2026-06-03
IBW-929Z-RM,"""I Came To See My Uncle..."" My Uncle Who Lives In The Countryside Loves My Niece Sexual Intercourse Recorded Video 4 Hours [Uncensored L**ked]",https://pic.javct.net/poster/20230908/1695387244.jpg,https://javct.net/v/ibw-929z-rm,240,2026-06-03
KSBJ-093,Slender Wife Ayaka Muto Who Was Cuckold And Fit In The Trap Of Her Husband And Brother-in-law,https://pic.javct.net/poster/05192026/fc262af440.jpg,https://javct.net/v/ksbj-093,120,2026-06-03
BKD-140,Maternal Copulation [Kurohone Path] Shinomiya Chiaki,https://pic.javct.net/poster/05192026/08fb9ac4cd.jpg,https://javct.net/v/bkd-140,110,2026-06-03
OLM-321E-RM,"This Sexy Woman With Fair Skin, G-cup Breasts, And Thick, Bushy Pubic Hair Wants To Cum Like Crazy From The Amazing Techniques Of A Professional Older Male Actor! - Mayu Suzuki [Uncensored L**ked]",https://pic.javct.net/poster/05192026/ff338067ef.jpg,https://javct.net/v/olm-321e-rm,120,2026-06-03
DOKS-674,"In A World Where Nipple Play Is Commonplace, Sensitive Office Ladies Reach Orgasms From Nipple Stimulation In Front Of Everyone Without Even Realizing They're Being Played With.",https://pic.javct.net/poster/05192026/15fc729f16.jpg,https://javct.net/v/doks-674,120,2026-06-03
348NTR-015-RM,"""Creampie Breaking News"" I got an erotic cabaret girl. She's a miraculous talent with a good face, good body, good sensitivity, and erotic throat. Her lie about her boyfriend was found out, and everyone was in an uproar. She did it in front of her boyfriend. The best work in the www series, and she cums inside without permission. There's no harm in watching it. [Uncensored L**ked]",https://pic.javct.net/poster/05192026/e4481b25fe.jpg,https://javct.net/v/348ntr-015-rm,75,2026-06-03
OLM-321E,"This Sexy Woman With Fair Skin, G-cup Breasts, And Thick, Bushy Pubic Hair Wants To Cum Like Crazy From The Amazing Techniques Of A Professional Older Male Actor! - Mayu Suzuki",https://pic.javct.net/poster/05192026/ff338067ef.jpg,https://javct.net/v/olm-321e,120,2026-06-03
10-053026-01,We got frisky in Kimono before heading out to the summer festival,https://pic.javct.net/poster/05192026/f56fa7738b.jpg,https://javct.net/v/10-053026-01,60,2026-06-03
AARM-025-RM,All New Dirty-Talking Dildo Masturbation. Her Pussy Is Dripping Wet! 3 [Uncensored L**ked],https://pic.javct.net/poster/20212709/1634213056.jpg,https://javct.net/v/aarm-025-rm,125,2026-06-03
JAN-024-RM,E Uniform 24 In Uniform [Uncensored L**ked],https://pic.javct.net/poster/07202025/1753054988.jpg,https://javct.net/v/jan-024-rm,130,2026-06-03
MIDA-659-RM,"Pretending To Listen To Her Best Friend's Girlfriend's Troubles, She Drugs Her With Aphrodisiacs, Remotely Vibrates And Trains Her, Then Plunges Her Into A Swamp With Her Huge Cock, Developing Her Peeing, Weak Pussy Into An NTR Kawaguchi Sakura [Uncensored L**ked]",https://pic.javct.net/poster/05192026/add45207a5.jpg,https://javct.net/v/mida-659-rm,140,2026-06-03
FC2PPV-4909459,"[Individual video] A frustrated young girl is fucked, her arms and legs are restrained and she squirts to climax",https://pic.javct.net/poster/05192026/846a51fbd9.jpg,https://javct.net/v/fc2ppv-4909459,25,2026-06-03
WHX-030,It Felt Good To Think About I Destroyed Pussy Intense I Was Thinking That Naughty While Your Job I Accepted ◆ AV Sex Yesterday!24-year-old Wind Noise Maika Receptionist,https://pic.javct.net/poster/05192026/f23283f8f4.jpg,https://javct.net/v/whx-030,150,2026-06-03
BDDA-030-RM,Mistress Contest ~ A super carnivorous girl sees a mistress recruitment advertisement and makes an intensely erotic appeal ~ Nozomi Arimura [Uncensored L**ked],https://pic.javct.net/poster/05192026/c809828f17.jpg,https://javct.net/v/bdda-030-rm,76,2026-06-03
AKDL-040-RM,"When I continued to to**ure a girl without a bra and showing her breasts until her nipples became hard, I felt it while twisting my hips. [Uncensored L**ked]",https://pic.javct.net/poster/04112026/1776223382412.jpg,https://javct.net/v/akdl-040-rm,230,2026-06-03
VGD-160-RM,All Documents AV Actress Sasaki Koiumi Of That Girl [Uncensored L**ked],https://pic.javct.net/poster/06032026/1774504308.jpg,https://javct.net/v/vgd-160-rm,140,2026-06-03
BOBB-381-RM,"Big Breasts Icup Angel In A White Coat Secret Breast Nursing That Starts With A Nurse Call Boin ""Monami Takarada"" Box [Uncensored L**ked]",https://pic.javct.net/poster/20230206/1687491000.jpg,https://javct.net/v/bobb-381-rm,120,2026-06-03
MIDD-883-RM,Berokissu Rich Chestnut Look Cute Netchori [Uncensored L**ked],https://pic.javct.net/poster/06032026/1774080229.jpg,https://javct.net/v/midd-883-rm,120,2026-06-03
BOKO-039-RM,"Just Before The Wedding, NTR Lesbian Esthetician ""Just For Today..."" That Night I Confided My Troubles To You, And We Made Love In A World Just For The Two Of Us, Where We Couldn't Think About Anything Else. Yuri Maina, Minoshima Meguri [Uncensored L**ked]",https://pic.javct.net/poster/05192026/de9b4a2e95.jpg,https://javct.net/v/boko-039-rm,171,2026-06-03
DV-529-RM,Kaede Matsushima Week Drown In Lust Of A Beautiful Woman Novelist Functional [Uncensored L**ked],https://pic.javct.net/poster/05192026/b35561e6c9.jpg,https://javct.net/v/dv-529-rm,120,2026-06-03
BBAN-195-RM,Susuke Susaki Squirting Squirting Cum Heavy Lesbian Lifting.~ Senshi Ai's Tsu Retriever Getting Caught In A Slender Body ~ [Uncensored L**ked],https://pic.javct.net/poster/20240410/1731107815.jpg,https://javct.net/v/bban-195-rm,150,2026-06-03
CESD-845-RM,Leah Mitsuko Girls × Kojirase Girls Lesbian Room Mate [Uncensored L**ked],https://pic.javct.net/poster/05192026/2078f124a6.jpg,https://javct.net/v/cesd-845-rm,167,2026-06-03
CESD-799-RM,Gachi Rez Homosexuality SEX Where Sena Ai Is Put Together And Rolled Up Oma ○ Cousin Of Otsuki Mai And Aoitsuki!De Nasty Two People Also Violently Blame Sena Love ... Everyone Shrimp Warp Climax! ! [Uncensored L**ked],https://pic.javct.net/poster/20242012/1736028657.jpg,https://javct.net/v/cesd-799-rm,121,2026-06-03
CESD-845,Leah Mitsuko Girls × Kojirase Girls Lesbian Room Mate,https://pic.javct.net/poster/05192026/2078f124a6.jpg,https://javct.net/v/cesd-845,167,2026-06-03
