code,title,image_url,page_url,views,date_scraped
EBOD-228-SUB,[Uncensored] Dutiful Mother Tia [English Subtitle],https://static.javct.net/poster/ebod-228.jpg,https://javct.net/v/ebod-228-sub,119,2026-07-08
GVG-781-RM,A Man Wants His Mother-In-Law's Obscene Tits. Eri Takigawa [Uncensored L**ked],https://pic.javct.net/poster/20212709/1632995722.jpg,https://javct.net/v/gvg-781-rm,120,2026-07-08
XVSR-153-RM,"Erotic Novel, Stepmom Is 19-Year-Old Widow, Ecstatic Tears Of Joy, Suzu Harumiya [Uncensored L**ked]",https://pic.javct.net/poster/20220406/1655917797.jpg,https://javct.net/v/xvsr-153-rm,116,2026-07-08
OBA-381-RM,Cougar Hunter Vol. 2!! My Stepson is Amazing in Bed... Ayaka Makimura [Uncensored L**ked],https://pic.javct.net/poster/20221202/1646614728.jpg,https://javct.net/v/oba-381-rm,141,2026-07-08
SPRD-870-RM,Surrogate Mama Shihori Endo [Uncensored L**ked],https://pic.javct.net/poster/20212011/1641000918.jpg,https://javct.net/v/sprd-870-rm,116,2026-07-08
SPRD-1242-RM,The Surrogate Mother Mio Morishita [Uncensored L**ked],https://pic.javct.net/poster/20212011/1640918548.jpg,https://javct.net/v/sprd-1242-rm,123,2026-07-08
SPRD-1260-SUB,"Dear Stepmom, I, I Like You Better Than My Wife... Iroha Fukuyama [English Subtitle]",https://pic.javct.net/poster/20212011/1637801865.jpg,https://javct.net/v/sprd-1260-sub,106,2026-07-08
VENU-740-RM,This Stepmother And Son Will Start Fucking 2 Seconds After Stepdaddy Leaves For Work Kana Morisawa [Uncensored L**ked],https://pic.javct.net/poster/20221202/1645061130.jpg,https://javct.net/v/venu-740-rm,113,2026-07-08
AUKG-511-RM,"A Wife And Her Mother-In-Law Became Lesbian Lovers - This Horny Stepmom Fucked Her Daughter-In-Law After Watching Her Prancing Around With Her Guard Down, Flashing Panty Shot Action At Her Alice Otsu Shuri Yamaguchi [Uncensored L**ked]",https://static.javct.net/poster/aukg-511.jpg,https://javct.net/v/aukg-511-rm,121,2026-07-08
SPRD-1392-RM,Creampie Relations With My Kind Step Mother... Emi Toda [Uncensored L**ked],https://pic.javct.net/poster/20212011/1637462437.jpg,https://javct.net/v/sprd-1392-rm,108,2026-07-08
JUL-705-RM,After The Graduation Ceremony ... Your Stepmom Is Giving You A Gift To Celebrate Your Entry Into Adulthood ... A Madonna Label Exclusive Beautiful Mature Woman Actress Is Celebrating Your Launch Into The Real World With Her Alluring Eroticism. Maki Hojo [Uncensored L**ked],https://pic.javct.net/poster/20212308/1631256467.jpg,https://javct.net/v/jul-705-rm,124,2026-07-08
GVH-364-RM,"Son-In-Law Aiming For His Mother-In-Law's Too-Sexy Big Titties, With Kyoko Ichikawa [Uncensored L**ked]",https://pic.javct.net/poster/20212011/1644641824.jpg,https://javct.net/v/gvh-364-rm,120,2026-07-08
VENU-088-RM,Magic Mother: Taking Advantage Of Mom's Body While Daddy Is Not Home Asuka Yuki [Uncensored L**ked],https://pic.javct.net/poster/20220406/1656526601.jpg,https://javct.net/v/venu-088-rm,82,2026-07-08
JUL-673-RM,I Was Forbidden To Masturbate When My Wife Was Pregnant So I had Sex With My Mother-In-Law Maki Hojo [Uncensored L**ked],https://static.javct.net/poster/jul-673.jpg,https://javct.net/v/jul-673-rm,120,2026-07-08
ADN-165-US,"Forbidden Immoral Sex 3 An Excessively Young Mother-In-Law Saeko Matsushita [English Subtitle, Reducing Mosaic]",https://pic.javct.net/poster/20221202/1646177501.jpg,https://javct.net/v/adn-165-us,114,2026-07-08
SDMU-673-RM,SOD Romance x French Publishing Living Together I'm A Spoiled Brat Living With My Stepmom Sumire Shiraishi [Uncensored L**ked],https://pic.javct.net/poster/20221202/1648868830.jpg,https://javct.net/v/sdmu-673-rm,129,2026-07-08
SPRD-644-RM,"My Stepmother, Is Way Better Than My Wife... Mari Yonezaki [Uncensored L**ked]",https://pic.javct.net/poster/20212011/1641519219.jpg,https://javct.net/v/sprd-644-rm,115,2026-07-08
SPRD-1484-RM,"Step-mother-in-law, You're Much Better Than My Wife... Iori Nanase [Uncensored L**ked]",https://pic.javct.net/poster/20212011/1637815526.jpg,https://javct.net/v/sprd-1484-rm,139,2026-07-08
JUL-645-RM,Horny Pregnant Stepmom Rides My Cock For A Creampie Behind The Old Man's Back Ai Mukai [Uncensored L**ked],https://static.javct.net/poster/jul-645.jpg,https://javct.net/v/jul-645-rm,124,2026-07-08
SPRD-993-RM,"Dear Stepmom, You're Much Better Than My Wife... Azusa Yagi [Uncensored L**ked]",https://pic.javct.net/poster/20212011/1640980073.jpg,https://javct.net/v/sprd-993-rm,124,2026-07-08
BANK-110-RM,Creampie Open-air Hot Spring Obscene Areola & Bing Bing Deca Nipple! H Byte Of Active JD [Uncensored L**ked],https://pic.javct.net/poster/20233001/1677212356.jpg,https://javct.net/v/bank-110-rm,155,2026-07-08
APAK-248-RM,"""More Ji Po Hard Shite!"" Immediate Saddle Carnivorous SEX! De Nasty! Glittering Flesh Feeling Gal And Demon Piss Intense Sexual Intercourse! Extreme Gachihame Adhesion Shooting! Minami Sawakita [Uncensored L**ked]",https://pic.javct.net/poster/20230302/1678509676.jpg,https://javct.net/v/apak-248-rm,120,2026-07-08
BLOR-211-RM,"A Tall, Big-breasted, And Big-butted Young Lady, Usually A Strong Beauty, Is Sexually To**ured And Becomes A Female With A Huge Cock. [Uncensored L**ked]",https://pic.javct.net/poster/20233001/1677296200.jpg,https://javct.net/v/blor-211-rm,115,2026-07-08
DDHZ-013-RM,Confinement Addicted Woman Claustrophobic Career Woman Riona Hirose [Uncensored L**ked],https://pic.javct.net/poster/20212709/1636783780.jpg,https://javct.net/v/ddhz-013-rm,113,2026-07-08
APAA-404-RM,Affair Trip Immoral Addicted Married Woman A Slutty Married Woman Who Melted In The Pleasure Of Semen Other Than Her Husband's Face And Uterus Asami Mizubata [Uncensored L**ked],https://pic.javct.net/poster/20230302/1678505555.jpg,https://javct.net/v/apaa-404-rm,158,2026-07-08
APAK-247-RM,Nasty Beautiful Girl Satsuki-chan [Extreme Sex With A Schoolgirl] Chaotic SEX That Climaxes! # Off Paco Daughter And Hotel Cage Nasty Climax SEX Mei Satsuki [Uncensored L**ked],https://pic.javct.net/poster/20233001/1677296386.jpg,https://javct.net/v/apak-247-rm,136,2026-07-08
STARS-132-SUB,An Exquisite Creamy Foaming Ferrer Who Can't Refuse If Requested Masami Ichikawa [English Subtitle],https://pic.javct.net/poster/04112026/84a145f5f6.jpg,https://javct.net/v/stars-132-sub,130,2026-07-08
DORI-029,"Paco Shooting No.29 Unauthorized Vaginal Cum Shot To A Simple J ● Shaved Raw Man Who Reminds Me ""It's No Good? Just Rubbing?"" I Was Angry That ""the Inside Is Useless ..."", So I Shot My Face For The Second Time!",https://pic.javct.net/poster/07052026/b5cd6332ea.jpg,https://javct.net/v/dori-029,94,2026-07-08
NHDTB-765-RM,When I Was Taking A Gonzo Of A Gentle Daughter Who Was Threatened To Spread Her Mother's Erotic Videos [Uncensored L**ked],https://pic.javct.net/poster/20230104/1681959493.jpg,https://javct.net/v/nhdtb-765-rm,155,2026-07-08
APAA-403-RM,Rich Muddy Sex With The Scent Of Chestnut Flowers And Love Juice. Alice Otsu [Uncensored L**ked],https://pic.javct.net/poster/20233001/1677296456.jpg,https://javct.net/v/apaa-403-rm,187,2026-07-08
MIDD-904-RM,Please do not look! A closer look at the face-spree-cum Suppin incontinence ~!Yuki niece ~ [Uncensored L**ked],https://pic.javct.net/poster/04112026/1776592467.jpg,https://javct.net/v/midd-904-rm,120,2026-07-08
SOE-100-RM,Ai Sayama Tremendous Risky Mosaic Facials [Uncensored L**ked],https://pic.javct.net/poster/07052026/fe3e1b3b71.jpg,https://javct.net/v/soe-100-rm,120,2026-07-08
XV-885-RM,"Will Retire ... I ... "". ""Haruka Ito'll Celebrate [Uncensored L**ked]",https://pic.javct.net/poster/07052026/1f61def67c.jpg,https://javct.net/v/xv-885-rm,180,2026-07-08
BANK-115-RM,A Prank Hot Spring Trip With An Obedient Beautiful Girl's Daughter-in-law [Uncensored L**ked],https://pic.javct.net/poster/20230302/1679642844.jpg,https://javct.net/v/bank-115-rm,150,2026-07-08
CAWB-010-RM,Was Assigned To Be The Sex Duty Officer During The School Trip... Asami Nami [Uncensored L**ked],https://pic.javct.net/poster/05192026/d85b865450.jpg,https://javct.net/v/cawb-010-rm,140,2026-07-08
MIDA-684-RM,"The Always-lonely, Plain Literary Girl Is Our Convenient Semen Shower Masturbation Pet, Kira Hoshi. [Uncensored L**ked]",https://pic.javct.net/poster/05192026/e995cc3d2c.jpg,https://javct.net/v/mida-684-rm,120,2026-07-08
MIDA-698-RM,"The Legend Of The Strongest Sex Drive, Who Used Up 10 Boxes Of Condoms In The Athletes' Village At The World Championships!! Newcomer 145cm Tall Junior Gymnastics Athlete Makes Her AV Debut!! Aine Sana [Uncensored L**ked]",https://pic.javct.net/poster/05192026/aa53b6556c.jpg,https://javct.net/v/mida-698-rm,150,2026-07-08
FSKT-019,A Woman Who Is Fucked Has A Desire To Be Fucked Again ...This Is True.,https://pic.javct.net/poster/07052026/f28a7a9ca3.jpg,https://javct.net/v/fskt-019,120,2026-07-08
BAB-086-RM,Prefectural Department Of Commerce Lightweight Slender GAL Ame-chan 01 [Uncensored L**ked],https://pic.javct.net/poster/20230302/1677898989.jpg,https://javct.net/v/bab-086-rm,139,2026-07-08
FNEO-015,"An Unprotected Passerra Girl Who Is Unconsciously ""stupid Emphasis"" Who Entered My Sight On A Bus Bus Is Too Cute ...",https://pic.javct.net/poster/07052026/bb93843728.jpg,https://javct.net/v/fneo-015,143,2026-07-08
DORI-030,"Paco Shooting No.30 Irama And Absent-minded Shaved J ● Begged ""I Want You To Put It In ..."" And Vaginal Cum Shot As It Is! Insert It Again From The Resurrection Blowjob And Vaginal Cum Shot For The Second Time!",https://pic.javct.net/poster/07052026/2a1fdacc80.jpg,https://javct.net/v/dori-030,90,2026-07-08
DOKS-445,"Watching Lucky Lady's Hidden Fucking Club ""Waki"" Is Thoroughly Appreciated ... Sniffing!I Lick It! !",https://pic.javct.net/poster/07052026/ed9f670b50.jpg,https://javct.net/v/doks-445,140,2026-07-08
T28-470-RM,● AA Cup Shaved Pretty AV Debut Fukasawa Heard Of School Graduation Freshly 18-year-old [Uncensored L**ked],https://pic.javct.net/poster/04112026/9b696795ed.jpg,https://javct.net/v/t28-470-rm,180,2026-07-08
PKPD-151-RM,Entertainment Escort [Uncensored L**ked],https://static.javct.net/poster/pkpd-151.jpg,https://javct.net/v/pkpd-151-rm,140,2026-07-08
FSKI-014,I Was Surprised By The Fact That I Was Sucking A Big Big Breast Of A Cute Amateur School Girl From The Beginning And Sucking Out A Sudden Big Cock Rubber And I Would Like To Become A Prisoner Of Big Cock By Saying Squid Without Stopping Or Squeezing It Or Not Record Of 10 School Girls Part 3,https://pic.javct.net/poster/07052026/9f1821ab6a.jpg,https://javct.net/v/fski-014,240,2026-07-08
HDRT-004,The black pantyhose of a female student is too tight.,https://pic.javct.net/poster/07052026/dff630a470.jpg,https://javct.net/v/hdrt-004,182,2026-07-08
NNPJ-404-RM,"Nampa Seducing Amateur Girls Who Missed Their Last Trains Home She Wasn't A Blowjob Genius, But When She Gave A Blowjob, She Had The Face Of An Angel!! Her Eyes Were Sparkling As She Gave Me A Blowjob, And Furiously Made Her Case By Flashing That Pretty Little Smile And Her Wonderful Personality This Super Cute Real-Life College Girl is Making Her Adult Video Debut!! [Uncensored L**ked]",https://static.javct.net/poster/nnpj-404.jpg,https://javct.net/v/nnpj-404-rm,150,2026-07-08
CHC-029-RM,Beautiful Girl Teased And Filmed In Private - Complete Submission To An Old Man! Miya-san Swimming Teacher Miya Minase [Uncensored L**ked],https://pic.javct.net/poster/07052026/918faa313c.jpg,https://javct.net/v/chc-029-rm,96,2026-07-08
FC2PPV-4926129,"Himeri, 19 years old/E cup **pyjpx*jsps: Curiosity hidden behind pure simplicity ❤ The first step taken gingerly",https://pic.javct.net/poster/07052026/288e3439d3.jpg,https://javct.net/v/fc2ppv-4926129,37,2026-07-08
JERA-013-RM,"Cum Swallowing Small Faced Sex Friend - She Has Sex With Me Once A Week But Won't Let Me Swallow Her Cum, So I Called Mochizuki Tsubomi-chan Out For A Date On The Weekend And We Went To A Love Hotel Together And Had Lots Of Cum Swallowing And Creampie Time [Uncensored L**ked]",https://pic.javct.net/poster/07052026/86c702c094.jpg,https://javct.net/v/jera-013-rm,211,2026-07-08
FC2PPV-2526543,"[Super beautiful legs, shiny pantyhose, gross vagina] **pyjpx*jsps <Massive creampie> The endless loop of climax that never ends no matter how many times I cum, my testicles are empty. “Give me your sperm!”",https://pic.javct.net/poster/07052026/07facb024b.jpg,https://javct.net/v/fc2ppv-2526543,39,2026-07-08
CLOT-040-RM,Alluring Black Pantyhose-Wearing Female Boss: Yukina Mafuyu [Uncensored L**ked],https://pic.javct.net/poster/07052026/b29ccba988.jpg,https://javct.net/v/clot-040-rm,126,2026-07-08
CLOT-040,Alluring Black Pantyhose-Wearing Female Boss: Yukina Mafuyu,https://pic.javct.net/poster/07052026/b29ccba988.jpg,https://javct.net/v/clot-040,126,2026-07-08
ATID-689-RM,A Female Boss Is Repeatedly Brought To Orgasm By Her Incompetent Subordinate Using A Clitoral Suction Device Until Her Lower Body Is Shaking Uncontrollably. [Uncensored L**ked],https://pic.javct.net/poster/05192026/154df4c48b.jpg,https://javct.net/v/atid-689-rm,150,2026-07-08
DVMM-414-RM,"By Day, She's A Quiet And Serious Senior Office Lady, But By Night, She's An Insatiable Fellatio Fanatic. Every Night At The Office, She Savors And Sucks Her Junior's Dick Dry, Working Overtime Without Giving Him A Blowjob! Her Beautiful Face Is Covered In Sticky, Gooey Semen As She Lets A Massive Amount Of Semen Cum Into Her Mouth, Finally Satisfying Her. Hibiki Ren [Uncensored L**ked]",https://pic.javct.net/poster/05192026/de42d0b431.jpg,https://javct.net/v/dvmm-414-rm,150,2026-07-08
HODV-21631-RM,She Turned Down A Debut In The Entertainment World. The Best SEXUAL Situation With A Fine Woman Who Seduces Men. Arisu Nanase. [Uncensored L**ked],https://pic.javct.net/poster/20212011/1638531027.jpg,https://javct.net/v/hodv-21631-rm,179,2026-07-08
FOCS-107-RM,Attacked While Sleeping In A Shared Room On A Business Trip... A Female Boss Who Has Been Vaginal Cum Shot Many Times By Two Juniors Even Though She Has A Fiance Mirai Nakamaru [Uncensored L**ked],https://pic.javct.net/poster/20222311/1671160411.jpg,https://javct.net/v/focs-107-rm,120,2026-07-08
MOND-243-RM,Longing Female Boss And Haruka Nogi [Uncensored L**ked],https://pic.javct.net/poster/20230302/1679719845.jpg,https://javct.net/v/mond-243-rm,120,2026-07-08
DVMM-414,"By Day, She's A Quiet And Serious Senior Office Lady, But By Night, She's An Insatiable Fellatio Fanatic. Every Night At The Office, She Savors And Sucks Her Junior's Dick Dry, Working Overtime Without Giving Him A Blowjob! Her Beautiful Face Is Covered In Sticky, Gooey Semen As She Lets A Massive Amount Of Semen Cum Into Her Mouth, Finally Satisfying Her. Hibiki Ren",https://pic.javct.net/poster/05192026/de42d0b431.jpg,https://javct.net/v/dvmm-414,150,2026-07-08
ATID-689,A Female Boss Is Repeatedly Brought To Orgasm By Her Incompetent Subordinate Using A Clitoral Suction Device Until Her Lower Body Is Shaking Uncontrollably.,https://pic.javct.net/poster/05192026/154df4c48b.jpg,https://javct.net/v/atid-689,150,2026-07-08
MADM-166-RM,"Is It Far From Home? Then...Come Over To My House.When I Missed The Last Train And Was Asked To Stay At Home, My Usually Serious Boss Showed Me A Bitchy Appearance That I Can't Imagine At All From The Appearance At Work...Kanna Misaki [Uncensored L**ked]",https://pic.javct.net/poster/20230302/1679720093.jpg,https://javct.net/v/madm-166-rm,150,2026-07-08
HODV-21630-RM,"Momonaga Sarina, I'm So Excited! Female In Heat Loves Making Guys Cum [Uncensored L**ked]",https://pic.javct.net/poster/20212011/1638531084.jpg,https://javct.net/v/hodv-21630-rm,149,2026-07-08
XMOM-55-RM,Closed Room Married Woman Female President And Late Night Cock Overtime Mizuki Yayoi [Uncensored L**ked],https://pic.javct.net/poster/20230104/1681355361.jpg,https://javct.net/v/xmom-55-rm,130,2026-07-08
HUNBL-131-RM,"""If You Don't Want To Be Taken Apart, Hold My Dick In Your Mouth!"" The Two Annoying Female Bosses Were A Lesbian Couple! [Uncensored L**ked]",https://pic.javct.net/poster/20230104/1680838175.jpg,https://javct.net/v/hunbl-131-rm,130,2026-07-08
DVEH-004-RM,The Female Boss Who Lives In Secret With Her At The Company Keeps Her Dick Close To Me Even During Remote Meetings Toa Seiri [Uncensored L**ked],https://pic.javct.net/poster/20230104/1682688072.jpg,https://javct.net/v/dveh-004-rm,145,2026-07-08
CJOD-517-RM,"On Her Ovulation Day, My Bossy, Bow-legged, Steaming, Panty-flashing Female Boss Lets Me Cum Inside Her, And With Dirty Talk And Erotic Harassment, She Makes Me Her Slutty Subordinate, Hibiki Ren, Have Sex With Her Once, Twice, Three Times This Month Too. [Uncensored L**ked]",https://pic.javct.net/poster/05192026/9d0113e264.jpg,https://javct.net/v/cjod-517-rm,120,2026-07-08
SNOS-255-RM,"Alone With My Strong-willed, Blue-collar Boss In A Shed Where We Took Shelter During A Torrential Downpour, I Felt Her Femininity In My Body, Drenched In Rain And Sweat, And We Devoured Each Other Instinctively Until Morning. [Uncensored L**ked]",https://pic.javct.net/poster/05192026/4c3c7c171a.jpg,https://javct.net/v/snos-255-rm,120,2026-07-08
SNOS-255,"Alone With My Strong-willed, Blue-collar Boss In A Shed Where We Took Shelter During A Torrential Downpour, I Felt Her Femininity In My Body, Drenched In Rain And Sweat, And We Devoured Each Other Instinctively Until Morning.",https://pic.javct.net/poster/05192026/4c3c7c171a.jpg,https://javct.net/v/snos-255,120,2026-07-08
CJOD-517,"On Her Ovulation Day, My Bossy, Bow-legged, Steaming, Panty-flashing Female Boss Lets Me Cum Inside Her, And With Dirty Talk And Erotic Harassment, She Makes Me Her Slutty Subordinate, Hibiki Ren, Have Sex With Her Once, Twice, Three Times This Month Too.",https://pic.javct.net/poster/05192026/9d0113e264.jpg,https://javct.net/v/cjod-517,120,2026-07-08
DNJR-050-RM,"She Wants To Domme And I Want To Be Dominated. I Was Suddenly Transferred To My Company's Lingerie Division And Seeing Me So Flustered Awakened My Coworker's BDSM Instincts - She Started Hitting On Me At Work Under The Guise Of ""Showing Me The Ropes""... Ruka Inaba [Uncensored L**ked]",https://static.javct.net/poster/dnjr-050.jpg,https://javct.net/v/dnjr-050-rm,149,2026-07-08
HUNTA-867-RM,"""Give Me More"" ""Isn't It Still Going On? 』 Reverse Sexual Harassment Home Drinking With Two Frustrated Busty Bosses. I Was Made To Ejaculate Many Times Until Morning With A Big Tits Sandwich. [Uncensored L**ked]",https://pic.javct.net/poster/20231011/1698663145.jpg,https://javct.net/v/hunta-867-rm,240,2026-07-08
MNGS-060-RM,"My Arrogant Female Boss Is Getting Married, So I Trained Her With A Super-intense, 1000x-sensitivity Aphrodisiac Remote Vibrator And Turned Her Wedding Into A Hellish, Near-orgasm-induced, Incontinent Wedding. - Misono Waka [Uncensored L**ked]",https://pic.javct.net/poster/05192026/f7c2b8f445.jpg,https://javct.net/v/mngs-060-rm,180,2026-07-08
BACJ-059-RM,Nao Yuki [Uncensored L**ked],https://pic.javct.net/poster/20230206/1686369763.jpg,https://javct.net/v/bacj-059-rm,122,2026-07-08
FC2PPV-4884888,[No *High quality Yui 22 years old Nogi◯ beauty's anal licking] Nogi◯ beauty tries anal licking The cute girl licks the anus so much that she gives a blowjob and releases a large amount of the old man's sperm ♡ Anal licking feels so good that the sperm splattered on her face lol,https://pic.javct.net/poster/04112026/1776755796.jpg,https://javct.net/v/fc2ppv-4884888,60,2026-07-08
FC2PPV-4884649,"[Uncensored] Gravure idol Aiko, 24 years old, the distance is too close to show off her beautiful breasts, and on nights when she can't say anything",https://pic.javct.net/poster/04112026/1776755525.jpg,https://javct.net/v/fc2ppv-4884649,25,2026-07-08
PA-042126-100,What If Your Dream Wife Wearing an Apron Naked? : Sakura Sakurai,https://pic.javct.net/poster/04112026/1776755661.jpg,https://javct.net/v/pa-042126-100,55,2026-07-08
10-042126-01,Collects the cum that was sprayed on her face and tastes every drop,https://pic.javct.net/poster/04112026/1776755750.jpg,https://javct.net/v/10-042126-01,09,2026-07-08
HZ-3829,Beauty Collection Vol.117 - Meirin,https://pic.javct.net/poster/04112026/1776755601.jpg,https://javct.net/v/hz-3829,59,2026-07-08
CR-042126-001,The tragedy of a wife who repays her husband's debts with her body,https://pic.javct.net/poster/04112026/1776755732.jpg,https://javct.net/v/cr-042126-001,61,2026-07-08
1P-042126-001,Happy Around in School! : Luxury Spa Club,https://pic.javct.net/poster/04112026/1776755765.jpg,https://javct.net/v/1p-042126-001,60,2026-07-08
FC2PPV-4884772,[Uncensored/Complete amateur/Creampie/Squirting] Neat and innocent 149cm short girl in uniform She's so cute that she inserts herself into a vagina that tightens so tight that you push her back and gives her a rich creampie ♡,https://pic.javct.net/poster/04112026/1776755692.jpg,https://javct.net/v/fc2ppv-4884772,14,2026-07-08
FC2PPV-4884691,"[Uncensored] Big-breasted receptionist Sayaka, 25 years old, her response is not a job, but a sex video record that is destroyed by a too polite distance",https://pic.javct.net/poster/04112026/1776755717.jpg,https://javct.net/v/fc2ppv-4884691,18,2026-07-08
FC2PPV-4884935,[Amateur's first shot] Sumire (18) 163 cm 47 kg D cup and the cutest shooting data was collected from the forehead camera's first person perspective video,https://pic.javct.net/poster/04112026/1776733868.jpg,https://javct.net/v/fc2ppv-4884935,66,2026-07-08
FC2PPV-4884375,"[Slender] A Kansai guy woke up after having sex for the first time in 2 years. He wanted more. He couldn't help but squirt at the overflowing moans. Two consecutive creampies, and a strong squirting finish.",https://pic.javct.net/poster/04112026/1776733779.jpg,https://javct.net/v/fc2ppv-4884375,63,2026-07-08
10-041926-01,Treasured Pussy Selection: Ai Nakano,https://pic.javct.net/poster/04112026/1776669419.jpg,https://javct.net/v/10-041926-01,14,2026-07-08
CR-042026-001,SEX establishment in which staff dress in costumes,https://pic.javct.net/poster/04112026/1776669371.jpg,https://javct.net/v/cr-042026-001,59,2026-07-08
FC2PPV-4883860,"[Limited Uncensored] A hole is made in the official layer condom of the fireworks costume, and she impregnates him on a dangerous day and accepts the invitation and has sex with him...♡ [Fireworks/Collapse Star Rail]",https://pic.javct.net/poster/04112026/1776645835.jpg,https://javct.net/v/fc2ppv-4883860,27,2026-07-08
FC2PPV-4883599,"[Complete secret version] [I cup] [Big breasts] [Creampie] Haruka, a new I cup graduate employee, was fo**ed to leave the company due to escalating harassment from her colleagues and boss [Chapter 1]",https://pic.javct.net/poster/04112026/1776576303.jpg,https://javct.net/v/fc2ppv-4883599,112,2026-07-08
FC2PPV-4883692,"[Uncensored] Hostess Marin, 23 years old, at first it was meant to be light, but before she knew it, the sex had become intense and she couldn't get out of it.",https://pic.javct.net/poster/04112026/1776576339.jpg,https://javct.net/v/fc2ppv-4883692,36,2026-07-08
HZ-3830,Asi-Hame!! Vol.26 - Zhang,https://pic.javct.net/poster/04112026/1776576140.jpg,https://javct.net/v/hz-3830,61,2026-07-08
FC2PPV-4878741,[Uncensored] ** The hidden face of nursery teacher Yumi (22)... Her secret is too neat,https://pic.javct.net/poster/04112026/1776576108.jpg,https://javct.net/v/fc2ppv-4878741,17,2026-07-08
FC2PPV-4882927,[Resale] [Mawashi Project] Here is a divine work full of F-cup beauties whose erotic marshmallow bodies make you irresistible no matter what you wear.,https://pic.javct.net/poster/04112026/1776570068.jpg,https://javct.net/v/fc2ppv-4882927,78,2026-07-08
FC2PPV-4879997,"[Uncensored] Ayame (27) Secretary with big breasts and beautiful breasts, intimate private life that is not usually shown",https://pic.javct.net/poster/04112026/1776576189.jpg,https://javct.net/v/fc2ppv-4879997,16,2026-07-08
FC2PPV-4883529,"380_[Dirty language graffiti] Thank you for her retirement, Runa-chan. Pervert dirty words graffiti on her super dynamite body. At the end, the three actors make Runa-chan enjoy her body to their heart's content. Creampie 4P Runa-chan Chapter 10 [Overseas version]",https://pic.javct.net/poster/04112026/1776569680.jpg,https://javct.net/v/fc2ppv-4883529,58,2026-07-08
HZ-3827,Perverted Maid Turns Into A Nympho With Her Master's Junk - Kaede Takagaki,https://pic.javct.net/poster/04112026/1776487863.jpg,https://javct.net/v/hz-3827,61,2026-07-08
PA-041826-100,It's Hawaii! A Bikini wife in high spirits!,https://pic.javct.net/poster/04112026/1776506834.jpg,https://javct.net/v/pa-041826-100,60,2026-07-08
10-041826-01,SEX within seconds of meeting : Ai Nakano,https://pic.javct.net/poster/04112026/1776487893.jpg,https://javct.net/v/10-041826-01,47,2026-07-08
OBA-096-RM,Mother Son Bath Time Fakecest Mari Yonezaki [Uncensored L**ked],https://pic.javct.net/poster/20221202/1646962870.jpg,https://javct.net/v/oba-096-rm,134,2026-07-08
SPRD-801-SUB,Ultra Authentic Carnal Fakecest Illustrated - Mother Massaged By Her Own Son Yoshie Mizuno [English Subtitle],https://pic.javct.net/poster/20221108/1662965131.jpg,https://javct.net/v/sprd-801-sub,120,2026-07-08
PA-070426-100,Fucking Nonstop in a Reverse Threesome Harem with Horny Mature Women,https://pic.javct.net/poster/07052026/abe3747b33.jpg,https://javct.net/v/pa-070426-100,60,2026-07-08
PA-070226-100,Natural Beauty : Ms. Sakura's Real Face,https://pic.javct.net/poster/05192026/f934eceadd.jpg,https://javct.net/v/pa-070226-100,47,2026-07-08
GVH-157-RM,Mama's True Lies Ena Koume [Uncensored L**ked],https://static.javct.net/poster/gvh-157.jpg,https://javct.net/v/gvh-157-rm,135,2026-07-08
1P-063026-001,PtoM SEX: Misuzu Imada,https://pic.javct.net/poster/05192026/1151ecb2a9.jpg,https://javct.net/v/1p-063026-001,58,2026-07-08
PA-063026-100,I fuck a beautiful E-cup mature woman who feels and cums all the time.,https://pic.javct.net/poster/05192026/b13e03bc95.jpg,https://javct.net/v/pa-063026-100,60,2026-07-08
