code,title,image_url,page_url,views,date_scraped
GMJK-011-RM,Outdoor Exposure Alice Oto [Uncensored L**ked],https://pic.javct.net/poster/20230207/1690433967.jpg,https://javct.net/v/gmjk-011-rm,120,2026-06-03
420HPT-054-RM,"Mina (21) Amateur Hoi Hoi, Amateur Hoi Hoi Pet, Amateur, Beautiful Girl, Excellent Style, Sensitive, Big Breasts, Masochistic Woman, Obedience, Sex Friend, Jumping, Outdoors, Shame, Toy, Creampie, Gonzo, Documentary [Uncensored L**ked]",https://pic.javct.net/poster/05192026/d164d702fb.jpg,https://javct.net/v/420hpt-054-rm,94,2026-06-03
FAX-427-RM,Woman was attacked by a man hit a woman walking the attack / Abegg to set / person for 2 summer of r**e [Uncensored L**ked],https://pic.javct.net/poster/05192026/e126ff2108.jpg,https://javct.net/v/fax-427-rm,100,2026-06-03
IBW-418Z-RM,1 ○ Year Old Sister Outdoors To**ure Eyebrows [Uncensored L**ked],https://pic.javct.net/poster/05192026/869c26f0cf.jpg,https://javct.net/v/ibw-418z-rm,120,2026-06-03
MURIKURI-007,Underwear! Half-naked! And Completely Naked... Stripping Off Her Work Clothes Piece By Piece And Sexually Assaulting Her! Forcing Her To Work In Humiliation Until The End Of Her Shift And Turning The Busty Camp Staff Into A Complete Masochist.,https://pic.javct.net/poster/05192026/c629fbb936.jpg,https://javct.net/v/murikuri-007,167,2026-06-03
TYSF-024-RM,"If It's An AV Production Company's AD, It's Natural To Become A Meat Urinal Ww Fo**ed To Appoint A Sex Processor! Demon Cream Pie Pursuit Press Mai Flower Hunting That Can Be Queued [Uncensored L**ked]",https://pic.javct.net/poster/20221108/1662710508.jpg,https://javct.net/v/tysf-024-rm,240,2026-06-03
FJIN-145-RM,"Pie Time!! Hot Spring Date With A Slippery, Oily J-cup Busty Girl - Hibiki Amamiya [Uncensored L**ked]",https://pic.javct.net/poster/05192026/e466353d7f.jpg,https://javct.net/v/fjin-145-rm,130,2026-06-03
XVSR-196-RM,Asami Nagase Go! !Assault Street Reverse Nampa DX Akihabara Brush Wholesale Ed. [Uncensored L**ked],https://pic.javct.net/poster/06032026/1773381604.jpg,https://javct.net/v/xvsr-196-rm,120,2026-06-03
FJIN-145,"Pie Time!! Hot Spring Date With A Slippery, Oily J-cup Busty Girl - Hibiki Amamiya",https://pic.javct.net/poster/05192026/e466353d7f.jpg,https://javct.net/v/fjin-145,130,2026-06-03
NPJS-268,No-bra Shinjuku Wandering Masochistic Dog Walking Date,https://pic.javct.net/poster/05192026/9d08365c10.jpg,https://javct.net/v/npjs-268,130,2026-06-03
EBOD-500,Openly Half-naked Exposure Veterinary Full View!Phallic Hunting NAOMI From Morning Today,https://pic.javct.net/poster/05192026/dd6e9cfc9f.jpg,https://javct.net/v/ebod-500,150,2026-06-03
420HPT-055-RM,"Lulu (24) Amateur Hoi Hoi, Amateur Hoi Hoi Pet, Amateur, Gal, Slender, Blue Hair, Short Hair, Masochist Woman, Sex Friend, Jumping, Outdoors, Shame, Toy, Creampie, Gonzo, Documentary [Uncensored L**ked]",https://pic.javct.net/poster/05192026/23aeecc80e.jpg,https://javct.net/v/420hpt-055-rm,108,2026-06-03
420HPT-055,"Lulu (24) Amateur Hoi Hoi, Amateur Hoi Hoi Pet, Amateur, Gal, Slender, Blue Hair, Short Hair, Masochist Woman, Sex Friend, Jumping, Outdoors, Shame, Toy, Creampie, Gonzo, Documentary",https://pic.javct.net/poster/05192026/23aeecc80e.jpg,https://javct.net/v/420hpt-055,108,2026-06-03
SGKI-078-RM,Naked Sports Battle 2026 Complete Edition [Uncensored L**ked],https://pic.javct.net/poster/05192026/08a39e27fb.jpg,https://javct.net/v/sgki-078-rm,180,2026-06-03
FAX-390-RM,Fucked-strip-hit Sex Crime! [Uncensored L**ked],https://pic.javct.net/poster/05192026/a45ce92578.jpg,https://javct.net/v/fax-390-rm,115,2026-06-03
SUN-092-RM,No Bra Nipples Pocchi Walk Feeling The Gaze In The Crowd Nipples Bing [Uncensored L**ked],https://pic.javct.net/poster/20230207/1689476945.jpg,https://javct.net/v/sun-092-rm,179,2026-06-03
FAX-263-RM,"War Of Plunder, R**e, Abduction Gangbang [Uncensored L**ked]",https://pic.javct.net/poster/20222410/1666920901.jpg,https://javct.net/v/fax-263-rm,102,2026-06-03
SKMJ-753-RM,"Amateur Beauties On A Walk With Remote-controlled Vibrators - Black Pantyhose Sensitive Career Women Edition - ""I Can't Hold Back Anymore...//"" Office Ladies With Beautiful Legs In Black Pantyhose Tremble And Climax In The Middle Of A Crowd! Their First Ever Humiliating Experience Unexpectedly Turns On Their Erotic Switch! Bold Car Masturbation During Car Rides! And Finally, A Mind-blowing Experience At A Hotel... [Uncensored L**ked]",https://pic.javct.net/poster/05192026/e0f354a82d.jpg,https://javct.net/v/skmj-753-rm,246,2026-06-03
SGKI-078,Naked Sports Battle 2026 Complete Edition,https://pic.javct.net/poster/05192026/08a39e27fb.jpg,https://javct.net/v/sgki-078,180,2026-06-03
AKDL-025-RM,"Shizuka, a college student who loves throat orgasms and sperm. Swallowing all the disgusting middle-aged men she meets for the first time [Dirty dick deep throat deep throat trance] [Begging for the most disgusting semen] [Outdoor urination in broad daylight] Shizuka Sugisaki [Uncensored L**ked]",https://pic.javct.net/poster/06032026/1774954579.jpg,https://javct.net/v/akdl-025-rm,182,2026-06-03
FC2PPV-4884888,[No *High quality Yui 22 years old Nogi◯ beauty's anal licking] Nogi◯ beauty tries anal licking The cute girl licks the anus so much that she gives a blowjob and releases a large amount of the old man's sperm ♡ Anal licking feels so good that the sperm splattered on her face lol,https://pic.javct.net/poster/04112026/1776755796.jpg,https://javct.net/v/fc2ppv-4884888,60,2026-04-25
FC2PPV-4884649,"[Uncensored] Gravure idol Aiko, 24 years old, the distance is too close to show off her beautiful breasts, and on nights when she can't say anything",https://pic.javct.net/poster/04112026/1776755525.jpg,https://javct.net/v/fc2ppv-4884649,25,2026-04-25
PA-042126-100,What If Your Dream Wife Wearing an Apron Naked? : Sakura Sakurai,https://pic.javct.net/poster/04112026/1776755661.jpg,https://javct.net/v/pa-042126-100,55,2026-04-25
10-042126-01,Collects the cum that was sprayed on her face and tastes every drop,https://pic.javct.net/poster/04112026/1776755750.jpg,https://javct.net/v/10-042126-01,09,2026-04-25
HZ-3829,Beauty Collection Vol.117 - Meirin,https://pic.javct.net/poster/04112026/1776755601.jpg,https://javct.net/v/hz-3829,59,2026-04-25
CR-042126-001,The tragedy of a wife who repays her husband's debts with her body,https://pic.javct.net/poster/04112026/1776755732.jpg,https://javct.net/v/cr-042126-001,61,2026-04-25
1P-042126-001,Happy Around in School! : Luxury Spa Club,https://pic.javct.net/poster/04112026/1776755765.jpg,https://javct.net/v/1p-042126-001,60,2026-04-25
FC2PPV-4884772,[Uncensored/Complete amateur/Creampie/Squirting] Neat and innocent 149cm short girl in uniform She's so cute that she inserts herself into a vagina that tightens so tight that you push her back and gives her a rich creampie ♡,https://pic.javct.net/poster/04112026/1776755692.jpg,https://javct.net/v/fc2ppv-4884772,14,2026-04-25
FC2PPV-4884691,"[Uncensored] Big-breasted receptionist Sayaka, 25 years old, her response is not a job, but a sex video record that is destroyed by a too polite distance",https://pic.javct.net/poster/04112026/1776755717.jpg,https://javct.net/v/fc2ppv-4884691,18,2026-04-25
FC2PPV-4884935,[Amateur's first shot] Sumire (18) 163 cm 47 kg D cup and the cutest shooting data was collected from the forehead camera's first person perspective video,https://pic.javct.net/poster/04112026/1776733868.jpg,https://javct.net/v/fc2ppv-4884935,66,2026-04-25
FC2PPV-4884375,"[Slender] A Kansai guy woke up after having sex for the first time in 2 years. He wanted more. He couldn't help but squirt at the overflowing moans. Two consecutive creampies, and a strong squirting finish.",https://pic.javct.net/poster/04112026/1776733779.jpg,https://javct.net/v/fc2ppv-4884375,63,2026-04-25
10-041926-01,Treasured Pussy Selection: Ai Nakano,https://pic.javct.net/poster/04112026/1776669419.jpg,https://javct.net/v/10-041926-01,14,2026-04-25
CR-042026-001,SEX establishment in which staff dress in costumes,https://pic.javct.net/poster/04112026/1776669371.jpg,https://javct.net/v/cr-042026-001,59,2026-04-25
FC2PPV-4883860,"[Limited Uncensored] A hole is made in the official layer condom of the fireworks costume, and she impregnates him on a dangerous day and accepts the invitation and has sex with him...♡ [Fireworks/Collapse Star Rail]",https://pic.javct.net/poster/04112026/1776645835.jpg,https://javct.net/v/fc2ppv-4883860,27,2026-04-25
FC2PPV-4883599,"[Complete secret version] [I cup] [Big breasts] [Creampie] Haruka, a new I cup graduate employee, was fo**ed to leave the company due to escalating harassment from her colleagues and boss [Chapter 1]",https://pic.javct.net/poster/04112026/1776576303.jpg,https://javct.net/v/fc2ppv-4883599,112,2026-04-25
FC2PPV-4883692,"[Uncensored] Hostess Marin, 23 years old, at first it was meant to be light, but before she knew it, the sex had become intense and she couldn't get out of it.",https://pic.javct.net/poster/04112026/1776576339.jpg,https://javct.net/v/fc2ppv-4883692,36,2026-04-25
HZ-3830,Asi-Hame!! Vol.26 - Zhang,https://pic.javct.net/poster/04112026/1776576140.jpg,https://javct.net/v/hz-3830,61,2026-04-25
FC2PPV-4878741,[Uncensored] ** The hidden face of nursery teacher Yumi (22)... Her secret is too neat,https://pic.javct.net/poster/04112026/1776576108.jpg,https://javct.net/v/fc2ppv-4878741,17,2026-04-25
FC2PPV-4882927,[Resale] [Mawashi Project] Here is a divine work full of F-cup beauties whose erotic marshmallow bodies make you irresistible no matter what you wear.,https://pic.javct.net/poster/04112026/1776570068.jpg,https://javct.net/v/fc2ppv-4882927,78,2026-04-25
FC2PPV-4879997,"[Uncensored] Ayame (27) Secretary with big breasts and beautiful breasts, intimate private life that is not usually shown",https://pic.javct.net/poster/04112026/1776576189.jpg,https://javct.net/v/fc2ppv-4879997,16,2026-04-25
FC2PPV-4883529,"380_[Dirty language graffiti] Thank you for her retirement, Runa-chan. Pervert dirty words graffiti on her super dynamite body. At the end, the three actors make Runa-chan enjoy her body to their heart's content. Creampie 4P Runa-chan Chapter 10 [Overseas version]",https://pic.javct.net/poster/04112026/1776569680.jpg,https://javct.net/v/fc2ppv-4883529,58,2026-04-25
HZ-3827,Perverted Maid Turns Into A Nympho With Her Master's Junk - Kaede Takagaki,https://pic.javct.net/poster/04112026/1776487863.jpg,https://javct.net/v/hz-3827,61,2026-04-25
PA-041826-100,It's Hawaii! A Bikini wife in high spirits!,https://pic.javct.net/poster/04112026/1776506834.jpg,https://javct.net/v/pa-041826-100,60,2026-04-25
10-041826-01,SEX within seconds of meeting : Ai Nakano,https://pic.javct.net/poster/04112026/1776487893.jpg,https://javct.net/v/10-041826-01,47,2026-04-25
FC2PPV-4912137,Aoi-chan with an idol face Gonzo part 2,https://pic.javct.net/poster/05192026/6f85e89018.jpg,https://javct.net/v/fc2ppv-4912137,31,2026-06-03
FC2PPV-4912458,He thrusts a thick finger into her asshole and fucks a beautiful wife with a big ass and makes her do NTR for the first time and cums inside her.,https://pic.javct.net/poster/05192026/c7e404dfad.jpg,https://javct.net/v/fc2ppv-4912458,77,2026-06-03
300MIUM-1313,"[A sullen boss who gets wet in the back of his throat] Frustrated boss with Chiko in his mouth, sat straight, deep-seated, with a neat face, a sullen and lewd model-like beauty shakes her hips and cums with convulsions and creampies [In-house affair] [Single man (subordinate) x married woman (boss)] case.23",https://pic.javct.net/poster/05192026/af1636dd9d.jpg,https://javct.net/v/300mium-1313,57,2026-06-03
300MIUM-793-RM,The clerk of the family is so cute and super erotic ... This little devil gal is a super carnivorous little devil who touches it immediately and tightens it at the deepest part of the throat www Irresponsible Creampie To A Beautiful Man Who Does A Thick Thick Super Muddy SEX I Like You: Would You Like To Skip The Company Today? [Uncensored L**ked],https://pic.javct.net/poster/20221202/1644882242.jpg,https://javct.net/v/300mium-793-rm,109,2026-06-03
261ARA-082-RM,Recruitment-chan 082 Rei 24 years old Private tutor [Uncensored L**ked],https://pic.javct.net/poster/05192026/1d4bc7063b.jpg,https://javct.net/v/261ara-082-rm,58,2026-06-03
SIRO-5696,"My first experience with a lewd body with a model-class style is too erotic, and my older sister's male experience is one night. Many men can't stand the erotic style and end up having sex. Check out this unconscious lewd girl [First shot] AV application online AV experience shooting 2566",https://pic.javct.net/poster/05192026/ddb095e083.jpg,https://javct.net/v/siro-5696,62,2026-06-03
200GANA-1025-RM,"Seriously soft, first shot 648 in Mejiro [Uncensored L**ked]",https://pic.javct.net/poster/05192026/14b8052d07.jpg,https://javct.net/v/200gana-1025-rm,56,2026-06-03
NNPJ-368-RM,"Surprised If You Pick Up And Take Off In Shibuya! ! Since It Was A 38 Kg Light-skinned Slim Girl, If You Call A Big Brother And Stick It Straight, You Will Bend The Flesh Of The Body. [Ikuikuku! ! 』Emergency AV Release Record Of Successful Fall Of 2019 Picked Up In SEX With Fat! ! Nampa JAPAN EXPRESS Vol.122 [Uncensored L**ked]",https://pic.javct.net/poster/05192026/8b8c31d7c6.jpg,https://javct.net/v/nnpj-368-rm,120,2026-06-03
FC2PPV-4912528,"SEX with 20 people** Plump mature woman Reika's first 4P, sweaty carnal dance with huge breasts and big butt",https://pic.javct.net/poster/05192026/2daecbf8e7.jpg,https://javct.net/v/fc2ppv-4912528,72,2026-06-03
FC2PPV-4912459,Fluffy H cup breast attack & creampie [Part 2],https://pic.javct.net/poster/05192026/9ab81135f7.jpg,https://javct.net/v/fc2ppv-4912459,33,2026-06-03
STARS-651-RM,Convenient Luxury Lingerie Model Compliant M Onaho Seno Minami Who Can Not Refuse The Client's Request [Uncensored L**ked],https://pic.javct.net/poster/20220406/1656998410.jpg,https://javct.net/v/stars-651-rm,140,2026-06-03
SCOP-546-SUB,Is This A Symbol Of Capitalism! What?There Is A Rumor That There Is A Special Pinna Saw In The VIP That Exists In Some Places In Tokyo!Pay Heavy Money And The SCOOP Team Gets Big Infiltration! !This Is Not The Usual Pin Sounding! What?Thorough Verification SP Whether It Is Genuine Super Luxury Pincer SP! [English Subtitle],https://pic.javct.net/poster/06032026/1774696877.jpg,https://javct.net/v/scop-546-sub,160,2026-06-03
DRPT-113-RM,"5. Riho Shishido, A Busty Beauty Who, While Hanging From A Strap On A Crowded Train, Had Both Of Her Nipples Stimulated Simultaneously, Resulting In Her Unfortunate Arousal. [Uncensored L**ked]",https://pic.javct.net/poster/05192026/164c44f9b6.jpg,https://javct.net/v/drpt-113-rm,140,2026-06-03
DRPT-113,"5. Riho Shishido, A Busty Beauty Who, While Hanging From A Strap On A Crowded Train, Had Both Of Her Nipples Stimulated Simultaneously, Resulting In Her Unfortunate Arousal.",https://pic.javct.net/poster/05192026/164c44f9b6.jpg,https://javct.net/v/drpt-113,140,2026-06-03
LUKE-024-RM,Natsuki Kisaragi [Uncensored L**ked],https://pic.javct.net/poster/20230207/1688791359.jpg,https://javct.net/v/luke-024-rm,130,2026-06-03
MFCW-073-RM,Koharu [Uncensored L**ked],https://pic.javct.net/poster/05192026/412443ccf7.jpg,https://javct.net/v/mfcw-073-rm,80,2026-06-03
MFCW-073,Koharu,https://pic.javct.net/poster/05192026/412443ccf7.jpg,https://javct.net/v/mfcw-073,80,2026-06-03
BBAN-455-RM,I Will Make Mitsuki Nagisa's Lesbian Desires Come True Before She Retires A Woman Who Wants To Have Sex With Mitsuki Nagisa X A Woman Who Wants To Have Sex With Mitsuki Nagisa Mitsuki Nagisa Hikaru Minazuki Kotone Fuyuai Ran Himeno NATSUKA [Uncensored L**ked],https://pic.javct.net/poster/20231711/1702010886.jpg,https://javct.net/v/bban-455-rm,170,2026-06-03
MFCW-072-RM,Himeka [Uncensored L**ked],https://pic.javct.net/poster/05192026/79abb7c27d.jpg,https://javct.net/v/mfcw-072-rm,74,2026-06-03
RDT-157-RM,I Was Looking At The Body Under The Sticky Wet Shirt With Her Bra Showing Through... [Uncensored L**ked],https://pic.javct.net/poster/05192026/7ddf2a0422.jpg,https://javct.net/v/rdt-157-rm,113,2026-06-03
MESU-142-RM,"Three-star Mature Woman Soapland: A Lucky Moment Spent With A Soap Girl On Her First Day Of Work, With Unlimited Ejaculation - Konatsu Aoba [Uncensored L**ked]",https://pic.javct.net/poster/05192026/5bae16201c.jpg,https://javct.net/v/mesu-142-rm,105,2026-06-03
MESU-142,"Three-star Mature Woman Soapland: A Lucky Moment Spent With A Soap Girl On Her First Day Of Work, With Unlimited Ejaculation - Konatsu Aoba",https://pic.javct.net/poster/05192026/5bae16201c.jpg,https://javct.net/v/mesu-142,105,2026-06-03
MFCW-072,Himeka,https://pic.javct.net/poster/05192026/79abb7c27d.jpg,https://javct.net/v/mfcw-072,74,2026-06-03
SIMA-037-RM,mountain stream [Uncensored L**ked],https://pic.javct.net/poster/04112026/186603ad3e.jpg,https://javct.net/v/sima-037-rm,75,2026-06-03
FC2PPV-4903757,"Face Showing Case #133 An amateur comes to do naughty things - An-chan (20) in red lingerie, sexy route, both legs exposed and vibrator to**ure",https://pic.javct.net/poster/05192026/2f434bcb66.jpg,https://javct.net/v/fc2ppv-4903757,56,2026-06-03
NHDTA-383-RM,"Drawing Model Wife Which Was Fed Aphrodisiac Juice Drips Stand ""asking For Sex"" Just Seen A Naked Woman [Uncensored L**ked]",https://pic.javct.net/poster/05192026/d65926d975.jpg,https://javct.net/v/nhdta-383-rm,200,2026-06-03
XRW-653-RM,"To Tell The Truth, I Like The Smell Of Smell. Sakuragi Yuuki Sound [Uncensored L**ked]",https://pic.javct.net/poster/05192026/c9638a7b8f.jpg,https://javct.net/v/xrw-653-rm,148,2026-06-03
SIMA-037,mountain stream,https://pic.javct.net/poster/04112026/186603ad3e.jpg,https://javct.net/v/sima-037,75,2026-06-03
SEND-47-RM,Another B ★ Jean Amount Of Star [Uncensored L**ked],https://pic.javct.net/poster/04112026/32ead47d2a.jpg,https://javct.net/v/send-47-rm,135,2026-06-03
VENX-370-RM,"""Are you excited by your aunt's underwear?"" Aunt Reimi Saegusaki squeezes out every drop of her nephew's sperm with freshly taken off panties [Uncensored L**ked]",https://pic.javct.net/poster/04112026/fbb3881706.jpg,https://javct.net/v/venx-370-rm,99,2026-06-03
VENX-370,"""Are you excited by your aunt's underwear?"" Aunt Reimi Saegusaki squeezes out every drop of her nephew's sperm with freshly taken off panties",https://pic.javct.net/poster/04112026/fbb3881706.jpg,https://javct.net/v/venx-370,99,2026-06-03
STAR-999-RM,SODstar Mahiro Yui 18 Years Old Sexual Orientation × Full Course 10 Corner 240 Minutes SP [Uncensored L**ked],https://pic.javct.net/poster/05192026/e2b3c39dd1.jpg,https://javct.net/v/star-999-rm,240,2026-06-03
WNSK-007-RM,Miri Goddess [Cosplay J Series] Immediate Saddle SEX Survival! ! 02 [Uncensored L**ked],https://pic.javct.net/poster/20230207/1689997141.jpg,https://javct.net/v/wnsk-007-rm,194,2026-06-03
ONEZ-118-RM,# I'm Not An Anime Otaku My Girlfriend's Girlfriend Is Good Menhera Obedient Pet Vol.002 Nanami Yu [Uncensored L**ked],https://pic.javct.net/poster/05192026/ed0dfc360c.jpg,https://javct.net/v/onez-118-rm,120,2026-06-03
TPNS-006-RM,A Super Talented Beautiful Man's Daughter Layer Is Always Full Erection Big Penis Slender And Loves Lewd The Best M [Uncensored L**ked],https://pic.javct.net/poster/20230804/1692417528.jpg,https://javct.net/v/tpns-006-rm,129,2026-06-03
DSAM-002-RM,"Amateur AV 143cm ● Cute Face, Small Pussy, Squirting And Wetting Herself, Orgy Photo Shoot! [Uncensored L**ked]",https://pic.javct.net/poster/05192026/7d7a6cec01.jpg,https://javct.net/v/dsam-002-rm,150,2026-06-03
TPNS-005-RM,5P Large Orgies [Minimum Short Stature But Extra Thick Penikuri Crossdressing Layer] On The Net It Is A High-handed Remark But In Real Life... [Super Sensitive Mesuiki Crazy Intrinsic De M] All Semen Ketsuma Co-launched Super Hard Asshole SEX Training Document Chibitori [Uncensored L**ked],https://pic.javct.net/poster/20230207/1689393485.jpg,https://javct.net/v/tpns-005-rm,112,2026-06-03
MMUS-110-RM,"Little Devilish, Provocative Beauty Shiori Imoto [Uncensored L**ked]",https://pic.javct.net/poster/05192026/453d946ab5.jpg,https://javct.net/v/mmus-110-rm,140,2026-06-03
FOCS-060-RM,Anal Licking! Temptress Maid With A Beautiful Huge Ass Uses Her Asshole To Induce Temptation. Get To Have A Creampie Load After Giving Anal Cunnilingus. Meisa Kawakita [Uncensored L**ked],https://pic.javct.net/poster/20221202/1650012605.jpg,https://javct.net/v/focs-060-rm,124,2026-06-03
AVSA-265-RM,SUPER FISHEYE FETISHISM Powerful Excitement Nectar Erotic Cosplay Sensual BODY Iori Tsukimi [Uncensored L**ked],https://pic.javct.net/poster/20230908/1694233101.jpg,https://javct.net/v/avsa-265-rm,120,2026-06-03
NNNC-024-RM,A National Idol Class Beautiful Girl And A Uniform Icharab 3 Sex Ai Kawana [Uncensored L**ked],https://pic.javct.net/poster/20230207/1689131705.jpg,https://javct.net/v/nnnc-024-rm,95,2026-06-03
LULU-439-RM,"I Slipped An Aphrodisiac Into A Beautiful, Big-butt Cosplayer Who Was Doing Casual Sex For Business, And Turned Her Into A Cum-filled Sex Slave, Squirting And Making Ecstatic Faces During A Photoshoot Where She Was Doing Sensual, Flexible Poses. [Uncensored L**ked]",https://pic.javct.net/poster/05192026/2d6bbf5b47.jpg,https://javct.net/v/lulu-439-rm,160,2026-06-03
ONEZ-119-RM,# Pretty Girl Whose Uniform Is Too Suited Is My Canojo Vol.006 Amami Kokoro [Uncensored L**ked],https://pic.javct.net/poster/20240807/1720885432.jpg,https://javct.net/v/onez-119-rm,120,2026-06-03
GKD-002-RM,Gakkugaku Of Woman Hasegawa Riho [Uncensored L**ked],https://pic.javct.net/poster/05192026/f1c693c301.jpg,https://javct.net/v/gkd-002-rm,120,2026-06-03
SGKI-004-RM,"It's Crazy! Mezamashi News: ""Never Change Your Expression During ON AIR'' Competitive Station Announcer, Third Year Professionalism [Uncensored L**ked]",https://pic.javct.net/poster/20252204/1747565585.jpg,https://javct.net/v/sgki-004-rm,115,2026-06-03
FC2PPV-4909453,God Style Ho ■Aqua-chan Minato in uniform at the live show is thin but an E-cup model and has a beautiful body.,https://pic.javct.net/poster/05192026/bb59692a5e.jpg,https://javct.net/v/fc2ppv-4909453,98,2026-06-03
EBOD-452-RM,Ultra Breast Jcup Cosplayers Mii-chan Of Rumor [Uncensored L**ked],https://pic.javct.net/poster/06032026/1775274233.jpg,https://javct.net/v/ebod-452-rm,120,2026-06-03
DSAM-002,"Amateur AV 143cm ● Cute Face, Small Pussy, Squirting And Wetting Herself, Orgy Photo Shoot!",https://pic.javct.net/poster/05192026/7d7a6cec01.jpg,https://javct.net/v/dsam-002,150,2026-06-03
MMUS-110,"Little Devilish, Provocative Beauty Shiori Imoto",https://pic.javct.net/poster/05192026/453d946ab5.jpg,https://javct.net/v/mmus-110,140,2026-06-03
BOBB-383-RM,"Milk Fetish Erotic Cosplay That Maximizes The Charm Of J Cup Beautiful Breasts 7 Boin ""Natsuno Kohaku"" Box2 [Uncensored L**ked]",https://pic.javct.net/poster/20230207/1689305599.jpg,https://javct.net/v/bobb-383-rm,120,2026-06-03
XMOM-59-RM,Sukeban Chisato 54 Years Old Chisato Shoda [Uncensored L**ked],https://pic.javct.net/poster/20230207/1689218031.jpg,https://javct.net/v/xmom-59-rm,110,2026-06-03
MIST-437-RM,"Moeka Marui, A Dispatched Maid Who Can Make Babies On Dangerous Days [Uncensored L**ked]",https://pic.javct.net/poster/20241804/1715275741.jpg,https://javct.net/v/mist-437-rm,146,2026-06-03
RTP-105-RM,"Halloween Party With 4 Beautiful Sisters Whose Father Got Married And Suddenly Became A Family! To Cute Cosplay Figure And To Play King Like Girls With Tension Butchuage! ! ""The Things The King Says Absolutely!""I Have Been Tempted By The King's Instructions To Show Me My Breasts And Kisses ... Trick Or Treat! What? [Uncensored L**ked]",https://pic.javct.net/poster/05192026/a14bac682f.jpg,https://javct.net/v/rtp-105-rm,135,2026-06-03
PGD-614-RM,"Fo**ed fucked Pissing - desire of ASUKA, Squirting, - gangbang [Uncensored L**ked]",https://pic.javct.net/poster/06032026/1775620869.jpg,https://javct.net/v/pgd-614-rm,170,2026-06-03
MIGD-625,Anal FUCK Cum Bukkake! Kimura Tuna,https://pic.javct.net/poster/05192026/c032bc4f87.jpg,https://javct.net/v/migd-625,120,2026-06-03
DSAM-001-RM,"A Wild Orgy With Two Super Cute, Close Female College Students, Culminating In Unprotected Sex. ~A Cum-filled Orgy To Get Pregnant~ [An Epic Episode!!] [Uncensored L**ked]",https://pic.javct.net/poster/05192026/33ec033842.jpg,https://javct.net/v/dsam-001-rm,140,2026-06-03
GOJU-316,"Fresh Semen Sticking To Her Face!! An Amateur Woman In Her Late 40s Gets A Sudden, Unannounced Facial Cumshot During Her First Masturbation Viewing! 15",https://pic.javct.net/poster/05192026/c4010ec133.jpg,https://javct.net/v/goju-316,167,2026-06-03
DOKS-676,Fully Clothed Cumshot - Semen Never Returns To The Scrotum -,https://pic.javct.net/poster/05192026/c297f6f0bd.jpg,https://javct.net/v/doks-676,100,2026-06-03
TGYM-002-RM,Unscrupulous Personal Trainer Obscene Muscle Training Road To Chibikko Macho Nanami Yokomiya [Uncensored L**ked],https://pic.javct.net/poster/20230207/1690434578.jpg,https://javct.net/v/tgym-002-rm,119,2026-06-03
STAR-997-RM,Kiritani Festival 25 Tin Po And Non Stop Bukkake Cum Inside Caused Large Great Orgy [Uncensored L**ked],https://pic.javct.net/poster/20241804/1716439490.jpg,https://javct.net/v/star-997-rm,125,2026-06-03
KTB-116-RM,"""I Only Felt Pleasure From Being Molested..."" The Side Story Of Ms. XX From Class Who Gets R**ed 7 Days Later ~A Week-long Record Of Molestation For [Female Student H] Who Was Caught Feeling Pleasure From Being Molested By A Classmate And Fell Into The Pleasure Of Molestation~ Hinako Matsui [Uncensored L**ked]",https://pic.javct.net/poster/05192026/e23f622c86.jpg,https://javct.net/v/ktb-116-rm,148,2026-06-03
BAB-192-RM,Ghostly Thump-Thump Schoolgirl Season 09: Ruka Itoi [Uncensored L**ked],https://pic.javct.net/poster/05192026/5a5af674fe.jpg,https://javct.net/v/bab-192-rm,129,2026-06-03
