code,title,image_url,page_url,views,date_scraped
XRW-732-RM,"Making My Tall, Proud And Aspirational Female Boss Give Deep Throat!! Honoka Takigawa [Uncensored L**ked]",https://pic.javct.net/poster/20221904/1652841107.jpg,https://javct.net/v/xrw-732-rm,181,2026-07-08
HMGL-191-RM,"Shy Bodies. Model, Entertainer, And Porn Actress. Kanna Asumi [Uncensored L**ked]",https://pic.javct.net/poster/20221202/1648315781.jpg,https://javct.net/v/hmgl-191-rm,117,2026-07-08
NKKD-213-RM,Taking A Married Woman Into The Public Bathrooms While She's On A Drive With Her Family And Fucking Her! 7 Toilet Sex [Uncensored L**ked],https://static.javct.net/poster/nkkd-213.jpg,https://javct.net/v/nkkd-213-rm,184,2026-07-08
HZGD-127-RM,Married Woman Violated And Creampied Over And Over By Despicable Neighbor Mika Kurosaki [Uncensored L**ked],https://pic.javct.net/poster/20221202/1647307630.jpg,https://javct.net/v/hzgd-127-rm,112,2026-07-08
HODV-21612-RM,Female Fuck Buddy That Is Just Perfect. 8.5 Head To Toe With Luscious G-cup Tits On This Gal. Sarina Momonaga [Uncensored L**ked],https://pic.javct.net/poster/20212709/1633176332.jpg,https://javct.net/v/hodv-21612-rm,149,2026-07-08
HODV-21612-SUB,Female Fuck Buddy That Is Just Perfect. 8.5 Head To Toe With Luscious G-cup Tits On This Gal. Sarina Momonaga [English Subtitle],https://pic.javct.net/poster/20212709/1633176332.jpg,https://javct.net/v/hodv-21612-sub,149,2026-07-08
HODV-21590-RM,[Full POV] Girls Speaking In Dialect: The Hiroshima Dialect - Ai Tsubakino [Uncensored L**ked],https://static.javct.net/poster/hodv-21590.jpg,https://javct.net/v/hodv-21590-rm,133,2026-07-08
JUX-930-RM,When My Wife Sparkles With Lust... Nene [Uncensored L**ked],https://pic.javct.net/poster/20222109/1665934712.jpg,https://javct.net/v/jux-930-rm,119,2026-07-08
VIPR-076-RM,Erica Sato Invades A Shady AV Shoot!! Erika Sato [Uncensored L**ked],https://pic.javct.net/poster/04112026/e3714f871a.jpg,https://javct.net/v/vipr-076-rm,60,2026-07-08
VIPR-078-RM,Dripping Wet Daydream Theater. Erika Sato . [Uncensored L**ked],https://pic.javct.net/poster/04112026/0f1129f2c2.jpg,https://javct.net/v/vipr-078-rm,59,2026-07-08
FOCS-048-RM,"38"" G-Cup Colossal Tits X 5'8"" Tall Crazy Girl With A Miraculously Slender Body - The Greatest Hard Rock Creampie Of Your Life Mira Sena [Uncensored L**ked]",https://pic.javct.net/poster/20212011/1644570879.jpg,https://javct.net/v/focs-048-rm,118,2026-07-08
VIPR-066-RM,BODY TO BODY Erika Sato [Uncensored L**ked],https://pic.javct.net/poster/04112026/81b6116248.jpg,https://javct.net/v/vipr-066-rm,58,2026-07-08
EKW-080-RM,"Today, I Want Her To Jack Me Off. An Mitsumi [Uncensored L**ked]",https://pic.javct.net/poster/20221904/1653628260.jpg,https://javct.net/v/ekw-080-rm,120,2026-07-08
JUY-865-RM,Madonna Exclusive Hot Mature Woman!! Married Woman's Lust Fuck Dripping With Immorality!! Husband Doesn't Know -My Dirty Lust And Secret- Maki Hojo [Uncensored L**ked],https://pic.javct.net/poster/20221904/1651553483.jpg,https://javct.net/v/juy-865-rm,119,2026-07-08
MIST-369-RM,With Kanami Miura At Night... Having Sex Like Crazy With A Beautiful Girl At Night. Kanami Miura [Uncensored L**ked],https://pic.javct.net/poster/20221202/1649322626.jpg,https://javct.net/v/mist-369-rm,150,2026-07-08
WKD-049-RM,Fallen Woman - Himari Kinoshita [Uncensored L**ked],https://pic.javct.net/poster/20212011/1641054004.jpg,https://javct.net/v/wkd-049-rm,52,2026-07-08
JUL-685-RM,31-day Abstinence Life: 3rd Document Showing The Explosive Desire Of A Married Woman Who Just Likes Dick Too Much!! Saori Nagashima [Uncensored L**ked],https://static.javct.net/poster/jul-685.jpg,https://javct.net/v/jul-685-rm,137,2026-07-08
SSIS-261-US,"Breast, Buttocks, Vagina, 171cm, Tasting The Best Style All Over Marin Hinata 's New World Of Acme [English Subtitle, Reducing Mosaic]",https://pic.javct.net/poster/20212011/1639118863.jpg,https://javct.net/v/ssis-261-us,145,2026-07-08
JUY-602-RM,"She Is Unfaithful With Her Clothes Still On, Full Tight Clothing Fuck. Reiko Sawamura [Uncensored L**ked]",https://pic.javct.net/poster/20220707/1660149537.jpg,https://javct.net/v/juy-602-rm,151,2026-07-08
KATU-090-RM,"Sexy Thick Thigh Job Makes You Want To Fuck 2, 5 Thick Dirty Miniskirt Sluts! [Uncensored L**ked]",https://pic.javct.net/poster/20212709/1634971908.jpg,https://javct.net/v/katu-090-rm,181,2026-07-08
FOCS-020-RM,Undiscovered Talent In Hakata! The 171cm Luxuriously Slender And Pure Beautiful Girl. A Lewd Sexual Extravaganza That Goes For 1 Night And 2 Days Without Sleep. Haru Yamaguchi [Uncensored L**ked],https://pic.javct.net/poster/20212308/1631874901.jpg,https://javct.net/v/focs-020-rm,123,2026-07-08
HBAD-619-RM,This Tall Erotic Wicked Woman Is Planning To Seduce A Rich Old Man And Knock Him Off And Clean Him Out Of All His Money But She Ends Up Getting Fucked Instead And Becoming His Sexy Slut. Mirai Sena. [Uncensored L**ked],https://pic.javct.net/poster/20221904/1650519375.jpg,https://javct.net/v/hbad-619-rm,110,2026-07-08
JUY-252-RM,My Big Sister-In-Law's Tight Peachy Ass Was Just Too Sexy... Maya Takeuchi [Uncensored L**ked],https://pic.javct.net/poster/20220406/1655379980.jpg,https://javct.net/v/juy-252-rm,118,2026-07-08
LULU-095-RM,"My Big Stepsister Was Working As A Model, And She Had Such A Beautiful Ass, I Could No Longer Resist, So I Gave Her A Furious Piston-Pounding Quickie, And Continued To Pour Creampie Cum Shots Into Her Ass. Himari Kinoshita [Uncensored L**ked]",https://pic.javct.net/poster/20212709/1633504868.jpg,https://javct.net/v/lulu-095-rm,148,2026-07-08
HZ-3887,Beauty Collection Vol.128 - Kaede Takagaki,https://pic.javct.net/poster/07052026/7f08eb26bb.jpg,https://javct.net/v/hz-3887,60,2026-07-08
HZ-3886,Devouring The Body Of Big Titted MILF! - Miyuki Sugawara,https://pic.javct.net/poster/07052026/b3aab2b6b5.jpg,https://javct.net/v/hz-3886,61,2026-07-08
HZ-3883,Beauty Collection Vol.127 - Rinka Tachibana,https://pic.javct.net/poster/05192026/aed4501f3e.jpg,https://javct.net/v/hz-3883,61,2026-07-08
HZ-3882,Asi-Hame!! Vol.28 - Xiaoxi,https://pic.javct.net/poster/05192026/d87cd38380.jpg,https://javct.net/v/hz-3882,68,2026-07-08
HZ-3881,Widow's Sexual Desire Vol.10 - Ema Kato,https://pic.javct.net/poster/05192026/89de8699b5.jpg,https://javct.net/v/hz-3881,61,2026-07-08
HZ-3879,Beauty Collection Vol.126 - Yuna Mori,https://pic.javct.net/poster/05192026/f24508b0b0.jpg,https://javct.net/v/hz-3879,61,2026-07-08
HZ-3873,Having Lovely Time With A Big Tits Amature Gril Vol.17 - Miku Kamiya,https://pic.javct.net/poster/05192026/43fad11cee.jpg,https://javct.net/v/hz-3873,54,2026-07-08
HZ-3872,"Sex Heaven -Savoring a Slender, Mature Beauty- - Aika Hoshino",https://pic.javct.net/poster/05192026/2ecf98cf86.jpg,https://javct.net/v/hz-3872,61,2026-07-08
HZ-3871,Seductive Women Sk**led at Sucking - Yui Shinjo - Miyu Morita,https://pic.javct.net/poster/05192026/2c28635f31.jpg,https://javct.net/v/hz-3871,52,2026-07-08
HZ-3870,Beauty Collection Vol.125 - Yu Okubo,https://pic.javct.net/poster/05192026/74e4872154.jpg,https://javct.net/v/hz-3870,60,2026-07-08
HZ-3869,Single Mother Gets A Cream Pie! - Sakie Hayasaka,https://pic.javct.net/poster/05192026/ed11c5c584.jpg,https://javct.net/v/hz-3869,62,2026-07-08
HZ-3868,Naughty Wife's Immoral Secret Over Her Husband Vol.22 - Mio Togashi,https://pic.javct.net/poster/05192026/5975e32378.jpg,https://javct.net/v/hz-3868,59,2026-07-08
BRV-133-RM,Raw creampie love ◆ A thick vaginal ejaculation special for a perverted 50-year-old lady who smiles and is very satisfied! Large-capacity pack containing 10 people [Uncensored L**ked],https://pic.javct.net/poster/05192026/273f6a92ad.jpg,https://javct.net/v/brv-133-rm,118,2026-07-08
ROYD-088-RM,"Caught Between Two Big-Breasted Older Girls Who Love Taking Care Of Me, I Popped A Boner And Lost My Virginity. Miu Arioka Yuri Oshikawa [Uncensored L**ked]",https://pic.javct.net/poster/20221904/1650619055.jpg,https://javct.net/v/royd-088-rm,221,2026-07-08
HZ-3866,Beauty Collection Vol.124 - Mami Sakai,https://pic.javct.net/poster/05192026/c597bd4285.jpg,https://javct.net/v/hz-3866,61,2026-07-08
HZ-3865,Having Lovely Time With A Big Tits Amature Gril Vol.16 - Mai Kagura,https://pic.javct.net/poster/05192026/fe3c484e26.jpg,https://javct.net/v/hz-3865,59,2026-07-08
HZ-3862,Beauty Collection Vol.123 - Nozomi Hamada,https://pic.javct.net/poster/05192026/95ba95d267.jpg,https://javct.net/v/hz-3862,61,2026-07-08
HZ-3861,Asi-Hame!! Vol.27 - Chen,https://pic.javct.net/poster/05192026/1dcc75eb0e.jpg,https://javct.net/v/hz-3861,61,2026-07-08
HZ-3860,Naughty Bitches Having Sex At The Entrance Vol.2 - Satomi - Kurumi Kokoro,https://pic.javct.net/poster/05192026/37ce0c8972.jpg,https://javct.net/v/hz-3860,60,2026-07-08
FC2PPV-4907806,"Sumire (18) Anyway, this is a first-person angle video of the second shooting of cute Sumire-chan, creampie, anal penetration ATM, and cosplay creampie.",https://pic.javct.net/poster/05192026/9e7d438c0d.jpg,https://javct.net/v/fc2ppv-4907806,58,2026-07-08
HZ-3858,Beauty Collection Vol.122 - Hitomi Tanmura,https://pic.javct.net/poster/05192026/ef10044e0b.jpg,https://javct.net/v/hz-3858,61,2026-07-08
ROYD-065-RM,"The School Idol That Moved Next Door Saw My Boner, And Though She Was Embarassed, She Turned Out To Be A Massive Slut. Mone Kouno [Uncensored L**ked]",https://static.javct.net/poster/royd-065.jpg,https://javct.net/v/royd-065-rm,140,2026-07-08
HZ-3853,Having Sex With A Quiet-Looking Amateur Girl - Miharu Azumi,https://pic.javct.net/poster/05192026/7b2e230564.jpg,https://javct.net/v/hz-3853,51,2026-07-08
HZ-3852,Slender MILF Gets Fucked in a Threesome! - Momoko Akasaka,https://pic.javct.net/poster/05192026/1fcc87afe8.jpg,https://javct.net/v/hz-3852,59,2026-07-08
PKPD-138-RM,I Picked Up A Girl With F-Cup Tits Who I Found In The Office District And Fucked Her Raw Minami Haruhana [Uncensored L**ked],https://static.javct.net/poster/pkpd-138.jpg,https://javct.net/v/pkpd-138-rm,139,2026-07-08
VRTM-327-RM,"When I Called A Housekeeper Over To My Bachelor Pad She Turned Out To Be Totally Stacked! Her Big Tits Gave Me Wood, And She Felt So Bad For Me She Gave Me A Handjob! Only My Huge Dick Turned Her On So Much She Couldn't Stop There - She Had To Ride It Cowgirl Style! Grinding Away And Begging For My Creampie! 2 [Uncensored L**ked]",https://pic.javct.net/poster/20221108/1663504006.jpg,https://javct.net/v/vrtm-327-rm,220,2026-07-08
GVG-404-RM,The Sexy PTA Chairwoman And The Student Council Brats [Uncensored L**ked],https://pic.javct.net/poster/20220406/1656676520.jpg,https://javct.net/v/gvg-404-rm,133,2026-07-08
VOSS-009-RM,"I Was Being Bullied For Having A Big Dick, So I Stopped Going To School, And When My Female Teacher Came To Visit Because She Was Worried About Me, She Took One Look At My Huge Cock And Got Hot And Horny 2 Hisae Yabe [Uncensored L**ked]",https://pic.javct.net/poster/20212011/1643856572.jpg,https://javct.net/v/voss-009-rm,99,2026-07-08
JUY-949-RM,A G-Cup Titty Married Woman Is Continuously Getting Fucked Raw Endless Ejaculations!! Ultra High-Class Creampie Baths Chikako Maru [Uncensored L**ked],https://pic.javct.net/poster/20221202/1649812871.jpg,https://javct.net/v/juy-949-rm,115,2026-07-08
GVG-373-RM,The Sexy PTA Chairwoman And The Naughty Student Council Yuna Takase [Uncensored L**ked],https://pic.javct.net/poster/20221904/1652315847.jpg,https://javct.net/v/gvg-373-rm,136,2026-07-08
MAZO-016-RM,"Department Store Receptionist, 27 Years Old, Tied Up With Chains, Womanizer Uterus Convulsions, Pure M, Gokubi Dcup, God's Constriction, Creampie During Lunch Break [Uncensored L**ked]",https://pic.javct.net/poster/05192026/506c6c50e1.jpg,https://javct.net/v/mazo-016-rm,75,2026-07-08
JUY-194-RM,The Coincidental Secret Room A Married Woman Female Doctor And Her Patient Nozomi Tanihara [Uncensored L**ked],https://pic.javct.net/poster/20212011/1640801270.jpg,https://javct.net/v/juy-194-rm,118,2026-07-08
SDDE-411-RM,"No Matter How Many Times They Fuck She's Still Horny. Countless Rounds Of Orgasmic Sex. One Night, Two Day Hotel Stay Of Ecstasy - 12 Loads In All! [Uncensored L**ked]",https://pic.javct.net/poster/20220406/1654569935.jpg,https://javct.net/v/sdde-411-rm,151,2026-07-08
MAZO-008-RM,Manners Instructor 26 Years Old Dildo Electric Demon Leverage Cheating SEX Continues Even During Engagement Perverted Woman Who Becomes A Semen Toilet Uterus Trampling Exciting Climax [Uncensored L**ked],https://pic.javct.net/poster/05192026/6e988e4fda.jpg,https://javct.net/v/mazo-008-rm,78,2026-07-08
GVG-801-RM,A Sexy Weather Girl Elder Sister And Her Bad Boys Mari Takasugi [Uncensored L**ked],https://pic.javct.net/poster/20212011/1643623764.jpg,https://javct.net/v/gvg-801-rm,136,2026-07-08
JUL-489-SUB,"A Madonna Label Exclusive Kana Mito She's Lifting Her Lesbian Ban!! While On A Business Trip, To Her Surprise, She Was Booked Into The Same Room At The Business Hotel With Her Cute Colleague, Whom She Discovered, To Her Further Surprise, That She Was A Lesbian. [English Subtitle]",https://pic.javct.net/poster/20212709/1636394681.jpg,https://javct.net/v/jul-489-sub,166,2026-07-08
ROYD-067-RM,"My C**ldhood Friend Is A Beautiful Older Woman With F-Cup Titties, And Now That I've Paid My Subscription Fees, I Can Insert My Dick Whenever I Want, As Much As I Want! As Long As I Pay The Monthly Fees, I Can Fuck Her Anytime, Anywhere, As Much As I Like! Mikako Horiuchi [Uncensored L**ked]",https://pic.javct.net/poster/20212308/1632470195.jpg,https://javct.net/v/royd-067-rm,157,2026-07-08
JUY-053-RM,My Lady Boss Is Cumming At Me Hard For Sex At The Office Eriko Miura [Uncensored L**ked],https://pic.javct.net/poster/20221904/1651464392.jpg,https://javct.net/v/juy-053-rm,119,2026-07-08
T28-381-RM,The Elderly Home Helper That Can't Say No To A Creampie [Uncensored L**ked],https://pic.javct.net/poster/20222109/1665547568.jpg,https://javct.net/v/t28-381-rm,124,2026-07-08
HUNTB-151-RM,"Door To Anywhere ""Aah, Pervert! Why Are You Here!? Get out!"" You Can Go Anywhere With This Door! And You Can Cum Anywhere With It Too! [Uncensored L**ked]",https://pic.javct.net/poster/20212709/1637308899.jpg,https://javct.net/v/huntb-151-rm,165,2026-07-08
MAZO-026-RM,A Public School Student 1 Years Old Trained To Train A First-Class Body As A Track And Field Club Super Sensitive Nipple Twist And Faints In Agony Irresponsible Seeding Sex Loving Masochist Lady [Uncensored L**ked],https://pic.javct.net/poster/04112026/3ca4374d65.jpg,https://javct.net/v/mazo-026-rm,72,2026-07-08
JUY-935-RM,"My Last Summer Break, Private Lessons With My Favorite Female Teacher In A Sweaty Classroom - Ayaka Makimura [Uncensored L**ked]",https://pic.javct.net/poster/20212011/1641085593.jpg,https://javct.net/v/juy-935-rm,120,2026-07-08
GVG-770-RM,A Sexy Weather Girl And Naughty Brats. Akari Mitani [Uncensored L**ked],https://pic.javct.net/poster/20212011/1643623940.jpg,https://javct.net/v/gvg-770-rm,137,2026-07-08
JUE-007-RM,"Showa. Female Medic Goes Out Looking For Her Lover On The Battlefield. A Sad And Ephemeral Wartime Story About Ongoing Struggles, Sex With Those In Power, Fucking A Father In Law. Ai Mukai. [Uncensored L**ked]",https://pic.javct.net/poster/20221202/1647760447.jpg,https://javct.net/v/jue-007-rm,120,2026-07-08
HDKA-246-RM,Nude Maid. Nude Maid Referral Office. Ena Satsuki [Uncensored L**ked],https://pic.javct.net/poster/20212011/1638335334.jpg,https://javct.net/v/hdka-246-rm,120,2026-07-08
JUL-489-RM,"A Madonna Label Exclusive Kana Mito She's Lifting Her Lesbian Ban!! While On A Business Trip, To Her Surprise, She Was Booked Into The Same Room At The Business Hotel With Her Cute Colleague, Whom She Discovered, To Her Further Surprise, That She Was A Lesbian. [Uncensored L**ked]",https://pic.javct.net/poster/20212709/1636394681.jpg,https://javct.net/v/jul-489-rm,166,2026-07-08
JUL-537-RM,On A Two Night Three Day Trip I Was Ordered To Stay In The Hotel And Ended Up Seducing The Hot Receptionist... Aoi Mukai [Uncensored L**ked],https://static.javct.net/poster/jul-537.jpg,https://javct.net/v/jul-537-rm,119,2026-07-08
JUY-917-RM,"I Got A New Job, And Now I'm The Fresh Face In The Office, And My Lady Boss Is Always Toying With Me During Work Hours Yuka Oshima [Uncensored L**ked]",https://pic.javct.net/poster/20221904/1652889883.jpg,https://javct.net/v/juy-917-rm,119,2026-07-08
STARS-076-RM,A Female College Student Who Fell For The Pleasure Of Yume Takeda Saunale [Uncensored L**ked],https://pic.javct.net/poster/20243105/1719749390.jpg,https://javct.net/v/stars-076-rm,120,2026-07-08
SDAB-177-RM,Beautiful Young 145cm Girl Gets Her Pussy And Throat Fucked Close Up And Hard By A Large Older Man Ran Sakita [Uncensored L**ked],https://static.javct.net/poster/sdab-177.jpg,https://javct.net/v/sdab-177-rm,123,2026-07-08
HOKS-219-RM,"Harmful Books: Confessions Of A Serious Office Lady... I'll Tell You About My Orgasmic Experiences, Aishin Lili [Uncensored L**ked]",https://pic.javct.net/poster/07052026/870aa1a956.jpg,https://javct.net/v/hoks-219-rm,84,2026-07-08
MOON-054-RM,A Late-night Convenience Store Worker Who Has An Affair With A Beautiful Part-timer In The Store Even When There Are No Customers For About 3 Minutes. [Uncensored L**ked],https://pic.javct.net/poster/07052026/952059082a.jpg,https://javct.net/v/moon-054-rm,140,2026-07-08
NDRA-046-RM,The Wife Who Became A Whore For My Neighbor 8 Her Nipple Was Prime For Fondling And Fucking Monami Takarada [Uncensored L**ked],https://pic.javct.net/poster/20221202/1646654725.jpg,https://javct.net/v/ndra-046-rm,132,2026-07-08
SSPD-151,I Love You All The Time. Married Woman Plundered Jessica Kizaki,https://pic.javct.net/poster/07052026/526875222f.jpg,https://javct.net/v/sspd-151,120,2026-07-08
APNS-265-RM,Bad Mortgaged Wife Riona Hirose [Uncensored L**ked],https://pic.javct.net/poster/20212709/1637387226.jpg,https://javct.net/v/apns-265-rm,120,2026-07-08
APNS-307-RM,Iba's Sex Processing Doll Wife Mai Hanagari [Uncensored L**ked],https://pic.javct.net/poster/20233001/1677294208.jpg,https://javct.net/v/apns-307-rm,114,2026-07-08
ALDN-129-RM,Naked Stepmom Mizuki Narasaki [Uncensored L**ked],https://pic.javct.net/poster/20233001/1677294452.jpg,https://javct.net/v/aldn-129-rm,110,2026-07-08
ALDN-130-RM,You Excited Aunt Like Me... What Are You Doing... Yuriko Takazono [Uncensored L**ked],https://pic.javct.net/poster/20233001/1677294390.jpg,https://javct.net/v/aldn-130-rm,105,2026-07-08
JHEM-006-RM,Dirty Abnormal Pleasure Bride Gets S&M Breaking In Extreme Rope Play 5 People Recorded 120 Minutes [Uncensored L**ked],https://pic.javct.net/poster/20230302/1677900721.jpg,https://javct.net/v/jhem-006-rm,120,2026-07-08
SHKD-923,"When A Married Woman (Who Was Trying To Get Pregnant) Gets R**ed And Impregnated By Her Husbands Boss, I Wonder What She Was Thinking As She Was Held In His Arms. Ai Mukai",https://pic.javct.net/poster/07052026/1a013c069a.jpg,https://javct.net/v/shkd-923,90,2026-07-08
MADM-122,The Next J Cup Busty Wife Misaki Rio Who Unconsciously Seduces With No Bra Sheer Breasts,https://pic.javct.net/poster/07052026/39af23604f.jpg,https://javct.net/v/madm-122,130,2026-07-08
XVSR-520,Ayaka Tomoda Max A Complete Works Complete BEST 4 Hours,https://pic.javct.net/poster/07052026/0a1e7ffc8c.jpg,https://javct.net/v/xvsr-520,240,2026-07-08
KSBJ-429-RM,"Tsubaki Kato, a mother-in-law who receives a night sex with her son-in-law and a friend on the 7th day of her husband's first birthday, falls into a female state in front of his deceased husband's photograph. [Uncensored L**ked]",https://pic.javct.net/poster/04112026/d15d43ba06.jpg,https://javct.net/v/ksbj-429-rm,107,2026-07-08
START-594,"""The Most Amazing Kiss That Will Make Any Man Fall Head Over Heels"" Six Scenarios Featuring A Thoughtful And Charming Woman In Various Professions.",https://pic.javct.net/poster/07052026/3860cdb628.jpg,https://javct.net/v/start-594,195,2026-07-08
GVH-372-RM,Naughty Nurses Riona Hirose [Uncensored L**ked],https://pic.javct.net/poster/20221202/1647061866.jpg,https://javct.net/v/gvh-372-rm,121,2026-07-08
SORA-461-RM,"""I Like Live Vibes...You Know?""Otaku Honor Student Virgin Chi For J-kei ◎Po Reserved Masturbation My Pure-minded Tintin Has Been Turned Into A Meat Vibrator...Ena Koume [Uncensored L**ked]",https://pic.javct.net/poster/20230205/1683950328.jpg,https://javct.net/v/sora-461-rm,150,2026-07-08
HOKS-225-RM,Eros Under Uniform Goodbye Teacher Meguri Minoshima [Uncensored L**ked],https://pic.javct.net/poster/04112026/a9f4067106.jpg,https://javct.net/v/hoks-225-rm,108,2026-07-08
BF-621,"When SEX With My Boyfriend Did Not Go Well, I Was Consulted By A Student And Decided To Practice SEX After School. Mahiro Ichiki",https://pic.javct.net/poster/07052026/7222d7986e.jpg,https://javct.net/v/bf-621,180,2026-07-08
JMTY-079,"[Youth X Transgender X Drama] Back When We Lost Our Virginity, We Were So Engrossed In Putting Our Holes Into Each Other. ""Our First Kiss, Our First Cumshot, Our First Anal Sex, And Then Reverse Anal, It's All A Great Memory."" Kondo Mumu",https://pic.javct.net/poster/07052026/872c2873cc.jpg,https://javct.net/v/jmty-079,120,2026-07-08
MOON-054,A Late-night Convenience Store Worker Who Has An Affair With A Beautiful Part-timer In The Store Even When There Are No Customers For About 3 Minutes.,https://pic.javct.net/poster/07052026/952059082a.jpg,https://javct.net/v/moon-054,140,2026-07-08
HOKS-219,"Harmful Books: Confessions Of A Serious Office Lady... I'll Tell You About My Orgasmic Experiences, Aishin Lili",https://pic.javct.net/poster/07052026/870aa1a956.jpg,https://javct.net/v/hoks-219,84,2026-07-08
SAN-204-RM,Sex Small Breasts Of 6 Cuckolded Young Wives [Uncensored L**ked],https://pic.javct.net/poster/20231912/1703992358.jpg,https://javct.net/v/san-204-rm,260,2026-07-08
FC2PPV-4934481,"Serina cries and masturbates with Blue Aka Selina. Serina masturbates with a big, beautiful, slender, fair-skinned, super slim body with thin legs.",https://pic.javct.net/poster/07052026/297828e6d3.jpg,https://javct.net/v/fc2ppv-4934481,59,2026-07-08
USAG-027-RM,"K-Cup/Colossal Tits/3 Fucks/Creampie/Self-Shot ""Seeing Yourself Be This Sexy Will Give You Confidence"" She's Normally Shy, But Not In The Bedroom! Girl Gets Bred With Thick, Creamy Cum! [Uncensored L**ked]",https://static.javct.net/poster/usag-027.jpg,https://javct.net/v/usag-027-rm,141,2026-07-08
MOGK-007,A College Girl Obsessed With Host Clubs Is Brainwashed Into Becoming A Sex Doll And Using Dirty Talk.,https://pic.javct.net/poster/07052026/fce544c0c8.jpg,https://javct.net/v/mogk-007,128,2026-07-08
INOT-004-RM,Pushing Girls Buy Dreams With ¥ Exchange! Super Insidious Sober C**ld Is Lustful And Rich Raw Creampie She Betrayed Her Boyfriend A Night That She Loved Po [Uncensored L**ked],https://pic.javct.net/poster/20233001/1677467273.jpg,https://javct.net/v/inot-004-rm,95,2026-07-08
MIDE-655,"Actual Temptation: Sensitive Pinsaro Girl Who Gets Wet from Blowjob, Minami Hatsukawa",https://pic.javct.net/poster/07052026/b0b42781db.jpg,https://javct.net/v/mide-655,120,2026-07-08
CPZ-69013-RM,199X In USSR ~A Record Of Raising An Enchantingly Charming Demon That Captivated All Of Japan~ Kanna Shirohime [Uncensored L**ked],https://pic.javct.net/poster/07052026/a06cb6e13f.jpg,https://javct.net/v/cpz-69013-rm,147,2026-07-08
START-570,"I Picked Up A Girl In Her School Clothes Who Had Overdosed And Passed Out On The Street, And Gave Her A 'second Round Of Sex' Until Her Eyes Were Glazed Over! She Became A Submissive Slut. - Ichinomiya Rui",https://pic.javct.net/poster/07052026/af14178c99.jpg,https://javct.net/v/start-570,140,2026-07-08
OTIN-023,Anal Masochist Wife Anal Creampie Affair - This Hairy Gal Wife Is A Masochist Who Explodes With Pounding In Her Asshole! She Tongues Out And Loses Her Mind While Her Tail Is Thrust Into Her Anus! Haruno Ando,https://pic.javct.net/poster/07052026/d05007e99a.jpg,https://javct.net/v/otin-023,127,2026-07-08
FGEN-005-RM,6 Classic Cosplays! Beautiful Girl And Dream Situation 6 People 240 Minutes [Uncensored L**ked],https://pic.javct.net/poster/20231011/1697082497.jpg,https://javct.net/v/fgen-005-rm,240,2026-07-08
ABW-148-RM,Aoharu Spend A Completely Subjective Experience With A Beautiful Girl In Uniform Spring 3 SEX # 08 180 Minutes To Experience All The Sweet And Sour Youth Graffiti With Naughty From Your Point Of View Mai Nanami [Uncensored L**ked],https://pic.javct.net/poster/20212308/1632381509.jpg,https://javct.net/v/abw-148-rm,195,2026-07-08
STAR-197-RM,Rich And Sweet Sex Saori Hara Saori Hara Eight Celebrities. [Uncensored L**ked],https://pic.javct.net/poster/07052026/41d5ee319d.jpg,https://javct.net/v/star-197-rm,240,2026-07-08
AKB-060-RM,Virtual Cosplay YouChuber [Uncensored L**ked],https://pic.javct.net/poster/20230206/1687392578.jpg,https://javct.net/v/akb-060-rm,200,2026-07-08
FAYS-014-RM,My Personal Cosplay Photoshoot: Maron [Uncensored L**ked],https://pic.javct.net/poster/05192026/a7d3eb2224.jpg,https://javct.net/v/fays-014-rm,80,2026-07-08
CPZ69-013,199X In USSR ~A Record Of Raising An Enchantingly Charming Demon That Captivated All Of Japan~ Kanna Shirohime,https://pic.javct.net/poster/07052026/a06cb6e13f.jpg,https://javct.net/v/cpz69-013,147,2026-07-08
FTO-001-RM,[Cosplay Individual Shooting L**ked] Filming Famous Layered People Who Participate In Comiket. Penis Inserted Directly Into The Enchanting Big Breasted Body [Uncensored L**ked],https://pic.javct.net/poster/20242108/1727018307.jpg,https://javct.net/v/fto-001-rm,133,2026-07-08
MIDD-992,Super Body × Pitakosu SPECIAL Hasegawa Rehoboth,https://pic.javct.net/poster/07052026/d42e2a9c86.jpg,https://javct.net/v/midd-992,180,2026-07-08
