code,title,image_url,page_url,views,date_scraped
HODV-21612-SUB,Female Fuck Buddy That Is Just Perfect. 8.5 Head To Toe With Luscious G-cup Tits On This Gal. Sarina Momonaga [English Subtitle],https://pic.javct.net/poster/20212709/1633176332.jpg,https://javct.net/v/hodv-21612-sub,149,2026-06-14
HODV-21590-RM,[Full POV] Girls Speaking In Dialect: The Hiroshima Dialect - Ai Tsubakino [Uncensored L**ked],https://static.javct.net/poster/hodv-21590.jpg,https://javct.net/v/hodv-21590-rm,133,2026-06-14
JUX-930-RM,When My Wife Sparkles With Lust... Nene [Uncensored L**ked],https://pic.javct.net/poster/20222109/1665934712.jpg,https://javct.net/v/jux-930-rm,119,2026-06-14
VIPR-076-RM,Erica Sato Invades A Shady AV Shoot!! Erika Sato [Uncensored L**ked],https://pic.javct.net/poster/04112026/e3714f871a.jpg,https://javct.net/v/vipr-076-rm,60,2026-06-14
VIPR-078-RM,Dripping Wet Daydream Theater. Erika Sato . [Uncensored L**ked],https://pic.javct.net/poster/04112026/0f1129f2c2.jpg,https://javct.net/v/vipr-078-rm,59,2026-06-14
FOCS-048-RM,"38"" G-Cup Colossal Tits X 5'8"" Tall Crazy Girl With A Miraculously Slender Body - The Greatest Hard Rock Creampie Of Your Life Mira Sena [Uncensored L**ked]",https://pic.javct.net/poster/20212011/1644570879.jpg,https://javct.net/v/focs-048-rm,118,2026-06-14
VIPR-066-RM,BODY TO BODY Erika Sato [Uncensored L**ked],https://pic.javct.net/poster/04112026/81b6116248.jpg,https://javct.net/v/vipr-066-rm,58,2026-06-14
EKW-080-RM,"Today, I Want Her To Jack Me Off. An Mitsumi [Uncensored L**ked]",https://pic.javct.net/poster/20221904/1653628260.jpg,https://javct.net/v/ekw-080-rm,120,2026-06-14
JUY-865-RM,Madonna Exclusive Hot Mature Woman!! Married Woman's Lust Fuck Dripping With Immorality!! Husband Doesn't Know -My Dirty Lust And Secret- Maki Hojo [Uncensored L**ked],https://pic.javct.net/poster/20221904/1651553483.jpg,https://javct.net/v/juy-865-rm,119,2026-06-14
MIST-369-RM,With Kanami Miura At Night... Having Sex Like Crazy With A Beautiful Girl At Night. Kanami Miura [Uncensored L**ked],https://pic.javct.net/poster/20221202/1649322626.jpg,https://javct.net/v/mist-369-rm,150,2026-06-14
WKD-049-RM,Fallen Woman - Himari Kinoshita [Uncensored L**ked],https://pic.javct.net/poster/20212011/1641054004.jpg,https://javct.net/v/wkd-049-rm,52,2026-06-14
JUL-685-RM,31-day Abstinence Life: 3rd Document Showing The Explosive Desire Of A Married Woman Who Just Likes Dick Too Much!! Saori Nagashima [Uncensored L**ked],https://static.javct.net/poster/jul-685.jpg,https://javct.net/v/jul-685-rm,137,2026-06-14
SSIS-261-US,"Breast, Buttocks, Vagina, 171cm, Tasting The Best Style All Over Marin Hinata 's New World Of Acme [English Subtitle, Reducing Mosaic]",https://pic.javct.net/poster/20212011/1639118863.jpg,https://javct.net/v/ssis-261-us,145,2026-06-14
JUY-602-RM,"She Is Unfaithful With Her Clothes Still On, Full Tight Clothing Fuck. Reiko Sawamura [Uncensored L**ked]",https://pic.javct.net/poster/20220707/1660149537.jpg,https://javct.net/v/juy-602-rm,151,2026-06-14
KATU-090-RM,"Sexy Thick Thigh Job Makes You Want To Fuck 2, 5 Thick Dirty Miniskirt Sluts! [Uncensored L**ked]",https://pic.javct.net/poster/20212709/1634971908.jpg,https://javct.net/v/katu-090-rm,181,2026-06-14
FOCS-020-RM,Undiscovered Talent In Hakata! The 171cm Luxuriously Slender And Pure Beautiful Girl. A Lewd Sexual Extravaganza That Goes For 1 Night And 2 Days Without Sleep. Haru Yamaguchi [Uncensored L**ked],https://pic.javct.net/poster/20212308/1631874901.jpg,https://javct.net/v/focs-020-rm,123,2026-06-14
HBAD-619-RM,This Tall Erotic Wicked Woman Is Planning To Seduce A Rich Old Man And Knock Him Off And Clean Him Out Of All His Money But She Ends Up Getting Fucked Instead And Becoming His Sexy Slut. Mirai Sena. [Uncensored L**ked],https://pic.javct.net/poster/20221904/1650519375.jpg,https://javct.net/v/hbad-619-rm,110,2026-06-14
JUY-252-RM,My Big Sister-In-Law's Tight Peachy Ass Was Just Too Sexy... Maya Takeuchi [Uncensored L**ked],https://pic.javct.net/poster/20220406/1655379980.jpg,https://javct.net/v/juy-252-rm,118,2026-06-14
LULU-095-RM,"My Big Stepsister Was Working As A Model, And She Had Such A Beautiful Ass, I Could No Longer Resist, So I Gave Her A Furious Piston-Pounding Quickie, And Continued To Pour Creampie Cum Shots Into Her Ass. Himari Kinoshita [Uncensored L**ked]",https://pic.javct.net/poster/20212709/1633504868.jpg,https://javct.net/v/lulu-095-rm,148,2026-06-14
NGOD-151-RM,Woman At The Convenience Store Headquarters 6 - Chitose Yuki [Uncensored L**ked],https://static.javct.net/poster/ngod-151.jpg,https://javct.net/v/ngod-151-rm,122,2026-06-14
SONE-496-SUB,"After 15 years of dedication to high jumping, she has decided to retire! The world-famous beautiful medalist who can no longer fly is now an addictive sex slave for her sponsor's old man presidents, Kaede Fua [English Subtitle]",https://pic.javct.net/poster/20241115/1732244084.jpg,https://javct.net/v/sone-496-sub,160,2026-06-14
SDNM-515V-RM,"[Bonus Edition] 49 years old... The last spring of her life. 178cm tall, a wife with a model-like figure. AV DEBUT Sanae Kurihara [Uncensored L**ked]",https://pic.javct.net/poster/09052025/1761187138.jpg,https://javct.net/v/sdnm-515v-rm,233,2026-06-14
SSNI-753-SUB,Amu Hanamiya [English Subtitle],https://pic.javct.net/poster/07202025/1756095305.jpg,https://javct.net/v/ssni-753-sub,120,2026-06-14
HEY-218,"Office Ladies Compilation : Aoi Mizutani, Mayumi Hamada, Yu Nakano",https://pic.javct.net/poster/09052025/1759192423.jpg,https://javct.net/v/hey-218,180,2026-06-14
HZ-3868,Naughty Wife's Immoral Secret Over Her Husband Vol.22 - Mio Togashi,https://pic.javct.net/poster/05192026/5975e32378.jpg,https://javct.net/v/hz-3868,59,2026-06-14
BRV-133-RM,Raw creampie love ◆ A thick vaginal ejaculation special for a perverted 50-year-old lady who smiles and is very satisfied! Large-capacity pack containing 10 people [Uncensored L**ked],https://pic.javct.net/poster/05192026/273f6a92ad.jpg,https://javct.net/v/brv-133-rm,118,2026-06-14
ROYD-088-RM,"Caught Between Two Big-Breasted Older Girls Who Love Taking Care Of Me, I Popped A Boner And Lost My Virginity. Miu Arioka Yuri Oshikawa [Uncensored L**ked]",https://pic.javct.net/poster/20221904/1650619055.jpg,https://javct.net/v/royd-088-rm,221,2026-06-14
HZ-3866,Beauty Collection Vol.124 - Mami Sakai,https://pic.javct.net/poster/05192026/c597bd4285.jpg,https://javct.net/v/hz-3866,61,2026-06-14
HZ-3865,Having Lovely Time With A Big Tits Amature Gril Vol.16 - Mai Kagura,https://pic.javct.net/poster/05192026/fe3c484e26.jpg,https://javct.net/v/hz-3865,59,2026-06-14
HZ-3862,Beauty Collection Vol.123 - Nozomi Hamada,https://pic.javct.net/poster/05192026/95ba95d267.jpg,https://javct.net/v/hz-3862,61,2026-06-14
HZ-3861,Asi-Hame!! Vol.27 - Chen,https://pic.javct.net/poster/05192026/1dcc75eb0e.jpg,https://javct.net/v/hz-3861,61,2026-06-14
HZ-3860,Naughty Bitches Having Sex At The Entrance Vol.2 - Satomi - Kurumi Kokoro,https://pic.javct.net/poster/05192026/37ce0c8972.jpg,https://javct.net/v/hz-3860,60,2026-06-14
FC2PPV-4907806,"Sumire (18) Anyway, this is a first-person angle video of the second shooting of cute Sumire-chan, creampie, anal penetration ATM, and cosplay creampie.",https://pic.javct.net/poster/05192026/9e7d438c0d.jpg,https://javct.net/v/fc2ppv-4907806,58,2026-06-14
HZ-3858,Beauty Collection Vol.122 - Hitomi Tanmura,https://pic.javct.net/poster/05192026/ef10044e0b.jpg,https://javct.net/v/hz-3858,61,2026-06-14
ROYD-065-RM,"The School Idol That Moved Next Door Saw My Boner, And Though She Was Embarassed, She Turned Out To Be A Massive Slut. Mone Kouno [Uncensored L**ked]",https://static.javct.net/poster/royd-065.jpg,https://javct.net/v/royd-065-rm,140,2026-06-14
HZ-3853,Having Sex With A Quiet-Looking Amateur Girl - Miharu Azumi,https://pic.javct.net/poster/05192026/7b2e230564.jpg,https://javct.net/v/hz-3853,51,2026-06-14
HZ-3852,Slender MILF Gets Fucked in a Threesome! - Momoko Akasaka,https://pic.javct.net/poster/05192026/1fcc87afe8.jpg,https://javct.net/v/hz-3852,59,2026-06-14
ROYD-060-RM,"When I Got My First Girlfriend, We Used This Camera To Film So Many Wonderful Memories ... And Now, I'm Using It To Film My Scary Friend While He Fucks Her ... And All The While, I Have A Melancholy Erection, That Just Won't Stop ... Rio Matsumoto [Uncensored L**ked]",https://static.javct.net/poster/royd-060.jpg,https://javct.net/v/royd-060-rm,134,2026-06-14
HZ-3850,Beauty Collection Vol.121 - Yui Nanase,https://pic.javct.net/poster/04112026/9d1f690735.jpg,https://javct.net/v/hz-3850,61,2026-06-14
HZ-3849,I Do Whatever I Want With A Busty MILF!! Vol.3 - Ayumi Fujiwara,https://pic.javct.net/poster/04112026/6a0e180676.jpg,https://javct.net/v/hz-3849,61,2026-06-14
HZ-3848,Erotic Multiple Creampies Vol.8 - Hina Sakurai,https://pic.javct.net/poster/04112026/1c5297f308.jpg,https://javct.net/v/hz-3848,55,2026-06-14
HZ-3846,Beauty Collection Vol.120 - Ami Ogura,https://pic.javct.net/poster/04112026/6df9806905.jpg,https://javct.net/v/hz-3846,61,2026-06-14
FC2PPV-4898377,"Sumire (18) The cutest girl in the second shoot, has a video of different angles of view, creampie, electric masturbation, anal penetration ATM, piston machine, and finally cosplay and creampie.",https://pic.javct.net/poster/04112026/3e21ffb8cd.jpg,https://javct.net/v/fc2ppv-4898377,174,2026-06-14
HZ-3844,Slut Amateur Girl Gets Fucked in a Threesome! - Maho Hoshijima,https://pic.javct.net/poster/04112026/f63afbff7e.jpg,https://javct.net/v/hz-3844,60,2026-06-14
HZ-3843,Slender MILF Stays Nude in Her Home - Hina Kusakabe,https://pic.javct.net/poster/04112026/03748f7c25.jpg,https://javct.net/v/hz-3843,55,2026-06-14
HZ-3837,Beauty Collection Vol.119 - Rion,https://pic.javct.net/poster/04112026/cbe3dbfa19.jpg,https://javct.net/v/hz-3837,61,2026-06-14
HZ-3828,A frustrated wife gets threesome with continuous creampies! - Sara Suzukake,https://pic.javct.net/poster/04112026/bc469fc5b4.jpg,https://javct.net/v/hz-3828,60,2026-06-14
HZ-3836,Beautiful Porcelain Skinned Nurse's Special Treatment - Yui Kisaragi,https://pic.javct.net/poster/04112026/2caa046390.jpg,https://javct.net/v/hz-3836,54,2026-06-14
GVG-373-RM,The Sexy PTA Chairwoman And The Naughty Student Council Yuna Takase [Uncensored L**ked],https://pic.javct.net/poster/20221904/1652315847.jpg,https://javct.net/v/gvg-373-rm,136,2026-06-14
MAZO-016-RM,"Department Store Receptionist, 27 Years Old, Tied Up With Chains, Womanizer Uterus Convulsions, Pure M, Gokubi Dcup, God's Constriction, Creampie During Lunch Break [Uncensored L**ked]",https://pic.javct.net/poster/05192026/506c6c50e1.jpg,https://javct.net/v/mazo-016-rm,75,2026-06-14
JUY-194-RM,The Coincidental Secret Room A Married Woman Female Doctor And Her Patient Nozomi Tanihara [Uncensored L**ked],https://pic.javct.net/poster/20212011/1640801270.jpg,https://javct.net/v/juy-194-rm,118,2026-06-14
SDDE-411-RM,"No Matter How Many Times They Fuck She's Still Horny. Countless Rounds Of Orgasmic Sex. One Night, Two Day Hotel Stay Of Ecstasy - 12 Loads In All! [Uncensored L**ked]",https://pic.javct.net/poster/20220406/1654569935.jpg,https://javct.net/v/sdde-411-rm,151,2026-06-14
MAZO-008-RM,Manners Instructor 26 Years Old Dildo Electric Demon Leverage Cheating SEX Continues Even During Engagement Perverted Woman Who Becomes A Semen Toilet Uterus Trampling Exciting Climax [Uncensored L**ked],https://pic.javct.net/poster/05192026/6e988e4fda.jpg,https://javct.net/v/mazo-008-rm,78,2026-06-14
GVG-801-RM,A Sexy Weather Girl Elder Sister And Her Bad Boys Mari Takasugi [Uncensored L**ked],https://pic.javct.net/poster/20212011/1643623764.jpg,https://javct.net/v/gvg-801-rm,136,2026-06-14
JUL-489-SUB,"A Madonna Label Exclusive Kana Mito She's Lifting Her Lesbian Ban!! While On A Business Trip, To Her Surprise, She Was Booked Into The Same Room At The Business Hotel With Her Cute Colleague, Whom She Discovered, To Her Further Surprise, That She Was A Lesbian. [English Subtitle]",https://pic.javct.net/poster/20212709/1636394681.jpg,https://javct.net/v/jul-489-sub,166,2026-06-14
ROYD-067-RM,"My C**ldhood Friend Is A Beautiful Older Woman With F-Cup Titties, And Now That I've Paid My Subscription Fees, I Can Insert My Dick Whenever I Want, As Much As I Want! As Long As I Pay The Monthly Fees, I Can Fuck Her Anytime, Anywhere, As Much As I Like! Mikako Horiuchi [Uncensored L**ked]",https://pic.javct.net/poster/20212308/1632470195.jpg,https://javct.net/v/royd-067-rm,157,2026-06-14
JUY-053-RM,My Lady Boss Is Cumming At Me Hard For Sex At The Office Eriko Miura [Uncensored L**ked],https://pic.javct.net/poster/20221904/1651464392.jpg,https://javct.net/v/juy-053-rm,119,2026-06-14
T28-381-RM,The Elderly Home Helper That Can't Say No To A Creampie [Uncensored L**ked],https://pic.javct.net/poster/20222109/1665547568.jpg,https://javct.net/v/t28-381-rm,124,2026-06-14
HUNTB-151-RM,"Door To Anywhere ""Aah, Pervert! Why Are You Here!? Get out!"" You Can Go Anywhere With This Door! And You Can Cum Anywhere With It Too! [Uncensored L**ked]",https://pic.javct.net/poster/20212709/1637308899.jpg,https://javct.net/v/huntb-151-rm,165,2026-06-14
MAZO-026-RM,A Public School Student 1 Years Old Trained To Train A First-Class Body As A Track And Field Club Super Sensitive Nipple Twist And Faints In Agony Irresponsible Seeding Sex Loving Masochist Lady [Uncensored L**ked],https://pic.javct.net/poster/04112026/3ca4374d65.jpg,https://javct.net/v/mazo-026-rm,72,2026-06-14
JUY-935-RM,"My Last Summer Break, Private Lessons With My Favorite Female Teacher In A Sweaty Classroom - Ayaka Makimura [Uncensored L**ked]",https://pic.javct.net/poster/20212011/1641085593.jpg,https://javct.net/v/juy-935-rm,120,2026-06-14
GVG-770-RM,A Sexy Weather Girl And Naughty Brats. Akari Mitani [Uncensored L**ked],https://pic.javct.net/poster/20212011/1643623940.jpg,https://javct.net/v/gvg-770-rm,137,2026-06-14
JUE-007-RM,"Showa. Female Medic Goes Out Looking For Her Lover On The Battlefield. A Sad And Ephemeral Wartime Story About Ongoing Struggles, Sex With Those In Power, Fucking A Father In Law. Ai Mukai. [Uncensored L**ked]",https://pic.javct.net/poster/20221202/1647760447.jpg,https://javct.net/v/jue-007-rm,120,2026-06-14
HDKA-246-RM,Nude Maid. Nude Maid Referral Office. Ena Satsuki [Uncensored L**ked],https://pic.javct.net/poster/20212011/1638335334.jpg,https://javct.net/v/hdka-246-rm,120,2026-06-14
JUL-489-RM,"A Madonna Label Exclusive Kana Mito She's Lifting Her Lesbian Ban!! While On A Business Trip, To Her Surprise, She Was Booked Into The Same Room At The Business Hotel With Her Cute Colleague, Whom She Discovered, To Her Further Surprise, That She Was A Lesbian. [Uncensored L**ked]",https://pic.javct.net/poster/20212709/1636394681.jpg,https://javct.net/v/jul-489-rm,166,2026-06-14
JUL-537-RM,On A Two Night Three Day Trip I Was Ordered To Stay In The Hotel And Ended Up Seducing The Hot Receptionist... Aoi Mukai [Uncensored L**ked],https://static.javct.net/poster/jul-537.jpg,https://javct.net/v/jul-537-rm,119,2026-06-14
JUY-917-RM,"I Got A New Job, And Now I'm The Fresh Face In The Office, And My Lady Boss Is Always Toying With Me During Work Hours Yuka Oshima [Uncensored L**ked]",https://pic.javct.net/poster/20221904/1652889883.jpg,https://javct.net/v/juy-917-rm,119,2026-06-14
JUY-932-RM,Do You Have A Thing For Older Women? My Female Boss Is Dripping With Sex Appeal At Our Secret Rendezvous Yuko Shiraki [Uncensored L**ked],https://pic.javct.net/poster/20221202/1645520332.jpg,https://javct.net/v/juy-932-rm,120,2026-06-14
JUY-861-RM,I'm The New Guy At Work And My Female Boss Keeps Toying With Me During Work Eriko Miura [Uncensored L**ked],https://pic.javct.net/poster/20221202/1646702161.jpg,https://javct.net/v/juy-861-rm,120,2026-06-14
PFES-029-SUB,The Wet Pantyhose Of The Cooking Expert. Honoka Tsuji [English Subtitle],https://pic.javct.net/poster/20221202/1648190355.jpg,https://javct.net/v/pfes-029-sub,133,2026-06-14
JUL-659-RM,"31 After A Long String Of Work Days, Office Sex That Destroys Reason. Men And Women On The Brink While Working For An Exploitative Company. Marika Kobayashi. [Uncensored L**ked]",https://static.javct.net/poster/jul-659.jpg,https://javct.net/v/jul-659-rm,120,2026-06-14
SCD-198-RM,She's Good At Getting Fucked A Bus Tour Guide In A Miniskirt Arisa Hanyu [Uncensored L**ked],https://pic.javct.net/poster/20212709/1634400573.jpg,https://javct.net/v/scd-198-rm,122,2026-06-14
XKK-052-RM,Secret Service Escort Beauty Meet In Excess Of The Needs Of Prince Lewd Blond [Uncensored L**ked],https://pic.javct.net/poster/05192026/b4f99650fd.jpg,https://javct.net/v/xkk-052-rm,100,2026-06-14
SORA-330-RM,"A Personality-Altering Mind Fuck Running Away Is The Better Option, And It Cums In Handy! An Excessively Overperforming Lady Boss Is Getting Put In Her Place By A Lowly Employee During The Presentation Mao Hamasaki [Uncensored L**ked]",https://pic.javct.net/poster/20212308/1630746706.jpg,https://javct.net/v/sora-330-rm,139,2026-06-14
HOKS-228-RM,Love And Money: A Dark Contract By Tae Kosaka [Uncensored L**ked],https://pic.javct.net/poster/05192026/ce5042e117.jpg,https://javct.net/v/hoks-228-rm,105,2026-06-14
DASD-835-SUB,The Story Of A Woman Who Wanted To Get Pregnant With Her Beloved Husband But Ended Up Being Impregnated By The Fertility Specialist! Yu Shinoda [English Subtitle],https://pic.javct.net/poster/20212709/1632967151.jpg,https://javct.net/v/dasd-835-sub,141,2026-06-14
NACR-925-SUB,"My Rationality Was Blown Away By The Sight Of My Mother-in-law, Who Was Completely Soaked By The Sudden Downpour. Chisato Shoda [English Subtitle]",https://pic.javct.net/poster/20253001/1741108126.jpg,https://javct.net/v/nacr-925-sub,124,2026-06-14
HOKS-228,Love And Money: A Dark Contract By Tae Kosaka,https://pic.javct.net/poster/05192026/ce5042e117.jpg,https://javct.net/v/hoks-228,105,2026-06-14
KSBJ-433,"My Sister-in-law, Who Ran Away From Home After A Fight With Her Husband, Seduced Me And We Had Unprotected Sex From Morning Till Night. - Azusa Tani",https://pic.javct.net/poster/05192026/3a2745adf3.jpg,https://javct.net/v/ksbj-433,122,2026-06-14
ALDN-176-RM,Mother R**e Creampie Mother Tamami Kurokawa Who Was Cummed Out For The First Time By Her Son [Uncensored L**ked],https://pic.javct.net/poster/20230206/1686368292.jpg,https://javct.net/v/aldn-176-rm,110,2026-06-14
HODV-21611-RM,"My Husband Doesn't Ever Want To Fuck Me, Now My Terrible Younger CEO At Work Takes Me In For Dominant Sex. NTR Cheating Scenario. Mizuki Yayoi [Uncensored L**ked]",https://pic.javct.net/poster/20212709/1633176387.jpg,https://javct.net/v/hodv-21611-rm,120,2026-06-14
JUY-319-RM,An Unforgettable Old Man - A Carved Tantrum Kissmark - Rena Nakaya [Uncensored L**ked],https://pic.javct.net/poster/05192026/633812e8f1.jpg,https://javct.net/v/juy-319-rm,120,2026-06-14
NEWM-053-RM,True / Abnormal Sex Fifty Mother And C**ld Part 34 Ripe Honey Pot To Heal The Exhausted Son Emi Toyonaga [Uncensored L**ked],https://pic.javct.net/poster/20230206/1687579095.jpg,https://javct.net/v/newm-053-rm,120,2026-06-14
AUKG-653,Fifty-something Lesbians ~A Mature Woman's Passionate Lesbian Affair Amidst A Sexless Marriage~,https://pic.javct.net/poster/05192026/73c20e5a22.jpg,https://javct.net/v/aukg-653,120,2026-06-14
ADN-064-RM,"You, And Forgive ....Immorality Of Canvas Uehara Ai [Uncensored L**ked]",https://pic.javct.net/poster/07202025/1756617264.jpg,https://javct.net/v/adn-064-rm,100,2026-06-14
ADN-067-RM,"You, And Forgive .... - Immoral Of Drainage - One Article Ayaginu Mika [Uncensored L**ked]",https://pic.javct.net/poster/05192026/aaaa67c366.jpg,https://javct.net/v/adn-067-rm,100,2026-06-14
MIKR-103-RM,"Hinako Mori, The Beautiful Swimming Club Advisor, Revives The Nearly Disbanded Swimming Club By Provocatively Wearing A High-cut Swimsuit And Giving Strict, Leg-shaping Lessons To Arouse The Sexually Charged Hearts And Penises Of The Male Students. [Uncensored L**ked]",https://pic.javct.net/poster/05192026/77432d61fa.jpg,https://javct.net/v/mikr-103-rm,170,2026-06-14
SAN-184-RM,Mother Best Sex 6 People [Uncensored L**ked],https://pic.javct.net/poster/20231011/1698722469.jpg,https://javct.net/v/san-184-rm,230,2026-06-14
GVG-443-RM,Forbidden Care Haruna Hebei [Uncensored L**ked],https://pic.javct.net/poster/20230804/1692194269.jpg,https://javct.net/v/gvg-443-rm,120,2026-06-14
VEC-590-RM,A Captivating Single Mother Who Moved Next To Her Apartment And Creampie Courtship Sex Ann Komatsu [Uncensored L**ked],https://pic.javct.net/poster/20230205/1685681646.jpg,https://javct.net/v/vec-590-rm,95,2026-06-14
STARS-042-RM,Confinement Of The Beautiful Scoop Photographer Masami Ichikawa [Uncensored L**ked],https://pic.javct.net/poster/20243105/1719524904.jpg,https://javct.net/v/stars-042-rm,110,2026-06-14
531HFC-042-RM,"On a business trip with my female boss, I unexpectedly found out that I was sharing a room with a transsexual... Hime Hanamiya Shoko Akase [Uncensored L**ked]",https://pic.javct.net/poster/05192026/f8e81e66f9.jpg,https://javct.net/v/531hfc-042-rm,46,2026-06-14
NSFS-469-SUB,Mature Mother 38 ~A Ripe Body Driven Wild By Her Son's Huge Penis~ Megumi Suzukawa [English Subtitle],https://pic.javct.net/poster/04112026/68623b1ce5.jpg,https://javct.net/v/nsfs-469-sub,91,2026-06-14
MIKR-103,"Hinako Mori, The Beautiful Swimming Club Advisor, Revives The Nearly Disbanded Swimming Club By Provocatively Wearing A High-cut Swimsuit And Giving Strict, Leg-shaping Lessons To Arouse The Sexually Charged Hearts And Penises Of The Male Students.",https://pic.javct.net/poster/05192026/77432d61fa.jpg,https://javct.net/v/mikr-103,170,2026-06-14
SDDE-444-RM,A Married Woman Who Was Exhibited In A Museum For The Sake Of Her Beloved Family Lena Fukiishi [Uncensored L**ked],https://pic.javct.net/poster/20221108/1661097661.jpg,https://javct.net/v/sdde-444-rm,112,2026-06-14
NSPS-605-RM,Husband's Best Friend And Rich Fuck  Husband Who Made Her Wife Fall Asleep In Debt Kata  Mayumi Imai [Uncensored L**ked],https://pic.javct.net/poster/20220406/1655728334.jpg,https://javct.net/v/nsps-605-rm,81,2026-06-14
T28-417-RM,Anikura Pretty Layer Immediately Hamenanpa [Uncensored L**ked],https://pic.javct.net/poster/06032026/1775710624.jpg,https://javct.net/v/t28-417-rm,200,2026-06-14
OTIN-026-RM,"Anal-dominant Wife's Anal Cumshot Affair: Two-hole To**ure With Toys And Dick! Thrusting Until Her Anus Swells And Turns Bright Red, Raw Cumshot Into Her Ripe Anus! Momoe Mikoto [Uncensored L**ked]",https://pic.javct.net/poster/05192026/6423054b7a.jpg,https://javct.net/v/otin-026-rm,96,2026-06-14
STARS-374-RM,Cum Dripping Infinite Ascension Costume Massage Parlor 4 COSPLAY 3 Sex Mei Miyajima [Uncensored L**ked],https://static.javct.net/poster/1621308856.jpeg,https://javct.net/v/stars-374-rm,135,2026-06-14
SQTE-693-RM,"More Than Friends With Benefits, Less Than Lovers. Cosplay! Cumming Inside! A Beautiful Girl With Insatiable Sexual Appetite And Endless Sex On Camera! Hanamori Natsuho [Uncensored L**ked]",https://pic.javct.net/poster/05192026/96ba5363e4.jpg,https://javct.net/v/sqte-693-rm,118,2026-06-14
FC2PPV-4919752,A romantic maid with the best breasts in a slick costume and a super sensitive 100cm H cup with plenty of serious juice NIKKE's must-have naughty edition Part 2,https://pic.javct.net/poster/05192026/66a0b0b7da.jpg,https://javct.net/v/fc2ppv-4919752,87,2026-06-14
SRS-062-RM,Bimbo Document Ruri-chan (20) Beauty-based Professional Student File.04 [Uncensored L**ked],https://pic.javct.net/poster/05192026/388fe8b58a.jpg,https://javct.net/v/srs-062-rm,135,2026-06-14
MIBB-020-RM,Fully Clothed Cosplay Temptation Queen Miho Ariga [Uncensored L**ked],https://pic.javct.net/poster/20230206/1686975991.jpg,https://javct.net/v/mibb-020-rm,123,2026-06-14
SQTE-693,"More Than Friends With Benefits, Less Than Lovers. Cosplay! Cumming Inside! A Beautiful Girl With Insatiable Sexual Appetite And Endless Sex On Camera! Hanamori Natsuho",https://pic.javct.net/poster/05192026/96ba5363e4.jpg,https://javct.net/v/sqte-693,118,2026-06-14
OTIN-026,"Anal-dominant Wife's Anal Cumshot Affair: Two-hole To**ure With Toys And Dick! Thrusting Until Her Anus Swells And Turns Bright Red, Raw Cumshot Into Her Ripe Anus! Momoe Mikoto",https://pic.javct.net/poster/05192026/6423054b7a.jpg,https://javct.net/v/otin-026,96,2026-06-14
NCYF-053,"White-eyed, Moaning, Masochistic, Agonizing, 19 Cumshots Inside, Short 145cm Sassy Little Girl Cosplayer [stomach Punch X Neck Ch**ing X Vaginal Pounding] Spectacular Squirting Pussy Destruction 6P Orgy SEX",https://pic.javct.net/poster/05192026/5d60703954.jpg,https://javct.net/v/ncyf-053,121,2026-06-14
MUKA-008-RM,Dressing An Adult Body In A School Uniform. Embarrassing School Uniform Cosplay Leads To A Walk Of Shame And Passionate Sex. [Uncensored L**ked],https://pic.javct.net/poster/05192026/2de08e7836.jpg,https://javct.net/v/muka-008-rm,190,2026-06-14
MUDR-380-RM,"A Close-up, In-depth Look At The Voluptuous Body Of The Goddess-breasted, Lewd Idol, Himesaki Hana. [Uncensored L**ked]",https://pic.javct.net/poster/05192026/6c597eebbf.jpg,https://javct.net/v/mudr-380-rm,140,2026-06-14
MUDR-380,"A Close-up, In-depth Look At The Voluptuous Body Of The Goddess-breasted, Lewd Idol, Himesaki Hana.",https://pic.javct.net/poster/05192026/6c597eebbf.jpg,https://javct.net/v/mudr-380,140,2026-06-14
XC-1436-RM,Welcome To Maxcafe! Asami Ogawa [Uncensored L**ked],https://pic.javct.net/poster/05192026/1e31e55558.jpg,https://javct.net/v/xc-1436-rm,60,2026-06-14
CIEL-006-RM,"""Do You Like My Big Boobs...?"" Hcup Ichacos Gonzo Sex With Huge Breasts And Super Sweet Gentle Girlfriend's Naughty Disturbed Female Fallen Sex Maya Kikuchi [Uncensored L**ked]",https://pic.javct.net/poster/20230205/1685158744.jpg,https://javct.net/v/ciel-006-rm,113,2026-06-14
