code,title,image_url,page_url,views,date_scraped
IESP-135-RM,Chinami Sakai Barrage Horny Wife 20 Pies [Uncensored L**ked],https://pic.javct.net/poster/05192026/a89c6f504c.jpg,https://javct.net/v/iesp-135-rm,100,2026-06-14
ENKI-039-RM,Naughty Japanese Sex Fest Breaks Out! Horny Blue-Eyed Slut Jun-chan Gets Fucked Raw by a Big White Cock and Cum Splashed in her Pussy. [Uncensored L**ked],https://static.javct.net/poster/enki-039.jpg,https://javct.net/v/enki-039-rm,237,2026-06-14
FC2PPV-4916927,"[No] Black 3P party on the day of birthday Reina, a cute foreign office lady with outstanding charm Chapter 6: Intense 3P with 2 big cock black people on her birthday, to**ured to the limit and creampied 2 times in a row [Overseas version] Bonus included",https://pic.javct.net/poster/05192026/d8d5b87191.jpg,https://javct.net/v/fc2ppv-4916927,71,2026-06-14
NSPS-013-RM,Woman Working In A Flock Of Man Keep It From Not Being A Job Whether Or Not You Are [Uncensored L**ked],https://pic.javct.net/poster/20222612/1673306527.jpg,https://javct.net/v/nsps-013-rm,92,2026-06-14
1P-060726-001,Bitch!,https://pic.javct.net/poster/05192026/9b85a0b47d.jpg,https://javct.net/v/1p-060726-001,89,2026-06-14
ENKI-016-RM,Chi  Po Pickled Trained Service Transformation Masochist Waka Kana Maki Others Stick Seeding Wheel [Uncensored L**ked],https://pic.javct.net/poster/20222410/1667315241.jpg,https://javct.net/v/enki-016-rm,215,2026-06-14
HUNTC-611-RM,"Aphrodisiac patience game ""Does this really work? I'm totally fine..."" ""I'm fine too."" A girl who got an aphrodisiac drinks it out of curiosity! A chicken race with a mysterious sense of pride: ""The one that works loses''! But my body is honest! The pussy gradually starts to get wet and the joy juices don't stop, leading to a lesbian orgy! Furthermore, my brother is in the room... [Uncensored L**ked]",https://pic.javct.net/poster/05192026/37884b74d0.jpg,https://javct.net/v/huntc-611-rm,180,2026-06-14
SDDE-356-RM,Department Issued Two True In Sexual Desire Processing Specialty Outpatient Clinic Gangbang Sex [Uncensored L**ked],https://pic.javct.net/poster/20242108/1724790062.jpg,https://javct.net/v/sdde-356-rm,165,2026-06-14
FC2PPV-4919821,"[Limited release] Musume in a box that has been pre-approved by the post office ♡ The elegant atmosphere completely collapses in front of the cock, and the pleasure recording video that finally starts shaking her hips [High-quality bonus included]",https://pic.javct.net/poster/05192026/f13c0a4c3e.jpg,https://javct.net/v/fc2ppv-4919821,39,2026-06-14
10-061326-01,A Cabaret Hostess on Her Day Off: Massive Creampies That Blow Her Mind,https://pic.javct.net/poster/05192026/e0f76ee61b.jpg,https://javct.net/v/10-061326-01,60,2026-06-14
CR-061326-001,Non Stop Suzu Nonomiya for 180min : Endless creampie to a nice body and beautiful woman Part. 2,https://pic.javct.net/poster/05192026/01f8d225b2.jpg,https://javct.net/v/cr-061326-001,92,2026-06-14
FC2PPV-4919591,"[No. Inside. Face showing] Erotic Dora ⚪︎mon I want to be inserted already ♡ * With the transcendent technique of the burning voice, my small light is sucked into the four-dimensional pocket...",https://pic.javct.net/poster/05192026/79565d5e52.jpg,https://javct.net/v/fc2ppv-4919591,68,2026-06-14
FC2PPV-4912520,"[Multiple play] The E-cup shaved girl says, ""I do whatever I want with a special toy for the rare association, and I have a series of supreme pleasures, so I'm lethargic and don't care about that, and cum inside me all the time.",https://pic.javct.net/poster/05192026/377069ba3d.jpg,https://javct.net/v/fc2ppv-4912520,62,2026-06-14
FC2PPV-4917087,"Although she is still a college student, she has not had any sex for a year and has a G cup body. She is a positive girl who has not had sex in a long time. She squeezed the cock with her tight pussy.",https://pic.javct.net/poster/05192026/6e920e87ac.jpg,https://javct.net/v/fc2ppv-4917087,103,2026-06-14
PA-061326-100,Naked at the front door  - Let's see if you can resist the naked seduction of a beautiful mature woman!,https://pic.javct.net/poster/05192026/b052ffb0aa.jpg,https://javct.net/v/pa-061326-100,24,2026-06-14
300MIUM-611-RM,"A working masochist. Case.37 Local station announcer/Mr. Akimoto/25 years old [Max Sensitivity Erotic Nipples] She was supposed to be recording a narration, but she went to a sex shoot to see her cumming with her big nipples erect. [Uncensored L**ked]",https://pic.javct.net/poster/05192026/d882d789e2.jpg,https://javct.net/v/300mium-611-rm,89,2026-06-14
UGH-034-RM,It was supposed to be just selling their pants... but... 5 office ladies were creampied in a public restroom. [Uncensored L**ked],https://pic.javct.net/poster/05192026/2aff1695b1.jpg,https://javct.net/v/ugh-034-rm,67,2026-06-14
UGH-016-RM,L**ked! Detention center visiting room video File.03 5 people [Uncensored L**ked],https://pic.javct.net/poster/05192026/b44df9ec25.jpg,https://javct.net/v/ugh-016-rm,57,2026-06-14
CR-061226-001,"The Story Of Luxury Spa Lady, Vol.152",https://pic.javct.net/poster/05192026/2a621572d0.jpg,https://javct.net/v/cr-061226-001,61,2026-06-14
420HOI-396-RM,"Lucky (24) Amateur Hoi Hoi Z, Amateur, Documentary, Gonzo, Beautiful Girl, Black Hair, Innocent, Beautiful Breasts, Facial [Uncensored L**ked]",https://pic.javct.net/poster/05192026/e2fab87cef.jpg,https://javct.net/v/420hoi-396-rm,79,2026-06-14
CRNX-261-RM,[4K] Dispatch personal trainer's beautiful butt temptation Ruru Haruno [Uncensored L**ked],https://pic.javct.net/poster/05192026/d094532083.jpg,https://javct.net/v/crnx-261-rm,49,2026-06-14
FC2PPV-4919133,"[No/Raw creampie] **pyjpx*jsps A small and very cute little devilish JD came to our store after receiving an email that new massage equipment was in stock.Once again, she requested a longer oil.",https://pic.javct.net/poster/05192026/99320c40e0.jpg,https://javct.net/v/fc2ppv-4919133,49,2026-06-14
PYU-468-RM,A lewd lady who eats a healthy dick that quickly gets erect. [Uncensored L**ked],https://pic.javct.net/poster/05192026/9d4a54b29c.jpg,https://javct.net/v/pyu-468-rm,39,2026-06-14
FC2PPV-4916209,"Enjoying the best J cup, rubbing, pinching, shaking, and licking the cock, the dream titty fuck that completely envelops the cock and squeezes out the excited balls over and over again until it's empty [faceless creampie]",https://pic.javct.net/poster/05192026/a60d08b317.jpg,https://javct.net/v/fc2ppv-4916209,49,2026-06-14
UGH-016,L**ked! Detention center visiting room video File.03 5 people,https://pic.javct.net/poster/05192026/b44df9ec25.jpg,https://javct.net/v/ugh-016,57,2026-06-14
UGH-034,It was supposed to be just selling their pants... but... 5 office ladies were creampied in a public restroom.,https://pic.javct.net/poster/05192026/2aff1695b1.jpg,https://javct.net/v/ugh-034,67,2026-06-14
FC2PPV-4918663,"[No] This month's No. 1 No. 1 No. 1 in this month's book nominations. Miss Menes, who has top-notch techniques and overwhelming visuals that will soothe your body and mind, offers the finest private service to traveling French people. [Overseas version] Bonus included",https://pic.javct.net/poster/05192026/61aaaf46ab.jpg,https://javct.net/v/fc2ppv-4918663,43,2026-06-14
BGN-045-RM,Newcomer Prestige Exclusive Debut [Uncensored L**ked],https://pic.javct.net/poster/05192026/eb38988405.jpg,https://javct.net/v/bgn-045-rm,200,2026-06-14
MVSD-695-RM,"A Masochistic Wife Of The Upper Class, Fo**ed To Repay The Debt Of Her Vanished Husband With Her Body, Is Dragged Into A Hell Of Depravity. Imprisoned And Ab**ed Day After Day By Scumbag Men, Her Beautiful Naked Body Discovers The Pleasure Of Masochistic Orgasms. - Harumi Kyomoto [Uncensored L**ked]",https://pic.javct.net/poster/05192026/0c35a6a264.jpg,https://javct.net/v/mvsd-695-rm,150,2026-06-14
MVSD-699-RM,"Hairy Ass, Dripping Intestinal Fluids, Gushing Anal Farts, Every Saturday She Leaves Her C**ld With Her Mother And Has A Wild Sex Marathon With Three Men, Works At A Call Center, A Fluffy, Slutty Mom Makes Her AV Debut With Anal Sex, Tsukino Midori [Uncensored L**ked]",https://pic.javct.net/poster/05192026/bbad9daac0.jpg,https://javct.net/v/mvsd-699-rm,170,2026-06-14
MVSD-692-RM,"A Massive Injection Of Aphrodisiac Semen Into Every Orifice! Drink It! Bathe In It! Get Cummed Inside! The More You Get Fucked, The More The Pleasure Doubles! A Brain-shattering Anal Kinky Three-hole Fuck With A Gaping Asshole! Tsukino Sui [Uncensored L**ked]",https://pic.javct.net/poster/05192026/78fd22dfbc.jpg,https://javct.net/v/mvsd-692-rm,120,2026-06-14
MAAN-1175,[Tsundere Squirting Beautiful Girl] The strongest gap between anime voice and G cup is cheeky but demon cute... Aniota girl with plump plump body appears bottomless explosive tide pump that never stops ww Pien runs wild with an orgasm that drowns her uncle www [Play with Ochipo-sama] [Yunochi],https://pic.javct.net/poster/05192026/170eb261f8.jpg,https://javct.net/v/maan-1175,88,2026-06-14
MAAN-1175-RM,[Tsundere Squirting Beautiful Girl] The strongest gap between anime voice and G cup is cheeky but demon cute... Aniota girl with plump plump body appears bottomless explosive tide pump that never stops ww Pien runs wild with an orgasm that drowns her uncle www [Play with Ochipo-sama] [Yunochi] [Uncensored L**ked],https://pic.javct.net/poster/05192026/170eb261f8.jpg,https://javct.net/v/maan-1175-rm,88,2026-06-14
300MIUM-1398,"We finally succeeded in the long-awaited threesome. We met a multi-sex woman with huge breasts that seemed like they were going to stay like this for the rest of her life, saying, ""If I don't act now, I'll stay like this for the rest of my life."" I met a multi-sex woman who talked about a shady dream with huge breasts that looked like they were about to burst. I was convinced that if I don't act now, I won't be able to have a threesome for the rest of my life...I was convinced, and an acquaintance I secretly called over also appeared. I was confused as to ""Eh, who?"" but the woman just kept getting fucked by two men. A demon piston deep-drama festival was held by two men with big dicks. She was shaking her big breasts like an erotic manga and went crazy. :case.64",https://pic.javct.net/poster/05192026/1cc416bf24.jpg,https://javct.net/v/300mium-1398,72,2026-06-14
DDFF-052,Throat Fuck X Nipple Fuck Esthetician Yuri,https://pic.javct.net/poster/05192026/b4046542d6.jpg,https://javct.net/v/ddff-052,124,2026-06-14
DDK-239,"Complete Obedience, One-Day Sex Slave ● Aoi Miumi",https://pic.javct.net/poster/05192026/aa0c34c015.jpg,https://javct.net/v/ddk-239,129,2026-06-14
ENKI-082-RM,"Big Tits, Big Ass, Perverted Girl Mizuki, Vaginal And Throat Pounding! Raw Creampie Only Female Pig Meat Urinal [Uncensored L**ked]",https://pic.javct.net/poster/20250903/1744910613.jpg,https://javct.net/v/enki-082-rm,265,2026-06-14
GKOK-002,Schoolgirl With Expanded Pussy: Mimori Toba,https://pic.javct.net/poster/05192026/7e32e4e240.jpg,https://javct.net/v/gkok-002,122,2026-06-14
REAL-648,Demon Ikase Mari 梨 夏,https://pic.javct.net/poster/05192026/0bf9e92fbe.jpg,https://javct.net/v/real-648,120,2026-06-14
MVSD-695,"A Masochistic Wife Of The Upper Class, Fo**ed To Repay The Debt Of Her Vanished Husband With Her Body, Is Dragged Into A Hell Of Depravity. Imprisoned And Ab**ed Day After Day By Scumbag Men, Her Beautiful Naked Body Discovers The Pleasure Of Masochistic Orgasms. - Harumi Kyomoto",https://pic.javct.net/poster/05192026/0c35a6a264.jpg,https://javct.net/v/mvsd-695,150,2026-06-14
CEMD-295-RM,I'll Give You My Trained Sex Doll! 4 Amiri Saito [Uncensored L**ked],https://pic.javct.net/poster/05192026/27900ba364.jpg,https://javct.net/v/cemd-295-rm,131,2026-06-14
AQSH-100-RM,My Wife Who Can't Stop Cheating De M Irama Woman Who Asks For Nipple Tampering Many Times Shiokawa Uni [Uncensored L**ked],https://pic.javct.net/poster/20230206/1686972364.jpg,https://javct.net/v/aqsh-100-rm,120,2026-06-14
NHDTB-771-RM,Pushing The Waist Of A Woman Who Goes Crazy When She Resists And Gets Out On The Verge Of Vaginal Cum Shot Many Times And Holds Her Back And Does Not Escape Ejaculation 4 [Uncensored L**ked],https://pic.javct.net/poster/20230205/1683257252.jpg,https://javct.net/v/nhdtb-771-rm,145,2026-06-14
HODV-21606-RM,Ultimate Masochist Wants To Be Trained So Pain Makes Her Cum. Kana Tanaka [Uncensored L**ked],https://pic.javct.net/poster/20212308/1630841975.jpg,https://javct.net/v/hodv-21606-rm,128,2026-06-14
SRS-060-RM,Bimbo Document Runa-chan (21) 3-year University Faculty Of Education File.03 [Uncensored L**ked],https://pic.javct.net/poster/05192026/485dd355d0.jpg,https://javct.net/v/srs-060-rm,135,2026-06-14
PXH-038-RM,"[Full Version] Amu Hanamiya, A Serious SEX With A G-cup Tall 172 Cm Tall, A Former Idol Who Charters A Godly AV Actress For One Day And Earnestly Instinctively Cum Shot Copulation [Uncensored L**ked]",https://pic.javct.net/poster/20212709/1635469231.jpg,https://javct.net/v/pxh-038-rm,130,2026-06-14
MVSD-699,"Hairy Ass, Dripping Intestinal Fluids, Gushing Anal Farts, Every Saturday She Leaves Her C**ld With Her Mother And Has A Wild Sex Marathon With Three Men, Works At A Call Center, A Fluffy, Slutty Mom Makes Her AV Debut With Anal Sex, Tsukino Midori",https://pic.javct.net/poster/05192026/bbad9daac0.jpg,https://javct.net/v/mvsd-699,170,2026-06-14
OFJE-593-RM,Ai Hongo Retirement S1 Complete 19 Works 15 Hours Box [Uncensored L**ked],https://pic.javct.net/poster/12082025/1767481403.jpg,https://javct.net/v/ofje-593-rm,930,2026-06-14
SDTH-010-RM,"Sex Is Always Better In The Raw! I Love To Fuck In The Raw! A Curious And Precocious Teenage Gal With An Immature Pussy Koenji ** Shopping District, Suginami City, Tokyo She's A Student At A Part-Time School, In Her 3rd Year, Class C Urara Uzuki (Not Her Real Name, 1* Years Old) *She May Not Look It, But She's A Barely Legal Babe With A Black Belt Who Is Ranked Number 1 In The Country In Karate She's Skipping Class To Make Her Adult Video Debut Continuous Injections Of Semen! [Uncensored L**ked]",https://static.javct.net/poster/1626783730.jpg,https://javct.net/v/sdth-010-rm,137,2026-06-14
DNJR-050-RM,"She Wants To Domme And I Want To Be Dominated. I Was Suddenly Transferred To My Company's Lingerie Division And Seeing Me So Flustered Awakened My Coworker's BDSM Instincts - She Started Hitting On Me At Work Under The Guise Of ""Showing Me The Ropes""... Ruka Inaba [Uncensored L**ked]",https://static.javct.net/poster/dnjr-050.jpg,https://javct.net/v/dnjr-050-rm,149,2026-06-14
SPRD-526-SUB,"My Stepmother, Is Way Better Than My Wife... Yoshie Fujisawa [English Subtitle]",https://pic.javct.net/poster/20212011/1640830423.jpg,https://javct.net/v/sprd-526-sub,115,2026-06-14
RCT-520-SUB,"The Beautiful Host Of ""You're The Father, You Should Know Your Daughter's Body!"" Riri Koda's Operation Surprise Fakecest Part 2. Father, Brother, The Whole Family Plays The Creampie Game Edition [English Subtitle]",https://pic.javct.net/poster/20221108/1663465069.jpg,https://javct.net/v/rct-520-sub,109,2026-06-14
ROYD-092-RM,My Super Horny Slut's Big Stepsister Is Cumming So Hard She's Spasming With Pleasure! My Friends Are Total Sexual Monsters ... Nanami Kawakami [Uncensored L**ked],https://pic.javct.net/poster/20221904/1653023612.jpg,https://javct.net/v/royd-092-rm,139,2026-06-14
HODV-21607-RM,(All POV) Rural Girls With Accents: Shizuoka Dialect Rin Kagura [Uncensored L**ked],https://pic.javct.net/poster/20212308/1630665334.jpg,https://javct.net/v/hodv-21607-rm,141,2026-06-14
JUL-608-SUB,My Friend's Mother Is A Prim And Proper Prude Yuko-san Turned Out To Be A Super Horny Bitch Who Will Suck My Semen So Hard My Balls Went Dry ... Yuko Shiraki [English Subtitle],https://static.javct.net/poster/jul-608.jpg,https://javct.net/v/jul-608-sub,150,2026-06-14
DVAJ-349-SUB,"My Stepsister Lets Me Put The First 3 cm In, Just Barely Not Fakecest Nanami Kawakami [English Subtitle]",https://pic.javct.net/poster/20220406/1656313947.jpg,https://javct.net/v/dvaj-349-sub,125,2026-06-14
JUL-608-RM,My Friend's Mother Is A Prim And Proper Prude Yuko-san Turned Out To Be A Super Horny Bitch Who Will Suck My Semen So Hard My Balls Went Dry ... Yuko Shiraki [Uncensored L**ked],https://static.javct.net/poster/jul-608.jpg,https://javct.net/v/jul-608-rm,150,2026-06-14
SPRD-526-RM,"My Stepmother, Is Way Better Than My Wife... Yoshie Fujisawa [Uncensored L**ked]",https://pic.javct.net/poster/20212011/1640830423.jpg,https://javct.net/v/sprd-526-rm,115,2026-06-14
XVSR-228-RM,Yui Hatano-festival Four Hours Of The World [Uncensored L**ked],https://pic.javct.net/poster/06032026/1775620431.jpg,https://javct.net/v/xvsr-228-rm,240,2026-06-14
ROE-054-SUB,"After Everyone Else Had Already Left The Nest, I Spent My Days With My Stepmom, Luxuriating In Lust ... Yuka Mizuno [English Subtitle]",https://pic.javct.net/poster/20221202/1647623753.jpg,https://javct.net/v/roe-054-sub,131,2026-06-14
OBA-065-RM,"After Fighting, Stepmother And Son Make Up with Fakecest: Chiaki Takeshita [Uncensored L**ked]",https://pic.javct.net/poster/20221202/1646291530.jpg,https://javct.net/v/oba-065-rm,115,2026-06-14
JUFE-317-RM,"My Wife Went To Visit Her Hometown For 7 Days, Leaving Me All Alone With My Stepdaughter - Who Sure Is Growing! A Record Of How She Whipped Out Her Colossal Tits, Sweat-Slicked And Bouncing While We Banged Until She Told Me She Loved Me Rena Momozono [Uncensored L**ked]",https://static.javct.net/poster/jufe-317.jpg,https://javct.net/v/jufe-317-rm,155,2026-06-14
FSDSS-991-SUB,"The First Raw Creampie Sheds, Her First Pleasure, So It Feels So Good, Convulses, Screams, And Big Orgasm Sex! Yoshizawa Ria [English Subtitle]",https://pic.javct.net/poster/20253001/1740845973.jpg,https://javct.net/v/fsdss-991-sub,120,2026-06-14
ABF-359-RM,"The Best Woman Who's Crazy About Me. -Male-centered, Unprotected Sex With Ejaculation Inside- Nonoura Dan [Uncensored L**ked]",https://pic.javct.net/poster/05192026/2926ef2143.jpg,https://javct.net/v/abf-359-rm,130,2026-06-14
MFYD-154-RM,"After A Period Of Abstinence Before A Bodybuilding Competition, The Muscular Wife's Libido Explodes During Hard, Muscle-shattering Orgasmic Sex! Sweaty, Gushing, And Bodily Fluids Flowing Like Crazy During This Fuck!! [Uncensored L**ked]",https://pic.javct.net/poster/05192026/36e1dfda37.jpg,https://javct.net/v/mfyd-154-rm,120,2026-06-14
EC-121-RM,Hundred Flower Demon Leverage Nishina [Uncensored L**ked],https://pic.javct.net/poster/05192026/ee6d903a72.jpg,https://javct.net/v/ec-121-rm,120,2026-06-14
DVMM-410-RM,"Documentary About A Working Woman's AV Debut: Akari (21 Years Old), The No. 1 Hostess At A High-class Club. With Her Translucent Skin, Moist Eyes, And Lustrous Hair, This Perverted Beauty Who Loves Fellatio And Cum Swallowing Makes Her One-time AV Debut. [Uncensored L**ked]",https://pic.javct.net/poster/05192026/43477d3e0d.jpg,https://javct.net/v/dvmm-410-rm,145,2026-06-14
SDAB-143-RM,Beyond The Limit To Go Crazy. Climax Convulsions Ikuiku Squirting Sense Development! !! Hasumiten [Uncensored L**ked],https://pic.javct.net/poster/05192026/a8fd47fad3.jpg,https://javct.net/v/sdab-143-rm,135,2026-06-14
FOCS-081-RM,Rookie Virgin Until Last Month! After The First H Sexual Desire Runaway And Masturbation 16 Times A Week! !! Muchimuchi Nursery Teacher Apprentice AV Debut Sora Shirasaka [Uncensored L**ked],https://pic.javct.net/poster/20220707/1659678998.jpg,https://javct.net/v/focs-081-rm,120,2026-06-14
DVDMS-959-RM,Impatient With A Month Of Abstinence ... Sexual Instinct Beyond The Limit Is Awakened! Ultimate Acme FINAL Yuuri Aoi [Uncensored L**ked],https://pic.javct.net/poster/20230205/1685681922.jpg,https://javct.net/v/dvdms-959-rm,150,2026-06-14
300MIUM-808-RM,"[Sperm drinking lewd daughter] Favorable MAX, it feels like a futuristic, and it is weak against pushing. [Uncensored L**ked]",https://pic.javct.net/poster/20221202/1647541009.jpg,https://javct.net/v/300mium-808-rm,144,2026-06-14
CSPL-017-RM,4K Revolution Dere Cute But... Can't Stop Akari Minase [Uncensored L**ked],https://pic.javct.net/poster/20230206/1687060380.jpg,https://javct.net/v/cspl-017-rm,64,2026-06-14
YAKO-041-RM,"""Wow, It's A Pleasure To Have A Man's Face Bukkake!"" Pure Slut Temperament Gal Bitch Senakichi [Uncensored L**ked]",https://pic.javct.net/poster/20230206/1686539505.jpg,https://javct.net/v/yako-041-rm,114,2026-06-14
FONE-157-RM,Dangerous Swastika Outdoor Exposure Cum Swallowing Devilish Cheeky Chibi Gal Chanmio [Uncensored L**ked],https://pic.javct.net/poster/20230205/1685158197.jpg,https://javct.net/v/fone-157-rm,119,2026-06-14
SYKH-192,A Leather-clad Woman With Dazzlingly Beautiful Legs; Seductive Legs That Bewitch Men; Honami Hazuki,https://pic.javct.net/poster/05192026/b16a8ebb78.jpg,https://javct.net/v/sykh-192,120,2026-06-14
BGN-043-RM,[Reducing Mosaic] Newcomer Prestige Exclusive Debut Mr. Akira Okada [Uncensored L**ked],https://static.javct.net/poster/bgn-043.jpg,https://javct.net/v/bgn-043-rm,200,2026-06-14
DVMM-410,"Documentary About A Working Woman's AV Debut: Akari (21 Years Old), The No. 1 Hostess At A High-class Club. With Her Translucent Skin, Moist Eyes, And Lustrous Hair, This Perverted Beauty Who Loves Fellatio And Cum Swallowing Makes Her One-time AV Debut.",https://pic.javct.net/poster/05192026/43477d3e0d.jpg,https://javct.net/v/dvmm-410,145,2026-06-14
EMTH-262,Plump And Voluptuous Women 5-Hour 30-Minute Extended Special: Kneading And Cumming Inside Their Bountiful Breasts! A Thorough Sex Documentary Of 8 Voluptuous Mature Women With Insatiable Sex Drives,https://pic.javct.net/poster/05192026/b6aeb240c8.jpg,https://javct.net/v/emth-262,330,2026-06-14
MCSR-066-RM,Out In The Afternoon Do Not Know Her Husband Apartment Wife [Uncensored L**ked],https://pic.javct.net/poster/20220707/1658342770.jpg,https://javct.net/v/mcsr-066-rm,120,2026-06-14
NKKD-363-RM,"My Wife (30) Was Seduced By A Part-time Worker (20) At Her Workplace... → I'm So Upset, So Please Release This As An Adult Video. () [Uncensored L**ked]",https://pic.javct.net/poster/05192026/c553dc6df7.jpg,https://javct.net/v/nkkd-363-rm,140,2026-06-14
DLDSS-519,Suzume Oyado Mino Suzume,https://pic.javct.net/poster/05192026/e5f23636c4.jpg,https://javct.net/v/dldss-519,181,2026-06-14
CLUB-454-RM,Farewell Party Of My Wife Who Left Off From Work Life My Beloved Bride Was Drunk By Alcohol And Was Brought To Sleep By The Company's Boss And Colleagues.Part 8 [Uncensored L**ked],https://pic.javct.net/poster/20230207/1689006396.jpg,https://javct.net/v/club-454-rm,230,2026-06-14
FPRE-236-RM,I'm My Father-in-law's Kissing Slave Until You Leave Work... Ebizaki Ao [Uncensored L**ked],https://pic.javct.net/poster/05192026/29df0e19bc.jpg,https://javct.net/v/fpre-236-rm,130,2026-06-14
ATYA-042,"A Responsible, Busty Gal Wife Takes On A Real Sex Shoot To Spite Her Cheating Husband... And Falls Into The Sticky Mating Of A Virile Old Man! Niwa Sae",https://pic.javct.net/poster/05192026/7b116df12b.jpg,https://javct.net/v/atya-042,120,2026-06-14
MYBA-095,A Married Woman's Petal-flipping - Kazu Takashima,https://pic.javct.net/poster/05192026/96fd291f6a.jpg,https://javct.net/v/myba-095,100,2026-06-14
EYAN-224-RM,"A Visiting Nurse Supporting Remote Islands; In Her Sixth Year Of Weekend Marriage; A Nurse On A Remote Island Can't Say No. Suzuka Yamashina, 27 Years Old. [Uncensored L**ked]",https://pic.javct.net/poster/05192026/8391ec9661.jpg,https://javct.net/v/eyan-224-rm,140,2026-06-14
JGAHO-033-RM,Friend Wife Obscene Tutor Nara Emiko [Uncensored L**ked],https://pic.javct.net/poster/05192026/69d58c4c83.jpg,https://javct.net/v/jgaho-033-rm,100,2026-06-14
FC2PPV-4916193,"[Uncensored x Personal Shooting] **pyjpx*jsps A beautiful wife in her 30s who is suffering from her husband's friend's ***** victim, and in return for her help, she returns the favor with a body of outstanding style.The extent of the affair of this young wife with a strong sexual desire is amazing.",https://pic.javct.net/poster/05192026/b9b755af9c.jpg,https://javct.net/v/fc2ppv-4916193,62,2026-06-14
DANDYA-037,Just 3cm From Her Crotch! A Seductive Massage Girl Who Brings Her Face So Close To Yours During A 69 Position That You Can Feel The Heat From Her Genitals. VOL.4,https://pic.javct.net/poster/05192026/e8dfa5d630.jpg,https://javct.net/v/dandya-037,226,2026-06-14
CLUB-455-RM,Lower-body Touch NG's Sekikaba Captures The Actual Situation Of Vulgar Customers Who Sk**lfully Wards Girls Who Enter The Store And Went Through The Production!Five [Uncensored L**ked],https://pic.javct.net/poster/05192026/0f9ba9a6c1.jpg,https://javct.net/v/club-455-rm,210,2026-06-14
GEBB-046,"Yukata Sleep R**e, Drug-induced Sex Aphrodisiac",https://pic.javct.net/poster/05192026/349a8c2743.jpg,https://javct.net/v/gebb-046,155,2026-06-14
NKKD-363,"My Wife (30) Was Seduced By A Part-time Worker (20) At Her Workplace... → I'm So Upset, So Please Release This As An Adult Video. ()",https://pic.javct.net/poster/05192026/c553dc6df7.jpg,https://javct.net/v/nkkd-363,140,2026-06-14
CLUB-452-RM,Yareru Married Crown Massage 19 Cum Inside Negotiation Voyeurism [Uncensored L**ked],https://pic.javct.net/poster/20230207/1689006334.jpg,https://javct.net/v/club-452-rm,230,2026-06-14
SCOP-617,"Handjob, Pinsaro, Deriheru, Sexual Feeling, Rejuvenated Beauty Japanese Customs 風 (Infinity) The World's Best Erotic Culture Gathers Here! ! Charisma Customs Proclivity 50 People And Gachi Production 4 Hours BEST Heisei's Total Settlement SP",https://pic.javct.net/poster/05192026/628f6b65bd.jpg,https://javct.net/v/scop-617,240,2026-06-14
JKSR-710-RM,Girls' Dorm Sex 5 Hours BEST 9 J○ Creampie Reality [Uncensored L**ked],https://pic.javct.net/poster/05192026/ba6dd04795.jpg,https://javct.net/v/jksr-710-rm,300,2026-06-14
SKMJ-405-RM,Voyeur Instructor Of Business Trip Personal Training Big Penis SEX Negotiations With A Trained Tight Man [Uncensored L**ked],https://pic.javct.net/poster/20230207/1689324567.jpg,https://javct.net/v/skmj-405-rm,223,2026-06-14
