code,title,image_url,page_url,views,date_scraped
EBOD-228-SUB,[Uncensored] Dutiful Mother Tia [English Subtitle],https://static.javct.net/poster/ebod-228.jpg,https://javct.net/v/ebod-228-sub,119,2026-06-03
GVG-781-RM,A Man Wants His Mother-In-Law's Obscene Tits. Eri Takigawa [Uncensored L**ked],https://pic.javct.net/poster/20212709/1632995722.jpg,https://javct.net/v/gvg-781-rm,120,2026-06-03
XVSR-153-RM,"Erotic Novel, Stepmom Is 19-Year-Old Widow, Ecstatic Tears Of Joy, Suzu Harumiya [Uncensored L**ked]",https://pic.javct.net/poster/20220406/1655917797.jpg,https://javct.net/v/xvsr-153-rm,116,2026-06-03
OBA-381-RM,Cougar Hunter Vol. 2!! My Stepson is Amazing in Bed... Ayaka Makimura [Uncensored L**ked],https://pic.javct.net/poster/20221202/1646614728.jpg,https://javct.net/v/oba-381-rm,141,2026-06-03
SPRD-870-RM,Surrogate Mama Shihori Endo [Uncensored L**ked],https://pic.javct.net/poster/20212011/1641000918.jpg,https://javct.net/v/sprd-870-rm,116,2026-06-03
SPRD-1242-RM,The Surrogate Mother Mio Morishita [Uncensored L**ked],https://pic.javct.net/poster/20212011/1640918548.jpg,https://javct.net/v/sprd-1242-rm,123,2026-06-03
SPRD-1260-SUB,"Dear Stepmom, I, I Like You Better Than My Wife... Iroha Fukuyama [English Subtitle]",https://pic.javct.net/poster/20212011/1637801865.jpg,https://javct.net/v/sprd-1260-sub,106,2026-06-03
VENU-740-RM,This Stepmother And Son Will Start Fucking 2 Seconds After Stepdaddy Leaves For Work Kana Morisawa [Uncensored L**ked],https://pic.javct.net/poster/20221202/1645061130.jpg,https://javct.net/v/venu-740-rm,113,2026-06-03
AUKG-511-RM,"A Wife And Her Mother-In-Law Became Lesbian Lovers - This Horny Stepmom Fucked Her Daughter-In-Law After Watching Her Prancing Around With Her Guard Down, Flashing Panty Shot Action At Her Alice Otsu Shuri Yamaguchi [Uncensored L**ked]",https://static.javct.net/poster/aukg-511.jpg,https://javct.net/v/aukg-511-rm,121,2026-06-03
SPRD-1392-RM,Creampie Relations With My Kind Step Mother... Emi Toda [Uncensored L**ked],https://pic.javct.net/poster/20212011/1637462437.jpg,https://javct.net/v/sprd-1392-rm,108,2026-06-03
JUL-705-RM,After The Graduation Ceremony ... Your Stepmom Is Giving You A Gift To Celebrate Your Entry Into Adulthood ... A Madonna Label Exclusive Beautiful Mature Woman Actress Is Celebrating Your Launch Into The Real World With Her Alluring Eroticism. Maki Hojo [Uncensored L**ked],https://pic.javct.net/poster/20212308/1631256467.jpg,https://javct.net/v/jul-705-rm,124,2026-06-03
GVH-364-RM,"Son-In-Law Aiming For His Mother-In-Law's Too-Sexy Big Titties, With Kyoko Ichikawa [Uncensored L**ked]",https://pic.javct.net/poster/20212011/1644641824.jpg,https://javct.net/v/gvh-364-rm,120,2026-06-03
VENU-088-RM,Magic Mother: Taking Advantage Of Mom's Body While Daddy Is Not Home Asuka Yuki [Uncensored L**ked],https://pic.javct.net/poster/20220406/1656526601.jpg,https://javct.net/v/venu-088-rm,82,2026-06-03
JUL-673-RM,I Was Forbidden To Masturbate When My Wife Was Pregnant So I had Sex With My Mother-In-Law Maki Hojo [Uncensored L**ked],https://static.javct.net/poster/jul-673.jpg,https://javct.net/v/jul-673-rm,120,2026-06-03
ADN-165-US,"Forbidden Immoral Sex 3 An Excessively Young Mother-In-Law Saeko Matsushita [English Subtitle, Reducing Mosaic]",https://pic.javct.net/poster/20221202/1646177501.jpg,https://javct.net/v/adn-165-us,114,2026-06-03
SDMU-673-RM,SOD Romance x French Publishing Living Together I'm A Spoiled Brat Living With My Stepmom Sumire Shiraishi [Uncensored L**ked],https://pic.javct.net/poster/20221202/1648868830.jpg,https://javct.net/v/sdmu-673-rm,129,2026-06-03
SPRD-644-RM,"My Stepmother, Is Way Better Than My Wife... Mari Yonezaki [Uncensored L**ked]",https://pic.javct.net/poster/20212011/1641519219.jpg,https://javct.net/v/sprd-644-rm,115,2026-06-03
SPRD-1484-RM,"Step-mother-in-law, You're Much Better Than My Wife... Iori Nanase [Uncensored L**ked]",https://pic.javct.net/poster/20212011/1637815526.jpg,https://javct.net/v/sprd-1484-rm,139,2026-06-03
JUL-645-RM,Horny Pregnant Stepmom Rides My Cock For A Creampie Behind The Old Man's Back Ai Mukai [Uncensored L**ked],https://static.javct.net/poster/jul-645.jpg,https://javct.net/v/jul-645-rm,124,2026-06-03
SPRD-993-RM,"Dear Stepmom, You're Much Better Than My Wife... Azusa Yagi [Uncensored L**ked]",https://pic.javct.net/poster/20212011/1640980073.jpg,https://javct.net/v/sprd-993-rm,124,2026-06-03
JUY-418-RM,This Stepmom Has Been Hungering For Her Son-In-Law's Big Cock 24 Hours A Day And Tempting Him To Taste Her Pussy Momoko Isshiki [Uncensored L**ked],https://pic.javct.net/poster/20221202/1647328046.jpg,https://javct.net/v/juy-418-rm,145,2026-06-03
JUY-751-RM,"Day And Night, I Crave My Daughter's Husband's Giant Cock Seduced By The Mother-In-Law Yuko Shiraki [Uncensored L**ked]",https://pic.javct.net/poster/20212709/1632936029.jpg,https://javct.net/v/juy-751-rm,168,2026-06-03
JUY-268-RM,A Passion Drenched Afternoon Mother In Law and Son's Unforgivable Act of Depravity Maki Tomoda [Uncensored L**ked],https://pic.javct.net/poster/20212011/1643684288.jpg,https://javct.net/v/juy-268-rm,119,2026-06-03
JUL-469-RM,"All Alone With My Hot Stepmom During A Power Outage... It All Started By Accident, But It Led To An Indecent Creampie Relationship. Yuko Shiraki [Uncensored L**ked]",https://pic.javct.net/poster/20212011/1637859383.jpg,https://javct.net/v/jul-469-rm,117,2026-06-03
FOCS-065-RM,AV Debut With G-Cup Big Tits. Beautiful Pale Skin And Beautiful Tits. Showing Her Inner Self Laid Completely Bare. Ruka Matsumoto [Uncensored L**ked],https://pic.javct.net/poster/20221202/1650012262.jpg,https://javct.net/v/focs-065-rm,124,2026-06-03
DFE-059-RM,A Middle-Aged Cherry Boy If I Could Be Reborn ... I Would Like To Be Born Again As A Cherry Boy. Chiharu Miyazawa [Uncensored L**ked],https://pic.javct.net/poster/20221202/1645866649.jpg,https://javct.net/v/dfe-059-rm,148,2026-06-03
SENN-006-RM,Nurse Kirishima Has Hard Sex With A Runaway Patient - Reona Kirishima [Uncensored L**ked],https://pic.javct.net/poster/20221202/1648380658.jpg,https://javct.net/v/senn-006-rm,47,2026-06-03
HODV-21595-RM,"The Stepbrother Of My Husband Licks Me Again And Again Until I Fall For Him, All While Hiding From My Husband. Kanna Hirai [Uncensored L**ked]",https://static.javct.net/poster/hodv-21595.jpg,https://javct.net/v/hodv-21595-rm,118,2026-06-03
ROYD-075-RM,Sex Life Together with Your Too Vulnerable Big-Titted Younger Stepsister in an Extremely Cramped Studio Apartment With No Place to Look Away. Mei Satsuki [Uncensored L**ked],https://pic.javct.net/poster/20212709/1637307416.jpg,https://javct.net/v/royd-075-rm,124,2026-06-03
FNS-223-RM,"Abstinence Release Document: 30 Days Of Sex And Masturbation Ban, And The Beast's Sexual Desire Is Completely Raised And Released In 120 Minutes Yayoi Hamabe [Uncensored L**ked]",https://pic.javct.net/poster/05192026/b64fcf5ff9.jpg,https://javct.net/v/fns-223-rm,145,2026-06-03
FNS-223,"Abstinence Release Document: 30 Days Of Sex And Masturbation Ban, And The Beast's Sexual Desire Is Completely Raised And Released In 120 Minutes Yayoi Hamabe",https://pic.javct.net/poster/05192026/b64fcf5ff9.jpg,https://javct.net/v/fns-223,145,2026-06-03
NSFS-007-SUB,Mature Stepmother 12  The Stepson Who Loved His Stepmother  Yuri Tadokoro [English Subtitle],https://static.javct.net/poster/nsfs-007.jpg,https://javct.net/v/nsfs-007-sub,116,2026-06-03
DFE-057-RM,I Am Eating Up This Young Girl. Rena Usami [Uncensored L**ked],https://pic.javct.net/poster/20212011/1640778896.jpg,https://javct.net/v/dfe-057-rm,123,2026-06-03
XVSR-621-RM,Ichika Matsumoto Binaural Sex Film! Ichika Matsumoto [Uncensored L**ked],https://pic.javct.net/poster/20212709/1635632986.jpg,https://javct.net/v/xvsr-621-rm,118,2026-06-03
GVG-801-RM,A Sexy Weather Girl Elder Sister And Her Bad Boys Mari Takasugi [Uncensored L**ked],https://pic.javct.net/poster/20212011/1643623764.jpg,https://javct.net/v/gvg-801-rm,136,2026-06-03
ROYD-074-RM,My Gentle and Cute C**ldhood Friend Spoils Me By Supporting With Depressed Me. Karen Asahina [Uncensored L**ked],https://pic.javct.net/poster/20212709/1637307475.jpg,https://javct.net/v/royd-074-rm,173,2026-06-03
FOCS-064-RM,"Extremely Slutty Drooling Woman!! Raunchy Sex With Deep Kissing And Nipple Licking, Yuuka Waraku [Uncensored L**ked]",https://pic.javct.net/poster/20221202/1650012332.jpg,https://javct.net/v/focs-064-rm,124,2026-06-03
DFE-058-RM,My Stepdaughter Provides For Me. Kurumi Iketani. [Uncensored L**ked],https://pic.javct.net/poster/20212011/1643450735.jpg,https://javct.net/v/dfe-058-rm,128,2026-06-03
VENU-169-RM,Fakecest with My Hot Ass Mother Miki Sato [Uncensored L**ked],https://pic.javct.net/poster/20220707/1657755619.jpg,https://javct.net/v/venu-169-rm,81,2026-06-03
HODV-21590-RM,[Full POV] Girls Speaking In Dialect: The Hiroshima Dialect - Ai Tsubakino [Uncensored L**ked],https://static.javct.net/poster/hodv-21590.jpg,https://javct.net/v/hodv-21590-rm,133,2026-06-03
URLH-016-RM,Super Tempted By Tits Fresh Face Sex Hostess Princess Rika Aimi [Uncensored L**ked],https://pic.javct.net/poster/20221108/1660691043.jpg,https://javct.net/v/urlh-016-rm,155,2026-06-03
TYSF-006-RM,"Mina Kitano (A Horny Slut) Is Conducting A Physical, Hands-On Sex Club Undercover Report She's Using Her Horny, Raw P*ssy And Letting It Run Wild For A Fucking Good Time (A Premeditated Crime) [Uncensored L**ked]",https://pic.javct.net/poster/20221202/1646375191.jpg,https://javct.net/v/tysf-006-rm,204,2026-06-03
DLDSS-503-RM,"Today Is My Rest Wife Day. ""Can Such An Old Woman In Her 40s Still Be Able To Appear In An AV?"" Real Married Woman Saki Ishida 46 Years Old AV Debut [Uncensored L**ked]",https://pic.javct.net/poster/05192026/1167a2e7a8.jpg,https://javct.net/v/dldss-503-rm,175,2026-06-03
DLDSS-503,"Today Is My Rest Wife Day. ""Can Such An Old Woman In Her 40s Still Be Able To Appear In An AV?"" Real Married Woman Saki Ishida 46 Years Old AV Debut",https://pic.javct.net/poster/05192026/1167a2e7a8.jpg,https://javct.net/v/dldss-503,175,2026-06-03
FMDL-009-RM,Super wide open legs oops! Jupojubo PtoM Sesame Ko Blow Ichika Matsumoto [Uncensored L**ked],https://pic.javct.net/poster/12082025/1767514045.jpg,https://javct.net/v/fmdl-009-rm,120,2026-06-03
FOCS-061-RM,"Short Stature 146cm For An AV Debut. That's The Height Minimum, But She Aspires To Do An AV While Her Sex Drive Is Surging. Tsukushi Yuzuki [Uncensored L**ked]",https://pic.javct.net/poster/20221202/1650012539.jpg,https://javct.net/v/focs-061-rm,124,2026-06-03
ROYD-071-RM,"My Step-sister Is Modest And Reserved, But When She Takes Her Glasses Off She's An Irresistible Beauty, Leading To Raw Fucking And A First-ever Creampie Between Her Thighs. Alice Nanase [Uncensored L**ked]",https://pic.javct.net/poster/20212709/1634886758.jpg,https://javct.net/v/royd-071-rm,161,2026-06-03
VENX-047-RM,"Stepmom Tempts Her Stepson Whith Whispers, So His Father Does Not Notice - Chitose Yuki [Uncensored L**ked]",https://static.javct.net/poster/1623493447.jpg,https://javct.net/v/venx-047-rm,116,2026-06-03
YMDS-286,"Machiapu raw Naka-chan! Even though she looks naked, she is pure in nature. Raw sex and creampie strategy for high-ranking girls - Continuous orgy creampie edition",https://pic.javct.net/poster/05192026/2acb71a004.jpg,https://javct.net/v/ymds-286,83,2026-06-03
AKDL-041-RM,"[Bakata Erotic Video] ""What!? In a place like this!!"" A thrilling secret blowjob that must never be found out [Uncensored L**ked]",https://pic.javct.net/poster/04112026/1776313046208.jpg,https://javct.net/v/akdl-041-rm,124,2026-06-03
DANDYA-041-RM,"Alone With A Busty Lady In A Mixed-gender Hot Spring Where Towels Are Prohibited! ""Excuse Me, Your Nipples Are Showing,"" She Said. Her Large Breasts, Which She Couldn't Completely Hide With Her Hands, Made Me Hard, And Then She Had Sex With Me. [Uncensored L**ked]",https://pic.javct.net/poster/05192026/63771e55de.jpg,https://javct.net/v/dandya-041-rm,231,2026-06-03
BABD-005-RM,005 Reina Murase Reina [Uncensored L**ked],https://pic.javct.net/poster/20230206/1688186883.jpg,https://javct.net/v/babd-005-rm,140,2026-06-03
HUNTB-628-RM,"A Training Camp License In The Countryside Is In A State Of Eating With A Matching App! I Didn't Get Matched With Anyone In The City, But I Got Matched With A Super Cute Girl With The Same Training Camp License! [Uncensored L**ked]",https://pic.javct.net/poster/20230207/1688705265.jpg,https://javct.net/v/huntb-628-rm,190,2026-06-03
MADM-169-RM,Order Immediately When You Want To Fuck A Slutty Married Woman Hibiki Otsuki Aiming For A Deliveryman Who Comes To The House [Uncensored L**ked],https://pic.javct.net/poster/20230206/1687579277.jpg,https://javct.net/v/madm-169-rm,110,2026-06-03
HUNTB-641-RM,"""Don't Look Like That!"" My Sister-in-law Wanders Around The House Wearing My School Jersey And Sexy Underwear. It's Too Erotic And Full Erection When You're Dressed Half-heartedly! Moreover [Uncensored L**ked]",https://pic.javct.net/poster/20230207/1691126225.jpg,https://javct.net/v/huntb-641-rm,150,2026-06-03
REAL-565-RM,Demon Fucking Hell Kazama Yumi [Uncensored L**ked],https://pic.javct.net/poster/06032026/1775524171.jpg,https://javct.net/v/real-565-rm,115,2026-06-03
FC2PPV-4912083,☆4 ejaculations☆ E cup beautiful big breasted nursery teacher (20) Squirting SEX in agony with great excitement due to the big thick penis that reaches deep inside,https://pic.javct.net/poster/05192026/83e75fd418.jpg,https://javct.net/v/fc2ppv-4912083,93,2026-06-03
FC2PPV-4904844,"This month's No. 1 nomination: I had sex with Miss Menes, a top-class technician who heals both body and soul, and an overwhelming visual [Uncensored creampie]",https://pic.javct.net/poster/05192026/d030285281.jpg,https://javct.net/v/fc2ppv-4904844,63,2026-06-03
AGMX-263-RM,The Thrill And Excitement Of Attacking A Woman While She's Sleeping Soundly. [Uncensored L**ked],https://pic.javct.net/poster/05192026/ef4e75f5a9.jpg,https://javct.net/v/agmx-263-rm,119,2026-06-03
FC2PPV-4912532,"[Amateur] Although he usually works as a cooking teacher, he was a pervert who was completely busy behind the scenes.",https://pic.javct.net/poster/05192026/81b561ad2e.jpg,https://javct.net/v/fc2ppv-4912532,80,2026-06-03
FC2PPV-4911975,Training record of a super masochist beauty... A small fry who cums without her master's permission. Her rationality collapses with a punishing demon piston.,https://pic.javct.net/poster/05192026/f2e4c01944.jpg,https://javct.net/v/fc2ppv-4911975,49,2026-06-03
FC2PPV-4909893,"[No] After all, she is a lewd beauty with a fully open face. Her petite body suits her in a school swimsuit costume. The way she opens her mouth wide and sticks out her tongue makes me gulp and cum inside her. *Bonus High resolution",https://pic.javct.net/poster/05192026/1ccf928a6f.jpg,https://javct.net/v/fc2ppv-4909893,51,2026-06-03
FC2PPV-4909662,[Individual video] Creampie in standing doggy style with a slender convenience store clerk with drooping breasts,https://pic.javct.net/poster/05192026/e00566b3e0.jpg,https://javct.net/v/fc2ppv-4909662,20,2026-06-03
DGRE-001-RM,Throat Attribute Shablist Minohara Honoka [Uncensored L**ked],https://pic.javct.net/poster/05192026/a0632fb923.jpg,https://javct.net/v/dgre-001-rm,120,2026-06-03
10-060226-01,Asia Girl's Portrait Collection: Yuna,https://pic.javct.net/poster/05192026/62b9007cea.jpg,https://javct.net/v/10-060226-01,78,2026-06-03
FC2PPV-4911951,"[Selected beauty] G cup super beautiful half model First time in life without pill, direct uterine creampie, limited release treasured video",https://pic.javct.net/poster/05192026/4110e124ab.jpg,https://javct.net/v/fc2ppv-4911951,29,2026-06-03
PA-060226-100,The Naughty Housekeeper Who Drives Men Wild,https://pic.javct.net/poster/05192026/791cc77369.jpg,https://javct.net/v/pa-060226-100,55,2026-06-03
DVMM-016-RM,Lifting Of The Ban On Appearance! ! Magic Mirror Flight A Neat And Dignified Beauty Staff Working At A Top-Class Department Store Her First Jubo Jubo Vacuum No Handjob Edition Vol.02 Total 12 Shots! All 6 SEX Special! ! God Blow SEX That An Elegant Older Sister Sucks Ji ○ Port With Her Heart [Uncensored L**ked],https://pic.javct.net/poster/20230908/1694752828.jpg,https://javct.net/v/dvmm-016-rm,245,2026-06-03
1P-060226-001,The Talk of the Town: That Girls' Bar—The Reality of the Easy-to-Get Hostesses,https://pic.javct.net/poster/05192026/fa24dbc14c.jpg,https://javct.net/v/1p-060226-001,64,2026-06-03
HZ-3862,Beauty Collection Vol.123 - Nozomi Hamada,https://pic.javct.net/poster/05192026/95ba95d267.jpg,https://javct.net/v/hz-3862,61,2026-06-03
JUX-930-RM,When My Wife Sparkles With Lust... Nene [Uncensored L**ked],https://pic.javct.net/poster/20222109/1665934712.jpg,https://javct.net/v/jux-930-rm,119,2026-06-03
VIPR-076-RM,Erica Sato Invades A Shady AV Shoot!! Erika Sato [Uncensored L**ked],https://pic.javct.net/poster/04112026/e3714f871a.jpg,https://javct.net/v/vipr-076-rm,60,2026-06-03
VIPR-078-RM,Dripping Wet Daydream Theater. Erika Sato . [Uncensored L**ked],https://pic.javct.net/poster/04112026/0f1129f2c2.jpg,https://javct.net/v/vipr-078-rm,59,2026-06-03
FOCS-048-RM,"38"" G-Cup Colossal Tits X 5'8"" Tall Crazy Girl With A Miraculously Slender Body - The Greatest Hard Rock Creampie Of Your Life Mira Sena [Uncensored L**ked]",https://pic.javct.net/poster/20212011/1644570879.jpg,https://javct.net/v/focs-048-rm,118,2026-06-03
VIPR-066-RM,BODY TO BODY Erika Sato [Uncensored L**ked],https://pic.javct.net/poster/04112026/81b6116248.jpg,https://javct.net/v/vipr-066-rm,58,2026-06-03
EKW-080-RM,"Today, I Want Her To Jack Me Off. An Mitsumi [Uncensored L**ked]",https://pic.javct.net/poster/20221904/1653628260.jpg,https://javct.net/v/ekw-080-rm,120,2026-06-03
JUY-865-RM,Madonna Exclusive Hot Mature Woman!! Married Woman's Lust Fuck Dripping With Immorality!! Husband Doesn't Know -My Dirty Lust And Secret- Maki Hojo [Uncensored L**ked],https://pic.javct.net/poster/20221904/1651553483.jpg,https://javct.net/v/juy-865-rm,119,2026-06-03
MIST-369-RM,With Kanami Miura At Night... Having Sex Like Crazy With A Beautiful Girl At Night. Kanami Miura [Uncensored L**ked],https://pic.javct.net/poster/20221202/1649322626.jpg,https://javct.net/v/mist-369-rm,150,2026-06-03
WKD-049-RM,Fallen Woman - Himari Kinoshita [Uncensored L**ked],https://pic.javct.net/poster/20212011/1641054004.jpg,https://javct.net/v/wkd-049-rm,52,2026-06-03
JUL-685-RM,31-day Abstinence Life: 3rd Document Showing The Explosive Desire Of A Married Woman Who Just Likes Dick Too Much!! Saori Nagashima [Uncensored L**ked],https://static.javct.net/poster/jul-685.jpg,https://javct.net/v/jul-685-rm,137,2026-06-03
SSIS-261-US,"Breast, Buttocks, Vagina, 171cm, Tasting The Best Style All Over Marin Hinata 's New World Of Acme [English Subtitle, Reducing Mosaic]",https://pic.javct.net/poster/20212011/1639118863.jpg,https://javct.net/v/ssis-261-us,145,2026-06-03
JUY-602-RM,"She Is Unfaithful With Her Clothes Still On, Full Tight Clothing Fuck. Reiko Sawamura [Uncensored L**ked]",https://pic.javct.net/poster/20220707/1660149537.jpg,https://javct.net/v/juy-602-rm,151,2026-06-03
KATU-090-RM,"Sexy Thick Thigh Job Makes You Want To Fuck 2, 5 Thick Dirty Miniskirt Sluts! [Uncensored L**ked]",https://pic.javct.net/poster/20212709/1634971908.jpg,https://javct.net/v/katu-090-rm,181,2026-06-03
FOCS-020-RM,Undiscovered Talent In Hakata! The 171cm Luxuriously Slender And Pure Beautiful Girl. A Lewd Sexual Extravaganza That Goes For 1 Night And 2 Days Without Sleep. Haru Yamaguchi [Uncensored L**ked],https://pic.javct.net/poster/20212308/1631874901.jpg,https://javct.net/v/focs-020-rm,123,2026-06-03
HBAD-619-RM,This Tall Erotic Wicked Woman Is Planning To Seduce A Rich Old Man And Knock Him Off And Clean Him Out Of All His Money But She Ends Up Getting Fucked Instead And Becoming His Sexy Slut. Mirai Sena. [Uncensored L**ked],https://pic.javct.net/poster/20221904/1650519375.jpg,https://javct.net/v/hbad-619-rm,110,2026-06-03
JUY-252-RM,My Big Sister-In-Law's Tight Peachy Ass Was Just Too Sexy... Maya Takeuchi [Uncensored L**ked],https://pic.javct.net/poster/20220406/1655379980.jpg,https://javct.net/v/juy-252-rm,118,2026-06-03
LULU-095-RM,"My Big Stepsister Was Working As A Model, And She Had Such A Beautiful Ass, I Could No Longer Resist, So I Gave Her A Furious Piston-Pounding Quickie, And Continued To Pour Creampie Cum Shots Into Her Ass. Himari Kinoshita [Uncensored L**ked]",https://pic.javct.net/poster/20212709/1633504868.jpg,https://javct.net/v/lulu-095-rm,148,2026-06-03
NGOD-151-RM,Woman At The Convenience Store Headquarters 6 - Chitose Yuki [Uncensored L**ked],https://static.javct.net/poster/ngod-151.jpg,https://javct.net/v/ngod-151-rm,122,2026-06-03
SONE-496-SUB,"After 15 years of dedication to high jumping, she has decided to retire! The world-famous beautiful medalist who can no longer fly is now an addictive sex slave for her sponsor's old man presidents, Kaede Fua [English Subtitle]",https://pic.javct.net/poster/20241115/1732244084.jpg,https://javct.net/v/sone-496-sub,160,2026-06-03
SDNM-515V-RM,"[Bonus Edition] 49 years old... The last spring of her life. 178cm tall, a wife with a model-like figure. AV DEBUT Sanae Kurihara [Uncensored L**ked]",https://pic.javct.net/poster/09052025/1761187138.jpg,https://javct.net/v/sdnm-515v-rm,233,2026-06-03
SSNI-753-SUB,Amu Hanamiya [English Subtitle],https://pic.javct.net/poster/07202025/1756095305.jpg,https://javct.net/v/ssni-753-sub,120,2026-06-03
HEY-218,"Office Ladies Compilation : Aoi Mizutani, Mayumi Hamada, Yu Nakano",https://pic.javct.net/poster/09052025/1759192423.jpg,https://javct.net/v/hey-218,180,2026-06-03
NAMH-042-RM,H-Cup Big Tits Newcomer [Uncensored L**ked],https://pic.javct.net/poster/09052025/1758090007.jpg,https://javct.net/v/namh-042-rm,107,2026-06-03
CR-060326-001,My Best Friend's Girlfriend Milks Me Dry with Her Incredible Cowgirl Sk**ls,https://pic.javct.net/poster/05192026/59b32004dd.jpg,https://javct.net/v/cr-060326-001,61,2026-06-03
MFCS-210,Nagisa,https://pic.javct.net/poster/05192026/379b969a55.jpg,https://javct.net/v/mfcs-210,68,2026-06-03
FC2PPV-4912071,"In Nijisanji, Anju Katrina is huge and beautiful, slender, fair-skinned, super slim body, and has slender legs. Nju masturbation edition",https://pic.javct.net/poster/05192026/cc9a243e69.jpg,https://javct.net/v/fc2ppv-4912071,52,2026-06-03
SIMO-018-RM,Mika [Uncensored L**ked],https://pic.javct.net/poster/05192026/0254ba72c8.jpg,https://javct.net/v/simo-018-rm,98,2026-06-03
START-550-RM,I started a polite life with Rui when I just started dating.Sometimes it's slow and sometimes it's a passionate sex life where I'm at the mercy of Rui Ichinomiya. [Uncensored L**ked],https://pic.javct.net/poster/05192026/f458a5436c.jpg,https://javct.net/v/start-550-rm,135,2026-06-03
FC2PPV-4909096,“It’s really bad. A former idol applied for her boyfriend (probably a host) who was in trouble with money.,https://pic.javct.net/poster/05192026/8b698a6424.jpg,https://javct.net/v/fc2ppv-4909096,54,2026-06-03
SIMO-018,Mika,https://pic.javct.net/poster/05192026/0254ba72c8.jpg,https://javct.net/v/simo-018,98,2026-06-03
865URKN-02001-RM,"[Erotic raw sex video with a beautiful, big-breasted, fair-skinned, and sexy lady with the strongest visuals] [She's so beautiful, but she's a slut with a happy gap for a blow job lover] [Her pink dick stands up, her beautiful breasts tremble, and she cums] Maina Yuri [Uncensored L**ked]",https://pic.javct.net/poster/05192026/65b4aaf72d.jpg,https://javct.net/v/865urkn-02001-rm,66,2026-06-03
CR-060226-001,Caribbebians: A body flushed and throbbing with pleasure,https://pic.javct.net/poster/05192026/3e9aebb716.jpg,https://javct.net/v/cr-060226-001,58,2026-06-03
DDH-418-RM,Yuzu & Natsumi [Uncensored L**ked],https://pic.javct.net/poster/05192026/26b51a790b.jpg,https://javct.net/v/ddh-418-rm,74,2026-06-03
SIMA-038-RM,It's bad [Uncensored L**ked],https://pic.javct.net/poster/05192026/2f3089c590.jpg,https://javct.net/v/sima-038-rm,54,2026-06-03
FMDL-012-RM,A must-see for girls! Full of erotic tech? GAL No.1 Grand Prix 2022 A special where a popular AV actress monitored a big breasted gal's private sex date! ! [Uncensored L**ked],https://pic.javct.net/poster/05192026/c58555f4a6.jpg,https://javct.net/v/fmdl-012-rm,220,2026-06-03
FC2PPV-4911943,"[None] [Female Body Sharing Chapter 18] A 176 cm model who cannot refuse when asked, has to be trained. Two men keep attacking her and train her in an intense 3P that makes her faint in agony [Overseas version] Bonus included",https://pic.javct.net/poster/05192026/f19a40e336.jpg,https://javct.net/v/fc2ppv-4911943,41,2026-06-03
XRW-674-RM,"Her Husband Was Deep In Debt, So She Got Fucked By A Stranger... Rina Otomi/Arisa Kawasaki/RISA [Uncensored L**ked]",https://pic.javct.net/poster/20222109/1664724806.jpg,https://javct.net/v/xrw-674-rm,174,2026-06-03
801SKEJ-072-RM,Sayuri (Beautiful busty housewife) [Uncensored L**ked],https://pic.javct.net/poster/05192026/8d63b23a4f.jpg,https://javct.net/v/801skej-072-rm,79,2026-06-03
MOND-249-RM,Longing Female Boss And Yuri Sasahara [Uncensored L**ked],https://pic.javct.net/poster/20230206/1687579155.jpg,https://javct.net/v/mond-249-rm,130,2026-06-03
FNS-211-RM,"""I'm going home because there's no last train!"" After a drinking party, two big-breasted bosses push me into the house and have close-up sandwich sex until morning Rin Yamitsu Jun Goddess [Uncensored L**ked]",https://pic.javct.net/poster/05192026/9936f3c10b.jpg,https://javct.net/v/fns-211-rm,229,2026-06-03
JUR-686-RM,"The Hidden True Nature Of Department Head Nanba, Who Always Belittles Her Subordinates. Revenge Training To Demote The Power-abusing Female Boss To My Personal Masochistic Slave. Nanba Akika [Uncensored L**ked]",https://pic.javct.net/poster/04112026/1776965948.jpg,https://javct.net/v/jur-686-rm,110,2026-06-03
