code,title,size,image_url,torrent_url,tags,actresses,date,page_url
HJMO713,舐めフェチ女子大生限定 ひょっとこフェラ連続射精ミッション 指定した射精回数をクリアできなければ即ズボ中出しの罰ゲーム,7.8 GB,https://pics.dmm.co.jp/mono/movie/adult/hjmo713/hjmo713pl.jpg,https://onejav.com/torrent/hjmo713/download/31057239/onejav.com_hjmo713.torrent,"Blow, Creampie, Female College Student, Huge Cock, Shame","月乃ことね, 望月りんね, Honoka Ashina, 若月もあ",2026-06-25,https://onejav.com/torrent/hjmo713
HBAD735,バイト先で知り合った欲求不満の変態ドM人妻とセフレになってヤリまくっています 芦名ほのか,3.9 GB,https://pics.dmm.co.jp/mono/movie/adult/1hbad735/1hbad735pl.jpg,https://onejav.com/torrent/hbad735/download/40690191/onejav.com_hbad735.torrent,Solowork,Honoka Ashina,2026-06-04,https://onejav.com/torrent/hbad735
AUKG650,巨乳美熟女セフレ調教 ～嫉妬に燃える愛欲監禁レズビアン～,5.0 GB,https://pics.dmm.co.jp/mono/movie/adult/aukg650/aukg650pl.jpg,https://onejav.com/torrent/aukg650/download/85546775/onejav.com_aukg650.torrent,"Big Tits, Confinement, Drama, Mature Woman","宇佐美すい, Honoka Ashina",2026-05-10,https://onejav.com/torrent/aukg650
DOKS673,顔面特化！アヘ顔四つん這い！,5.6 GB,https://pics.dmm.co.jp/mono/movie/adult/h_139doks673/h_139doks673pl.jpg,https://onejav.com/torrent/doks673/download/10441044/onejav.com_doks673.torrent,"Big Tits, Cuckold, Huge Butt, Lingerie, Masturbation, Older Sister, Other Fetish, Rolling Back Eyes, Fainting, Toy","雫月心桜, 立華静音, Honoka Ashina, 羽月乃蒼, 谷あづさ",2026-05-01,https://onejav.com/torrent/doks673
DOKS666,暗闇でこっそりバレずに射精へ誘う至福のスローフェラチオ（2）,4.9 GB,https://pics.dmm.co.jp/mono/movie/adult/h_139doks666/h_139doks666pl.jpg,https://onejav.com/torrent/doks666/download/15129228/onejav.com_doks666.torrent,"Big Tits, Blow, Breasts, Older Sister, Slut","羽月乃蒼, 谷あづさ, Honoka Ashina, 立華静音, 雫月心桜",2026-03-18,https://onejav.com/torrent/doks666
DOKS668,精子バンクに志願したら超優良提供者と認定され、目の色が変わった女医やナースに枯れ果てるまでザーメンを強●採取された非モテの僕,5.6 GB,https://pics.dmm.co.jp/mono/movie/adult/h_139doks668/h_139doks668pl.jpg,https://onejav.com/torrent/doks668/download/08175523/onejav.com_doks668.torrent,"Creampie, Female Doctor, Harem, Nurse, Slut","谷あづさ, Honoka Ashina, 羽月乃蒼",2026-03-18,https://onejav.com/torrent/doks668
NSFS461,性犯罪白書 ～ある女性タレントの性接待～ 芦名ほのか,4.9 GB,https://pics.dmm.co.jp/mono/movie/adult/nsfs461/nsfs461pl.jpg,https://onejav.com/torrent/nsfs461/download/84606459/onejav.com_nsfs461.torrent,"Beautiful Girl, Big Tits, Drama, Experience Confession, Solowork",Honoka Ashina,2026-03-07,https://onejav.com/torrent/nsfs461
MIBB071,感度良好な豊満ボディー！エロ丸出しイケイケなドスケベお姉さん！！ 芦名ほのか,4.9 GB,https://pics.dmm.co.jp/mono/movie/adult/mibb071/mibb071pl.jpg,https://onejav.com/torrent/mibb071/download/59308641/onejav.com_mibb071.torrent,"Big Tits, Butt, Leg Fetish, Leotard, Pantyhose, Solowork",Honoka Ashina,2026-01-17,https://onejav.com/torrent/mibb071
NSFS441,新・償い20 許しを乞うために身を捧げた妻 芦名ほのか,5.4 GB,https://pics.dmm.co.jp/mono/movie/adult/nsfs441/nsfs441pl.jpg,https://onejav.com/torrent/nsfs441/download/13489064/onejav.com_nsfs441.torrent,"Affair, Big Tits, BIGセール, Drama, Married Woman, Solowork",Honoka Ashina,2025-12-20,https://onejav.com/torrent/nsfs441
MRHP049,大音量でAV見てたら隣の家に住むデカ尻美人妻がクレーム入れに押しかけて来た。欲求不満の人妻は僕の勃起チ●ポに発情して逆レ搾精！僕は生ディルドとして飼われることになった 芦名ほのか,5.3 GB,https://pics.dmm.co.jp/mono/movie/adult/mrhp049/mrhp049pl.jpg,https://onejav.com/torrent/mrhp049/download/73827779/onejav.com_mrhp049.torrent,"Creampie, Huge Butt, Married Woman, M男, Slut, Solowork",Honoka Ashina,2025-12-13,https://onejav.com/torrent/mrhp049
