code,title,size,image_url,torrent_url,tags,actresses,date,page_url
START596,俺が目を付けたパーソナルインストラクターが結婚してたなんて許さない 洗脳エステで俺の思い通りにしてやる！ 神木麗,3.7 GB,https://pics.dmm.co.jp/mono/movie/adult/1start596/1start596pl.jpg,https://onejav.com/torrent/start596/download/49244494/onejav.com_start596.torrent,"Bride, Creampie, Cuckold, Instructor, Solowork",Rei Kamiki,2026-06-09,https://onejav.com/torrent/start596
START581,これが交際歴1年の恋人がするセックス！？リアルにものすごく近い同棲生活！最高にエッチで可愛い神木麗が彼女になってハメまくり！,5.3 GB,https://pics.dmm.co.jp/mono/movie/adult/1start581/1start581pl.jpg,https://onejav.com/torrent/start581/download/39688837/onejav.com_start581.torrent,"Big Tits, Blow, Couple, Love, Masturbation, Solowork",Rei Kamiki,2026-05-12,https://onejav.com/torrent/start581
START542,会社では性格がキツすぎるパワハラ女上司に飲みに誘われて、愚痴を聞いたらまさかの豹変！甘々メンヘラで立場逆転して、何度もおねだり中出しセックス 神木麗,5.7 GB,https://pics.dmm.co.jp/mono/movie/adult/1start542/1start542pl.jpg,https://onejav.com/torrent/start542/download/21741978/onejav.com_start542.torrent,"Big Tits, Breasts, Drama, OL, Planning, Solowork",Rei Kamiki,2026-04-14,https://onejav.com/torrent/start542
START539,神木麗の壁尻パネルを出張レンタル！暴走する精子満タン男たちのザーメンを膣で受け止め白濁マン汁まみれでガクイキする二日間に密着！,9.9 GB,https://pics.dmm.co.jp/mono/movie/adult/1start539/1start539pl.jpg,https://onejav.com/torrent/start539/download/04700282/onejav.com_start539.torrent,"Back, BIGセール, Butt, Creampie, Planning, Solowork",Rei Kamiki,2026-03-10,https://onejav.com/torrent/start539
START498,ハプバーでSEXをしたのは親友の旦那。もっと責めたい女と責められたい女…正反対の人妻二人が快楽堕ちして夫婦交換スワッピング4Pする仲になるまで。 青空ひかり 神木麗,12.7 GB,https://pics.dmm.co.jp/mono/movie/adult/1start498/1start498pl.jpg,https://onejav.com/torrent/start498/download/42040756/onejav.com_start498.torrent,"3P, 4P, 4HR+, Affair, BIGセール, Drama, Married Woman, Swingers","Hikari Aozora, Rei Kamiki",2026-03-03,https://onejav.com/torrent/start498
START488,いいなり温泉旅行 神木麗,6.7 GB,https://pics.dmm.co.jp/mono/movie/adult/1start488/1start488pl.jpg,https://onejav.com/torrent/start488/download/42408676/onejav.com_start488.torrent,"Acme · Orgasm, Big Tits, Hot Spring, Nasty, Hardcore, Restraint, Solowork",Rei Kamiki,2026-02-10,https://onejav.com/torrent/start488
START508,閉店後の棚卸しで終電を逃した俺はバイトの子の家に泊まることに 頑なにすっぴんを拒む姿が可愛くて火が付いたが逆に絶倫腰フリマシーンと化した彼女に朝までしぼり取られた 神木麗,5.6 GB,https://pics.dmm.co.jp/mono/movie/adult/1start508/1start508pl.jpg,https://onejav.com/torrent/start508/download/39383136/onejav.com_start508.torrent,"Big Tits, Blow, Cowgirl, Creampie, Solowork, Subordinates, Colleagues",Rei Kamiki,2026-01-27,https://onejav.com/torrent/start508
START443,初めての全裸わ○せつスポーツテスト 神木麗,5.6 GB,https://pics.dmm.co.jp/mono/movie/adult/1start443/1start443pl.jpg,https://onejav.com/torrent/start443/download/63292075/onejav.com_start443.torrent,"3P, 4P, Breasts, Muscle, Solowork, Sport",Rei Kamiki,2025-11-11,https://onejav.com/torrent/start443
START436,4年目にして初めてのソープ！射精無限大Hカップ早漏ソープ 精子がカラッポになるまでヌいてくれる神乳ボディ 神木麗,5.2 GB,https://pics.dmm.co.jp/mono/movie/adult/1start436/1start436pl.jpg,https://onejav.com/torrent/start436/download/68073881/onejav.com_start436.torrent,"BIGセール, Creampie, Lotion, Prostitutes, Soapland, Solowork",Rei Kamiki,2025-10-14,https://onejav.com/torrent/start436
START405,雑魚チ〇ポを貶しながらも何度だってヌいてくれて本番までさせてくれる！日本一回転率の悪い罵倒バニーピンサロ！ 神木麗,5.1 GB,https://pics.dmm.co.jp/mono/movie/adult/1start405/1start405pl.jpg,https://onejav.com/torrent/start405/download/42332116/onejav.com_start405.torrent,"Bunny Girl, Prostitutes, Slut, Solowork, Subjectivity",Rei Kamiki,2025-09-09,https://onejav.com/torrent/start405
