code,title,size,image_url,torrent_url,tags,actresses,date,page_url
OFES049,俺が退室したと勘違いした地味なラブホ清掃員のパツンパツンデカパイがエロすぎて…乳ワイパー性交で延長中出ししまくった。 波多野結衣,5.7 GB,https://pics.dmm.co.jp/mono/movie/adult/ofes049/ofes049pl.jpg,https://onejav.com/torrent/ofes049/download/83122927/onejav.com_ofes049.torrent,"Big Tits, Busty Fetish, Creampie, Hotel, Solowork, Titty Fuck",Yui Hatano,2026-06-26,https://onejav.com/torrent/ofes049
BONU046,M男にお尻を出して大量おしっこ飲ませる顔騎奥さん 波多野結衣,6.7 GB,https://pics.dmm.co.jp/mono/movie/adult/bonu046/bonu046pl.jpg,https://onejav.com/torrent/bonu046/download/84322927/onejav.com_bonu046.torrent,"Big Tits, Cunnilingus, Facesitting, Huge Butt, M男, Solowork",Yui Hatano,2026-06-06,https://onejav.com/torrent/bonu046
RCTD735,TSF世界改変 コンビニ編 もしもいつものコンビニがTSF要素満載で現実改変されたら…,5.0 GB,https://pics.dmm.co.jp/mono/movie/adult/1rctd735/1rctd735pl.jpg,https://onejav.com/torrent/rctd735/download/24538189/onejav.com_rctd735.torrent,"Big Tits, Futanari, Orgy, Planning, Sex Conversion, Feminized, Various Professions","Yui Hatano, 皆月ひかる, 河合陽菜",2026-06-06,https://onejav.com/torrent/rctd735
CEMD851,ノーブラ熟巨乳ムチムチおっぱいデート～酒飲み●っぱらい編 波多野結衣,7.0 GB,https://pics.dmm.co.jp/mono/movie/adult/cemd851/cemd851pl.jpg,https://onejav.com/torrent/cemd851/download/39199787/onejav.com_cemd851.torrent,"Big Tits, Creampie, Outdoors, Shame, Shaved, Solowork",Yui Hatano,2026-06-06,https://onejav.com/torrent/cemd851
NGOD343,あの巨根支配からの卒業ー。生徒にデカチン支配された女教師妻がようやく迎えた卒業式の日…,5.8 GB,https://pics.dmm.co.jp/mono/movie/adult/ngod343/ngod343pl.jpg,https://onejav.com/torrent/ngod343/download/97713834/onejav.com_ngod343.torrent,"Big Tits, Cuckold, Female Teacher, Huge Cock, Married Woman, Solowork",Yui Hatano,2026-06-05,https://onejav.com/torrent/ngod343
REBD1038,Yui8 The Magical Musical・波多野結衣,2.9 GB,https://pics.dmm.co.jp/mono/movie/adult/h_346rebd1038/h_346rebd1038pl.jpg,https://onejav.com/torrent/rebd1038/download/25099274/onejav.com_rebd1038.torrent,"AV女優, Big Tits, Image Video, Sexy, Solowork, Tall",Yui Hatano,2026-06-04,https://onejav.com/torrent/rebd1038
AARM352,オナニーするのに実用的！エグい体位でパコられてるヌルヌルま○こをドアップでタップリ味わえるエロビ Ver.5,3.9 GB,https://pics.dmm.co.jp/mono/movie/adult/aarm352/aarm352pl.jpg,https://onejav.com/torrent/aarm352/download/14680595/onejav.com_aarm352.torrent,"Blow, Breasts, Cowgirl, Huge Butt, Sweat","Yui Hatano, 小野坂ゆいか",2026-06-04,https://onejav.com/torrent/aarm352
AVSA437,ぬるテカ肉感ドエロ極上ボディ 光沢ぬるぬる恵体を激しく突き上げ爆乳揺らして止まらない快感痙攣絶頂 波多野結衣,5.2 GB,https://pics.dmm.co.jp/mono/movie/adult/avsa437/avsa437pl.jpg,https://onejav.com/torrent/avsa437/download/34298030/onejav.com_avsa437.torrent,"BBW, Big Tits, Huge Butt, Other Fetish, Solowork",Yui Hatano,2026-05-23,https://onejav.com/torrent/avsa437
DOA139,女王様降臨 私の言うことは絶対でしょ？ 波多野結衣,4.1 GB,https://pics.dmm.co.jp/mono/movie/adult/doa139/doa139pl.jpg,https://onejav.com/torrent/doa139/download/82033223/onejav.com_doa139.torrent,"Footjob, Leg Fetish, Mistress, M男, Solowork, Urination",Yui Hatano,2026-05-23,https://onejav.com/torrent/doa139
BONY191,抜かずに連射で膣内シェイク！！ まんキャパオーバー無制限中出し 波多野結衣,5.4 GB,https://pics.dmm.co.jp/mono/movie/adult/bony191/bony191pl.jpg,https://onejav.com/torrent/bony191/download/83465282/onejav.com_bony191.torrent,"Big Tits, Blow, Creampie, Huge Butt, Solowork, Squirting",Yui Hatano,2026-05-22,https://onejav.com/torrent/bony191
