code,title,size,image_url,torrent_url,tags,actresses,date,page_url
ALDN597,兄嫁と中出ししまくった数日間 三池小春,4.0 GB,https://pics.dmm.co.jp/mono/movie/adult/aldn597/aldn597pl.jpg,https://onejav.com/torrent/aldn597/download/81260719/onejav.com_aldn597.torrent,"Creampie, Married Woman, Mature Woman, Solowork",三池小春,2026-07-11,https://onejav.com/torrent/aldn597
ALDN590,中出しの快楽に堕ちた妻 三池小春,4.1 GB,https://pics.dmm.co.jp/mono/movie/adult/aldn590/aldn590pl.jpg,https://onejav.com/torrent/aldn590/download/70426900/onejav.com_aldn590.torrent,"Creampie, Married Woman, Mature Woman, Solowork",三池小春,2026-06-06,https://onejav.com/torrent/aldn590
USBA089,Mの衝撃 服従調教 清楚な従順女が本性剥き出し本気のマゾイキ 三池小春,3.7 GB,https://pics.dmm.co.jp/mono/movie/adult/usba089/usba089pl.jpg,https://onejav.com/torrent/usba089/download/38703379/onejav.com_usba089.torrent,"M女, Restraint, Restraints, Solowork",三池小春,2026-06-06,https://onejav.com/torrent/usba089
ODVHJ076,人妻たちのガチイキ丸見えディルドオナニー18,8.0 GB,https://pics.dmm.co.jp/mono/movie/adult/48odvhj076/48odvhj076pl.jpg,https://onejav.com/torrent/odvhj076/download/25618946/onejav.com_odvhj076.torrent,"Big Tits, Dildo, Married Woman, Masturbation, Mature Woman","澄河美花, 三池小春, 玉城夏帆, Miho Tsuno, 盛永いろは, 藤井レイラ, 白峰郁美",2026-05-07,https://onejav.com/torrent/odvhj076
USBA088,欲望だだ漏れ発情液まみれの変態Wマゾスペレズ中出し調教,5.5 GB,https://pics.dmm.co.jp/mono/movie/adult/usba088/usba088pl.jpg,https://onejav.com/torrent/usba088/download/43408704/onejav.com_usba088.torrent,"Creampie, Lesbian Kiss, M女","三池小春, 二宮もも",2026-03-07,https://onejav.com/torrent/usba088
APRG001,デリヘルを呼んだ僕は清楚妻の母性と性感テクに我慢できず、潮吹きに溺れるドM妻を朝までイカセ続けた。デリ妻ペット【欲情支配】ハメ撮り記録 三池小春,6.0 GB,https://pics.dmm.co.jp/mono/movie/adult/aprg001/aprg001pl.jpg,https://onejav.com/torrent/aprg001/download/12883384/onejav.com_aprg001.torrent,"Creampie, Facials, Married Woman, Nasty, Hardcore, POV, Solowork",三池小春,2026-02-21,https://onejav.com/torrent/aprg001
MOND302,綺麗な近所の奥さんが 三池小春,5.4 GB,https://pics.dmm.co.jp/mono/movie/adult/mond302/mond302pl.jpg,https://onejav.com/torrent/mond302/download/24906486/onejav.com_mond302.torrent,"Creampie, Married Woman, Mature Woman, Solowork",三池小春,2026-02-21,https://onejav.com/torrent/mond302
USBA087,特別捜査官緊縛マゾ調教 裏切り・捕縛・洗脳 奴●堕ちした美人女捜査官 三池小春,4.5 GB,https://pics.dmm.co.jp/mono/movie/adult/usba087/usba087pl.jpg,https://onejav.com/torrent/usba087/download/02289487/onejav.com_usba087.torrent,"Female Investigator, Restraint, Restraints, Solowork",三池小春,2026-02-21,https://onejav.com/torrent/usba087
MISM431,喉奥の教典（狂天） 三池小春,6.7 GB,https://pics.dmm.co.jp/mono/movie/adult/mism431/mism431pl.jpg,https://onejav.com/torrent/mism431/download/37585134/onejav.com_mism431.torrent,"Deep Throating, M女, Nasty, Hardcore, Slender, SM, Solowork",三池小春,2026-02-20,https://onejav.com/torrent/mism431
ALDN551,抱きたい元嫁 三池小春,5.7 GB,https://pics.dmm.co.jp/mono/movie/adult/aldn551/aldn551pl.jpg,https://onejav.com/torrent/aldn551/download/41295172/onejav.com_aldn551.torrent,"Creampie, Married Woman, Mature Woman, Solowork",三池小春,2026-01-24,https://onejav.com/torrent/aldn551
