code,title,size,image_url,torrent_url,tags,actresses,date,page_url
ATYA042,しっかり者ギャル奥さん（爆乳）浮気した夫へのあてつけに本番撮影に挑み…絶倫おじのねっとり交尾に堕ちる！ 二羽紗愛,5.7 GB,https://pics.dmm.co.jp/mono/movie/adult/atya042/atya042pl.jpg,https://onejav.com/torrent/atya042/download/60276062/onejav.com_atya042.torrent,"Big Tits, Huge Butt, Married Woman, Solowork, Titty Fuck",二羽紗愛,2026-06-13,https://onejav.com/torrent/atya042
HMN843,童貞筆下ろし三姉妹デカパイレンジャー 二羽紗愛 滝川すみれ 月乃ことね,4.0 GB,https://pics.dmm.co.jp/mono/movie/adult/hmn843/hmn843pl.jpg,https://onejav.com/torrent/hmn843/download/81494510/onejav.com_hmn843.torrent,"Big Tits, Creampie, Kiss, Orgy, Virgin Man","二羽紗愛, 滝川すみれ, 月乃ことね",2026-06-12,https://onejav.com/torrent/hmn843
BBAN589,朝起きたら隣に裸の同僚が。 なぜか敏感なカラダ。どうやら私は昨夜レズ堕ちしていたようです…【2段階レズ堕ち】 有岡みう 二羽紗愛,6.8 GB,https://pics.dmm.co.jp/mono/movie/adult/bban589/bban589pl.jpg,https://onejav.com/torrent/bban589/download/82020467/onejav.com_bban589.torrent,"Acme · Orgasm, Big Tits, Lesbian Kiss, OL","有岡みう, 二羽紗愛",2026-06-05,https://onejav.com/torrent/bban589
AUKG647,義妹にレズられて… ～兄の留守に巨乳義姉をレズ誘惑する小悪魔ビアン～,5.1 GB,https://pics.dmm.co.jp/mono/movie/adult/aukg647/aukg647pl.jpg,https://onejav.com/torrent/aukg647/download/74204706/onejav.com_aukg647.torrent,"Big Tits, Drama, Married Woman, Sister","二羽紗愛, 桃瀬ひまり",2026-03-14,https://onejav.com/torrent/aukg647
FJIN127,キメセクの巣 スライム爆乳ぷるぷる！ アヘ顔ガンギマリFUCK！！ 二羽紗愛,5.4 GB,https://pics.dmm.co.jp/mono/movie/adult/fjin127/fjin127pl.jpg,https://onejav.com/torrent/fjin127/download/51869537/onejav.com_fjin127.torrent,"Big Tits, Drug, Lotion, Nasty, Hardcore, Solowork, Sweat",二羽紗愛,2026-02-28,https://onejav.com/torrent/fjin127
PYM550,ねぇ～私の前でおちん〇んシコシコして！自撮りオナサポ 指だけオナニー,9.5 GB,https://pics.dmm.co.jp/mono/movie/adult/h_283pym550/h_283pym550pl.jpg,https://onejav.com/torrent/pym550/download/29014932/onejav.com_pym550.torrent,"Breasts, Masturbation, Masturbation Support, Older Sister, Shaved","似鳥日菜, 二羽紗愛, 橘いおり, 花衣つばき, 七美まみ, 小鳩るり, Yuri Honma, 由衣陽菜, 双葉いろは, 水原わこ",2026-02-15,https://onejav.com/torrent/pym550
VEC763,魅惑のテクニックでお色気むんむんナイスボディ！エロパフォーマンス最高の彼女のママがヤリたい盛りの娘の彼氏と激しいセックスを繰り広げる 二羽紗愛,4.3 GB,https://pics.dmm.co.jp/mono/movie/adult/vec763/vec763pl.jpg,https://onejav.com/torrent/vec763/download/36856860/onejav.com_vec763.torrent,"Big Tits, Creampie, Cuckold, Married Woman, Mature Woman, Solowork",二羽紗愛,2026-02-13,https://onejav.com/torrent/vec763
DVAJ720,奇跡の神乳BEST 最高のドスケベおっぱいを揉んで揺らして挟まれてプルプルもちもち柔らか乳肉味わい尽くす5時間,12.7 GB,https://pics.dmm.co.jp/mono/movie/adult/dvaj720/dvaj720pl.jpg,https://onejav.com/torrent/dvaj720/download/68325920/onejav.com_dvaj720.torrent,"4HR+, Best, Omnibus, Big Tits, Breasts, Busty Fetish, Titty Fuck","小野坂ゆいか, 天月あず, Nozomi Arimura, 小坂ひまり, 二羽紗愛, 藤咲紫, 碓井せりな, Asami Mizuhashi, 静河, 花衣つばき, ▼すべて表示する",2026-01-10,https://onejav.com/torrent/dvaj720
DRPT103,満員電車で吊り革にぶら下げられ両乳首同時開発のすえ無念の発情してしまった巨乳美女4 二羽紗愛,6.8 GB,https://pics.dmm.co.jp/mono/movie/adult/1drpt103/1drpt103pl.jpg,https://onejav.com/torrent/drpt103/download/19672744/onejav.com_drpt103.torrent,"Big Tits, Restraint, Shame, Solowork, Squirting, Toy",二羽紗愛,2026-01-02,https://onejav.com/torrent/drpt103
FTHTD166,コンビニのバックヤードでセックスをするのが好きな彼女は不倫をしていた。二羽紗愛,5.5 GB,https://pics.dmm.co.jp/mono/movie/adult/1fthtd166/1fthtd166pl.jpg,https://onejav.com/torrent/fthtd166/download/48372974/onejav.com_fthtd166.torrent,"Big Tits, Creampie, Drama, Older Sister, Shaved, Solowork",二羽紗愛,2025-12-28,https://onejav.com/torrent/fthtd166
