code,title,size,image_url,torrent_url,tags,actresses,date,page_url
DFE115,人妻メス声ダダ漏れエステ（DFE-115）,3.1 GB,https://pics.dmm.co.jp/mono/movie/adult/2dfe115/2dfe115pl.jpg,https://onejav.com/torrent/dfe115/download/50691392/onejav.com_dfe115.torrent,"Beauty Shop, Big Tits, Cum, Lotion, Married Woman, Massage, Mature Woman, Multiple Story","花衣つばき, 八森わか菜",2026-06-28,https://onejav.com/torrent/dfe115
PYM567,都合のいい僕専用おしゃぶりペット お口でご奉仕下品なフェラ顔女子 撮り下ろし11人 爆速フェラ抜き鬼連射！特典映像付き！総勢41人,10.6 GB,https://pics.dmm.co.jp/mono/movie/adult/h_283pym567/h_283pym567pl.jpg,https://onejav.com/torrent/pym567/download/09606119/onejav.com_pym567.torrent,"4HR+, Blow, Cum, Facials, Handjob","白百合みなみ, 八森わか菜, 幸村紀那, 工藤ゆり, 鮎川万里香, 佐野りか, 橘紅葉, Yuina Taki, 真城かのん, 渡辺まりか, ▼すべて表示する",2026-06-21,https://onejav.com/torrent/pym567
HMN877,保護女子集団里親譲渡会 身寄りのない娘たちに希望を。5人のマ○コをナマで確認して持ち帰れる激ヤバ施設に潜入！,5.3 GB,https://pics.dmm.co.jp/mono/movie/adult/hmn877/hmn877pl.jpg,https://onejav.com/torrent/hmn877/download/65141663/onejav.com_hmn877.torrent,"Creampie, Harem, Kiss, Mini, Orgy, Petite","谷村凪咲, 花守夏歩, 八森わか菜, 満島アンナ, 由良かな",2026-05-22,https://onejav.com/torrent/hmn877
PYM554,おま〇こズボズボ 美尻デカ尻ディルドオナニー 貴方のおちん〇ん食べちゃうぞ,10.4 GB,https://pics.dmm.co.jp/mono/movie/adult/h_283pym554/h_283pym554pl.jpg,https://onejav.com/torrent/pym554/download/05309750/onejav.com_pym554.torrent,"4HR+, Close Up, Cowgirl, Dildo, Masturbation, Older Sister, Subjectivity","Kokoro Ayase, 加護まり, Hotaru Nogi, 愛瀬ゆう, Yuina Taki, 乃南ゆり, 浅桜エリ, 指原美奈, 橘紅葉, 八森わか菜",2026-03-29,https://onejav.com/torrent/pym554
GVH830,潰れかかった温泉旅館の姉妹女将は持ち前のスキルを活かしたエロすぎる接客で経営を立て直す！ 八森わか菜/由良かな,7.4 GB,https://pics.dmm.co.jp/mono/movie/adult/gvh830/gvh830pl.jpg,https://onejav.com/torrent/gvh830/download/42325251/onejav.com_gvh830.torrent,"Hot Spring, Landlady, Hostess, Nose Hook, Sister, Squirting","八森わか菜, 由良かな",2026-03-14,https://onejav.com/torrent/gvh830
SDMUA096,肛門処女の最強ド変態が初アナルで腸汁ダクダク気張りイキ ウルトラ超大量浣腸スペシャル 八森わか菜,11.8 GB,https://pics.dmm.co.jp/mono/movie/adult/1sdmua096/1sdmua096pl.jpg,https://onejav.com/torrent/sdmua096/download/16573663/onejav.com_sdmua096.torrent,"Anal, Anal Sex, Deep Throating, Enema, Nasty, Hardcore, Solowork",八森わか菜,2026-01-13,https://onejav.com/torrent/sdmua096
SORA615,僕の身代わりにDQN達に犯●れデカチンのヤリ部屋と化した自宅で串刺し喉奥イラマでアヘ堕ちする姉を見て思わず…クズ勃起 八森わか菜,5.4 GB,https://pics.dmm.co.jp/mono/movie/adult/sora615/sora615pl.jpg,https://onejav.com/torrent/sora615/download/69190745/onejav.com_sora615.torrent,"Creampie, Deep Throating, Humiliation, Solowork",八森わか菜,2025-10-04,https://onejav.com/torrent/sora615
DMOW222,罵倒痴女のセンズリ射精管理,6.2 GB,https://pics.dmm.co.jp/mono/movie/adult/h_139dmow222/h_139dmow222pl.jpg,https://onejav.com/torrent/dmow222/download/32415494/onejav.com_dmow222.torrent,"Cowgirl, Dirty Words, Leg Fetish, M男, Older Sister, Other Fetish, School Uniform, Slut, Urination","花衣つばき, 菊池はる, 松井日奈子, Kyouka Tachibana, 九井スナオ, 八森わか菜",2025-09-02,https://onejav.com/torrent/dmow222
DNJR146,女教師ハーレムオナサポ学園 女教師による正しい射精レッスン センズリから中出しセックスまで,5.7 GB,https://pics.dmm.co.jp/mono/movie/adult/dnjr146/dnjr146pl.jpg,https://onejav.com/torrent/dnjr146/download/24544864/onejav.com_dnjr146.torrent,"3P, 4P, Female Teacher, Harem, M男, Slut","花衣つばき, 九井スナオ, 八森わか菜, 湊波流, Kyouka Tachibana",2025-08-30,https://onejav.com/torrent/dnjr146
XVSR837,男も思わず喘ぐフェラテク15名の撮り下ろし精子ゴックン・口内発射フェラチオ170分,7.2 GB,https://pics.dmm.co.jp/mono/movie/adult/xvsr837/xvsr837pl.jpg,https://onejav.com/torrent/xvsr837/download/01305208/onejav.com_xvsr837.torrent,"Beautiful Girl, Blow, Cum, Other Fetish, Subjectivity","有栖舞衣, 希咲那奈, 真白みのり, 八森わか菜, 望月つぼみ, 音羽美鈴, 幾野まち, 山口由愛, わか菜ほの, 逢月ひまり, ▼すべて表示する",2025-08-30,https://onejav.com/torrent/xvsr837
