code,title,size,image_url,torrent_url,tags,actresses,date,page_url
JYMA107,肉感ボディで濃厚サービスの神対応メイド むっちり美巨乳のエロカワ家政婦,6.0 GB,https://pics.dmm.co.jp/mono/movie/adult/jyma107/jyma107pl.jpg,https://onejav.com/torrent/jyma107/download/07363033/onejav.com_jyma107.torrent,"BBW, Big Tits, Creampie, Documentary, Maid, Solowork",天月あず,2026-06-20,https://onejav.com/torrent/jyma107
PKPL066,恋人いちゃラブドキュメント 完全無欠の美巨乳と天真爛漫 天月あずちゃんと1日イチャイチャデート,5.9 GB,https://pics.dmm.co.jp/mono/movie/adult/pkpl066/pkpl066pl.jpg,https://onejav.com/torrent/pkpl066/download/76614397/onejav.com_pkpl066.torrent,"Beautiful Girl, Big Tits, Breasts, Creampie, POV, Solowork",天月あず,2026-06-08,https://onejav.com/torrent/pkpl066
EKDV819,このメス女…只今発情真っ盛り！？ 天月あずとしてみませんか？,5.7 GB,https://pics.dmm.co.jp/mono/movie/adult/ekdv819/ekdv819pl.jpg,https://onejav.com/torrent/ekdv819/download/67646176/onejav.com_ekdv819.torrent,"Big Tits, Bitch, Cowgirl, Creampie, Facesitting, Huge Cock, Kiss, Masturbation, Reversed Role, Solowork",天月あず,2026-05-23,https://onejav.com/torrent/ekdv819
ALDN558,結婚する妻が種付されに帰省する 天月あず,5.7 GB,https://pics.dmm.co.jp/mono/movie/adult/aldn558/aldn558pl.jpg,https://onejav.com/torrent/aldn558/download/09797365/onejav.com_aldn558.torrent,"Big Tits, Creampie, Married Woman, Mature Woman, Solowork",天月あず,2026-02-07,https://onejav.com/torrent/aldn558
MDBK404,優しいベビーシッターが甘トロおっぱいでたっくさん癒してくれるバブみ巨乳デリヘル,5.8 GB,https://pics.dmm.co.jp/mono/movie/adult/mdbk404/mdbk404pl.jpg,https://onejav.com/torrent/mdbk404/download/68329600/onejav.com_mdbk404.torrent,"Big Tits, Creampie, Naked apron, Soapland, Titty Fuck","胡桃さくら, 花衣つばき, 天月あず",2026-02-07,https://onejav.com/torrent/mdbk404
SQTE655,休日に彼女と。性欲ヤバメの彼女とサウナで汗だく種付けSEX 天月あず,4.2 GB,https://pics.dmm.co.jp/mono/movie/adult/sqte655/sqte655pl.jpg,https://onejav.com/torrent/sqte655/download/34001062/onejav.com_sqte655.torrent,"Beautiful Girl, Big Tits, Blow, Solowork, Sweat, Travel",天月あず,2026-01-31,https://onejav.com/torrent/sqte655
GVH814,デカ乳プルンプルン！デカ尻ブリンブリン！がんばれ！がんばれ！腰振り応援Wチアガール！！ 天月あず/宇流木さらら,6.9 GB,https://pics.dmm.co.jp/mono/movie/adult/gvh814/gvh814pl.jpg,https://onejav.com/torrent/gvh814/download/36512597/onejav.com_gvh814.torrent,"Big Tits, Cheerleader, Cowgirl, Dirty Words, Huge Butt","天月あず, 宇流木さらら",2026-01-24,https://onejav.com/torrent/gvh814
DVAJ720,奇跡の神乳BEST 最高のドスケベおっぱいを揉んで揺らして挟まれてプルプルもちもち柔らか乳肉味わい尽くす5時間,12.7 GB,https://pics.dmm.co.jp/mono/movie/adult/dvaj720/dvaj720pl.jpg,https://onejav.com/torrent/dvaj720/download/84249307/onejav.com_dvaj720.torrent,"4HR+, Best, Omnibus, Big Tits, Breasts, Busty Fetish, Titty Fuck","小野坂ゆいか, 天月あず, Nozomi Arimura, 小坂ひまり, 二羽紗愛, 藤咲紫, 碓井せりな, Asami Mizuhashi, 静河, 花衣つばき, ▼すべて表示する",2026-01-10,https://onejav.com/torrent/dvaj720
CAWD908,セーラー機関銃ボイン少女 違●製薬工場に潜入依頼を受けたスパイ女学生は返り討ちに遭う…イキ潮大洪水キメセク拷問堕ち,5.0 GB,https://pics.dmm.co.jp/mono/movie/adult/cawd908/cawd908pl.jpg,https://onejav.com/torrent/cawd908/download/96724228/onejav.com_cawd908.torrent,"Acme · Orgasm, Big Tits, Orgy, Sailor Suit, Squirting","糸井瑠花, 天月あず",2026-01-01,https://onejav.com/torrent/cawd908
RCTD709,女性専用 乳首こねクリニック健康診断5 チクビアン女医の粘着感度チェック初めての乳首合わせでイキ狂う！,6.2 GB,https://pics.dmm.co.jp/mono/movie/adult/1rctd709/1rctd709pl.jpg,https://onejav.com/torrent/rctd709/download/20794438/onejav.com_rctd709.torrent,"Big Tits, Female Doctor, Other Fetish, Planning, School Girls","天月あず, 乙羽あむ, 深月めい",2025-12-20,https://onejav.com/torrent/rctd709
