code,title,size,image_url,torrent_url,tags,actresses,date,page_url
YSN659,妹を育成中～両親も知らない間に妹を肉オナホに育成した俺は変態ですか？ 尋井うみ,4.4 GB,https://pics.dmm.co.jp/mono/movie/adult/h_127ysn659/h_127ysn659pl.jpg,https://onejav.com/torrent/ysn659/download/49307586/onejav.com_ysn659.torrent,"Conceived, Creampie, Nasty, Hardcore, Other Fetish, Shaved, Solowork",尋井うみ,2026-06-03,https://onejav.com/torrent/ysn659
YST352,レイヤーをやり始めた姉を無言で貪った 尋井うみ,4.2 GB,https://pics.dmm.co.jp/mono/movie/adult/540yst352/540yst352pl.jpg,https://onejav.com/torrent/yst352/download/54601644/onejav.com_yst352.torrent,"Breasts, Conceived, Cosplay, Creampie, Nasty, Hardcore, Solowork",尋井うみ,2026-04-27,https://onejav.com/torrent/yst352
MBDD2170,Crystal U/尋井うみ,3.5 GB,https://pics.dmm.co.jp/mono/movie/adult/n_707mbdd2170/n_707mbdd2170pl.jpg,https://onejav.com/torrent/mbdd2170/download/43583148/onejav.com_mbdd2170.torrent,"Idol, Image Video, Solowork",尋井うみ,2026-04-11,https://onejav.com/torrent/mbdd2170
RCTD724,妄想エッチなオカルトシリーズ エイリアン・アブダクション ～私はUFOに連れ去られ宇宙人の子供を孕まされました～,3.3 GB,https://pics.dmm.co.jp/mono/movie/adult/1rctd724/1rctd724pl.jpg,https://onejav.com/torrent/rctd724/download/15604212/onejav.com_rctd724.torrent,"BIGセール, Conceived, Creampie, Planning, Restraint, School Girls, SF","碧那美海, 尋井うみ, 吉井美希",2026-03-17,https://onejav.com/torrent/rctd724
SYKH181,ブーツの美魔女とナマ交尾 即ズボチ〇ポの快感に美貌が蕩ける… うみさん25歳 尋井うみ,4.6 GB,https://pics.dmm.co.jp/mono/movie/adult/sykh181/sykh181pl.jpg,https://onejav.com/torrent/sykh181/download/14954499/onejav.com_sykh181.torrent,"Creampie, Erotic Wear, Impromptu Sex, Leg Fetish, Pantyhose, Solowork",尋井うみ,2026-03-14,https://onejav.com/torrent/sykh181
MADB001,新人AV Debut「152センチ、44キロ」「●校教師」本物美人教師衝撃のAVデビュー 尋井うみ,5.4 GB,https://pics.dmm.co.jp/mono/movie/adult/madb001/madb001pl.jpg,https://onejav.com/torrent/madb001/download/60103993/onejav.com_madb001.torrent,"Beautiful Girl, Debut Production, Female Teacher, Glasses, Slender, Solowork",尋井うみ,2025-07-19,https://onejav.com/torrent/madb001
