code,title,size,image_url,torrent_url,tags,actresses,date,page_url
NACX174,五十路熟女欲情オナニー21人,11.6 GB,https://pics.dmm.co.jp/mono/movie/adult/h_237nacx174/h_237nacx174pl.jpg,https://onejav.com/torrent/nacx174/download/78992255/onejav.com_nacx174.torrent,"4HR+, Best, Omnibus, Masturbation, Mature Woman","麻生千春, 上島美都子, 大石忍, 小田しおり, 横山紗江子, 小林真梨香, 豊永映美, 古川祥子, 遠藤しおり, 西園寺美緒, ▼すべて表示する",2026-07-05,https://onejav.com/torrent/nacx174
NASK279,嫁の母 優しい義母の熟れた身体 興奮する禁断の家庭内不倫 4人4時間,10.1 GB,https://pics.dmm.co.jp/mono/movie/adult/nask279/nask279pl.jpg,https://onejav.com/torrent/nask279/download/67441540/onejav.com_nask279.torrent,"4HR+, Affair, Best, Omnibus, BIGセール, Incest, Mature Woman","夏樹カオル, 小林真梨香, 加山なつこ, 花撫あや",2025-08-23,https://onejav.com/torrent/nask279
NMEX001,絶倫巨根男との寝取られ性交にハマる巨乳で巨尻な10人の淫乱妻たち,10.1 GB,https://pics.dmm.co.jp/mono/movie/adult/nmex001/nmex001pl.jpg,https://onejav.com/torrent/nmex001/download/07017806/onejav.com_nmex001.torrent,"Big Tits, Cuckold, Drama, Huge Butt, Married Woman","吉井美希, 小林真梨香, 武藤あやか",2025-01-18,https://onejav.com/torrent/nmex001
NSFS302,ザ・近親相姦 母と息子 熟れゆく禁断セックス,10.5 GB,https://pics.dmm.co.jp/mono/movie/adult/nsfs302/nsfs302pl.jpg,https://onejav.com/torrent/nsfs302/download/38115454/onejav.com_nsfs302.torrent,"4HR+, Best, Omnibus, Drama, Incest, Mature Woman, Mother","森美希, 翔田千里, 広瀬結香, 美川由加里, 小林真梨香, 坂下真希, 京野美麗, 山口珠理",2024-07-20,https://onejav.com/torrent/nsfs302
NASK084,熟年交尾 ねっとり濃厚に快楽を貪る中高年男女のナイトライフ 10人4時間,10.3 GB,https://pics.dmm.co.jp/mono/movie/adult/nask084/nask084pl.jpg,https://onejav.com/torrent/nask084/download/45058882/onejav.com_nask084.torrent,"4HR+, BBW, Best, Omnibus, Married Woman, Mature Woman","山口珠理, 小林真梨香, 森美希, 堀美也子, 伊織涼子, 永瀬昭子, 京野美沙, 真矢あかり, 森野雫, 三ツ瀬祐美子",2024-06-08,https://onejav.com/torrent/nask084
NASK048,四十路の母 性欲を持て余した熟女の禁断近親相姦劇 6人4時間,10.2 GB,https://pics.dmm.co.jp/mono/movie/adult/nask048/nask048pl.jpg,https://onejav.com/torrent/nask048/download/21626422/onejav.com_nask048.torrent,"4HR+, Best, Omnibus, Mature Woman, Mother","森野雫, 三ツ瀬祐美子, 池谷佳純, 真崎理恵子, 青山涼香, 小林真梨香",2024-04-06,https://onejav.com/torrent/nask048
SCD230,憧れの叔母さんが野外放尿,4.8 GB,https://pics.dmm.co.jp/mono/movie/adult/scd230/scd230pl.jpg,https://onejav.com/torrent/scd230/download/48792922/onejav.com_scd230.torrent,"Aunt, Creampie, Mature Woman, Multiple Story, Urination","竹内梨恵, 小林真梨香",2024-02-17,https://onejav.com/torrent/scd230
ALDN237,娘の旦那とダクあせ交尾 小林真梨香,4.6 GB,https://pics.dmm.co.jp/mono/movie/adult/aldn237/aldn237pl.jpg,https://onejav.com/torrent/aldn237/download/29714916/onejav.com_aldn237.torrent,"Big Tits, Creampie, Drama, Married Woman, Mature Woman, Solowork",小林真梨香,2023-11-11,https://onejav.com/torrent/aldn237
KSBJ181,,4.9 GB,https://pics.dmm.co.jp/mono/movie/adult/ksbj181/ksbj181pl.jpg,https://onejav.com/torrent/ksbj181/download/56309579/onejav.com_ksbj181.torrent,,小林真梨香,2022-02-12,https://onejav.com/torrent/ksbj181
SPRD1514,,5.6 GB,https://pics.dmm.co.jp/mono/movie/adult/18sprd1514/18sprd1514pl.jpg,https://onejav.com/torrent/sprd1514/download/32290638/onejav.com_sprd1514.torrent,,小林真梨香,2022-02-10,https://onejav.com/torrent/sprd1514
