code,title,size,image_url,torrent_url,tags,actresses,date,page_url
DOKS678,へこへこ腰が止まらない ピンピンこりっこり勃起乳首オナニー2,3.5 GB,https://pics.dmm.co.jp/mono/movie/adult/h_139doks678/h_139doks678pl.jpg,https://onejav.com/torrent/doks678/download/70784832/onejav.com_doks678.torrent,"Big Tits, Breasts, Masturbation, Nasty, Hardcore, Older Sister, Other Fetish, Small Tits, Toy, Various Professions","真白みのり, 丸最レア, 久和原せいら, 山口由愛, 北岡果林",2026-06-26,https://onejav.com/torrent/doks678
DNJR157,女子〇生の匂い立つムレムレ黒パンストで美脚コキ 3期,3.6 GB,https://pics.dmm.co.jp/mono/movie/adult/dnjr157/dnjr157pl.jpg,https://onejav.com/torrent/dnjr157/download/67529390/onejav.com_dnjr157.torrent,"Footjob, Leg Fetish, M男, School Girls, Slut","北岡果林, 久和原せいら, 真白みのり, 丸最レア, 山口由愛",2026-05-30,https://onejav.com/torrent/dnjr157
RCTD732,羞恥SEX洗脳 スリングショット水着でトレーニング2 マン！コー！マン！コー！みんなでセクササイズ,4.9 GB,https://pics.dmm.co.jp/mono/movie/adult/1rctd732/1rctd732pl.jpg,https://onejav.com/torrent/rctd732/download/51429408/onejav.com_rctd732.torrent,"Bitch, Other Fetish, Planning, Shame, Swimsuit","花衣つばき, 山口由愛, 尾崎みのり",2026-05-05,https://onejav.com/torrent/rctd732
AARM342,無防備な睾丸と裏筋を容赦なく刺激！四つん這い悶絶回春サロン3,5.2 GB,https://pics.dmm.co.jp/mono/movie/adult/aarm342/aarm342pl.jpg,https://onejav.com/torrent/aarm342/download/84651543/onejav.com_aarm342.torrent,"Beauty Shop, Handjob, Lotion","伊東沙蘭, 山口由愛, 岬さくら, 辻早織, 久和原せいら",2026-03-21,https://onejav.com/torrent/aarm342
AARM336,添い寝ベロチューでとろとろの唾液飲まされ続けながらスロー手こきで焦らされ続ける,5.1 GB,https://pics.dmm.co.jp/mono/movie/adult/aarm336/aarm336pl.jpg,https://onejav.com/torrent/aarm336/download/27924085/onejav.com_aarm336.torrent,"Handjob, Kiss, M男, Slut","新村あかり, 花里アカリ, 本田瞳, 水瀬さな, 相沢澪, 山口由愛",2026-02-24,https://onejav.com/torrent/aarm336
AARM335,オトコの尻肉つかんで舌をねじこみしゃぶり尽くす鬼アナル舐め！3,5.2 GB,https://pics.dmm.co.jp/mono/movie/adult/aarm335/aarm335pl.jpg,https://onejav.com/torrent/aarm335/download/22977520/onejav.com_aarm335.torrent,"Anal, Handjob, Other Fetish, Slut","Nia, 花里アカリ, 山口由愛, 伊東沙蘭, 福原みな",2026-02-19,https://onejav.com/torrent/aarm335
AARM329,はたらく女子のベロチュー着衣SEX、フィニッシュは制服にぶっかけ！,6.3 GB,https://pics.dmm.co.jp/mono/movie/adult/aarm329/aarm329pl.jpg,https://onejav.com/torrent/aarm329/download/96569652/onejav.com_aarm329.torrent,"BIGセール, Bukkake, Cowgirl, Kiss, Uniform, Various Professions","Nia, 山口由愛, 赤名いと, 辻早織",2025-12-18,https://onejav.com/torrent/aarm329
AARM319,最強ご褒美チクビ性感！緩急自在の指技弄り×超濃厚乳首舐め×生乳頭こすり合わせ,5.4 GB,https://pics.dmm.co.jp/mono/movie/adult/aarm319/aarm319pl.jpg,https://onejav.com/torrent/aarm319/download/23260345/onejav.com_aarm319.torrent,"Big Tits, Close Up, Dirty Words, M男","Nozomi Arimura, 山口由愛, 福原みな, 白石かんな, 乃南ゆい, 伊東沙蘭",2025-10-23,https://onejav.com/torrent/aarm319
OKK099,山口由愛 濡れてテカってピッタリ密着 神競泳水着 可愛い女子の競泳水着姿をじっとりと堪能！着替え盗撮から始まり貧乳から巨乳にパイパン、ハミ毛、ジョリワキ等のフェチ接写やローションソーププレイや競泳水着ぶっかけ等を完全着衣で楽しむAV,4.0 GB,https://pics.dmm.co.jp/mono/movie/adult/1okk099/1okk099pl.jpg,https://onejav.com/torrent/okk099/download/41696059/onejav.com_okk099.torrent,"Beautiful Girl, Bukkake, Close Up, Lotion, School Swimsuit, Solowork, Voyeur",山口由愛,2025-09-15,https://onejav.com/torrent/okk099
XVSR837,男も思わず喘ぐフェラテク15名の撮り下ろし精子ゴックン・口内発射フェラチオ170分,7.2 GB,https://pics.dmm.co.jp/mono/movie/adult/xvsr837/xvsr837pl.jpg,https://onejav.com/torrent/xvsr837/download/25403820/onejav.com_xvsr837.torrent,"Beautiful Girl, Blow, Cum, Other Fetish, Subjectivity","有栖舞衣, 希咲那奈, 真白みのり, 八森わか菜, 望月つぼみ, 音羽美鈴, 幾野まち, 山口由愛, わか菜ほの, 逢月ひまり, ▼すべて表示する",2025-08-30,https://onejav.com/torrent/xvsr837
