code,title,size,image_url,torrent_url,tags,actresses,date,page_url
MNGS059,新米教師の僕は生意気ギャルに顔騎で逆に理解らせられた 春陽モカ,3.2 GB,https://pics.dmm.co.jp/mono/movie/adult/mngs059/mngs059pl.jpg,https://onejav.com/torrent/mngs059/download/09114811/onejav.com_mngs059.torrent,"Cowgirl, Facesitting, Gal, School Girls, Slut, Solowork",春陽モカ,2026-06-12,https://onejav.com/torrent/mngs059
WAAA654,聖水ビチョ濡れ快楽パーティー おしっこ・唾液・汗・マン汁をダラダラ飲ませる超ヤバい体液痴女と溺愛中出しFUCK！ 春陽モカ,4.9 GB,https://pics.dmm.co.jp/mono/movie/adult/waaa654/waaa654pl.jpg,https://onejav.com/torrent/waaa654/download/95696594/onejav.com_waaa654.torrent,"Gal, Kiss, Slut, Solowork, Sweat, Urination",春陽モカ,2026-05-29,https://onejav.com/torrent/waaa654
HMN858,出没！逆痴●ギャル 気弱そうな男の股間をむぎゅっと握ってナマ挿入を誘惑する痴女のいる痴●電車 春陽モカ,3.4 GB,https://pics.dmm.co.jp/mono/movie/adult/hmn858/hmn858pl.jpg,https://onejav.com/torrent/hmn858/download/21193146/onejav.com_hmn858.torrent,"Creampie, Gal, Kiss, Orgy, Slut, Solowork",春陽モカ,2026-05-22,https://onejav.com/torrent/hmn858
CJOD511,モカちんはギャル美容師！カットの隙に唾液じゅるる～～～！ベロチュウ騎乗位で13発痴女られたボク 春陽モカ,3.6 GB,https://pics.dmm.co.jp/mono/movie/adult/cjod511/cjod511pl.jpg,https://onejav.com/torrent/cjod511/download/39500999/onejav.com_cjod511.torrent,"Big Tits, Cowgirl, Creampie, Gal, Kiss, Solowork",春陽モカ,2026-05-22,https://onejav.com/torrent/cjod511
MNGS056,エッチなお悩みタメ口淫語手コキで「悪い精子出さないとアンタ4ぬよ」搾精解決！チン相GAL生ハメ占い師 春陽モカ,6.4 GB,https://pics.dmm.co.jp/mono/movie/adult/mngs056/mngs056pl.jpg,https://onejav.com/torrent/mngs056/download/75082556/onejav.com_mngs056.torrent,"Big Tits, Creampie, Gal, Handjob, Slut, Solowork",春陽モカ,2026-05-15,https://onejav.com/torrent/mngs056
PPPE423,メイド派遣サービスでやってきたのは…教え子ギャル！？ 教師を財布扱いする生意気デカ乳に悩乱チ○ポ生ハメ中出し10発！ 春陽モカ,4.7 GB,https://pics.dmm.co.jp/mono/movie/adult/pppe423/pppe423pl.jpg,https://onejav.com/torrent/pppe423/download/91468793/onejav.com_pppe423.torrent,"Big Tits, Creampie, Maid, Slender, Solowork, Titty Fuck",春陽モカ,2026-05-15,https://onejav.com/torrent/pppe423
HMN841,春陽モカVS童貞くん 24時間中出し24発射できるまで帰れません！！ ひとつ屋根の下で5人のM男童貞とギャルが監禁モニタリング！早く帰りたいから爆ヌキまくりSP,6.2 GB,https://pics.dmm.co.jp/mono/movie/adult/hmn841/hmn841pl.jpg,https://onejav.com/torrent/hmn841/download/69892598/onejav.com_hmn841.torrent,"3P, 4P, Blow, Creampie, Kiss, Solowork, Virgin Man",春陽モカ,2026-04-24,https://onejav.com/torrent/hmn841
WAAA631,「セックスの練習させてよ！？」男勝りな幼馴染のモカがコンドーム一個だけを持参してまさかのお願い 俺が思ってた以上にモカのカラダは巨乳ですけべでおま○こ気持ちよくって... 初めてのセックスにハマってしまい未熟おま○こに三日三晩の中出しセックス10発 春陽モカ,4.9 GB,https://pics.dmm.co.jp/mono/movie/adult/waaa631/waaa631pl.jpg,https://onejav.com/torrent/waaa631/download/81967772/onejav.com_waaa631.torrent,"Big Tits, Creampie, Gal, School Girls, Slender, Solowork",春陽モカ,2026-04-03,https://onejav.com/torrent/waaa631
CJOD503,入り浸りギャルにマンガを貸した分だけマ○コレンタル 馬乗りビッタンビッタン杭打ちでお礼中出し痴女られる僕 春陽モカ,5.0 GB,https://pics.dmm.co.jp/mono/movie/adult/cjod503/cjod503pl.jpg,https://onejav.com/torrent/cjod503/download/75933839/onejav.com_cjod503.torrent,"Blow, Cowgirl, Gal, Slut, Solowork, Uniform",春陽モカ,2026-03-20,https://onejav.com/torrent/cjod503
PPPE410,【Gスポ経由ポルチオ直撃メッタ突き教育ピストン】 親戚から預かった反抗期巨乳メスガキGALをザーメン逆流種付けプレスで理解らせてやった 春陽モカ,5.0 GB,https://pics.dmm.co.jp/mono/movie/adult/pppe410/pppe410pl.jpg,https://onejav.com/torrent/pppe410/download/39482529/onejav.com_pppe410.torrent,"Big Tits, Creampie, Humiliation, Slender, Solowork, Titty Fuck",春陽モカ,2026-03-13,https://onejav.com/torrent/pppe410
