code,title,size,image_url,torrent_url,tags,actresses,date,page_url
KUSE043,大量の腸汁ダクダクダクダク超キバリイキ 爆＊アゲ浣腸噴射 覚醒ギャルアナル 有星あおり,10.4 GB,https://pics.dmm.co.jp/mono/movie/adult/1kuse043/1kuse043pl.jpg,https://onejav.com/torrent/kuse043/download/07922924/onejav.com_kuse043.torrent,"Anal Sex, Close Up, Enema, Gal, Planning, Solowork",有星あおり,2026-06-30,https://onejav.com/torrent/kuse043
IENF394,サエない僕を不憫に思った美人な姉に「擦りつけるだけだよ」という約束で素股してもらっていたら互いに気持ち良すぎてマ○コはグッショリ！でヌルっと生挿入！「え！？入ってる？」でもどうにも止まらなくて中出し！（IENF-394）,5.0 GB,https://pics.dmm.co.jp/mono/movie/adult/1ienf394/1ienf394pl.jpg,https://onejav.com/torrent/ienf394/download/31101717/onejav.com_ienf394.torrent,"Creampie, Prank, Slut","小那海あや, 有星あおり, Amiri Saitou",2026-01-07,https://onejav.com/torrent/ienf394
HNTRZ023,巨乳スレンダーギャルをおっさんから守ったら、お礼にと手を引かれて連れてこられたのはラブホ。男を虜にするハーレム小悪魔ギャル宮城。 有星あおり 柚木ひなた 瀬那ルミナ,6.2 GB,https://pics.dmm.co.jp/mono/movie/adult/hntrz023/hntrz023pl.jpg,https://onejav.com/torrent/hntrz023/download/76796546/onejav.com_hntrz023.torrent,"Creampie, Gal, Harem, Slender, Slut","有星あおり, 柚木ひなた, 瀬那ルミナ",2025-09-19,https://onejav.com/torrent/hntrz023
IENF382,対戦相手は巨根AV男優！？罰ゲームは即ハメ生中出し！かわいすぎるシロウト女子大生が必死にイキ耐える 凄いテク我慢ゲームにチャレンジ！ 6,6.4 GB,https://pics.dmm.co.jp/mono/movie/adult/1ienf382/1ienf382pl.jpg,https://onejav.com/torrent/ienf382/download/71842678/onejav.com_ienf382.torrent,"BIGセール, Creampie, Female College Student, Nampa","天馬ゆい, 有星あおり, Amiri Saitou",2025-04-10,https://onejav.com/torrent/ienf382
IENF369,素人女子大生が高額バイト代につられてヌードデッサンモデルに！マ〇コのビラビラまで丁寧に描かれる羞恥にマ〇コはグッショリ！生で挿入されてイキまくり！ 8,5.2 GB,https://pics.dmm.co.jp/mono/movie/adult/1ienf369/1ienf369pl.jpg,https://onejav.com/torrent/ienf369/download/98686853/onejav.com_ienf369.torrent,"Beautiful Girl, Creampie","Nozomi Arimura, Rie Miyagi, 有星あおり",2025-03-06,https://onejav.com/torrent/ienf369
IESP750,有星あおり レズ解禁 悪ノリゲームで気付いた親友としてではない’好き’,4.0 GB,https://pics.dmm.co.jp/mono/movie/adult/1iesp750/1iesp750pl.jpg,https://onejav.com/torrent/iesp750/download/50890298/onejav.com_iesp750.torrent,"Drama, Slender","有星あおり, Nozomi Arimura",2025-01-09,https://onejav.com/torrent/iesp750
GDRD012,Red Dragon 有星あおり,7.2 GB,https://pics.dmm.co.jp/mono/movie/adult/gdrd012/gdrd012pl.jpg,https://onejav.com/torrent/gdrd012/download/22548798/onejav.com_gdrd012.torrent,"Creampie, Gal, Prostitutes, Solowork, Sun tan, Titty Fuck",有星あおり,2023-12-09,https://onejav.com/torrent/gdrd012
NKD276,Women Who Have Requested Training For Female Body Humiliation,11.7 GB,https://pics.dmm.co.jp/mono/movie/adult/nkd276/nkd276pl.jpg,https://onejav.com/torrent/nkd276/download/57833660/onejav.com_nkd276.torrent,"4HR+, Nasty, Hardcore, Restraints, SM","有星あおり, 橋野愛琉, 岬あずさ, 麻倉ゆあ",2021-05-30,https://onejav.com/torrent/nkd276
PLY005,Galla Camp Mana Hirano / Aori Arihoshi,8.2 GB,https://pics.dmm.co.jp/mono/movie/adult/h_1557ply005/h_1557ply005pl.jpg,https://onejav.com/torrent/ply005/download/82711908/onejav.com_ply005.torrent,"Documentary, Outdoors, Planning, Squirting","平野まな, 有星あおり",2021-03-09,https://onejav.com/torrent/ply005
MDTM628,A Helping Girl Who Opens Her Crotch Vulgarly Without Matching Her Face. Two,4.0 GB,https://pics.dmm.co.jp/mono/movie/adult/84mdtm628/84mdtm628pl.jpg,https://onejav.com/torrent/mdtm628/download/94736135/onejav.com_mdtm628.torrent,"4HR+, Beautiful Girl, Creampie, School Girls, Toy, Uniform","永瀬ゆい, 有星あおり, 南野あさひ, 弥生みづき",2020-04-18,https://onejav.com/torrent/mdtm628
