code,title,size,image_url,torrent_url,tags,actresses,date,page_url
START590,よっぱらうとフェラ魔になるバイト先の優しい先輩 童貞のボクは即尺タマ舐めアナル舐めで腰砕けになるほどブッ濃い精子をドバドバ搾られた 柴崎はる,4.7 GB,https://pics.dmm.co.jp/mono/movie/adult/1start590/1start590pl.jpg,https://onejav.com/torrent/start590/download/48181322/onejav.com_start590.torrent,"Bitch, Blow, Drinking Party, Instructor, Solowork, Virgin Man",柴崎はる,2026-07-07,https://onejav.com/torrent/start590
START571,受胎病棟 来月結婚する後輩女医が夜勤中休憩しているところに何度も特濃精子を中出しして幸せな将来を破壊してやる 柴崎はる,5.6 GB,https://pics.dmm.co.jp/mono/movie/adult/1start571/1start571pl.jpg,https://onejav.com/torrent/start571/download/46720939/onejav.com_start571.torrent,"Creampie, Cuckold, Drama, Female Doctor, Hospital, Clinic, Solowork",柴崎はる,2026-06-02,https://onejav.com/torrent/start571
START535,柴崎はるちゃんが男性専用サウナに潜入チャレンジ！つるぺたおっぱいを震わせ羞恥に耐えるも女バレしてハメられちゃいました,6.4 GB,https://pics.dmm.co.jp/mono/movie/adult/1start535/1start535pl.jpg,https://onejav.com/torrent/start535/download/60525536/onejav.com_start535.torrent,"Bath, Creampie, Orgy, Small Tits, Solowork, Sweat",柴崎はる,2026-05-05,https://onejav.com/torrent/start535
START526,【中イキ＆外イキ】アクメチャリ・ピストンバイブ・電マでイカされて「もうイッてるからぁぁ」中イキ直後も電マで責められ両アクメ・超胸揺れピストン 柴崎はる,5.2 GB,https://pics.dmm.co.jp/mono/movie/adult/1start526/1start526pl.jpg,https://onejav.com/torrent/start526/download/63386244/onejav.com_start526.torrent,"Acme · Orgasm, Back, BIGセール, Planning, Solowork, Toy, Vibe",柴崎はる,2026-03-10,https://onejav.com/torrent/start526
START504,無限性欲おばけの宮島めいちゃん柴崎はるちゃんがファン9名とイクっ！無制限発射OK日帰り温泉ツアー,6.6 GB,https://pics.dmm.co.jp/mono/movie/adult/1start504/1start504pl.jpg,https://onejav.com/torrent/start504/download/48863392/onejav.com_start504.torrent,"Blow, Creampie, Fan Appreciation, Harem, Orgy","Mei Miyajima, 柴崎はる",2026-02-24,https://onejav.com/torrent/start504
START507,「お前、胸あるのか？」美少年系バイト女子が引っ越し現場でセクハラされまくって…汗臭上司のデカチンにイカされ続けた 柴崎はる,6.5 GB,https://pics.dmm.co.jp/mono/movie/adult/1start507/1start507pl.jpg,https://onejav.com/torrent/start507/download/73371978/onejav.com_start507.torrent,"Back, Blow, Drama, Planning, Solowork",柴崎はる,2026-02-03,https://onejav.com/torrent/start507
START487,夏、再会、そしてハメ撮り。台本無しで汗だくで抱き合った真夏のセックスドキュメント 柴崎はる,6.7 GB,https://pics.dmm.co.jp/mono/movie/adult/1start487/1start487pl.jpg,https://onejav.com/torrent/start487/download/90069643/onejav.com_start487.torrent,"Blow, Cowgirl, Cunnilingus, Documentary, POV, Solowork",柴崎はる,2026-01-06,https://onejav.com/torrent/start487
START460,【性処理救助】避難生活で正義感あふれる災害レスキュー隊員が救助の一環として、集団中出しを受け入れるまでの1か月間 柴崎はる,5.8 GB,https://pics.dmm.co.jp/mono/movie/adult/1start460/1start460pl.jpg,https://onejav.com/torrent/start460/download/44908681/onejav.com_start460.torrent,"Back, Cowgirl, Cunnilingus, Drama, Handjob, Solowork",柴崎はる,2025-12-02,https://onejav.com/torrent/start460
START434,引きこもり社不女、能力:時間停止 柴崎はる,5.6 GB,https://pics.dmm.co.jp/mono/movie/adult/1start434/1start434pl.jpg,https://onejav.com/torrent/start434/download/33473600/onejav.com_start434.torrent,"Planning, Prank, Solowork, Time Stop",柴崎はる,2025-11-04,https://onejav.com/torrent/start434
START417,キモメンおじさん大大好き性交！！ 柴崎はる,6.0 GB,https://pics.dmm.co.jp/mono/movie/adult/1start417/1start417pl.jpg,https://onejav.com/torrent/start417/download/93938388/onejav.com_start417.torrent,"BIGセール, Documentary, Facials, Kiss, Small Tits, Solowork",柴崎はる,2025-10-07,https://onejav.com/torrent/start417
