code,title,size,image_url,torrent_url,tags,actresses,date,page_url
PYM570,今日は私で精子出してっ 自撮りちんしこ誘惑見せ合いオナニー,7.6 GB,https://pics.dmm.co.jp/mono/movie/adult/h_283pym570/h_283pym570pl.jpg,https://onejav.com/torrent/pym570/download/65005510/onejav.com_pym570.torrent,"4HR+, Big Tits, Breasts, Masturbation, Slut","天月あず, 谷村凪咲, 月乃ことね, 白雪美月, 森かおり, 碧那美海, 宇佐美すい, 朝妃りお, 山下紗和, 森亜秋",2026-07-15,https://onejav.com/torrent/pym570
JUR690,絶対にバレてはいけない関係性―。 彼女の母は憂さ晴らし専用マゾ乳ペット 森かおり,4.6 GB,https://pics.dmm.co.jp/mono/movie/adult/jur690/jur690pl.jpg,https://onejav.com/torrent/jur690/download/70542225/onejav.com_jur690.torrent,"Creampie, Drama, Married Woman, Mature Woman, SM, Solowork",森かおり,2026-03-06,https://onejav.com/torrent/jur690
JUR650,中出し接待NTR 廃業寸前の温泉宿が三ツ星旅館になった理由ー。 森かおり,5.9 GB,https://pics.dmm.co.jp/mono/movie/adult/jur650/jur650pl.jpg,https://onejav.com/torrent/jur650/download/40398446/onejav.com_jur650.torrent,"Cuckold, Hot Spring, Landlady, Hostess, Married Woman, Mature Woman, Solowork",森かおり,2026-02-06,https://onejav.com/torrent/jur650
JUR606,麗しきランジェリー、唾液と精液で汚れた酬いの人妻保険外交員 森かおり,7.8 GB,https://pics.dmm.co.jp/mono/movie/adult/jur606/jur606pl.jpg,https://onejav.com/torrent/jur606/download/34228863/onejav.com_jur606.torrent,"Creampie, Kiss, Lingerie, Married Woman, Mature Woman, Solowork",森かおり,2026-01-09,https://onejav.com/torrent/jur606
JUR574,夫と子作りSEXをした後はいつも義父に中出しされ続けています…。 森かおり,5.6 GB,https://pics.dmm.co.jp/mono/movie/adult/jur574/jur574pl.jpg,https://onejav.com/torrent/jur574/download/98718609/onejav.com_jur574.torrent,"Creampie, Drama, Kiss, Married Woman, Mature Woman, Solowork",森かおり,2025-12-05,https://onejav.com/torrent/jur574
JUR056,奥ゆかしい、その美しさを、より深く―。 新人 美貌と品格を併せ持つ人妻 森かおり 37歳 AV DEBUT,5.1 GB,https://pics.dmm.co.jp/mono/movie/adult/jur056/jur056pl.jpg,https://onejav.com/torrent/jur056/download/50665091/onejav.com_jur056.torrent,"Affair, Big Tits, Debut Production, Married Woman, Mature Woman, Solowork",森かおり,2025-11-07,https://onejav.com/torrent/jur056
