code,title,size,image_url,torrent_url,tags,actresses,date,page_url
NSFS492,嫉妬と勃起と興奮 レンタル妻11 澄河美花,3.2 GB,https://pics.dmm.co.jp/mono/movie/adult/nsfs492/nsfs492pl.jpg,https://onejav.com/torrent/nsfs492/download/39221445/onejav.com_nsfs492.torrent,"Big Tits, Cuckold, Drama, Married Woman, Mature Woman, Solowork",澄河美花,2026-07-11,https://onejav.com/torrent/nsfs492
ODVHJ076,人妻たちのガチイキ丸見えディルドオナニー18,8.0 GB,https://pics.dmm.co.jp/mono/movie/adult/48odvhj076/48odvhj076pl.jpg,https://onejav.com/torrent/odvhj076/download/54103596/onejav.com_odvhj076.torrent,"Big Tits, Dildo, Married Woman, Masturbation, Mature Woman","澄河美花, 三池小春, 玉城夏帆, Miho Tsuno, 盛永いろは, 藤井レイラ, 白峰郁美",2026-05-07,https://onejav.com/torrent/odvhj076
AGMX257,ヨダレ特化！唾液に溺れるツバだくベロチュー手コキ,4.9 GB,https://pics.dmm.co.jp/mono/movie/adult/agmx257/agmx257pl.jpg,https://onejav.com/torrent/agmx257/download/09973506/onejav.com_agmx257.torrent,"Blow, Handjob, Kiss, Other Fetish, Slut","安堂はるの, 澄河美花, 瀬戸ひなこ, 上田紗奈, 相沢澪, 藍澤りく, 織本せりの",2026-04-30,https://onejav.com/torrent/agmx257
PFAS042,夫婦交換の部屋 金のための肉欲契約・熟したカラダに群がる男たち,4.6 GB,https://pics.dmm.co.jp/mono/movie/adult/pfas042/pfas042pl.jpg,https://onejav.com/torrent/pfas042/download/72480996/onejav.com_pfas042.torrent,"Big Tits, Drama, Kiss, Mature Woman, Nasty, Hardcore, Swingers","鈴河めぐみ, 澄河美花",2026-02-14,https://onejav.com/torrent/pfas042
MADV620,「言わないで…」嫁の留守中にモデル級OLの義姉が家に来て…無防備にその曲線美を見せ迫って来た…ガマン出来ない俺は、何度も彼女に中出しをしてしまった… 澄河美花,6.2 GB,https://pics.dmm.co.jp/mono/movie/adult/madv620/madv620pl.jpg,https://onejav.com/torrent/madv620/download/51093573/onejav.com_madv620.torrent,"Affair, Blow, Creampie, Cuckold, Facials, Masturbation, OL, Slut, Solowork, Titty Fuck, Vibe",澄河美花,2026-02-07,https://onejav.com/torrent/madv620
TPPN268,杭打ちピストン＆種付けプレス ぐちょ膣を射抜く！澄河美花の本気の汗だく絶頂セックス,5.1 GB,https://pics.dmm.co.jp/mono/movie/adult/tppn268/tppn268pl.jpg,https://onejav.com/torrent/tppn268/download/12848098/onejav.com_tppn268.torrent,"Big Tits, BIGセール, Cowgirl, Creampie, Nasty, Hardcore, Solowork, Sweat",澄河美花,2025-12-19,https://onejav.com/torrent/tppn268
ODVHJ068,人妻不倫性交流出動画,7.5 GB,https://pics.dmm.co.jp/mono/movie/adult/48odvhj068/48odvhj068pl.jpg,https://onejav.com/torrent/odvhj068/download/01911574/onejav.com_odvhj068.torrent,"Big Tits, Creampie, Cuckold, Huge Cock, Married Woman, Mature Woman","大原理央, 河北笑茉, 澄河美花, Azu Komatsu",2025-10-27,https://onejav.com/torrent/odvhj068
ALDN518,中出しの快楽に堕ちた妻 澄河美花,5.7 GB,https://pics.dmm.co.jp/mono/movie/adult/aldn518/aldn518pl.jpg,https://onejav.com/torrent/aldn518/download/86791976/onejav.com_aldn518.torrent,"Big Tits, Creampie, Cuckold, Married Woman, Mature Woman, Solowork",澄河美花,2025-10-25,https://onejav.com/torrent/aldn518
VEC727,頼れる美人妻は職場の後輩たちに口説かれ犯●れまくる 澄河美花,4.4 GB,https://pics.dmm.co.jp/mono/movie/adult/vec727/vec727pl.jpg,https://onejav.com/torrent/vec727/download/91203491/onejav.com_vec727.torrent,"Big Tits, Creampie, Married Woman, Mature Woman, Orgy, Solowork",澄河美花,2025-08-29,https://onejav.com/torrent/vec727
HOKS203,借金妻 絶頂に濡れる日々 町内会長に300万/お義父さまからのご支援 澄河美花,4.0 GB,https://pics.dmm.co.jp/mono/movie/adult/hoks203/hoks203pl.jpg,https://onejav.com/torrent/hoks203/download/25240459/onejav.com_hoks203.torrent,"Big Tits, BIGセール, Drama, Married Woman, Mature Woman, Nasty, Hardcore, Solowork",澄河美花,2025-08-23,https://onejav.com/torrent/hoks203
