code,title,size,image_url,torrent_url,tags,actresses,date,page_url
RCTD734,チクチン 乳首が肉棒になってる実写AVください！,3.7 GB,https://pics.dmm.co.jp/mono/movie/adult/1rctd734/1rctd734pl.jpg,https://onejav.com/torrent/rctd734/download/86317305/onejav.com_rctd734.torrent,"3P, 4P, Delusion, Futanari, OL, Other Fetish, Planning","浅風ゆい, 新村あかり, 瀬戸ひなこ",2026-06-20,https://onejav.com/torrent/rctd734
WA586,「私を目で壊してっ！」淫乱妻オナニー独白 本能がバグる自撮り妻 10名,4.8 GB,https://pics.dmm.co.jp/mono/movie/adult/h_047wa586/h_047wa586pl.jpg,https://onejav.com/torrent/wa586/download/71199011/onejav.com_wa586.torrent,"Acme · Orgasm, Married Woman, Masturbation, Nasty, Hardcore","花衣つばき, 工藤ゆり, 花撫あや, 五芭, 真城かのん, 間宮詩, 瀬戸ひなこ, 北村海智, あすかみおん, 大原理央",2026-05-17,https://onejav.com/torrent/wa586
DASS955,憧れの女社長には巨根が生えていた。権力とち○ぽに屈服し、婚約者を裏切る完全調教NTR 池田マリナ 瀬戸ひなこ,4.8 GB,https://pics.dmm.co.jp/mono/movie/adult/dass955/dass955pl.jpg,https://onejav.com/torrent/dass955/download/33786302/onejav.com_dass955.torrent,"Affair, Cuckold, Female Boss, OL, Transsexual","池田マリナ, 瀬戸ひなこ",2026-05-08,https://onejav.com/torrent/dass955
MKON134,マチアプでJDと待ち合わせしたつもりがJ系が来た 捕まりたくないけど欲望に負けて中出しSEX！！ 瀬戸ひなこ,4.8 GB,https://pics.dmm.co.jp/mono/movie/adult/mkon134/mkon134pl.jpg,https://onejav.com/torrent/mkon134/download/24981018/onejav.com_mkon134.torrent,"Beautiful Girl, Creampie, School Girls, School Uniform, Slut, Solowork",瀬戸ひなこ,2026-05-02,https://onejav.com/torrent/mkon134
AGMX257,ヨダレ特化！唾液に溺れるツバだくベロチュー手コキ,4.9 GB,https://pics.dmm.co.jp/mono/movie/adult/agmx257/agmx257pl.jpg,https://onejav.com/torrent/agmx257/download/45727575/onejav.com_agmx257.torrent,"Blow, Handjob, Kiss, Other Fetish, Slut","安堂はるの, 澄河美花, 瀬戸ひなこ, 上田紗奈, 相沢澪, 藍澤りく, 織本せりの",2026-04-30,https://onejav.com/torrent/agmx257
PFES118,猛烈イラマで苦しみ果て こってり精子とエヅキ愛液に溺れる 喉奥射精シンデレラ 瀬戸ひなこ,8.1 GB,https://pics.dmm.co.jp/mono/movie/adult/pfes118/pfes118pl.jpg,https://onejav.com/torrent/pfes118/download/07846573/onejav.com_pfes118.torrent,"Beautiful Girl, Cum, Deep Throating, M女, Nasty, Hardcore, Solowork",瀬戸ひなこ,2026-03-27,https://onejav.com/torrent/pfes118
AGAV162,足裏フェチシズム ～変態に寛容なギャルなので、ぜひ足マ〇コをじっくり堪能させていただきたい～ 瀬戸ひなこ,5.0 GB,https://pics.dmm.co.jp/mono/movie/adult/agav162/agav162pl.jpg,https://onejav.com/torrent/agav162/download/76075156/onejav.com_agav162.torrent,"Beauty Shop, Footjob, Leg Fetish, Other Fetish, School Uniform, Solowork",瀬戸ひなこ,2026-02-21,https://onejav.com/torrent/agav162
AGMX255,顔で抜く！！顔面ドアップ主観フェラ,4.3 GB,https://pics.dmm.co.jp/mono/movie/adult/agmx255/agmx255pl.jpg,https://onejav.com/torrent/agmx255/download/89015597/onejav.com_agmx255.torrent,"Beautiful Girl, Blow, Handjob, Other Fetish, Subjectivity","橘内ひなた, 兼咲みゆ, 甘井くるみ, Yuina Taki, 相沢澪, 安堂はるの, 瀬戸ひなこ",2026-01-24,https://onejav.com/torrent/agmx255
PYM547,アナタは私専用おちん○ん！ 騎乗位特化ディルドオナニー,10.4 GB,https://pics.dmm.co.jp/mono/movie/adult/h_283pym547/h_283pym547pl.jpg,https://onejav.com/torrent/pym547/download/21087793/onejav.com_pym547.torrent,"4HR+, Breasts, Masturbation, Older Sister, Toy","虹村ゆみ, 幸村紀那, 望月ふうか, 工藤ゆり, 椿りか, 真城かのん, 千川とわ, 若月もあ, 瀬戸ひなこ, 蒼まりな",2026-01-15,https://onejav.com/torrent/pym547
MADV607,令和版 私は痴女 ひなみ×りんか×ひなこ,7.2 GB,https://pics.dmm.co.jp/mono/movie/adult/madv607/madv607pl.jpg,https://onejav.com/torrent/madv607/download/36747622/onejav.com_madv607.torrent,"Big Tits, Cum, Facesitting, Huge Cock, Married Woman, Shaved, Slender, Slut, Squirting, Titty Fuck","石川陽波, 雨村梨花, 瀬戸ひなこ",2025-10-25,https://onejav.com/torrent/madv607
