code,title,size,image_url,torrent_url,tags,actresses,date,page_url
ODVHJ078,某都内サウナにいた綺麗で色っぽいアカスリおばさん妻たちと性交できたエロ話…（4）,7.7 GB,https://pics.dmm.co.jp/mono/movie/adult/48odvhj078/48odvhj078pl.jpg,https://onejav.com/torrent/odvhj078/download/03385804/onejav.com_odvhj078.torrent,"Big Tits, Creampie, Cuckold, Huge Cock, Married Woman, Massage, Mature Woman","白峰郁美, 月野夜宵, 宮ノ木しゅんか, 東ふうか",2026-07-14,https://onejav.com/torrent/odvhj078
HOKS221,熟女濃厚接吻 エリート議員43才の卑猥なる下半身 白峰郁美,4.1 GB,https://pics.dmm.co.jp/mono/movie/adult/hoks221/hoks221pl.jpg,https://onejav.com/torrent/hoks221/download/30638271/onejav.com_hoks221.torrent,"Big Tits, Drama, Huge Butt, Kiss, Mature Woman, Nasty, Hardcore, Solowork",白峰郁美,2026-05-25,https://onejav.com/torrent/hoks221
ODVHJ076,人妻たちのガチイキ丸見えディルドオナニー18,8.0 GB,https://pics.dmm.co.jp/mono/movie/adult/48odvhj076/48odvhj076pl.jpg,https://onejav.com/torrent/odvhj076/download/50677996/onejav.com_odvhj076.torrent,"Big Tits, Dildo, Married Woman, Masturbation, Mature Woman","澄河美花, 三池小春, 玉城夏帆, Miho Tsuno, 盛永いろは, 藤井レイラ, 白峰郁美",2026-05-07,https://onejav.com/torrent/odvhj076
JBD304,あなた、許して…。緊縛特別版 縄に堕ちた私 白峰郁美,4.8 GB,https://pics.dmm.co.jp/mono/movie/adult/jbd304/jbd304pl.jpg,https://onejav.com/torrent/jbd304/download/06811157/onejav.com_jbd304.torrent,"Affair, Cuckold, Married Woman, Restraints, SM, Solowork",白峰郁美,2026-03-02,https://onejav.com/torrent/jbd304
NSFS428,熟母37 ～シングルマザーの肉体教育～ 白峰郁美,5.0 GB,https://pics.dmm.co.jp/mono/movie/adult/nsfs428/nsfs428pl.jpg,https://onejav.com/torrent/nsfs428/download/75886357/onejav.com_nsfs428.torrent,"Big Tits, Drama, Incest, Mature Woman, Mother, Solowork",白峰郁美,2025-11-08,https://onejav.com/torrent/nsfs428
SAME180,兄が犯したのは、僕の初恋の人だった。 白峰郁美,6.6 GB,https://pics.dmm.co.jp/mono/movie/adult/same180/same180pl.jpg,https://onejav.com/torrent/same180/download/36109398/onejav.com_same180.torrent,"Creampie, Drama, Female Teacher, Humiliation, Solowork",白峰郁美,2025-08-29,https://onejav.com/torrent/same180
JUR291,体育館がみんなと先生のラブホテル 白峰郁美,6.8 GB,https://pics.dmm.co.jp/mono/movie/adult/jur291/jur291pl.jpg,https://onejav.com/torrent/jur291/download/34120992/onejav.com_jur291.torrent,"Big Tits, Creampie, Female Teacher, Married Woman, Mature Woman, Solowork",白峰郁美,2025-05-09,https://onejav.com/torrent/jur291
JUR227,愛する夫の為に、身代わり週末肉便器。 超絶倫極悪オヤジに、孕むまで何度も中出しされ続けて…。 白峰郁美,7.5 GB,https://pics.dmm.co.jp/mono/movie/adult/jur227/jur227pl.jpg,https://onejav.com/torrent/jur227/download/42789292/onejav.com_jur227.torrent,"Big Tits, Conceived, Creampie, Married Woman, Mature Woman, Solowork",白峰郁美,2025-04-04,https://onejav.com/torrent/jur227
JUR201,身も心も相性抜群の2人ー。‘想い’と‘唇’が重なる濃密接吻ソープ 白峰郁美,7.1 GB,https://pics.dmm.co.jp/mono/movie/adult/jur201/jur201pl.jpg,https://onejav.com/torrent/jur201/download/44970536/onejav.com_jur201.torrent,"Big Tits, Creampie, Married Woman, Mature Woman, Soapland, Solowork",白峰郁美,2025-03-07,https://onejav.com/torrent/jur201
JUR166,人妻秘書、汗と接吻に満ちた社長室中出し性交 妖熟の淫乳秘書、登場―。 白峰郁美,6.3 GB,https://pics.dmm.co.jp/mono/movie/adult/jur166/jur166pl.jpg,https://onejav.com/torrent/jur166/download/81925164/onejav.com_jur166.torrent,"Big Tits, Creampie, Mature Woman, Secretary, Solowork",白峰郁美,2025-02-07,https://onejav.com/torrent/jur166
