code,title,size,image_url,torrent_url,tags,actresses,date,page_url
PYM570,今日は私で精子出してっ 自撮りちんしこ誘惑見せ合いオナニー,7.6 GB,https://pics.dmm.co.jp/mono/movie/adult/h_283pym570/h_283pym570pl.jpg,https://onejav.com/torrent/pym570/download/65005510/onejav.com_pym570.torrent,"4HR+, Big Tits, Breasts, Masturbation, Slut","天月あず, 谷村凪咲, 月乃ことね, 白雪美月, 森かおり, 碧那美海, 宇佐美すい, 朝妃りお, 山下紗和, 森亜秋",2026-07-15,https://onejav.com/torrent/pym570
XMOM115,ベロナメ変態倶楽部 むっちりドマゾな巨乳奥様は妖艶なベロでデカチン舐め回す。 白雪美月,3.6 GB,https://pics.dmm.co.jp/mono/movie/adult/h_086xmom115/h_086xmom115pl.jpg,https://onejav.com/torrent/xmom115/download/51998563/onejav.com_xmom115.torrent,"3P, 4P, BBW, Big Tits, Creampie, Mature Woman, Solowork",白雪美月,2026-06-20,https://onejav.com/torrent/xmom115
BBTU114,ぱいシャ！ アヘ顔巨乳にザーメンぶっかけ 白雪美月,5.0 GB,https://pics.dmm.co.jp/mono/movie/adult/bbtu114/bbtu114pl.jpg,https://onejav.com/torrent/bbtu114/download/41356510/onejav.com_bbtu114.torrent,"BBW, Big Tits, Lotion, Orgy, Solowork, Titty Fuck",白雪美月,2026-05-18,https://onejav.com/torrent/bbtu114
FJIN139,パイ活！！オイルぬるぬるLcup爆乳ギャルと温泉デート 白雪美月,5.5 GB,https://pics.dmm.co.jp/mono/movie/adult/fjin139/fjin139pl.jpg,https://onejav.com/torrent/fjin139/download/44643325/onejav.com_fjin139.torrent,"BBW, Busty Fetish, Hot Spring, Lotion, Outdoors, Solowork",白雪美月,2026-05-02,https://onejav.com/torrent/fjin139
URE138,シリーズ累計35万DL！！ 殿堂入り逆3Pハーレム同人が三度実写化！！ 原作:サークルしまぱん 巨乳が二人いないと勃起しない夫のために友達を連れてきた妻3,6.1 GB,https://pics.dmm.co.jp/mono/movie/adult/ure138/ure138pl.jpg,https://onejav.com/torrent/ure138/download/54774914/onejav.com_ure138.torrent,"3P, 4P, Big Tits, Married Woman, Mature Woman, Original Collaboration","橘メアリー, 白雪美月",2026-04-10,https://onejav.com/torrent/ure138
FJIN131,親の再婚でできた義姉は喪女だらしないのにエロすぎた無防備巨乳な姉に杭打ち中出しされた僕… 白雪美月,5.4 GB,https://pics.dmm.co.jp/mono/movie/adult/fjin131/fjin131pl.jpg,https://onejav.com/torrent/fjin131/download/23466708/onejav.com_fjin131.torrent,"BBW, Big Tits, Creampie, Sister, Solowork, Titty Fuck",白雪美月,2026-04-04,https://onejav.com/torrent/fjin131
TNJS003,天然爆乳田舎娘のノーブラ東京観光～美月ちゃん（Iカップ・105cm） 白雪美月,4.8 GB,https://pics.dmm.co.jp/mono/movie/adult/tnjs003/tnjs003pl.jpg,https://onejav.com/torrent/tnjs003/download/86600350/onejav.com_tnjs003.torrent,"Big Tits, Blow, Car Sex, Shame, Solowork, Toy",白雪美月,2026-01-17,https://onejav.com/torrent/tnjs003
VENX359,「見つめすぎ！そんなに私のおっぱい気になるの？」巨乳の叔母が僕を誘惑する耳元の囁きと密着セックス 白雪美月,5.0 GB,https://pics.dmm.co.jp/mono/movie/adult/venx359/venx359pl.jpg,https://onejav.com/torrent/venx359/download/49677609/onejav.com_venx359.torrent,"Aunt, Big Tits, Creampie, Married Woman, Mature Woman, Solowork",白雪美月,2026-01-16,https://onejav.com/torrent/venx359
HBAD725,デカチンの先輩に目をつけられて寝取られたLカップ爆乳彼女 白雪美月,5.2 GB,https://pics.dmm.co.jp/mono/movie/adult/1hbad725/1hbad725pl.jpg,https://onejav.com/torrent/hbad725/download/14482241/onejav.com_hbad725.torrent,Solowork,白雪美月,2026-01-08,https://onejav.com/torrent/hbad725
YMDD473,群がる蟲舌 無数の舌にねっとり舐め嬲られて絶頂を迎える女たち,4.2 GB,https://pics.dmm.co.jp/mono/movie/adult/ymdd473/ymdd473pl.jpg,https://onejav.com/torrent/ymdd473/download/93276897/onejav.com_ymdd473.torrent,"3P, 4P, Acme · Orgasm, Big Tits, Creampie, Deep Throating","羽月乃蒼, 白雪美月",2025-11-29,https://onejav.com/torrent/ymdd473
