code,title,size,image_url,torrent_url,tags,actresses,date,page_url
DDK239,完全服従 一日性奴● 碧那美海,4.6 GB,https://pics.dmm.co.jp/mono/movie/adult/ddk239/ddk239pl.jpg,https://onejav.com/torrent/ddk239/download/87569868/onejav.com_ddk239.torrent,"Confinement, Deep Throating, Evil, Humiliation, Solowork",碧那美海,2026-06-13,https://onejav.com/torrent/ddk239
NSFS484,2泊3日のキャンプ 町内会まわしテント6 オヤジたちに何度も中出しされた私の妻 碧那美海,4.3 GB,https://pics.dmm.co.jp/mono/movie/adult/nsfs484/nsfs484pl.jpg,https://onejav.com/torrent/nsfs484/download/66687195/onejav.com_nsfs484.torrent,"Big Tits, Creampie, Drama, Married Woman, Solowork",碧那美海,2026-06-06,https://onejav.com/torrent/nsfs484
SMOK039,【ベロ接吻セクハラ】残業中のオフィスで二人きり、よだれダラダラ濡れ長舌をねじ込み密着濃厚ベロちゅうしながら若手精子を搾り取る人妻巨乳女上司 碧那美海,6.0 GB,https://pics.dmm.co.jp/mono/movie/adult/smok039/smok039pl.jpg,https://onejav.com/torrent/smok039/download/63284592/onejav.com_smok039.torrent,"Big Tits, Creampie, Kiss, OL, Solowork",碧那美海,2026-05-30,https://onejav.com/torrent/smok039
GVH844,母娘親子丼レ×プ 性処理肉便器として孕むまで連続中出し輪●され続けた親子連鎖 皆瀬あかり/碧那美海,6.7 GB,https://pics.dmm.co.jp/mono/movie/adult/gvh844/gvh844pl.jpg,https://onejav.com/torrent/gvh844/download/47361701/onejav.com_gvh844.torrent,"Creampie, Deep Throating, Married Woman, Orgy, School Girls","皆瀬あかり, 碧那美海",2026-05-09,https://onejav.com/torrent/gvh844
MGMQ167,M男がみんな夢中になる保健室のアナル責め先生。碧那美海,4.7 GB,https://pics.dmm.co.jp/mono/movie/adult/mgmq167/mgmq167pl.jpg,https://onejav.com/torrent/mgmq167/download/51255520/onejav.com_mgmq167.torrent,"Anal, Blow, Handjob, M男, Slut, Solowork",碧那美海,2026-04-18,https://onejav.com/torrent/mgmq167
RCTD724,妄想エッチなオカルトシリーズ エイリアン・アブダクション ～私はUFOに連れ去られ宇宙人の子供を孕まされました～,3.3 GB,https://pics.dmm.co.jp/mono/movie/adult/1rctd724/1rctd724pl.jpg,https://onejav.com/torrent/rctd724/download/28352975/onejav.com_rctd724.torrent,"BIGセール, Conceived, Creampie, Planning, Restraint, School Girls, SF","碧那美海, 尋井うみ, 吉井美希",2026-03-17,https://onejav.com/torrent/rctd724
