code,title,size,image_url,torrent_url,tags,actresses,date,page_url
MIDA688,NTR ゲス上司と結婚直前ネトラレ ダメと言いながらカラダは拒絶しなかった婚約者カノジョ 福田ゆあ,5.4 GB,https://pics.dmm.co.jp/mono/movie/adult/mida688/mida688pl.jpg,https://onejav.com/torrent/mida688/download/54804010/onejav.com_mida688.torrent,"Blow, Cuckold, Kiss, OL, Slender, Solowork",福田ゆあ,2026-07-03,https://onejav.com/torrent/mida688
MIDA652,「もう射精してるってばぁ！」状態でも汗だくベロキスで塞いで何度も跨ってくる痴女お姉さん 福田ゆあ,5.5 GB,https://pics.dmm.co.jp/mono/movie/adult/mida652/mida652pl.jpg,https://onejav.com/torrent/mida652/download/57893483/onejav.com_mida652.torrent,"Beautiful Girl, Big Tits, Kiss, Slut, Solowork, Sweat",福田ゆあ,2026-05-29,https://onejav.com/torrent/mida652
MIDA616,彼女の妹のノーブラ誘惑に負け巨乳ナマ乳沼に溺れたサイテーなボク 福田ゆあ,5.3 GB,https://pics.dmm.co.jp/mono/movie/adult/mida616/mida616pl.jpg,https://onejav.com/torrent/mida616/download/79977739/onejav.com_mida616.torrent,"Big Tits, Cuckold, No Bra, Sister, Solowork, Uniform",福田ゆあ,2026-05-01,https://onejav.com/torrent/mida616
MIDA543,ゆあ汁まみれ ノンストップ320絶頂×痙攣2201ビクビク×オーガズム汁5990cc 禁欲明け敏感よわよわおま☆こ即堕ちイッてるってばぁ！追撃アクメスペシャル 福田ゆあ,6.8 GB,https://pics.dmm.co.jp/mono/movie/adult/mida543/mida543pl.jpg,https://onejav.com/torrent/mida543/download/79595540/onejav.com_mida543.torrent,"3P, 4P, Acme · Orgasm, Facials, Nasty, Hardcore, Solowork, Squirting",福田ゆあ,2026-03-02,https://onejav.com/torrent/mida543
MIDA509,国宝級美少女とお泊りホテルSEX 台本無しのイチャLOVE濃厚淫らにイキまくるガチハメリアル映像 福田ゆあ,5.4 GB,https://pics.dmm.co.jp/mono/movie/adult/mida509/mida509pl.jpg,https://onejav.com/torrent/mida509/download/09971749/onejav.com_mida509.torrent,"Beautiful Girl, Big Tits, Date, Kiss, POV, Solowork",福田ゆあ,2026-01-30,https://onejav.com/torrent/mida509
MIDA470,国宝級美少女 アヘアヘ放心淫れイキ4本番 福田ゆあ,9.8 GB,https://pics.dmm.co.jp/mono/movie/adult/mida470/mida470pl.jpg,https://onejav.com/torrent/mida470/download/85678819/onejav.com_mida470.torrent,"Acme · Orgasm, Beautiful Girl, Big Tits, Huge Cock, Solowork, Squirting",福田ゆあ,2026-01-01,https://onejav.com/torrent/mida470
MIDA438,国宝級美少女 Hcup最強笑顔プリンセス そして、エッロい。大型新人 AV DEBUT MOODYZ創立25周年記念 福田ゆあ,9.7 GB,https://pics.dmm.co.jp/mono/movie/adult/mida438/mida438pl.jpg,https://onejav.com/torrent/mida438/download/13774561/onejav.com_mida438.torrent,"Beautiful Girl, Big Tits, Debut Production, Facials, Solowork, Squirting",福田ゆあ,2025-11-28,https://onejav.com/torrent/mida438
