code,title,size,image_url,torrent_url,tags,actresses,date,page_url
BBAN592,上映中の映画館でまさかギャルにイカされるなんて... 声も出せずエンドロールまでじっくり快楽を植え付けられる羞恥レズ痴●,6.8 GB,https://pics.dmm.co.jp/mono/movie/adult/bban592/bban592pl.jpg,https://onejav.com/torrent/bban592/download/87470178/onejav.com_bban592.torrent,"Beautiful Girl, Big Tits, Lesbian Kiss, Slut","赤名いと, Nozomi Arimura",2026-07-10,https://onejav.com/torrent/bban592
MUKD577,私たち、気持ちいいことにめっちゃドハマり中！ とある日のオフパコ中出し乱交 赤名いと 五芭 虹村ゆみ 二葉エマ,8.4 GB,https://pics.dmm.co.jp/mono/movie/adult/mukd577/mukd577pl.jpg,https://onejav.com/torrent/mukd577/download/84626657/onejav.com_mukd577.torrent,"Creampie, Orgy, POV, School Girls","赤名いと, 五芭, 虹村ゆみ, Ema Futaba",2026-06-12,https://onejav.com/torrent/mukd577
APGH056,優等生だったあの娘 「ちょっと大人になりました」 蕩ける視線でアナル舐めご奉仕 ぬくもり求めて密着性交 赤名いと,5.7 GB,https://pics.dmm.co.jp/mono/movie/adult/apgh056/apgh056pl.jpg,https://onejav.com/torrent/apgh056/download/83160785/onejav.com_apgh056.torrent,"Beautiful Girl, Cum, Facials, Female College Student, POV, Solowork",赤名いと,2026-06-08,https://onejav.com/torrent/apgh056
HSODA119,教え子洗脳。陸上部女子たちの脳内を勝手にいじくり回して、自分の性奴●にする教師。 虹村ゆみ 赤名いと,4.2 GB,https://pics.dmm.co.jp/mono/movie/adult/hsoda119/hsoda119pl.jpg,https://onejav.com/torrent/hsoda119/download/92706627/onejav.com_hsoda119.torrent,"3P, 4P, Bloomers, Blow, Nasty, Hardcore, School Girls","虹村ゆみ, 赤名いと",2026-05-08,https://onejav.com/torrent/hsoda119
CAWD973,女子学生インフルエンサーいと、探してます。情報求む。VLOG中にレ●プ魔に襲われそのまま撮影が生々しいハメ撮り強●記録へ‥ 赤名いと,5.0 GB,https://pics.dmm.co.jp/mono/movie/adult/cawd973/cawd973pl.jpg,https://onejav.com/torrent/cawd973/download/41563799/onejav.com_cawd973.torrent,"Acme · Orgasm, Beautiful Girl, Creampie, M女, Solowork, Uniform",赤名いと,2026-04-03,https://onejav.com/torrent/cawd973
BBAN578,きっとキミは運命の人。2人で168回絶頂しないと帰れません...そんな非日常がくれた濃密な時間と本当の愛。 五芭 赤名いと,10.1 GB,https://pics.dmm.co.jp/mono/movie/adult/bban578/bban578pl.jpg,https://onejav.com/torrent/bban578/download/98515582/onejav.com_bban578.torrent,"4HR+, Beautiful Girl, Breasts, Cosplay, Lesbian Kiss","五芭, 赤名いと",2026-03-06,https://onejav.com/torrent/bban578
KNMB115,駐車場で見つけた無毛つるぺたニートチョロまん家出娘 赤名いと,5.2 GB,https://pics.dmm.co.jp/mono/movie/adult/h_491knmb115/h_491knmb115pl.jpg,https://onejav.com/torrent/knmb115/download/27122778/onejav.com_knmb115.torrent,"Beautiful Girl, Breasts, Creampie, POV, Slender, Solowork",赤名いと,2025-12-27,https://onejav.com/torrent/knmb115
NTRH016,マジックミラーNTRエステ 隣で美乳スレンダーな彼女が寝取られているのに、僕は巨乳お姉さんの凄テクに抗えず、生中セックスしてしまった。 都月るいさ 赤名いと,7.1 GB,https://pics.dmm.co.jp/mono/movie/adult/ntrh016/ntrh016pl.jpg,https://onejav.com/torrent/ntrh016/download/88528186/onejav.com_ntrh016.torrent,"Creampie, Cuckold, Lotion, Massage, Nasty, Hardcore","Ruisa Totsuki, 赤名いと",2025-12-26,https://onejav.com/torrent/ntrh016
AARM329,はたらく女子のベロチュー着衣SEX、フィニッシュは制服にぶっかけ！,6.3 GB,https://pics.dmm.co.jp/mono/movie/adult/aarm329/aarm329pl.jpg,https://onejav.com/torrent/aarm329/download/86299879/onejav.com_aarm329.torrent,"BIGセール, Bukkake, Cowgirl, Kiss, Uniform, Various Professions","Nia, 山口由愛, 赤名いと, 辻早織",2025-12-18,https://onejav.com/torrent/aarm329
MVSD668,相撲部屋のクソ生意気な親方の愛娘に堪忍袋の緒が切れた絶倫力士達が圧迫種付プレス精子逆流しても終わらない追撃中出し輪● 赤名いと,5.4 GB,https://pics.dmm.co.jp/mono/movie/adult/mvsd668/mvsd668pl.jpg,https://onejav.com/torrent/mvsd668/download/01478626/onejav.com_mvsd668.torrent,"Beautiful Girl, Breasts, Creampie, School Girls, School Uniform, Solowork",赤名いと,2025-12-12,https://onejav.com/torrent/mvsd668
