code,title,size,image_url,torrent_url,tags,actresses,date,page_url
NACX174,五十路熟女欲情オナニー21人,11.6 GB,https://pics.dmm.co.jp/mono/movie/adult/h_237nacx174/h_237nacx174pl.jpg,https://onejav.com/torrent/nacx174/download/67057698/onejav.com_nacx174.torrent,"4HR+, Best, Omnibus, Masturbation, Mature Woman","麻生千春, 上島美都子, 大石忍, 小田しおり, 横山紗江子, 小林真梨香, 豊永映美, 古川祥子, 遠藤しおり, 西園寺美緒, ▼すべて表示する",2026-07-05,https://onejav.com/torrent/nacx174
NASK270,流れるような曲線美！スレンダー熟女16人,10.2 GB,https://pics.dmm.co.jp/mono/movie/adult/nask270/nask270pl.jpg,https://onejav.com/torrent/nask270/download/72271929/onejav.com_nask270.torrent,"4HR+, Best, Omnibus, Mature Woman, Slender, Small Tits","麻生千春, 遠藤しおり, 沙原さゆ, 阿部栞菜, 平岡里枝子, 宮沢優里, 羽田つばさ, Ian Hanasaki, 神尾千明, 峰岸カレン, ▼すべて表示する",2025-07-19,https://onejav.com/torrent/nask270
NSFS403,AIリマスター版 極上濃厚エロビデオ もの凄い接吻 名作永久保存版3時間,8.8 GB,https://pics.dmm.co.jp/mono/movie/adult/nsfs403/nsfs403pl.jpg,https://onejav.com/torrent/nsfs403/download/60889477/onejav.com_nsfs403.torrent,"Best, Omnibus, Drama, Kiss, Married Woman, Multiple Story","森野雫, 大友唯愛, 石川さとこ, 真心実, 真白希美, 桜沢まひる, 遠藤しおり, 杉本蘭",2025-07-19,https://onejav.com/torrent/nsfs403
NMEX002,嫁の母に中出しNTR,10.1 GB,https://pics.dmm.co.jp/mono/movie/adult/nmex002/nmex002pl.jpg,https://onejav.com/torrent/nmex002/download/89117256/onejav.com_nmex002.torrent,"Big Tits, Cuckold, Drama, Married Woman, Mature Woman","遠藤しおり, 峰田ななみ, 成宮いろは, 杉岡恵美子",2025-02-15,https://onejav.com/torrent/nmex002
HDKA313,はだかの訪問介護士総集編6人4時間VOL.05,10.2 GB,https://pics.dmm.co.jp/mono/movie/adult/h_237hdka313/h_237hdka313pl.jpg,https://onejav.com/torrent/hdka313/download/52999799/onejav.com_hdka313.torrent,"4HR+, Best, Omnibus, BIGセール, Mature Woman, Other Fetish, Various Professions","金杉里織, 音羽文子, 時田こずえ, 椿あき, 植木翔子, 遠藤しおり",2024-12-05,https://onejav.com/torrent/hdka313
HMIX039,熟年男女の生々しい快楽交尾 ねっとり濃厚な中高年の貪り合うような密着セックス 20人 4時間,10.3 GB,https://pics.dmm.co.jp/mono/movie/adult/hmix039/hmix039pl.jpg,https://onejav.com/torrent/hmix039/download/30034329/onejav.com_hmix039.torrent,"4HR+, Best, Omnibus, Married Woman, Mature Woman, Multiple Story","山口珠理, 伊織涼子, 西園寺美緒, 三ツ瀬祐美子, 豊永映美, 生野光代, 姫川礼子, 遠藤しおり, 美原すみれ, 三枝由梨, ▼すべて表示する",2024-11-23,https://onejav.com/torrent/hmix039
NATR731,まるまる！艶堂しほり2,10.3 GB,https://pics.dmm.co.jp/mono/movie/adult/natr731/natr731pl.jpg,https://onejav.com/torrent/natr731/download/04628628/onejav.com_natr731.torrent,"4HR+, Actress Best, Married Woman, Mature Woman, Slender, Solowork",遠藤しおり,2024-07-20,https://onejav.com/torrent/natr731
UMSO560,おじいちゃんを元気づける為、全裸で介護し、オナニーを見せ、そしてフェラまでしてあげる優しい介護士さんVOL.03,10.2 GB,https://pics.dmm.co.jp/mono/movie/adult/umso560/umso560pl.jpg,https://onejav.com/torrent/umso560/download/76285624/onejav.com_umso560.torrent,"4HR+, Best, Omnibus, Masturbation, Mature Woman, Various Professions","片瀬仁美, 宮本紗央里, 本庄瞳, 加藤あやの, 遠藤しおり, 植木翔子, Waka Ninomiya, 北川礼子, 伊織涼子, 森野雫",2024-07-20,https://onejav.com/torrent/umso560
NACX128,ムラムラがもう我慢できない！美熟女の絶頂オナニー24人VOL.03,9.5 GB,https://pics.dmm.co.jp/mono/movie/adult/h_237nacx128/h_237nacx128pl.jpg,https://onejav.com/torrent/nacx128/download/01213906/onejav.com_nacx128.torrent,"4HR+, Best, Omnibus, Big Tits, Huge Butt, Masturbation, Mature Woman","新村あかり, 羽咲美亜, 遠藤しおり, 夏樹カオル, Nozomi Azuma, 日南まつり, 北川舞, 本郷まや, Yuri Honma, 夕季ちとせ, ▼すべて表示する",2023-10-05,https://onejav.com/torrent/nacx128
