code,title,size,image_url,torrent_url,tags,actresses,date,page_url
GVH860,クソ生意気な巨乳女子マネージャーを完堕ちするまで徹底的にわからせる連続中出し逆襲レ×プ輪●。 黒島玲衣,7.4 GB,https://pics.dmm.co.jp/mono/movie/adult/gvh860/gvh860pl.jpg,https://onejav.com/torrent/gvh860/download/26437345/onejav.com_gvh860.torrent,"3P, 4P, Bloomers, Club Activities, Manager, Creampie, School Girls, Solowork",黒島玲衣,2026-07-11,https://onejav.com/torrent/gvh860
DSOD018,この高飛車女に恨みあるやつ全員集合！超キモメンの粘着バチボコ拷姦で精神崩壊！中出しタン壺誕生SEX！ 黒島玲衣,8.7 GB,https://pics.dmm.co.jp/mono/movie/adult/dsod018/dsod018pl.jpg,https://onejav.com/torrent/dsod018/download/59621034/onejav.com_dsod018.torrent,"Creampie, Deep Throating, Humiliation, Orgy, Solowork",黒島玲衣,2026-07-10,https://onejav.com/torrent/dsod018
UMD1012,入院生活が長すぎて無防備な新人ナースのぱつぱつスケパン尻で毎日勃起してしまう僕11,4.9 GB,https://pics.dmm.co.jp/mono/movie/adult/125umd1012/125umd1012pl.jpg,https://onejav.com/torrent/umd1012/download/16082381/onejav.com_umd1012.torrent,"Handjob, Nurse","あかね麗, 小野坂ゆいか, 黒島玲衣",2026-07-08,https://onejav.com/torrent/umd1012
HMN875,中出ししないと出れない部屋 借金返済がチャラになると集められ狭小空間に閉じ込められた男4人、女1人。 射精する度に返済額が減額し、この部屋を出られるルールのために女ひとりしかいないから中出しされまくったOLの話。 黒島玲衣,6.8 GB,https://pics.dmm.co.jp/mono/movie/adult/hmn875/hmn875pl.jpg,https://onejav.com/torrent/hmn875/download/90951113/onejav.com_hmn875.torrent,"Blow, Creampie, Kiss, Nasty, Hardcore, Orgy, Solowork",黒島玲衣,2026-06-19,https://onejav.com/torrent/hmn875
SQTE691,休日に彼女と。酔いに任せて 脳まで気持ち良い中出し温泉SEX 黒島玲衣,3.9 GB,https://pics.dmm.co.jp/mono/movie/adult/sqte691/sqte691pl.jpg,https://onejav.com/torrent/sqte691/download/18740472/onejav.com_sqte691.torrent,"Beautiful Girl, Blow, Creampie, Hot Spring, Masturbation, Solowork",黒島玲衣,2026-06-13,https://onejav.com/torrent/sqte691
SOAV137,人妻の浮気心 黒島玲衣,5.9 GB,https://pics.dmm.co.jp/mono/movie/adult/soav137/soav137pl.jpg,https://onejav.com/torrent/soav137/download/29895806/onejav.com_soav137.torrent,"Affair, Big Tits, Creampie, Married Woman, Solowork",黒島玲衣,2026-05-31,https://onejav.com/torrent/soav137
MIAB669,顔面特化 黒島玲衣のバイノーラル淫語オナニーサポートとおま●こドアップ騎乗位2D,4.4 GB,https://pics.dmm.co.jp/mono/movie/adult/miab669/miab669pl.jpg,https://onejav.com/torrent/miab669/download/81832333/onejav.com_miab669.torrent,"Creampie, Masturbation Support, Slender, Solowork, Subjectivity",黒島玲衣,2026-05-29,https://onejav.com/torrent/miab669
MADM218,セレブ妻オナホ堕ち 承認欲求に満ちた肉棒狂い雑魚マ●コ 黒島玲衣,4.3 GB,https://pics.dmm.co.jp/mono/movie/adult/madm218/madm218pl.jpg,https://onejav.com/torrent/madm218/download/07079282/onejav.com_madm218.torrent,"Affair, Back, Big Tits, Cowgirl, Creampie, Married Woman, Masturbation, Restraint, Slut, Solowork, Vibe",黒島玲衣,2026-05-23,https://onejav.com/torrent/madm218
HODV22068,デリヘル呼んだら初恋の幼馴染と12年ぶりの再会して朝まで生ハメ中出し射精した 黒島玲衣,5.8 GB,https://pics.dmm.co.jp/mono/movie/adult/41hodv22068/41hodv22068pl.jpg,https://onejav.com/torrent/hodv22068/download/46688874/onejav.com_hodv22068.torrent,"Beautiful Girl, Big Tits, Creampie, Cum, Drama, Love, Prostitutes, Solowork",黒島玲衣,2026-05-22,https://onejav.com/torrent/hodv22068
IENF445,経験豊富な優しい素人人妻が最高の童貞筆おろし 25,6.8 GB,https://pics.dmm.co.jp/mono/movie/adult/1ienf445/1ienf445pl.jpg,https://onejav.com/torrent/ienf445/download/85926114/onejav.com_ienf445.torrent,"Big Tits, Creampie, Married Woman, Nampa, Virgin Man","小野坂ゆいか, 小鈴みかん, 黒島玲衣",2026-05-18,https://onejav.com/torrent/ienf445
