code,title,size,image_url,torrent_url,tags,actresses,date,page_url
PRWF011,「もうイキましたぁ！…またイグッ！」細身巨乳妻の覚醒アクメドキュメント 小松空,6.0 GB,https://pics.dmm.co.jp/mono/movie/adult/prwf011/prwf011pl.jpg,https://onejav.com/torrent/prwf011/download/69028195/onejav.com_prwf011.torrent,"3P, 4P, Acme · Orgasm, Affair, Married Woman, Nasty, Hardcore, Solowork",小松空,2026-05-15,https://onejav.com/torrent/prwf011
MXGS1432,誰も助けてくれない ゲス野郎に狙われた冷酷無比中出しレ●プ 小那海あや,4.6 GB,https://pics.dmm.co.jp/mono/movie/adult/h_068mxgs1432/h_068mxgs1432pl.jpg,https://onejav.com/torrent/mxgs1432/download/32637540/onejav.com_mxgs1432.torrent,Solowork,小那海あや,2026-06-16,https://onejav.com/torrent/mxgs1432
FC2PPV4921495,FC2-PPV-4921495 【無修正】変態中出しおじさんナンパシリーズ第5弾：スタイル抜群の黒髪清楚な美人受付嬢をナンパしてガチ生中出し,7.7 GB,https://contents-thumbnail2.fc2.com/w1280/storage201000.contents.fc2.com/file/411/41024541/1781508656.74.png,https://onejav.com/torrent/fc2ppv4921495/download/20018912/onejav.com_fc2ppv4921495.torrent,"Amateur, Beautiful Girl, Black Hair, FC2, Uncensored",,2026-06-16,https://onejav.com/torrent/fc2ppv4921495
EBWH334,●●県高●学校陸上競技大会 3位受賞― 高跳び競技で得た長身Hカップ肉体美ボディむき出しバカ強い性欲セックス 陸上女子（21） AVデビュー 清水優愛,5.7 GB,https://pics.dmm.co.jp/mono/movie/adult/ebwh334/ebwh334pl.jpg,https://onejav.com/torrent/ebwh334/download/61379279/onejav.com_ebwh334.torrent,"Athlete, Big Tits, Debut Production, Slender, Solowork, Tall",清水優愛,2026-04-17,https://onejav.com/torrent/ebwh334
SDAM174,はじめての牛乳浣腸相撲大会2（ガチ）。 一般女性4名参加,6.1 GB,https://pics.dmm.co.jp/mono/movie/adult/1sdam174/1sdam174pl.jpg,https://onejav.com/torrent/sdam174/download/67116041/onejav.com_sdam174.torrent,"Amateur, Anal, Enema, Planning, Toy",,2026-06-16,https://onejav.com/torrent/sdam174
MXGS1435,僕だけのアイドルが優しく見つめながら癒してくれて可愛いスマイルで白濁ザーメンを受け止めてくれる！本城はな,5.5 GB,https://pics.dmm.co.jp/mono/movie/adult/h_068mxgs1435/h_068mxgs1435pl.jpg,https://onejav.com/torrent/mxgs1435/download/56669585/onejav.com_mxgs1435.torrent,Solowork,本城はな,2026-06-16,https://onejav.com/torrent/mxgs1435
SDMM233,マジックミラー号 現役CAさんに、SOD式セクハラ講習！現役CAたちは黒パンストのお尻を撫でまわされても、プロ意識で対処しきることはできるのか？？フライト直前/直後の優しいCA女子限定in蒲田,8.1 GB,https://pics.dmm.co.jp/mono/movie/adult/1sdmm233/1sdmm233pl.jpg,https://onejav.com/torrent/sdmm233/download/82975178/onejav.com_sdmm233.torrent,"Big Tits, Creampie, Documentary, Older Sister, Virgin Man",,2026-06-16,https://onejav.com/torrent/sdmm233
FC2PPV4895410,FC2-PPV-4895410 【顔出し解禁】『爆乳Jカップグラドル 孕ませデート旅行』危険日2回中出し含むガチハメ撮り限定公開映像。 ※順次値上げ,2.6 GB,https://contents-thumbnail2.fc2.com/w1280/storage201000.contents.fc2.com/file/393/39269224/1777889006.2.jpg,https://onejav.com/torrent/fc2ppv4895410/download/81955515/onejav.com_fc2ppv4895410.torrent,"Amateur, Beautiful Girl, Big Tits, Blow, Breasts, Close Up, Creampie, FC2, POV, Slender",,2026-05-05,https://onejav.com/torrent/fc2ppv4895410
FC2PPV4884522,FC2-PPV-4884522 欲望全開！20cmオーバー巨根がキツキツアナルにたっぷり大射精！大量顔射！歴代屈指の名器でした！,6.2 GB,https://contents-thumbnail2.fc2.com/w1280/storage201000.contents.fc2.com/file/408/40749754/1776618089.21.png,https://onejav.com/torrent/fc2ppv4884522/download/71641927/onejav.com_fc2ppv4884522.torrent,"Amateur, FC2",,2026-04-21,https://onejav.com/torrent/fc2ppv4884522
SNOS209,最強ヒロインが アナタのちんちん100％支配… 24時間犯してあげる 瀬戸環奈,6.9 GB,https://pics.dmm.co.jp/mono/movie/adult/snos209/snos209pl.jpg,https://onejav.com/torrent/snos209/download/84924372/onejav.com_snos209.torrent,"Big Tits, Blow, Cosplay, Handjob, Slut, Solowork",瀬戸環奈,2026-06-05,https://onejav.com/torrent/snos209
