code,title,size,image_url,torrent_url,tags,actresses,date,page_url
FC2PPV4911951,FC2-PPV-4911951 【厳選美女】『Gカップ超美形ハーフモデル』人生初のピル無し子宮直撃生中出し。限定公開秘蔵映像。,2.1 GB,https://contents-thumbnail2.fc2.com/w1280/storage201000.contents.fc2.com/file/393/39269224/1780306448.88.jpg,https://onejav.com/torrent/fc2ppv4911951/download/37687397/onejav.com_fc2ppv4911951.torrent,"Amateur, Beautiful Girl, Big Tits, Blow, Breasts, Close Up, Creampie, FC2, POV, Slender",,2026-06-02,https://onejav.com/torrent/fc2ppv4911951
EBWH338,穴が足りない集落に派遣された看護師なんだからワシらの子種をかたっぱしから着床するのも立派な仕事じゃろ？ 柏木ふみか,5.2 GB,https://pics.dmm.co.jp/mono/movie/adult/ebwh338/ebwh338pl.jpg,https://onejav.com/torrent/ebwh338/download/65755617/onejav.com_ebwh338.torrent,"Acme · Orgasm, Big Tits, Cuckold, Nurse, Older Sister, Solowork",柏木ふみか,2026-06-12,https://onejav.com/torrent/ebwh338
ABF362,,4.1 GB,https://image.mgstage.com/images/prestige/abf/362/pb_e_abf-362.jpg,https://onejav.com/torrent/abf362/download/03924017/onejav.com_abf362.torrent,,,2026-06-25,https://onejav.com/torrent/abf362
ZMAR157,,10.9 GB,https://pics.dmm.co.jp/mono/movie/adult/h_237zmar157/h_237zmar157pl.jpg,https://onejav.com/torrent/zmar157/download/40358319/onejav.com_zmar157.torrent,,,2026-06-25,https://onejav.com/torrent/zmar157
EBWH332,従来の「着衣巨乳」では届かなかった、圧倒的なピタピタ感 史上最薄、0.01mm。 「極薄」ナマ着衣セックス 柏木ふみか,4.1 GB,https://pics.dmm.co.jp/mono/movie/adult/ebwh332/ebwh332pl.jpg,https://onejav.com/torrent/ebwh332/download/17577724/onejav.com_ebwh332.torrent,"Big Tits, Cosplay, Lotion, No Bra, Solowork, Titty Fuck",柏木ふみか,2026-05-16,https://onejav.com/torrent/ebwh332
SNOS209,最強ヒロインが アナタのちんちん100％支配… 24時間犯してあげる 瀬戸環奈,6.9 GB,https://pics.dmm.co.jp/mono/movie/adult/snos209/snos209pl.jpg,https://onejav.com/torrent/snos209/download/95621559/onejav.com_snos209.torrent,"Big Tits, Blow, Cosplay, Handjob, Slut, Solowork",瀬戸環奈,2026-06-05,https://onejav.com/torrent/snos209
892OERO002,旦那に内緒でエロがる奥さん。ホテルに入った瞬間「ずっとムラムラしてた…」ってすごい勢いでキス。これからセックスするのに、'こんなモノ(指輪)'いらないよね？俺がどっぷり中出ししてあげるから。【特典映像付き】,3.4 GB,https://image.mgstage.com/images/kyantamaseisouin/892oero/002/pb_e_892oero-002.jpg,https://onejav.com/torrent/892oero002/download/76507517/onejav.com_892oero002.torrent,"Affair, Amateur, Big Tits, Creampie, Married Woman, POV",,2026-04-27,https://onejav.com/torrent/892oero002
JUYU003,,5.5 GB,https://pics.dmm.co.jp/mono/movie/adult/juyu003/juyu003pl.jpg,https://onejav.com/torrent/juyu003/download/25423198/onejav.com_juyu003.torrent,,,2026-06-25,https://onejav.com/torrent/juyu003
ABF363,完全主観×鬼イカせ イッても止めない激FUCK！！！追撃5.000ピストン 三佳詩【限定特典映像30分付き】,5.9 GB,https://image.mgstage.com/images/prestige/abf/363/pb_e_abf-363.jpg,https://onejav.com/torrent/abf363/download/64159775/onejav.com_abf363.torrent,"Big Tits, Cosplay, Shaved, Solowork, Subjectivity",三佳詩,2026-06-25,https://onejav.com/torrent/abf363
FC2PPV4926047,FC2-PPV-4926047 ★顔出し★素人さんがえっちな事をしにやってきた！ケース＃138　ぶっちゃけタイプ過ぎてガチで途中でイキそうになった…ｗ色白美マン　ユウカちゃん（20）の場合,4.8 GB,https://contents-thumbnail2.fc2.com/w1280/storage201000.contents.fc2.com/file/368/36773637/1782231604.65.png,https://onejav.com/torrent/fc2ppv4926047/download/39104063/onejav.com_fc2ppv4926047.torrent,"Amateur, Big Tits, Creampie, Electric Massager, FC2, Petite, POV, Slender, Toy",,2026-06-25,https://onejav.com/torrent/fc2ppv4926047
