code,title,size,image_url,torrent_url,tags,actresses,date,page_url
EBWH332,従来の「着衣巨乳」では届かなかった、圧倒的なピタピタ感 史上最薄、0.01mm。 「極薄」ナマ着衣セックス 柏木ふみか,4.1 GB,https://pics.dmm.co.jp/mono/movie/adult/ebwh332/ebwh332pl.jpg,https://onejav.com/torrent/ebwh332/download/06576111/onejav.com_ebwh332.torrent,"Big Tits, Cosplay, Lotion, No Bra, Solowork, Titty Fuck",柏木ふみか,2026-05-16,https://onejav.com/torrent/ebwh332
EBWH338,穴が足りない集落に派遣された看護師なんだからワシらの子種をかたっぱしから着床するのも立派な仕事じゃろ？ 柏木ふみか,5.2 GB,https://pics.dmm.co.jp/mono/movie/adult/ebwh338/ebwh338pl.jpg,https://onejav.com/torrent/ebwh338/download/34226330/onejav.com_ebwh338.torrent,"Acme · Orgasm, Big Tits, Cuckold, Nurse, Older Sister, Solowork",柏木ふみか,2026-06-12,https://onejav.com/torrent/ebwh338
SNOS209,最強ヒロインが アナタのちんちん100％支配… 24時間犯してあげる 瀬戸環奈,6.9 GB,https://pics.dmm.co.jp/mono/movie/adult/snos209/snos209pl.jpg,https://onejav.com/torrent/snos209/download/45041518/onejav.com_snos209.torrent,"Big Tits, Blow, Cosplay, Handjob, Slut, Solowork",瀬戸環奈,2026-06-05,https://onejav.com/torrent/snos209
IPZZ831,新任女教師は部活合宿の下見で先輩ゲス教師に媚薬を飲まされ脱いだら凄いスリム巨乳を全身クリトリス感度にされキメセク堕ち,4.2 GB,https://pics.dmm.co.jp/mono/movie/adult/ipzz831/ipzz831pl.jpg,https://onejav.com/torrent/ipzz831/download/87280461/onejav.com_ipzz831.torrent,"Acme · Orgasm, Beautiful Girl, Big Tits, Blow, Cuckold, Solowork",坂井美桜,2026-05-08,https://onejav.com/torrent/ipzz831
SNOS149,新時代グラドル絶頂解禁 震えが止まらない初絶頂でイクッ！未体験3本番 博多彩葉,4.6 GB,https://pics.dmm.co.jp/mono/movie/adult/snos149/snos149pl.jpg,https://onejav.com/torrent/snos149/download/47876601/onejav.com_snos149.torrent,"3P, 4P, Beautiful Girl, Big Tits, Facials, Idol, Solowork",博多彩葉,2026-05-08,https://onejav.com/torrent/snos149
HJMO724,,6.3 GB,https://pics.dmm.co.jp/mono/movie/adult/hjmo724/hjmo724pl.jpg,https://onejav.com/torrent/hjmo724/download/20443059/onejav.com_hjmo724.torrent,,,2026-06-21,https://onejav.com/torrent/hjmo724
PETS066,ボクがオナホ覚醒マゾ男の娘になるまで…,4.0 GB,https://pics.dmm.co.jp/mono/movie/adult/pets066/pets066pl.jpg,https://onejav.com/torrent/pets066/download/26696839/onejav.com_pets066.torrent,"Amateur, Cross Dressing, Rolling Back Eyes, Fainting, Transsexual",,2026-06-21,https://onejav.com/torrent/pets066
FC2PPV4923958,FC2-PPV-4923958 経験人数少!中出しNG!ウブでまじめなDカップOLにイヤイヤチンポ責めさせて最後はピュアマンコにチンポねじこむ！,4.4 GB,https://contents-thumbnail2.fc2.com/w1280/storage200000.contents.fc2.com/file/408/40702218/1781870654.05.png,https://onejav.com/torrent/fc2ppv4923958/download/20219892/onejav.com_fc2ppv4923958.torrent,"Amateur, Blow, Breasts, FC2, Handjob, Petite, Vibe",,2026-06-22,https://onejav.com/torrent/fc2ppv4923958
BASJ044,寝取られ突き放され消えた二人の愛は、再び黄色のスイセンのように美しく咲く 明里ともか,5.0 GB,https://pics.dmm.co.jp/mono/movie/adult/basj044/basj044pl.jpg,https://onejav.com/torrent/basj044/download/07663427/onejav.com_basj044.torrent,"Affair, Cuckold, Slut, Solowork",明里ともか,2026-06-22,https://onejav.com/torrent/basj044
HJMO722,,5.2 GB,https://pics.dmm.co.jp/mono/movie/adult/hjmo722/hjmo722pl.jpg,https://onejav.com/torrent/hjmo722/download/67386566/onejav.com_hjmo722.torrent,,,2026-06-21,https://onejav.com/torrent/hjmo722
