code,title,size,image_url,torrent_url,tags,actresses,date,page_url
FC2PPV4933419,FC2-PPV-4933419 敏感すぎるスーツ学.生21歳。膣奥を責めると痙攣が終始止まらなくなり生チ●ポぶち込まれるとト.んで屈服→大量中出し。,3.6 GB,https://contents-thumbnail2.fc2.com/w1280/storage201000.contents.fc2.com/file/373/37231718/1783139134.21.png,https://onejav.com/torrent/fc2ppv4933419/download/10136905/onejav.com_fc2ppv4933419.torrent,"Amateur, Beautiful Girl, Blow, Breasts, Creampie, FC2, POV",,2026-07-06,https://onejav.com/torrent/fc2ppv4933419
300MIUM1369,【学会不倫】可愛い顔してどスケベすぎる歯科助手と密会中出し。黒スト美脚で限界まで搾り取ってくるどエロい騎乗位。仕事中とは立場逆転。甘サド痴女に責められる生ハメ不倫【既婚男性(歯科院長)×独身女性(歯科助手)】 case.24,3.3 GB,https://image.mgstage.com/images/prestigepremium/300mium/1369/pb_e_300mium-1369.jpg,https://onejav.com/torrent/300mium1369/download/08310416/onejav.com_300mium1369.torrent,"Affair, Amateur, Big Tits, Cosplay, Facials, POV, Slut",,2026-06-16,https://onejav.com/torrent/300mium1369
FC2PPV4933359,FC2-PPV-4933359 絶頂回数30回超え⁉️男性経験少ないメンエス嬢がハメ撮り体験で本能覚醒！モニター越しに自分の痴態を見ながらガチイキする黒髪美**のヤバいやつ,5.4 GB,https://contents-thumbnail2.fc2.com/w1280/storage201000.contents.fc2.com/file/388/38703450/1783130999.06.jpg,https://onejav.com/torrent/fc2ppv4933359/download/01596853/onejav.com_fc2ppv4933359.torrent,"Amateur, Black Hair, Creampie, FC2, POV, Uncensored",,2026-07-05,https://onejav.com/torrent/fc2ppv4933359
HEYZO3886,,2.2 GB,https://www.heyzo.com/contents/3000/3886/images/player_thumbnail_en.jpg,https://onejav.com/torrent/heyzo3886/download/10041750/onejav.com_heyzo3886.torrent,,,2026-07-05,https://onejav.com/torrent/heyzo3886
SNOS248,新人NO.1STYLE 水泳一筋 純情なお姉さん 園梨音 AVデビュー,5.9 GB,https://pics.dmm.co.jp/mono/movie/adult/snos248/snos248pl.jpg,https://onejav.com/torrent/snos248/download/23232360/onejav.com_snos248.torrent,"Athlete, Debut Production, Facials, Older Sister, Slender, Solowork",園梨音,2026-06-05,https://onejav.com/torrent/snos248
FC2PPV4932455,FC2-PPV-4932455 【緊急7/12期限セール】【1900→1400】【デカチンに〇落した週刊漫画誌グラドル】極小ワレメに巨チン喰らってマン〇ブリブリこいて〇〇イキして首〇めイラマビ〇タ喰いながら激ピストンにマ〇発情し着床,4.1 GB,https://contents-thumbnail2.fc2.com/w1280/storage200000.contents.fc2.com/file/324/32305252/1782982919.88.jpg,https://onejav.com/torrent/fc2ppv4932455/download/18919456/onejav.com_fc2ppv4932455.torrent,"Amateur, FC2",,2026-07-05,https://onejav.com/torrent/fc2ppv4932455
FC2PPV4931103,,8.1 GB,https://contents-thumbnail2.fc2.com/w1280/storage201000.contents.fc2.com/file/286/28519270/1783134255.35.jpg,https://onejav.com/torrent/fc2ppv4931103/download/95381541/onejav.com_fc2ppv4931103.torrent,,,2026-07-05,https://onejav.com/torrent/fc2ppv4931103
SNOS172,新世代グラドル生々しく嘘のないリアル4セックス 博多彩葉,6.4 GB,https://pics.dmm.co.jp/mono/movie/adult/snos172/snos172pl.jpg,https://onejav.com/torrent/snos172/download/13816119/onejav.com_snos172.torrent,"3P, 4P, Acme · Orgasm, Beautiful Girl, Big Tits, Idol, Solowork",博多彩葉,2026-06-05,https://onejav.com/torrent/snos172
SNOS209,最強ヒロインが アナタのちんちん100％支配… 24時間犯してあげる 瀬戸環奈,6.9 GB,https://pics.dmm.co.jp/mono/movie/adult/snos209/snos209pl.jpg,https://onejav.com/torrent/snos209/download/02983445/onejav.com_snos209.torrent,"Big Tits, Blow, Cosplay, Handjob, Slut, Solowork",瀬戸環奈,2026-06-05,https://onejav.com/torrent/snos209
FC2PPV4911951,FC2-PPV-4911951 【厳選美女】『Gカップ超美形ハーフモデル』人生初のピル無し子宮直撃生中出し。限定公開秘蔵映像。,2.1 GB,https://contents-thumbnail2.fc2.com/w1280/storage201000.contents.fc2.com/file/393/39269224/1780306448.88.jpg,https://onejav.com/torrent/fc2ppv4911951/download/11140224/onejav.com_fc2ppv4911951.torrent,"Amateur, Beautiful Girl, Big Tits, Blow, Breasts, Close Up, Creampie, FC2, POV, Slender",,2026-06-02,https://onejav.com/torrent/fc2ppv4911951
