code,title,size,image_url,torrent_url,tags,actresses,date,page_url
FC2PPV4934472,,2.3 GB,https://contents-thumbnail2.fc2.com/w1280/storage201000.contents.fc2.com/file/403/40203095/1783334143.55.gif,https://onejav.com/torrent/fc2ppv4934472/download/26770064/onejav.com_fc2ppv4934472.torrent,,,2026-07-14,https://onejav.com/torrent/fc2ppv4934472
CEAD747,,5.6 GB,https://pics.dmm.co.jp/mono/movie/adult/cead747/cead747pl.jpg,https://onejav.com/torrent/cead747/download/27535719/onejav.com_cead747.torrent,,,2026-07-14,https://onejav.com/torrent/cead747
DLDSS513,「今年も給料上がったよ。」嬉しそうに語る夫をよそに私は夫の上司に中出しされています―。‘恋をしたい’専属女優《中出し》解禁。 桜坂ふうか,6.7 GB,https://pics.dmm.co.jp/mono/movie/adult/1dldss513/1dldss513pl.jpg,https://onejav.com/torrent/dldss513/download/28319770/onejav.com_dldss513.torrent,"Big Tits, Creampie, Cuckold, Married Woman, Mature Woman, Solowork",桜坂ふうか,2026-07-14,https://onejav.com/torrent/dldss513
SNOS257,新人NO.1STYLE ひ・と・き・わ20歳 京都の女子大生 蜜このはAVデビュー,5.0 GB,https://pics.dmm.co.jp/mono/movie/adult/snos257/snos257pl.jpg,https://onejav.com/torrent/snos257/download/80758585/onejav.com_snos257.torrent,"Big Tits, Debut Production, Facials, Slender, Solowork, Titty Fuck",蜜このは,2026-06-19,https://onejav.com/torrent/snos257
ABF358,究極のぬるぬるオーガズム 涼森れむ,5.5 GB,https://image.mgstage.com/images/prestige/abf/358/pb_e_abf-358.jpg,https://onejav.com/torrent/abf358/download/01446750/onejav.com_abf358.torrent,"Big Tits, Breasts, Lotion, Solowork",Remu Suzumori,2026-06-11,https://onejav.com/torrent/abf358
EBWH346,アスリート支援NPO職員 若手育成コーディネーター 身長170cm 元新体操選手のしなやかG乳 篠倉珠生（25）,5.5 GB,https://pics.dmm.co.jp/mono/movie/adult/ebwh346/ebwh346pl.jpg,https://onejav.com/torrent/ebwh346/download/44792979/onejav.com_ebwh346.torrent,"Athlete, Big Tits, Debut Production, M女, Solowork, Tall",篠倉珠生,2026-06-12,https://onejav.com/torrent/ebwh346
EBWH332,従来の「着衣巨乳」では届かなかった、圧倒的なピタピタ感 史上最薄、0.01mm。 「極薄」ナマ着衣セックス 柏木ふみか,4.1 GB,https://pics.dmm.co.jp/mono/movie/adult/ebwh332/ebwh332pl.jpg,https://onejav.com/torrent/ebwh332/download/77451852/onejav.com_ebwh332.torrent,"Big Tits, Cosplay, Lotion, No Bra, Solowork, Titty Fuck",柏木ふみか,2026-05-16,https://onejav.com/torrent/ebwh332
START567,男友達の妹の無防備なハミ乳ノーブラ姿に思わずガン見！二人っきりになった時にノーブラを指摘したら恥じらいまくりで押しに弱くてそのままハメまくった 小笠原菜乃,3.2 GB,https://pics.dmm.co.jp/mono/movie/adult/1start567/1start567pl.jpg,https://onejav.com/torrent/start567/download/54667509/onejav.com_start567.torrent,"Big Tits, Drama, No Bra, Sister, Solowork",小笠原菜乃,2026-07-14,https://onejav.com/torrent/start567
FC2PPV4938255,FC2-PPV-4938255 ※初回数量限定5850pt→1560pt※【３P中出し】最近きつくなってきました。人権はないのでしょうか？と突然,3.7 GB,https://contents-thumbnail2.fc2.com/w1280/storage201000.contents.fc2.com/file/377/37682362/1783909894.06.jpg,https://onejav.com/torrent/fc2ppv4938255/download/34784773/onejav.com_fc2ppv4938255.torrent,"Affair, Amateur, Bath, Blow, Creampie, FC2, Married Woman, Mature Woman, Orgy, POV, Slender",,2026-07-14,https://onejav.com/torrent/fc2ppv4938255
EBWH338,穴が足りない集落に派遣された看護師なんだからワシらの子種をかたっぱしから着床するのも立派な仕事じゃろ？ 柏木ふみか,5.2 GB,https://pics.dmm.co.jp/mono/movie/adult/ebwh338/ebwh338pl.jpg,https://onejav.com/torrent/ebwh338/download/23971971/onejav.com_ebwh338.torrent,"Acme · Orgasm, Big Tits, Cuckold, Nurse, Older Sister, Solowork",柏木ふみか,2026-06-12,https://onejav.com/torrent/ebwh338
