code,title,size,image_url,torrent_url,tags,actresses,date,page_url
FC2PPV4915119,FC2-PPV-4915119 【無修正ｘ個人撮影】サロン開業の資金調達困難の為アナル解放！初めてのアナルをトロトロにほぐしてIN！アナルに挿入されながらオマンコくぱぁピースする人妻！,5.2 GB,https://contents-thumbnail2.fc2.com/w1280/storage200000.contents.fc2.com/file/316/31589918/1780560274.96.jpg,https://onejav.com/torrent/fc2ppv4915119/download/67275531/onejav.com_fc2ppv4915119.torrent,"Affair, Amateur, Anal, Back, Cowgirl, FC2, Married Woman, Mature Woman, POV, Uncensored",,2026-06-06,https://onejav.com/torrent/fc2ppv4915119
FC2PPV4912079,FC2-PPV-4912079 □りコンさーん！巨乳フェチさーん！集まれー！□りフェイス×デカパイ×美くびれのエロティカル３重奏！21歳ピンク看護師のえっちな検診♡,6.7 GB,https://contents-thumbnail2.fc2.com/w1280/storage201000.contents.fc2.com/file/394/39346299/1780313372.79.png,https://onejav.com/torrent/fc2ppv4912079/download/63194376/onejav.com_fc2ppv4912079.torrent,"Amateur, Beautiful Girl, Big Tits, Blow, Breasts, FC2, POV, Slender, Titty Fuck",,2026-06-06,https://onejav.com/torrent/fc2ppv4912079
SNOS197,客達を勃起させちゃう風呂屋ひとり娘のフェロ漏れしなやかボディ！ 銭湯、ジジイたちの乱交場へ 楓ふうあ,6.2 GB,https://pics.dmm.co.jp/mono/movie/adult/snos197/snos197pl.jpg,https://onejav.com/torrent/snos197/download/81671752/onejav.com_snos197.torrent,"Acme · Orgasm, Blow, Nasty, Hardcore, Orgy, Slender, Solowork",Fuua Kaede,2026-04-10,https://onejav.com/torrent/snos197
FC2PPV4915289,FC2-PPV-4915289 すみれ(18)かわいいツインテールの３回目撮影。イラマとアナル舐めさせられ、膣に入れられた水をストローで飲まれてしまう。中出し、アナル貫通ATMもしています。,7.3 GB,https://contents-thumbnail2.fc2.com/w1280/storage200000.contents.fc2.com/file/261/26076760/1780580667.77.jpg,https://onejav.com/torrent/fc2ppv4915289/download/40583317/onejav.com_fc2ppv4915289.torrent,"Amateur, Anal, Beautiful Girl, Blow, Creampie, Deep Throating, FC2, Petite, Toy, Uncensored",,2026-06-06,https://onejav.com/torrent/fc2ppv4915289
MIDA580,立ち退き依頼で来た役所の地味メガネ爆乳を監禁アクメ Gカップ乳首ビンビン神乳揉みまくり！頑固オヤジの絶倫ピストンでガニ股オーガズムしちゃった私 天宮花南,5.4 GB,https://pics.dmm.co.jp/mono/movie/adult/mida580/mida580pl.jpg,https://onejav.com/torrent/mida580/download/96957562/onejav.com_mida580.torrent,"Acme · Orgasm, Big Tits, Confinement, Creampie, Solowork, Squirting",Kanan Amamiya,2026-04-07,https://onejav.com/torrent/mida580
SNOS124,あの話題の超庶民お姉ちゃん、一歩イイオンナ感。人生初めて尽くし性交で絶頂イキまくり初体験3本番 鈴木希,9.4 GB,https://pics.dmm.co.jp/mono/movie/adult/snos124/snos124pl.jpg,https://onejav.com/torrent/snos124/download/57771698/onejav.com_snos124.torrent,"3P, 4P, Beautiful Girl, Big Tits, Older Sister, Slender, Solowork",鈴木希,2026-04-10,https://onejav.com/torrent/snos124
FC2PPV4915321,FC2-PPV-4915321 ♀221 色気むんむんのどへんたいせりかちゃんのイキっぷりがやばいｗ ウォシュレット型アナル舐めも！ ★特典で無修正,3.8 GB,https://contents-thumbnail2.fc2.com/w1280/storage201000.contents.fc2.com/file/376/37547480/1780585187.71.jpg,https://onejav.com/torrent/fc2ppv4915321/download/76290636/onejav.com_fc2ppv4915321.torrent,"Amateur, Creampie, FC2, Uncensored",,2026-06-06,https://onejav.com/torrent/fc2ppv4915321
FC2PPV4915171,FC2-PPV-4915171 【二週間50%OFF】【初】Dカップ22歳初々しい新卒ムスメ。「いっぱい飲みたい…」18cmの巨根しゃぶり尽くし、濃厚ザーメンをしっかりごっくんさせる！,2.1 GB,https://contents-thumbnail2.fc2.com/w1280/storage201000.contents.fc2.com/file/373/37213813/1780566576.2.png,https://onejav.com/torrent/fc2ppv4915171/download/40250517/onejav.com_fc2ppv4915171.torrent,"Amateur, Beautiful Girl, Blow, FC2, POV, Uncensored",,2026-06-06,https://onejav.com/torrent/fc2ppv4915171
MIDA624,,5.1 GB,https://pics.dmm.co.jp/mono/movie/adult/mida624/mida624pl.jpg,https://onejav.com/torrent/mida624/download/91389136/onejav.com_mida624.torrent,,,2026-05-01,https://onejav.com/torrent/mida624
SNOS183,最強ヒロインと 一緒に終電逃して ホテル泊まって 朝までヤリたい！ 瀬戸環奈,4.7 GB,https://pics.dmm.co.jp/mono/movie/adult/snos183/snos183pl.jpg,https://onejav.com/torrent/snos183/download/34371741/onejav.com_snos183.torrent,"Beautiful Girl, Big Tits, Blow, Breasts, Facials, Solowork",瀬戸環奈,2026-05-08,https://onejav.com/torrent/snos183
