code,title,size,image_url,torrent_url,tags,actresses,date,page_url
SNOS283,雨の日にコインランドリーに現れ、洗濯が終わるまでエッチな体が完全無防備な隙だらけお姉さん 楓ふうあ,5.6 GB,https://pics.dmm.co.jp/mono/movie/adult/snos283/snos283pl.jpg,https://onejav.com/torrent/snos283/download/82188173/onejav.com_snos283.torrent,"Beautiful Girl, OL, Other Fetish, Slender, Solowork, Tall",Fuua Kaede,2026-06-05,https://onejav.com/torrent/snos283
FC2PPV4863830,FC2-PPV-4863830 【有名アイドル第二弾】本物アイドルにゃちゃんを自宅に連れ込んで、中出し→即挿入のエンドレスセックス。ハメてハメてハメ倒してきました(^^♪,2.8 GB,https://contents-thumbnail2.fc2.com/w1280/storage200000.contents.fc2.com/file/400/39968267/1774017704.92.jpg,https://onejav.com/torrent/fc2ppv4863830/download/58723197/onejav.com_fc2ppv4863830.torrent,"Amateur, FC2",,2026-05-10,https://onejav.com/torrent/fc2ppv4863830
MFYD142,拘束×激ピス×デカチ○ポ！三枝れい史上最高セックス余裕で更新！イってイってイキまくっちゃった！！,7.2 GB,https://pics.dmm.co.jp/mono/movie/adult/mfyd142/mfyd142pl.jpg,https://onejav.com/torrent/mfyd142/download/24714845/onejav.com_mfyd142.torrent,"Creampie, Married Woman, Mature Woman, Restraint, Solowork",三枝れい,2026-05-15,https://onejav.com/torrent/mfyd142
PRWF011,「もうイキましたぁ！…またイグッ！」細身巨乳妻の覚醒アクメドキュメント 小松空,6.0 GB,https://pics.dmm.co.jp/mono/movie/adult/prwf011/prwf011pl.jpg,https://onejav.com/torrent/prwf011/download/41007732/onejav.com_prwf011.torrent,"3P, 4P, Acme · Orgasm, Affair, Married Woman, Nasty, Hardcore, Solowork",小松空,2026-05-15,https://onejav.com/torrent/prwf011
SIRO5684,ドスケベ変態OLが日頃のストレス発散に応募してきた！上司からのセクハラ！ストレスが溜まり過ぎてオナニーで発散していたが、性欲限界突破！後ろからガンガン突かれてるOLが1番エロい！ 【初撮り】ネットでAV応募→AV体験撮影 2570,2.4 GB,https://image.mgstage.com/images/shirouto/siro/5684/pb_e_siro-5684.jpg,https://onejav.com/torrent/siro5684/download/07605192/onejav.com_siro5684.torrent,"Amateur, Debut Production, OL, POV, Shaved, Slender",,2026-06-09,https://onejav.com/torrent/siro5684
892OERO003,「悪い事してるのは、私だけじゃないもん」最初は旦那への仕返しのつもりだったのに、気づけばこのチ●ポがいいって夢中で腰を振り下ろして喘ぎまくる奥さん。揺れる猥尻。旦那に放置されてるご無沙汰マ●コに容赦無く中出し。,2.2 GB,https://image.mgstage.com/images/kyantamaseisouin/892oero/003/pb_e_892oero-003.jpg,https://onejav.com/torrent/892oero003/download/71805845/onejav.com_892oero003.torrent,"Affair, Amateur, Creampie, Huge Butt, Married Woman, POV, Subjectivity",,2026-06-10,https://onejav.com/torrent/892oero003
FC2PPV4917815,FC2-PPV-4917815 【６月１８日まで限定半額セール！】【顔出しモザ無】【個撮オフパコ】ゼ○ゼロイヴ○ンコスのオホ声ドスケベ巨乳レイヤーと個撮中出しえっち！【レビュー特典付き】,3.7 GB,https://contents-thumbnail2.fc2.com/w1280/storage200000.contents.fc2.com/file/397/39636916/1780927491.23.jpg,https://onejav.com/torrent/fc2ppv4917815/download/68896041/onejav.com_fc2ppv4917815.torrent,"Amateur, Big Tits, Blow, Breasts, Cosplay, Cowgirl, Creampie, FC2, Masturbation, POV, Titty Fuck, Uncensored",,2026-06-10,https://onejav.com/torrent/fc2ppv4917815
MIDA624,,5.1 GB,https://pics.dmm.co.jp/mono/movie/adult/mida624/mida624pl.jpg,https://onejav.com/torrent/mida624/download/70636881/onejav.com_mida624.torrent,,,2026-05-01,https://onejav.com/torrent/mida624
FNS215,ぐったりしても執拗な追撃ピストンで何度もイカされ続ける密室ホテル性交 甘夏唯,5.8 GB,https://cdn.faleno.net/top/wp-content/uploads/2026/05/FNS-215_1200.jpg?output-quality=60,https://onejav.com/torrent/fns215/download/03941236/onejav.com_fns215.torrent,,甘夏唯,2026-06-10,https://onejav.com/torrent/fns215
FC2PPV4917039,FC2-PPV-4917039 ♡６/18日迄半額【無・完全素人・生中出し】スレンダーで、とっても綺麗なOLさんは、マ〇コをベロベロ舐められてぶっといチ〇ポでズコズコされて、中に出されるのが好きなんです！生（なま）中出し２発！,3.2 GB,https://contents-thumbnail2.fc2.com/w1280/storage201000.contents.fc2.com/file/392/39182810/1780831436.83.jpg,https://onejav.com/torrent/fc2ppv4917039/download/18193042/onejav.com_fc2ppv4917039.torrent,"Amateur, Anal, Back, Beautiful legs, Blow, Butt, Cowgirl, Creampie, Cunnilingus, Electric Massager, FC2, OL, POV, Shaved, Slender, Uncensored",,2026-06-09,https://onejav.com/torrent/fc2ppv4917039
