code,title,image_url,page_url,views,date_scraped
FC2PPV-4923958,Few people with experience\! No creampie! Let a naive and serious D cup office lady attack your cock and finally screw the cock into her pure pussy.,https://pic.javct.net/poster/05192026/b672e9724f.jpg,https://javct.net/v/fc2ppv-4923958,60,2026-06-22
TLDC-056,"Hell Is Like Heaven: ""I'll Do My Best Today As A Dick.''",https://pic.javct.net/poster/05192026/88fb5cb001.jpg,https://javct.net/v/tldc-056,68,2026-06-22
NOSKN-102,[ALL Unedited] NO Cut! NO SKIN! Nakadashi! Completely Uncut Video Of Real Creampie Sumire Aisaka,https://pic.javct.net/poster/05192026/2ff0e55ae1.jpg,https://javct.net/v/noskn-102,0,2026-06-22
HOIZ-130-RM,"Hoihoi Lover 22 ~ Konokono Hamedori ~ Amateur Hoihoi LOVER, Personal Shooting, Couple, Home, Amateur, Beautiful Girl, Female College Student, Gonzo, Big Breasts, Beautiful Breasts, Petite, Black Hair, Fair Skin, Facial, Cosplay, Chinese Dress, Slender, Waist [Uncensored L**ked]",https://pic.javct.net/poster/20240807/1721448606.jpg,https://javct.net/v/hoiz-130-rm,307,2026-06-22
NGHJ-064,"Would You Help This Virgin Boy With His Masturbation? A Super Cute And Kind Cheerleader Will Encourage The Virgin Boy's Sensitive Dick, And They'll Both Feel Good Over And Over Again During Their First Time Sex!",https://pic.javct.net/poster/05192026/9738ff4aef.jpg,https://javct.net/v/nghj-064,192,2026-06-22
DORI-006,"Paco Shooting No.06 Female College Student With Beautiful Breasts With Bytes For The First Time, A Strange Man Refuses Creampie But Is Facial Shot!",https://pic.javct.net/poster/05192026/9f31c1d9e4.jpg,https://javct.net/v/dori-006,59,2026-06-22
543TAXD-037-RM,"Furthermore, the whole story of evil deeds by a villainous taxi driver part.37 [Uncensored L**ked]",https://pic.javct.net/poster/20230206/1686402450.jpg,https://javct.net/v/543taxd-037-rm,58,2026-06-22
543TAXD-051-RM,Maki The whole story of the evil deeds of a villainous taxi driver part.51 [Uncensored L**ked],https://pic.javct.net/poster/20231011/1698405754.jpg,https://javct.net/v/543taxd-051-rm,63,2026-06-22
543TAXD-049-RM,Miho The whole story of the evil deeds of a villainous taxi driver part.49 [Uncensored L**ked],https://pic.javct.net/poster/20231011/1697371057.jpg,https://javct.net/v/543taxd-049-rm,61,2026-06-22
543TAXD-047-RM,Kana The whole story of evil deeds by a villainous taxi driver part.47 [Uncensored L**ked],https://pic.javct.net/poster/20230804/1691580306.jpg,https://javct.net/v/543taxd-047-rm,59,2026-06-22
200GANA-3399,"A neat and clean tongue clown anaconda housewife [Fuka, 27 years old] squeezes out the sperm with her proud tongue pifera and erotic hips. She is a real softie, first shooting 2312",https://pic.javct.net/poster/05192026/8cc4b7e3bb.jpg,https://javct.net/v/200gana-3399,64,2026-06-22
FC2PPV-4924767,"[No] Two black guys with big dicks, a cool beauty with long black hair and a princess cut, violently fucked, and a sweaty hardcore 3P with two consecutive vaginal cum shots at the end [Overseas version] Bonus included",https://pic.javct.net/poster/05192026/bf612b18b1.jpg,https://javct.net/v/fc2ppv-4924767,45,2026-06-22
FC2PPV-4922731,An ordinary wife who came to have an affair out of frustration is real and super erotic *Full length (Gonzo) (Amateur) *Review bonus included,https://pic.javct.net/poster/05192026/74e917126e.jpg,https://javct.net/v/fc2ppv-4922731,77,2026-06-22
FC2PPV-4924344,"0419_001 Maya-chan, 18 years old, is a former idol with a fair skin and F cup who is attracting a lot of attention in 2026. She impregnates herself and appears in a sex video with an old man, but since it was incomplete, she is sold in bulk at a low price (explosive)",https://pic.javct.net/poster/05192026/2286c339da.jpg,https://javct.net/v/fc2ppv-4924344,102,2026-06-22
BGN-065-RM,Rookie Prestige Exclusive Debut Kamiya Nagi [Uncensored L**ked],https://static.javct.net/poster/bgn-065.jpg,https://javct.net/v/bgn-065-rm,190,2026-06-22
NNPJ-395-RM,"The Day When I Made A Pass, I Can Not Fuck, I Met Again At A Later Date And Had SEX Out In A Mess. [Uncensored L**ked]",https://pic.javct.net/poster/05192026/4cd3f5892f.jpg,https://javct.net/v/nnpj-395-rm,160,2026-06-22
DVDMS-949-RM,"General Men's And Women's Monitoring AV Negotiations To Assault Just Before The Last Train On The Way Home After The Party! Adult Male And Female Friends Challenge Extreme Mission Of 100,000 Yen Per Shot! Two Tipsy Young Wives Have Harlem Reverse 3P Continuous Ejaculation Sex With A Married Man Until Morning At A Love Hotel! A Secret Orgy That Forgets Each Other's Home Can't Be Settled With Just One Shot! ! [Uncensored L**ked]",https://pic.javct.net/poster/20230104/1682688172.jpg,https://javct.net/v/dvdms-949-rm,180,2026-06-22
COGM-046-RM,Breasts Marudashiko-chan And Petit Exposure Chilling Time God Milk In My House [Uncensored L**ked],https://pic.javct.net/poster/20230104/1682740015.jpg,https://javct.net/v/cogm-046-rm,106,2026-06-22
SRS-079-RM,"Yariman Document Yuria-chan (20) Girls Bar Shop Clerk File.16 I Can Not Refuse When I Say ""likes"", Carelessly Exceeded The Number Of People Three-digit [Uncensored L**ked]",https://pic.javct.net/poster/05192026/a3184315ce.jpg,https://javct.net/v/srs-079-rm,135,2026-06-22
FC2PPV-4924800,[No] Fair-skinned nurse's fair-skinned F cup amateur body ☆ Rocket breasts are bulging and ejaculation inside the vagina,https://pic.javct.net/poster/05192026/b23d51c14c.jpg,https://javct.net/v/fc2ppv-4924800,31,2026-06-22
292MY-1061,Chisato Matsumoto 1,https://pic.javct.net/poster/05192026/7911485f77.jpg,https://javct.net/v/292my-1061,44,2026-06-22
PXH-049-RM,"Obo Girl 018 Momo-chan (23) Even If It's A Little Shadowy, Miss Kyaba Is Good At Tide Peeing Blowjob ← SEX All Day Practiced With Banana [Uncensored L**ked]",https://pic.javct.net/poster/20221202/1649215754.jpg,https://javct.net/v/pxh-049-rm,120,2026-06-22
200GANA-2438-RM,"In The Spear Room Of A Pick-Up Master Of Hyakusen-Renma, Brought In SEX Hidd** Camera 191 Bringing A Cute Erotic Sister To The Spear Room, Enjoying Sweet Sex Like A Lover, Wiggling Your Body With A Polite Caress And Feeling Trembling And Trembling spree [Uncensored L**ked]",https://pic.javct.net/poster/20222612/1674965779.jpg,https://javct.net/v/200gana-2438-rm,62,2026-06-22
BLOR-300-RM,"Cool Hotel Lady's Sudden Transformation Into A Cock-slaying Thug, ""It's So Amazing Inside!"", She's Beaten Hard By A Huge Cock, Her Eyes Rolling Back And Her Face Contorted In Ecstasy, Becoming A Total Masochist. [Uncensored L**ked]",https://pic.javct.net/poster/05192026/d0b45863bb.jpg,https://javct.net/v/blor-300-rm,95,2026-06-22
