code,title,image_url,page_url,views,date_scraped
DOKB-001,"[Amateur Hot And Wild ROOM] A Cohabiting Couple Having Sex In Their Room From Noon! Lovey-dovey, Instant Sex, Anytime, Anywhere In The House, Filmed Sex, Cumming Inside. Featuring 5 Sexy And Cute Girlfriends!",https://pic.javct.net/poster/05192026/af6e90322b.jpg,https://javct.net/v/dokb-001,220,2026-07-03
FC2PPV-4932309,Money-deprived masochist JD with continuous creampie fuckin' eyes,https://pic.javct.net/poster/05192026/f0507a4b3c.jpg,https://javct.net/v/fc2ppv-4932309,59,2026-07-03
FC2PPV-4931887,Behind-the-scenes course of a certain Kita-ku cosplay cafe ♥ A top ranking neat girl exposes her raw pussy in a private off-shot after an event & goes crazy in a lewd photo session,https://pic.javct.net/poster/05192026/38fe318f52.jpg,https://javct.net/v/fc2ppv-4931887,58,2026-07-03
SIRO-5699,"The phantom silk breasts are real breasts The phantom breasts that the breast explorer Kada encountered are flexible and elastic that defy gravity, and the elasticity that envelops everything at the moment of contact.You will also encounter the miraculous treasure tromako that men have been pursuing since ancient times.You will be a witness to a miracle [First shot] AV application online AV experience shooting 2582",https://pic.javct.net/poster/05192026/bb2c55cda5.jpg,https://javct.net/v/siro-5699,67,2026-07-03
BNST-090,Pushers Bookmark,https://pic.javct.net/poster/05192026/9c0619d244.jpg,https://javct.net/v/bnst-090,138,2026-07-03
AKDL-069-RM,(An Amateur Interview) She's Performing In This Adult Video Without Telling Her Parents She Has A Cute Name For Her Pussy This Nice Girl Is Beautiful But Bashfully Cumming For The First Time Rui 20 Years Old Occupation: Trade School Student [Uncensored L**ked],https://pic.javct.net/poster/04112026/3d30e58f34.jpg,https://javct.net/v/akdl-069-rm,148,2026-07-03
FC2PPV-4932368,Only 1 person with uncensored experience from Aomori Music college student 18 readers Model special value 115 160 cm 45 kg E cup Raw cock inserted just 6 months after losing virginity ⇒ Creampie,https://pic.javct.net/poster/05192026/1a006c0d78.jpg,https://javct.net/v/fc2ppv-4932368,67,2026-07-03
DLPN-027-RM,"Isn't I Dirty Like This? Rika-san (27), A S-class Body Nasty Busty Wife Who Straddles A Man And Rubs A Stranger's Stick Into The Uterus And Makes A Continuous Orgasm At The Woman On Top Posture [Uncensored L**ked]",https://pic.javct.net/poster/20230302/1679110859.jpg,https://javct.net/v/dlpn-027-rm,121,2026-07-03
FC2PPV-4932401,[No] Heir to a long-established store with a plump body,https://pic.javct.net/poster/05192026/bfb2286f0b.jpg,https://javct.net/v/fc2ppv-4932401,69,2026-07-03
DSAM-004,"A Nursery School Specializing In Older C**ldren, Filled With Maternal Love And Affection.",https://pic.javct.net/poster/05192026/497a85c314.jpg,https://javct.net/v/dsam-004,130,2026-07-03
FC2PPV-4923490,"I left the remote control in my super cute and soothing girlfriend until she came to her room, and she wanted me to have her pussy flooded in full erotic mode, so I gave her a deep insemination [Face/Uncensored/Creampie]",https://pic.javct.net/poster/05192026/6afcaa3ca0.jpg,https://javct.net/v/fc2ppv-4923490,71,2026-07-03
COGM-042-RM,Almost Virgin-chan Do Nervous! More Than 10 Steps Of Adult Stairs [Uncensored L**ked],https://pic.javct.net/poster/20230302/1680319408.jpg,https://javct.net/v/cogm-042-rm,106,2026-07-03
259LUXU-1361-RM,"Luxury TV 1349 A fascinating former gravure idol who instantly captivates the world's men has appeared. Her big breasts, which she says she used to have a complex about, have become her weapon of joy when seen, and the one-of-a-kind breast swaying that charms you with the piston of a big cock is a masterpiece. Her glamorous body, which is extremely comfortable to hold, is generously revealed and her orgasms become wild. [Uncensored L**ked]",https://pic.javct.net/poster/05192026/3075b32097.jpg,https://javct.net/v/259luxu-1361-rm,78,2026-07-03
259LUXU-1395-RM,"Luxury TV 1377 A former gravure idol who can't forget the exciting pleasure she experienced during the shooting and reappears, exposing her rich breasts, plump butt, and voluptuous body wrapped in lotion in front of the camera, and her sexual desire even greater than before, and the slut play where she actively devours men is a must-see [Uncensored L**ked]",https://pic.javct.net/poster/05192026/d688f915bc.jpg,https://javct.net/v/259luxu-1395-rm,55,2026-07-03
SDAB-169-RM,Small Body Young Face Dreamful H Cup Amu Ohara 18 Years Old SOD Exclusive AV Debut [Uncensored L**ked],https://pic.javct.net/poster/05192026/d5113f3502.jpg,https://javct.net/v/sdab-169-rm,135,2026-07-03
SKMJ-417-RM,Waiting 3 Months To Make A Reservation At A Men's Beauty Salon Where No Touching Is Allowed God's Men's Miss Ejaculation Unlimited Raw Insertion Inside Out Back Option Completely Voyeur 5 [Uncensored L**ked],https://pic.javct.net/poster/20230804/1691750238.jpg,https://javct.net/v/skmj-417-rm,234,2026-07-03
XRW-750-RM,Dirty Copulation Records Vol2 Of Amateur Mature Women Who Are Full Of Libido [Uncensored L**ked],https://pic.javct.net/poster/05192026/f96d7a018b.jpg,https://javct.net/v/xrw-750-rm,136,2026-07-03
SGA-075-RM,"And The Best Of His Mistress, Put Out The Best In Sexual Intercourse.Nine [Uncensored L**ked]",https://pic.javct.net/poster/05192026/6fde88e551.jpg,https://javct.net/v/sga-075-rm,130,2026-07-03
892OERO-008-RM,"A horny housewife nurse who wants to have sex without telling her husband has an affair with her. A big-assed big-breasted married woman who serves her sweetly, saying, ""I don't mind if you love me,"" is having an affair with a horny married woman who wants to have sex without telling her husband.The neat and elegant wife gets more and more stupid with pleasure, and she squirts repeatedly and cums inside that lewd pussy. [Uncensored L**ked]",https://pic.javct.net/poster/05192026/f930afffd3.jpg,https://javct.net/v/892oero-008-rm,69,2026-07-03
413INSTV-719-RM,"A working older sister negotiates to appear on the Internet broadcast program Tei, and even brings creampie sex into the documentary Real estate sales person Himari-san (pseudonym) [Uncensored L**ked]",https://pic.javct.net/poster/05192026/9913f462a5.jpg,https://javct.net/v/413instv-719-rm,80,2026-07-03
JMTY-082-RM,Tadaman File 28 Mayu 28 years old A record of drinking and creampieing a convenient sex friend [Uncensored L**ked],https://pic.javct.net/poster/05192026/242c0dee5d.jpg,https://javct.net/v/jmty-082-rm,118,2026-07-03
420HPT-062-RM,"Sana (25) Amateur Hoi Hoi, Amateur Hoi Hoi Pet, Amateur, Black Hair, Shaved, Obedient, Sensitive, Endless Orgasm, Sex Friend, Jumping, Outdoors, Shame, Toy, Creampie, Gonzo, Documentary [Uncensored L**ked]",https://pic.javct.net/poster/05192026/0725e7d776.jpg,https://javct.net/v/420hpt-062-rm,94,2026-07-03
JJGG-002-RM,A quiet married woman begs for a younger man's semen while being teased. A sexless housewife's desire went out of control for two very lewd days. Sawa Kirishima [Uncensored L**ked],https://pic.javct.net/poster/05192026/03e819d9d9.jpg,https://javct.net/v/jjgg-002-rm,102,2026-07-03
FC2PPV-4932391,"0392_0418_001 Kanna-chan, 20 years old, Miyu-chan, 19 years old. Her two real best friends' dirty PPKT sex friends are milking her in cowgirl position until her balls are empty. Pregnant creampie 3P orgy fuck (explosive)",https://pic.javct.net/poster/05192026/f92a511d88.jpg,https://javct.net/v/fc2ppv-4932391,138,2026-07-03
