code,title,image_url,page_url,views,date_scraped
WANZ-261-RM,Off Meeting Marie Out Danger During The Day Once Famous Cosplayers Month [Uncensored L**ked],https://pic.javct.net/poster/20241902/1710262032.jpg,https://javct.net/v/wanz-261-rm,120,2026-06-25
TAD-016-RM,Slaves Black Market Bidders Women [Uncensored L**ked],https://pic.javct.net/poster/05192026/485c3b3c1c.jpg,https://javct.net/v/tad-016-rm,164,2026-06-25
PKPL-064,"Amateur Sex Friend Document: Mina, A Cool But Secretly Submissive Girl Who Loves Raw Sex",https://pic.javct.net/poster/05192026/d50a5ac80b.jpg,https://javct.net/v/pkpl-064,120,2026-06-25
DROP-137,Covered In Milky White Love Juice!! Amateur Girl's First Time Masturbating With A Black Dildo (9),https://pic.javct.net/poster/05192026/5d04ec4c74.jpg,https://javct.net/v/drop-137,165,2026-06-25
FC2PPV-4922818-RM,"*Ends immediately as this is a real idol* Creampie to the youngest member of the 7-member group, an SS class 18 year old with a body fat percentage of 8.6% *13.5GB highest quality original version distributed on a first-come, first-served basis [Uncensored L**ked]",https://pic.javct.net/poster/05192026/e24806b05b.jpg,https://javct.net/v/fc2ppv-4922818-rm,60,2026-06-25
FSKI-001,"Beginner's Pretty Amateur Girls School Student's ""big Tits"" Sucked And Sucked And Got A Snatch Of Raw Cuts And Baby Feeding Hands!Maternal Instinct Attach To The Kindness Of The Girls Who Were Tickled And Aim For Raw Man To Thank You (SEX)! ""eh?Do Not Do It! What? """,https://pic.javct.net/poster/05192026/a177f486c1.jpg,https://javct.net/v/fski-001,225,2026-06-25
MIST-259,Amateur Married Woman Deriheru Dispatch Complete Voyeur G Cup Married Woman Yuki 30 Years Old,https://pic.javct.net/poster/05192026/dccd60ad5b.jpg,https://javct.net/v/mist-259,160,2026-06-25
420HPT-057-RM,"Suzu (21) Amateur Hoi Hoi, Amateur Hoi Hoi Pet, Amateur, Neat, Big Breasts, Sullen, Obedient, Masochistic Woman, Sex Friend, Jumping, Outdoors, Shame, Toy, Creampie, Gonzo, Documentary [Uncensored L**ked]",https://pic.javct.net/poster/05192026/0536ac16dd.jpg,https://javct.net/v/420hpt-057-rm,104,2026-06-25
812MMC-027-RM,"[When I get compliments, I console myself] Even though it's a photo book, I brought my own vibrator and I just masturbate in the bathroom thinking I won't be found out. Someone else's wife has the sex drive of a rabbit. #Tokyo Wakazuma Biyori vol. 027 [Only required to pay attention to the meeting, not living, comforting oneself] Meimei is coming photo true collection. Massaging stick.Returning to unresolved appearance.Masturbation in a place where one goes straight away.An old woman with a strong sexual desire and a different person like a rabbit #A good day for a married woman in Tokyo vol.027 [Uncensored L**ked]",https://pic.javct.net/poster/05192026/7cc8640234.jpg,https://javct.net/v/812mmc-027-rm,89,2026-06-25
413INSTV-717-RM,"Extremely popular among weak men with overwhelming visuals, over 800,000 registered users H-cup slender big-breasted streamer's lovey-dovey creampie video with her boyfriend l**ked [Uncensored L**ked]",https://pic.javct.net/poster/05192026/88852ea04b.jpg,https://javct.net/v/413instv-717-rm,65,2026-06-25
200GANA-3400-RM,"A slender half-girl has an explosive orgasm, she's beautiful no matter how you cut it... She's covered in cum all over her porcelain doll-like skin. Don't miss the sight of this half-girl doing yoga, dancing and eating her pink nipples and clitoris that match her slender body... Seriously soft girl, first shoot 2313 [Uncensored L**ked]",https://pic.javct.net/poster/05192026/8c62978870.jpg,https://javct.net/v/200gana-3400-rm,64,2026-06-25
FC2PPV-4923669,"Pure love, a love that grows in secret from real parents. A long-established confectionery store, a blushing sex video on the signboard*",https://pic.javct.net/poster/05192026/0b24ce50db.jpg,https://javct.net/v/fc2ppv-4923669,65,2026-06-25
AIAV-050,"[Strongest Evolution] Completely Subjective Specialization! Erodroid Nijinohime, Who Is Too Devilish, Stares At You And To**ures You Non-stop As A Slut [Full AI Beautiful Girl]",https://pic.javct.net/poster/05192026/95c93f2494.jpg,https://javct.net/v/aiav-050,79,2026-06-25
DVDMS-952-RM,"Lifting Of The Ban On Appearance! ! Magic Mirror Flight A Neat And Dignified Beauty Staff Working At A First-Class Department Store First Public Deep Kiss Vol.06 All 8 SEX Special! ! A Beauty Staff Member With Moist Lips Entangles Her Tongue Violently With A Thick Kiss That Makes Her Masturbation Get Wet! Even Though I'm At Work, I'm Covered In Kisses... [Uncensored L**ked]",https://pic.javct.net/poster/20230205/1683879525.jpg,https://javct.net/v/dvdms-952-rm,265,2026-06-25
FC2PPV-4926103,I had a reverse 3P with two beautiful women with beautiful breasts and beautiful butts who impregnated me and made me understand.,https://pic.javct.net/poster/05192026/4e9bbaf339.jpg,https://javct.net/v/fc2ppv-4926103,47,2026-06-25
FC2PPV-4923553,A beautiful witch teacher who is popular with the male members of the cooking class. A large amount of creampie in the pussy of the unfailingly eager to fuck.,https://pic.javct.net/poster/05192026/ba0bab7b71.jpg,https://javct.net/v/fc2ppv-4923553,62,2026-06-25
413INSTV-717,"Extremely popular among weak men with overwhelming visuals, over 800,000 registered users H-cup slender big-breasted streamer's lovey-dovey creampie video with her boyfriend l**ked",https://pic.javct.net/poster/05192026/88852ea04b.jpg,https://javct.net/v/413instv-717,65,2026-06-25
420HPT-057,"Suzu (21) Amateur Hoi Hoi, Amateur Hoi Hoi Pet, Amateur, Neat, Big Breasts, Sullen, Obedient, Masochistic Woman, Sex Friend, Jumping, Outdoors, Shame, Toy, Creampie, Gonzo, Documentary",https://pic.javct.net/poster/05192026/0536ac16dd.jpg,https://javct.net/v/420hpt-057,104,2026-06-25
FC2PPV-4925699,This is a visit from a single customer who had booked a reward massage in the morning to relieve the fatigue of a harsh day.,https://pic.javct.net/poster/05192026/095436ea71.jpg,https://javct.net/v/fc2ppv-4925699,53,2026-06-25
812MMC-027,"[When I get compliments, I console myself] Even though it's a photo book, I brought my own vibrator and I just masturbate in the bathroom thinking I won't be found out. Someone else's wife has the sex drive of a rabbit. #Tokyo Wakazuma Biyori vol. 027 [Only required to pay attention to the meeting, not living, comforting oneself] Meimei is coming photo true collection. Massaging stick.Returning to unresolved appearance.Masturbation in a place where one goes straight away.An old woman with a strong sexual desire and a different person like a rabbit #A good day for a married woman in Tokyo vol.027",https://pic.javct.net/poster/05192026/7cc8640234.jpg,https://javct.net/v/812mmc-027,89,2026-06-25
FC2PPV-4921388,*Amateur Collapse Misaki (22) Sensitivity 1000% Creampie in Sensitive Pussy & Vaginal Release ◯ Collapse in Gay Sex,https://pic.javct.net/poster/05192026/c3d34f1f8a.jpg,https://javct.net/v/fc2ppv-4921388,50,2026-06-25
FC2PPV-4924820,"[My first sex video] I was called to a business hotel and we took a shower together, and I felt my sensitive anus, and I was so excited that I inserted my finger and my pussy at the same time, and we exchanged LINEs. I brightened it up with a review benefit and was completely naked.''",https://pic.javct.net/poster/05192026/49ff3cbeb0.jpg,https://javct.net/v/fc2ppv-4924820,48,2026-06-25
200GANA-3400,"A slender half-girl has an explosive orgasm, she's beautiful no matter how you cut it... She's covered in cum all over her porcelain doll-like skin. Don't miss the sight of this half-girl doing yoga, dancing and eating her pink nipples and clitoris that match her slender body... Seriously soft girl, first shoot 2313",https://pic.javct.net/poster/05192026/8c62978870.jpg,https://javct.net/v/200gana-3400,64,2026-06-25
FC2PPV-4918885,"It will be rude if you don't cum inside the best beauty salon experience using all of the fingers, mouth, pussy, and 19-year-old beautiful Mens [Uncensored creampie]",https://pic.javct.net/poster/05192026/3958af1ab5.jpg,https://javct.net/v/fc2ppv-4918885,72,2026-06-25
