code,title,image_url,page_url,views,date_scraped
FC2PPV-4915084,"[Uncensored]**pyjpx*jsps Donkey's love slave breast diary Call a big-breasted sex friend and enjoy playing with her favorite breasts - Of course, call the I-cup tit-fuck-exploding dick guy and cum inside him - Big breasts 〇〇 loves standing doggy style",https://pic.javct.net/poster/05192026/588abeb8d6.jpg,https://javct.net/v/fc2ppv-4915084,72,2026-06-05
HMGL-154-RM,Ripe Ass Big Fucking Amateur Hashima Love 92 Centimeters Of Gifu [Uncensored L**ked],https://pic.javct.net/poster/04112026/1776058214.jpg,https://javct.net/v/hmgl-154-rm,130,2026-06-05
SIRO-5683-RM,"A cute theme park girl with a cute anime voice is so sensitive that she is so sensitive that she cries over and over again and is so cute that she thrusts hard lol This is just the beginning of SEX traction Everyone, get your tissues ready! [First shot] AV application online AV experience shooting 2567 [Uncensored L**ked]",https://pic.javct.net/poster/05192026/c132e10c52.jpg,https://javct.net/v/siro-5683-rm,62,2026-06-05
NNPJ-372-RM,Female College Students Only! Beer Festival 2019! ! Tipsy Echiech JD2 Group Is OK Immediately With Love Hotel! ! Hatchake Orgy SEX Party! ! [Uncensored L**ked],https://pic.javct.net/poster/05192026/94f308a323.jpg,https://javct.net/v/nnpj-372-rm,150,2026-06-05
PASN-025-RM,[Strongest Heroine 003] Isn't I cute? A confident play of a beautiful girl with an outstanding presence [Uncensored L**ked],https://pic.javct.net/poster/05192026/701c1f520c.jpg,https://javct.net/v/pasn-025-rm,135,2026-06-05
ID-039-RM,I Ordered A 20-Year Old Beautiful Girl Real College Girl Delivery Health Call Girl! Sara Kagami [Uncensored L**ked],https://pic.javct.net/poster/20221904/1652353176.jpg,https://javct.net/v/id-039-rm,126,2026-06-05
FC2PPV-4913467,"A horny wife seeking stimulation, unparalleled big dick non-stop fuck, and endless orgasms during raw sex.",https://pic.javct.net/poster/05192026/ae95fa36cb.jpg,https://javct.net/v/fc2ppv-4913467,53,2026-06-05
FC2PPV-4900507,"7 years of marriage, 5 years of non-response, my friend's beautiful G-cup wife is violated with someone else's stick, and she pleads for creampie [faceless creampie]",https://pic.javct.net/poster/05192026/08df17158a.jpg,https://javct.net/v/fc2ppv-4900507,62,2026-06-05
HJMO-342-RM,Challenge In The Husband And Wife!when You Put Up 20 Minutes A Terrible Tech Husband Aki Sasaki Prize!sex Cum Wife Cuckold If You Wait Too Long Been Squid Twice! ! [Uncensored L**ked],https://pic.javct.net/poster/05192026/29ec9040e4.jpg,https://javct.net/v/hjmo-342-rm,230,2026-06-05
FC2PPV-4910695,[No] Top secret video of sex with a slender minimum body beauty in super close-up where you can see even her pores [Nanasawa 〇a] [High resolution with bonus] [24 hours limited sale],https://pic.javct.net/poster/05192026/fb8486f790.jpg,https://javct.net/v/fc2ppv-4910695,146,2026-06-05
FC2PPV-4914884,"[Lifted] **pyjpx*jsps Reiwa's White Gal Early Benefits Beautiful Breasts Fair-skinned ""Cyaba Girl's Pussy"" Twitching. Ultra-convulsive thick cock overflowing with seiki, plenty of creampie",https://pic.javct.net/poster/05192026/1954959f78.jpg,https://javct.net/v/fc2ppv-4914884,50,2026-06-05
FOL-010-RM,Too Beautiful Ramen Shop Clerk [Uncensored L**ked],https://pic.javct.net/poster/20222109/1664709297.jpg,https://javct.net/v/fol-010-rm,118,2026-06-05
STSK-230-RM,"Real Estate Lady Gets Raw Sashimi, Raw Sashimi Hunt, Gets Her Vagina And Face Soiled With Semen During A Property Viewing Due To Uncompliance Acts. [Uncensored L**ked]",https://pic.javct.net/poster/05192026/07d9367e51.jpg,https://javct.net/v/stsk-230-rm,165,2026-06-05
C-2400,"Adultery, Then ... 006 Next Life's Journey # 017",https://pic.javct.net/poster/05192026/fae52c46b2.jpg,https://javct.net/v/c-2400,150,2026-06-05
STSK-229,"I'm A NEET, So What? A Freeloading Woman Who Doesn't Want To Work. I'm Only Good At Sex. Self-proclaimed Housekeeper, Living At Home. I Spent The Whole Day Holed Up With My 30-something Unemployed Girlfriend, Fucking Like Crazy And Cumming Inside Her A Lot Lol.",https://pic.javct.net/poster/05192026/4a7fa1e045.jpg,https://javct.net/v/stsk-229,203,2026-06-05
STSK-227,"Betrayal And NTR Behind Your Best Friend's Back! Male Friendship Vs. Lust!? After A Drinking Party, He Misses The Last Train And Lets His Best Friend's Girlfriend Stay Over, Resulting In NTR Footage! Fueled By Alcohol And The Mood, They End Up Having Sex, And Their Physical Chemistry Is Amazing, Leading To A Decadent, Unprotected Sex Session Until Morning! A Woman Who Betrays Her Boyfriend X A Man Who Betrays His Best Friend",https://pic.javct.net/poster/05192026/0728c9a388.jpg,https://javct.net/v/stsk-227,226,2026-06-05
HZ-3904,"Creampie in Europe #Amber, Barbie - Amber - Barbie",https://pic.javct.net/poster/05192026/6b6aac08aa.jpg,https://javct.net/v/hz-3904,73,2026-06-05
FTHTD-205-RM,Good News For Troubled Women! ? The Sensitivity Improvement Committee Will Solve Your Problems! [Uncensored L**ked],https://pic.javct.net/poster/05192026/a9964d80a5.jpg,https://javct.net/v/fthtd-205-rm,295,2026-06-05
SIRO-5683,"A cute theme park girl with a cute anime voice is so sensitive that she is so sensitive that she cries over and over again and is so cute that she thrusts hard lol This is just the beginning of SEX traction Everyone, get your tissues ready! [First shot] AV application online AV experience shooting 2567",https://pic.javct.net/poster/05192026/c132e10c52.jpg,https://javct.net/v/siro-5683,62,2026-06-05
YAKO-092-RM,"A Sexless, Slutty, Big-breasted, Beautiful Wife Becomes Addicted To The Rock-hard Cocks Of Young Men; A Shameless Record Of Her Affair. [Uncensored L**ked]",https://pic.javct.net/poster/05192026/3e819c8995.jpg,https://javct.net/v/yako-092-rm,240,2026-06-05
NHDTC-212,"A Casual AV Appearance On The Magic Mirror Bus! ""If You Don't Film My Face..."" She Gets Fucked From Behind With A Butt Panel And Squirts! Breaking The Promise Of Just Ass Fucking, She Gets Unexpectedly Penetrated! The Frustrated Big-assed Girlfriend Gives In To The Unparalleled Pleasure Of A Stranger's Cock Being Thrust Into Her In Front Of Her Boyfriend And Allows Him To Cum Inside Her.",https://pic.javct.net/poster/05192026/a0d44b1ecc.jpg,https://javct.net/v/nhdtc-212,180,2026-06-05
FC2PPV-4913780,[Uncensored/Complete Amateur/Creampie/Squirting] G-cup beautiful breasts slender body side job men's office lady 2 shots deep inside her vagina during a creampie shoot ♡,https://pic.javct.net/poster/05192026/2df3a1fa6c.jpg,https://javct.net/v/fc2ppv-4913780,20,2026-06-05
PA-060426-100,It's Hawaii! A Bikini wife in high spirits! : Ways to End a Sexless Marriage,https://pic.javct.net/poster/05192026/0f9f84ff40.jpg,https://javct.net/v/pa-060426-100,60,2026-06-05
10-060426-01,Devoted Titjob and Blowjob : Yoshino Hashiba,https://pic.javct.net/poster/05192026/3e2ff31795.jpg,https://javct.net/v/10-060426-01,11,2026-06-05
