code,title,image_url,page_url,views,date_scraped
FC2PPV-4923369,[No] Top secret video of a former gravure idol with huge breasts having sex all day long Ana Kawai [High resolution with bonus] [24 hours limited sale],https://pic.javct.net/poster/05192026/974ba18e3d.jpg,https://javct.net/v/fc2ppv-4923369,132,2026-06-26
FC2PPV-4927068,[Raw Dollar / Uncensored] 2 consecutive raw insertions into the beautiful E-cup breasts!! Plenty of thick sperm from the plump BODY's hairy pussy!! Original version!!,https://pic.javct.net/poster/05192026/3781c0b131.jpg,https://javct.net/v/fc2ppv-4927068,44,2026-06-26
FC2PPV-4926055,Super cute and neat Chihiro-chan's gonzo debut,https://pic.javct.net/poster/05192026/cb8806ae5b.jpg,https://javct.net/v/fc2ppv-4926055,55,2026-06-26
10-062626-01,Pussy to Mouth Sex: Hitomi Tanmura,https://pic.javct.net/poster/05192026/34c0171933.jpg,https://javct.net/v/10-062626-01,60,2026-06-26
TAMEG-001-RM,Goro Tameike's Interview Therapy Part 1 Ayako Sato 46 years old Mai Fuyuki [Uncensored L**ked],https://pic.javct.net/poster/05192026/884a69a383.jpg,https://javct.net/v/tameg-001-rm,84,2026-06-26
FC2PPV-4927279,"0407_002 Hana-chan, 21 years old, decided to make a series until she got pregnant during an AV shoot.She impregnated her desire to make her lewd H cup breasts bigger, and when the old man made it come true, she also made her stomach bigger (explosive)",https://pic.javct.net/poster/05192026/e8903ebfa4.jpg,https://javct.net/v/fc2ppv-4927279,178,2026-06-26
FC2PPV-4925840,"[First shoot / 2 shots] This is a sex battle with a fair-skinned beautiful naked woman who is a monster of sexual desire even though she is so cute. Even the cameraman can't resist and immediately joins in the fight, but he does his best to make you ejaculate in large quantities in seconds.",https://pic.javct.net/poster/05192026/b84a46fdfc.jpg,https://javct.net/v/fc2ppv-4925840,88,2026-06-26
FC2PPV-4920344-RM,"Raw sex with a super angelic school student. While giving a blow job to the teacher's penis, her pussy juices are dripping all over... An overwhelmingly beautiful butt hidden behind the uniform. A pure body with pure white skin. Mass impregnation on a really dangerous day... [Uncensored L**ked]",https://pic.javct.net/poster/05192026/6ede56c611.jpg,https://javct.net/v/fc2ppv-4920344-rm,262,2026-06-26
FC2PPV-4925085,"Uncensored Super Cute ❤ Former Idol Research Student 18 ♡ Sequel Uniform twin tail loose socks, creampie in a narrow pussy with natural pubic hair without a rubber band\!",https://pic.javct.net/poster/05192026/979b470aff.jpg,https://javct.net/v/fc2ppv-4925085,53,2026-06-26
WA-588-RM,"Amateur Wife Pick-Up, Unprotected Sex With All Of Them, 5 Hours, Celebrity DX 105 [Uncensored L**ked]",https://pic.javct.net/poster/05192026/fe29989cd0.jpg,https://javct.net/v/wa-588-rm,300,2026-06-26
FC2PPV-4926354,"[43-year-old mother of two c**ldren] **pyjpx*jsps I forgot about being exposed and safe sex, and became just a female bitch who enjoys raw sex and creampie with her face exposed lol",https://pic.javct.net/poster/05192026/8efca51b1c.jpg,https://javct.net/v/fc2ppv-4926354,64,2026-06-26
FC2PPV-4923982,"She's a slender slender girl with small breasts that shows off her ribs when she's pussy-fucking, and 2 ejaculations are ejaculated with a strong piston on her slender body that's about to break. If you like plump things, it's better not to watch it. [Facial exposure/Uncensored/Creampie]",https://pic.javct.net/poster/05192026/f01da546f3.jpg,https://javct.net/v/fc2ppv-4923982,80,2026-06-26
FC2PPV-4927200,"[Fntia freezes because it's too extreme] **pyjpx*jsps An I-cup idol with divine breasts is exposed by the window and exposed! ""Absolutely not! People will see it! Two consecutive creampies in a sense of immorality!'' It's a video that can never be published as it was featured in a weekly magazine",https://pic.javct.net/poster/05192026/afff6d8bd6.jpg,https://javct.net/v/fc2ppv-4927200,34,2026-06-26
FC2PPV-4925697,[No] Completely unprocessed 19 years old ♡ Has armpit hair and pubic hair ♡ Look at the natural secret zone on her delicate figure ♡ [SP additional benefits],https://pic.javct.net/poster/05192026/c97346930a.jpg,https://javct.net/v/fc2ppv-4925697,43,2026-06-26
DLPN-028-RM,The Cloudy Juice That Sticks To The Bristle Man Hair That Grows Up To The Buttocks Hole Is Disgusting. Spoiled Dirty Busty Wife Aino (28) Who Was Too Serious With Other Sticks [Uncensored L**ked],https://pic.javct.net/poster/20230104/1681529922.jpg,https://javct.net/v/dlpn-028-rm,135,2026-06-26
FC2PPV-4918868,"[Uncensored] A cute girl with blue eyes, when she takes off her clothes, she has a plump body and inserts it into her butt hole and pussy, giving her a delicious masochist experience* High-resolution gift included with the review Angler",https://pic.javct.net/poster/05192026/f4340fa753.jpg,https://javct.net/v/fc2ppv-4918868,29,2026-06-26
SKMJ-760,"Full Face Reveal, Hardcore Pickup! I Got Help With My Masturbation From A Super Kind, Angelic Nurse! I Thrust My Fully Erect, Circumcised Penis Deep Into Her White Coat Against Her Adorable Naked Body! I Came Inside Her Over And Over Again Until My Balls Were Empty! Shinjuku Ward General Hospital Nurse Edition",https://pic.javct.net/poster/05192026/eb63feb68e.jpg,https://javct.net/v/skmj-760,245,2026-06-26
FC2PPV-4926294,"[Single shot] When I handed the remote control vibrator to Yuka-chan, who loves everyone, it hit her huge clitoris and even more, she used a persistent vibrator to spray a large amount of semen inside and outside (SNN-54)",https://pic.javct.net/poster/05192026/98b626d72b.jpg,https://javct.net/v/fc2ppv-4926294,38,2026-06-26
SYKH-074-RM,"""Standing Wife"" Class B Mature Woman Misaki 34 Years Old [Uncensored L**ked]",https://pic.javct.net/poster/20230104/1681532694.jpg,https://javct.net/v/sykh-074-rm,110,2026-06-26
328CNSTV-018-RM,[Reading warning/Big areola] The challenge of a 48-year-old lewd glamorous J-cup plump body desire monster married woman Shiho Terashima [Uncensored L**ked],https://pic.javct.net/poster/05192026/739cb3ebed.jpg,https://javct.net/v/328cnstv-018-rm,120,2026-06-26
FC2PPV-4921247-RM,[Face-showing ban lifted] “Real idol-turned-God-biju G-cup beauty” Highly invested 77-minute real sex video from face-showing appearance contract to ejaculation” *Only a few left [Uncensored L**ked],https://pic.javct.net/poster/05192026/9efd09b5e5.jpg,https://javct.net/v/fc2ppv-4921247-rm,54,2026-06-26
GMDMS-004-RM,Maki Married Woman on a Mamachari's Greedy Mom Activity SEX Kana Morisawa [Uncensored L**ked],https://pic.javct.net/poster/05192026/f0b18a05f1.jpg,https://javct.net/v/gmdms-004-rm,65,2026-06-26
TKFC-095-RM,A real mother who is being trained as a pervert as her son's lover (posting name: Aiko) [Uncensored L**ked],https://pic.javct.net/poster/05192026/6888120d69.jpg,https://javct.net/v/tkfc-095-rm,94,2026-06-26
328CNSTV-017-RM,"Kaori Mori, 38 years old, a beautiful slender and erotic big-breasted married woman who came looking for a place to release her sexual desires that she had nowhere else to go. [Uncensored L**ked]",https://pic.javct.net/poster/05192026/ef72a522d7.jpg,https://javct.net/v/328cnstv-017-rm,120,2026-06-26
