code,title,image_url,page_url,views,date_scraped
FC2PPV-4938589,226 A store-bought pussy opener interview with all 5 girls creampied (of course),https://pic.javct.net/poster/07052026/c33afa275f.jpg,https://javct.net/v/fc2ppv-4938589,95,2026-07-15
FC2PPV-4938458,"[Individual video] The newlywed ballet school teacher is made into a meat urinal with a cock and is poured with thick semen, making her very excited...",https://pic.javct.net/poster/07052026/b0019488dc.jpg,https://javct.net/v/fc2ppv-4938458,31,2026-07-15
200GANA-3412,"""After a delicious meal, I'll make dessert..."" A 25-year-old esthetician with just the right amount of elasticity and an immoral moment at the mercy of her esthetician-trained techniques. A real softie, first shoot 2323",https://pic.javct.net/poster/07052026/6834b7e41a.jpg,https://javct.net/v/200gana-3412,72,2026-07-15
FC2PPV-4938580,"[Successful pick-up after frequent visits] While at work, I was called to the parking lot in the name of inspection in uniform and exposed outdoors and gave a standing blowjob while many people came and creampied me from the standing position. Review bonus included'' 《fat only/uncensored/chubby》",https://pic.javct.net/poster/07052026/ea6a86b0cb.jpg,https://javct.net/v/fc2ppv-4938580,28,2026-07-15
FC2PPV-4938540,"Educational ㊐. I don't have enough part-time jobs to match up with a big jerk, so I applied out of curiosity. ""I want you to maximize my strength // Pink Man'' I beg for creampie while convulsing,",https://pic.javct.net/poster/07052026/51ec0608ad.jpg,https://javct.net/v/fc2ppv-4938540,47,2026-07-15
FC2PPV-4938657,227 Thoroughly taste the body of a sparkling beauty with a raw dick ♡ Uncensored with special bonus,https://pic.javct.net/poster/07052026/606d8a1f3d.jpg,https://javct.net/v/fc2ppv-4938657,48,2026-07-15
FC2PPV-4938484,"[No] The popular fair-skinned F-cup beauty is back again with flashy hair, slim style, and even more cuteness⤴ Super beautiful skin and dazzling micro bikini. Gokkun creampie. *Bonus High resolution",https://pic.javct.net/poster/07052026/98950e2207.jpg,https://javct.net/v/fc2ppv-4938484,52,2026-07-15
AKDL-087-RM,"Appearing after work! A lewd office lady who sucks dick until late at night, begging for a quick threesome #M girl #loves blowjobs #immediate orgasm convulsions 26 years old",https://pic.javct.net/poster/05192026/a5d94a0b45.jpg,https://javct.net/v/akdl-087-rm,69,2026-07-15
FC2PPV-4938541,Uncensored A lecturer at a nail vocational school who loves dicks so much ❤ Raw sex in her stuffy pussy after a day of work - I ejaculated in her slutty mouth,https://pic.javct.net/poster/07052026/807ee8e57f.jpg,https://javct.net/v/fc2ppv-4938541,39,2026-07-15
FC2PPV-4903848,The business trip lady is so cute and obscene that she released two loads of white waste [Uncensored creampie],https://pic.javct.net/poster/07052026/e11b96bbe5.jpg,https://javct.net/v/fc2ppv-4903848,83,2026-07-15
JJGG-004-RM,"A slender but busty married woman who was left alone for 5 years. ""I'm sorry for being such an old woman..."" the trembling 45-year-old housewife smiled and begged for creampie. Keori Nakamura",https://pic.javct.net/poster/07052026/07a9ba2abb.jpg,https://javct.net/v/jjgg-004-rm,118,2026-07-15
FC2PPV-4938427,I masturbated the waist of Yuzuki Yuzuki with teratera silver panties at God Style.,https://pic.javct.net/poster/07052026/0508dab245.jpg,https://javct.net/v/fc2ppv-4938427,56,2026-07-15
FTHT-357-RM,An Incident Involving A Person That Occurred At An AV Shooting Site! The Scene Of The Crime Is Extremely Chaotic... And Then A Savior Appears! ? Detective Nozomi Stands Up! ! ! ~ Yay Takashima Incident ~ [Uncensored L**ked],https://pic.javct.net/poster/07052026/1c66df7f5a.jpg,https://javct.net/v/ftht-357-rm,86,2026-07-15
420HHL-155-RM,"KAINE(21) ​​Amateur Hoi Hoi Lover, Amateur, Couple Gonzo, Cosplay, Slender, Waist, Black Hair, Beautiful Girl, Squirting, Facial [Uncensored L**ked]",https://pic.javct.net/poster/07052026/a31a5be011.jpg,https://javct.net/v/420hhl-155-rm,70,2026-07-15
FTHT-345-RM,Verification! Can You Really Feel The Head Spa Wire? ? The Devil's Hand Of Pleasure Approaches The Female Monitors Who Gathered To Verify The Effectiveness Of Health Equipment! ? 10 Monitor Participants [Distribution Limited Vol.2] [Uncensored L**ked],https://pic.javct.net/poster/07052026/b700796c5f.jpg,https://javct.net/v/ftht-345-rm,125,2026-07-15
FC2PPV-4937567,"[First shot] Her fair-skinned F-cup body is irresistibly neat and clean, and she has a constitution that is hard to imagine, and I was excited to see her panting so much, so I creampied her.",https://pic.javct.net/poster/07052026/27be3d0f87.jpg,https://javct.net/v/fc2ppv-4937567,71,2026-07-15
SABA-813-RM,Job Hunting Female College Students Who Sell Their Bodies To Get Job Offers Too Extreme Power Harassment Interview Video... Raw Vaginal Cum Shot Self-PR Vol.004,https://pic.javct.net/poster/20233001/1676086767.jpg,https://javct.net/v/saba-813-rm,110,2026-07-15
FTHT-344-RM,Verification! Can You Really Feel The Head Spa Wire? ? The Devil's Hand Of Pleasure Approaches The Female Monitors Who Gathered To Verify The Effectiveness Of Health Equipment! ? 10 Monitor Participants [Distribution Limited Vol.1] [Uncensored L**ked],https://pic.javct.net/poster/07052026/6592c161eb.jpg,https://javct.net/v/ftht-344-rm,124,2026-07-15
FTHT-356-RM,Unreasonable Daily Life At A School With An Overwhelmingly High Proportion Of Girls (and Full Of Sluts) ~Sexual FALENO School Edition~ [Uncensored L**ked],https://pic.javct.net/poster/07052026/41eb720ae6.jpg,https://javct.net/v/ftht-356-rm,82,2026-07-15
SDAB-354-RM,"""I want to do more naughty things..."" A naive baby-faced archery girl's full-on sex! 18 year old AV debut Yua Kaname",https://pic.javct.net/poster/07052026/be7c9569b1.jpg,https://javct.net/v/sdab-354-rm,222,2026-07-15
USAG-094-RM,"Amateur Girl Takes On A Fixed Vibrator Blowjob Game!! She Wins A Prize If She Can Make A Man Ejaculate With Her Blowjob... But If She Cums First, She Gets A Follow-up Piston Fuck With Internal Ejaculation!!",https://pic.javct.net/poster/07052026/6b6e420564.jpg,https://javct.net/v/usag-094-rm,126,2026-07-15
FC2PPV-4938613,[Personal photography] A 35-year-old mature wife writhes in agony as her whole body is covered in erogenous zones. Her unprocessed pubic hair may be valuable.,https://pic.javct.net/poster/07052026/d2a8af4d90.jpg,https://javct.net/v/fc2ppv-4938613,39,2026-07-15
259LUXU-292,Luxury TV 320,https://pic.javct.net/poster/07052026/c268150dab.jpg,https://javct.net/v/259luxu-292,58,2026-07-15
259LUXU-306,Luxury TV 280,https://pic.javct.net/poster/07052026/d45b042aa2.jpg,https://javct.net/v/259luxu-306,59,2026-07-15
