code,title,image_url,page_url,views,date_scraped
SCOP-812-RM,"Reunion After A Long Time With The Cutest Yankee Girl In School! Even Though I've Been Fooling My Virginity, I'm Full Of Vaginal Cum Shot To The Bimbo Who Makes My Body Jump From The Moment I Insert My Cock Once! 6 [Uncensored L**ked]",https://pic.javct.net/poster/20230206/1686372555.jpg,https://javct.net/v/scop-812-rm,135,2026-06-13
TKFC-109-RM,Married woman anal fisted (posting name ◎ Yuki & Keiko) [Uncensored L**ked],https://pic.javct.net/poster/05192026/7bdae98295.jpg,https://javct.net/v/tkfc-109-rm,49,2026-06-13
SRS-063-RM,Amateur Hunter 2 · 44 [Uncensored L**ked],https://pic.javct.net/poster/05192026/34e429c3ac.jpg,https://javct.net/v/srs-063-rm,135,2026-06-13
TOTTE-263-RM,"A spider cowgirl chicken race where a swimsuit gal takes on the challenge! Get 100 yen for every piston! However, if you ejaculate, your prize money will be immediately forfeited! I have a big dick with a big erection! My rationality collapses and I can't stop shaking my hips, so I end up creampied! ? Take a picture and put it out! Magic Mirror Issue ~Sana Edition~ [Uncensored L**ked]",https://pic.javct.net/poster/05192026/a0877cb762.jpg,https://javct.net/v/totte-263-rm,58,2026-06-13
HIKR-259-RM,A big game of sex with the house studio manager in Los Angeles! Hello West (24) [Uncensored L**ked],https://pic.javct.net/poster/05192026/97e52c2046.jpg,https://javct.net/v/hikr-259-rm,83,2026-06-13
USAG-093,"For Office Ladies With Beautiful Legs Only!! With Their Eyes Blindfolded And Wearing Their Own Black Pantyhose, They Had To Rely Solely On Their Sense Of Touch To Guess What They Were Touching! Correct Guesses Meant A Prize, Incorrect Guesses Meant An Immediate Erotic Punishment!!",https://pic.javct.net/poster/05192026/67495319dd.jpg,https://javct.net/v/usag-093,174,2026-06-13
EMTH-262,Plump And Voluptuous Women 5-Hour 30-Minute Extended Special: Kneading And Cumming Inside Their Bountiful Breasts! A Thorough Sex Documentary Of 8 Voluptuous Mature Women With Insatiable Sex Drives,https://pic.javct.net/poster/05192026/b6aeb240c8.jpg,https://javct.net/v/emth-262,330,2026-06-13
MIHD-005-RM,Hamedori distribution limited MOODYZ exclusive natural sex released Kira Kira [Uncensored L**ked],https://pic.javct.net/poster/05192026/8811eafe63.jpg,https://javct.net/v/mihd-005-rm,110,2026-06-13
OFTR-010,Lots Of Panty Shots And Glimpses Of Breasts!! Young Ladies Walking Down The Street! How About Earning Some Pocket Money Playing A Treasure Hunt Game While Using A Fixed Vibrator And Remote Vibrator?,https://pic.javct.net/poster/05192026/de9712dfd3.jpg,https://javct.net/v/oftr-010,168,2026-06-13
PAKO-105,"At A Hotel Across From Her Husband's Office, The Tall, Beautiful Young Wife, A Working Office Lady, Is Repeatedly Seduced Through Group Sex, Bondage, Blindfolds, And To**ure.",https://pic.javct.net/poster/05192026/2c91f4597c.jpg,https://javct.net/v/pako-105,140,2026-06-13
SKMJ-757,"""What, You're Still Going? How Many Times Are You Going To Cum Inside Me? I Can't Take It Anymore! I'm Cumming Too Much And I'm Going Crazy!!"" Amateur College Girl Vs. Handsome AV Actor: Cumming Tag. Chase Him Around And If He Catches You, He'll Cum Inside You Endlessly With Super-fast Thrusting!! 3",https://pic.javct.net/poster/05192026/e507811b4a.jpg,https://javct.net/v/skmj-757,180,2026-06-13
SKMJ-758,"On The Other Side Of The One-way Mirror Is Her Beloved Husband // A Frustrated Mom, Overwhelmed By C**ldcare, Gives A Hands-free Blowjob Right In Front Of Her Husband, Sucking His Big Dick With Just Her Mouth!? Shyly, She Sucks His Big Dick With Just Her Mouth, Getting So Engrossed That She Explodes With Lust And Blushes With Arousal... Raw Sex In Front Of Daddy...",https://pic.javct.net/poster/05192026/27e47ab258.jpg,https://javct.net/v/skmj-758,228,2026-06-13
ALOG-029,"My Innocent Girlfriend Is Corrupted, And The Unsuspecting Girl Accepts The Lewd Requests With A Smile.",https://pic.javct.net/poster/05192026/b16dbba3ed.jpg,https://javct.net/v/alog-029,120,2026-06-13
SKMJ-756,"A Sweaty Amateur High School Girl From A Sports Club, Still In Her Uniform After Practice, Tries Bareback Sex! For The First Time In Her Life, She Gets Rubbed Against A Rock-hard Huge Cock, And Her Innocent Pussy Gets Wet With Embarrassment Before It's Smoothly Inserted, Leading To A Powerful Orgasm And Multiple Cumshots!",https://pic.javct.net/poster/05192026/a28156bd2f.jpg,https://javct.net/v/skmj-756,182,2026-06-13
200GANA-3406-RM,"[I prefer tampons to tampons] A fierce man wearing a fluffy natural skin. A 27-year-old H-cup beauty clinic worker is immersed in an erotic game while holding a princess. As a result, her nipples are twitching and her sensitive body collapses. A real softie, first shot 2308 [Uncensored L**ked]",https://pic.javct.net/poster/05192026/64cab51c14.jpg,https://javct.net/v/200gana-3406-rm,58,2026-06-13
200GANA-3406,"[I prefer tampons to tampons] A fierce man wearing a fluffy natural skin. A 27-year-old H-cup beauty clinic worker is immersed in an erotic game while holding a princess. As a result, her nipples are twitching and her sensitive body collapses. A real softie, first shot 2308",https://pic.javct.net/poster/05192026/64cab51c14.jpg,https://javct.net/v/200gana-3406,58,2026-06-13
300MIUM-1389,"[Explosive Titty Fuck Heaven] A smile, a female face, an orgasmic face that can only be shown to my girlfriend, who has perfect skin, and I, wearing no make-up clothes, are having sex with each other... When I take off my bursting blouse, I soak in the bathtub with her big J-cup boobs, and we touch each other's bodies. From the night when we are enveloped by each other's shiny boobs, the morning begins with raw sex, where we promise to have sex with each other all day long. A secret couple sex video post [semi-cohabiting girlfriend]",https://pic.javct.net/poster/05192026/33a72f6f73.jpg,https://javct.net/v/300mium-1389,99,2026-06-13
FC2PPV-4917756,"#43 ""I'm gonna die ohhhh I'm gonna cum so hard after the near-miss hell. My little body convulses and screams in ecstasy during sex""",https://pic.javct.net/poster/05192026/d0fa9a63b8.jpg,https://javct.net/v/fc2ppv-4917756,99,2026-06-13
FC2PPV-4919240,[Uncensored] Cross-dressing male interview for therapist recruitment,https://pic.javct.net/poster/05192026/21283c79c5.jpg,https://javct.net/v/fc2ppv-4919240,34,2026-06-13
MUFR-008,I'm A Female Otaku Of Underground Idols. The Day I Crossed The Line With Just A Female Friend. ~I Was More Into My Close Female Friend Who Was Also A Fan Of The Same Idol Than The Idol I Was Supporting.~,https://pic.javct.net/poster/05192026/e92f50dadd.jpg,https://javct.net/v/mufr-008,140,2026-06-13
FC2PPV-4918768,"A rare video of a former c**ld actor who appeared in a popular morning drama begging a naive, black-haired college girl to cum inside her for the first time in P sex with her lewd switch fully open.",https://pic.javct.net/poster/05192026/e4d219b5c2.jpg,https://javct.net/v/fc2ppv-4918768,69,2026-06-13
IENE-873-RM,I Got Such A Wonderful Thing If A Gentle Young Woman I Found In Jiyugaoka Gave Me Troubles Chi Po. [Uncensored L**ked],https://pic.javct.net/poster/05192026/523a3a7a6e.jpg,https://javct.net/v/iene-873-rm,210,2026-06-13
DVDMS-957-RM,"Appearance MM No. Only Close Female Friends The Magic Mirror A Pair Of Female College Students Challenge The ""Virgin Brush Dropping Escape Game""! 2 Harlem 3P Of 2 JDs Who Got Excited About Virgin Cocks Who Were Shy But Shy And Scrambled For Dicks! The Last Is W Raw Vaginal Cum Shot! [Uncensored L**ked]",https://pic.javct.net/poster/20230206/1685693839.jpg,https://javct.net/v/dvdms-957-rm,240,2026-06-13
CHCH-036-RM,A One-time Mistake Made By A Full-time Housewife With I-cup Breasts. A Full-time Housewife Who Had An Affair With A Young Man She Met On Social Media And Was Blackmailed By A Stolen Video Made Her Head To A Designated Apartment In The Suburbs Of Tokyo... [Uncensored L**ked],https://pic.javct.net/poster/20230206/1686974202.jpg,https://javct.net/v/chch-036-rm,125,2026-06-13
