code,title,image_url,page_url,views,date_scraped
JJPP-169,A DVD Of A Voyeur Of A Handsome Guy Bringing A Mature Woman Into A Room And Bringing It To SEX. 158 - Forcibly We Have To Cum As It Is -,https://pic.javct.net/poster/05192026/373644a86f.jpg,https://javct.net/v/jjpp-169,130,2026-06-08
NNPJ-379-RM,Talented Girls Found In Shinjuku In The Middle Of Tokyo! Rolling Up A Celebrity-class Amateur Beautiful Girl Is Super-incontinence! The Peeing Of The Girls! Look At The Too Erotic Before (when Cute When Picking Up) And After (l**k Vulgarity)! [Uncensored L**ked],https://pic.javct.net/poster/05192026/28312ca2a0.jpg,https://javct.net/v/nnpj-379-rm,230,2026-06-08
DIVAS-086,Too High Level! 6 Decapai Patsukin Beauties! Adhesion Sex With A Japanese Boy With Erotic Body! 4 Hours BEST,https://pic.javct.net/poster/05192026/4f442bb1c1.jpg,https://javct.net/v/divas-086,240,2026-06-08
DVDMS-974-RM,"Good Friends On The Way Home From School ○ A Group Of Three School Students Challenge! If You Let Me Ejaculate, You Lose! Suspenseful Pounding Cock Crisis One-shot Game! Handjob → Blow Job → Tit Fuck → Finally, Extreme Size Stop Of Raw Insertion! ! [Uncensored L**ked]",https://pic.javct.net/poster/20230206/1688100900.jpg,https://javct.net/v/dvdms-974-rm,180,2026-06-08
FC2PPV-4910476,Pregnant woman's self-nude shooting scene [12 weeks pregnant: 2 types of underwear & nude] Model K retired pregnant woman nude collection #01,https://pic.javct.net/poster/05192026/d2082fe7d0.jpg,https://javct.net/v/fc2ppv-4910476,45,2026-06-08
JJPP-175,A DVD Of A Voyeur Of A Handsome Guy Taking A Mature Woman Into A Room And Bringing It To SEX. 164-I Forcibly Made A Vaginal Cum Shot-,https://pic.javct.net/poster/05192026/95e2961dc3.jpg,https://javct.net/v/jjpp-175,125,2026-06-08
JJPP-170,A DVD Of A Voyeur Of A Handsome Guy Taking A Mature Woman Into A Room And Bringing It To SEX. 159 ~ I Forcibly Made A Vaginal Cum Shot ~,https://pic.javct.net/poster/05192026/697c2963b0.jpg,https://javct.net/v/jjpp-170,125,2026-06-08
BDSR-058-RM,Assault!! Around The Front Of The Station Along The Yamanote Nampa Hardcore Housewife! Kanda - Okachimachi Hen Cum Amateur Wife Suddenly [Uncensored L**ked],https://pic.javct.net/poster/05192026/6a1283dd16.jpg,https://javct.net/v/bdsr-058-rm,120,2026-06-08
JJPP-167,A DVD Of A Voyeur Of A Handsome Guy Taking A Mature Woman Into A Room And Bringing It To SEX. 156 ~ I Forcibly Made A Vaginal Cum Shot ~,https://pic.javct.net/poster/05192026/42b2ba1543.jpg,https://javct.net/v/jjpp-167,125,2026-06-08
FIND-006-RM,"20 Years Of Marriage. I Want To Release The Libido That I Have Accumulated Without Cheating! ! A Shy Plump Wife Forty Years Debut! Emi-san, 47 Years Old [Uncensored L**ked]",https://pic.javct.net/poster/20230207/1688527793.jpg,https://javct.net/v/find-006-rm,120,2026-06-08
PAKO-061-RM,Tall Slender Miraculous Beautiful Mature Woman AV Appearance Occupation School Teacher [Uncensored L**ked],https://pic.javct.net/poster/20230206/1687839283.jpg,https://javct.net/v/pako-061-rm,135,2026-06-08
NNPJ-380-RM,An Unusually Cute Girl Was Abnormally Perverted. Masochistic Addictive Exposure Exposing Propensity [Uncensored L**ked],https://pic.javct.net/poster/05192026/27a69f9b8e.jpg,https://javct.net/v/nnpj-380-rm,180,2026-06-08
PAIS-045-RM,"An Active Civil Servant With Colossal Tits While Working, I-cup Is A Fierce Moody Who Masturbates In The Toilet At Work (City Hall) [Uncensored L**ked]",https://pic.javct.net/poster/20230206/1687839344.jpg,https://javct.net/v/pais-045-rm,129,2026-06-08
ONEX-001-RM,Black Hair Shortcut Girl And Sex 01 [Uncensored L**ked],https://pic.javct.net/poster/20230206/1688028267.jpg,https://javct.net/v/onex-001-rm,120,2026-06-08
GOJU-236-RM,Squirting Joba Joba Wife In Gotanda Asano 45 Years Old [Uncensored L**ked],https://pic.javct.net/poster/20230207/1688526775.jpg,https://javct.net/v/goju-236-rm,133,2026-06-08
PXH-025-RM,Obo Girl 006 Yuria (19) 19-year-old Part-time Jobber Naturally Vaginal Cum Shot Demon Jet Daughter Overwhelming Beautiful Legs Always Estrus Syndrome Healing Sex Monster [Uncensored L**ked],https://static.javct.net/poster/pxh-025.jpg,https://javct.net/v/pxh-025-rm,150,2026-06-08
COGM-051-RM,"Marunouchi OL, Side Job Is Immediate Hamederiheru [Uncensored L**ked]",https://pic.javct.net/poster/20230206/1688186579.jpg,https://javct.net/v/cogm-051-rm,107,2026-06-08
DIVAS-076,Diamond In The Rough Living In The Countryside Of Europe! I'm Going To Make Use Of Japanese Hard Cocks To Transcendence Shaved Beauties! 8 People 4 Hours SP,https://pic.javct.net/poster/05192026/a413c82803.jpg,https://javct.net/v/divas-076,240,2026-06-08
IPBZ-023-RM,Limited distribution: Natupoke REC: Nene Misumi Gonzo IP actress released as she is [Uncensored L**ked],https://pic.javct.net/poster/05192026/14ebafe009.jpg,https://javct.net/v/ipbz-023-rm,110,2026-06-08
FC2PPV-4916625,"[No]《First shot》Pure and cute modern Pien-chan, who is sensitively panting, has a lot of creampie",https://pic.javct.net/poster/05192026/59d0b205b5.jpg,https://javct.net/v/fc2ppv-4916625,58,2026-06-08
FC2PPV-4916927,"[No] Black 3P party on the day of birthday Reina, a cute foreign office lady with outstanding charm Chapter 6: Intense 3P with 2 big cock black people on her birthday, to**ured to the limit and creampied 2 times in a row [Overseas version] Bonus included",https://pic.javct.net/poster/05192026/d8d5b87191.jpg,https://javct.net/v/fc2ppv-4916927,71,2026-06-08
DIVAS-082,"Picking Up Japanese In Europe, The Mecca Of Transcendent Beauties! From Too Beautiful Supporters To The Strongest Prostitutes No.1... 4 Hours Of Exciting Nampa Sex!",https://pic.javct.net/poster/05192026/65c9ca7301.jpg,https://javct.net/v/divas-082,240,2026-06-08
USAG-091,Unstoppable Arousal And Hip Shaking!! Incredible Dildo Masturbation 4,https://pic.javct.net/poster/05192026/cd4aa949e1.jpg,https://javct.net/v/usag-091,142,2026-06-08
FC2PPV-4915930,"My first experience was with my seniors in the basketball club, and I made it without permission. ""I'm going to get pregnant by injecting my special secret technique, Sison.''",https://pic.javct.net/poster/05192026/442b5111e0.jpg,https://javct.net/v/fc2ppv-4915930,51,2026-06-08
