code,title,image_url,page_url,views,date_scraped
MISM-155-RM,Ayami Who Wants To Poke Her Butt Hole Hard Like Irama [Uncensored L**ked],https://pic.javct.net/poster/20231711/1702450375.jpg,https://javct.net/v/mism-155-rm,120,2026-07-10
BBAN-581,[Celebrating The Comeback] [Celebrating The Return Of Lesbians] Hasumi Claire's Amazing Technique! A Strap-on Lesbian Visit To Your Home And I'll Make You Cum Like Crazy!,https://pic.javct.net/poster/07052026/c3ea3fc1a4.jpg,https://javct.net/v/bban-581,220,2026-07-10
DASD-288-RM,Sex Out In The First Anal Of All Fire Real Sperm Charm Plenty Pretty Sakurai Kokorona [Uncensored L**ked],https://pic.javct.net/poster/09052025/1757596529.jpg,https://javct.net/v/dasd-288-rm,150,2026-07-10
ACZD-145-RM,A Super-beautiful Man Who Is In Heat By Having His Anus Licked. He Trains His Sensitive Body To Convulse And Beg. Nanako [Uncensored L**ked],https://pic.javct.net/poster/20231011/1699617272.jpg,https://javct.net/v/aczd-145-rm,151,2026-07-10
MOPG-039,I Want You To Commit. Masochist Bondage Bond Yuka Shinohara,https://pic.javct.net/poster/07052026/79847e030b.jpg,https://javct.net/v/mopg-039,126,2026-07-10
RMER-023-RM,"Celia's Big Butt, Fart And Buttjob Firing Celia Aizuki [Uncensored L**ked]",https://pic.javct.net/poster/20233001/1677296833.jpg,https://javct.net/v/rmer-023-rm,121,2026-07-10
OTIN-023-RM,Anal Masochist Wife Anal Creampie Affair - This Hairy Gal Wife Is A Masochist Who Explodes With Pounding In Her Asshole! She Tongues Out And Loses Her Mind While Her Tail Is Thrust Into Her Anus! Haruno Ando [Uncensored L**ked],https://pic.javct.net/poster/07052026/d05007e99a.jpg,https://javct.net/v/otin-023-rm,127,2026-07-10
DASD-256-RM,Mayu Shimazaki [Uncensored L**ked],https://pic.javct.net/poster/09052025/1757343579.jpg,https://javct.net/v/dasd-256-rm,119,2026-07-10
QRDW-003,Pleasure brainwashing All Thai whole body control Natural drugs that destroy the brain Murasaki Murasaki,https://pic.javct.net/poster/07052026/aba03e7a67.jpg,https://javct.net/v/qrdw-003,114,2026-07-10
REAL-631-RM,Anal Spotted Punching 17 Holes Special! ! [Uncensored L**ked],https://pic.javct.net/poster/05192026/9bd4554f3e.jpg,https://javct.net/v/real-631-rm,240,2026-07-10
DASD-245-RM,The Spinning 100 Volley Serizawa Gangbang Fo**ed Out Anal [Uncensored L**ked],https://pic.javct.net/poster/20240807/1721170004.jpg,https://javct.net/v/dasd-245-rm,150,2026-07-10
BOKD-156,Massive Ejaculation Of Iki Rolling With Toy Toy Blame 27 People 240 Minutes,https://pic.javct.net/poster/07052026/aee4c9e73d.jpg,https://javct.net/v/bokd-156,240,2026-07-10
MOPG-037,Clothed M Man Hunting Pitapita Jeans Harassment Mirori Morishita,https://pic.javct.net/poster/07052026/f8720240d8.jpg,https://javct.net/v/mopg-037,103,2026-07-10
KTKN-013-RM,"No Questions Asked, An Overwhelming Presence, A Stunningly Beautiful Cross-dressing Boy Who Is 190cm Tall. [Uncensored L**ked]",https://pic.javct.net/poster/05192026/7f1c4c7b81.jpg,https://javct.net/v/ktkn-013-rm,215,2026-07-10
770RABI-069-RM,Anal affair explosive orgasm face [Uncensored L**ked],https://pic.javct.net/poster/07052026/955962a62b.jpg,https://javct.net/v/770rabi-069-rm,51,2026-07-10
770RABI-071-RM,Anal affair gal wife's pre-cut ass gets messy [Uncensored L**ked],https://pic.javct.net/poster/07052026/e3fedea007.jpg,https://javct.net/v/770rabi-071-rm,54,2026-07-10
NVH-082-RM,"""A Beautiful Girl? No, A Cross-dressing Pretty Boy."" II [Uncensored L**ked]",https://pic.javct.net/poster/05192026/16a0daf4de.jpg,https://javct.net/v/nvh-082-rm,170,2026-07-10
MOPG-036,I Want You To Commit.Which Masochism? Bondage Mirou Ann,https://pic.javct.net/poster/07052026/fc3313148d.jpg,https://javct.net/v/mopg-036,123,2026-07-10
OTIN-023,Anal Masochist Wife Anal Creampie Affair - This Hairy Gal Wife Is A Masochist Who Explodes With Pounding In Her Asshole! She Tongues Out And Loses Her Mind While Her Tail Is Thrust Into Her Anus! Haruno Ando,https://pic.javct.net/poster/07052026/d05007e99a.jpg,https://javct.net/v/otin-023,127,2026-07-10
FC2PPV-4933628,*60% off for the first time only until the 11th* [AF] [Face] The image of him enduring his first AF with a bright red face is a very immoral video.,https://pic.javct.net/poster/07052026/555c1e3c6a.jpg,https://javct.net/v/fc2ppv-4933628,46,2026-07-10
JUKD-652-RM,Chinami Sakai Beautiful Mature Woman And Black [Uncensored L**ked],https://pic.javct.net/poster/07052026/16844c5404.jpg,https://javct.net/v/jukd-652-rm,120,2026-07-10
SOAN-129-RM,"Anal Seminar: A Serious Office Worker Experiences Multiple Anal Orgasms With A Cock → Forgets Her Vagina And Becomes Addicted To Her Anus, Becoming A Sex Friend. Subject Number: 004 Tsukimachi Aoba [Uncensored L**ked]",https://pic.javct.net/poster/05192026/411232721a.jpg,https://javct.net/v/soan-129-rm,133,2026-07-10
RCTD-739-RM,That Legendary Shop Is Back In Business! The 2026 Butt-Filled Beer Garden: A Beer Garden Full Of Butts And Exposed Anuses! Stunning Beer Girls Show Off Their Anuses And Give Lewd Instructions For Masturbation! [Uncensored L**ked],https://pic.javct.net/poster/07052026/56fadca42f.jpg,https://javct.net/v/rctd-739-rm,100,2026-07-10
MOPG-035,The Best M Sexual Sensation That The Brain Is Fucked And Brains Get Fucked Up TRY Hirasaki Yuzu,https://pic.javct.net/poster/07052026/6970ae973d.jpg,https://javct.net/v/mopg-035,115,2026-07-10
