code,title,image_url,page_url,views,date_scraped
ACZD-254-RM,Young Wife Turned Human Toilet Training: Enema And Breeding [Uncensored L**ked],https://pic.javct.net/poster/05192026/1b76ada082.jpg,https://javct.net/v/aczd-254-rm,191,2026-06-15
SRS-067-RM,Bimbo Document Rena-chan 22-year-old Cram School Teacher File.07 [Uncensored L**ked],https://pic.javct.net/poster/05192026/58f416c669.jpg,https://javct.net/v/srs-067-rm,135,2026-06-15
YAKO-094-RM,"The Beautiful Career Woman's True Nature Was That Of A Secretly Perverted, Masochistic Transsexual. A L**ked Video Of Her Having Sex Six Times Would Be The End Of Her Career If Her Colleagues Saw It. [Uncensored L**ked]",https://pic.javct.net/poster/05192026/bc894c31e5.jpg,https://javct.net/v/yako-094-rm,240,2026-06-15
SXMA-022-RM,Shangri-La Spa: Beautiful And Crazy Lustful Dance Part 12: My Penis And Anus Have Become So Sensitive It's Driven Insane - Shihori Hirate [Uncensored L**ked],https://pic.javct.net/poster/05192026/29f51b4e55.jpg,https://javct.net/v/sxma-022-rm,116,2026-06-15
PTS-547,"Wife Has Her Anus, Which Even Her Husband Has Never Touched, Stimulated By Two Masseuses Right Next To Her Husband. Although She Knows It's Wrong, The Simultaneous Penetration Of Her Two Unknown Orifices Leads Her To An Unstoppable Series Of Orgasms.",https://pic.javct.net/poster/05192026/530a6f8a6f.jpg,https://javct.net/v/pts-547,176,2026-06-15
MOPE-029,10 Beauties Who Make A Male Fuck With Peniban In Male Hole,https://pic.javct.net/poster/05192026/11a665d31f.jpg,https://javct.net/v/mope-029,156,2026-06-15
MOPE-030,Anal Fist ~ Brain Iki Crazy ~,https://pic.javct.net/poster/05192026/3cb3f4997f.jpg,https://javct.net/v/mope-030,156,2026-06-15
MIGD-641,Human Body Fixed Anal Slave History Takanashi,https://pic.javct.net/poster/05192026/bb4e9afa6d.jpg,https://javct.net/v/migd-641,120,2026-06-15
MOPG-012,Kan'no Of Flower Of God Man Prisoners - Kanohana God Negotiation -,https://pic.javct.net/poster/05192026/1651aa913e.jpg,https://javct.net/v/mopg-012,118,2026-06-15
MOPA-028,Shaved ☆ Rectum Hit S-class Strap-on Dildo Of Gal [source Miina]!,https://pic.javct.net/poster/05192026/38cb795ef7.jpg,https://javct.net/v/mopa-028,118,2026-06-15
BDSM-084-RM,Masochistic Actress Sakikazu Sasaki To**ure Record [Uncensored L**ked],https://pic.javct.net/poster/20230205/1685599207.jpg,https://javct.net/v/bdsm-084-rm,136,2026-06-15
SDDE-481-RM,"Man Who Can Stop Time Was Real!~ Happy That Her Proud Of The Guys ""in O'sleeping"" Saddle Defeated!Latent Life Hen [Uncensored L**ked]",https://pic.javct.net/poster/20230104/1682418277.jpg,https://javct.net/v/sdde-481-rm,120,2026-06-15
OTIN-026-RM,"Anal-dominant Wife's Anal Cumshot Affair: Two-hole To**ure With Toys And Dick! Thrusting Until Her Anus Swells And Turns Bright Red, Raw Cumshot Into Her Ripe Anus! Momoe Mikoto [Uncensored L**ked]",https://pic.javct.net/poster/05192026/6423054b7a.jpg,https://javct.net/v/otin-026-rm,96,2026-06-15
ASEX-014,"Super Hot! Super Real Gal Anal Fuck! Double Hole, Triple Hole, Enema Party Party! Anal Trip Ahegao Gal Party Night Love Haruno Ando",https://pic.javct.net/poster/05192026/b0819b6511.jpg,https://javct.net/v/asex-014,151,2026-06-15
MGMQ-169-RM,"I Was In A Hotel Room With A Junior Female Colleague On A Business Trip, And She Sexually Assaulted Me, Anally Penetrated Me, And Made Me Orgasm Repeatedly Until Morning. (Miyagi Rie) [Uncensored L**ked]",https://pic.javct.net/poster/05192026/da2255c632.jpg,https://javct.net/v/mgmq-169-rm,123,2026-06-15
FC2PPV-4916896,I had anal sex with a female college student while filming.,https://pic.javct.net/poster/05192026/142e7322bb.jpg,https://javct.net/v/fc2ppv-4916896,118,2026-06-15
DFE-078-RM,My Daughter Eats It. Rin Ikuta [Uncensored L**ked],https://pic.javct.net/poster/20241703/1711682908.jpg,https://javct.net/v/dfe-078-rm,133,2026-06-15
YAKO-094,"The Beautiful Career Woman's True Nature Was That Of A Secretly Perverted, Masochistic Transsexual. A L**ked Video Of Her Having Sex Six Times Would Be The End Of Her Career If Her Colleagues Saw It.",https://pic.javct.net/poster/05192026/bc894c31e5.jpg,https://javct.net/v/yako-094,240,2026-06-15
TCD-335,NH Health Mature Woman Owner Mom Pushes The Limits With Reverse Anal Massive Ejaculation - Kaoru Ushijima,https://pic.javct.net/poster/05192026/a25ca97330.jpg,https://javct.net/v/tcd-335,143,2026-06-15
MGMQ-169,"I Was In A Hotel Room With A Junior Female Colleague On A Business Trip, And She Sexually Assaulted Me, Anally Penetrated Me, And Made Me Orgasm Repeatedly Until Morning. (Miyagi Rie)",https://pic.javct.net/poster/05192026/da2255c632.jpg,https://javct.net/v/mgmq-169,123,2026-06-15
TKFC-109-RM,Married woman anal fisted (posting name ◎ Yuki & Keiko) [Uncensored L**ked],https://pic.javct.net/poster/05192026/7bdae98295.jpg,https://javct.net/v/tkfc-109-rm,49,2026-06-15
SXMA-022,Shangri-La Spa: Beautiful And Crazy Lustful Dance Part 12: My Penis And Anus Have Become So Sensitive It's Driven Insane - Shihori Hirate,https://pic.javct.net/poster/05192026/29f51b4e55.jpg,https://javct.net/v/sxma-022,116,2026-06-15
OTIN-026,"Anal-dominant Wife's Anal Cumshot Affair: Two-hole To**ure With Toys And Dick! Thrusting Until Her Anus Swells And Turns Bright Red, Raw Cumshot Into Her Ripe Anus! Momoe Mikoto",https://pic.javct.net/poster/05192026/6423054b7a.jpg,https://javct.net/v/otin-026,96,2026-06-15
SOAN-083-RM,"I Wanted To Fulfill My Younger Husband's Selfish NTR...I'm Going To Sleep In Two Holes From Monday...A Real Amateur Wife Who Appeared Without Permission Thinking Of Her Husband's Habit Of Cuckolding, Full-time Housewife Hotaru Mori (a Pseudonym) Cuckolding Anal Consent [Uncensored L**ked]",https://pic.javct.net/poster/20221108/1663390105.jpg,https://javct.net/v/soan-083-rm,170,2026-06-15
