code,title,image_url,page_url,views,date_scraped
SDDE-481-RM,"Man Who Can Stop Time Was Real!~ Happy That Her Proud Of The Guys ""in O'sleeping"" Saddle Defeated!Latent Life Hen [Uncensored L**ked]",https://pic.javct.net/poster/20230104/1682418277.jpg,https://javct.net/v/sdde-481-rm,120,2026-06-14
OTIN-026-RM,"Anal-dominant Wife's Anal Cumshot Affair: Two-hole To**ure With Toys And Dick! Thrusting Until Her Anus Swells And Turns Bright Red, Raw Cumshot Into Her Ripe Anus! Momoe Mikoto [Uncensored L**ked]",https://pic.javct.net/poster/05192026/6423054b7a.jpg,https://javct.net/v/otin-026-rm,96,2026-06-14
ASEX-014,"Super Hot! Super Real Gal Anal Fuck! Double Hole, Triple Hole, Enema Party Party! Anal Trip Ahegao Gal Party Night Love Haruno Ando",https://pic.javct.net/poster/05192026/b0819b6511.jpg,https://javct.net/v/asex-014,151,2026-06-14
MGMQ-169-RM,"I Was In A Hotel Room With A Junior Female Colleague On A Business Trip, And She Sexually Assaulted Me, Anally Penetrated Me, And Made Me Orgasm Repeatedly Until Morning. (Miyagi Rie) [Uncensored L**ked]",https://pic.javct.net/poster/05192026/da2255c632.jpg,https://javct.net/v/mgmq-169-rm,123,2026-06-14
FC2PPV-4916896,I had anal sex with a female college student while filming.,https://pic.javct.net/poster/05192026/142e7322bb.jpg,https://javct.net/v/fc2ppv-4916896,118,2026-06-14
DFE-078-RM,My Daughter Eats It. Rin Ikuta [Uncensored L**ked],https://pic.javct.net/poster/20241703/1711682908.jpg,https://javct.net/v/dfe-078-rm,133,2026-06-14
YAKO-094,"The Beautiful Career Woman's True Nature Was That Of A Secretly Perverted, Masochistic Transsexual. A L**ked Video Of Her Having Sex Six Times Would Be The End Of Her Career If Her Colleagues Saw It.",https://pic.javct.net/poster/05192026/bc894c31e5.jpg,https://javct.net/v/yako-094,240,2026-06-14
TCD-335,NH Health Mature Woman Owner Mom Pushes The Limits With Reverse Anal Massive Ejaculation - Kaoru Ushijima,https://pic.javct.net/poster/05192026/a25ca97330.jpg,https://javct.net/v/tcd-335,143,2026-06-14
MGMQ-169,"I Was In A Hotel Room With A Junior Female Colleague On A Business Trip, And She Sexually Assaulted Me, Anally Penetrated Me, And Made Me Orgasm Repeatedly Until Morning. (Miyagi Rie)",https://pic.javct.net/poster/05192026/da2255c632.jpg,https://javct.net/v/mgmq-169,123,2026-06-14
TKFC-109-RM,Married woman anal fisted (posting name ◎ Yuki & Keiko) [Uncensored L**ked],https://pic.javct.net/poster/05192026/7bdae98295.jpg,https://javct.net/v/tkfc-109-rm,49,2026-06-14
SXMA-022,Shangri-La Spa: Beautiful And Crazy Lustful Dance Part 12: My Penis And Anus Have Become So Sensitive It's Driven Insane - Shihori Hirate,https://pic.javct.net/poster/05192026/29f51b4e55.jpg,https://javct.net/v/sxma-022,116,2026-06-14
OTIN-026,"Anal-dominant Wife's Anal Cumshot Affair: Two-hole To**ure With Toys And Dick! Thrusting Until Her Anus Swells And Turns Bright Red, Raw Cumshot Into Her Ripe Anus! Momoe Mikoto",https://pic.javct.net/poster/05192026/6423054b7a.jpg,https://javct.net/v/otin-026,96,2026-06-14
SOAN-083-RM,"I Wanted To Fulfill My Younger Husband's Selfish NTR...I'm Going To Sleep In Two Holes From Monday...A Real Amateur Wife Who Appeared Without Permission Thinking Of Her Husband's Habit Of Cuckolding, Full-time Housewife Hotaru Mori (a Pseudonym) Cuckolding Anal Consent [Uncensored L**ked]",https://pic.javct.net/poster/20221108/1663390105.jpg,https://javct.net/v/soan-083-rm,170,2026-06-14
MOPA-026,[Konno Hikaru] Groin Sadism Tati Continue Monster Strap-on Dildo Of,https://pic.javct.net/poster/05192026/23688adfa3.jpg,https://javct.net/v/mopa-026,127,2026-06-14
MOPE-027,2018 M Male Paradise BEST 10,https://pic.javct.net/poster/05192026/e9fb4e26c6.jpg,https://javct.net/v/mope-027,158,2026-06-14
FC2PPV-4919240,[Uncensored] Cross-dressing male interview for therapist recruitment,https://pic.javct.net/poster/05192026/21283c79c5.jpg,https://javct.net/v/fc2ppv-4919240,34,2026-06-14
CEMD-294-RM,Ass Hole Agony! I Will Destroy Your Anus. De Masochist Woman Nanako Takamiya Delighted With Bullying Anal Sex [Uncensored L**ked],https://pic.javct.net/poster/20233001/1676086454.jpg,https://javct.net/v/cemd-294-rm,135,2026-06-14
ACZD-254,Young Wife Turned Human Toilet Training: Enema And Breeding,https://pic.javct.net/poster/05192026/1b76ada082.jpg,https://javct.net/v/aczd-254,191,2026-06-14
SDDE-464-RM,"Weekly ""she"" Launches Infinite Combinations! A Unique SEX Toy Made With Parts Sent Every Week [Uncensored L**ked]",https://pic.javct.net/poster/12082025/1766244778.jpg,https://javct.net/v/sdde-464-rm,100,2026-06-14
SOAN-065-RM,"After Her Husband And C**ld Go To Sleep, This Horny MILF Is Getting Both Her Holes Rocked Through The Night, Starting On Monday ... Her Husband Has Cuckold Fantasies, So We Indulged His Tastes By Featuring This Horny Housewife In A Real Fuck Video Nozomi Arimura (Not Her Real Name) [Uncensored L**ked]",https://pic.javct.net/poster/20212308/1630728715.jpg,https://javct.net/v/soan-065-rm,125,2026-06-14
MAD-110-RM,No. 2 Toy Orgasm Ass Fuck Hole W Insult Anal R**e [Uncensored L**ked],https://pic.javct.net/poster/05192026/12f47c7792.jpg,https://javct.net/v/mad-110-rm,120,2026-06-14
MOPG-010,Man Of Delusion Office - Mass Ejaculation And Huge Me With Strap-on Dildo Of Ideal Make Me Mesuiki Senior OL ~ An Takase,https://pic.javct.net/poster/05192026/88c13e0d88.jpg,https://javct.net/v/mopg-010,100,2026-06-14
MOPE-026,Anal Fist & Foot Fuck ~ Pleasure Pleasures Man Feels In Anal - Dry Orgasm -,https://pic.javct.net/poster/05192026/c0af9aabf4.jpg,https://javct.net/v/mope-026,155,2026-06-14
NHDTC-208-RM,"Simultaneous Remote Control Vibrator Development For Two Holes, Shameful, Beautiful-assed Part-timer Girl Unable To Move Due To Remote Double Orgasm, Gushing Profusely In Ecstasy. [Uncensored L**ked]",https://pic.javct.net/poster/05192026/7ed7e53aae.jpg,https://javct.net/v/nhdtc-208-rm,265,2026-06-14
