code,title,image_url,page_url,views,date_scraped
TDMN-018-RM,Sex Charm Yuka Ichii [Uncensored L**ked],https://pic.javct.net/poster/20230206/1686539627.jpg,https://javct.net/v/tdmn-018-rm,133,2026-06-16
ASEX-014-RM,"Super Hot! Super Real Gal Anal Fuck! Double Hole, Triple Hole, Enema Party Party! Anal Trip Ahegao Gal Party Night Love Haruno Ando [Uncensored L**ked]",https://pic.javct.net/poster/05192026/b0819b6511.jpg,https://javct.net/v/asex-014-rm,151,2026-06-16
SDAM-174,First milk enema sumo tournament 2 (really). 4 general women participated,https://pic.javct.net/poster/05192026/e63bc035d5.jpg,https://javct.net/v/sdam-174,139,2026-06-16
FC2PPV-4921031,[Amateur's first shot] Kira (18) 152 cm 38 kg sensitive cute girl gets excited with a toy and has her anal penetrated at an ATM. This is a different angle edit of the video.,https://pic.javct.net/poster/05192026/dfcebc6792.jpg,https://javct.net/v/fc2ppv-4921031,151,2026-06-16
FC2PPV-4920874,"[Complete amateur] A 19-year-old JD who is so preoccupied with naughty things that he can't concentrate in class. His sunken breasts are sucked, his naive body is devoured by an old man, he writhes in agony, and cums with his butt.",https://pic.javct.net/poster/05192026/422a0303c7.jpg,https://javct.net/v/fc2ppv-4920874,66,2026-06-16
MOPE-031,Pantyhose Slut ~ I Want To Be Fucked By Smelling Pantyhose Legs ~,https://pic.javct.net/poster/05192026/1ebdcb3b8d.jpg,https://javct.net/v/mope-031,145,2026-06-16
MOPA-029,Penis Grew Girls And Ketsuma Co ○ Man Narumi Urumi Revised Hirose Lilia,https://pic.javct.net/poster/05192026/7448477de5.jpg,https://javct.net/v/mopa-029,116,2026-06-16
MOPT-049-RM,"Long-legged Lady Teases Masochistic Man In Pantyhose, Jeans And Knee-high Boots Mizuki Sakino [Uncensored L**ked]",https://pic.javct.net/poster/09052025/1760722175.jpg,https://javct.net/v/mopt-049-rm,116,2026-06-16
CEMD-299-RM,Let's Have Sex In A Camper! Anal SEX Version 3 Haru Ogawa [Uncensored L**ked],https://pic.javct.net/poster/20233001/1677297997.jpg,https://javct.net/v/cemd-299-rm,128,2026-06-16
ACZD-254-RM,Young Wife Turned Human Toilet Training: Enema And Breeding [Uncensored L**ked],https://pic.javct.net/poster/05192026/1b76ada082.jpg,https://javct.net/v/aczd-254-rm,191,2026-06-16
SRS-067-RM,Bimbo Document Rena-chan 22-year-old Cram School Teacher File.07 [Uncensored L**ked],https://pic.javct.net/poster/05192026/58f416c669.jpg,https://javct.net/v/srs-067-rm,135,2026-06-16
YAKO-094-RM,"The Beautiful Career Woman's True Nature Was That Of A Secretly Perverted, Masochistic Transsexual. A L**ked Video Of Her Having Sex Six Times Would Be The End Of Her Career If Her Colleagues Saw It. [Uncensored L**ked]",https://pic.javct.net/poster/05192026/bc894c31e5.jpg,https://javct.net/v/yako-094-rm,240,2026-06-16
SXMA-022-RM,Shangri-La Spa: Beautiful And Crazy Lustful Dance Part 12: My Penis And Anus Have Become So Sensitive It's Driven Insane - Shihori Hirate [Uncensored L**ked],https://pic.javct.net/poster/05192026/29f51b4e55.jpg,https://javct.net/v/sxma-022-rm,116,2026-06-16
PTS-547,"Wife Has Her Anus, Which Even Her Husband Has Never Touched, Stimulated By Two Masseuses Right Next To Her Husband. Although She Knows It's Wrong, The Simultaneous Penetration Of Her Two Unknown Orifices Leads Her To An Unstoppable Series Of Orgasms.",https://pic.javct.net/poster/05192026/530a6f8a6f.jpg,https://javct.net/v/pts-547,176,2026-06-16
MOPE-029,10 Beauties Who Make A Male Fuck With Peniban In Male Hole,https://pic.javct.net/poster/05192026/11a665d31f.jpg,https://javct.net/v/mope-029,156,2026-06-16
MOPE-030,Anal Fist ~ Brain Iki Crazy ~,https://pic.javct.net/poster/05192026/3cb3f4997f.jpg,https://javct.net/v/mope-030,156,2026-06-16
MIGD-641,Human Body Fixed Anal Slave History Takanashi,https://pic.javct.net/poster/05192026/bb4e9afa6d.jpg,https://javct.net/v/migd-641,120,2026-06-16
MOPG-012,Kan'no Of Flower Of God Man Prisoners - Kanohana God Negotiation -,https://pic.javct.net/poster/05192026/1651aa913e.jpg,https://javct.net/v/mopg-012,118,2026-06-16
MOPA-028,Shaved ☆ Rectum Hit S-class Strap-on Dildo Of Gal [source Miina]!,https://pic.javct.net/poster/05192026/38cb795ef7.jpg,https://javct.net/v/mopa-028,118,2026-06-16
BDSM-084-RM,Masochistic Actress Sakikazu Sasaki To**ure Record [Uncensored L**ked],https://pic.javct.net/poster/20230205/1685599207.jpg,https://javct.net/v/bdsm-084-rm,136,2026-06-16
SDDE-481-RM,"Man Who Can Stop Time Was Real!~ Happy That Her Proud Of The Guys ""in O'sleeping"" Saddle Defeated!Latent Life Hen [Uncensored L**ked]",https://pic.javct.net/poster/20230104/1682418277.jpg,https://javct.net/v/sdde-481-rm,120,2026-06-16
OTIN-026-RM,"Anal-dominant Wife's Anal Cumshot Affair: Two-hole To**ure With Toys And Dick! Thrusting Until Her Anus Swells And Turns Bright Red, Raw Cumshot Into Her Ripe Anus! Momoe Mikoto [Uncensored L**ked]",https://pic.javct.net/poster/05192026/6423054b7a.jpg,https://javct.net/v/otin-026-rm,96,2026-06-16
ASEX-014,"Super Hot! Super Real Gal Anal Fuck! Double Hole, Triple Hole, Enema Party Party! Anal Trip Ahegao Gal Party Night Love Haruno Ando",https://pic.javct.net/poster/05192026/b0819b6511.jpg,https://javct.net/v/asex-014,151,2026-06-16
MGMQ-169-RM,"I Was In A Hotel Room With A Junior Female Colleague On A Business Trip, And She Sexually Assaulted Me, Anally Penetrated Me, And Made Me Orgasm Repeatedly Until Morning. (Miyagi Rie) [Uncensored L**ked]",https://pic.javct.net/poster/05192026/da2255c632.jpg,https://javct.net/v/mgmq-169-rm,123,2026-06-16
