code,title,image_url,page_url,views,date_scraped
AVSA-440-RM,Crossdressing Girl Debut: Super S-Class Stunning Crossdresser Rio [Uncensored L**ked],https://pic.javct.net/poster/05192026/45f7ea4501.jpg,https://javct.net/v/avsa-440-rm,112,2026-06-08
TIMD-033,Boys ♂ X ♂ Lesbian Let's Have Sex Like BL! Kino X Nico,https://pic.javct.net/poster/05192026/3c1f69d546.jpg,https://javct.net/v/timd-033,149,2026-06-08
REAL-643,Extreme Anal Hell Cum Inside Out,https://pic.javct.net/poster/05192026/8ef0cfc8a8.jpg,https://javct.net/v/real-643,140,2026-06-08
MOPG-006,How To Make The M Room - Livestock - Wakatsuki Mizuna,https://pic.javct.net/poster/05192026/cf234fa5a1.jpg,https://javct.net/v/mopg-006,117,2026-06-08
MOPE-019,Hanyu Arisa ~ Woman For M ~ 4 Hours BEST,https://pic.javct.net/poster/05192026/b83b00008c.jpg,https://javct.net/v/mope-019,257,2026-06-08
CKW-001-RM,"It Was Always Decided That I Would Be Called During My Lunch Break. But... Ejaculation Is 9 Hours Later. Moreover, It Is Blamed Immediately After That. And In The End, The Rapid-fire Sex Sato's? [Uncensored L**ked]",https://pic.javct.net/poster/20230206/1687495969.jpg,https://javct.net/v/ckw-001-rm,130,2026-06-08
SVSHA-003-RM,Shame New Student Development Health Checkup 2022 [Uncensored L**ked],https://pic.javct.net/poster/20222612/1673494385.jpg,https://javct.net/v/svsha-003-rm,275,2026-06-08
SDDE-356-RM,Department Issued Two True In Sexual Desire Processing Specialty Outpatient Clinic Gangbang Sex [Uncensored L**ked],https://pic.javct.net/poster/20242108/1724790062.jpg,https://javct.net/v/sdde-356-rm,165,2026-06-08
AARM-002-RM,JOI!! Masturbation Instructions From Sexy Girls Talking Dirty [Uncensored L**ked],https://static.javct.net/poster/aarm-002.jpg,https://javct.net/v/aarm-002-rm,241,2026-06-08
MGMQ-168-RM,A Young Wife Who Seduces And Devours Younger Submissive Men Is A Nymphomaniac Who Loves Anal Sex And Has Been Reverse-trained By Her Perverted Husband. - Akane Rei [Uncensored L**ked],https://pic.javct.net/poster/05192026/b1e8dad957.jpg,https://javct.net/v/mgmq-168-rm,112,2026-06-08
CEMD-284-RM,Anal SEX Revival As Long As One! 3 Keiko Ninomiya [Uncensored L**ked],https://pic.javct.net/poster/20222612/1673063025.jpg,https://javct.net/v/cemd-284-rm,136,2026-06-08
FC2PPV-4915289,"Sumire (18) 3rd shoot with cute twin tails, she is fo**ed to lick her anus, has a creampie where she drinks the water in her vagina through a straw, and does an anal penetration ATM.",https://pic.javct.net/poster/05192026/e02205e5f4.jpg,https://javct.net/v/fc2ppv-4915289,102,2026-06-08
FC2PPV-4915119,"[Uncensored x Personal Shooting] **pyjpx*jsps Due to difficulty in raising funds to open a salon, a married woman releases her anus for the first time and loosens her anus and spreads her pussy while being penetrated in the IN anus.",https://pic.javct.net/poster/05192026/12de3db435.jpg,https://javct.net/v/fc2ppv-4915119,72,2026-06-08
MGMQ-168,A Young Wife Who Seduces And Devours Younger Submissive Men Is A Nymphomaniac Who Loves Anal Sex And Has Been Reverse-trained By Her Perverted Husband. - Akane Rei,https://pic.javct.net/poster/05192026/b1e8dad957.jpg,https://javct.net/v/mgmq-168,112,2026-06-08
AVSA-440,Crossdressing Girl Debut: Super S-Class Stunning Crossdresser Rio,https://pic.javct.net/poster/05192026/45f7ea4501.jpg,https://javct.net/v/avsa-440,112,2026-06-08
NHDTC-208,"Simultaneous Remote Control Vibrator Development For Two Holes, Shameful, Beautiful-assed Part-timer Girl Unable To Move Due To Remote Double Orgasm, Gushing Profusely In Ecstasy.",https://pic.javct.net/poster/05192026/7ed7e53aae.jpg,https://javct.net/v/nhdtc-208,265,2026-06-08
KUSE-042-RM,A local civil servant who is an anal virgin has anal for the first time and is filled with intestinal juice Azusa Tani The longest series in the series is 260 minutes milk enema sprinkling special [Uncensored L**ked],https://pic.javct.net/poster/04112026/25f77229e7.jpg,https://javct.net/v/kuse-042-rm,263,2026-06-08
MOPG-002,Male Female Fallen - Nipple Anal Man Tide Iki-Ashina Yulia,https://pic.javct.net/poster/05192026/2bd51cd7c8.jpg,https://javct.net/v/mopg-002,118,2026-06-08
MOPA-018,HoshiSaki Yuna Are Prisoners To 'man Prisoners Hope Of The M Man',https://pic.javct.net/poster/05192026/0244e200d2.jpg,https://javct.net/v/mopa-018,120,2026-06-08
MOPE-014,Anal Fist & Foot Fuck ~ Mesuiki · Dry Orgasm Which Dominates The Senses Of Man,https://pic.javct.net/poster/05192026/9470a47ced.jpg,https://javct.net/v/mope-014,151,2026-06-08
SDDE-486-RM,In Raw Ass Hole Wrap Gently Gin Erection Chi ○ Port Of Local Residents Out Immediately Anal Division Of Your Work In Genuine [Uncensored L**ked],https://pic.javct.net/poster/20230804/1693220735.jpg,https://javct.net/v/sdde-486-rm,135,2026-06-08
MIGD-626,Incredibly Beautiful Woman Shemale Debut AyaginuSaki Anzu那,https://pic.javct.net/poster/05192026/3ce2ec951b.jpg,https://javct.net/v/migd-626,120,2026-06-08
MOPG-001,Best Rapist Hayakawa A Man Leading Up Depends On Mesuiki Mizuki,https://pic.javct.net/poster/05192026/9db2666362.jpg,https://javct.net/v/mopg-001,125,2026-06-08
MOPC-002,Lesbian Couple Of Gold Kick M Wrestling Strap-on Dildo W R**e Ogawa Merle / Ichinose Airi,https://pic.javct.net/poster/05192026/247a77ab02.jpg,https://javct.net/v/mopc-002,144,2026-06-08
