code,title,image_url,page_url,views,date_scraped
JUAN-017-RM,De M Beautiful Married Woman Rin Amamiya Who Lifts The Ban On Two Penetration Anal For The Perverted Parent And C**ld Next Door [Uncensored L**ked],https://pic.javct.net/poster/20230206/1686972908.jpg,https://javct.net/v/juan-017-rm,121,2026-06-10
QRDA-213-RM,Anal Fist Man Penis Band Sex Slave ● Hakuho Renka [Uncensored L**ked],https://pic.javct.net/poster/05192026/0cb2c02ace.jpg,https://javct.net/v/qrda-213-rm,138,2026-06-10
MOPG-008,Simultaneous Climax ~ Rina Takakura In Masochist Human Anatomy - Anal & Penis Simultaneous Man Prisoners,https://pic.javct.net/poster/05192026/3ca5dd7517.jpg,https://javct.net/v/mopg-008,104,2026-06-10
MOPA-023,"Men And Women Reverse SEX Hirose Of ""I Woman"" Nanami",https://pic.javct.net/poster/05192026/fd9ac4b805.jpg,https://javct.net/v/mopa-023,117,2026-06-10
MIGD-634,Anal FUCK Cum Bukkake! Konishi Yu,https://pic.javct.net/poster/05192026/c19c04c1d1.jpg,https://javct.net/v/migd-634,120,2026-06-10
SRS-056-RM,Amateur Hunter 241 [Uncensored L**ked],https://pic.javct.net/poster/20241703/1711963022.jpg,https://javct.net/v/srs-056-rm,120,2026-06-10
SVSHA-001-RM,Shame! Strong Before The Arrival Of The New Nurse In The Ward Medical Examination We Were Made To Be Experimental Subjects For Medical Intern 2022 Winter [Uncensored L**ked],https://pic.javct.net/poster/05192026/922d6314c5.jpg,https://javct.net/v/svsha-001-rm,218,2026-06-10
FC2PPV-4917039,"[Complete Amateur Creampie] A slender and very beautiful office lady likes to have her pussy licked, her big dick licked, and then ejaculated inside.Two raw creampies.",https://pic.javct.net/poster/05192026/631330dbd1.jpg,https://javct.net/v/fc2ppv-4917039,44,2026-06-10
MGMQ-022,He Sees [Hinomi Naruzawa] So That M Man Seems To Be A Meat Toilet.,https://pic.javct.net/poster/05192026/d9866ef372.jpg,https://javct.net/v/mgmq-022,109,2026-06-10
MOPE-015,Onasapo Subjective Lewd Woman Handjob Crime & Anal Fist,https://pic.javct.net/poster/05192026/f6aba67e15.jpg,https://javct.net/v/mope-015,159,2026-06-10
MOPE-017,Hamasaki Mao ~ Woman For M ~ 4 Hours BEST,https://pic.javct.net/poster/05192026/a08b80cafe.jpg,https://javct.net/v/mope-017,247,2026-06-10
MOPA-019,HatsuMisa Reverse Anal R**e Of A Rare 'cute Face To Huge Strap-on Dildo In M ​​man Prisoners',https://pic.javct.net/poster/05192026/c0ab494f85.jpg,https://javct.net/v/mopa-019,137,2026-06-10
MOPG-003,Masochist Rolled Anal & Penis Simultaneous Man Prisoners Naho Hazuki,https://pic.javct.net/poster/05192026/e857e21fdd.jpg,https://javct.net/v/mopg-003,116,2026-06-10
MOPG-007,Squid Have Been Men - Kururuki Oranges Until Committed To Tried - My Head Is Funny,https://pic.javct.net/poster/05192026/0426bcf051.jpg,https://javct.net/v/mopg-007,122,2026-06-10
MOPE-020,Penivan Male Crime 10 Erotic Waist Use,https://pic.javct.net/poster/05192026/78bcead9ce.jpg,https://javct.net/v/mope-020,158,2026-06-10
AVSA-440-RM,Crossdressing Girl Debut: Super S-Class Stunning Crossdresser Rio [Uncensored L**ked],https://pic.javct.net/poster/05192026/45f7ea4501.jpg,https://javct.net/v/avsa-440-rm,112,2026-06-10
TIMD-033,Boys ♂ X ♂ Lesbian Let's Have Sex Like BL! Kino X Nico,https://pic.javct.net/poster/05192026/3c1f69d546.jpg,https://javct.net/v/timd-033,149,2026-06-10
REAL-643,Extreme Anal Hell Cum Inside Out,https://pic.javct.net/poster/05192026/8ef0cfc8a8.jpg,https://javct.net/v/real-643,140,2026-06-10
MOPG-006,How To Make The M Room - Livestock - Wakatsuki Mizuna,https://pic.javct.net/poster/05192026/cf234fa5a1.jpg,https://javct.net/v/mopg-006,117,2026-06-10
MOPE-019,Hanyu Arisa ~ Woman For M ~ 4 Hours BEST,https://pic.javct.net/poster/05192026/b83b00008c.jpg,https://javct.net/v/mope-019,257,2026-06-10
CKW-001-RM,"It Was Always Decided That I Would Be Called During My Lunch Break. But... Ejaculation Is 9 Hours Later. Moreover, It Is Blamed Immediately After That. And In The End, The Rapid-fire Sex Sato's? [Uncensored L**ked]",https://pic.javct.net/poster/20230206/1687495969.jpg,https://javct.net/v/ckw-001-rm,130,2026-06-10
SVSHA-003-RM,Shame New Student Development Health Checkup 2022 [Uncensored L**ked],https://pic.javct.net/poster/20222612/1673494385.jpg,https://javct.net/v/svsha-003-rm,275,2026-06-10
SDDE-356-RM,Department Issued Two True In Sexual Desire Processing Specialty Outpatient Clinic Gangbang Sex [Uncensored L**ked],https://pic.javct.net/poster/20242108/1724790062.jpg,https://javct.net/v/sdde-356-rm,165,2026-06-10
AARM-002-RM,JOI!! Masturbation Instructions From Sexy Girls Talking Dirty [Uncensored L**ked],https://static.javct.net/poster/aarm-002.jpg,https://javct.net/v/aarm-002-rm,241,2026-06-10
