code,title,image_url,page_url,views,date_scraped
EBOD-459-RM,Bus Tour With A Bare-Naked Busty Guide Ami Tokunaga [Uncensored L**ked],https://pic.javct.net/poster/20221904/1651711385.jpg,https://javct.net/v/ebod-459-rm,119,2026-06-09
XV-439-RM,New Comer! Saya Love [Uncensored L**ked],https://pic.javct.net/poster/05192026/b92de83527.jpg,https://javct.net/v/xv-439-rm,59,2026-06-09
ONEZ-125-RM,Generalized Sensory Zone Anti-inflammation Premature Ejaculation L**kage Daughter Deviation AV Debut Teaching Practice Student Aina (21) [Uncensored L**ked],https://pic.javct.net/poster/05192026/14e937f407.jpg,https://javct.net/v/onez-125-rm,120,2026-06-09
T38-064-RM,"Big-breasted Schoolgirls On Their Way To School, Sakura Yuno And Yui Hina, Have Completely Fallen Prey To A Group Of Perverts. [Uncensored L**ked]",https://pic.javct.net/poster/05192026/ef18d4c22b.jpg,https://javct.net/v/t38-064-rm,120,2026-06-09
DFE-071-RM,I Have My Daughter Feed Me. Ran Himeno [Uncensored L**ked],https://pic.javct.net/poster/20230804/1692933552.jpg,https://javct.net/v/dfe-071-rm,137,2026-06-09
SCOP-912-RM,"Picked Up A Stingy, Cold-hearted Sugar Baby Girl At To○ Yokosuka And Snapped, Forcibly Restraining Her! Despite Being The One Receiving The Money, This Arrogant Little Slut Was Brought To Orgasm With Toys!! I Shoved My Stinky Old Man Cock Into Her Unprotected, Fertile Uterus And Injected A Massive Amount Of My Cum!! [Uncensored L**ked]",https://pic.javct.net/poster/05192026/a58f4c8086.jpg,https://javct.net/v/scop-912-rm,125,2026-06-09
MIDD-892-RM,18-year-old rookie nova girl! !Oshima Rina debut ♪ active female college student of a number of human experience [Uncensored L**ked],https://pic.javct.net/poster/06032026/1774751794.jpg,https://javct.net/v/midd-892-rm,180,2026-06-09
PKPD-113-RM,Enjo Dating Creampie OK 18 Years Old Cooled M Beautiful Girl Creampie Daughter Tamaki Nico [Uncensored L**ked],https://pic.javct.net/poster/04112026/1775889578.jpg,https://javct.net/v/pkpd-113-rm,140,2026-06-09
ONEX-002-RM,A Serious And Inconspicuous Woman Is A Sober Bitch Girl Who Can't Stop Her Vulgar Delusions ~ 02 [Uncensored L**ked],https://pic.javct.net/poster/20230206/1688028155.jpg,https://javct.net/v/onex-002-rm,120,2026-06-09
AKDL-271-RM,[L**ked Video] Girl Having Sex With A Classmate Right After Graduation Prefectural 〇〇 Academy Class D General Course Hikaru Spring 2024 [Uncensored L**ked],https://pic.javct.net/poster/20241902/1709769797.jpg,https://javct.net/v/akdl-271-rm,117,2026-06-09
ABW-110-RM,"With a beautiful girl, a private hot spring, and dense sexual intercourse. 14 Charter an absolute beautiful girl for one night and go to a hot spring inn in the mountains Mai Nanami [Uncensored L**ked]",https://static.javct.net/poster/abw-110.jpg,https://javct.net/v/abw-110-rm,145,2026-06-09
BGN-006-RM,Rookie Prestige Exclusive Debut [Uncensored L**ked],https://pic.javct.net/poster/20230104/1682688956.jpg,https://javct.net/v/bgn-006-rm,180,2026-06-09
SQTE-483-RM,The Beautiful Girl With Double Teeth I Saw In The City Was A Wonderful Girl With Beautiful Breasts And Cowgirl Position. Himari Ozuki [Uncensored L**ked],https://pic.javct.net/poster/20230206/1688190978.jpg,https://javct.net/v/sqte-483-rm,96,2026-06-09
STARS-048-RM,101 Shooting Bucksmanship Amateur Male Super Super Crown Genuine Semen Takeda Yume [Uncensored L**ked],https://pic.javct.net/poster/20243105/1719525185.jpg,https://javct.net/v/stars-048-rm,135,2026-06-09
PKPD-420-RM,"A Romantic Documentary About Lovers: A Day Of Intimate Dating With Ruka Itoi, A Real-life Anime Heroine With Short Black Hair. [Uncensored L**ked]",https://pic.javct.net/poster/05192026/a00a33cb34.jpg,https://javct.net/v/pkpd-420-rm,120,2026-06-09
APGH-056-RM,"That Girl Who Used To Be A Top Student, ""I've Grown Up A Bit,"" Offers Anal Licking Service With A Melting Gaze, And Engages In Intimate Sex Seeking Warmth. Akana Ito [Uncensored L**ked]",https://pic.javct.net/poster/05192026/689f5fac1b.jpg,https://javct.net/v/apgh-056-rm,130,2026-06-09
FC2PPV-4917550,"[No]**, I was surprised that the daycare worker's behind-the-scenes face fetish video was allowed to go live [Download available in review]",https://pic.javct.net/poster/05192026/37f6beb934.jpg,https://javct.net/v/fc2ppv-4917550,45,2026-06-09
PKPL-066,Lovey-Dovey Documentary: A Day Of Intimate Date With The Perfect Big-Breasted Beauty And Innocent Azuki Amatsuki,https://pic.javct.net/poster/05192026/b790c8aef7.jpg,https://javct.net/v/pkpl-066,120,2026-06-09
PKPD-420,"A Romantic Documentary About Lovers: A Day Of Intimate Dating With Ruka Itoi, A Real-life Anime Heroine With Short Black Hair.",https://pic.javct.net/poster/05192026/a00a33cb34.jpg,https://javct.net/v/pkpd-420,120,2026-06-09
420HOI-397,"Magumi (23) Amateur Hoi Hoi Z, Amateur, Documentary, Gonzo, Beautiful Girl, Innocent, Slender, Masturbation, Electric Massager, Squirting, Facial",https://pic.javct.net/poster/05192026/d9cd16dfa9.jpg,https://javct.net/v/420hoi-397,91,2026-06-09
TYOD-375-RM,Arai Ara Lesbian Disinhibition Beloquist Tightly Fitting With Man Juice Aoi Leana Arai Ai [Uncensored L**ked],https://pic.javct.net/poster/20242012/1734742462.jpg,https://javct.net/v/tyod-375-rm,150,2026-06-09
XVSR-303,MAX-A Exclusive Actress's Ultra-luxury Schedule Spring Massage Esthetics,https://pic.javct.net/poster/05192026/cd8392b2e1.jpg,https://javct.net/v/xvsr-303,240,2026-06-09
T28-516,Girls In Public Toilets,https://pic.javct.net/poster/05192026/8b5d7077ef.jpg,https://javct.net/v/t28-516,120,2026-06-09
APGH-056,"That Girl Who Used To Be A Top Student, ""I've Grown Up A Bit,"" Offers Anal Licking Service With A Melting Gaze, And Engages In Intimate Sex Seeking Warmth. Akana Ito",https://pic.javct.net/poster/05192026/689f5fac1b.jpg,https://javct.net/v/apgh-056,130,2026-06-09
