code,title,image_url,page_url,views,date_scraped
FC2PPV-4919908-RM,"I've never had a boyfriend before, **pyjpx*jsps 1 person, only once, ◯ 8 years old, innocent, pure, serious, 547th person to shoot individually [Uncensored L**ked]",https://pic.javct.net/poster/05192026/ca6ea452b3.jpg,https://javct.net/v/fc2ppv-4919908-rm,215,2026-06-20
MILK-130-RM,Sick Kawaii Idol Yui Who Was Made To Pee And Got Buzzed Individual Photography X Diuretics X Fucked And Controlled Pillow Fight X Off-package Sex X Massive Squirting X Incontinence Orgy Yui Hazuki [Uncensored L**ked],https://pic.javct.net/poster/20212011/1641445361.jpg,https://javct.net/v/milk-130-rm,116,2026-06-20
XVSR-248-RM,Cinderella Girl Hatsumi Hatsumi [Uncensored L**ked],https://pic.javct.net/poster/04112026/1776839020.jpg,https://javct.net/v/xvsr-248-rm,130,2026-06-20
ONEZ-139-RM,C**ld Making From The Beginning To The End By A Couple I Want A C**ld Video FILE.001 Department Store Clerk Marriage 1 Year Miho (24 Years Old) [Uncensored L**ked],https://pic.javct.net/poster/05192026/b6fdf6a5bb.jpg,https://javct.net/v/onez-139-rm,120,2026-06-20
FC2PPV-4919821-RM,"[Limited release] Musume in a box that has been pre-approved by the post office ♡ The elegant atmosphere completely collapses in front of the cock, and the pleasure recording video that finally starts shaking her hips [High-quality bonus included] [Uncensored L**ked]",https://pic.javct.net/poster/05192026/f13c0a4c3e.jpg,https://javct.net/v/fc2ppv-4919821-rm,39,2026-06-20
SNOS-268-RM,"My Classmate, Who's Head Over Heels For Me And Has Incredible Sexual Stamina, Hides In My House And Sneaks Out Whenever She Gets The Chance To Force Herself On Me Again And Again. (Nagisa Airi) [Uncensored L**ked]",https://pic.javct.net/poster/05192026/b0ccca8e09.jpg,https://javct.net/v/snos-268-rm,120,2026-06-20
SNOS-214-RM,"A Naive, Easily Deceived Girl Is Taken To A Perverted Old Man's Home, Where She Is Subjected To Insidious Training, Having Her Bodily Fluids Sucked And Being Licked And R**ed. [Uncensored L**ked]",https://pic.javct.net/poster/05192026/5cfa21aa56.jpg,https://javct.net/v/snos-214-rm,150,2026-06-20
DSOD-015-RM,"Gave My Slender, Busty Stepdaughter, Who Hates Men, An Aphrodisiac For A Week. Her Womb Ached, And She Lost Her Reason, And Despite Her Reluctance, She Began To Crave My Huge Cock. - Ruka Itoi [Uncensored L**ked]",https://pic.javct.net/poster/05192026/0045ee21da.jpg,https://javct.net/v/dsod-015-rm,120,2026-06-20
FC2PPV-4921957,[No] First facial cumshot in my life A cute and fluffy beauty whose areolas are a little bigger and darker in color is erotic ⤴ A lot of it is applied and it's sticky ⤴ *Bonus High quality,https://pic.javct.net/poster/05192026/4702803f2d.jpg,https://javct.net/v/fc2ppv-4921957,53,2026-06-20
FC2PPV-4923256,"[Powerful POV Men-S 11] The best H-cup S-class beauty from a healthy store without nudes gives a close-up oil massage, the best titty fuck, and a teasing blowjob that blows away all reason!!",https://pic.javct.net/poster/05192026/70d61c6e32.jpg,https://javct.net/v/fc2ppv-4923256,19,2026-06-20
DSOD-024-RM,"A Woman Was **dnapped By A Delivery Driver For An Escort Service. A Greasy, Aging Old Man Ejaculated Not Just Once, But Multiple Times, His Thick Cum Squirting Deep Into Her Uterus, Causing Her To Climax From The Licking. Akari Neo [Uncensored L**ked]",https://pic.javct.net/poster/05192026/df034c1715.jpg,https://javct.net/v/dsod-024-rm,140,2026-06-20
AMBI-213,"My Niece, Who Ran Away From Home, Has An Abnormal Masochistic Desire. ""Please Punish Me,"" She Begs, As This Masochistic Girl Is Completely Trained. - Minami Hinano",https://pic.javct.net/poster/05192026/d7e65a8fec.jpg,https://javct.net/v/ambi-213,117,2026-06-20
SNOS-266-RM,"Is It Okay To Keep The Extremely Sensitive, Delicate Girl 'Hatsumi Nanoka' Cumming For 12 Hours Straight? [Uncensored L**ked]",https://pic.javct.net/poster/05192026/344e8f54d2.jpg,https://javct.net/v/snos-266-rm,120,2026-06-20
APKH-196,"Please Film Me Having Sex... ""If You Lick My Balls, Lots Of Sperm Will Come Out!"" Lewd Service Sex From A Naturally Perverted Reiwa Girl, Voluptuous Angel Hanamori Natsuho",https://pic.javct.net/poster/05192026/f1f5a40bcb.jpg,https://javct.net/v/apkh-196,154,2026-06-20
SNOS-341-RM,How About Using My Daughter's Body As A Substitute... I Got Involved With Loan Sharks And Repaid My Debts With My Cute Daughter. - Sakakibara Moe [Uncensored L**ked],https://pic.javct.net/poster/05192026/56a30882c1.jpg,https://javct.net/v/snos-341-rm,120,2026-06-20
WANZ-202-RM,Aoi Koharu Out A Large Amount Of Semen Blow To Niagara Girl [Uncensored L**ked],https://pic.javct.net/poster/05192026/d5a54669d9.jpg,https://javct.net/v/wanz-202-rm,120,2026-06-20
SNOS-210-RM,"An Idol's First Experience, It's The Best! The Legendary Hakata Idol Candidate 'Shiraishi Touha''s First Time In 3 Real Sex Scenes, A Special Full Of Firsts That Will Make You Cum Like Crazy. [Uncensored L**ked]",https://pic.javct.net/poster/05192026/4d6c41611e.jpg,https://javct.net/v/snos-210-rm,140,2026-06-20
GMEM-152,ULTRA SWEET Akagai Beautiful Girl Warrior Super Dangerous Pleasure Awakening Incontinence Orgasm Hell ~ Akagai Infinite Climax Tears in the Crack That Can't Stop ~ Sara Isshiki,https://pic.javct.net/poster/05192026/5ebf251339.jpg,https://javct.net/v/gmem-152,129,2026-06-20
MKMP-732,"My Father, A Sex Offender, Was Released From Prison And Came Home. It Was Our First Reunion In Over Ten Years. However, My Father Was Uneasy About My Overly Boyish Appearance, So He Continued To Imprint The Pleasures Of Womanhood Onto My Body. Satsuki Ena",https://pic.javct.net/poster/05192026/349346f3e6.jpg,https://javct.net/v/mkmp-732,120,2026-06-20
REAL-994,"Street Singer R**ed. I, Who Sing Of Love With Dreams In My Heart, Was Deceived, Imprisoned, And Corrupted With An Aphrodisiac... I Continue To Scream In A High-pitched Voice Today As Well. Kurumi Sakura",https://pic.javct.net/poster/05192026/ab365f94f3.jpg,https://javct.net/v/real-994,125,2026-06-20
SOE-957-SUB,"Aika Yumeno , Cum! [English Subtitle]",https://pic.javct.net/poster/20221108/1662023684.jpg,https://javct.net/v/soe-957-sub,148,2026-06-20
FC2PPV-4923259,"[No] [Female Body Sharing Party Chapter 20] A 20-year-old H-cup fair-skinned beautiful butt former leader of the rhythmic gymnastics club who shows off her sk**lful techniques at the sharing meeting, and the threat of creampie and titty fuck ejaculation against her great-uncle and a black man.[Overseas version] Bonus included",https://pic.javct.net/poster/05192026/a1b4875a52.jpg,https://javct.net/v/fc2ppv-4923259,51,2026-06-20
SNOS-253-RM,"Creepy, Huge Old Man Dotes On A Young Body From Head To Toe, And A Greasy, Wild Orgy Ensues With Honoka Watanabe. [Uncensored L**ked]",https://pic.javct.net/poster/05192026/5c1c7b3048.jpg,https://javct.net/v/snos-253-rm,150,2026-06-20
SNOS-231-RM,"A Diamond-like Beauty Gets Her Saliva, Sweat, Love Juice, And Pussy Juice All Licked Up In A Wild Orgy With 10 Old Men. [Uncensored L**ked]",https://pic.javct.net/poster/05192026/bce07722a4.jpg,https://javct.net/v/snos-231-rm,150,2026-06-20
