code,title,image_url,page_url,views,date_scraped
FNEO-070-RM,Make A Baby! A Transparent White-skinned Hidden Big-breasted Beautiful Girl Invites An Uncle To C**ld-making SEX With A Youthful Smile. Riko Hashimoto [Uncensored L**ked],https://pic.javct.net/poster/20230104/1681270638.jpg,https://javct.net/v/fneo-070-rm,139,2026-06-24
GMEM-095-RM,ULTRA SWEET Akagai Bishoujo Soldier Strong Horny Climax Training-Pleasant Pleasure Panic Innocent Flesh-Anka Suzune [Uncensored L**ked],https://pic.javct.net/poster/20230205/1684556462.jpg,https://javct.net/v/gmem-095-rm,125,2026-06-24
HODV-21619-RM,A Tecaher I can't Stand Holds A Secret Against Me... Riho Takahashi [Uncensored L**ked],https://pic.javct.net/poster/20212709/1636112589.jpg,https://javct.net/v/hodv-21619-rm,120,2026-06-24
ONSG-063-RM,Busty Deriheru Misuzu Mifune [Uncensored L**ked],https://pic.javct.net/poster/20230104/1682138896.jpg,https://javct.net/v/onsg-063-rm,130,2026-06-24
ONET-015-RM,Brother And The Last Out In Staying Travel Riona Minami [Uncensored L**ked],https://pic.javct.net/poster/05192026/b95e7e9b02.jpg,https://javct.net/v/onet-015-rm,125,2026-06-24
ONET-014-RM,Brainwashing Puppet And Uniforms Bambina.Miyuki Sakura [Uncensored L**ked],https://pic.javct.net/poster/05192026/1c6adae884.jpg,https://javct.net/v/onet-014-rm,125,2026-06-24
VGD-193-RM,My Neighbor 's Wife China Mei Mei [Uncensored L**ked],https://pic.javct.net/poster/04112026/1776222627.jpg,https://javct.net/v/vgd-193-rm,100,2026-06-24
SABA-821-RM,Exposure Video Membership Refre Where Celebrities Go Incognito 01 [Uncensored L**ked],https://pic.javct.net/poster/20230104/1680928061.jpg,https://javct.net/v/saba-821-rm,120,2026-06-24
BAGR-085-RM,"""I'll Keep Watching Your Expression Of Endurance Forever."" A Devilish Girl's Gaze-in-the-eyes Ejaculation Control Video - Seira Kuwahara [Uncensored L**ked]",https://pic.javct.net/poster/05192026/7bf03c31e5.jpg,https://javct.net/v/bagr-085-rm,130,2026-06-24
BAGR-088-RM,"Otoha Misuzu, A Promiscuous Young Girl Who Overcame Forbidden Love And Learned About Adult Love. [Uncensored L**ked]",https://pic.javct.net/poster/05192026/763de9659f.jpg,https://javct.net/v/bagr-088-rm,126,2026-06-24
INCT-024,Male Sex Toy Black Hair Beautiful Girl Is Onappeto Ao 18 Years Old Eikawa Ooa,https://pic.javct.net/poster/05192026/83584b52b4.jpg,https://javct.net/v/inct-024,122,2026-06-24
HOMA-037,"My Sister, A Cheeky Guy, Gloomy And Enticing While She Smiles, I Can Not Take It Anymore! Eikawa Ooa",https://pic.javct.net/poster/05192026/a77640fa28.jpg,https://javct.net/v/homa-037,128,2026-06-24
ABP-883-RM,Mion Sonoda's Finest Brush Wholesale 2nd 27 Miraculous Sex Recording That Draws Down The Fan's Virginity Himself [Uncensored L**ked],https://pic.javct.net/poster/20221202/1649954440.jpg,https://javct.net/v/abp-883-rm,220,2026-06-24
JKSR-485-RM,"(L**ked Video) Schoolgirls - Sports Training Camp Sex 2 - Sex, Night Visits, Ravished In A Three-Some, Baths, Peeping On Change Rooms... Totally Naughty Footage [Uncensored L**ked]",https://static.javct.net/poster/jksr-485.jpg,https://javct.net/v/jksr-485-rm,144,2026-06-24
JKSR-478-RM,"[L**ked Video] Girls ○ Raw Club Activities Training Camp Sex Japanese R**e, Night ● I, Attacked 3P, Bath, Change Of Clothes Voyeur ... Many Other Obscene Videos Full Video 133 Minutes [Uncensored L**ked]",https://pic.javct.net/poster/05192026/a05fe20b9a.jpg,https://javct.net/v/jksr-478-rm,133,2026-06-24
STARS-296-RM,I Want To Be A Slut By A Pure White Rotor Ichika Nagano [Uncensored L**ked],https://pic.javct.net/poster/20241902/1708907436.jpg,https://javct.net/v/stars-296-rm,120,2026-06-24
STARS-244-RM,Overnight At M Man House  He Plays With A Chi-po As A Slut Nico Nico Esukare  And The Idol's Faint Bullying Nuqui & Exquisite Piss SEX 24 O'clock Ichika Nagano [Uncensored L**ked],https://pic.javct.net/poster/20222311/1671612464.jpg,https://javct.net/v/stars-244-rm,135,2026-06-24
STARS-287-RM,Aphrodisiac X Delicate Body X Intense Piston The Squid Is So Crazy That The Head Gets Crazy And L**ks! Kimeseku Big Cum! !! Ichika Nagano [Uncensored L**ked],https://pic.javct.net/poster/20233001/1675871728.jpg,https://javct.net/v/stars-287-rm,125,2026-06-24
300MIUM-1383-RM,"[Beautiful girl beyond Karabo] Rent the idol-class beautiful girl Mer-chan as his girlfriend, and completely record the whole story of him doing erotic acts that are originally prohibited. When he takes off his clothes, he has a real raw sex with the idol-class beautiful girl whose beautiful G breasts and plump butt arouse the sense of immorality, and the end is a lot of creampie finish [Rental girlfriend] [Uncensored L**ked]",https://pic.javct.net/poster/05192026/1246252437.jpg,https://javct.net/v/300mium-1383-rm,106,2026-06-24
KTRA-568-RM,4 Hours Of Exciting Brother-sister Incest With My Sisters In Uniform [Uncensored L**ked],https://pic.javct.net/poster/20230908/1695461126.jpg,https://javct.net/v/ktra-568-rm,241,2026-06-24
IENF-449-RM,Amateur Female College Student Lured By High Pay To Become A Nude Drawing Model! Her Pussy Gets Soaking Wet From The Humiliation Of Being Visually Violated As Even The Labia Of Her Vagina Are Meticulously Drawn! She Cums Like Crazy As She's Penetrated Raw! 11 [Uncensored L**ked],https://pic.javct.net/poster/05192026/cb4441b40b.jpg,https://javct.net/v/ienf-449-rm,157,2026-06-24
FC2PPV-4922818,"*Ends immediately as this is a real idol* Creampie to the youngest member of the 7-member group, an SS class 18 year old with a body fat percentage of 8.6% *13.5GB highest quality original version distributed on a first-come, first-served basis",https://pic.javct.net/poster/05192026/e24806b05b.jpg,https://javct.net/v/fc2ppv-4922818,60,2026-06-24
TYAN-007-RM,Big Ass Beautiful Girl Hunting Emika Shiratori [Uncensored L**ked],https://pic.javct.net/poster/20230205/1684471591.jpg,https://javct.net/v/tyan-007-rm,120,2026-06-24
SDAB-156-RM,Compliant Uniform Beautiful Girl Absolute Obedience Raw Saddle Creampie Sexual Intercourse Marina Saito [Uncensored L**ked],https://pic.javct.net/poster/05192026/b4706e3e87.jpg,https://javct.net/v/sdab-156-rm,135,2026-06-24
