code,title,image_url,page_url,views,date_scraped
MILK-171-RM,Voyeurism Perverted House Invasion Crimson R**e Neat And Clean J Turned Into A Sex Slave Iki Crazy Absolute Obedience Sex Miku Misora Miku [Uncensored L**ked],https://pic.javct.net/poster/20230205/1683173764.jpg,https://javct.net/v/milk-171-rm,120,2026-06-27
SDAB-159-RM,"The First And Best Violation Of School Rules ""First Vaginal Cum Shot At School"" The Most Naive And Naughty Girl Of The Year! Chika Sato [Uncensored L**ked]",https://pic.javct.net/poster/20240807/1722227239.jpg,https://javct.net/v/sdab-159-rm,135,2026-06-27
FC2PPV-4927418,"The most perverted woman in Japan is this one. ""I want you to break it harder and harder. This perverted gal is waiting with all her might in a pose that you should use.''",https://pic.javct.net/poster/05192026/6edb87fd3f.jpg,https://javct.net/v/fc2ppv-4927418,52,2026-06-27
PKPL-064-RM,"Amateur Sex Friend Document: Mina, A Cool But Secretly Submissive Girl Who Loves Raw Sex [Uncensored L**ked]",https://pic.javct.net/poster/05192026/d50a5ac80b.jpg,https://javct.net/v/pkpl-064-rm,120,2026-06-27
STARS-057-RM,Mahiro Yui 777 Hours Piston Until The Man Juice Overflowing By Abstinence & Temper Becomes Meringue [Uncensored L**ked],https://pic.javct.net/poster/20243105/1719741858.jpg,https://javct.net/v/stars-057-rm,135,2026-06-27
FC2PPV-4926023,"[No] Beautiful F-cup big breasts with pure white smooth skin.She is tall and has long limbs, and she has an outstanding style⤴ Swallowing Creampie *Bonus High resolution",https://pic.javct.net/poster/05192026/3a3cdbb1be.jpg,https://javct.net/v/fc2ppv-4926023,52,2026-06-27
OFES-057-RM,"""There Are No More Trains And I'm Soaked From The Heavy Rain, Can I Come Over To Your Place Now?"" I Ended Up Sharing A Room With The Famous Slutty Big-breasted Duo From My Class... My Virgin Cock, Which Got Instantly Hard At The Sight Of Their Wet, See-through Boobs, Was Used As Their Sex Toy All Night Long. Chiba Yuka, Shishido Riho [Uncensored L**ked]",https://pic.javct.net/poster/05192026/a272d399d6.jpg,https://javct.net/v/ofes-057-rm,120,2026-06-27
STAR-645-RM,"Kasumi Much Entangled Soggy Kiss, Once You Do Not Stop And Will Come With Fire Estrus Dense Sex [Uncensored L**ked]",https://pic.javct.net/poster/05192026/d973030329.jpg,https://javct.net/v/star-645-rm,115,2026-06-27
TNOZ-047,"This Girl Is Insane! She's An Incredibly Cute Cosplayer, But She's Also A Sex-crazed Monster On A Whole Other Level. Deep Kissing, Saliva Exchange, And Self-throating, She Cums Uncontrollably And Empties The Balls Of The Virile, Big-dick Cameramen In A 7-person Orgy.",https://pic.javct.net/poster/05192026/a9037ec959.jpg,https://javct.net/v/tnoz-047,194,2026-06-27
DSJH-017-RM,Relentless Orgasm Training With Continuous Squirting Until All Bodily Fluids Are Drained - Another Kind Of Youth Experienced By Schoolgirl Beauties - [Uncensored L**ked],https://pic.javct.net/poster/05192026/1fb788ef32.jpg,https://javct.net/v/dsjh-017-rm,119,2026-06-27
KNMB-125,"[For Actresses Who Love Live Performances Only] Live, Live",https://pic.javct.net/poster/05192026/71dd684f1d.jpg,https://javct.net/v/knmb-125,120,2026-06-27
HNDS-060-RM,Retirement × Cum Inside It Will Be Youthful At The End Everyone Special! ! ! [Uncensored L**ked],https://pic.javct.net/poster/20241804/1714539889.jpg,https://javct.net/v/hnds-060-rm,150,2026-06-27
FAYS-013,Amateur Entry: Apparel Store Clerk Begs For Anal Sex - Debut,https://pic.javct.net/poster/05192026/1479db1666.jpg,https://javct.net/v/fays-013,90,2026-06-27
NMCH-016,"Not A Sex Friend, Not A Girlfriend. A Secretly Perverted, Big-assed Beauty With A Full-on L**i Body Having A Blast Filming Our Sex! Rion-chan, Izumi Rion",https://pic.javct.net/poster/05192026/f79840f03d.jpg,https://javct.net/v/nmch-016,90,2026-06-27
JKSR-586-RM,[L**ked Video] Girls ○ Raw Club Activity Training Camp Sex 12 Track And Field Club's Sexually Processed Meat Urinal [Uncensored L**ked],https://pic.javct.net/poster/20230104/1682137598.jpg,https://javct.net/v/jksr-586-rm,181,2026-06-27
CHUC-178,"This Beautiful, Innocent-looking Woman With Gorgeous Breasts Is Actually A Slut. Eri (23)",https://pic.javct.net/poster/05192026/f105726caa.jpg,https://javct.net/v/chuc-178,60,2026-06-27
JKSR-594-RM,[L**ked Video] Girls ○ Raw Club Activity Camp Sex 13 Archery Club's Sexually Processed Meat Urinal [Uncensored L**ked],https://pic.javct.net/poster/20230206/1687579703.jpg,https://javct.net/v/jksr-594-rm,181,2026-06-27
JKSR-554-RM,"[L**ked Video] Women's  Raw Club Activity Camp Sex 10 Archery Club Edition Japanese R**e, Night  I, Attacked 3P, Bath, Change Of Clothes Voyeur ... Many Other Obscene Videos [Uncensored L**ked]",https://pic.javct.net/poster/20221108/1661575972.jpg,https://javct.net/v/jksr-554-rm,147,2026-06-27
AGMX-261,Pull It Out With Your Face!! Close-up Face-to-face Blowjob 3,https://pic.javct.net/poster/05192026/02b4804340.jpg,https://javct.net/v/agmx-261,94,2026-06-27
WTEX-017,Cosplay Support. Otaku-oji Creampie Bukkake Orgy I-cup Slime-breasted Cosplayer Miu Is Tricked Into An Erotically Filmed Raw Creampie Begging Dick-loving Girl! 1000 Consecutive Pistons With No Condom And Squirting Orgasms!,https://pic.javct.net/poster/05192026/e1e21f98fe.jpg,https://javct.net/v/wtex-017,130,2026-06-27
MIDA-111-SUB,"G-spot Development With A Huge Cock, Orgasmic Vagina Chase Piston Squirting Awakening Orgasm, Tono Hanarin [English Subtitle]",https://pic.javct.net/poster/20250903/1743098307.jpg,https://javct.net/v/mida-111-sub,150,2026-06-27
FC2PPV-4923369,[No] Top secret video of a former gravure idol with huge breasts having sex all day long Ana Kawai [High resolution with bonus] [24 hours limited sale],https://pic.javct.net/poster/05192026/974ba18e3d.jpg,https://javct.net/v/fc2ppv-4923369,132,2026-06-27
FC2PPV-4927068,[Raw Dollar / Uncensored] 2 consecutive raw insertions into the beautiful E-cup breasts!! Plenty of thick sperm from the plump BODY's hairy pussy!! Original version!!,https://pic.javct.net/poster/05192026/3781c0b131.jpg,https://javct.net/v/fc2ppv-4927068,44,2026-06-27
FC2PPV-4927279,"0407_002 Hana-chan, 21 years old, decided to make a series until she got pregnant during an AV shoot.She impregnated her desire to make her lewd H cup breasts bigger, and when the old man made it come true, she also made her stomach bigger (explosive)",https://pic.javct.net/poster/05192026/e8903ebfa4.jpg,https://javct.net/v/fc2ppv-4927279,178,2026-06-27
