code,title,image_url,page_url,views,date_scraped
TYAN-007-RM,Big Ass Beautiful Girl Hunting Emika Shiratori [Uncensored L**ked],https://pic.javct.net/poster/20230205/1684471591.jpg,https://javct.net/v/tyan-007-rm,120,2026-06-23
SDAB-156-RM,Compliant Uniform Beautiful Girl Absolute Obedience Raw Saddle Creampie Sexual Intercourse Marina Saito [Uncensored L**ked],https://pic.javct.net/poster/05192026/b4706e3e87.jpg,https://javct.net/v/sdab-156-rm,135,2026-06-23
RGAV-004-RM,"A Deluxe Collection Of 2 SPIV Videos Featuring Hardcore 60-year-old Men Having Sex: [1. A Beautiful Girl With Perfect Proportions Like A TV Announcer] [2. A Serious And Innocent Girl From A Prestigious High School] All Of The Masterful Techniques Revealed [Beauty Collapses → Eyes Rolling Back In Genuine Orgasm, Completely Broken] Shaved Pussy Made To Scream With Pleasure By Cunning Cunnilingus, Then An Old Man's Dick Pounding Away In Shocking Sex Video [Uncensored L**ked]",https://pic.javct.net/poster/05192026/c123949a75.jpg,https://javct.net/v/rgav-004-rm,149,2026-06-23
ONEZ-142-RM,# Live Cream Piece Made Reflex Vol.004 Masahi Sakasaki [Uncensored L**ked],https://pic.javct.net/poster/05192026/b60b494718.jpg,https://javct.net/v/onez-142-rm,125,2026-06-23
300MIUM-1383,"[Beautiful girl beyond Karabo] Rent the idol-class beautiful girl Mer-chan as his girlfriend, and completely record the whole story of him doing erotic acts that are originally prohibited. When he takes off his clothes, he has a real raw sex with the idol-class beautiful girl whose beautiful G breasts and plump butt arouse the sense of immorality, and the end is a lot of creampie finish [Rental girlfriend]",https://pic.javct.net/poster/05192026/1246252437.jpg,https://javct.net/v/300mium-1383,106,2026-06-23
GMEM-152-RM,ULTRA SWEET Akagai Beautiful Girl Warrior Super Dangerous Pleasure Awakening Incontinence Orgasm Hell ~ Akagai Infinite Climax Tears in the Crack That Can't Stop ~ Sara Isshiki [Uncensored L**ked],https://pic.javct.net/poster/05192026/5ebf251339.jpg,https://javct.net/v/gmem-152-rm,129,2026-06-23
T28-547,My Sister And Parents Who Met After A Long Absence With Incest Casual Sexual Intercourse Sexual Intercourse Mai Yaroi,https://pic.javct.net/poster/05192026/ee81b6beaa.jpg,https://javct.net/v/t28-547,130,2026-06-23
FVMD-007-RM,"7 God Blow Sumire Mizukawa Who Sucks With Her Lips, Obscene Tongue [Uncensored L**ked]",https://pic.javct.net/poster/05192026/ad7c4e1c84.jpg,https://javct.net/v/fvmd-007-rm,112,2026-06-23
POMD-003-RM,"[Amateur POV] While staring at each other for a long time, I'm going to have a good time SEX. Indecent Mistress Who Loves Pacifiers Kokona Asakura [Uncensored L**ked]",https://pic.javct.net/poster/05192026/4aaa0b26d4.jpg,https://javct.net/v/pomd-003-rm,112,2026-06-23
AMBI-213-RM,"My Niece, Who Ran Away From Home, Has An Abnormal Masochistic Desire. ""Please Punish Me,"" She Begs, As This Masochistic Girl Is Completely Trained. - Minami Hinano [Uncensored L**ked]",https://pic.javct.net/poster/05192026/d7e65a8fec.jpg,https://javct.net/v/ambi-213-rm,117,2026-06-23
TUE-136-RM,Strong Crime Video Collection In The Darkness [Uncensored L**ked],https://pic.javct.net/poster/20230104/1682911915.jpg,https://javct.net/v/tue-136-rm,120,2026-06-23
SCR-313-RM,A Video Posted By Bringing A Plain And Quiet Neighborhood Girl In A Sailor Uniform To Her Home And Raping It [Uncensored L**ked],https://pic.javct.net/poster/20230104/1682912039.jpg,https://javct.net/v/scr-313-rm,120,2026-06-23
EBOD-471-RM,Golden Ratio Rocket NAOMI Of E-BODY Exclusive Debut Tan [Uncensored L**ked],https://pic.javct.net/poster/04112026/1776913070.jpg,https://javct.net/v/ebod-471-rm,150,2026-06-23
TANF-040-RM,A Cosplayer Who Dreams Of Becoming An Idol Is Tricked Into Becoming A Drug-fueled AV Actress - BadFilm #04 [Uncensored L**ked],https://pic.javct.net/poster/05192026/8aef32debb.jpg,https://javct.net/v/tanf-040-rm,167,2026-06-23
MISM-141-RM,AF Feels Good Enough To Melt The Brain!De M Tsurman Hentai Anal Fuck I Love My Daughter! Rui Uzuki [Uncensored L**ked],https://pic.javct.net/poster/05192026/00477beb0c.jpg,https://javct.net/v/mism-141-rm,180,2026-06-23
HOMA-129-RM,My Uncle Told Me That Playing With Your Nipples Makes Your Breasts Bigger... Sumire Kuramoto [Uncensored L**ked],https://pic.javct.net/poster/20230205/1684556214.jpg,https://javct.net/v/homa-129-rm,136,2026-06-23
ONET-013-RM,Aphrodisiac Pleasure Dependent Transformation Addiction Gangimari Black Gal Girls Out Of School Students Live In Conceived To SEX Eri-chan [Uncensored L**ked],https://pic.javct.net/poster/05192026/96831c26f3.jpg,https://javct.net/v/onet-013-rm,120,2026-06-23
MUDR-107-RM,Three Days Erika Arimura Who Rolled Up In Her Brother's Room Before The Sister Of A Libido Monster Who Goes To A Boarding School From Spring Moves [Uncensored L**ked],https://pic.javct.net/poster/20241703/1712493959.jpg,https://javct.net/v/mudr-107-rm,110,2026-06-23
KV-320-RM,Pacifier Prep School 109: Tsubomi Mochizuki [Uncensored L**ked],https://pic.javct.net/poster/05192026/47cbedb306.jpg,https://javct.net/v/kv-320-rm,138,2026-06-23
FC2PPV-4924460,[Uncensored] Perverted creampie uncle pick-up series 7th volume: Pick up a cute nursery teacher who is too kind and creampie her,https://pic.javct.net/poster/05192026/765833ceee.jpg,https://javct.net/v/fc2ppv-4924460,180,2026-06-23
IENF-449,Amateur Female College Student Lured By High Pay To Become A Nude Drawing Model! Her Pussy Gets Soaking Wet From The Humiliation Of Being Visually Violated As Even The Labia Of Her Vagina Are Meticulously Drawn! She Cums Like Crazy As She's Penetrated Raw! 11,https://pic.javct.net/poster/05192026/cb4441b40b.jpg,https://javct.net/v/ienf-449,157,2026-06-23
FC2PPV-4924434,SEX genius: Intense cowgirl position and bent over position are the best [Part 2],https://pic.javct.net/poster/05192026/665ad951ca.jpg,https://javct.net/v/fc2ppv-4924434,27,2026-06-23
FC2PPV-4923497,"[Yui-chan x Individual Shooting] Started by touching her breasts... After playing with them a little, she started squirting and became too sensitive, so she orgasmed continuously...",https://pic.javct.net/poster/05192026/9fa59774e4.jpg,https://javct.net/v/fc2ppv-4923497,63,2026-06-23
BAGR-088,"Otoha Misuzu, A Promiscuous Young Girl Who Overcame Forbidden Love And Learned About Adult Love.",https://pic.javct.net/poster/05192026/763de9659f.jpg,https://javct.net/v/bagr-088,126,2026-06-23
