code,title,image_url,page_url,views,date_scraped
MIDA-695-RM,"Unleashed: First Ever Unprotected Sex With Ejaculation Inside. Thorough Development Of The Cervix And G-spot In Her Still Immature Uterus And Slender Body, Leading To A Dripping Wet, Sensitive Pussy And An Orgasm With Ejaculation Inside. Kawaguchi Sakura [Uncensored L**ked]",https://pic.javct.net/poster/05192026/8b3529660b.jpg,https://javct.net/v/mida-695-rm,120,2026-07-04
FSKT-014,Immature Mind And Body Girl Relief,https://pic.javct.net/poster/07052026/e1c2aafedb.jpg,https://javct.net/v/fskt-014,132,2026-07-04
T28-558,Niece Exchange 4 - Training niece exchange record by two uncles - Mitsuki Nagisa Hiraka,https://pic.javct.net/poster/07052026/c83dee06aa.jpg,https://javct.net/v/t28-558,190,2026-07-04
PKPD-425,"No-bra, Unprotected Sex On A Hot Spring Trip - Yukine Nagasaki",https://pic.javct.net/poster/05192026/420537be78.jpg,https://javct.net/v/pkpd-425,120,2026-07-04
PKPD-424,I'll Take The Virginity Of A New Actress With Internal Ejaculation. Kikka Momozaki,https://pic.javct.net/poster/05192026/aab840606e.jpg,https://javct.net/v/pkpd-424,120,2026-07-04
BANK-114-RM,W Provocative Beautiful Girl Beautiful Girls Who Tease Men With A Smile [Uncensored L**ked],https://pic.javct.net/poster/20230302/1679642907.jpg,https://javct.net/v/bank-114-rm,165,2026-07-04
DANDY-847-RM,"When I Was Touched By My Nipples While I Was Cleaning Up And I Feeled Twitching, The Nurse Unexpectedly Opened My Nipples To A Slut! Lerorello! ! Chupapapapa! ! ! VOL.2 [Uncensored L**ked]",https://pic.javct.net/poster/20230302/1677979338.jpg,https://javct.net/v/dandy-847-rm,155,2026-07-04
PKPD-147-RM,MSGK Unauthorized Creampie Sex - Mental Minefield Crazy Young Idol Kurumi-chan (18) & Beast-Girl Ami Who Loves Hunting For Cock On Social Media (18) [Uncensored L**ked],https://static.javct.net/poster/pkpd-147.jpg,https://javct.net/v/pkpd-147-rm,139,2026-07-04
FONE-153-RM,"""I Have A Complex Because My Nipples Are Longer Than People And I'm Super Sensitive..."" A Mushy Maiden Who Is Constantly Stimulated With Suspenders While Having Erect Nipples All Year Round Has Applied. [Uncensored L**ked]",https://pic.javct.net/poster/20230302/1678591702.jpg,https://javct.net/v/fone-153-rm,151,2026-07-04
SNKH-026-RM,I Love Decachin! A Pure Bitch Joins A Black Man For The First Time Big Black Dick Addicted To Po Ena Kasuga [Uncensored L**ked],https://pic.javct.net/poster/20230302/1679718768.jpg,https://javct.net/v/snkh-026-rm,120,2026-07-04
CAWB-003-RM,C**ld Manager Makes AV Debut: The Youngest Manager Working At A Diner Wants To Be Pleasured With Her Slender A-cup Breasts. Eri Moriya [Uncensored L**ked],https://pic.javct.net/poster/05192026/3cc6f5d07f.jpg,https://javct.net/v/cawb-003-rm,130,2026-07-04
ONEZ-149-RM,# Live Cream Piece Made Reflex Vol.005 Rui Sushi [Uncensored L**ked],https://pic.javct.net/poster/20241804/1716004538.jpg,https://javct.net/v/onez-149-rm,120,2026-07-04
FAYS-014,My Personal Cosplay Photoshoot: Maron,https://pic.javct.net/poster/05192026/a7d3eb2224.jpg,https://javct.net/v/fays-014,80,2026-07-04
SAME-245-RM,I'm Being R**ed Every Day By My Mother's New Husband. [Uncensored L**ked],https://pic.javct.net/poster/05192026/f97caca4e1.jpg,https://javct.net/v/same-245-rm,120,2026-07-04
EBOD-483-RM,I Wanted To See More Various World ... Baby-faced In Disproportionate And Tits 98cmI Cup Active Female College Students Miyamori Naho 20-year-old AV Debut Tokyo Previous Experience Number Slightly Too One Young For From The Countryside School Admission [Uncensored L**ked],https://pic.javct.net/poster/04112026/af95eea54f.jpg,https://javct.net/v/ebod-483-rm,120,2026-07-04
MIFD-723-RM,"The Girl I Wanted To Have Sex With The Most In My Class During My Student Days. Sensitive, Healthy Beauty, Current College Student, Now Appearing In An Adult Video! Akamaru Ruruna [Uncensored L**ked]",https://pic.javct.net/poster/05192026/32282feb8d.jpg,https://javct.net/v/mifd-723-rm,160,2026-07-04
420ERK-116-RM,Ten-chan [Uncensored L**ked],https://pic.javct.net/poster/05192026/a463282b7d.jpg,https://javct.net/v/420erk-116-rm,69,2026-07-04
ATID-685-RM,I'll Make You Ejaculate While You Kiss Her So You Can Kiss Her Properly. [Uncensored L**ked],https://pic.javct.net/poster/05192026/702b84fca2.jpg,https://javct.net/v/atid-685-rm,150,2026-07-04
FC2PPV-4932450,"A beauty club member who is fluent in languages ​​and has good looks, pushes KAO's pleasure limits from behind and squeezes her pussy from above, ""Poke my breasts L'' and cum on her face with the whites of her eyes",https://pic.javct.net/poster/05192026/54b917e4bb.jpg,https://javct.net/v/fc2ppv-4932450,60,2026-07-04
FC2PPV-4932918,"Athletic beauty with 10 years of experience in the swimming club: ""No, there's someone else...The remote rotor is switched on, and the senior's cock squats on the street, giving her a lot of education and giving her plenty of creampie.''",https://pic.javct.net/poster/05192026/985294ce64.jpg,https://javct.net/v/fc2ppv-4932918,58,2026-07-04
FC2PPV-4930317,[No] It's too erotic that a woman with a very powerful H cup and a plain-looking woman loves erotic things with her huge breasts ⤴ Titty fuck ejaculation makes her cleavage wet... Creampie *Bonus High quality,https://pic.javct.net/poster/07052026/73027bcce9.jpg,https://javct.net/v/fc2ppv-4930317,48,2026-07-04
FC2PPV-4933101,[First shot] A beautiful woman with beautiful breasts and a beautiful butt had intense NTR sex with a big-cocked black man in front of her boyfriend for the first time,https://pic.javct.net/poster/05192026/631bf33a00.jpg,https://javct.net/v/fc2ppv-4933101,48,2026-07-04
FC2PPV-4932818,"[Uncensored / Powerful POV Men-S 14] **pyjpx*jsps The best G-cup micro bikini titty fuck is on the verge of making your brain cum, and the sweet temptation of a neat and clean big-breasted girl from a healthy store is enough to make you completely fall for the secret op-ed raw sex!",https://pic.javct.net/poster/05192026/4ad70e34c5.jpg,https://javct.net/v/fc2ppv-4932818,45,2026-07-04
YUJ-068-RM,"""How About We Date Until You Give Me An Answer To Your Confession?"" On The Day I Confessed To The Girl I'd Liked For So Long, A Female Friend From University Confessed To Me... I Was So Engrossed In Her That I Forgot About The Girl I Liked, And We Had Sex Over And Over Again. [Uncensored L**ked]",https://pic.javct.net/poster/05192026/3942e58fb7.jpg,https://javct.net/v/yuj-068-rm,150,2026-07-04
