code,title,image_url,page_url,views,date_scraped
CHUC-024-RM,SEX Loving H Cup JD And Creampie Sex Yume (22) Yume Aikawa [Uncensored L**ked],https://pic.javct.net/poster/20222612/1672114426.jpg,https://javct.net/v/chuc-024-rm,60,2026-06-24
FMDL-001-RM,"Once I've Got A Cock In My Mouth, I Won't Let It Go Until I Ejaculate Ultimate Penis Love Mitsuki Yuina [Uncensored L**ked]",https://pic.javct.net/poster/05192026/c8964d223c.jpg,https://javct.net/v/fmdl-001-rm,127,2026-06-24
NNNC-021-RM,Genuine Cream Pie My Only Cute Saffle Is A Big Sensitive BODY Raw Fucking Nasty Girl 3 SEX [Uncensored L**ked],https://pic.javct.net/poster/20230104/1681270104.jpg,https://javct.net/v/nnnc-021-rm,116,2026-06-24
DORI-085-RM,"Paco Shooting No.85 ""Nipples... They're Really Hard ◆"" A G-cup, Big-breasted J ● Told Me, ""I Want To Fuck You Raw♪"", And I Cummed In Twice! [Uncensored L**ked]",https://pic.javct.net/poster/20230104/1681269214.jpg,https://javct.net/v/dori-085-rm,73,2026-06-24
DFE-102-RM,Sexual Sensation Explosion Shrimp Arching Acme Salon Morisawa Kana [Uncensored L**ked],https://pic.javct.net/poster/20250606/1751044377.jpg,https://javct.net/v/dfe-102-rm,123,2026-06-24
GVG-815-RM,Busty Love Boyzuka 's Hood Prank Rinne Or What [Uncensored L**ked],https://pic.javct.net/poster/20241902/1709707415.jpg,https://javct.net/v/gvg-815-rm,135,2026-06-24
SAN-190-RM,Slutty Big-breasted Wife Who Is Obsessed With A Dick With A Silicone Ring / Sora Nakagawa [Uncensored L**ked],https://pic.javct.net/poster/20231711/1701105615.jpg,https://javct.net/v/san-190-rm,120,2026-06-24
PKPD-135-RM,Nenne Is A Poor Girl In Glasses With J-Cup Titties Who Lives In An Apartment Complex Nenne Ui [Uncensored L**ked],https://pic.javct.net/poster/20212709/1636393281.jpg,https://javct.net/v/pkpd-135-rm,128,2026-06-24
HODV-21619-RM,A Tecaher I can't Stand Holds A Secret Against Me... Riho Takahashi [Uncensored L**ked],https://pic.javct.net/poster/20212709/1636112589.jpg,https://javct.net/v/hodv-21619-rm,120,2026-06-24
PKPD-134-RM,Completely Private Video Transcendental God Style Sister Midorikawa Miyabito Staying Alone For The First Time Midorikawa Miyabi [Uncensored L**ked],https://pic.javct.net/poster/20230206/1686321010.jpg,https://javct.net/v/pkpd-134-rm,128,2026-06-24
ONSG-063-RM,Busty Deriheru Misuzu Mifune [Uncensored L**ked],https://pic.javct.net/poster/20230104/1682138896.jpg,https://javct.net/v/onsg-063-rm,130,2026-06-24
NACT-123-RM,Oil Mania Hanayagi Anna [Uncensored L**ked],https://pic.javct.net/poster/04112026/bc16f92eb4.jpg,https://javct.net/v/nact-123-rm,121,2026-06-24
VGD-193-RM,My Neighbor 's Wife China Mei Mei [Uncensored L**ked],https://pic.javct.net/poster/04112026/1776222627.jpg,https://javct.net/v/vgd-193-rm,100,2026-06-24
SW-892-RM,"Seduced By A Frustrated Plump Colossal Breasted Wife In A Tight Knit Dress! ? When I Show Off My Colossal Tits That Are About To Spill, I'm Seduced By A Frustrated Muchimuchi Colossal Tits Wife In A Perfect Adhesion Knit Dress! ? When I Was Shown My Colossal Tits That Could Be Spilling Out And They Snuggled Up To Me, My Reason Blows Away... Alice Kisaki / Kozue Nakano [Uncensored L**ked]",https://pic.javct.net/poster/20230205/1683776877.jpg,https://javct.net/v/sw-892-rm,154,2026-06-24
PGD-651-RM,Nana Fucking Healing Together Madoka Full Course Of Active Esthetician 101cm Boobs [Uncensored L**ked],https://pic.javct.net/poster/04112026/a03c9f0b1f.jpg,https://javct.net/v/pgd-651-rm,120,2026-06-24
T28-440-RM,"The Day You Went To The Hot Spring Trip, I Was Unreasonable SEX And The Sister Of Three. [Uncensored L**ked]",https://pic.javct.net/poster/04112026/1776839156.jpg,https://javct.net/v/t28-440-rm,120,2026-06-24
EBOD-472-RM,Competition History In '14!Interscholastic Competition!Supple And Lean Muscle Hcup Body!Active Sprint Player AV Debut! Sasaki Yui [Uncensored L**ked],https://pic.javct.net/poster/04112026/1777001692.jpg,https://javct.net/v/ebod-472-rm,150,2026-06-24
JUY-329-RM,"I Found A Certain Married Woman's Back Stuff When I Saw A Certain SNS! ! ""Every Tuesday"" She Distributes Onna Videos.I Guess It Was A Neighbor's Marriage .... Mizukawa Maple [Uncensored L**ked]",https://pic.javct.net/poster/20250606/1752276401.jpg,https://javct.net/v/juy-329-rm,120,2026-06-24
SGT-059-RM,The Wives Of Setagaya: Yoshino's Chapter 2 By Yoshino Kanzawa [Uncensored L**ked],https://pic.javct.net/poster/05192026/159489b2e0.jpg,https://javct.net/v/sgt-059-rm,122,2026-06-24
OFKU-246-RM,"My Voluptuous, Big-breasted, Big-hipped Stepmother Was A Male Esthetician... Her Body And Libido Are Off The Charts! Super Close Contact With Her Pleasure-inducing, Fleshy Body. Sexy Big Breasts X Big Butt X Big Areolas. Tsukada Shiori [Uncensored L**ked]",https://pic.javct.net/poster/05192026/a6eace0ab0.jpg,https://javct.net/v/ofku-246-rm,120,2026-06-24
BAGR-089-RM,"Two Maids Accompany A Young Lady On Her Wedding Night, Helping Her Practice. [Uncensored L**ked]",https://pic.javct.net/poster/05192026/4b28b57898.jpg,https://javct.net/v/bagr-089-rm,139,2026-06-24
BAGR-088-RM,"Otoha Misuzu, A Promiscuous Young Girl Who Overcame Forbidden Love And Learned About Adult Love. [Uncensored L**ked]",https://pic.javct.net/poster/05192026/763de9659f.jpg,https://javct.net/v/bagr-088-rm,126,2026-06-24
SSNI-984,"A Story About An Eagle, An Elderly Landlord, Spending Three Years And 123 Days Taking Advantage Of The Weaknesses Of A Female College Student Living Next Door Who Had Been Secretly Watching And Completing Physical And Mental Training. Tsubaki Sannomiya",https://pic.javct.net/poster/05192026/658abea1cb.jpg,https://javct.net/v/ssni-984,120,2026-06-24
MIDA-130-SUB,Her Voice Is So Cute! Nipples Are Hard And Her Breasts Are Stimulated With An Oil Massage. Yuno Sakura [English Subtitle],https://pic.javct.net/poster/20250903/1744302995.jpg,https://javct.net/v/mida-130-sub,150,2026-06-24
