code,title,image_url,page_url,views,date_scraped
PKPD-170-RM,Love Documentary For Lover. Pleasant Outdoor Date With Mina Konno-chan Who Is A Beautiful E-Cup College Girl With Amazing Body.,https://pic.javct.net/poster/20212011/1638689829.jpg,https://javct.net/v/pkpd-170-rm,129,2026-07-16
XVSR-295-RM,H Cup Kachida Mao VS G Cup Mihara Honoka Beauty Big Tits Battle Loyal ~ 130 Minutes Non Stop Document ~,https://pic.javct.net/poster/05192026/23f45006f6.jpg,https://javct.net/v/xvsr-295-rm,130,2026-07-16
BGN-055-RM,Rookie Prestige Exclusive Debut Big Dusty Yamato Ayako Fujitani Maho,https://pic.javct.net/poster/10232025/1763337600.jpg,https://javct.net/v/bgn-055-rm,175,2026-07-16
MIDA-121-SUB,"""Even Though It's Just A Small Dick, It's Rock Hard!"" I'm A Tutor Who Lost To The Temptation Of A Naughty Girl With Her Huge Tits... She Made Me Cum With A Devilish Titty Fuck... She Made Me Cum With A Pounding Sex... She Even Played With My Empty Balls. Toa Yuki [English Subtitle]",https://pic.javct.net/poster/20250903/1744303462.jpg,https://javct.net/v/mida-121-sub,150,2026-07-16
NHDTB-221-RM,A Woman Lustfully Sucks A Nipple With Persistent Stimulation Of A Nipple At A Hot Spring Bath Does Not Refuse Sprays With A Pleasant Feel Of A Slow Piston That Does Not Spray Splashes [Uncensored L**ked],https://pic.javct.net/poster/07052026/1af5f5f575.jpg,https://javct.net/v/nhdtb-221-rm,220,2026-07-16
NHDTA-609-RM,If You See A Busty Woman Before Has Been Left Naked Invisible Is Suffer A Keyed Mask You Can Either Help You If? The One Shot Do?,https://pic.javct.net/poster/20230804/1693313258.jpg,https://javct.net/v/nhdta-609-rm,150,2026-07-16
MOND-058-RM,Confessions Of A Concentrated Affair Wife Ayase Minami,https://pic.javct.net/poster/20231711/1702312557.jpg,https://javct.net/v/mond-058-rm,140,2026-07-16
ALDN-471-SUB,Even My Stepmother Wants To Get Pregnant. Miki Akai [English Subtitle],https://pic.javct.net/poster/20252204/1749228973.jpg,https://javct.net/v/aldn-471-sub,125,2026-07-16
MDB-995-RM,Busty Slut Guiding Her Cock In A Superior Woman On Top [Uncensored L**ked],https://pic.javct.net/poster/07052026/19f4e45cf7.jpg,https://javct.net/v/mdb-995-rm,150,2026-07-16
OMT-008-RM,Beautiful Big Breasts Lotion Covered! Middle-aged Love College Student Exposed M Temperament Cataclysm Shame Fuck! ! Mihara Honoka [Uncensored L**ked],https://pic.javct.net/poster/07052026/cdf186c49b.jpg,https://javct.net/v/omt-008-rm,120,2026-07-16
NHDTB-249-RM,Simultaneous Up And Down Molest 3 Woman Who Is Simultaneously Blamed With Nipple And MAKO For Two Masochists [Uncensored L**ked],https://pic.javct.net/poster/07052026/0a4e3a20ef.jpg,https://javct.net/v/nhdtb-249-rm,190,2026-07-16
SOE-237-RM,Sakura Here Seen An Indecent Body × Risky Mosaic Perfect Body [Uncensored L**ked],https://pic.javct.net/poster/07052026/9f8aa5bb98.jpg,https://javct.net/v/soe-237-rm,150,2026-07-16
ZEAA-23-RM,This K Cup Voluminous Titty Mature Woman Cram School Instructor Will Never Be Satisfied With Just Normal Sex Misa Arisawa,https://pic.javct.net/poster/20221108/1661767390.jpg,https://javct.net/v/zeaa-23-rm,130,2026-07-16
GVH-160,Ma ○ Ko Device Bondage XVIII Iron Restraint Ma ○ Ko To**ure Mayu Suzuki,https://pic.javct.net/poster/07052026/5139dd42d9.jpg,https://javct.net/v/gvh-160,130,2026-07-16
VRTM-414-RM,"""I Also Want C**ldren!""Deca Milk Homemade Working In A Nursery School Consults With A Colleague 's Man Troubles!Pregnancy Desire Is Too Strong Breast Feeding Handjob With A Mother-overflowing Tits!Pleading Inside Repeatedly Repeatedly Inserting Young Chi Who Is Not Withering  Himself To Shake The Deck And Shake It!3",https://pic.javct.net/poster/20230302/1678861679.jpg,https://javct.net/v/vrtm-414-rm,150,2026-07-16
SSPD-024-RM,Treasures Of The Jungle Puazon Thief 4 Leopard Woman Woman [Uncensored L**ked],https://pic.javct.net/poster/07052026/42451fa5f8.jpg,https://javct.net/v/sspd-024-rm,160,2026-07-16
KATU-039-RM,A Flesh Fantasy Slut Horny Coed Bathing An Erotic And Perverted Elder Sister And Some Dirty Old Men,https://pic.javct.net/poster/20220707/1660004860.jpg,https://javct.net/v/katu-039-rm,130,2026-07-16
SCOP-652,"While Saying “Do N’t Do Anything Weird"", When You Rush To A Woman With A Prime That Invites You Frustratingly, You Transform Yourself Into A Bitch Woman Who Sucks On Herself! !It Will Be Full Of Euphoria If You Make Use Of What You've Requested And Squid With Raw Insertion And Even Vaginal Cum Shot.",https://pic.javct.net/poster/07052026/136cca5abd.jpg,https://javct.net/v/scop-652,240,2026-07-16
HODV-21643-RM,"Cheating Wives. The Secrets of Housewives...Getting Caught Would be Horrible, but in This Naughty Video Between Two People Having an Affair, She Asks ""Just One More Time"" Even Though She Knows It is Wrong.",https://pic.javct.net/poster/20212011/1642148299.jpg,https://javct.net/v/hodv-21643-rm,238,2026-07-16
FC2PPV-4938863,[Winner of Beauty Contest] Beauty influencer with rapidly increasing number of followers Private rare sex video for over 2 hours [High quality],https://pic.javct.net/poster/07052026/19135a5a2e.jpg,https://javct.net/v/fc2ppv-4938863,67,2026-07-16
FAX-530-RM,Man And Woman Who Drowned In Henry Tsukamoto Every Trick In The Book Lust-lust [Uncensored L**ked],https://pic.javct.net/poster/07052026/7d0ac137d7.jpg,https://javct.net/v/fax-530-rm,95,2026-07-16
XVSR-348,Perfect Subjectivity I And Icha LOVE Sex Only For You,https://pic.javct.net/poster/07052026/e093e65699.jpg,https://javct.net/v/xvsr-348,240,2026-07-16
EBOD-552,Wet Clothing Obscene Nipples Hcup Breasts Maid Nene Sakura,https://pic.javct.net/poster/07052026/6460a06c16.jpg,https://javct.net/v/ebod-552,120,2026-07-16
VEMA-030-RM,Busty Nurse Wife - Ai Airi [Uncensored L**ked],https://pic.javct.net/poster/07052026/287f47e571.jpg,https://javct.net/v/vema-030-rm,90,2026-07-16
