code,title,image_url,page_url,views,date_scraped
JUNY-043-RM,Dirty Men Toy With Curvy Bodied Girl Even While Her Boyfriend Is Right There. Colossal Tits And Massive Ass In Swimsuit Gets Teased By Personal Trainer. Climax NTR Getting Cheated On Pervert. Reo Fujisawa [Uncensored L**ked],https://pic.javct.net/poster/20212308/1631859469.jpg,https://javct.net/v/juny-043-rm,172,2026-07-10
JUNY-035-RM,My Old Friend's Got Thick Thighs - Grinding Them Together To Wring Out Every Last Drop Of Cum Reo Fujisawa [Uncensored L**ked],https://static.javct.net/poster/juny-035.jpg,https://javct.net/v/juny-035-rm,126,2026-07-10
JUNY-056-RM,The Temptation Of Voluptuous Flesh: The Hot Slut Next Door Seduced Me With Her Naughty Exposed Curves Reo Fujisawa [Uncensored L**ked],https://pic.javct.net/poster/20212011/1644561180.jpg,https://javct.net/v/juny-056-rm,148,2026-07-10
BAB-038-RM,The Lewdest Girl In History Was Hiding These Huge G-cup Breasts - Rino Yuki [Uncensored L**ked],https://pic.javct.net/poster/20212011/1637468766.jpg,https://javct.net/v/bab-038-rm,94,2026-07-10
JUFE-076-RM,I Had Creampie Sex With My Wife's Hot Sister With Colossal Tits While My Wife Was Away On A Company Trip For 5 Days. Ruka Inaba [Uncensored L**ked],https://pic.javct.net/poster/20220707/1658281244.jpg,https://javct.net/v/jufe-076-rm,163,2026-07-10
JUY-843-RM,The Worst Man Made Me Cum So Hard I Could Die... Akari Mitani [Uncensored L**ked],https://pic.javct.net/poster/20221202/1650304956.jpg,https://javct.net/v/juy-843-rm,118,2026-07-10
JUFE-034-RM,All The Male Subs Are Talking About It!? The Ball-Charging Pub Where Men Are Teased Mercilessly. Miyu Yanagi [Uncensored L**ked],https://pic.javct.net/poster/20220707/1658280323.jpg,https://javct.net/v/jufe-034-rm,152,2026-07-10
NIMA-006-RM,The Long-Awaited Live-Action Adaptation Of The Ultimate Fleshy Comic Featuring Nanami Matsumoto! A Slightly Ugly Girl Who'll Ruin You For Anyone Else Her Face Is 40 Out Of 100 But Her Body Is 120 Out Of 100 Nanami Matsumoto [Uncensored L**ked],https://pic.javct.net/poster/20221202/1646702221.jpg,https://javct.net/v/nima-006-rm,118,2026-07-10
VENX-023-RM,"Lately, This Voluptuous Mature Woman Started To Worry About Her Figure, But I Got A Super Erection Watching The Bride's Mother Bashfully Fret And Frown Maria Nagai [Uncensored L**ked]",https://pic.javct.net/poster/20212709/1632732687.jpg,https://javct.net/v/venx-023-rm,89,2026-07-10
JUY-531-RM,The Married Woman Investigator Wears Jeans Maki Tomoda [Uncensored L**ked],https://pic.javct.net/poster/20220707/1659400606.jpg,https://javct.net/v/juy-531-rm,119,2026-07-10
ENKI-039-RM,Naughty Japanese Sex Fest Breaks Out! Horny Blue-Eyed Slut Jun-chan Gets Fucked Raw by a Big White Cock and Cum Splashed in her Pussy. [Uncensored L**ked],https://static.javct.net/poster/enki-039.jpg,https://javct.net/v/enki-039-rm,237,2026-07-10
FOCS-068-RM,Creampie Volunteer AV Debut! Minori Mashiro Loves Cooking And She Uses The Huge E-Cup Tits And Big Ass That Fall Out Of Her Apron As Weapons During Sex! Creampie Challenge! [Uncensored L**ked],https://pic.javct.net/poster/20221904/1652425268.jpg,https://javct.net/v/focs-068-rm,122,2026-07-10
NKKD-225-RM,My Coworker Fucked My Wife On The Emergency Stairs At My Office!! 2 [Uncensored L**ked],https://pic.javct.net/poster/20212308/1631255948.jpg,https://javct.net/v/nkkd-225-rm,197,2026-07-10
FOCS-064-RM,"Extremely Slutty Drooling Woman!! Raunchy Sex With Deep Kissing And Nipple Licking, Yuuka Waraku [Uncensored L**ked]",https://pic.javct.net/poster/20221202/1650012332.jpg,https://javct.net/v/focs-064-rm,124,2026-07-10
FOCS-060-RM,Anal Licking! Temptress Maid With A Beautiful Huge Ass Uses Her Asshole To Induce Temptation. Get To Have A Creampie Load After Giving Anal Cunnilingus. Meisa Kawakita [Uncensored L**ked],https://pic.javct.net/poster/20221202/1650012605.jpg,https://javct.net/v/focs-060-rm,124,2026-07-10
EBOD-451-RM,The Temptation Of A Voluptuous Babe In High-Legged Lingerie With Plenty Of Camel Toe    Chitose Saegusa [Uncensored L**ked],https://pic.javct.net/poster/20221108/1661401477.jpg,https://javct.net/v/ebod-451-rm,118,2026-07-10
JUFE-343-RM,Weak-Willed Busty Nurse Mina Kitano Is In Charge of My Penis [Uncensored L**ked],https://pic.javct.net/poster/20212709/1635488737.jpg,https://javct.net/v/jufe-343-rm,154,2026-07-10
TIKB-116-RM,"My Super Cute Friend With Benefits Hana-tan, Starring Hana Shirato [Uncensored L**ked]",https://static.javct.net/poster/tikb-116.jpg,https://javct.net/v/tikb-116-rm,131,2026-07-10
TIKP-063-RM,"(The Fuck Log) When Ena Satsuki Gets Down To Party, She Unleashes Her Slut Aura Full Throttle, And That's How We Filmed This POV Video! [Uncensored L**ked]",https://pic.javct.net/poster/20212709/1636876662.jpg,https://javct.net/v/tikp-063-rm,118,2026-07-10
SOAV-083-RM,A Married Woman's Cheating Heart. Mei Hosho [Uncensored L**ked],https://pic.javct.net/poster/20212011/1638654795.jpg,https://javct.net/v/soav-083-rm,143,2026-07-10
VENX-013-RM,I Can't Live Without My Stepson Anymore... Horny MILF Cums 50 Times On Her Boy's Rod In A Creampie Trance Of Erotic Ecstasy Kanon Ibuki [Uncensored L**ked],https://static.javct.net/poster/1629212477.jpg,https://javct.net/v/venx-013-rm,104,2026-07-10
VENX-008-RM,"""Uh, You're Touching Me With Your Tits..."" Bathing With My Hot Busty Stepmom Maria Nagai [Uncensored L**ked]",https://pic.javct.net/poster/20212011/1638319575.jpg,https://javct.net/v/venx-008-rm,106,2026-07-10
JUY-297-RM,Married Woman Babes Are Hooked On The Pleasure They Get From This Lusty Massage Parlor Ryoko Furusawa [Uncensored L**ked],https://pic.javct.net/poster/20220707/1659839138.jpg,https://javct.net/v/juy-297-rm,147,2026-07-10
EKW-076-RM,Control By Deep Kiss Yuri Honma [Uncensored L**ked],https://pic.javct.net/poster/20212011/1640453387.jpg,https://javct.net/v/ekw-076-rm,99,2026-07-10
