code,title,image_url,page_url,views,date_scraped
ROYD-319,"My Female Friend, Who Has A Boyfriend, Comes To Stay Over Every Night And Unconsciously Tries To Seduce Me, Leaving Me In A State Of Torment Because I Can't Muster The Courage To Make A Move.",https://pic.javct.net/poster/05192026/15dd219bdd.jpg,https://javct.net/v/royd-319,130,2026-06-05
BBTU-072-RM,Healing Big Tits Titty Fuck Mama Esthetic Marina Yuzuki [Uncensored L**ked],https://pic.javct.net/poster/20231711/1702698328.jpg,https://javct.net/v/bbtu-072-rm,128,2026-06-05
AVSA-289-RM,"Super Close-up Shot, Obscene Erotic Areolas, Huge Breasts, And Sex-obsessed Rimu Yumino [Uncensored L**ked]",https://pic.javct.net/poster/20231912/1704511009.jpg,https://javct.net/v/avsa-289-rm,137,2026-06-05
RKI-754,THE SECOND LOVE ~The First And Last Couple Swapping NTR~ Eligibility: Couples Married For 16 Years Or More. That's All.,https://pic.javct.net/poster/05192026/58d96d5397.jpg,https://javct.net/v/rki-754,120,2026-06-05
PKPD-112-RM,Yen Woman Dating Creampie Ok Short Black Hair Pervert Employee Ol Kashiwagi Ami [Uncensored L**ked],https://pic.javct.net/poster/06032026/1775800875.jpg,https://javct.net/v/pkpd-112-rm,138,2026-06-05
KSBJ-028-RM,Big Brother's Wife's New Promising Promise [Uncensored L**ked],https://pic.javct.net/poster/06032026/1775015890.jpg,https://javct.net/v/ksbj-028-rm,114,2026-06-05
JJDA-037-RM,"Misono Suwon, Wife Of A Kind And Busty Teacher Who Encourages Me Who Is Unemployed [Uncensored L**ked]",https://pic.javct.net/poster/20230206/1688099232.jpg,https://javct.net/v/jjda-037-rm,120,2026-06-05
FC2PPV-4915084,"[Uncensored]**pyjpx*jsps Donkey's love slave breast diary Call a big-breasted sex friend and enjoy playing with her favorite breasts - Of course, call the I-cup tit-fuck-exploding dick guy and cum inside him - Big breasts 〇〇 loves standing doggy style",https://pic.javct.net/poster/05192026/588abeb8d6.jpg,https://javct.net/v/fc2ppv-4915084,72,2026-06-05
HMGL-154-RM,Ripe Ass Big Fucking Amateur Hashima Love 92 Centimeters Of Gifu [Uncensored L**ked],https://pic.javct.net/poster/04112026/1776058214.jpg,https://javct.net/v/hmgl-154-rm,130,2026-06-05
VOD-018-RM,Real Amateur Wife Document 3rd Beautiful Platinum K Cup Colossal Tits Wife Wants Berokisu Adhesion Sex Mana Kawahara [Uncensored L**ked],https://pic.javct.net/poster/20230206/1688100765.jpg,https://javct.net/v/vod-018-rm,125,2026-06-05
VENX-217-RM,My Son's Wife Gets Creampied By Her Father-In-Law And Knows Real Sex And Is Extremely Pleasant Emily Kajima [Uncensored L**ked],https://pic.javct.net/poster/20230206/1687496414.jpg,https://javct.net/v/venx-217-rm,95,2026-06-05
328HMDNV-928-RM,"A married woman who was active as a weather girl until a few years ago retired because she longed for a normal life, but there was no stimulation and she was stressed to the max! Dirty creampie sex to remember her younger days [Uncensored L**ked]",https://pic.javct.net/poster/05192026/03a7fc3c95.jpg,https://javct.net/v/328hmdnv-928-rm,65,2026-06-05
PKPT-015-RM,Wanting Office Lady Hana Haruna Hana [Uncensored L**ked],https://pic.javct.net/poster/20230206/1688189090.jpg,https://javct.net/v/pkpt-015-rm,130,2026-06-05
IPZZ-828,"The Voluptuous, Healthy Body Of The Swimming Club Advisor Is Exposed In A Revealing Swimsuit. Teacher And Student Gangbang, Covered In Semen During A Midsummer Orgy Camp. Nagahama Mitsuri",https://pic.javct.net/poster/05192026/801e269591.jpg,https://javct.net/v/ipzz-828,140,2026-06-05
REAL-840-RM,A High School Girl Who Doesn't Know Anything Yet Repeats Orgasms While Spitting Lewd Words. Dirty Voice Soaked In Aphrodisiac Sakura Kurumi [Uncensored L**ked],https://pic.javct.net/poster/20241901/1705719696.jpg,https://javct.net/v/real-840-rm,125,2026-06-05
NACT-133,Oil Enthusiast Reika Takeda,https://pic.javct.net/poster/05192026/2b3fb3fcd5.jpg,https://javct.net/v/nact-133,121,2026-06-05
MIDD-887-RM,Maple Pie Birth Mei Yuki [Uncensored L**ked],https://pic.javct.net/poster/06032026/1774329637.jpg,https://javct.net/v/midd-887-rm,180,2026-06-05
DFDM-074-RM,Uncle And P-Activity J-Type - A Seemingly Quiet But Secretly Perverted J-type Girl's Record Of Sleeping With Older Men - Nagisa Yasaka [Uncensored L**ked],https://pic.javct.net/poster/05192026/af5a40a22d.jpg,https://javct.net/v/dfdm-074-rm,122,2026-06-05
NGOD-343,Graduation From The Domination Of That Giant Penis—the Day Of Graduation Finally Arrives For The Female Teacher Wife Who Was Dominated By Her Student's Huge Cock...,https://pic.javct.net/poster/05192026/8a86a82215.jpg,https://javct.net/v/ngod-343,120,2026-06-05
PASN-025-RM,[Strongest Heroine 003] Isn't I cute? A confident play of a beautiful girl with an outstanding presence [Uncensored L**ked],https://pic.javct.net/poster/05192026/701c1f520c.jpg,https://javct.net/v/pasn-025-rm,135,2026-06-05
NHDTC-213-RM,"A Quiet, Inconspicuous, Perverted, Plain Girl In Class Lures Boys Into A Private Room And Makes Them Ejaculate Repeatedly—she's A Perverted Girl 2 [Uncensored L**ked]",https://pic.javct.net/poster/05192026/484decdd7b.jpg,https://javct.net/v/nhdtc-213-rm,205,2026-06-05
SNOS-232,"Sueho Kinmatsu Is Stripped Naked In Seconds! Sex In Seconds! ""What?! This Is Really Impossible!!!"" Surprise Instant Thong GP!",https://pic.javct.net/poster/05192026/d9b3eddb68.jpg,https://javct.net/v/snos-232,150,2026-06-05
ROE-509,"MONROE exclusive Former female announcer's creampie ban lifted! ! A beautiful friend's mother, days drowning in kisses and fertilization. Miyabi Inamori",https://pic.javct.net/poster/05192026/7bcabfbeea.jpg,https://javct.net/v/roe-509,115,2026-06-05
FC2PPV-4913467,"A horny wife seeking stimulation, unparalleled big dick non-stop fuck, and endless orgasms during raw sex.",https://pic.javct.net/poster/05192026/ae95fa36cb.jpg,https://javct.net/v/fc2ppv-4913467,53,2026-06-05
