code,title,image_url,page_url,views,date_scraped
328CNSTV-018,[Reading warning/Big areola] The challenge of a 48-year-old lewd glamorous J-cup plump body desire monster married woman Shiho Terashima,https://pic.javct.net/poster/05192026/847cff0b19.jpg,https://javct.net/v/328cnstv-018,120,2026-06-30
XVSR-331,Bracon Sister And Brother And Brother Crazy Cum Shot Acting Freely And Free,https://pic.javct.net/poster/05192026/57f0ff4a23.jpg,https://javct.net/v/xvsr-331,120,2026-06-30
MIST-272,I Want To Get Pregnant And Make An AV Debut! !I Don't Want To Get Old Without Getting Pregnant ... I Cup Big Tits Chitose (38),https://pic.javct.net/poster/05192026/f4d3372fdd.jpg,https://javct.net/v/mist-272,160,2026-06-30
MIDD-987,Oh Dcup Super Rarity Soap Lady Yuri Satomi,https://pic.javct.net/poster/05192026/4660a1866e.jpg,https://javct.net/v/midd-987,150,2026-06-30
AKDL-122,[Munekoi] You are in love with my chest,https://pic.javct.net/poster/05192026/eba0c188d2.jpg,https://javct.net/v/akdl-122,95,2026-06-30
EBOD-536,Kimoota Virgin Brush Wholesale Slut Gal Naomi,https://pic.javct.net/poster/05192026/b73eea0f00.jpg,https://javct.net/v/ebod-536,150,2026-06-30
BOBB-372-RM,"Double Colossal Tits Harem Of Jcup Dream Your Desires Will Be Granted! Great Ascension With Erotic Cosplay & Healing Milk Fetish Play! Boin ""Suwon Misono & Seiri Toa"" Box [Uncensored L**ked]",https://pic.javct.net/poster/20230104/1680843320.jpg,https://javct.net/v/bobb-372-rm,120,2026-06-30
CHUC-031-RM,Sex-Crazy G-Cup OL And Creampie Sex Minaho (30) Minaho Ariga [Uncensored L**ked],https://pic.javct.net/poster/20230302/1679888430.jpg,https://javct.net/v/chuc-031-rm,70,2026-06-30
HODV-21629-RM,"I'm An Anti-social Shut-in That Never Leaves My Room, This Unbelievably Slutty Younger Woman Takes My Unwashed Dick With A Smiling Face For As Much Lewd Titty Fuck And Blowjob Fun As I Want. Reona Tomiyasu [Uncensored L**ked]",https://pic.javct.net/poster/20212011/1638531143.jpg,https://javct.net/v/hodv-21629-rm,127,2026-06-30
BBTU-093-RM,Tied Breasts To**ure Copulation Souka Minamihata [Uncensored L**ked],https://pic.javct.net/poster/20241115/1734148451.jpg,https://javct.net/v/bbtu-093-rm,106,2026-06-30
START-586-RM,"Homeroom teacher: ""Starting today, I'll assign Shinkawa to be in charge of sex treatment. If you don't store enough semen to fill a beaker in a week, you'll be expelled from school, so do your best.'' Sora Shinkawa [Uncensored L**ked]",https://pic.javct.net/poster/05192026/c543c452d3.jpg,https://javct.net/v/start-586-rm,118,2026-06-30
SCOP-503-RM,"Despite Her Temptation Of A Close Friend Of A Bath, Desire Full Erection! !Prepare Yourself And Smile ● Massive Sperm Masses Are Launched In Large Quantities! ! [Uncensored L**ked]",https://pic.javct.net/poster/20230908/1695948527.jpg,https://javct.net/v/scop-503-rm,150,2026-06-30
INOT-005-RM,2 Holes OK With Big Tits! ? Tipsy Pick-up Infiltration! Serve With The Famous Vagina & Intestinal Pressure! All-you-can-eat Icharab Saddle [Uncensored L**ked],https://pic.javct.net/poster/20230302/1679888116.jpg,https://javct.net/v/inot-005-rm,100,2026-06-30
UNDG-010-RM,The woman who got picked up on Friday was a pervert who made her tide blow repeatedly and went crazy with a big cock. [Uncensored L**ked],https://pic.javct.net/poster/05192026/e655554e1b.jpg,https://javct.net/v/undg-010-rm,85,2026-06-30
MEYD-474,"Actually, My Husband's Boss Continues Being Fucked ... Jinguji Temple Nao",https://pic.javct.net/poster/05192026/8e5bc1edab.jpg,https://javct.net/v/meyd-474,120,2026-06-30
START-573-RM,"NTR During Delivery - Momona Koibuchi, a newlywed married woman, gets scared in the car while accompanying a married veteran driver on a delivery trip. [Uncensored L**ked]",https://pic.javct.net/poster/05192026/38d53e5d64.jpg,https://javct.net/v/start-573-rm,124,2026-06-30
XVSR-267-RM,Continuous Launch Guarantee Included! ! The Best Feeling Soap In The World Rimi Hatsumi [Uncensored L**ked],https://pic.javct.net/poster/04112026/2bafdd2268.jpg,https://javct.net/v/xvsr-267-rm,120,2026-06-30
MYBA-057-RM,Married Woman's Petal Flipping Mio Kimishima [Uncensored L**ked],https://pic.javct.net/poster/20230104/1681533571.jpg,https://javct.net/v/myba-057-rm,141,2026-06-30
VEC-691-SUB,Wife Addicted To Women-Only Brothels NTR Morisawa Kana [English Subtitle],https://pic.javct.net/poster/20250903/1742492482.jpg,https://javct.net/v/vec-691-sub,125,2026-06-30
KSBJ-051-RM,Barefoot Wife Aoi Yurika [Uncensored L**ked],https://pic.javct.net/poster/04112026/1776912999.jpg,https://javct.net/v/ksbj-051-rm,120,2026-06-30
STARS-061-RM,"For The First Time, A Large Amount Of Intense Piston Shrimp Warp Crest Convulsions Acme Minagawa Chiharu [Uncensored L**ked]",https://pic.javct.net/poster/20243105/1719748644.jpg,https://javct.net/v/stars-061-rm,180,2026-06-30
MILK-178-RM,"God Menes Miss Waiting For Reservation Half A Year Raw Fucking Creampie OK Behind The Scenes Complete Peeping Style, Face, Service When I Thought That It Ended With A SSS Class Slut, I Was Squeezed. Ayaka Mochizuki [Uncensored L**ked]",https://pic.javct.net/poster/20230207/1688614863.jpg,https://javct.net/v/milk-178-rm,139,2026-06-30
SGA-031-RM,"An Overly Obedient E-Cup Plump Married Woman Mei Kisaragi 38 Years Old AV Debut ""It Looks Like It's Going To Be A Habit..."" Her First AV, A Sexless Married Woman Captivated By The Pleasure She's Never Experienced [Uncensored L**ked]",https://pic.javct.net/poster/20221108/1661818197.jpg,https://javct.net/v/sga-031-rm,120,2026-06-30
SDAB-164-RM,"Up To 7 Times A Day, It's So Awesome! Smooth Skin Flesh Loved BODY! !! Kanon Shiraishi SOD Exclusive AV Debut [Uncensored L**ked]",https://pic.javct.net/poster/05192026/e95e0d4ae2.jpg,https://javct.net/v/sdab-164-rm,130,2026-06-30
