code,title,image_url,page_url,views,date_scraped
WHX-030,It Felt Good To Think About I Destroyed Pussy Intense I Was Thinking That Naughty While Your Job I Accepted ◆ AV Sex Yesterday!24-year-old Wind Noise Maika Receptionist,https://pic.javct.net/poster/05192026/f23283f8f4.jpg,https://javct.net/v/whx-030,150,2026-06-03
APAK-256-RM,Innocent Fcup Voluptuous Uniform Beautiful Girl Nasty Climax Student Guidance Mito Wakui [Uncensored L**ked],https://pic.javct.net/poster/20230206/1687578788.jpg,https://javct.net/v/apak-256-rm,115,2026-06-03
BBTU-068-RM,Big Tits Masochist Squirt Splash Fuck Marina Yuzuki [Uncensored L**ked],https://pic.javct.net/poster/20231011/1697255819.jpg,https://javct.net/v/bbtu-068-rm,134,2026-06-03
MFCS-210,Nagisa,https://pic.javct.net/poster/05192026/379b969a55.jpg,https://javct.net/v/mfcs-210,68,2026-06-03
AKDL-041-RM,"[Bakata Erotic Video] ""What!? In a place like this!!"" A thrilling secret blowjob that must never be found out [Uncensored L**ked]",https://pic.javct.net/poster/04112026/1776313046208.jpg,https://javct.net/v/akdl-041-rm,124,2026-06-03
MIDA-104-SUB,During A Training Camp For The Prestigious Boxing Club... The Big-breasted Uniform Manager Mao Hotta Was Gang-r**ed While Asleep [English Subtitle],https://pic.javct.net/poster/20250903/1743098715.jpg,https://javct.net/v/mida-104-sub,120,2026-06-03
DANDYA-041-RM,"Alone With A Busty Lady In A Mixed-gender Hot Spring Where Towels Are Prohibited! ""Excuse Me, Your Nipples Are Showing,"" She Said. Her Large Breasts, Which She Couldn't Completely Hide With Her Hands, Made Me Hard, And Then She Had Sex With Me. [Uncensored L**ked]",https://pic.javct.net/poster/05192026/63771e55de.jpg,https://javct.net/v/dandya-041-rm,231,2026-06-03
FOCS-065-RM,AV Debut With G-Cup Big Tits. Beautiful Pale Skin And Beautiful Tits. Showing Her Inner Self Laid Completely Bare. Ruka Matsumoto [Uncensored L**ked],https://pic.javct.net/poster/20221202/1650012262.jpg,https://javct.net/v/focs-065-rm,124,2026-06-03
JYMA-036-RM,Frustrated Beautiful Busty Ass Wife Eats Men Sexual Desire Monster Flesh Feeling Body Nasty M Wife Masochist Slut Wife With Sex And Body Is Accused And Cums Hana Himesaki [Uncensored L**ked],https://pic.javct.net/poster/20230206/1687494696.jpg,https://javct.net/v/jyma-036-rm,120,2026-06-03
BDDA-030-RM,Mistress Contest ~ A super carnivorous girl sees a mistress recruitment advertisement and makes an intensely erotic appeal ~ Nozomi Arimura [Uncensored L**ked],https://pic.javct.net/poster/05192026/c809828f17.jpg,https://javct.net/v/bdda-030-rm,76,2026-06-03
BBTU-069-RM,Big Breasts Horny Pie Monster Chitose Yuuki [Uncensored L**ked],https://pic.javct.net/poster/20231011/1697255753.jpg,https://javct.net/v/bbtu-069-rm,120,2026-06-03
BABM-020-RM,The J-kei Mama Who Lives Next Door Spoils Me With Big Boobs And Tolerance! Feel Babu And Baby Return SEX Amu Ohara [Uncensored L**ked],https://pic.javct.net/poster/20230206/1687578484.jpg,https://javct.net/v/babm-020-rm,127,2026-06-03
AKDL-040-RM,"When I continued to to**ure a girl without a bra and showing her breasts until her nipples became hard, I felt it while twisting my hips. [Uncensored L**ked]",https://pic.javct.net/poster/04112026/1776223382412.jpg,https://javct.net/v/akdl-040-rm,230,2026-06-03
MOND-249-RM,Longing Female Boss And Yuri Sasahara [Uncensored L**ked],https://pic.javct.net/poster/20230206/1687579155.jpg,https://javct.net/v/mond-249-rm,130,2026-06-03
KSBJ-024-RM,Freedom In The Younger Brother Of The Bride Kana [Uncensored L**ked],https://pic.javct.net/poster/06032026/1774697122.jpg,https://javct.net/v/ksbj-024-rm,118,2026-06-03
VGD-160-RM,All Documents AV Actress Sasaki Koiumi Of That Girl [Uncensored L**ked],https://pic.javct.net/poster/06032026/1774504308.jpg,https://javct.net/v/vgd-160-rm,140,2026-06-03
DFE-060-RM,Skewered Full Bocco Ayaka Hirosaki [Uncensored L**ked],https://pic.javct.net/poster/20221904/1650615563.jpg,https://javct.net/v/dfe-060-rm,127,2026-06-03
BOBB-381-RM,"Big Breasts Icup Angel In A White Coat Secret Breast Nursing That Starts With A Nurse Call Boin ""Monami Takarada"" Box [Uncensored L**ked]",https://pic.javct.net/poster/20230206/1687491000.jpg,https://javct.net/v/bobb-381-rm,120,2026-06-03
MIDD-883-RM,Berokissu Rich Chestnut Look Cute Netchori [Uncensored L**ked],https://pic.javct.net/poster/06032026/1774080229.jpg,https://javct.net/v/midd-883-rm,120,2026-06-03
BOKO-039-RM,"Just Before The Wedding, NTR Lesbian Esthetician ""Just For Today..."" That Night I Confided My Troubles To You, And We Made Love In A World Just For The Two Of Us, Where We Couldn't Think About Anything Else. Yuri Maina, Minoshima Meguri [Uncensored L**ked]",https://pic.javct.net/poster/05192026/de9b4a2e95.jpg,https://javct.net/v/boko-039-rm,171,2026-06-03
REAL-565-RM,Demon Fucking Hell Kazama Yumi [Uncensored L**ked],https://pic.javct.net/poster/06032026/1775524171.jpg,https://javct.net/v/real-565-rm,115,2026-06-03
EBOD-457-RM,Soggy Concentrated Kiss And Estrus Berokisu Intercourse Mayu Suzuki [Uncensored L**ked],https://pic.javct.net/poster/06032026/1775711202.jpg,https://javct.net/v/ebod-457-rm,150,2026-06-03
FC2PPV-4912083,☆4 ejaculations☆ E cup beautiful big breasted nursery teacher (20) Squirting SEX in agony with great excitement due to the big thick penis that reaches deep inside,https://pic.javct.net/poster/05192026/83e75fd418.jpg,https://javct.net/v/fc2ppv-4912083,93,2026-06-03
FC2PPV-4912528,"SEX with 20 people** Plump mature woman Reika's first 4P, sweaty carnal dance with huge breasts and big butt",https://pic.javct.net/poster/05192026/2daecbf8e7.jpg,https://javct.net/v/fc2ppv-4912528,72,2026-06-03
