code,title,image_url,page_url,views,date_scraped
SIR-035,Amateur wife interview File No.035,https://pic.javct.net/poster/07052026/3db00820bc.jpg,https://javct.net/v/sir-035,62,2026-07-08
HTM-109B,Mature woman's cheating is serious sex VOL.109 Part 2 Yuka (43),https://pic.javct.net/poster/07052026/62128689ef.jpg,https://javct.net/v/htm-109b,70,2026-07-08
TKFC-167,"Painful masochist woman, whip, rubber, electric shock, female who climaxes from pain (posting name: Ayako)",https://pic.javct.net/poster/07052026/3648952939.jpg,https://javct.net/v/tkfc-167,56,2026-07-08
MIGD-668,The Mao Specialty Soap Kurata Out In Ultra-luxury,https://pic.javct.net/poster/07052026/b59e695d91.jpg,https://javct.net/v/migd-668,120,2026-07-08
MIST-282,Bubble Wash Body Massage That Haruna Hana Services In A Cowgirl Style,https://pic.javct.net/poster/07052026/75768196d1.jpg,https://javct.net/v/mist-282,165,2026-07-08
FEST-003,A beauty salon girl who loves blowjobs and can't help but suck on erect cocks 3,https://pic.javct.net/poster/07052026/b04debe2f1.jpg,https://javct.net/v/fest-003,157,2026-07-08
XVSR-340,Unstoppable Drinking × Best Erotic SEX Onoei Yaka,https://pic.javct.net/poster/07052026/4e8054e903.jpg,https://javct.net/v/xvsr-340,120,2026-07-08
BIJN-239-RM,THE Document Instinct Bare Climax SEX A Beautiful Married Woman Who Wants To Be A Meat Urinal Breaks The Limit Incontinence Orgy Climax Wakamiya Hazuki [Uncensored L**ked],https://pic.javct.net/poster/20230302/1677898864.jpg,https://javct.net/v/bijn-239-rm,128,2026-07-08
BANK-110-RM,Creampie Open-air Hot Spring Obscene Areola & Bing Bing Deca Nipple! H Byte Of Active JD [Uncensored L**ked],https://pic.javct.net/poster/20233001/1677212356.jpg,https://javct.net/v/bank-110-rm,155,2026-07-08
SCOP-643,Aloha!Is This A Pin Salo! ?Is This Japan? ?There Is A Rumor That A Tropical Country-style Resort Pinsaro Exists In Some Places In Tokyo!The Familiar SCOOP Bag Is Deeply Infiltrated Every Time! !It's Hotter Than Usual Pinsaro! !Super Adherence To The Hot Summer Ever Summer Pinsaro! !,https://pic.javct.net/poster/07052026/9ec472e79f.jpg,https://javct.net/v/scop-643,150,2026-07-08
NINE-067-RM,[Highest Grade Super Aged Meat Mature Woman] Kayo (50 Years Old) Carnivorous Colossal Breasts J-cup Mother Who Overprotects Her Doting Son Sexually [Uncensored L**ked],https://pic.javct.net/poster/20233001/1677466895.jpg,https://javct.net/v/nine-067-rm,111,2026-07-08
KSBJ-063-RM,Seduced By My Son's Wife ... Mayu Suzuki [Uncensored L**ked],https://pic.javct.net/poster/06032026/1775636234.jpg,https://javct.net/v/ksbj-063-rm,122,2026-07-08
BLOR-211-RM,"A Tall, Big-breasted, And Big-butted Young Lady, Usually A Strong Beauty, Is Sexually To**ured And Becomes A Female With A Huge Cock. [Uncensored L**ked]",https://pic.javct.net/poster/20233001/1677296200.jpg,https://javct.net/v/blor-211-rm,115,2026-07-08
HUNTB-518-RM,My Life Changed Completely When I Was A Virgin And Refused To Go To School! 3 Big Breasted Sisters-in-law Who Suddenly Made It Treat Me As A King! My Exclusive Bimbo Who Lets Me Fuck Him Whenever I Like [Uncensored L**ked],https://pic.javct.net/poster/20230302/1678424275.jpg,https://javct.net/v/huntb-518-rm,130,2026-07-08
BHG-048-RM,Plenty Sweet And Dense The Temptation Of A Longing W Busty Slut Sister [Uncensored L**ked],https://pic.javct.net/poster/20233001/1677296262.jpg,https://javct.net/v/bhg-048-rm,170,2026-07-08
MILK-197-RM,Female Sex Anal Development Date - Anal Remote Bike Walk X Super Stimulation Of The Prostate With A Thick Strap-on - Continuous Sex During Dry Orgasm - Ayaka Mochizuki [Uncensored L**ked],https://pic.javct.net/poster/20231912/1704907869.jpg,https://javct.net/v/milk-197-rm,140,2026-07-08
XVSR-281-RM,Asama Namase Interviewed The First Time After Amateur 's Pretending Shop Interview! ! [Uncensored L**ked],https://pic.javct.net/poster/10232025/1761778620.jpg,https://javct.net/v/xvsr-281-rm,120,2026-07-08
T28-473-RM,Fishing Stupid Uncle Diary - Madonna Otsuki Sound And Rainbow Trout And Trout Fishing Challenge! !~ [Uncensored L**ked],https://pic.javct.net/poster/04112026/a4df6fb6d6.jpg,https://javct.net/v/t28-473-rm,120,2026-07-08
NOSKN-023-RM,"Former Celebrity F Cup 29 Years Old, SSS Personality, Strongest Model With Beautiful Legs Sakura Misaki @ North Skins! [Creampie Document] [Uncensored L**ked]",https://pic.javct.net/poster/20231711/1700454959.jpg,https://javct.net/v/noskn-023-rm,130,2026-07-08
MEAT-044-RM,Jcup Rental Encouragement Exploitation Of Her Deca Milk Ji Po's Worries Encouragement Encouragement Fucking Cheering On A Woman Who Can't Refuse Ayumi-chan Ayumi-an [Uncensored L**ked],https://pic.javct.net/poster/20230302/1679112816.jpg,https://javct.net/v/meat-044-rm,160,2026-07-08
XRW-761-RM,A Big Ass Celebrity Wife Who Got Peeped By Her Housecleaner Hikari Sakuraba [Uncensored L**ked],https://pic.javct.net/poster/20220406/1656955249.jpg,https://javct.net/v/xrw-761-rm,127,2026-07-08
STARS-075-RM,Super Sensitive Clitoris Wandering And Writhing Limit Acme Mana Sakura [Uncensored L**ked],https://pic.javct.net/poster/20243105/1719749329.jpg,https://javct.net/v/stars-075-rm,135,2026-07-08
OIGS-049-RM,Rope Sickness Married Woman Masochistic Confession Of A Busty Married Woman Falling Into A Rope Slave Hazuki Wakamiya [Uncensored L**ked],https://pic.javct.net/poster/20230302/1678508507.jpg,https://javct.net/v/oigs-049-rm,103,2026-07-08
AKDL-077-RM,[AV you want to watch before going to sleep] Completely subjective. A handjob to induce sleep to induce a comfortable sleep. [Uncensored L**ked],https://pic.javct.net/poster/05192026/2ad70b03a0.jpg,https://javct.net/v/akdl-077-rm,122,2026-07-08
