code,title,image_url,page_url,views,date_scraped
SIRO-5688,Kintama Factory Sperm Mass Production Plump Ripe Beautiful Body [Iroha 35 years old] Boasts a man's bone with his sticky technique [First shot] AV application online AV experience shooting 2575,https://pic.javct.net/poster/05192026/42c8359ca8.jpg,https://javct.net/v/siro-5688,64,2026-06-18
FC2PPV-4922216,"[Uncensored/Complete amateur/Creampie/Squirting] Even though she's neat and clean, she has an ahegao face and has a thrilling orgasm regardless of her appearance. F-cup black hair, plump, 18 whole body convulsions orgasm. The best cum Creampie in a tight pussy for the first time in my life",https://pic.javct.net/poster/05192026/61b7907b24.jpg,https://javct.net/v/fc2ppv-4922216,21,2026-06-18
ABF-348-RM,Ultimate Ecstasy: A New Realm Of Pleasure That Courses Through Every Nerve— Remu Suzumori [Uncensored L**ked],https://pic.javct.net/poster/04112026/582624978e.jpg,https://javct.net/v/abf-348-rm,120,2026-06-18
PA-061826-100,"Housewife Pussy Encyclopedia, 179 Deluxe Edition",https://pic.javct.net/poster/05192026/849abd5835.jpg,https://javct.net/v/pa-061826-100,58,2026-06-18
FC2PPV-4922072,[Individual shooting/Erotic chiropractor] Neat and clean housewife who looks like 〇〇 If you touch me that deep... My reason collapses as my too sensitive body is massaged and creampie raw massage,https://pic.javct.net/poster/05192026/c3aaa67340.jpg,https://javct.net/v/fc2ppv-4922072,41,2026-06-18
328HMDNV-897,"A middle-aged married woman who spent her 20s as an idol, abandoned her peaceful days after marriage and had an affair with a man with a big dick, creampie sex, in search of stimulation.",https://pic.javct.net/poster/05192026/27a38fbee2.jpg,https://javct.net/v/328hmdnv-897,80,2026-06-18
1P-061826-001,"Human Meat Toilet! ~Office Lady Nami Sawaguchi: Dogeza, Creampie, and Fo**ed Apology~",https://pic.javct.net/poster/05192026/1bf9c65032.jpg,https://javct.net/v/1p-061826-001,64,2026-06-18
VOSS-109-RM,Because My Lonely Lady Is Bedridden Because Of A Cold I've Been Sweating Because Of My Feverishness And I'm So Hot That Big Tits Can Be Seen Through!Because It Is Too Erotic Dress I Am Excited While Thinking It Is Bad I Can Not Take My Eyes Off My Aunt What Will It Be On The Verge Of Onslaught! What?6 [Uncensored L**ked],https://pic.javct.net/poster/20241804/1716283428.jpg,https://javct.net/v/voss-109-rm,85,2026-06-18
BOBB-373-RM,"Enjoy Plenty Of Natural I Cup Beautiful Big Breasts With A Dazzling Smile In Milk Fetish Play! Boin ""Sakura Mita"" Box [Uncensored L**ked]",https://pic.javct.net/poster/20230104/1681447674.jpg,https://javct.net/v/bobb-373-rm,120,2026-06-18
FC2PPV-4922412,"I thought it was tuna, but it turned out to be a natural product.The chubby Rimu/Sume of the sushi restaurant lies to her husband at lunchtime and uses someone else's dick to ascend to heaven.",https://pic.javct.net/poster/05192026/1916bc5a5a.jpg,https://javct.net/v/fc2ppv-4922412,67,2026-06-18
ABF-360,Asuna Kawai's unusual love,https://pic.javct.net/poster/05192026/e172d59c98.jpg,https://javct.net/v/abf-360,120,2026-06-18
MILK-128-RM,"I Told This G-Cup Newlywed Lady Who Was About To Have Her Wedding That I Was Going To Give Her Some Special Treatment, And Instead Developed Her Sensual Abilities This Sensitive Big Tits Wife Was Lathered Up With Oil And Started To Feel Super Sensual, So I Plunged My Big Dick In Raw Totally Fucked, Cum Crazy Sex Mirai Sena [Uncensored L**ked]",https://pic.javct.net/poster/20212011/1638418771.jpg,https://javct.net/v/milk-128-rm,109,2026-06-18
KSBJ-042-RM,Hadaka's Wife Kanagi Mandarin Oranges [Uncensored L**ked],https://pic.javct.net/poster/04112026/1776136113.jpg,https://javct.net/v/ksbj-042-rm,124,2026-06-18
BOU-003-RM,"Monk Bar 3: Despite Being A Glamorous Wife, She Hasn't Had Sex In A While, So She Calms Herself Down With Alcohol And A Monk's Stick / She's Desperate For A Man... I'd Like To Keep Her Company With My Monk's Dick / The Lustful Beast Is Running Wild, I Need To Insert My Magic Wand Immediately / Her Huge Breasts That Make You Want To Knead Them And Her Youthful Face Are Dangerous Signs Of Lust [Uncensored L**ked]",https://pic.javct.net/poster/05192026/291954c0d5.jpg,https://javct.net/v/bou-003-rm,150,2026-06-18
URKK-099-RM,"Ever Since I Was Moved In As A Housekeeper In A Share House Full Of Female College Students, My Dick Was Shared With The Frustrated Girls Every Day And We Had A Lot Of Sex With Them! [Uncensored L**ked]",https://pic.javct.net/poster/20241703/1712374975.jpg,https://javct.net/v/urkk-099-rm,147,2026-06-18
REAL-593-RM,Demon Fucking Hell Best Strongest Fucking Corps Nonstop Shear Defeated Specials [Uncensored L**ked],https://pic.javct.net/poster/04112026/16ec95e1ae.jpg,https://javct.net/v/real-593-rm,240,2026-06-18
XVSR-243-RM,Debut Document Of Hadaka's Lady Heat Continent Ari Mori Ryo [Uncensored L**ked],https://pic.javct.net/poster/04112026/1776592855.jpg,https://javct.net/v/xvsr-243-rm,150,2026-06-18
VGD-181-RM,Girl Ririko Shiina That Talks Back Report Of AV Actress [Uncensored L**ked],https://pic.javct.net/poster/06032026/1775621367.jpg,https://javct.net/v/vgd-181-rm,140,2026-06-18
T28-423-RM,Busty CA Kanno Sayuki [Uncensored L**ked],https://pic.javct.net/poster/04112026/1776057791.jpg,https://javct.net/v/t28-423-rm,140,2026-06-18
URKK-098-RM,Two Big-breasted C**ldhood Friends Who Use My Room As A Hangout Place Have Sex With Me As Much As They Want And Ejaculate Every Day. [Uncensored L**ked],https://pic.javct.net/poster/20241902/1709957713.jpg,https://javct.net/v/urkk-098-rm,140,2026-06-18
T28-422-RM,Busty Sister And Incest Of Active That Too Erotic [Uncensored L**ked],https://pic.javct.net/poster/04112026/1775972482.jpg,https://javct.net/v/t28-422-rm,120,2026-06-18
FC2PPV-4904521-RM,"G cup, fired busty **pyjpx*jsps God style complete first shooting, crying, regret, NTR, deepthroat, big, neck, titty fuck, anal licking, gag, nostril licking, 545th individual shooting [Uncensored L**ked]",https://pic.javct.net/poster/05192026/1b250e47b1.jpg,https://javct.net/v/fc2ppv-4904521-rm,217,2026-06-18
MOND-247-RM,Longing Sister-in-Law And Reiko Kobayakawa [Uncensored L**ked],https://pic.javct.net/poster/20230205/1684555450.jpg,https://javct.net/v/mond-247-rm,120,2026-06-18
NEM-021-RM,True / Abnormal Intercourse Forty Mothers And Their Sons Four Nasty Mother Satisfying Loneliness With My Son Yumi Kazama [Uncensored L**ked],https://pic.javct.net/poster/04112026/62b845d35f.jpg,https://javct.net/v/nem-021-rm,120,2026-06-18
