code,title,image_url,page_url,views,date_scraped
UMAN-008,Forbidden NTR: Unable To Resist My Stepfather's Huge Dick... Immoral Caregiving,https://pic.javct.net/poster/07052026/14dfcc8af5.jpg,https://javct.net/v/uman-008,120,2026-07-10
SNOS-269-RM,"Called A High-class Escort Service And Miraculously Ran Into My Idol, Legendary Gravure Idol, Kiho Kanematsu, And We Ended Up Having A Secret Relationship... [Uncensored L**ked]",https://pic.javct.net/poster/07052026/6e762696a4.jpg,https://javct.net/v/snos-269-rm,160,2026-07-10
JUR-091-RM,"Intimate Sex ~My Sinful Self, Addicted To An Affair With A Student's Parent At School~ [Uncensored L**ked]",https://pic.javct.net/poster/07052026/44fefcf37c.jpg,https://javct.net/v/jur-091-rm,120,2026-07-10
VEMA-032-RM,My Friend's Busty Wife Is A Super-sexy And Perverted Home Tutor - Murakami Ryouko [Uncensored L**ked],https://pic.javct.net/poster/07052026/6fe3779856.jpg,https://javct.net/v/vema-032-rm,90,2026-07-10
NMSL-043-RM,Revenge R**e: I lost my mind due to the constant pleasure. Rei Kuroshima [Uncensored L**ked],https://pic.javct.net/poster/07052026/b405238353.jpg,https://javct.net/v/nmsl-043-rm,158,2026-07-10
JUR-803-RM,"Only I, The Class Representative, Know The Hidden Side Of Student Guidance Teacher Kanna-sensei. After School, I Spend My Days Engaging In Exhibitionism On School Grounds With The School's Most Serious Female Teacher. [Uncensored L**ked]",https://pic.javct.net/poster/07052026/e866f25402.jpg,https://javct.net/v/jur-803-rm,140,2026-07-10
UMAN-009,Sad News! My Beloved Wife Was Seduced By My Own Father.,https://pic.javct.net/poster/07052026/e2972b161a.jpg,https://javct.net/v/uman-009,120,2026-07-10
EUMD-001-RM,Hey sticky slut! J Cup Glamorous Female Boss Mion Hazuki Who Plays With The Older And Lower [Uncensored L**ked],https://pic.javct.net/poster/07052026/8319a9c46d.jpg,https://javct.net/v/eumd-001-rm,125,2026-07-10
DVRT-019-RM,The Day A Girl With Frigidity Was Destroyed By Uncle Pig Mitsuki Yuina [Uncensored L**ked],https://pic.javct.net/poster/20230302/1677820157.jpg,https://javct.net/v/dvrt-019-rm,120,2026-07-10
IPZZ-873-RM,"As An Idol Otaku, I Encountered A Pervert For The First Time During A Live Concert... Confused But Also Exhilarated, I Reached A Decadent Climax With An Irresistible Thrill. I Can't Forget The Pleasure I Felt Then, And Ever Since, I Wait For A Pervert On The Train Every Day. - Miina Tsuji [Uncensored L**ked]",https://pic.javct.net/poster/07052026/8ebae10834.jpg,https://javct.net/v/ipzz-873-rm,120,2026-07-10
GOJU-224-RM,Monster Mature Woman With Unlimited Libido Fuyu-san 54 Years Old Non-stop 6P Sex Explodes Everyday Lust! ! [Uncensored L**ked],https://pic.javct.net/poster/20233001/1677652039.jpg,https://javct.net/v/goju-224-rm,126,2026-07-10
BOBB-367-RM,"A Dental Assistant Who Pushes Jcup Colossal Tits Against Her Face Secretly Healing Boobs Service & Intercourse Treatment! Boin ""Suwon Misono"" Box6 [Uncensored L**ked]",https://pic.javct.net/poster/20230302/1678419927.jpg,https://javct.net/v/bobb-367-rm,120,2026-07-10
VRTM-399-RM,"""I Want To Massage Because It Is Good At Once"" Let Your Long-awaited Deca-lady Boss Who Is Flattering Defenseless Unprotected Coma And Grab It!All-you-can-eat Chewing Out Inside The Toasted Meat Toilet Bowl! [Uncensored L**ked]",https://pic.javct.net/poster/07052026/93a76b33bb.jpg,https://javct.net/v/vrtm-399-rm,150,2026-07-10
HZGD-201-RM,"I Went Home To Visit My Family And Met My Stepmom's Employee, A Sensual Colossal Tits Married Woman. Madoka Shizuki [Uncensored L**ked]",https://pic.javct.net/poster/20212709/1633426262.jpg,https://javct.net/v/hzgd-201-rm,118,2026-07-10
HTM-109B-RM,Mature woman's cheating is serious sex VOL.109 Part 2 Yuka (43) [Uncensored L**ked],https://pic.javct.net/poster/07052026/62128689ef.jpg,https://javct.net/v/htm-109b-rm,70,2026-07-10
BANK-113-RM,Busty Married Woman Onsen Dating 30 Years Old Mikuru With Colossal Tits And Natural J Cups [Uncensored L**ked],https://pic.javct.net/poster/20230302/1678427887.jpg,https://javct.net/v/bank-113-rm,125,2026-07-10
AVSA-321-RM,"103cm Glamorous Beautiful Big Tits Cosplayer! She Shakes Her Big Tits And Cums Over And Over Again With The Guys From Her Offline Club, And Has A Cum-bukkake Gangbang Creampie Sex! Aoi Hazuki [Uncensored L**ked]",https://pic.javct.net/poster/20243105/1719024545.jpg,https://javct.net/v/avsa-321-rm,120,2026-07-10
AKDL-079-RM,"[Big-breasted amateur] Super beautiful big-breasted I cup Hana, a lewd college girl who has only experienced it once but masturbates every day at home [Uncensored L**ked]",https://pic.javct.net/poster/05192026/cc2303c778.jpg,https://javct.net/v/akdl-079-rm,126,2026-07-10
TIKB-153-RM,"[Caution: Too Much Stiffness] Individual Shooting, Dirty Little Girl, Gal, Gonzo Kanatan Morisawa Kana [Uncensored L**ked]",https://pic.javct.net/poster/20233001/1677294695.jpg,https://javct.net/v/tikb-153-rm,115,2026-07-10
LULU-259-RM,"My Big-breasted Wife, Who Hasn't Had Sex Since She Gave Birth, Is Made To Change Into A Sailor Suit/school Swimsuit/bloomers/date Clothes/J-style Uniform By Her Neighbor's Erect Student, And Even Though She's Embarrassed, She Continues To Shake Her Hips In A Frenzy. They Were Having NTR Youth Sex With An Age Difference With Continuous Creampie. Mao Kurata [Uncensored L**ked]",https://pic.javct.net/poster/20231711/1701405597.jpg,https://javct.net/v/lulu-259-rm,160,2026-07-10
KATU-111-RM,Nipple Bing Bin Dirty Caregiver Huge Areola Big Breast Obscenity Anaconda Slut [Uncensored L**ked],https://pic.javct.net/poster/20233001/1677295240.jpg,https://javct.net/v/katu-111-rm,158,2026-07-10
HDKA-276-RM,Naked Housewife Hinata Kimizuka (30) Living In Shibuya Ward [Uncensored L**ked],https://pic.javct.net/poster/20233001/1676868082.jpg,https://javct.net/v/hdka-276-rm,120,2026-07-10
SNOS-258-RM,The Ultimate Heroine's Intense Fellatio And Massive Facial Cumshot: Kanna Seto [Uncensored L**ked],https://pic.javct.net/poster/07052026/60faee5565.jpg,https://javct.net/v/snos-258-rm,150,2026-07-10
VEC-575-RM,Brought A Beautiful Married Woman Who Works At A Part-Time Job Home To Creampie Sex Ayatsu Natsuyagi [Uncensored L**ked],https://pic.javct.net/poster/20233001/1677209174.jpg,https://javct.net/v/vec-575-rm,105,2026-07-10
