code,title,image_url,page_url,views,date_scraped
FC2PPV-4914933,Uncensored Highly educated beauty pageant winner ❤ College student E cup tall slender beautiful legs hairless pussy spread ~ Embarrassed to fully open her breasts and wet close-up close-up ♡ Vibrator masturbation ♡ Bathing blow job and cum in the mouth,https://pic.javct.net/poster/05192026/f9eace05ee.jpg,https://javct.net/v/fc2ppv-4914933,29,2026-06-06
ROYD-319-RM,"My Female Friend, Who Has A Boyfriend, Comes To Stay Over Every Night And Unconsciously Tries To Seduce Me, Leaving Me In A State Of Torment Because I Can't Muster The Courage To Make A Move. [Uncensored L**ked]",https://pic.javct.net/poster/05192026/15dd219bdd.jpg,https://javct.net/v/royd-319-rm,130,2026-06-06
FC2PPV-4910214,"Mahiro, an employee of the general affairs department who has learned how to play with fire (23 years old, E cup) ❤ I'll stir up the instincts that I can't hide anymore with my cock as a reward [Part 3 Gonzo] **pyjpx*jsps",https://pic.javct.net/poster/05192026/a10c993e6d.jpg,https://javct.net/v/fc2ppv-4910214,34,2026-06-06
FC2PPV-4915325,"In Nijisanji, Anju Katrina is big and beautiful, slender, fair-skinned, super slim body, legs are slender, and Nju has a beautiful butt, Koki Ecchi edition",https://pic.javct.net/poster/05192026/2aeadf3c35.jpg,https://javct.net/v/fc2ppv-4915325,72,2026-06-06
START-562-RM,"""I won't forgive you if you get an erection from someone other than me, right?"" We finally got together... We're living together in reverse celibacy! ? Extreme dick observation diary of bondage girlfriend and premature ejaculation boyfriend Mana Sakura [Uncensored L**ked]",https://pic.javct.net/poster/04112026/ef93442c27.jpg,https://javct.net/v/start-562-rm,143,2026-06-06
NACT-136,"[NTR] ""Am I Not Good Enough?"" Momose Himari, The Son's Wife, Falls For Her Father-in-law Who Has Become Incredibly Virile After Taking A Youth-rejuvenating Drug.",https://pic.javct.net/poster/05192026/8a9202d2ed.jpg,https://javct.net/v/nact-136,120,2026-06-06
MGMQ-168,A Young Wife Who Seduces And Devours Younger Submissive Men Is A Nymphomaniac Who Loves Anal Sex And Has Been Reverse-trained By Her Perverted Husband. - Akane Rei,https://pic.javct.net/poster/05192026/b1e8dad957.jpg,https://javct.net/v/mgmq-168,112,2026-06-06
DVAJ-746,"A Beautiful Lingerie Model Is Secretly Fitted With Aphrodisiac-coated Panties, Causing Her Pussy To Tingle And Become Soaking Wet, Her Lower Body Shaking Uncontrollably, And Her Shameless Ahegao Face As She Repeatedly Orgasms And Loses Control Of Her Bladder, Receiving 2800cc Of Cum From Her Drug-fueled Sex Training Session. - Mayu Hazuki",https://pic.javct.net/poster/05192026/ca48225b4e.jpg,https://javct.net/v/dvaj-746,137,2026-06-06
MGOLD-062,"Win Big With The Gacha, A Marriage Agency Specializing In Foreigners! Young! Big Breasts! Erotic! A Newlywed Life With The Cutest Asian Girl! ! Lisa",https://pic.javct.net/poster/05192026/afea80e499.jpg,https://javct.net/v/mgold-062,120,2026-06-06
DVAJ-744,"Whispering Dirty Talk ASMR And Sticky Slow Handjob Instructions Keep Your Erection Rock Hard The Whole Time. Teasing And Playing With Your Dick, Stopping Just Short Of The Climax Multiple Times, Pushing You To The Limits Of Ultimate Orgasm - Tomoe Hikari",https://pic.javct.net/poster/05192026/45bb30353a.jpg,https://javct.net/v/dvaj-744,150,2026-06-06
REAL-995,Fo**ed Apology Irrumatio: A Professional Woman Who Uses Her Throat To Deal With Unreasonable Complaints From Unreasonable Customers.,https://pic.javct.net/poster/05192026/48a5b0c165.jpg,https://javct.net/v/real-995,130,2026-06-06
HUNTC-561,"""What?! This Is Practical Training?"" I Enrolled In A Sports Instructor Vocational School And I'm The Only Guy! The Practical Training Involves Getting Incredibly Close To Girls In Tight, Sexy Outfits That Show Off Their Body Lines! And It's A Harem Orgy!",https://pic.javct.net/poster/05192026/a5d243b4b3.jpg,https://javct.net/v/huntc-561,110,2026-06-06
NACR-923-SUB,"Call Girls Are Strictly Prohibited From Having Sex! So If You Have A Favorite Customer, Seduce Him And Have Sex With Him Outside Of Work Hours. [English Subtitle]",https://pic.javct.net/poster/20253001/1741108261.jpg,https://javct.net/v/nacr-923-sub,118,2026-06-06
DOKS-672,"Amateur Girl's Penetrating Onahole Blowjob, Double The Pleasure With Mouth And Onahole, Massive Oral Ejaculation.",https://pic.javct.net/poster/05192026/ce5fbc4688.jpg,https://javct.net/v/doks-672,170,2026-06-06
HUNTC-428,"""Bring Home A New, Healthy Cock Quickly! Otherwise, I'll Eat Your Pussy!"" I'm Fo**ed To Bring Home Men For My Sexually Insatiable Roommate. My Cute And Kind Roommate Has An Abnormally High Sex Drive! If I Don't Bring A Man Home Every Day, I'll Either Get Attacked Or My Boyfriend Will...",https://pic.javct.net/poster/05192026/15437c5897.jpg,https://javct.net/v/huntc-428,160,2026-06-06
IPZZ-869-RM,Substitute Human Toilet: 10 Days Of Captivity With A Virile Yakuza Old Man Who Can't Stop Ejaculating No Matter How Many Times He Ejaculates [Uncensored L**ked],https://pic.javct.net/poster/05192026/715ce6ec96.jpg,https://javct.net/v/ipzz-869-rm,120,2026-06-06
FNS-216,Deceived By An Unscrupulous Therapist... Shrimp Warped Squirting Climax Esthetics That Makes You Cum So Much That Your Pussy Becomes Stupid Mia Kamiki,https://pic.javct.net/poster/05192026/7496085c1e.jpg,https://javct.net/v/fns-216,155,2026-06-06
MADV-197-RM,"First To Have Been Bullied So Shy Secretary Dispatch Two Rookie, I Put Away Wet [Uncensored L**ked]",https://pic.javct.net/poster/05192026/c6924a512a.jpg,https://javct.net/v/madv-197-rm,120,2026-06-06
KV-320,Pacifier Prep School 109: Tsubomi Mochizuki,https://pic.javct.net/poster/05192026/47cbedb306.jpg,https://javct.net/v/kv-320,138,2026-06-06
HSODA-121,"I Had Absolutely No Intention Of Doing That, But My Overly Self-conscious Mother Mistook My Gaze For ""lust"" And Forcibly Tries To Satisfy Her Sexual Needs Every Day.",https://pic.javct.net/poster/05192026/bf4d002e02.jpg,https://javct.net/v/hsoda-121,120,2026-06-06
FC2PPV-4914907,"[No] [Female body sharing session Chapter 19, Part 2] First black release 3P, H cup natural big breasts big ass office worker shared with black actor Unavoidable creampie in a healthy figure who takes care of two selfish cocks with his whole body [Overseas version] Bonus included",https://pic.javct.net/poster/05192026/42e99d6fd0.jpg,https://javct.net/v/fc2ppv-4914907,47,2026-06-06
10-060526-01,Structure Of Woman: Ai Nakano,https://pic.javct.net/poster/05192026/b19862eb94.jpg,https://javct.net/v/10-060526-01,51,2026-06-06
FC2PPV-4913395,[Individual shooting] Sex with a slender and beautiful office lady,https://pic.javct.net/poster/05192026/3a24e58c10.jpg,https://javct.net/v/fc2ppv-4913395,31,2026-06-06
AKDL-044-RM,"I love big punch lines, so I use a dedicated blowjob machine [bubbly drool, deep throat deep throat, swallowing semen, and careful slow blowjob] Miyu Nanase [Uncensored L**ked]",https://pic.javct.net/poster/04112026/1776652193.jpg,https://javct.net/v/akdl-044-rm,168,2026-06-06
