code,title,image_url,page_url,views,date_scraped
SDAB-159-RM,"The First And Best Violation Of School Rules ""First Vaginal Cum Shot At School"" The Most Naive And Naughty Girl Of The Year! Chika Sato [Uncensored L**ked]",https://pic.javct.net/poster/20240807/1722227239.jpg,https://javct.net/v/sdab-159-rm,135,2026-06-27
MISM-150-RM,Throat Back Devil Remodeling Super Pleasure!Deep Throat Dedicated De M Throat Ma ○ Ko Where All Meat Sticks Go Mad! [Uncensored L**ked],https://pic.javct.net/poster/20253001/1739778863.jpg,https://javct.net/v/mism-150-rm,170,2026-06-27
FC2PPV-4927418,"The most perverted woman in Japan is this one. ""I want you to break it harder and harder. This perverted gal is waiting with all her might in a pose that you should use.''",https://pic.javct.net/poster/05192026/6edb87fd3f.jpg,https://javct.net/v/fc2ppv-4927418,52,2026-06-27
FC2PPV-4926813,"[Face, creampie] The extremely erotic *san who was popular last time gave a sticky blowjob, and her beautiful big breasts and beautiful pussy were pressed against her boner and she ejaculated.",https://pic.javct.net/poster/05192026/30f82d771d.jpg,https://javct.net/v/fc2ppv-4926813,69,2026-06-27
FC2PPV-4926023,"[No] Beautiful F-cup big breasts with pure white smooth skin.She is tall and has long limbs, and she has an outstanding style⤴ Swallowing Creampie *Bonus High resolution",https://pic.javct.net/poster/05192026/3a3cdbb1be.jpg,https://javct.net/v/fc2ppv-4926023,52,2026-06-27
LOCK-012,"LOCK-ON@Moe ""I Only Came For A Job Interview..."" High School Girl Shiramiya Moe Becomes A Sex Toy For The Store Manager, Sexually Harassed And Fo**ed Into Live Sex Under The Guise Of Customer Service Practice.",https://pic.javct.net/poster/05192026/b7a84e2a29.jpg,https://javct.net/v/lock-012,115,2026-06-27
ABP-732-RM,Harushima Ryo's Finest Grasping Brush 21 A Virgin Assault To A Loving And Sexually Inviting Squirrel! [Uncensored L**ked],https://pic.javct.net/poster/05192026/df97b0fa24.jpg,https://javct.net/v/abp-732-rm,210,2026-06-27
OFES-048-RM,"Arai Rima, A Gal Idol Who Gives Amazing Fan Service, Gives Deep Throat Blowjobs And Facial Cum Showers, And Has An Off-camera Sex Photoshoot. [Uncensored L**ked]",https://pic.javct.net/poster/05192026/34f6e84676.jpg,https://javct.net/v/ofes-048-rm,150,2026-06-27
HJMO-714,"Only For Beautiful Female Workers Whose Job It Is To Look At Customers! The ""Never Look Away"" Subjective POV Blowjob Championship! Win A Prize If You Can Make The Customer Ejaculate Without Looking Away Within The Time Limit! If You Fail 3 Times, You'll Be Immediately Punished With A Fuck And Cumshot.",https://pic.javct.net/poster/05192026/9b16479d08.jpg,https://javct.net/v/hjmo-714,160,2026-06-27
OFES-053-RM,"""That Introverted Girl You Dumped Is Now A Busty Gravure Idol With Over 1 Million Followers, You Know? Lol"" - She Seduces Me With Her Voluptuous, Busty Body, Turning The Tables On Me, Even Though I Already Have A Girlfriend - Live-action Version [Uncensored L**ked]",https://pic.javct.net/poster/05192026/e0879c678b.jpg,https://javct.net/v/ofes-053-rm,100,2026-06-27
NMCH-016,"Not A Sex Friend, Not A Girlfriend. A Secretly Perverted, Big-assed Beauty With A Full-on L**i Body Having A Blast Filming Our Sex! Rion-chan, Izumi Rion",https://pic.javct.net/poster/05192026/f79840f03d.jpg,https://javct.net/v/nmch-016,90,2026-06-27
MOOR-060,Haruno Ando Was So Sexy After The Shoot! I Got Permission To Release The Footage That I Accidentally Recorded During The Launch Party.,https://pic.javct.net/poster/05192026/66a9b91dba.jpg,https://javct.net/v/moor-060,120,2026-06-27
ABP-741-RM,Absolute Iron Plate Situation 10 Complete Subjectivity! ! !Harumaki Ryo Gives A Very H 4 Situation [Uncensored L**ked],https://pic.javct.net/poster/05192026/5555e7b833.jpg,https://javct.net/v/abp-741-rm,170,2026-06-27
START-581-RM,This is the sex that lovers have for one year! ? Living together is very close to reality! The most naughty and cute Rei Kamiki becomes your girlfriend and fucks you! [Uncensored L**ked],https://pic.javct.net/poster/04112026/5572e11442.jpg,https://javct.net/v/start-581-rm,123,2026-06-27
HONB-492,"Older Guy Who Loves Girls: A Hall Of Fame Pick-Up Trip, Absolutely Beautiful Girl, Dangerous Sex 15",https://pic.javct.net/poster/05192026/79efa8543b.jpg,https://javct.net/v/honb-492,60,2026-06-27
AGMX-261,Pull It Out With Your Face!! Close-up Face-to-face Blowjob 3,https://pic.javct.net/poster/05192026/02b4804340.jpg,https://javct.net/v/agmx-261,94,2026-06-27
CHC-033,"Beautiful Girl Played With And Filmed Having Sex - Completely Submissive To An Old Man! Ami, Young Wife, Inamori Ami",https://pic.javct.net/poster/05192026/1a55c506af.jpg,https://javct.net/v/chc-033,89,2026-06-27
WTEX-017,Cosplay Support. Otaku-oji Creampie Bukkake Orgy I-cup Slime-breasted Cosplayer Miu Is Tricked Into An Erotically Filmed Raw Creampie Begging Dick-loving Girl! 1000 Consecutive Pistons With No Condom And Squirting Orgasms!,https://pic.javct.net/poster/05192026/e1e21f98fe.jpg,https://javct.net/v/wtex-017,130,2026-06-27
HODV-22078-RM,Are Your Balls Already Empty? A Sadistic Call Girl Drained Me Of All My Sperm All Night Long Until Morning. - Tsukino Kasumi [Uncensored L**ked],https://pic.javct.net/poster/05192026/fb896a6629.jpg,https://javct.net/v/hodv-22078-rm,140,2026-06-27
HONB-491,"Older Guy Who Loves Girls: A Hall Of Fame Pick-Up Trip, Absolutely Beautiful Girl, Dangerous Sex 14",https://pic.javct.net/poster/05192026/e5ae924ff1.jpg,https://javct.net/v/honb-491,57,2026-06-27
FC2PPV-4923369,[No] Top secret video of a former gravure idol with huge breasts having sex all day long Ana Kawai [High resolution with bonus] [24 hours limited sale],https://pic.javct.net/poster/05192026/974ba18e3d.jpg,https://javct.net/v/fc2ppv-4923369,132,2026-06-27
FSKI-003,"A Cute And Cute Schoolgirl Is The First To Experience 18 Cm Big Cock Of Ojisan! ""I'm Sorry!Big! ""While I Feel That I Have To Remove The Rubber Rubber Unexpectedly!School Girls Who Had Become A Prisoner Of The Big Dick In 93 Iki Of Rolled Up Maiden Ma ○ Co From The Dimension Stop",https://pic.javct.net/poster/05192026/597313c973.jpg,https://javct.net/v/fski-003,215,2026-06-27
DORI-019,"Paco Shooting No.19 I Made J ○ Who Was Addicted To The Pleasantness Of Raw Chin In The First Unauthorized Vaginal Cum Shot Begging ""Please Put It In With Ojisan's Chin Chin Raw ..."", And Also Vaginal Cum Shot In The Second Time !!",https://pic.javct.net/poster/05192026/f2fba7be58.jpg,https://javct.net/v/dori-019,91,2026-06-27
KSBJ-119,My Son's Daughter-in-law Was A Horny Woman From The Ground Up ... Maron Natsuki,https://pic.javct.net/poster/05192026/ae918fda69.jpg,https://javct.net/v/ksbj-119,120,2026-06-27
