code,title,image_url,page_url,views,date_scraped
HUNTC-441,"""Sorry For Making Fun Of You For Being A Virgin. Shall I Be Your Sex Practice Partner?"" My Stepsister, Who Used To Tease Me About Being A Bullied Virgin, Turns The Tables And Gives Me A Runaway, Non-stop, Relentless Piston Thrust That Keeps Me Cumming Again And Again!",https://pic.javct.net/poster/07052026/9aaf962415.jpg,https://javct.net/v/huntc-441,170,2026-07-13
FC2PPV-4937975,[Winner of National Competition] Divine visual Ballet prestigious school student Nano-chan 18 years old Over 85 minutes of 4K high-quality sex video including creampie without rubber * Only a few left,https://pic.javct.net/poster/07052026/c8f662765a.jpg,https://javct.net/v/fc2ppv-4937975,55,2026-07-13
FC2PPV-4937974,"[First shot] [Facial appearance] A slender beauty with beautiful breasts and a beautiful butt is made to cum with a big black cock for the first time, and is creampied and impregnated with SEX",https://pic.javct.net/poster/07052026/0bba441df7.jpg,https://javct.net/v/fc2ppv-4937974,31,2026-07-13
USAG-094,"Amateur Girl Takes On A Fixed Vibrator Blowjob Game!! She Wins A Prize If She Can Make A Man Ejaculate With Her Blowjob... But If She Cums First, She Gets A Follow-up Piston Fuck With Internal Ejaculation!!",https://pic.javct.net/poster/07052026/6b6e420564.jpg,https://javct.net/v/usag-094,126,2026-07-13
HUNTC-523,"Despite Being A Plain-looking Girl, Her First Sexual Experience Instantly Puts Her Number Of Partners At Five! A Plain-looking College Student Is Invited To Her First Orgy Party! While The Slutty Girls Have Sex As If It's The Most Natural Thing In The World, The Plain Girl Gets Swept Up In The Excitement And Becomes Addicted To Cocks, Ultimately Making Her Debut In A Massive Orgy!",https://pic.javct.net/poster/07052026/69faca9af4.jpg,https://javct.net/v/huntc-523,140,2026-07-13
APRG-006,"""You Can't Cum Yet!"" Near-miss Handjob! Instant Blowjob! Little Devil Office Lady Call Girl [G Cup] 2-day, 1-night Sex Filming With Cum Inside Oguri Misao",https://pic.javct.net/poster/07052026/46233aaa64.jpg,https://javct.net/v/aprg-006,124,2026-07-13
FC2PPV-4938028,"[No] In front of her rough dick boyfriend, a neat beauty is fucked with a big black dick and creampied in NTR [Overseas version] Bonus included",https://pic.javct.net/poster/07052026/7725345491.jpg,https://javct.net/v/fc2ppv-4938028,45,2026-07-13
BACJ-045-RM,Big Ass Older Sister Who Pistons Pistons Until The Ball Is Empty After Dense Straddling Berokisu Mana Nagase [Uncensored L**ked],https://pic.javct.net/poster/20233001/1676088262.jpg,https://javct.net/v/bacj-045-rm,143,2026-07-13
HUNTB-500-RM,"Unlimited Insertion With Anyone! Used Car Dealer Edition As Long As You Pay A Fixed Monthly Fee, You Can Ride As Many People (female) As You Like At The Used Car Dealer! Unlimited Firing! ? [Uncensored L**ked]",https://pic.javct.net/poster/20230302/1678424712.jpg,https://javct.net/v/huntb-500-rm,150,2026-07-13
YMDD-314-RM,To Yoko **ds' Younger Sister Shigaru Pien-chan Adhesion Document Kozue Fujita Who Only Knows How To Fill The Void With Creampie H [Uncensored L**ked],https://pic.javct.net/poster/20230302/1677901207.jpg,https://javct.net/v/ymdd-314-rm,150,2026-07-13
REAL-640-RM,Pole Blowjob Cum Drinking Heaven Fountain? [Uncensored L**ked],https://pic.javct.net/poster/05192026/facce8c06f.jpg,https://javct.net/v/real-640-rm,130,2026-07-13
BONY-037-RM,Pet With A Horse Stimulant Is Waiting For You Today. H Cup Yoga Instructor Edition Iori Tsukimi [Uncensored L**ked],https://pic.javct.net/poster/20233001/1675999045.jpg,https://javct.net/v/bony-037-rm,120,2026-07-13
ONEZ-162-RM,About The Matter That I Was A Bizarre Friend When I Called Deriherg When I Was A Student Minami Aya [Uncensored L**ked],https://pic.javct.net/poster/07052026/344cc5e894.jpg,https://javct.net/v/onez-162-rm,120,2026-07-13
REAL-637-RM,Very Blow Job Cum Heaven Natsume Airi [Uncensored L**ked],https://pic.javct.net/poster/05192026/e2a433ba0d.jpg,https://javct.net/v/real-637-rm,120,2026-07-13
BGN-049-RM,Newcomer Prestige Exclusive Debut Kawai Asuna Miracle Natural Breast H Cup [Uncensored L**ked],https://pic.javct.net/poster/07052026/e4645df9d5.jpg,https://javct.net/v/bgn-049-rm,205,2026-07-13
MUDR-147-RM,Young Girl Is Enthralled With Men's Crotches... Impregnation Party Aoi Nakajo [Uncensored L**ked],https://static.javct.net/poster/mudr-147.jpg,https://javct.net/v/mudr-147-rm,159,2026-07-13
NNPJ-432-RM,"* Yakekuso Cheating Video ""I Was Cheating On My Husband ..."" Picking Up Girls And Forgetting Their Husbands With All Their Might, A Beautiful Half-wife Who Goes Crazy The Theory That A Weak Woman Is Crazy [Uncensored L**ked]",https://pic.javct.net/poster/07052026/764e5ab3dd.jpg,https://javct.net/v/nnpj-432-rm,120,2026-07-13
MSFH-039-RM,Gear Change P To M Hirose Riona Who Repeats Licking From High Speed To Low Speed [Uncensored L**ked],https://pic.javct.net/poster/01202026/1772407902.jpg,https://javct.net/v/msfh-039-rm,140,2026-07-13
MDTM-882-RM,Hinako Mori: The Legend Of A God-Tier Superstar Complete Memorial BEST [Uncensored L**ked],https://pic.javct.net/poster/07052026/6ab225fea2.jpg,https://javct.net/v/mdtm-882-rm,220,2026-07-13
FC2PPV-4936834,"A gentle JD who has high ideals and can't find a boyfriend, in fact, she loves sex so much that she even applied for sex, she is so sensitive that she squirts and convulses repeatedly, a rich sex video that raises the ideal of body compatibility again [high-quality bonus]",https://pic.javct.net/poster/07052026/ac1a2aad6c.jpg,https://javct.net/v/fc2ppv-4936834,40,2026-07-13
FTHTD-222,"""Oh No, It's My Fault? My Aunt Is In Trouble."" I Was Getting A Massage At The Home Beauty Salon Run By My Aunt, Who Is A Former Slut With Big Boobs, And My Crotch Reacted In Full Force. A Dick Writhing In Agony With Long Hair Entangled In Bare Legs. I Want You To Insert It Quickly, But Even If You Are So Impatient... Mayu Suzuki",https://pic.javct.net/poster/07052026/4ecfb49e6a.jpg,https://javct.net/v/fthtd-222,124,2026-07-13
FTHTD-206,"[Live-action Adaptation] Onii-san, Would You Like To Have Tea With Us? Starring Yui Tenma/Rika Tsubaki Original Work Fumiki Morizuki",https://pic.javct.net/poster/07052026/70c8780388.jpg,https://javct.net/v/fthtd-206,105,2026-07-13
FTHTD-215,I Stopped Time To Suck My Favorite Dick.,https://pic.javct.net/poster/07052026/3efbbf0b6e.jpg,https://javct.net/v/fthtd-215,122,2026-07-13
CJOB-208,Practical For Masturbation! The Ultimate Close-up Blowjob Compilation Featuring Only The Cock Being Sucked And Licked! 35 Carefully Selected Scenes.,https://pic.javct.net/poster/07052026/52c621cc41.jpg,https://javct.net/v/cjob-208,240,2026-07-13
