code,title,image_url,page_url,views,date_scraped
CEMD-858,A lewd and masochistic mature woman - First anal release & 2-hole 3P sex - Saki Aikawa,https://pic.javct.net/poster/05192026/e5b960fa64.jpg,https://javct.net/v/cemd-858,154,2026-06-21
BRV-159-RM,The Science of Agony - Masochistic Woman's Encyclopedia NEO 9 [Uncensored L**ked],https://pic.javct.net/poster/05192026/2be3d1ab04.jpg,https://javct.net/v/brv-159-rm,118,2026-06-21
COU-011-RM,"""Don't Put It In..."" My Wife's Mother Is So Sexy I Ended Up Having Creampie Sex With Her. 2-disc Set [Uncensored L**ked]",https://pic.javct.net/poster/05192026/22fc8c32d7.jpg,https://javct.net/v/cou-011-rm,240,2026-06-21
REAL-580-RM,S&M And Relentless Orgasms Hina Kinami [Uncensored L**ked],https://pic.javct.net/poster/20221202/1647307338.jpg,https://javct.net/v/real-580-rm,143,2026-06-21
MXGS-795-RM,Customs Channel 42 Nozomi Aso [Uncensored L**ked],https://pic.javct.net/poster/05192026/df5394a56d.jpg,https://javct.net/v/mxgs-795-rm,120,2026-06-21
EMU-028-RM,"I'll Forever Slut Strongest Of Riko Tachibana, Retirement, Special Hell Slut! [Uncensored L**ked]",https://pic.javct.net/poster/05192026/09c169b19c.jpg,https://javct.net/v/emu-028-rm,120,2026-06-21
MXGS-703-RM,Aso Rare × Bondage QUEEN [Uncensored L**ked],https://pic.javct.net/poster/05192026/b26ee6a0cc.jpg,https://javct.net/v/mxgs-703-rm,125,2026-06-21
REAL-629,Fast Pleasure Handjob Dirty Blame M Man K**ling Of The Strongest Slut Technician M Erogenous Nishinippori Bizarre Clinic Active Enrolled Miss Matsushima Nami,https://pic.javct.net/poster/05192026/1fd18bbee9.jpg,https://javct.net/v/real-629,125,2026-06-21
JBD-280-RM,Sailor Uniform And Bondage Rope... Ichika Matsumoto [Uncensored L**ked],https://pic.javct.net/poster/20221202/1648797604.jpg,https://javct.net/v/jbd-280-rm,116,2026-06-21
XRW-658-RM,"Aphrodisiac Sprightly Caught Inside And Out!Nonstop 4 Hour Special!Chirami Sakura, Mariana Yukizuki, Mio Kimishima, Rika Goto [Uncensored L**ked]",https://pic.javct.net/poster/05192026/17c2f69894.jpg,https://javct.net/v/xrw-658-rm,240,2026-06-21
IESP-683-RM,Rara Kudo In Open Season For Lesbians: I Fell In Love With The Cameraman's Cousin [Uncensored L**ked],https://static.javct.net/poster/iesp-683.jpg,https://javct.net/v/iesp-683-rm,122,2026-06-21
GVH-848-RM,Restraining A Masochistic Man And Imprinting Pleasure On Him With Ejaculation Control And Follow-up Male Cum! Titjob GOD Bondage Slut! Yoshine Yuria [Uncensored L**ked],https://pic.javct.net/poster/05192026/25f7ad6350.jpg,https://javct.net/v/gvh-848-rm,160,2026-06-21
LUCY-027-RM,"The Secret Of My Female Boss: In Private, She Was A Submissive Masochistic Woman - Saki Usumi [Uncensored L**ked]",https://pic.javct.net/poster/05192026/45dec560ec.jpg,https://javct.net/v/lucy-027-rm,116,2026-06-21
FC2PPV-4901451,"[200,000 followers collapse] A popular Hcup cosplayer who regularly posts extreme posts at large-scale events. An extremely intense photo shoot in which she challenged herself due to default on debt repayments. Massive molestation and misdeed while jumping with the whites of her eyes peeled [13",https://pic.javct.net/poster/05192026/e086d49f67.jpg,https://javct.net/v/fc2ppv-4901451,61,2026-06-21
LUCY-027,"The Secret Of My Female Boss: In Private, She Was A Submissive Masochistic Woman - Saki Usumi",https://pic.javct.net/poster/05192026/45dec560ec.jpg,https://javct.net/v/lucy-027,116,2026-06-21
FAX-239-RM,Lust Battleground: Mother & Daughter Passed Around by 50 Men [Uncensored L**ked],https://pic.javct.net/poster/20221904/1652660133.jpg,https://javct.net/v/fax-239-rm,125,2026-06-21
GVH-848,Restraining A Masochistic Man And Imprinting Pleasure On Him With Ejaculation Control And Follow-up Male Cum! Titjob GOD Bondage Slut! Yoshine Yuria,https://pic.javct.net/poster/05192026/25f7ad6350.jpg,https://javct.net/v/gvh-848,160,2026-06-21
NACT-129-RM,"A Voyeuristic Masochistic Tutor Witnesses Her Student's Father's Hardcore S&M Mating And Becomes Aroused. With Her Secret Exposed, The College Student's True Nature Is Revealed Through Cotton Rope And A Collar In This Complete Record Of Her Training. (Rin Ouka) [Uncensored L**ked]",https://pic.javct.net/poster/05192026/8389d4f28e.jpg,https://javct.net/v/nact-129-rm,119,2026-06-21
DV-339-RM,Kaede Matsushima Obscenity Model [Uncensored L**ked],https://pic.javct.net/poster/05192026/9988b49709.jpg,https://javct.net/v/dv-339-rm,120,2026-06-21
NACT-129,"A Voyeuristic Masochistic Tutor Witnesses Her Student's Father's Hardcore S&M Mating And Becomes Aroused. With Her Secret Exposed, The College Student's True Nature Is Revealed Through Cotton Rope And A Collar In This Complete Record Of Her Training. (Rin Ouka)",https://pic.javct.net/poster/05192026/8389d4f28e.jpg,https://javct.net/v/nact-129,119,2026-06-21
EBOD-494,Tits I Cup Fluent Bonn Of The Original Foreign Models!Kyu!Bondage! Sasaki Erie,https://pic.javct.net/poster/04112026/9ca67fe25e.jpg,https://javct.net/v/ebod-494,120,2026-06-21
JUC-605,Tortoise Shell Bride 2 ~A young beautiful wife who feels tied down by her father-in-law~ Satomi Suzuki,https://pic.javct.net/poster/04112026/a94227afdb.jpg,https://javct.net/v/juc-605,118,2026-06-21
MKMP-062,Undercover Investigator Nishikawa Yui,https://pic.javct.net/poster/04112026/44df8e9fcf.jpg,https://javct.net/v/mkmp-062,115,2026-06-21
NFDM-244,Circle Women Bang Away At A Man's Ass Gather,https://pic.javct.net/poster/04112026/b2809d8c12.jpg,https://javct.net/v/nfdm-244,125,2026-06-21
