code,title,image_url,page_url,views,date_scraped
SRS-077-RM,Yariman Document Yui-chan Caregiver File.14 Abduction Video That Seems To Have Prejudice To Those In Nursing Career. [Uncensored L**ked],https://pic.javct.net/poster/05192026/cbb5df9769.jpg,https://javct.net/v/srs-077-rm,135,2026-06-20
FC2PPV-4923569,[Facial cumshot x cum swallowing] 22 minutes and 7 shots of 170cm tall (8 head and body) beautiful woman Ten giving her two things with semen,https://pic.javct.net/poster/05192026/c42e89ba86.jpg,https://javct.net/v/fc2ppv-4923569,21,2026-06-20
GQN-012,"[Genuine Cumshot & Raw Outing] ""If It's A Raw Vagina, You Don't Need Clothes, Right?"" Yuika Onosaka's Naked Cumshot Apartment",https://pic.javct.net/poster/05192026/f20fd114f3.jpg,https://javct.net/v/gqn-012,155,2026-06-20
GUN-788,"Lick It Until It's Slippery And Shiny, The Soles Of The Feet And Saliva",https://pic.javct.net/poster/05192026/e3a1c2c7c7.jpg,https://javct.net/v/gun-788,120,2026-06-20
ONEZ-138-RM,"Do Strike Baseball Team Manager Uniform Girls.Mr. Tsuyoshi Tsuyoshi, President Of Yuki Morning [Uncensored L**ked]",https://pic.javct.net/poster/05192026/9eb182c804.jpg,https://javct.net/v/onez-138-rm,120,2026-06-20
SRS-074-RM,"A Slut Documentary Ruka-chan (Age 21) A Flower Arrangement Assistant File.12 A Sadistic Gal With Amazing Technique And An Ejaculation Fetish When She's Surrounded By Cocks, She Gets Super Excited!! [Uncensored L**ked]",https://pic.javct.net/poster/05192026/861fcd50f0.jpg,https://javct.net/v/srs-074-rm,125,2026-06-20
FC2PPV-4922764,Shafneet from Tochigi endless orgasm fuck and creampie bukkake on the verge of techno break,https://pic.javct.net/poster/05192026/21de407421.jpg,https://javct.net/v/fc2ppv-4922764,72,2026-06-20
MIGD-587-SUB,Dream Woman Vol.95 Natsume Saiharu [English Subtitle],https://pic.javct.net/poster/04112026/92a1ca26c2.jpg,https://javct.net/v/migd-587-sub,180,2026-06-20
RCT-315-RM,AV DEBUT Rico Campaign Miyase Girl Of The Year 2010 178cm9 Tall Head And Body [Uncensored L**ked],https://pic.javct.net/poster/05192026/d7e1d3235d.jpg,https://javct.net/v/rct-315-rm,130,2026-06-20
SRS-070-RM,Shirout Hunter 2 · 47 [Uncensored L**ked],https://pic.javct.net/poster/05192026/05dc00afbb.jpg,https://javct.net/v/srs-070-rm,125,2026-06-20
T28-535,I Will Not Stop Absolutely No Matter How Many Times I Go!Beautiful Girl Pursuit Piston Continuous Cum,https://pic.javct.net/poster/05192026/c0b39da997.jpg,https://javct.net/v/t28-535,165,2026-06-20
TOTK-022-RM,"A Stunningly Beautiful Woman With A Top-tier Penis, Unleashing Her Primal Instincts And Getting A Full Erection For Anal Fucking. [Uncensored L**ked]",https://pic.javct.net/poster/05192026/f03a6e4fb5.jpg,https://javct.net/v/totk-022-rm,275,2026-06-20
XRW-693-RM,Female Teacher Bukkake Gangbang Receives A Large Amount Of Semen Of The Student In The Face! [Uncensored L**ked],https://pic.javct.net/poster/05192026/7c6db128d0.jpg,https://javct.net/v/xrw-693-rm,120,2026-06-20
SRS-066-RM,"Amateur Hunter 2, 45 [Uncensored L**ked]",https://pic.javct.net/poster/05192026/0b58aa34f1.jpg,https://javct.net/v/srs-066-rm,130,2026-06-20
TNIK-027-RM,Virginity Taken! Perverted Sex With A Sexy Mature Woman Who Lives In The Neighborhood - Kotomiya Mami [Uncensored L**ked],https://pic.javct.net/poster/05192026/6f2e5bd491.jpg,https://javct.net/v/tnik-027-rm,120,2026-06-20
TKOU-023-RM,Bukkake Gokkun Training Center ~A Record Of Experiments On Masochistic Women Falling Into Pleasure~ Shiramiya Moe [Uncensored L**ked],https://pic.javct.net/poster/05192026/d4dd1a2375.jpg,https://javct.net/v/tkou-023-rm,129,2026-06-20
SRS-064-RM,Bimbo Document Rio-chan 19-year-old Esthetician (no Nuqui) File.05 [Uncensored L**ked],https://pic.javct.net/poster/05192026/5ae5aba53b.jpg,https://javct.net/v/srs-064-rm,135,2026-06-20
MVSD-072-RM,Risa Murakami Pussy Outback And Want To Drink [Uncensored L**ked],https://pic.javct.net/poster/05192026/94a2c9a721.jpg,https://javct.net/v/mvsd-072-rm,190,2026-06-20
SRS-065-RM,Bimbo Document Emily 22-year-old Girl Bar Work File.06 [Uncensored L**ked],https://pic.javct.net/poster/05192026/9cf83b3bc4.jpg,https://javct.net/v/srs-065-rm,130,2026-06-20
EBOD-466-RM,Ban Sss-body Pies Authenticity Shinozaki Yu [Uncensored L**ked],https://pic.javct.net/poster/20230207/1689293582.jpg,https://javct.net/v/ebod-466-rm,120,2026-06-20
TOTK-022,"A Stunningly Beautiful Woman With A Top-tier Penis, Unleashing Her Primal Instincts And Getting A Full Erection For Anal Fucking.",https://pic.javct.net/poster/05192026/f03a6e4fb5.jpg,https://javct.net/v/totk-022,275,2026-06-20
SRS-062-RM,Bimbo Document Ruri-chan (20) Beauty-based Professional Student File.04 [Uncensored L**ked],https://pic.javct.net/poster/05192026/388fe8b58a.jpg,https://javct.net/v/srs-062-rm,135,2026-06-20
SMKD-010,"Complete Coma - 4 People - Publishing Proofreader Part-timer (19) / Cheerleading Club Member (21) / Bartender Apprentice (20) / Dance Club Member (1●) All Internal Ejaculation, Sleepwalking Seconds",https://pic.javct.net/poster/05192026/f1259188e4.jpg,https://javct.net/v/smkd-010,205,2026-06-20
SYKH-079-RM,"""Standing Wife"" Class B Mature Woman Megumi 40 Years Old [Uncensored L**ked]",https://pic.javct.net/poster/20230206/1686974514.jpg,https://javct.net/v/sykh-079-rm,110,2026-06-20
