code,title,image_url,page_url,views,date_scraped
SRS-070-RM,Shirout Hunter 2 · 47 [Uncensored L**ked],https://pic.javct.net/poster/05192026/05dc00afbb.jpg,https://javct.net/v/srs-070-rm,125,2026-06-17
T28-535,I Will Not Stop Absolutely No Matter How Many Times I Go!Beautiful Girl Pursuit Piston Continuous Cum,https://pic.javct.net/poster/05192026/c0b39da997.jpg,https://javct.net/v/t28-535,165,2026-06-17
TOTK-022-RM,"A Stunningly Beautiful Woman With A Top-tier Penis, Unleashing Her Primal Instincts And Getting A Full Erection For Anal Fucking. [Uncensored L**ked]",https://pic.javct.net/poster/05192026/f03a6e4fb5.jpg,https://javct.net/v/totk-022-rm,275,2026-06-17
XRW-693-RM,Female Teacher Bukkake Gangbang Receives A Large Amount Of Semen Of The Student In The Face! [Uncensored L**ked],https://pic.javct.net/poster/05192026/7c6db128d0.jpg,https://javct.net/v/xrw-693-rm,120,2026-06-17
SRS-066-RM,"Amateur Hunter 2, 45 [Uncensored L**ked]",https://pic.javct.net/poster/05192026/0b58aa34f1.jpg,https://javct.net/v/srs-066-rm,130,2026-06-17
TNIK-027-RM,Virginity Taken! Perverted Sex With A Sexy Mature Woman Who Lives In The Neighborhood - Kotomiya Mami [Uncensored L**ked],https://pic.javct.net/poster/05192026/6f2e5bd491.jpg,https://javct.net/v/tnik-027-rm,120,2026-06-17
TKOU-023-RM,Bukkake Gokkun Training Center ~A Record Of Experiments On Masochistic Women Falling Into Pleasure~ Shiramiya Moe [Uncensored L**ked],https://pic.javct.net/poster/05192026/d4dd1a2375.jpg,https://javct.net/v/tkou-023-rm,129,2026-06-17
SRS-064-RM,Bimbo Document Rio-chan 19-year-old Esthetician (no Nuqui) File.05 [Uncensored L**ked],https://pic.javct.net/poster/05192026/5ae5aba53b.jpg,https://javct.net/v/srs-064-rm,135,2026-06-17
MVSD-072-RM,Risa Murakami Pussy Outback And Want To Drink [Uncensored L**ked],https://pic.javct.net/poster/05192026/94a2c9a721.jpg,https://javct.net/v/mvsd-072-rm,190,2026-06-17
SRS-065-RM,Bimbo Document Emily 22-year-old Girl Bar Work File.06 [Uncensored L**ked],https://pic.javct.net/poster/05192026/9cf83b3bc4.jpg,https://javct.net/v/srs-065-rm,130,2026-06-17
EBOD-466-RM,Ban Sss-body Pies Authenticity Shinozaki Yu [Uncensored L**ked],https://pic.javct.net/poster/20230207/1689293582.jpg,https://javct.net/v/ebod-466-rm,120,2026-06-17
TOTK-022,"A Stunningly Beautiful Woman With A Top-tier Penis, Unleashing Her Primal Instincts And Getting A Full Erection For Anal Fucking.",https://pic.javct.net/poster/05192026/f03a6e4fb5.jpg,https://javct.net/v/totk-022,275,2026-06-17
SRS-062-RM,Bimbo Document Ruri-chan (20) Beauty-based Professional Student File.04 [Uncensored L**ked],https://pic.javct.net/poster/05192026/388fe8b58a.jpg,https://javct.net/v/srs-062-rm,135,2026-06-17
SMKD-010,"Complete Coma - 4 People - Publishing Proofreader Part-timer (19) / Cheerleading Club Member (21) / Bartender Apprentice (20) / Dance Club Member (1●) All Internal Ejaculation, Sleepwalking Seconds",https://pic.javct.net/poster/05192026/f1259188e4.jpg,https://javct.net/v/smkd-010,205,2026-06-17
SYKH-079-RM,"""Standing Wife"" Class B Mature Woman Megumi 40 Years Old [Uncensored L**ked]",https://pic.javct.net/poster/20230206/1686974514.jpg,https://javct.net/v/sykh-079-rm,110,2026-06-17
TKOU-023,Bukkake Gokkun Training Center ~A Record Of Experiments On Masochistic Women Falling Into Pleasure~ Shiramiya Moe,https://pic.javct.net/poster/05192026/d4dd1a2375.jpg,https://javct.net/v/tkou-023,129,2026-06-17
TNIK-027,Virginity Taken! Perverted Sex With A Sexy Mature Woman Who Lives In The Neighborhood - Kotomiya Mami,https://pic.javct.net/poster/05192026/6f2e5bd491.jpg,https://javct.net/v/tnik-027,120,2026-06-17
SDAB-140-RM,"Juice, Sweat, Tide And Sperm Burst From Your Fresh, Fresh Body! Doppyun 7 Shots! !! A Naive Girl From The Countryside! Miko Tanaka [Uncensored L**ked]",https://pic.javct.net/poster/05192026/436cb0eb95.jpg,https://javct.net/v/sdab-140-rm,130,2026-06-17
MIGD-634,Anal FUCK Cum Bukkake! Konishi Yu,https://pic.javct.net/poster/05192026/c19c04c1d1.jpg,https://javct.net/v/migd-634,120,2026-06-17
SRS-056-RM,Amateur Hunter 241 [Uncensored L**ked],https://pic.javct.net/poster/20241703/1711963022.jpg,https://javct.net/v/srs-056-rm,120,2026-06-17
STARS-048-RM,101 Shooting Bucksmanship Amateur Male Super Super Crown Genuine Semen Takeda Yume [Uncensored L**ked],https://pic.javct.net/poster/20243105/1719525185.jpg,https://javct.net/v/stars-048-rm,135,2026-06-17
KTSB-011-RM,"Sensitive Sensitive Akari Who Felt Even At The Fingertips Of Molest Is Not Only Skirt, But Please Be Up To The Inside Of ""Ma · Ko!""Duskabe Molesting Girl Who Begs For Begging Inside! [Uncensored L**ked]",https://pic.javct.net/poster/05192026/9ea2c55a5b.jpg,https://javct.net/v/ktsb-011-rm,150,2026-06-17
MIGD-630,Black Companies Kawamura Cum Maya,https://pic.javct.net/poster/05192026/8ec633a6aa.jpg,https://javct.net/v/migd-630,120,2026-06-17
857OMG-031-RM,"Maybe I was filled with sexual desire for a secret meeting with an idol who sent me a DM, and from the moment I inserted her, I felt like I was melting and went crazy, and I didn't hesitate to cum all over her cute sparkling face... [Uncensored L**ked]",https://pic.javct.net/poster/05192026/0d27c7a620.jpg,https://javct.net/v/857omg-031-rm,84,2026-06-17
