code,title,image_url,page_url,views,date_scraped
1P-061826-001,"Human Meat Toilet! ~Office Lady Nami Sawaguchi: Dogeza, Creampie, and Fo**ed Apology~",https://pic.javct.net/poster/05192026/1bf9c65032.jpg,https://javct.net/v/1p-061826-001,64,2026-06-18
ABF-360,Asuna Kawai's unusual love,https://pic.javct.net/poster/05192026/e172d59c98.jpg,https://javct.net/v/abf-360,120,2026-06-18
CADV-667-RM,Daughter Girl Metamorphosis Poisoning 8 Hours! ! [Uncensored L**ked],https://pic.javct.net/poster/04112026/f495c6f959.jpg,https://javct.net/v/cadv-667-rm,480,2026-06-18
ABF-361,A liberal arts girl who indulges in the wet sex of a middle-aged man. Sticky high humidity silent sex Nanami Nakamori,https://pic.javct.net/poster/05192026/6a1c4a78da.jpg,https://javct.net/v/abf-361,120,2026-06-18
SRS-072-RM,Yariman Document Rinka (21) Former Bus Guide · Currently Unemployed File.10 [Uncensored L**ked],https://pic.javct.net/poster/05192026/e7b717b676.jpg,https://javct.net/v/srs-072-rm,135,2026-06-18
326FCT-222-RM,"[Main story] Riku-chan, a C-cup girl who looks good with a short cut, whom I met on a certain SNS site, was a viewer of Gonzo videos, and when I negotiated for a photo shoot, she let me shoot her with a big creampie lol [Uncensored L**ked]",https://pic.javct.net/poster/05192026/f3081917e7.jpg,https://javct.net/v/326fct-222-rm,93,2026-06-18
ONED-557-RM,Shou Nishino Sex At School To ~Tsu Barely [Uncensored L**ked],https://pic.javct.net/poster/05192026/39a1c76742.jpg,https://javct.net/v/oned-557-rm,120,2026-06-18
MIDD-589-RM,Shou Nishino Best For Masturbation [Uncensored L**ked],https://pic.javct.net/poster/05192026/c89e9ead70.jpg,https://javct.net/v/midd-589-rm,120,2026-06-18
FC2PPV-4921544,Amelia Watson with her chubby thighs did some serious clear dildo masturbation with plenty of juice,https://pic.javct.net/poster/05192026/7777eacafe.jpg,https://javct.net/v/fc2ppv-4921544,49,2026-06-18
326FCT-223-RM,"[Main story] Yuzu-chan is so young, but she cries out and cries repeatedly. Her gestures and attitude are appropriate for her age. Creampie sex video shoot. [Uncensored L**ked]",https://pic.javct.net/poster/05192026/98cfd4ed7a.jpg,https://javct.net/v/326fct-223-rm,100,2026-06-18
300MIUM-1369-RM,"[Academia Affair] A secret meeting with a dental assistant who has a cute face and is too naughty, creampies, black strokes, beautiful legs, and squeezes her to the limit in an erotic cowgirl position.The position is reversed from when she was at work.A raw sex affair where she is blamed by a sweet sadistic slut [Married man (dental director) x single woman (dental assistant)] case.24 [Uncensored L**ked]",https://pic.javct.net/poster/05192026/24f4c80c6d.jpg,https://javct.net/v/300mium-1369-rm,82,2026-06-18
KYMI-032-RM,Pitacos W Slut [Uncensored L**ked],https://pic.javct.net/poster/20230206/1686976179.jpg,https://javct.net/v/kymi-032-rm,129,2026-06-18
FOCS-087-RM,"Beautiful Busty 148cm Plain Cosplayer I Couldn't Say No To My Kimoota Fathers' Insults, And I Woke Up To A Creampie Orgy! Saki Sakura [Uncensored L**ked]",https://pic.javct.net/poster/20221108/1663305293.jpg,https://javct.net/v/focs-087-rm,120,2026-06-18
TIKB-221-RM,"Infiltrating A Photoshoot Featuring Busty, Voluptuous Cosplayers Having Unprotected Sex And Cumming Inside! Their Lust Is On Full Display, And They're Addicted To Cock. [Uncensored L**ked]",https://pic.javct.net/poster/05192026/3e66aef87d.jpg,https://javct.net/v/tikb-221-rm,134,2026-06-18
801SKEJ-075-RM,Satsuki (neat big breasts I cup) [Uncensored L**ked],https://pic.javct.net/poster/05192026/275f00a472.jpg,https://javct.net/v/801skej-075-rm,76,2026-06-18
MIGD-644,Tremendous Tongue On Fire Cum Sakuragi Yuki Sound,https://pic.javct.net/poster/05192026/2090824771.jpg,https://javct.net/v/migd-644,180,2026-06-18
COSQ-12-RM,Pretty Soldier Sailor Heroine Kotone Amamiya [Uncensored L**ked],https://pic.javct.net/poster/05192026/e6873a9ba6.jpg,https://javct.net/v/cosq-12-rm,120,2026-06-18
300MIUM-1369,"[Academia Affair] A secret meeting with a dental assistant who has a cute face and is too naughty, creampies, black strokes, beautiful legs, and squeezes her to the limit in an erotic cowgirl position.The position is reversed from when she was at work.A raw sex affair where she is blamed by a sweet sadistic slut [Married man (dental director) x single woman (dental assistant)] case.24",https://pic.javct.net/poster/05192026/24f4c80c6d.jpg,https://javct.net/v/300mium-1369,82,2026-06-18
326FCT-223,"[Main story] Yuzu-chan is so young, but she cries out and cries repeatedly. Her gestures and attitude are appropriate for her age. Creampie sex video shoot.",https://pic.javct.net/poster/05192026/98cfd4ed7a.jpg,https://javct.net/v/326fct-223,100,2026-06-18
HUNTB-633-RM,"3rd Year Class C's School Festival Refreshment Stand Is A Time-stopped Cafe Always Stop! You Can Be Sexually Harassed At Any Time At A Time-stop Cafe, Whether You Look At Panchira, Touch Boobs, Or Kiss... [Uncensored L**ked]",https://pic.javct.net/poster/20230206/1687491558.jpg,https://javct.net/v/huntb-633-rm,140,2026-06-18
SRS-068-RM,Yariman Document Miyu-chan Maid Cafe Clerk File.08 [Uncensored L**ked],https://pic.javct.net/poster/06032026/1773145094.jpg,https://javct.net/v/srs-068-rm,130,2026-06-18
EBOD-468-RM,Of Plump Cosplayers First Time Human Bullet Orgy Off Meeting Hatese Haruna [Uncensored L**ked],https://pic.javct.net/poster/04112026/1776665584.jpg,https://javct.net/v/ebod-468-rm,120,2026-06-18
326FCT-219-RM,"[Main story] A short man with a round face and a short stature, out of curiosity, I allowed him to take a picture of me, enjoying the large E cup of the areola, and letting me cum inside him lol [Uncensored L**ked]",https://pic.javct.net/poster/05192026/0435cbbb7c.jpg,https://javct.net/v/326fct-219-rm,72,2026-06-18
ONEZ-132-RM,No Bra Invite With A Nipple Patch ◆ The Slut Girl Is Belo Choo Love A Perverted Girl!Himari-chan Working At Uniform Cafe [Uncensored L**ked],https://pic.javct.net/poster/05192026/873c4f5869.jpg,https://javct.net/v/onez-132-rm,120,2026-06-18
