code,title,image_url,page_url,views,date_scraped
STAR-999-RM,SODstar Mahiro Yui 18 Years Old Sexual Orientation × Full Course 10 Corner 240 Minutes SP [Uncensored L**ked],https://pic.javct.net/poster/05192026/e2b3c39dd1.jpg,https://javct.net/v/star-999-rm,240,2026-06-03
FC2PPV-4912071,"In Nijisanji, Anju Katrina is huge and beautiful, slender, fair-skinned, super slim body, and has slender legs. Nju masturbation edition",https://pic.javct.net/poster/05192026/cc9a243e69.jpg,https://javct.net/v/fc2ppv-4912071,52,2026-06-03
WNSK-007-RM,Miri Goddess [Cosplay J Series] Immediate Saddle SEX Survival! ! 02 [Uncensored L**ked],https://pic.javct.net/poster/20230207/1689997141.jpg,https://javct.net/v/wnsk-007-rm,194,2026-06-03
ONEZ-118-RM,# I'm Not An Anime Otaku My Girlfriend's Girlfriend Is Good Menhera Obedient Pet Vol.002 Nanami Yu [Uncensored L**ked],https://pic.javct.net/poster/05192026/ed0dfc360c.jpg,https://javct.net/v/onez-118-rm,120,2026-06-03
TPNS-006-RM,A Super Talented Beautiful Man's Daughter Layer Is Always Full Erection Big Penis Slender And Loves Lewd The Best M [Uncensored L**ked],https://pic.javct.net/poster/20230804/1692417528.jpg,https://javct.net/v/tpns-006-rm,129,2026-06-03
DSAM-002-RM,"Amateur AV 143cm ● Cute Face, Small Pussy, Squirting And Wetting Herself, Orgy Photo Shoot! [Uncensored L**ked]",https://pic.javct.net/poster/05192026/7d7a6cec01.jpg,https://javct.net/v/dsam-002-rm,150,2026-06-03
TPNS-005-RM,5P Large Orgies [Minimum Short Stature But Extra Thick Penikuri Crossdressing Layer] On The Net It Is A High-handed Remark But In Real Life... [Super Sensitive Mesuiki Crazy Intrinsic De M] All Semen Ketsuma Co-launched Super Hard Asshole SEX Training Document Chibitori [Uncensored L**ked],https://pic.javct.net/poster/20230207/1689393485.jpg,https://javct.net/v/tpns-005-rm,112,2026-06-03
MMUS-110-RM,"Little Devilish, Provocative Beauty Shiori Imoto [Uncensored L**ked]",https://pic.javct.net/poster/05192026/453d946ab5.jpg,https://javct.net/v/mmus-110-rm,140,2026-06-03
FOCS-060-RM,Anal Licking! Temptress Maid With A Beautiful Huge Ass Uses Her Asshole To Induce Temptation. Get To Have A Creampie Load After Giving Anal Cunnilingus. Meisa Kawakita [Uncensored L**ked],https://pic.javct.net/poster/20221202/1650012605.jpg,https://javct.net/v/focs-060-rm,124,2026-06-03
AVSA-265-RM,SUPER FISHEYE FETISHISM Powerful Excitement Nectar Erotic Cosplay Sensual BODY Iori Tsukimi [Uncensored L**ked],https://pic.javct.net/poster/20230908/1694233101.jpg,https://javct.net/v/avsa-265-rm,120,2026-06-03
NNNC-024-RM,A National Idol Class Beautiful Girl And A Uniform Icharab 3 Sex Ai Kawana [Uncensored L**ked],https://pic.javct.net/poster/20230207/1689131705.jpg,https://javct.net/v/nnnc-024-rm,95,2026-06-03
LULU-439-RM,"I Slipped An Aphrodisiac Into A Beautiful, Big-butt Cosplayer Who Was Doing Casual Sex For Business, And Turned Her Into A Cum-filled Sex Slave, Squirting And Making Ecstatic Faces During A Photoshoot Where She Was Doing Sensual, Flexible Poses. [Uncensored L**ked]",https://pic.javct.net/poster/05192026/2d6bbf5b47.jpg,https://javct.net/v/lulu-439-rm,160,2026-06-03
ONEZ-119-RM,# Pretty Girl Whose Uniform Is Too Suited Is My Canojo Vol.006 Amami Kokoro [Uncensored L**ked],https://pic.javct.net/poster/20240807/1720885432.jpg,https://javct.net/v/onez-119-rm,120,2026-06-03
GKD-002-RM,Gakkugaku Of Woman Hasegawa Riho [Uncensored L**ked],https://pic.javct.net/poster/05192026/f1c693c301.jpg,https://javct.net/v/gkd-002-rm,120,2026-06-03
SGKI-004-RM,"It's Crazy! Mezamashi News: ""Never Change Your Expression During ON AIR'' Competitive Station Announcer, Third Year Professionalism [Uncensored L**ked]",https://pic.javct.net/poster/20252204/1747565585.jpg,https://javct.net/v/sgki-004-rm,115,2026-06-03
FC2PPV-4909453,God Style Ho ■Aqua-chan Minato in uniform at the live show is thin but an E-cup model and has a beautiful body.,https://pic.javct.net/poster/05192026/bb59692a5e.jpg,https://javct.net/v/fc2ppv-4909453,98,2026-06-03
XVSR-196-RM,Asami Nagase Go! !Assault Street Reverse Nampa DX Akihabara Brush Wholesale Ed. [Uncensored L**ked],https://pic.javct.net/poster/06032026/1773381604.jpg,https://javct.net/v/xvsr-196-rm,120,2026-06-03
EBOD-452-RM,Ultra Breast Jcup Cosplayers Mii-chan Of Rumor [Uncensored L**ked],https://pic.javct.net/poster/06032026/1775274233.jpg,https://javct.net/v/ebod-452-rm,120,2026-06-03
DSAM-002,"Amateur AV 143cm ● Cute Face, Small Pussy, Squirting And Wetting Herself, Orgy Photo Shoot!",https://pic.javct.net/poster/05192026/7d7a6cec01.jpg,https://javct.net/v/dsam-002,150,2026-06-03
MMUS-110,"Little Devilish, Provocative Beauty Shiori Imoto",https://pic.javct.net/poster/05192026/453d946ab5.jpg,https://javct.net/v/mmus-110,140,2026-06-03
BOBB-383-RM,"Milk Fetish Erotic Cosplay That Maximizes The Charm Of J Cup Beautiful Breasts 7 Boin ""Natsuno Kohaku"" Box2 [Uncensored L**ked]",https://pic.javct.net/poster/20230207/1689305599.jpg,https://javct.net/v/bobb-383-rm,120,2026-06-03
XMOM-59-RM,Sukeban Chisato 54 Years Old Chisato Shoda [Uncensored L**ked],https://pic.javct.net/poster/20230207/1689218031.jpg,https://javct.net/v/xmom-59-rm,110,2026-06-03
MIST-437-RM,"Moeka Marui, A Dispatched Maid Who Can Make Babies On Dangerous Days [Uncensored L**ked]",https://pic.javct.net/poster/20241804/1715275741.jpg,https://javct.net/v/mist-437-rm,146,2026-06-03
RTP-105-RM,"Halloween Party With 4 Beautiful Sisters Whose Father Got Married And Suddenly Became A Family! To Cute Cosplay Figure And To Play King Like Girls With Tension Butchuage! ! ""The Things The King Says Absolutely!""I Have Been Tempted By The King's Instructions To Show Me My Breasts And Kisses ... Trick Or Treat! What? [Uncensored L**ked]",https://pic.javct.net/poster/05192026/a14bac682f.jpg,https://javct.net/v/rtp-105-rm,135,2026-06-03
