code,title,image_url,page_url,views,date_scraped
MILK-130-RM,Sick Kawaii Idol Yui Who Was Made To Pee And Got Buzzed Individual Photography X Diuretics X Fucked And Controlled Pillow Fight X Off-package Sex X Massive Squirting X Incontinence Orgy Yui Hazuki [Uncensored L**ked],https://pic.javct.net/poster/20212011/1641445361.jpg,https://javct.net/v/milk-130-rm,116,2026-06-20
XMOM-56-RM,Sukeban Reiko 42 Years Old Reiko Kobayakawa [Uncensored L**ked],https://pic.javct.net/poster/20230205/1683776694.jpg,https://javct.net/v/xmom-56-rm,95,2026-06-20
FC2PPV-4923167,"I love to stroke my dick lovingly... I love it with my dick... I love it with my■ pucker thigh, Amelia Watson. I did it. Seriously, juice is plenty.",https://pic.javct.net/poster/05192026/a7c65356c9.jpg,https://javct.net/v/fc2ppv-4923167,97,2026-06-20
326FCT-222,"[Main story] Riku-chan, a C-cup girl who looks good with a short cut, whom I met on a certain SNS site, was a viewer of Gonzo videos, and when I negotiated for a photo shoot, she let me shoot her with a big creampie lol",https://pic.javct.net/poster/05192026/485f2eed6e.jpg,https://javct.net/v/326fct-222,93,2026-06-20
MIBB-081,"This Cute, Innocent-looking Girl Is Actually Just A Slut! Despite Her Appearance, She's Incredibly Horny And Loves To Have Sex, Even With Her Clothes On!! Airi Ichise",https://pic.javct.net/poster/05192026/4115e5043d.jpg,https://javct.net/v/mibb-081,117,2026-06-20
HMN-876-RM,"Cosplayer With A Bouncy, Peachy Butt Gives Her Butt To Camera-loving Old Men With All Her Might! Even When Her Ripe Hips Are Pounded From Behind, She Smiles And Cums Repeatedly As She Engages In Off-camera Sex And Pillow Talk. Perfume Jun [Uncensored L**ked]",https://pic.javct.net/poster/05192026/b0a9fc2b21.jpg,https://javct.net/v/hmn-876-rm,150,2026-06-20
BOBB-374-RM,"Milk Fetish Erotic Cosplay That Maximizes The Charm Of I Cup Beautiful Breasts 7 Boin ""Yumina Miyafuji"" Box2 [Uncensored L**ked]",https://pic.javct.net/poster/20230205/1683260551.jpg,https://javct.net/v/bobb-374-rm,120,2026-06-20
MIST-476-RM,Yui Tenma [Uncensored L**ked],https://pic.javct.net/poster/20250606/1752116800.jpg,https://javct.net/v/mist-476-rm,153,2026-06-20
ONEZ-138-RM,"Do Strike Baseball Team Manager Uniform Girls.Mr. Tsuyoshi Tsuyoshi, President Of Yuki Morning [Uncensored L**ked]",https://pic.javct.net/poster/05192026/9eb182c804.jpg,https://javct.net/v/onez-138-rm,120,2026-06-20
HMN-876,"Cosplayer With A Bouncy, Peachy Butt Gives Her Butt To Camera-loving Old Men With All Her Might! Even When Her Ripe Hips Are Pounded From Behind, She Smiles And Cums Repeatedly As She Engages In Off-camera Sex And Pillow Talk. Perfume Jun",https://pic.javct.net/poster/05192026/b0a9fc2b21.jpg,https://javct.net/v/hmn-876,150,2026-06-20
ABF-360-RM,Asuna Kawai's unusual love [Uncensored L**ked],https://pic.javct.net/poster/05192026/e172d59c98.jpg,https://javct.net/v/abf-360-rm,120,2026-06-20
ABF-361-RM,A liberal arts girl who indulges in the wet sex of a middle-aged man. Sticky high humidity silent sex Nanami Nakamori [Uncensored L**ked],https://pic.javct.net/poster/05192026/6a1c4a78da.jpg,https://javct.net/v/abf-361-rm,120,2026-06-20
1P-061826-001,"Human Meat Toilet! ~Office Lady Nami Sawaguchi: Dogeza, Creampie, and Fo**ed Apology~",https://pic.javct.net/poster/05192026/1bf9c65032.jpg,https://javct.net/v/1p-061826-001,64,2026-06-20
ABF-360,Asuna Kawai's unusual love,https://pic.javct.net/poster/05192026/e172d59c98.jpg,https://javct.net/v/abf-360,120,2026-06-20
CADV-667-RM,Daughter Girl Metamorphosis Poisoning 8 Hours! ! [Uncensored L**ked],https://pic.javct.net/poster/04112026/f495c6f959.jpg,https://javct.net/v/cadv-667-rm,480,2026-06-20
ABF-361,A liberal arts girl who indulges in the wet sex of a middle-aged man. Sticky high humidity silent sex Nanami Nakamori,https://pic.javct.net/poster/05192026/6a1c4a78da.jpg,https://javct.net/v/abf-361,120,2026-06-20
SRS-072-RM,Yariman Document Rinka (21) Former Bus Guide · Currently Unemployed File.10 [Uncensored L**ked],https://pic.javct.net/poster/05192026/e7b717b676.jpg,https://javct.net/v/srs-072-rm,135,2026-06-20
326FCT-222-RM,"[Main story] Riku-chan, a C-cup girl who looks good with a short cut, whom I met on a certain SNS site, was a viewer of Gonzo videos, and when I negotiated for a photo shoot, she let me shoot her with a big creampie lol [Uncensored L**ked]",https://pic.javct.net/poster/05192026/f3081917e7.jpg,https://javct.net/v/326fct-222-rm,93,2026-06-20
ONED-557-RM,Shou Nishino Sex At School To ~Tsu Barely [Uncensored L**ked],https://pic.javct.net/poster/05192026/39a1c76742.jpg,https://javct.net/v/oned-557-rm,120,2026-06-20
MIDD-589-RM,Shou Nishino Best For Masturbation [Uncensored L**ked],https://pic.javct.net/poster/05192026/c89e9ead70.jpg,https://javct.net/v/midd-589-rm,120,2026-06-20
FC2PPV-4921544,Amelia Watson with her chubby thighs did some serious clear dildo masturbation with plenty of juice,https://pic.javct.net/poster/05192026/7777eacafe.jpg,https://javct.net/v/fc2ppv-4921544,49,2026-06-20
326FCT-223-RM,"[Main story] Yuzu-chan is so young, but she cries out and cries repeatedly. Her gestures and attitude are appropriate for her age. Creampie sex video shoot. [Uncensored L**ked]",https://pic.javct.net/poster/05192026/98cfd4ed7a.jpg,https://javct.net/v/326fct-223-rm,100,2026-06-20
300MIUM-1369-RM,"[Academia Affair] A secret meeting with a dental assistant who has a cute face and is too naughty, creampies, black strokes, beautiful legs, and squeezes her to the limit in an erotic cowgirl position.The position is reversed from when she was at work.A raw sex affair where she is blamed by a sweet sadistic slut [Married man (dental director) x single woman (dental assistant)] case.24 [Uncensored L**ked]",https://pic.javct.net/poster/05192026/24f4c80c6d.jpg,https://javct.net/v/300mium-1369-rm,82,2026-06-20
KYMI-032-RM,Pitacos W Slut [Uncensored L**ked],https://pic.javct.net/poster/20230206/1686976179.jpg,https://javct.net/v/kymi-032-rm,129,2026-06-20
