code,title,image_url,page_url,views,date_scraped
FC2PPV-4936346,"Blue Akaserina is seriously naughty, big and beautiful, slender, fair-skinned, super slim body, and has slender legs.",https://pic.javct.net/poster/07052026/a3c6e3c7a5.jpg,https://javct.net/v/fc2ppv-4936346,94,2026-07-12
RKI-751-RM,"Let Me Stay The Night, Nerd Boy. A Sexy And Cute Girl With A Strong Libido Who Will Even Let Me Have Cosplay Sex With Her, And I Can Cum Inside Her As Much As I Want And Mark Her. Kurumi Sakura [Uncensored L**ked]",https://pic.javct.net/poster/07052026/42de24fc0c.jpg,https://javct.net/v/rki-751-rm,100,2026-07-12
T28-485-RM,Over Wearing Like A Clothes Girl To An Adult! [Uncensored L**ked],https://pic.javct.net/poster/20240410/1729702817.jpg,https://javct.net/v/t28-485-rm,180,2026-07-12
SDAB-183-RM,Boyish Girls Dressed As Boys And First Vaginal Cum Shot In Men's Costumes 3 Raw Ji  Port! Don't Be Quick [Uncensored L**ked],https://static.javct.net/poster/sdab-183.jpg,https://javct.net/v/sdab-183-rm,140,2026-07-12
YST-290-RM,Toa Kotone Silently Devoured My Sister Who Started Layering [Uncensored L**ked],https://pic.javct.net/poster/20230302/1677819460.jpg,https://javct.net/v/yst-290-rm,101,2026-07-12
FC2PPV-4937700,[No] Recommended ☆ Gonzo with naked exposure with a beautiful woman on the way home ☆ Massive creampie,https://pic.javct.net/poster/07052026/27e5797405.jpg,https://javct.net/v/fc2ppv-4937700,52,2026-07-12
MKMP-739-RM,"Her Cute Butt Costume Is So Irresistible That It's Guaranteed To Make Men Swoon!! Erika Ozaki, A Cafe Girl With A Peachy Butt, Is So Easily Swayed By Men That She'll Readily Give Them A Handjob. [Uncensored L**ked]",https://pic.javct.net/poster/07052026/7ddb33517b.jpg,https://javct.net/v/mkmp-739-rm,130,2026-07-12
FC2PPV-4936585,"A succubus cosplay with an I-cup divine breasts gravure idol who farts two times in a row and shoots the camera is seriously geeky!! Even when there is trouble, she gets carried away and is cheeky, so this time she will release the scene during the shooting as it is without editing.",https://pic.javct.net/poster/07052026/0a2e55095a.jpg,https://javct.net/v/fc2ppv-4936585,35,2026-07-12
FC2PPV-4932682,"[SS grade sequel] Very popular beautiful men esplay, the penis is on the verge of exploding, and the attack and defense change, squirting festival",https://pic.javct.net/poster/07052026/67f5a22f58.jpg,https://javct.net/v/fc2ppv-4932682,67,2026-07-12
MILK-219-RM,A Neat And Slender Underground Idol Who Provokes Otakus. A Perverted Slut In A Secret Cosplay. A Masochistic Girl Who Becomes A Sex Slave With Creampie And Cosplay Sex That Milks Semen. Luna Tsukino [Uncensored L**ked],https://pic.javct.net/poster/20242108/1726073221.jpg,https://javct.net/v/milk-219-rm,115,2026-07-12
TNOZ-048,"I Taught This Super Arrogant F-cup Busty Cosplayer A Lesson In Real Bodily Fluid Play By Having Her Swallow Saliva And Pee. Everyone Gave Her Deep Kisses + Continuous Irrumation, Crying And Sobbing = I Kept Bringing Her To Orgasm Until Her Shaved Pussy Was Destroyed With Intense Thrusting, Turning Her Into A Complete Masochist In A 7-person Orgy.",https://pic.javct.net/poster/07052026/0a08511a7a.jpg,https://javct.net/v/tnoz-048,151,2026-07-12
TANF-041,A Cosplayer Who Dreams Of Becoming An Idol Is Tricked Into Becoming A Drug-fueled AV Actress - BadFilm #05,https://pic.javct.net/poster/07052026/c703ea7140.jpg,https://javct.net/v/tanf-041,155,2026-07-12
MKMP-739,"Her Cute Butt Costume Is So Irresistible That It's Guaranteed To Make Men Swoon!! Erika Ozaki, A Cafe Girl With A Peachy Butt, Is So Easily Swayed By Men That She'll Readily Give Them A Handjob.",https://pic.javct.net/poster/07052026/7ddb33517b.jpg,https://javct.net/v/mkmp-739,130,2026-07-12
ONEX-071-RM,Vulgar Fawning And Pregnancy Begging Maid Willing To Make Babies 03 [Uncensored L**ked],https://pic.javct.net/poster/20241115/1732759960.jpg,https://javct.net/v/onex-071-rm,240,2026-07-12
SNOS-281-RM,"[School Festival Booth] Tall J● Fo**ed To Wear A High-cut Swimsuit And Serve Customers With Her Sexy Legs! Unable To Refuse Aroused Customers, She Offers Secret Menu Sex Services. Asuha Mitsuha [Uncensored L**ked]",https://pic.javct.net/poster/07052026/4c2f39b8f6.jpg,https://javct.net/v/snos-281-rm,150,2026-07-12
T28-483-RM,Record The Video That Was Taken Hid Her Cosplayers [Uncensored L**ked],https://pic.javct.net/poster/04112026/a3e0a2d734.jpg,https://javct.net/v/t28-483-rm,150,2026-07-12
AVSA-321-RM,"103cm Glamorous Beautiful Big Tits Cosplayer! She Shakes Her Big Tits And Cums Over And Over Again With The Guys From Her Offline Club, And Has A Cum-bukkake Gangbang Creampie Sex! Aoi Hazuki [Uncensored L**ked]",https://pic.javct.net/poster/20243105/1719024545.jpg,https://javct.net/v/avsa-321-rm,120,2026-07-12
MIST-128-RM,It Does Not Fit Just Dial And Wooed Just A Tokyo Famous Deriheru Of Production Ban!cosplay Deriheru Collection 8 Until The Glaring Man Who Is Out Of Raw Medium To Deriheru Miss [Uncensored L**ked],https://pic.javct.net/poster/06032026/1772843052.jpg,https://javct.net/v/mist-128-rm,160,2026-07-12
STARS-080-RM,Butt Fetish Special! !I'm Accustomed Many Times By Rolling Up The Anal Circle From The Back Vagina Back Intense Piston Many Times! Ogura Yuna [Uncensored L**ked],https://pic.javct.net/poster/20230205/1685027694.jpg,https://javct.net/v/stars-080-rm,135,2026-07-12
RKI-751,"Let Me Stay The Night, Nerd Boy. A Sexy And Cute Girl With A Strong Libido Who Will Even Let Me Have Cosplay Sex With Her, And I Can Cum Inside Her As Much As I Want And Mark Her. Kurumi Sakura",https://pic.javct.net/poster/07052026/42de24fc0c.jpg,https://javct.net/v/rki-751,100,2026-07-12
SNOS-281,"[School Festival Booth] Tall J● Fo**ed To Wear A High-cut Swimsuit And Serve Customers With Her Sexy Legs! Unable To Refuse Aroused Customers, She Offers Secret Menu Sex Services. Asuha Mitsuha",https://pic.javct.net/poster/07052026/4c2f39b8f6.jpg,https://javct.net/v/snos-281,150,2026-07-12
CSPL-012-RM,"[4K] 4K Revolution The costume is cute, but...I can't stop. Aoi Kururugi Vol.4 [Uncensored L**ked]",https://pic.javct.net/poster/07052026/9e669e4222.jpg,https://javct.net/v/cspl-012-rm,68,2026-07-12
MOGK-007-RM,A College Girl Obsessed With Host Clubs Is Brainwashed Into Becoming A Sex Doll And Using Dirty Talk. [Uncensored L**ked],https://pic.javct.net/poster/07052026/fce544c0c8.jpg,https://javct.net/v/mogk-007-rm,128,2026-07-12
857OMG-033-RM,"A 20-year-old JD wears the uniform she wore until a few years ago, and fucks her until she's satisfied.It's an exciting night to see her big tits and her extremely slippery tight pussy. [Uncensored L**ked]",https://pic.javct.net/poster/07052026/d1daeef60f.jpg,https://javct.net/v/857omg-033-rm,97,2026-07-12
