code,title,image_url,page_url,views,date_scraped
MAAN-1181-RM,"[G-breasted cosplayer] A cute and cute active girl appears in a costume that is more erotic than naked, and makes the cheeky layer who is used to photo shoots submit to the cock, and the white of the eyes tear up in the Irama of the cock, and the whites of the eyes are teary. [Uncensored L**ked]",https://pic.javct.net/poster/07052026/47596cb893.jpg,https://javct.net/v/maan-1181-rm,96,2026-07-04
MAAN-1181,"[G-breasted cosplayer] A cute and cute active girl appears in a costume that is more erotic than naked, and makes the cheeky layer who is used to photo shoots submit to the cock, and the white of the eyes tear up in the Irama of the cock, and the whites of the eyes are teary.",https://pic.javct.net/poster/07052026/47596cb893.jpg,https://javct.net/v/maan-1181,96,2026-07-04
FAYS-014,My Personal Cosplay Photoshoot: Maron,https://pic.javct.net/poster/05192026/a7d3eb2224.jpg,https://javct.net/v/fays-014,80,2026-07-04
PASN-029-RM,Sweaty and juicy summer real wet SEX [Uncensored L**ked],https://pic.javct.net/poster/05192026/a649bf0d3b.jpg,https://javct.net/v/pasn-029-rm,121,2026-07-04
NEO-854-RM,"When She Climaxes, Her Legs Are Always Straight. (Illegible) [Uncensored L**ked]",https://pic.javct.net/poster/05192026/e84cb8fe00.jpg,https://javct.net/v/neo-854-rm,117,2026-07-04
420ERK-116-RM,Ten-chan [Uncensored L**ked],https://pic.javct.net/poster/05192026/a463282b7d.jpg,https://javct.net/v/420erk-116-rm,69,2026-07-04
VDD-131-RM,Female Teacher In ... [Threatening Suite Room] Ayane Suzukawa [Uncensored L**ked],https://pic.javct.net/poster/05192026/775b4343ea.jpg,https://javct.net/v/vdd-131-rm,120,2026-07-04
GVH-857,"Black Pantyhose Slut Cosplayer, Lewd Verbal A**se, Hibiki Ren",https://pic.javct.net/poster/05192026/d937592efa.jpg,https://javct.net/v/gvh-857,165,2026-07-04
ABP-662-RM,She Lives Together And Has Multiple Characters! What? VOL.03 Subjective Image Full Load Of 5 Personality And Daily Change Virtual SEX Sanmasa Suzumura Airi [Uncensored L**ked],https://pic.javct.net/poster/05192026/56995598a8.jpg,https://javct.net/v/abp-662-rm,205,2026-07-04
MMUS-111,"Mami Zenba, The Devilishly Provocative Beautiful Girl",https://pic.javct.net/poster/05192026/7a68663a89.jpg,https://javct.net/v/mmus-111,134,2026-07-04
GM-031,28cm To The Uterus De Direct Hit Of The Affair His Wife Over The Muscles Erection Dekachi ● Po!Drama!Future Of ... Monthly Erogomesu Vol.10,https://pic.javct.net/poster/05192026/d2aa5c9739.jpg,https://javct.net/v/gm-031,120,2026-07-04
BONY-044-RM,Mama Is A G-cup Cosplayer Kokona Asakura [Uncensored L**ked],https://pic.javct.net/poster/20230104/1682048025.jpg,https://javct.net/v/bony-044-rm,135,2026-07-04
CIEL-004-RM,Ichakosu Gonzo Peach Uniform Everyone Envy Blissful Sex With Her Aoi Kururugi [Uncensored L**ked],https://pic.javct.net/poster/20230302/1679888353.jpg,https://javct.net/v/ciel-004-rm,124,2026-07-04
BOBB-370-RM,"Breast Fetish Erotic Cosplay That Maximizes The Charm Of Beautiful Breasts 7 Boin ""Tenshi-chan"" Box2 [Uncensored L**ked]",https://pic.javct.net/poster/20230302/1679030613.jpg,https://javct.net/v/bobb-370-rm,120,2026-07-04
MIST-116-RM,It Does Not Fit Just Dial And Wooed Just A Tokyo Famous Deriheru Of Production Ban!Cosplay Deriheru Collection 5 Until The Glaring Man Who Is Out Of Raw Medium To Deriheru Miss [Uncensored L**ked],https://pic.javct.net/poster/01202026/1772180719.jpg,https://javct.net/v/mist-116-rm,160,2026-07-04
TNOZ-025-RM,Gachi 5P Large Orgies Big Boobs Big Breasts Wheel 100cm Layer 18 Years Old [Nipple Iki Repeated Super Sensitive & Throat Irama Ezuki Juice Large Injection] Climax Pee Public De M White Drodo... [Uncensored L**ked],https://pic.javct.net/poster/20230207/1688790488.jpg,https://javct.net/v/tnoz-025-rm,211,2026-07-04
ABW-145-RM,Spocos Sweaty SEX 4 Production Athletic Association Yuiki Rumina Act.28 Exhilarating SEX With Sweat [Uncensored L**ked],https://pic.javct.net/poster/20212308/1631838759.jpg,https://javct.net/v/abw-145-rm,135,2026-07-04
ATID-692,"A True Documentary: The Confession Of Active Cosplayer Iinari Nao - Voyeurism, R**e, Casual Sex, Sex Tapes... What Was Just Barely Hidden Behind The Pasties Of Iinari Nao, A Self-proclaimed ""perverted Cosplayer"" Who Sells Her Extreme Revealing Outfits.",https://pic.javct.net/poster/05192026/ba437257a5.jpg,https://javct.net/v/atid-692,140,2026-07-04
DSAM-003,"A Wild Orgy With Two Super Cute, Close Female College Students, Culminating In Unprotected Sex. ~A Cum-filled Orgy To Get Them Pregnant~ [An Epic Episode!!] ()",https://pic.javct.net/poster/05192026/94a17dd274.jpg,https://javct.net/v/dsam-003,120,2026-07-04
VDD-087-RM,Stewardess In ... [suite Intimidation Room] Cabin Attendant Remi (26) [Uncensored L**ked],https://pic.javct.net/poster/05192026/2250b816e3.jpg,https://javct.net/v/vdd-087-rm,120,2026-07-04
10-070226-01,Cute Costume: Use the twin-ponytails as steering wheel to take control.,https://pic.javct.net/poster/05192026/048a06ec8e.jpg,https://javct.net/v/10-070226-01,54,2026-07-04
PASN-029,Sweaty and juicy summer real wet SEX,https://pic.javct.net/poster/05192026/a649bf0d3b.jpg,https://javct.net/v/pasn-029,121,2026-07-04
ABF-364,"Weekday Female Teacher, Weekend Sex Toy. Airi Suzumura",https://pic.javct.net/poster/05192026/7fde5b67eb.jpg,https://javct.net/v/abf-364,115,2026-07-04
ABF-366,"I Was Made To Orgasm Multiple Times In The Movie Theater At Work, Unable To Make A Sound So That No One Around Me Would Notice... Mai Nanashima",https://pic.javct.net/poster/05192026/d723730740.jpg,https://javct.net/v/abf-366,90,2026-07-04
