code,title,image_url,page_url,views,date_scraped
ABF-223-SUB,Complaint Apology Harassment Umi Yatsukake [English Subtitle],https://pic.javct.net/poster/20252204/1745468518.jpg,https://javct.net/v/abf-223-sub,135,2026-06-27
FC2PPV-4927355,"[Uncensored x Personal Shooting] **pyjpx*jsps My mother-in-law found out about my red erotic lingerie. She told me to throw it away, but it was a waste, so I wore it today as a last memory lol",https://pic.javct.net/poster/05192026/ddcbe74ac4.jpg,https://javct.net/v/fc2ppv-4927355,56,2026-06-27
ABP-732-RM,Harushima Ryo's Finest Grasping Brush 21 A Virgin Assault To A Loving And Sexually Inviting Squirrel! [Uncensored L**ked],https://pic.javct.net/poster/05192026/df97b0fa24.jpg,https://javct.net/v/abp-732-rm,210,2026-06-27
TNOZ-047,"This Girl Is Insane! She's An Incredibly Cute Cosplayer, But She's Also A Sex-crazed Monster On A Whole Other Level. Deep Kissing, Saliva Exchange, And Self-throating, She Cums Uncontrollably And Empties The Balls Of The Virile, Big-dick Cameramen In A 7-person Orgy.",https://pic.javct.net/poster/05192026/a9037ec959.jpg,https://javct.net/v/tnoz-047,194,2026-06-27
MMUS-107,Devilish And Provocative Beautiful Girl Airu Sato,https://pic.javct.net/poster/05192026/87048eeaf3.jpg,https://javct.net/v/mmus-107,133,2026-06-27
FAYS-013,Amateur Entry: Apparel Store Clerk Begs For Anal Sex - Debut,https://pic.javct.net/poster/05192026/1479db1666.jpg,https://javct.net/v/fays-013,90,2026-06-27
WTEX-017,Cosplay Support. Otaku-oji Creampie Bukkake Orgy I-cup Slime-breasted Cosplayer Miu Is Tricked Into An Erotically Filmed Raw Creampie Begging Dick-loving Girl! 1000 Consecutive Pistons With No Condom And Squirting Orgasms!,https://pic.javct.net/poster/05192026/e1e21f98fe.jpg,https://javct.net/v/wtex-017,130,2026-06-27
HODV-22080-RM,"The Best Girlfriend With Amazing Physical Compatibility, A Sweet And Slutty Gal, Kaho Shirahama, With Whom I Have A Passionate Sex Marathon. [Uncensored L**ked]",https://pic.javct.net/poster/05192026/d1050ed31e.jpg,https://javct.net/v/hodv-22080-rm,148,2026-06-27
FC2PPV-4927200,"[Fntia freezes because it's too extreme] **pyjpx*jsps An I-cup idol with divine breasts is exposed by the window and exposed! ""Absolutely not! People will see it! Two consecutive creampies in a sense of immorality!'' It's a video that can never be published as it was featured in a weekly magazine",https://pic.javct.net/poster/05192026/afff6d8bd6.jpg,https://javct.net/v/fc2ppv-4927200,34,2026-06-27
PMGG-029-RM,A lecherous man's daughter and a lewd asshole! 2D-class strong visuals x unstoppable sweet sadistic dirty talk and creampie anal fuck that will definitely drain your sperm! [Eve-chan] Yumishiro Eve [Uncensored L**ked],https://pic.javct.net/poster/05192026/109fc8e6ab.jpg,https://javct.net/v/pmgg-029-rm,73,2026-06-27
34ID-017,25 people recommended cosplay beautiful girl blowjob video collection 4 hours,https://pic.javct.net/poster/05192026/8cd157f872.jpg,https://javct.net/v/34id-017,244,2026-06-27
HODV-22080,"The Best Girlfriend With Amazing Physical Compatibility, A Sweet And Slutty Gal, Kaho Shirahama, With Whom I Have A Passionate Sex Marathon.",https://pic.javct.net/poster/05192026/d1050ed31e.jpg,https://javct.net/v/hodv-22080,148,2026-06-27
ONEX-119,A Nostalgic Youth Soapland 10,https://pic.javct.net/poster/05192026/0ca0415942.jpg,https://javct.net/v/onex-119,240,2026-06-27
ONEX-121,Obedient Sailor Uniform Girl And Hardcore Sex 01 Amateur Sex Video By A Uniform Fetishist Photographer (40s),https://pic.javct.net/poster/05192026/c8651b2229.jpg,https://javct.net/v/onex-121,240,2026-06-27
ONEX-120,Having Mind-blowing Sex With A Beloved Idol: A Video Posted By A Producer In His 40s 07,https://pic.javct.net/poster/05192026/a84b78d37d.jpg,https://javct.net/v/onex-120,240,2026-06-27
JUFD-955,"Although It Is A Pub, It Is A Real Ant Truly! What?Big Tits Cast Haruna Hana",https://pic.javct.net/poster/05192026/a2cc11d97a.jpg,https://javct.net/v/jufd-955,160,2026-06-27
ABF-363-RM,"Completely Subjective × Intense Orgasm, Doesn't Stop Even After She Cums, A Fierce FUCK!!! A Follow-up Of 5,000 Pistons, Miyoshi [Uncensored L**ked]",https://pic.javct.net/poster/05192026/83b4e406f3.jpg,https://javct.net/v/abf-363-rm,135,2026-06-27
ABF-362-RM,"Our Sex Lives, The Unseen In Our Class. (by Umi Hachigake) [Uncensored L**ked]",https://pic.javct.net/poster/05192026/69a4744749.jpg,https://javct.net/v/abf-362-rm,135,2026-06-27
ABF-362,"Our Sex Lives, The Unseen In Our Class. (by Umi Hachigake)",https://pic.javct.net/poster/05192026/69a4744749.jpg,https://javct.net/v/abf-362,135,2026-06-27
ABF-363,"Completely Subjective × Intense Orgasm, Doesn't Stop Even After She Cums, A Fierce FUCK!!! A Follow-up Of 5,000 Pistons, Miyoshi",https://pic.javct.net/poster/05192026/83b4e406f3.jpg,https://javct.net/v/abf-363,135,2026-06-27
TNOZ-022-RM,Serious Voice Actor Idol Aspiring Beautiful Girl Layer 18 Years Old Unbelievable Intrinsic De M Nature [Drinking Saliva & Irama Throat Ejaculation Cum Swallowing] [Iki Leaving Incontinence Peeing & Raw Vaginal Cum Shot] Beautiful Girl Soaked In Body Fluids Gorgeous Double Special 153 Minutes [Uncensored L**ked],https://pic.javct.net/poster/20230104/1681532383.jpg,https://javct.net/v/tnoz-022-rm,153,2026-06-27
EBOD-474-RM,Beautiful Super Body JK Investigator Suzuki Mayu [Uncensored L**ked],https://pic.javct.net/poster/04112026/e0763ed9d6.jpg,https://javct.net/v/ebod-474-rm,120,2026-06-27
WANZ-261-RM,Off Meeting Marie Out Danger During The Day Once Famous Cosplayers Month [Uncensored L**ked],https://pic.javct.net/poster/20241902/1710262032.jpg,https://javct.net/v/wanz-261-rm,120,2026-06-27
REAL-672,"If You Can Not Ejaculate Within 10 Minutes With Maki Rika's Superb Ferritic, Please Use Nie To Apologize For Breaking Apologies!",https://pic.javct.net/poster/05192026/df1e024f36.jpg,https://javct.net/v/real-672,125,2026-06-27
