code,title,image_url,page_url,views,date_scraped
ONEX-119-RM,A Nostalgic Youth Soapland 10 [Uncensored L**ked],https://pic.javct.net/poster/05192026/0ca0415942.jpg,https://javct.net/v/onex-119-rm,240,2026-06-29
FC2PPV-4924514,"A super beautiful big breasted female president who has it all - beauty, money, and a doctor husband - has an affair before trying to get pregnant, and she becomes a pervert and begs for creampie with lewd sex.",https://pic.javct.net/poster/05192026/6e1463fff0.jpg,https://javct.net/v/fc2ppv-4924514,60,2026-06-29
NCYF-040-RM,"Specialized In Pregnancy, 18 Shots Of Creampie Semen, The Biggest Dick Of Her Life, A Punishment That Bulges Her Belly, A Arrogant Beautiful Girl Cosplayer Who Looks Down On Others Goes Crazy And Becomes A Complete Masochist In A Trance, An Extreme 7P Orgy Sex [Uncensored L**ked]",https://pic.javct.net/poster/20250903/1741970614.jpg,https://javct.net/v/ncyf-040-rm,155,2026-06-29
300MIUM-1366,"[I will lend you a super masochistic woman] ""Master'' is always one pattern... I want you to tease me more, but I want you to tease me more, but I'm a curious woman with a mouthful mouth. I don't stop even if I can't stop deep throating. I like it until it's time for a deep throat. I'm a hodai user. Hodai M is OK with anything because I'm a M... [Masochist's home Q delivery]",https://pic.javct.net/poster/05192026/382ffba956.jpg,https://javct.net/v/300mium-1366,105,2026-06-29
YST-354-RM,Minato Haru Silently Devoured His Younger Sister Who Had Just Started Cosplaying. [Uncensored L**ked],https://pic.javct.net/poster/05192026/198b6d4fa7.jpg,https://javct.net/v/yst-354-rm,102,2026-06-29
NLD-031-RM,This Married Woman Is My Personal Vtuber For Swallowing () [Uncensored L**ked],https://pic.javct.net/poster/05192026/3b2ce14735.jpg,https://javct.net/v/nld-031-rm,136,2026-06-29
MIST-111-RM,It Does Not Fit Just Dial And Wooed Just A Tokyo Famous Deriheru Of Production Ban!Cosplay Deriheru Collection 4 Until The Glaring Man Who Is Out Of Raw Medium To Deriheru Miss [Uncensored L**ked],https://pic.javct.net/poster/20240410/1729464910.jpg,https://javct.net/v/mist-111-rm,160,2026-06-29
SOE-268-RM,Big Risky Mosaic Pakopako In Costume! Azusa Nagasawa [Uncensored L**ked],https://pic.javct.net/poster/05192026/5a0262b3bd.jpg,https://javct.net/v/soe-268-rm,230,2026-06-29
ABP-930-RM,"Customs Tower Erogenous Full Course 3 Hours SPECIAL ACT.30 180 Minutes A Beautiful Girl With Too Cute Faces, Voices, And Reactions Grants All Your Desires [Uncensored L**ked]",https://pic.javct.net/poster/05192026/57595f4997.jpg,https://javct.net/v/abp-930-rm,180,2026-06-29
259LUXU-1888-RM,"""Human physical beauty is profound.'' A teacher in a painting class who has sex with a student is restrained with duct tape and squirts repeatedly due to fingering and penetration.A continuous squirting climax that floods the room with water.Luxury TV 1875 [Uncensored L**ked]",,https://javct.net/v/259luxu-1888-rm,72,2026-06-29
259LUXU-1888,"""Human physical beauty is profound.'' A teacher in a painting class who has sex with a student is restrained with duct tape and squirts repeatedly due to fingering and penetration.A continuous squirting climax that floods the room with water.Luxury TV 1875",,https://javct.net/v/259luxu-1888,72,2026-06-29
FC2PPV-4927642,"[Completely secret version] **pyjpx*jsps [Squirting] [Slutty] [Volume warning] Mina, an I-cup office lady, can't stop squirting while half-crying. Her abominable behavior is exposed to the point where her brain is shaking [Chapter 7]",https://pic.javct.net/poster/05192026/b8988c0483.jpg,https://javct.net/v/fc2ppv-4927642,108,2026-06-29
FAYS-013-RM,Amateur Entry: Apparel Store Clerk Begs For Anal Sex - Debut [Uncensored L**ked],https://pic.javct.net/poster/05192026/1479db1666.jpg,https://javct.net/v/fays-013-rm,90,2026-06-29
ABP-426,Transformation Pet With Real Estate Yatabe Kazusuna With Rent Property File.06,https://pic.javct.net/poster/05192026/fffb285b05.jpg,https://javct.net/v/abp-426,195,2026-06-29
LADYL-003-RM,Lesbian Prison [Uncensored L**ked],https://pic.javct.net/poster/20233001/1675584371.jpg,https://javct.net/v/ladyl-003-rm,120,2026-06-29
WTEX-017-RM,Cosplay Support. Otaku-oji Creampie Bukkake Orgy I-cup Slime-breasted Cosplayer Miu Is Tricked Into An Erotically Filmed Raw Creampie Begging Dick-loving Girl! 1000 Consecutive Pistons With No Condom And Squirting Orgasms! [Uncensored L**ked],https://pic.javct.net/poster/05192026/e1e21f98fe.jpg,https://javct.net/v/wtex-017-rm,130,2026-06-29
STAR-364-RM,Aso rare Kyun Cum First the milk of your port ○ Ochi [Uncensored L**ked],https://pic.javct.net/poster/20230104/1681786785.jpg,https://javct.net/v/star-364-rm,155,2026-06-29
YST-354,Minato Haru Silently Devoured His Younger Sister Who Had Just Started Cosplaying.,https://pic.javct.net/poster/05192026/198b6d4fa7.jpg,https://javct.net/v/yst-354,102,2026-06-29
CIEL-011-RM,Shall We Do It After School? Smiling Shy Big Breasts Kcup Ena Koume [Uncensored L**ked],https://pic.javct.net/poster/20231912/1703610695.jpg,https://javct.net/v/ciel-011-rm,112,2026-06-29
NLD-031,This Married Woman Is My Personal Vtuber For Swallowing (),https://pic.javct.net/poster/05192026/3b2ce14735.jpg,https://javct.net/v/nld-031,136,2026-06-29
PASN-028-RM,Riho Fujimori Tsubaki Rika Akira Ellie Beautiful busty actress teaches the essence of sex [Uncensored L**ked],https://pic.javct.net/poster/05192026/45a26aaec6.jpg,https://javct.net/v/pasn-028-rm,100,2026-06-29
FTKD-003-RM,Happening Bar Where Married Women Who Want To Be Cuckold Gather [Uncensored L**ked],https://pic.javct.net/poster/20230205/1684986193.jpg,https://javct.net/v/ftkd-003-rm,186,2026-06-29
FC2PPV-4927560,Sitting Insertion Serious Sex KanColle Kitakami Kaze-sama costume was done by an office lady with puffy nipples.Ecchi Edition,https://pic.javct.net/poster/05192026/030ad40ed1.jpg,https://javct.net/v/fc2ppv-4927560,114,2026-06-29
ABF-223-SUB,Complaint Apology Harassment Umi Yatsukake [English Subtitle],https://pic.javct.net/poster/20252204/1745468518.jpg,https://javct.net/v/abf-223-sub,135,2026-06-29
