code,title,image_url,page_url,views,date_scraped
GM-024,Yuji Gomez / Loves 024 Monthly Erotic Gomez Vol.2,https://pic.javct.net/poster/05192026/ef729e28c1.jpg,https://javct.net/v/gm-024,160,2026-06-26
FSKI-003,"A Cute And Cute Schoolgirl Is The First To Experience 18 Cm Big Cock Of Ojisan! ""I'm Sorry!Big! ""While I Feel That I Have To Remove The Rubber Rubber Unexpectedly!School Girls Who Had Become A Prisoner Of The Big Dick In 93 Iki Of Rolled Up Maiden Ma ○ Co From The Dimension Stop",https://pic.javct.net/poster/05192026/597313c973.jpg,https://javct.net/v/fski-003,215,2026-06-26
DORI-019,"Paco Shooting No.19 I Made J ○ Who Was Addicted To The Pleasantness Of Raw Chin In The First Unauthorized Vaginal Cum Shot Begging ""Please Put It In With Ojisan's Chin Chin Raw ..."", And Also Vaginal Cum Shot In The Second Time !!",https://pic.javct.net/poster/05192026/f2fba7be58.jpg,https://javct.net/v/dori-019,91,2026-06-26
HODV-21723,"Adultery Wife Pleasure Of Wives Because It Is A Forbidden Relationship, It Gets Excited A Chaste Wife Becomes A Female In Estrus And A Vivid Sex Video Of An Adult Man And Woman",https://pic.javct.net/poster/05192026/61bea229f8.jpg,https://javct.net/v/hodv-21723,240,2026-06-26
KSBJ-119,My Son's Daughter-in-law Was A Horny Woman From The Ground Up ... Maron Natsuki,https://pic.javct.net/poster/05192026/ae918fda69.jpg,https://javct.net/v/ksbj-119,120,2026-06-26
URE-018-RM,Ai Uehara Heroine Love Original Pong Takahanada ! !Wife A Bud [Uncensored L**ked],https://pic.javct.net/poster/20220707/1658341338.jpg,https://javct.net/v/ure-018-rm,220,2026-06-26
MIST-263,Former CA Tsurumi Asuka (provisional) A High Spec Career Tossed To Make A Shaky AV Debut Transformation Desire And Sexual Desire Are Too Strong And It Is Barite That I Had Sex With A Customer In Flight!,https://pic.javct.net/poster/05192026/94e895a022.jpg,https://javct.net/v/mist-263,155,2026-06-26
10-062626-01,Pussy to Mouth Sex: Hitomi Tanmura,https://pic.javct.net/poster/05192026/34c0171933.jpg,https://javct.net/v/10-062626-01,60,2026-06-26
CR-062626-001,Pampering and Training by a Motherly Younger Mother-in-Law,https://pic.javct.net/poster/05192026/22c33aa2ae.jpg,https://javct.net/v/cr-062626-001,61,2026-06-26
MUCD-356-RM,"It Feels So Good, I Can't Stop!! The Best 4 Hours Of Squirting As The Body Of A Schoolgirl In Uniform Overflows With Pleasure. [Uncensored L**ked]",https://pic.javct.net/poster/05192026/ab789afa5c.jpg,https://javct.net/v/mucd-356-rm,240,2026-06-26
SVFLA-021,A slut who makes you lick and talk dirty asshole. Mina Kitano shows off her anus in an obscene pose and has perverted sex,https://pic.javct.net/poster/05192026/c61ebd83d3.jpg,https://javct.net/v/svfla-021,252,2026-06-26
FC2PPV-4927279,"0407_002 Hana-chan, 21 years old, decided to make a series until she got pregnant during an AV shoot.She impregnated her desire to make her lewd H cup breasts bigger, and when the old man made it come true, she also made her stomach bigger (explosive)",https://pic.javct.net/poster/05192026/e8903ebfa4.jpg,https://javct.net/v/fc2ppv-4927279,178,2026-06-26
FC2PPV-4925840,"[First shoot / 2 shots] This is a sex battle with a fair-skinned beautiful naked woman who is a monster of sexual desire even though she is so cute. Even the cameraman can't resist and immediately joins in the fight, but he does his best to make you ejaculate in large quantities in seconds.",https://pic.javct.net/poster/05192026/b84a46fdfc.jpg,https://javct.net/v/fc2ppv-4925840,88,2026-06-26
SCR-347-RM,Midsummer Nightmare: Female R**e And Internal Ejaculation - 4-Hour Video L**k [Uncensored L**ked],https://pic.javct.net/poster/05192026/00c1481dbc.jpg,https://javct.net/v/scr-347-rm,240,2026-06-26
FC2PPV-4925085,"Uncensored Super Cute ❤ Former Idol Research Student 18 ♡ Sequel Uniform twin tail loose socks, creampie in a narrow pussy with natural pubic hair without a rubber band\!",https://pic.javct.net/poster/05192026/979b470aff.jpg,https://javct.net/v/fc2ppv-4925085,53,2026-06-26
34ID-018,4 hours of insemination sex with a beautiful girl who cums so much when she sleeps in the back,https://pic.javct.net/poster/05192026/13f3e18a77.jpg,https://javct.net/v/34id-018,244,2026-06-26
WA-588-RM,"Amateur Wife Pick-Up, Unprotected Sex With All Of Them, 5 Hours, Celebrity DX 105 [Uncensored L**ked]",https://pic.javct.net/poster/05192026/fe29989cd0.jpg,https://javct.net/v/wa-588-rm,300,2026-06-26
FC2PPV-4926354,"[43-year-old mother of two c**ldren] **pyjpx*jsps I forgot about being exposed and safe sex, and became just a female bitch who enjoys raw sex and creampie with her face exposed lol",https://pic.javct.net/poster/05192026/8efca51b1c.jpg,https://javct.net/v/fc2ppv-4926354,64,2026-06-26
CHRV-176-RM,Older Brother Bing Taro To A Younger Sister Who Masturbates By Reading A Sensual Novel! My Sister's Huge Breasts Are Worth Seeing! Sailor Uniform Raw Creampie! H Cup 99cm Walnut [Uncensored L**ked],https://pic.javct.net/poster/20230104/1680928953.jpg,https://javct.net/v/chrv-176-rm,150,2026-06-26
FC2PPV-4923982,"She's a slender slender girl with small breasts that shows off her ribs when she's pussy-fucking, and 2 ejaculations are ejaculated with a strong piston on her slender body that's about to break. If you like plump things, it's better not to watch it. [Facial exposure/Uncensored/Creampie]",https://pic.javct.net/poster/05192026/f01da546f3.jpg,https://javct.net/v/fc2ppv-4923982,80,2026-06-26
NMSL-042,A beautiful influencer at the height of her popularity is targeted and r**ed with ruthless creampie Nia,https://pic.javct.net/poster/05192026/ce4b711fb3.jpg,https://javct.net/v/nmsl-042,120,2026-06-26
HODV-22084,Car Sex Affair: Reason Goes Haywire In The Car!! The 'unstoppable Relationship' Of A Couple With A Secret.,https://pic.javct.net/poster/05192026/ed0170f6ca.jpg,https://javct.net/v/hodv-22084,241,2026-06-26
FC2PPV-4927200,"[Fntia freezes because it's too extreme] **pyjpx*jsps An I-cup idol with divine breasts is exposed by the window and exposed! ""Absolutely not! People will see it! Two consecutive creampies in a sense of immorality!'' It's a video that can never be published as it was featured in a weekly magazine",https://pic.javct.net/poster/05192026/afff6d8bd6.jpg,https://javct.net/v/fc2ppv-4927200,34,2026-06-26
FUNK-022-RM,"The Rumored Exhibitionist Teacher ""Did You Know The Bad Story About Class B's Mio-sensei? After Class, She Walked Around The School Naked."" Megu Mio [Uncensored L**ked]",https://pic.javct.net/poster/20230104/1682739459.jpg,https://javct.net/v/funk-022-rm,135,2026-06-26
