code,title,image_url,page_url,views,date_scraped
ROYD-319,"My Female Friend, Who Has A Boyfriend, Comes To Stay Over Every Night And Unconsciously Tries To Seduce Me, Leaving Me In A State Of Torment Because I Can't Muster The Courage To Make A Move.",https://pic.javct.net/poster/05192026/15dd219bdd.jpg,https://javct.net/v/royd-319,130,2026-06-05
MIST-092-RM,Once You Sleep And You To Ji ○ The Issues Quietly Inserted Gattsuri During Sister Sleeping On Defenseless Once You Have Verified That It Does Not Occur By Rubbing The Face Excitement Quite The Sister Of Underwear That Does Not Happen! ! [Uncensored L**ked],https://pic.javct.net/poster/05192026/baa8cca1a4.jpg,https://javct.net/v/mist-092-rm,150,2026-06-05
DASS-970,She is given an aphrodisiac and starts sweating! Natural and vulgar crab crotch jobajoba peeing! Jerky and convulsive sensitive hot yoga class Minami Kojima,https://pic.javct.net/poster/05192026/28cb878391.jpg,https://javct.net/v/dass-970,150,2026-06-05
FSDSS-987-SUB,"When I Called A Delivery Health Service, A New Female Employee Came To The Company With A Bright Future, So She Turned Into A Sex Doll That She Had To Do With Her At Work, To**da Ami [English Subtitle]",https://pic.javct.net/poster/20253001/1740241205.jpg,https://javct.net/v/fsdss-987-sub,145,2026-06-05
PKPD-112-RM,Yen Woman Dating Creampie Ok Short Black Hair Pervert Employee Ol Kashiwagi Ami [Uncensored L**ked],https://pic.javct.net/poster/06032026/1775800875.jpg,https://javct.net/v/pkpd-112-rm,138,2026-06-05
JJDA-037-RM,"Misono Suwon, Wife Of A Kind And Busty Teacher Who Encourages Me Who Is Unemployed [Uncensored L**ked]",https://pic.javct.net/poster/20230206/1688099232.jpg,https://javct.net/v/jjda-037-rm,120,2026-06-05
IENF-271-RM,Good Friends Challenge The Erotic Mission For The Prize Money! Forbidden Incest! Unequaled Younger Brother Is In Estrus For A Beautiful Older Sister! Many Times Creampie! [Uncensored L**ked],https://pic.javct.net/poster/20230206/1687403874.jpg,https://javct.net/v/ienf-271-rm,155,2026-06-05
SY-223-RM,"Dear Mrs. Kumiko, 30 Years Old, Living In A Four-and-a-half Tatami Mat Room ● Amateur Four-and-a-half Tatami Mat Room Raw Sex Series Fujikawa Nozomi [Uncensored L**ked]",https://pic.javct.net/poster/05192026/6cca4acc7b.jpg,https://javct.net/v/sy-223-rm,120,2026-06-05
FC2PPV-4915084,"[Uncensored]**pyjpx*jsps Donkey's love slave breast diary Call a big-breasted sex friend and enjoy playing with her favorite breasts - Of course, call the I-cup tit-fuck-exploding dick guy and cum inside him - Big breasts 〇〇 loves standing doggy style",https://pic.javct.net/poster/05192026/588abeb8d6.jpg,https://javct.net/v/fc2ppv-4915084,72,2026-06-05
YSN-601-RM,It Is Kept By The Brother Of A C**ld Uncle Who Is Stupid But Has A Strong Libido. Anka Suzune [Uncensored L**ked],https://pic.javct.net/poster/20230206/1687495181.jpg,https://javct.net/v/ysn-601-rm,101,2026-06-05
JUR-750-RM,"A Stunningly Beautiful Housewife With A Big Butt Gets Her Defenseless Ass Exposed While Cleaning, Her Anus Instantly Bared And Goes Wild With Pleasure, Becoming Addicted To Raw Sex Again And Again. [Uncensored L**ked]",https://pic.javct.net/poster/05192026/de82a3f5b3.jpg,https://javct.net/v/jur-750-rm,120,2026-06-05
YMDS-284-RM,The slut wagon is on its way! ! Happening A Go Go! ! Riho Shishido and Liz's unusual journey is out of control! Super-accelerated amateurs' reverse Nan parade with bulging horny luggage - Sexy happenings edition [Uncensored L**ked],https://pic.javct.net/poster/05192026/35ced54e4d.jpg,https://javct.net/v/ymds-284-rm,105,2026-06-05
YMDD-331-RM,Younger Sister Catering Service A Solid Love AI Sister Who Fully Affirms Me Fantastic BOIN EMILY [Uncensored L**ked],https://pic.javct.net/poster/20230206/1688190610.jpg,https://javct.net/v/ymdd-331-rm,100,2026-06-05
YMDS-283-RM,The slut wagon is on its way! ! Happening A Go Go! ! Riho Shishido and Liz's unusual journey is out of control! Super-accelerated amateurs' reverse Nan parade with overflowing horny luggage Exposure unblocked edition [Uncensored L**ked],https://pic.javct.net/poster/05192026/fd33b27cd2.jpg,https://javct.net/v/ymds-283-rm,122,2026-06-05
VOD-018-RM,Real Amateur Wife Document 3rd Beautiful Platinum K Cup Colossal Tits Wife Wants Berokisu Adhesion Sex Mana Kawahara [Uncensored L**ked],https://pic.javct.net/poster/20230206/1688100765.jpg,https://javct.net/v/vod-018-rm,125,2026-06-05
VENX-217-RM,My Son's Wife Gets Creampied By Her Father-In-Law And Knows Real Sex And Is Extremely Pleasant Emily Kajima [Uncensored L**ked],https://pic.javct.net/poster/20230206/1687496414.jpg,https://javct.net/v/venx-217-rm,95,2026-06-05
328HMDNV-928-RM,"A married woman who was active as a weather girl until a few years ago retired because she longed for a normal life, but there was no stimulation and she was stressed to the max! Dirty creampie sex to remember her younger days [Uncensored L**ked]",https://pic.javct.net/poster/05192026/03a7fc3c95.jpg,https://javct.net/v/328hmdnv-928-rm,65,2026-06-05
PKPT-015-RM,Wanting Office Lady Hana Haruna Hana [Uncensored L**ked],https://pic.javct.net/poster/20230206/1688189090.jpg,https://javct.net/v/pkpt-015-rm,130,2026-06-05
ID-058-RM,"My Beloved Escort Girl 58: The Young-Faced, Perverted Florist Is A Super Sensitive, Cumming Kitten Edition. I Pollinate The Dew-soaked Pistil Of The Florist With My Cock And Cum Inside! Her Sensitive Nipples Become Erect And Her Tiny Bud Twitches And Convulses As She Blossoms! Minami Shirayuri [Uncensored L**ked]",https://pic.javct.net/poster/05192026/f3ac1fd993.jpg,https://javct.net/v/id-058-rm,100,2026-06-05
JUR-763,"Chapter 2 of an ordinary but not ordinary housewife! ! Creampie ban drummer. After having sex with my husband to make a baby, I am always creampied by my son-in-law... Narumi Koyuki",https://pic.javct.net/poster/05192026/ee87a6af3e.jpg,https://javct.net/v/jur-763,138,2026-06-05
YOCH-002-RM,I'm A Woman... Even My Stepmom Wants To Be Impregnated... Yuri Honma [Uncensored L**ked],https://pic.javct.net/poster/20230206/1687404754.jpg,https://javct.net/v/yoch-002-rm,110,2026-06-05
PS-129-RM,"New B-grade Amateur First Shoot 129 ""Sorry, Daddy."" Rio, 25 Years Old, Lives In Osaka, Beer Vendor At The Baseball Stadium, A Seductive Kansai Woman, Sweating Profusely During Orgasm ""No, Stop... I'm Getting Turned On... I'm Getting Turned On!"" ""She Sucks The Cock With Her Moist, Plump Mouth!"" ""Her Smooth Kansai Accent Is So Hot..."" Oikawa Rio [Uncensored L**ked]",https://pic.javct.net/poster/05192026/0178f32d95.jpg,https://javct.net/v/ps-129-rm,100,2026-06-05
PASN-025-RM,[Strongest Heroine 003] Isn't I cute? A confident play of a beautiful girl with an outstanding presence [Uncensored L**ked],https://pic.javct.net/poster/05192026/701c1f520c.jpg,https://javct.net/v/pasn-025-rm,135,2026-06-05
STAR-767-SUB,Iori Furukawa Men's Beauty Salon Out In That Whisper Your Ear In Gently Dirty [English Subtitle],https://pic.javct.net/poster/06032026/1775114919.jpg,https://javct.net/v/star-767-sub,180,2026-06-05
