code,title,image_url,page_url,views,date_scraped
VOSS-161-RM,"""I Already Have A New Boyfriend!"" When Her Ex-Husband Started Stalking Her, The Lady Next Door Tried To Get Rid Of Him By Saying That She Was Dating Me, A Cherry Boy! When He Threatened Her, Saying, ""If You Two Are Lovers, Then Start Fucking, Right Here, Right Now!"" We Had To Start Fucking Furiously, And We Had To Make Sure He Didn't Realize I Was Getting My Cherry Popped! [Uncensored L**ked]",https://pic.javct.net/poster/05192026/d0c8ed0ad2.jpg,https://javct.net/v/voss-161-rm,95,2026-07-03
LULU-442-RM,"I Used The Sticky Nipple Development Techniques I Learned From Erotic Manga To Make The Large, Defenseless Breasts Of My Pale-skinned, Anime-loving, Introverted Otaku Friend's Areolas Sensitive, And Then Had A Blast Playing With Her Nipples Until She Came. [Uncensored L**ked]",https://pic.javct.net/poster/05192026/50d32ddb25.jpg,https://javct.net/v/lulu-442-rm,160,2026-07-03
JJDA-075-RM,"My Junior's Wife Is Being Penetrated By The Huge Cock Of A Jobless, Gambling-addicted, Slovenly Man On Welfare. [Uncensored L**ked]",https://pic.javct.net/poster/05192026/78cc87767b.jpg,https://javct.net/v/jjda-075-rm,120,2026-07-03
FC2PPV-4931887,Behind-the-scenes course of a certain Kita-ku cosplay cafe ♥ A top ranking neat girl exposes her raw pussy in a private off-shot after an event & goes crazy in a lewd photo session,https://pic.javct.net/poster/05192026/38fe318f52.jpg,https://javct.net/v/fc2ppv-4931887,58,2026-07-03
CR-070326-001,Clean it up! : Naughty gal discovers her hookup partner is good at cunnilingus,https://pic.javct.net/poster/05192026/8d4114bdc3.jpg,https://javct.net/v/cr-070326-001,61,2026-07-03
CAWD-972-RM,"""I Have No Memory Of It, But My Body Is Burning With Desire."" Mayuki Ito's Latent Eroticism Explodes. Hypnotic Awakening Ecstasy. [Uncensored L**ked]",https://pic.javct.net/poster/05192026/5ea9f2ee8b.jpg,https://javct.net/v/cawd-972-rm,140,2026-07-03
WAAA-661-RM,"""I'm Already Cumming!"" She Came Inside Him Multiple Times! Ayatsuki Nanao [Uncensored L**ked]",https://pic.javct.net/poster/05192026/007e78c784.jpg,https://javct.net/v/waaa-661-rm,120,2026-07-03
BNST-090,Pushers Bookmark,https://pic.javct.net/poster/05192026/9c0619d244.jpg,https://javct.net/v/bnst-090,138,2026-07-03
FC2PPV-4932368,Only 1 person with uncensored experience from Aomori Music college student 18 readers Model special value 115 160 cm 45 kg E cup Raw cock inserted just 6 months after losing virginity ⇒ Creampie,https://pic.javct.net/poster/05192026/1a006c0d78.jpg,https://javct.net/v/fc2ppv-4932368,67,2026-07-03
ADN-783-RM,The Story Of How I Had Sex With A Beautiful Married Woman Who Lived In The Same Apartment Building. (Hoshimiya Ichika) [Uncensored L**ked],https://pic.javct.net/poster/05192026/09a20244ff.jpg,https://javct.net/v/adn-783-rm,120,2026-07-03
ADN-784-RM,Please Forgive Me... You Stole Even My Heart. [Uncensored L**ked],https://pic.javct.net/poster/05192026/ad5914ef19.jpg,https://javct.net/v/adn-784-rm,120,2026-07-03
FC2PPV-4932401,[No] Heir to a long-established store with a plump body,https://pic.javct.net/poster/05192026/bfb2286f0b.jpg,https://javct.net/v/fc2ppv-4932401,69,2026-07-03
MIDA-678-RM,Decoy Investigator Mayu - Drug-Induced Sex And Infiltration - Aerial Undercover Investigation - Mayu Shino [Uncensored L**ked],https://pic.javct.net/poster/05192026/344897d4fe.jpg,https://javct.net/v/mida-678-rm,130,2026-07-03
ALDN-140-RM,Mother's R**e Creampie Mother Miori Akimoto Who Was Cummed Out For The First Time By Her Son [Uncensored L**ked],https://pic.javct.net/poster/20230302/1679716322.jpg,https://javct.net/v/aldn-140-rm,105,2026-07-03
DSAM-004,"A Nursery School Specializing In Older C**ldren, Filled With Maternal Love And Affection.",https://pic.javct.net/poster/05192026/497a85c314.jpg,https://javct.net/v/dsam-004,130,2026-07-03
WAAA-658-RM,I Was Sexually Assaulted By My Hated Stepfather... [Uncensored L**ked],https://pic.javct.net/poster/05192026/1a19e08649.jpg,https://javct.net/v/waaa-658-rm,120,2026-07-03
GVH-845-RM,Forbidden Caregiving: Ayami Mori [Uncensored L**ked],https://pic.javct.net/poster/04112026/09a5f4838c.jpg,https://javct.net/v/gvh-845-rm,120,2026-07-03
CHRV-174-RM,"In Fact, There Was A Sister Who Had An Illegitimate C**ld, Big Boobs Of The Caribbean Sister's Colossal Breasts Are Worth Seeing! Sailor Uniform Raw Creampie! I Cup 99cm Rosé Pai [Uncensored L**ked]",https://pic.javct.net/poster/20230302/1678511810.jpg,https://javct.net/v/chrv-174-rm,150,2026-07-03
FC2PPV-4923490,"I left the remote control in my super cute and soothing girlfriend until she came to her room, and she wanted me to have her pussy flooded in full erotic mode, so I gave her a deep insemination [Face/Uncensored/Creampie]",https://pic.javct.net/poster/05192026/6afcaa3ca0.jpg,https://javct.net/v/fc2ppv-4923490,71,2026-07-03
HUNTB-572-RM,"Unlimited Insertion With Anyone! Convenience Store Version If You Accumulate A Fixed Amount Of Points Every Month, You Can Get As Much As You Want To Be A Part-time Job Girl And Area Manager At A Convenience Store! ? [Uncensored L**ked]",https://pic.javct.net/poster/20230104/1682051495.jpg,https://javct.net/v/huntb-572-rm,170,2026-07-03
HUNTB-571-RM,"I Don't Care If I'm Dead! I'm In A Harem Immediately In 30 Seconds From The Start! Always A Harem State Share House! Anyway, Only Naughty Busty Female College Students Live [Uncensored L**ked]",https://pic.javct.net/poster/20230104/1680842692.jpg,https://javct.net/v/huntb-571-rm,160,2026-07-03
DORR-002-RM,Pichi Cream Pie The Whole Story That Happened To Himari While She Was At Home Himari Hina [Uncensored L**ked],https://pic.javct.net/poster/20230104/1680408728.jpg,https://javct.net/v/dorr-002-rm,141,2026-07-03
FOCS-107-RM,Attacked While Sleeping In A Shared Room On A Business Trip... A Female Boss Who Has Been Vaginal Cum Shot Many Times By Two Juniors Even Though She Has A Fiance Mirai Nakamaru [Uncensored L**ked],https://pic.javct.net/poster/20222311/1671160411.jpg,https://javct.net/v/focs-107-rm,120,2026-07-03
CSPL-014-RM,[4K] 4K Revolution Dere Cute But... Can't Stop Kozue Fujita [Uncensored L**ked],https://pic.javct.net/poster/20230302/1679199324.jpg,https://javct.net/v/cspl-014-rm,89,2026-07-03
