code,title,image_url,page_url,views,date_scraped
HZGD-044-RM,Married Life Insurance Ready To Seduce With Beauty Tits For The Contract Airi Sato [Uncensored L**ked],https://pic.javct.net/poster/05192026/8184812990.jpg,https://javct.net/v/hzgd-044-rm,120,2026-06-12
DFE-077-RM,My Daughter Eats It. Misaki Tsukimoto [Uncensored L**ked],https://pic.javct.net/poster/20241902/1708662163.jpg,https://javct.net/v/dfe-077-rm,124,2026-06-12
DAR-001-RM,Geki Kawa Women's Sleep Teropako Wakuman [Uncensored L**ked],https://pic.javct.net/poster/20230206/1686820032.jpg,https://javct.net/v/dar-001-rm,140,2026-06-12
XRW-687-RM,Please Tell Me-Married People Who Sleep With Anyone-Hanyu Arisa-Yuri Mai-Kanna Misaki [Uncensored L**ked],https://pic.javct.net/poster/20242108/1727250549.jpg,https://javct.net/v/xrw-687-rm,162,2026-06-12
ROE-103-SUB,"After 10 Days Of Giving My Longing Aunt An Aphrodisiac, I Became A Meat Urinal With Unlimited Vaginal Cum Shot. Maki Tomoda [English Subtitle]",https://pic.javct.net/poster/20222109/1663912885.jpg,https://javct.net/v/roe-103-sub,120,2026-06-12
VEC-590-RM,A Captivating Single Mother Who Moved Next To Her Apartment And Creampie Courtship Sex Ann Komatsu [Uncensored L**ked],https://pic.javct.net/poster/20230205/1685681646.jpg,https://javct.net/v/vec-590-rm,95,2026-06-12
SMCD-032-RM,"Even though I had such a hard time yesterday...I woke up and saw my girlfriend without makeup, so cute that when I got an erection in the morning, I immediately gushed! Flirty SEX [Uncensored L**ked]",https://pic.javct.net/poster/05192026/990c3e597c.jpg,https://javct.net/v/smcd-032-rm,162,2026-06-12
328CNSTV-007-RM,"""An easy job that will get you fired up'' Introducing a simple part-time job to poor housewives who are struggling with living expenses due to the prolonged recession. [Uncensored L**ked]",https://pic.javct.net/poster/05192026/513dcb8049.jpg,https://javct.net/v/328cnstv-007-rm,125,2026-06-12
NXGS-018-RM,"Fifty-year-old Mother, Forbidden Immoral Mother-son Incest [Uncensored L**ked]",https://pic.javct.net/poster/05192026/b6d08c372b.jpg,https://javct.net/v/nxgs-018-rm,120,2026-06-12
SYKH-078-RM,Raw Mating With A Beautiful Witch In Boots Her Beautiful Face Melts Into The Pleasure Of Immediate Pleasure... Yurina 34 Years Old [Uncensored L**ked],https://pic.javct.net/poster/20230206/1686974576.jpg,https://javct.net/v/sykh-078-rm,110,2026-06-12
JKSR-710-RM,Girls' Dorm Sex 5 Hours BEST 9 J○ Creampie Reality [Uncensored L**ked],https://pic.javct.net/poster/05192026/ba6dd04795.jpg,https://javct.net/v/jksr-710-rm,300,2026-06-12
IENFA-06603-RM,"My big-breasted older sister, who felt pity for me for not having sex, asked me to intercrural sex with her, promising that I would just rub her, and we both felt so good that our pussies were soaking wet! Insert it raw! ""What!? Is it inside?"" But I can't stop and cum! Hatori Kosaki [Uncensored L**ked]",https://pic.javct.net/poster/05192026/7b6cfd1505.jpg,https://javct.net/v/ienfa-06603-rm,42,2026-06-12
OFKU-240-RM,"""Why Is My Stepmom Sucking My Dick?"" I Woke Up To Find My Stepmom Giving Me A Blowjob In Bed... I Couldn't Help But Wake Up And Have Creampie Sex [Uncensored L**ked]",https://pic.javct.net/poster/05192026/3d867c8f60.jpg,https://javct.net/v/ofku-240-rm,120,2026-06-12
SRS-061-RM,Amateur Hunter 2 · 43 [Uncensored L**ked],https://pic.javct.net/poster/05192026/62fd875122.jpg,https://javct.net/v/srs-061-rm,135,2026-06-12
MOKO-043-RM,Sexual Treatment Ward: Beautiful Nurse's Erotic Nursing 180 Minutes [Uncensored L**ked],https://pic.javct.net/poster/05192026/594f09fa44.jpg,https://javct.net/v/moko-043-rm,180,2026-06-12
SABA-832-RM,Exposure Video Membership Refre Where Celebrities Go Incognito 02 [Uncensored L**ked],https://pic.javct.net/poster/20230206/1686372679.jpg,https://javct.net/v/saba-832-rm,120,2026-06-12
KRS-299-RM,"This is it! Amateur PREMIUM She's such a plain lady, but she's amazing. [Uncensored L**ked]",https://pic.javct.net/poster/05192026/7773658f07.jpg,https://javct.net/v/krs-299-rm,60,2026-06-12
IENFA-07602-RM,"A girl in my class who moved to Tokyo and came to stay at my house near my school, who lives alone, watched my AV and got horny! ! Nozomi Arimura [Uncensored L**ked]",https://pic.javct.net/poster/05192026/9710d6812e.jpg,https://javct.net/v/ienfa-07602-rm,46,2026-06-12
PXH-038-RM,"[Full Version] Amu Hanamiya, A Serious SEX With A G-cup Tall 172 Cm Tall, A Former Idol Who Charters A Godly AV Actress For One Day And Earnestly Instinctively Cum Shot Copulation [Uncensored L**ked]",https://pic.javct.net/poster/20212709/1635469231.jpg,https://javct.net/v/pxh-038-rm,130,2026-06-12
CRNX-261-RM,[4K] Dispatch personal trainer's beautiful butt temptation Ruru Haruno [Uncensored L**ked],https://pic.javct.net/poster/05192026/d094532083.jpg,https://javct.net/v/crnx-261-rm,49,2026-06-12
MFYD-147,"While My Wife, Who Is Pregnant With Our Second C**ld, Was Visiting Her Parents, I Had A Lot Of Sex With The Teacher At My Eldest Son's Daycare Center At Home.",https://pic.javct.net/poster/05192026/f90dbd0fa1.jpg,https://javct.net/v/mfyd-147,160,2026-06-12
PRED-874-RM,"Saturday Morning After A Drinking Party, I Was So Drunk Last Night I Didn't Notice, But My Senior Colleague's Sporty Underwear As She Woke Up Made Me Incredibly Excited And I Got A Morning Erection! I Came Inside Her Multiple Times, Once, Twice, Three Times, And Didn't Let Her Go Home Even After Sunset. Karen Yuzuriha [Uncensored L**ked]",https://pic.javct.net/poster/05192026/62aaf705bb.jpg,https://javct.net/v/pred-874-rm,120,2026-06-12
CRNX-263-RM,[4K] I cuckolded a single man in a racy swimsuit... Hikaru Miyanishi [Uncensored L**ked],https://pic.javct.net/poster/05192026/3d8b290b39.jpg,https://javct.net/v/crnx-263-rm,61,2026-06-12
IENFA-06102-RM,"My breasts belong to my brother.My sister is concerned about her breasts, which are growing bigger and bigger. I can't help but be curious about her boobs being played around with each other in defenseless poses! Yui Tomita [Uncensored L**ked]",https://pic.javct.net/poster/05192026/58e9bdc91f.jpg,https://javct.net/v/ienfa-06102-rm,44,2026-06-12
