code,title,image_url,page_url,views,date_scraped
HUNTB-551-RM,Unconscious Temptation! Sister's Pants Are 3 Cm In Front Of Me! My Sister-in-law Is A Rookie Esthetician! My Serious Sister-in-law Practices Surgery With My Body! It's Good To Do It Desperately... [Uncensored L**ked],https://pic.javct.net/poster/20230205/1683263347.jpg,https://javct.net/v/huntb-551-rm,240,2026-06-22
BAGR-089,"Two Maids Accompany A Young Lady On Her Wedding Night, Helping Her Practice.",https://pic.javct.net/poster/05192026/4b28b57898.jpg,https://javct.net/v/bagr-089,139,2026-06-22
TLDC-056,"Hell Is Like Heaven: ""I'll Do My Best Today As A Dick.''",https://pic.javct.net/poster/05192026/88fb5cb001.jpg,https://javct.net/v/tldc-056,68,2026-06-22
NOSKN-102,[ALL Unedited] NO Cut! NO SKIN! Nakadashi! Completely Uncut Video Of Real Creampie Sumire Aisaka,https://pic.javct.net/poster/05192026/2ff0e55ae1.jpg,https://javct.net/v/noskn-102,0,2026-06-22
XVSR-321,Life First!Live Vaginal Cum Shot SEX Closely Documents! Hatsumi Hatsumi,https://pic.javct.net/poster/05192026/b359efaa26.jpg,https://javct.net/v/xvsr-321,120,2026-06-22
NGHJ-064,"Would You Help This Virgin Boy With His Masturbation? A Super Cute And Kind Cheerleader Will Encourage The Virgin Boy's Sensitive Dick, And They'll Both Feel Good Over And Over Again During Their First Time Sex!",https://pic.javct.net/poster/05192026/9738ff4aef.jpg,https://javct.net/v/nghj-064,192,2026-06-22
MIGD-650,During The First Time Of The Intrinsic Out Nishida Karina,https://pic.javct.net/poster/05192026/b9db96c83f.jpg,https://javct.net/v/migd-650,160,2026-06-22
REAL-663,I Could Only Look At The Appearance Of Her (Kimi) Being Fucked By His Father And Being Developed.Mai Chan,https://pic.javct.net/poster/05192026/9fc41c3411.jpg,https://javct.net/v/real-663,120,2026-06-22
SCOP-627,A Young Teacher Who Visited At A Family Visit To A Widowed Mother's House Of Frustration Living With A C**ld And Two C**ldren Ahead Of Her Husband A Mother Who Has Been Muramura Due To A Young Man (chi ● Po) Who Has Been In Close Range After A Long Time ...,https://pic.javct.net/poster/05192026/89b85093c6.jpg,https://javct.net/v/scop-627,150,2026-06-22
MIST-257,Direct Hit On Dangerous Day !! Soapland Where You Can Make Babies 15 - Sakuragi Yukine,https://pic.javct.net/poster/05192026/cf117f571b.jpg,https://javct.net/v/mist-257,160,2026-06-22
URKK-104-RM,"At Least 10 Shots!! Big Tits Shaking As They Cum, And You Can Cum As Many Times As You Want In This Big Tits Rejuvenation And Aphrodisiac Salon Compilation II [Uncensored L**ked]",https://pic.javct.net/poster/20240807/1723256952.jpg,https://javct.net/v/urkk-104-rm,240,2026-06-22
POMD-002-RM,"[Amateur POV] While staring at each other for a long time, I'm going to have a good time SEX. Adultery Diary Kodue Minami Engaging With A Young Wife With Beautiful Legs [Uncensored L**ked]",https://pic.javct.net/poster/05192026/ecd28c4547.jpg,https://javct.net/v/pomd-002-rm,125,2026-06-22
543TAXD-051-RM,Maki The whole story of the evil deeds of a villainous taxi driver part.51 [Uncensored L**ked],https://pic.javct.net/poster/20231011/1698405754.jpg,https://javct.net/v/543taxd-051-rm,63,2026-06-22
543TAXD-049-RM,Miho The whole story of the evil deeds of a villainous taxi driver part.49 [Uncensored L**ked],https://pic.javct.net/poster/20231011/1697371057.jpg,https://javct.net/v/543taxd-049-rm,61,2026-06-22
543TAXD-047-RM,Kana The whole story of evil deeds by a villainous taxi driver part.47 [Uncensored L**ked],https://pic.javct.net/poster/20230804/1691580306.jpg,https://javct.net/v/543taxd-047-rm,59,2026-06-22
FOCS-091-RM,Zensho: Seeding Diary With An Innocent Girl Futaba Kurumi: A Neighborhood Girl I'Ve Known From A Long Time Is A Loser Who Accepts All The Sexual Desires Of A Middle-Aged Uncle [Uncensored L**ked],https://pic.javct.net/poster/20222109/1665722493.jpg,https://javct.net/v/focs-091-rm,125,2026-06-22
DVRT-021-RM,To My Older Sister Who Can't See Anything When She Takes Off Her Bottle-bottomed Glasses... Iori Tsukimi [Uncensored L**ked],https://pic.javct.net/poster/20230104/1682688014.jpg,https://javct.net/v/dvrt-021-rm,135,2026-06-22
BONY-049-RM,Black Money Loan! ! Money Pig File.01 Icup Young Wife Miu [Uncensored L**ked],https://pic.javct.net/poster/20230205/1684466751.jpg,https://javct.net/v/bony-049-rm,160,2026-06-22
ALDN-167-RM,A Jerky Woman Miki Yoshii [Uncensored L**ked],https://pic.javct.net/poster/20230205/1684554674.jpg,https://javct.net/v/aldn-167-rm,105,2026-06-22
SW-134-RM,Amateur Mature Woman Creampie Raw Footage Riu 43 Years Old A Mature Woman In Her 40's Like A Kawahara's Erotic Book Too Vulgar White Breast Press... Riu Nagata [Uncensored L**ked],https://pic.javct.net/poster/20221108/1662099664.jpg,https://javct.net/v/sw-134-rm,130,2026-06-22
JRZE-147-RM,First Shooting Age Fifty Wife Document Akiko Goto [Uncensored L**ked],https://pic.javct.net/poster/20230205/1683775572.jpg,https://javct.net/v/jrze-147-rm,120,2026-06-22
FC2PPV-4924767,"[No] Two black guys with big dicks, a cool beauty with long black hair and a princess cut, violently fucked, and a sweaty hardcore 3P with two consecutive vaginal cum shots at the end [Overseas version] Bonus included",https://pic.javct.net/poster/05192026/bf612b18b1.jpg,https://javct.net/v/fc2ppv-4924767,45,2026-06-22
MIST-105-RM,AV Actress To Be Squid In Front Of Friends [Uncensored L**ked],https://pic.javct.net/poster/05192026/45b27d8c6a.jpg,https://javct.net/v/mist-105-rm,160,2026-06-22
VOSS-092-RM,"This Mama Had An Itchy Crotch, So She Rubbed Some Cream On It, But It Turned Out To Be Aphrodisiac Cream Instead, So When She Rubbed It Into Her Pussy, She Got Hot And Horny! ""Fuck Me Hard, Please!"" Masturbation Alone Wasn't Enough To Satisfy Her, So She Spread Her Legs Wide And Begged Me To Shove My Cock Deep Into Her Pussy 2 [Uncensored L**ked]",https://pic.javct.net/poster/20221904/1653527451.jpg,https://javct.net/v/voss-092-rm,82,2026-06-22
