code,title,image_url,page_url,views,date_scraped
SCOP-812-RM,"Reunion After A Long Time With The Cutest Yankee Girl In School! Even Though I've Been Fooling My Virginity, I'm Full Of Vaginal Cum Shot To The Bimbo Who Makes My Body Jump From The Moment I Insert My Cock Once! 6 [Uncensored L**ked]",https://pic.javct.net/poster/20230206/1686372555.jpg,https://javct.net/v/scop-812-rm,135,2026-06-13
ABW-131-RM,An Adult Vaginal Cum Shot Excursion That Is Densely Spun By Just Two People. Nonoura Warm Trip02 ALL Raw Creampie 3SEX [Uncensored L**ked],https://static.javct.net/poster/abw-131.jpg,https://javct.net/v/abw-131-rm,180,2026-06-13
SRS-063-RM,Amateur Hunter 2 · 44 [Uncensored L**ked],https://pic.javct.net/poster/05192026/34e429c3ac.jpg,https://javct.net/v/srs-063-rm,135,2026-06-13
UGH-016-RM,L**ked! Detention center visiting room video File.03 5 people [Uncensored L**ked],https://pic.javct.net/poster/05192026/b44df9ec25.jpg,https://javct.net/v/ugh-016-rm,57,2026-06-13
TOTTE-263-RM,"A spider cowgirl chicken race where a swimsuit gal takes on the challenge! Get 100 yen for every piston! However, if you ejaculate, your prize money will be immediately forfeited! I have a big dick with a big erection! My rationality collapses and I can't stop shaking my hips, so I end up creampied! ? Take a picture and put it out! Magic Mirror Issue ~Sana Edition~ [Uncensored L**ked]",https://pic.javct.net/poster/05192026/a0877cb762.jpg,https://javct.net/v/totte-263-rm,58,2026-06-13
PRED-881-RM,Former Local TV Announcer's First Ever Unprotected Sex! 10 Shots Of Semen Injected Into Her Innocent Pussy In A Special Edition - Kana Tamura [Uncensored L**ked],https://pic.javct.net/poster/05192026/48e7ea3a3a.jpg,https://javct.net/v/pred-881-rm,160,2026-06-13
HMN-882-RM,"AV Actresses Just Have To Show Sex, Right? No! A Newcomer With Beautiful Breasts Who's A Little Too Confident Will Be Taught The Initiation Of AV Filming. First Shoot, First Cumshot, Orgasmic Sex Debut. Cute Little Bird [Uncensored L**ked]",https://pic.javct.net/poster/05192026/cad39354c3.jpg,https://javct.net/v/hmn-882-rm,130,2026-06-13
HIKR-259-RM,A big game of sex with the house studio manager in Los Angeles! Hello West (24) [Uncensored L**ked],https://pic.javct.net/poster/05192026/97e52c2046.jpg,https://javct.net/v/hikr-259-rm,83,2026-06-13
DVMM-410,"Documentary About A Working Woman's AV Debut: Akari (21 Years Old), The No. 1 Hostess At A High-class Club. With Her Translucent Skin, Moist Eyes, And Lustrous Hair, This Perverted Beauty Who Loves Fellatio And Cum Swallowing Makes Her One-time AV Debut.",https://pic.javct.net/poster/05192026/43477d3e0d.jpg,https://javct.net/v/dvmm-410,145,2026-06-13
DVMM-407,"A Female College Student Aiming To Become An AV Announcer Takes On The Challenge Of Reporting On A Hoarder's House That's Causing Trouble For The Neighbors! During The Interview, A Horny Old Man Who Hasn't Had Sex In Over 10 Years Goes Wild And Immediately Thrusts His Foul-smelling, Dirty Dick Into Her! He Keeps Thrusting Without Pulling Out Until He's Poured Out All The Semen He's Been Saving Up...",https://pic.javct.net/poster/05192026/3db5cf46ed.jpg,https://javct.net/v/dvmm-407,175,2026-06-13
EMTH-262,Plump And Voluptuous Women 5-Hour 30-Minute Extended Special: Kneading And Cumming Inside Their Bountiful Breasts! A Thorough Sex Documentary Of 8 Voluptuous Mature Women With Insatiable Sex Drives,https://pic.javct.net/poster/05192026/b6aeb240c8.jpg,https://javct.net/v/emth-262,330,2026-06-13
NKKD-363,"My Wife (30) Was Seduced By A Part-time Worker (20) At Her Workplace... → I'm So Upset, So Please Release This As An Adult Video. ()",https://pic.javct.net/poster/05192026/c553dc6df7.jpg,https://javct.net/v/nkkd-363,140,2026-06-13
SYKH-193,"Boots Beauty PREMIUM: The Art Of Dressing - Kasumi, 27 Years Old, Tsukino Kasumi",https://pic.javct.net/poster/05192026/b5609761ce.jpg,https://javct.net/v/sykh-193,130,2026-06-13
SUJI-311,"""He's Underestimating Me, So He's Doomed."" Unconscious Giant Cock Inserted Without Consent, Humiliating Pleasure, Drug-fueled Sex, Falling Into Depravity, Making A Sassy, Cold Girl Understand, Fo**ed Pussy Fucking, Cumming Inside, Apology, Shaved Pussy, Student Kaho Hanamori Natsuho",https://pic.javct.net/poster/05192026/c3c600ed7c.jpg,https://javct.net/v/suji-311,115,2026-06-13
SQTE-693,"More Than Friends With Benefits, Less Than Lovers. Cosplay! Cumming Inside! A Beautiful Girl With Insatiable Sexual Appetite And Endless Sex On Camera! Hanamori Natsuho",https://pic.javct.net/poster/05192026/96ba5363e4.jpg,https://javct.net/v/sqte-693,118,2026-06-13
MNGS-060-RM,"My Arrogant Female Boss Is Getting Married, So I Trained Her With A Super-intense, 1000x-sensitivity Aphrodisiac Remote Vibrator And Turned Her Wedding Into A Hellish, Near-orgasm-induced, Incontinent Wedding. - Misono Waka [Uncensored L**ked]",https://pic.javct.net/poster/05192026/f7c2b8f445.jpg,https://javct.net/v/mngs-060-rm,180,2026-06-13
ONSG-106,"Big-breasted Escort Girl, H-cup, Kaho Shirahama",https://pic.javct.net/poster/05192026/d3fbee7cc0.jpg,https://javct.net/v/onsg-106,130,2026-06-13
GVH-853,Forbidden Caregiving - Nagisa Tanimura,https://pic.javct.net/poster/05192026/8e1d861660.jpg,https://javct.net/v/gvh-853,120,2026-06-13
SQTE-692,My Junior Who's Always Available As A Sex Toy: Yuika Onosaka,https://pic.javct.net/poster/05192026/11f9928214.jpg,https://javct.net/v/sqte-692,109,2026-06-13
MRSS-188,"In This Corrupt Village, Unable To Bear A C**ld For My Beloved Wife, I Could Not Resist The Corrupt Customs Of The Village And Could Only Watch In Silence As She Was Impregnated By Men. - Shiori Imoto",https://pic.javct.net/poster/05192026/403469f8cd.jpg,https://javct.net/v/mrss-188,129,2026-06-13
MDBK-116-RM,Super Nasty Luxury Delivery Health Miss 4 Who Will Ejaculate Many Times With The Finest Body [Uncensored L**ked],https://pic.javct.net/poster/05192026/cd1015d963.jpg,https://javct.net/v/mdbk-116-rm,155,2026-06-13
SUJI-312,"Found An Abandoned Baby In Front Of My House... It's A Tiny, Hairless Hinano-chan, 146cm Tall, Minami Hinano",https://pic.javct.net/poster/05192026/0aa77fbcdb.jpg,https://javct.net/v/suji-312,107,2026-06-13
DVAJ-349-SUB,"My Stepsister Lets Me Put The First 3 cm In, Just Barely Not Fakecest Nanami Kawakami [English Subtitle]",https://pic.javct.net/poster/20220406/1656313947.jpg,https://javct.net/v/dvaj-349-sub,125,2026-06-13
MNGS-062-RM,"S-class Slender Beauty Sora Amakawa Is Showcased In Stunning Visuals (recorded With 4K Equipment). After Years Of Abstinence, She Devours Male Actors As She Pleases, Becoming A Lusty Slut In 6 Segments With 14 Cumshots And Milking In This Special. [Uncensored L**ked]",https://pic.javct.net/poster/05192026/3ab6a2ff13.jpg,https://javct.net/v/mngs-062-rm,220,2026-06-13
