code,title,image_url,page_url,views,date_scraped
MISM-142-RM,Crazy Anal Fuck Mazo [Uncensored L**ked],https://pic.javct.net/poster/05192026/bb4e18d9a5.jpg,https://javct.net/v/mism-142-rm,220,2026-06-24
YMRK-070,Brutal Manager Creampie R**e Victim Room 701 Female Student MiMi,https://pic.javct.net/poster/05192026/0c7cf38fd8.jpg,https://javct.net/v/ymrk-070,73,2026-06-24
SCOP-628,Put Ji ● Port In The Upper And Lower Holes! !Onitsuki Deep Throating SEX 30 People 4 Hours,https://pic.javct.net/poster/05192026/f531e43b02.jpg,https://javct.net/v/scop-628,240,2026-06-24
MISM-141-RM,AF Feels Good Enough To Melt The Brain!De M Tsurman Hentai Anal Fuck I Love My Daughter! Rui Uzuki [Uncensored L**ked],https://pic.javct.net/poster/05192026/00477beb0c.jpg,https://javct.net/v/mism-141-rm,180,2026-06-24
CEMD-308-RM,I Went On A Deep Throat Date In The Downtown Area While Wearing Tobiko! White Flower [Uncensored L**ked],https://pic.javct.net/poster/20230302/1678511880.jpg,https://javct.net/v/cemd-308-rm,138,2026-06-24
HUNBL-158-RM,Runaway Girl Confinement Bathroom Chain R**e [Uncensored L**ked],https://pic.javct.net/poster/20230205/1683261827.jpg,https://javct.net/v/hunbl-158-rm,110,2026-06-24
HUNBL-092-RM,Women's  Raw Public Toilet Leap [Uncensored L**ked],https://pic.javct.net/poster/20221904/1651817150.jpg,https://javct.net/v/hunbl-092-rm,170,2026-06-24
HUNBL-124-RM,Masochistic Perverted Therapist With An Ecstatic Expression - [Uncensored L**ked],https://pic.javct.net/poster/20233001/1677207845.jpg,https://javct.net/v/hunbl-124-rm,140,2026-06-24
HUNBL-120-RM,Abducted By A Worker At A Construction Site And Suspended In A Restraint Ring [Uncensored L**ked],https://pic.javct.net/poster/20222311/1671763165.jpg,https://javct.net/v/hunbl-120-rm,110,2026-06-24
HUNBL-086-RM,Face Fucked As Soon As They Open The Door! 20 Sudden Deep Throat Blowjobs! 20 Loads Of Cum Swallowed! 2 [Uncensored L**ked],https://pic.javct.net/poster/20221202/1647652502.jpg,https://javct.net/v/hunbl-086-rm,142,2026-06-24
MIAD-981-SUB,Convulsions Climax Silent Les × Up Help Call In Rough Has Been Been Afraid That Being Labeled Fucked K**led Press The Voice Was School Girls Yuri Asada [English Subtitle],https://pic.javct.net/poster/04112026/05ec0ba910.jpg,https://javct.net/v/miad-981-sub,150,2026-06-24
BONY-049-RM,Black Money Loan! ! Money Pig File.01 Icup Young Wife Miu [Uncensored L**ked],https://pic.javct.net/poster/20230205/1684466751.jpg,https://javct.net/v/bony-049-rm,160,2026-06-24
DOTM-004-RM,"Local Young Wife Akari Who Gets Wet Other Than Her Husband A 25-Year-Old Osaka Resident ""My First Gokkun Was In 6th Grade"" A Newlywed Wife Semen 11 Semen Drinking Men On A Sperm Donation Bulletin Board [Uncensored L**ked]",https://pic.javct.net/poster/20230104/1682911406.jpg,https://javct.net/v/dotm-004-rm,135,2026-06-24
HUNBL-032-RM,Amnesiac Woman [Uncensored L**ked],https://pic.javct.net/poster/05192026/ecc5d1afef.jpg,https://javct.net/v/hunbl-032-rm,170,2026-06-24
476MLA-278-RM,[Main story] The tide will not stop because it feels too good ~ Until the high-education miscon female college student who is too cute with big tits falls into pleasure ~ [Uncensored L**ked],https://pic.javct.net/poster/05192026/fb49d0733b.jpg,https://javct.net/v/476mla-278-rm,86,2026-06-24
476MLA-278,[Main story] The tide will not stop because it feels too good ~ Until the high-education miscon female college student who is too cute with big tits falls into pleasure ~,https://pic.javct.net/poster/05192026/fb49d0733b.jpg,https://javct.net/v/476mla-278,86,2026-06-24
IPZ-964,Trained Idle Neck Str**gled!Tide Blows!Continuous Spanking!Nipple Twists!Breakup Torn! Minami Aizawa,https://pic.javct.net/poster/05192026/7bfbe02ce9.jpg,https://javct.net/v/ipz-964,120,2026-06-24
MISM-139-RM,"Anal NTS From Now On, I Have A Daughter-in-law's Anal. Megumi 26-year-old Husband Of Mazo Love Wife Megumi Anal Cuckold Training Diary [Uncensored L**ked]",https://pic.javct.net/poster/05192026/7ae30b6bdb.jpg,https://javct.net/v/mism-139-rm,160,2026-06-24
MIAE-227-SUB,A Female Teacher Who Strikes DQN And Gets Stuck In All Four Anal Sexes Is Convulsant Lespe Shinoda Yu [English Subtitle],https://pic.javct.net/poster/04112026/1c6c0a65b6.jpg,https://javct.net/v/miae-227-sub,120,2026-06-24
MISM-445-RM,"""I Want To Know My True Limits."" Anal Training Beyond Heaven, Overk**l Orgasm. Penis-focused 3-hole Destruction Activity. Aoi Ai [Uncensored L**ked]",https://pic.javct.net/poster/05192026/0c482bed65.jpg,https://javct.net/v/mism-445-rm,140,2026-06-24
MVG-167-RM,"I Took Revenge On My Shitty Boss's Cute Daughter By Brainwashing And Hypnotizing Her, Then I Broke Her Down With Deep Throat Fellatio Until She Wet Herself Profusely. - Kohinata Meru [Uncensored L**ked]",https://pic.javct.net/poster/05192026/390b5d5d26.jpg,https://javct.net/v/mvg-167-rm,145,2026-06-24
MISM-444-RM,"No Matter How Much You Apologize Or Scream, It Won't Stop. A Woman With A Merciless Desire To Be R**ed, To**ured, And Hyper-to**ured, With Her Throat, Asshole, And Pussy Being Penetrated In All Three Holes. Otogoto Rui [Uncensored L**ked]",https://pic.javct.net/poster/05192026/57e998964e.jpg,https://javct.net/v/mism-444-rm,110,2026-06-24
MISM-449-RM,"""Drink → Vomit → Hold It In"" The Most Insane Irrumatio Extreme Recycling. The Vomit-drinking Drain Woman. Futaba Emma [Uncensored L**ked]",https://pic.javct.net/poster/05192026/25657e9d12.jpg,https://javct.net/v/mism-449-rm,120,2026-06-24
MISM-448-RM,An Immature Girl Who Wandered In. The Most Insane Obedient Fellatio Iori [Uncensored L**ked],https://pic.javct.net/poster/05192026/ee76fc9a2c.jpg,https://javct.net/v/mism-448-rm,120,2026-06-24
