code,title,image_url,page_url,views,date_scraped
DOCP-180-RM,"I'm Gonna Get It! Add To The Weakness Of The Beauty Maid Who Has Been Dispatched In The Housekeeping Agency Service, And Follow-up Piston Fo**ed Out! 2 [Uncensored L**ked]",https://pic.javct.net/poster/07052026/fb498a3fa0.jpg,https://javct.net/v/docp-180-rm,235,2026-07-15
DDFF-044-RM,Throat R**e X Nipple R**e Aesthetician Yuri Adachi,https://pic.javct.net/poster/09052025/1760723477.jpg,https://javct.net/v/ddff-044-rm,121,2026-07-15
XRW-777-RM,"Take In Bondage Fucker Half Married Woman On SNS And Take It To Me, To**ure Rolling Training Nishida Karina [Uncensored L**ked]",https://pic.javct.net/poster/07052026/18a603c5af.jpg,https://javct.net/v/xrw-777-rm,101,2026-07-15
XRW-979-RM,Throat Ma ● Co Creampie Beautiful Girl Training Deep Throating Mio Ichijo [Uncensored L**ked],https://pic.javct.net/poster/07052026/df2a3489c9.jpg,https://javct.net/v/xrw-979-rm,230,2026-07-15
MISM-165-RM,"Roll It Up Until It Spits Out, Drink It And Spit It Again The Most Crazy Reverse Deep Throat In History [Uncensored L**ked]",https://pic.javct.net/poster/07052026/d08ab86d6e.jpg,https://javct.net/v/mism-165-rm,180,2026-07-15
MISM-173-RM,Beautiful Masochist Excavation Good-looking Indoor Girls AV Debut To Marvel When An Acquaintance Knows [Uncensored L**ked],https://pic.javct.net/poster/07052026/6757af859a.jpg,https://javct.net/v/mism-173-rm,150,2026-07-15
300MIUM-1445,"[Kneel down and use the back of your throat to serve me] She kneels down with every inch of her carefully manicured body, and as she holds out her cock, her plump lips touch it, and it guides her into her warm mouth.",https://pic.javct.net/poster/07052026/f7ec6895ad.jpg,https://javct.net/v/300mium-1445,65,2026-07-15
FSBK-025-RM,"Sexual Fetish Unleashed: Deep Throat And Asshole Fucking, Triple Hole Training By The Person She Loves, Turning Her Into A Masochist, Anal Beauty Mayuri, Takeuchi Mayuri [Uncensored L**ked]",https://pic.javct.net/poster/07052026/123e4decca.jpg,https://javct.net/v/fsbk-025-rm,137,2026-07-15
HUNBL-128-RM,"A Girl Was Supposed To Only Sell Pants, But She Was Taken To An Empty Place And Fo**ed To Fuck Her. [Uncensored L**ked]",https://pic.javct.net/poster/20230302/1678424960.jpg,https://javct.net/v/hunbl-128-rm,120,2026-07-15
REAL-640-RM,Pole Blowjob Cum Drinking Heaven Fountain? [Uncensored L**ked],https://pic.javct.net/poster/05192026/facce8c06f.jpg,https://javct.net/v/real-640-rm,130,2026-07-15
REAL-637-RM,Very Blow Job Cum Heaven Natsume Airi [Uncensored L**ked],https://pic.javct.net/poster/05192026/e2a433ba0d.jpg,https://javct.net/v/real-637-rm,120,2026-07-15
JUY-355-RM,I Can't Tell My Dear Husband I Like Cock That Reaches The Back Of My Throat Hikari Anzai [Uncensored L**ked],https://pic.javct.net/poster/20220406/1656495894.jpg,https://javct.net/v/juy-355-rm,116,2026-07-15
348NTR-105-RM,"[NTR] I know that women in the early aughts have a great sexual desire, and basically if you call them, they'll let you fuck them lol [Uncensored L**ked]",https://pic.javct.net/poster/07052026/ddaa5c4530.jpg,https://javct.net/v/348ntr-105-rm,66,2026-07-15
MISM-064-RM,"Piercing Until Spits, The Most Crazy Deep Throat History Ever [Uncensored L**ked]",https://pic.javct.net/poster/07052026/f9b07e93b2.jpg,https://javct.net/v/mism-064-rm,150,2026-07-15
MISM-053-RM,She's Getting Pumped Until She Gags In The World's Craziest Blowjob Frenzy Mihara Honoka [Uncensored L**ked],https://pic.javct.net/poster/20222410/1668449684.jpg,https://javct.net/v/mism-053-rm,180,2026-07-15
DDFF-019-RM,Heinous Throat Wedding Planner - Iroha Minami [Uncensored L**ked],https://pic.javct.net/poster/20212011/1642232685.jpg,https://javct.net/v/ddff-019-rm,126,2026-07-15
348NTR-105,"[NTR] I know that women in the early aughts have a great sexual desire, and basically if you call them, they'll let you fuck them lol",https://pic.javct.net/poster/07052026/ddaa5c4530.jpg,https://javct.net/v/348ntr-105,66,2026-07-15
FC2PPV-4937309,"Natural beauty fully showing her face, **pyjpx*jsps, worried about the shooting, I'm going home...'' Tears, regret, crying, all you want'' creampie, 550th individual shooting",https://pic.javct.net/poster/07052026/57f03b9269.jpg,https://javct.net/v/fc2ppv-4937309,217,2026-07-15
XRW-772-RM,Throat ● Co Pies Beautiful Girl To**ure Deep Throating Nazuna Nonohara [Uncensored L**ked],https://pic.javct.net/poster/07052026/06569502dc.jpg,https://javct.net/v/xrw-772-rm,160,2026-07-15
REAL-632-RM,Healing Likeness Of Retreat Deep Throw Hospitality Tsuno Miho [Uncensored L**ked],https://pic.javct.net/poster/20222410/1668326610.jpg,https://javct.net/v/real-632-rm,115,2026-07-15
LOCK-013-RM,LOCK-ON@Luna A Super Cold And Arrogant Sugar Baby J-type Girl Is Made To Understand And Is Fo**ed Into A Deep Throat Fuck And Cummed Inside. Amane Luna [Uncensored L**ked],https://pic.javct.net/poster/07052026/b39e63f135.jpg,https://javct.net/v/lock-013-rm,120,2026-07-15
LOCK-013,LOCK-ON@Luna A Super Cold And Arrogant Sugar Baby J-type Girl Is Made To Understand And Is Fo**ed Into A Deep Throat Fuck And Cummed Inside. Amane Luna,https://pic.javct.net/poster/07052026/b39e63f135.jpg,https://javct.net/v/lock-013,120,2026-07-15
FSBK-025,"Sexual Fetish Unleashed: Deep Throat And Asshole Fucking, Triple Hole Training By The Person She Loves, Turning Her Into A Masochist, Anal Beauty Mayuri, Takeuchi Mayuri",https://pic.javct.net/poster/07052026/123e4decca.jpg,https://javct.net/v/fsbk-025,137,2026-07-15
DSOD-018-RM,"All Those Who Have A Grudge Against This Arrogant Woman, Gather Here! A Super Creepy Guy's Relentless, Brutal To**ure And R**e Will Break Her Down Mentally! A Cum-filled Spittoon Is Born During Sex! Rei Kuroshima [Uncensored L**ked]",https://pic.javct.net/poster/07052026/444f76c68f.jpg,https://javct.net/v/dsod-018-rm,140,2026-07-15
