code,title,image_url,page_url,views,date_scraped
YTR-163-RM,Noka Sato Did It For A Whole 4 Hours. [Uncensored L**ked],https://pic.javct.net/poster/20230908/1695366063.jpg,https://javct.net/v/ytr-163-rm,240,2026-07-02
ABP-920-RM,The Female Manager Is Our Sexual Processing Pet. 036 Nonoura Warm [Uncensored L**ked],https://pic.javct.net/poster/05192026/3bb30f5284.jpg,https://javct.net/v/abp-920-rm,185,2026-07-02
FW-012,A wife who was fucked by her father-in-law without telling her husband. Stepdaughter Aoi Aosaka awakens to a new sexual desire and gets used to the meat urinal life,https://pic.javct.net/poster/05192026/d473c572da.jpg,https://javct.net/v/fw-012,148,2026-07-02
XVT-067,Behind the Scenes/Interview I tried to verify how far I can go in a pressure interview. Mari Azusa,https://pic.javct.net/poster/05192026/006e27013f.jpg,https://javct.net/v/xvt-067,76,2026-07-02
YMDS-296,"Insect tongues swarm Yuno Sakura, a big-breasted honor student who becomes a substitute sacrifice in a hospital room late at night",https://pic.javct.net/poster/05192026/1a2284b002.jpg,https://javct.net/v/ymds-296,58,2026-07-02
YMDS-295,"Insect tongues swarm Ruka Itoi, a beautiful girl with big breasts and an athlete in uniform who climaxes after being licked around in the hospital room",https://pic.javct.net/poster/05192026/eddac851eb.jpg,https://javct.net/v/ymds-295,60,2026-07-02
TKI-101-RM,MASOTRONIX 01 01 Out In Bondage Collapse Acme [Uncensored L**ked],https://pic.javct.net/poster/05192026/0ae56a9620.jpg,https://javct.net/v/tki-101-rm,125,2026-07-02
XBS-003-RM,Masochist Dirty Beast Gero Training 2nd Chihiro Hirose [Uncensored L**ked],https://pic.javct.net/poster/05192026/fdbb9777b2.jpg,https://javct.net/v/xbs-003-rm,122,2026-07-02
BBTU-093-RM,Tied Breasts To**ure Copulation Souka Minamihata [Uncensored L**ked],https://pic.javct.net/poster/20241115/1734148451.jpg,https://javct.net/v/bbtu-093-rm,106,2026-07-02
SDAB-202-SUB,White Slender Schoolgirl Who Can't Get Interested in Boys of Her Generation - Sakura Ren [English Subtitle],https://pic.javct.net/poster/20212709/1635563120.jpg,https://javct.net/v/sdab-202-sub,135,2026-07-02
ANAV-008-RM,Deep Throat specializing in drawing Shizune Tachibana [Uncensored L**ked],https://pic.javct.net/poster/01202026/1770485936282.jpg,https://javct.net/v/anav-008-rm,150,2026-07-02
FC2PPV-4928009,"[Individual shooting] Downer beauty, ejaculation in mouth and vagina twice",https://pic.javct.net/poster/05192026/26c20ca05f.jpg,https://javct.net/v/fc2ppv-4928009,82,2026-07-02
34ID-017-RM,25 people recommended cosplay beautiful girl blowjob video collection 4 hours [Uncensored L**ked],https://pic.javct.net/poster/05192026/8cd157f872.jpg,https://javct.net/v/34id-017-rm,244,2026-07-02
GDJP-011-RM,"Tracking, Begging On Your Knees To Pick Up Women, Screaming, K**ling Married Women 11 [Uncensored L**ked]",https://pic.javct.net/poster/05192026/f62f1413c1.jpg,https://javct.net/v/gdjp-011-rm,140,2026-07-02
GDJP-008-RM,"Pursuit, Kneeling, Picking Up, Screaming, Married Woman K**ler 8 [Uncensored L**ked]",https://pic.javct.net/poster/05192026/f4de5624a3.jpg,https://javct.net/v/gdjp-008-rm,140,2026-07-02
SUN-082-RM,A Beautiful Lady Who Wants To Taste Semen To The Back Of Her Throat Gokkun Outdoor Date With A Maso Wife [Uncensored L**ked],https://pic.javct.net/poster/20230104/1680408545.jpg,https://javct.net/v/sun-082-rm,189,2026-07-02
MAAN-1178-RM,[Pervert Masochist woman who loves banging] A full-course punishment of a natural masochist who feels pleasure when she is slapped. Thoroughly stimulates the portio with a belly pan and holds her head down and treats her like a masturbator from behind and goes crazy with a creamy face and can't stop convulsing. [Pretty neighbor] [Mayuri] [Uncensored L**ked],https://pic.javct.net/poster/05192026/81f9e998b4.jpg,https://javct.net/v/maan-1178-rm,62,2026-07-02
TKI-093-RM,Enchanting Boobs Slave 08 Big Tits Slave And Thick Sperm 24 Shots [Uncensored L**ked],https://pic.javct.net/poster/05192026/44023187f2.jpg,https://javct.net/v/tki-093-rm,125,2026-07-02
GTJ-093-RM,Rough Play/Meat Ball Aya Shiomi [Uncensored L**ked],https://static.javct.net/poster/gtj-093.jpg,https://javct.net/v/gtj-093-rm,123,2026-07-02
MXGS-095-RM,FUCK Love Affair Of Miss Akiho Cast No.1 Queen! Akiho Yoshizawa [Uncensored L**ked],https://pic.javct.net/poster/20230207/1690213263.jpg,https://javct.net/v/mxgs-095-rm,135,2026-07-02
300MIUM-1366-RM,"[I will lend you a super masochistic woman] ""Master'' is always one pattern... I want you to tease me more, but I want you to tease me more, but I'm a curious woman with a mouthful mouth. I don't stop even if I can't stop deep throating. I like it until it's time for a deep throat. I'm a hodai user. Hodai M is OK with anything because I'm a M... [Masochist's home Q delivery] [Uncensored L**ked]",https://pic.javct.net/poster/05192026/382ffba956.jpg,https://javct.net/v/300mium-1366-rm,105,2026-07-02
FC2PPV-4929598,"Sumire (18) Anal licking, creampie, anal penetration ATM, and other unreleased scenes are included.",https://pic.javct.net/poster/05192026/6186e5b0c2.jpg,https://javct.net/v/fc2ppv-4929598,114,2026-07-02
300MIUM-1366,"[I will lend you a super masochistic woman] ""Master'' is always one pattern... I want you to tease me more, but I want you to tease me more, but I'm a curious woman with a mouthful mouth. I don't stop even if I can't stop deep throating. I like it until it's time for a deep throat. I'm a hodai user. Hodai M is OK with anything because I'm a M... [Masochist's home Q delivery]",https://pic.javct.net/poster/05192026/382ffba956.jpg,https://javct.net/v/300mium-1366,105,2026-07-02
XRW-732-RM,"Making My Tall, Proud And Aspirational Female Boss Give Deep Throat!! Honoka Takigawa [Uncensored L**ked]",https://pic.javct.net/poster/20221904/1652841107.jpg,https://javct.net/v/xrw-732-rm,181,2026-07-02
