code,title,image_url,page_url,views,date_scraped
VDD-204-RM,Female Teacher In... (Threatening Suite Room) Rei Kuroshima [Uncensored L**ked],https://pic.javct.net/poster/04112026/25c93dfee9.jpg,https://javct.net/v/vdd-204-rm,131,2026-06-04
BBTU-071-RM,Big Breasted Black Gal Throat Fuck Rumina Sena [Uncensored L**ked],https://pic.javct.net/poster/20231711/1700276960.jpg,https://javct.net/v/bbtu-071-rm,101,2026-06-04
REAL-640,Pole Blowjob Cum Drinking Heaven Fountain?,https://pic.javct.net/poster/05192026/facce8c06f.jpg,https://javct.net/v/real-640,130,2026-06-04
ABW-123-RM,Aesthetics Of Facial Cumshots 15 Sprinkle The Cloudy Man Juice That Has Accumulated On The Face Of A Beautiful Woman Mai Nanami [Uncensored L**ked],https://static.javct.net/poster/abw-123.jpg,https://javct.net/v/abw-123-rm,195,2026-06-04
MISM-130-RM,The Most Crazy Fans Grieve And Mourn Imamachio Idol Throat Injured Illusionous Cock Meat Stick My Throat Training Training With A Microphone!Gebo Injection! Aoi Kokoro [Uncensored L**ked],https://pic.javct.net/poster/05192026/4e232eb027.jpg,https://javct.net/v/mism-130-rm,180,2026-06-04
FOCS-066-RM,"Sensitive, Luxurious Small Tits. Intense Orgasms And Non-stop Pleasure During Hard Creampie Fucking. Yui Setouchi [Uncensored L**ked]",https://pic.javct.net/poster/20221904/1652427613.jpg,https://javct.net/v/focs-066-rm,119,2026-06-04
MXGS-742-RM,Cum Spree Climax Goddess Aso Nozomi [Uncensored L**ked],https://pic.javct.net/poster/05192026/5613fc9ea2.jpg,https://javct.net/v/mxgs-742-rm,120,2026-06-04
DFDM-074,Uncle And P-Activity J-Type - A Seemingly Quiet But Secretly Perverted J-type Girl's Record Of Sleeping With Older Men - Nagisa Yasaka,https://pic.javct.net/poster/05192026/af5a40a22d.jpg,https://javct.net/v/dfdm-074,122,2026-06-04
YST-353,"Regardless Of Whether It's Vulgar Or Refined, I Want To Toy With Minato-san In A Truly Brutal Way.",https://pic.javct.net/poster/05192026/5501678514.jpg,https://javct.net/v/yst-353,103,2026-06-04
ABP-749,"Cum Shot Fucking Raw, Pretty Cum Shot Intercourse. To Forget Me And Go To The Vagina Of Sukimura Crazy I Got An Unlimited Creampie Inside Outbreak Kazura Suzumura Airo",https://pic.javct.net/poster/05192026/d625c6bc88.jpg,https://javct.net/v/abp-749,240,2026-06-04
REAL-637,Very Blow Job Cum Heaven Natsume Airi,https://pic.javct.net/poster/05192026/e2a433ba0d.jpg,https://javct.net/v/real-637,120,2026-06-04
YSN-660,I Want To Devour My Sister's Amazing Body. - Minato Haru,https://pic.javct.net/poster/05192026/d70b053e54.jpg,https://javct.net/v/ysn-660,107,2026-06-04
BBTU-068-RM,Big Tits Masochist Squirt Splash Fuck Marina Yuzuki [Uncensored L**ked],https://pic.javct.net/poster/20231011/1697255819.jpg,https://javct.net/v/bbtu-068-rm,134,2026-06-04
MISM-129-RM,Hard Maso Idol AV Debut That Will Destroy Fans' Dreams Authentic Underground Idols Swap Microphones To Chi-po And They Rage Extremely Rash! Mazuakumé! Aoi Kokoro [Uncensored L**ked],https://pic.javct.net/poster/05192026/ed7fa6cb44.jpg,https://javct.net/v/mism-129-rm,210,2026-06-04
DFE-060-RM,Skewered Full Bocco Ayaka Hirosaki [Uncensored L**ked],https://pic.javct.net/poster/20221904/1650615563.jpg,https://javct.net/v/dfe-060-rm,127,2026-06-04
FC2PPV-4912083,☆4 ejaculations☆ E cup beautiful big breasted nursery teacher (20) Squirting SEX in agony with great excitement due to the big thick penis that reaches deep inside,https://pic.javct.net/poster/05192026/83e75fd418.jpg,https://javct.net/v/fc2ppv-4912083,93,2026-06-04
DGRE-001-RM,Throat Attribute Shablist Minohara Honoka [Uncensored L**ked],https://pic.javct.net/poster/05192026/a0632fb923.jpg,https://javct.net/v/dgre-001-rm,120,2026-06-04
DOCP-033-RM,A Surprised Female College Student Who Falls Instantly And Suddenly To A Pleasure That Is Fucked In His Throat With Ambush Irama [Uncensored L**ked],https://pic.javct.net/poster/05192026/27ed582a18.jpg,https://javct.net/v/docp-033-rm,135,2026-06-04
REAL-563-RM,Bondage Breasts Demon Capitalize Herbs Chitose [Uncensored L**ked],https://pic.javct.net/poster/20221904/1652915963.jpg,https://javct.net/v/real-563-rm,120,2026-06-04
PIYO-235-RM,"[Perverted Desires] People Say I Look Serious, But I Want To Try Abnormal Sex... We All Took Turns Messing Up An Intelligent, Bespectacled High School Girl Whose Face Was Bright Red And Who Was Moaning Uncontrollably... She Has A Great Personality, Is A Closet Pervert, And Is A Juicy Beauty. [Uncensored L**ked]",https://pic.javct.net/poster/05192026/6b7f91ab2b.jpg,https://javct.net/v/piyo-235-rm,190,2026-06-04
MISM-128-RM,Toilets Dating Liked Old Man Melancholy Of Luxury Bishou And Secret Raw Bunny Cuddling Out Toilet Sexual Intercourse! [Uncensored L**ked],https://pic.javct.net/poster/05192026/eb7288be94.jpg,https://javct.net/v/mism-128-rm,150,2026-06-04
PXH-019-RM,Obo Girl 003 Sacchan (20) From Miyazaki God Milk I-cup Spanking Favorite Big Breast Freeter Strangling Climax Constitution Explosive Iki Premature Ejaculation Girl [Uncensored L**ked],https://pic.javct.net/poster/05192026/dd82b18c2e.jpg,https://javct.net/v/pxh-019-rm,150,2026-06-04
CEMD-273-RM,A Woman Drowning In Overflowing Sexual Impulses Sex Donna Yui Hatano 2 Super Erotic 4SEX [Uncensored L**ked],https://pic.javct.net/poster/20222311/1671854735.jpg,https://javct.net/v/cemd-273-rm,245,2026-06-04
HODV-21589-RM,"Suzuka Nakajo, A Slender Beauty Of A Bottomless Domaso Meat Urinal [Uncensored L**ked]",https://static.javct.net/poster/hodv-21589.jpg,https://javct.net/v/hodv-21589-rm,133,2026-06-04
