code,title,image_url,page_url,views,date_scraped
YST-296-RM,I'm A Pervert Who Drips Pussy Juice Even Though My Father-in-law Treats Me As A Mouth. Umino Firefly [Uncensored L**ked],https://pic.javct.net/poster/20230205/1685072262.jpg,https://javct.net/v/yst-296-rm,104,2026-06-15
SDDE-493-RM,Semen Collection Special Explosion Suction / Swallow Throat Swallow Ward VER 3.0.0 [Uncensored L**ked],https://pic.javct.net/poster/05192026/ba8389bf07.jpg,https://javct.net/v/sdde-493-rm,240,2026-06-15
SRS-067-RM,Bimbo Document Rena-chan 22-year-old Cram School Teacher File.07 [Uncensored L**ked],https://pic.javct.net/poster/05192026/58f416c669.jpg,https://javct.net/v/srs-067-rm,135,2026-06-15
DDFF-052-RM,Throat Fuck X Nipple Fuck Esthetician Yuri [Uncensored L**ked],https://pic.javct.net/poster/05192026/b4046542d6.jpg,https://javct.net/v/ddff-052-rm,124,2026-06-15
MIGD-641,Human Body Fixed Anal Slave History Takanashi,https://pic.javct.net/poster/05192026/bb4e9afa6d.jpg,https://javct.net/v/migd-641,120,2026-06-15
MAAN-1176-RM,"[Masochist play with my favorite actor] It's been a long time since I've been horny and I can't stop looking for a deep masochist woman who keeps cumming while screaming w With a face covered in semen, I'm ready for the second round from the cock sucking, intense sex [Thanks Bitch] [Bookmark] [Uncensored L**ked]",https://pic.javct.net/poster/05192026/bef3f7a373.jpg,https://javct.net/v/maan-1176-rm,85,2026-06-15
DDK-239-RM,"Complete Obedience, One-Day Sex Slave ● Aoi Miumi [Uncensored L**ked]",https://pic.javct.net/poster/05192026/aa0c34c015.jpg,https://javct.net/v/ddk-239-rm,129,2026-06-15
348NTR-100-RM,"[NTR] It's been talked about that just because she's a nursery teacher, it doesn't seem like she's ever had a romantic relationship, but Nagomi definitely follows that pattern lol [Uncensored L**ked]",https://pic.javct.net/poster/05192026/e973acb533.jpg,https://javct.net/v/348ntr-100-rm,60,2026-06-15
FC2PPV-4919908,"I've never had a boyfriend before, **pyjpx*jsps 1 person, only once, ◯ 8 years old, innocent, pure, serious, 547th person to shoot individually",https://pic.javct.net/poster/05192026/ca6ea452b3.jpg,https://javct.net/v/fc2ppv-4919908,215,2026-06-15
MAAN-1176,"[Masochist play with my favorite actor] It's been a long time since I've been horny and I can't stop looking for a deep masochist woman who keeps cumming while screaming w With a face covered in semen, I'm ready for the second round from the cock sucking, intense sex [Thanks Bitch] [Bookmark]",https://pic.javct.net/poster/05192026/bef3f7a373.jpg,https://javct.net/v/maan-1176,85,2026-06-15
348NTR-100,"[NTR] It's been talked about that just because she's a nursery teacher, it doesn't seem like she's ever had a romantic relationship, but Nagomi definitely follows that pattern lol",https://pic.javct.net/poster/05192026/e973acb533.jpg,https://javct.net/v/348ntr-100,60,2026-06-15
HODV-21613-RM,"Masochist Genius!! An Extremely Masochistic Barely Legal Girl, A Bottomless Lewd Metamorphosis - Erena Takeda, 19 Years Old [Uncensored L**ked]",https://pic.javct.net/poster/20212709/1633184355.jpg,https://javct.net/v/hodv-21613-rm,128,2026-06-15
BDSM-084-RM,Masochistic Actress Sakikazu Sasaki To**ure Record [Uncensored L**ked],https://pic.javct.net/poster/20230205/1685599207.jpg,https://javct.net/v/bdsm-084-rm,136,2026-06-15
MILK-038-RM,Tall Time!Rota Aerial Pan Ban Konishi Marie [Uncensored L**ked],https://pic.javct.net/poster/20243105/1717948731.jpg,https://javct.net/v/milk-038-rm,120,2026-06-15
ENKI-086-RM,"A Masochistic Creampie Urinal Who Just Wants To Have Raw Sex. Tsuna. A Selfish, Weak-willed Pussy That's Looking For A Good Cock Gets Pounded Hard In The Uterus And Gang-banged. [Uncensored L**ked]",https://pic.javct.net/poster/07202025/1755794482.jpg,https://javct.net/v/enki-086-rm,245,2026-06-15
HAWA-381,"A Single Mother From The Neighborhood, Rena (32 Years Old), Who Started A Men's Esthetics Business At Home Because She Was Struggling Financially, Had Unprotected Sex With Me.",https://pic.javct.net/poster/05192026/381338ba2a.jpg,https://javct.net/v/hawa-381,155,2026-06-15
BGN-045-RM,Newcomer Prestige Exclusive Debut [Uncensored L**ked],https://pic.javct.net/poster/05192026/eb38988405.jpg,https://javct.net/v/bgn-045-rm,200,2026-06-15
MVSD-695-RM,"A Masochistic Wife Of The Upper Class, Fo**ed To Repay The Debt Of Her Vanished Husband With Her Body, Is Dragged Into A Hell Of Depravity. Imprisoned And Ab**ed Day After Day By Scumbag Men, Her Beautiful Naked Body Discovers The Pleasure Of Masochistic Orgasms. - Harumi Kyomoto [Uncensored L**ked]",https://pic.javct.net/poster/05192026/0c35a6a264.jpg,https://javct.net/v/mvsd-695-rm,150,2026-06-15
MVSD-699-RM,"Hairy Ass, Dripping Intestinal Fluids, Gushing Anal Farts, Every Saturday She Leaves Her C**ld With Her Mother And Has A Wild Sex Marathon With Three Men, Works At A Call Center, A Fluffy, Slutty Mom Makes Her AV Debut With Anal Sex, Tsukino Midori [Uncensored L**ked]",https://pic.javct.net/poster/05192026/bbad9daac0.jpg,https://javct.net/v/mvsd-699-rm,170,2026-06-15
MVSD-692-RM,"A Massive Injection Of Aphrodisiac Semen Into Every Orifice! Drink It! Bathe In It! Get Cummed Inside! The More You Get Fucked, The More The Pleasure Doubles! A Brain-shattering Anal Kinky Three-hole Fuck With A Gaping Asshole! Tsukino Sui [Uncensored L**ked]",https://pic.javct.net/poster/05192026/78fd22dfbc.jpg,https://javct.net/v/mvsd-692-rm,120,2026-06-15
MAAN-1175,[Tsundere Squirting Beautiful Girl] The strongest gap between anime voice and G cup is cheeky but demon cute... Aniota girl with plump plump body appears bottomless explosive tide pump that never stops ww Pien runs wild with an orgasm that drowns her uncle www [Play with Ochipo-sama] [Yunochi],https://pic.javct.net/poster/05192026/170eb261f8.jpg,https://javct.net/v/maan-1175,88,2026-06-15
MAAN-1175-RM,[Tsundere Squirting Beautiful Girl] The strongest gap between anime voice and G cup is cheeky but demon cute... Aniota girl with plump plump body appears bottomless explosive tide pump that never stops ww Pien runs wild with an orgasm that drowns her uncle www [Play with Ochipo-sama] [Yunochi] [Uncensored L**ked],https://pic.javct.net/poster/05192026/170eb261f8.jpg,https://javct.net/v/maan-1175-rm,88,2026-06-15
300MIUM-1398-RM,"We finally succeeded in the long-awaited threesome. We met a multi-sex woman with huge breasts that seemed like they were going to stay like this for the rest of her life, saying, ""If I don't act now, I'll stay like this for the rest of my life."" I met a multi-sex woman who talked about a shady dream with huge breasts that looked like they were about to burst. I was convinced that if I don't act now, I won't be able to have a threesome for the rest of my life...I was convinced, and an acquaintance I secretly called over also appeared. I was confused as to ""Eh, who?"" but the woman just kept getting fucked by two men. A demon piston deep-drama festival was held by two men with big dicks. She was shaking her big breasts like an erotic manga and went crazy. :case.64 [Uncensored L**ked]",https://pic.javct.net/poster/05192026/1cc416bf24.jpg,https://javct.net/v/300mium-1398-rm,72,2026-06-15
300MIUM-1398,"We finally succeeded in the long-awaited threesome. We met a multi-sex woman with huge breasts that seemed like they were going to stay like this for the rest of her life, saying, ""If I don't act now, I'll stay like this for the rest of my life."" I met a multi-sex woman who talked about a shady dream with huge breasts that looked like they were about to burst. I was convinced that if I don't act now, I won't be able to have a threesome for the rest of my life...I was convinced, and an acquaintance I secretly called over also appeared. I was confused as to ""Eh, who?"" but the woman just kept getting fucked by two men. A demon piston deep-drama festival was held by two men with big dicks. She was shaking her big breasts like an erotic manga and went crazy. :case.64",https://pic.javct.net/poster/05192026/1cc416bf24.jpg,https://javct.net/v/300mium-1398,72,2026-06-15
