code,title,image_url,page_url,views,date_scraped
ONET-020-RM,Blowjob JK Reflexology Fujinami Satori Vol.001 [Uncensored L**ked],https://pic.javct.net/poster/05192026/b0ae6141fe.jpg,https://javct.net/v/onet-020-rm,120,2026-06-28
801SKEJ-079-RM,Chizuru (long-time female friend x sex) [Uncensored L**ked],https://pic.javct.net/poster/05192026/2d9d9cd92d.jpg,https://javct.net/v/801skej-079-rm,76,2026-06-28
REAL-603-RM,Demon Capitalize Ayumi Shinoda [Uncensored L**ked],https://pic.javct.net/poster/20253001/1741295720.jpg,https://javct.net/v/real-603-rm,120,2026-06-28
LWQ-005-RM,"Cute, Masochistic Onahole Girl Who Falls Into A State Of Ecstasy: Takemoto Mii [Uncensored L**ked]",https://pic.javct.net/poster/05192026/984b116b61.jpg,https://javct.net/v/lwq-005-rm,117,2026-06-28
TKI-017-RM,MASOTRONIX [Uncensored L**ked],https://pic.javct.net/poster/05192026/900e9556df.jpg,https://javct.net/v/tki-017-rm,125,2026-06-28
FC2PPV-4928405,"Tsubasa (19) It seems like she doesn't want to kiss or do a severe saggy breast blow job, but she also did an ATM with anal penetration and ejaculation in her mouth.",https://pic.javct.net/poster/05192026/76de69c512.jpg,https://javct.net/v/fc2ppv-4928405,81,2026-06-28
GDJP-008,"Pursuit, Kneeling, Picking Up, Screaming, Married Woman K**ler 8",https://pic.javct.net/poster/05192026/f4de5624a3.jpg,https://javct.net/v/gdjp-008,140,2026-06-28
YST-355,"Regardless Of Whether It's Vulgar Or Refined, I Want To Toy With Yuri In A Truly Brutal Way. - Yuri",https://pic.javct.net/poster/05192026/e94165e133.jpg,https://javct.net/v/yst-355,100,2026-06-28
DOCP-159-RM,I Did Not Want To Distract The Dazzling Smile I Could Not Suppress The Impulse I Did Not Stop Even I Stopped Doing It Until I Got A Dirty Look And I Did It. [Uncensored L**ked],https://pic.javct.net/poster/05192026/4f89435e78.jpg,https://javct.net/v/docp-159-rm,185,2026-06-28
MAAN-1178,[Pervert Masochist woman who loves banging] A full-course punishment of a natural masochist who feels pleasure when she is slapped. Thoroughly stimulates the portio with a belly pan and holds her head down and treats her like a masturbator from behind and goes crazy with a creamy face and can't stop convulsing. [Pretty neighbor] [Mayuri],https://pic.javct.net/poster/05192026/81f9e998b4.jpg,https://javct.net/v/maan-1178,62,2026-06-28
VDD-206,Secretary In... (Threatening Suite Room) Shiori Hamabe,https://pic.javct.net/poster/05192026/490f6dc924.jpg,https://javct.net/v/vdd-206,135,2026-06-28
300MIUM-1406,"Sanctioned by an erotic and evil woman [Ultra luxury body] [G breast hat trick] Talking about shallow soccer that comes out at this time of year I noticed from the story of a player who likes big breasts that I was recruited by the gambling community lol One shot red card lol No questions asked lol I peeled it off and inserted it immediately lol I guess I've been doing it the way I wanted until now, but today I made it clear lol : case.65",https://pic.javct.net/poster/05192026/3bad5c7481.jpg,https://javct.net/v/300mium-1406,62,2026-06-28
REAL-602-RM,Demon Capitalize Super Best Four Hours Large Capstone Special [Uncensored L**ked],https://pic.javct.net/poster/04112026/1bc9f22005.jpg,https://javct.net/v/real-602-rm,240,2026-06-28
MISM-150-RM,Throat Back Devil Remodeling Super Pleasure!Deep Throat Dedicated De M Throat Ma ○ Ko Where All Meat Sticks Go Mad! [Uncensored L**ked],https://pic.javct.net/poster/20253001/1739778863.jpg,https://javct.net/v/mism-150-rm,170,2026-06-28
OFES-039-RM,"Anal Throat Pussy, The Most Insane Luxury 3-hole Full Course, Asshole Pounded To The Extreme, Feeling Like Strawberries. Pushing The Limits, Irrumatio Hell, Feeling Like Vanilla. Seika, A Cheerful, Ordinary Vocational School Student Attending Pastry School. [Uncensored L**ked]",https://pic.javct.net/poster/05192026/cbc299868d.jpg,https://javct.net/v/ofes-039-rm,150,2026-06-28
ZRK-004-RM,"Male Chauvinism, Throat To**ure, Gagging Hell: Throat Roar Edition By Misuzu Okuyama [Uncensored L**ked]",https://pic.javct.net/poster/05192026/968c977e8c.jpg,https://javct.net/v/zrk-004-rm,122,2026-06-28
GDJP-011,"Tracking, Begging On Your Knees To Pick Up Women, Screaming, K**ling Married Women 11",https://pic.javct.net/poster/05192026/f62f1413c1.jpg,https://javct.net/v/gdjp-011,140,2026-06-28
SCR-347-RM,Midsummer Nightmare: Female R**e And Internal Ejaculation - 4-Hour Video L**k [Uncensored L**ked],https://pic.javct.net/poster/05192026/00c1481dbc.jpg,https://javct.net/v/scr-347-rm,240,2026-06-28
MIGD-712-RM,Consecutive Creampies For A Pissing Girl Niko Ayuna [Uncensored L**ked],https://pic.javct.net/poster/20220406/1656988469.jpg,https://javct.net/v/migd-712-rm,119,2026-06-28
HODV-21622-RM,Perverted Tattooed Beauty Who Likes Face Fucking -Reira Kuon [Uncensored L**ked],https://pic.javct.net/poster/20212709/1636599842.jpg,https://javct.net/v/hodv-21622-rm,121,2026-06-28
MISM-147-RM,The Second Fairy In The Toilet Bowl [Uncensored L**ked],https://pic.javct.net/poster/05192026/da40f7b5df.jpg,https://javct.net/v/mism-147-rm,120,2026-06-28
XRW-721-RM,An Office Worker With A Super-lingual Sk**l That I Met In The Daily Work REC BAR Of A Tie-up Teacher [Uncensored L**ked],https://pic.javct.net/poster/05192026/705e59911a.jpg,https://javct.net/v/xrw-721-rm,100,2026-06-28
FC2PPV-4926294,"[Single shot] When I handed the remote control vibrator to Yuka-chan, who loves everyone, it hit her huge clitoris and even more, she used a persistent vibrator to spray a large amount of semen inside and outside (SNN-54)",https://pic.javct.net/poster/05192026/98b626d72b.jpg,https://javct.net/v/fc2ppv-4926294,38,2026-06-28
YMRK-070-RM,Brutal Manager Creampie R**e Victim Room 701 Female Student MiMi [Uncensored L**ked],https://pic.javct.net/poster/05192026/0c7cf38fd8.jpg,https://javct.net/v/ymrk-070-rm,73,2026-06-28
