code,title,image_url,page_url,views,date_scraped
APNS-315-RM,Nymphomaniac Stamp Despair Live Streaming Mitsuki Nagisa [Uncensored L**ked],https://pic.javct.net/poster/20230206/1687578726.jpg,https://javct.net/v/apns-315-rm,113,2026-06-03
SAN-171-RM,"A Busty Wife Who Failed In Her Business In Tokyo And Returned To The Countryside, Where She Was Toyed With By A Gardener And Became A Cripple / Rino Yuki [Uncensored L**ked]",https://pic.javct.net/poster/20230908/1696047616.jpg,https://javct.net/v/san-171-rm,130,2026-06-03
HODV-21595-RM,"The Stepbrother Of My Husband Licks Me Again And Again Until I Fall For Him, All While Hiding From My Husband. Kanna Hirai [Uncensored L**ked]",https://static.javct.net/poster/hodv-21595.jpg,https://javct.net/v/hodv-21595-rm,118,2026-06-03
MOON-007-RM,"I Don't Cum Inside My Husband Who Doesn't Give Me Cunnilingus, But I Want To Cum Inside You Who Makes Me Squid With Cunnilingus. Non Kobana [Uncensored L**ked]",https://pic.javct.net/poster/20230207/1688267575.jpg,https://javct.net/v/moon-007-rm,137,2026-06-03
START-571-RM,Fertility Ward: A junior female doctor who is getting married next month will destroy her happy future by ejaculating her with special concentrated sperm over and over again while she is taking a break during the night shift.Haru Shibasaki [Uncensored L**ked],https://pic.javct.net/poster/05192026/45ca7f7b08.jpg,https://javct.net/v/start-571-rm,129,2026-06-03
TAMM-026-RM,I Will Let You Be A Trained Female Teacher Do M Transformation Woman [Uncensored L**ked],https://pic.javct.net/poster/05192026/9a0f1d7161.jpg,https://javct.net/v/tamm-026-rm,125,2026-06-03
HZGD-123-RM,Pies Jealousy Of The Wife Of The Boss Pies Les  Pu Ayane Touka [Uncensored L**ked],https://pic.javct.net/poster/20222311/1671848380.jpg,https://javct.net/v/hzgd-123-rm,117,2026-06-03
FAX-426-RM,Women and sex and war Showa [Uncensored L**ked],https://pic.javct.net/poster/05192026/c7cb9cce6e.jpg,https://javct.net/v/fax-426-rm,265,2026-06-03
STARS-651-RM,Convenient Luxury Lingerie Model Compliant M Onaho Seno Minami Who Can Not Refuse The Client's Request [Uncensored L**ked],https://pic.javct.net/poster/20220406/1656998410.jpg,https://javct.net/v/stars-651-rm,140,2026-06-03
START-550-RM,I started a polite life with Rui when I just started dating.Sometimes it's slow and sometimes it's a passionate sex life where I'm at the mercy of Rui Ichinomiya. [Uncensored L**ked],https://pic.javct.net/poster/05192026/f458a5436c.jpg,https://javct.net/v/start-550-rm,135,2026-06-03
NSFS-007-SUB,Mature Stepmother 12  The Stepson Who Loved His Stepmother  Yuri Tadokoro [English Subtitle],https://static.javct.net/poster/nsfs-007.jpg,https://javct.net/v/nsfs-007-sub,116,2026-06-03
GVG-801-RM,A Sexy Weather Girl Elder Sister And Her Bad Boys Mari Takasugi [Uncensored L**ked],https://pic.javct.net/poster/20212011/1643623764.jpg,https://javct.net/v/gvg-801-rm,136,2026-06-03
XRW-674-RM,"Her Husband Was Deep In Debt, So She Got Fucked By A Stranger... Rina Otomi/Arisa Kawasaki/RISA [Uncensored L**ked]",https://pic.javct.net/poster/20222109/1664724806.jpg,https://javct.net/v/xrw-674-rm,174,2026-06-03
SAN-170-RM,"Husband Who Bet On His Wife Playfully Woke Up To Cuckold And Lost Everything, And A Pure Love Wife Betrayed Her Husband And Devoted To Others' Cocks / Sora Nakagawa [Uncensored L**ked]",https://pic.javct.net/poster/20230908/1696047678.jpg,https://javct.net/v/san-170-rm,120,2026-06-03
FAX-427-RM,Woman was attacked by a man hit a woman walking the attack / Abegg to set / person for 2 summer of r**e [Uncensored L**ked],https://pic.javct.net/poster/05192026/e126ff2108.jpg,https://javct.net/v/fax-427-rm,100,2026-06-03
FAX-404-RM,For Middle-aged Man Want The Woman Who Had Committed Illegal Sleep Courier Back ... [Uncensored L**ked],https://pic.javct.net/poster/05192026/668282878c.jpg,https://javct.net/v/fax-404-rm,110,2026-06-03
START-550,I started a polite life with Rui when I just started dating.Sometimes it's slow and sometimes it's a passionate sex life where I'm at the mercy of Rui Ichinomiya.,https://pic.javct.net/poster/05192026/f458a5436c.jpg,https://javct.net/v/start-550,135,2026-06-03
START-571,Fertility Ward: A junior female doctor who is getting married next month will destroy her happy future by ejaculating her with special concentrated sperm over and over again while she is taking a break during the night shift.Haru Shibasaki,https://pic.javct.net/poster/05192026/45ca7f7b08.jpg,https://javct.net/v/start-571,129,2026-06-03
FAX-417-RM,Of High-crime District [Uncensored L**ked],https://pic.javct.net/poster/05192026/5279dadf4e.jpg,https://javct.net/v/fax-417-rm,125,2026-06-03
NSFS-473-RM,My Cute Daughter-in-law's White Body Gets Punished By Her Father-in-law...11 Hinako Matsui [Uncensored L**ked],https://pic.javct.net/poster/04112026/1777076518.jpg,https://javct.net/v/nsfs-473-rm,111,2026-06-03
BKD-142-RM,Maternal Copulation [whistling Path] Hitomi Enjo [Uncensored L**ked],https://pic.javct.net/poster/05192026/430fe5049f.jpg,https://javct.net/v/bkd-142-rm,120,2026-06-03
BKD-143,Maternal Copulation [large Bodhisattva Path] Nara Emiko,https://pic.javct.net/poster/05192026/9ee3ffc192.jpg,https://javct.net/v/bkd-143,120,2026-06-03
SAN-169-RM,The Madness Of A Mother Who Doted Too Much On Her Son And Broken Down / Miho Tsuno [Uncensored L**ked],https://pic.javct.net/poster/20230908/1696047740.jpg,https://javct.net/v/san-169-rm,120,2026-06-03
STARS-026-RM,Mana Sakura The Escapee [Uncensored L**ked],https://pic.javct.net/poster/20220406/1654661555.jpg,https://javct.net/v/stars-026-rm,108,2026-06-03
