code,title,image_url,page_url,views,date_scraped
XKK-052-RM,Secret Service Escort Beauty Meet In Excess Of The Needs Of Prince Lewd Blond [Uncensored L**ked],https://pic.javct.net/poster/05192026/b4f99650fd.jpg,https://javct.net/v/xkk-052-rm,100,2026-06-14
SORA-330-RM,"A Personality-Altering Mind Fuck Running Away Is The Better Option, And It Cums In Handy! An Excessively Overperforming Lady Boss Is Getting Put In Her Place By A Lowly Employee During The Presentation Mao Hamasaki [Uncensored L**ked]",https://pic.javct.net/poster/20212308/1630746706.jpg,https://javct.net/v/sora-330-rm,139,2026-06-14
HOKS-228-RM,Love And Money: A Dark Contract By Tae Kosaka [Uncensored L**ked],https://pic.javct.net/poster/05192026/ce5042e117.jpg,https://javct.net/v/hoks-228-rm,105,2026-06-14
DASD-835-SUB,The Story Of A Woman Who Wanted To Get Pregnant With Her Beloved Husband But Ended Up Being Impregnated By The Fertility Specialist! Yu Shinoda [English Subtitle],https://pic.javct.net/poster/20212709/1632967151.jpg,https://javct.net/v/dasd-835-sub,141,2026-06-14
NACR-925-SUB,"My Rationality Was Blown Away By The Sight Of My Mother-in-law, Who Was Completely Soaked By The Sudden Downpour. Chisato Shoda [English Subtitle]",https://pic.javct.net/poster/20253001/1741108126.jpg,https://javct.net/v/nacr-925-sub,124,2026-06-14
HOKS-228,Love And Money: A Dark Contract By Tae Kosaka,https://pic.javct.net/poster/05192026/ce5042e117.jpg,https://javct.net/v/hoks-228,105,2026-06-14
KSBJ-433,"My Sister-in-law, Who Ran Away From Home After A Fight With Her Husband, Seduced Me And We Had Unprotected Sex From Morning Till Night. - Azusa Tani",https://pic.javct.net/poster/05192026/3a2745adf3.jpg,https://javct.net/v/ksbj-433,122,2026-06-14
ALDN-176-RM,Mother R**e Creampie Mother Tamami Kurokawa Who Was Cummed Out For The First Time By Her Son [Uncensored L**ked],https://pic.javct.net/poster/20230206/1686368292.jpg,https://javct.net/v/aldn-176-rm,110,2026-06-14
HODV-21611-RM,"My Husband Doesn't Ever Want To Fuck Me, Now My Terrible Younger CEO At Work Takes Me In For Dominant Sex. NTR Cheating Scenario. Mizuki Yayoi [Uncensored L**ked]",https://pic.javct.net/poster/20212709/1633176387.jpg,https://javct.net/v/hodv-21611-rm,120,2026-06-14
JUY-319-RM,An Unforgettable Old Man - A Carved Tantrum Kissmark - Rena Nakaya [Uncensored L**ked],https://pic.javct.net/poster/05192026/633812e8f1.jpg,https://javct.net/v/juy-319-rm,120,2026-06-14
NEWM-053-RM,True / Abnormal Sex Fifty Mother And C**ld Part 34 Ripe Honey Pot To Heal The Exhausted Son Emi Toyonaga [Uncensored L**ked],https://pic.javct.net/poster/20230206/1687579095.jpg,https://javct.net/v/newm-053-rm,120,2026-06-14
AUKG-653,Fifty-something Lesbians ~A Mature Woman's Passionate Lesbian Affair Amidst A Sexless Marriage~,https://pic.javct.net/poster/05192026/73c20e5a22.jpg,https://javct.net/v/aukg-653,120,2026-06-14
ADN-064-RM,"You, And Forgive ....Immorality Of Canvas Uehara Ai [Uncensored L**ked]",https://pic.javct.net/poster/07202025/1756617264.jpg,https://javct.net/v/adn-064-rm,100,2026-06-14
ADN-067-RM,"You, And Forgive .... - Immoral Of Drainage - One Article Ayaginu Mika [Uncensored L**ked]",https://pic.javct.net/poster/05192026/aaaa67c366.jpg,https://javct.net/v/adn-067-rm,100,2026-06-14
MIKR-103-RM,"Hinako Mori, The Beautiful Swimming Club Advisor, Revives The Nearly Disbanded Swimming Club By Provocatively Wearing A High-cut Swimsuit And Giving Strict, Leg-shaping Lessons To Arouse The Sexually Charged Hearts And Penises Of The Male Students. [Uncensored L**ked]",https://pic.javct.net/poster/05192026/77432d61fa.jpg,https://javct.net/v/mikr-103-rm,170,2026-06-14
SAN-184-RM,Mother Best Sex 6 People [Uncensored L**ked],https://pic.javct.net/poster/20231011/1698722469.jpg,https://javct.net/v/san-184-rm,230,2026-06-14
GVG-443-RM,Forbidden Care Haruna Hebei [Uncensored L**ked],https://pic.javct.net/poster/20230804/1692194269.jpg,https://javct.net/v/gvg-443-rm,120,2026-06-14
VEC-590-RM,A Captivating Single Mother Who Moved Next To Her Apartment And Creampie Courtship Sex Ann Komatsu [Uncensored L**ked],https://pic.javct.net/poster/20230205/1685681646.jpg,https://javct.net/v/vec-590-rm,95,2026-06-14
STARS-042-RM,Confinement Of The Beautiful Scoop Photographer Masami Ichikawa [Uncensored L**ked],https://pic.javct.net/poster/20243105/1719524904.jpg,https://javct.net/v/stars-042-rm,110,2026-06-14
531HFC-042-RM,"On a business trip with my female boss, I unexpectedly found out that I was sharing a room with a transsexual... Hime Hanamiya Shoko Akase [Uncensored L**ked]",https://pic.javct.net/poster/05192026/f8e81e66f9.jpg,https://javct.net/v/531hfc-042-rm,46,2026-06-14
NSFS-469-SUB,Mature Mother 38 ~A Ripe Body Driven Wild By Her Son's Huge Penis~ Megumi Suzukawa [English Subtitle],https://pic.javct.net/poster/04112026/68623b1ce5.jpg,https://javct.net/v/nsfs-469-sub,91,2026-06-14
MIKR-103,"Hinako Mori, The Beautiful Swimming Club Advisor, Revives The Nearly Disbanded Swimming Club By Provocatively Wearing A High-cut Swimsuit And Giving Strict, Leg-shaping Lessons To Arouse The Sexually Charged Hearts And Penises Of The Male Students.",https://pic.javct.net/poster/05192026/77432d61fa.jpg,https://javct.net/v/mikr-103,170,2026-06-14
SDDE-444-RM,A Married Woman Who Was Exhibited In A Museum For The Sake Of Her Beloved Family Lena Fukiishi [Uncensored L**ked],https://pic.javct.net/poster/20221108/1661097661.jpg,https://javct.net/v/sdde-444-rm,112,2026-06-14
NSPS-605-RM,Husband's Best Friend And Rich Fuck  Husband Who Made Her Wife Fall Asleep In Debt Kata  Mayumi Imai [Uncensored L**ked],https://pic.javct.net/poster/20220406/1655728334.jpg,https://javct.net/v/nsps-605-rm,81,2026-06-14
