code,title,image_url,page_url,views,date_scraped
GVG-814-RM,Forbidden Care Nurse Kudo Manami [Uncensored L**ked],https://pic.javct.net/poster/20240410/1730450175.jpg,https://javct.net/v/gvg-814-rm,120,2026-06-24
SAN-190-RM,Slutty Big-breasted Wife Who Is Obsessed With A Dick With A Silicone Ring / Sora Nakagawa [Uncensored L**ked],https://pic.javct.net/poster/20231711/1701105615.jpg,https://javct.net/v/san-190-rm,120,2026-06-24
SMOM-007-RM,"Shin · Abnormal sexual intercourse 40 mother and c**ld Reiko Yamaguchi, a prostitute mature mother who● is embraced by her father-in-law and confused by her son [Uncensored L**ked]",https://pic.javct.net/poster/05192026/92276e93a6.jpg,https://javct.net/v/smom-007-rm,115,2026-06-24
SSNI-984,"A Story About An Eagle, An Elderly Landlord, Spending Three Years And 123 Days Taking Advantage Of The Weaknesses Of A Female College Student Living Next Door Who Had Been Secretly Watching And Completing Physical And Mental Training. Tsubaki Sannomiya",https://pic.javct.net/poster/05192026/658abea1cb.jpg,https://javct.net/v/ssni-984,120,2026-06-24
AQSH-087-RM,"Instead Of Reporting His Wife For Shoplifting, He Scolds Her With A Creampie Instead. The Next Day, She Comes Back For More. Civil Servant's Sub Wife Ena Koume [Uncensored L**ked]",https://pic.javct.net/poster/20221904/1652508504.jpg,https://javct.net/v/aqsh-087-rm,120,2026-06-24
APNS-414-RM,A Schoolgirl Obsessed With Exhibitionism; Her Uterus Throbs With The Thought Of Having Her Pussy Seen... Yuka Chiba [Uncensored L**ked],https://pic.javct.net/poster/05192026/dcc5346ef0.jpg,https://javct.net/v/apns-414-rm,106,2026-06-24
NSPS-615-RM,At The Edge Of A Marriage Separated By An Age Difference Of 20 Years... My Wife Got Fucked By A Younger Man! Nao Wakana [Uncensored L**ked],https://pic.javct.net/poster/20221904/1651770567.jpg,https://javct.net/v/nsps-615-rm,95,2026-06-24
ALDN-168-RM,"After All, A Single Mother Is The Best... Sumire Mihara [Uncensored L**ked]",https://pic.javct.net/poster/20230205/1684554608.jpg,https://javct.net/v/aldn-168-rm,105,2026-06-24
HOKS-146-RM,Nikuyome (do It!) Intense Night Passion [Uncensored L**ked],https://pic.javct.net/poster/20230205/1684560037.jpg,https://javct.net/v/hoks-146-rm,86,2026-06-24
HOMA-129-RM,My Uncle Told Me That Playing With Your Nipples Makes Your Breasts Bigger... Sumire Kuramoto [Uncensored L**ked],https://pic.javct.net/poster/20230205/1684556214.jpg,https://javct.net/v/homa-129-rm,136,2026-06-24
SAN-189-RM,A Beautiful Wife Who Was Cuckolded By A Fake Doctor And Turned Into A C**ld And Became Dick Crazy / Akari Minase [Uncensored L**ked],https://pic.javct.net/poster/20231711/1701105679.jpg,https://javct.net/v/san-189-rm,130,2026-06-24
EMBZ-343,Seductive Saleswoman Mihara Sumire,https://pic.javct.net/poster/05192026/b5c5b36df0.jpg,https://javct.net/v/embz-343,130,2026-06-24
VEC-172-RM,Large Incontinence.undignified Bisho Wetting Of Horny Wife That - Elegant Bukkake Are Mating - Tachibana Yuka [Uncensored L**ked],https://pic.javct.net/poster/04112026/31f8a01882.jpg,https://javct.net/v/vec-172-rm,95,2026-06-24
NSPS-696-RM,The Rental Wife 10 The Tables Were Turned Between This Husband And His Former Employee Mio Kimijima [Uncensored L**ked],https://pic.javct.net/poster/20221108/1661995819.jpg,https://javct.net/v/nsps-696-rm,83,2026-06-24
EMBZ-343-RM,Seductive Saleswoman Mihara Sumire [Uncensored L**ked],https://pic.javct.net/poster/05192026/b5c5b36df0.jpg,https://javct.net/v/embz-343-rm,130,2026-06-24
ALDN-167-RM,A Jerky Woman Miki Yoshii [Uncensored L**ked],https://pic.javct.net/poster/20230205/1684554674.jpg,https://javct.net/v/aldn-167-rm,105,2026-06-24
SAN-188-RM,"A Story About A Busty Married Woman Who Reluctantly Sacrifices Her Body To A Member Of The Devilish Shinsho For Her Husband's Promotion, But Before She Knows It, She Falls Into An Adulterous Penis / Yuzu Kou [Uncensored L**ked]",https://pic.javct.net/poster/20231711/1701105746.jpg,https://javct.net/v/san-188-rm,130,2026-06-24
NACT-140-RM,"Rainy Days Are My Masochistic Anniversaries. Abandoned By My Husband, I Beg The Master Of My Former Part-time Job For Obedience. - Higashi Fuuka [Uncensored L**ked]",https://pic.javct.net/poster/05192026/37ddfc279c.jpg,https://javct.net/v/nact-140-rm,114,2026-06-24
NACT-144-RM,Bookings Are Pouring In! 100% Satisfaction Guaranteed! Mature Beauty Cosplay Delivery: Hikari Hime [Uncensored L**ked],https://pic.javct.net/poster/05192026/8882f2e74f.jpg,https://javct.net/v/nact-144-rm,110,2026-06-24
JARB-034,Sweet Wife Inviting Married Woman,https://pic.javct.net/poster/05192026/3813742a39.jpg,https://javct.net/v/jarb-034,240,2026-06-24
JARB-014,Companion Of A Couple In Tasogarenoji,https://pic.javct.net/poster/05192026/a7ce951093.jpg,https://javct.net/v/jarb-014,230,2026-06-24
JARB-012,【No Bread Cafe】 【Mistress Bank】 Youth Story Of Showa Night,https://pic.javct.net/poster/05192026/d3ffb6b478.jpg,https://javct.net/v/jarb-012,165,2026-06-24
JARB-003,My Husband Saw It!Love Ho Insincere Shame Wife,https://pic.javct.net/poster/05192026/5cda3bfef8.jpg,https://javct.net/v/jarb-003,120,2026-06-24
JARB-002,Escape Of Widow Insult,https://pic.javct.net/poster/05192026/a8cf86eecc.jpg,https://javct.net/v/jarb-002,190,2026-06-24
