code,title,image_url,page_url,views,date_scraped
ALDN-179-RM,Daughter's Husband And Mating Reiko Himekawa [Uncensored L**ked],https://pic.javct.net/poster/20230206/1687576284.jpg,https://javct.net/v/aldn-179-rm,105,2026-06-04
SAN-173-RM,A Bi-breasted Young Wife Who Was Bullied By A Big Dick Father-in-law Who Needs Nursing Care And Becomes A Neurosis And Becomes A Cripple / Hikaru Minazuki [Uncensored L**ked],https://pic.javct.net/poster/20230908/1696047487.jpg,https://javct.net/v/san-173-rm,130,2026-06-04
STARS-687-SUB,"""I'm Addicted To My Former Kyoko And Berokisu Swamp."" When I Reunited With Yui For The First Time In Five Years, I Was So Beautiful That I Couldn't See It, So I Lost My Sexual Desire And Had A Dense Kiss Entanglement With Saliva. I Am A Current Teacher. Yui Mahiro [English Subtitle]",https://pic.javct.net/poster/20222109/1665453493.jpg,https://javct.net/v/stars-687-sub,130,2026-06-04
IPX-638-RM,My Father-in-law's Favorite Food That I Hate To Die Was A Girl ○ Raw Me ... Humiliation That Is Squid While Being Fucked Many Times ● Emma Futaba [Uncensored L**ked],https://pic.javct.net/poster/20241902/1708675186.jpg,https://javct.net/v/ipx-638-rm,120,2026-06-04
NGOD-018-SUB,Japan Netora Are Grand Prize Winners Netora The Fiance Aki Sasaki [English Subtitle],https://pic.javct.net/poster/06032026/1773704913.jpg,https://javct.net/v/ngod-018-sub,120,2026-06-04
APNS-315-RM,Nymphomaniac Stamp Despair Live Streaming Mitsuki Nagisa [Uncensored L**ked],https://pic.javct.net/poster/20230206/1687578726.jpg,https://javct.net/v/apns-315-rm,113,2026-06-04
SAN-171-RM,"A Busty Wife Who Failed In Her Business In Tokyo And Returned To The Countryside, Where She Was Toyed With By A Gardener And Became A Cripple / Rino Yuki [Uncensored L**ked]",https://pic.javct.net/poster/20230908/1696047616.jpg,https://javct.net/v/san-171-rm,130,2026-06-04
HODV-21595-RM,"The Stepbrother Of My Husband Licks Me Again And Again Until I Fall For Him, All While Hiding From My Husband. Kanna Hirai [Uncensored L**ked]",https://static.javct.net/poster/hodv-21595.jpg,https://javct.net/v/hodv-21595-rm,118,2026-06-04
MOON-007-RM,"I Don't Cum Inside My Husband Who Doesn't Give Me Cunnilingus, But I Want To Cum Inside You Who Makes Me Squid With Cunnilingus. Non Kobana [Uncensored L**ked]",https://pic.javct.net/poster/20230207/1688267575.jpg,https://javct.net/v/moon-007-rm,137,2026-06-04
START-571-RM,Fertility Ward: A junior female doctor who is getting married next month will destroy her happy future by ejaculating her with special concentrated sperm over and over again while she is taking a break during the night shift.Haru Shibasaki [Uncensored L**ked],https://pic.javct.net/poster/05192026/45ca7f7b08.jpg,https://javct.net/v/start-571-rm,129,2026-06-04
TAMM-026-RM,I Will Let You Be A Trained Female Teacher Do M Transformation Woman [Uncensored L**ked],https://pic.javct.net/poster/05192026/9a0f1d7161.jpg,https://javct.net/v/tamm-026-rm,125,2026-06-04
HZGD-123-RM,Pies Jealousy Of The Wife Of The Boss Pies Les  Pu Ayane Touka [Uncensored L**ked],https://pic.javct.net/poster/20222311/1671848380.jpg,https://javct.net/v/hzgd-123-rm,117,2026-06-04
FAX-426-RM,Women and sex and war Showa [Uncensored L**ked],https://pic.javct.net/poster/05192026/c7cb9cce6e.jpg,https://javct.net/v/fax-426-rm,265,2026-06-04
STARS-651-RM,Convenient Luxury Lingerie Model Compliant M Onaho Seno Minami Who Can Not Refuse The Client's Request [Uncensored L**ked],https://pic.javct.net/poster/20220406/1656998410.jpg,https://javct.net/v/stars-651-rm,140,2026-06-04
START-550-RM,I started a polite life with Rui when I just started dating.Sometimes it's slow and sometimes it's a passionate sex life where I'm at the mercy of Rui Ichinomiya. [Uncensored L**ked],https://pic.javct.net/poster/05192026/f458a5436c.jpg,https://javct.net/v/start-550-rm,135,2026-06-04
NSFS-007-SUB,Mature Stepmother 12  The Stepson Who Loved His Stepmother  Yuri Tadokoro [English Subtitle],https://static.javct.net/poster/nsfs-007.jpg,https://javct.net/v/nsfs-007-sub,116,2026-06-04
GVG-801-RM,A Sexy Weather Girl Elder Sister And Her Bad Boys Mari Takasugi [Uncensored L**ked],https://pic.javct.net/poster/20212011/1643623764.jpg,https://javct.net/v/gvg-801-rm,136,2026-06-04
XRW-674-RM,"Her Husband Was Deep In Debt, So She Got Fucked By A Stranger... Rina Otomi/Arisa Kawasaki/RISA [Uncensored L**ked]",https://pic.javct.net/poster/20222109/1664724806.jpg,https://javct.net/v/xrw-674-rm,174,2026-06-04
SAN-170-RM,"Husband Who Bet On His Wife Playfully Woke Up To Cuckold And Lost Everything, And A Pure Love Wife Betrayed Her Husband And Devoted To Others' Cocks / Sora Nakagawa [Uncensored L**ked]",https://pic.javct.net/poster/20230908/1696047678.jpg,https://javct.net/v/san-170-rm,120,2026-06-04
FAX-427-RM,Woman was attacked by a man hit a woman walking the attack / Abegg to set / person for 2 summer of r**e [Uncensored L**ked],https://pic.javct.net/poster/05192026/e126ff2108.jpg,https://javct.net/v/fax-427-rm,100,2026-06-04
FAX-404-RM,For Middle-aged Man Want The Woman Who Had Committed Illegal Sleep Courier Back ... [Uncensored L**ked],https://pic.javct.net/poster/05192026/668282878c.jpg,https://javct.net/v/fax-404-rm,110,2026-06-04
START-550,I started a polite life with Rui when I just started dating.Sometimes it's slow and sometimes it's a passionate sex life where I'm at the mercy of Rui Ichinomiya.,https://pic.javct.net/poster/05192026/f458a5436c.jpg,https://javct.net/v/start-550,135,2026-06-04
START-571,Fertility Ward: A junior female doctor who is getting married next month will destroy her happy future by ejaculating her with special concentrated sperm over and over again while she is taking a break during the night shift.Haru Shibasaki,https://pic.javct.net/poster/05192026/45ca7f7b08.jpg,https://javct.net/v/start-571,129,2026-06-04
FAX-417-RM,Of High-crime District [Uncensored L**ked],https://pic.javct.net/poster/05192026/5279dadf4e.jpg,https://javct.net/v/fax-417-rm,125,2026-06-04
