code,title,image_url,page_url,views,date_scraped
IPX-557,I've Been Lustful For The Unequaled Pant Voice Of My Neighbor's Resident ... All-you-can-eat Young Chi Po! !! Manager NTR Minami Aizawa,https://pic.javct.net/poster/05192026/ec5dca2c83.jpg,https://javct.net/v/ipx-557,120,2026-06-18
IPX-494,"Graduation Ceremony, I Was Humiliated By My Students .... Minami Aizawa",https://pic.javct.net/poster/05192026/1458cfae1e.jpg,https://javct.net/v/ipx-494,120,2026-06-18
MOND-247-RM,Longing Sister-in-Law And Reiko Kobayakawa [Uncensored L**ked],https://pic.javct.net/poster/20230205/1684555450.jpg,https://javct.net/v/mond-247-rm,120,2026-06-18
HODV-21767-RM,"When I'm Alone With My Cute Colleague Who Can't Help But Speak Kitakyushu Dialect, I Have Lovey-dovey Dialect Sex Mizuki Yayoi [Uncensored L**ked]",https://pic.javct.net/poster/20230205/1685089039.jpg,https://javct.net/v/hodv-21767-rm,136,2026-06-18
NTRD-113-RM,Netorareze The Story Of Cuckolding My Wife By The Men Of The Construction House Narimiya Iroha [Uncensored L**ked],https://pic.javct.net/poster/20230205/1683344888.jpg,https://javct.net/v/ntrd-113-rm,115,2026-06-18
MUDR-099-RM,Ever Since That Day... A Beautiful Girl In Uniform Receives S&M Breaking In Creampie Training - Inaba Ruka [Uncensored L**ked],https://pic.javct.net/poster/06032026/1772840308.jpg,https://javct.net/v/mudr-099-rm,120,2026-06-18
SQIS-121,The Married Couple Next Door: I Can Always Hear The Wife's Moans.,https://pic.javct.net/poster/05192026/e248ebc3dc.jpg,https://javct.net/v/sqis-121,167,2026-06-18
GVG-395-RM,Naughty Nurses Miho Tono [Uncensored L**ked],https://pic.javct.net/poster/20220406/1655965148.jpg,https://javct.net/v/gvg-395-rm,124,2026-06-18
SAN-174-RM,The Presence Is Incomparable! A Truly Legendary Actress. Anyway Sawamura Reiko Deluxe [Uncensored L**ked],https://pic.javct.net/poster/20230908/1696047423.jpg,https://javct.net/v/san-174-rm,260,2026-06-18
HOKS-149-RM,"I'm Still Young, But... My Cute Wife, A 19-Year-Old Wife, A 54-Year-Old Husband Shoplifting Play / A Man Who Married A Daughter Who Came Back To Shaba [Uncensored L**ked]",https://pic.javct.net/poster/20230206/1686972973.jpg,https://javct.net/v/hoks-149-rm,103,2026-06-18
MUDR-094-RM,Ever Since That Day ... Uniform Beautiful Girl Out Of Bondage Training Moe Arika [Uncensored L**ked],https://pic.javct.net/poster/06032026/1773018908.jpg,https://javct.net/v/mudr-094-rm,120,2026-06-18
REAL-592-RM,Bondage Demon Capitalize Otoha Nanase-byte Destination Pretty Saddle Was In JK ~ [Uncensored L**ked],https://pic.javct.net/poster/04112026/84c0b6ffe1.jpg,https://javct.net/v/real-592-rm,115,2026-06-18
MDVHJ-082-RM,The Widow Climaxes Over And Over Again To The Pleasure Of Sexual Intercourse In The Unequaled C**ldren's Room... [Uncensored L**ked],https://pic.javct.net/poster/20230205/1685159989.jpg,https://javct.net/v/mdvhj-082-rm,180,2026-06-18
HZGD-127-RM,Married Woman Violated And Creampied Over And Over By Despicable Neighbor Mika Kurosaki [Uncensored L**ked],https://pic.javct.net/poster/20221202/1647307630.jpg,https://javct.net/v/hzgd-127-rm,112,2026-06-18
AUKG-653-RM,Fifty-something Lesbians ~A Mature Woman's Passionate Lesbian Affair Amidst A Sexless Marriage~ [Uncensored L**ked],https://pic.javct.net/poster/05192026/73c20e5a22.jpg,https://javct.net/v/aukg-653-rm,120,2026-06-18
CEMD-301-RM,Hatano Psychosomatic Medicine We Will Solve Your Troubles With Brainwashing Lesbian Therapy. [Uncensored L**ked],https://pic.javct.net/poster/05192026/593a7d0935.jpg,https://javct.net/v/cemd-301-rm,168,2026-06-18
HOKS-148-RM,"After All, The Woman Gets Wet At That Time! Fo**ed Sexual Intercourse [Uncensored L**ked]",https://pic.javct.net/poster/20230206/1686371499.jpg,https://javct.net/v/hoks-148-rm,100,2026-06-18
XRW-700-RM,"Young Wives Who Are Sold In Debt And Embraced By Strangers But Pleasures Don't Stop There Are Hasei, Shiiba Mikuru, Ayane And Toka [Uncensored L**ked]",https://pic.javct.net/poster/05192026/3e145df54d.jpg,https://javct.net/v/xrw-700-rm,175,2026-06-18
HZGD-115-RM,"Immediately After Getting Married, I Met A Senior Who Was Longing For School Days, And I Met A Backlash NTR Mai Imai [Uncensored L**ked]",https://pic.javct.net/poster/09052025/1757202774.jpg,https://javct.net/v/hzgd-115-rm,123,2026-06-18
KSBJ-433-RM,"My Sister-in-law, Who Ran Away From Home After A Fight With Her Husband, Seduced Me And We Had Unprotected Sex From Morning Till Night. - Azusa Tani [Uncensored L**ked]",https://pic.javct.net/poster/05192026/3a2745adf3.jpg,https://javct.net/v/ksbj-433-rm,122,2026-06-18
NSPS-824-RM,Master Nagase And Father-in-law And Daughter-in-law That Nagae Director Chooses [Uncensored L**ked],https://pic.javct.net/poster/20230205/1683472454.jpg,https://javct.net/v/nsps-824-rm,258,2026-06-18
NXGS-017-RM,Dense SEX That Tastes The Body Like A Mature Woman With Moderate Flesh [Uncensored L**ked],https://pic.javct.net/poster/20230207/1689825464.jpg,https://javct.net/v/nxgs-017-rm,120,2026-06-18
SDDE-508-RM,"""Students!For A Health Class Tomorrow, Bring A Mother Instead Of A Human Model! "" Ken Miyako Ichijo [Uncensored L**ked]",https://pic.javct.net/poster/20222410/1666774559.jpg,https://javct.net/v/sdde-508-rm,120,2026-06-18
NACR-929-SUB,"Unexpectedly, We Share A Room Together And I'm A Boring Boss, But I Have The Most Beautiful Subordinate In The Company... Aya Konami [English Subtitle]",https://pic.javct.net/poster/20250903/1742403316.jpg,https://javct.net/v/nacr-929-sub,117,2026-06-18
