code,title,image_url,page_url,views,date_scraped
SDMU-601-RM,SOD Romance Original Amagasaki Norio Sacrifice Office ~ Beauty Elite OL Gets R**ed Inside The Company On Behalf Of His Subordinates ~ Akira Tomoka [Uncensored L**ked],https://pic.javct.net/poster/20230205/1683792283.jpg,https://javct.net/v/sdmu-601-rm,130,2026-07-03
ADN-783-RM,The Story Of How I Had Sex With A Beautiful Married Woman Who Lived In The Same Apartment Building. (Hoshimiya Ichika) [Uncensored L**ked],https://pic.javct.net/poster/05192026/09a20244ff.jpg,https://javct.net/v/adn-783-rm,120,2026-07-03
ADN-784-RM,Please Forgive Me... You Stole Even My Heart. [Uncensored L**ked],https://pic.javct.net/poster/05192026/ad5914ef19.jpg,https://javct.net/v/adn-784-rm,120,2026-07-03
SILK-035-RM,Face To Face 3rd Season [Uncensored L**ked],https://pic.javct.net/poster/20233001/1677697537.jpg,https://javct.net/v/silk-035-rm,134,2026-07-03
ALDN-140-RM,Mother's R**e Creampie Mother Miori Akimoto Who Was Cummed Out For The First Time By Her Son [Uncensored L**ked],https://pic.javct.net/poster/20230302/1679716322.jpg,https://javct.net/v/aldn-140-rm,105,2026-07-03
MOND-243-RM,Longing Female Boss And Haruka Nogi [Uncensored L**ked],https://pic.javct.net/poster/20230302/1679719845.jpg,https://javct.net/v/mond-243-rm,120,2026-07-03
SAN-201-RM,A Story About A Pachinko Married Woman With A Lot Of Brain Juice Who Bathed In Her Husband's Semen Without Telling Her Husband For Financial Reasons And Became Addicted To It Before She Knew It / Miki Yoshii [Uncensored L**ked],https://pic.javct.net/poster/20231912/1703992556.jpg,https://javct.net/v/san-201-rm,130,2026-07-03
T28-461-RM,Home At Last For Creampie Sex With My Big Sister Kurumi Seseragi [Uncensored L**ked],https://pic.javct.net/poster/20221904/1652230636.jpg,https://javct.net/v/t28-461-rm,141,2026-07-03
SAME-231,I Can't Forget The Way That Man I Hate So Much Used His Hips When He R**ed Me... Kosuzu Mikan,https://pic.javct.net/poster/05192026/c9ba9ed2d9.jpg,https://javct.net/v/same-231,150,2026-07-03
STARS-067-RM,Koizumi Hinata × Nonohara Nazuna SODstar × Youth Age W Cast Geki Pis Does Not Stop Nikoichi Big Tits Continue To Get Fucked [Uncensored L**ked],https://pic.javct.net/poster/20243105/1719748834.jpg,https://javct.net/v/stars-067-rm,120,2026-07-03
YUJ-068,"""How About We Date Until You Give Me An Answer To Your Confession?"" On The Day I Confessed To The Girl I'd Liked For So Long, A Female Friend From University Confessed To Me... I Was So Engrossed In Her That I Forgot About The Girl I Liked, And We Had Sex Over And Over Again.",https://pic.javct.net/poster/05192026/3942e58fb7.jpg,https://javct.net/v/yuj-068,150,2026-07-03
ADN-790,I Was Embraced By My Daughter's Boyfriend. The Story Of How We Had Sex Non-stop From The Day He Forcibly Pushed Me Down. - Rinka Ono,https://pic.javct.net/poster/05192026/675c7e02a1.jpg,https://javct.net/v/adn-790,120,2026-07-03
YUJ-061,"After Getting Divorced, Quitting My Job, And Returning To My Hometown, I Unexpectedly Reunited With My Ex-girlfriend. This Is The Story Of A Few Days Spent With My Ex-girlfriend, Whom I Loved But Broke Up With Because Of The Long Distance, And With Whom I Couldn't Forget, As We Longed For Each Other Like We Did In The Old Days.",https://pic.javct.net/poster/05192026/a81f8ff37c.jpg,https://javct.net/v/yuj-061,120,2026-07-03
SAME-227,The Person My Subordinate Assaulted Was The Woman I Loved.,https://pic.javct.net/poster/05192026/e7611f74e1.jpg,https://javct.net/v/same-227,130,2026-07-03
YUJ-065,"From The Day We First Had Sex Until Our Last Day Together. A Record Of A Year Of Living Together, Where Our Physical Chemistry Was So Amazing That We Lost Track Of Time And Had Sex Almost Every Day.",https://pic.javct.net/poster/05192026/6611dae4ad.jpg,https://javct.net/v/yuj-065,160,2026-07-03
SAME-245,I'm Being R**ed Every Day By My Mother's New Husband.,https://pic.javct.net/poster/05192026/f97caca4e1.jpg,https://javct.net/v/same-245,120,2026-07-03
ADN-783,The Story Of How I Had Sex With A Beautiful Married Woman Who Lived In The Same Apartment Building. (Hoshimiya Ichika),https://pic.javct.net/poster/05192026/09a20244ff.jpg,https://javct.net/v/adn-783,120,2026-07-03
ADN-784,Please Forgive Me... You Stole Even My Heart.,https://pic.javct.net/poster/05192026/ad5914ef19.jpg,https://javct.net/v/adn-784,120,2026-07-03
MIMK-276,"""I'll Double Your Salary If You Let Me Grope Your Breasts..."" A Married Woman At A Local Chinese Restaurant During Preparations... Live-action Version. Despite The Owner's Outrageous Request, She Gave Herself To Him For The Sake Of Her Family's Finances... Nao Jinguji",https://pic.javct.net/poster/05192026/2ba18fde82.jpg,https://javct.net/v/mimk-276,120,2026-07-03
ATID-681,I Ended Up Sleeping With The College Student Who Moved In Next Door. Please Forgive Me...,https://pic.javct.net/poster/05192026/18eaeff704.jpg,https://javct.net/v/atid-681,120,2026-07-03
MOND-232-RM,Longing Brother-in-law And Shizuka Momoi [Uncensored L**ked],https://pic.javct.net/poster/20220406/1654927744.jpg,https://javct.net/v/mond-232-rm,125,2026-07-03
MOND-242-RM,A Beautiful Neighborhood Wife Is An Komatsu [Uncensored L**ked],https://pic.javct.net/poster/20230302/1678506382.jpg,https://javct.net/v/mond-242-rm,120,2026-07-03
SAN-200-RM,Stepmother Controlled By Her Psychopathic Son-in-law / Mari Ueto [Uncensored L**ked],https://pic.javct.net/poster/20231912/1703992624.jpg,https://javct.net/v/san-200-rm,120,2026-07-03
XRW-744-RM,"Busty Lewd Wife, Wife Of S**ta, Cuckold Wife Mashiro Ann, Rei Hanamiya, Risa Mochizuki [Uncensored L**ked]",https://pic.javct.net/poster/05192026/ece2f0da24.jpg,https://javct.net/v/xrw-744-rm,165,2026-07-03
