code,title,image_url,page_url,views,date_scraped
DORI-024,Paco Shooting No.24 Athlete's Tall Glamor Inverted Nipple Big Tits J ○ Refuses To Insert Raw Chin But Feels Better And Finally Allowed Vaginal Cum Shot!,https://pic.javct.net/poster/05192026/b8c3fbdd10.jpg,https://javct.net/v/dori-024,83,2026-07-01
LOVE-017,"That One Person In Class.I Say ""Yarasero"" To Have The Courage Because It Is Not Be Popular Girl In The Dark Roots.",https://pic.javct.net/poster/05192026/7d479db934.jpg,https://javct.net/v/love-017,120,2026-07-01
FNEO-009,"I Will Lend You A ""Gutsukuru Girls School Student"" Seen In Town.Vol.2",https://pic.javct.net/poster/05192026/6612fe5a91.jpg,https://javct.net/v/fneo-009,140,2026-07-01
APAK-250-RM,Fierce Carnal Affair Passion Ikuiku Wife! Sayaka-san (26) A Carnivorous And Superb Body F-Cup Beautiful Married Woman And Horny Climax Sex Sayaka Megumi [Uncensored L**ked],https://pic.javct.net/poster/20230302/1679715941.jpg,https://javct.net/v/apak-250-rm,143,2026-07-01
SHIND-063-RM,Adhesive Stalker M's Request Idiot · Home Invasion Record # 99 · 100 [Uncensored L**ked],https://pic.javct.net/poster/20230804/1694059633.jpg,https://javct.net/v/shind-063-rm,178,2026-07-01
XRW-742-RM,Aphrodisiac And Drill-Endless Orgasm-Rui Ichinose [Uncensored L**ked],https://pic.javct.net/poster/05192026/d30eed4d18.jpg,https://javct.net/v/xrw-742-rm,125,2026-07-01
SOE-272-RM,Three Flower Kayama × Risky Mosaic Ban Esuwan Entertainer [Uncensored L**ked],https://pic.javct.net/poster/05192026/47916c8ef0.jpg,https://javct.net/v/soe-272-rm,120,2026-07-01
DANDY-832-RM,"When I Showed A Full Erection From The Front To J  Sitting In Front Of A Crowded Train, I Was Shy But Curious! Even Though There Was A Passenger, He Held My Cock [Uncensored L**ked]",https://pic.javct.net/poster/20222109/1666239437.jpg,https://javct.net/v/dandy-832-rm,155,2026-07-01
APAA-407-RM,Soothing Female College Student's Dirty Life Aoi Nakajo [Uncensored L**ked],https://pic.javct.net/poster/20230104/1682135787.jpg,https://javct.net/v/apaa-407-rm,138,2026-07-01
APNS-309-RM,Plunge-in Sales Pillow Sales A Sales Lady Weak To Push Go Sleep And Get A Job Sayaka Megumi [Uncensored L**ked],https://pic.javct.net/poster/20230104/1682135592.jpg,https://javct.net/v/apns-309-rm,116,2026-07-01
APAK-252-RM,Innocent School Beautiful Girl Creampie Climax Hana Hits The Uterus Directly! Demon Iki L**king! Stakeout Riding! Nasty Climax Student Guidance Handicraft Club Kana Kusunoki [Uncensored L**ked],https://pic.javct.net/poster/20230104/1682135717.jpg,https://javct.net/v/apak-252-rm,125,2026-07-01
REAL-611-RM,Grated Take Super BEST Treasured Mass Facials Rich One-shot Special With Extras! ! [Uncensored L**ked],https://pic.javct.net/poster/04112026/12c8c6f80b.jpg,https://javct.net/v/real-611-rm,300,2026-07-01
MIDD-900-RM,◆ pear pear Katsuki Yuu Yuu Natural Style [Uncensored L**ked],https://pic.javct.net/poster/04112026/1776135853.jpg,https://javct.net/v/midd-900-rm,150,2026-07-01
SHIND-061-RM,Adhesive Stalker M's Request Idiot · Home Invasion Record # 97 · 98 [Uncensored L**ked],https://pic.javct.net/poster/20230207/1691034085.jpg,https://javct.net/v/shind-061-rm,178,2026-07-01
HND-626,"20 Years Old First Time To Be Hilarious How To Imitate Literary Beauty Girls Delusion!I Went To The First Adult Shop, Vaginal Cum Shot And Purchased AV Immediately! ! Hundred Leaves Flower Sound",https://pic.javct.net/poster/05192026/fb08ea3104.jpg,https://javct.net/v/hnd-626,160,2026-07-01
ABP-823-RM,Her Older Sister Is A Temptation Prickly Girl. 18 I Went To Her House To Play And I Was Pressed By My Sister And Ikenai Relations ... Harumasa Ryo [Uncensored L**ked],https://pic.javct.net/poster/05192026/9cf01f7ecb.jpg,https://javct.net/v/abp-823-rm,200,2026-07-01
APNS-125-RM,Two Beauties Who Are Gangbanged Until Hate And The Two Girls Who Keep Being Poured Semen Miho Morishita Yu Kawakami [Uncensored L**ked],https://pic.javct.net/poster/05192026/14fc85bc12.jpg,https://javct.net/v/apns-125-rm,143,2026-07-01
DORI-022,"Paco Shooting No.22 It Looks Like A Crazy Gal Who Uses Honorifics For People Who Meet For The First Time J ○ Repeatedly Saying ""Ah, Yabai"" And Middle-aged, Forgetting Honorifics And Allowing Vaginal Cum Shot!",https://pic.javct.net/poster/05192026/6653026230.jpg,https://javct.net/v/dori-022,99,2026-07-01
SHIND-055-RM,Adhesive Stalker M's Request Idiot · Home Invasion Record # 91 · 92 [Uncensored L**ked],https://pic.javct.net/poster/20230205/1683173686.jpg,https://javct.net/v/shind-055-rm,195,2026-07-01
APRG-002-RM,"I Called A Delivery Health Girl And Couldn't Resist The Young Essence And Tight Meat Pussy Of The Schoolgirl, So I Continued To Fuck The Masochistic Girl Who Was Drowning In Deep Throat And Climax Until The Morning. Delivery Girl Pet [lustful Stick Part-time Job] Obedient Sex Video Yasaka Nagi [Uncensored L**ked]",https://pic.javct.net/poster/05192026/992de1e736.jpg,https://javct.net/v/aprg-002-rm,148,2026-07-01
APNS-308-RM,Horny Stamp Despair Live Streaming Aoi Nakajo [Uncensored L**ked],https://pic.javct.net/poster/20230104/1680926122.jpg,https://javct.net/v/apns-308-rm,114,2026-07-01
ANKB-017-RM,Mixed Bathing Open-air Human Bullet SEX With Big Boobs I Cup Woman [Uncensored L**ked],https://pic.javct.net/poster/20230104/1680924230.jpg,https://javct.net/v/ankb-017-rm,155,2026-07-01
NLD-031-RM,This Married Woman Is My Personal Vtuber For Swallowing () [Uncensored L**ked],https://pic.javct.net/poster/05192026/3b2ce14735.jpg,https://javct.net/v/nld-031-rm,136,2026-07-01
APAK-251-RM,Nasty De M-type Female Clerk Yuki-san [Extreme Intercourse With A Working Woman] Gap Moe! Enthusiastic Copulation Of Plain Glasses OL! # Off Paco Girl And Hotel Cage Nasty Climax SEX Yuki Hiiragi [Uncensored L**ked],https://pic.javct.net/poster/20230104/1680924045.jpg,https://javct.net/v/apak-251-rm,132,2026-07-01
