code,title,image_url,page_url,views,date_scraped
MIDA-684-RM,"The Always-lonely, Plain Literary Girl Is Our Convenient Semen Shower Masturbation Pet, Kira Hoshi. [Uncensored L**ked]",https://pic.javct.net/poster/05192026/e995cc3d2c.jpg,https://javct.net/v/mida-684-rm,120,2026-07-04
MIDA-698-RM,"The Legend Of The Strongest Sex Drive, Who Used Up 10 Boxes Of Condoms In The Athletes' Village At The World Championships!! Newcomer 145cm Tall Junior Gymnastics Athlete Makes Her AV Debut!! Aine Sana [Uncensored L**ked]",https://pic.javct.net/poster/05192026/aa53b6556c.jpg,https://javct.net/v/mida-698-rm,150,2026-07-04
ABP-704-RM,Hasegawa Rui Lucky Sketch 6 All The Erotic Things You Can Imagine Can Happen In Reality! ! [Uncensored L**ked],https://pic.javct.net/poster/05192026/4a8a023974.jpg,https://javct.net/v/abp-704-rm,160,2026-07-04
ABP-662-RM,She Lives Together And Has Multiple Characters! What? VOL.03 Subjective Image Full Load Of 5 Personality And Daily Change Virtual SEX Sanmasa Suzumura Airi [Uncensored L**ked],https://pic.javct.net/poster/05192026/56995598a8.jpg,https://javct.net/v/abp-662-rm,205,2026-07-04
MIKR-107-RM,"Former Track And Field Athlete Matsumoto Asuka, With An Insane Sex Drive, Makes Her AV Debut! ● An Adrenaline-fueled Fuck From A Hot-b**oded Athlete With A Big Butt Who Competed In The National High School E**den (relay Race) Championships! [Uncensored L**ked]",https://pic.javct.net/poster/05192026/60091a2652.jpg,https://javct.net/v/mikr-107-rm,160,2026-07-04
BLOR-214-RM,An Elegant Lady Who Works At A Relaxation Salon An Intellectual And Humorous Slender Beauty Gets Fucked With An Unequaled Cock And Falls To A Screaming Female [Uncensored L**ked],https://pic.javct.net/poster/20230302/1679715442.jpg,https://javct.net/v/blor-214-rm,103,2026-07-04
MIKR-107,"Former Track And Field Athlete Matsumoto Asuka, With An Insane Sex Drive, Makes Her AV Debut! ● An Adrenaline-fueled Fuck From A Hot-b**oded Athlete With A Big Butt Who Competed In The National High School E**den (relay Race) Championships!",https://pic.javct.net/poster/05192026/60091a2652.jpg,https://javct.net/v/mikr-107,160,2026-07-04
CAWB-010,Was Assigned To Be The Sex Duty Officer During The School Trip... Asami Nami,https://pic.javct.net/poster/05192026/d85b865450.jpg,https://javct.net/v/cawb-010,140,2026-07-04
MIDA-698,"The Legend Of The Strongest Sex Drive, Who Used Up 10 Boxes Of Condoms In The Athletes' Village At The World Championships!! Newcomer 145cm Tall Junior Gymnastics Athlete Makes Her AV Debut!! Aine Sana",https://pic.javct.net/poster/05192026/aa53b6556c.jpg,https://javct.net/v/mida-698,150,2026-07-04
MIDA-684,"The Always-lonely, Plain Literary Girl Is Our Convenient Semen Shower Masturbation Pet, Kira Hoshi.",https://pic.javct.net/poster/05192026/e995cc3d2c.jpg,https://javct.net/v/mida-684,120,2026-07-04
FSKT-012,Brown Cloudy Splash Yutsuki Aisha,https://pic.javct.net/poster/05192026/88617d4518.jpg,https://javct.net/v/fskt-012,120,2026-07-04
DORI-025,"Paco Shooting No.25 With A Smile, I Was Happy To Say ""I'll Have A Dessert ♪"" And I Was Pleased With The Insertion Of Raw Chin And The Double Teeth That Were Vaginal Cum Shot Were Reinserted Into The Cute J ● And I Shot My Face!",https://pic.javct.net/poster/05192026/c8da0a7b97.jpg,https://javct.net/v/dori-025,81,2026-07-04
KTRA-501-RM,I Let My Caring Little Sister Touch My Erection And Help Me Ejaculate. Sunflower [Uncensored L**ked],https://pic.javct.net/poster/20230302/1678506969.jpg,https://javct.net/v/ktra-501-rm,118,2026-07-04
ABF-365,Limit Break SEX: Breaking The Shell Of An Absolute Beauty And Awakening Her Masochistic Side Through Sex VOL.13 Alice Shaku,https://pic.javct.net/poster/05192026/bdae1887aa.jpg,https://javct.net/v/abf-365,135,2026-07-04
BLOR-213-RM,"A Voluptuous Older Sister At An Indian Curry Shop She's Usually A Cheerful Personality, But When She Sees Cock, She Turns Into A Lewd Little Girl And Shakes Her Big Ass And Cums! [Uncensored L**ked]",https://pic.javct.net/poster/20230302/1679715502.jpg,https://javct.net/v/blor-213-rm,122,2026-07-04
SHIND-057-RM,Adhesive Stalker M's Request Idiot · Home Invasion Record # 93 · 94 [Uncensored L**ked],https://pic.javct.net/poster/20230205/1685598947.jpg,https://javct.net/v/shind-057-rm,192,2026-07-04
ABF-366,"I Was Made To Orgasm Multiple Times In The Movie Theater At Work, Unable To Make A Sound So That No One Around Me Would Notice... Mai Nanashima",https://pic.javct.net/poster/05192026/d723730740.jpg,https://javct.net/v/abf-366,90,2026-07-04
FSKI-009,"""Ah! Cute Amateur School Girls In The Beginning In Front Of The 18 Cm Big Cock Of The Old Man""Wow ..."" And Blush!The Size Stop In The Big Cock Of The Electric Ma And Tick It Breaks In The Lap In The Rap Intercourse From The Living Hell, And It Is Inserted Suddenly Without Saying The Presence Or Absence!O ○ の 乙 乙 乙 放 放 放 School Girls Part 1",https://pic.javct.net/poster/05192026/b70cd29321.jpg,https://javct.net/v/fski-009,240,2026-07-04
DORI-024,Paco Shooting No.24 Athlete's Tall Glamor Inverted Nipple Big Tits J ○ Refuses To Insert Raw Chin But Feels Better And Finally Allowed Vaginal Cum Shot!,https://pic.javct.net/poster/05192026/b8c3fbdd10.jpg,https://javct.net/v/dori-024,83,2026-07-04
LOVE-017,"That One Person In Class.I Say ""Yarasero"" To Have The Courage Because It Is Not Be Popular Girl In The Dark Roots.",https://pic.javct.net/poster/05192026/7d479db934.jpg,https://javct.net/v/love-017,120,2026-07-04
FNEO-009,"I Will Lend You A ""Gutsukuru Girls School Student"" Seen In Town.Vol.2",https://pic.javct.net/poster/05192026/6612fe5a91.jpg,https://javct.net/v/fneo-009,140,2026-07-04
APAK-250-RM,Fierce Carnal Affair Passion Ikuiku Wife! Sayaka-san (26) A Carnivorous And Superb Body F-Cup Beautiful Married Woman And Horny Climax Sex Sayaka Megumi [Uncensored L**ked],https://pic.javct.net/poster/20230302/1679715941.jpg,https://javct.net/v/apak-250-rm,143,2026-07-04
SHIND-063-RM,Adhesive Stalker M's Request Idiot · Home Invasion Record # 99 · 100 [Uncensored L**ked],https://pic.javct.net/poster/20230804/1694059633.jpg,https://javct.net/v/shind-063-rm,178,2026-07-04
XRW-742-RM,Aphrodisiac And Drill-Endless Orgasm-Rui Ichinose [Uncensored L**ked],https://pic.javct.net/poster/05192026/d30eed4d18.jpg,https://javct.net/v/xrw-742-rm,125,2026-07-04
