code,title,image_url,page_url,views,date_scraped
SHIND-055-RM,Adhesive Stalker M's Request Idiot · Home Invasion Record # 91 · 92 [Uncensored L**ked],https://pic.javct.net/poster/20230205/1683173686.jpg,https://javct.net/v/shind-055-rm,195,2026-06-29
APRG-002-RM,"I Called A Delivery Health Girl And Couldn't Resist The Young Essence And Tight Meat Pussy Of The Schoolgirl, So I Continued To Fuck The Masochistic Girl Who Was Drowning In Deep Throat And Climax Until The Morning. Delivery Girl Pet [lustful Stick Part-time Job] Obedient Sex Video Yasaka Nagi [Uncensored L**ked]",https://pic.javct.net/poster/05192026/992de1e736.jpg,https://javct.net/v/aprg-002-rm,148,2026-06-29
APNS-308-RM,Horny Stamp Despair Live Streaming Aoi Nakajo [Uncensored L**ked],https://pic.javct.net/poster/20230104/1680926122.jpg,https://javct.net/v/apns-308-rm,114,2026-06-29
ANKB-017-RM,Mixed Bathing Open-air Human Bullet SEX With Big Boobs I Cup Woman [Uncensored L**ked],https://pic.javct.net/poster/20230104/1680924230.jpg,https://javct.net/v/ankb-017-rm,155,2026-06-29
NLD-031-RM,This Married Woman Is My Personal Vtuber For Swallowing () [Uncensored L**ked],https://pic.javct.net/poster/05192026/3b2ce14735.jpg,https://javct.net/v/nld-031-rm,136,2026-06-29
APAK-251-RM,Nasty De M-type Female Clerk Yuki-san [Extreme Intercourse With A Working Woman] Gap Moe! Enthusiastic Copulation Of Plain Glasses OL! # Off Paco Girl And Hotel Cage Nasty Climax SEX Yuki Hiiragi [Uncensored L**ked],https://pic.javct.net/poster/20230104/1680924045.jpg,https://javct.net/v/apak-251-rm,132,2026-06-29
APAA-405-RM,Awesome! A Lovely Girl Who Looks Good In Uniform Mei Satsuki [Uncensored L**ked],https://pic.javct.net/poster/20230104/1680924169.jpg,https://javct.net/v/apaa-405-rm,143,2026-06-29
DFDM-075-RM,"The Devilish Massage Girl, Ryukawa Rio, Seduces You Through Your Panties. [Uncensored L**ked]",https://pic.javct.net/poster/05192026/3ada6c4353.jpg,https://javct.net/v/dfdm-075-rm,115,2026-06-29
EKDV-219-RM,Let's Tutor At Azusa Nagasawa [Uncensored L**ked],https://pic.javct.net/poster/05192026/0fa416ac37.jpg,https://javct.net/v/ekdv-219-rm,120,2026-06-29
NLD-032-RM,Nipple Pleasure Men's Salon [Uncensored L**ked],https://pic.javct.net/poster/05192026/2add7c8962.jpg,https://javct.net/v/nld-032-rm,115,2026-06-29
SOE-268-RM,Big Risky Mosaic Pakopako In Costume! Azusa Nagasawa [Uncensored L**ked],https://pic.javct.net/poster/05192026/5a0262b3bd.jpg,https://javct.net/v/soe-268-rm,230,2026-06-29
ONED-937-RM,Firing Wildly Vigorous Facial Milf [Uncensored L**ked],https://pic.javct.net/poster/05192026/b8c7a097d3.jpg,https://javct.net/v/oned-937-rm,124,2026-06-29
DOCP-159,I Did Not Want To Distract The Dazzling Smile I Could Not Suppress The Impulse I Did Not Stop Even I Stopped Doing It Until I Got A Dirty Look And I Did It.,https://pic.javct.net/poster/05192026/fe244a96e6.jpg,https://javct.net/v/docp-159,185,2026-06-29
FNEO-004,"I Told My Father, ""Go Here.""",https://pic.javct.net/poster/05192026/4fe730fcf1.jpg,https://javct.net/v/fneo-004,140,2026-06-29
DORI-021,"Paco Shooting No.21 Athlete-based Creampie In J ○ Who Allowed Raw Chin Insertion While Playing With A Healthy Body And Making It Squid! The Erection Hasn't Stopped Yet, And I Stir The Pussy Again And Shoot A Facial!",https://pic.javct.net/poster/05192026/d152c81f2b.jpg,https://javct.net/v/dori-021,79,2026-06-29
HJBB-172-RM,Great Climax NTR Best That Keeps Being Made To Cum While Being Watched By The Man She Loves [Uncensored L**ked],https://pic.javct.net/poster/20231011/1697171324.jpg,https://javct.net/v/hjbb-172-rm,240,2026-06-29
SHIND-054-RM,Adhesive Stalker M's Assistance Dating/Sorry R**e Record Blue 13/14 [Uncensored L**ked],https://pic.javct.net/poster/20230104/1680750676.jpg,https://javct.net/v/shind-054-rm,170,2026-06-29
HALT-026-RM,[Real Amateur] Presenting A Big Penis To A Petite Office Lady Who Came Out To The City And Encountered Too Many Perverts And Can't Tell Anyone About Her Sexual Habits Kanon Katase [Uncensored L**ked],https://pic.javct.net/poster/20230104/1681531945.jpg,https://javct.net/v/halt-026-rm,115,2026-06-29
LWQ-005-RM,"Cute, Masochistic Onahole Girl Who Falls Into A State Of Ecstasy: Takemoto Mii [Uncensored L**ked]",https://pic.javct.net/poster/05192026/984b116b61.jpg,https://javct.net/v/lwq-005-rm,117,2026-06-29
DOCP-159-RM,I Did Not Want To Distract The Dazzling Smile I Could Not Suppress The Impulse I Did Not Stop Even I Stopped Doing It Until I Got A Dirty Look And I Did It. [Uncensored L**ked],https://pic.javct.net/poster/05192026/4f89435e78.jpg,https://javct.net/v/docp-159-rm,185,2026-06-29
NLD-032,Nipple Pleasure Men's Salon,https://pic.javct.net/poster/05192026/2add7c8962.jpg,https://javct.net/v/nld-032,115,2026-06-29
DFDM-075,"The Devilish Massage Girl, Ryukawa Rio, Seduces You Through Your Panties.",https://pic.javct.net/poster/05192026/3ada6c4353.jpg,https://javct.net/v/dfdm-075,115,2026-06-29
NLD-031,This Married Woman Is My Personal Vtuber For Swallowing (),https://pic.javct.net/poster/05192026/3b2ce14735.jpg,https://javct.net/v/nld-031,136,2026-06-29
ABF-211-SUB,A Super High-end Dating Club Where You Can Spend The Night With Asuna Kawai [English Subtitle],https://pic.javct.net/poster/20250903/1742442841.jpg,https://javct.net/v/abf-211-sub,130,2026-06-29
