code,title,image_url,page_url,views,date_scraped
ABF-347-RM,The Doctor Who Verbally A**ses Men In Her Examination Room - Alice Shaku [Uncensored L**ked],https://pic.javct.net/poster/04112026/1d86776ebf.jpg,https://javct.net/v/abf-347-rm,120,2026-06-08
GOOD-015-RM,Wife Migui Adultery Trip Yu (Pseudonym) 29 Years Old Yu Hironaka [Uncensored L**ked],https://pic.javct.net/poster/20230206/1687841348.jpg,https://javct.net/v/good-015-rm,143,2026-06-08
SOE-941,4 Production Special Dream Ayano Aika First Experience,https://pic.javct.net/poster/05192026/c211aaf945.jpg,https://javct.net/v/soe-941,120,2026-06-08
FOCS-072-RM,Debut Of A Young Lady With One New Experience-The Day When A Boxed Girl Awakens To Sexual Pleasure-Sara Yoshiki [Uncensored L**ked],https://pic.javct.net/poster/20220406/1655447639.jpg,https://javct.net/v/focs-072-rm,120,2026-06-08
BLOR-221-RM,"A Gentle And Intelligent Nursery Teacher Actually, She's Super Dirty... Drooling, Tears, And Serious Juice Scattered, And It Got Messed Up [Uncensored L**ked]",https://pic.javct.net/poster/20230206/1687578179.jpg,https://javct.net/v/blor-221-rm,120,2026-06-08
APKH-194-RM,Healing Boobs Goddess Body... Innocent Big-breasted Schoolgirl's Lewd Service Sex Please Film Me Having Sex... G-cup Chiba Yuka [Uncensored L**ked],https://pic.javct.net/poster/05192026/bc5bda16df.jpg,https://javct.net/v/apkh-194-rm,154,2026-06-08
MXGS-171-RM,Female Teacher Akiho Yoshizawa M De Nasty Was Crime Spree [Uncensored L**ked],https://pic.javct.net/poster/05192026/8276acd178.jpg,https://javct.net/v/mxgs-171-rm,120,2026-06-08
WHX-036,"Recoil Kana Parents Had Been Suppressed By Severely?I Love Sex!I, I Wonder If Transformation ◆ Pin Standing Nipple Has Become My Switch!I Usually Have Been Secretary In Shaven ◆ FujiNaka Nozomi Secretary 23 Years Old",https://pic.javct.net/poster/05192026/c4aae0797a.jpg,https://javct.net/v/whx-036,150,2026-06-08
SVVRT-079-RM,"Amateur Variety Show: Only Big-Butted Office Ladies On The Street! If You Miss, You're Instantly Fucked And Cummed Inside In A Wall-butt Style Vibrator Challenge! Stimulated Deep Inside The Vagina With A Super Thick Vibrator, The Slutty Ass Is Exposed And The Cumming Spurts Are Unstoppable!! 4 [Uncensored L**ked]",https://pic.javct.net/poster/05192026/b740e07cb8.jpg,https://javct.net/v/svvrt-079-rm,282,2026-06-08
APNS-413-RM,"The Training Of A Young Lady: 30 Hellish Days Until Conception - Endless Breeding, A Masochistic Girl Driven Mad By Orgasm - Nagisa Yasaka [Uncensored L**ked]",https://pic.javct.net/poster/05192026/bfec3f9f86.jpg,https://javct.net/v/apns-413-rm,118,2026-06-08
MADM-219-RM,"The Neighbor's Wife Is A Busty Instructor With A Voluptuous Body That Boldly Seduces, Leading To A Dream Come True Scenario Of Forbidden Extramarital Sex With Unprotected Intercourse. - Koume Ena [Uncensored L**ked]",https://pic.javct.net/poster/05192026/45359a5992.jpg,https://javct.net/v/madm-219-rm,120,2026-06-08
BLOR-220-RM,An Izakaya Poster Girl She's Usually Cool But Her Shy Smile Is Super Cute A Professional Unequaled Cock Makes You Remember How To Orgasm In Real Life [Uncensored L**ked],https://pic.javct.net/poster/20230206/1687578241.jpg,https://javct.net/v/blor-220-rm,130,2026-06-08
NACT-134-RM,Squeeze Out Every Last Drop Of Semen Until Your Balls Are Empty! Mobile Oil Massage - Rin Higashi [Uncensored L**ked],https://pic.javct.net/poster/05192026/48d421f2dc.jpg,https://javct.net/v/nact-134-rm,121,2026-06-08
MIDE-738-RM,Bikkun Bikkun Convulsions Do Not Stop 4 First Live! Nana Yagi [Uncensored L**ked],https://pic.javct.net/poster/20243105/1717717591.jpg,https://javct.net/v/mide-738-rm,210,2026-06-08
MADV-633-RM,"NTR In A Competitive Swimsuit: A Beautiful Woman With Gorgeous Legs And A Perfect Ass In A High-cut Swimsuit Gets Me Fully Erect. Despite Being Married, She Makes Me Cum Over And Over Again During Intense Sex. Shiori Imoto [Uncensored L**ked]",https://pic.javct.net/poster/05192026/effc75767f.jpg,https://javct.net/v/madv-633-rm,130,2026-06-08
EKDV-820-RM,"When I Woke Up This Morning, I Had Become... Konami Aya!! [Uncensored L**ked]",https://pic.javct.net/poster/05192026/b905bb6779.jpg,https://javct.net/v/ekdv-820-rm,140,2026-06-08
APRG-003-RM,"""I Love Deep Inside... Use My Hole However You Like."" I Called A Call Girl And Couldn't Stop Getting A Full Erection From The Big Boobs And Big Ass Of The Slutty Wife, And I Fucked Her As Much As I Wanted Until Morning, Making Her Cum Over And Over. Call Girl Pet [lustful Domination] Amateur Sex Video Record Sunao Kui [Uncensored L**ked]",https://pic.javct.net/poster/05192026/dcae027c67.jpg,https://javct.net/v/aprg-003-rm,140,2026-06-08
CPZ69-010,That Kimese Mouth Doll (Love Doll) Does Intense XXX,https://pic.javct.net/poster/05192026/6a7a6b95de.jpg,https://javct.net/v/cpz69-010,134,2026-06-08
BLOR-219-RM,"An Interesting, High-Tension OL Who Enlivens A Drinking Party Actually, She Was A Pervert Sobbing And Sobbing While Crying And Masochistic Masochism! Ji Po Fallen [Uncensored L**ked]",https://pic.javct.net/poster/20230206/1687578302.jpg,https://javct.net/v/blor-219-rm,130,2026-06-08
SNOS-248-RM,"Newcomer No. 1 Style: A Pure And Innocent Older Sister Who Is Dedicated To Swimming, Sonoko Rion, Makes Her AV Debut. [Uncensored L**ked]",https://pic.javct.net/poster/05192026/4942d97840.jpg,https://javct.net/v/snos-248-rm,160,2026-06-08
IPZZ-865-RM,"[Abusive And Obscene Language × Massive Facial Cumshots × Completely Subjective] A Beautiful, Sadistic Maid With A Sharp Tongue Smiles And Belittles Me, A Masochist, And Provides Abusive Service. [Uncensored L**ked]",https://pic.javct.net/poster/05192026/33114db4b7.jpg,https://javct.net/v/ipzz-865-rm,110,2026-06-08
APNS-413,"The Training Of A Young Lady: 30 Hellish Days Until Conception - Endless Breeding, A Masochistic Girl Driven Mad By Orgasm - Nagisa Yasaka",https://pic.javct.net/poster/05192026/bfec3f9f86.jpg,https://javct.net/v/apns-413,118,2026-06-08
SNOS-227-RM,"Born Into A Pretty Family And Becoming A News Anchor, She Must Have Been A Winner In Life, Right? But Since She Foolishly Came To A Slum To Do Some Reporting, She Can't Complain If She Gets Envied And R**ed By Low-income Day Laborers. - Marin Mita [Uncensored L**ked]",https://pic.javct.net/poster/05192026/c54c9b078e.jpg,https://javct.net/v/snos-227-rm,120,2026-06-08
MADM-219,"The Neighbor's Wife Is A Busty Instructor With A Voluptuous Body That Boldly Seduces, Leading To A Dream Come True Scenario Of Forbidden Extramarital Sex With Unprotected Intercourse. - Koume Ena",https://pic.javct.net/poster/05192026/45359a5992.jpg,https://javct.net/v/madm-219,120,2026-06-08
