code,title,image_url,page_url,views,date_scraped
NACT-134-RM,Squeeze Out Every Last Drop Of Semen Until Your Balls Are Empty! Mobile Oil Massage - Rin Higashi [Uncensored L**ked],https://pic.javct.net/poster/05192026/48d421f2dc.jpg,https://javct.net/v/nact-134-rm,121,2026-06-07
MIDE-738-RM,Bikkun Bikkun Convulsions Do Not Stop 4 First Live! Nana Yagi [Uncensored L**ked],https://pic.javct.net/poster/20243105/1717717591.jpg,https://javct.net/v/mide-738-rm,210,2026-06-07
MADV-633-RM,"NTR In A Competitive Swimsuit: A Beautiful Woman With Gorgeous Legs And A Perfect Ass In A High-cut Swimsuit Gets Me Fully Erect. Despite Being Married, She Makes Me Cum Over And Over Again During Intense Sex. Shiori Imoto [Uncensored L**ked]",https://pic.javct.net/poster/05192026/effc75767f.jpg,https://javct.net/v/madv-633-rm,130,2026-06-07
EKDV-820-RM,"When I Woke Up This Morning, I Had Become... Konami Aya!! [Uncensored L**ked]",https://pic.javct.net/poster/05192026/b905bb6779.jpg,https://javct.net/v/ekdv-820-rm,140,2026-06-07
APRG-003-RM,"""I Love Deep Inside... Use My Hole However You Like."" I Called A Call Girl And Couldn't Stop Getting A Full Erection From The Big Boobs And Big Ass Of The Slutty Wife, And I Fucked Her As Much As I Wanted Until Morning, Making Her Cum Over And Over. Call Girl Pet [lustful Domination] Amateur Sex Video Record Sunao Kui [Uncensored L**ked]",https://pic.javct.net/poster/05192026/dcae027c67.jpg,https://javct.net/v/aprg-003-rm,140,2026-06-07
CPZ69-010,That Kimese Mouth Doll (Love Doll) Does Intense XXX,https://pic.javct.net/poster/05192026/6a7a6b95de.jpg,https://javct.net/v/cpz69-010,134,2026-06-07
BLOR-219-RM,"An Interesting, High-Tension OL Who Enlivens A Drinking Party Actually, She Was A Pervert Sobbing And Sobbing While Crying And Masochistic Masochism! Ji Po Fallen [Uncensored L**ked]",https://pic.javct.net/poster/20230206/1687578302.jpg,https://javct.net/v/blor-219-rm,130,2026-06-07
SNOS-248-RM,"Newcomer No. 1 Style: A Pure And Innocent Older Sister Who Is Dedicated To Swimming, Sonoko Rion, Makes Her AV Debut. [Uncensored L**ked]",https://pic.javct.net/poster/05192026/4942d97840.jpg,https://javct.net/v/snos-248-rm,160,2026-06-07
IPZZ-865-RM,"[Abusive And Obscene Language × Massive Facial Cumshots × Completely Subjective] A Beautiful, Sadistic Maid With A Sharp Tongue Smiles And Belittles Me, A Masochist, And Provides Abusive Service. [Uncensored L**ked]",https://pic.javct.net/poster/05192026/33114db4b7.jpg,https://javct.net/v/ipzz-865-rm,110,2026-06-07
APNS-413,"The Training Of A Young Lady: 30 Hellish Days Until Conception - Endless Breeding, A Masochistic Girl Driven Mad By Orgasm - Nagisa Yasaka",https://pic.javct.net/poster/05192026/bfec3f9f86.jpg,https://javct.net/v/apns-413,118,2026-06-07
SNOS-227-RM,"Born Into A Pretty Family And Becoming A News Anchor, She Must Have Been A Winner In Life, Right? But Since She Foolishly Came To A Slum To Do Some Reporting, She Can't Complain If She Gets Envied And R**ed By Low-income Day Laborers. - Marin Mita [Uncensored L**ked]",https://pic.javct.net/poster/05192026/c54c9b078e.jpg,https://javct.net/v/snos-227-rm,120,2026-06-07
MADM-219,"The Neighbor's Wife Is A Busty Instructor With A Voluptuous Body That Boldly Seduces, Leading To A Dream Come True Scenario Of Forbidden Extramarital Sex With Unprotected Intercourse. - Koume Ena",https://pic.javct.net/poster/05192026/45359a5992.jpg,https://javct.net/v/madm-219,120,2026-06-07
APNS-412,Middle-aged Cock Fetishist Schoolgirl Gets Cummed Inside By Neighborhood Uncles While Home Alone - Yui Hina,https://pic.javct.net/poster/05192026/301f86db30.jpg,https://javct.net/v/apns-412,120,2026-06-07
ONED-860-RM,Risa Kasumi NO.1 STYLE × × Hyper Hyper Barely Barely [Uncensored L**ked],https://pic.javct.net/poster/20230206/1687956067.jpg,https://javct.net/v/oned-860-rm,120,2026-06-07
EKDV-820,"When I Woke Up This Morning, I Had Become... Konami Aya!!",https://pic.javct.net/poster/05192026/b905bb6779.jpg,https://javct.net/v/ekdv-820,140,2026-06-07
SVVRT-079,"Amateur Variety Show: Only Big-Butted Office Ladies On The Street! If You Miss, You're Instantly Fucked And Cummed Inside In A Wall-butt Style Vibrator Challenge! Stimulated Deep Inside The Vagina With A Super Thick Vibrator, The Slutty Ass Is Exposed And The Cumming Spurts Are Unstoppable!! 4",https://pic.javct.net/poster/05192026/b740e07cb8.jpg,https://javct.net/v/svvrt-079,282,2026-06-07
MADV-633,"NTR In A Competitive Swimsuit: A Beautiful Woman With Gorgeous Legs And A Perfect Ass In A High-cut Swimsuit Gets Me Fully Erect. Despite Being Married, She Makes Me Cum Over And Over Again During Intense Sex. Shiori Imoto",https://pic.javct.net/poster/05192026/effc75767f.jpg,https://javct.net/v/madv-633,130,2026-06-07
CHIB-004,"[Playing Tricks On Two Little Girls] Unable To Control My Excitement When I Saw Their Innocent Smiles Cloud Over And Their Faces Become Anxious And Wary, I Buried My Adult Erect Penis Into Their Immature Vaginas...",https://pic.javct.net/poster/05192026/20af7f1342.jpg,https://javct.net/v/chib-004,160,2026-06-07
NACT-134,Squeeze Out Every Last Drop Of Semen Until Your Balls Are Empty! Mobile Oil Massage - Rin Higashi,https://pic.javct.net/poster/05192026/48d421f2dc.jpg,https://javct.net/v/nact-134,121,2026-06-07
MIDD-500-RM,Maria Ozawa Doctor Gloss [Uncensored L**ked],https://pic.javct.net/poster/05192026/aca1c61abf.jpg,https://javct.net/v/midd-500-rm,120,2026-06-07
APRG-003,"""I Love Deep Inside... Use My Hole However You Like."" I Called A Call Girl And Couldn't Stop Getting A Full Erection From The Big Boobs And Big Ass Of The Slutty Wife, And I Fucked Her As Much As I Wanted Until Morning, Making Her Cum Over And Over. Call Girl Pet [lustful Domination] Amateur Sex Video Record Sunao Kui",https://pic.javct.net/poster/05192026/dcae027c67.jpg,https://javct.net/v/aprg-003,140,2026-06-07
SNOS-234-RM,The Revealing Swimsuits Of Gravure Idols Arouse The R**e Desires Of The Photography Staff - Rui Shido [Uncensored L**ked],https://pic.javct.net/poster/05192026/410a859aff.jpg,https://javct.net/v/snos-234-rm,120,2026-06-07
APKH-194,Healing Boobs Goddess Body... Innocent Big-breasted Schoolgirl's Lewd Service Sex Please Film Me Having Sex... G-cup Chiba Yuka,https://pic.javct.net/poster/05192026/bc5bda16df.jpg,https://javct.net/v/apkh-194,154,2026-06-07
MIDD-887-RM,Maple Pie Birth Mei Yuki [Uncensored L**ked],https://pic.javct.net/poster/06032026/1774329637.jpg,https://javct.net/v/midd-887-rm,180,2026-06-07
