code,title,image_url,page_url,views,date_scraped
FMDL-001-RM,"Once I've Got A Cock In My Mouth, I Won't Let It Go Until I Ejaculate Ultimate Penis Love Mitsuki Yuina [Uncensored L**ked]",https://pic.javct.net/poster/05192026/c8964d223c.jpg,https://javct.net/v/fmdl-001-rm,127,2026-06-24
PKPD-135-RM,Nenne Is A Poor Girl In Glasses With J-Cup Titties Who Lives In An Apartment Complex Nenne Ui [Uncensored L**ked],https://pic.javct.net/poster/20212709/1636393281.jpg,https://javct.net/v/pkpd-135-rm,128,2026-06-24
HODV-21619-RM,A Tecaher I can't Stand Holds A Secret Against Me... Riho Takahashi [Uncensored L**ked],https://pic.javct.net/poster/20212709/1636112589.jpg,https://javct.net/v/hodv-21619-rm,120,2026-06-24
FNS-221-RM,"Why Don't You Just Try It Out? Lol My C**ldhood Friend, A Gal Sister, Got Addicted To My Big Dick And Kept Shaking Her Hips For 3 Days RARA [Uncensored L**ked]",https://pic.javct.net/poster/05192026/730ff746b4.jpg,https://javct.net/v/fns-221-rm,120,2026-06-24
BABM-003-RM,The Doting Step-Mom Ena Makes Me Feel Loved And Takes Care Of Me And When I Cry She Spoils Me With Sex Ena Koume [Uncensored L**ked],https://pic.javct.net/poster/20212308/1631368853.jpg,https://javct.net/v/babm-003-rm,114,2026-06-24
AQSH-087-RM,"Instead Of Reporting His Wife For Shoplifting, He Scolds Her With A Creampie Instead. The Next Day, She Comes Back For More. Civil Servant's Sub Wife Ena Koume [Uncensored L**ked]",https://pic.javct.net/poster/20221904/1652508504.jpg,https://javct.net/v/aqsh-087-rm,120,2026-06-24
ABF-226-SUB,Sweet Sadist Nipple Slut Remu Suzumori [English Subtitle],https://pic.javct.net/poster/20252204/1746679319.jpg,https://javct.net/v/abf-226-sub,135,2026-06-24
FVMD-007-RM,"7 God Blow Sumire Mizukawa Who Sucks With Her Lips, Obscene Tongue [Uncensored L**ked]",https://pic.javct.net/poster/05192026/ad7c4e1c84.jpg,https://javct.net/v/fvmd-007-rm,112,2026-06-24
POMD-003-RM,"[Amateur POV] While staring at each other for a long time, I'm going to have a good time SEX. Indecent Mistress Who Loves Pacifiers Kokona Asakura [Uncensored L**ked]",https://pic.javct.net/poster/05192026/4aaa0b26d4.jpg,https://javct.net/v/pomd-003-rm,112,2026-06-24
NSPS-615-RM,At The Edge Of A Marriage Separated By An Age Difference Of 20 Years... My Wife Got Fucked By A Younger Man! Nao Wakana [Uncensored L**ked],https://pic.javct.net/poster/20221904/1651770567.jpg,https://javct.net/v/nsps-615-rm,95,2026-06-24
FNS-221,"Why Don't You Just Try It Out? Lol My C**ldhood Friend, A Gal Sister, Got Addicted To My Big Dick And Kept Shaking Her Hips For 3 Days RARA",https://pic.javct.net/poster/05192026/730ff746b4.jpg,https://javct.net/v/fns-221,120,2026-06-24
VENX-030-RM,"""Your Tits Are On Me..."" Have Sex In The Tub With My Super Hot Big Titty Mother In Law Hana Himesaki [Uncensored L**ked]",https://pic.javct.net/poster/20212709/1632732514.jpg,https://javct.net/v/venx-030-rm,110,2026-06-24
STARS-367-RM,"""It'll Be A Month From Now ... Before We Meet Again ..."" I'm In A Long Distance Relationship With My Girlfriend, And So We Used What Little Time We Have Together To Furiously Creampie Fuck Until My Balls Are Drained Dry As We Enjoyed The Passion Of A Purely Loving Sexual Encounter Makoto Toda [Uncensored L**ked]",https://static.javct.net/poster/1619516485.jpg,https://javct.net/v/stars-367-rm,130,2026-06-24
NSPS-696-RM,The Rental Wife 10 The Tables Were Turned Between This Husband And His Former Employee Mio Kimijima [Uncensored L**ked],https://pic.javct.net/poster/20221108/1661995819.jpg,https://javct.net/v/nsps-696-rm,83,2026-06-24
POMD-002-RM,"[Amateur POV] While staring at each other for a long time, I'm going to have a good time SEX. Adultery Diary Kodue Minami Engaging With A Young Wife With Beautiful Legs [Uncensored L**ked]",https://pic.javct.net/poster/05192026/ecd28c4547.jpg,https://javct.net/v/pomd-002-rm,125,2026-06-24
SDAB-155-RM,First Creampie At School First Rule Violation At School! Too Cute And Tits Too Big! Miraculously Colossal I-Cup Tits! Hana Himesaki [Uncensored L**ked],https://pic.javct.net/poster/20220707/1660096160.jpg,https://javct.net/v/sdab-155-rm,130,2026-06-24
JJDA-027-RM,Kind And Gentle Aunt-In-Law Gives Favors Behind Husband's Back To Cherry Boy Nephew-In-Law Who Has Come to Tokyo To Look For a Job [Uncensored L**ked],https://pic.javct.net/poster/20221202/1645866246.jpg,https://javct.net/v/jjda-027-rm,123,2026-06-24
AKDL-110,KDK (Seduction) I Seduced This Woman My Friend's Girlfriend College Girl Honoka 20 Years Old Honoka Suzumi,https://static.javct.net/poster/akdl-110.jpg,https://javct.net/v/akdl-110,144,2026-06-24
VENX-026-RM,One Night And Two Days Of Being Drained Dry By My Wife's Older Sister Who Suddenly Came On To Me [Uncensored L**ked],https://pic.javct.net/poster/20212709/1632732571.jpg,https://javct.net/v/venx-026-rm,114,2026-06-24
LORS-001-RM,Blue Collar Girl Goes To Hospital For Injury And Gets Teased By Perverted Doctor! [Uncensored L**ked],https://pic.javct.net/poster/05192026/b6bbc889b0.jpg,https://javct.net/v/lors-001-rm,120,2026-06-24
SDAB-154-RM,"Youthful Getaway - Fair-Skinned Beautiful Girl Spends A Summer Day Slaking Her Lust: Cum Swallowing/Fucking In The Open Air/As Hard As She Can, Seeking Pleasure With Her Whole Body Chika Sato [Uncensored L**ked]",https://pic.javct.net/poster/20221202/1645487322.jpg,https://javct.net/v/sdab-154-rm,140,2026-06-24
VENX-021-RM,"""Do Old Lady Panties Excite You? Older Woman Milks Young Man Of All Of His Cum With Her Worn Panties Sakura Tsukishima [Uncensored L**ked]",https://pic.javct.net/poster/20212308/1632205222.jpg,https://javct.net/v/venx-021-rm,105,2026-06-24
JAG-065-RM,Ravaging Female Teacher Azusa [Uncensored L**ked],https://pic.javct.net/poster/20220707/1657675339.jpg,https://javct.net/v/jag-065-rm,117,2026-06-24
JUC-507-RM,My Wife's Young Sister - The Wild Woman I Saw on the Voyeur Camera ( Risa Kasumi ) [Uncensored L**ked],https://pic.javct.net/poster/20222109/1666319366.jpg,https://javct.net/v/juc-507-rm,118,2026-06-24
