code,title,image_url,page_url,views,date_scraped
HODV-21631-RM,She Turned Down A Debut In The Entertainment World. The Best SEXUAL Situation With A Fine Woman Who Seduces Men. Arisu Nanase. [Uncensored L**ked],https://pic.javct.net/poster/20212011/1638531027.jpg,https://javct.net/v/hodv-21631-rm,179,2026-07-03
PKPD-145-RM,Amateur Fuck Buddy Documentary - Lightly Buzzed Creampie Sex With Fragrant Pretty Office Lady In Pantyhose - Hana Shirato [Uncensored L**ked],https://static.javct.net/poster/pkpd-145.jpg,https://javct.net/v/pkpd-145-rm,123,2026-07-03
PGD-664-RM,Yuki Shin Face Sitting Special [Uncensored L**ked],https://pic.javct.net/poster/20220406/1654486957.jpg,https://javct.net/v/pgd-664-rm,150,2026-07-03
T28-461-RM,Home At Last For Creampie Sex With My Big Sister Kurumi Seseragi [Uncensored L**ked],https://pic.javct.net/poster/20221904/1652230636.jpg,https://javct.net/v/t28-461-rm,141,2026-07-03
PKPD-146-RM,"Compensated Dating - 18 Years Old, Creampie OK - Half-Seriously Dating Airi, A Shy Honors Student With Plump E-Cup Tits - Airi Momose [Uncensored L**ked]",https://static.javct.net/poster/pkpd-146.jpg,https://javct.net/v/pkpd-146-rm,125,2026-07-03
JUY-339-RM,The Night My Wife Got Fucked The Lustful Nightmare That Her Husband Had Secretly Wished For Rin Yamamoto [Uncensored L**ked],https://pic.javct.net/poster/20212011/1640937205.jpg,https://javct.net/v/juy-339-rm,119,2026-07-03
DLDSS-508-RM,"The Best First Co-star ""I'm Assigned To DOTCH? ” Naho Ozawa 2nd Anniversary X DAHLIA Renewal Commemoration Naho Ozawa/Suzume Mino, The Strongest Double Female Boss In History Who Competes For Young New Employees [Uncensored L**ked]",https://pic.javct.net/poster/05192026/d8998c0eb2.jpg,https://javct.net/v/dldss-508-rm,180,2026-07-03
FNS-214,"""Huh...Sana-chan!?'' I Mistakenly Kissed My Girlfriend's Younger Sister Deeply. I Had Sex With My Girlfriend's Younger Sister, Who Was Blushing From Our First Kiss And Had Our Tongues Intertwined With Each Other... Sana Ikuta",https://pic.javct.net/poster/05192026/6ef47f5573.jpg,https://javct.net/v/fns-214,120,2026-07-03
FNS-209-RM,"It Was A Saturday Morning When I Was Woken Up At My House By A Male Friend. We Had Lunch, Had Sex, Went To The Convenience Store In The Evening, Had Sex, And Slept Together Again On Sunday Night. Ranran Fujii [Uncensored L**ked]",https://pic.javct.net/poster/04112026/01b4dfd536.jpg,https://javct.net/v/fns-209-rm,150,2026-07-03
EBON-006-RM,"""Someday, surely..."" Before you know it, your beloved c**ldhood friend's body is being stained by your friend... The c**ldhood friend BSS series, which has sold over 230,000 copies in total, is finally being made into a film! Until I take everything from you - Riho Shishido [Uncensored L**ked]",https://pic.javct.net/poster/05192026/e9bee068bf.jpg,https://javct.net/v/ebon-006-rm,112,2026-07-03
VEMA-172-SUB,"Beautiful Female Teacher's Girlfriend Is My Class Homeroom Teacher, Club Advisor, And My Lover - Forbidden Passionate Creampie Sex With Older Girlfriend From Morning Till Night - Kana Morisawa [English Subtitle]",https://pic.javct.net/poster/20212709/1637310644.jpg,https://javct.net/v/vema-172-sub,110,2026-07-03
XVSR-333,My Far Goddess Far Away.Haruka Wataki 4 Hours,https://pic.javct.net/poster/05192026/e1dfefb6c1.jpg,https://javct.net/v/xvsr-333,240,2026-07-03
BAB-038-RM,The Lewdest Girl In History Was Hiding These Huge G-cup Breasts - Rino Yuki [Uncensored L**ked],https://pic.javct.net/poster/20212011/1637468766.jpg,https://javct.net/v/bab-038-rm,94,2026-07-03
ABF-365,Limit Break SEX: Breaking The Shell Of An Absolute Beauty And Awakening Her Masochistic Side Through Sex VOL.13 Alice Shaku,https://pic.javct.net/poster/05192026/bdae1887aa.jpg,https://javct.net/v/abf-365,135,2026-07-03
KSBJ-053-RM,My Brothers Wife Yu Miyashima [Uncensored L**ked],https://pic.javct.net/poster/20212011/1644452601.jpg,https://javct.net/v/ksbj-053-rm,103,2026-07-03
GVG-823-RM,The Town Doctor And His Face-Licking Perverted Creampie Medical Records Mitsuki Kamiya [Uncensored L**ked],https://pic.javct.net/poster/20221108/1661255333.jpg,https://javct.net/v/gvg-823-rm,130,2026-07-03
ABF-364,"Weekday Female Teacher, Weekend Sex Toy. Airi Suzumura",https://pic.javct.net/poster/05192026/7fde5b67eb.jpg,https://javct.net/v/abf-364,115,2026-07-03
XVSR-271-RM,Unstoppable Jealousy x Sex Yui Hatano [Uncensored L**ked],https://pic.javct.net/poster/20221108/1661130183.jpg,https://javct.net/v/xvsr-271-rm,119,2026-07-03
ABF-366,"I Was Made To Orgasm Multiple Times In The Movie Theater At Work, Unable To Make A Sound So That No One Around Me Would Notice... Mai Nanashima",https://pic.javct.net/poster/05192026/d723730740.jpg,https://javct.net/v/abf-366,90,2026-07-03
PKPD-144-RM,Compensated Dating - Creampie OK! 18 Year Old Petite Hottie Ichika Nagano [Uncensored L**ked],https://static.javct.net/poster/pkpd-144.jpg,https://javct.net/v/pkpd-144-rm,115,2026-07-03
SAN-472-RM,"Yui Hatano, The Legendary Actress With The Most Film Appearances Of All Time, 265 Minutes [Uncensored L**ked]",https://pic.javct.net/poster/05192026/6a64d10dcd.jpg,https://javct.net/v/san-472-rm,265,2026-07-03
SAN-473-RM,"Cute Face And A Cuddly, Plump Body: Usami Nana 260 Minutes [Uncensored L**ked]",https://pic.javct.net/poster/05192026/4022066eb3.jpg,https://javct.net/v/san-473-rm,260,2026-07-03
SDAB-168-RM,This Naughty And Boyish Girl With A Sensual Body Is Twitching And Throbbing And Cumming Like A Cunt And Moaning And Wailing In Ecstasy Like A Wretched Bitch She's Wearing Her Uniform While Engaging In Oiled-Up Massage Sex Nana Hayami [Uncensored L**ked],https://pic.javct.net/poster/20212709/1636501705.jpg,https://javct.net/v/sdab-168-rm,135,2026-07-03
CEAD-735-RM,Kasumi Yua 2-disc Hyper Best 4 Hours 49 Minutes [Uncensored L**ked],https://pic.javct.net/poster/05192026/7ce9a7d918.jpg,https://javct.net/v/cead-735-rm,289,2026-07-03
