code,title,image_url,page_url,views,date_scraped
XVSR-289-RM,Miyoshi Hoshino 4 Hours [Uncensored L**ked],https://pic.javct.net/poster/04112026/86c58ac656.jpg,https://javct.net/v/xvsr-289-rm,240,2026-07-12
FNS-235-RM,"When I Woke Up In The Morning, I Saw A Completely Naked Beautiful Woman...I Couldn't Resist And Immediately Inserted My Dick In The Morning! They Were A Perfect Match And We Fucked All Day Long... Tsubasa Mai [Uncensored L**ked]",https://pic.javct.net/poster/07052026/674c968d7b.jpg,https://javct.net/v/fns-235-rm,120,2026-07-12
JUY-943-RM,Her First Appearance With Madonna! - My Husband Doesn't Know About My Secret Desires - Shoko Akiyama [Uncensored L**ked],https://pic.javct.net/poster/20220406/1655138513.jpg,https://javct.net/v/juy-943-rm,118,2026-07-12
FNS-235,"When I Woke Up In The Morning, I Saw A Completely Naked Beautiful Woman...I Couldn't Resist And Immediately Inserted My Dick In The Morning! They Were A Perfect Match And We Fucked All Day Long... Tsubasa Mai",https://pic.javct.net/poster/07052026/674c968d7b.jpg,https://javct.net/v/fns-235,120,2026-07-12
HZGD-202-RM,"""Taken Advantage Of By My Terrible Brother-in-law, Making Me Give Into Pleasure I've Never Known Before..."" Emotions Remain The Same As Always, But The Husband Switches Places With The Brother-in-law. Tsubasa Hachino [Uncensored L**ked]",https://pic.javct.net/poster/20212709/1637178109.jpg,https://javct.net/v/hzgd-202-rm,119,2026-07-12
FVMD-006-RM,"Calling Male Employees In The Company Licking The Whole Body Crazy, Playing With 'Sperm Squeezing Vero Slut Boss Wakamiya Hazuki [Uncensored L**ked]",https://pic.javct.net/poster/07052026/f4c7dade33.jpg,https://javct.net/v/fvmd-006-rm,108,2026-07-12
PKPD-159-RM,"Dating An 18 Year Old Girl Named Himari Who Will Let Me Creampie Her, She's Almost A Virgin, Super Masochistic, And In The 1st Year, I Can Creampie Her All I Want - Himari Ayase [Uncensored L**ked]",https://static.javct.net/poster/pkpd-159.jpg,https://javct.net/v/pkpd-159-rm,124,2026-07-12
SDAB-182-RM,"Asuna Kusunoki: Works At A Maid Cafe, Likes To Draw, Looking For Love SOD Exclusive Porn Debut [Uncensored L**ked]",https://static.javct.net/poster/1623728037.jpg,https://javct.net/v/sdab-182-rm,129,2026-07-12
RCTD-415-RM,"Big Tits Female Pro Wrestler Himeka, Unfortunately It's Her Fertile Day! Back To Back Creampie Death Match!! [Uncensored L**ked]",https://static.javct.net/poster/rctd-415.jpg,https://javct.net/v/rctd-415-rm,121,2026-07-12
DDFF-017-RM,A Barely Legal Babe In Shame Deep Throat Subjugation Maika Hiizumi [Uncensored L**ked],https://pic.javct.net/poster/20212709/1636793393.jpg,https://javct.net/v/ddff-017-rm,127,2026-07-12
DDFF-012-RM,The Face-Fucking Interview. Ichika Kasagi. [Uncensored L**ked],https://static.javct.net/poster/ddff-012.jpg,https://javct.net/v/ddff-012-rm,119,2026-07-12
DDFF-018-RM,Life Is A Psycopath. Mummify Bitch Who Ruined Your Life And Poke Her In The Pussy. Yui Tenma [Uncensored L**ked],https://pic.javct.net/poster/20212011/1639889916.jpg,https://javct.net/v/ddff-018-rm,111,2026-07-12
IPOK-026,National Treasure Face Karen Kaede's Best Fellatio 90 ALL Complete 12 Hours,https://pic.javct.net/poster/07052026/db6190c2b6.jpg,https://javct.net/v/ipok-026,690,2026-07-12
VENU-093-RM,Fakecest Horny Stepmom Masturbates With Stepson's Pants Miku Hasegawa [Uncensored L**ked],https://pic.javct.net/poster/20220406/1656590101.jpg,https://javct.net/v/venu-093-rm,85,2026-07-12
MIDA-125-SUB,Fumika Nakayama [English Subtitle],https://pic.javct.net/poster/20250903/1744303228.jpg,https://javct.net/v/mida-125-sub,130,2026-07-12
MKMP-574-RM,The Number One Slut For Embracing Mizuki Yayoi 240 Minutes Premium BEST [Uncensored L**ked],https://pic.javct.net/poster/20242108/1724471800.jpg,https://javct.net/v/mkmp-574-rm,240,2026-07-12
EUMD-001-RM,Hey sticky slut! J Cup Glamorous Female Boss Mion Hazuki Who Plays With The Older And Lower [Uncensored L**ked],https://pic.javct.net/poster/07052026/8319a9c46d.jpg,https://javct.net/v/eumd-001-rm,125,2026-07-12
HZGD-201-RM,"I Went Home To Visit My Family And Met My Stepmom's Employee, A Sensual Colossal Tits Married Woman. Madoka Shizuki [Uncensored L**ked]",https://pic.javct.net/poster/20212709/1633426262.jpg,https://javct.net/v/hzgd-201-rm,118,2026-07-12
HODV-21641-RM,[Complete POV] Girl With A Dialect. The Okinawan Dialect. Kokono Terada [Uncensored L**ked],https://pic.javct.net/poster/20212011/1642148424.jpg,https://javct.net/v/hodv-21641-rm,133,2026-07-12
PKPD-158-RM,"A Documentary On Mitsuki, My Amateur Fuck-Buddy, Who Is An Extremely Beautiful Girl, Neat and Clean, Small-Titted, And Looking For A Job. Mitsuki Hirose. [Uncensored L**ked]",https://static.javct.net/poster/pkpd-158.jpg,https://javct.net/v/pkpd-158-rm,141,2026-07-12
FVMD-005-RM,The reason why that cute girl in the company is addicted to adultery and is sweaty and greedy and addicted to sex. Colossal Tits Rookie Subordinate I Cup Maya Kikuchi [Uncensored L**ked],https://pic.javct.net/poster/07052026/f43af1cd86.jpg,https://javct.net/v/fvmd-005-rm,117,2026-07-12
MILK-205-RM,"Voyeurism, molester, coma, ●●● F-cup beautiful breasted nurse turned into a meat urinal, orgasm-crazy absolute submissive sex Mika Horiuchi [Uncensored L**ked]",https://pic.javct.net/poster/20241703/1712247113.jpg,https://javct.net/v/milk-205-rm,131,2026-07-12
PGD-682-RM,Shocking! Yuki Shin's Godly Ass Fucked By Black Cock [Uncensored L**ked],https://pic.javct.net/poster/20221202/1647523202.jpg,https://javct.net/v/pgd-682-rm,160,2026-07-12
JUY-351-RM,The Night My Hot Aunt Crashed At My Apartment... Kaori Mizusawa [Uncensored L**ked],https://pic.javct.net/poster/20221904/1651463919.jpg,https://javct.net/v/juy-351-rm,120,2026-07-12
