code,title,image_url,page_url,views,date_scraped
MILK-130-RM,Sick Kawaii Idol Yui Who Was Made To Pee And Got Buzzed Individual Photography X Diuretics X Fucked And Controlled Pillow Fight X Off-package Sex X Massive Squirting X Incontinence Orgy Yui Hazuki [Uncensored L**ked],https://pic.javct.net/poster/20212011/1641445361.jpg,https://javct.net/v/milk-130-rm,116,2026-06-20
FNS-222-RM,"During A Dark Fitness Creampie Exercise, Her Big Breasts, Clitoris, And Pussy Are All Played With And She Reaches A Humiliating Climax Ranran Fujii [Uncensored L**ked]",https://pic.javct.net/poster/05192026/7035372221.jpg,https://javct.net/v/fns-222-rm,115,2026-06-20
SOE-957-SUB,"Aika Yumeno , Cum! [English Subtitle]",https://pic.javct.net/poster/20221108/1662023684.jpg,https://javct.net/v/soe-957-sub,148,2026-06-20
VOSS-030-RM,"This Lonely Old Lady Was Living Alone, And So When She Came Down With A Cold, I Went To Visit Her, And Her Closthes Were So Soaked With Sweat, I Could See Her Big Tits Right Through Them! She Looked So Sexy I Couldn't Just Leave Her Like That, And I Was About Ready To Ejaculate, So What Should I Do!? Mikan Kururugi [Uncensored L**ked]",https://pic.javct.net/poster/20212011/1643115590.jpg,https://javct.net/v/voss-030-rm,85,2026-06-20
VENX-136-SUB,Taking Magic Chems For 100 Times The Sensitivity. Stepmom And Stepson Go At It Like Crazy With Each Other Over Passionate Creampie Sex. Yuko Shiraki [English Subtitle],https://pic.javct.net/poster/20221904/1651814012.jpg,https://javct.net/v/venx-136-sub,112,2026-06-20
MILK-129-RM,Riona Minami 10th Anniversary Film - The Path I've Taken with My Fans - May 10 Years of Thank You's Reach Everyone [Uncensored L**ked],https://pic.javct.net/poster/20212011/1638476107.jpg,https://javct.net/v/milk-129-rm,148,2026-06-20
GVG-404-RM,The Sexy PTA Chairwoman And The Student Council Brats [Uncensored L**ked],https://pic.javct.net/poster/20220406/1656676520.jpg,https://javct.net/v/gvg-404-rm,133,2026-06-20
MIST-476-RM,Yui Tenma [Uncensored L**ked],https://pic.javct.net/poster/20250606/1752116800.jpg,https://javct.net/v/mist-476-rm,153,2026-06-20
JKSR-27901-RM,A girl who can't hold it in and wets herself: Twin tails x plump x big butt Noa Eikawa Noa [Uncensored L**ked],https://pic.javct.net/poster/05192026/45086dd7d7.jpg,https://javct.net/v/jksr-27901-rm,59,2026-06-20
JIMMY-002-RM,Why Don't You Stop Cheating? The Smell Of Another Woman's Vagina That Hangs Over Me Every Night Is Ruining My Pride... Nazuki Aoshima [Uncensored L**ked],https://pic.javct.net/poster/05192026/b8c7ff2cce.jpg,https://javct.net/v/jimmy-002-rm,120,2026-06-20
FNS-222,"During A Dark Fitness Creampie Exercise, Her Big Breasts, Clitoris, And Pussy Are All Played With And She Reaches A Humiliating Climax Ranran Fujii",https://pic.javct.net/poster/05192026/7035372221.jpg,https://javct.net/v/fns-222,115,2026-06-20
VOSS-009-RM,"I Was Being Bullied For Having A Big Dick, So I Stopped Going To School, And When My Female Teacher Came To Visit Because She Was Worried About Me, She Took One Look At My Huge Cock And Got Hot And Horny 2 Hisae Yabe [Uncensored L**ked]",https://pic.javct.net/poster/20212011/1643856572.jpg,https://javct.net/v/voss-009-rm,99,2026-06-20
MCSR-349-RM,The Hottest Housewife Gets Fucked In Front of Her Husband... Monami Takarada [Uncensored L**ked],https://pic.javct.net/poster/20221904/1652003669.jpg,https://javct.net/v/mcsr-349-rm,130,2026-06-20
JUY-531-RM,The Married Woman Investigator Wears Jeans Maki Tomoda [Uncensored L**ked],https://pic.javct.net/poster/20220707/1659400606.jpg,https://javct.net/v/juy-531-rm,119,2026-06-20
STARS-198-RM,Hikari Aozora I Visited My C**ldhood Friend For The First Time In years And Secretly Fucked Her 12 Times At Her Family Home And Made Memories That Would Last A Lifetime [Uncensored L**ked],https://pic.javct.net/poster/20221202/1648055601.jpg,https://javct.net/v/stars-198-rm,224,2026-06-20
ABF-350-RM,Takimoto Musou (Takimoto Shizukuha) [Uncensored L**ked],https://pic.javct.net/poster/04112026/1e704c71ae.jpg,https://javct.net/v/abf-350-rm,115,2026-06-20
ABF-349-RM,A Record Of Cohabitation And Unprotected Sex Between A Perverse Couple Dominated By Sexual Desire. Nonoura Dan [Uncensored L**ked],https://pic.javct.net/poster/04112026/67d9b8f61c.jpg,https://javct.net/v/abf-349-rm,110,2026-06-20
REBD-1044,Mituha2 Silent Evolution,https://pic.javct.net/poster/05192026/28427948ca.jpg,https://javct.net/v/rebd-1044,82,2026-06-20
REBD-1042,Yuuka2 Amber-Colored Longing - Yuuka Tada,https://pic.javct.net/poster/05192026/8998bb3310.jpg,https://javct.net/v/rebd-1042,85,2026-06-20
REBD-1045,Anzu (apricot Buds) - Kagawa Apricots,https://pic.javct.net/poster/05192026/c18dba406b.jpg,https://javct.net/v/rebd-1045,89,2026-06-20
ABF-348-RM,Ultimate Ecstasy: A New Realm Of Pleasure That Courses Through Every Nerve— Remu Suzumori [Uncensored L**ked],https://pic.javct.net/poster/04112026/582624978e.jpg,https://javct.net/v/abf-348-rm,120,2026-06-20
MILK-128-RM,"I Told This G-Cup Newlywed Lady Who Was About To Have Her Wedding That I Was Going To Give Her Some Special Treatment, And Instead Developed Her Sensual Abilities This Sensitive Big Tits Wife Was Lathered Up With Oil And Started To Feel Super Sensual, So I Plunged My Big Dick In Raw Totally Fucked, Cum Crazy Sex Mirai Sena [Uncensored L**ked]",https://pic.javct.net/poster/20212011/1638418771.jpg,https://javct.net/v/milk-128-rm,109,2026-06-20
JUY-325-RM,My Very Own Beast Momoko Isshiki [Uncensored L**ked],https://pic.javct.net/poster/20212011/1641350279.jpg,https://javct.net/v/juy-325-rm,115,2026-06-20
MIDE-845-RM,"An Erotic Awakening For An Abstinent 18 Year Old - Watch Her Cum, Scream, And Writhe As She's Teased And Brought To Multiple Orgasms Rikka Ono [Uncensored L**ked]",https://pic.javct.net/poster/20212709/1637388060.jpg,https://javct.net/v/mide-845-rm,119,2026-06-20
