code,title,image_url,page_url,views,date_scraped
FOCS-065-RM,AV Debut With G-Cup Big Tits. Beautiful Pale Skin And Beautiful Tits. Showing Her Inner Self Laid Completely Bare. Ruka Matsumoto [Uncensored L**ked],https://pic.javct.net/poster/20221202/1650012262.jpg,https://javct.net/v/focs-065-rm,124,2026-06-03
DFE-059-RM,A Middle-Aged Cherry Boy If I Could Be Reborn ... I Would Like To Be Born Again As A Cherry Boy. Chiharu Miyazawa [Uncensored L**ked],https://pic.javct.net/poster/20221202/1645866649.jpg,https://javct.net/v/dfe-059-rm,148,2026-06-03
SENN-006-RM,Nurse Kirishima Has Hard Sex With A Runaway Patient - Reona Kirishima [Uncensored L**ked],https://pic.javct.net/poster/20221202/1648380658.jpg,https://javct.net/v/senn-006-rm,47,2026-06-03
HODV-21595-RM,"The Stepbrother Of My Husband Licks Me Again And Again Until I Fall For Him, All While Hiding From My Husband. Kanna Hirai [Uncensored L**ked]",https://static.javct.net/poster/hodv-21595.jpg,https://javct.net/v/hodv-21595-rm,118,2026-06-03
ROYD-075-RM,Sex Life Together with Your Too Vulnerable Big-Titted Younger Stepsister in an Extremely Cramped Studio Apartment With No Place to Look Away. Mei Satsuki [Uncensored L**ked],https://pic.javct.net/poster/20212709/1637307416.jpg,https://javct.net/v/royd-075-rm,124,2026-06-03
FNS-223-RM,"Abstinence Release Document: 30 Days Of Sex And Masturbation Ban, And The Beast's Sexual Desire Is Completely Raised And Released In 120 Minutes Yayoi Hamabe [Uncensored L**ked]",https://pic.javct.net/poster/05192026/b64fcf5ff9.jpg,https://javct.net/v/fns-223-rm,145,2026-06-03
FNS-223,"Abstinence Release Document: 30 Days Of Sex And Masturbation Ban, And The Beast's Sexual Desire Is Completely Raised And Released In 120 Minutes Yayoi Hamabe",https://pic.javct.net/poster/05192026/b64fcf5ff9.jpg,https://javct.net/v/fns-223,145,2026-06-03
NSFS-007-SUB,Mature Stepmother 12  The Stepson Who Loved His Stepmother  Yuri Tadokoro [English Subtitle],https://static.javct.net/poster/nsfs-007.jpg,https://javct.net/v/nsfs-007-sub,116,2026-06-03
DFE-057-RM,I Am Eating Up This Young Girl. Rena Usami [Uncensored L**ked],https://pic.javct.net/poster/20212011/1640778896.jpg,https://javct.net/v/dfe-057-rm,123,2026-06-03
XVSR-621-RM,Ichika Matsumoto Binaural Sex Film! Ichika Matsumoto [Uncensored L**ked],https://pic.javct.net/poster/20212709/1635632986.jpg,https://javct.net/v/xvsr-621-rm,118,2026-06-03
GVG-801-RM,A Sexy Weather Girl Elder Sister And Her Bad Boys Mari Takasugi [Uncensored L**ked],https://pic.javct.net/poster/20212011/1643623764.jpg,https://javct.net/v/gvg-801-rm,136,2026-06-03
ROYD-074-RM,My Gentle and Cute C**ldhood Friend Spoils Me By Supporting With Depressed Me. Karen Asahina [Uncensored L**ked],https://pic.javct.net/poster/20212709/1637307475.jpg,https://javct.net/v/royd-074-rm,173,2026-06-03
FOCS-064-RM,"Extremely Slutty Drooling Woman!! Raunchy Sex With Deep Kissing And Nipple Licking, Yuuka Waraku [Uncensored L**ked]",https://pic.javct.net/poster/20221202/1650012332.jpg,https://javct.net/v/focs-064-rm,124,2026-06-03
DFE-058-RM,My Stepdaughter Provides For Me. Kurumi Iketani. [Uncensored L**ked],https://pic.javct.net/poster/20212011/1643450735.jpg,https://javct.net/v/dfe-058-rm,128,2026-06-03
VENU-169-RM,Fakecest with My Hot Ass Mother Miki Sato [Uncensored L**ked],https://pic.javct.net/poster/20220707/1657755619.jpg,https://javct.net/v/venu-169-rm,81,2026-06-03
HODV-21590-RM,[Full POV] Girls Speaking In Dialect: The Hiroshima Dialect - Ai Tsubakino [Uncensored L**ked],https://static.javct.net/poster/hodv-21590.jpg,https://javct.net/v/hodv-21590-rm,133,2026-06-03
URLH-016-RM,Super Tempted By Tits Fresh Face Sex Hostess Princess Rika Aimi [Uncensored L**ked],https://pic.javct.net/poster/20221108/1660691043.jpg,https://javct.net/v/urlh-016-rm,155,2026-06-03
TYSF-006-RM,"Mina Kitano (A Horny Slut) Is Conducting A Physical, Hands-On Sex Club Undercover Report She's Using Her Horny, Raw P*ssy And Letting It Run Wild For A Fucking Good Time (A Premeditated Crime) [Uncensored L**ked]",https://pic.javct.net/poster/20221202/1646375191.jpg,https://javct.net/v/tysf-006-rm,204,2026-06-03
DLDSS-503-RM,"Today Is My Rest Wife Day. ""Can Such An Old Woman In Her 40s Still Be Able To Appear In An AV?"" Real Married Woman Saki Ishida 46 Years Old AV Debut [Uncensored L**ked]",https://pic.javct.net/poster/05192026/1167a2e7a8.jpg,https://javct.net/v/dldss-503-rm,175,2026-06-03
DLDSS-503,"Today Is My Rest Wife Day. ""Can Such An Old Woman In Her 40s Still Be Able To Appear In An AV?"" Real Married Woman Saki Ishida 46 Years Old AV Debut",https://pic.javct.net/poster/05192026/1167a2e7a8.jpg,https://javct.net/v/dldss-503,175,2026-06-03
FMDL-009-RM,Super wide open legs oops! Jupojubo PtoM Sesame Ko Blow Ichika Matsumoto [Uncensored L**ked],https://pic.javct.net/poster/12082025/1767514045.jpg,https://javct.net/v/fmdl-009-rm,120,2026-06-03
FOCS-061-RM,"Short Stature 146cm For An AV Debut. That's The Height Minimum, But She Aspires To Do An AV While Her Sex Drive Is Surging. Tsukushi Yuzuki [Uncensored L**ked]",https://pic.javct.net/poster/20221202/1650012539.jpg,https://javct.net/v/focs-061-rm,124,2026-06-03
ROYD-071-RM,"My Step-sister Is Modest And Reserved, But When She Takes Her Glasses Off She's An Irresistible Beauty, Leading To Raw Fucking And A First-ever Creampie Between Her Thighs. Alice Nanase [Uncensored L**ked]",https://pic.javct.net/poster/20212709/1634886758.jpg,https://javct.net/v/royd-071-rm,161,2026-06-03
VENX-047-RM,"Stepmom Tempts Her Stepson Whith Whispers, So His Father Does Not Notice - Chitose Yuki [Uncensored L**ked]",https://static.javct.net/poster/1623493447.jpg,https://javct.net/v/venx-047-rm,116,2026-06-03
