code,title,image_url,page_url,views,date_scraped
JIMMY-001,"Mom, Come Home Early... My Trousers Seem Strange... Sakuragi Nagisa",https://pic.javct.net/poster/05192026/e5383e5fb5.jpg,https://javct.net/v/jimmy-001,120,2026-06-10
FNS-215,"Even When She Goes Limp, She Continues To Be Made To Cum Over And Over Again By The Relentless Pursuit Piston. Yui Amanatsu Has Sex In A Closed Room Hotel.",https://pic.javct.net/poster/05192026/de8272f1cf.jpg,https://javct.net/v/fns-215,140,2026-06-10
MYBA-039-RM,Married Woman Petal Turning Aizuki Celia [Uncensored L**ked],https://pic.javct.net/poster/20212709/1635449620.jpg,https://javct.net/v/myba-039-rm,146,2026-06-10
SDAB-138-RM,Thick Kissing SEx With A Middle Aged Man In The Middle Of Summer. Elena Takeda [Uncensored L**ked],https://pic.javct.net/poster/20221202/1645232717.jpg,https://javct.net/v/sdab-138-rm,136,2026-06-10
STARS-405-RM,Cum In 15 Seconds! Quickie Sex 3: Hibiki Natsume [Uncensored L**ked],https://static.javct.net/poster/1625550182.jpg,https://javct.net/v/stars-405-rm,140,2026-06-10
SDDE-450-RM,"Cooking, Cleaning, And Satisfying The Sexual Urges Of 10 Boys In A Non-Stop Sex Life Cum Crazy Boys And A Gal Mama AIKA [Uncensored L**ked]",https://pic.javct.net/poster/20212011/1641530758.jpg,https://javct.net/v/sdde-450-rm,128,2026-06-10
ROYD-084-RM,"I've Got A Pregnancy Fetish For Her, And I Swear I'm Going To Impregnate Her! I Always Loved My Big Stepsister, But Now She's Getting Married, So For The Next 72 Hours, I'm Going To Fuck Her Until She Gets Pregnant With My C**ld, And I Pumped Her With Every Last Drop Of My Semen! Misuzu Mifune [Uncensored L**ked]",https://pic.javct.net/poster/20221202/1645163644.jpg,https://javct.net/v/royd-084-rm,135,2026-06-10
JUY-762-RM,"My Husband Doesn't Know My Dirty Secrets And Desires, Sana Matsunaga [Uncensored L**ked]",https://pic.javct.net/poster/20212011/1640153272.jpg,https://javct.net/v/juy-762-rm,118,2026-06-10
SDAB-132-RM,She's Got Such Huge Tits And She's So Cute... But... A Miraculous I-Cup Colossal Tits Virgin!! Hana Himesaki An SOD Exclusive Adult Video Debut [Uncensored L**ked],https://pic.javct.net/poster/20220707/1660096067.jpg,https://javct.net/v/sdab-132-rm,181,2026-06-10
EBOD-459-RM,Bus Tour With A Bare-Naked Busty Guide Ami Tokunaga [Uncensored L**ked],https://pic.javct.net/poster/20221904/1651711385.jpg,https://javct.net/v/ebod-459-rm,119,2026-06-10
T28-407-RM,Sexual Release - Hot Sex Begging For Hot Smothering Kisses - Azumi Chino [Uncensored L**ked],https://pic.javct.net/poster/20220406/1657157637.jpg,https://javct.net/v/t28-407-rm,178,2026-06-10
KSBJ-033-RM,The Naked Wife ERIKA [Uncensored L**ked],https://pic.javct.net/poster/20220707/1657526582.jpg,https://javct.net/v/ksbj-033-rm,127,2026-06-10
MYBA-038-RM,A Married Woman's Blooming - Ai Hiraoka [Uncensored L**ked],https://pic.javct.net/poster/20212308/1631970954.jpg,https://javct.net/v/myba-038-rm,148,2026-06-10
JUY-887-RM,"The Weekend I Lied About Leaving On A Business Trip, My Wife Fucked The Shit Out Of This Guy She's Been Cheating With. I Had Pretended To Leave On Business, But Stayed Hidden In The House The Whole Time And Saw Everything... Eriko Miura [Uncensored L**ked]",https://pic.javct.net/poster/20212011/1637641687.jpg,https://javct.net/v/juy-887-rm,118,2026-06-10
FSDSS-999-SUB,I Couldn't Be Satisfied With My Boyfriend...I Ended Up Getting Hooked On The Old Man's Big Dick Swamp At My Parents' House When I Went Home.Yamashita Sawa. [English Subtitle],https://pic.javct.net/poster/20253001/1741287109.jpg,https://javct.net/v/fsdss-999-sub,120,2026-06-10
NTR-065-RM,My Wife Was Being Fo**ed By The Boy Next Door To Suck His Cock Every Day Momoka Ogawa [Uncensored L**ked],https://pic.javct.net/poster/20220406/1656987633.jpg,https://javct.net/v/ntr-065-rm,120,2026-06-10
IESP-458-RM,Gloomy Apartment Wife [Uncensored L**ked],https://pic.javct.net/poster/20221904/1653305027.jpg,https://javct.net/v/iesp-458-rm,118,2026-06-10
MOPE-017,Hamasaki Mao ~ Woman For M ~ 4 Hours BEST,https://pic.javct.net/poster/05192026/a08b80cafe.jpg,https://javct.net/v/mope-017,247,2026-06-10
XVSR-304,Yui Hiratsuka 4 Hours Cum Shot Cum On Her Daughter Who I Loved,https://pic.javct.net/poster/05192026/16c29b277a.jpg,https://javct.net/v/xvsr-304,240,2026-06-10
ABF-346-RM,"I Was Seduced By My Sister-in-law, Whom I Secretly Admired, And My Emotions Exploded, Causing Me To Ejaculate Inside Her Multiple Times... Airi Suzumura [Uncensored L**ked]",https://pic.javct.net/poster/04112026/352a52bc0c.jpg,https://javct.net/v/abf-346-rm,135,2026-06-10
ABF-347-RM,The Doctor Who Verbally A**ses Men In Her Examination Room - Alice Shaku [Uncensored L**ked],https://pic.javct.net/poster/04112026/1d86776ebf.jpg,https://javct.net/v/abf-347-rm,120,2026-06-10
POMD-006-RM,"[Amateur POV] While staring at each other for a long time, I'm going to have a good time SEX. Yukari's [Uncensored L**ked]",https://pic.javct.net/poster/05192026/69b1445046.jpg,https://javct.net/v/pomd-006-rm,72,2026-06-10
MYBA-035-RM,The Blooming Of A Wife - Nanami Mineda [Uncensored L**ked],https://static.javct.net/poster/myba-035.jpg,https://javct.net/v/myba-035-rm,97,2026-06-10
VENU-880-RM,The Bride's Mother I Creampie Fucked My Wife's Mother Toka Rinne [Uncensored L**ked],https://pic.javct.net/poster/20221904/1653969584.jpg,https://javct.net/v/venu-880-rm,103,2026-06-10
