code,title,image_url,page_url,views,date_scraped
FTHTD-222,"""Oh No, It's My Fault? My Aunt Is In Trouble."" I Was Getting A Massage At The Home Beauty Salon Run By My Aunt, Who Is A Former Slut With Big Boobs, And My Crotch Reacted In Full Force. A Dick Writhing In Agony With Long Hair Entangled In Bare Legs. I Want You To Insert It Quickly, But Even If You Are So Impatient... Mayu Suzuki",https://pic.javct.net/poster/07052026/4ecfb49e6a.jpg,https://javct.net/v/fthtd-222,124,2026-07-12
FTHTD-206,"[Live-action Adaptation] Onii-san, Would You Like To Have Tea With Us? Starring Yui Tenma/Rika Tsubaki Original Work Fumiki Morizuki",https://pic.javct.net/poster/07052026/70c8780388.jpg,https://javct.net/v/fthtd-206,105,2026-07-12
FTHTD-215,I Stopped Time To Suck My Favorite Dick.,https://pic.javct.net/poster/07052026/3efbbf0b6e.jpg,https://javct.net/v/fthtd-215,122,2026-07-12
CR-071226-001,"Shared Lovers: Him, Me, and His Friend",https://pic.javct.net/poster/07052026/a9fab57d2f.jpg,https://javct.net/v/cr-071226-001,57,2026-07-12
IMO-019-RM,"While I Was Masturbating In The Bathroom, My Sister Who Was Completely Naked Broke In! ? Forbidden Domestic Brother And Sister Creampie Incest (2) [Uncensored L**ked]",https://pic.javct.net/poster/20233001/1675566357.jpg,https://javct.net/v/imo-019-rm,111,2026-07-12
FNS-235-RM,"When I Woke Up In The Morning, I Saw A Completely Naked Beautiful Woman...I Couldn't Resist And Immediately Inserted My Dick In The Morning! They Were A Perfect Match And We Fucked All Day Long... Tsubasa Mai [Uncensored L**ked]",https://pic.javct.net/poster/07052026/674c968d7b.jpg,https://javct.net/v/fns-235-rm,120,2026-07-12
PGD-688-RM,"Handjobs, Dirty Slut Teacher Reiko Sawamura [Uncensored L**ked]",https://pic.javct.net/poster/20222410/1667318230.jpg,https://javct.net/v/pgd-688-rm,150,2026-07-12
SKMJ-765-RM,"A Cute Nurse Who's Like An Angel In A White Coat! ""Could You Help This Virgin Guy Who's Suffering From Premature Ejaculation Improve His Condition?"" This Nurse, Who Seems Experienced With Male Organs But Is Surprisingly Innocent, Gets Turned On By The Virgin Guy Who Ejaculates Too Quickly And Gives Him A Raw, Unprotected First-time Sex Experience! [Uncensored L**ked]",https://pic.javct.net/poster/07052026/ed578ea470.jpg,https://javct.net/v/skmj-765-rm,224,2026-07-12
TARD-001-RM,I'll Let You Fuck My Mom So Let Me Fuck Yours. Sayuri Takizawa Yoshie Fujisawa [Uncensored L**ked],https://pic.javct.net/poster/20221202/1645004258.jpg,https://javct.net/v/tard-001-rm,114,2026-07-12
FNS-235,"When I Woke Up In The Morning, I Saw A Completely Naked Beautiful Woman...I Couldn't Resist And Immediately Inserted My Dick In The Morning! They Were A Perfect Match And We Fucked All Day Long... Tsubasa Mai",https://pic.javct.net/poster/07052026/674c968d7b.jpg,https://javct.net/v/fns-235,120,2026-07-12
DSKM-087-RM,What Happens To Show Your Erection ○ Port Switch To Married Woman Of Frustration! ? 6. [Uncensored L**ked],https://pic.javct.net/poster/20230804/1691390953.jpg,https://javct.net/v/dskm-087-rm,165,2026-07-12
1P-071126-001,Graduation gift from my mother-in-law,https://pic.javct.net/poster/07052026/8835483e82.jpg,https://javct.net/v/1p-071126-001,61,2026-07-12
HZ-3889,Would You Like To Sex With My Wife? - Nami Sawaguchi,https://pic.javct.net/poster/07052026/3e44fdb115.jpg,https://javct.net/v/hz-3889,58,2026-07-12
AKDL-138,"Behind-the-scenes op-ed: At a men's beauty salon, I was given a very gentle slow handjob and a slow cowgirl position, and was healed many times.",https://pic.javct.net/poster/07052026/b3a4563351.jpg,https://javct.net/v/akdl-138,123,2026-07-12
ONED-747-RM,Barely Screaming! Yuma Asami Big Magnum FUCK [Uncensored L**ked],https://pic.javct.net/poster/07052026/1651f10b73.jpg,https://javct.net/v/oned-747-rm,120,2026-07-12
TYSF-038-RM,"When I Asked For A Family Agency Service, A Exciting Rental Sister Came In An Erotic Dress! Sarina Momonaga [Uncensored L**ked]",https://pic.javct.net/poster/20230302/1678423848.jpg,https://javct.net/v/tysf-038-rm,140,2026-07-12
MDBK-422,"Even After Ejaculation, It Never Stops. Endless Simultaneous Nipple And Penis Stimulation. Unlimited Continuous Ejaculation. Nipple Stimulation Specialist Escort Service. Cowgirl Position With Internal Ejaculation Option Available.",https://pic.javct.net/poster/07052026/80075fa28c.jpg,https://javct.net/v/mdbk-422,145,2026-07-12
MOPG-040,Men's Nipple Clitorisization Plan Shirasaki Yuzu,https://pic.javct.net/poster/07052026/26c5225336.jpg,https://javct.net/v/mopg-040,119,2026-07-12
VENU-093-RM,Fakecest Horny Stepmom Masturbates With Stepson's Pants Miku Hasegawa [Uncensored L**ked],https://pic.javct.net/poster/20220406/1656590101.jpg,https://javct.net/v/venu-093-rm,85,2026-07-12
HZ-3888,Bonus Special Vol.13 - Mirai Minano - Nako Nagase - Nozomi Maruyama,https://pic.javct.net/poster/07052026/6db4435697.jpg,https://javct.net/v/hz-3888,55,2026-07-12
CR-071026-001,"One more time, One more fuck: Begged one more fuck with Saki Konno who can do easily even immediately after shooting",https://pic.javct.net/poster/07052026/a984add53c.jpg,https://javct.net/v/cr-071026-001,27,2026-07-12
VEMA-025-RM,Nagisa Weathervane Ready Reception Of Carnal Life Insurance [Uncensored L**ked],https://pic.javct.net/poster/20230104/1682031335.jpg,https://javct.net/v/vema-025-rm,85,2026-07-12
SKMJ-765,"A Cute Nurse Who's Like An Angel In A White Coat! ""Could You Help This Virgin Guy Who's Suffering From Premature Ejaculation Improve His Condition?"" This Nurse, Who Seems Experienced With Male Organs But Is Surprisingly Innocent, Gets Turned On By The Virgin Guy Who Ejaculates Too Quickly And Gives Him A Raw, Unprotected First-time Sex Experience!",https://pic.javct.net/poster/07052026/ed578ea470.jpg,https://javct.net/v/skmj-765,224,2026-07-12
SNOS-303-RM,My Former Student Is Head Over Heels For Me!? She Barged Into My Home And Almost Got Caught By My Wife For A Super-immoral Nipple Licking And Handjob! Kawagoe Nico [Uncensored L**ked],https://pic.javct.net/poster/07052026/dafea2dcc7.jpg,https://javct.net/v/snos-303-rm,120,2026-07-12
