code,title,image_url,page_url,views,date_scraped
TLDC-056-RM,"Hell Is Like Heaven: ""I'll Do My Best Today As A Dick.'' [Uncensored L**ked]",https://pic.javct.net/poster/05192026/88fb5cb001.jpg,https://javct.net/v/tldc-056-rm,68,2026-06-23
REAL-668,Slutty King's Frenzy Man Squirting & Dry Orgasm Culmination Full Course Haruna Hanana,https://pic.javct.net/poster/05192026/7cac004fa0.jpg,https://javct.net/v/real-668,120,2026-06-23
NOSKN-102-RM,[ALL Unedited] NO Cut! NO SKIN! Nakadashi! Completely Uncut Video Of Real Creampie Sumire Aisaka [Uncensored L**ked],https://pic.javct.net/poster/05192026/2ff0e55ae1.jpg,https://javct.net/v/noskn-102-rm,0,2026-06-23
HKW-009-RM,I'll Lend You The Key To The Room Where M-kun Is Waiting. () [Uncensored L**ked],https://pic.javct.net/poster/20230205/1685071960.jpg,https://javct.net/v/hkw-009-rm,126,2026-06-23
SGKI-097,"With Her Juices Dripping, Her Body Flushed And Sweating Profusely, And Her Body Squirting Profusely, She Secretly Orgasms Repeatedly During The Company Presentation Without The Job Seekers Noticing! A Company Presentation Of Ultimate Ecstasy.",https://pic.javct.net/poster/05192026/7df09f9d5c.jpg,https://javct.net/v/sgki-097,160,2026-06-23
FNS-221,"Why Don't You Just Try It Out? Lol My C**ldhood Friend, A Gal Sister, Got Addicted To My Big Dick And Kept Shaking Her Hips For 3 Days RARA",https://pic.javct.net/poster/05192026/730ff746b4.jpg,https://javct.net/v/fns-221,120,2026-06-23
CJOD-523,Rejuvenating Asian men's beauty salon where a naughty older sister comes as a slut and allows creampie Airi Ichise,https://pic.javct.net/poster/05192026/f42b7cb5eb.jpg,https://javct.net/v/cjod-523,150,2026-06-23
SGKI-097-RM,"With Her Juices Dripping, Her Body Flushed And Sweating Profusely, And Her Body Squirting Profusely, She Secretly Orgasms Repeatedly During The Company Presentation Without The Job Seekers Noticing! A Company Presentation Of Ultimate Ecstasy. [Uncensored L**ked]",https://pic.javct.net/poster/05192026/7df09f9d5c.jpg,https://javct.net/v/sgki-097-rm,160,2026-06-23
FC2PPV-4923958,Few people with experience\! No creampie! Let a naive and serious D cup office lady attack your cock and finally screw the cock into her pure pussy.,https://pic.javct.net/poster/05192026/b672e9724f.jpg,https://javct.net/v/fc2ppv-4923958,60,2026-06-23
TLDC-056,"Hell Is Like Heaven: ""I'll Do My Best Today As A Dick.''",https://pic.javct.net/poster/05192026/88fb5cb001.jpg,https://javct.net/v/tldc-056,68,2026-06-23
NOSKN-102,[ALL Unedited] NO Cut! NO SKIN! Nakadashi! Completely Uncut Video Of Real Creampie Sumire Aisaka,https://pic.javct.net/poster/05192026/2ff0e55ae1.jpg,https://javct.net/v/noskn-102,0,2026-06-23
MOPG-022,Amatoshiro M Temptation Slut Temptation Orgasm For The First Time Public!Shoot Down Video Recording Special Edition Imai Yu,https://pic.javct.net/poster/05192026/80f77914c4.jpg,https://javct.net/v/mopg-022,98,2026-06-23
BBTU-083-RM,My Dick Was Confined By A Big-breasted Gal. Kokoro Ayase [Uncensored L**ked],https://pic.javct.net/poster/20240807/1720839311.jpg,https://javct.net/v/bbtu-083-rm,110,2026-06-23
FC2PPV-4924344,"0419_001 Maya-chan, 18 years old, is a former idol with a fair skin and F cup who is attracting a lot of attention in 2026. She impregnates herself and appears in a sex video with an old man, but since it was incomplete, she is sold in bulk at a low price (explosive)",https://pic.javct.net/poster/05192026/2286c339da.jpg,https://javct.net/v/fc2ppv-4924344,102,2026-06-23
EMSK-011-RM,ASMR Men's Esthetics June Lovejoy That Makes You Melt From Your Ears With Juru Necho Sounds And Whispering Dirty Talk [Uncensored L**ked],https://pic.javct.net/poster/20230205/1685072020.jpg,https://javct.net/v/emsk-011-rm,128,2026-06-23
WANZ-217-RM,The SEX Pie ★ Medium If You Can Put Up With Terrible Tech Sakurai Ayu! [Uncensored L**ked],https://pic.javct.net/poster/20230205/1684205877.jpg,https://javct.net/v/wanz-217-rm,180,2026-06-23
WANZ-228-RM,Membership Soap Blue Shadow Natsume [Uncensored L**ked],https://pic.javct.net/poster/05192026/55e9c07f88.jpg,https://javct.net/v/wanz-228-rm,100,2026-06-23
PYM-567,"My Convenient Personal Pacifier Pet, Girls With Vulgar Blowjob Faces Who Serve With Their Mouths, 11 Girls In Newly Filmed Footage, Rapid-fire Blowjobs! Bonus Footage Included! A Total Of 41 Girls",https://pic.javct.net/poster/05192026/2d5613809b.jpg,https://javct.net/v/pym-567,300,2026-06-23
WZEN-101,"Rubber Glove Encyclopedia 09: Fellatio, Handjob, 12 Amateur Girls",https://pic.javct.net/poster/05192026/6c54cba19a.jpg,https://javct.net/v/wzen-101,181,2026-06-23
DAZD-296,Forbidden Close-contact Cock Stroking! Best Penis Rubbing Helmet-to-helmet,https://pic.javct.net/poster/05192026/97cb25bb05.jpg,https://javct.net/v/dazd-296,120,2026-06-23
MOPE-036,2021 M Man Paradise BEST 10,https://pic.javct.net/poster/05192026/b37548814e.jpg,https://javct.net/v/mope-036,156,2026-06-23
MOPE-035,2020 M Man Paradise BEST10,https://pic.javct.net/poster/05192026/a7c2d2053f.jpg,https://javct.net/v/mope-035,155,2026-06-23
VRTM-327-RM,"When I Called A Housekeeper Over To My Bachelor Pad She Turned Out To Be Totally Stacked! Her Big Tits Gave Me Wood, And She Felt So Bad For Me She Gave Me A Handjob! Only My Huge Dick Turned Her On So Much She Couldn't Stop There - She Had To Ride It Cowgirl Style! Grinding Away And Begging For My Creampie! 2 [Uncensored L**ked]",https://pic.javct.net/poster/20221108/1663504006.jpg,https://javct.net/v/vrtm-327-rm,220,2026-06-23
HZ-3873,Having Lovely Time With A Big Tits Amature Gril Vol.17 - Miku Kamiya,https://pic.javct.net/poster/05192026/43fad11cee.jpg,https://javct.net/v/hz-3873,54,2026-06-23
