code,title,image_url,page_url,views,date_scraped
CR-070726-001,"The Ecstasy: A passionate, intense kissing and sex session between adults",https://pic.javct.net/poster/07052026/b4c72bf5b3.jpg,https://javct.net/v/cr-070726-001,58,2026-07-07
FNS-231,"The 30 Minutes I Was In The Bath Was The Time I Had To Endure It.While I Was Taking A Bath, My Growing Body Was Defiled By My Pervert Stepfather. Beach Yayoi",https://pic.javct.net/poster/07052026/742f0cf9dc.jpg,https://javct.net/v/fns-231,120,2026-07-07
BAGR-014-RM,My Cohabiting Girlfriend Is A Kin Mastoker Who Always Tampering With My Balls Asuka Momose [Uncensored L**ked],https://pic.javct.net/poster/20230302/1678509473.jpg,https://javct.net/v/bagr-014-rm,124,2026-07-07
REAL-629-RM,Fast Pleasure Handjob Dirty Blame M Man K**ling Of The Strongest Slut Technician M Erogenous Nishinippori Bizarre Clinic Active Enrolled Miss Matsushima Nami [Uncensored L**ked],https://pic.javct.net/poster/05192026/1fd18bbee9.jpg,https://javct.net/v/real-629-rm,125,2026-07-07
STARS-074-RM,Iku Estrus Rikejo (science-based Women) Deca Ass Pressed Oppression Face Riding Masami Ichikawa [Uncensored L**ked],https://pic.javct.net/poster/20243105/1719749267.jpg,https://javct.net/v/stars-074-rm,115,2026-07-07
MIDE-655,"Actual Temptation: Sensitive Pinsaro Girl Who Gets Wet from Blowjob, Minami Hatsukawa",https://pic.javct.net/poster/07052026/b0b42781db.jpg,https://javct.net/v/mide-655,120,2026-07-07
UMD-797-RM,"I Was Getting A Lymph Node Massage And It Felt So Good I Could No Longer Resist, So I Started To Toy With This Pretty Elder Stepsisters Body Until She Started To Get Hot And Horny, And I Decided To Go For Broke And Ask Her For A Fuck, And She Let Me!! 3 [Uncensored L**ked]",https://pic.javct.net/poster/20212709/1634533906.jpg,https://javct.net/v/umd-797-rm,122,2026-07-07
DLDSS-507-RM,Electric Revival Nozomi Tanihara Serious About Mature Women. Charisma Descends Into The New DAHLIA. [Uncensored L**ked],https://pic.javct.net/poster/07052026/3d56679773.jpg,https://javct.net/v/dldss-507-rm,180,2026-07-07
SONE-674-SUB,A One-on-one Private Sex Lesson With An Erotic Tutor Who Will Teach You Everything From Deep Kissing To Tongue Licking To The Best Pistons. Alice Hana [English Subtitle],https://pic.javct.net/poster/20250903/1743704397.jpg,https://javct.net/v/sone-674-sub,120,2026-07-07
FNS-232-RM,"What Was Hidden Under The Sweatshirt Was Fair-skinned And Beautiful Big Breasts.The More You Massaged Her, The More Lewd She Became, Having Sex With Her For The First Time During A Sleepover Mia Kamiki [Uncensored L**ked]",https://pic.javct.net/poster/07052026/3d5e9509d1.jpg,https://javct.net/v/fns-232-rm,115,2026-07-07
FC2PPV-4933454,"0280_030 Mizuki-chan, 22 years old, is a sad gravure idol who was impregnated in an AV shoot and became an unrecognized twin ma.ma. Take a look at the No. 1 breasts of all time that spill out from her K cup huge breasts (explosion)",https://pic.javct.net/poster/07052026/e38f14c0f9.jpg,https://javct.net/v/fc2ppv-4933454,107,2026-07-07
FC2PPV-4930662,A SSS class Edokko beauty (22) who grew up in a downtown area and a messy raw copulation in a moe yukata ⇒ Continuous creampie in her pink pussy,https://pic.javct.net/poster/07052026/1edcf2c3af.jpg,https://javct.net/v/fc2ppv-4930662,55,2026-07-07
MXGS-051-RM,Sexy Pet Acky! Akiho Yoshizawa [Uncensored L**ked],https://pic.javct.net/poster/07052026/592cdf32de.jpg,https://javct.net/v/mxgs-051-rm,135,2026-07-07
VRNC-090-RM,Orgy Sex With Beautiful Women Wearing Cute Red And White Santa Costumes! The Men Were Stunned By The Outstanding Proportions And Became Fully Erect! It Turned Into A Christmas Night That Could Truly Be Called A Night Of Sex! [Kotone/Maina/Emi/Nanami] Ver Emi & Nanami [Uncensored L**ked],https://pic.javct.net/poster/07052026/7da7f297e0.jpg,https://javct.net/v/vrnc-090-rm,82,2026-07-07
NACT-152-RM,"Top-notch Techniques To Soothe The Soul And Extract Every Last Drop Of Semen! Super Popular Rejuvenation Men's Esthetician, Reiko Kobayakawa [Uncensored L**ked]",https://pic.javct.net/poster/07052026/ebd6125568.jpg,https://javct.net/v/nact-152-rm,113,2026-07-07
DLDSS-507,Electric Revival Nozomi Tanihara Serious About Mature Women. Charisma Descends Into The New DAHLIA.,https://pic.javct.net/poster/07052026/3d56679773.jpg,https://javct.net/v/dldss-507,180,2026-07-07
FC2PPV-2409152,"[Celebrity Mature Woman / Lewd Woman] **pyjpx*jsps Instinctively exposed sex while wearing body stockings! Cock, mmmmmmmmmmm... withdrawal symptoms from sucking it all the time! I poured a lot of semen on her clitoris and vagina hole!!",https://pic.javct.net/poster/07052026/354ed78df3.jpg,https://javct.net/v/fc2ppv-2409152,09,2026-07-07
VRNC-090,Orgy Sex With Beautiful Women Wearing Cute Red And White Santa Costumes! The Men Were Stunned By The Outstanding Proportions And Became Fully Erect! It Turned Into A Christmas Night That Could Truly Be Called A Night Of Sex! [Kotone/Maina/Emi/Nanami] Ver Emi & Nanami,https://pic.javct.net/poster/07052026/7da7f297e0.jpg,https://javct.net/v/vrnc-090,82,2026-07-07
STCVS-048,[Overwhelming Presence Of A Man] (1) Playing Pranks On The Ace Candidate In The Toilet! (2) Playing A Prank In Front Of My Boyfriend During Lunch Time! (3) Prank A New Graduate Working Overtime At Her Desk! [Delusion Erotic Man #Tsukino-san & Wakatsuki-san & Miyamoto-san],https://pic.javct.net/poster/07052026/bc5815aa6d.jpg,https://javct.net/v/stcvs-048,122,2026-07-07
VRNC-092,Tsurupeta,https://pic.javct.net/poster/07052026/0eca4c6436.jpg,https://javct.net/v/vrnc-092,69,2026-07-07
CR-070526-001,The senpai who shoves her tongue in and sucks every last bit out during a hardcore anal-licking session.,https://pic.javct.net/poster/07052026/05f2a7ad78.jpg,https://javct.net/v/cr-070526-001,58,2026-07-07
MOPG-035,The Best M Sexual Sensation That The Brain Is Fucked And Brains Get Fucked Up TRY Hirasaki Yuzu,https://pic.javct.net/poster/07052026/6970ae973d.jpg,https://javct.net/v/mopg-035,115,2026-07-07
DORI-084-RM,"Paco Shooting No.84 I Retired From Club Activities And My Sexual Desire Became Dangerous And I Begged ""I Want You To Make Me Namanaka"". When I Said That, I Said, ""Good "", So I Cummed In A Row! [Uncensored L**ked]",https://pic.javct.net/poster/20230302/1678591763.jpg,https://javct.net/v/dori-084-rm,71,2026-07-07
MXSPS-267-RM,180 Minutes After Death Comes Like Akiho Is Crazy Enough To Stand The Smoke Point Of The Switch ● Me. Akiho Yoshizawa [Uncensored L**ked],https://pic.javct.net/poster/07052026/879730684a.jpg,https://javct.net/v/mxsps-267-rm,180,2026-07-07
