code,title,image_url,page_url,views,date_scraped
MOPP-086-RM,"Sakura Misaki, An Anal Pleasure Specialist Who Traps M Men And Can't Get Out [Uncensored L**ked]",https://pic.javct.net/poster/20243105/1717209697.jpg,https://javct.net/v/mopp-086-rm,119,2026-07-04
WAAA-663-RM,"Super Technique Double Slut Reboot! Triple Super Pleasure Attack On Men's Pleasure Spots: Nipples, Glans, And Anus! Cumshot Brothel Deluxe Hibiki Otsuki, Claire Hasumi [Uncensored L**ked]",https://pic.javct.net/poster/05192026/f26613db4f.jpg,https://javct.net/v/waaa-663-rm,150,2026-07-04
MIDA-691-RM,Ejaculation (Death) Kiss Esthetics ~ An Irresistible Kissing Temptation. A Tongue-kissing Massage Parlor That Will Drive You Crazy With Explosive Ejaculations ~ Nana Yagi [Uncensored L**ked],https://pic.javct.net/poster/05192026/286942ec50.jpg,https://javct.net/v/mida-691-rm,180,2026-07-04
DORI-083-RM,"Paco Shooting No.83 After Getting A Creampie, She's A Slender, Gentle J Who Has Been Eating Pleasantly Ever After She Wriggles Her Waist And Says, ""Put Out Old Man's Sperm!"" [Uncensored L**ked]",https://pic.javct.net/poster/20230302/1678591825.jpg,https://javct.net/v/dori-083-rm,73,2026-07-04
MIKR-106-RM,"""I'll Give You The Best Handjob Of Your Life!"" A Cock-job Nurse Whose Right Hand Can't Stop When She Sees An Erect Cock Gently, Intensely, Licks, Vacuums, Licks Nipples, And Makes The Glans Explode! Goddess Handjob Clinic Sasaki Aki [Uncensored L**ked]",https://pic.javct.net/poster/05192026/c4a951c1bd.jpg,https://javct.net/v/mikr-106-rm,150,2026-07-04
FNS-214-RM,"""Huh...Sana-chan!?'' I Mistakenly Kissed My Girlfriend's Younger Sister Deeply. I Had Sex With My Girlfriend's Younger Sister, Who Was Blushing From Our First Kiss And Had Our Tongues Intertwined With Each Other... Sana Ikuta [Uncensored L**ked]",https://pic.javct.net/poster/05192026/6ef47f5573.jpg,https://javct.net/v/fns-214-rm,120,2026-07-04
SOE-201-RM,Risa Kasumi Nomination NO.1 Bakobako Risky Mosaic Customs × NO.1STYLE × 4 Hours [Uncensored L**ked],https://pic.javct.net/poster/05192026/0c0dfd36ab.jpg,https://javct.net/v/soe-201-rm,240,2026-07-04
DLDSS-509,An Outlet For A Lonely Man's Desires... A Married Woman In A Back Alley Chinese Dress Bar. Two Years Have Passed Since The Shocking Comeback. Beauty Shines Even More. Naho Ozawa,https://pic.javct.net/poster/05192026/b6f85adf0f.jpg,https://javct.net/v/dldss-509,125,2026-07-04
MOPG-033,Onna Who Is Crazy With Pleasure For A Man Who Is Being Arrested And Being Fucked.vol.3 First Public Release!Shoot Down Video Recording Special Edition Yuushi Mimai,https://pic.javct.net/poster/05192026/7eef60a66f.jpg,https://javct.net/v/mopg-033,133,2026-07-04
HZ-3900,Hina Sakurai's Pussy Squirt Show - Hina Sakurai,https://pic.javct.net/poster/05192026/806ce48eac.jpg,https://javct.net/v/hz-3900,18,2026-07-04
MXGS-200-RM,"Gila Body Take Libido, Undulate. Akiho Yoshizawa [Uncensored L**ked]",https://pic.javct.net/poster/05192026/7adcaba3eb.jpg,https://javct.net/v/mxgs-200-rm,120,2026-07-04
CSPL-014-RM,[4K] 4K Revolution Dere Cute But... Can't Stop Kozue Fujita [Uncensored L**ked],https://pic.javct.net/poster/20230302/1679199324.jpg,https://javct.net/v/cspl-014-rm,89,2026-07-04
DLDSS-508-RM,"The Best First Co-star ""I'm Assigned To DOTCH? ” Naho Ozawa 2nd Anniversary X DAHLIA Renewal Commemoration Naho Ozawa/Suzume Mino, The Strongest Double Female Boss In History Who Competes For Young New Employees [Uncensored L**ked]",https://pic.javct.net/poster/05192026/d8998c0eb2.jpg,https://javct.net/v/dldss-508-rm,180,2026-07-04
FNS-214,"""Huh...Sana-chan!?'' I Mistakenly Kissed My Girlfriend's Younger Sister Deeply. I Had Sex With My Girlfriend's Younger Sister, Who Was Blushing From Our First Kiss And Had Our Tongues Intertwined With Each Other... Sana Ikuta",https://pic.javct.net/poster/05192026/6ef47f5573.jpg,https://javct.net/v/fns-214,120,2026-07-04
WAAA-668,"If You Can Withstand Her Amazing Technique, You Can Have Raw Creampie Sex! - Takeuchi Yuuki",https://pic.javct.net/poster/05192026/34d5a72732.jpg,https://javct.net/v/waaa-668,180,2026-07-04
SKMJ-416-RM,"Almost Zero To**ure Experience // A Super Naive Amateur Girl Is Alone With A M Man Ww ""Hey, Don't Put Out Sperm /// But Don't Put It Out On Your Own~"" ! ? Nipple Licking Handjobs, Face Sitting, Footjobs, Cursing To Stop Small Devils // Endless Erotic Waist Swinging In Pile Driving Cowgirl Straddling M Chin That Explodes... [Uncensored L**ked]",https://pic.javct.net/poster/20230804/1691750299.jpg,https://javct.net/v/skmj-416-rm,257,2026-07-04
WAAA-663,"Super Technique Double Slut Reboot! Triple Super Pleasure Attack On Men's Pleasure Spots: Nipples, Glans, And Anus! Cumshot Brothel Deluxe Hibiki Otsuki, Claire Hasumi",https://pic.javct.net/poster/05192026/f26613db4f.jpg,https://javct.net/v/waaa-663,150,2026-07-04
WAAA-641,The Beautiful Wife Next Door Makes Slurping And Sloppy Sounds And Whispers Dirty Talk That Will Give You A Full Erection Through Your Ears - Adultery Masturbation Support ASMR Misaki Kanna,https://pic.javct.net/poster/05192026/f9929ba792.jpg,https://javct.net/v/waaa-641,160,2026-07-04
YUJ-061,"After Getting Divorced, Quitting My Job, And Returning To My Hometown, I Unexpectedly Reunited With My Ex-girlfriend. This Is The Story Of A Few Days Spent With My Ex-girlfriend, Whom I Loved But Broke Up With Because Of The Long Distance, And With Whom I Couldn't Forget, As We Longed For Each Other Like We Did In The Old Days.",https://pic.javct.net/poster/05192026/a81f8ff37c.jpg,https://javct.net/v/yuj-061,120,2026-07-04
MIDA-691,Ejaculation (Death) Kiss Esthetics ~ An Irresistible Kissing Temptation. A Tongue-kissing Massage Parlor That Will Drive You Crazy With Explosive Ejaculations ~ Nana Yagi,https://pic.javct.net/poster/05192026/286942ec50.jpg,https://javct.net/v/mida-691,180,2026-07-04
MIKR-106,"""I'll Give You The Best Handjob Of Your Life!"" A Cock-job Nurse Whose Right Hand Can't Stop When She Sees An Erect Cock Gently, Intensely, Licks, Vacuums, Licks Nipples, And Makes The Glans Explode! Goddess Handjob Clinic Sasaki Aki",https://pic.javct.net/poster/05192026/c4a951c1bd.jpg,https://javct.net/v/mikr-106,150,2026-07-04
FNS-209-RM,"It Was A Saturday Morning When I Was Woken Up At My House By A Male Friend. We Had Lunch, Had Sex, Went To The Convenience Store In The Evening, Had Sex, And Slept Together Again On Sunday Night. Ranran Fujii [Uncensored L**ked]",https://pic.javct.net/poster/04112026/01b4dfd536.jpg,https://javct.net/v/fns-209-rm,150,2026-07-04
1P-070226-001,Welcome to the Creampie Cum Toilet: Ayana Yamagishi,https://pic.javct.net/poster/05192026/6aa2a72c78.jpg,https://javct.net/v/1p-070226-001,59,2026-07-04
CR-070226-001,Centurion Soap: Aika Hoshino,https://pic.javct.net/poster/05192026/efe58b9795.jpg,https://javct.net/v/cr-070226-001,61,2026-07-04
