code,title,image_url,page_url,views,date_scraped
10-063026-01,Blowjob while shaving 3,https://pic.javct.net/poster/05192026/8bb86f8d17.jpg,https://javct.net/v/10-063026-01,09,2026-06-30
MOPG-030,Onna Who Is Crazy With Pleasure For A Man Who Is Being Arrested And Being Fucked.vol.2 First Public Release!Shoot Downward Video Recording Special Edition Kyo Miura,https://pic.javct.net/poster/05192026/7efa057627.jpg,https://javct.net/v/mopg-030,120,2026-06-30
MXGS-081-RM,Akiho Yoshizawa Absolute Slut Akiho Mad ○ Ji Woke Up Port [Uncensored L**ked],https://pic.javct.net/poster/05192026/9d25569bca.jpg,https://javct.net/v/mxgs-081-rm,135,2026-06-30
MGNL-177-RM,“Limited To Close Couples Only! A Word Association Game Where You Get Your Body Pranked While Sticking Your Head Out Of A Hole In The Wall! ”A Young Wife Of A Beauty Club Member Takes On The Challenge! Her Overly Sensitive Inverted Nipples Are Sucked Out And She Continues With A Questionable Response! ? Massive Creampie Sex Where The Vagina Is Penetrated Many Times And The Husband Can't React To It! ! [Street Corner Amateur Monitoring #Asami #25 Years Old] [Uncensored L**ked],https://pic.javct.net/poster/05192026/96086d4f4e.jpg,https://javct.net/v/mgnl-177-rm,60,2026-06-30
FC2PPV-4930495,"[Public] Ai-chan #9, a really cute and beautiful woman with beautiful breasts and a nice ass, made me understand his rough dick in front of him, and had NTR creampie and sex with her.",https://pic.javct.net/poster/05192026/98fe5ff222.jpg,https://javct.net/v/fc2ppv-4930495,39,2026-06-30
MGNL-176-RM,"""A Kind-hearted Nurse Solves The Problems Of Premature Ejaculation And Virgin Patients!?"" An Older Sister-like Nurse Gently Squeezes The Sperm Out Of Her Patients!! Even If She Ejaculates Three Times, She Immediately Revives Her Penis With Her Raw Vagina... A High-speed Virgin Fuck Makes Her Cum 3 Times In A Row!! [Street Corner Amateur Monitoring # Akina # 28 Years Old] [Uncensored L**ked]",https://pic.javct.net/poster/05192026/7487dc4c9b.jpg,https://javct.net/v/mgnl-176-rm,70,2026-06-30
OLM-329,I Fill My Hole (anal) With An Old Man,https://pic.javct.net/poster/05192026/c14c3fb1b3.jpg,https://javct.net/v/olm-329,180,2026-06-30
MOPG-029,Onna Who Is Crazy With Pleasure For A Man Who Is Being Arrested And Being Fucked.First Public Release!Shoot Down Video Recording Special Edition Kitagawa Yuzu,https://pic.javct.net/poster/05192026/8fd3fd2781.jpg,https://javct.net/v/mopg-029,115,2026-06-30
HUNTB-526-RM,"""If You Make Me Squid, I'll Study! If You Cum Before Me, I'll Never Study!"" Little Devil Girl ○ Raw Vs Unequaled Private Tutor! A Sex Battle Breaks Out With A Female Student Who Plays With Me [Uncensored L**ked]",https://pic.javct.net/poster/20230104/1682048454.jpg,https://javct.net/v/huntb-526-rm,190,2026-06-30
BABM-017-RM,"Babu Miaru Asuka Mama Praises Me For Just Being Alive, So I'm Pretending To Be A Baby And Have Sex Asuka Momose [Uncensored L**ked]",https://pic.javct.net/poster/20230104/1681530291.jpg,https://javct.net/v/babm-017-rm,121,2026-06-30
DFDM-075-RM,"The Devilish Massage Girl, Ryukawa Rio, Seduces You Through Your Panties. [Uncensored L**ked]",https://pic.javct.net/poster/05192026/3ada6c4353.jpg,https://javct.net/v/dfdm-075-rm,115,2026-06-30
NLD-032-RM,Nipple Pleasure Men's Salon [Uncensored L**ked],https://pic.javct.net/poster/05192026/2add7c8962.jpg,https://javct.net/v/nld-032-rm,115,2026-06-30
VOSS-105-RM,It Was The Old Beauty Teacher Teacher Who Came When Calling Married Wife Deriher! !I (the Currently Unemployed Pachinkas) The Notification Table Was All 1 Because I Was Watching Something With The Poor (wal) Of The School Days Tickets Decided To Take A Weakness And Revenge Sex! !3 [Uncensored L**ked],https://pic.javct.net/poster/05192026/2e82896309.jpg,https://javct.net/v/voss-105-rm,100,2026-06-30
ONED-937-RM,Firing Wildly Vigorous Facial Milf [Uncensored L**ked],https://pic.javct.net/poster/05192026/b8c7a097d3.jpg,https://javct.net/v/oned-937-rm,124,2026-06-30
MOPG-028,"Male's New Dry Orgasm Dream M Erotic Slut ""Maki Kyoko"" Edition First Public Release!Shoot Down Video Recording Special Edition",https://pic.javct.net/poster/05192026/42d3c21270.jpg,https://javct.net/v/mopg-028,119,2026-06-30
FC2PPV-4929324,"[New Divine Episode] Tashiro-chan, who has idol looks and SSS level, came back as an adult, so she decided to have creampie sex with her pregnancy confirmed.",https://pic.javct.net/poster/05192026/ec1db67416.jpg,https://javct.net/v/fc2ppv-4929324,41,2026-06-30
1P-062826-001,M Slut: Suzu Nonomiya,https://pic.javct.net/poster/05192026/78a1ae981e.jpg,https://javct.net/v/1p-062826-001,61,2026-06-30
HZ-3882,Asi-Hame!! Vol.28 - Xiaoxi,https://pic.javct.net/poster/05192026/d87cd38380.jpg,https://javct.net/v/hz-3882,68,2026-06-30
SDDE-302,Hand Job Clinic Fan Thanksgiving 2013,https://pic.javct.net/poster/05192026/e9a19b0634.jpg,https://javct.net/v/sdde-302,120,2026-06-30
ADN-684-SUB,"[Binaural Recording For Maximum Immersion!] A Night Of Staring Into The Eyes Of A Married Woman's Subordinate Who Was Sharing A Room With Me, Whispering In My Ear So Close I Could Hear His Breathing. Iroha Natsume [English Subtitle]",https://pic.javct.net/poster/20252204/1746125687.jpg,https://javct.net/v/adn-684-sub,120,2026-06-30
ARMM-012-RM,Arisawa Real Gauze Lust Temptation Of Wife [Uncensored L**ked],https://pic.javct.net/poster/05192026/2ce381c795.jpg,https://javct.net/v/armm-012-rm,120,2026-06-30
ARMM-037-RM,Wearing No Underwear Addiction That Is Inspired By Mukai Love [Uncensored L**ked],https://pic.javct.net/poster/05192026/5cb002d93e.jpg,https://javct.net/v/armm-037-rm,125,2026-06-30
NLD-032,Nipple Pleasure Men's Salon,https://pic.javct.net/poster/05192026/2add7c8962.jpg,https://javct.net/v/nld-032,115,2026-06-30
DFDM-075,"The Devilish Massage Girl, Ryukawa Rio, Seduces You Through Your Panties.",https://pic.javct.net/poster/05192026/3ada6c4353.jpg,https://javct.net/v/dfdm-075,115,2026-06-30
