code,title,image_url,page_url,views,date_scraped
BACJ-056-RM,Extreme To**ure Beauty Salon Where Repeaters Continue To Splendid Finger Techniques Yurika Hiyama [Uncensored L**ked],https://pic.javct.net/poster/20230205/1683347775.jpg,https://javct.net/v/bacj-056-rm,133,2026-06-21
XRW-717-RM,Envy-Women Who Make Excuses To Make A Man Ugly [Uncensored L**ked],https://pic.javct.net/poster/05192026/a37fb99b3f.jpg,https://javct.net/v/xrw-717-rm,159,2026-06-21
MOPP-123-RM,"A Masochistic Trap Where A Teasing Slut Plays With You Until Your Brain Is Melting With Pleasure, Never Letting You Ejaculate In This Rewarding To**ure Of Masochistic Pleasure - Mizuhata Asami [Uncensored L**ked]",https://pic.javct.net/poster/05192026/5abd134a61.jpg,https://javct.net/v/mopp-123-rm,122,2026-06-21
CJOD-519-RM,"""Rubbing It With Your Hand Doesn't Count As Cheating,"" My Girlfriend's Best Friend Whispers, Pressing Her Breasts Against Mine, And Gives Me A Handjob, Draining Me Of So Much Sperm That I Won't Be Able To Get Up Tomorrow. - Riho Shishido [Uncensored L**ked]",https://pic.javct.net/poster/05192026/95d2e3a495.jpg,https://javct.net/v/cjod-519-rm,150,2026-06-21
KAGP-396,"Amateur Pickup And Masturbation Viewing 24 You Just Have To Watch! So, Would You Mind Taking A Look At My Dick?",https://pic.javct.net/poster/05192026/e4efda545f.jpg,https://javct.net/v/kagp-396,191,2026-06-21
UZU-038-RM,"My Wife, A Former No. 1 Escort Girl, Tames My Passive Self In Our Married Life. - Kasumi Tsukino [Uncensored L**ked]",https://pic.javct.net/poster/05192026/6b219052e4.jpg,https://javct.net/v/uzu-038-rm,150,2026-06-21
1P-062026-001,PtoM SEX: Saki Konno,https://pic.javct.net/poster/05192026/c190acf3a4.jpg,https://javct.net/v/1p-062026-001,60,2026-06-21
UZU-038,"My Wife, A Former No. 1 Escort Girl, Tames My Passive Self In Our Married Life. - Kasumi Tsukino",https://pic.javct.net/poster/05192026/6b219052e4.jpg,https://javct.net/v/uzu-038,150,2026-06-21
PA-062026-100,Mature Lady Piledriver Position BJ: Momoko Akasaka,https://pic.javct.net/poster/05192026/d14f2f4c80.jpg,https://javct.net/v/pa-062026-100,51,2026-06-21
FNS-222-RM,"During A Dark Fitness Creampie Exercise, Her Big Breasts, Clitoris, And Pussy Are All Played With And She Reaches A Humiliating Climax Ranran Fujii [Uncensored L**ked]",https://pic.javct.net/poster/05192026/7035372221.jpg,https://javct.net/v/fns-222-rm,115,2026-06-21
MOPP-123,"A Masochistic Trap Where A Teasing Slut Plays With You Until Your Brain Is Melting With Pleasure, Never Letting You Ejaculate In This Rewarding To**ure Of Masochistic Pleasure - Mizuhata Asami",https://pic.javct.net/poster/05192026/5abd134a61.jpg,https://javct.net/v/mopp-123,122,2026-06-21
CJOD-531-RM,"Even In The Reiwa Era, The No. 1 Dirty Talk Queen, Hasumi Claire, Offers Ejaculation Control JOI. Get Hooked On Claire-sama With Her Teasing And Whispered Seductive Words. [Uncensored L**ked]",https://pic.javct.net/poster/05192026/4169db5a10.jpg,https://javct.net/v/cjod-531-rm,180,2026-06-21
HZ-3871,Seductive Women Sk**led at Sucking - Yui Shinjo - Miyu Morita,https://pic.javct.net/poster/05192026/2c28635f31.jpg,https://javct.net/v/hz-3871,52,2026-06-21
EBOD-136-RM,SP JULIA SSS-BODY4 Bloom Time Returning [Uncensored L**ked],https://pic.javct.net/poster/20222410/1666800318.jpg,https://javct.net/v/ebod-136-rm,240,2026-06-21
FC2PPV-4922837,"[It's about to come out] A D-cup beauty gives me a vacuum blowjob, and my baby gets pumped up and down, and she gives me a close hand job from behind, pushing me over the limit.",https://pic.javct.net/poster/05192026/eec8752ef5.jpg,https://javct.net/v/fc2ppv-4922837,60,2026-06-21
CR-061926-001,Luxury Adult Healing Spa: Girl nowadays is highly sexed,https://pic.javct.net/poster/05192026/78b3ddf4b8.jpg,https://javct.net/v/cr-061926-001,61,2026-06-21
HUNTB-539-RM,"""I Didn't Do It, But Do You Have Proof?"" From A Bullish ""I'm Sorry... I'll Do Anything, Even Sex, So Please Don't Tell My Parents And School..."" I Shoplifted At The Supermarket [Uncensored L**ked]",https://pic.javct.net/poster/20230205/1683263652.jpg,https://javct.net/v/huntb-539-rm,220,2026-06-21
CJOB-209,"Unable To Move, She Is Attacked In Both Erogenous Zones At Once And Ejaculates In A Pincer Attack Harem BEST",https://pic.javct.net/poster/05192026/79a8ff9d0c.jpg,https://javct.net/v/cjob-209,240,2026-06-21
XV-736-RM,Rio Can Not Only Ultimate Berochu [Uncensored L**ked],https://pic.javct.net/poster/05192026/1fe0354922.jpg,https://javct.net/v/xv-736-rm,120,2026-06-21
JIMMY-002-RM,Why Don't You Stop Cheating? The Smell Of Another Woman's Vagina That Hangs Over Me Every Night Is Ruining My Pride... Nazuki Aoshima [Uncensored L**ked],https://pic.javct.net/poster/05192026/b8c7ff2cce.jpg,https://javct.net/v/jimmy-002-rm,120,2026-06-21
FNS-222,"During A Dark Fitness Creampie Exercise, Her Big Breasts, Clitoris, And Pussy Are All Played With And She Reaches A Humiliating Climax Ranran Fujii",https://pic.javct.net/poster/05192026/7035372221.jpg,https://javct.net/v/fns-222,115,2026-06-21
CJOD-531,"Even In The Reiwa Era, The No. 1 Dirty Talk Queen, Hasumi Claire, Offers Ejaculation Control JOI. Get Hooked On Claire-sama With Her Teasing And Whispered Seductive Words.",https://pic.javct.net/poster/05192026/4169db5a10.jpg,https://javct.net/v/cjod-531,180,2026-06-21
CJOD-519,"""Rubbing It With Your Hand Doesn't Count As Cheating,"" My Girlfriend's Best Friend Whispers, Pressing Her Breasts Against Mine, And Gives Me A Handjob, Draining Me Of So Much Sperm That I Won't Be Able To Get Up Tomorrow. - Riho Shishido",https://pic.javct.net/poster/05192026/95d2e3a495.jpg,https://javct.net/v/cjod-519,150,2026-06-21
NHDTC-217-RM,M-man Development Train 3: A Dominant Older Woman Makes Him Ejaculate Inside His Clothes With A Handjob In Her Pocket. [Uncensored L**ked],https://pic.javct.net/poster/05192026/bffadcb51e.jpg,https://javct.net/v/nhdtc-217-rm,175,2026-06-21
