code,title,image_url,page_url,views,date_scraped
FSDSS-999-SUB,I Couldn't Be Satisfied With My Boyfriend...I Ended Up Getting Hooked On The Old Man's Big Dick Swamp At My Parents' House When I Went Home.Yamashita Sawa. [English Subtitle],https://pic.javct.net/poster/20253001/1741287109.jpg,https://javct.net/v/fsdss-999-sub,120,2026-06-09
MGMQ-022,He Sees [Hinomi Naruzawa] So That M Man Seems To Be A Meat Toilet.,https://pic.javct.net/poster/05192026/d9866ef372.jpg,https://javct.net/v/mgmq-022,109,2026-06-09
CR-060826-001,Five kinds of Titty Fucks and the Ideal Boob Sex,https://pic.javct.net/poster/05192026/cf4a15b2c9.jpg,https://javct.net/v/cr-060826-001,61,2026-06-09
MOPE-015,Onasapo Subjective Lewd Woman Handjob Crime & Anal Fist,https://pic.javct.net/poster/05192026/f6aba67e15.jpg,https://javct.net/v/mope-015,159,2026-06-09
MOPA-019,HatsuMisa Reverse Anal R**e Of A Rare 'cute Face To Huge Strap-on Dildo In M ​​man Prisoners',https://pic.javct.net/poster/05192026/c0ab494f85.jpg,https://javct.net/v/mopa-019,137,2026-06-09
MOPG-003,Masochist Rolled Anal & Penis Simultaneous Man Prisoners Naho Hazuki,https://pic.javct.net/poster/05192026/e857e21fdd.jpg,https://javct.net/v/mopg-003,116,2026-06-09
PGD-697,"Handjobs Dirty Slut Teacher Sakurai, Ayu",https://pic.javct.net/poster/05192026/5883a2767f.jpg,https://javct.net/v/pgd-697,150,2026-06-09
COGM-051-RM,"Marunouchi OL, Side Job Is Immediate Hamederiheru [Uncensored L**ked]",https://pic.javct.net/poster/20230206/1688186579.jpg,https://javct.net/v/cogm-051-rm,107,2026-06-09
FNS-216-RM,Deceived By An Unscrupulous Therapist... Shrimp Warped Squirting Climax Esthetics That Makes You Cum So Much That Your Pussy Becomes Stupid Mia Kamiki [Uncensored L**ked],https://pic.javct.net/poster/05192026/7496085c1e.jpg,https://javct.net/v/fns-216-rm,155,2026-06-09
DLDSS-517-RM,"An Exotic Beauty, Exclusive To DAHLIA [Uncensored L**ked]",https://pic.javct.net/poster/05192026/443c574a59.jpg,https://javct.net/v/dldss-517-rm,160,2026-06-09
SOE-032-RM,Risa Kasumi FUCK Passions Violently Disturbed NO.1STYLE × Risky Mosaic [Uncensored L**ked],https://pic.javct.net/poster/20230206/1688129886.jpg,https://javct.net/v/soe-032-rm,120,2026-06-09
SDDE-411-RM,"No Matter How Many Times They Fuck She's Still Horny. Countless Rounds Of Orgasmic Sex. One Night, Two Day Hotel Stay Of Ecstasy - 12 Loads In All! [Uncensored L**ked]",https://pic.javct.net/poster/20220406/1654569935.jpg,https://javct.net/v/sdde-411-rm,151,2026-06-09
1P-060726-001,Bitch!,https://pic.javct.net/poster/05192026/9b85a0b47d.jpg,https://javct.net/v/1p-060726-001,89,2026-06-09
CKW-001-RM,"It Was Always Decided That I Would Be Called During My Lunch Break. But... Ejaculation Is 9 Hours Later. Moreover, It Is Blamed Immediately After That. And In The End, The Rapid-fire Sex Sato's? [Uncensored L**ked]",https://pic.javct.net/poster/20230206/1687495969.jpg,https://javct.net/v/ckw-001-rm,130,2026-06-09
ROYD-321-RM,"I couldn't stand the beautiful beauty salon girl at the body wash salon where touching is prohibited, so I touched her with feathers. The ban was lifted unexpectedly after real negotiations, even though he was prepared to be banned. Himari Kinoshita [Uncensored L**ked]",https://pic.javct.net/poster/05192026/4110cdc002.jpg,https://javct.net/v/royd-321-rm,129,2026-06-09
MGOLD-062-RM,"Win Big With The Gacha, A Marriage Agency Specializing In Foreigners! Young! Big Breasts! Erotic! A Newlywed Life With The Cutest Asian Girl! ! Lisa [Uncensored L**ked]",https://pic.javct.net/poster/05192026/afea80e499.jpg,https://javct.net/v/mgold-062-rm,120,2026-06-09
DVAJ-744-RM,"Whispering Dirty Talk ASMR And Sticky Slow Handjob Instructions Keep Your Erection Rock Hard The Whole Time. Teasing And Playing With Your Dick, Stopping Just Short Of The Climax Multiple Times, Pushing You To The Limits Of Ultimate Orgasm - Tomoe Hikari [Uncensored L**ked]",https://pic.javct.net/poster/05192026/45bb30353a.jpg,https://javct.net/v/dvaj-744-rm,150,2026-06-09
SVSHA-003-RM,Shame New Student Development Health Checkup 2022 [Uncensored L**ked],https://pic.javct.net/poster/20222612/1673494385.jpg,https://javct.net/v/svsha-003-rm,275,2026-06-09
FC2PPV-4915564,I to**ure the plump clit of a beautiful fair-skinned F-cup beauty and make her cum.I feel her pussy undulating and let out a sweet voice.I thrust my cock into the unsatisfied person.,https://pic.javct.net/poster/05192026/3bc9402533.jpg,https://javct.net/v/fc2ppv-4915564,57,2026-06-09
MGMQ-168-RM,A Young Wife Who Seduces And Devours Younger Submissive Men Is A Nymphomaniac Who Loves Anal Sex And Has Been Reverse-trained By Her Perverted Husband. - Akane Rei [Uncensored L**ked],https://pic.javct.net/poster/05192026/b1e8dad957.jpg,https://javct.net/v/mgmq-168-rm,112,2026-06-09
DLDSS-517,"An Exotic Beauty, Exclusive To DAHLIA",https://pic.javct.net/poster/05192026/443c574a59.jpg,https://javct.net/v/dldss-517,160,2026-06-09
HUNTC-561-RM,"""What?! This Is Practical Training?"" I Enrolled In A Sports Instructor Vocational School And I'm The Only Guy! The Practical Training Involves Getting Incredibly Close To Girls In Tight, Sexy Outfits That Show Off Their Body Lines! And It's A Harem Orgy! [Uncensored L**ked]",https://pic.javct.net/poster/05192026/a5d243b4b3.jpg,https://javct.net/v/huntc-561-rm,110,2026-06-09
SNOS-241-RM,[The Night Bus Pervert Who Actually Existed] A Mysterious Beauty Sitting Next To Me Squeezed Every Last Drop Of My Cum Out Of Me From The Moment The Lights Went Out Until We Arrived At Our Destination. [Uncensored L**ked],https://pic.javct.net/poster/05192026/f4a8b930e3.jpg,https://javct.net/v/snos-241-rm,120,2026-06-09
1P-060626-001,Braless Neighbor In The Morning: Sakura Aoi,https://pic.javct.net/poster/05192026/0186f49b80.jpg,https://javct.net/v/1p-060626-001,56,2026-06-09
