code,title,image_url,page_url,views,date_scraped
COGM-051-RM,"Marunouchi OL, Side Job Is Immediate Hamederiheru [Uncensored L**ked]",https://pic.javct.net/poster/20230206/1688186579.jpg,https://javct.net/v/cogm-051-rm,107,2026-06-08
FNS-216-RM,Deceived By An Unscrupulous Therapist... Shrimp Warped Squirting Climax Esthetics That Makes You Cum So Much That Your Pussy Becomes Stupid Mia Kamiki [Uncensored L**ked],https://pic.javct.net/poster/05192026/7496085c1e.jpg,https://javct.net/v/fns-216-rm,155,2026-06-08
DLDSS-517-RM,"An Exotic Beauty, Exclusive To DAHLIA [Uncensored L**ked]",https://pic.javct.net/poster/05192026/443c574a59.jpg,https://javct.net/v/dldss-517-rm,160,2026-06-08
SOE-032-RM,Risa Kasumi FUCK Passions Violently Disturbed NO.1STYLE × Risky Mosaic [Uncensored L**ked],https://pic.javct.net/poster/20230206/1688129886.jpg,https://javct.net/v/soe-032-rm,120,2026-06-08
SDDE-411-RM,"No Matter How Many Times They Fuck She's Still Horny. Countless Rounds Of Orgasmic Sex. One Night, Two Day Hotel Stay Of Ecstasy - 12 Loads In All! [Uncensored L**ked]",https://pic.javct.net/poster/20220406/1654569935.jpg,https://javct.net/v/sdde-411-rm,151,2026-06-08
1P-060726-001,Bitch!,https://pic.javct.net/poster/05192026/9b85a0b47d.jpg,https://javct.net/v/1p-060726-001,89,2026-06-08
CKW-001-RM,"It Was Always Decided That I Would Be Called During My Lunch Break. But... Ejaculation Is 9 Hours Later. Moreover, It Is Blamed Immediately After That. And In The End, The Rapid-fire Sex Sato's? [Uncensored L**ked]",https://pic.javct.net/poster/20230206/1687495969.jpg,https://javct.net/v/ckw-001-rm,130,2026-06-08
ROYD-321-RM,"I couldn't stand the beautiful beauty salon girl at the body wash salon where touching is prohibited, so I touched her with feathers. The ban was lifted unexpectedly after real negotiations, even though he was prepared to be banned. Himari Kinoshita [Uncensored L**ked]",https://pic.javct.net/poster/05192026/4110cdc002.jpg,https://javct.net/v/royd-321-rm,129,2026-06-08
MGOLD-062-RM,"Win Big With The Gacha, A Marriage Agency Specializing In Foreigners! Young! Big Breasts! Erotic! A Newlywed Life With The Cutest Asian Girl! ! Lisa [Uncensored L**ked]",https://pic.javct.net/poster/05192026/afea80e499.jpg,https://javct.net/v/mgold-062-rm,120,2026-06-08
DVAJ-744-RM,"Whispering Dirty Talk ASMR And Sticky Slow Handjob Instructions Keep Your Erection Rock Hard The Whole Time. Teasing And Playing With Your Dick, Stopping Just Short Of The Climax Multiple Times, Pushing You To The Limits Of Ultimate Orgasm - Tomoe Hikari [Uncensored L**ked]",https://pic.javct.net/poster/05192026/45bb30353a.jpg,https://javct.net/v/dvaj-744-rm,150,2026-06-08
SVSHA-003-RM,Shame New Student Development Health Checkup 2022 [Uncensored L**ked],https://pic.javct.net/poster/20222612/1673494385.jpg,https://javct.net/v/svsha-003-rm,275,2026-06-08
FC2PPV-4915564,I to**ure the plump clit of a beautiful fair-skinned F-cup beauty and make her cum.I feel her pussy undulating and let out a sweet voice.I thrust my cock into the unsatisfied person.,https://pic.javct.net/poster/05192026/3bc9402533.jpg,https://javct.net/v/fc2ppv-4915564,57,2026-06-08
MGMQ-168-RM,A Young Wife Who Seduces And Devours Younger Submissive Men Is A Nymphomaniac Who Loves Anal Sex And Has Been Reverse-trained By Her Perverted Husband. - Akane Rei [Uncensored L**ked],https://pic.javct.net/poster/05192026/b1e8dad957.jpg,https://javct.net/v/mgmq-168-rm,112,2026-06-08
DLDSS-517,"An Exotic Beauty, Exclusive To DAHLIA",https://pic.javct.net/poster/05192026/443c574a59.jpg,https://javct.net/v/dldss-517,160,2026-06-08
HUNTC-561-RM,"""What?! This Is Practical Training?"" I Enrolled In A Sports Instructor Vocational School And I'm The Only Guy! The Practical Training Involves Getting Incredibly Close To Girls In Tight, Sexy Outfits That Show Off Their Body Lines! And It's A Harem Orgy! [Uncensored L**ked]",https://pic.javct.net/poster/05192026/a5d243b4b3.jpg,https://javct.net/v/huntc-561-rm,110,2026-06-08
SNOS-241-RM,[The Night Bus Pervert Who Actually Existed] A Mysterious Beauty Sitting Next To Me Squeezed Every Last Drop Of My Cum Out Of Me From The Moment The Lights Went Out Until We Arrived At Our Destination. [Uncensored L**ked],https://pic.javct.net/poster/05192026/f4a8b930e3.jpg,https://javct.net/v/snos-241-rm,120,2026-06-08
1P-060626-001,Braless Neighbor In The Morning: Sakura Aoi,https://pic.javct.net/poster/05192026/0186f49b80.jpg,https://javct.net/v/1p-060626-001,56,2026-06-08
ROYD-078-RM,Old Guy Gets Hard When You Play WIth Nipples! Seems So Happy So I Will Lick Nipples With My Tongue Pussy! Ruka Inaba [Uncensored L**ked],https://pic.javct.net/poster/20212011/1640329658.jpg,https://javct.net/v/royd-078-rm,190,2026-06-08
DLDSS-504-RM,"“Perverted Age” Chapter 2. Haruga Oto's ""Tenjin'' Creampie Ban Lifted. [Uncensored L**ked]",https://pic.javct.net/poster/05192026/f40b24dc0f.jpg,https://javct.net/v/dldss-504-rm,135,2026-06-08
SNOS-236-RM,"A Sexy Giantess, A Beautiful Woman Over 180cm Tall, Looked Down On Me, Teased Me, And Made Me Cum 13 Times. How Embarrassing For Me. Ashitaba Mitsuha [Uncensored L**ked]",https://pic.javct.net/poster/05192026/dfd41c7ab1.jpg,https://javct.net/v/snos-236-rm,120,2026-06-08
ONED-860-RM,Risa Kasumi NO.1 STYLE × × Hyper Hyper Barely Barely [Uncensored L**ked],https://pic.javct.net/poster/20230206/1687956067.jpg,https://javct.net/v/oned-860-rm,120,2026-06-08
MGMQ-168,A Young Wife Who Seduces And Devours Younger Submissive Men Is A Nymphomaniac Who Loves Anal Sex And Has Been Reverse-trained By Her Perverted Husband. - Akane Rei,https://pic.javct.net/poster/05192026/b1e8dad957.jpg,https://javct.net/v/mgmq-168,112,2026-06-08
MGOLD-062,"Win Big With The Gacha, A Marriage Agency Specializing In Foreigners! Young! Big Breasts! Erotic! A Newlywed Life With The Cutest Asian Girl! ! Lisa",https://pic.javct.net/poster/05192026/afea80e499.jpg,https://javct.net/v/mgold-062,120,2026-06-08
DVAJ-744,"Whispering Dirty Talk ASMR And Sticky Slow Handjob Instructions Keep Your Erection Rock Hard The Whole Time. Teasing And Playing With Your Dick, Stopping Just Short Of The Climax Multiple Times, Pushing You To The Limits Of Ultimate Orgasm - Tomoe Hikari",https://pic.javct.net/poster/05192026/45bb30353a.jpg,https://javct.net/v/dvaj-744,150,2026-06-08
