code,title,image_url,page_url,views,date_scraped
VRNC-101-RM,L**ked Cabaret Lady And Others [Uncensored L**ked],https://pic.javct.net/poster/07052026/2a417a48a6.jpg,https://javct.net/v/vrnc-101-rm,71,2026-07-16
STCVS-052-RM,[Walking Smartphone Monitor Who Polices Beautiful Girls With His Meat Stick] (1) Polices The Beautiful President's Daughter Who Is Studying With An App! (2) Crack Down On Kansai Dialect Office Ladies Who Are Making Rounds While Looking At The Map! (3) A Busty Girl Who Is Having A Message Session With Her Favorite Boyfriend Is Arrested In Front Of Her Boyfriend! [Delusion Erotic Man #Aoi & Sana & Mina] [Uncensored L**ked],https://pic.javct.net/poster/07052026/9080178b3d.jpg,https://javct.net/v/stcvs-052-rm,150,2026-07-16
MGNL-184-RM,"""Thorough Verification Of Whether College Students With Friends Cross The Line With Slippery Oils And Slippery Crotches☆"" Slender JD With A Dazzling Smile Develops Into A Raw Shark By Rubbing Slippery Oils And Crotches With A Seminar Friend Boy♪... Even Though He Has An Orgasm, He Does Not Stop Overwriting Continuous Creampie☆ [Street Corner Amateur Monitoring♯ Miku] [Uncensored L**ked]",https://pic.javct.net/poster/07052026/c3ab9eeabf.jpg,https://javct.net/v/mgnl-184-rm,87,2026-07-16
SUPD-053-RM,Kaela Uehara DIGITAL CHANNEL [Uncensored L**ked],https://pic.javct.net/poster/07052026/d12be6d53d.jpg,https://javct.net/v/supd-053-rm,220,2026-07-16
VRNC-099-RM,"Orgy Sex With 4 Cafe Girls With Amazing Styles! Let's Have A Drink At Home With The Four Heavenly Kings Who Have Everything: Beautiful Looks, Beautiful Breasts, Beautiful Legs, And Beautiful Butts! Men Who Can't Even Stand Up Because Of The Pheromones Are So Fucked Up! [Kanna/Meru/Akiho/Meisa] Ver Kanna & Mel [Uncensored L**ked]",https://pic.javct.net/poster/07052026/64ddd0c2c6.jpg,https://javct.net/v/vrnc-099-rm,85,2026-07-16
STCV-600-RM,Geek-friendly Gal Was Real!? The Middle Age Of Virginity Is Musha To Brown Big Tits! Imadoki Girl Is Squeezed With A Giant Dick She Has Been Holding For 35 Years♪ [DT + α # Anachan] [Uncensored L**ked],https://pic.javct.net/poster/07052026/e760793bff.jpg,https://javct.net/v/stcv-600-rm,89,2026-07-16
MGNL-180-RM,"""The Gentle Nurse Solves The Problems Of The Patient In Charge Of Premature Ejaculation & Virginity!♯?"" Omotori Giant Ass Nurse Grinds Down The Strong Meat Stick Of The Patient In Charge With A Raw Vagina... No Matter How Many Times You Ejaculate, You Can Instantly Resurrect The Virginity While Melodiously Waiting For Pregnancy!! [Street Corner Amateur Monitoring Is♯ 27 Years Old] [Uncensored L**ked]",https://pic.javct.net/poster/07052026/de1a832ca3.jpg,https://javct.net/v/mgnl-180-rm,0,2026-07-16
MGNL-182-RM,[Love Love Heat Couple Exclusive! Pounding Cuckold Silhouette Quiz♪] Transparency The Strongest Color White Body JD Is Tossed Over The Challenge☆ Cloth By The Big Man... Continuous In And Out From The Raw Insertion● In The Pie Bun With The Shadow Painting Performance! [♯21-year-old♯ College Student♯ With Street Corner Amateur Monitoring] [Uncensored L**ked],https://pic.javct.net/poster/07052026/e9cf24dea7.jpg,https://javct.net/v/mgnl-182-rm,48,2026-07-16
FNS-236,"All Records Of The Collapse Of Jun (27), A Three-year C-group Teacher Goddess Of Modern Japanese Language At A Prefectural● School.",https://pic.javct.net/poster/07052026/9c23eb8409.jpg,https://javct.net/v/fns-236,165,2026-07-16
FSFST-006-RM,Treasured Gonzo Video Before AV Debut Shizuku Kashiwagi [Uncensored L**ked],https://pic.javct.net/poster/07052026/224b20c9c6.jpg,https://javct.net/v/fsfst-006-rm,57,2026-07-16
FC2PPV-4938458,"[Individual video] The newlywed ballet school teacher is made into a meat urinal with a cock and is poured with thick semen, making her very excited...",https://pic.javct.net/poster/07052026/b0019488dc.jpg,https://javct.net/v/fc2ppv-4938458,31,2026-07-16
EMSK-009-RM,ASMR Men's Beauty Salon Mio Ichijo,https://pic.javct.net/poster/20233001/1675395179.jpg,https://javct.net/v/emsk-009-rm,120,2026-07-16
FTHT-357-RM,An Incident Involving A Person That Occurred At An AV Shooting Site! The Scene Of The Crime Is Extremely Chaotic... And Then A Savior Appears! ? Detective Nozomi Stands Up! ! ! ~ Yay Takashima Incident ~ [Uncensored L**ked],https://pic.javct.net/poster/07052026/1c66df7f5a.jpg,https://javct.net/v/ftht-357-rm,86,2026-07-16
FTHT-345-RM,Verification! Can You Really Feel The Head Spa Wire? ? The Devil's Hand Of Pleasure Approaches The Female Monitors Who Gathered To Verify The Effectiveness Of Health Equipment! ? 10 Monitor Participants [Distribution Limited Vol.2] [Uncensored L**ked],https://pic.javct.net/poster/07052026/b700796c5f.jpg,https://javct.net/v/ftht-345-rm,125,2026-07-16
FTHT-344-RM,Verification! Can You Really Feel The Head Spa Wire? ? The Devil's Hand Of Pleasure Approaches The Female Monitors Who Gathered To Verify The Effectiveness Of Health Equipment! ? 10 Monitor Participants [Distribution Limited Vol.1] [Uncensored L**ked],https://pic.javct.net/poster/07052026/6592c161eb.jpg,https://javct.net/v/ftht-344-rm,124,2026-07-16
FTHT-356-RM,Unreasonable Daily Life At A School With An Overwhelmingly High Proportion Of Girls (and Full Of Sluts) ~Sexual FALENO School Edition~ [Uncensored L**ked],https://pic.javct.net/poster/07052026/41eb720ae6.jpg,https://javct.net/v/ftht-356-rm,82,2026-07-16
SNOS-207-RM,"A Short, Unemployed, Unpopular Older Brother Is Looked Down Upon And Teased By His Busty, Tall, Popular Younger Sister, Leading To Devilish Sex. - Honoka Watanabe [Uncensored L**ked]",https://pic.javct.net/poster/05192026/192b4a1389.jpg,https://javct.net/v/snos-207-rm,120,2026-07-16
FSFST-006,Treasured Gonzo Video Before AV Debut Shizuku Kashiwagi,https://pic.javct.net/poster/07052026/224b20c9c6.jpg,https://javct.net/v/fsfst-006,57,2026-07-16
1P-071426-001,PtoM SEX: Yuki Mizuki,https://pic.javct.net/poster/07052026/468675fff6.jpg,https://javct.net/v/1p-071426-001,61,2026-07-16
MOPG-044,The Best M Eroticism Trip That The Brain Gets In Convulsions Is Caught Mukai Aoi,https://pic.javct.net/poster/07052026/b138c436a4.jpg,https://javct.net/v/mopg-044,120,2026-07-16
HZ-3891,Beauty Collection Vol.129 - Rina Kashino,https://pic.javct.net/poster/07052026/d656b4c959.jpg,https://javct.net/v/hz-3891,55,2026-07-16
BASJ-002-RM,Auntie Will Teach You Adult Kiss [Uncensored L**ked],https://pic.javct.net/poster/20233001/1676088078.jpg,https://javct.net/v/basj-002-rm,126,2026-07-16
BMW-361,55 Best Handjobs By A Slutty Pervert Who Always Teases Two Spots With Her Sexy Tongue While Rubbing Her Hand:,https://pic.javct.net/poster/07052026/5051601a4a.jpg,https://javct.net/v/bmw-361,220,2026-07-16
MIGD-626-RM,Incredibly Beautiful Woman Shemale Debut AyaginuSaki Anzu那 [Uncensored L**ked],https://pic.javct.net/poster/05192026/3ce2ec951b.jpg,https://javct.net/v/migd-626-rm,120,2026-07-16
