code,title,image_url,page_url,views,date_scraped
JJDA-075-RM,"My Junior's Wife Is Being Penetrated By The Huge Cock Of A Jobless, Gambling-addicted, Slovenly Man On Welfare. [Uncensored L**ked]",https://pic.javct.net/poster/05192026/78cc87767b.jpg,https://javct.net/v/jjda-075-rm,120,2026-07-03
DVMM-416,"Immediately Had Sex With A Pale-skinned, Big-assed House Cleaning Lady! The Married Woman, Who Was Captivated By My Big Dick, Showed Up Unannounced The Next Day, So I Gave Her Multiple Orgasms And Cummed Inside Her Until She Was Satisfied. 52 Arioka Miu",https://pic.javct.net/poster/05192026/ffbf8a26eb.jpg,https://javct.net/v/dvmm-416,165,2026-07-03
JJDA-075,"My Junior's Wife Is Being Penetrated By The Huge Cock Of A Jobless, Gambling-addicted, Slovenly Man On Welfare.",https://pic.javct.net/poster/05192026/78cc87767b.jpg,https://javct.net/v/jjda-075,120,2026-07-03
MIDA-683,Ooh Voice Burst Convulsions Trembling Unleashed Cumshot Orgasm Orgy Special Shiraishi Nami,https://pic.javct.net/poster/05192026/cdc9b2970b.jpg,https://javct.net/v/mida-683,150,2026-07-03
GM-030,"A 28cm Non-standard Cock In Married ... Aigachi ● Jammed To Port ... ""Nana Imamiya (21) Tourist Guide's, The Land Of Gomez ● Po Good Domo! (Delicious),"" ""to An Takase (33) Man's Face Also Rising Oma ● Rubbing The C**ld "","" Mayu Kawai (29) Agony In G Cup Marshmallow Body Pleasure! ""monthly Erotic Gomez Vol.9",https://pic.javct.net/poster/05192026/3d98afb24c.jpg,https://javct.net/v/gm-030,140,2026-07-03
DVDMS-361-RM,Takamine Flower Beautiful Cabin Attendant Only!A Baseball Fist Caught Inside The Airline!If You Win 1 Million Yen!If It Does Not Suddenly Decacine Immediately Fake!It Is A Continuous Cum Shot Without Pulling Out With A Pursuit Piston Which Does Not Stop Even If It Goes Back In Front Of My Boss At The CA Oma Oka On The Way Back From The Flight!18 People In Total For 4 People [Uncensored L**ked],https://pic.javct.net/poster/05192026/2ac420608b.jpg,https://javct.net/v/dvdms-361-rm,220,2026-07-03
DVDMS-330-RM,General Men's Monitoring AV Magic Mirror Beyond The Magic Mirror!Big Breasted Wife Of The C**ld Has Decked Out The First Portia Sex Development Sex Development Of Life!Short Small Husband 's Husband Did Not Reach The Vagina Back To The Decachin Direct Hit Pistol!I Shake My Uterine Mouth Violently In Front Of My Husband And Spread All Over The Body While Spreading The Tide ... [Uncensored L**ked],https://pic.javct.net/poster/05192026/3eaf283498.jpg,https://javct.net/v/dvdms-330-rm,240,2026-07-03
ODVHJ-073-RM,Married Woman Affair Sex Video (2) [Uncensored L**ked],https://pic.javct.net/poster/05192026/d6f9dca041.jpg,https://javct.net/v/odvhj-073-rm,180,2026-07-03
GM-028,"28cm Of Latin A Big Cock In A Cheating Wife ... Rolled Reservoir Libido Wife, Sexual Desire Is Too Strong Married Woman, Beautiful Wife To Cling To Gomez Of Cock, G Cup Tayun Was Yun Body Married Woman, Home Even Without Regard To The Massage Manager Gomez Of The Original Japanese Boxing Champion Wives Of Body And Mind And Became Hooked.Monthly Erotic Gomez Vol.7",https://pic.javct.net/poster/05192026/015e35869d.jpg,https://javct.net/v/gm-028,150,2026-07-03
CEMD-321-RM,Pleasure Hell SEX That Does Not Stop Even If You Cum! 120 Minutes Of Endlessly Intense SEX That Doesn't Give You Free Time! Anna Hanayagi [Uncensored L**ked],https://pic.javct.net/poster/20230104/1680929074.jpg,https://javct.net/v/cemd-321-rm,126,2026-07-03
JUY-336-RM,Ever Since That Day When I Got My Pussy Pumped To The Deepest Depths Of My Life... Reika Hashimoto [Uncensored L**ked],https://pic.javct.net/poster/20220406/1656495835.jpg,https://javct.net/v/juy-336-rm,120,2026-07-03
567BEAF-220-RM,"A bruising old man k**ler who is full of things he wants and has surpassed his materialistic limits. A sub-standard big dick and deep vaginal penetration that causes him to have a spectacular orgasm. Lala-chan, 22 years old, is a big-breasted, bristle girl who goes crazy. [Uncensored L**ked]",https://pic.javct.net/poster/05192026/2ca55ef440.jpg,https://javct.net/v/567beaf-220-rm,75,2026-07-03
FC2PPV-4930495,"[Public] Ai-chan #9, a really cute and beautiful woman with beautiful breasts and a nice ass, made me understand his rough dick in front of him, and had NTR creampie and sex with her.",https://pic.javct.net/poster/05192026/98fe5ff222.jpg,https://javct.net/v/fc2ppv-4930495,39,2026-07-03
GM-027,Yuji Gomez / Loves Monthly Erotic Gomez Vol.6 28 Centimeter Gachi Muscle!Married Shy Was Raw Black Cock Versus Spear,https://pic.javct.net/poster/05192026/edba651edc.jpg,https://javct.net/v/gm-027,150,2026-07-03
FC2PPV-4926396,"[No] I asked a cute 24-year-old girl who was alone after the last train to come to the pick-up room, and as a result, her eyes lit up and she immediately fucked him, and she was a real angel as she accepted the creampie with a smile [Overseas version] Bonus included",https://pic.javct.net/poster/05192026/ce5ff8188e.jpg,https://javct.net/v/fc2ppv-4926396,43,2026-07-03
HJMO-713-RM,"For College Girls With A Licking Fetish Only: Hyottoko Blowjob And Continuous Ejaculation Mission. If You Fail To Complete The Specified Number Of Ejaculations, You Will Be Punished With An Immediate Cumshot Inside. [Uncensored L**ked]",https://pic.javct.net/poster/05192026/4463ed0e79.jpg,https://javct.net/v/hjmo-713-rm,190,2026-07-03
ATYA-037-RM,"A Super Sexy, Busty, Horny Wife With An Erotic Body Is Hooked On A Big Dick And Loses Her Mind In Sex! Hirose Miyu [Uncensored L**ked]",https://pic.javct.net/poster/05192026/22d615302e.jpg,https://javct.net/v/atya-037-rm,121,2026-07-03
DVDMS-970-RM,Appearance MM No. The Magic Mirror Convulsions Gakuburu Incontinence Tobizio Blowing Blue Sky Public Recording! An Amateur Girl Who Aims To Be A Professional Voice Actor Is Calmly Continuous While Reading The Manuscript! ! Big Penis Insertion Intense Piston That Is Banned From Broadcasting Into A Dripping Wet Collapse Oma! [Uncensored L**ked],https://pic.javct.net/poster/20230206/1688100810.jpg,https://javct.net/v/dvdms-970-rm,220,2026-07-03
DVDMS-308-RM,"General Males And Females Monitoring AV In Two Closed-door Rooms Male And Female Friends Are Sexual Consultations Consultation The Most Pretty Female College Student In The University Continues To Be Declined And Declined, Still A Virgin Boy Friend Challenged Writing Brush Mission! 2 Omaka Who Gently Accepted Curiously And Surprisedly In Big Boyfriend Than Boyfriend Is Instantly Large ... [Uncensored L**ked]",https://pic.javct.net/poster/05192026/62f3ff1c4c.jpg,https://javct.net/v/dvdms-308-rm,160,2026-07-03
NHDTB-114-RM,A Black Wife Who Is Locked By Crutches Without Stopping But Locked By Broken Crutches And Does Not Pull Out But It Does Not Pull Out Even If It Goes Out With A Black Cheol P [Uncensored L**ked],https://pic.javct.net/poster/20230804/1691473205.jpg,https://javct.net/v/nhdtb-114-rm,120,2026-07-03
HALT-026-RM,[Real Amateur] Presenting A Big Penis To A Petite Office Lady Who Came Out To The City And Encountered Too Many Perverts And Can't Tell Anyone About Her Sexual Habits Kanon Katase [Uncensored L**ked],https://pic.javct.net/poster/20230104/1681531945.jpg,https://javct.net/v/halt-026-rm,115,2026-07-03
STARS-058-RM,Broken Brothers Who Cried For Virginity To My Older Sister 's Friends Continuous Hard Piston Shoes Shrimp Warping Convulsions Iki Grand None Narimiya Rika [Uncensored L**ked],https://pic.javct.net/poster/20243105/1719741920.jpg,https://javct.net/v/stars-058-rm,130,2026-07-03
DVDMS-749-RM,"Quickie Pounding For Janitor MILFs With Irresistibly Tight Asses Dispatched To The One-Way Mirror Cab! You Didn't Tell Me They'd Be Filming It... They Protest, But The Director's Huge Dick Overwhelms Their Sense Of Caution And The Whole High-Speed Fuck Ends Up On Camera! Savor The Flavor These Big-Booty Matures Would Never Give Their Husbands In Japan's Sexiest Car... [Uncensored L**ked]",https://pic.javct.net/poster/20212011/1639726475.jpg,https://javct.net/v/dvdms-749-rm,142,2026-07-03
ODVHJ-073,Married Woman Affair Sex Video (2),https://pic.javct.net/poster/05192026/d6f9dca041.jpg,https://javct.net/v/odvhj-073,180,2026-07-03
