code,title,image_url,page_url,views,date_scraped
EKDV-820,"When I Woke Up This Morning, I Had Become... Konami Aya!!",https://pic.javct.net/poster/05192026/b905bb6779.jpg,https://javct.net/v/ekdv-820,140,2026-06-06
FC2PPV-4915883,[Public] A beautiful woman with beautiful breasts and a nice butt who is salivating with a huge black dick and two black men with a big dick destroy it and have a 3P to make them creampie,https://pic.javct.net/poster/05192026/16cac15ed8.jpg,https://javct.net/v/fc2ppv-4915883,71,2026-06-06
NGOD-341,"A Story Of Impregnation In Tokyo: Impregnated By My Husband's Stepson's Perfectly Matched, Circumcised, Huge Penis...",https://pic.javct.net/poster/05192026/c38a6773e6.jpg,https://javct.net/v/ngod-341,120,2026-06-06
BIGC-007,"[Beautiful Young Wife Is The Wife Of The Company President At Her Part-time Job] A Proud Celebrity Woman... Begs On Her Knees For A Huge Cock, Falls Into A Submissive State, Suffocates During Anal Sex And Is C**ked While Being Intensely Piston-fucked, Her Beauty Crumbling As She Reaches A Trance Of Orgasmic Frenzy.",https://pic.javct.net/poster/05192026/c231fb5db5.jpg,https://javct.net/v/bigc-007,197,2026-06-06
JUR-780-RM,"My C**ldhood Friend, Who Used To Have A Crush On Me And Had A Small Penis, Had Evolved Into A Man With A Huge Penis And A Strong Sex Drive, So I Ended Up Getting Hooked On Raw Sex With Him Many Times... [Uncensored L**ked]",https://pic.javct.net/poster/05192026/eb2ce7ba3a.jpg,https://javct.net/v/jur-780-rm,120,2026-06-06
NSFS-485,I Fell For A Man With A Bigger Cock Than My Husband... I Can't Tell You. - Sakumatsuna,https://pic.javct.net/poster/05192026/ffa5755ae3.jpg,https://javct.net/v/nsfs-485,107,2026-06-06
NGOD-345,My Grandfather And My Mother... My Beloved And Admired Mother's Body Is Being Touched By That Perverted Old Man...,https://pic.javct.net/poster/05192026/c846bb0fcd.jpg,https://javct.net/v/ngod-345,120,2026-06-06
NGOD-344-RM,Workplace Molestation: It Seems The Quiet Office Worker's Wife Is Being Subjected To Daily Lewd Acts By Her Boss With A Huge Penis... [Uncensored L**ked],https://pic.javct.net/poster/05192026/5ba242ac55.jpg,https://javct.net/v/ngod-344-rm,130,2026-06-06
ROE-505-RM,"I'm A Failure As A Mother, Having Been Penetrated To The Depths Of My Vagina By My Stepson's Huge Cock, Realizing I'm Just A Female. [Uncensored L**ked]",https://pic.javct.net/poster/05192026/cbdc8a3170.jpg,https://javct.net/v/roe-505-rm,120,2026-06-06
BBTU-073-RM,Big Breasts Girl Screaming Throat Pussy Yuri Aise [Uncensored L**ked],https://pic.javct.net/poster/20231711/1702699572.jpg,https://javct.net/v/bbtu-073-rm,110,2026-06-06
NGOD-345-RM,My Grandfather And My Mother... My Beloved And Admired Mother's Body Is Being Touched By That Perverted Old Man... [Uncensored L**ked],https://pic.javct.net/poster/05192026/c846bb0fcd.jpg,https://javct.net/v/ngod-345-rm,120,2026-06-06
NGOD-343,Graduation From The Domination Of That Giant Penis—the Day Of Graduation Finally Arrives For The Female Teacher Wife Who Was Dominated By Her Student's Huge Cock...,https://pic.javct.net/poster/05192026/8a86a82215.jpg,https://javct.net/v/ngod-343,120,2026-06-06
NGOD-344,Workplace Molestation: It Seems The Quiet Office Worker's Wife Is Being Subjected To Daily Lewd Acts By Her Boss With A Huge Penis...,https://pic.javct.net/poster/05192026/5ba242ac55.jpg,https://javct.net/v/ngod-344,130,2026-06-06
NHDTB-104-RM,I Will Make The Next Married Woman Who Visited With An Apology Of Noise Trouble Ashorekimae And Throat Firing In The Vertical Throat [Uncensored L**ked],https://pic.javct.net/poster/05192026/594fefeb21.jpg,https://javct.net/v/nhdtb-104-rm,130,2026-06-06
JUR-780,"My C**ldhood Friend, Who Used To Have A Crush On Me And Had A Small Penis, Had Evolved Into A Man With A Huge Penis And A Strong Sex Drive, So I Ended Up Getting Hooked On Raw Sex With Him Many Times...",https://pic.javct.net/poster/05192026/eb2ce7ba3a.jpg,https://javct.net/v/jur-780,120,2026-06-06
ROE-505,"I'm A Failure As A Mother, Having Been Penetrated To The Depths Of My Vagina By My Stepson's Huge Cock, Realizing I'm Just A Female.",https://pic.javct.net/poster/05192026/cbdc8a3170.jpg,https://javct.net/v/roe-505,120,2026-06-06
DVMM-400-RM,"Face Reveal MM Edition - For Exam Takers Only - The Magic Mirror: A Sloshing Blowjob Interview For Female Students Aiming To Get Into A Top University! 2. So Much Semen Is Ejaculated Into Their Mouths That They Can't Speak During Their Self-introductions! A Huge Cock Is Thrust Into Their Hot, Innocent Pussies After The Extreme Interview, Resulting In A Semen-drenched Sex Session! Everyone Gets Cummed Inside Special... [Uncensored L**ked]",https://pic.javct.net/poster/05192026/f1e2a137a5.jpg,https://javct.net/v/dvmm-400-rm,230,2026-06-06
FC2PPV-4912458,He thrusts a thick finger into her asshole and fucks a beautiful wife with a big ass and makes her do NTR for the first time and cums inside her.,https://pic.javct.net/poster/05192026/c7e404dfad.jpg,https://javct.net/v/fc2ppv-4912458,77,2026-06-06
MADM-169-RM,Order Immediately When You Want To Fuck A Slutty Married Woman Hibiki Otsuki Aiming For A Deliveryman Who Comes To The House [Uncensored L**ked],https://pic.javct.net/poster/20230206/1687579277.jpg,https://javct.net/v/madm-169-rm,110,2026-06-06
FC2PPV-4912528,"SEX with 20 people** Plump mature woman Reika's first 4P, sweaty carnal dance with huge breasts and big butt",https://pic.javct.net/poster/05192026/2daecbf8e7.jpg,https://javct.net/v/fc2ppv-4912528,72,2026-06-06
DVMM-016-RM,Lifting Of The Ban On Appearance! ! Magic Mirror Flight A Neat And Dignified Beauty Staff Working At A Top-Class Department Store Her First Jubo Jubo Vacuum No Handjob Edition Vol.02 Total 12 Shots! All 6 SEX Special! ! God Blow SEX That An Elegant Older Sister Sucks Ji ○ Port With Her Heart [Uncensored L**ked],https://pic.javct.net/poster/20230908/1694752828.jpg,https://javct.net/v/dvmm-016-rm,245,2026-06-06
SMOK-038-RM,"[Sucking Sexual Harassment] Alone In The Office During Overtime, A Gorilla-like Boss Continues To Suck And Train The Sensitive Clitoris Of A New, Hairless Office Lady, Hinata Yuna, Causing Her Legs To Tremble And Her Orgasmic Squirting To The Point Of Ecstasy. [Uncensored L**ked]",https://pic.javct.net/poster/05192026/2c67d8ec02.jpg,https://javct.net/v/smok-038-rm,158,2026-06-06
KSBJ-097,"My Brother's Wife Yuri Hikawa, My Sister-in-law Who Fell Into My Big Cock",https://pic.javct.net/poster/05192026/71b8def399.jpg,https://javct.net/v/ksbj-097,123,2026-06-06
DVMM-400,"Face Reveal MM Edition - For Exam Takers Only - The Magic Mirror: A Sloshing Blowjob Interview For Female Students Aiming To Get Into A Top University! 2. So Much Semen Is Ejaculated Into Their Mouths That They Can't Speak During Their Self-introductions! A Huge Cock Is Thrust Into Their Hot, Innocent Pussies After The Extreme Interview, Resulting In A Semen-drenched Sex Session! Everyone Gets Cummed Inside Special...",https://pic.javct.net/poster/05192026/f1e2a137a5.jpg,https://javct.net/v/dvmm-400,230,2026-06-06
