code,title,image_url,page_url,views,date_scraped
REAL-595-RM,Demon Fucking Hell Amayo Droplets [Uncensored L**ked],https://pic.javct.net/poster/04112026/2512ff603c.jpg,https://javct.net/v/real-595-rm,150,2026-06-19
SNOS-280,"My Son Has Taken A Liking To A Busty Maid, And My Son And I (the Father) Will Share Her. - Minami Haru",https://pic.javct.net/poster/05192026/22062d7ca0.jpg,https://javct.net/v/snos-280,140,2026-06-19
SNOS-260,Free Nurse: L-cup Nurse Has Her Weakness Exploited By A Patient And Is Fo**ed To Perform Breast Ejaculation And Rough Sex As Much As She Wants. - Kimura Aimi,https://pic.javct.net/poster/05192026/07870257a3.jpg,https://javct.net/v/snos-260,120,2026-06-19
IQQQ-51,"A Married Woman Teacher, Momose Jogasaki, Gets 10 Times Wetter During A Climax-inducing Lesson Where She Can't Make A Sound.",https://pic.javct.net/poster/05192026/3445d35fbc.jpg,https://javct.net/v/iqqq-51,100,2026-06-19
KSBJ-109,20 BEST Creampies For A Mature Woman With Dripping Breasts,https://pic.javct.net/poster/05192026/4c5e4c0050.jpg,https://javct.net/v/ksbj-109,244,2026-06-19
MIST-463-RM,Butt Hell Black Mask Big Tits 105cm - Big Butt 105cm Heavyweight Super Mature Woman [Uncensored L**ked],https://pic.javct.net/poster/20253001/1738813736.jpg,https://javct.net/v/mist-463-rm,162,2026-06-19
PAIS-044-RM,"A Sexless 30-year Celebrity Busty Wife, Emergency Appearance. Miraculous I-cup Glamorous Body Marika (53 Years Old) Lives In Yokohama [Uncensored L**ked]",https://pic.javct.net/poster/20230206/1686539690.jpg,https://javct.net/v/pais-044-rm,93,2026-06-19
MIST-462-RM,The Butt Hell Minamihata Souka [Uncensored L**ked],https://pic.javct.net/poster/20253001/1738813781.jpg,https://javct.net/v/mist-462-rm,158,2026-06-19
MIDD-967,Soap Lady Hitomi Jcup Super Delicious,https://pic.javct.net/poster/05192026/2f7f358cb8.jpg,https://javct.net/v/midd-967,120,2026-06-19
MIDE-003,Temptation Bra Life Special Hitomi Without Permission Of Ultra Tits Married,https://pic.javct.net/poster/05192026/b6cef0418b.jpg,https://javct.net/v/mide-003,150,2026-06-19
BOBB-380-RM,"Cup Super Beautiful Colossal Tits X 1 Experienced Person A Pure Country Girl Makes Her New Face Debut! Boin ""Natsuno Kohaku"" Box ~ Enjoy Freshly Picked Fruit With Milk Fetish Play! ~ [Uncensored L**ked]",https://pic.javct.net/poster/20230206/1686886725.jpg,https://javct.net/v/bobb-380-rm,120,2026-06-19
BHG-050-RM,Lcup Mami Hoshino Titty Fuck 10 Nuki! ~Waitress Edition~ [Uncensored L**ked],https://pic.javct.net/poster/20230206/1687578362.jpg,https://javct.net/v/bhg-050-rm,130,2026-06-19
KSBJ-037-RM,Barefoot Wife Aoki Kuroki [Uncensored L**ked],https://pic.javct.net/poster/20240807/1724029969.jpg,https://javct.net/v/ksbj-037-rm,113,2026-06-19
BOBB-379-RM,"Mcup Dirty Little Devil Advent! Squeezing Semen With Transcendence Milk Slutty Sex Activity Boin ""Yuria Yoshine"" Box2 [Uncensored L**ked]",https://pic.javct.net/poster/20230205/1685678661.jpg,https://javct.net/v/bobb-379-rm,120,2026-06-19
EMTH-262,Plump And Voluptuous Women 5-Hour 30-Minute Extended Special: Kneading And Cumming Inside Their Bountiful Breasts! A Thorough Sex Documentary Of 8 Voluptuous Mature Women With Insatiable Sex Drives,https://pic.javct.net/poster/05192026/b6aeb240c8.jpg,https://javct.net/v/emth-262,330,2026-06-19
CHCH-036-RM,A One-time Mistake Made By A Full-time Housewife With I-cup Breasts. A Full-time Housewife Who Had An Affair With A Young Man She Met On Social Media And Was Blackmailed By A Stolen Video Made Her Head To A Designated Apartment In The Suburbs Of Tokyo... [Uncensored L**ked],https://pic.javct.net/poster/20230206/1686974202.jpg,https://javct.net/v/chch-036-rm,125,2026-06-19
KRS-299-RM,"This is it! Amateur PREMIUM She's such a plain lady, but she's amazing. [Uncensored L**ked]",https://pic.javct.net/poster/05192026/7773658f07.jpg,https://javct.net/v/krs-299-rm,60,2026-06-19
NINE-072-RM,[Super A5 Rank Highest Grade Aged Meat Arrives] A Sexless Married Woman With Colossal J-Cup Breasts Frustration Accumulates And Fulfills Her Perverted Delusions. Reiko (48 Years Old) [Uncensored L**ked],https://pic.javct.net/poster/20230205/1685159927.jpg,https://javct.net/v/nine-072-rm,130,2026-06-19
NINE-073-RM,[Individual Shooting] I Called A Plump Office Lady Who Works In Shimbashi During Her Lunch Break At Work And Tried To Have Hidd** Camera Sex [Uncensored L**ked],https://pic.javct.net/poster/20230206/1686539811.jpg,https://javct.net/v/nine-073-rm,134,2026-06-19
DIVAS-092,"So, It’s Huge! ! Great Excavation! 115cmJ Cup! Blonde German Beauty With Big Breasts And More. The Weight Of The Breasts Is Over 3KG! !",https://pic.javct.net/poster/05192026/ed9d0033e5.jpg,https://javct.net/v/divas-092,187,2026-06-19
PAIS-045-RM,"An Active Civil Servant With Colossal Tits While Working, I-cup Is A Fierce Moody Who Masturbates In The Toilet At Work (City Hall) [Uncensored L**ked]",https://pic.javct.net/poster/20230206/1687839344.jpg,https://javct.net/v/pais-045-rm,129,2026-06-19
DIVAS-077,With Huge Breasts! All 100cm Over H Cup Or More! Blonde Beauty Super Best 10 People 4 Hours,https://pic.javct.net/poster/05192026/ff4fe008bc.jpg,https://javct.net/v/divas-077,240,2026-06-19
DIVAS-085,National Treasure-class Beauty Has Sex With Japanese People In A Thick Raw! Japanese People Make Full Use Of Very Naughty Erotic Busty Patsukin Beauties! !,https://pic.javct.net/poster/05192026/541c02541d.jpg,https://javct.net/v/divas-085,130,2026-06-19
DIVAS-087,Overseas Beautiful Mature Woman Has Sex With Japanese And Thick Raw! Eroboin Big Breasts And Style Is Too Dangerous! Japanese People Make The Most Of Beautiful Witches With The Strongest Libido! !,https://pic.javct.net/poster/05192026/406b2bee7c.jpg,https://javct.net/v/divas-087,228,2026-06-19
