code,title,image_url,page_url,views,date_scraped
NGOD-343,Graduation From The Domination Of That Giant Penis—the Day Of Graduation Finally Arrives For The Female Teacher Wife Who Was Dominated By Her Student's Huge Cock...,https://pic.javct.net/poster/05192026/8a86a82215.jpg,https://javct.net/v/ngod-343,120,2026-06-05
NGOD-344,Workplace Molestation: It Seems The Quiet Office Worker's Wife Is Being Subjected To Daily Lewd Acts By Her Boss With A Huge Penis...,https://pic.javct.net/poster/05192026/5ba242ac55.jpg,https://javct.net/v/ngod-344,130,2026-06-05
NHDTB-104-RM,I Will Make The Next Married Woman Who Visited With An Apology Of Noise Trouble Ashorekimae And Throat Firing In The Vertical Throat [Uncensored L**ked],https://pic.javct.net/poster/05192026/594fefeb21.jpg,https://javct.net/v/nhdtb-104-rm,130,2026-06-05
JUR-780,"My C**ldhood Friend, Who Used To Have A Crush On Me And Had A Small Penis, Had Evolved Into A Man With A Huge Penis And A Strong Sex Drive, So I Ended Up Getting Hooked On Raw Sex With Him Many Times...",https://pic.javct.net/poster/05192026/eb2ce7ba3a.jpg,https://javct.net/v/jur-780,120,2026-06-05
ROE-505,"I'm A Failure As A Mother, Having Been Penetrated To The Depths Of My Vagina By My Stepson's Huge Cock, Realizing I'm Just A Female.",https://pic.javct.net/poster/05192026/cbdc8a3170.jpg,https://javct.net/v/roe-505,120,2026-06-05
DVMM-400-RM,"Face Reveal MM Edition - For Exam Takers Only - The Magic Mirror: A Sloshing Blowjob Interview For Female Students Aiming To Get Into A Top University! 2. So Much Semen Is Ejaculated Into Their Mouths That They Can't Speak During Their Self-introductions! A Huge Cock Is Thrust Into Their Hot, Innocent Pussies After The Extreme Interview, Resulting In A Semen-drenched Sex Session! Everyone Gets Cummed Inside Special... [Uncensored L**ked]",https://pic.javct.net/poster/05192026/f1e2a137a5.jpg,https://javct.net/v/dvmm-400-rm,230,2026-06-05
FC2PPV-4912458,He thrusts a thick finger into her asshole and fucks a beautiful wife with a big ass and makes her do NTR for the first time and cums inside her.,https://pic.javct.net/poster/05192026/c7e404dfad.jpg,https://javct.net/v/fc2ppv-4912458,77,2026-06-05
MADM-169-RM,Order Immediately When You Want To Fuck A Slutty Married Woman Hibiki Otsuki Aiming For A Deliveryman Who Comes To The House [Uncensored L**ked],https://pic.javct.net/poster/20230206/1687579277.jpg,https://javct.net/v/madm-169-rm,110,2026-06-05
FC2PPV-4912528,"SEX with 20 people** Plump mature woman Reika's first 4P, sweaty carnal dance with huge breasts and big butt",https://pic.javct.net/poster/05192026/2daecbf8e7.jpg,https://javct.net/v/fc2ppv-4912528,72,2026-06-05
DVMM-016-RM,Lifting Of The Ban On Appearance! ! Magic Mirror Flight A Neat And Dignified Beauty Staff Working At A Top-Class Department Store Her First Jubo Jubo Vacuum No Handjob Edition Vol.02 Total 12 Shots! All 6 SEX Special! ! God Blow SEX That An Elegant Older Sister Sucks Ji ○ Port With Her Heart [Uncensored L**ked],https://pic.javct.net/poster/20230908/1694752828.jpg,https://javct.net/v/dvmm-016-rm,245,2026-06-05
SMOK-038-RM,"[Sucking Sexual Harassment] Alone In The Office During Overtime, A Gorilla-like Boss Continues To Suck And Train The Sensitive Clitoris Of A New, Hairless Office Lady, Hinata Yuna, Causing Her Legs To Tremble And Her Orgasmic Squirting To The Point Of Ecstasy. [Uncensored L**ked]",https://pic.javct.net/poster/05192026/2c67d8ec02.jpg,https://javct.net/v/smok-038-rm,158,2026-06-05
KSBJ-097,"My Brother's Wife Yuri Hikawa, My Sister-in-law Who Fell Into My Big Cock",https://pic.javct.net/poster/05192026/71b8def399.jpg,https://javct.net/v/ksbj-097,123,2026-06-05
DVMM-400,"Face Reveal MM Edition - For Exam Takers Only - The Magic Mirror: A Sloshing Blowjob Interview For Female Students Aiming To Get Into A Top University! 2. So Much Semen Is Ejaculated Into Their Mouths That They Can't Speak During Their Self-introductions! A Huge Cock Is Thrust Into Their Hot, Innocent Pussies After The Extreme Interview, Resulting In A Semen-drenched Sex Session! Everyone Gets Cummed Inside Special...",https://pic.javct.net/poster/05192026/f1e2a137a5.jpg,https://javct.net/v/dvmm-400,230,2026-06-05
DVMM-408-RM,"Instant Fuck With A Big-assed Athlete College Girl! The Next Day, After Intensely Thrusting My Big Dick Into The Ass Of My Swimming Club Student In Her Swimsuit, Making Her Convulse And Orgasm Repeatedly... She Was In Full Heat Mode And Seduced Me, Letting Me Cum Inside Her Multiple Times. - Yui Hina [Uncensored L**ked]",https://pic.javct.net/poster/05192026/99d3969b43.jpg,https://javct.net/v/dvmm-408-rm,155,2026-06-05
DFE-114-RM,I Would Like You To Ejaculate Deep In My Throat. Please Allow Me To Swallow Your Semen. () [Uncensored L**ked],https://pic.javct.net/poster/05192026/b9aea38eb0.jpg,https://javct.net/v/dfe-114-rm,191,2026-06-05
SMOK-038,"[Sucking Sexual Harassment] Alone In The Office During Overtime, A Gorilla-like Boss Continues To Suck And Train The Sensitive Clitoris Of A New, Hairless Office Lady, Hinata Yuna, Causing Her Legs To Tremble And Her Orgasmic Squirting To The Point Of Ecstasy.",https://pic.javct.net/poster/05192026/2c67d8ec02.jpg,https://javct.net/v/smok-038,158,2026-06-05
MIDA-647-RM,"Giant Dick NTR: A Gym Teacher With A Huge Cock Forces His Beloved Slender Club Manager's Undeveloped Pussy Deep Inside, Thrusting And Making Her Arch Her Back And Twitch As She Orgasms Against Her Will. [Uncensored L**ked]",https://pic.javct.net/poster/05192026/f5c2dc7630.jpg,https://javct.net/v/mida-647-rm,140,2026-06-05
STOL-146-RM,"As Soon As She Realizes A Customer Has A Huge Penis, The Dispatched Escort Girl Performs The Act, Which Is Against The Shop's Rules. [Uncensored L**ked]",https://pic.javct.net/poster/05192026/bd076b98ef.jpg,https://javct.net/v/stol-146-rm,220,2026-06-05
TYSF-034-RM,"The Men Who Violated Me A Few Years Ago Are Right In Front Of My Eyes Again... On Their Way Home From Musho, The To**ure Devil's Skewered W Seeding Press From Morning Till Night... Sumire Kuramoto [Uncensored L**ked]",https://pic.javct.net/poster/20222612/1672975726.jpg,https://javct.net/v/tysf-034-rm,120,2026-06-05
MIST-440-RM,Overshot Aunt Sex For Aunt Enthusiasts By Aunts Aunt Fumino 60 Years Old Fumino Ishikawa [Uncensored L**ked],https://pic.javct.net/poster/20243105/1717609427.jpg,https://javct.net/v/mist-440-rm,168,2026-06-05
MIDA-659-RM,"Pretending To Listen To Her Best Friend's Girlfriend's Troubles, She Drugs Her With Aphrodisiacs, Remotely Vibrates And Trains Her, Then Plunges Her Into A Swamp With Her Huge Cock, Developing Her Peeing, Weak Pussy Into An NTR Kawaguchi Sakura [Uncensored L**ked]",https://pic.javct.net/poster/05192026/add45207a5.jpg,https://javct.net/v/mida-659-rm,140,2026-06-05
STOL-146,"As Soon As She Realizes A Customer Has A Huge Penis, The Dispatched Escort Girl Performs The Act, Which Is Against The Shop's Rules.",https://pic.javct.net/poster/05192026/bd076b98ef.jpg,https://javct.net/v/stol-146,220,2026-06-05
DFE-114,I Would Like You To Ejaculate Deep In My Throat. Please Allow Me To Swallow Your Semen. (),https://pic.javct.net/poster/05192026/b9aea38eb0.jpg,https://javct.net/v/dfe-114,191,2026-06-05
MIDA-659,"Pretending To Listen To Her Best Friend's Girlfriend's Troubles, She Drugs Her With Aphrodisiacs, Remotely Vibrates And Trains Her, Then Plunges Her Into A Swamp With Her Huge Cock, Developing Her Peeing, Weak Pussy Into An NTR Kawaguchi Sakura",https://pic.javct.net/poster/05192026/add45207a5.jpg,https://javct.net/v/mida-659,140,2026-06-05
