code,title,image_url,page_url,views,date_scraped
SDDE-417-RM,Sexual Desire Specialist Sex Outpatient Clinic 10 Real Creampies Department. Cumming In The Pussies Of 6 Nurses Special [Uncensored L**ked],https://pic.javct.net/poster/20220406/1655221707.jpg,https://javct.net/v/sdde-417-rm,225,2026-06-10
START-569-RM,"[The Diversity Of Cumming And Ultimate Orgasm] Instant Fuck, Big Dick, Flexible Fuck Nanase Atsushi [Uncensored L**ked]",https://pic.javct.net/poster/05192026/b1e079e316.jpg,https://javct.net/v/start-569-rm,155,2026-06-10
START-569,"[The Diversity Of Cumming And Ultimate Orgasm] Instant Fuck, Big Dick, Flexible Fuck Nanase Atsushi",https://pic.javct.net/poster/05192026/b1e079e316.jpg,https://javct.net/v/start-569,155,2026-06-10
START-583-RM,"It's Guaranteed To Make You Cum! Beyond The Peak Of Orgasm, A Truly Mind-blowing Trance Of Incontinence And Spasms, A Relentless, Hard Piston Thrust That Continues Even As You Cry And Scream, Tenjin Hagoromo [Uncensored L**ked]",https://pic.javct.net/poster/05192026/e5067eee06.jpg,https://javct.net/v/start-583-rm,115,2026-06-10
BIGC-007-RM,"[Beautiful Young Wife Is The Wife Of The Company President At Her Part-time Job] A Proud Celebrity Woman... Begs On Her Knees For A Huge Cock, Falls Into A Submissive State, Suffocates During Anal Sex And Is C**ked While Being Intensely Piston-fucked, Her Beauty Crumbling As She Reaches A Trance Of Orgasmic Frenzy. [Uncensored L**ked]",https://pic.javct.net/poster/05192026/c231fb5db5.jpg,https://javct.net/v/bigc-007-rm,197,2026-06-10
START-583,"It's Guaranteed To Make You Cum! Beyond The Peak Of Orgasm, A Truly Mind-blowing Trance Of Incontinence And Spasms, A Relentless, Hard Piston Thrust That Continues Even As You Cry And Scream, Tenjin Hagoromo",https://pic.javct.net/poster/05192026/e5067eee06.jpg,https://javct.net/v/start-583,115,2026-06-10
SSNI-035,Shaved Ban!Hairless Slender Big Tits Body First Shaving Fetishes Picture V Yume No Aikaka,https://pic.javct.net/poster/05192026/0b8450cfdf.jpg,https://javct.net/v/ssni-035,150,2026-06-10
BLOR-220-RM,An Izakaya Poster Girl She's Usually Cool But Her Shy Smile Is Super Cute A Professional Unequaled Cock Makes You Remember How To Orgasm In Real Life [Uncensored L**ked],https://pic.javct.net/poster/20230206/1687578241.jpg,https://javct.net/v/blor-220-rm,130,2026-06-10
EKDV-820-RM,"When I Woke Up This Morning, I Had Become... Konami Aya!! [Uncensored L**ked]",https://pic.javct.net/poster/05192026/b905bb6779.jpg,https://javct.net/v/ekdv-820-rm,140,2026-06-10
NGOD-341-RM,"A Story Of Impregnation In Tokyo: Impregnated By My Husband's Stepson's Perfectly Matched, Circumcised, Huge Penis... [Uncensored L**ked]",https://pic.javct.net/poster/05192026/c38a6773e6.jpg,https://javct.net/v/ngod-341-rm,120,2026-06-10
IENE-973-RM,It Was Such A Dirty Thing When I Got A Black Mecca ○ P With A Beautiful Married Woman Found In Shinjuku. [Uncensored L**ked],https://pic.javct.net/poster/05192026/7480b62826.jpg,https://javct.net/v/iene-973-rm,130,2026-06-10
EKDV-820,"When I Woke Up This Morning, I Had Become... Konami Aya!!",https://pic.javct.net/poster/05192026/b905bb6779.jpg,https://javct.net/v/ekdv-820,140,2026-06-10
FC2PPV-4915883,[Public] A beautiful woman with beautiful breasts and a nice butt who is salivating with a huge black dick and two black men with a big dick destroy it and have a 3P to make them creampie,https://pic.javct.net/poster/05192026/16cac15ed8.jpg,https://javct.net/v/fc2ppv-4915883,71,2026-06-10
NGOD-341,"A Story Of Impregnation In Tokyo: Impregnated By My Husband's Stepson's Perfectly Matched, Circumcised, Huge Penis...",https://pic.javct.net/poster/05192026/c38a6773e6.jpg,https://javct.net/v/ngod-341,120,2026-06-10
BIGC-007,"[Beautiful Young Wife Is The Wife Of The Company President At Her Part-time Job] A Proud Celebrity Woman... Begs On Her Knees For A Huge Cock, Falls Into A Submissive State, Suffocates During Anal Sex And Is C**ked While Being Intensely Piston-fucked, Her Beauty Crumbling As She Reaches A Trance Of Orgasmic Frenzy.",https://pic.javct.net/poster/05192026/c231fb5db5.jpg,https://javct.net/v/bigc-007,197,2026-06-10
JUR-780-RM,"My C**ldhood Friend, Who Used To Have A Crush On Me And Had A Small Penis, Had Evolved Into A Man With A Huge Penis And A Strong Sex Drive, So I Ended Up Getting Hooked On Raw Sex With Him Many Times... [Uncensored L**ked]",https://pic.javct.net/poster/05192026/eb2ce7ba3a.jpg,https://javct.net/v/jur-780-rm,120,2026-06-10
NSFS-485,I Fell For A Man With A Bigger Cock Than My Husband... I Can't Tell You. - Sakumatsuna,https://pic.javct.net/poster/05192026/ffa5755ae3.jpg,https://javct.net/v/nsfs-485,107,2026-06-10
NGOD-345,My Grandfather And My Mother... My Beloved And Admired Mother's Body Is Being Touched By That Perverted Old Man...,https://pic.javct.net/poster/05192026/c846bb0fcd.jpg,https://javct.net/v/ngod-345,120,2026-06-10
NGOD-344-RM,Workplace Molestation: It Seems The Quiet Office Worker's Wife Is Being Subjected To Daily Lewd Acts By Her Boss With A Huge Penis... [Uncensored L**ked],https://pic.javct.net/poster/05192026/5ba242ac55.jpg,https://javct.net/v/ngod-344-rm,130,2026-06-10
ROE-505-RM,"I'm A Failure As A Mother, Having Been Penetrated To The Depths Of My Vagina By My Stepson's Huge Cock, Realizing I'm Just A Female. [Uncensored L**ked]",https://pic.javct.net/poster/05192026/cbdc8a3170.jpg,https://javct.net/v/roe-505-rm,120,2026-06-10
BBTU-073-RM,Big Breasts Girl Screaming Throat Pussy Yuri Aise [Uncensored L**ked],https://pic.javct.net/poster/20231711/1702699572.jpg,https://javct.net/v/bbtu-073-rm,110,2026-06-10
NGOD-345-RM,My Grandfather And My Mother... My Beloved And Admired Mother's Body Is Being Touched By That Perverted Old Man... [Uncensored L**ked],https://pic.javct.net/poster/05192026/c846bb0fcd.jpg,https://javct.net/v/ngod-345-rm,120,2026-06-10
NGOD-343,Graduation From The Domination Of That Giant Penis—the Day Of Graduation Finally Arrives For The Female Teacher Wife Who Was Dominated By Her Student's Huge Cock...,https://pic.javct.net/poster/05192026/8a86a82215.jpg,https://javct.net/v/ngod-343,120,2026-06-10
NGOD-344,Workplace Molestation: It Seems The Quiet Office Worker's Wife Is Being Subjected To Daily Lewd Acts By Her Boss With A Huge Penis...,https://pic.javct.net/poster/05192026/5ba242ac55.jpg,https://javct.net/v/ngod-344,130,2026-06-10
