code,title,image_url,page_url,views,date_scraped
NGOD-348,"A Virile, Sexually Insatiable Grandfather And His Demure Daughter-in-law. The Grandfather's... Thing... Is So Impressive That She Becomes Addicted... A Forbidden Life Together That They Can't Stop.",https://pic.javct.net/poster/07052026/41f820f0b3.jpg,https://javct.net/v/ngod-348,130,2026-07-10
NKKD-364,"Big Dick Incest: Mother With Huge Breasts And Dark Skin Seduced By Her Son's Hard, Erect, Circumcised Cock.",https://pic.javct.net/poster/07052026/59281dd1ff.jpg,https://javct.net/v/nkkd-364,120,2026-07-10
ROE-520,"My Stepson's Huge Cock Penetrated Me To The Depths Of My Vagina, And I Was Reminded That I'm Just A Female, A Failure As A Mother. - Fuyuka Hoshi",https://pic.javct.net/poster/07052026/0436f02511.jpg,https://javct.net/v/roe-520,120,2026-07-10
NGOD-346,"The Married Woman In The School Infirmary Gets Off On The Virile Students' Huge, Circumcised Cocks...",https://pic.javct.net/poster/07052026/a95eb6cb6d.jpg,https://javct.net/v/ngod-346,120,2026-07-10
NGOD-347-RM,"Fo**ed To Tutor Her Husband's Boss...the Wife Gets Pregnant By The Boss's And His Son's Two Enormous, Thick Penises. [Uncensored L**ked]",https://pic.javct.net/poster/07052026/454a4da06f.jpg,https://javct.net/v/ngod-347-rm,140,2026-07-10
NGOD-347,"Fo**ed To Tutor Her Husband's Boss...the Wife Gets Pregnant By The Boss's And His Son's Two Enormous, Thick Penises.",https://pic.javct.net/poster/07052026/454a4da06f.jpg,https://javct.net/v/ngod-347,140,2026-07-10
SNOS-279,"""Oh, There You Are."" My Virgin, Bottom-of-the-barrel Brother Has Zero Presence And Is Less Than Air To Me, But His Sex Drive Seems Unnecessarily Strong, So I'll Lend Him My Pussy For Free. - Marin Mita",https://pic.javct.net/poster/07052026/c5c9376bc4.jpg,https://javct.net/v/snos-279,120,2026-07-10
BLOR-212-RM,"An Arasa Girl Who Has A L**ita Face That Makes You Think It's A Little Unbelievable Her Personality And Demeanor Are Super Cute, But Her Libido Is Amazing... [Uncensored L**ked]",https://pic.javct.net/poster/20233001/1677298122.jpg,https://javct.net/v/blor-212-rm,130,2026-07-10
FC2PPV-4935422,[Face showing/Ekiben] [Public] F-cup beauty with beautiful breasts and nice butt is made to divulge with a big black cock for the first time in an ekiben and is creampied and fucked,https://pic.javct.net/poster/07052026/d8fb1b8286.jpg,https://javct.net/v/fc2ppv-4935422,26,2026-07-10
NKKD-220-RM,Ideal Married Life In The Countryside...The Perfect Chance For This Thirsty Wife To Get A Taste Of Local Farmers' Huge Cocks Inside Her Chitose Yuki [Uncensored L**ked],https://static.javct.net/poster/nkkd-220.jpg,https://javct.net/v/nkkd-220-rm,124,2026-07-10
MIST-126-RM,Show Off The Big Penis To Handjob Deriheru Miss Your Touch Ban! As Bareback In The Place That Became Addicted To Big Penis! Until You Put Rainy Day Raw Medium To Handjob Miss Full Voyeur! Five [Uncensored L**ked],https://pic.javct.net/poster/01202026/1772510088.jpg,https://javct.net/v/mist-126-rm,160,2026-07-10
BMW-250,Direct Dicking Deep Down The Womb! 108 Consecutive Carnal Mating Press Clips!,https://pic.javct.net/poster/07052026/d327cf5784.jpg,https://javct.net/v/bmw-250,240,2026-07-10
CEMD-331-RM,Autonomic Nerves Flew Away! Sweaty Climax Super Iki SEX! ! 2 Anna Hanayagi [Uncensored L**ked],https://pic.javct.net/poster/20230205/1683347590.jpg,https://javct.net/v/cemd-331-rm,137,2026-07-10
SDAB-175-RM,Not Even 5' Tall: Itty Bitty Girl With Colossal Tits Takes Massive Dicks - Teeny Tiny Teen Pounded By Older Guys Until She Cums Amu Ohara [Uncensored L**ked],https://static.javct.net/poster/1618308922.jpg,https://javct.net/v/sdab-175-rm,132,2026-07-10
MIST-122-RM,Show Off The Big Penis To Handjob Deriheru Miss Your Touch Ban!As Bareback In The Place That Became Addicted To Big Penis!Until You Put Rainy Day Raw Medium To Handjob Miss Full Voyeur!Four [Uncensored L**ked],https://pic.javct.net/poster/01202026/1772334321.jpg,https://javct.net/v/mist-122-rm,160,2026-07-10
HJMO-603-RM,"Big Ass Athlete Girls Only! Fixed Dildo Guessing Game Dominant Pole Ippon Game! 1 Million Yen Prize If You Hit It! If You Remove It, You Will Immediately Get A Big Cock On The Spot! Sensitive Ma  Co Immediately After Orgasm With A Dildo Can't Refuse To Get Conceived And Vaginal Cum Shot! ? [Uncensored L**ked]",https://pic.javct.net/poster/20230302/1679024847.jpg,https://javct.net/v/hjmo-603-rm,160,2026-07-10
MIST-501-RM,"Obashot Auntie's, By Auntie, For Auntie Maniacs, Auntie Sex Mami Auntie 40 Years Old Kotomiya Mami [Uncensored L**ked]",https://pic.javct.net/poster/07052026/59fe786f63.jpg,https://javct.net/v/mist-501-rm,199,2026-07-10
MIST-501,"Obashot Auntie's, By Auntie, For Auntie Maniacs, Auntie Sex Mami Auntie 40 Years Old Kotomiya Mami",https://pic.javct.net/poster/07052026/59fe786f63.jpg,https://javct.net/v/mist-501,199,2026-07-10
DVMM-416-RM,"Immediately Had Sex With A Pale-skinned, Big-assed House Cleaning Lady! The Married Woman, Who Was Captivated By My Big Dick, Showed Up Unannounced The Next Day, So I Gave Her Multiple Orgasms And Cummed Inside Her Until She Was Satisfied. 52 Arioka Miu [Uncensored L**ked]",https://pic.javct.net/poster/05192026/ffbf8a26eb.jpg,https://javct.net/v/dvmm-416-rm,165,2026-07-10
START-245-SUB,"""Always Having Sex With MINAMO"" A Big Dick Is Inserted All Day Long From Morning To Night, And It's Instant Sex [English Subtitle]",https://pic.javct.net/poster/20253001/1738600807.jpg,https://javct.net/v/start-245-sub,135,2026-07-10
CEMD-326-RM,Autonomic Nerves Flew Away! Sweaty Climax Super Iki SEX! ! Cocona Yuki [Uncensored L**ked],https://pic.javct.net/poster/20230104/1682134911.jpg,https://javct.net/v/cemd-326-rm,138,2026-07-10
MIDA-683-RM,Ooh Voice Burst Convulsions Trembling Unleashed Cumshot Orgasm Orgy Special Shiraishi Nami [Uncensored L**ked],https://pic.javct.net/poster/05192026/cdc9b2970b.jpg,https://javct.net/v/mida-683-rm,150,2026-07-10
FC2PPV-4933101,[First shot] A beautiful woman with beautiful breasts and a beautiful butt had intense NTR sex with a big-cocked black man in front of her boyfriend for the first time,https://pic.javct.net/poster/05192026/631bf33a00.jpg,https://javct.net/v/fc2ppv-4933101,48,2026-07-10
GVH-856,Mother And Son R**e Miho Tsuno,https://pic.javct.net/poster/05192026/a9c294a4c9.jpg,https://javct.net/v/gvh-856,120,2026-07-10
