code,title,image_url,page_url,views,date_scraped
CHCH-030-RM,Grandma And Her Grandson Have A Soothing Colossal Breasted Beautiful Witch Who Can't Believe She Has A Grandc**ld Her Sperm Krappo Small Devil Rich Breast Sex Activity Hisako (56 Years Old/J Cup) [Uncensored L**ked],https://pic.javct.net/poster/20233001/1676689069.jpg,https://javct.net/v/chch-030-rm,110,2026-07-13
KTKC-157-RM,"During Her School Days, She Went Up In Flames On SNS And Was Toyed With By Her Classmates As A Milk Urinal. Unfortunate Reiwa Edition K-cup Busty Sober C**ld, Second Virgin DEBUT Ayako (super Part-time Clerk) [Uncensored L**ked]",https://pic.javct.net/poster/20233001/1675480468.jpg,https://javct.net/v/ktkc-157-rm,125,2026-07-13
UMAN-007-RM,"No Bra, No Panties, Huge Boobs, Slutty Housewife: The Story Of How The Neighbor's Wife, With Her 120cm K-cup Breasts And Voluptuous Butt, Seduced Me Without A Bra Or Panties. [Uncensored L**ked]",https://pic.javct.net/poster/07052026/0bdb4a06e3.jpg,https://javct.net/v/uman-007-rm,120,2026-07-13
SONE-678-SUB,"See-through, Wet, And Slipping Out! 5 Situations Where A Clothed Big-breasted Woman's Soft J-cup Breasts Unconsciously Tempt You Shino Mayu [English Subtitle]",https://pic.javct.net/poster/20250903/1743704183.jpg,https://javct.net/v/sone-678-sub,120,2026-07-13
PPPD-519-RM,Busty Daughter Became Even If Les  Up Pies To Ok The World Hitomi [Uncensored L**ked],https://pic.javct.net/poster/20221904/1653969766.jpg,https://javct.net/v/pppd-519-rm,120,2026-07-13
NDRA-088-RM,I'm Fucking My Girlfriend's Mom In Secret... Iori Yuki [Uncensored L**ked],https://static.javct.net/poster/ndra-088.jpg,https://javct.net/v/ndra-088-rm,120,2026-07-13
NINE-123,"A Voluptuous Gem! A Big, Muscular, Swimmer-type Housewife With J-cup Breasts Makes An Emergency Appearance After Being Sexually Frustrated.",https://pic.javct.net/poster/07052026/eea4dc901f.jpg,https://javct.net/v/nine-123,240,2026-07-13
AVSA-324-RM,Super Close-Up Big Tit Bunny Big Tits Voluptuous Anal Fucking Yuria Yoshine [Uncensored L**ked],https://pic.javct.net/poster/20243105/1720232153.jpg,https://javct.net/v/avsa-324-rm,151,2026-07-13
SAN-471-RM,"Prices Are So High I Can't Make Ends Meet! Even A Single Rice Ball At The Convenience Store Costs About 200 Yen, It's Just Impossible. 002 Marina, Riku [Uncensored L**ked]",https://pic.javct.net/poster/07052026/2777af4501.jpg,https://javct.net/v/san-471-rm,93,2026-07-13
AKID-064-RM,"After A College Student Limited Drinking Party, Take It Back To The Room To Take A Voyeur In The Room And Shut Up To AV No. 28 Filthy JD Older Sister Hen Mana / I Cup / 21 Years Old / H Cup / 21 Years Old [Uncensored L**ked]",https://pic.javct.net/poster/07052026/3d2f1e92fd.jpg,https://javct.net/v/akid-064-rm,220,2026-07-13
YAKO-095-RM,"Oh, My Beautiful, Chubby, Masochistic Wife Is Falling Into Depravity! A Story Of Obscene Ascension In Shinjuku. 6 Sex Scenes, 4 Hours [Uncensored L**ked]",https://pic.javct.net/poster/05192026/954df975c0.jpg,https://javct.net/v/yako-095-rm,240,2026-07-13
MAQQ-014,"[A Must-see For Enthusiasts] Slime K-cup Busty Young Wife, L**ked. Five Intense Sex Scenes With A Frustrated, Fair-skinned, Soothing Amateur.",https://pic.javct.net/poster/07052026/6fba3c457d.jpg,https://javct.net/v/maqq-014,240,2026-07-13
UMAN-007,"No Bra, No Panties, Huge Boobs, Slutty Housewife: The Story Of How The Neighbor's Wife, With Her 120cm K-cup Breasts And Voluptuous Butt, Seduced Me Without A Bra Or Panties.",https://pic.javct.net/poster/07052026/0bdb4a06e3.jpg,https://javct.net/v/uman-007,120,2026-07-13
BOBB-367-RM,"A Dental Assistant Who Pushes Jcup Colossal Tits Against Her Face Secretly Healing Boobs Service & Intercourse Treatment! Boin ""Suwon Misono"" Box6 [Uncensored L**ked]",https://pic.javct.net/poster/20230302/1678419927.jpg,https://javct.net/v/bobb-367-rm,120,2026-07-13
BANK-113-RM,Busty Married Woman Onsen Dating 30 Years Old Mikuru With Colossal Tits And Natural J Cups [Uncensored L**ked],https://pic.javct.net/poster/20230302/1678427887.jpg,https://javct.net/v/bank-113-rm,125,2026-07-13
AVSA-321-RM,"103cm Glamorous Beautiful Big Tits Cosplayer! She Shakes Her Big Tits And Cums Over And Over Again With The Guys From Her Offline Club, And Has A Cum-bukkake Gangbang Creampie Sex! Aoi Hazuki [Uncensored L**ked]",https://pic.javct.net/poster/20243105/1719024545.jpg,https://javct.net/v/avsa-321-rm,120,2026-07-13
NGOD-349,"A Voluptuous Stepmother Impregnated By Her Nerdy Son... Her Husband Is Unaware Of Her Secret, Gushing Vaginal Fluids And Copious Amounts Of Semen During Incestuous Intercourse Within The Family.",https://pic.javct.net/poster/07052026/b3547007e2.jpg,https://javct.net/v/ngod-349,140,2026-07-13
DOA-035-RM,Muchimuchi Colossal I Cup L**ita Beautiful Girl [Uncensored L**ked],https://pic.javct.net/poster/20233001/1677297875.jpg,https://javct.net/v/doa-035-rm,140,2026-07-13
PAIS-039-RM,"A Charismatic Busty Prostitute, 12 Shots Of A Slut, Will Be Released Private Video. [Uncensored L**ked]",https://pic.javct.net/poster/20233001/1677466834.jpg,https://javct.net/v/pais-039-rm,128,2026-07-13
NKKD-220-RM,Ideal Married Life In The Countryside...The Perfect Chance For This Thirsty Wife To Get A Taste Of Local Farmers' Huge Cocks Inside Her Chitose Yuki [Uncensored L**ked],https://static.javct.net/poster/nkkd-220.jpg,https://javct.net/v/nkkd-220-rm,124,2026-07-13
SONE-666-SUB,Fully Squirting Nagi Hikaru [English Subtitle],https://pic.javct.net/poster/20250903/1743704902.jpg,https://javct.net/v/sone-666-sub,120,2026-07-13
NINE-067-RM,[Highest Grade Super Aged Meat Mature Woman] Kayo (50 Years Old) Carnivorous Colossal Breasts J-cup Mother Who Overprotects Her Doting Son Sexually [Uncensored L**ked],https://pic.javct.net/poster/20233001/1677466895.jpg,https://javct.net/v/nine-067-rm,111,2026-07-13
NDRA-046-RM,The Wife Who Became A Whore For My Neighbor 8 Her Nipple Was Prime For Fondling And Fucking Monami Takarada [Uncensored L**ked],https://pic.javct.net/poster/20221202/1646654725.jpg,https://javct.net/v/ndra-046-rm,132,2026-07-13
FC2PPV-4931572,"*Ends while supplies last *19-year-old M cup Spanish x Japanese half-gravure idol Unavoidable titflash rush due to her size that exceeds the standard Shocking mass creampie video *Original video will be sent on a first-come, first-served basis",https://pic.javct.net/poster/07052026/1811d7a20c.jpg,https://javct.net/v/fc2ppv-4931572,66,2026-07-13
