code,title,image_url,page_url,views,date_scraped
CRNX-263-RM,[4K] I cuckolded a single man in a racy swimsuit... Hikaru Miyanishi [Uncensored L**ked],https://pic.javct.net/poster/05192026/3d8b290b39.jpg,https://javct.net/v/crnx-263-rm,61,2026-06-12
CRNX-262-RM,[4K] Momo Shiraishi sexually assaults a female student in uniform at home [Uncensored L**ked],https://pic.javct.net/poster/05192026/82c2f96e02.jpg,https://javct.net/v/crnx-262-rm,51,2026-06-12
CRNX-264-RM,[4K] Niece's Bold Temptation! Transparent Bunny Sex Naruto with My Favorite Uncle [Uncensored L**ked],https://pic.javct.net/poster/05192026/6923370fdc.jpg,https://javct.net/v/crnx-264-rm,42,2026-06-12
FNS-225-RM,Big-ass gym trainer's back piston 4SEX that only attracts big dicks Rui Shinomiya [Uncensored L**ked],https://pic.javct.net/poster/05192026/2e459222c8.jpg,https://javct.net/v/fns-225-rm,150,2026-06-12
FC2PPV-4918326,"[Falling in love with a random smile, the temptation of long black hair] Hitomi, 18 years old with divine style, is in agony for the first time with a big cock over 20 cm and has a large amount of creampie, and we have captured it on camera",https://pic.javct.net/poster/05192026/07035db15e.jpg,https://javct.net/v/fc2ppv-4918326,44,2026-06-12
SW-904-RM,"When I Visited My Friend's Share House, It Was Full Of Beautiful Older Sisters With No Bra And Big Tits! ? I Was Nervous, But My Older Sister Gently Treated Me And I Got A Full Erection With Her Tits In Full View From Between Her Clothes. I Was Treated Well! ! [Uncensored L**ked]",https://pic.javct.net/poster/20230207/1688614376.jpg,https://javct.net/v/sw-904-rm,177,2026-06-12
FNS-225,Big-ass gym trainer's back piston 4SEX that only attracts big dicks Rui Shinomiya,https://pic.javct.net/poster/05192026/2e459222c8.jpg,https://javct.net/v/fns-225,150,2026-06-12
CRNX-262,[4K] Momo Shiraishi sexually assaults a female student in uniform at home,https://pic.javct.net/poster/05192026/82c2f96e02.jpg,https://javct.net/v/crnx-262,51,2026-06-12
CRNX-264,[4K] Niece's Bold Temptation! Transparent Bunny Sex Naruto with My Favorite Uncle,https://pic.javct.net/poster/05192026/6923370fdc.jpg,https://javct.net/v/crnx-264,42,2026-06-12
CRNX-263,[4K] I cuckolded a single man in a racy swimsuit... Hikaru Miyanishi,https://pic.javct.net/poster/05192026/3d8b290b39.jpg,https://javct.net/v/crnx-263,61,2026-06-12
SDDE-417-RM,Sexual Desire Specialist Sex Outpatient Clinic 10 Real Creampies Department. Cumming In The Pussies Of 6 Nurses Special [Uncensored L**ked],https://pic.javct.net/poster/20220406/1655221707.jpg,https://javct.net/v/sdde-417-rm,225,2026-06-12
START-569-RM,"[The Diversity Of Cumming And Ultimate Orgasm] Instant Fuck, Big Dick, Flexible Fuck Nanase Atsushi [Uncensored L**ked]",https://pic.javct.net/poster/05192026/b1e079e316.jpg,https://javct.net/v/start-569-rm,155,2026-06-12
START-569,"[The Diversity Of Cumming And Ultimate Orgasm] Instant Fuck, Big Dick, Flexible Fuck Nanase Atsushi",https://pic.javct.net/poster/05192026/b1e079e316.jpg,https://javct.net/v/start-569,155,2026-06-12
START-583-RM,"It's Guaranteed To Make You Cum! Beyond The Peak Of Orgasm, A Truly Mind-blowing Trance Of Incontinence And Spasms, A Relentless, Hard Piston Thrust That Continues Even As You Cry And Scream, Tenjin Hagoromo [Uncensored L**ked]",https://pic.javct.net/poster/05192026/e5067eee06.jpg,https://javct.net/v/start-583-rm,115,2026-06-12
BIGC-007-RM,"[Beautiful Young Wife Is The Wife Of The Company President At Her Part-time Job] A Proud Celebrity Woman... Begs On Her Knees For A Huge Cock, Falls Into A Submissive State, Suffocates During Anal Sex And Is C**ked While Being Intensely Piston-fucked, Her Beauty Crumbling As She Reaches A Trance Of Orgasmic Frenzy. [Uncensored L**ked]",https://pic.javct.net/poster/05192026/c231fb5db5.jpg,https://javct.net/v/bigc-007-rm,197,2026-06-12
START-583,"It's Guaranteed To Make You Cum! Beyond The Peak Of Orgasm, A Truly Mind-blowing Trance Of Incontinence And Spasms, A Relentless, Hard Piston Thrust That Continues Even As You Cry And Scream, Tenjin Hagoromo",https://pic.javct.net/poster/05192026/e5067eee06.jpg,https://javct.net/v/start-583,115,2026-06-12
SSNI-035,Shaved Ban!Hairless Slender Big Tits Body First Shaving Fetishes Picture V Yume No Aikaka,https://pic.javct.net/poster/05192026/0b8450cfdf.jpg,https://javct.net/v/ssni-035,150,2026-06-12
BLOR-220-RM,An Izakaya Poster Girl She's Usually Cool But Her Shy Smile Is Super Cute A Professional Unequaled Cock Makes You Remember How To Orgasm In Real Life [Uncensored L**ked],https://pic.javct.net/poster/20230206/1687578241.jpg,https://javct.net/v/blor-220-rm,130,2026-06-12
EKDV-820-RM,"When I Woke Up This Morning, I Had Become... Konami Aya!! [Uncensored L**ked]",https://pic.javct.net/poster/05192026/b905bb6779.jpg,https://javct.net/v/ekdv-820-rm,140,2026-06-12
NGOD-341-RM,"A Story Of Impregnation In Tokyo: Impregnated By My Husband's Stepson's Perfectly Matched, Circumcised, Huge Penis... [Uncensored L**ked]",https://pic.javct.net/poster/05192026/c38a6773e6.jpg,https://javct.net/v/ngod-341-rm,120,2026-06-12
IENE-973-RM,It Was Such A Dirty Thing When I Got A Black Mecca ○ P With A Beautiful Married Woman Found In Shinjuku. [Uncensored L**ked],https://pic.javct.net/poster/05192026/7480b62826.jpg,https://javct.net/v/iene-973-rm,130,2026-06-12
EKDV-820,"When I Woke Up This Morning, I Had Become... Konami Aya!!",https://pic.javct.net/poster/05192026/b905bb6779.jpg,https://javct.net/v/ekdv-820,140,2026-06-12
FC2PPV-4915883,[Public] A beautiful woman with beautiful breasts and a nice butt who is salivating with a huge black dick and two black men with a big dick destroy it and have a 3P to make them creampie,https://pic.javct.net/poster/05192026/16cac15ed8.jpg,https://javct.net/v/fc2ppv-4915883,71,2026-06-12
NGOD-341,"A Story Of Impregnation In Tokyo: Impregnated By My Husband's Stepson's Perfectly Matched, Circumcised, Huge Penis...",https://pic.javct.net/poster/05192026/c38a6773e6.jpg,https://javct.net/v/ngod-341,120,2026-06-12
