code,title,image_url,page_url,views,date_scraped
NGOD-341-RM,"A Story Of Impregnation In Tokyo: Impregnated By My Husband's Stepson's Perfectly Matched, Circumcised, Huge Penis... [Uncensored L**ked]",https://pic.javct.net/poster/05192026/c38a6773e6.jpg,https://javct.net/v/ngod-341-rm,120,2026-06-07
ALDN-588-RM,My Mother-in-law Is So Much Better Than My Wife... Sayuri Hayama [Uncensored L**ked],https://pic.javct.net/poster/05192026/17f54cfcd0.jpg,https://javct.net/v/aldn-588-rm,125,2026-06-07
ROYD-327-RM,"I Kneaded My Older Sister's Big Ass, Which Was Carelessly Showing Off Her Black Pantyhose, And Ended Up Cumming Inside Her. [Uncensored L**ked]",https://pic.javct.net/poster/05192026/23fbbaa994.jpg,https://javct.net/v/royd-327-rm,140,2026-06-07
GVH-851-RM,Exploring The Clothed Breasts Of My Beloved Busty Aunt ~ Memories Of Burying My Face Inside Her Obscenely Bulging Sweater ~ Riho Shishido [Uncensored L**ked],https://pic.javct.net/poster/05192026/0243ba8f24.jpg,https://javct.net/v/gvh-851-rm,165,2026-06-07
UMD-1009-RM,"My Shy, Pervy And Horny Little Sister Has A Very Strong Sex Drive. Her Behavior Completely Changed After She Discovered The Pleasures Of Dry Humping!! She Kept Shaking Her Crotch On My Throbbing Cock When Suddendly It Was About To Penetrate Her Smooth And Slippery Pussy!! I Made A Promise To Only Put In The First 3 Cm Of My Dick But I Failed To Keep It, And Ended-up Putting It 15cm Deep!! 03 [Uncensored L**ked]",https://pic.javct.net/poster/05192026/458de2f736.jpg,https://javct.net/v/umd-1009-rm,200,2026-06-07
MDVHJ-083-RM,"""Father-in-law, If You Forgive Me Any More, I Will..."" A Bride Who Cums On Her Husband's Father's Unequaled Cock...Chapter 5 Reiko Kobayakawa [Uncensored L**ked]",https://pic.javct.net/poster/20230206/1687839527.jpg,https://javct.net/v/mdvhj-083-rm,100,2026-06-07
HUNTA-341-RM,"A Big Tits Too Big Sister Is Actually A Strike! !Just Two People With Such A Big Sister And A Small Bath! !Why Was It Such A Thing ...?My Sister Living Alone In Tokyo Has Returned To My Parents' House For The First Time In A Long Time!My Sister Is Very Kind And Smart And My Younger Brother Says, But I Have Big Tits ... [Uncensored L**ked]",https://pic.javct.net/poster/20230205/1684980810.jpg,https://javct.net/v/hunta-341-rm,240,2026-06-07
RCTD-737,"ROCKET Honpo - High-priced Purchase Of Incestuous Sex Items, Part 2: What Started As A Way For A Parent And C**ld To Earn A Little Pocket Money Turns Into A Series Of High-value Appraisals!!",https://pic.javct.net/poster/05192026/ebe19f1091.jpg,https://javct.net/v/rctd-737,160,2026-06-07
NGOD-341,"A Story Of Impregnation In Tokyo: Impregnated By My Husband's Stepson's Perfectly Matched, Circumcised, Huge Penis...",https://pic.javct.net/poster/05192026/c38a6773e6.jpg,https://javct.net/v/ngod-341,120,2026-06-07
GVH-851,Exploring The Clothed Breasts Of My Beloved Busty Aunt ~ Memories Of Burying My Face Inside Her Obscenely Bulging Sweater ~ Riho Shishido,https://pic.javct.net/poster/05192026/0243ba8f24.jpg,https://javct.net/v/gvh-851,165,2026-06-07
NACT-136,"[NTR] ""Am I Not Good Enough?"" Momose Himari, The Son's Wife, Falls For Her Father-in-law Who Has Become Incredibly Virile After Taking A Youth-rejuvenating Drug.",https://pic.javct.net/poster/05192026/8a9202d2ed.jpg,https://javct.net/v/nact-136,120,2026-06-07
ALDN-591,"Shiori Tsukada, The Surrogate Mother",https://pic.javct.net/poster/05192026/fbd427f784.jpg,https://javct.net/v/aldn-591,100,2026-06-07
ALDN-588,My Mother-in-law Is So Much Better Than My Wife... Sayuri Hayama,https://pic.javct.net/poster/05192026/17f54cfcd0.jpg,https://javct.net/v/aldn-588,125,2026-06-07
ROE-502,"For 10 Years, He Has Harbored Feelings For His Mother, And He Continues His Relentless Pursuit Of Her, Ejaculating Inside Her 16 Times In A Row During Incestuous Sex.",https://pic.javct.net/poster/05192026/7351e488ff.jpg,https://javct.net/v/roe-502,150,2026-06-07
HSODA-121,"I Had Absolutely No Intention Of Doing That, But My Overly Self-conscious Mother Mistook My Gaze For ""lust"" And Forcibly Tries To Satisfy Her Sexual Needs Every Day.",https://pic.javct.net/poster/05192026/bf4d002e02.jpg,https://javct.net/v/hsoda-121,120,2026-06-07
NGOD-345,My Grandfather And My Mother... My Beloved And Admired Mother's Body Is Being Touched By That Perverted Old Man...,https://pic.javct.net/poster/05192026/c846bb0fcd.jpg,https://javct.net/v/ngod-345,120,2026-06-07
ROE-502-RM,"For 10 Years, He Has Harbored Feelings For His Mother, And He Continues His Relentless Pursuit Of Her, Ejaculating Inside Her 16 Times In A Row During Incestuous Sex. [Uncensored L**ked]",https://pic.javct.net/poster/05192026/7351e488ff.jpg,https://javct.net/v/roe-502-rm,150,2026-06-07
NGOD-345-RM,My Grandfather And My Mother... My Beloved And Admired Mother's Body Is Being Touched By That Perverted Old Man... [Uncensored L**ked],https://pic.javct.net/poster/05192026/c846bb0fcd.jpg,https://javct.net/v/ngod-345-rm,120,2026-06-07
AKDL-045-RM,"""Can I record a video of me making love to my father?"" A family diary of a stepc**ld and stepfather that happened 6 years after they started living together Mizuki Yayoi [Uncensored L**ked]",https://pic.javct.net/poster/04112026/1776666032101.jpg,https://javct.net/v/akdl-045-rm,119,2026-06-07
MIST-092-RM,Once You Sleep And You To Ji ○ The Issues Quietly Inserted Gattsuri During Sister Sleeping On Defenseless Once You Have Verified That It Does Not Occur By Rubbing The Face Excitement Quite The Sister Of Underwear That Does Not Happen! ! [Uncensored L**ked],https://pic.javct.net/poster/05192026/baa8cca1a4.jpg,https://javct.net/v/mist-092-rm,150,2026-06-07
IENF-271-RM,Good Friends Challenge The Erotic Mission For The Prize Money! Forbidden Incest! Unequaled Younger Brother Is In Estrus For A Beautiful Older Sister! Many Times Creampie! [Uncensored L**ked],https://pic.javct.net/poster/20230206/1687403874.jpg,https://javct.net/v/ienf-271-rm,155,2026-06-07
YSN-601-RM,It Is Kept By The Brother Of A C**ld Uncle Who Is Stupid But Has A Strong Libido. Anka Suzune [Uncensored L**ked],https://pic.javct.net/poster/20230206/1687495181.jpg,https://javct.net/v/ysn-601-rm,101,2026-06-07
YOCH-002-RM,I'm A Woman... Even My Stepmom Wants To Be Impregnated... Yuri Honma [Uncensored L**ked],https://pic.javct.net/poster/20230206/1687404754.jpg,https://javct.net/v/yoch-002-rm,110,2026-06-07
ROYD-327,"I Kneaded My Older Sister's Big Ass, Which Was Carelessly Showing Off Her Black Pantyhose, And Ended Up Cumming Inside Her.",https://pic.javct.net/poster/05192026/23fbbaa994.jpg,https://javct.net/v/royd-327,140,2026-06-07
