code,title,image_url,page_url,views,date_scraped
IENF-455,"I wanted to lose my virginity to my first girlfriend, but I never expected to lose my virginity to my younger sister...",https://pic.javct.net/poster/07052026/df5d6a1b3e.jpg,https://javct.net/v/ienf-455,128,2026-07-13
T38-066,Intense Incestuous Sex With My Busty Younger Sister Who Returned To The Countryside - Mami Zenba,https://pic.javct.net/poster/07052026/354f2f4ab9.jpg,https://javct.net/v/t38-066,150,2026-07-13
JUAN-015-RM,"Ryoko Izumi, A Mother Who Lifts The Ban On Anal For Her Son [Uncensored L**ked]",https://pic.javct.net/poster/20233001/1676690456.jpg,https://javct.net/v/juan-015-rm,121,2026-07-13
LULU-262-RM,"My Adult Younger Brother Was Irritated By The Defenseless Breasts Of A Big-breasted NEET Older Sister Who I Met For The First Time In Several Years, So I Impregnated Her Many Times As A Raw Masturbator And Instilled A Sense Of Responsibility In Her. Yuria Yoshine [Uncensored L**ked]",https://pic.javct.net/poster/20231912/1703829546.jpg,https://javct.net/v/lulu-262-rm,160,2026-07-13
MDVHJ-074-RM,"When My Husband Is Away From Home At Work, I'm Going Crazy With My Unfaithful Father-In-Law Who Has A Big Cock... Chapter 2 Miyu Hirosue [Uncensored L**ked]",https://pic.javct.net/poster/20222612/1674789548.jpg,https://javct.net/v/mdvhj-074-rm,110,2026-07-13
SPRD-817-SUB,Is Rubbed His Son Again And Again Mother Kondo Ikumi [English Subtitle],https://pic.javct.net/poster/20230207/1689120615.jpg,https://javct.net/v/sprd-817-sub,130,2026-07-13
TARD-008-RM,"I'll Inspire My Mother, Let Me Do What Your Mother. Sha Teen C**ld Katagiri Rika Fujishita [Uncensored L**ked]",https://pic.javct.net/poster/07052026/52b785de2f.jpg,https://javct.net/v/tard-008-rm,120,2026-07-13
ALDN-123-RM,Mating Maiko Kashiwagi With Her Daughter's Husband [Uncensored L**ked],https://pic.javct.net/poster/20233001/1676084540.jpg,https://javct.net/v/aldn-123-rm,105,2026-07-13
T38-067-RM,Distorted Remarriage Life: A Married Woman Controlled By Her New Husband's Father. [Uncensored L**ked],https://pic.javct.net/poster/07052026/68c13a84ad.jpg,https://javct.net/v/t38-067-rm,130,2026-07-13
AOZ-176Z-RM,Biological C**ld Incest Picture Which I Was R**ed By Horny The Chest Peeping Out From Clothes Disturbed Mother Was Drunk [Uncensored L**ked],https://pic.javct.net/poster/20241901/1706659043.jpg,https://javct.net/v/aoz-176z-rm,110,2026-07-13
IBW-905Z-RM,Incest Video Of A Daughter Who Continues To Be Fucked By Her Father Kozue Fujita [Uncensored L**ked],https://pic.javct.net/poster/20222612/1674789869.jpg,https://javct.net/v/ibw-905z-rm,110,2026-07-13
IMO-019-RM,"While I Was Masturbating In The Bathroom, My Sister Who Was Completely Naked Broke In! ? Forbidden Domestic Brother And Sister Creampie Incest (2) [Uncensored L**ked]",https://pic.javct.net/poster/20233001/1675566357.jpg,https://javct.net/v/imo-019-rm,111,2026-07-13
YST-290-RM,Toa Kotone Silently Devoured My Sister Who Started Layering [Uncensored L**ked],https://pic.javct.net/poster/20230302/1677819460.jpg,https://javct.net/v/yst-290-rm,101,2026-07-13
TARD-003-RM,"I'll let someone with a mother of me, let me Yarra to your mother. Kanda Maki generation Sha Akagi [Uncensored L**ked]",https://pic.javct.net/poster/07052026/d115f6785e.jpg,https://javct.net/v/tard-003-rm,130,2026-07-13
AED-213-RM,Incest Vaginal Creampie For A Fifty-Something Mother Kasumi Shimazaki [Uncensored L**ked],https://pic.javct.net/poster/20233001/1675481842.jpg,https://javct.net/v/aed-213-rm,120,2026-07-13
ROE-514-RM,"For 10 Years, I Have Harbored Feelings For My Mother, And I Have Been Relentlessly Pursuing Her With 16 Consecutive Ejaculations Inside Her. - Satsuki Kirioka [Uncensored L**ked]",https://pic.javct.net/poster/07052026/73d9ea7384.jpg,https://javct.net/v/roe-514-rm,120,2026-07-13
NKKD-364-RM,"Big Dick Incest: Mother With Huge Breasts And Dark Skin Seduced By Her Son's Hard, Erect, Circumcised Cock. [Uncensored L**ked]",https://pic.javct.net/poster/07052026/59281dd1ff.jpg,https://javct.net/v/nkkd-364-rm,120,2026-07-13
T38-067,Distorted Remarriage Life: A Married Woman Controlled By Her New Husband's Father.,https://pic.javct.net/poster/07052026/68c13a84ad.jpg,https://javct.net/v/t38-067,130,2026-07-13
NGHJ-068,"Outside The One-way Mirror Is Her Beloved Husband, Whom She Has Just Remarried... The Busty New Stepmother And Her Virgin Son Are Alone In A Private Room For Incestuous Sex, With Him Taking Her Virginity And Cumming Inside Her. ""If We Have Sex... Will You Call Me Mom?"" The Stepmother's Pussy Gently Accepts Her Son And The Virile Virgin's Dick Will Not Stop At Just One Ejaculation.",https://pic.javct.net/poster/07052026/f59d0b01b3.jpg,https://javct.net/v/nghj-068,191,2026-07-13
HOKS-137-RM,"Modern Carnal Theater If You Die, Go To Hell! Father 60 Years Old / Daughter 30 Years Old Intercourse 365 Days Saki Miizumi [Uncensored L**ked]",https://pic.javct.net/poster/20230302/1678508829.jpg,https://javct.net/v/hoks-137-rm,98,2026-07-13
NACT-128-RM,"Yuika Onosaka, A Young Wife Repeatedly R**ed By Her Insatiable Stepfather And Trained To Be A Slut. [Uncensored L**ked]",https://pic.javct.net/poster/05192026/7b6e9ff50d.jpg,https://javct.net/v/nact-128-rm,117,2026-07-13
NACT-126-RM,A Week Of Being Toyed With By Her Husband's Father: The Son's Wife Driven Mad By Pleasure - Misaki Hikari [Uncensored L**ked],https://pic.javct.net/poster/05192026/cfb4dbc37d.jpg,https://javct.net/v/nact-126-rm,124,2026-07-13
ROE-516-RM,"In The C**ldhood Home Where Everyone Else Has Left Home, I Spend My Days In Incestuous Relations With My Mother. - Masaru Inamori [Uncensored L**ked]",https://pic.javct.net/poster/07052026/146d90ca1d.jpg,https://javct.net/v/roe-516-rm,160,2026-07-13
T28-565,"On A Day When My Parents Were Not There, I Was Scared All Day Long Until My Sister And Sperm Died.I Love Winter",https://pic.javct.net/poster/07052026/24a98790de.jpg,https://javct.net/v/t28-565,130,2026-07-13
