code,title,image_url,page_url,views,date_scraped
KSBJ-434,I Can't Help But Adore My Son! - Yuhi Satoumi,https://pic.javct.net/poster/05192026/8f73aa48ed.jpg,https://javct.net/v/ksbj-434,105,2026-06-13
VENX-373-RM,"Mom, A Cum-filled Sex Toy Anytime. A Mother Who Has Become A Sex Toy For Her Son Who Is Desperate For Female Companionship, Pretends Not To Feel Anything Despite Enjoying It, And Eagerly Awaits The Next Time They Have Sex. - Kana Morisawa [Uncensored L**ked]",https://pic.javct.net/poster/05192026/7111ff0f72.jpg,https://javct.net/v/venx-373-rm,100,2026-06-13
KSBJ-103,Very Kind My Mom,https://pic.javct.net/poster/05192026/0ce9581409.jpg,https://javct.net/v/ksbj-103,242,2026-06-13
T28-525,"On My Parents' Free Day, I Snapped All Day Long Until My Sister And Sperm Died. Mari Takasugi",https://pic.javct.net/poster/05192026/ccd4c538c6.jpg,https://javct.net/v/t28-525,130,2026-06-13
GVG-443-RM,Forbidden Care Haruna Hebei [Uncensored L**ked],https://pic.javct.net/poster/20230804/1692194269.jpg,https://javct.net/v/gvg-443-rm,120,2026-06-13
ROE-107-SUB,Days Of Incest With My Mother At My Parents' House Where The Whole Family Left The Nest. Natsuko Kayama [English Subtitle],https://pic.javct.net/poster/20222109/1665120317.jpg,https://javct.net/v/roe-107-sub,130,2026-06-13
NXGS-018-RM,"Fifty-year-old Mother, Forbidden Immoral Mother-son Incest [Uncensored L**ked]",https://pic.javct.net/poster/05192026/b6d08c372b.jpg,https://javct.net/v/nxgs-018-rm,120,2026-06-13
IENFA-06603-RM,"My big-breasted older sister, who felt pity for me for not having sex, asked me to intercrural sex with her, promising that I would just rub her, and we both felt so good that our pussies were soaking wet! Insert it raw! ""What!? Is it inside?"" But I can't stop and cum! Hatori Kosaki [Uncensored L**ked]",https://pic.javct.net/poster/05192026/7b6cfd1505.jpg,https://javct.net/v/ienfa-06603-rm,42,2026-06-13
IENFA-06102-RM,"My breasts belong to my brother.My sister is concerned about her breasts, which are growing bigger and bigger. I can't help but be curious about her boobs being played around with each other in defenseless poses! Yui Tomita [Uncensored L**ked]",https://pic.javct.net/poster/05192026/58e9bdc91f.jpg,https://javct.net/v/ienfa-06102-rm,44,2026-06-13
ROE-073-SUB,"A Dear Mother, Even Her Rebellious Son, Accepts Her Days As A Meat Guy. Rieko Hiraoka [English Subtitle]",https://pic.javct.net/poster/20220406/1654842012.jpg,https://javct.net/v/roe-073-sub,120,2026-06-13
IENFA-06203-RM,"When I was playing a trick on my sister, a sleeping schoolgirl, she asked me to fuck her raw, and even though I was about to cum, she was locked with crab scissors and I couldn't escape, so I cum inside her! Yui Nagase [Uncensored L**ked]",https://pic.javct.net/poster/05192026/088667e824.jpg,https://javct.net/v/ienfa-06203-rm,38,2026-06-13
NSFS-469-SUB,Mature Mother 38 ~A Ripe Body Driven Wild By Her Son's Huge Penis~ Megumi Suzukawa [English Subtitle],https://pic.javct.net/poster/04112026/68623b1ce5.jpg,https://javct.net/v/nsfs-469-sub,91,2026-06-13
VENX-373,"Mom, A Cum-filled Sex Toy Anytime. A Mother Who Has Become A Sex Toy For Her Son Who Is Desperate For Female Companionship, Pretends Not To Feel Anything Despite Enjoying It, And Eagerly Awaits The Next Time They Have Sex. - Kana Morisawa",https://pic.javct.net/poster/05192026/7111ff0f72.jpg,https://javct.net/v/venx-373,100,2026-06-13
VENU-081-RM,Nao Mizuki Big Booty Mother Incest Violent Night After Night [Uncensored L**ked],https://pic.javct.net/poster/20230104/1682577682.jpg,https://javct.net/v/venu-081-rm,80,2026-06-13
NUKA-63-RM,Six Creampies Without Pulling Out Incest Close Copulation Saki Oishi [Uncensored L**ked],https://pic.javct.net/poster/20230206/1686798979.jpg,https://javct.net/v/nuka-63-rm,110,2026-06-13
NEWM-097-RM,"True Abnormal Sexual Intercourse: Fifty-Something Mother And Son, Part 40: Her Body Is Fo**ed To Feel The Violation Of Her Son, Rieko Hiraoka [Uncensored L**ked]",https://pic.javct.net/poster/20242012/1734754695.jpg,https://javct.net/v/newm-097-rm,120,2026-06-13
NXGS-018,"Fifty-year-old Mother, Forbidden Immoral Mother-son Incest",https://pic.javct.net/poster/05192026/b6d08c372b.jpg,https://javct.net/v/nxgs-018,120,2026-06-13
T38-065-RM,"From The Day She Got Her First Period...a Daughter Is Repeatedly Violated And Ab**ed By Her Father In Incestuous Relationships. Yuyu, Toka, Yuzu [Uncensored L**ked]",https://pic.javct.net/poster/05192026/c38204fbe7.jpg,https://javct.net/v/t38-065-rm,140,2026-06-13
T38-065,"From The Day She Got Her First Period...a Daughter Is Repeatedly Violated And Ab**ed By Her Father In Incestuous Relationships. Yuyu, Toka, Yuzu",https://pic.javct.net/poster/05192026/c38204fbe7.jpg,https://javct.net/v/t38-065,140,2026-06-13
HUNTB-615-RM,"""Not Enough! Don't Hesitate To Think That You're A C**ld And Poke A Lot! ] When I Was Taking A Bath With My Little Sister, I Hug Her With A Fierce Belochu That Puts Adults To Shame ... 2 [Uncensored L**ked]",https://pic.javct.net/poster/20230206/1687491620.jpg,https://javct.net/v/huntb-615-rm,230,2026-06-13
COGM-052-RM,"I Can Still Forgive My Sister For Being A Nudist, But I'm Very Troubled Because She Masturbates Everywhere. [Uncensored L**ked]",https://pic.javct.net/poster/20230206/1688186517.jpg,https://javct.net/v/cogm-052-rm,115,2026-06-13
NACT-136-RM,"[NTR] ""Am I Not Good Enough?"" Momose Himari, The Son's Wife, Falls For Her Father-in-law Who Has Become Incredibly Virile After Taking A Youth-rejuvenating Drug. [Uncensored L**ked]",https://pic.javct.net/poster/05192026/8a9202d2ed.jpg,https://javct.net/v/nact-136-rm,120,2026-06-13
KTDS-752,Plump Breasts Duero Sister And Spear Rolled Carnal Sex Sister And Fornication MizuSaki Akane,https://pic.javct.net/poster/05192026/3de19fe654.jpg,https://javct.net/v/ktds-752,119,2026-06-13
T28-517,My Sister And Parents Met After A Long Absence To My Parents Incest Incest Casual Sexual Intercourse You Color Flower Sounds,https://pic.javct.net/poster/05192026/9f254934ab.jpg,https://javct.net/v/t28-517,120,2026-06-13
