code,title,image_url,page_url,views,date_scraped
HSODA-118,Amateur Monitoring Of Beauty Treatments Using A Magic Mirror.,https://pic.javct.net/poster/07052026/405b7aea14.jpg,https://javct.net/v/hsoda-118,130,2026-07-10
BBAN-593,"Meeting You Changed My World. A Dream Lesbian Liberation Documentary About Loving And Being Loved By The Person I've Always Admired. Hanatori Toka, Kato Tsubaki",https://pic.javct.net/poster/07052026/989eb2cefe.jpg,https://javct.net/v/bban-593,170,2026-07-10
BBAN-592,I never expected a gal to cum in a movie theater where a movie was showing... A shameful lesbian molester who can't even make a sound and is thoroughly instilled with pleasure until the end credits.,https://pic.javct.net/poster/07052026/856acd7051.jpg,https://javct.net/v/bban-592,118,2026-07-10
BBAN-598,"""Why Am I The One Who's Fallen For Yuri?!"" I Was Supposed To Be Cupid, But I Was Seduced By A Beautiful Girl And Completely Defeated By Pleasure... I Ended Up Showing My Best Friend, Who Was In A WSS (I Was The One Who Liked Her First...) State, My Lesbian Sex.",https://pic.javct.net/poster/07052026/fc8d30a1e1.jpg,https://javct.net/v/bban-598,120,2026-07-10
BBAN-581,[Celebrating The Comeback] [Celebrating The Return Of Lesbians] Hasumi Claire's Amazing Technique! A Strap-on Lesbian Visit To Your Home And I'll Make You Cum Like Crazy!,https://pic.javct.net/poster/07052026/c3ea3fc1a4.jpg,https://javct.net/v/bban-581,220,2026-07-10
DASS-985,"Want To Be My Pet? A True Story. The Stunning Beauties Who Keep Lesbian Pets: Kyoko Hanamiya, Kana Yura, Kotone Fuyua",https://pic.javct.net/poster/07052026/facf9365c7.jpg,https://javct.net/v/dass-985,190,2026-07-10
DWD-099-RM,Koharu Kikoiumiaoi Sasaki Lesbian Love Rubbing Nipples Berokisu [Uncensored L**ked],https://pic.javct.net/poster/07052026/fea778f198.jpg,https://javct.net/v/dwd-099-rm,126,2026-07-10
BBAN-003-RM,Female Only Shared House Lesbian Hatano Yui Kan'nami Multi Ichihana [Uncensored L**ked],https://pic.javct.net/poster/20230206/1686220072.jpg,https://javct.net/v/bban-003-rm,150,2026-07-10
AUKG-628-RM,Sexual Matching Lesbians ~Beautiful Lesbians Who Invite Women On A Matching Site~ [Uncensored L**ked],https://pic.javct.net/poster/20250606/1749833493.jpg,https://javct.net/v/aukg-628-rm,120,2026-07-10
AUKG-634-RM,Lesbian Delivery Health ~ Home Delivery OK! Women-only Delivery Health. Here Are The New Girls You Can Play With Right Now! ~ [Uncensored L**ked],https://pic.javct.net/poster/07202025/1756484654.jpg,https://javct.net/v/aukg-634-rm,120,2026-07-10
BBAN-364-RM,"Business Trip Massage Parlor. Young Wife Gets Her Desires Teased In This Lesbian Series. Her Body Is Built-up With Lust And The Massage Parlor Worker Knows Just How To Let It Out. Riona Hirose, Tsubasa Hachino [Uncensored L**ked]",https://pic.javct.net/poster/20221202/1646372500.jpg,https://javct.net/v/bban-364-rm,167,2026-07-10
JUY-344-RM,"Dual Personality Married Lesbian ""Another One I Want ... I Want That Girl -"" Nami Sekine Rin Kirishima [Uncensored L**ked]",https://pic.javct.net/poster/20243105/1718813196.jpg,https://javct.net/v/juy-344-rm,120,2026-07-10
AUKG-211-RM,Les Pet (2) [Uncensored L**ked],https://pic.javct.net/poster/20241115/1732869920.jpg,https://javct.net/v/aukg-211-rm,110,2026-07-10
HUNTB-514-RM,"What!? This Is An Exercise!? When I Entered Nursing College, I Was The Only Man! ? In School Exercises, The Breasts And Buttocks Look Defenseless And Are Touched, So Naturally Full Erections! [Uncensored L**ked]",https://pic.javct.net/poster/20230302/1679628777.jpg,https://javct.net/v/huntb-514-rm,190,2026-07-10
AUKG-654-RM,Until She Fell Into Lesbianism... ~First Lesbian Sex With A Slutty Lesbian I Met On Social Media~ [Uncensored L**ked],https://pic.javct.net/poster/05192026/cac25b31e1.jpg,https://javct.net/v/aukg-654-rm,120,2026-07-10
AUKG-654,Until She Fell Into Lesbianism... ~First Lesbian Sex With A Slutty Lesbian I Met On Social Media~,https://pic.javct.net/poster/05192026/cac25b31e1.jpg,https://javct.net/v/aukg-654,120,2026-07-10
AP-158,"Contrary Look And A Library School Girls Lesbian Molester Likely Serious, Girl School Girls Have A High Sex Drive Abnormally Ends Up Lesbian Pervert The Beauty Sister Naive Likely That I Saw At The Library!",https://pic.javct.net/poster/05192026/50c03ac20b.jpg,https://javct.net/v/ap-158,110,2026-07-10
ATID-681,I Ended Up Sleeping With The College Student Who Moved In Next Door. Please Forgive Me...,https://pic.javct.net/poster/05192026/18eaeff704.jpg,https://javct.net/v/atid-681,120,2026-07-10
CEMD-323-RM,Happy Lesbian Staring At Each Other ~ SEX Documentary Aoi Kururugi X Jun Suehiro [Uncensored L**ked],https://pic.javct.net/poster/20230104/1682139326.jpg,https://javct.net/v/cemd-323-rm,139,2026-07-10
MUKD-481-RM,"A Secret That No One Knows, Just The Two Of Us. Ichika Tokana [Uncensored L**ked]",https://pic.javct.net/poster/20230302/1679028203.jpg,https://javct.net/v/mukd-481-rm,120,2026-07-10
CEAD-735-RM,Kasumi Yua 2-disc Hyper Best 4 Hours 49 Minutes [Uncensored L**ked],https://pic.javct.net/poster/05192026/7ce9a7d918.jpg,https://javct.net/v/cead-735-rm,289,2026-07-10
MIRD-283-RM,"Authentic Lesbian Sex & Co-starring For The First Time - Drown In A Flood Of Beauty. Two Beautiful Women And Nonstop Cumming Harem Sex - Miu Nakamura, Aki Sasaki [Uncensored L**ked]",https://pic.javct.net/poster/04112026/dab13eec90.jpg,https://javct.net/v/mird-283-rm,180,2026-07-10
CEMD-322-RM,"SEX Monster ""Ayaka Mochizuki"" Teaches New Actress ""Arisu Hanae"" Every Step Of The Way! Endless Lesbian Pleasure Goes Crazy Intensely! ! [Uncensored L**ked]",https://pic.javct.net/poster/20230104/1680929013.jpg,https://javct.net/v/cemd-322-rm,127,2026-07-10
BBSS-071-RM,L**i Lesbians. Rich Lesbian Sex 4 Hours Best Of Innocent Girls Who Are Crazy For Each Other And Climax [Uncensored L**ked],https://pic.javct.net/poster/20230302/1678419987.jpg,https://javct.net/v/bbss-071-rm,240,2026-07-10
