code,title,image_url,page_url,views,date_scraped
MVG-137-RM,Covered In Cum!! Lewd Masochistic Gal Lesbian Fuck!! Nozomi Arimura / Aya Nogi [Uncensored L**ked],https://pic.javct.net/poster/07202025/1755882025.jpg,https://javct.net/v/mvg-137-rm,155,2026-07-11
OPUD-313-RM,Thick Breast Milk Piss! Bathing Drinking Urine Lesbian Nozomi Hazuki Minori Kuwata [Uncensored L**ked],https://pic.javct.net/poster/20233001/1676821431.jpg,https://javct.net/v/opud-313-rm,120,2026-07-11
BDA-091-RM,Violated Female Inmate Doing Hard Time On The Inside Ai Hoshina [Uncensored L**ked],https://pic.javct.net/poster/20212709/1635834889.jpg,https://javct.net/v/bda-091-rm,136,2026-07-11
HUNT-806-RM,"Nurse's Frustration With ""busy! ""It Thinks That It Can Do H Soon As The Hospital To Believe Such A Rumor, Just Nurse's Straight-laced Attitude Of An Ultra-cold ... Businesslike.But When There, I Found A Hospital Lesbian Scene Secret Of Beauty Nurse Couple Ubu Nurse Couple Pretty Inpatient Tits Woman Doctor Couple! [Uncensored L**ked]",https://pic.javct.net/poster/01202026/1772793525.jpg,https://javct.net/v/hunt-806-rm,245,2026-07-11
HUNTC-616,"""What?! No Way! Am I The Only One In My Class Who Gets Erections? No, Am I The Only One In The World?!"" It's Been A Year Since All The Other Men Stopped Getting Erections... But For Some Reason, I'm The Only One Who Gets Erections, And I've Entered A Period Of Incredible Popularity!! Putting An End To The Era Where My Female Classmates Were Satisfied With Just Having Lesbian Encounters Among Themselves!!",https://pic.javct.net/poster/07052026/a1da54cdc6.jpg,https://javct.net/v/huntc-616,240,2026-07-11
HSODA-118-RM,Amateur Monitoring Of Beauty Treatments Using A Magic Mirror. [Uncensored L**ked],https://pic.javct.net/poster/07052026/405b7aea14.jpg,https://javct.net/v/hsoda-118-rm,130,2026-07-11
CEMD-864,Akari Niimura Destroys Transsexual Ena Hisaki With A Strap-on Anal Sex!,https://pic.javct.net/poster/07052026/29dd01ba6d.jpg,https://javct.net/v/cemd-864,131,2026-07-11
HSODA-118,Amateur Monitoring Of Beauty Treatments Using A Magic Mirror.,https://pic.javct.net/poster/07052026/405b7aea14.jpg,https://javct.net/v/hsoda-118,130,2026-07-11
BBAN-593,"Meeting You Changed My World. A Dream Lesbian Liberation Documentary About Loving And Being Loved By The Person I've Always Admired. Hanatori Toka, Kato Tsubaki",https://pic.javct.net/poster/07052026/989eb2cefe.jpg,https://javct.net/v/bban-593,170,2026-07-11
BBAN-592,I never expected a gal to cum in a movie theater where a movie was showing... A shameful lesbian molester who can't even make a sound and is thoroughly instilled with pleasure until the end credits.,https://pic.javct.net/poster/07052026/856acd7051.jpg,https://javct.net/v/bban-592,118,2026-07-11
BBAN-598,"""Why Am I The One Who's Fallen For Yuri?!"" I Was Supposed To Be Cupid, But I Was Seduced By A Beautiful Girl And Completely Defeated By Pleasure... I Ended Up Showing My Best Friend, Who Was In A WSS (I Was The One Who Liked Her First...) State, My Lesbian Sex.",https://pic.javct.net/poster/07052026/fc8d30a1e1.jpg,https://javct.net/v/bban-598,120,2026-07-11
BBAN-581,[Celebrating The Comeback] [Celebrating The Return Of Lesbians] Hasumi Claire's Amazing Technique! A Strap-on Lesbian Visit To Your Home And I'll Make You Cum Like Crazy!,https://pic.javct.net/poster/07052026/c3ea3fc1a4.jpg,https://javct.net/v/bban-581,220,2026-07-11
DASS-985,"Want To Be My Pet? A True Story. The Stunning Beauties Who Keep Lesbian Pets: Kyoko Hanamiya, Kana Yura, Kotone Fuyua",https://pic.javct.net/poster/07052026/facf9365c7.jpg,https://javct.net/v/dass-985,190,2026-07-11
DWD-099-RM,Koharu Kikoiumiaoi Sasaki Lesbian Love Rubbing Nipples Berokisu [Uncensored L**ked],https://pic.javct.net/poster/07052026/fea778f198.jpg,https://javct.net/v/dwd-099-rm,126,2026-07-11
BBAN-003-RM,Female Only Shared House Lesbian Hatano Yui Kan'nami Multi Ichihana [Uncensored L**ked],https://pic.javct.net/poster/20230206/1686220072.jpg,https://javct.net/v/bban-003-rm,150,2026-07-11
AUKG-628-RM,Sexual Matching Lesbians ~Beautiful Lesbians Who Invite Women On A Matching Site~ [Uncensored L**ked],https://pic.javct.net/poster/20250606/1749833493.jpg,https://javct.net/v/aukg-628-rm,120,2026-07-11
AUKG-634-RM,Lesbian Delivery Health ~ Home Delivery OK! Women-only Delivery Health. Here Are The New Girls You Can Play With Right Now! ~ [Uncensored L**ked],https://pic.javct.net/poster/07202025/1756484654.jpg,https://javct.net/v/aukg-634-rm,120,2026-07-11
BBAN-364-RM,"Business Trip Massage Parlor. Young Wife Gets Her Desires Teased In This Lesbian Series. Her Body Is Built-up With Lust And The Massage Parlor Worker Knows Just How To Let It Out. Riona Hirose, Tsubasa Hachino [Uncensored L**ked]",https://pic.javct.net/poster/20221202/1646372500.jpg,https://javct.net/v/bban-364-rm,167,2026-07-11
JUY-344-RM,"Dual Personality Married Lesbian ""Another One I Want ... I Want That Girl -"" Nami Sekine Rin Kirishima [Uncensored L**ked]",https://pic.javct.net/poster/20243105/1718813196.jpg,https://javct.net/v/juy-344-rm,120,2026-07-11
AUKG-211-RM,Les Pet (2) [Uncensored L**ked],https://pic.javct.net/poster/20241115/1732869920.jpg,https://javct.net/v/aukg-211-rm,110,2026-07-11
HUNTB-514-RM,"What!? This Is An Exercise!? When I Entered Nursing College, I Was The Only Man! ? In School Exercises, The Breasts And Buttocks Look Defenseless And Are Touched, So Naturally Full Erections! [Uncensored L**ked]",https://pic.javct.net/poster/20230302/1679628777.jpg,https://javct.net/v/huntb-514-rm,190,2026-07-11
AUKG-654-RM,Until She Fell Into Lesbianism... ~First Lesbian Sex With A Slutty Lesbian I Met On Social Media~ [Uncensored L**ked],https://pic.javct.net/poster/05192026/cac25b31e1.jpg,https://javct.net/v/aukg-654-rm,120,2026-07-11
AUKG-654,Until She Fell Into Lesbianism... ~First Lesbian Sex With A Slutty Lesbian I Met On Social Media~,https://pic.javct.net/poster/05192026/cac25b31e1.jpg,https://javct.net/v/aukg-654,120,2026-07-11
AP-158,"Contrary Look And A Library School Girls Lesbian Molester Likely Serious, Girl School Girls Have A High Sex Drive Abnormally Ends Up Lesbian Pervert The Beauty Sister Naive Likely That I Saw At The Library!",https://pic.javct.net/poster/05192026/50c03ac20b.jpg,https://javct.net/v/ap-158,110,2026-07-11
