code,title,image_url,page_url,views,date_scraped
VENX-316-SUB,"""Do You Get Excited By My Underwear?"" Auntie Adachi Yuri Squeezes Out Every Last Drop Of Her Nephew's Sperm With Her Freshly Removed Panties [English Subtitle]",https://pic.javct.net/poster/20250903/1742492335.jpg,https://javct.net/v/venx-316-sub,100,2026-06-16
MAAN-1176-RM,"[Masochist play with my favorite actor] It's been a long time since I've been horny and I can't stop looking for a deep masochist woman who keeps cumming while screaming w With a face covered in semen, I'm ready for the second round from the cock sucking, intense sex [Thanks Bitch] [Bookmark] [Uncensored L**ked]",https://pic.javct.net/poster/05192026/bef3f7a373.jpg,https://javct.net/v/maan-1176-rm,85,2026-06-16
SDDE-467-RM,"Hospitality Also Shy Oma Co ○ Aviation 7 Adhesion Cowgirl In ""uniforms, Underwear, Naked"", Superb Room Service That Plenty Of Taste Also Ejaculation [Uncensored L**ked]",https://pic.javct.net/poster/20241804/1715726433.jpg,https://javct.net/v/sdde-467-rm,180,2026-06-16
MAAN-1176,"[Masochist play with my favorite actor] It's been a long time since I've been horny and I can't stop looking for a deep masochist woman who keeps cumming while screaming w With a face covered in semen, I'm ready for the second round from the cock sucking, intense sex [Thanks Bitch] [Bookmark]",https://pic.javct.net/poster/05192026/bef3f7a373.jpg,https://javct.net/v/maan-1176,85,2026-06-16
MDBK-288-RM,"In The Morning, When I Woke Up, A Half-naked Female Colleague Next To Me... Was Forcibly Attacked By Me! ? When I Thought My Life Was Over, I Asked For The Continuation Of Yesterday... [Uncensored L**ked]",https://pic.javct.net/poster/20230205/1683350567.jpg,https://javct.net/v/mdbk-288-rm,140,2026-06-16
CLUB-455-RM,Lower-body Touch NG's Sekikaba Captures The Actual Situation Of Vulgar Customers Who Sk**lfully Wards Girls Who Enter The Store And Went Through The Production!Five [Uncensored L**ked],https://pic.javct.net/poster/05192026/0f9ba9a6c1.jpg,https://javct.net/v/club-455-rm,210,2026-06-16
HMGL-177-RM,To**ure Glamourous Nakadashi But Komari Daughter Mori Firefly [Uncensored L**ked],https://pic.javct.net/poster/20240807/1720470429.jpg,https://javct.net/v/hmgl-177-rm,130,2026-06-16
XRW-690-RM,Big Tits Service Maid!The Master's Heat-huge Semen Is Boobs Bukkake 20 Barrage Special! ! [Uncensored L**ked],https://pic.javct.net/poster/05192026/c9378d8b81.jpg,https://javct.net/v/xrw-690-rm,260,2026-06-16
MFYD-151-RM,"From check-in to check-out, she wears lewd lingerie and cums with the intense piston of her muscular dick! ! Rei Saegusa [Uncensored L**ked]",https://pic.javct.net/poster/05192026/3831dfbff2.jpg,https://javct.net/v/mfyd-151-rm,171,2026-06-16
MFYD-157-RM,"With My Best Lover At A Villa—drenched In Sweat And Passion, Kissing And Licking. Having Sex Over And Over Until Morning, Undisturbed By Anyone… [Uncensored L**ked]",https://pic.javct.net/poster/05192026/a95c26a41a.jpg,https://javct.net/v/mfyd-157-rm,120,2026-06-16
HMGL-176-RM,Embarrassing Body # Shortcut Rookie Tojo Rin [Uncensored L**ked],https://pic.javct.net/poster/04112026/1776913137.jpg,https://javct.net/v/hmgl-176-rm,140,2026-06-16
MFYD-151,"From check-in to check-out, she wears lewd lingerie and cums with the intense piston of her muscular dick! ! Rei Saegusa",https://pic.javct.net/poster/05192026/3831dfbff2.jpg,https://javct.net/v/mfyd-151,171,2026-06-16
MFYD-157,"With My Best Lover At A Villa—drenched In Sweat And Passion, Kissing And Licking. Having Sex Over And Over Until Morning, Undisturbed By Anyone…",https://pic.javct.net/poster/05192026/a95c26a41a.jpg,https://javct.net/v/mfyd-157,120,2026-06-16
FC2PPV-4915538,"Case #136 where an amateur came to do naughty things with her face exposed. The case of Miku-chan (20), a cute fairy who was given a toy and a lot of mouth fuck.",https://pic.javct.net/poster/05192026/2e031dc88c.jpg,https://javct.net/v/fc2ppv-4915538,56,2026-06-16
VNDS-3431-RM,"The Beauty Secrets Of An Insurance Lady: Ryoko Izumi, A Sperm Hunter In Her Sixties [Uncensored L**ked]",https://pic.javct.net/poster/05192026/1509ee1b06.jpg,https://javct.net/v/vnds-3431-rm,110,2026-06-16
SUFU-02-RM,Two Dedicated Business Trip Back Manners Pies [Uncensored L**ked],https://pic.javct.net/poster/05192026/0d3a01f142.jpg,https://javct.net/v/sufu-02-rm,100,2026-06-16
VNDS-3431,"The Beauty Secrets Of An Insurance Lady: Ryoko Izumi, A Sperm Hunter In Her Sixties",https://pic.javct.net/poster/05192026/1509ee1b06.jpg,https://javct.net/v/vnds-3431,110,2026-06-16
ROE-330-SUB,"""Do You Really Get Excited When You See My Underwear...?"" The Middle-aged Woman's Boss Can't Hide Her Feminine Pleasure At The Sight Of Her Subordinate's Perverted Dick Aroused By The Hidd** Camera Footage, So Instead Of Scolding Him, She Disciplines Him By Controlling His Ejaculation... Shoko Matsumoto [English Subtitle]",https://pic.javct.net/poster/20250903/1742494397.jpg,https://javct.net/v/roe-330-sub,120,2026-06-16
390JNT-120,"[Unstoppable desire and overflowing tide] [Big ass short wife x creampie x 3P] [Adult immoral lingerie sex] Sexual desire increases as she gets older, no matter how hard she fucks even though she has a husband, it's not enough... Such a married woman has her first 3P in her life and overflows with the desire to collapse her rationality, squirt, squirt sex crazy, orgasm disordered, dripping wet creampie sex [3 years of marriage, Akine, 30 years old] #37",https://pic.javct.net/poster/05192026/3bd79b7efa.jpg,https://javct.net/v/390jnt-120,119,2026-06-16
390JNT-120-RM,"[Unstoppable desire and overflowing tide] [Big ass short wife x creampie x 3P] [Adult immoral lingerie sex] Sexual desire increases as she gets older, no matter how hard she fucks even though she has a husband, it's not enough... Such a married woman has her first 3P in her life and overflows with the desire to collapse her rationality, squirt, squirt sex crazy, orgasm disordered, dripping wet creampie sex [3 years of marriage, Akine, 30 years old] #37 [Uncensored L**ked]",https://pic.javct.net/poster/05192026/3bd79b7efa.jpg,https://javct.net/v/390jnt-120-rm,119,2026-06-16
T28-520,Pretty Girl In Cute Little Underwear Popular With Cosplayers And Cum Shot Intercourse,https://pic.javct.net/poster/05192026/51dc4f903d.jpg,https://javct.net/v/t28-520,220,2026-06-16
MIST-100-RM,Direct Hit On Dangerous Day !! Soapland Where You Can Make Babies 07 [Uncensored L**ked],https://pic.javct.net/poster/05192026/0d4857d676.jpg,https://javct.net/v/mist-100-rm,145,2026-06-16
MAGURO-076-RM,Nikkan Gal Mixed Bathing Carnal Bathhouse Erotic Too Transformation Older Sister And Lewd Men Nishimura Nina [Uncensored L**ked],https://pic.javct.net/poster/04112026/c6531c902c.jpg,https://javct.net/v/maguro-076-rm,150,2026-06-16
DVAJ-746-RM,"A Beautiful Lingerie Model Is Secretly Fitted With Aphrodisiac-coated Panties, Causing Her Pussy To Tingle And Become Soaking Wet, Her Lower Body Shaking Uncontrollably, And Her Shameless Ahegao Face As She Repeatedly Orgasms And Loses Control Of Her Bladder, Receiving 2800cc Of Cum From Her Drug-fueled Sex Training Session. - Mayu Hazuki [Uncensored L**ked]",https://pic.javct.net/poster/05192026/ca48225b4e.jpg,https://javct.net/v/dvaj-746-rm,137,2026-06-16
