code,title,image_url,page_url,views,date_scraped
WAWA-037-RM,Hawaii 3rd Anniversary Project: Discovered In A Foreign Country! A Tall Beauty From Northern Europe And A Japanese Boy Have Creampie Sex [Uncensored L**ked],https://pic.javct.net/poster/20252204/1747846986.jpg,https://javct.net/v/wawa-037-rm,152,2026-06-22
ONEZ-139-RM,C**ld Making From The Beginning To The End By A Couple I Want A C**ld Video FILE.001 Department Store Clerk Marriage 1 Year Miho (24 Years Old) [Uncensored L**ked],https://pic.javct.net/poster/05192026/b6fdf6a5bb.jpg,https://javct.net/v/onez-139-rm,120,2026-06-22
FC2PPV-4918501,An uncensored G-cup law school plump gal with a fluffy body and plump butt that makes you feel irresistible. She gives a blowjob and cums in her mouth and inserts a raw cock and cums inside her.,https://pic.javct.net/poster/05192026/42a74e5192.jpg,https://javct.net/v/fc2ppv-4918501,58,2026-06-22
VAGU-154-SUB,Next To The Wife Manami Continuous Climax Lingerie Na Yoshikawa [English Subtitle],https://pic.javct.net/poster/04112026/1777042874.jpg,https://javct.net/v/vagu-154-sub,90,2026-06-22
MIDE-845-RM,"An Erotic Awakening For An Abstinent 18 Year Old - Watch Her Cum, Scream, And Writhe As She's Teased And Brought To Multiple Orgasms Rikka Ono [Uncensored L**ked]",https://pic.javct.net/poster/20212709/1637388060.jpg,https://javct.net/v/mide-845-rm,119,2026-06-22
HZGD-127-RM,Married Woman Violated And Creampied Over And Over By Despicable Neighbor Mika Kurosaki [Uncensored L**ked],https://pic.javct.net/poster/20221202/1647307630.jpg,https://javct.net/v/hzgd-127-rm,112,2026-06-22
VENX-316-SUB,"""Do You Get Excited By My Underwear?"" Auntie Adachi Yuri Squeezes Out Every Last Drop Of Her Nephew's Sperm With Her Freshly Removed Panties [English Subtitle]",https://pic.javct.net/poster/20250903/1742492335.jpg,https://javct.net/v/venx-316-sub,100,2026-06-22
MAAN-1176-RM,"[Masochist play with my favorite actor] It's been a long time since I've been horny and I can't stop looking for a deep masochist woman who keeps cumming while screaming w With a face covered in semen, I'm ready for the second round from the cock sucking, intense sex [Thanks Bitch] [Bookmark] [Uncensored L**ked]",https://pic.javct.net/poster/05192026/bef3f7a373.jpg,https://javct.net/v/maan-1176-rm,85,2026-06-22
SDDE-467-RM,"Hospitality Also Shy Oma Co ○ Aviation 7 Adhesion Cowgirl In ""uniforms, Underwear, Naked"", Superb Room Service That Plenty Of Taste Also Ejaculation [Uncensored L**ked]",https://pic.javct.net/poster/20241804/1715726433.jpg,https://javct.net/v/sdde-467-rm,180,2026-06-22
MAAN-1176,"[Masochist play with my favorite actor] It's been a long time since I've been horny and I can't stop looking for a deep masochist woman who keeps cumming while screaming w With a face covered in semen, I'm ready for the second round from the cock sucking, intense sex [Thanks Bitch] [Bookmark]",https://pic.javct.net/poster/05192026/bef3f7a373.jpg,https://javct.net/v/maan-1176,85,2026-06-22
MDBK-288-RM,"In The Morning, When I Woke Up, A Half-naked Female Colleague Next To Me... Was Forcibly Attacked By Me! ? When I Thought My Life Was Over, I Asked For The Continuation Of Yesterday... [Uncensored L**ked]",https://pic.javct.net/poster/20230205/1683350567.jpg,https://javct.net/v/mdbk-288-rm,140,2026-06-22
CLUB-455-RM,Lower-body Touch NG's Sekikaba Captures The Actual Situation Of Vulgar Customers Who Sk**lfully Wards Girls Who Enter The Store And Went Through The Production!Five [Uncensored L**ked],https://pic.javct.net/poster/05192026/0f9ba9a6c1.jpg,https://javct.net/v/club-455-rm,210,2026-06-22
HMGL-177-RM,To**ure Glamourous Nakadashi But Komari Daughter Mori Firefly [Uncensored L**ked],https://pic.javct.net/poster/20240807/1720470429.jpg,https://javct.net/v/hmgl-177-rm,130,2026-06-22
XRW-690-RM,Big Tits Service Maid!The Master's Heat-huge Semen Is Boobs Bukkake 20 Barrage Special! ! [Uncensored L**ked],https://pic.javct.net/poster/05192026/c9378d8b81.jpg,https://javct.net/v/xrw-690-rm,260,2026-06-22
MFYD-151-RM,"From check-in to check-out, she wears lewd lingerie and cums with the intense piston of her muscular dick! ! Rei Saegusa [Uncensored L**ked]",https://pic.javct.net/poster/05192026/3831dfbff2.jpg,https://javct.net/v/mfyd-151-rm,171,2026-06-22
MFYD-157-RM,"With My Best Lover At A Villa—drenched In Sweat And Passion, Kissing And Licking. Having Sex Over And Over Until Morning, Undisturbed By Anyone… [Uncensored L**ked]",https://pic.javct.net/poster/05192026/a95c26a41a.jpg,https://javct.net/v/mfyd-157-rm,120,2026-06-22
HMGL-176-RM,Embarrassing Body # Shortcut Rookie Tojo Rin [Uncensored L**ked],https://pic.javct.net/poster/04112026/1776913137.jpg,https://javct.net/v/hmgl-176-rm,140,2026-06-22
MFYD-151,"From check-in to check-out, she wears lewd lingerie and cums with the intense piston of her muscular dick! ! Rei Saegusa",https://pic.javct.net/poster/05192026/3831dfbff2.jpg,https://javct.net/v/mfyd-151,171,2026-06-22
MFYD-157,"With My Best Lover At A Villa—drenched In Sweat And Passion, Kissing And Licking. Having Sex Over And Over Until Morning, Undisturbed By Anyone…",https://pic.javct.net/poster/05192026/a95c26a41a.jpg,https://javct.net/v/mfyd-157,120,2026-06-22
FC2PPV-4915538,"Case #136 where an amateur came to do naughty things with her face exposed. The case of Miku-chan (20), a cute fairy who was given a toy and a lot of mouth fuck.",https://pic.javct.net/poster/05192026/2e031dc88c.jpg,https://javct.net/v/fc2ppv-4915538,56,2026-06-22
VNDS-3431-RM,"The Beauty Secrets Of An Insurance Lady: Ryoko Izumi, A Sperm Hunter In Her Sixties [Uncensored L**ked]",https://pic.javct.net/poster/05192026/1509ee1b06.jpg,https://javct.net/v/vnds-3431-rm,110,2026-06-22
SUFU-02-RM,Two Dedicated Business Trip Back Manners Pies [Uncensored L**ked],https://pic.javct.net/poster/05192026/0d3a01f142.jpg,https://javct.net/v/sufu-02-rm,100,2026-06-22
VNDS-3431,"The Beauty Secrets Of An Insurance Lady: Ryoko Izumi, A Sperm Hunter In Her Sixties",https://pic.javct.net/poster/05192026/1509ee1b06.jpg,https://javct.net/v/vnds-3431,110,2026-06-22
ROE-330-SUB,"""Do You Really Get Excited When You See My Underwear...?"" The Middle-aged Woman's Boss Can't Hide Her Feminine Pleasure At The Sight Of Her Subordinate's Perverted Dick Aroused By The Hidd** Camera Footage, So Instead Of Scolding Him, She Disciplines Him By Controlling His Ejaculation... Shoko Matsumoto [English Subtitle]",https://pic.javct.net/poster/20250903/1742494397.jpg,https://javct.net/v/roe-330-sub,120,2026-06-22
