code,title,image_url,page_url,views,date_scraped
USYW-002-RM,First Shooting Beautiful Calligrapher AV Fallen Yukika Kakimoto [Uncensored L**ked],https://pic.javct.net/poster/20230206/1687496536.jpg,https://javct.net/v/usyw-002-rm,122,2026-06-04
KSBJ-027-RM,Barefoot Wife Mizuki Nozomi [Uncensored L**ked],https://pic.javct.net/poster/20230908/1694517917.jpg,https://javct.net/v/ksbj-027-rm,111,2026-06-04
CEMD-278-RM,"""Cuckold Shop"" Will NTR Your Wife! 2 White Flowers [Uncensored L**ked]",https://pic.javct.net/poster/20222311/1671854482.jpg,https://javct.net/v/cemd-278-rm,130,2026-06-04
KSBJ-026-RM,Barefoot Wife Maori Orihara [Uncensored L**ked],https://pic.javct.net/poster/06032026/1774855524.jpg,https://javct.net/v/ksbj-026-rm,122,2026-06-04
MYBA-008-RM,Married Wife's Flower Petal Turning Saeki Okayama [Uncensored L**ked],https://pic.javct.net/poster/20252204/1747807477.jpg,https://javct.net/v/myba-008-rm,96,2026-06-04
FERA-174-RM,An Aunt's Enchanting Armpits - A Boy Licking An Older Man Gets Fucked By His Sexual Appeal - Yuko Shiraki [Uncensored L**ked],https://pic.javct.net/poster/20230206/1688008869.jpg,https://javct.net/v/fera-174-rm,95,2026-06-04
VEC-595-RM,Brought A Beautiful Married Woman Who Works At A Part-Time Job Home To Creampie Sex Saki Oishi [Uncensored L**ked],https://pic.javct.net/poster/20230206/1687496475.jpg,https://javct.net/v/vec-595-rm,95,2026-06-04
SAN-173-RM,A Bi-breasted Young Wife Who Was Bullied By A Big Dick Father-in-law Who Needs Nursing Care And Becomes A Neurosis And Becomes A Cripple / Hikaru Minazuki [Uncensored L**ked],https://pic.javct.net/poster/20230908/1696047487.jpg,https://javct.net/v/san-173-rm,130,2026-06-04
MIST-090-RM,The Impact Of Netora Is Video Letter From The Wife That You Love!3 Wife Once Private Video Watching A DVD To Try Masturbation In Their Own Had Reflected A Video That Has Been In The Other Man Out In The Absence Of That Still Was! [Uncensored L**ked],https://pic.javct.net/poster/05192026/04a721a417.jpg,https://javct.net/v/mist-090-rm,160,2026-06-04
MYBA-006-RM,Housewife's Petal Turnover Yuki Nanami [Uncensored L**ked],https://pic.javct.net/poster/20241804/1716078884.jpg,https://javct.net/v/myba-006-rm,110,2026-06-04
JJPP-152,A DVD That Shows How A Handsome Man Brings A Mature Woman Into A Room And Brings It To SEX. 141 ~ I Forcibly Cummed Out ~,https://pic.javct.net/poster/05192026/9d2ea07411.jpg,https://javct.net/v/jjpp-152,125,2026-06-04
JJPP-150,A DVD That Shows How A Handsome Man Brings A Mature Woman Into A Room And Brings It To SEX. 139 ~ I Forcibly Cummed Out As It Is ~,https://pic.javct.net/poster/05192026/6f75512af6.jpg,https://javct.net/v/jjpp-150,120,2026-06-04
JJPP-151,A DVD That Shows How A Handsome Man Brings A Mature Woman Into A Room And Brings It To SEX. 140 ~ I Forcibly Cum Inside Out ~,https://pic.javct.net/poster/05192026/620df70bd1.jpg,https://javct.net/v/jjpp-151,120,2026-06-04
JJPP-146,A DVD That Voyeurs How A Handsome Guy Brings A Mature Woman To The Room And Brings It To SEX. 135 ~ I've Forcibly Pushed It Out ~,https://pic.javct.net/poster/05192026/eb4a667aba.jpg,https://javct.net/v/jjpp-146,125,2026-06-04
JJPP-145,A DVD That Voyeurs How A Handsome Guy Brings A Mature Woman To The Room And Brings It To SEX. 134 ~ I've Forcibly Cummed Out As It Is ~,https://pic.javct.net/poster/05192026/7bb0e308ba.jpg,https://javct.net/v/jjpp-145,120,2026-06-04
ROE-023-RM,"Nice Body Dripping with Sweat, An Excellent Woman Full of Elegance. Yuka Mizuno, 43 Years Old. A MONROE Exclusive - Chapter One - [Uncensored L**ked]",https://pic.javct.net/poster/20212709/1637307713.jpg,https://javct.net/v/roe-023-rm,138,2026-06-04
FC2PPV-4912995,[Individual shooting/outdoor exposure & blowjob] <Big breasted chubby wife> Sagging breasts! A face! Sexless and frustrated sexual body copulation! Obscene big areolas are proof of perverted!!,https://pic.javct.net/poster/05192026/c24682a079.jpg,https://javct.net/v/fc2ppv-4912995,59,2026-06-04
VEC-430-RM,"It Was Just Supposed To Be A One-Time Affair Of Infidelity... She Never Should Have Fucked Him, But Now She's Betraying Her Husband By Going On A Date With His Underling Yuka Mizuno [Uncensored L**ked]",https://pic.javct.net/poster/20212011/1638350581.jpg,https://javct.net/v/vec-430-rm,111,2026-06-04
JJPP-153,A DVD That Shows How A Handsome Man Brings A Mature Woman Into A Room And Brings It To SEX. 142 ~ I Forcibly Cum Inside ~,https://pic.javct.net/poster/05192026/c471cdb2af.jpg,https://javct.net/v/jjpp-153,125,2026-06-04
JJPP-148,A DVD That Shows A Handsome Guy Taking A Mature Woman Into A Room And Bringing It To SEX. 137 ~ I Forcibly Cummed Out As It Is ~,https://pic.javct.net/poster/05192026/ff3631734a.jpg,https://javct.net/v/jjpp-148,125,2026-06-04
300MIUM-1313-RM,"[A sullen boss who gets wet in the back of his throat] Frustrated boss with Chiko in his mouth, sat straight, deep-seated, with a neat face, a sullen and lewd model-like beauty shakes her hips and cums with convulsions and creampies [In-house affair] [Single man (subordinate) x married woman (boss)] case.23 [Uncensored L**ked]",https://pic.javct.net/poster/05192026/af1636dd9d.jpg,https://javct.net/v/300mium-1313-rm,57,2026-06-04
JJPP-144,A DVD That Voyeurs How A Handsome Guy Brings A Mature Woman To The Room And Brings It To SEX. 133 ~ I've Forcibly Cummed Out As It Is ~,https://pic.javct.net/poster/05192026/b19a1720d7.jpg,https://javct.net/v/jjpp-144,115,2026-06-04
JJPP-154,A DVD That Shows How A Handsome Man Brings A Mature Woman Into A Room And Brings It To SEX. 143 ~ I Forcibly Cummed Out As It Is ~,https://pic.javct.net/poster/05192026/ab6fb0eb0d.jpg,https://javct.net/v/jjpp-154,120,2026-06-04
JJPP-147,A DVD That Voyeurs How A Handsome Guy Brings A Mature Woman To The Room And Brings It To SEX. 136 ~ I've Forcibly Cummed As It Is ~,https://pic.javct.net/poster/05192026/f63a016506.jpg,https://javct.net/v/jjpp-147,120,2026-06-04
