code,title,image_url,page_url,views,date_scraped
NINE-123,"A Voluptuous Gem! A Big, Muscular, Swimmer-type Housewife With J-cup Breasts Makes An Emergency Appearance After Being Sexually Frustrated.",https://pic.javct.net/poster/07052026/eea4dc901f.jpg,https://javct.net/v/nine-123,240,2026-07-12
FC2PPV-4937184,Real secret sex with a super beautiful secretary with an outstanding style. A married woman who cums a lot. Super erotic,https://pic.javct.net/poster/07052026/6e0e219098.jpg,https://javct.net/v/fc2ppv-4937184,20,2026-07-12
NSFS-492-RM,"Jealousy, Erection, And Excitement: Rental Wife 11 - Mika Sumikawa [Uncensored L**ked]",https://pic.javct.net/poster/07052026/1637a8e68f.jpg,https://javct.net/v/nsfs-492-rm,116,2026-07-12
IQQQ-37-RM,Married Woman Teacher Kaho Tamaki Gets Wet 10 Times In A Climax Class Where She Can't Speak [Uncensored L**ked],https://pic.javct.net/poster/20222612/1674701478.jpg,https://javct.net/v/iqqq-37-rm,100,2026-07-12
VEC-577-RM,"Immediate Fucking With A Senior's Wife W Affair As Long As Time Permits With The Best Cheating Partner, If You Meet, You'll Only Have Creampie Sex Ayumi Natsukawa [Uncensored L**ked]",https://pic.javct.net/poster/20230302/1678423728.jpg,https://javct.net/v/vec-577-rm,100,2026-07-12
JUC-777-RM,Wakana Kinoshita Chapter 3 Is A Married Woman Gets Fucked Twice [Uncensored L**ked],https://pic.javct.net/poster/07052026/457ed0febc.jpg,https://javct.net/v/juc-777-rm,120,2026-07-12
ACHJ-061-SUB,"Sometimes You Just Want To Be A Slut... Madonna Exclusive, Ultimate Beautiful Mature Woman ""Kimura Rei"" Available For Hire. [English Subtitle]",https://pic.javct.net/poster/20250903/1744911490.jpg,https://javct.net/v/achj-061-sub,110,2026-07-12
ZEAA-83-RM,After An Erotic Married Woman Po-Hunting Sex A Stranger Likes An Erection Mara Shiokawa Sea Urchin [Uncensored L**ked],https://pic.javct.net/poster/20230302/1678332884.jpg,https://javct.net/v/zeaa-83-rm,100,2026-07-12
SCOP-211-RM,Cum OK! ?I've Done Secretly Hiding In Husband And Daughter-in-law Of A Friend During Pregnancy! ? 2. [Uncensored L**ked],https://pic.javct.net/poster/20233001/1675788529.jpg,https://javct.net/v/scop-211-rm,240,2026-07-12
FC2PPV-4937338,"[Big breasts exposed] She was quite shy, but since she had amazing breasts, people started playing around with her big breasts. She is a married woman with quite big breasts.",https://pic.javct.net/poster/07052026/e90474f6ca.jpg,https://javct.net/v/fc2ppv-4937338,71,2026-07-12
ONEZ-159-RM,C**ld Making From Start To Finish By A Couple Wanting C**ldren Video FILE.003 Career Consulting Company Ayano (29 Years Old) [Uncensored L**ked],https://pic.javct.net/poster/07052026/2d963d94dc.jpg,https://javct.net/v/onez-159-rm,120,2026-07-12
KSBJ-067-RM,Busty Wife Ayaka Makimura Who Was Fo**ed To Repay Her Body For Her Husband's Debt [Uncensored L**ked],https://pic.javct.net/poster/04112026/b7bdbdadba.jpg,https://javct.net/v/ksbj-067-rm,120,2026-07-12
JRZE-132-RM,First Shooting Married Woman Documentary Satomi Narushima [Uncensored L**ked],https://pic.javct.net/poster/20233001/1675308656.jpg,https://javct.net/v/jrze-132-rm,120,2026-07-12
SGA-082-RM,"Beautiful Wife Gap E Cup Married Toda Faint 29-year-old AV Debut Usually Too Terrible Is That You And Unfussy, The Reality Was A Pervert Wife Kagidasu The Smell Enters The Switch To The Touch Ji ○! ! 47 [Uncensored L**ked]",https://pic.javct.net/poster/07052026/e4dd967441.jpg,https://javct.net/v/sga-082-rm,130,2026-07-12
ROE-518-RM,"I Could Love You More... So Much More. Reunion 'Reverse' NTR ~A Raw, Unprotected Affair With An Old Friend I Haven't Seen In 10 Years~ [Uncensored L**ked]",https://pic.javct.net/poster/07052026/b07b329f70.jpg,https://javct.net/v/roe-518-rm,120,2026-07-12
DLDSS-511-RM,"""Tonight, I'm going to have a second c**ld with my son-in-law."" Creampie ban lifted Saki Ishida [Uncensored L**ked]",https://pic.javct.net/poster/07052026/7c585f4990.jpg,https://javct.net/v/dldss-511-rm,129,2026-07-12
TARD-004-RM,"I'll let someone with a mother of me, let me Yarra to your mother. Asagiri Ichihana Maya Sawamura [Uncensored L**ked]",https://pic.javct.net/poster/07052026/80722ca7b7.jpg,https://javct.net/v/tard-004-rm,120,2026-07-12
TARD-003-RM,"I'll let someone with a mother of me, let me Yarra to your mother. Kanda Maki generation Sha Akagi [Uncensored L**ked]",https://pic.javct.net/poster/07052026/d115f6785e.jpg,https://javct.net/v/tard-003-rm,130,2026-07-12
CESD-099-RM,Dad And Chills One Wheel Blooming In Downtown Flower Naive Family Sunset Melancholy Super Serious Sex Hatano Yui [Uncensored L**ked],https://pic.javct.net/poster/07052026/cee755a62f.jpg,https://javct.net/v/cesd-099-rm,154,2026-07-12
TARD-005-RM,"I'll inspire a teacher, my teacher let me do what you. [Uncensored L**ked]",https://pic.javct.net/poster/07052026/8c4d52a4a8.jpg,https://javct.net/v/tard-005-rm,120,2026-07-12
AED-213-RM,Incest Vaginal Creampie For A Fifty-Something Mother Kasumi Shimazaki [Uncensored L**ked],https://pic.javct.net/poster/20233001/1675481842.jpg,https://javct.net/v/aed-213-rm,120,2026-07-12
TARD-001-RM,I'll Let You Fuck My Mom So Let Me Fuck Yours. Sayuri Takizawa Yoshie Fujisawa [Uncensored L**ked],https://pic.javct.net/poster/20221202/1645004258.jpg,https://javct.net/v/tard-001-rm,114,2026-07-12
259LUXU-235,Luxury TV 235,https://pic.javct.net/poster/07052026/8397e898d9.jpg,https://javct.net/v/259luxu-235,58,2026-07-12
JMD-107-RM,"I, Edition ... Really Erotic In [Uncensored L**ked]",https://pic.javct.net/poster/07052026/db0f849ac6.jpg,https://javct.net/v/jmd-107-rm,140,2026-07-12
