code,title,image_url,page_url,views,date_scraped
ALDN-465-SUB,Female CEO's Sexual Desire Yuko Shiraki [English Subtitle],https://pic.javct.net/poster/20252204/1748018685.jpg,https://javct.net/v/aldn-465-sub,130,2026-07-13
JJGG-004,"A slender but busty married woman who was left alone for 5 years. ""I'm sorry for being such an old woman..."" the trembling 45-year-old housewife smiled and begged for creampie. Keori Nakamura",https://pic.javct.net/poster/07052026/07a9ba2abb.jpg,https://javct.net/v/jjgg-004,118,2026-07-13
BIJN-237-RM,THE Document Instinct Barely Climax SEX Colossal Breasts I Cup Frustrated Wife Hana Himesaki [Uncensored L**ked],https://pic.javct.net/poster/20233001/1675481467.jpg,https://javct.net/v/bijn-237-rm,113,2026-07-13
BASJ-003-RM,"Yurika Aoi, A Wife Who Awakens A Slut After Being Dated By Her Husband's NTR Propensity [Uncensored L**ked]",https://pic.javct.net/poster/20233001/1676084042.jpg,https://javct.net/v/basj-003-rm,126,2026-07-13
CHCH-030-RM,Grandma And Her Grandson Have A Soothing Colossal Breasted Beautiful Witch Who Can't Believe She Has A Grandc**ld Her Sperm Krappo Small Devil Rich Breast Sex Activity Hisako (56 Years Old/J Cup) [Uncensored L**ked],https://pic.javct.net/poster/20233001/1676689069.jpg,https://javct.net/v/chch-030-rm,110,2026-07-13
CHUC-045-RM,"Mari Ueto, A Minato Ward Married Woman Who Hides From Her Husband Working Overseas And Makes Her Cum Inside With Her Pocket Money (31 Years Old) [Uncensored L**ked]",https://pic.javct.net/poster/20230908/1695786555.jpg,https://javct.net/v/chuc-045-rm,60,2026-07-13
KSBJ-237-RM,A Sex-Dependent Wife Who Hunts Men Indiscriminately Izumi Sakuma [Uncensored L**ked],https://pic.javct.net/poster/20230302/1677902676.jpg,https://javct.net/v/ksbj-237-rm,120,2026-07-13
ALDN-461-SUB,Lucky Man Traveling Alone Yukine Nakazaki [English Subtitle],https://pic.javct.net/poster/20252204/1746810956.jpg,https://javct.net/v/aldn-461-sub,115,2026-07-13
JRZE-133-RM,First Shooting Married Woman Document Yuka Takagi [Uncensored L**ked],https://pic.javct.net/poster/20233001/1675913706.jpg,https://javct.net/v/jrze-133-rm,120,2026-07-13
MDVHJ-074-RM,"When My Husband Is Away From Home At Work, I'm Going Crazy With My Unfaithful Father-In-Law Who Has A Big Cock... Chapter 2 Miyu Hirosue [Uncensored L**ked]",https://pic.javct.net/poster/20222612/1674789548.jpg,https://javct.net/v/mdvhj-074-rm,110,2026-07-13
JUY-355-RM,I Can't Tell My Dear Husband I Like Cock That Reaches The Back Of My Throat Hikari Anzai [Uncensored L**ked],https://pic.javct.net/poster/20220406/1656495894.jpg,https://javct.net/v/juy-355-rm,116,2026-07-13
C-2977-RM,"Please Sleep With My Wife, Ririka (30) 135 [Uncensored L**ked]",https://pic.javct.net/poster/07052026/ea98a30be4.jpg,https://javct.net/v/c-2977-rm,150,2026-07-13
SGA-084-RM,Wife You Are Tired Of Usually A Bland Sex With E Cup Housewife Aikawa Hiro 32-year-old AV Debut Husband Too Much Propensity Awakening Does Not Stop The Excitement In Intimacies With Others Barre Inevitable Public Place! ! 48 [Uncensored L**ked],https://pic.javct.net/poster/07052026/9722be065a.jpg,https://javct.net/v/sga-084-rm,130,2026-07-13
SPRD-817-SUB,Is Rubbed His Son Again And Again Mother Kondo Ikumi [English Subtitle],https://pic.javct.net/poster/20230207/1689120615.jpg,https://javct.net/v/sprd-817-sub,130,2026-07-13
GS-2143-RM,Married Woman's Hot Spring Romance Trip 181 [Uncensored L**ked],https://pic.javct.net/poster/07052026/4e84ac2a45.jpg,https://javct.net/v/gs-2143-rm,160,2026-07-13
ALDN-596-RM,The Moment I Fell In Love With A Mature Woman - Rieko Hiraoka [Uncensored L**ked],https://pic.javct.net/poster/07052026/cfd5294909.jpg,https://javct.net/v/aldn-596-rm,105,2026-07-13
VNDS-7064-RM,Mamatomo!Wheels 2 Extra Number Of Spears Friend [Uncensored L**ked],https://pic.javct.net/poster/07052026/4b94e93ceb.jpg,https://javct.net/v/vnds-7064-rm,180,2026-07-13
TARD-011-RM,"I'll Inspire My Chief Mourner, Let Me Do What Kimi's Chief Mourner. [Uncensored L**ked]",https://pic.javct.net/poster/07052026/74b08373df.jpg,https://javct.net/v/tard-011-rm,120,2026-07-13
TARD-006-RM,"I'll Inspire My Manager, General Manager Let Me Do What You. [Uncensored L**ked]",https://pic.javct.net/poster/07052026/8805ae8e29.jpg,https://javct.net/v/tard-006-rm,120,2026-07-13
TARD-008-RM,"I'll Inspire My Mother, Let Me Do What Your Mother. Sha Teen C**ld Katagiri Rika Fujishita [Uncensored L**ked]",https://pic.javct.net/poster/07052026/52b785de2f.jpg,https://javct.net/v/tard-008-rm,120,2026-07-13
ANB-216-RM,I Became A Mother's Toy And Fainted In Agony! Beautiful Mother-in-law's Bombshell Body! Shizuka Momoi [Uncensored L**ked],https://pic.javct.net/poster/20233001/1675481780.jpg,https://javct.net/v/anb-216-rm,110,2026-07-13
TARD-014-RM,I Will Let You Fuck My Wife If You Will Let Me Fuck Yours. Nao Hayakawa Saeko Kisaragi [Uncensored L**ked],https://pic.javct.net/poster/07052026/755217b564.jpg,https://javct.net/v/tard-014-rm,100,2026-07-13
259LUXU-255,Luxury TV 253,https://pic.javct.net/poster/07052026/5f427d4220.jpg,https://javct.net/v/259luxu-255,57,2026-07-13
259LUXU-252,Luxury TV 227,https://pic.javct.net/poster/07052026/047aea92ba.jpg,https://javct.net/v/259luxu-252,59,2026-07-13
