code,title,image_url,page_url,views,date_scraped
HODV-21596-RM,I Filmed An AV! A Convenient Devilish Little Slut With G-cup Breasts - Yuka Hoshi [Uncensored L**ked],https://static.javct.net/poster/hodv-21596.jpg,https://javct.net/v/hodv-21596-rm,149,2026-06-04
GVG-804-RM,Ma ○ Ko Device Bondage VI Iron Restraint Ma Ko To**ure Oshimi Hiki [Uncensored L**ked],https://pic.javct.net/poster/05192026/be75c3d6d6.jpg,https://javct.net/v/gvg-804-rm,125,2026-06-04
UMD-878-RM,"[Sad News] After This, These Big Tits Will Be Deliciously Served By Masseuse Uncles! ! Five [Uncensored L**ked]",https://pic.javct.net/poster/20230207/1689223407.jpg,https://javct.net/v/umd-878-rm,190,2026-06-04
FC2PPV-4913897,A wonderful single woman in her 30s with beautiful skin and a divorce who is raising her mother and continuing her career is here.,https://pic.javct.net/poster/05192026/d6616a4273.jpg,https://javct.net/v/fc2ppv-4913897,58,2026-06-04
JUKF-132-RM,Holiday Teacher Kasumi Sena [Uncensored L**ked],https://pic.javct.net/poster/04112026/06f3a2095a.jpg,https://javct.net/v/jukf-132-rm,150,2026-06-04
GS-1751-RM,Asian Traditional Massage Shop Voyeur 91 [Uncensored L**ked],https://pic.javct.net/poster/05192026/3075b005e8.jpg,https://javct.net/v/gs-1751-rm,120,2026-06-04
IENE-931-RM,Always Nipple To**ure Men's Esthetic 2 [Uncensored L**ked],https://pic.javct.net/poster/05192026/2f0ac29d41.jpg,https://javct.net/v/iene-931-rm,230,2026-06-04
UMD-877-RM,Infiltrate! ! ●●2 Minutes Walk From The North Exit Of The Station! This Is The Rumored Dark Reflex! ! 2 [Uncensored L**ked],https://pic.javct.net/poster/20230207/1689223470.jpg,https://javct.net/v/umd-877-rm,120,2026-06-04
FC2PPV-4912083,☆4 ejaculations☆ E cup beautiful big breasted nursery teacher (20) Squirting SEX in agony with great excitement due to the big thick penis that reaches deep inside,https://pic.javct.net/poster/05192026/83e75fd418.jpg,https://javct.net/v/fc2ppv-4912083,93,2026-06-04
FSDSS-138,Vagina Iki Medium Strong ● Looking At The Camera Portio Development Beauty Treatment Salon Natsu Tojo,https://pic.javct.net/poster/05192026/fd07802662.jpg,https://javct.net/v/fsdss-138,120,2026-06-04
MIST-233,Renumi Claire Massage With Foam Cleansing Body Serving In Woman On Style,https://pic.javct.net/poster/05192026/94c7aa7f63.jpg,https://javct.net/v/mist-233,125,2026-06-04
SIMA-038-RM,It's bad [Uncensored L**ked],https://pic.javct.net/poster/05192026/2f3089c590.jpg,https://javct.net/v/sima-038-rm,54,2026-06-04
FOD-004-RM,"""If I Were Your Husband, I Wouldn't Let You Feel So Lonely..."" The One Magic Phrase That Allows Me, A Socially Awkward Guy, To See Through A Dependent, Mentally Unstable Housewife, Trap Her In My Heart, And Drive Her Crazy () [Uncensored L**ked]",https://pic.javct.net/poster/05192026/88d1b283d8.jpg,https://javct.net/v/fod-004-rm,126,2026-06-04
TEAM-068,Latest Rejuvenated Massage Us To Your Service The Best Of Healing In Tsujimoto Apricots,https://pic.javct.net/poster/05192026/5f4c33d2bc.jpg,https://javct.net/v/team-068,120,2026-06-04
IMJO-008-RM,[Female style voyeur] The real sexual reality of modern girls captured by the camera [Women's After 5] [Seina] [Uncensored L**ked],https://pic.javct.net/poster/05192026/beb8ed6d16.jpg,https://javct.net/v/imjo-008-rm,71,2026-06-04
FC2PPV-4909653,[Individual video] Deep sex at a love hotel with a housewife,https://pic.javct.net/poster/05192026/ebd4edb668.jpg,https://javct.net/v/fc2ppv-4909653,40,2026-06-04
IMJO-008,[Female style voyeur] The real sexual reality of modern girls captured by the camera [Women's After 5] [Seina],https://pic.javct.net/poster/05192026/beb8ed6d16.jpg,https://javct.net/v/imjo-008,71,2026-06-04
UMD-875-RM,This Woman Is Convinced! ! Regular Customers Begged To Enter Immediately! ! Sudden Oil Massage 3 [Uncensored L**ked],https://pic.javct.net/poster/20230207/1689223597.jpg,https://javct.net/v/umd-875-rm,120,2026-06-04
GONE-062-RM,Erotic Black Sister Nozomi Arimura [Uncensored L**ked],https://pic.javct.net/poster/20230207/1689132084.jpg,https://javct.net/v/gone-062-rm,143,2026-06-04
HUNTB-618-RM,"""If It Feels So Good, Would You Like To Do More?"" If You Extend It, Your Service Will Not Stop! ? A Local Ryokan's Too Big Breasts Masseuse. [Uncensored L**ked]",https://pic.javct.net/poster/20230207/1688701324.jpg,https://javct.net/v/huntb-618-rm,180,2026-06-04
FOCS-062-RM,"After School For Girls In Uniform ... In Front Of My Hated Father, I'm Going To Be R**ed By A Dirty Uncle. Urara Kanon [Uncensored L**ked]",https://pic.javct.net/poster/20221202/1650012463.jpg,https://javct.net/v/focs-062-rm,120,2026-06-04
ONEZ-117-RM,Premium Oriental Married Live Birth Spring Massage Vol.001 Sakuragi Yuuki Sound [Uncensored L**ked],https://pic.javct.net/poster/05192026/4ad9304e97.jpg,https://javct.net/v/onez-117-rm,130,2026-06-04
SSNI-198,Big Bicker Sexual Feeling Development Frustration · Convulsions · Shrimp Warp Massage Tsujimoto Ann,https://pic.javct.net/poster/05192026/2f4405e504.jpg,https://javct.net/v/ssni-198,150,2026-06-04
FC2PPV-4910714,"Shino (19\) Amateur in the countryside's 3rd shoot. I put a thick vibrator in his anus, and with a piledriver, I shoved vegetables into his vagina and anus.",https://pic.javct.net/poster/05192026/214d9560ef.jpg,https://javct.net/v/fc2ppv-4910714,123,2026-06-04
