code,title,image_url,page_url,views,date_scraped
HUNTC-547-RM,Wall Butt Massage [Uncensored L**ked],https://pic.javct.net/poster/05192026/2420e5a5bf.jpg,https://javct.net/v/huntc-547-rm,180,2026-06-07
ROYD-321-RM,"I couldn't stand the beautiful beauty salon girl at the body wash salon where touching is prohibited, so I touched her with feathers. The ban was lifted unexpectedly after real negotiations, even though he was prepared to be banned. Himari Kinoshita [Uncensored L**ked]",https://pic.javct.net/poster/05192026/4110cdc002.jpg,https://javct.net/v/royd-321-rm,129,2026-06-07
CLUB-857-RM,"Busty Bikini Slut Beauty Salon That Seduces With Tiny Swimsuits, Twists And Turns Nipples, And Makes Them Cum Inside Raw [Uncensored L**ked]",https://pic.javct.net/poster/20241115/1732854944.jpg,https://javct.net/v/club-857-rm,220,2026-06-07
FUFU-027-RM,I Asked The Masseuse To The Familiar Erogenous In Secret To His Wife Chaste C**ld Annals Of C**ld ... T (38) R (24) [Uncensored L**ked],https://pic.javct.net/poster/05192026/c084d869a6.jpg,https://javct.net/v/fufu-027-rm,90,2026-06-07
HODV-21612-SUB,Female Fuck Buddy That Is Just Perfect. 8.5 Head To Toe With Luscious G-cup Tits On This Gal. Sarina Momonaga [English Subtitle],https://pic.javct.net/poster/20212709/1633176332.jpg,https://javct.net/v/hodv-21612-sub,149,2026-06-07
SNIS-067,Screaming of Yume乃A how cum when,https://pic.javct.net/poster/05192026/bd6f613797.jpg,https://javct.net/v/snis-067,180,2026-06-07
IESM-069-RM,Miina Konno Bondage Lifted [Uncensored L**ked],https://pic.javct.net/poster/20230206/1687403752.jpg,https://javct.net/v/iesm-069-rm,115,2026-06-07
STAR-767-SUB,Iori Furukawa Men's Beauty Salon Out In That Whisper Your Ear In Gently Dirty [English Subtitle],https://pic.javct.net/poster/06032026/1775114919.jpg,https://javct.net/v/star-767-sub,180,2026-06-07
ROYD-321,"I couldn't stand the beautiful beauty salon girl at the body wash salon where touching is prohibited, so I touched her with feathers. The ban was lifted unexpectedly after real negotiations, even though he was prepared to be banned. Himari Kinoshita",https://pic.javct.net/poster/05192026/4110cdc002.jpg,https://javct.net/v/royd-321,129,2026-06-07
NNPJ-248-RM,"""There's A Big Tits Bikini Amateur There!New Sunscreen Oil (Actually Contains Aphrodisiac) Why Do Not You Paint? "" Nodori Niururu Nipple Massage Persistently Nectaroli Tightly Boobs!I'm Too Excited And I Want To Get Fucked, So I Got Sexually Intense As It Is! [Uncensored L**ked]",https://pic.javct.net/poster/20230205/1685160177.jpg,https://javct.net/v/nnpj-248-rm,190,2026-06-07
HUNTC-547,Wall Butt Massage,https://pic.javct.net/poster/05192026/2420e5a5bf.jpg,https://javct.net/v/huntc-547,180,2026-06-07
AVZG-046-RM,Voyeur beauty salon! Currently being distributed without permission! ! Big breasted sisters Emiri & Yu [Uncensored L**ked],https://pic.javct.net/poster/05192026/9574025f68.jpg,https://javct.net/v/avzg-046-rm,119,2026-06-07
YOCH-032-RM,"After 15 years of marriage, a sexless 39-year-old married woman relapses in a massage course for re-employment... She can't stand the store manager's dirty hands and feels it all... Her frustrated pussy goes wild and begs for raw sex and creampie... The immoral climax... Saki Miizumi, 39 years old [Uncensored L**ked]",https://pic.javct.net/poster/05192026/a7c32a49f3.jpg,https://javct.net/v/yoch-032-rm,126,2026-06-07
YOCH-032,"After 15 years of marriage, a sexless 39-year-old married woman relapses in a massage course for re-employment... She can't stand the store manager's dirty hands and feels it all... Her frustrated pussy goes wild and begs for raw sex and creampie... The immoral climax... Saki Miizumi, 39 years old",https://pic.javct.net/poster/05192026/a7c32a49f3.jpg,https://javct.net/v/yoch-032,126,2026-06-07
HODV-21596-RM,I Filmed An AV! A Convenient Devilish Little Slut With G-cup Breasts - Yuka Hoshi [Uncensored L**ked],https://static.javct.net/poster/hodv-21596.jpg,https://javct.net/v/hodv-21596-rm,149,2026-06-07
GVG-804-RM,Ma ○ Ko Device Bondage VI Iron Restraint Ma Ko To**ure Oshimi Hiki [Uncensored L**ked],https://pic.javct.net/poster/05192026/be75c3d6d6.jpg,https://javct.net/v/gvg-804-rm,125,2026-06-07
UMD-878-RM,"[Sad News] After This, These Big Tits Will Be Deliciously Served By Masseuse Uncles! ! Five [Uncensored L**ked]",https://pic.javct.net/poster/20230207/1689223407.jpg,https://javct.net/v/umd-878-rm,190,2026-06-07
FC2PPV-4913897,A wonderful single woman in her 30s with beautiful skin and a divorce who is raising her mother and continuing her career is here.,https://pic.javct.net/poster/05192026/d6616a4273.jpg,https://javct.net/v/fc2ppv-4913897,58,2026-06-07
JUKF-132-RM,Holiday Teacher Kasumi Sena [Uncensored L**ked],https://pic.javct.net/poster/04112026/06f3a2095a.jpg,https://javct.net/v/jukf-132-rm,150,2026-06-07
GS-1751-RM,Asian Traditional Massage Shop Voyeur 91 [Uncensored L**ked],https://pic.javct.net/poster/05192026/3075b005e8.jpg,https://javct.net/v/gs-1751-rm,120,2026-06-07
IENE-931-RM,Always Nipple To**ure Men's Esthetic 2 [Uncensored L**ked],https://pic.javct.net/poster/05192026/2f0ac29d41.jpg,https://javct.net/v/iene-931-rm,230,2026-06-07
UMD-877-RM,Infiltrate! ! ●●2 Minutes Walk From The North Exit Of The Station! This Is The Rumored Dark Reflex! ! 2 [Uncensored L**ked],https://pic.javct.net/poster/20230207/1689223470.jpg,https://javct.net/v/umd-877-rm,120,2026-06-07
FC2PPV-4912083,☆4 ejaculations☆ E cup beautiful big breasted nursery teacher (20) Squirting SEX in agony with great excitement due to the big thick penis that reaches deep inside,https://pic.javct.net/poster/05192026/83e75fd418.jpg,https://javct.net/v/fc2ppv-4912083,93,2026-06-07
FSDSS-138,Vagina Iki Medium Strong ● Looking At The Camera Portio Development Beauty Treatment Salon Natsu Tojo,https://pic.javct.net/poster/05192026/fd07802662.jpg,https://javct.net/v/fsdss-138,120,2026-06-07
