code,title,image_url,page_url,views,date_scraped
BKD-180,Maternal And C**ld Mating - Tenryu River Road - Ashikawa Ishikawa,https://pic.javct.net/poster/07052026/de44544ab4.jpg,https://javct.net/v/bkd-180,110,2026-07-05
567BEAF-221,"Unsatisfied with her husband's lukewarm sex, she seeks stimulation and ends up in endless acme hell with non-stop sex with her big dick. Sumire, a 28-year-old wife with a perverted desire.",https://pic.javct.net/poster/07052026/a7fff96e77.jpg,https://javct.net/v/567beaf-221,70,2026-07-05
GOOD-012-RM,Wife Migui Adultery Trip Ann (Pseudonym) 32 Years Old An Komatsu [Uncensored L**ked],https://pic.javct.net/poster/20230302/1678591621.jpg,https://javct.net/v/good-012-rm,102,2026-07-05
CEMD-324-RM,"""I Won't Allow This To End"" A Slut Who Doesn't Know How To Blame Until The Sperm Doesn't Come Out! ! Yui Hatano [Uncensored L**ked]",https://pic.javct.net/poster/20230104/1682139264.jpg,https://javct.net/v/cemd-324-rm,126,2026-07-05
AKDL-071-RM,I was a J-kei 20 years ago... Yumika Saeki [Uncensored L**ked],https://pic.javct.net/poster/04112026/ceb11513b6.jpg,https://javct.net/v/akdl-071-rm,61,2026-07-05
NACX-174,21 Mature Women In Their 50s Having Sex And Masturbating,https://pic.javct.net/poster/07052026/618bcbdbd4.jpg,https://javct.net/v/nacx-174,243,2026-07-05
SKM-1002-RM,Pantyhose Fired Can Not Be Age Fifty Legs Wife Endure!Dripping!Beto Arrive!Stroked Turn!Turn Stroked Wet Co ○ Ma! Ikumi Kondo Yuko Anritsu Kaede Tsutsumi [Uncensored L**ked],https://pic.javct.net/poster/07052026/f060b1e91f.jpg,https://javct.net/v/skm-1002-rm,120,2026-07-05
GOUL-003-RM,Rich Raw Squirrel From The Arcade Date! ! I Had An Orgy Sex With A Frustrated Beautiful Wife [Uncensored L**ked],https://pic.javct.net/poster/20230302/1678936450.jpg,https://javct.net/v/goul-003-rm,170,2026-07-05
JUY-915-RM,The Married Woman Babes From Next Door Were Fighting Over Me In A Dream Cum True Harlem New Life Together [Uncensored L**ked],https://pic.javct.net/poster/20221904/1652060363.jpg,https://javct.net/v/juy-915-rm,148,2026-07-05
VOD-016-RM,Real Amateur Wife Document 2nd [Ideal Beauty Big Tits] First 3P Sex With Athletic Wife Who Is Enchanted By Perfect Form Of I Cup Asuka Ihara [Uncensored L**ked],https://pic.javct.net/poster/20230302/1680238734.jpg,https://javct.net/v/vod-016-rm,120,2026-07-05
SPRD-801-SUB,Ultra Authentic Carnal Fakecest Illustrated - Mother Massaged By Her Own Son Yoshie Mizuno [English Subtitle],https://pic.javct.net/poster/20221108/1662965131.jpg,https://javct.net/v/sprd-801-sub,120,2026-07-05
KSBJ-058-RM,"The Cuckold Who Fell In A Bag, Wife Ikawa Nozomi [Uncensored L**ked]",https://pic.javct.net/poster/04112026/4b65ce093d.jpg,https://javct.net/v/ksbj-058-rm,121,2026-07-05
CAMP-003-RM,Assignation Sasaki Love Sea Resort In American Cruiser Affair Every Time [Uncensored L**ked],https://pic.javct.net/poster/07052026/5ecc927964.jpg,https://javct.net/v/camp-003-rm,140,2026-07-05
JUY-341-RM,Document! !Exclusive Actress Verification Plan Does A Married Wife Yuka Kana Who Is A Talented Guy Gets Urged By A Chara Man And Sexed? [Uncensored L**ked],https://pic.javct.net/poster/20220707/1659926271.jpg,https://javct.net/v/juy-341-rm,150,2026-07-05
VENX-202-RM,"I'm On The Breasts, But... Bathing Sex With A Super Type Busty Sister-In-Law Sakura Minami [Uncensored L**ked]",https://pic.javct.net/poster/20230302/1679632087.jpg,https://javct.net/v/venx-202-rm,95,2026-07-05
VEC-516-RM,The Secret Of Only Two People With My Friend's Mother. Forcibly Having Sex With An Aunt ... Mayu Suzuki [Uncensored L**ked],https://pic.javct.net/poster/20212011/1642766546.jpg,https://javct.net/v/vec-516-rm,100,2026-07-05
KSBJ-066-SUB,Naked Wife Rei Takatsuki [English Subtitle],https://pic.javct.net/poster/04112026/2cc86c6609.jpg,https://javct.net/v/ksbj-066-sub,123,2026-07-05
SKM-1003-RM,Legs Wife Wife Can Not Gaman Fire Pantyhose!Shirataru!Sticky!I Turn Around!I Sweat The Damp Smack! Ayako Kanoe Yayoi Amano Tsubaki Kato [Uncensored L**ked],https://pic.javct.net/poster/07052026/5246d7aeed.jpg,https://javct.net/v/skm-1003-rm,120,2026-07-05
MIST-518,"Grotesque Masturbation ~The Grotesquer The Masturbation, The Better~ Kana Shiokawa, Sumire Mihara, Kazuna Tsukihara, Mizuki Narazaki",https://pic.javct.net/poster/07052026/4e7bdf9b9c.jpg,https://javct.net/v/mist-518,154,2026-07-05
JUY-954-RM,"Usually This Big Sister-In-Law Is A Plain Jane... But The Truth is, She's Got A Hot Body And Is A Horny Orgasmic Slut Who Will Never Stop No Matter How Many Times She Cums!! Shiori Kamisaki [Uncensored L**ked]",https://pic.javct.net/poster/20212011/1640274237.jpg,https://javct.net/v/juy-954-rm,121,2026-07-05
MIST-501,"Obashot Auntie's, By Auntie, For Auntie Maniacs, Auntie Sex Mami Auntie 40 Years Old Kotomiya Mami",https://pic.javct.net/poster/07052026/59fe786f63.jpg,https://javct.net/v/mist-501,199,2026-07-05
VOD-059-RM,"Virgins, Gather 'round!! A Documentary Of Your First Time With A Cumshot, Where Ouka Rin Uses Ultra-dirty Words To Entice You To Ejaculation. [Uncensored L**ked]",https://pic.javct.net/poster/05192026/912efbf819.jpg,https://javct.net/v/vod-059-rm,105,2026-07-05
VENX-374-RM,"Driven By Sexual Frustration, I Applied To Be In An Adult Film, Only To Find Out The Actor Who Showed Up Was My Son. I Couldn't Say Anything At The Time, So We Had Sex, And It Felt So Good That We Did It A Lot When I Got Home. - Chisato Shoda [Uncensored L**ked]",https://pic.javct.net/poster/05192026/3b62075590.jpg,https://javct.net/v/venx-374-rm,100,2026-07-05
KSBJ-067-SUB,Busty Wife Ayaka Makimura Who Was Fo**ed To Repay Her Body For Her Husband's Debt [English Subtitle],https://pic.javct.net/poster/04112026/b7bdbdadba.jpg,https://javct.net/v/ksbj-067-sub,120,2026-07-05
