code,title,image_url,page_url,views,date_scraped
MYBA-049-RM,Married Woman's Petal Flipping Sena Kasumi [Uncensored L**ked],https://pic.javct.net/poster/20221108/1660365360.jpg,https://javct.net/v/myba-049-rm,154,2026-06-20
NKKD-282-RM,"This Time, My Wife (44) Was Caught By A Part-time Job (20) ... → I'm Sorry, So Please Release The AV As It Is. [Uncensored L**ked]",https://pic.javct.net/poster/20230205/1683263102.jpg,https://javct.net/v/nkkd-282-rm,170,2026-06-20
XMOM-56-RM,Sukeban Reiko 42 Years Old Reiko Kobayakawa [Uncensored L**ked],https://pic.javct.net/poster/20230205/1683776694.jpg,https://javct.net/v/xmom-56-rm,95,2026-06-20
VEMA-200-RM,"The Remarriage Partner Brought By My Father Was Mr. Saki, A Nurse Who I Admired While I Was In The Hospital. Jealous Erection Creampie Sex Saki Oishi [Uncensored L**ked]",https://pic.javct.net/poster/20230205/1683262497.jpg,https://javct.net/v/vema-200-rm,100,2026-06-20
JUR-762-RM,The Days Of Endless Gangbangs With Unprotected Sex Never End. [Uncensored L**ked],https://pic.javct.net/poster/05192026/cb1f8a7c5b.jpg,https://javct.net/v/jur-762-rm,120,2026-06-20
FC2PPV-4923504,"[Uncensored x personal photography] * * pyjpx * jsps Ara Furuki, a mature wife with pubic hair and gray hair, once again... her husband was absent from the pachinko, and the mature woman BBA cummed with the use of her first toy at the same time when she was lonely.",https://pic.javct.net/poster/05192026/fe4fa6deea.jpg,https://javct.net/v/fc2ppv-4923504,67,2026-06-20
ROE-506-RM,"My Beloved Mother And Older Brother Were Having Sex Behind My Back. I Fuck My Mother, Who Has A Womanly Side To Her, Just Like My Brother Did. Codependent Mother-son Incest. [Uncensored L**ked]",https://pic.javct.net/poster/05192026/3346fa0c1e.jpg,https://javct.net/v/roe-506-rm,120,2026-06-20
FC2PPV-4923358,[Uncensored/Creampie/Face exposed/Bonus included] A married woman who only knows men from her arranged marriage husband,https://pic.javct.net/poster/05192026/8136c9fa40.jpg,https://javct.net/v/fc2ppv-4923358,59,2026-06-20
JRZE-306-RM,First Shooting 50 Years Old Wife Documentary Ren Asakura [Uncensored L**ked],https://pic.javct.net/poster/05192026/34907a6e68.jpg,https://javct.net/v/jrze-306-rm,118,2026-06-20
KSBJ-050-SUB,"Chisato Shojita, A Mother-in-law Who Drowned In Playing With Her Son-in-law [English Subtitle]",https://pic.javct.net/poster/04112026/1776839799.jpg,https://javct.net/v/ksbj-050-sub,115,2026-06-20
MIST-517,"Auntie Shot: Auntie Sex By Aunties, For Auntie Enthusiasts, Auntie Madoka, 35 Years Old",https://pic.javct.net/poster/05192026/2943621c93.jpg,https://javct.net/v/mist-517,176,2026-06-20
CEMD-857,Thorough Analysis Of Misaki Kanna ~A Whole Day Of Non-stop Cunnilingus And Orgasms~ 2,https://pic.javct.net/poster/05192026/7a80ec7ca7.jpg,https://javct.net/v/cemd-857,177,2026-06-20
CEAD-753,"K-cup Soothing Mature Beauty 'Shiori Tsukada' ~ Three Consecutive Cumshots As She Falls Into Depravity With Her Busty Esthetician, Secret Social Media Account, And Big-butt Housekeeper!!",https://pic.javct.net/poster/05192026/9fbc2b2326.jpg,https://javct.net/v/cead-753,150,2026-06-20
JUR-764-RM,"Neighborhood Camp NTR: Shocking Footage Of A Wife Cheating On Her Husband And Getting Creampied Over And Over Again In A Tent, [Viewer Discretion Advised] - Shinohara Iyo [Uncensored L**ked]",https://pic.javct.net/poster/05192026/36d884a8a9.jpg,https://javct.net/v/jur-764-rm,150,2026-06-20
NACT-143,Squeeze Out Every Last Drop Of Semen Until Your Balls Are Empty! Mobile Oil Massage By Shiho Terashima,https://pic.javct.net/poster/05192026/5125f51692.jpg,https://javct.net/v/nact-143,123,2026-06-20
NHDTA-968-RM,Oyakodon 4 Out In The Quagmire Can Not Backtrack Seen In The Mother The Place You've Committed A Sister [Uncensored L**ked],https://pic.javct.net/poster/05192026/ff600e5787.jpg,https://javct.net/v/nhdta-968-rm,240,2026-06-20
NACT-144,Bookings Are Pouring In! 100% Satisfaction Guaranteed! Mature Beauty Cosplay Delivery: Hikari Hime,https://pic.javct.net/poster/05192026/8882f2e74f.jpg,https://javct.net/v/nact-144,110,2026-06-20
SMOM-007,"Shin · Abnormal sexual intercourse 40 mother and c**ld Reiko Yamaguchi, a prostitute mature mother who● is embraced by her father-in-law and confused by her son",https://pic.javct.net/poster/05192026/92276e93a6.jpg,https://javct.net/v/smom-007,115,2026-06-20
JUR-775-RM,"""...I Can Just Lick The Tip, So Cheer Up?"" Her Mother, Seeing His Uncircumcised Virgin Dick, Took Pity On Him And Gave Him A Thorough, Deep Blowjob, Sucking Only The Glans. [Uncensored L**ked]",https://pic.javct.net/poster/05192026/b27747123b.jpg,https://javct.net/v/jur-775-rm,140,2026-06-20
XMOM-115,"Tongue-licking Pervert Club: A Plump, Masochistic, Big-breasted Housewife Licks A Huge Cock With Her Seductive Tongue. Mizuki Shirayuki",https://pic.javct.net/poster/05192026/3a82bfffda.jpg,https://javct.net/v/xmom-115,105,2026-06-20
NSFS-488,"Because I was cheeky, I r**ed her.My wife was fo**ed to get wet 2, Mio Aizawa.",https://pic.javct.net/poster/05192026/8dcda3d954.jpg,https://javct.net/v/nsfs-488,131,2026-06-20
JUR-736-RM,"""She Was Actually Fo**ed Into It, Wasn't She...?"" My Aunt Kana, Whom I Secretly Harbored Feelings For, Had Already Been Seduced By Some Old Guy In The Neighborhood... Widow BSS ~I Was Supposed To Confess My Feelings On The First Anniversary Of Her Death, But She Had Already Been Taken Away From Me.~ [Uncensored L**ked]",https://pic.javct.net/poster/05192026/fe3d453f48.jpg,https://javct.net/v/jur-736-rm,100,2026-06-20
DLDSS-518,A married secretary's secret cunnilingus affair under the desk. Naho Ozawa,https://pic.javct.net/poster/05192026/cc3c5e8679.jpg,https://javct.net/v/dldss-518,133,2026-06-20
DASS-984-RM,"Her Mother Is More My Sexual Preference Than Her, And I'm So Aroused That My Penis Hurts. - Honami Hazuki [Uncensored L**ked]",https://pic.javct.net/poster/05192026/06400ffd0e.jpg,https://javct.net/v/dass-984-rm,120,2026-06-20
