code,title,image_url,page_url,views,date_scraped
FC2PPV-4915119,"[Uncensored x Personal Shooting] **pyjpx*jsps Due to difficulty in raising funds to open a salon, a married woman releases her anus for the first time and loosens her anus and spreads her pussy while being penetrated in the IN anus.",https://pic.javct.net/poster/05192026/12de3db435.jpg,https://javct.net/v/fc2ppv-4915119,72,2026-06-06
FC2PPV-4913925,"[So cute that you can't believe she's 42 years old] **pyjpx*jsps It was supposed to be her first and last affair, but she even let him cum inside her during the threesome, and she fell into serious pleasure and ended up breaking off her marriage lol",https://pic.javct.net/poster/05192026/e95be44c92.jpg,https://javct.net/v/fc2ppv-4913925,44,2026-06-06
JRZE-304-RM,First-time Filming Of A 60-year-old Wife: Kinue Izumi [Uncensored L**ked],https://pic.javct.net/poster/05192026/230f197f6c.jpg,https://javct.net/v/jrze-304-rm,125,2026-06-06
JRZE-303-RM,First-time Filming Of A 50-year-old Wife: Tomoka Yahiro [Uncensored L**ked],https://pic.javct.net/poster/05192026/a255d24669.jpg,https://javct.net/v/jrze-303-rm,145,2026-06-06
ALDN-589,I Had Unprotected Sex With My Sister-in-law For Several Days - Meguri Minoshima,https://pic.javct.net/poster/05192026/175678f82e.jpg,https://javct.net/v/aldn-589,150,2026-06-06
GMA-097,"Bondage Training Wife: A Wife, Secretly In Debt To Her Husband, Is Tied Up And Embraced By An Ex-boyfriend. She Writhes In Abnormal Pleasure Amidst Guilt And A Sense Of Depravity. (Rie Miyagi)",https://pic.javct.net/poster/05192026/76cf900b00.jpg,https://javct.net/v/gma-097,120,2026-06-06
JUR-780-RM,"My C**ldhood Friend, Who Used To Have A Crush On Me And Had A Small Penis, Had Evolved Into A Man With A Huge Penis And A Strong Sex Drive, So I Ended Up Getting Hooked On Raw Sex With Him Many Times... [Uncensored L**ked]",https://pic.javct.net/poster/05192026/eb2ce7ba3a.jpg,https://javct.net/v/jur-780-rm,120,2026-06-06
CEAD-751,"Kana Morisawa, A Lustful Housewife With Big Breasts And A Huge Ass, Drives Men Wild. ~Three Intense Sex Scenes As She Indulges In The Secret Affairs Of Her Sugar Mommy Activities And The Pleasure Of Unconsciousness!",https://pic.javct.net/poster/05192026/fd4c7197b6.jpg,https://javct.net/v/cead-751,157,2026-06-06
ENKI-014-RM,Female Masochist Nasty Wife Bukkake Kinky Mature Woman Creampie Onahoru Marika [Uncensored L**ked],https://pic.javct.net/poster/05192026/d7bac48b7b.jpg,https://javct.net/v/enki-014-rm,190,2026-06-06
JRZE-304,First-time Filming Of A 60-year-old Wife: Kinue Izumi,https://pic.javct.net/poster/05192026/230f197f6c.jpg,https://javct.net/v/jrze-304,125,2026-06-06
JRZE-303,First-time Filming Of A 50-year-old Wife: Tomoka Yahiro,https://pic.javct.net/poster/05192026/a255d24669.jpg,https://javct.net/v/jrze-303,145,2026-06-06
ALDN-590,"My Wife, Koharu Miike, Has Fallen Into The Pleasure Of Internal Ejaculation.",https://pic.javct.net/poster/05192026/711745799e.jpg,https://javct.net/v/aldn-590,150,2026-06-06
JUR-747-RM,"From The Day I Lost My Virginity To Nao, The Manager Of My Student Apartment Building, Until Graduation, I Spent My Last Years Of Youth Immersed In Unprotected Sex, Going Along With Whatever She Invited Me To. [Uncensored L**ked]",https://pic.javct.net/poster/05192026/b18182106d.jpg,https://javct.net/v/jur-747-rm,140,2026-06-06
JUR-087-RM,"Beneath Her Dignified Expression Lies Bottomless Eroticism. Madonna's Exclusive Model, Kyoko Maki, With Her I-cup Breasts And Long Limbs, Engages In Three Intense Deep Kissing And Cum-in-the-vagina Sex Scenes. [Uncensored L**ked]",https://pic.javct.net/poster/05192026/c229d6492e.jpg,https://javct.net/v/jur-087-rm,120,2026-06-06
ALDN-591,"Shiori Tsukada, The Surrogate Mother",https://pic.javct.net/poster/05192026/fbd427f784.jpg,https://javct.net/v/aldn-591,100,2026-06-06
ALDN-588,My Mother-in-law Is So Much Better Than My Wife... Sayuri Hayama,https://pic.javct.net/poster/05192026/17f54cfcd0.jpg,https://javct.net/v/aldn-588,125,2026-06-06
ACHJ-087,"An erotic wife with unparalleled hip swings. A training story about how I fo**ed my husband's boss, who was completely rotten, into submission with my overwhelming use of the hips. Uruki Sarara",https://pic.javct.net/poster/05192026/600191f47d.jpg,https://javct.net/v/achj-087,180,2026-06-06
JJPP-164,This Is A DVD That Takes A Voyeur Of How A Handsome Man Brings A Mature Woman Into A Room And Brings It To SEX. 153 ~ I Forcibly Vaginal Cum Shot As It Is ~,https://pic.javct.net/poster/05192026/0629915a55.jpg,https://javct.net/v/jjpp-164,130,2026-06-06
JUR-081-RM,NTR Shocking Cheating Video Of A Nude Model Wife Drowning In Shameful Sex With Her Husband's Boss - Ichika [Uncensored L**ked],https://pic.javct.net/poster/05192026/2570fd8823.jpg,https://javct.net/v/jur-081-rm,130,2026-06-06
ROE-502,"For 10 Years, He Has Harbored Feelings For His Mother, And He Continues His Relentless Pursuit Of Her, Ejaculating Inside Her 16 Times In A Row During Incestuous Sex.",https://pic.javct.net/poster/05192026/7351e488ff.jpg,https://javct.net/v/roe-502,150,2026-06-06
JUR-741,"Swept Away By Sweet Whispers, I Became Addicted To Secluded Sex With A Married Woman Until I Had To Repeat A Year Of University... - Kanoha Yuuki",https://pic.javct.net/poster/05192026/431cbe8228.jpg,https://javct.net/v/jur-741,140,2026-06-06
JJPP-160,A DVD That Takes A Voyeur Of How A Handsome Man Brings A Mature Woman Into A Room And Brings It To SEX. 149 ~ I Forcibly Vaginal Cum Shot As It Is ~,https://pic.javct.net/poster/05192026/4bbdd1b225.jpg,https://javct.net/v/jjpp-160,125,2026-06-06
JUR-691,"A Fleeting Glimpse Of Her Revealing Cleavage Shatters All Reason. Instant Sex With A Married Woman In An Overly Provocative, Loose-fitting Bra.",https://pic.javct.net/poster/05192026/504f208d7c.jpg,https://javct.net/v/jur-691,130,2026-06-06
JUR-732,"Only I, The Class Representative, Know The Hidden Side Of Student Guidance Counselor Meguri-sensei. After School, I Spend My Days Engaging In Exhibitionism On School Grounds With The School's Most Serious Female Teacher.",https://pic.javct.net/poster/05192026/5777f0e7c7.jpg,https://javct.net/v/jur-732,150,2026-06-06
