code,title,image_url,page_url,views,date_scraped
ALDN-465-SUB,Female CEO's Sexual Desire Yuko Shiraki [English Subtitle],https://pic.javct.net/poster/20252204/1748018685.jpg,https://javct.net/v/aldn-465-sub,130,2026-07-13
JJGG-004,"A slender but busty married woman who was left alone for 5 years. ""I'm sorry for being such an old woman..."" the trembling 45-year-old housewife smiled and begged for creampie. Keori Nakamura",https://pic.javct.net/poster/07052026/07a9ba2abb.jpg,https://javct.net/v/jjgg-004,118,2026-07-13
CHCH-030-RM,Grandma And Her Grandson Have A Soothing Colossal Breasted Beautiful Witch Who Can't Believe She Has A Grandc**ld Her Sperm Krappo Small Devil Rich Breast Sex Activity Hisako (56 Years Old/J Cup) [Uncensored L**ked],https://pic.javct.net/poster/20233001/1676689069.jpg,https://javct.net/v/chch-030-rm,110,2026-07-13
CEMD-341-RM,"""Misaki Sakura""'s Real Face-Creampie Ahegao Climax 4SEX- [Uncensored L**ked]",https://pic.javct.net/poster/20230205/1684561144.jpg,https://javct.net/v/cemd-341-rm,212,2026-07-13
KSBJ-237-RM,A Sex-Dependent Wife Who Hunts Men Indiscriminately Izumi Sakuma [Uncensored L**ked],https://pic.javct.net/poster/20230302/1677902676.jpg,https://javct.net/v/ksbj-237-rm,120,2026-07-13
JUAN-015-RM,"Ryoko Izumi, A Mother Who Lifts The Ban On Anal For Her Son [Uncensored L**ked]",https://pic.javct.net/poster/20233001/1676690456.jpg,https://javct.net/v/juan-015-rm,121,2026-07-13
ALDN-461-SUB,Lucky Man Traveling Alone Yukine Nakazaki [English Subtitle],https://pic.javct.net/poster/20252204/1746810956.jpg,https://javct.net/v/aldn-461-sub,115,2026-07-13
CEMD-343-RM,"""All Men In General! Please Make Me Cum!""-A Sex Documentary That An Amateur Man I Found On The Street Made Me Cum Until I Broke-Miku Misora [Uncensored L**ked]",https://pic.javct.net/poster/20230206/1686369391.jpg,https://javct.net/v/cemd-343-rm,138,2026-07-13
JRZE-133-RM,First Shooting Married Woman Document Yuka Takagi [Uncensored L**ked],https://pic.javct.net/poster/20233001/1675913706.jpg,https://javct.net/v/jrze-133-rm,120,2026-07-13
JUY-355-RM,I Can't Tell My Dear Husband I Like Cock That Reaches The Back Of My Throat Hikari Anzai [Uncensored L**ked],https://pic.javct.net/poster/20220406/1656495894.jpg,https://javct.net/v/juy-355-rm,116,2026-07-13
SGA-084-RM,Wife You Are Tired Of Usually A Bland Sex With E Cup Housewife Aikawa Hiro 32-year-old AV Debut Husband Too Much Propensity Awakening Does Not Stop The Excitement In Intimacies With Others Barre Inevitable Public Place! ! 48 [Uncensored L**ked],https://pic.javct.net/poster/07052026/9722be065a.jpg,https://javct.net/v/sga-084-rm,130,2026-07-13
SPRD-817-SUB,Is Rubbed His Son Again And Again Mother Kondo Ikumi [English Subtitle],https://pic.javct.net/poster/20230207/1689120615.jpg,https://javct.net/v/sprd-817-sub,130,2026-07-13
CEMD-861-RM,"A Total Pervert, A Total Slut... She Just Wants To Do Whatever She Wants! Filmed Sex And Raw Cumshot Date - Hikari Hime [Uncensored L**ked]",https://pic.javct.net/poster/07052026/96307e989e.jpg,https://javct.net/v/cemd-861-rm,136,2026-07-13
ALDN-596-RM,The Moment I Fell In Love With A Mature Woman - Rieko Hiraoka [Uncensored L**ked],https://pic.javct.net/poster/07052026/cfd5294909.jpg,https://javct.net/v/aldn-596-rm,105,2026-07-13
TARD-011-RM,"I'll Inspire My Chief Mourner, Let Me Do What Kimi's Chief Mourner. [Uncensored L**ked]",https://pic.javct.net/poster/07052026/74b08373df.jpg,https://javct.net/v/tard-011-rm,120,2026-07-13
TARD-006-RM,"I'll Inspire My Manager, General Manager Let Me Do What You. [Uncensored L**ked]",https://pic.javct.net/poster/07052026/8805ae8e29.jpg,https://javct.net/v/tard-006-rm,120,2026-07-13
TARD-008-RM,"I'll Inspire My Mother, Let Me Do What Your Mother. Sha Teen C**ld Katagiri Rika Fujishita [Uncensored L**ked]",https://pic.javct.net/poster/07052026/52b785de2f.jpg,https://javct.net/v/tard-008-rm,120,2026-07-13
ANB-216-RM,I Became A Mother's Toy And Fainted In Agony! Beautiful Mother-in-law's Bombshell Body! Shizuka Momoi [Uncensored L**ked],https://pic.javct.net/poster/20233001/1675481780.jpg,https://javct.net/v/anb-216-rm,110,2026-07-13
ALDN-123-RM,Mating Maiko Kashiwagi With Her Daughter's Husband [Uncensored L**ked],https://pic.javct.net/poster/20233001/1676084540.jpg,https://javct.net/v/aldn-123-rm,105,2026-07-13
TARD-014-RM,I Will Let You Fuck My Wife If You Will Let Me Fuck Yours. Nao Hayakawa Saeko Kisaragi [Uncensored L**ked],https://pic.javct.net/poster/07052026/755217b564.jpg,https://javct.net/v/tard-014-rm,100,2026-07-13
259LUXU-252,Luxury TV 227,https://pic.javct.net/poster/07052026/047aea92ba.jpg,https://javct.net/v/259luxu-252,59,2026-07-13
259LUXU-260,Luxury TV 249 Shiori Tani 30 years old pianist,https://pic.javct.net/poster/07052026/3722695fa8.jpg,https://javct.net/v/259luxu-260,59,2026-07-13
259LUXU-259,Luxury TV 255,https://pic.javct.net/poster/07052026/c4c95c01ff.jpg,https://javct.net/v/259luxu-259,59,2026-07-13
SPRD-1130-RM,My Sex Friend From Back In The Day... My Friend's Mother Eriko Miura [Uncensored L**ked],https://pic.javct.net/poster/20212011/1641443727.jpg,https://javct.net/v/sprd-1130-rm,123,2026-07-13
