code,title,image_url,page_url,views,date_scraped
328HMDNV-930-RM,A J-cup big-breasted married woman who works at a supermarket! A man comes to the store for her boobs and gets so excited that she has sex with him and has sex with him. [Uncensored L**ked],https://pic.javct.net/poster/05192026/ed3bdf4c2e.jpg,https://javct.net/v/328hmdnv-930-rm,70,2026-06-11
C-2414,Mature Woman Color Travel # 004,https://pic.javct.net/poster/05192026/22e7707e46.jpg,https://javct.net/v/c-2414,120,2026-06-11
VENU-081-RM,Nao Mizuki Big Booty Mother Incest Violent Night After Night [Uncensored L**ked],https://pic.javct.net/poster/20230104/1682577682.jpg,https://javct.net/v/venu-081-rm,80,2026-06-11
328HMDNV-930,A J-cup big-breasted married woman who works at a supermarket! A man comes to the store for her boobs and gets so excited that she has sex with him and has sex with him.,https://pic.javct.net/poster/05192026/ed3bdf4c2e.jpg,https://javct.net/v/328hmdnv-930,70,2026-06-11
GVG-373-RM,The Sexy PTA Chairwoman And The Naughty Student Council Yuna Takase [Uncensored L**ked],https://pic.javct.net/poster/20221904/1652315847.jpg,https://javct.net/v/gvg-373-rm,136,2026-06-11
JKNK-136-RM,Holding Mother-in-law Next To The Bride [Uncensored L**ked],https://pic.javct.net/poster/20230207/1689392994.jpg,https://javct.net/v/jknk-136-rm,120,2026-06-11
NINE-072-RM,[Super A5 Rank Highest Grade Aged Meat Arrives] A Sexless Married Woman With Colossal J-Cup Breasts Frustration Accumulates And Fulfills Her Perverted Delusions. Reiko (48 Years Old) [Uncensored L**ked],https://pic.javct.net/poster/20230205/1685159927.jpg,https://javct.net/v/nine-072-rm,130,2026-06-11
NUKA-63-RM,Six Creampies Without Pulling Out Incest Close Copulation Saki Oishi [Uncensored L**ked],https://pic.javct.net/poster/20230206/1686798979.jpg,https://javct.net/v/nuka-63-rm,110,2026-06-11
VGD-168-RM,Yoshijuku Woman Document S**ta All Of Chisato [Uncensored L**ked],https://pic.javct.net/poster/20242012/1734800235.jpg,https://javct.net/v/vgd-168-rm,140,2026-06-11
CEMD-293-RM,Tears Of Non-stop Super Squid SEX23 Mitsuki Yuina [Uncensored L**ked],https://pic.javct.net/poster/20233001/1676089370.jpg,https://javct.net/v/cemd-293-rm,126,2026-06-11
HMGL-174-RM,Embarrassing Body Training Quite A Few Daughters Forest Hotaru [Uncensored L**ked],https://pic.javct.net/poster/04112026/1776839934.jpg,https://javct.net/v/hmgl-174-rm,130,2026-06-11
ROE-340-SUB,"POV NTR: The Person In The ""POV Video"" Sent To Me By Mistake From My Best Friend Was My Mother. Touko Yoshinaga [English Subtitle]",https://pic.javct.net/poster/20250903/1743705970.jpg,https://javct.net/v/roe-340-sub,120,2026-06-11
VNDS-3432-RM,"Beautiful Mature Woman's Masturbation Viewing Party. I Was Just Supposed To Be Watching, But The Excited Lady Gave Me A Cleaning Blowjob And Then Took It In Her Mouth And Had Raw Sex With Me! 2 [Uncensored L**ked]",https://pic.javct.net/poster/05192026/0388bf9303.jpg,https://javct.net/v/vnds-3432-rm,130,2026-06-11
VNDS-5228-RM,Erotic Older Woman! 180 Minutes Of Intense Sex With A 60-year-old Grandma Who Can't Stand The Urge To Cum [Uncensored L**ked],https://pic.javct.net/poster/05192026/d03f526d2a.jpg,https://javct.net/v/vnds-5228-rm,180,2026-06-11
VNDS-3431-RM,"The Beauty Secrets Of An Insurance Lady: Ryoko Izumi, A Sperm Hunter In Her Sixties [Uncensored L**ked]",https://pic.javct.net/poster/05192026/1509ee1b06.jpg,https://javct.net/v/vnds-3431-rm,110,2026-06-11
EMBZ-103-RM,Netora R**e! Lust Tits Wife Was Trained In Cult As Sex Slaves Nara Emiko [Uncensored L**ked],https://pic.javct.net/poster/05192026/c2a9758b69.jpg,https://javct.net/v/embz-103-rm,130,2026-06-11
AQSH-099-RM,Public Employee's Wife Mami Sakurai Targeted By Parents And C**ldren Who Fake Injuries In A Traffic Accident And Request Indecent Acts [Uncensored L**ked],https://pic.javct.net/poster/20230206/1686972428.jpg,https://javct.net/v/aqsh-099-rm,120,2026-06-11
YAG-127,Falling Lady Humiliation PARTY Shoko Furukawa,https://pic.javct.net/poster/05192026/358a9723a3.jpg,https://javct.net/v/yag-127,125,2026-06-11
NEWM-097-RM,"True Abnormal Sexual Intercourse: Fifty-Something Mother And Son, Part 40: Her Body Is Fo**ed To Feel The Violation Of Her Son, Rieko Hiraoka [Uncensored L**ked]",https://pic.javct.net/poster/20242012/1734754695.jpg,https://javct.net/v/newm-097-rm,120,2026-06-11
CNSTV-007,Introducing a simple part-time job to the wife of a poor housewife struggling with living expenses in a protracted recession,https://pic.javct.net/poster/05192026/114c3c1fc8.jpg,https://javct.net/v/cnstv-007,125,2026-06-11
NXGS-018,"Fifty-year-old Mother, Forbidden Immoral Mother-son Incest",https://pic.javct.net/poster/05192026/b6d08c372b.jpg,https://javct.net/v/nxgs-018,120,2026-06-11
VNDS-3431,"The Beauty Secrets Of An Insurance Lady: Ryoko Izumi, A Sperm Hunter In Her Sixties",https://pic.javct.net/poster/05192026/1509ee1b06.jpg,https://javct.net/v/vnds-3431,110,2026-06-11
SPZ-1167,"At A Sauna In A Healthy Store, I Put My Erect Penis On The Plump Body Of A Body Scrub Lady...",https://pic.javct.net/poster/05192026/c6465aa66c.jpg,https://javct.net/v/spz-1167,120,2026-06-11
OFKU-240,"""Why Is My Stepmom Sucking My Dick?"" I Woke Up To Find My Stepmom Giving Me A Blowjob In Bed... I Couldn't Help But Wake Up And Have Creampie Sex",https://pic.javct.net/poster/05192026/3d867c8f60.jpg,https://javct.net/v/ofku-240,120,2026-06-11
