code,title,image_url,page_url,views,date_scraped
PA-060426-100,It's Hawaii! A Bikini wife in high spirits! : Ways to End a Sexless Marriage,https://pic.javct.net/poster/05192026/0f9f84ff40.jpg,https://javct.net/v/pa-060426-100,60,2026-06-05
PA-060226-100,The Naughty Housekeeper Who Drives Men Wild,https://pic.javct.net/poster/05192026/791cc77369.jpg,https://javct.net/v/pa-060226-100,55,2026-06-05
NSFS-007-SUB,Mature Stepmother 12  The Stepson Who Loved His Stepmother  Yuri Tadokoro [English Subtitle],https://static.javct.net/poster/nsfs-007.jpg,https://javct.net/v/nsfs-007-sub,116,2026-06-05
VENU-169-RM,Fakecest with My Hot Ass Mother Miki Sato [Uncensored L**ked],https://pic.javct.net/poster/20220707/1657755619.jpg,https://javct.net/v/venu-169-rm,81,2026-06-05
PA-053026-100,Natural Beauty : Ms. Hironaka's Real Face,https://pic.javct.net/poster/05192026/25b43628eb.jpg,https://javct.net/v/pa-053026-100,27,2026-06-05
PA-052826-100,What If Your Dream Wife Wearing an Apron Naked? : Mirei Imada,https://pic.javct.net/poster/05192026/1710bf2e31.jpg,https://javct.net/v/pa-052826-100,27,2026-06-05
1P-052826-001,Devouring Men!,https://pic.javct.net/poster/05192026/30fce924df.jpg,https://javct.net/v/1p-052826-001,58,2026-06-05
SPRD-801-RM,Ultra Authentic Carnal Fakecest Illustrated - Mother Massaged By Her Own Son Yoshie Mizuno [Uncensored L**ked],https://pic.javct.net/poster/20221108/1662965131.jpg,https://javct.net/v/sprd-801-rm,120,2026-06-05
OBA-054-RM,"Mom, Now the Dehumidifier is Broken. - Chiaki Takeshita [Uncensored L**ked]",https://pic.javct.net/poster/20212011/1640936904.jpg,https://javct.net/v/oba-054-rm,117,2026-06-05
1P-070525-001,Aika Hoshino's Yoga Sex,https://pic.javct.net/poster/05192026/b0588dda75.jpg,https://javct.net/v/1p-070525-001,61,2026-06-05
PA-052626-100,The Temptation of My Unbelievably Sexy Sister-in-Law,https://pic.javct.net/poster/05192026/e272c44859.jpg,https://javct.net/v/pa-052626-100,57,2026-06-05
PA-052326-100,It's Hawaii! A Bikini wife in high spirits! : Ways to End a Sexless Marriage,https://pic.javct.net/poster/05192026/6c8dc8e374.jpg,https://javct.net/v/pa-052326-100,60,2026-06-05
NEM-034-RM,Forbidden Sex With The Bride's Mother Chapter Thirty-Three I Like My Stepmom Better Than My Wife... Rieko Hiraoka [Uncensored L**ked],https://pic.javct.net/poster/20212011/1640019335.jpg,https://javct.net/v/nem-034-rm,120,2026-06-05
PA-052126-100,A mix of saliva and love juice! A married woman's intense PtoM sex!  : Sara Suzukake,https://pic.javct.net/poster/05192026/9a9e87e82f.jpg,https://javct.net/v/pa-052126-100,60,2026-06-05
GVG-014-RM,Mama's Real Sex Education Kanako Ioka [Uncensored L**ked],https://pic.javct.net/poster/20221904/1651452891.jpg,https://javct.net/v/gvg-014-rm,117,2026-06-05
PA-051926-100,The Temptation of My Busty Boss,https://pic.javct.net/poster/04112026/f80ffcd8f9.jpg,https://javct.net/v/pa-051926-100,60,2026-06-05
PA-051626-100,Working mothers in rural areas : Salesperson for probiotic beverages,https://pic.javct.net/poster/04112026/b686261e70.jpg,https://javct.net/v/pa-051626-100,80,2026-06-05
1P-051626-001,Yui Shinjo: Brought to a Genuine Climax by a Perverted Old Guy,https://pic.javct.net/poster/04112026/0ed16d373b.jpg,https://javct.net/v/1p-051626-001,57,2026-06-05
GVG-785-RM,Stepmother And Offspring Fucking Hitomi Enjoji [Uncensored L**ked],https://pic.javct.net/poster/20212011/1641519705.jpg,https://javct.net/v/gvg-785-rm,131,2026-06-05
NHDTA-898-RM,C**ldhood Friend - Her Little Sister - Her Older Sister - And Even Her Mom! Busty Family Gets Fucked By A Virgin Boy 2 [Uncensored L**ked],https://pic.javct.net/poster/20220707/1660013084.jpg,https://javct.net/v/nhdta-898-rm,142,2026-06-05
PA-051426-100,A Horny Mom Who Gets Forcibly Fucked by Her Son's Friend but Can't Help But Enjoy It,https://pic.javct.net/poster/04112026/0f0d04fc49.jpg,https://javct.net/v/pa-051426-100,54,2026-06-05
1P-051426-001,The Professional Sexy Actress's Style: Eri Saeki,https://pic.javct.net/poster/04112026/7009d842af.jpg,https://javct.net/v/1p-051426-001,56,2026-06-05
GVG-782-RM,Mom's Real Sex Education Kanako Maeda [Uncensored L**ked],https://pic.javct.net/poster/20212011/1644199528.jpg,https://javct.net/v/gvg-782-rm,120,2026-06-05
PA-051226-100,"Mature Woman Special Movie 19 ~ 30s,40s and 50s ~",https://pic.javct.net/poster/04112026/e8d54f3afa.jpg,https://javct.net/v/pa-051226-100,72,2026-06-05
