code,title,image_url,page_url,views,date_scraped
10-062326-01,The condom broke—an unexpected bareback session,https://pic.javct.net/poster/05192026/42b3b35c5e.jpg,https://javct.net/v/10-062326-01,61,2026-06-23
SDNM-553-RM,"""The delicious smiles of my husband and daughter are the happiest"" A cheerful mother who is good at cooking has her first affair Mayuka Arisawa 36 years old Married for 8 years Lives in Hyogo Prefecture Mother of a 6 year old daughter [Uncensored L**ked]",https://pic.javct.net/poster/05192026/98e0d272a4.jpg,https://javct.net/v/sdnm-553-rm,157,2026-06-23
543TAXD-028-RM,Rika The whole story of evil deeds by a villainous taxi driver part.28 [Uncensored L**ked],https://pic.javct.net/poster/20230205/1683561415.jpg,https://javct.net/v/543taxd-028-rm,54,2026-06-23
SDNM-553,"""The delicious smiles of my husband and daughter are the happiest"" A cheerful mother who is good at cooking has her first affair Mayuka Arisawa 36 years old Married for 8 years Lives in Hyogo Prefecture Mother of a 6 year old daughter",https://pic.javct.net/poster/05192026/98e0d272a4.jpg,https://javct.net/v/sdnm-553,157,2026-06-23
AKDL-057-RM,"[Amateur interview] Silently appeared in AV with her boyfriend. Her hair is thick. Satomi, 22-year-old office lady, is shy but gets excited when she sees the joints. [Uncensored L**ked]",https://pic.javct.net/poster/04112026/10a22f63b6.jpg,https://javct.net/v/akdl-057-rm,119,2026-06-23
SIMH-005,Riho,https://pic.javct.net/poster/05192026/e5aded6bed.jpg,https://javct.net/v/simh-005,77,2026-06-23
FC2PPV-4924836,[Completely showing her face/no face] A once-in-a-thousand-year angelic idol cums a lot and has private creampie sex,https://pic.javct.net/poster/05192026/e88e806482.jpg,https://javct.net/v/fc2ppv-4924836,34,2026-06-23
FC2PPV-4925066,[World Cup Commemoration] Samurai Blue's big support special project with 3 women.Sakuike meat forest with semen goals in 3 vaginas,https://pic.javct.net/poster/05192026/fc1554e060.jpg,https://javct.net/v/fc2ppv-4925066,85,2026-06-23
FC2PPV-4924434,SEX genius: Intense cowgirl position and bent over position are the best [Part 2],https://pic.javct.net/poster/05192026/665ad951ca.jpg,https://javct.net/v/fc2ppv-4924434,27,2026-06-23
CR-062226-001,Wednesday Caribbeancom: The theory that MILF who talk about her past and her heroic deeds are easy to get laid with - Part 2,https://pic.javct.net/poster/05192026/2e1cf6cf14.jpg,https://javct.net/v/cr-062226-001,32,2026-06-23
SIMH-005-RM,Riho [Uncensored L**ked],https://pic.javct.net/poster/05192026/e5aded6bed.jpg,https://javct.net/v/simh-005-rm,77,2026-06-23
FC2PPV-4923958,Few people with experience\! No creampie! Let a naive and serious D cup office lady attack your cock and finally screw the cock into her pure pussy.,https://pic.javct.net/poster/05192026/b672e9724f.jpg,https://javct.net/v/fc2ppv-4923958,60,2026-06-23
FC2PPV-4924767,"[No] Two black guys with big dicks, a cool beauty with long black hair and a princess cut, violently fucked, and a sweaty hardcore 3P with two consecutive vaginal cum shots at the end [Overseas version] Bonus included",https://pic.javct.net/poster/05192026/bf612b18b1.jpg,https://javct.net/v/fc2ppv-4924767,45,2026-06-23
FC2PPV-4924344,"0419_001 Maya-chan, 18 years old, is a former idol with a fair skin and F cup who is attracting a lot of attention in 2026. She impregnates herself and appears in a sex video with an old man, but since it was incomplete, she is sold in bulk at a low price (explosive)",https://pic.javct.net/poster/05192026/2286c339da.jpg,https://javct.net/v/fc2ppv-4924344,102,2026-06-23
AKDL-056-RM,[Off-paco video] A bitch layer who is as cute as an idol but gets naughty when she drinks: Kanon Kanon Kanon [Uncensored L**ked],https://pic.javct.net/poster/04112026/13d931ee98.jpg,https://javct.net/v/akdl-056-rm,60,2026-06-23
MYBA-051-RM,A Married Woman'S Petals Are White Flowers [Uncensored L**ked],https://pic.javct.net/poster/20222109/1665818781.jpg,https://javct.net/v/myba-051-rm,128,2026-06-23
801SKEJ-078-RM,Yume (Beautiful big breasted idol x creampie) [Uncensored L**ked],https://pic.javct.net/poster/05192026/589b590a93.jpg,https://javct.net/v/801skej-078-rm,76,2026-06-23
HMRK-036-RM,"[Official office lady with no panties full of pheromones] Everyone is good, so I can't choose... She doesn't mean anything but she's a natural, lewd lady with five legs and gets fucked by sex! She lets out a sweet voice and cums in a lewd woman who writhes in raw cock while cumming inside her!! [She's so erotic that she can't stop being erotic] ​​[Yuri] Kudo Yuri [Uncensored L**ked]",https://pic.javct.net/poster/20250903/1741499745.jpg,https://javct.net/v/hmrk-036-rm,84,2026-06-23
230OREMO-048-RM,K University Rixu Job Hunting Student M [Uncensored L**ked],https://pic.javct.net/poster/20231011/1698025676.jpg,https://javct.net/v/230oremo-048-rm,33,2026-06-23
AKDL-110,KDK (Seduction) I Seduced This Woman My Friend's Girlfriend College Girl Honoka 20 Years Old Honoka Suzumi,https://static.javct.net/poster/akdl-110.jpg,https://javct.net/v/akdl-110,144,2026-06-23
CR-062126-001,"One more time, One more fuck: Kanami Uno Begged one more fuck immediately after shooting",https://pic.javct.net/poster/05192026/219fdc7b7d.jpg,https://javct.net/v/cr-062126-001,25,2026-06-23
10-062126-01,Treasured Pussy Selection: Nana Amano,https://pic.javct.net/poster/05192026/4b99fbab1c.jpg,https://javct.net/v/10-062126-01,16,2026-06-23
FC2PPV-4922593,[The first one that actually existed] 18-year-old natural G-Cup beauty vocalist's undisclosed collection Unlocked pov photography golden ratio overwhelming beauty Nude legendary debut,https://pic.javct.net/poster/05192026/2a34e71210.jpg,https://javct.net/v/fc2ppv-4922593,70,2026-06-23
HMRK-020-RM,"[Slender shaved beautiful girl] A very cute active female college student appears, her sensitive pussy is too wet, her tight white peach beautiful ass is pounded in the background, and her cute face is covered in semen... Gonzo sex where she releases her naughty nature even though she is shy [ Sexuality, Gonzo] [An] [Uncensored L**ked]",https://pic.javct.net/poster/20242108/1727045519.jpg,https://javct.net/v/hmrk-020-rm,94,2026-06-23
