code,title,image_url,page_url,views,date_scraped
AKDL-271-RM,[L**ked Video] Girl Having Sex With A Classmate Right After Graduation Prefectural 〇〇 Academy Class D General Course Hikaru Spring 2024 [Uncensored L**ked],https://pic.javct.net/poster/20241902/1709769797.jpg,https://javct.net/v/akdl-271-rm,117,2026-06-09
BGN-006-RM,Rookie Prestige Exclusive Debut [Uncensored L**ked],https://pic.javct.net/poster/20230104/1682688956.jpg,https://javct.net/v/bgn-006-rm,180,2026-06-09
CR-060826-001,Five kinds of Titty Fucks and the Ideal Boob Sex,https://pic.javct.net/poster/05192026/cf4a15b2c9.jpg,https://javct.net/v/cr-060826-001,61,2026-06-09
FC2PPV-4916703,"A devilishly beautiful woman with big breasts and a fair-skinned beautiful body, her true identity is a former entertainment manager.The way she goes crazy after being injected with semen over and over again is a sight to behold.",https://pic.javct.net/poster/05192026/b45d65da75.jpg,https://javct.net/v/fc2ppv-4916703,96,2026-06-09
MAZO-016-RM,"Department Store Receptionist, 27 Years Old, Tied Up With Chains, Womanizer Uterus Convulsions, Pure M, Gokubi Dcup, God's Constriction, Creampie During Lunch Break [Uncensored L**ked]",https://pic.javct.net/poster/05192026/506c6c50e1.jpg,https://javct.net/v/mazo-016-rm,75,2026-06-09
SKJK-021-RM,Little C**ld 0 Yen Saffle-chan Riku (Honor Student) Riku Otomi [Uncensored L**ked],https://pic.javct.net/poster/20230206/1688027905.jpg,https://javct.net/v/skjk-021-rm,130,2026-06-09
FC2PPV-4915930,"My first experience was with my seniors in the basketball club, and I made it without permission. ""I'm going to get pregnant by injecting my special secret technique, Sison.''",https://pic.javct.net/poster/05192026/442b5111e0.jpg,https://javct.net/v/fc2ppv-4915930,51,2026-06-09
300MIUM-1345,The extremely erotic unrivaled moves of a reverse Nan girl who has realized the truth of this world that everything can be solved if only her breasts are bigger.,https://pic.javct.net/poster/05192026/ead0695ad7.jpg,https://javct.net/v/300mium-1345,79,2026-06-09
300MIUM-551-RM,"A working masochist. Case.30 Salesperson for a housing equipment company/Mr. Hoshinaka/23 years old The salesperson seems to be very serious, but when I follow him around on the outside, he suddenly starts slacking off. He takes advantage of his secret bad habit and the sex negotiations are super smooth. While everyone else is working, he gets fucked hard and gets excited. Facial cumshot on a troubled office lady. [Uncensored L**ked]",https://pic.javct.net/poster/05192026/b96e37299e.jpg,https://javct.net/v/300mium-551-rm,106,2026-06-09
300MIUM-1380,"The most cute little devil with an unparalleled penis [Delicious-looking nipples] [Very sensitive] ""I feel sorry for you, even though your penis is so hard'' ""If you don't tell me, you won't find out'' I was writhing in shock for a long time, but when I realized that I was cumming right away, he was in control lol You can't resist something like this lol #Female style #Women's sex industry #Peeping: file.41",https://pic.javct.net/poster/05192026/9c19ecb897.jpg,https://javct.net/v/300mium-1380,119,2026-06-09
FC2PPV-4916375,[Big breasted office lady] Highly educated real estate office lady squirts and gets creampied covered in oil,https://pic.javct.net/poster/05192026/f62d9bdca9.jpg,https://javct.net/v/fc2ppv-4916375,59,2026-06-09
300MIUM-1345-RM,The extremely erotic unrivaled moves of a reverse Nan girl who has realized the truth of this world that everything can be solved if only her breasts are bigger. [Uncensored L**ked],https://pic.javct.net/poster/05192026/ead0695ad7.jpg,https://javct.net/v/300mium-1345-rm,79,2026-06-09
10-060726-01,Pussy to Mouth Sex: Miku Kamiya,https://pic.javct.net/poster/05192026/acf212f053.jpg,https://javct.net/v/10-060726-01,56,2026-06-09
AKDL-047-RM,[NTR at work] Cheating video of a co-worker's beautiful married woman being seduced and having sex with her while she was at work Yumika Saeki [Uncensored L**ked],https://pic.javct.net/poster/04112026/1776840078911.jpg,https://javct.net/v/akdl-047-rm,95,2026-06-09
ROE-036-RM,7th Anniversary of Debut!! Second Madonna Exclusive!! Submissive Creampie Drama!!! Rieko the Housekeeper is the Family's Stand-In Mother and Creampie pet. [Uncensored L**ked],https://pic.javct.net/poster/20212011/1641541329.jpg,https://javct.net/v/roe-036-rm,120,2026-06-09
FC2PPV-4916633,Book-/things\. /shi./ro.◯/. and♡Kiyoshi./so.cute♡dreams of being a nurse.gaku./raw.Yuzu-chan♡o./◯./ne.for trouble./re-shooting♡fair-skinned soft body♡extreme orgasm♡no./◯./ka.creampie sex♡,https://pic.javct.net/poster/05192026/56b68cfcbd.jpg,https://javct.net/v/fc2ppv-4916633,106,2026-06-09
MDON-085-RM,Streaming only: Madonna exclusive actress' Real debut. SEASON 2 MADOOOON!!! Yuuka Niizuma POV [Uncensored L**ked],https://pic.javct.net/poster/10232025/1762276762.jpg,https://javct.net/v/mdon-085-rm,77,2026-06-09
ROE-510-RM,I indulged in massive convulsive sex with my beloved daughter's boyfriend. Rinka Ono [Uncensored L**ked],https://pic.javct.net/poster/05192026/4c957ccea9.jpg,https://javct.net/v/roe-510-rm,120,2026-06-09
PA-060626-100,I was introduced to her by a naughty mom friend. Vol.1 Yui Shinjo,https://pic.javct.net/poster/05192026/f09a5e68bb.jpg,https://javct.net/v/pa-060626-100,59,2026-06-09
10-060626-01,Wireless Rotor Walk : Mai Ishikawa,https://pic.javct.net/poster/05192026/416f5e88a1.jpg,https://javct.net/v/10-060626-01,66,2026-06-09
AKDL-046-RM,[Couple NTR] Sleeping with her in front of her boyfriend (21 year old JD Mitsuha-chan) Mitsuha Higuchi [Uncensored L**ked],https://pic.javct.net/poster/04112026/1776750406878.jpg,https://javct.net/v/akdl-046-rm,207,2026-06-09
CR-060626-001,"One more time, One more fuck: Begged one more fuck with Tsubasa Honjo who can do easily even immediately after shooting",https://pic.javct.net/poster/05192026/1e08c84979.jpg,https://javct.net/v/cr-060626-001,30,2026-06-09
1P-060626-001,Braless Neighbor In The Morning: Sakura Aoi,https://pic.javct.net/poster/05192026/0186f49b80.jpg,https://javct.net/v/1p-060626-001,56,2026-06-09
FC2PPV-4913313,"[No algae bonus] A JD with a beautiful big breasts boyfriend who came to see me from Hokkaido wanted to have some good sex, so when she came for a secret meeting, she exploded both inside and outside.",https://pic.javct.net/poster/05192026/a2fdeb4490.jpg,https://javct.net/v/fc2ppv-4913313,47,2026-06-09
