code,title,image_url,page_url,views,date_scraped
CR-060326-001,My Best Friend's Girlfriend Milks Me Dry with Her Incredible Cowgirl Sk**ls,https://pic.javct.net/poster/05192026/59b32004dd.jpg,https://javct.net/v/cr-060326-001,61,2026-06-03
MFCS-210,Nagisa,https://pic.javct.net/poster/05192026/379b969a55.jpg,https://javct.net/v/mfcs-210,68,2026-06-03
SENN-006-RM,Nurse Kirishima Has Hard Sex With A Runaway Patient - Reona Kirishima [Uncensored L**ked],https://pic.javct.net/poster/20221202/1648380658.jpg,https://javct.net/v/senn-006-rm,47,2026-06-03
HODV-21595-RM,"The Stepbrother Of My Husband Licks Me Again And Again Until I Fall For Him, All While Hiding From My Husband. Kanna Hirai [Uncensored L**ked]",https://static.javct.net/poster/hodv-21595.jpg,https://javct.net/v/hodv-21595-rm,118,2026-06-03
FC2PPV-4912071,"In Nijisanji, Anju Katrina is huge and beautiful, slender, fair-skinned, super slim body, and has slender legs. Nju masturbation edition",https://pic.javct.net/poster/05192026/cc9a243e69.jpg,https://javct.net/v/fc2ppv-4912071,52,2026-06-03
FC2PPV-4912083,☆4 ejaculations☆ E cup beautiful big breasted nursery teacher (20) Squirting SEX in agony with great excitement due to the big thick penis that reaches deep inside,https://pic.javct.net/poster/05192026/83e75fd418.jpg,https://javct.net/v/fc2ppv-4912083,93,2026-06-03
FC2PPV-4904844,"This month's No. 1 nomination: I had sex with Miss Menes, a top-class technician who heals both body and soul, and an overwhelming visual [Uncensored creampie]",https://pic.javct.net/poster/05192026/d030285281.jpg,https://javct.net/v/fc2ppv-4904844,63,2026-06-03
FC2PPV-4911975,Training record of a super masochist beauty... A small fry who cums without her master's permission. Her rationality collapses with a punishing demon piston.,https://pic.javct.net/poster/05192026/f2e4c01944.jpg,https://javct.net/v/fc2ppv-4911975,49,2026-06-03
SIMO-018-RM,Mika [Uncensored L**ked],https://pic.javct.net/poster/05192026/0254ba72c8.jpg,https://javct.net/v/simo-018-rm,98,2026-06-03
FC2PPV-4911951,"[Selected beauty] G cup super beautiful half model First time in life without pill, direct uterine creampie, limited release treasured video",https://pic.javct.net/poster/05192026/4110e124ab.jpg,https://javct.net/v/fc2ppv-4911951,29,2026-06-03
PA-060226-100,The Naughty Housekeeper Who Drives Men Wild,https://pic.javct.net/poster/05192026/791cc77369.jpg,https://javct.net/v/pa-060226-100,55,2026-06-03
START-550-RM,I started a polite life with Rui when I just started dating.Sometimes it's slow and sometimes it's a passionate sex life where I'm at the mercy of Rui Ichinomiya. [Uncensored L**ked],https://pic.javct.net/poster/05192026/f458a5436c.jpg,https://javct.net/v/start-550-rm,135,2026-06-03
DFE-057-RM,I Am Eating Up This Young Girl. Rena Usami [Uncensored L**ked],https://pic.javct.net/poster/20212011/1640778896.jpg,https://javct.net/v/dfe-057-rm,123,2026-06-03
FC2PPV-4909096,“It’s really bad. A former idol applied for her boyfriend (probably a host) who was in trouble with money.,https://pic.javct.net/poster/05192026/8b698a6424.jpg,https://javct.net/v/fc2ppv-4909096,54,2026-06-03
ROYD-074-RM,My Gentle and Cute C**ldhood Friend Spoils Me By Supporting With Depressed Me. Karen Asahina [Uncensored L**ked],https://pic.javct.net/poster/20212709/1637307475.jpg,https://javct.net/v/royd-074-rm,173,2026-06-03
SIMO-018,Mika,https://pic.javct.net/poster/05192026/0254ba72c8.jpg,https://javct.net/v/simo-018,98,2026-06-03
865URKN-02001-RM,"[Erotic raw sex video with a beautiful, big-breasted, fair-skinned, and sexy lady with the strongest visuals] [She's so beautiful, but she's a slut with a happy gap for a blow job lover] [Her pink dick stands up, her beautiful breasts tremble, and she cums] Maina Yuri [Uncensored L**ked]",https://pic.javct.net/poster/05192026/65b4aaf72d.jpg,https://javct.net/v/865urkn-02001-rm,66,2026-06-03
CR-060226-001,Caribbebians: A body flushed and throbbing with pleasure,https://pic.javct.net/poster/05192026/3e9aebb716.jpg,https://javct.net/v/cr-060226-001,58,2026-06-03
DDH-418-RM,Yuzu & Natsumi [Uncensored L**ked],https://pic.javct.net/poster/05192026/26b51a790b.jpg,https://javct.net/v/ddh-418-rm,74,2026-06-03
SIMA-038-RM,It's bad [Uncensored L**ked],https://pic.javct.net/poster/05192026/2f3089c590.jpg,https://javct.net/v/sima-038-rm,54,2026-06-03
FMDL-012-RM,A must-see for girls! Full of erotic tech? GAL No.1 Grand Prix 2022 A special where a popular AV actress monitored a big breasted gal's private sex date! ! [Uncensored L**ked],https://pic.javct.net/poster/05192026/c58555f4a6.jpg,https://javct.net/v/fmdl-012-rm,220,2026-06-03
FC2PPV-4911943,"[None] [Female Body Sharing Chapter 18] A 176 cm model who cannot refuse when asked, has to be trained. Two men keep attacking her and train her in an intense 3P that makes her faint in agony [Overseas version] Bonus included",https://pic.javct.net/poster/05192026/f19a40e336.jpg,https://javct.net/v/fc2ppv-4911943,41,2026-06-03
XRW-674-RM,"Her Husband Was Deep In Debt, So She Got Fucked By A Stranger... Rina Otomi/Arisa Kawasaki/RISA [Uncensored L**ked]",https://pic.javct.net/poster/20222109/1664724806.jpg,https://javct.net/v/xrw-674-rm,174,2026-06-03
801SKEJ-072-RM,Sayuri (Beautiful busty housewife) [Uncensored L**ked],https://pic.javct.net/poster/05192026/8d63b23a4f.jpg,https://javct.net/v/801skej-072-rm,79,2026-06-03
