code,title,image_url,page_url,views,date_scraped
PA-063026-100,I fuck a beautiful E-cup mature woman who feels and cums all the time.,https://pic.javct.net/poster/05192026/b13e03bc95.jpg,https://javct.net/v/pa-063026-100,60,2026-06-30
476MLA-048-RM,[A lot of de S technique that overwhelms the actor  2 consecutive vaginal cum shot to a maid cafe clerk with overwhelming lewd potential] [Uncensored L**ked],https://pic.javct.net/poster/20212308/1631154396.jpg,https://javct.net/v/476mla-048-rm,74,2026-06-30
AKDL-065-RM,"[Couple NTR] Cuckolding girlfriend in front of her boyfriend (Minami-chan, 22-year-old general store clerk) [Uncensored L**ked]",https://pic.javct.net/poster/04112026/5f55f091e2.jpg,https://javct.net/v/akdl-065-rm,162,2026-06-30
FC2PPV-4930333,[No] [Secret U〇Pyoi Cosplay Off Paco] Popular U〇Pyoi Dai〇 Creampie Sex with Carnivorous Gal Layer in Scarlet Competition Costume [Review Bonus Included],https://pic.javct.net/poster/05192026/7f0d1d303d.jpg,https://javct.net/v/fc2ppv-4930333,88,2026-06-30
FC2PPV-4921616,"[Cosplay] The first experience of playing with Pichi Pichi at the age of 19 made her cum with erotic cosplay, and her body tingled and she squeezed herself to the end of pleasure, cumming inside her tight pussy, and she became addicted to it and came again.",https://pic.javct.net/poster/05192026/25c71298a8.jpg,https://javct.net/v/fc2ppv-4921616,67,2026-06-30
SGA-031-RM,"An Overly Obedient E-Cup Plump Married Woman Mei Kisaragi 38 Years Old AV Debut ""It Looks Like It's Going To Be A Habit..."" Her First AV, A Sexless Married Woman Captivated By The Pleasure She's Never Experienced [Uncensored L**ked]",https://pic.javct.net/poster/20221108/1661818197.jpg,https://javct.net/v/sga-031-rm,120,2026-06-30
JUY-336-RM,Ever Since That Day When I Got My Pussy Pumped To The Deepest Depths Of My Life... Reika Hashimoto [Uncensored L**ked],https://pic.javct.net/poster/20220406/1656495835.jpg,https://javct.net/v/juy-336-rm,120,2026-06-30
420ERK-105-RM,"Sana-chan (25) Amateur Hoi Hoi, Erotic Kyun, Amateur, Neat, Young Lady, Beautiful Breasts, Slender, Alcohol Lover, Shaved Pussy, Cosplay, Facial, Gonzo, Documentary [Uncensored L**ked]",https://pic.javct.net/poster/05192026/10380e09af.jpg,https://javct.net/v/420erk-105-rm,79,2026-06-30
567BEAF-220-RM,"A bruising old man k**ler who is full of things he wants and has surpassed his materialistic limits. A sub-standard big dick and deep vaginal penetration that causes him to have a spectacular orgasm. Lala-chan, 22 years old, is a big-breasted, bristle girl who goes crazy. [Uncensored L**ked]",https://pic.javct.net/poster/05192026/2ca55ef440.jpg,https://javct.net/v/567beaf-220-rm,75,2026-06-30
FC2PPV-4930495,"[Public] Ai-chan #9, a really cute and beautiful woman with beautiful breasts and a nice ass, made me understand his rough dick in front of him, and had NTR creampie and sex with her.",https://pic.javct.net/poster/05192026/98fe5ff222.jpg,https://javct.net/v/fc2ppv-4930495,39,2026-06-30
MFCW-074-RM,Rin [Uncensored L**ked],https://pic.javct.net/poster/05192026/794e1f23f8.jpg,https://javct.net/v/mfcw-074-rm,97,2026-06-30
FNS-218,I will forcefully stop you from cumming! Forcibly shifting the peak boiling point and exploding pleasure Tsubasa Mai,https://pic.javct.net/poster/05192026/b1120947c8.jpg,https://javct.net/v/fns-218,124,2026-06-30
300MIUM-1366-RM,"[I will lend you a super masochistic woman] ""Master'' is always one pattern... I want you to tease me more, but I want you to tease me more, but I'm a curious woman with a mouthful mouth. I don't stop even if I can't stop deep throating. I like it until it's time for a deep throat. I'm a hodai user. Hodai M is OK with anything because I'm a M... [Masochist's home Q delivery] [Uncensored L**ked]",https://pic.javct.net/poster/05192026/382ffba956.jpg,https://javct.net/v/300mium-1366-rm,105,2026-06-30
FC2PPV-4929790,"After work, a slutty office lady with an NTR old man and a black man are shared by two men and continue to be brought to their climax by rotating insertion, and their bodies are in a state of limit, and they are inseminated twice in a row [Overseas version] Bonus included",https://pic.javct.net/poster/05192026/7fe4a4313a.jpg,https://javct.net/v/fc2ppv-4929790,41,2026-06-30
FC2PPV-4926396,"[No] I asked a cute 24-year-old girl who was alone after the last train to come to the pick-up room, and as a result, her eyes lit up and she immediately fucked him, and she was a real angel as she accepted the creampie with a smile [Overseas version] Bonus included",https://pic.javct.net/poster/05192026/ce5ff8188e.jpg,https://javct.net/v/fc2ppv-4926396,43,2026-06-30
FC2PPV-4929849,"[First shot/18 year old generation] Innocent real nursing school student (barely legal 3rd year student) with 1 experience teaching a man to an innocent girl in special training I was aiming to be a nurse, but instead I got an injection",https://pic.javct.net/poster/05192026/b8a0df3e1f.jpg,https://javct.net/v/fc2ppv-4929849,117,2026-06-30
FC2PPV-4925304,1 person experience Cute E cup plump female college student (20) with a short cut is pounded hard by her perverted boyfriend's big penis,https://pic.javct.net/poster/05192026/400a0d9b82.jpg,https://javct.net/v/fc2ppv-4925304,67,2026-06-30
300MIUM-1366,"[I will lend you a super masochistic woman] ""Master'' is always one pattern... I want you to tease me more, but I want you to tease me more, but I'm a curious woman with a mouthful mouth. I don't stop even if I can't stop deep throating. I like it until it's time for a deep throat. I'm a hodai user. Hodai M is OK with anything because I'm a M... [Masochist's home Q delivery]",https://pic.javct.net/poster/05192026/382ffba956.jpg,https://javct.net/v/300mium-1366,105,2026-06-30
200GANA-3396-RM,"Inviting an endangered type of young girl to a dangerous black commercial van... Is the destination in the mountains, a scrap factory, or a love road straight? A serious softie, first shot 2315 [Uncensored L**ked]",https://pic.javct.net/poster/05192026/774affd8ce.jpg,https://javct.net/v/200gana-3396-rm,62,2026-06-30
PXH-051-RM,Obo Girl 019 Ten-chan (19) 19 Sai Innocent Ecchi Cuteness Full Toy Sommelier Rim Job Self-Licking Smile Heart A Hard Worker Who Will Do Anything [Uncensored L**ked],https://pic.javct.net/poster/20221904/1652270559.jpg,https://javct.net/v/pxh-051-rm,150,2026-06-30
AKDL-064-RM,[Amateur interview] Silently appearing in AV at school 'Take Saki's beauty' A serious girl turns into M and has incontinence Natsuki 21 years old vocational student [Uncensored L**ked],https://pic.javct.net/poster/04112026/c56c23fee1.jpg,https://javct.net/v/akdl-064-rm,131,2026-06-30
AKDL-063-RM,[Off Paco video] Cute as an idol and with huge breasts and G cup! ! Bitch layer that makes you feel naughty when you drink it: Ayaka [Uncensored L**ked],https://pic.javct.net/poster/04112026/d876ad2f67.jpg,https://javct.net/v/akdl-063-rm,62,2026-06-30
JUY-900-RM,"""Divine Tits"" I Cup Popular Series Appearance!! Married Woman Across The Hall, Nanami Matsumoto [Uncensored L**ked]",https://pic.javct.net/poster/20212011/1642028739.jpg,https://javct.net/v/juy-900-rm,152,2026-06-30
JUY-843-RM,The Worst Man Made Me Cum So Hard I Could Die... Akari Mitani [Uncensored L**ked],https://pic.javct.net/poster/20221202/1650304956.jpg,https://javct.net/v/juy-843-rm,118,2026-06-30
