code,title,image_url,page_url,views,date_scraped
DASD-090-RM,Big Triple Gangbang R**e [Uncensored L**ked],https://pic.javct.net/poster/20220406/1656432719.jpg,https://javct.net/v/dasd-090-rm,120,2026-06-25
1P-062326-001,An orgy paradise where reason goes out the window!,https://pic.javct.net/poster/05192026/200a5463af.jpg,https://javct.net/v/1p-062326-001,49,2026-06-25
REAL-655,Female College Student Pregnant R**e Cum Shot 20 Consecutive BEST 4 Hours,https://pic.javct.net/poster/05192026/2dfb5ab974.jpg,https://javct.net/v/real-655,240,2026-06-25
WANZ-241-RM,Les ×-flops Gangbang Haze Lisa Out Of Kunoichi [Uncensored L**ked],https://pic.javct.net/poster/20230206/1688010624.jpg,https://javct.net/v/wanz-241-rm,110,2026-06-25
MIAD-981-SUB,Convulsions Climax Silent Les × Up Help Call In Rough Has Been Been Afraid That Being Labeled Fucked K**led Press The Voice Was School Girls Yuri Asada [English Subtitle],https://pic.javct.net/poster/04112026/05ec0ba910.jpg,https://javct.net/v/miad-981-sub,150,2026-06-25
FC2PPV-4924767,"[No] Two black guys with big dicks, a cool beauty with long black hair and a princess cut, violently fucked, and a sweaty hardcore 3P with two consecutive vaginal cum shots at the end [Overseas version] Bonus included",https://pic.javct.net/poster/05192026/bf612b18b1.jpg,https://javct.net/v/fc2ppv-4924767,45,2026-06-25
AKDL-056-RM,[Off-paco video] A bitch layer who is as cute as an idol but gets naughty when she drinks: Kanon Kanon Kanon [Uncensored L**ked],https://pic.javct.net/poster/04112026/13d931ee98.jpg,https://javct.net/v/akdl-056-rm,60,2026-06-25
PLA-018-RM,Instinctive Raw Creampie Orgy Azusa Nagasawa x Kyoko Maki [Uncensored L**ked],https://pic.javct.net/poster/20220406/1655280221.jpg,https://javct.net/v/pla-018-rm,120,2026-06-25
CEMD-858-RM,A lewd and masochistic mature woman - First anal release & 2-hole 3P sex - Saki Aikawa [Uncensored L**ked],https://pic.javct.net/poster/05192026/e5b960fa64.jpg,https://javct.net/v/cemd-858-rm,154,2026-06-25
PRTD-021-SUB,Decoy Investigator Yu - Ya Risa Sneak In Case - Yu Shinoda [English Subtitle],https://pic.javct.net/poster/04112026/a7c65a7f52.jpg,https://javct.net/v/prtd-021-sub,120,2026-06-25
JARB-001,The Wife Of The Old Novelist Prey,https://pic.javct.net/poster/05192026/d4939d6929.jpg,https://javct.net/v/jarb-001,120,2026-06-25
FAD-1786-RM,Kazuwa's reverse r**e - Fo**ed sex with a nice guy!! [Uncensored L**ked],https://pic.javct.net/poster/05192026/5796740cee.jpg,https://javct.net/v/fad-1786-rm,100,2026-06-25
NMSL-041,"""Please wait...I have a boyfriend waiting outside the wall..."" Prisoner Creampie Seeding Prison Rei Kuroshima",https://pic.javct.net/poster/05192026/b77d44543f.jpg,https://javct.net/v/nmsl-041,123,2026-06-25
FC2PPV-4923649,[Public] Creampie NTR impregnated hardcore 3P fuck with two big cock black men and a frustrated petite housewife,https://pic.javct.net/poster/05192026/47d7c708c9.jpg,https://javct.net/v/fc2ppv-4923649,167,2026-06-25
CEMD-858,A lewd and masochistic mature woman - First anal release & 2-hole 3P sex - Saki Aikawa,https://pic.javct.net/poster/05192026/e5b960fa64.jpg,https://javct.net/v/cemd-858,154,2026-06-25
FC2PPV-4909801-RM,A pair of senior and junior office ladies who are best friends get so excited at a group date that they miss the last train and have a creampie bukkake orgy at a hotel until morning. [Uncensored L**ked],https://pic.javct.net/poster/05192026/1cc4086002.jpg,https://javct.net/v/fc2ppv-4909801-rm,52,2026-06-25
MIDD-974,School Girls Gangbang R**e Kanae Luke,https://pic.javct.net/poster/05192026/c844e5ce67.jpg,https://javct.net/v/midd-974,120,2026-06-25
1P-061826-001,"Human Meat Toilet! ~Office Lady Nami Sawaguchi: Dogeza, Creampie, and Fo**ed Apology~",https://pic.javct.net/poster/05192026/1bf9c65032.jpg,https://javct.net/v/1p-061826-001,64,2026-06-25
CADV-667-RM,Daughter Girl Metamorphosis Poisoning 8 Hours! ! [Uncensored L**ked],https://pic.javct.net/poster/04112026/f495c6f959.jpg,https://javct.net/v/cadv-667-rm,480,2026-06-25
MVSD-341-SUB,Stop Time Daughter Tadaman Casual Vaginal Cum Shot Sena Ai [English Subtitle],https://pic.javct.net/poster/04112026/1777002000.jpg,https://javct.net/v/mvsd-341-sub,120,2026-06-25
REAL-590-RM,Pies R**e To School Girls Conceived 20 Barrage Abe 乃Miku [Uncensored L**ked],https://pic.javct.net/poster/20222109/1666140545.jpg,https://javct.net/v/real-590-rm,135,2026-06-25
STARS-438-RM,"""Because The Back Menu Of Our Store Is The Squirting Of The Teacher, Come To Play? W"" Mahiro Tadai, A New Female Teacher Who Was Gangbanged By Students At The School Festival [Uncensored L**ked]",https://pic.javct.net/poster/20212709/1634549265.jpg,https://javct.net/v/stars-438-rm,135,2026-06-25
MIAD-981-RM,Convulsions Climax Silent Les × Up Help Call In Rough Has Been Been Afraid That Being Labeled Fucked K**led Press The Voice Was School Girls Yuri Asada [Uncensored L**ked],https://pic.javct.net/poster/04112026/05ec0ba910.jpg,https://javct.net/v/miad-981-rm,150,2026-06-25
SRS-066-RM,"Amateur Hunter 2, 45 [Uncensored L**ked]",https://pic.javct.net/poster/05192026/0b58aa34f1.jpg,https://javct.net/v/srs-066-rm,130,2026-06-25
