code,title,image_url,page_url,views,date_scraped
SRS-066-RM,"Amateur Hunter 2, 45 [Uncensored L**ked]",https://pic.javct.net/poster/05192026/0b58aa34f1.jpg,https://javct.net/v/srs-066-rm,130,2026-06-15
MIDD-365-RM,Shou Nishino Gangbang R**e Female Teacher [Uncensored L**ked],https://pic.javct.net/poster/05192026/edbc041216.jpg,https://javct.net/v/midd-365-rm,170,2026-06-15
FC2PPV-4920409,9P Part 1 with cute cute Yun-chan 3 consecutive creampies on a dangerous day ready for pregnancy Cusco after creampie Challenge to new vaginal observation_#32,https://pic.javct.net/poster/05192026/f6ee6d1e29.jpg,https://javct.net/v/fc2ppv-4920409,73,2026-06-15
SDDE-474-RM,[Orgy Sumaho Video] Love She Was The Princess Of Yarisa! [Uncensored L**ked],https://pic.javct.net/poster/20230804/1694003599.jpg,https://javct.net/v/sdde-474-rm,150,2026-06-15
FC2PPV-4917889,"Celebrity wife Ryoko, 36 years old, has a skewered orgy with a solo fan club member in the room, hugs her, and holds her tongue.",https://pic.javct.net/poster/05192026/785013def2.jpg,https://javct.net/v/fc2ppv-4917889,40,2026-06-15
FC2PPV-4917103,[Individual shooting] 3P raw sex with a perverted married woman who is hungry for sex. She can't stop lusting for sex,https://pic.javct.net/poster/05192026/54cb0bac25.jpg,https://javct.net/v/fc2ppv-4917103,41,2026-06-15
ENKI-088-RM,"A Declaration of Submission: A Real-Life Cum Toilet, A Masochistic Creampie Gangbang Wants to Be Beaten Up, Wasa-chan [Uncensored L**ked]",https://pic.javct.net/poster/10232025/1761249838.jpg,https://javct.net/v/enki-088-rm,225,2026-06-15
DASD-005-RM,Pies Popular Fashion Model Maria Ozawa R**ed For 20 Consecutive Times! [Uncensored L**ked],https://pic.javct.net/poster/05192026/7af67ca2c2.jpg,https://javct.net/v/dasd-005-rm,120,2026-06-15
GVG-318-RM,Amorousness P ● A Chairman And Evil Brat Student Council Seta SoMegumi [Uncensored L**ked],https://pic.javct.net/poster/20240410/1729813648.jpg,https://javct.net/v/gvg-318-rm,130,2026-06-15
YAG-127,Falling Lady Humiliation PARTY Shoko Furukawa,https://pic.javct.net/poster/05192026/358a9723a3.jpg,https://javct.net/v/yag-127,125,2026-06-15
ENKI-046-RM,Tsukino Is An Erotically Fine Woman Who Loves Cocks And Will Easily Let You Fuck Her She's Baring Her Lusty Soul With Blowjob Action And Perverted Ass-Shaking Sex In This Collection Of Creampie Raw Footage [Uncensored L**ked],https://pic.javct.net/poster/20221202/1645262850.jpg,https://javct.net/v/enki-046-rm,241,2026-06-15
APAK-219-RM,Had Orgy With F-Cup Female Teacher Who I Couldn't Refuse. Caught By Orgy Group Of Big Tits Female Teachers And Taught To Climax. Close-Up Filming. Non Kohana. [Uncensored L**ked],https://pic.javct.net/poster/20221202/1646459341.jpg,https://javct.net/v/apak-219-rm,142,2026-06-15
ENKI-045-RM,Begging To Be Filled With Cum Loyal Servant Girl Has Her Disciplined Pussy Filled With Real Cum Rough Creampie [Uncensored L**ked],https://pic.javct.net/poster/20212011/1642839212.jpg,https://javct.net/v/enki-045-rm,226,2026-06-15
HND-027-RM,Nonstop Fucking Perfect Activity!Pies For 20 Consecutive Mizuno Example That Does Not End [Uncensored L**ked],https://pic.javct.net/poster/05192026/ff72f0bf1d.jpg,https://javct.net/v/hnd-027-rm,160,2026-06-15
ENKI-040-RM,"In Her 20s But Slept With At Least 1000 Guys Meeting An Easygoing Legendary Slutty Bitch From The Red Light District At An Event Cool And Shameless, We Have A Nonstop Fucking After Some Foreplay! But The Tables Turn When I Creampie Her Over And Over And Make Her Mine Mi [Uncensored L**ked]",https://static.javct.net/poster/enki-040.jpg,https://javct.net/v/enki-040-rm,124,2026-06-15
MIGD-634,Anal FUCK Cum Bukkake! Konishi Yu,https://pic.javct.net/poster/05192026/c19c04c1d1.jpg,https://javct.net/v/migd-634,120,2026-06-15
FC2PPV-4917101,[Face showing] A busty housewife with unmeasurable K-cups who is played with in 3P actually loves sex and squirts a lot,https://pic.javct.net/poster/05192026/354074dffd.jpg,https://javct.net/v/fc2ppv-4917101,39,2026-06-15
SRS-056-RM,Amateur Hunter 241 [Uncensored L**ked],https://pic.javct.net/poster/20241703/1711963022.jpg,https://javct.net/v/srs-056-rm,120,2026-06-15
EBOD-459-RM,Bus Tour With A Bare-Naked Busty Guide Ami Tokunaga [Uncensored L**ked],https://pic.javct.net/poster/20221904/1651711385.jpg,https://javct.net/v/ebod-459-rm,119,2026-06-15
IESP-135-RM,Chinami Sakai Barrage Horny Wife 20 Pies [Uncensored L**ked],https://pic.javct.net/poster/05192026/a89c6f504c.jpg,https://javct.net/v/iesp-135-rm,100,2026-06-15
ENKI-039-RM,Naughty Japanese Sex Fest Breaks Out! Horny Blue-Eyed Slut Jun-chan Gets Fucked Raw by a Big White Cock and Cum Splashed in her Pussy. [Uncensored L**ked],https://static.javct.net/poster/enki-039.jpg,https://javct.net/v/enki-039-rm,237,2026-06-15
FC2PPV-4916927,"[No] Black 3P party on the day of birthday Reina, a cute foreign office lady with outstanding charm Chapter 6: Intense 3P with 2 big cock black people on her birthday, to**ured to the limit and creampied 2 times in a row [Overseas version] Bonus included",https://pic.javct.net/poster/05192026/d8d5b87191.jpg,https://javct.net/v/fc2ppv-4916927,71,2026-06-15
NSPS-013-RM,Woman Working In A Flock Of Man Keep It From Not Being A Job Whether Or Not You Are [Uncensored L**ked],https://pic.javct.net/poster/20222612/1673306527.jpg,https://javct.net/v/nsps-013-rm,92,2026-06-15
1P-060726-001,Bitch!,https://pic.javct.net/poster/05192026/9b85a0b47d.jpg,https://javct.net/v/1p-060726-001,89,2026-06-15
