code,title,image_url,page_url,views,date_scraped
HND-027-RM,Nonstop Fucking Perfect Activity!Pies For 20 Consecutive Mizuno Example That Does Not End [Uncensored L**ked],https://pic.javct.net/poster/05192026/ff72f0bf1d.jpg,https://javct.net/v/hnd-027-rm,160,2026-06-10
ENKI-040-RM,"In Her 20s But Slept With At Least 1000 Guys Meeting An Easygoing Legendary Slutty Bitch From The Red Light District At An Event Cool And Shameless, We Have A Nonstop Fucking After Some Foreplay! But The Tables Turn When I Creampie Her Over And Over And Make Her Mine Mi [Uncensored L**ked]",https://static.javct.net/poster/enki-040.jpg,https://javct.net/v/enki-040-rm,124,2026-06-10
MIGD-634,Anal FUCK Cum Bukkake! Konishi Yu,https://pic.javct.net/poster/05192026/c19c04c1d1.jpg,https://javct.net/v/migd-634,120,2026-06-10
FC2PPV-4917101,[Face showing] A busty housewife with unmeasurable K-cups who is played with in 3P actually loves sex and squirts a lot,https://pic.javct.net/poster/05192026/354074dffd.jpg,https://javct.net/v/fc2ppv-4917101,39,2026-06-10
SRS-056-RM,Amateur Hunter 241 [Uncensored L**ked],https://pic.javct.net/poster/20241703/1711963022.jpg,https://javct.net/v/srs-056-rm,120,2026-06-10
EBOD-459-RM,Bus Tour With A Bare-Naked Busty Guide Ami Tokunaga [Uncensored L**ked],https://pic.javct.net/poster/20221904/1651711385.jpg,https://javct.net/v/ebod-459-rm,119,2026-06-10
IESP-135-RM,Chinami Sakai Barrage Horny Wife 20 Pies [Uncensored L**ked],https://pic.javct.net/poster/05192026/a89c6f504c.jpg,https://javct.net/v/iesp-135-rm,100,2026-06-10
ENKI-039-RM,Naughty Japanese Sex Fest Breaks Out! Horny Blue-Eyed Slut Jun-chan Gets Fucked Raw by a Big White Cock and Cum Splashed in her Pussy. [Uncensored L**ked],https://static.javct.net/poster/enki-039.jpg,https://javct.net/v/enki-039-rm,237,2026-06-10
FC2PPV-4916927,"[No] Black 3P party on the day of birthday Reina, a cute foreign office lady with outstanding charm Chapter 6: Intense 3P with 2 big cock black people on her birthday, to**ured to the limit and creampied 2 times in a row [Overseas version] Bonus included",https://pic.javct.net/poster/05192026/d8d5b87191.jpg,https://javct.net/v/fc2ppv-4916927,71,2026-06-10
NSPS-013-RM,Woman Working In A Flock Of Man Keep It From Not Being A Job Whether Or Not You Are [Uncensored L**ked],https://pic.javct.net/poster/20222612/1673306527.jpg,https://javct.net/v/nsps-013-rm,92,2026-06-10
1P-060726-001,Bitch!,https://pic.javct.net/poster/05192026/9b85a0b47d.jpg,https://javct.net/v/1p-060726-001,89,2026-06-10
ENKI-016-RM,Chi  Po Pickled Trained Service Transformation Masochist Waka Kana Maki Others Stick Seeding Wheel [Uncensored L**ked],https://pic.javct.net/poster/20222410/1667315241.jpg,https://javct.net/v/enki-016-rm,215,2026-06-10
HUNTC-611-RM,"Aphrodisiac patience game ""Does this really work? I'm totally fine..."" ""I'm fine too."" A girl who got an aphrodisiac drinks it out of curiosity! A chicken race with a mysterious sense of pride: ""The one that works loses''! But my body is honest! The pussy gradually starts to get wet and the joy juices don't stop, leading to a lesbian orgy! Furthermore, my brother is in the room... [Uncensored L**ked]",https://pic.javct.net/poster/05192026/37884b74d0.jpg,https://javct.net/v/huntc-611-rm,180,2026-06-10
SDDE-356-RM,Department Issued Two True In Sexual Desire Processing Specialty Outpatient Clinic Gangbang Sex [Uncensored L**ked],https://pic.javct.net/poster/20242108/1724790062.jpg,https://javct.net/v/sdde-356-rm,165,2026-06-10
484SNO-009-RM,"I'm Serious Until The Morning, Non-stop Serious 10 Shots In A Row [Uncensored L**ked]",https://pic.javct.net/poster/20230207/1690287514.jpg,https://javct.net/v/484sno-009-rm,180,2026-06-10
ENKI-013-RM,Obedient Female Falling Sensitive De M Girls  Raw SEX Awakening Others Stick Gachi Raw Saddle Creampie Gangbang Miku [Uncensored L**ked],https://pic.javct.net/poster/20222410/1667127384.jpg,https://javct.net/v/enki-013-rm,220,2026-06-10
FC2PPV-4915883,[Public] A beautiful woman with beautiful breasts and a nice butt who is salivating with a huge black dick and two black men with a big dick destroy it and have a 3P to make them creampie,https://pic.javct.net/poster/05192026/16cac15ed8.jpg,https://javct.net/v/fc2ppv-4915883,71,2026-06-10
HUNTC-611,"Aphrodisiac patience game ""Does this really work? I'm totally fine..."" ""I'm fine too."" A girl who got an aphrodisiac drinks it out of curiosity! A chicken race with a mysterious sense of pride: ""The one that works loses''! But my body is honest! The pussy gradually starts to get wet and the joy juices don't stop, leading to a lesbian orgy! Furthermore, my brother is in the room...",https://pic.javct.net/poster/05192026/37884b74d0.jpg,https://javct.net/v/huntc-611,180,2026-06-10
MIGD-627,Pies Dedicated Meat Urinal Konishi Marie,https://pic.javct.net/poster/05192026/aff4b6fa8e.jpg,https://javct.net/v/migd-627,150,2026-06-10
FC2PPV-4913788,"[First shot] First experience with a black man, 4P A shy beauty with glasses and beautiful breasts and a nice butt gets fucked by 3 big cock black men.Of course, she is fucked raw, bukkake, creampied and impregnated, 4P fuck",https://pic.javct.net/poster/05192026/a33d212bd8.jpg,https://javct.net/v/fc2ppv-4913788,46,2026-06-10
FC2PPV-4912528,"SEX with 20 people** Plump mature woman Reika's first 4P, sweaty carnal dance with huge breasts and big butt",https://pic.javct.net/poster/05192026/2daecbf8e7.jpg,https://javct.net/v/fc2ppv-4912528,72,2026-06-10
MIGD-625,Anal FUCK Cum Bukkake! Kimura Tuna,https://pic.javct.net/poster/05192026/c032bc4f87.jpg,https://javct.net/v/migd-625,120,2026-06-10
GVG-802-RM,Squirrel Harassment From Teasing Students Will Not Be A Teacher! Kazu Mizukawa [Uncensored L**ked],https://pic.javct.net/poster/05192026/21c84ec5e7.jpg,https://javct.net/v/gvg-802-rm,130,2026-06-10
FC2PPV-4909701,"[6 shots in a row] A slender beautiful music college student gets horny by sucking multiple big cocks with plenty of saliva, and climaxes with continuous raw sex and facial cumshots immediately after creampie",https://pic.javct.net/poster/05192026/4ba933dc39.jpg,https://javct.net/v/fc2ppv-4909701,57,2026-06-10
