code,title,image_url,page_url,views,date_scraped
HALE-023-RM,Mom Friend And A Day Trip Affair Exposure Trip Kokona Yuki [Uncensored L**ked],https://pic.javct.net/poster/20230302/1679113317.jpg,https://javct.net/v/hale-023-rm,139,2026-07-05
GEBB-052-RM,"I Found Some High-achieving, J-type Girls Taking Selfies And Exposing Themselves After School, So I Took Photos Of All Four Of Them. [Uncensored L**ked]",https://pic.javct.net/poster/05192026/ffefa0e1ac.jpg,https://javct.net/v/gebb-052-rm,135,2026-07-05
FJIN-151-RM,"Boob Job Cumshot!! After Ejaculation, The Man Gets A Boob Job And Cums Again - Hazuki Noa [Uncensored L**ked]",https://pic.javct.net/poster/05192026/ebd691a551.jpg,https://javct.net/v/fjin-151-rm,124,2026-07-05
RAPD-007-RM,"Outdoor R**e Strong Psychopaths In A Secluded Mountain Area Married Women Who Were Attacked By The Devil And Cried And Cried In Vain And Became Comforters Sae Fujiki, Aina Nagase, Miu Harutani [Uncensored L**ked]",https://pic.javct.net/poster/20230302/1679718899.jpg,https://javct.net/v/rapd-007-rm,135,2026-07-05
SUN-079-RM,Standing Back Exposure Slender Big Butt Beauty #Park #Parking Lot #Rooftop #Hotel... Poke From Behind And Fuck Knees [Uncensored L**ked],https://pic.javct.net/poster/20230302/1679541874.jpg,https://javct.net/v/sun-079-rm,184,2026-07-05
PASN-029-RM,Sweaty and juicy summer real wet SEX [Uncensored L**ked],https://pic.javct.net/poster/05192026/a649bf0d3b.jpg,https://javct.net/v/pasn-029-rm,121,2026-07-05
GEBB-052,"I Found Some High-achieving, J-type Girls Taking Selfies And Exposing Themselves After School, So I Took Photos Of All Four Of Them.",https://pic.javct.net/poster/05192026/ffefa0e1ac.jpg,https://javct.net/v/gebb-052,135,2026-07-05
FJIN-151,"Boob Job Cumshot!! After Ejaculation, The Man Gets A Boob Job And Cums Again - Hazuki Noa",https://pic.javct.net/poster/05192026/ebd691a551.jpg,https://javct.net/v/fjin-151,124,2026-07-05
DRPT-061-RM,Outdoor Peeing Schoolgirls Chained Spread-legged Restraint Pee Spray 3 Rion Izumi Hikaru Minazuki Kana Yura [Uncensored L**ked],https://pic.javct.net/poster/20240807/1723086625.jpg,https://javct.net/v/drpt-061-rm,125,2026-07-05
420HPT-062-RM,"Sana (25) Amateur Hoi Hoi, Amateur Hoi Hoi Pet, Amateur, Black Hair, Shaved, Obedient, Sensitive, Endless Orgasm, Sex Friend, Jumping, Outdoors, Shame, Toy, Creampie, Gonzo, Documentary [Uncensored L**ked]",https://pic.javct.net/poster/05192026/0725e7d776.jpg,https://javct.net/v/420hpt-062-rm,94,2026-07-05
MIDA-696,"I'm A Part-time Worker Who's Subjected To Humiliating Naked Training By A Perverted Store Manager, And I'm Fo**ed To Serve Customers Without A Bra Or Panties During The Late-night Shift.",https://pic.javct.net/poster/05192026/611fde1e64.jpg,https://javct.net/v/mida-696,120,2026-07-05
PASN-029,Sweaty and juicy summer real wet SEX,https://pic.javct.net/poster/05192026/a649bf0d3b.jpg,https://javct.net/v/pasn-029,121,2026-07-05
BDA-172-RM,Exposure In A Tropical Paradise Sex Too Free Without Worrying About The Eyes! Waka Misono [Uncensored L**ked],https://pic.javct.net/poster/20230302/1679715628.jpg,https://javct.net/v/bda-172-rm,142,2026-07-05
CEAD-735-RM,Kasumi Yua 2-disc Hyper Best 4 Hours 49 Minutes [Uncensored L**ked],https://pic.javct.net/poster/05192026/7ce9a7d918.jpg,https://javct.net/v/cead-735-rm,289,2026-07-05
ONED-869-RM,"Barely My Girlfriend, Yuma Asami [Uncensored L**ked]",https://pic.javct.net/poster/05192026/90f42d2e3e.jpg,https://javct.net/v/oned-869-rm,120,2026-07-05
SUN-083-RM,Karen Sein Drinking Cum Swallowing Petite (AAA Cup) Black Hair And Blowjob Date [Uncensored L**ked],https://pic.javct.net/poster/20230104/1681615634.jpg,https://javct.net/v/sun-083-rm,194,2026-07-05
MIDD-901-RM,Active college student travel for the first time a two-day intensive training blistering sex! ! Rina Oshima [Uncensored L**ked],https://pic.javct.net/poster/04112026/1776312693.jpg,https://javct.net/v/midd-901-rm,150,2026-07-05
KAGP-397,[Private Shoot] Blowjob Anywhere Guaranteed To Fill You Up! Top 18 Facials 280 Minutes,https://pic.javct.net/poster/05192026/0d79c654ad.jpg,https://javct.net/v/kagp-397,280,2026-07-05
SUN-082-RM,A Beautiful Lady Who Wants To Taste Semen To The Back Of Her Throat Gokkun Outdoor Date With A Maso Wife [Uncensored L**ked],https://pic.javct.net/poster/20230104/1680408545.jpg,https://javct.net/v/sun-082-rm,189,2026-07-05
HAZU-035-RM,"An Embarrassing Exhibitionist Journey With Her Son's Classmate's Skinny Daughter. ""You Have A Cute Face, But Your Nipples Are Long And Obscene,"" She Says, Punishing Him By Relentlessly Playing With His Nipples. [Uncensored L**ked]",https://pic.javct.net/poster/05192026/54e1512f14.jpg,https://javct.net/v/hazu-035-rm,106,2026-07-05
GKD-011-RM,Gakkugaku Of Woman Thin Saki-ryu [Uncensored L**ked],https://pic.javct.net/poster/20242012/1734742567.jpg,https://javct.net/v/gkd-011-rm,120,2026-07-05
NHDTB-155-RM,Night Pool Molester [Uncensored L**ked],https://pic.javct.net/poster/20230804/1691475037.jpg,https://javct.net/v/nhdtb-155-rm,180,2026-07-05
MIDD-898-RM,Yuki niece Sex On The Beach [Uncensored L**ked],https://pic.javct.net/poster/06032026/1775274035.jpg,https://javct.net/v/midd-898-rm,120,2026-07-05
CEMD-320-RM,"Shame, Ling, Tobikko Wearing, Downtown Date! 5 ~Married Woman Hanaki Shirakawa [Uncensored L**ked]",https://pic.javct.net/poster/20230104/1680925381.jpg,https://javct.net/v/cemd-320-rm,144,2026-07-05
