code,title,image_url,page_url,views,date_scraped
XVSR-344,Your Home Changes Quickly To Soap Land! !Bishojo Limited Delivery Cream Cream Soap Prepared Masaru Yoshikiri,https://pic.javct.net/poster/07052026/1ec4ddbf79.jpg,https://javct.net/v/xvsr-344,120,2026-07-11
ONED-850-RM,Barely One In The Sex Shop Pakopako 6! Yuma Asami [Uncensored L**ked],https://pic.javct.net/poster/07052026/d3596e55da.jpg,https://javct.net/v/oned-850-rm,120,2026-07-11
NNPJ-408-RM,"Back Byte Verification Document Popular In Ike ○! Wakeari Big Breasts Deriheru Miss Nampa Ayase-san (Tentative) H Cup Active Intelli Tutor Female College Student Forbidden Back Op Production Voyeur Success! !! After That, I Met Outside The Store And Made My AV Debut As It Was! !! [Uncensored L**ked]",https://pic.javct.net/poster/07052026/5f87bebb52.jpg,https://javct.net/v/nnpj-408-rm,120,2026-07-11
XVSR-286-RM,Absolutely Possible Raw Cum Shot Mother-of-lady Okami Young Leave [Uncensored L**ked],https://pic.javct.net/poster/04112026/a2f329598b.jpg,https://javct.net/v/xvsr-286-rm,120,2026-07-11
JUR-746-RM,"I Ran Into A Coworker At A Brothel Who Was Leaving To Get Married... I Added A Bunch Of Extra Options To Her, Who Had Always Treated Me Coldly And Looked Down On Me, And Made Her Cum Until Her Pussy Was Numb. [Uncensored L**ked]",https://pic.javct.net/poster/07052026/2251270b1a.jpg,https://javct.net/v/jur-746-rm,150,2026-07-11
JUL-388,"High-class Whore Nao Jinguji Bewitching, Splendid Married Woman-, The Beauty Is Extreme.",https://pic.javct.net/poster/07052026/03740780f0.jpg,https://javct.net/v/jul-388,120,2026-07-11
SNOS-269-RM,"Called A High-class Escort Service And Miraculously Ran Into My Idol, Legendary Gravure Idol, Kiho Kanematsu, And We Ended Up Having A Secret Relationship... [Uncensored L**ked]",https://pic.javct.net/poster/07052026/6e762696a4.jpg,https://javct.net/v/snos-269-rm,160,2026-07-11
MIST-128-RM,It Does Not Fit Just Dial And Wooed Just A Tokyo Famous Deriheru Of Production Ban!cosplay Deriheru Collection 8 Until The Glaring Man Who Is Out Of Raw Medium To Deriheru Miss [Uncensored L**ked],https://pic.javct.net/poster/06032026/1772843052.jpg,https://javct.net/v/mist-128-rm,160,2026-07-11
HUNTB-581-RM,Fully Booked Up To Half A Year In Advance! The Popular Secret Of The Rumored Mansion Sekukyaba Is All-you-can-drink All The Time! Norinori's Busty Girls Are Free To Fuck Without Permission At The Same Price! [Uncensored L**ked],https://pic.javct.net/poster/20230104/1682055687.jpg,https://javct.net/v/huntb-581-rm,130,2026-07-11
JUR-746,"I Ran Into A Coworker At A Brothel Who Was Leaving To Get Married... I Added A Bunch Of Extra Options To Her, Who Had Always Treated Me Coldly And Looked Down On Me, And Made Her Cum Until Her Pussy Was Numb.",https://pic.javct.net/poster/07052026/2251270b1a.jpg,https://javct.net/v/jur-746,150,2026-07-11
SNOS-269,"Called A High-class Escort Service And Miraculously Ran Into My Idol, Legendary Gravure Idol, Kiho Kanematsu, And We Ended Up Having A Secret Relationship...",https://pic.javct.net/poster/07052026/6e762696a4.jpg,https://javct.net/v/snos-269,160,2026-07-11
SCOP-644,"The Reunion Of The Beautiful Yankee And Shock Who Had Been Bullying Me In The Old Days Of Taking Off NG Onakura!The Early Stage Is A Real Story Play That Is Fo**ed To Get Masturbation In Front Of The Eyes!In Turn, It Is Fo**ed To Live To Distract Yourself From Working In The Genres! !It Feels If I Can Insert Ji ● Port, And It Is Put Out Continuously In The Ex-girl Who Rolls Ahi Lickingly! !",https://pic.javct.net/poster/07052026/6fd86c9c5b.jpg,https://javct.net/v/scop-644,145,2026-07-11
MIST-127-RM,"At ""An Old Traditional Titty Pub"" In The Biggest Entertainment District In Japan, New Girls Will Secretly Fuck Their Customers Raw In Order To Steal Them From The Veteran Girls 06 [Uncensored L**ked]",https://pic.javct.net/poster/01202026/1772592191.jpg,https://javct.net/v/mist-127-rm,160,2026-07-11
MIST-209-SUB,"At ""An Old Traditional Titty Pub"" In The Biggest Entertainment District In Japan, New Girls Will Secretly Fuck Their Customers Raw In Order To Steal Them From The Veteran Girls 10 [English Subtitle]",https://pic.javct.net/poster/04112026/9df49150c0.jpg,https://javct.net/v/mist-209-sub,160,2026-07-11
MIGD-668,The Mao Specialty Soap Kurata Out In Ultra-luxury,https://pic.javct.net/poster/07052026/b59e695d91.jpg,https://javct.net/v/migd-668,120,2026-07-11
SCOP-643,Aloha!Is This A Pin Salo! ?Is This Japan? ?There Is A Rumor That A Tropical Country-style Resort Pinsaro Exists In Some Places In Tokyo!The Familiar SCOOP Bag Is Deeply Infiltrated Every Time! !It's Hotter Than Usual Pinsaro! !Super Adherence To The Hot Summer Ever Summer Pinsaro! !,https://pic.javct.net/poster/07052026/9ec472e79f.jpg,https://javct.net/v/scop-643,150,2026-07-11
IENF-257-RM,Jun Suehiro Highest Grade Beautiful Girl Creampie Soap [Uncensored L**ked],https://pic.javct.net/poster/20230302/1678331898.jpg,https://javct.net/v/ienf-257-rm,140,2026-07-11
XVSR-281-RM,Asama Namase Interviewed The First Time After Amateur 's Pretending Shop Interview! ! [Uncensored L**ked],https://pic.javct.net/poster/10232025/1761778620.jpg,https://javct.net/v/xvsr-281-rm,120,2026-07-11
MIST-126-RM,Show Off The Big Penis To Handjob Deriheru Miss Your Touch Ban! As Bareback In The Place That Became Addicted To Big Penis! Until You Put Rainy Day Raw Medium To Handjob Miss Full Voyeur! Five [Uncensored L**ked],https://pic.javct.net/poster/01202026/1772510088.jpg,https://javct.net/v/mist-126-rm,160,2026-07-11
MIAA-166-RM,Super V.I.P 180cm tall tattoo beauty Ultra Highest quality creampie soapland Sato El [Uncensored L**ked],https://pic.javct.net/poster/20252204/1746480617.jpg,https://javct.net/v/miaa-166-rm,120,2026-07-11
AUKG-634-RM,Lesbian Delivery Health ~ Home Delivery OK! Women-only Delivery Health. Here Are The New Girls You Can Play With Right Now! ~ [Uncensored L**ked],https://pic.javct.net/poster/07202025/1756484654.jpg,https://javct.net/v/aukg-634-rm,120,2026-07-11
ABS-095-RM,"Akane Yui, Yui Zhu Sound Soap Satisfaction Perfect Score [Uncensored L**ked]",https://pic.javct.net/poster/07052026/34ee0cc8ab.jpg,https://javct.net/v/abs-095-rm,120,2026-07-11
MIST-122-RM,Show Off The Big Penis To Handjob Deriheru Miss Your Touch Ban!As Bareback In The Place That Became Addicted To Big Penis!Until You Put Rainy Day Raw Medium To Handjob Miss Full Voyeur!Four [Uncensored L**ked],https://pic.javct.net/poster/01202026/1772334321.jpg,https://javct.net/v/mist-122-rm,160,2026-07-11
STARS-072-RM,Love Sex Cowgirl Service Sex Minagawa Chiharu [Uncensored L**ked],https://pic.javct.net/poster/20243105/1719749143.jpg,https://javct.net/v/stars-072-rm,135,2026-07-11
