code,title,image_url,page_url,views,date_scraped
SNOS-269-RM,"Called A High-class Escort Service And Miraculously Ran Into My Idol, Legendary Gravure Idol, Kiho Kanematsu, And We Ended Up Having A Secret Relationship... [Uncensored L**ked]",https://pic.javct.net/poster/07052026/6e762696a4.jpg,https://javct.net/v/snos-269-rm,160,2026-07-10
MIST-128-RM,It Does Not Fit Just Dial And Wooed Just A Tokyo Famous Deriheru Of Production Ban!cosplay Deriheru Collection 8 Until The Glaring Man Who Is Out Of Raw Medium To Deriheru Miss [Uncensored L**ked],https://pic.javct.net/poster/06032026/1772843052.jpg,https://javct.net/v/mist-128-rm,160,2026-07-10
HUNTB-581-RM,Fully Booked Up To Half A Year In Advance! The Popular Secret Of The Rumored Mansion Sekukyaba Is All-you-can-drink All The Time! Norinori's Busty Girls Are Free To Fuck Without Permission At The Same Price! [Uncensored L**ked],https://pic.javct.net/poster/20230104/1682055687.jpg,https://javct.net/v/huntb-581-rm,130,2026-07-10
JUR-746,"I Ran Into A Coworker At A Brothel Who Was Leaving To Get Married... I Added A Bunch Of Extra Options To Her, Who Had Always Treated Me Coldly And Looked Down On Me, And Made Her Cum Until Her Pussy Was Numb.",https://pic.javct.net/poster/07052026/2251270b1a.jpg,https://javct.net/v/jur-746,150,2026-07-10
SNOS-269,"Called A High-class Escort Service And Miraculously Ran Into My Idol, Legendary Gravure Idol, Kiho Kanematsu, And We Ended Up Having A Secret Relationship...",https://pic.javct.net/poster/07052026/6e762696a4.jpg,https://javct.net/v/snos-269,160,2026-07-10
SCOP-644,"The Reunion Of The Beautiful Yankee And Shock Who Had Been Bullying Me In The Old Days Of Taking Off NG Onakura!The Early Stage Is A Real Story Play That Is Fo**ed To Get Masturbation In Front Of The Eyes!In Turn, It Is Fo**ed To Live To Distract Yourself From Working In The Genres! !It Feels If I Can Insert Ji ● Port, And It Is Put Out Continuously In The Ex-girl Who Rolls Ahi Lickingly! !",https://pic.javct.net/poster/07052026/6fd86c9c5b.jpg,https://javct.net/v/scop-644,145,2026-07-10
MIST-127-RM,"At ""An Old Traditional Titty Pub"" In The Biggest Entertainment District In Japan, New Girls Will Secretly Fuck Their Customers Raw In Order To Steal Them From The Veteran Girls 06 [Uncensored L**ked]",https://pic.javct.net/poster/01202026/1772592191.jpg,https://javct.net/v/mist-127-rm,160,2026-07-10
MIST-209-SUB,"At ""An Old Traditional Titty Pub"" In The Biggest Entertainment District In Japan, New Girls Will Secretly Fuck Their Customers Raw In Order To Steal Them From The Veteran Girls 10 [English Subtitle]",https://pic.javct.net/poster/04112026/9df49150c0.jpg,https://javct.net/v/mist-209-sub,160,2026-07-10
MIGD-668,The Mao Specialty Soap Kurata Out In Ultra-luxury,https://pic.javct.net/poster/07052026/b59e695d91.jpg,https://javct.net/v/migd-668,120,2026-07-10
SCOP-643,Aloha!Is This A Pin Salo! ?Is This Japan? ?There Is A Rumor That A Tropical Country-style Resort Pinsaro Exists In Some Places In Tokyo!The Familiar SCOOP Bag Is Deeply Infiltrated Every Time! !It's Hotter Than Usual Pinsaro! !Super Adherence To The Hot Summer Ever Summer Pinsaro! !,https://pic.javct.net/poster/07052026/9ec472e79f.jpg,https://javct.net/v/scop-643,150,2026-07-10
IENF-257-RM,Jun Suehiro Highest Grade Beautiful Girl Creampie Soap [Uncensored L**ked],https://pic.javct.net/poster/20230302/1678331898.jpg,https://javct.net/v/ienf-257-rm,140,2026-07-10
XVSR-281-RM,Asama Namase Interviewed The First Time After Amateur 's Pretending Shop Interview! ! [Uncensored L**ked],https://pic.javct.net/poster/10232025/1761778620.jpg,https://javct.net/v/xvsr-281-rm,120,2026-07-10
MIST-126-RM,Show Off The Big Penis To Handjob Deriheru Miss Your Touch Ban! As Bareback In The Place That Became Addicted To Big Penis! Until You Put Rainy Day Raw Medium To Handjob Miss Full Voyeur! Five [Uncensored L**ked],https://pic.javct.net/poster/01202026/1772510088.jpg,https://javct.net/v/mist-126-rm,160,2026-07-10
MIAA-166-RM,Super V.I.P 180cm tall tattoo beauty Ultra Highest quality creampie soapland Sato El [Uncensored L**ked],https://pic.javct.net/poster/20252204/1746480617.jpg,https://javct.net/v/miaa-166-rm,120,2026-07-10
AUKG-634-RM,Lesbian Delivery Health ~ Home Delivery OK! Women-only Delivery Health. Here Are The New Girls You Can Play With Right Now! ~ [Uncensored L**ked],https://pic.javct.net/poster/07202025/1756484654.jpg,https://javct.net/v/aukg-634-rm,120,2026-07-10
ABS-095-RM,"Akane Yui, Yui Zhu Sound Soap Satisfaction Perfect Score [Uncensored L**ked]",https://pic.javct.net/poster/07052026/34ee0cc8ab.jpg,https://javct.net/v/abs-095-rm,120,2026-07-10
MIST-122-RM,Show Off The Big Penis To Handjob Deriheru Miss Your Touch Ban!As Bareback In The Place That Became Addicted To Big Penis!Until You Put Rainy Day Raw Medium To Handjob Miss Full Voyeur!Four [Uncensored L**ked],https://pic.javct.net/poster/01202026/1772334321.jpg,https://javct.net/v/mist-122-rm,160,2026-07-10
STARS-072-RM,Love Sex Cowgirl Service Sex Minagawa Chiharu [Uncensored L**ked],https://pic.javct.net/poster/20243105/1719749143.jpg,https://javct.net/v/stars-072-rm,135,2026-07-10
MIDE-655,"Actual Temptation: Sensitive Pinsaro Girl Who Gets Wet from Blowjob, Minami Hatsukawa",https://pic.javct.net/poster/07052026/b0b42781db.jpg,https://javct.net/v/mide-655,120,2026-07-10
XVSR-520,Ayaka Tomoda Max A Complete Works Complete BEST 4 Hours,https://pic.javct.net/poster/07052026/0a1e7ffc8c.jpg,https://javct.net/v/xvsr-520,240,2026-07-10
KV-323-RM,"Pacifier Academy Pin Salon Department 16: Kana Kusunoki, Meguri Minoshima [Uncensored L**ked]",https://pic.javct.net/poster/07052026/2f9da07dfb.jpg,https://javct.net/v/kv-323-rm,130,2026-07-10
SNIS-472,Super Premium Sex Miss Aoi Tsukasa,https://pic.javct.net/poster/07052026/a05debf920.jpg,https://javct.net/v/snis-472,170,2026-07-10
NACT-152-RM,"Top-notch Techniques To Soothe The Soul And Extract Every Last Drop Of Semen! Super Popular Rejuvenation Men's Esthetician, Reiko Kobayakawa [Uncensored L**ked]",https://pic.javct.net/poster/07052026/ebd6125568.jpg,https://javct.net/v/nact-152-rm,113,2026-07-10
KV-323,"Pacifier Academy Pin Salon Department 16: Kana Kusunoki, Meguri Minoshima",https://pic.javct.net/poster/07052026/2f9da07dfb.jpg,https://javct.net/v/kv-323,130,2026-07-10
