code,title,image_url,page_url,views,date_scraped
MIGD-668,The Mao Specialty Soap Kurata Out In Ultra-luxury,https://pic.javct.net/poster/07052026/b59e695d91.jpg,https://javct.net/v/migd-668,120,2026-07-08
SCOP-643,Aloha!Is This A Pin Salo! ?Is This Japan? ?There Is A Rumor That A Tropical Country-style Resort Pinsaro Exists In Some Places In Tokyo!The Familiar SCOOP Bag Is Deeply Infiltrated Every Time! !It's Hotter Than Usual Pinsaro! !Super Adherence To The Hot Summer Ever Summer Pinsaro! !,https://pic.javct.net/poster/07052026/9ec472e79f.jpg,https://javct.net/v/scop-643,150,2026-07-08
IENF-257-RM,Jun Suehiro Highest Grade Beautiful Girl Creampie Soap [Uncensored L**ked],https://pic.javct.net/poster/20230302/1678331898.jpg,https://javct.net/v/ienf-257-rm,140,2026-07-08
XVSR-281-RM,Asama Namase Interviewed The First Time After Amateur 's Pretending Shop Interview! ! [Uncensored L**ked],https://pic.javct.net/poster/10232025/1761778620.jpg,https://javct.net/v/xvsr-281-rm,120,2026-07-08
MIST-126-RM,Show Off The Big Penis To Handjob Deriheru Miss Your Touch Ban! As Bareback In The Place That Became Addicted To Big Penis! Until You Put Rainy Day Raw Medium To Handjob Miss Full Voyeur! Five [Uncensored L**ked],https://pic.javct.net/poster/01202026/1772510088.jpg,https://javct.net/v/mist-126-rm,160,2026-07-08
MIAA-166-RM,Super V.I.P 180cm tall tattoo beauty Ultra Highest quality creampie soapland Sato El [Uncensored L**ked],https://pic.javct.net/poster/20252204/1746480617.jpg,https://javct.net/v/miaa-166-rm,120,2026-07-08
AUKG-634-RM,Lesbian Delivery Health ~ Home Delivery OK! Women-only Delivery Health. Here Are The New Girls You Can Play With Right Now! ~ [Uncensored L**ked],https://pic.javct.net/poster/07202025/1756484654.jpg,https://javct.net/v/aukg-634-rm,120,2026-07-08
ABS-095-RM,"Akane Yui, Yui Zhu Sound Soap Satisfaction Perfect Score [Uncensored L**ked]",https://pic.javct.net/poster/07052026/34ee0cc8ab.jpg,https://javct.net/v/abs-095-rm,120,2026-07-08
MIST-122-RM,Show Off The Big Penis To Handjob Deriheru Miss Your Touch Ban!As Bareback In The Place That Became Addicted To Big Penis!Until You Put Rainy Day Raw Medium To Handjob Miss Full Voyeur!Four [Uncensored L**ked],https://pic.javct.net/poster/01202026/1772334321.jpg,https://javct.net/v/mist-122-rm,160,2026-07-08
STARS-072-RM,Love Sex Cowgirl Service Sex Minagawa Chiharu [Uncensored L**ked],https://pic.javct.net/poster/20243105/1719749143.jpg,https://javct.net/v/stars-072-rm,135,2026-07-08
MIDE-655,"Actual Temptation: Sensitive Pinsaro Girl Who Gets Wet from Blowjob, Minami Hatsukawa",https://pic.javct.net/poster/07052026/b0b42781db.jpg,https://javct.net/v/mide-655,120,2026-07-08
XVSR-520,Ayaka Tomoda Max A Complete Works Complete BEST 4 Hours,https://pic.javct.net/poster/07052026/0a1e7ffc8c.jpg,https://javct.net/v/xvsr-520,240,2026-07-08
KV-323-RM,"Pacifier Academy Pin Salon Department 16: Kana Kusunoki, Meguri Minoshima [Uncensored L**ked]",https://pic.javct.net/poster/07052026/2f9da07dfb.jpg,https://javct.net/v/kv-323-rm,130,2026-07-08
SNIS-472,Super Premium Sex Miss Aoi Tsukasa,https://pic.javct.net/poster/07052026/a05debf920.jpg,https://javct.net/v/snis-472,170,2026-07-08
NACT-152-RM,"Top-notch Techniques To Soothe The Soul And Extract Every Last Drop Of Semen! Super Popular Rejuvenation Men's Esthetician, Reiko Kobayakawa [Uncensored L**ked]",https://pic.javct.net/poster/07052026/ebd6125568.jpg,https://javct.net/v/nact-152-rm,113,2026-07-08
KV-323,"Pacifier Academy Pin Salon Department 16: Kana Kusunoki, Meguri Minoshima",https://pic.javct.net/poster/07052026/2f9da07dfb.jpg,https://javct.net/v/kv-323,130,2026-07-08
OVG-150-RM,The Actual Situation Of A Malicious Customer Who Inserts Lively With A Prohibited Delivery Delivery 3 [Uncensored L**ked],https://pic.javct.net/poster/07052026/5cafe00614.jpg,https://javct.net/v/ovg-150-rm,135,2026-07-08
TDER-001-RM,Deriheru Production Unauthorized Release Of Rule-Breaking I've Exposed It To A Popular Girl! [Uncensored L**ked],https://pic.javct.net/poster/20230302/1678591151.jpg,https://javct.net/v/tder-001-rm,105,2026-07-08
NACT-152,"Top-notch Techniques To Soothe The Soul And Extract Every Last Drop Of Semen! Super Popular Rejuvenation Men's Esthetician, Reiko Kobayakawa",https://pic.javct.net/poster/07052026/ebd6125568.jpg,https://javct.net/v/nact-152,113,2026-07-08
XVSR-335,Authentic Cum Shot Pole Tech Genius Lady Rimi Hatsumi,https://pic.javct.net/poster/07052026/785df5a673.jpg,https://javct.net/v/xvsr-335,120,2026-07-08
MIST-278,"At ""An Old Traditional Titty Pub"" In The Biggest Entertainment District In Japan, Your Favorite Girls Will Fuck You Raw With Cowgirl Sex Until You Cum Inside Her - Misaki Azusa",https://pic.javct.net/poster/07052026/5b23576d04.jpg,https://javct.net/v/mist-278,160,2026-07-08
MIST-117-RM,Legally Indecent Exposure!Raw Inserted By Standing Back To Pervert Deriheru Miss Still Grabbed The Strap!Cum!Three [Uncensored L**ked],https://pic.javct.net/poster/01202026/1772099752.jpg,https://javct.net/v/mist-117-rm,160,2026-07-08
SOE-201-RM,Risa Kasumi Nomination NO.1 Bakobako Risky Mosaic Customs × NO.1STYLE × 4 Hours [Uncensored L**ked],https://pic.javct.net/poster/05192026/0c0dfd36ab.jpg,https://javct.net/v/soe-201-rm,240,2026-07-08
GVH-858,"A Tall Lounge Hostess From Minato Ward, A 170cm Tall Office Lady, Makes You Drink Her Pee! Toast With A Champagne Tower Of Holy Water Pouring Down From Her Height! A Pee-drenched Sex Session Where You Can Taste Her Pee-smelling Asshole And Pussy! Tomoe Hikari",https://pic.javct.net/poster/05192026/0d8d834a17.jpg,https://javct.net/v/gvh-858,160,2026-07-08
