code,title,image_url,page_url,views,date_scraped
MIDD-974,School Girls Gangbang R**e Kanae Luke,https://pic.javct.net/poster/05192026/c844e5ce67.jpg,https://javct.net/v/midd-974,120,2026-06-19
ISKF-005,Drunkness × Unconscious Mind C**ld JD Founded In A Street Application With A Company Employee-like Woman Who Was Picked Up On The Street Of Shinjuku [Mari],https://pic.javct.net/poster/05192026/fcebba9be8.jpg,https://javct.net/v/iskf-005,108,2026-06-19
ISKF-003,Drunkenness × Unconscious **d A Woman Found In A Club In Roppongi [Karin] And Miss Caba In Gotanda [Eriena],https://pic.javct.net/poster/05192026/bed76b68c8.jpg,https://javct.net/v/iskf-003,105,2026-06-19
ISKF-008,Drunkenness × Consciousness Unknown C**ld English Conversation Talked About [♪ つ ね] Of A Lecturer On Dating [Yuzuki],https://pic.javct.net/poster/05192026/f4c32dde5c.jpg,https://javct.net/v/iskf-008,119,2026-06-19
ISKF-007,Drunkenness × Unconscious Minded C**ld I Got To Know A Companion With Yukari Picked Up At A Karaoke Store Near The Closing Time [A Bitari],https://pic.javct.net/poster/05192026/28f02bb747.jpg,https://javct.net/v/iskf-007,120,2026-06-19
ISKF-004,Drunkenness × Unknown C**ld Junior High School Student In Shinjuku [Miyu] I Found In A Drinking Shop And A Student Hunting In Ikebukuro [Reina],https://pic.javct.net/poster/05192026/27611e0710.jpg,https://javct.net/v/iskf-004,116,2026-06-19
SVDVD-539-RM,Shame Freshman Developmental Health Diagnosis 2016 Spring [Uncensored L**ked],https://pic.javct.net/poster/05192026/27241ee9dd.jpg,https://javct.net/v/svdvd-539-rm,260,2026-06-19
SOE-111-RM,Risa Kasumi - Young Wife Who Was Violated In Front Of Husband NO.1STYLE  Risky Mosaic [Uncensored L**ked],https://pic.javct.net/poster/20222410/1666657940.jpg,https://javct.net/v/soe-111-rm,120,2026-06-19
ISJ-016,Female School Student Production Student Lee ● 12 People 4 Hours 3,https://pic.javct.net/poster/05192026/7e25ad8ae0.jpg,https://javct.net/v/isj-016,240,2026-06-19
ISJ-015,Female School Student Production Student Lee ● 12 People 4 Hours 2,https://pic.javct.net/poster/05192026/307c75faf3.jpg,https://javct.net/v/isj-015,240,2026-06-19
ISJ-019,Forbidden Living Daughter And Forbidding Mate Mating 12 People 4 Hours 2,https://pic.javct.net/poster/05192026/af4ed33893.jpg,https://javct.net/v/isj-019,240,2026-06-19
ISJ-018,Forbidden Birth With Cute Sister Mating 12 People 4 Hours,https://pic.javct.net/poster/05192026/c618a19d43.jpg,https://javct.net/v/isj-018,240,2026-06-19
ISJ-014,Female School Student Production Student Lee ● 12 People 4 Hours,https://pic.javct.net/poster/05192026/0cfae9641e.jpg,https://javct.net/v/isj-014,240,2026-06-19
XRW-701-RM,A Woman Who Gets Wet Despite Being Attacked Kanna Misaki [Uncensored L**ked],https://pic.javct.net/poster/05192026/ce5c724f86.jpg,https://javct.net/v/xrw-701-rm,169,2026-06-19
DASD-236,Doll Kotone Further Committed,https://pic.javct.net/poster/05192026/00d7724476.jpg,https://javct.net/v/dasd-236,100,2026-06-19
RBD-239,Shizuka Kanno - Assessment Of Sorrow - The Night Of Compliant Sex Slaves Anal Beautiful Wife,https://pic.javct.net/poster/05192026/fc2ef12ba2.jpg,https://javct.net/v/rbd-239,120,2026-06-19
REAL-590-RM,Pies R**e To School Girls Conceived 20 Barrage Abe 乃Miku [Uncensored L**ked],https://pic.javct.net/poster/20222109/1666140545.jpg,https://javct.net/v/real-590-rm,135,2026-06-19
HZGD-115-RM,"Immediately After Getting Married, I Met A Senior Who Was Longing For School Days, And I Met A Backlash NTR Mai Imai [Uncensored L**ked]",https://pic.javct.net/poster/09052025/1757202774.jpg,https://javct.net/v/hzgd-115-rm,123,2026-06-19
WANZ-162-RM,Nodoi Itano Yuki And Fierce Throat [Uncensored L**ked],https://pic.javct.net/poster/05192026/65f3730dcf.jpg,https://javct.net/v/wanz-162-rm,120,2026-06-19
STARS-438-RM,"""Because The Back Menu Of Our Store Is The Squirting Of The Teacher, Come To Play? W"" Mahiro Tadai, A New Female Teacher Who Was Gangbanged By Students At The School Festival [Uncensored L**ked]",https://pic.javct.net/poster/20212709/1634549265.jpg,https://javct.net/v/stars-438-rm,135,2026-06-19
AP-676-RM,Extraordinary Brother-in-law Brother-in-law Cum Shot Hellfollowing Five Of The Sister-in-law That Suddenly Made Up And Put It In And Out Again And Again!One By One With Certainty To Go To Hell [Uncensored L**ked],https://pic.javct.net/poster/05192026/4034286498.jpg,https://javct.net/v/ap-676-rm,110,2026-06-19
AP-700-RM,Bully Girl  Raw Chasing After Ruins And Revenge! [Uncensored L**ked],https://pic.javct.net/poster/20222311/1671839947.jpg,https://javct.net/v/ap-700-rm,160,2026-06-19
RBD-226,Yuna Takizawa Beautiful Woman Teacher Was Fo**ed To Incest,https://pic.javct.net/poster/05192026/8c81cdb74f.jpg,https://javct.net/v/rbd-226,120,2026-06-19
SDDE-503-RM,"A Man Who Can Stop Time Has Existed!~ New Ability Person, Takuya Takuro Appeared!I Will Stop Fucking Ano Girl!Editing [Uncensored L**ked]",https://pic.javct.net/poster/20230104/1681896908.jpg,https://javct.net/v/sdde-503-rm,120,2026-06-19
