code,title,image_url,page_url,views,date_scraped
XV-483-RM,Saya Love Surreal Pleasure [Uncensored L**ked],https://pic.javct.net/poster/05192026/fce371fdb6.jpg,https://javct.net/v/xv-483-rm,120,2026-06-10
SHKD-428,I Miss Your Campus Is Not Unable To Resist The Bell Sound Riona ... 2,https://pic.javct.net/poster/05192026/9750e4a977.jpg,https://javct.net/v/shkd-428,120,2026-06-10
T28-516,Girls In Public Toilets,https://pic.javct.net/poster/05192026/8b5d7077ef.jpg,https://javct.net/v/t28-516,120,2026-06-10
SCOP-609,Otoko Conquers As Instinct And Onna Is Sexually Pressured As Done! !Resistance Also Keeps Being Fucked Vaguely Onna 30 People 4 Hours BEST,https://pic.javct.net/poster/05192026/dbcf5c95f6.jpg,https://javct.net/v/scop-609,240,2026-06-10
SSNI-545,"My Father And Father-in-law I'm R**ed By My Two Fathers, And I'm Destined To Be Fucked For A Lifetime ... Yumeno Aika",https://pic.javct.net/poster/05192026/4964384b0d.jpg,https://javct.net/v/ssni-545,120,2026-06-10
MXGS-171-RM,Female Teacher Akiho Yoshizawa M De Nasty Was Crime Spree [Uncensored L**ked],https://pic.javct.net/poster/05192026/8276acd178.jpg,https://javct.net/v/mxgs-171-rm,120,2026-06-10
SSNI-890,Gachi's Uniform Stalker Demon Is Aiming For Heavy Rain ● Su Yumeno Aika,https://pic.javct.net/poster/05192026/92915e8c93.jpg,https://javct.net/v/ssni-890,120,2026-06-10
NSPS-070-RM,2 Commit Sexual Assault Force The Strong Woman [Uncensored L**ked],https://pic.javct.net/poster/20222612/1674835423.jpg,https://javct.net/v/nsps-070-rm,88,2026-06-10
ATKD-107-RM,Riko Tachibana Special [Uncensored L**ked],https://pic.javct.net/poster/05192026/690a63eacc.jpg,https://javct.net/v/atkd-107-rm,220,2026-06-10
SNIS-546,Large A Valley Staff Our Sexual Processing Manager Petite A Hidden Busty Compliant Daughter. Aika 149cm,https://pic.javct.net/poster/05192026/6096d226c7.jpg,https://javct.net/v/snis-546,150,2026-06-10
MXGS-733-RM,Rapist ~ Woman Compel The Sexual Relationship To Others ~ Aso Nozomi [Uncensored L**ked],https://pic.javct.net/poster/05192026/cb9f8dc0e5.jpg,https://javct.net/v/mxgs-733-rm,120,2026-06-10
TAMM-026-RM,I Will Let You Be A Trained Female Teacher Do M Transformation Woman [Uncensored L**ked],https://pic.javct.net/poster/05192026/9a0f1d7161.jpg,https://javct.net/v/tamm-026-rm,125,2026-06-10
HZGD-123-RM,Pies Jealousy Of The Wife Of The Boss Pies Les  Pu Ayane Touka [Uncensored L**ked],https://pic.javct.net/poster/20222311/1671848380.jpg,https://javct.net/v/hzgd-123-rm,117,2026-06-10
FAX-426-RM,Women and sex and war Showa [Uncensored L**ked],https://pic.javct.net/poster/05192026/c7cb9cce6e.jpg,https://javct.net/v/fax-426-rm,265,2026-06-10
NHDTA-965-RM,Ikasero In Piston Homestretch Caught Busty Woman Escaping From The Mixed Bathing Molester Molester Teacher! ! [Uncensored L**ked],https://pic.javct.net/poster/20240807/1722986453.jpg,https://javct.net/v/nhdta-965-rm,170,2026-06-10
DOCP-033-RM,A Surprised Female College Student Who Falls Instantly And Suddenly To A Pleasure That Is Fucked In His Throat With Ambush Irama [Uncensored L**ked],https://pic.javct.net/poster/05192026/27ed582a18.jpg,https://javct.net/v/docp-033-rm,135,2026-06-10
SHKD-551-SUB,R**e Document Ai Uehara [English Subtitle],https://pic.javct.net/poster/04112026/1776330377.jpg,https://javct.net/v/shkd-551-sub,90,2026-06-10
FAX-427-RM,Woman was attacked by a man hit a woman walking the attack / Abegg to set / person for 2 summer of r**e [Uncensored L**ked],https://pic.javct.net/poster/05192026/e126ff2108.jpg,https://javct.net/v/fax-427-rm,100,2026-06-10
FAX-404-RM,For Middle-aged Man Want The Woman Who Had Committed Illegal Sleep Courier Back ... [Uncensored L**ked],https://pic.javct.net/poster/05192026/668282878c.jpg,https://javct.net/v/fax-404-rm,110,2026-06-10
FAX-417-RM,Of High-crime District [Uncensored L**ked],https://pic.javct.net/poster/05192026/5279dadf4e.jpg,https://javct.net/v/fax-417-rm,125,2026-06-10
MIDE-734-RM,Investigator Kana Was Caught Because Of Me For One Year. [Uncensored L**ked],https://pic.javct.net/poster/20230104/1681429673.jpg,https://javct.net/v/mide-734-rm,120,2026-06-10
DV-426-RM,Kaede Matsushima CLUB GAL SEX [Uncensored L**ked],https://pic.javct.net/poster/05192026/a45ea076cd.jpg,https://javct.net/v/dv-426-rm,120,2026-06-10
MIDE-876-RM,Female Teacher Les X Puwa ● ~ Devil Irama / Group Humiliation ~ Nana Yagi [Uncensored L**ked],https://pic.javct.net/poster/20230206/1686641650.jpg,https://javct.net/v/mide-876-rm,150,2026-06-10
ATID-212-RM,"Yu Summer Kaize Truth Investigator Woman, And Was Buried In The Darkness - Drowning In Tentacles [Uncensored L**ked]",https://pic.javct.net/poster/05192026/c1e0db8f31.jpg,https://javct.net/v/atid-212-rm,120,2026-06-10
