code,title,image_url,page_url,views,date_scraped
FSKT-023,The Most Pretty Girls Student In Japan Is My Creampie Love Doll Yura,https://pic.javct.net/poster/07052026/08f937fdfc.jpg,https://javct.net/v/fskt-023,120,2026-07-12
XVSR-289-RM,Miyoshi Hoshino 4 Hours [Uncensored L**ked],https://pic.javct.net/poster/04112026/86c58ac656.jpg,https://javct.net/v/xvsr-289-rm,240,2026-07-12
HUNTB-496-RM,"""It's Really Disgusting To Get An Erection With This! W"" A Miniskirt Girl In My Class Is Estrus In My Cock That Gets Erect Even If It's Stepped On...! A House For A Girl In My Class... [Uncensored L**ked]",https://pic.javct.net/poster/20233001/1677210650.jpg,https://javct.net/v/huntb-496-rm,180,2026-07-12
HUNTB-493-RM,"""Why Don't You Leave Now... You've Been Together For Three Days?"" ""Eh!? Three Days?"" [Uncensored L**ked]",https://pic.javct.net/poster/20233001/1677210712.jpg,https://javct.net/v/huntb-493-rm,170,2026-07-12
XRW-773-RM,A Tied Up Schoolgirl Slathered With Aphrodisiacs Is Squirting To Orgasmic Oblivion - Inaba Ruka [Uncensored L**ked],https://pic.javct.net/poster/07052026/10a3208e02.jpg,https://javct.net/v/xrw-773-rm,160,2026-07-12
MILK-221-RM,"Perverted Photography, Tailing, Entering The House, Turning An Innocent Schoolgirl Into A Sex Slave, Going Crazy With Pleasure, Absolute Sex, Marui Moeka [Uncensored L**ked]",https://pic.javct.net/poster/20242108/1727283867.jpg,https://javct.net/v/milk-221-rm,115,2026-07-12
NSODN-022-RM,A Video Of A Group Of Seven Men And Women Having An Orgy During Summer Vacation In A Rural Area Has Been L**ked. [Uncensored L**ked],https://pic.javct.net/poster/07052026/6191c57dc9.jpg,https://javct.net/v/nsodn-022-rm,120,2026-07-12
HUNTC-616-RM,"""What?! No Way! Am I The Only One In My Class Who Gets Erections? No, Am I The Only One In The World?!"" It's Been A Year Since All The Other Men Stopped Getting Erections... But For Some Reason, I'm The Only One Who Gets Erections, And I've Entered A Period Of Incredible Popularity!! Putting An End To The Era Where My Female Classmates Were Satisfied With Just Having Lesbian Encounters Among Themselves!! [Uncensored L**ked]",https://pic.javct.net/poster/07052026/a1da54cdc6.jpg,https://javct.net/v/huntc-616-rm,240,2026-07-12
MKON-143-RM,I'm Troubled By My Excessively Thick Pubic Hair. I'll Teach This J-type Girl Who's Worried About Wanting To Get Rid Of It The Wonders Of Thick Pubic Hair With My Body! Sara Isshiki [Uncensored L**ked],https://pic.javct.net/poster/07052026/fc34e8c490.jpg,https://javct.net/v/mkon-143-rm,128,2026-07-12
ROYD-334-RM,"A Cocky, Arrogant J-pop Idol Who Takes Life Lightly Turns Out To Be A Sensitive, Weakling With A Slutty Pussy. Nonstop, Intense Private Lessons From A Virile Teacher. Miyu Otori [Uncensored L**ked]",https://pic.javct.net/poster/07052026/89da372f02.jpg,https://javct.net/v/royd-334-rm,100,2026-07-12
SCOP-915,"When I Gave A Chiropractic Massage To Loosen Up The Body Of A Female Swimmer Whose Times Had Been Stagnating, Her Sensitive Teenage Body Caused A Large Amount Of Love Juice To Gush From Between Her Legs, So I Finished By Loosening Up Her Vagina And She Came In A Series Of Orgasms!!",https://pic.javct.net/poster/07052026/ccf98c4ce2.jpg,https://javct.net/v/scop-915,145,2026-07-12
DNJR-160-RM,Female Student Harem Masturbation Support Academy: Proper Ejaculation Lessons By J●! From Masturbation To Unprotected Sex. [Uncensored L**ked],https://pic.javct.net/poster/07052026/276d14827e.jpg,https://javct.net/v/dnjr-160-rm,105,2026-07-12
APAK-333,"Hazuki, The Innocent Masochist, Reaches Orgasm With Internal Ejaculation. The Delicate Body Of This Beautiful Girl Groans In Pain! Intense Orgasm From A Devilish Thrust! Direct Hit To The Uterus! Legs Shaking! ""This Is The First Time I've Felt Anything Like This! I'm Going To Break!"" Lewd Orgasm Student Guidance: Sano Hazuki",https://pic.javct.net/poster/07052026/96c41a077a.jpg,https://javct.net/v/apak-333,127,2026-07-12
FNEO-020,"My Father Told Me ""Go Here"".Three In A Bowl",https://pic.javct.net/poster/07052026/335775111f.jpg,https://javct.net/v/fneo-020,142,2026-07-12
SNOS-325-RM,"After Being Repeatedly R**ed By A Super-sexually Insatiable, Out-of-control Teacher During Every Break From Morning Until The 10th Time... I Finally Succumbed To My Masochistic Desires. - Rino Sakurano [Uncensored L**ked]",https://pic.javct.net/poster/07052026/87f46fd9a8.jpg,https://javct.net/v/snos-325-rm,120,2026-07-12
KHIP-008-RM,"My Niece J Series Who Came To My House Due To Bad Behavior I Couldn't Resist The Peachy Ass Peeking From My Miniskirt, And When I Attacked, She Unexpectedly Honestly Fucked Me And Ever Since Then, I've Been Cumming Every Day! Nanami Yokomiya [Uncensored L**ked]",https://pic.javct.net/poster/20230302/1677900660.jpg,https://javct.net/v/khip-008-rm,127,2026-07-12
MUKD-301-RM,Airi Sato Out In The Real Sensitive Busty Girl Uniform Of G-cup To Shake Deep-afterimage Of Nipple I Seem Rest Of Erotic Comics Like [Uncensored L**ked],https://pic.javct.net/poster/07052026/80fbd08516.jpg,https://javct.net/v/mukd-301-rm,110,2026-07-12
WANZ-883-RM,"""What!? Hey, Did You Just Cum Inside Me!?"" To Cover His Premature Ejaculation He Went Overtime With Extended Piston-Pumping Action And Kept His Dick Inside For Some Follow-Up Creampie Fucking!! - Inaba Ruka [Uncensored L**ked]",https://pic.javct.net/poster/07052026/7a82106436.jpg,https://javct.net/v/wanz-883-rm,120,2026-07-12
HUNTC-616,"""What?! No Way! Am I The Only One In My Class Who Gets Erections? No, Am I The Only One In The World?!"" It's Been A Year Since All The Other Men Stopped Getting Erections... But For Some Reason, I'm The Only One Who Gets Erections, And I've Entered A Period Of Incredible Popularity!! Putting An End To The Era Where My Female Classmates Were Satisfied With Just Having Lesbian Encounters Among Themselves!!",https://pic.javct.net/poster/07052026/a1da54cdc6.jpg,https://javct.net/v/huntc-616,240,2026-07-12
HSODA-127-RM,"A School Life Filled With Insults, Scorn, And Excitement. A Class Of A**sers Who Mock Your Small Penis But Still Give You A Handjob And Make You Hard Again And Again. [Uncensored L**ked]",https://pic.javct.net/poster/07052026/4b117b1d9d.jpg,https://javct.net/v/hsoda-127-rm,180,2026-07-12
MVG-168,Class In Chaos With A Hilarious Face! Pure J-pop Idol's Face Collapses In Ecstatic Climax! Shiori Mamiya,https://pic.javct.net/poster/07052026/65757dd765.jpg,https://javct.net/v/mvg-168,165,2026-07-12
MKON-143,I'm Troubled By My Excessively Thick Pubic Hair. I'll Teach This J-type Girl Who's Worried About Wanting To Get Rid Of It The Wonders Of Thick Pubic Hair With My Body! Sara Isshiki,https://pic.javct.net/poster/07052026/fc34e8c490.jpg,https://javct.net/v/mkon-143,128,2026-07-12
HND-408-RM,Stop Nipple Naked Blunder And Staked Piston!Mischief Love Cum Shot JK ​​3 Real Eikawa Riko [Uncensored L**ked],https://pic.javct.net/poster/07052026/251e1769bd.jpg,https://javct.net/v/hnd-408-rm,120,2026-07-12
URMT-007,Schoolgirls Wholeheartedly Swallow Cock After School: Super Concentrated Cum Swallowing Edition,https://pic.javct.net/poster/07052026/6bc5bcc400.jpg,https://javct.net/v/urmt-007,180,2026-07-12
