code,title,image_url,page_url,views,date_scraped
FSGD-004,"Your Name Is ""not Do"".Joy Knew In The Fucked Is That ... Sena Yamaji",https://pic.javct.net/poster/05192026/b2b432418c.jpg,https://javct.net/v/fsgd-004,123,2026-06-26
FSKI-003,"A Cute And Cute Schoolgirl Is The First To Experience 18 Cm Big Cock Of Ojisan! ""I'm Sorry!Big! ""While I Feel That I Have To Remove The Rubber Rubber Unexpectedly!School Girls Who Had Become A Prisoner Of The Big Dick In 93 Iki Of Rolled Up Maiden Ma ○ Co From The Dimension Stop",https://pic.javct.net/poster/05192026/597313c973.jpg,https://javct.net/v/fski-003,215,2026-06-26
DORI-019,"Paco Shooting No.19 I Made J ○ Who Was Addicted To The Pleasantness Of Raw Chin In The First Unauthorized Vaginal Cum Shot Begging ""Please Put It In With Ojisan's Chin Chin Raw ..."", And Also Vaginal Cum Shot In The Second Time !!",https://pic.javct.net/poster/05192026/f2fba7be58.jpg,https://javct.net/v/dori-019,91,2026-06-26
MUCD-356-RM,"It Feels So Good, I Can't Stop!! The Best 4 Hours Of Squirting As The Body Of A Schoolgirl In Uniform Overflows With Pleasure. [Uncensored L**ked]",https://pic.javct.net/poster/05192026/ab789afa5c.jpg,https://javct.net/v/mucd-356-rm,240,2026-06-26
HUNTB-533-RM,"""Even If It's Small, I Can Pinch It!"" My Younger Sister Who Was Made Fun Of Her Small Tits Desperately Fucking! It's Not Going To Be... Chiku Koki! But Chiku Koki Feels So Good That It Seems To Be Alive ... [Uncensored L**ked]",https://pic.javct.net/poster/20230104/1680843006.jpg,https://javct.net/v/huntb-533-rm,180,2026-06-26
KHIP-009-RM,"My Niece J Series Who Came To My House Due To Bad Behavior I Couldn't Resist The Peachy Ass Peeking From My Miniskirt, And When I Attacked, She Unexpectedly Honestly Fucked Me And Ever Since Then, I've Been Cumming Every Day! Rina Takase [Uncensored L**ked]",https://pic.javct.net/poster/20230104/1680927264.jpg,https://javct.net/v/khip-009-rm,124,2026-06-26
DORI-087-RM,"Paco Shooting No.87 I'm 173 Cm Tall With Beautiful Legs And Beautiful Breasts, But I've Creampied This J* Twice! [Uncensored L**ked]",https://pic.javct.net/poster/20230104/1681270701.jpg,https://javct.net/v/dori-087-rm,72,2026-06-26
LULU-218-RM,"My Father's Remarriage Suddenly Made A Namaiki Deca-ass Neo Gal J-kei Younger Sister Irritated Me With Panchira Provocation, So I Made A Virgin Immediately Saddle Preaching Piston Many Times And Made It Understand. Satsuki Ena [Uncensored L**ked]",https://pic.javct.net/poster/20230206/1685763667.jpg,https://javct.net/v/lulu-218-rm,160,2026-06-26
ONET-018-RM,It Has Been Fucked Ass Hole To Dad And Uncle Yumeno Asahina [Uncensored L**ked],https://pic.javct.net/poster/05192026/dd8f55b2f0.jpg,https://javct.net/v/onet-018-rm,125,2026-06-26
OFES-051,"An Annual Event Held At A Certain Girls' School: A Breast Health Check Exclusively For Girls. Areola, Softness, Sensitivity...the Condition Of The Female Genitalia Is Carefully Observed And Sexually Harassed.",https://pic.javct.net/poster/05192026/425e05abc8.jpg,https://javct.net/v/ofes-051,160,2026-06-26
DSJH-017,Relentless Orgasm Training With Continuous Squirting Until All Bodily Fluids Are Drained - Another Kind Of Youth Experienced By Schoolgirl Beauties -,https://pic.javct.net/poster/05192026/1fb788ef32.jpg,https://javct.net/v/dsjh-017,119,2026-06-26
BAZX-255-RM,Natural Big Tits Is The Best! Giving Raw Destructive Creampies To A Female Schoolgirl With Godly Tits! 01 [Uncensored L**ked],https://pic.javct.net/poster/05192026/7eca64e43f.jpg,https://javct.net/v/bazx-255-rm,235,2026-06-26
FSKI-002,"""I Can Not Say It Is Not Easy ..."" At The Esthetic Shop That Aimed At The Girls' Power Up, I Entrusted Myself To A Female Surgical Practitioner But I Was Relieved Male Practitioner! What?Unmoved By The Man's Mouth And Unable To Refuse Unimportant Entrusted To Pleasure Uniforms Pretty Girls Erogenous Oil Massage",https://pic.javct.net/poster/05192026/ce25aea12a.jpg,https://javct.net/v/fski-002,214,2026-06-26
FNEO-002,"""eh!?Is Not This Sex? ""Rubbing With Raw Cotton With Raw Cheeks If You Scold With A Bare Crotch You Can Not Be Patient And It Gets Pleasant And It Has Been Squeezed Many Times And Can Not Resist Even If Inserted In Nuruli And MAKO, Can Not Stand It, Can Not Stand School Girls Who Kept Swinging",https://pic.javct.net/poster/05192026/08b35a59ae.jpg,https://javct.net/v/fneo-002,238,2026-06-26
GBRK-002-RM,"*Viewer Discretion Advised* J●R**e 2: Indiscriminate Ejaculation! 20 Victims, 301 Minutes [Uncensored L**ked]",https://pic.javct.net/poster/05192026/4ffba194ce.jpg,https://javct.net/v/gbrk-002-rm,301,2026-06-26
DORI-009,"Paco Shooting No.09 ""That's Good! I'm Going! Iku! Iku!"" The Beautiful Leg Slender J ● Who Has Done It 20 Times Or More Concentrates On Things That Make You Feel Better Than Daily Money I Was Delighted!",https://pic.javct.net/poster/05192026/601cf60116.jpg,https://javct.net/v/dori-009,67,2026-06-26
LOVE-001,LOVE & SEX-1,https://pic.javct.net/poster/05192026/66bfd12a8e.jpg,https://javct.net/v/love-001,306,2026-06-26
FUNK-021-RM,"SNS Exposure Play-by-play In The Corner Of The Classroom, The Shadowy J-kei Who Doesn't Stand Out Was A Girl Who Wanted To Show Off Her Big Breasts... I Always Knew That She Was Live-streaming Shameful Masturbation After School With Otaku Dirty Talk. [Uncensored L**ked]",https://pic.javct.net/poster/20230104/1682739523.jpg,https://javct.net/v/funk-021-rm,200,2026-06-26
DORI-086-RM,"Paco Shooting No.86 After Club Activities Ended And Retired, ""I'm Fucking Little By Little ◆"" I Gave A Creampie To J*'s Raw Pussy Twice! [Uncensored L**ked]",https://pic.javct.net/poster/20230104/1681269153.jpg,https://javct.net/v/dori-086-rm,79,2026-06-26
MUDR-115-RM,Uniform Beautiful Girl Of NTR Constitution To Be Taken Down Everywhere I Go Ao Neo [Uncensored L**ked],https://pic.javct.net/poster/05192026/9e0d31ed26.jpg,https://javct.net/v/mudr-115-rm,120,2026-06-26
JRBA-007-RM,"Niece Kozue's Minor Fish Ma Kozue Is Cheeky But A Cute Guy Who Apologizes ""I'm Sorry"" Kozue Fujita [Uncensored L**ked]",https://pic.javct.net/poster/20230104/1681531692.jpg,https://javct.net/v/jrba-007-rm,180,2026-06-26
ONET-016-RM,Brainwashing Puppet And Uniforms Bambina.Gauze 々Hara Lily [Uncensored L**ked],https://pic.javct.net/poster/05192026/a6d6af7b7d.jpg,https://javct.net/v/onet-016-rm,120,2026-06-26
SCOP-806-RM,"[Creampie Appeal! ? ] Thoroughly SCOOP The Ecology Of Z Generation Dad Life J ●! ! Modern Girls Who Are Hungry For The Warmth Of Human Skin Are Close To Each Other And Are Super Aggressive When It Comes To Sex! ! When It Seems To Be Alive, Hold The Crab Scissors Tightly With Your Feet And Force Vaginal Ejaculation! ! [Uncensored L**ked]",https://pic.javct.net/poster/20230104/1680927940.jpg,https://javct.net/v/scop-806-rm,145,2026-06-26
ONET-017-RM,Aggravated School Girls Pet Vol.001 Minori Otari [Uncensored L**ked],https://pic.javct.net/poster/05192026/2726f490ce.jpg,https://javct.net/v/onet-017-rm,120,2026-06-26
