code,title,image_url,page_url,views,date_scraped
REAL-663,I Could Only Look At The Appearance Of Her (Kimi) Being Fucked By His Father And Being Developed.Mai Chan,https://pic.javct.net/poster/05192026/9fc41c3411.jpg,https://javct.net/v/real-663,120,2026-06-22
DAVK-081-RM,[Miracle J Cup Beautiful Big Tits] Perverted Boyfriend's NTR Hobby Lent To A Gross Man And A Uniform Beautiful Girl's 100cm Super Soft Colossal Tits Titty Fuck Ejaculation Pai Pamma Co First Seen Man's Sperm 10 Or More Bukkake Creampie Body Fluid Pickled Super Orgy [Uncensored L**ked],https://pic.javct.net/poster/20230205/1683349114.jpg,https://javct.net/v/davk-081-rm,120,2026-06-22
ONET-012-RM,Aphrodisiac Pleasure Dependent Transformation Addiction Doeroyandere Girls Out Of School Students Live In Conceived To SEX Aine [Uncensored L**ked],https://pic.javct.net/poster/05192026/954948270b.jpg,https://javct.net/v/onet-012-rm,130,2026-06-22
APKH-196-RM,"Please Film Me Having Sex... ""If You Lick My Balls, Lots Of Sperm Will Come Out!"" Lewd Service Sex From A Naturally Perverted Reiwa Girl, Voluptuous Angel Hanamori Natsuho [Uncensored L**ked]",https://pic.javct.net/poster/05192026/f1f5a40bcb.jpg,https://javct.net/v/apkh-196-rm,154,2026-06-22
MADV-634-RM,[4K] Yamashita Saiko who was fo**ed to wear a swimsuit in violation of school rules by a school girl who is serious and has white skin and beautiful breasts... Saiko repeatedly had sex with Saiko and Creampie again and again [Uncensored L**ked],https://pic.javct.net/poster/05192026/a9494cfde1.jpg,https://javct.net/v/madv-634-rm,127,2026-06-22
DORI-004,"Paco Shooting No.04 ""That's The Ultimate Choice ..."" Raw SEX Inexperienced J ● Accepted Raw Chin Insertion In Exchange For Daily Money Up And Was Vaginal Cum Shot!",https://pic.javct.net/poster/05192026/67aa20e5c6.jpg,https://javct.net/v/dori-004,85,2026-06-22
JRBA-008-RM,Obedient Ma Co Is Cuckold In Front Of The Grandfather Who Dedicated His Virginity At The Grandfather's Compliant ATM. Miku Arima [Uncensored L**ked],https://pic.javct.net/poster/20230205/1684556153.jpg,https://javct.net/v/jrba-008-rm,160,2026-06-22
JUBE-004-RM,"After School Secrets A Pure Girl Who Has Recently Started Working As A Dad Is Turned Into A Neat And Clean Bitch With Money, Alcohol And Power. [Uncensored L**ked]",https://pic.javct.net/poster/20230205/1684559913.jpg,https://javct.net/v/jube-004-rm,153,2026-06-22
BABM-018-RM,"Mama's Repayment For Me, Who Broke Both Hands While Protecting Me From An Accident, Bab Miaru Manatsu-chan Became My Mom! Manatsu Misaki [Uncensored L**ked]",https://pic.javct.net/poster/20230205/1683346368.jpg,https://javct.net/v/babm-018-rm,111,2026-06-22
AKDL-055-RM,J-style toilet [Uncensored L**ked],https://pic.javct.net/poster/04112026/509fe6a84a.jpg,https://javct.net/v/akdl-055-rm,58,2026-06-22
HUNTB-550-RM,"""I'll Teach You Naughty Things"" → ""No More! Don't Move! It's Going To Break!"" My C**ldhood Friend, Who Always Looks Down On Me, Screams At My Uncontrollable Unfaithful Cock! [Uncensored L**ked]",https://pic.javct.net/poster/20230205/1683263409.jpg,https://javct.net/v/huntb-550-rm,170,2026-06-22
MFT-005-RM,"When I Heard That The Biological Research Department Was Recruiting Sperm For An Experiment, I Was Hired Immediately And Was Overtaken By A Cute Science Female Member! ""Can You Put Out A Little More?"" [Uncensored L**ked]",https://pic.javct.net/poster/20230206/1687405380.jpg,https://javct.net/v/mft-005-rm,179,2026-06-22
HUNTC-619-RM,"Our School Has A ""Special Sex Education Department"" Where Both Boys And Girls With Strong Libidos Are Considered Top Students! This Is A Department Dedicated To Training Exceptionally Sexual Students. Every Day, Students Learn About And Experience Sex. Here, What Is Valued Is Not Suppressing Desires, But Understanding Them Correctly. [Uncensored L**ked]",https://pic.javct.net/poster/05192026/51b3c74b7e.jpg,https://javct.net/v/huntc-619-rm,130,2026-06-22
KHIP-010-RM,"My Niece J Series Who Came To My House Due To Bad Behavior I Couldn't Resist The Peachy Ass Peeking From My Miniskirt, And When I Attacked, She Unexpectedly Honestly Fucked Me And Ever Since Then, I've Been Cumming Every Day! Maika Hiizumi [Uncensored L**ked]",https://pic.javct.net/poster/20230205/1683345569.jpg,https://javct.net/v/khip-010-rm,131,2026-06-22
HUNTC-507-RM,"Public execution of masturbation by a girl classmate with glasses who looks like a virgin and who wants to pretend to be an erotic manga! When I entered a preparatory school that was an all-girls school until last year, it was almost an all-girls school with a male to female ratio of 1:9! Girls are strong! I am at the mercy of girls! ! Even though I was definitely a gangster girl in middle school... [Uncensored L**ked]",https://pic.javct.net/poster/05192026/0f22700a31.jpg,https://javct.net/v/huntc-507-rm,242,2026-06-22
SDAB-154-RM,"Youthful Getaway - Fair-Skinned Beautiful Girl Spends A Summer Day Slaking Her Lust: Cum Swallowing/Fucking In The Open Air/As Hard As She Can, Seeking Pleasure With Her Whole Body Chika Sato [Uncensored L**ked]",https://pic.javct.net/poster/20221202/1645487322.jpg,https://javct.net/v/sdab-154-rm,140,2026-06-22
YAG-129,¥ Exchange JK Outdoor Exposure OK 3P Horny Back Byte Cream Pies Harajuku System Reademo Yumeka (Tentative),https://pic.javct.net/poster/05192026/2c3a226de0.jpg,https://javct.net/v/yag-129,125,2026-06-22
HUNTA-558-RM,"Knockout Completely On My Sister's Protruding Butt! !Erection Chi Po Pierces Melimely Through The Pants! ""You Were Such A Cute Little Ass? ! ""Even Now I Am A Good Friend From A Young Age ○ Even Now My Sister I Love Is A Super Beauty Butt! !My Younger Sister Who Had Never Consciously Ever Watched It Unexpectedly ... [Uncensored L**ked]",https://pic.javct.net/poster/20231912/1705251018.jpg,https://javct.net/v/hunta-558-rm,240,2026-06-22
ROYD-325-RM,"""Heatstroke?"" Thanks To The Busty Manager's Unaware Nursing, Instead Of Recovering From Summer Fatigue, He Gets Rock Hard And Has Sex!? The Day Before The Competition, He's Lost In Her Kind, Soft, And Voluptuous Body. [Uncensored L**ked]",https://pic.javct.net/poster/05192026/ac0aea3831.jpg,https://javct.net/v/royd-325-rm,140,2026-06-22
HUNTC-533-RM,"From this year, the third Sunday in June has become an annual ""Brother's Day""! My brother's word is absolute! On this day, no matter what kind of big brother you want to fuck with your sister! It doesn't matter if you're in front of your parents! Even if you are a sister who usually fights with each other, you have to listen to everything you say with gratitude on this day! [Uncensored L**ked]",https://pic.javct.net/poster/05192026/7cce1c8b93.jpg,https://javct.net/v/huntc-533-rm,168,2026-06-22
HUBLK-070-RM,"I Was To**ured And R**ed Endlessly Until The Beautiful Sunrise. I Was Mercilessly Ab**ed By Strangers, My Throat And Pussy Being Brutally Violated. [Uncensored L**ked]",https://pic.javct.net/poster/05192026/e4b3ab299c.jpg,https://javct.net/v/hublk-070-rm,120,2026-06-22
HUNBL-017-RM,Strangling After School Mass Incontinence In Irama [Uncensored L**ked],https://pic.javct.net/poster/05192026/ebe9961dce.jpg,https://javct.net/v/hunbl-017-rm,140,2026-06-22
HUBLK-073-RM,Group Time Stop R**e 2 [Uncensored L**ked],https://pic.javct.net/poster/05192026/b2f80529b6.jpg,https://javct.net/v/hublk-073-rm,140,2026-06-22
XVSR-247-RM,Back / Tsubomi Undisclosed SEX Attachment Collection Image [Uncensored L**ked],https://pic.javct.net/poster/04112026/1776749791.jpg,https://javct.net/v/xvsr-247-rm,240,2026-06-22
