code,title,image_url,page_url,views,date_scraped
SNOS-281-RM,"[School Festival Booth] Tall J● Fo**ed To Wear A High-cut Swimsuit And Serve Customers With Her Sexy Legs! Unable To Refuse Aroused Customers, She Offers Secret Menu Sex Services. Asuha Mitsuha [Uncensored L**ked]",https://pic.javct.net/poster/07052026/4c2f39b8f6.jpg,https://javct.net/v/snos-281-rm,150,2026-07-10
DVRT-019-RM,The Day A Girl With Frigidity Was Destroyed By Uncle Pig Mitsuki Yuina [Uncensored L**ked],https://pic.javct.net/poster/20230302/1677820157.jpg,https://javct.net/v/dvrt-019-rm,120,2026-07-10
JRBA-006-RM,My First Hand Job Was My Family's Pet Dog. An Adolescent Brain Moody Perverted Girl Who Shows An Abnormal Interest In Chi Port Raw Kurumi Futaba Kurumi [Uncensored L**ked],https://pic.javct.net/poster/20230302/1679110099.jpg,https://javct.net/v/jrba-006-rm,180,2026-07-10
HUNTB-649-RM,"On The Day The World Ends, There Will Be Only Girls Left And I Will Be The Only Man. That's Why A Girl Asks For Help And Hides Together, But It's So Close That You Can Hear The Heartbeat And Erection Unscrupulously! [Uncensored L**ked]",https://pic.javct.net/poster/20230207/1691121495.jpg,https://javct.net/v/huntb-649-rm,190,2026-07-10
TUE-134-RM,Collection Of Sneaky Toilet Les Pu Video Collection Aimed Only For Girls Raw [Uncensored L**ked],https://pic.javct.net/poster/20230302/1677985112.jpg,https://javct.net/v/tue-134-rm,120,2026-07-10
HSODA-127,"A School Life Filled With Insults, Scorn, And Excitement. A Class Of A**sers Who Mock Your Small Penis But Still Give You A Handjob And Make You Hard Again And Again.",https://pic.javct.net/poster/07052026/4b117b1d9d.jpg,https://javct.net/v/hsoda-127,180,2026-07-10
NSODN-022,A Video Of A Group Of Seven Men And Women Having An Orgy During Summer Vacation In A Rural Area Has Been L**ked.,https://pic.javct.net/poster/07052026/6191c57dc9.jpg,https://javct.net/v/nsodn-022,120,2026-07-10
ROYD-334,"A Cocky, Arrogant J-pop Idol Who Takes Life Lightly Turns Out To Be A Sensitive, Weakling With A Slutty Pussy. Nonstop, Intense Private Lessons From A Virile Teacher. Miyu Otori",https://pic.javct.net/poster/07052026/89da372f02.jpg,https://javct.net/v/royd-334,100,2026-07-10
SNOS-281,"[School Festival Booth] Tall J● Fo**ed To Wear A High-cut Swimsuit And Serve Customers With Her Sexy Legs! Unable To Refuse Aroused Customers, She Offers Secret Menu Sex Services. Asuha Mitsuha",https://pic.javct.net/poster/07052026/4c2f39b8f6.jpg,https://javct.net/v/snos-281,150,2026-07-10
SNOS-325,"After Being Repeatedly R**ed By A Super-sexually Insatiable, Out-of-control Teacher During Every Break From Morning Until The 10th Time... I Finally Succumbed To My Masochistic Desires. - Rino Sakurano",https://pic.javct.net/poster/07052026/87f46fd9a8.jpg,https://javct.net/v/snos-325,120,2026-07-10
SONE-673-SUB,"""Uncle, Touch Me More."" I Couldn't Resist The Bright-smiling Innocent Girl And Started Molesting Her... She Became Addicted To My Technique More Than Her Boyfriend. Kawagoe Niko [English Subtitle]",https://pic.javct.net/poster/20250903/1743704469.jpg,https://javct.net/v/sone-673-sub,150,2026-07-10
ACZD-145-RM,A Super-beautiful Man Who Is In Heat By Having His Anus Licked. He Trains His Sensitive Body To Convulse And Beg. Nanako [Uncensored L**ked],https://pic.javct.net/poster/20231011/1699617272.jpg,https://javct.net/v/aczd-145-rm,151,2026-07-10
REAL-696,Schoolgirl Absent R**e Creampie 20 Barrage 10 People Total Of 200 Shot BEST 4 Hours,https://pic.javct.net/poster/07052026/485bf1db10.jpg,https://javct.net/v/real-696,240,2026-07-10
FNEO-017,Angels' Blowjobs-14 Female Students Who Want To Blowjobs-,https://pic.javct.net/poster/07052026/7a1a93ba54.jpg,https://javct.net/v/fneo-017,240,2026-07-10
EBOD-439,Target Of International Students Nordic Girl Fucked In Japanese In School Suzumori Rosa,https://pic.javct.net/poster/07052026/cf03b8fa17.jpg,https://javct.net/v/ebod-439,120,2026-07-10
DORI-032,Paco Shooting No.32 Creampie In Big Tits J ● That Sucks On The Tits Of The G Cup And Knocks With Raw Chin Many Times! Cum In The Mouth From Fucking & Blowjob!,https://pic.javct.net/poster/07052026/61948590a0.jpg,https://javct.net/v/dori-032,84,2026-07-10
KAWD-980,I Am Committing A Blank One Hour Remarried Partner's Daughter Every Day Until My Wife Comes Home. Cherry Blossoms,https://pic.javct.net/poster/07052026/adc10ebc38.jpg,https://javct.net/v/kawd-980,120,2026-07-10
BANK-112-RM,A Natural Beautiful Girl With Convulsions And A Mischievous Hot Spring Trip [Uncensored L**ked],https://pic.javct.net/poster/20230302/1678427948.jpg,https://javct.net/v/bank-112-rm,130,2026-07-10
HUNTB-535-RM,"Let's Have Sex, I'll... I Can Only Thank You With My Body. Super Bimbo Gal With Curly Hair Show Bra White Loose Is Stupid But Super Hard-working Shop [Uncensored L**ked]",https://pic.javct.net/poster/20230302/1679631719.jpg,https://javct.net/v/huntb-535-rm,200,2026-07-10
NHDTB-741-RM,"""Don't Let Anyone See You..."" Massive Incontinence J* Who Was Forcibly Stripped Naked In Her Jacket And Was Made To Cum Remotely At The School Looking For Clothes [Uncensored L**ked]",https://pic.javct.net/poster/20233001/1677046017.jpg,https://javct.net/v/nhdtb-741-rm,105,2026-07-10
MUDR-126-RM,"Ever Since That Day ... Rei Kuruki, A Beautiful Girl In Uniform Who Is Vaginal Cum Shot During Bondage Training [Uncensored L**ked]",https://pic.javct.net/poster/20230206/1686362226.jpg,https://javct.net/v/mudr-126-rm,120,2026-07-10
SDAB-180-RM,"Juice, Sweat, Tide, Sperm Pop Off From A Fresh And Fresh Body Covered With Youth Juice! Doppyun Youth 10 Shots! !! Riho Takahashi, An Energetic Girl Who Laughs Well With An H-cup Young Face [Uncensored L**ked]",https://static.javct.net/poster/sdab-180.jpg,https://javct.net/v/sdab-180-rm,120,2026-07-10
SDAB-179-RM,Won't You Save This Crybaby Heroine? Non Hanakado SOD Only Porn Debut [Uncensored L**ked],https://static.javct.net/poster/1623129404.jpg,https://javct.net/v/sdab-179-rm,138,2026-07-10
SUJI-303-RM,Adolescent Sexuality Leads To Lust. Forbidden Brother And Sister Creampie Incest Shaved Sister Oto Misaki Sound [Uncensored L**ked],https://pic.javct.net/poster/07052026/50d61af558.jpg,https://javct.net/v/suji-303-rm,95,2026-07-10
