code,title,image_url,page_url,views,date_scraped
TYAN-007-RM,Big Ass Beautiful Girl Hunting Emika Shiratori [Uncensored L**ked],https://pic.javct.net/poster/20230205/1684471591.jpg,https://javct.net/v/tyan-007-rm,120,2026-06-23
SW-586-RM,"I'll Do It As A Grilled Pig!Bad Girls Who Crooked Up With Mench ○ Raw And Me.However, It Was Pretty Cute And It Became Flattering When It Became One Person, It Was A Girl Who Was A Lamb Who Was Covered With A Wolf's Skin And Could Not Refuse Something Pleasant. [Uncensored L**ked]",https://pic.javct.net/poster/05192026/45bfbb1aa3.jpg,https://javct.net/v/sw-586-rm,150,2026-06-23
SDAB-156-RM,Compliant Uniform Beautiful Girl Absolute Obedience Raw Saddle Creampie Sexual Intercourse Marina Saito [Uncensored L**ked],https://pic.javct.net/poster/05192026/b4706e3e87.jpg,https://javct.net/v/sdab-156-rm,135,2026-06-23
APNS-414-RM,A Schoolgirl Obsessed With Exhibitionism; Her Uterus Throbs With The Thought Of Having Her Pussy Seen... Yuka Chiba [Uncensored L**ked],https://pic.javct.net/poster/05192026/dcc5346ef0.jpg,https://javct.net/v/apns-414-rm,106,2026-06-23
DORI-007,"Paco Shooting No.07 When I Push It Up Strongly And Deeply With Raw Chin, It Makes A Squirting Sound And Squirts, And It Is Vaginal Cum Shot As It Is To The Modern Naughty Gal J ● -chan!",https://pic.javct.net/poster/05192026/d0ccc567ce.jpg,https://javct.net/v/dori-007,80,2026-06-23
TUE-136-RM,Strong Crime Video Collection In The Darkness [Uncensored L**ked],https://pic.javct.net/poster/20230104/1682911915.jpg,https://javct.net/v/tue-136-rm,120,2026-06-23
SCR-313-RM,A Video Posted By Bringing A Plain And Quiet Neighborhood Girl In A Sailor Uniform To Her Home And Raping It [Uncensored L**ked],https://pic.javct.net/poster/20230104/1682912039.jpg,https://javct.net/v/scr-313-rm,120,2026-06-23
MUCD-356,"It Feels So Good, I Can't Stop!! The Best 4 Hours Of Squirting As The Body Of A Schoolgirl In Uniform Overflows With Pleasure.",https://pic.javct.net/poster/05192026/ab789afa5c.jpg,https://javct.net/v/mucd-356,240,2026-06-23
REAL-655,Female College Student Pregnant R**e Cum Shot 20 Consecutive BEST 4 Hours,https://pic.javct.net/poster/05192026/2dfb5ab974.jpg,https://javct.net/v/real-655,240,2026-06-23
GAJK-011-RM,A Schoolgirl Who Gets S&M Training In A Storehouse An Innocent Girl Who Was Threatened By Her Family Hostage And Fucked. Extreme And Abnormal Pleasure That You Feel Even Though You Don't Like It Himari Ayase [Uncensored L**ked],https://pic.javct.net/poster/20230205/1683349053.jpg,https://javct.net/v/gajk-011-rm,120,2026-06-23
ONET-013-RM,Aphrodisiac Pleasure Dependent Transformation Addiction Gangimari Black Gal Girls Out Of School Students Live In Conceived To SEX Eri-chan [Uncensored L**ked],https://pic.javct.net/poster/05192026/96831c26f3.jpg,https://javct.net/v/onet-013-rm,120,2026-06-23
LULU-215-RM,"I Couldn't Stand The Bulging Milk Of My Fair-skinned, Busty Niece, And My Perverted Uncle Impregnated Me Many Times With A Piston With Breast Sucking And Made Me Cum Inside. Saki Sakura [Uncensored L**ked]",https://pic.javct.net/poster/20230206/1685763852.jpg,https://javct.net/v/lulu-215-rm,160,2026-06-23
BAGR-088,"Otoha Misuzu, A Promiscuous Young Girl Who Overcame Forbidden Love And Learned About Adult Love.",https://pic.javct.net/poster/05192026/763de9659f.jpg,https://javct.net/v/bagr-088,126,2026-06-23
HUNTA-044-RM,"If Accustomed To The Sister Of The More Than 20 Years Of Age Difference Of Year, No Longer It's Rubbed Like A Stranger, And The Last Minute I'm Not A Pervert ... Even If The Erection Said To Be Brother And Sister, And The Younger Sister Of The  School Students, Still Do Not Have Her Gravel = Good Year Of Age Platelet My Uncle. [Uncensored L**ked]",https://pic.javct.net/poster/20222410/1668450508.jpg,https://javct.net/v/hunta-044-rm,225,2026-06-23
STARS-161-RM,A Small Devil Temptation Sex Ichika Nagano Who Is Provocative Only By Showing The Panchira To Me For Some Reason [Uncensored L**ked],https://pic.javct.net/poster/20222410/1668586477.jpg,https://javct.net/v/stars-161-rm,135,2026-06-23
HUNBL-092-RM,Women's  Raw Public Toilet Leap [Uncensored L**ked],https://pic.javct.net/poster/20221904/1651817150.jpg,https://javct.net/v/hunbl-092-rm,170,2026-06-23
HUNBL-112-RM,The Manager Of Club Activities Is The Club Member's Sex Slave [Uncensored L**ked],https://pic.javct.net/poster/20222109/1665119372.jpg,https://javct.net/v/hunbl-112-rm,170,2026-06-23
MIAD-981-SUB,Convulsions Climax Silent Les × Up Help Call In Rough Has Been Been Afraid That Being Labeled Fucked K**led Press The Voice Was School Girls Yuri Asada [English Subtitle],https://pic.javct.net/poster/04112026/05ec0ba910.jpg,https://javct.net/v/miad-981-sub,150,2026-06-23
REAL-663,I Could Only Look At The Appearance Of Her (Kimi) Being Fucked By His Father And Being Developed.Mai Chan,https://pic.javct.net/poster/05192026/9fc41c3411.jpg,https://javct.net/v/real-663,120,2026-06-23
DAVK-081-RM,[Miracle J Cup Beautiful Big Tits] Perverted Boyfriend's NTR Hobby Lent To A Gross Man And A Uniform Beautiful Girl's 100cm Super Soft Colossal Tits Titty Fuck Ejaculation Pai Pamma Co First Seen Man's Sperm 10 Or More Bukkake Creampie Body Fluid Pickled Super Orgy [Uncensored L**ked],https://pic.javct.net/poster/20230205/1683349114.jpg,https://javct.net/v/davk-081-rm,120,2026-06-23
ONET-012-RM,Aphrodisiac Pleasure Dependent Transformation Addiction Doeroyandere Girls Out Of School Students Live In Conceived To SEX Aine [Uncensored L**ked],https://pic.javct.net/poster/05192026/954948270b.jpg,https://javct.net/v/onet-012-rm,130,2026-06-23
APKH-196-RM,"Please Film Me Having Sex... ""If You Lick My Balls, Lots Of Sperm Will Come Out!"" Lewd Service Sex From A Naturally Perverted Reiwa Girl, Voluptuous Angel Hanamori Natsuho [Uncensored L**ked]",https://pic.javct.net/poster/05192026/f1f5a40bcb.jpg,https://javct.net/v/apkh-196-rm,154,2026-06-23
MADV-634-RM,[4K] Yamashita Saiko who was fo**ed to wear a swimsuit in violation of school rules by a school girl who is serious and has white skin and beautiful breasts... Saiko repeatedly had sex with Saiko and Creampie again and again [Uncensored L**ked],https://pic.javct.net/poster/05192026/a9494cfde1.jpg,https://javct.net/v/madv-634-rm,127,2026-06-23
DORI-004,"Paco Shooting No.04 ""That's The Ultimate Choice ..."" Raw SEX Inexperienced J ● Accepted Raw Chin Insertion In Exchange For Daily Money Up And Was Vaginal Cum Shot!",https://pic.javct.net/poster/05192026/67aa20e5c6.jpg,https://javct.net/v/dori-004,85,2026-06-23
