code,title,image_url,page_url,views,date_scraped
PKPD-126-RM,Enjo Dating Creampie OK 18 Years Old Minimum Demon Wet Ro ● Famous Instrument Girl Mona Amemiya [Uncensored L**ked],https://pic.javct.net/poster/04112026/1777001413.jpg,https://javct.net/v/pkpd-126-rm,128,2026-06-15
FLAV-327-RM,Perverted Big Ass School Girls Are Our Sexual Desire Processing Meat Urinals Bewitching Bimbo Gals School Girls Are Perverted Semen Monsters Who Do A Medical Examination While Drinking Semen While All Drops Of Uncle's Thick Sperm Are Tastes In The Mouth [Uncensored L**ked],https://pic.javct.net/poster/20230206/1688188486.jpg,https://javct.net/v/flav-327-rm,160,2026-06-15
GAJK-012-RM,A Trap Aimed At The Athletic Club Girls Who Came To The District Tournament. A Few Days Of Hell Being Threatened And R**ed By A Perverted Teacher Shizuku Hanai [Uncensored L**ked],https://pic.javct.net/poster/20230206/1686371942.jpg,https://javct.net/v/gajk-012-rm,135,2026-06-15
MUDR-381-RM,"Sexually Charged, Overly Erotic Schoolgirl In Uniform Devours A Man In A Passionate, Sweaty Sex Session. [Uncensored L**ked]",https://pic.javct.net/poster/05192026/04239d8fc0.jpg,https://javct.net/v/mudr-381-rm,190,2026-06-15
SDAB-145-RM,PtoM Gakuen Shiraki Lisa Who Blows Ji Po Who Defeated Saddle At The Woman On Top Posture And Immediately Repeats Insertion [Uncensored L**ked],https://pic.javct.net/poster/05192026/6e48e8f49a.jpg,https://javct.net/v/sdab-145-rm,135,2026-06-15
ROYD-230-SUB,Is It Okay To Pay Rent With Pussy?! A Sudden Erotic Cohabitation With A Defenseless Runaway Girl!? A Slutty Girl In A Uniform Who Will Milk You With Her Sweet Cowgirl Position From Morning Till Night Has Come To Stay With Me. Anzu Koko [English Subtitle],https://pic.javct.net/poster/20250903/1742494108.jpg,https://javct.net/v/royd-230-sub,120,2026-06-15
AP-503-RM,Onsen Ryokan Mother-Daughter Chasing After Aphrodisiac Cum Inside Masturbation [Uncensored L**ked],https://pic.javct.net/poster/05192026/a9700b7146.jpg,https://javct.net/v/ap-503-rm,125,2026-06-15
SDDE-503-RM,"A Man Who Can Stop Time Has Existed!~ New Ability Person, Takuya Takuro Appeared!I Will Stop Fucking Ano Girl!Editing [Uncensored L**ked]",https://pic.javct.net/poster/20230104/1681896908.jpg,https://javct.net/v/sdde-503-rm,120,2026-06-15
DFE-081-RM,My Daughter Is Feeding Me. [Uncensored L**ked],https://pic.javct.net/poster/20243105/1719548811.jpg,https://javct.net/v/dfe-081-rm,134,2026-06-15
PIYO-172-RM,"""If You're Not Playing With Me, Why Don't You Put Me Inside?"" [Uncensored L**ked]",https://pic.javct.net/poster/20230206/1686194146.jpg,https://javct.net/v/piyo-172-rm,170,2026-06-15
SKMJ-407-RM,"Big Penis Sanction! I Made A Salty PA ● Life Super Impertinent Daughter Thoroughly Understand Condom Poi In The Middle Of The Back! No Matter How Many Times I Apologize, I Will Never Forgive The High-speed Intense Piston That Completely Defeats My Legs! I Want To Cry! ! 2 4 Rotten Enkou Girls Licking Adults [Uncensored L**ked]",https://pic.javct.net/poster/20230207/1689324443.jpg,https://javct.net/v/skmj-407-rm,263,2026-06-15
YMDD-126-RM,Our Students Are Too Erotic Angels And Instant Grabs · Licking · Creampie · Pre-ketsu Student Council President Aya Sasami [Uncensored L**ked],https://pic.javct.net/poster/05192026/792de42960.jpg,https://javct.net/v/ymdd-126-rm,160,2026-06-15
SUJI-311-RM,"""He's Underestimating Me, So He's Doomed."" Unconscious Giant Cock Inserted Without Consent, Humiliating Pleasure, Drug-fueled Sex, Falling Into Depravity, Making A Sassy, Cold Girl Understand, Fo**ed Pussy Fucking, Cumming Inside, Apology, Shaved Pussy, Student Kaho Hanamori Natsuho [Uncensored L**ked]",https://pic.javct.net/poster/05192026/c3c600ed7c.jpg,https://javct.net/v/suji-311-rm,115,2026-06-15
DAVK-082-RM,Middle-Aged Men's Thick Cocks Are Expanded And Continuously Inserted Into A Small Crack Of A Little C**ld [Please Forgive Me Again...Ignore My Begging] De Masochistic Saseko Training Training For Orgy Party Only [Uncensored L**ked],https://pic.javct.net/poster/20230206/1686368968.jpg,https://javct.net/v/davk-082-rm,128,2026-06-15
GVH-853-RM,Forbidden Caregiving - Nagisa Tanimura [Uncensored L**ked],https://pic.javct.net/poster/05192026/8e1d861660.jpg,https://javct.net/v/gvh-853-rm,120,2026-06-15
NHDTB-782-RM,You Can't Get Off The Bus Without Having Sex [Uncensored L**ked],https://pic.javct.net/poster/20230206/1687405257.jpg,https://javct.net/v/nhdtb-782-rm,150,2026-06-15
FOCS-083-RM,Full Affirmation Taking Advantage Of Her Kindness Facial NTR Woman Sumire Kuramoto Who Is Smiled By The Sperm Of A Man Who Does Not Know [Uncensored L**ked],https://pic.javct.net/poster/20221108/1662098022.jpg,https://javct.net/v/focs-083-rm,120,2026-06-15
DORI-093-RM,"Paco Shooting No.93 Recently, It's Fun To Have Sex And It's Fun To Have A Big Breasted J ● With A G Cup. [Uncensored L**ked]",https://pic.javct.net/poster/20230206/1686540180.jpg,https://javct.net/v/dori-093-rm,72,2026-06-15
SMA-481-RM,Rui Saotome Panties HighSchool [Uncensored L**ked],https://pic.javct.net/poster/05192026/8ea7531937.jpg,https://javct.net/v/sma-481-rm,120,2026-06-15
URKK-085-RM,The Perverted Landlord Next Door Makes Me Cum With Her Nipples And Fucks Me Every Day Nana Kisaki [Uncensored L**ked],https://pic.javct.net/poster/20230207/1688790423.jpg,https://javct.net/v/urkk-085-rm,133,2026-06-15
SDTH-010-RM,"Sex Is Always Better In The Raw! I Love To Fuck In The Raw! A Curious And Precocious Teenage Gal With An Immature Pussy Koenji ** Shopping District, Suginami City, Tokyo She's A Student At A Part-Time School, In Her 3rd Year, Class C Urara Uzuki (Not Her Real Name, 1* Years Old) *She May Not Look It, But She's A Barely Legal Babe With A Black Belt Who Is Ranked Number 1 In The Country In Karate She's Skipping Class To Make Her Adult Video Debut Continuous Injections Of Semen! [Uncensored L**ked]",https://static.javct.net/poster/1626783730.jpg,https://javct.net/v/sdth-010-rm,137,2026-06-15
SVVRT-081,"Amateur variety show only for female students! Pee around the world! If you can spin 360 degrees while squirting, you win a prize of 100,000 yen! An adult's big cock piston can't stop the continuous ejaculation of an immature pussy whose sensitivity has increased due to continuous ejaculation! !",https://pic.javct.net/poster/05192026/aaa0e0f6bc.jpg,https://javct.net/v/svvrt-081,173,2026-06-15
MUKD-577-RM,"We're Totally Hooked On Feeling Good! One Day's Casual Group Sex With Cumming Inside Akana Ito, Goba, Nijimura Yumi, Futaba Emma [Uncensored L**ked]",https://pic.javct.net/poster/05192026/bc1135ce4c.jpg,https://javct.net/v/mukd-577-rm,170,2026-06-15
SDDE-472-RM,"""Please Help Me!Daily Cock I'm In The Bullied C**ld Every Day, In The Physical Education Warehouse, Is Constrained To Women Students Of Classmates, It Has Been In Sex Slaves!This I Is Not R**e! ?It Is Terrible! "" [Uncensored L**ked]",https://pic.javct.net/poster/05192026/09df0931bc.jpg,https://javct.net/v/sdde-472-rm,100,2026-06-15
