code,title,image_url,page_url,views,date_scraped
DANDY-853-RM,"A Slut And Just The Two Of Us On The Last Train! A Little Devil Girl Who Panchira In The Seat Opposite J ○ Ver ○ When I Was Erect By Raw Temptation, I Was Fucked VOL.5 [Uncensored L**ked]",https://pic.javct.net/poster/20230104/1681974450.jpg,https://javct.net/v/dandy-853-rm,192,2026-06-30
DORI-023,"Paco Shooting No.23 ""I'm Pouring ♪ I'm Getting Excited Right Now"" I Begged Miniman For Vaginal Cum Shot I Made Vaginal Cum Shot Twice In Spite Of The Words Of Petite J ○!",https://pic.javct.net/poster/05192026/df14c5b4a5.jpg,https://javct.net/v/dori-023,73,2026-06-30
SDAB-202-SUB,White Slender Schoolgirl Who Can't Get Interested in Boys of Her Generation - Sakura Ren [English Subtitle],https://pic.javct.net/poster/20212709/1635563120.jpg,https://javct.net/v/sdab-202-sub,135,2026-06-30
APAK-252-RM,Innocent School Beautiful Girl Creampie Climax Hana Hits The Uterus Directly! Demon Iki L**king! Stakeout Riding! Nasty Climax Student Guidance Handicraft Club Kana Kusunoki [Uncensored L**ked],https://pic.javct.net/poster/20230104/1682135717.jpg,https://javct.net/v/apak-252-rm,125,2026-06-30
TUE-135-RM,Girl Blow Video Of My Younger Sister Whose Technique Was Divine When She Became Raw [Uncensored L**ked],https://pic.javct.net/poster/20230104/1680667538.jpg,https://javct.net/v/tue-135-rm,120,2026-06-30
PKPD-142-RM,Fucking School Girls In Black Pantyhose Raw And Cumming On Their Faces Over And Over Rin And Miku [Uncensored L**ked],https://static.javct.net/poster/pkpd-142.jpg,https://javct.net/v/pkpd-142-rm,140,2026-06-30
SDAB-163-RM,Boyish Is Shy. Early SOD Exclusive AV Debut [Uncensored L**ked],https://pic.javct.net/poster/05192026/35a47ea512.jpg,https://javct.net/v/sdab-163-rm,135,2026-06-30
SDAB-164-RM,"Up To 7 Times A Day, It's So Awesome! Smooth Skin Flesh Loved BODY! !! Kanon Shiraishi SOD Exclusive AV Debut [Uncensored L**ked]",https://pic.javct.net/poster/05192026/e95e0d4ae2.jpg,https://javct.net/v/sdab-164-rm,130,2026-06-30
DOPU-002-RM,Pies Were To R**e School Girls [Uncensored L**ked],https://pic.javct.net/poster/05192026/f0198655a6.jpg,https://javct.net/v/dopu-002-rm,90,2026-06-30
GOJI-105,[Brutal R**e Double Pack] A Record Of Despair As An Innocent Schoolgirl Is Brutally Turned Into A Sex Toy By Her Own Father.,https://pic.javct.net/poster/05192026/02046fcba4.jpg,https://javct.net/v/goji-105,247,2026-06-30
FNEO-006,"Sasioff ~ A One-to-one Male And Female Off-party Party 01 When I Meet At A Convenience Store Nearby, The Distance Is Too Short, Body Touch And Persistent Pushing My Chest Hoy Hoi っ っ て My House Fighting With My Parent's Fight Came Home "" Waiting For God ""A Girl Who Misunderstands Girls And"" Dating """,https://pic.javct.net/poster/05192026/024ad0cd15.jpg,https://javct.net/v/fneo-006,240,2026-06-30
FSKI-007,"If I Was Looking At The Big Boy ○ Chin Who Is Crazy About Masturbation In VR, I Would Feel Naughty, I Got A Naughty ... I Got A Real SEX In Boys And School",https://pic.javct.net/poster/05192026/5963eeb9b6.jpg,https://javct.net/v/fski-007,127,2026-06-30
DORI-022,"Paco Shooting No.22 It Looks Like A Crazy Gal Who Uses Honorifics For People Who Meet For The First Time J ○ Repeatedly Saying ""Ah, Yabai"" And Middle-aged, Forgetting Honorifics And Allowing Vaginal Cum Shot!",https://pic.javct.net/poster/05192026/6653026230.jpg,https://javct.net/v/dori-022,99,2026-06-30
T28-553,Drenched Girls ● Raw Bus,https://pic.javct.net/poster/05192026/2f3f4194d4.jpg,https://javct.net/v/t28-553,120,2026-06-30
DOPU-002,Pies Were To R**e School Girls,https://pic.javct.net/poster/05192026/f0198655a6.jpg,https://javct.net/v/dopu-002,90,2026-06-30
PKPD-141-RM,Pulling Out Mid-Ejaculation After Fucking A Sugar Baby Schoolgirl With G-Cup Peach-Like Tits Rimi Momono [Uncensored L**ked],https://static.javct.net/poster/pkpd-141.jpg,https://javct.net/v/pkpd-141-rm,139,2026-06-30
LOCK-012-RM,"LOCK-ON@Moe ""I Only Came For A Job Interview..."" High School Girl Shiramiya Moe Becomes A Sex Toy For The Store Manager, Sexually Harassed And Fo**ed Into Live Sex Under The Guise Of Customer Service Practice. [Uncensored L**ked]",https://pic.javct.net/poster/05192026/b7a84e2a29.jpg,https://javct.net/v/lock-012-rm,115,2026-06-30
APRG-002-RM,"I Called A Delivery Health Girl And Couldn't Resist The Young Essence And Tight Meat Pussy Of The Schoolgirl, So I Continued To Fuck The Masochistic Girl Who Was Drowning In Deep Throat And Climax Until The Morning. Delivery Girl Pet [lustful Stick Part-time Job] Obedient Sex Video Yasaka Nagi [Uncensored L**ked]",https://pic.javct.net/poster/05192026/992de1e736.jpg,https://javct.net/v/aprg-002-rm,148,2026-06-30
JKSR-610-RM,Female Manager Who Handles Sex! Everyone Cums Inside Due To Sexual Desire Running Wild! ! [L**ked Video] Female Student Club Training Camp Sex 15 [Uncensored L**ked],https://pic.javct.net/poster/20231011/1697861394.jpg,https://javct.net/v/jksr-610-rm,180,2026-06-30
HUNTB-526-RM,"""If You Make Me Squid, I'll Study! If You Cum Before Me, I'll Never Study!"" Little Devil Girl ○ Raw Vs Unequaled Private Tutor! A Sex Battle Breaks Out With A Female Student Who Plays With Me [Uncensored L**ked]",https://pic.javct.net/poster/20230104/1682048454.jpg,https://javct.net/v/huntb-526-rm,190,2026-06-30
BABM-017-RM,"Babu Miaru Asuka Mama Praises Me For Just Being Alive, So I'm Pretending To Be A Baby And Have Sex Asuka Momose [Uncensored L**ked]",https://pic.javct.net/poster/20230104/1681530291.jpg,https://javct.net/v/babm-017-rm,121,2026-06-30
MILK-176-RM,"**Creampie R**e Targeted Girls**, Yuka. Yuka Ichii [Uncensored L**ked]",https://pic.javct.net/poster/20230206/1686799039.jpg,https://javct.net/v/milk-176-rm,132,2026-06-30
APAA-405-RM,Awesome! A Lovely Girl Who Looks Good In Uniform Mei Satsuki [Uncensored L**ked],https://pic.javct.net/poster/20230104/1680924169.jpg,https://javct.net/v/apaa-405-rm,143,2026-06-30
JKSR-625-RM,Competitive Swimsuit J〇! ! Everyone Cums Inside The Erotic Body! ! [L**ked Video] Women's Club Training Camp Sex 17 [Uncensored L**ked],https://pic.javct.net/poster/20241902/1708707335.jpg,https://javct.net/v/jksr-625-rm,188,2026-06-30
