code,title,image_url,page_url,views,date_scraped
JRBA-008-RM,Obedient Ma Co Is Cuckold In Front Of The Grandfather Who Dedicated His Virginity At The Grandfather's Compliant ATM. Miku Arima [Uncensored L**ked],https://pic.javct.net/poster/20230205/1684556153.jpg,https://javct.net/v/jrba-008-rm,160,2026-06-21
JUBE-004-RM,"After School Secrets A Pure Girl Who Has Recently Started Working As A Dad Is Turned Into A Neat And Clean Bitch With Money, Alcohol And Power. [Uncensored L**ked]",https://pic.javct.net/poster/20230205/1684559913.jpg,https://javct.net/v/jube-004-rm,153,2026-06-21
BABM-018-RM,"Mama's Repayment For Me, Who Broke Both Hands While Protecting Me From An Accident, Bab Miaru Manatsu-chan Became My Mom! Manatsu Misaki [Uncensored L**ked]",https://pic.javct.net/poster/20230205/1683346368.jpg,https://javct.net/v/babm-018-rm,111,2026-06-21
AKDL-055-RM,J-style toilet [Uncensored L**ked],https://pic.javct.net/poster/04112026/509fe6a84a.jpg,https://javct.net/v/akdl-055-rm,58,2026-06-21
HUNTB-550-RM,"""I'll Teach You Naughty Things"" → ""No More! Don't Move! It's Going To Break!"" My C**ldhood Friend, Who Always Looks Down On Me, Screams At My Uncontrollable Unfaithful Cock! [Uncensored L**ked]",https://pic.javct.net/poster/20230205/1683263409.jpg,https://javct.net/v/huntb-550-rm,170,2026-06-21
MFT-005-RM,"When I Heard That The Biological Research Department Was Recruiting Sperm For An Experiment, I Was Hired Immediately And Was Overtaken By A Cute Science Female Member! ""Can You Put Out A Little More?"" [Uncensored L**ked]",https://pic.javct.net/poster/20230206/1687405380.jpg,https://javct.net/v/mft-005-rm,179,2026-06-21
HUNTC-619-RM,"Our School Has A ""Special Sex Education Department"" Where Both Boys And Girls With Strong Libidos Are Considered Top Students! This Is A Department Dedicated To Training Exceptionally Sexual Students. Every Day, Students Learn About And Experience Sex. Here, What Is Valued Is Not Suppressing Desires, But Understanding Them Correctly. [Uncensored L**ked]",https://pic.javct.net/poster/05192026/51b3c74b7e.jpg,https://javct.net/v/huntc-619-rm,130,2026-06-21
KHIP-010-RM,"My Niece J Series Who Came To My House Due To Bad Behavior I Couldn't Resist The Peachy Ass Peeking From My Miniskirt, And When I Attacked, She Unexpectedly Honestly Fucked Me And Ever Since Then, I've Been Cumming Every Day! Maika Hiizumi [Uncensored L**ked]",https://pic.javct.net/poster/20230205/1683345569.jpg,https://javct.net/v/khip-010-rm,131,2026-06-21
HUNTC-507-RM,"Public execution of masturbation by a girl classmate with glasses who looks like a virgin and who wants to pretend to be an erotic manga! When I entered a preparatory school that was an all-girls school until last year, it was almost an all-girls school with a male to female ratio of 1:9! Girls are strong! I am at the mercy of girls! ! Even though I was definitely a gangster girl in middle school... [Uncensored L**ked]",https://pic.javct.net/poster/05192026/0f22700a31.jpg,https://javct.net/v/huntc-507-rm,242,2026-06-21
SDAB-154-RM,"Youthful Getaway - Fair-Skinned Beautiful Girl Spends A Summer Day Slaking Her Lust: Cum Swallowing/Fucking In The Open Air/As Hard As She Can, Seeking Pleasure With Her Whole Body Chika Sato [Uncensored L**ked]",https://pic.javct.net/poster/20221202/1645487322.jpg,https://javct.net/v/sdab-154-rm,140,2026-06-21
YAG-129,¥ Exchange JK Outdoor Exposure OK 3P Horny Back Byte Cream Pies Harajuku System Reademo Yumeka (Tentative),https://pic.javct.net/poster/05192026/2c3a226de0.jpg,https://javct.net/v/yag-129,125,2026-06-21
HUNTA-558-RM,"Knockout Completely On My Sister's Protruding Butt! !Erection Chi Po Pierces Melimely Through The Pants! ""You Were Such A Cute Little Ass? ! ""Even Now I Am A Good Friend From A Young Age ○ Even Now My Sister I Love Is A Super Beauty Butt! !My Younger Sister Who Had Never Consciously Ever Watched It Unexpectedly ... [Uncensored L**ked]",https://pic.javct.net/poster/20231912/1705251018.jpg,https://javct.net/v/hunta-558-rm,240,2026-06-21
ROYD-325-RM,"""Heatstroke?"" Thanks To The Busty Manager's Unaware Nursing, Instead Of Recovering From Summer Fatigue, He Gets Rock Hard And Has Sex!? The Day Before The Competition, He's Lost In Her Kind, Soft, And Voluptuous Body. [Uncensored L**ked]",https://pic.javct.net/poster/05192026/ac0aea3831.jpg,https://javct.net/v/royd-325-rm,140,2026-06-21
HUNTC-533-RM,"From this year, the third Sunday in June has become an annual ""Brother's Day""! My brother's word is absolute! On this day, no matter what kind of big brother you want to fuck with your sister! It doesn't matter if you're in front of your parents! Even if you are a sister who usually fights with each other, you have to listen to everything you say with gratitude on this day! [Uncensored L**ked]",https://pic.javct.net/poster/05192026/7cce1c8b93.jpg,https://javct.net/v/huntc-533-rm,168,2026-06-21
HUBLK-070-RM,"I Was To**ured And R**ed Endlessly Until The Beautiful Sunrise. I Was Mercilessly Ab**ed By Strangers, My Throat And Pussy Being Brutally Violated. [Uncensored L**ked]",https://pic.javct.net/poster/05192026/e4b3ab299c.jpg,https://javct.net/v/hublk-070-rm,120,2026-06-21
HUNBL-017-RM,Strangling After School Mass Incontinence In Irama [Uncensored L**ked],https://pic.javct.net/poster/05192026/ebe9961dce.jpg,https://javct.net/v/hunbl-017-rm,140,2026-06-21
HUBLK-073-RM,Group Time Stop R**e 2 [Uncensored L**ked],https://pic.javct.net/poster/05192026/b2f80529b6.jpg,https://javct.net/v/hublk-073-rm,140,2026-06-21
XVSR-247-RM,Back / Tsubomi Undisclosed SEX Attachment Collection Image [Uncensored L**ked],https://pic.javct.net/poster/04112026/1776749791.jpg,https://javct.net/v/xvsr-247-rm,240,2026-06-21
AKDL-054-RM,"[Forbidden ◆Hidd** camera◆] ""No! No! Not here ◆"" Prefectural regular school J-type flirt kissing/fellatio video *Ayase looks like a ●, nipples with erogenous zone G cup, bruises and cute, ponytail girl on a date on the way to school, etc. [Uncensored L**ked]",https://pic.javct.net/poster/04112026/05ae699bd3.jpg,https://javct.net/v/akdl-054-rm,133,2026-06-21
T28-427-RM,Memories 2 To That Signed Turbulent In Promiscuity - After School In The Classroom Out In The School Girls School [Uncensored L**ked],https://pic.javct.net/poster/04112026/1776312270.jpg,https://javct.net/v/t28-427-rm,170,2026-06-21
NHDTB-768-RM,Remote Lesbian Slut Older Neat And Clean Woman Remotely Manipulated By A Plain Girl At The Library [Uncensored L**ked],https://pic.javct.net/poster/20230205/1683775130.jpg,https://javct.net/v/nhdtb-768-rm,195,2026-06-21
LULU-212-RM,A Neat And Clean Slope System Fair-Skinned Deca-ass Niece J-type Little Devil Miniskirt Panchira Grasp The Weakness That Was Erecting Relatives And Make It A Good M! I Was Played With My Uncle's Big Cock Many Times With Vaginal Cum Shot And Shaved Vaginal Squeeze. Akari Minase [Uncensored L**ked],https://pic.javct.net/poster/20230104/1682741617.jpg,https://javct.net/v/lulu-212-rm,160,2026-06-21
SW-581-RM,"Every Morning I See A Knee High Thigh V Vantage Women's ○ ○ If Life Is Cute And You Got A Hard Pace, ""Okayo No Skave.""An Angry Face With Inflating A Cheek.But It Was A Tiny Faw Small Devil Who Gazes At Me With The Eyes That Urulled Soon.4 Ami Asami [Uncensored L**ked]",https://pic.javct.net/poster/05192026/6b99ecd3a8.jpg,https://javct.net/v/sw-581-rm,170,2026-06-21
HUNTB-549-RM,"The Appearance Of The Daughter-in-law Who Thought She Was A C**ld Was Unexpectedly Erotic And Erected! One Day, I Ended Up Living With My Daughter-in-law, Who Loves Me Very Much. [Uncensored L**ked]",https://pic.javct.net/poster/20230205/1683263470.jpg,https://javct.net/v/huntb-549-rm,190,2026-06-21
