code,title,image_url,page_url,views,date_scraped
NIMA-082-RM,Live-action Version Of My Only Yuki-nee - Himari Kinoshita [Uncensored L**ked],https://pic.javct.net/poster/05192026/ce2c968493.jpg,https://javct.net/v/nima-082-rm,110,2026-07-05
NPJS-260-RM,"Sneaking Into The Pool Late At Night, A Youthful, Secretly Soaking Wet, Passionate, And Intensely Intimate J●SEX [Uncensored L**ked]",https://pic.javct.net/poster/05192026/c67ef0dc6f.jpg,https://javct.net/v/npjs-260-rm,90,2026-07-05
XV-940-RM,Nana Ogura Bus Molester In Our Uniform [Uncensored L**ked],https://pic.javct.net/poster/20230302/1679476832.jpg,https://javct.net/v/xv-940-rm,120,2026-07-05
FSKI-013,"The House Opposite Is A Girls' Dormitory!A Female Student Who Didn't Realize That She Was Peeping Into A Man In The House Across The Street From Changing Clothes And Embarrassing Life One Day, Her Eyes Met ...",https://pic.javct.net/poster/07052026/924e91f51d.jpg,https://javct.net/v/fski-013,128,2026-07-05
DORI-028,"Paco Shooting No.28 Stir The Baby-faced J ● Tsuruman Who Begged ""Can't You Put It In Yet?"" With Raw Chin And Vaginal Cum Shot! It's Not Enough Yet And It's Shot In The Mouth As It Is From The Cleaning Fellatio!",https://pic.javct.net/poster/07052026/596f82b89d.jpg,https://javct.net/v/dori-028,69,2026-07-05
BANK-115-RM,A Prank Hot Spring Trip With An Obedient Beautiful Girl's Daughter-in-law [Uncensored L**ked],https://pic.javct.net/poster/20230302/1679642844.jpg,https://javct.net/v/bank-115-rm,150,2026-07-05
DORI-084-RM,"Paco Shooting No.84 I Retired From Club Activities And My Sexual Desire Became Dangerous And I Begged ""I Want You To Make Me Namanaka"". When I Said That, I Said, ""Good "", So I Cummed In A Row! [Uncensored L**ked]",https://pic.javct.net/poster/20230302/1678591763.jpg,https://javct.net/v/dori-084-rm,71,2026-07-05
GAJK-009-RM,A School Girl Who Gets Bondage Training In A Storehouse. Rope Training And Humiliating Punishment Mari Kagami [Uncensored L**ked],https://pic.javct.net/poster/20230302/1678507287.jpg,https://javct.net/v/gajk-009-rm,120,2026-07-05
FUNK-013-RM,A Serious And Irresistible Female Impersonator Is Merciless To The Members Of The Chest Fucking Club. [Uncensored L**ked],https://pic.javct.net/poster/20230302/1679110605.jpg,https://javct.net/v/funk-013-rm,185,2026-07-05
DVEH-002-RM,"Developed A Big Penis For A Boyish, Brown, Undeveloped Girl Who Is Too Young To Have Sex With An Overly Sensitive Lewd Body NATSUKA [Uncensored L**ked]",https://pic.javct.net/poster/20230302/1680238313.jpg,https://javct.net/v/dveh-002-rm,160,2026-07-05
DVEH-091-RM,"Plain-looking Pussy. I Approached An Unpopular Girl Who Was Engrossed In Her Otaku Activities In The Corner Of The Classroom, Only To Find Out She Was A True Slut Who Loved Cocks. I Was Treated Like A Shared Flesh Dildo And They Fucked Me Until My Balls Were Empty. Minazuki Hikaru, Arisu Mai [Uncensored L**ked]",https://pic.javct.net/poster/05192026/267fccb3ab.jpg,https://javct.net/v/dveh-091-rm,165,2026-07-05
FJIN-153-RM,"Plump, Voluptuous J-pop Idols Interrupt My Exam Studies With Panty Flashes And Reverse Molestation!! They Swarm Around My Instantly Erect Dick, Cumming Uncontrollably And Making Me Soaking Wet - Warning! Kosaka Himari, Futaba Ayuka [Uncensored L**ked]",https://pic.javct.net/poster/05192026/57e40dafd5.jpg,https://javct.net/v/fjin-153-rm,125,2026-07-05
GEBB-052-RM,"I Found Some High-achieving, J-type Girls Taking Selfies And Exposing Themselves After School, So I Took Photos Of All Four Of Them. [Uncensored L**ked]",https://pic.javct.net/poster/05192026/ffefa0e1ac.jpg,https://javct.net/v/gebb-052-rm,135,2026-07-05
SORA-641-RM,"Drug-addicted, Busty, Precocious J-pop Idol Student **dnapped And Subjected To Brutal Slaps And Excessive Orgasms With Eyes Rolling Back! Ruka Itoi [Uncensored L**ked]",https://pic.javct.net/poster/05192026/0ad4b982de.jpg,https://javct.net/v/sora-641-rm,130,2026-07-05
PIYO-237,8th Anniversary Of Chick. An Old Man Who Massages And Impregnates Girls With Real Sperm Without Them Noticing. The 2nd,https://pic.javct.net/poster/07052026/b576068b5b.jpg,https://javct.net/v/piyo-237,200,2026-07-05
FSKI-012,"Even If You Are Surprised And Confused By Stopping The Cute Girl's School Student With A Big Dick Of 18 Centimeters Of Electric Ma And Ticks Or Inserting It Without Saying Whether Or Not It Is A Maiden Who Gently Accepts "" If Over Wrap ... '' All You Want To Do With Your Words! Part 2",https://pic.javct.net/poster/07052026/3248e58bdf.jpg,https://javct.net/v/fski-012,240,2026-07-05
MIDA-684-RM,"The Always-lonely, Plain Literary Girl Is Our Convenient Semen Shower Masturbation Pet, Kira Hoshi. [Uncensored L**ked]",https://pic.javct.net/poster/05192026/e995cc3d2c.jpg,https://javct.net/v/mida-684-rm,120,2026-07-05
FSKT-014,Immature Mind And Body Girl Relief,https://pic.javct.net/poster/07052026/e1c2aafedb.jpg,https://javct.net/v/fskt-014,132,2026-07-05
GM-032,Black B**od Of 28cm To Virgin ● Po Lacrosse Athletes School Girls Mayu Yuki (Nakata) Shin Gomez,https://pic.javct.net/poster/07052026/25cfcd0aeb.jpg,https://javct.net/v/gm-032,100,2026-07-05
DORI-027,"Paco Shooting No.27 When I Rubbed Chestnuts With Raw Chin, I Made A Vaginal Cum Shot Twice To J ● Who Begged ""Put It In ... Put It In ...""!",https://pic.javct.net/poster/07052026/fa3cc3ce96.jpg,https://javct.net/v/dori-027,84,2026-07-05
FNEO-012,"I Told My Father, ""Go Here.""Two",https://pic.javct.net/poster/07052026/d626411049.jpg,https://javct.net/v/fneo-012,144,2026-07-05
UPSM-031-RM,Do Not Jam In The Transferee Rare Compensated Dating [Uncensored L**ked],https://pic.javct.net/poster/05192026/0cd6fc90be.jpg,https://javct.net/v/upsm-031-rm,150,2026-07-05
BANK-114-RM,W Provocative Beautiful Girl Beautiful Girls Who Tease Men With A Smile [Uncensored L**ked],https://pic.javct.net/poster/20230302/1679642907.jpg,https://javct.net/v/bank-114-rm,165,2026-07-05
DVEH-001-RM,Our Manager Who Accepts Everything With A Cute Smile And A Dick In Good Times And Bad! She Let Me Bukkake For The Score Of The Final Game! Hinata Yura [Uncensored L**ked],https://pic.javct.net/poster/20230302/1680238343.jpg,https://javct.net/v/dveh-001-rm,145,2026-07-05
