code,title,image_url,page_url,views,date_scraped
DORI-024,Paco Shooting No.24 Athlete's Tall Glamor Inverted Nipple Big Tits J ○ Refuses To Insert Raw Chin But Feels Better And Finally Allowed Vaginal Cum Shot!,https://pic.javct.net/poster/05192026/b8c3fbdd10.jpg,https://javct.net/v/dori-024,83,2026-07-01
FNEO-009,"I Will Lend You A ""Gutsukuru Girls School Student"" Seen In Town.Vol.2",https://pic.javct.net/poster/05192026/6612fe5a91.jpg,https://javct.net/v/fneo-009,140,2026-07-01
LULU-244-RM,"My Girlfriend's Younger Sister, A Kansai Female Brat With Big Breasts, Who Always Makes Fun Of Me, Was Given Thorough Nipple Training To Make Her Sensitive To Premature Ejaculation, And I Turned Her Into A Nipple Creampie Masturbator. Arai Lima [Uncensored L**ked]",https://pic.javct.net/poster/20230908/1695965462.jpg,https://javct.net/v/lulu-244-rm,160,2026-07-01
JUKF-096-RM,A Rumored Schoolgirl Underground Idol An Uncle's Fan And A Private Business Earning Pocket Money Nonoka-chan Sato Nonoka [Uncensored L**ked],https://pic.javct.net/poster/20230302/1679716952.jpg,https://javct.net/v/jukf-096-rm,143,2026-07-01
MFT-004-RM,"""Please Move Quietly, Please?"" Bruises And Cute Club Juniors Come To Me During Break Time And Club Activities And Adhere To Doting! Pretend To Flirt And Secretly Fuck Your Dick In Your Skirt. I Can't Let The People Around Me Find Out, And I Can't Even Make A Strange Voice At The Rushing Pleasure. [Uncensored L**ked]",https://pic.javct.net/poster/20230205/1684985460.jpg,https://javct.net/v/mft-004-rm,186,2026-07-01
MTALL-095-RM,"Sister, Can You Teach Me How To Take Off My Bra? Shirahananon [Uncensored L**ked]",https://pic.javct.net/poster/20231711/1701281932.jpg,https://javct.net/v/mtall-095-rm,145,2026-07-01
STARS-608-RM,A Cheeky Little Devil Schoolgirl At A Tavern Part-time Job Who Seduces Me With A Dirty Dirty Word I Just Learned Mei Miyajima-Ejaculation Over And Over Again Even If The Sperm Is Empty I Was Bitten [Uncensored L**ked],https://pic.javct.net/poster/20220406/1655797851.jpg,https://javct.net/v/stars-608-rm,135,2026-07-01
DANDY-832-RM,"When I Showed A Full Erection From The Front To J  Sitting In Front Of A Crowded Train, I Was Shy But Curious! Even Though There Was A Passenger, He Held My Cock [Uncensored L**ked]",https://pic.javct.net/poster/20222109/1666239437.jpg,https://javct.net/v/dandy-832-rm,155,2026-07-01
BBAN-401-RM,Best Friend Assault Lesbian Who Devours Her Body Covered With Saliva My Best Friend I Believed Was An Underwear Thief Targeting Me Kana Hoshimiya Also Known As Yura [Uncensored L**ked],https://pic.javct.net/poster/20233001/1675999508.jpg,https://javct.net/v/bban-401-rm,150,2026-07-01
FSKI-008,Record Of 10 Shrine Maidens Who Were Treated As Evil Vice Treatment Aiming At Innocent School Girls And Filled With Their Evil Desires To Fulfill Their Own Sexual Desires,https://pic.javct.net/poster/05192026/bf6ec8ac66.jpg,https://javct.net/v/fski-008,240,2026-07-01
DANDY-853-RM,"A Slut And Just The Two Of Us On The Last Train! A Little Devil Girl Who Panchira In The Seat Opposite J ○ Ver ○ When I Was Erect By Raw Temptation, I Was Fucked VOL.5 [Uncensored L**ked]",https://pic.javct.net/poster/20230104/1681974450.jpg,https://javct.net/v/dandy-853-rm,192,2026-07-01
DORI-023,"Paco Shooting No.23 ""I'm Pouring ♪ I'm Getting Excited Right Now"" I Begged Miniman For Vaginal Cum Shot I Made Vaginal Cum Shot Twice In Spite Of The Words Of Petite J ○!",https://pic.javct.net/poster/05192026/df14c5b4a5.jpg,https://javct.net/v/dori-023,73,2026-07-01
SDAB-202-SUB,White Slender Schoolgirl Who Can't Get Interested in Boys of Her Generation - Sakura Ren [English Subtitle],https://pic.javct.net/poster/20212709/1635563120.jpg,https://javct.net/v/sdab-202-sub,135,2026-07-01
APAK-252-RM,Innocent School Beautiful Girl Creampie Climax Hana Hits The Uterus Directly! Demon Iki L**king! Stakeout Riding! Nasty Climax Student Guidance Handicraft Club Kana Kusunoki [Uncensored L**ked],https://pic.javct.net/poster/20230104/1682135717.jpg,https://javct.net/v/apak-252-rm,125,2026-07-01
TUE-135-RM,Girl Blow Video Of My Younger Sister Whose Technique Was Divine When She Became Raw [Uncensored L**ked],https://pic.javct.net/poster/20230104/1680667538.jpg,https://javct.net/v/tue-135-rm,120,2026-07-01
PKPD-142-RM,Fucking School Girls In Black Pantyhose Raw And Cumming On Their Faces Over And Over Rin And Miku [Uncensored L**ked],https://static.javct.net/poster/pkpd-142.jpg,https://javct.net/v/pkpd-142-rm,140,2026-07-01
SDAB-163-RM,Boyish Is Shy. Early SOD Exclusive AV Debut [Uncensored L**ked],https://pic.javct.net/poster/05192026/35a47ea512.jpg,https://javct.net/v/sdab-163-rm,135,2026-07-01
SDAB-164-RM,"Up To 7 Times A Day, It's So Awesome! Smooth Skin Flesh Loved BODY! !! Kanon Shiraishi SOD Exclusive AV Debut [Uncensored L**ked]",https://pic.javct.net/poster/05192026/e95e0d4ae2.jpg,https://javct.net/v/sdab-164-rm,130,2026-07-01
DOPU-002-RM,Pies Were To R**e School Girls [Uncensored L**ked],https://pic.javct.net/poster/05192026/f0198655a6.jpg,https://javct.net/v/dopu-002-rm,90,2026-07-01
GOJI-105,[Brutal R**e Double Pack] A Record Of Despair As An Innocent Schoolgirl Is Brutally Turned Into A Sex Toy By Her Own Father.,https://pic.javct.net/poster/05192026/02046fcba4.jpg,https://javct.net/v/goji-105,247,2026-07-01
FNEO-006,"Sasioff ~ A One-to-one Male And Female Off-party Party 01 When I Meet At A Convenience Store Nearby, The Distance Is Too Short, Body Touch And Persistent Pushing My Chest Hoy Hoi っ っ て My House Fighting With My Parent's Fight Came Home "" Waiting For God ""A Girl Who Misunderstands Girls And"" Dating """,https://pic.javct.net/poster/05192026/024ad0cd15.jpg,https://javct.net/v/fneo-006,240,2026-07-01
FSKI-007,"If I Was Looking At The Big Boy ○ Chin Who Is Crazy About Masturbation In VR, I Would Feel Naughty, I Got A Naughty ... I Got A Real SEX In Boys And School",https://pic.javct.net/poster/05192026/5963eeb9b6.jpg,https://javct.net/v/fski-007,127,2026-07-01
DORI-022,"Paco Shooting No.22 It Looks Like A Crazy Gal Who Uses Honorifics For People Who Meet For The First Time J ○ Repeatedly Saying ""Ah, Yabai"" And Middle-aged, Forgetting Honorifics And Allowing Vaginal Cum Shot!",https://pic.javct.net/poster/05192026/6653026230.jpg,https://javct.net/v/dori-022,99,2026-07-01
T28-553,Drenched Girls ● Raw Bus,https://pic.javct.net/poster/05192026/2f3f4194d4.jpg,https://javct.net/v/t28-553,120,2026-07-01
