code,title,image_url,page_url,views,date_scraped
FSKI-014,I Was Surprised By The Fact That I Was Sucking A Big Big Breast Of A Cute Amateur School Girl From The Beginning And Sucking Out A Sudden Big Cock Rubber And I Would Like To Become A Prisoner Of Big Cock By Saying Squid Without Stopping Or Squeezing It Or Not Record Of 10 School Girls Part 3,https://pic.javct.net/poster/07052026/9f1821ab6a.jpg,https://javct.net/v/fski-014,240,2026-07-06
HDRT-004,The black pantyhose of a female student is too tight.,https://pic.javct.net/poster/07052026/dff630a470.jpg,https://javct.net/v/hdrt-004,182,2026-07-06
DORI-029,"Paco Shooting No.29 Unauthorized Vaginal Cum Shot To A Simple J ● Shaved Raw Man Who Reminds Me ""It's No Good? Just Rubbing?"" I Was Angry That ""the Inside Is Useless ..."", So I Shot My Face For The Second Time!",https://pic.javct.net/poster/07052026/b5cd6332ea.jpg,https://javct.net/v/dori-029,94,2026-07-06
SUJI-303,Adolescent Sexuality Leads To Lust. Forbidden Brother And Sister Creampie Incest Shaved Sister Oto Misaki Sound,https://pic.javct.net/poster/07052026/50d61af558.jpg,https://javct.net/v/suji-303,95,2026-07-06
XVSR-277-RM,"To My Daughter Who Loved Me, I Brought A Crowd Cum On Misa Osawa 4 Hours [Uncensored L**ked]",https://pic.javct.net/poster/04112026/8deb37f686.jpg,https://javct.net/v/xvsr-277-rm,240,2026-07-06
FLAV-320-RM,The Rumored Idol Schoolgirl Is A Little Devil Slut Who Tempts Uncles With A Big Ass With A Perverted Nipple Bing Noka Sato [Uncensored L**ked],https://pic.javct.net/poster/20230302/1680321138.jpg,https://javct.net/v/flav-320-rm,150,2026-07-06
ROYD-038,5 Days Of Sex Practice With Repeated Raw Squirrels For The First Delicate Ubu C**ldhood Friend Mahiro Ichiki,https://pic.javct.net/poster/07052026/a1fa81eaaa.jpg,https://javct.net/v/royd-038,150,2026-07-06
DANDY-846-RM,"An Unexpected Encounter With A W Slut On The Last Train! When I Was Tempted By The Temptation Of A Beautiful Legged Woman In The Seat Opposite, I Was Fucked Many Times In A Sandwich VOL.2 [Uncensored L**ked]",https://pic.javct.net/poster/20233001/1675566737.jpg,https://javct.net/v/dandy-846-rm,207,2026-07-06
HUNTB-503-RM,"Brother, Give Me A Piggyback! I'll Make You Feel Good! A Mini Slut Cousin Who Seduces Me With A Piggyback! Reunited With My Cousin For The First Time In Several Years! Same As Before... [Uncensored L**ked]",https://pic.javct.net/poster/20230302/1679629035.jpg,https://javct.net/v/huntb-503-rm,160,2026-07-06
SDAB-173-RM,"The First And Best Violation Of School Rules ""First Time Out At School"" It's The Best To Be Erotic With White Whip Whip! !! Kanon Shiraishi [Uncensored L**ked]",https://pic.javct.net/poster/07052026/e8ec0f99d7.jpg,https://javct.net/v/sdab-173-rm,135,2026-07-06
PKPD-150-RM,"Sugar Baby: Age 18, Creampie OK - Half-In, Half Out Of Fishnet Pantyhose Shion Natsume [Uncensored L**ked]",https://static.javct.net/poster/pkpd-150.jpg,https://javct.net/v/pkpd-150-rm,126,2026-07-06
MIMU-010-RM,"Sex is tempted to completely grown-up if you have a tutor, the ""cousin""! Moreover, out and aware of me in reverse if you wanted to get angry or would be seen in the sisters that sex ... [Uncensored L**ked]",https://pic.javct.net/poster/20241902/1709679955.jpg,https://javct.net/v/mimu-010-rm,200,2026-07-06
PIYO-237-RM,8th Anniversary Of Chick. An Old Man Who Massages And Impregnates Girls With Real Sperm Without Them Noticing. The 2nd [Uncensored L**ked],https://pic.javct.net/poster/07052026/b576068b5b.jpg,https://javct.net/v/piyo-237-rm,200,2026-07-06
MKON-142-RM,Sugar Daddy Time Leap! After 1000 Reloads To Seduce A Cold-Hearted J-Type Girl... Yura Kana [Uncensored L**ked],https://pic.javct.net/poster/05192026/a03eda294f.jpg,https://javct.net/v/mkon-142-rm,130,2026-07-06
FNEO-013,Sasioff 02,https://pic.javct.net/poster/07052026/47a7c6c135.jpg,https://javct.net/v/fneo-013,240,2026-07-06
MURIKURI-012,A Beautiful High School Girl Is Fo**ed To Ride A Bus Where She Is Covered In Semen And Goes Home In Shame.,https://pic.javct.net/poster/07052026/2e0fa7e720.jpg,https://javct.net/v/murikuri-012,156,2026-07-06
NIMA-082-RM,Live-action Version Of My Only Yuki-nee - Himari Kinoshita [Uncensored L**ked],https://pic.javct.net/poster/05192026/ce2c968493.jpg,https://javct.net/v/nima-082-rm,110,2026-07-06
NPJS-260-RM,"Sneaking Into The Pool Late At Night, A Youthful, Secretly Soaking Wet, Passionate, And Intensely Intimate J●SEX [Uncensored L**ked]",https://pic.javct.net/poster/05192026/c67ef0dc6f.jpg,https://javct.net/v/npjs-260-rm,90,2026-07-06
XV-940-RM,Nana Ogura Bus Molester In Our Uniform [Uncensored L**ked],https://pic.javct.net/poster/20230302/1679476832.jpg,https://javct.net/v/xv-940-rm,120,2026-07-06
FSKI-013,"The House Opposite Is A Girls' Dormitory!A Female Student Who Didn't Realize That She Was Peeping Into A Man In The House Across The Street From Changing Clothes And Embarrassing Life One Day, Her Eyes Met ...",https://pic.javct.net/poster/07052026/924e91f51d.jpg,https://javct.net/v/fski-013,128,2026-07-06
DORI-028,"Paco Shooting No.28 Stir The Baby-faced J ● Tsuruman Who Begged ""Can't You Put It In Yet?"" With Raw Chin And Vaginal Cum Shot! It's Not Enough Yet And It's Shot In The Mouth As It Is From The Cleaning Fellatio!",https://pic.javct.net/poster/07052026/596f82b89d.jpg,https://javct.net/v/dori-028,69,2026-07-06
BANK-115-RM,A Prank Hot Spring Trip With An Obedient Beautiful Girl's Daughter-in-law [Uncensored L**ked],https://pic.javct.net/poster/20230302/1679642844.jpg,https://javct.net/v/bank-115-rm,150,2026-07-06
DORI-084-RM,"Paco Shooting No.84 I Retired From Club Activities And My Sexual Desire Became Dangerous And I Begged ""I Want You To Make Me Namanaka"". When I Said That, I Said, ""Good "", So I Cummed In A Row! [Uncensored L**ked]",https://pic.javct.net/poster/20230302/1678591763.jpg,https://javct.net/v/dori-084-rm,71,2026-07-06
GAJK-009-RM,A School Girl Who Gets Bondage Training In A Storehouse. Rope Training And Humiliating Punishment Mari Kagami [Uncensored L**ked],https://pic.javct.net/poster/20230302/1678507287.jpg,https://javct.net/v/gajk-009-rm,120,2026-07-06
