code,title,image_url,page_url,views,date_scraped
DFE-074-RM,My Daughter Eats It. Miiro Momosaki [Uncensored L**ked],https://pic.javct.net/poster/20231711/1700800636.jpg,https://javct.net/v/dfe-074-rm,134,2026-06-11
HUNTB-614-RM,"""Let's Continue That Time..."" The Continuation Of That Day's Naughty Show. When I Was Young, I Showed Each Other's Genitals While Playing, And My C**ldhood Friend Came Back As A Transcendent Beautiful Girl. [Uncensored L**ked]",https://pic.javct.net/poster/20230206/1687497218.jpg,https://javct.net/v/huntb-614-rm,200,2026-06-11
T28-411-RM,School Girls Model G Cup 90cm Blonde Busty Paipanro ● Over Data Girl Rory Gartner And Cum Fuck [Uncensored L**ked],https://pic.javct.net/poster/06032026/1775365879.jpg,https://javct.net/v/t28-411-rm,130,2026-06-11
PKPD-117-RM,Enjo Dating Creampie OK 18 Years Old Pure Glasses Chibikko Creampie Daughter Sora Inoue [Uncensored L**ked],https://pic.javct.net/poster/04112026/1776222917.jpg,https://javct.net/v/pkpd-117-rm,120,2026-06-11
FOCS-077-RM,Everything Is My First Experience ... I'm On A Graduation Trip With My Teacher Today. Secret Sexual Intercourse Between A Teacher And A Student Whose Ethics Have Collapsed Nana Kisaki [Uncensored L**ked],https://pic.javct.net/poster/20220707/1657870384.jpg,https://javct.net/v/focs-077-rm,120,2026-06-11
SDAB-140-RM,"Juice, Sweat, Tide And Sperm Burst From Your Fresh, Fresh Body! Doppyun 7 Shots! !! A Naive Girl From The Countryside! Miko Tanaka [Uncensored L**ked]",https://pic.javct.net/poster/05192026/436cb0eb95.jpg,https://javct.net/v/sdab-140-rm,130,2026-06-11
APNS-314-RM,Daughter Training 30 Days Of Hell Until Pregnancy Miu Wakui [Uncensored L**ked],https://pic.javct.net/poster/20230206/1686370195.jpg,https://javct.net/v/apns-314-rm,109,2026-06-11
SDDE-463-RM,Exposure Of Ano Daughter Of Atashi Mono [Uncensored L**ked],https://pic.javct.net/poster/20243105/1717632730.jpg,https://javct.net/v/sdde-463-rm,90,2026-06-11
HUNTC-391,"""They're Not Big Enough To Hold Between My Breasts, But..."" I Reach Ecstasy With A Titjob From My C**ldhood Friend Who's Self-conscious About Her Small Breasts! I Pretend To Be Indifferent To My C**ldhood Friend's Complex About Her Small Breasts, But When I Forcefully Reach Out My Hand And Say, ""Maybe They'll Grow If I Rub Them?"", She Resists At First But Starts To Fidget And Her Body Begins To Feel Pleasure!",https://pic.javct.net/poster/05192026/836f928796.jpg,https://javct.net/v/huntc-391,160,2026-06-11
CRNX-262,[4K] Momo Shiraishi sexually assaults a female student in uniform at home,https://pic.javct.net/poster/05192026/82c2f96e02.jpg,https://javct.net/v/crnx-262,51,2026-06-11
STAR-700-SUB,"Wet Clothing School Girls That Furukawa Iori Dripping Rain, Sweat, Tears ... Soaked In The More Estrus, Seek The Crazy A Pleasure [English Subtitle]",https://pic.javct.net/poster/20230104/1683031833.jpg,https://javct.net/v/star-700-sub,170,2026-06-11
HUNTB-578-RM,"""You Don't Get Excited With A C**ld's Body, Right? W"" The Deca-ass L**i Girl Who Seduces Me Is The Daughter Of My Boss, My Friend's Sister, My Cousin. Mischief [Uncensored L**ked]",https://pic.javct.net/poster/20230206/1686284311.jpg,https://javct.net/v/huntb-578-rm,160,2026-06-11
GZAP-079-RM,Our Exhibitionist Teacher I Witnessed A Strict Female Teacher Indulging In School Exposure... I'm Absolutely No Good At School... But I Can't Stop Taking Embarrassing Selfies [Uncensored L**ked],https://pic.javct.net/poster/20230206/1688028396.jpg,https://javct.net/v/gzap-079-rm,181,2026-06-11
DFE-072-RM,My Daughter Eats It. Erika Ozaki [Uncensored L**ked],https://pic.javct.net/poster/20230908/1695358986.jpg,https://javct.net/v/dfe-072-rm,120,2026-06-11
MASM-013-RM,Asuka Momose Was Squeezed Into Her Weakness By A Cheeky Female Brat Student And Smashed Her Teacher's Pride By Being Cursed [Uncensored L**ked],https://pic.javct.net/poster/20230206/1686976118.jpg,https://javct.net/v/masm-013-rm,120,2026-06-11
TUE-138-RM,Beautiful Girls Who Are Obscene On Trains And Buses [Uncensored L**ked],https://pic.javct.net/poster/20230207/1688527182.jpg,https://javct.net/v/tue-138-rm,120,2026-06-11
SW-903-RM,Lucky Lewd Underwear Girls ○ Raw Oh! Did You See My Pants Just Now? And Sperm Release To Cute God Deployment With Clumsy Cousin! [Uncensored L**ked],https://pic.javct.net/poster/20230207/1688623673.jpg,https://javct.net/v/sw-903-rm,170,2026-06-11
PKPD-115-RM,Enjo Dating Creampie OK 18 Years Old Infinite Libido MAX Creampie Daughter Ryoka Kurumi [Uncensored L**ked],https://pic.javct.net/poster/04112026/1776058000.jpg,https://javct.net/v/pkpd-115-rm,130,2026-06-11
HUNTB-615-RM,"""Not Enough! Don't Hesitate To Think That You're A C**ld And Poke A Lot! ] When I Was Taking A Bath With My Little Sister, I Hug Her With A Fierce Belochu That Puts Adults To Shame ... 2 [Uncensored L**ked]",https://pic.javct.net/poster/20230206/1687491620.jpg,https://javct.net/v/huntb-615-rm,230,2026-06-11
DFE-070-RM,I Have My Daughter Feed Me. Kozue Fujita [Uncensored L**ked],https://pic.javct.net/poster/20230207/1690516715.jpg,https://javct.net/v/dfe-070-rm,118,2026-06-11
HUNTC-391-RM,"""They're Not Big Enough To Hold Between My Breasts, But..."" I Reach Ecstasy With A Titjob From My C**ldhood Friend Who's Self-conscious About Her Small Breasts! I Pretend To Be Indifferent To My C**ldhood Friend's Complex About Her Small Breasts, But When I Forcefully Reach Out My Hand And Say, ""Maybe They'll Grow If I Rub Them?"", She Resists At First But Starts To Fidget And Her Body Begins To Feel Pleasure! [Uncensored L**ked]",https://pic.javct.net/poster/05192026/836f928796.jpg,https://javct.net/v/huntc-391-rm,160,2026-06-11
AVSA-294-RM,The Neat And Serious Mai Senior I Admire Is A Beastly Pervert Teacher Sex Slave Mai Arisu [Uncensored L**ked],https://pic.javct.net/poster/20241901/1707536990.jpg,https://javct.net/v/avsa-294-rm,129,2026-06-11
DFE-071-RM,I Have My Daughter Feed Me. Ran Himeno [Uncensored L**ked],https://pic.javct.net/poster/20230804/1692933552.jpg,https://javct.net/v/dfe-071-rm,137,2026-06-11
PKPD-113-RM,Enjo Dating Creampie OK 18 Years Old Cooled M Beautiful Girl Creampie Daughter Tamaki Nico [Uncensored L**ked],https://pic.javct.net/poster/04112026/1775889578.jpg,https://javct.net/v/pkpd-113-rm,140,2026-06-11
