code,title,image_url,page_url,views,date_scraped
ABF-348-RM,Ultimate Ecstasy: A New Realm Of Pleasure That Courses Through Every Nerve— Remu Suzumori [Uncensored L**ked],https://pic.javct.net/poster/04112026/582624978e.jpg,https://javct.net/v/abf-348-rm,120,2026-06-18
PA-061826-100,"Housewife Pussy Encyclopedia, 179 Deluxe Edition",https://pic.javct.net/poster/05192026/849abd5835.jpg,https://javct.net/v/pa-061826-100,58,2026-06-18
CADV-667-RM,Daughter Girl Metamorphosis Poisoning 8 Hours! ! [Uncensored L**ked],https://pic.javct.net/poster/04112026/f495c6f959.jpg,https://javct.net/v/cadv-667-rm,480,2026-06-18
T28-423-RM,Busty CA Kanno Sayuki [Uncensored L**ked],https://pic.javct.net/poster/04112026/1776057791.jpg,https://javct.net/v/t28-423-rm,140,2026-06-18
SRS-073-RM,Yariman Document Hikari (20) Golf Instructor File.11 Special Habit Sex Elite Public Morality Violation Exciting Sex Of Surere [Uncensored L**ked],https://pic.javct.net/poster/05192026/6a4092625a.jpg,https://javct.net/v/srs-073-rm,135,2026-06-18
NHDTC-216,Nipple Development Train 9,https://pic.javct.net/poster/05192026/e7a5ff3134.jpg,https://javct.net/v/nhdtc-216,220,2026-06-18
HSM-086,"Beautiful, Tall, Slender, And Gorgeous Cross-dressing Boy, Izumi Rina, Loves Sex So Much That She Made Her AV Debut!!",https://pic.javct.net/poster/05192026/ef6a8f75d3.jpg,https://javct.net/v/hsm-086,150,2026-06-18
420HPT-059-RM,"Nonoka (30) Amateur Hoi Hoi, Amateur Hoi Hoi Pet, Amateur, Black Hair, Super Masochistic, Obedient, Sensitive, Hedonist, Sex Friend, Jumping, Outdoors, Shame, Toy, Creampie, Gonzo, Documentary [Uncensored L**ked]",https://pic.javct.net/poster/05192026/df3e8db048.jpg,https://javct.net/v/420hpt-059-rm,104,2026-06-18
SDAM-174-RM,First milk enema sumo tournament 2 (really). 4 general women participated [Uncensored L**ked],https://pic.javct.net/poster/05192026/e63bc035d5.jpg,https://javct.net/v/sdam-174-rm,139,2026-06-18
326IHD-009-RM,"Tsubomi, a 19-year-old vocational student, wanted to concentrate on her studies, so instead of her part-time job, which she couldn't do much of, she took on the challenge of having sex with her dad. [Uncensored L**ked]",https://pic.javct.net/poster/05192026/6919d35c63.jpg,https://javct.net/v/326ihd-009-rm,67,2026-06-18
420HPT-059,"Nonoka (30) Amateur Hoi Hoi, Amateur Hoi Hoi Pet, Amateur, Black Hair, Super Masochistic, Obedient, Sensitive, Hedonist, Sex Friend, Jumping, Outdoors, Shame, Toy, Creampie, Gonzo, Documentary",https://pic.javct.net/poster/05192026/df3e8db048.jpg,https://javct.net/v/420hpt-059,104,2026-06-18
FC2PPV-4921135,"[Adult Eros] Beautiful, fair-skinned, slender elementary school piano teacher gives a raw cock reverse lesson to support a girl in love",https://pic.javct.net/poster/05192026/20e7f27adb.jpg,https://javct.net/v/fc2ppv-4921135,94,2026-06-18
326IHD-009,"Tsubomi, a 19-year-old vocational student, wanted to concentrate on her studies, so instead of her part-time job, which she couldn't do much of, she took on the challenge of having sex with her dad.",https://pic.javct.net/poster/05192026/6919d35c63.jpg,https://javct.net/v/326ihd-009,67,2026-06-18
HALT-030-RM,New Employee Seeding Plan Sensitive Buttobi L**king On A Hot Spring Trip H Machi Ikuta [Uncensored L**ked],https://pic.javct.net/poster/20230206/1686973161.jpg,https://javct.net/v/halt-030-rm,125,2026-06-18
SRS-071-RM,Yariman Document Yumeika (18) University Student File.09 [Uncensored L**ked],https://pic.javct.net/poster/05192026/e2aa33f524.jpg,https://javct.net/v/srs-071-rm,130,2026-06-18
NNPJ-388-RM,178 Cm! High-rise Model Class Adults With A Sloppy Face 19 Years Old (actually A High-height Complex) [Uncensored L**ked],https://pic.javct.net/poster/05192026/f738a904ff.jpg,https://javct.net/v/nnpj-388-rm,120,2026-06-18
HZ-3870,Beauty Collection Vol.125 - Yu Okubo,https://pic.javct.net/poster/05192026/74e4872154.jpg,https://javct.net/v/hz-3870,60,2026-06-18
PA-061626-100,A single mother who wants to feel like a woman again while her c**ld is at daycare,https://pic.javct.net/poster/05192026/b9dd64ed92.jpg,https://javct.net/v/pa-061626-100,61,2026-06-18
MILK-052-RM,One Month Abstinence Challenge Of Yuri Kamiya!Frustration Is A Big Explosion In A Large Amount Of Pheromone Bomb Drop Nasty Brain Iki L**ked SEX [Uncensored L**ked],https://pic.javct.net/poster/05192026/a9f29de061.jpg,https://javct.net/v/milk-052-rm,115,2026-06-18
SIMA-039-RM,Yuri [Uncensored L**ked],https://pic.javct.net/poster/05192026/3cd3ab1a80.jpg,https://javct.net/v/sima-039-rm,59,2026-06-18
420HPT-056-RM,"Natsuki (21) Amateur Hoi Hoi, Amateur Hoi Hoi Pet, Amateur, Black Hair, Masochist, Neat, Obedient, Sensitive, Infinite Orgasms, Sex Friend, Jumping, Outdoors, Shame, Toy, Creampie, Gonzo, Documentary [Uncensored L**ked]",https://pic.javct.net/poster/05192026/fa62c6f8bc.jpg,https://javct.net/v/420hpt-056-rm,99,2026-06-18
SDAM-174,First milk enema sumo tournament 2 (really). 4 general women participated,https://pic.javct.net/poster/05192026/e63bc035d5.jpg,https://javct.net/v/sdam-174,139,2026-06-18
SGKI-093A,The ultimate psychological battle where piston vibrators are set against each other on 12 chairs Piston Vibrator Chair Game 3rd Tournament Preliminary Block A,https://pic.javct.net/poster/05192026/5b06a75eb4.jpg,https://javct.net/v/sgki-093a,99,2026-06-18
SGKI-092,Beautiful instructor shows off road lessons Public road acme driving,https://pic.javct.net/poster/05192026/a97694bd31.jpg,https://javct.net/v/sgki-092,92,2026-06-18
