code,title,image_url,page_url,views,date_scraped
TCD-330-RM,Devilishly Beautiful Cross-dressing Boy Goes On A Drunken 'reverse Anal' Date With Kurusu Raira. [Uncensored L**ked],https://pic.javct.net/poster/05192026/081102ecb4.jpg,https://javct.net/v/tcd-330-rm,128,2026-06-10
TCD-328-RM,"Humiliation, Sexual Assault, Wearing A Tobikko (fish Roe) And Going On A Date In The Entertainment District! ~Crossdresser Edition~ 3 Mel [Uncensored L**ked]",https://pic.javct.net/poster/05192026/559cd8c390.jpg,https://javct.net/v/tcd-328-rm,131,2026-06-10
HSM-087,"A Cross-dressing Boy, Ayumi Namikawa, Makes Her AV Debut, Experiencing Orgasms So Intense They Make Her Lose Consciousness And Push Her Beyond The Limits Of Ecstasy.",https://pic.javct.net/poster/05192026/728164ee8c.jpg,https://javct.net/v/hsm-087,140,2026-06-10
AVSA-440-RM,Crossdressing Girl Debut: Super S-Class Stunning Crossdresser Rio [Uncensored L**ked],https://pic.javct.net/poster/05192026/45f7ea4501.jpg,https://javct.net/v/avsa-440-rm,112,2026-06-10
TCD-331,"A Day In The Life Of Me And My Girlfriend With A Penis, A Taxi Date, Day 6, By Ena Saki",https://pic.javct.net/poster/05192026/71272ef1be.jpg,https://javct.net/v/tcd-331,170,2026-06-10
TCD-334,"Newhalf - Tears, Nonstop, Intense Anal Sex 4 Mel",https://pic.javct.net/poster/05192026/e4f1fab783.jpg,https://javct.net/v/tcd-334,126,2026-06-10
TIMD-033,Boys ♂ X ♂ Lesbian Let's Have Sex Like BL! Kino X Nico,https://pic.javct.net/poster/05192026/3c1f69d546.jpg,https://javct.net/v/timd-033,149,2026-06-10
TCD-332,"Humiliation, Sexual Assault, Wearing A Tobikko (fish Roe) And Going On A Date In The Entertainment District! ~Crossdresser Edition~ 4 Suzushiro Meika",https://pic.javct.net/poster/05192026/6160c327db.jpg,https://javct.net/v/tcd-332,126,2026-06-10
DASS-981-RM,"Super Cute NH ""Hiiragi Momiji"" And A Healing Nymphomaniac Have A Passionate 2-night, 3-day Cohabitation Life Where They Keep Having Sex Day And Night. Hiiragi Momiji, Miyanishi Hikaru [Uncensored L**ked]",https://pic.javct.net/poster/05192026/d81cd06716.jpg,https://javct.net/v/dass-981-rm,210,2026-06-10
TCD-328,"Humiliation, Sexual Assault, Wearing A Tobikko (fish Roe) And Going On A Date In The Entertainment District! ~Crossdresser Edition~ 3 Mel",https://pic.javct.net/poster/05192026/559cd8c390.jpg,https://javct.net/v/tcd-328,131,2026-06-10
AVSA-440,Crossdressing Girl Debut: Super S-Class Stunning Crossdresser Rio,https://pic.javct.net/poster/05192026/45f7ea4501.jpg,https://javct.net/v/avsa-440,112,2026-06-10
TCD-330,Devilishly Beautiful Cross-dressing Boy Goes On A Drunken 'reverse Anal' Date With Kurusu Raira.,https://pic.javct.net/poster/05192026/081102ecb4.jpg,https://javct.net/v/tcd-330,128,2026-06-10
DASS-981,"Super Cute NH ""Hiiragi Momiji"" And A Healing Nymphomaniac Have A Passionate 2-night, 3-day Cohabitation Life Where They Keep Having Sex Day And Night. Hiiragi Momiji, Miyanishi Hikaru",https://pic.javct.net/poster/05192026/d81cd06716.jpg,https://javct.net/v/dass-981,210,2026-06-10
MIGD-626,Incredibly Beautiful Woman Shemale Debut AyaginuSaki Anzu那,https://pic.javct.net/poster/05192026/3ce2ec951b.jpg,https://javct.net/v/migd-626,120,2026-06-10
NVH-080-RM,"My Best Friend At The All-boys School Is Actually A Girl!? A Transsexual, Flat-chested, Boyish Lesbian: Kondo Mumu / Monami Suzu [Uncensored L**ked]",https://pic.javct.net/poster/05192026/bb1603b261.jpg,https://javct.net/v/nvh-080-rm,160,2026-06-10
SDGY-002-RM,"This Beautiful Woman Is A Feminine Man [unbounded By Gender, Limitless Perverted Possibilities], A Super-aggressive, Masochistic Slut Begging For Immediate Sex, Saying ""Hey, Let's Have Sex,"" Offering A Parade Of Pleasure-focused Service That Would Be Absolutely Impossible With The Opposite Sex. [Uncensored L**ked]",https://pic.javct.net/poster/05192026/1e58688dd5.jpg,https://javct.net/v/sdgy-002-rm,130,2026-06-10
MOOC-021-RM,"""You Can Do Whatever You Want With My Ass..."" After My Girlfriend Dumped Me, The Big-assed Cross-dressing Manager Of The Baseball Team Became My Always-available Ass-fucking Junior And Comforted Me With Anal Sex And Cumming Inside. Nanako [Uncensored L**ked]",https://pic.javct.net/poster/05192026/5bc3e90fd8.jpg,https://javct.net/v/mooc-021-rm,160,2026-06-10
TPNS-006-RM,A Super Talented Beautiful Man's Daughter Layer Is Always Full Erection Big Penis Slender And Loves Lewd The Best M [Uncensored L**ked],https://pic.javct.net/poster/20230804/1692417528.jpg,https://javct.net/v/tpns-006-rm,129,2026-06-10
TPNS-005-RM,5P Large Orgies [Minimum Short Stature But Extra Thick Penikuri Crossdressing Layer] On The Net It Is A High-handed Remark But In Real Life... [Super Sensitive Mesuiki Crazy Intrinsic De M] All Semen Ketsuma Co-launched Super Hard Asshole SEX Training Document Chibitori [Uncensored L**ked],https://pic.javct.net/poster/20230207/1689393485.jpg,https://javct.net/v/tpns-005-rm,112,2026-06-10
MOOC-022-RM,"I Captivated The Frustrated Penis Of The Fair-skinned Trans Woman Who Lives Nearby And Whom I Admired, By Restraining Her And Training Her With A Sex Toy Machine, Leaving Her To Orgasm And Ejaculate Repeatedly, Making Her Fall In Love With Me. (Shirakawa Miyuki) [Uncensored L**ked]",https://pic.javct.net/poster/05192026/7eac031669.jpg,https://javct.net/v/mooc-022-rm,150,2026-06-10
NVH-080,"My Best Friend At The All-boys School Is Actually A Girl!? A Transsexual, Flat-chested, Boyish Lesbian: Kondo Mumu / Monami Suzu",https://pic.javct.net/poster/05192026/bb1603b261.jpg,https://javct.net/v/nvh-080,160,2026-06-10
MOOC-021,"""You Can Do Whatever You Want With My Ass..."" After My Girlfriend Dumped Me, The Big-assed Cross-dressing Manager Of The Baseball Team Became My Always-available Ass-fucking Junior And Comforted Me With Anal Sex And Cumming Inside. Nanako",https://pic.javct.net/poster/05192026/5bc3e90fd8.jpg,https://javct.net/v/mooc-021,160,2026-06-10
SDGY-002,"This Beautiful Woman Is A Feminine Man [unbounded By Gender, Limitless Perverted Possibilities], A Super-aggressive, Masochistic Slut Begging For Immediate Sex, Saying ""Hey, Let's Have Sex,"" Offering A Parade Of Pleasure-focused Service That Would Be Absolutely Impossible With The Opposite Sex.",https://pic.javct.net/poster/05192026/1e58688dd5.jpg,https://javct.net/v/sdgy-002,130,2026-06-10
MOOC-022,"I Captivated The Frustrated Penis Of The Fair-skinned Trans Woman Who Lives Nearby And Whom I Admired, By Restraining Her And Training Her With A Sex Toy Machine, Leaving Her To Orgasm And Ejaculate Repeatedly, Making Her Fall In Love With Me. (Shirakawa Miyuki)",https://pic.javct.net/poster/05192026/7eac031669.jpg,https://javct.net/v/mooc-022,150,2026-06-10
