code,title,image_url,page_url,views,date_scraped
XV-439-RM,New Comer! Saya Love [Uncensored L**ked],https://pic.javct.net/poster/05192026/b92de83527.jpg,https://javct.net/v/xv-439-rm,59,2026-06-09
PKPD-421-RM,I'll Take The Virginity Of A New Actress With Internal Ejaculation. Shina Kiki [Uncensored L**ked],https://pic.javct.net/poster/05192026/dcaa38c23c.jpg,https://javct.net/v/pkpd-421-rm,120,2026-06-09
FOCS-073-RM,Moeno Ikuhara AV Debut Ruru Arisu. Best Friend And No Boyfriend = Age But Expectation Of More Than 50 Experienced Newcomers! [Uncensored L**ked],https://pic.javct.net/poster/20220406/1656058639.jpg,https://javct.net/v/focs-073-rm,120,2026-06-09
NACR-919-SUB,My Husband's Brother And I Had A Nude Photoshoot. I Learned The Pleasure Of Being Seen Naked Through The Viewfinder... Azuma Rin [English Subtitle],https://pic.javct.net/poster/20253001/1739985611.jpg,https://javct.net/v/nacr-919-sub,119,2026-06-09
STARS-048-RM,101 Shooting Bucksmanship Amateur Male Super Super Crown Genuine Semen Takeda Yume [Uncensored L**ked],https://pic.javct.net/poster/20243105/1719525185.jpg,https://javct.net/v/stars-048-rm,135,2026-06-09
FC2PPV-4917550,"[No]**, I was surprised that the daycare worker's behind-the-scenes face fetish video was allowed to go live [Download available in review]",https://pic.javct.net/poster/05192026/37f6beb934.jpg,https://javct.net/v/fc2ppv-4917550,45,2026-06-09
FC2PPV-4917039,"[Complete Amateur Creampie] A slender and very beautiful office lady likes to have her pussy licked, her big dick licked, and then ejaculated inside.Two raw creampies.",https://pic.javct.net/poster/05192026/631330dbd1.jpg,https://javct.net/v/fc2ppv-4917039,44,2026-06-09
MADV-233-RM,I Raging Nasty Slut [Uncensored L**ked],https://pic.javct.net/poster/05192026/f7575540db.jpg,https://javct.net/v/madv-233-rm,120,2026-06-09
START-583,"It's Guaranteed To Make You Cum! Beyond The Peak Of Orgasm, A Truly Mind-blowing Trance Of Incontinence And Spasms, A Relentless, Hard Piston Thrust That Continues Even As You Cry And Scream, Tenjin Hagoromo",https://pic.javct.net/poster/05192026/e5067eee06.jpg,https://javct.net/v/start-583,115,2026-06-09
FCH-124,[Completely private room personal] Close service leads to ejaculation...Muscle training sex man Vol.2,https://pic.javct.net/poster/05192026/b1e84f8908.jpg,https://javct.net/v/fch-124,214,2026-06-09
DOSA-017-RM,Sanctuary-Kotone Amamiya- [Uncensored L**ked],https://pic.javct.net/poster/05192026/c41e7564c9.jpg,https://javct.net/v/dosa-017-rm,103,2026-06-09
420HOI-397,"Magumi (23) Amateur Hoi Hoi Z, Amateur, Documentary, Gonzo, Beautiful Girl, Innocent, Slender, Masturbation, Electric Massager, Squirting, Facial",https://pic.javct.net/poster/05192026/d9cd16dfa9.jpg,https://javct.net/v/420hoi-397,91,2026-06-09
PKPD-421,I'll Take The Virginity Of A New Actress With Internal Ejaculation. Shina Kiki,https://pic.javct.net/poster/05192026/dcaa38c23c.jpg,https://javct.net/v/pkpd-421,120,2026-06-09
DASD-648-SUB,The Unconscious Temptation Of A Quiet And Natural Married Woman Who Can Not Refuse If Asked. Shinoda Yu [English Subtitle],https://pic.javct.net/poster/04112026/1777090835.jpg,https://javct.net/v/dasd-648-sub,120,2026-06-09
FC2PPV-4916703,"A devilishly beautiful woman with big breasts and a fair-skinned beautiful body, her true identity is a former entertainment manager.The way she goes crazy after being injected with semen over and over again is a sight to behold.",https://pic.javct.net/poster/05192026/b45d65da75.jpg,https://javct.net/v/fc2ppv-4916703,96,2026-06-09
XVSR-302,Giant Cum X Large Convulsions Agga Crazy Cum Shot GUKKBLE SEX Ryuuden Kotone,https://pic.javct.net/poster/05192026/7bd25d786c.jpg,https://javct.net/v/xvsr-302,120,2026-06-09
SOE-927,Aika Rookie Debut AV 乃 Dream NO.1 STYLE,https://pic.javct.net/poster/05192026/28fd7e8a82.jpg,https://javct.net/v/soe-927,120,2026-06-09
FOCS-072-RM,Debut Of A Young Lady With One New Experience-The Day When A Boxed Girl Awakens To Sexual Pleasure-Sara Yoshiki [Uncensored L**ked],https://pic.javct.net/poster/20220406/1655447639.jpg,https://javct.net/v/focs-072-rm,120,2026-06-09
PRED-749-SUB,"Want To Thoroughly Humiliate This Elegant Female Announcer, So I'll Make Her Blush And Cum Again And Again! First Time 3 Scenes Waka Natsuki [English Subtitle]",https://pic.javct.net/poster/20250903/1741887541.jpg,https://javct.net/v/pred-749-sub,120,2026-06-09
FC2PPV-4916927,"[No] Black 3P party on the day of birthday Reina, a cute foreign office lady with outstanding charm Chapter 6: Intense 3P with 2 big cock black people on her birthday, to**ured to the limit and creampied 2 times in a row [Overseas version] Bonus included",https://pic.javct.net/poster/05192026/d8d5b87191.jpg,https://javct.net/v/fc2ppv-4916927,71,2026-06-09
DIVAS-081,Picking Up Girls In Europe From Drinking At Night To Sex... Missy Love & Lili Chamel,https://pic.javct.net/poster/05192026/bd9e004ed8.jpg,https://javct.net/v/divas-081,120,2026-06-09
MAAN-1174,"[A positive beauty who also licks anus] A beauty club favorite with a supple body. Once you put it in her mouth, Chico won't let go of it. Her pussy is on the verge of collapse due to the toy dual-wielding gun to**ure. Her cosplay is on the verge of collapse. [Pretty neighbor] [Miyu]",https://pic.javct.net/poster/05192026/e5683be215.jpg,https://javct.net/v/maan-1174,59,2026-06-09
NAKA-012-RM,Obscene RQ ~ 10 Head Slender BODY's Steamed Crotch ~ Aso Nozomi [Uncensored L**ked],https://pic.javct.net/poster/05192026/eec1569b48.jpg,https://javct.net/v/naka-012-rm,120,2026-06-09
MAAN-1174-RM,"[A positive beauty who also licks anus] A beauty club favorite with a supple body. Once you put it in her mouth, Chico won't let go of it. Her pussy is on the verge of collapse due to the toy dual-wielding gun to**ure. Her cosplay is on the verge of collapse. [Pretty neighbor] [Miyu] [Uncensored L**ked]",https://pic.javct.net/poster/05192026/e5683be215.jpg,https://javct.net/v/maan-1174-rm,59,2026-06-09
