code,title,image_url,page_url,views,date_scraped
326IHD-009,"Tsubomi, a 19-year-old vocational student, wanted to concentrate on her studies, so instead of her part-time job, which she couldn't do much of, she took on the challenge of having sex with her dad.",https://pic.javct.net/poster/05192026/6919d35c63.jpg,https://javct.net/v/326ihd-009,67,2026-06-17
MILK-055-RM,Height 171 Cm 8 Body Active College Student Brilliant AV Debut Aoyama Airi [Uncensored L**ked],https://pic.javct.net/poster/05192026/d66f105950.jpg,https://javct.net/v/milk-055-rm,130,2026-06-17
HONB-299-RM,Raw SEX Until Morning Young Man / Momo [Uncensored L**ked],https://pic.javct.net/poster/20230206/1686539873.jpg,https://javct.net/v/honb-299-rm,68,2026-06-17
KAM-130-RM,Shoplifting Beautiful Girl In Uniform By An Unscrupulous Erotic Manager Of A Convenience Store In Tokyo Video Kotone Toa [Uncensored L**ked],https://pic.javct.net/poster/20230205/1683869293.jpg,https://javct.net/v/kam-130-rm,120,2026-06-17
NXG-434-RM,I'm Dying To Fuck You! Apartment Manager Aunt [Uncensored L**ked],https://pic.javct.net/poster/20230207/1689825586.jpg,https://javct.net/v/nxg-434-rm,120,2026-06-17
200GANA-3392-RM,"[This is a one-night stand x aromatic lady] Taking advantage of my loneliness, I pretend to be a counselor and get into a cute butt's complaint, and my soul gym becomes cloudy. A serious softie, first shot 2309 [Uncensored L**ked]",https://pic.javct.net/poster/05192026/e20cbc7991.jpg,https://javct.net/v/200gana-3392-rm,63,2026-06-17
SIMM-906,Miyuu,https://pic.javct.net/poster/05192026/dc143e3438.jpg,https://javct.net/v/simm-906,65,2026-06-17
HZGD-127-RM,Married Woman Violated And Creampied Over And Over By Despicable Neighbor Mika Kurosaki [Uncensored L**ked],https://pic.javct.net/poster/20221202/1647307630.jpg,https://javct.net/v/hzgd-127-rm,112,2026-06-17
348NTR-041-RM,"Unauthorized Creampie in Transcendental Shuraba With idol-class looks ... I found a cute girlfriend looking at the illuminations with a smile w Such a girl will appear in AV or the end of the world w Boyfriend Azasu She was not enthusiastic at first, but his I decided to appear that I could wipe out the trauma w She who seems pure was a perfect talent if I took it off ... A pant voice that grows up to an immature body that bounces every time a fierce piss After this, super shuraba w ah w [Uncensored L**ked]",https://pic.javct.net/poster/20221202/1648661422.jpg,https://javct.net/v/348ntr-041-rm,84,2026-06-17
NNPJ-388-RM,178 Cm! High-rise Model Class Adults With A Sloppy Face 19 Years Old (actually A High-height Complex) [Uncensored L**ked],https://pic.javct.net/poster/05192026/f738a904ff.jpg,https://javct.net/v/nnpj-388-rm,120,2026-06-17
SDAB-148-RM,Honor Student With Pink Nipples And White Skin! The Most Naive And Naughty Girl Of The Year! Chika Sato SOD Exclusive AV Debut [Uncensored L**ked],https://pic.javct.net/poster/05192026/5a94663ead.jpg,https://javct.net/v/sdab-148-rm,195,2026-06-17
PKPD-422-RM,"A Documentary Of A Drinking Session In A Room With Unprotected Sex: Shirasaki Rion, A Beautiful Girl With Overwhelmingly Clear, Fair Skin. [Uncensored L**ked]",https://pic.javct.net/poster/05192026/17ef94096b.jpg,https://javct.net/v/pkpd-422-rm,120,2026-06-17
348NTR-045-RM,"Unauthorized Vaginal Cum Shot NTR A Vaginal Cum Shot That He's Never Had Before... I Found A Cool Couple In Shibuya I Don't Want To Appear In A Model Class Beauty AV, But I Want Stimulation So I'm Prepared To Appear To Answer His Feelings Actually, I'm dissatisfied with his too gentle sex, so let's stir it up with the actor's big cock, but when it starts, she still shows a sense of resistance. But tears at the end... [Uncensored L**ked]",https://pic.javct.net/poster/20221108/1662163667.jpg,https://javct.net/v/348ntr-045-rm,104,2026-06-17
DASD-236,Doll Kotone Further Committed,https://pic.javct.net/poster/05192026/00d7724476.jpg,https://javct.net/v/dasd-236,100,2026-06-17
1P-061626-001,Hospitality from A mature woman exuding a Showa,https://pic.javct.net/poster/05192026/37930159f0.jpg,https://javct.net/v/1p-061626-001,58,2026-06-17
SKMJ-411-RM,"A Kind And Beautiful Nursing Mom! ""Can You Help A Virgin Who Suffers From Premature Ejaculation To Improve Her Outbursts?"" A Cute Mama Who Is Full Of Motherhood Has A Vaginal Cum Shot SPECIAL For A Virgin Who Has Too Premature Ejaculation! [Uncensored L**ked]",https://pic.javct.net/poster/20230207/1690549190.jpg,https://javct.net/v/skmj-411-rm,274,2026-06-17
PA-061626-100,A single mother who wants to feel like a woman again while her c**ld is at daycare,https://pic.javct.net/poster/05192026/b9dd64ed92.jpg,https://javct.net/v/pa-061626-100,61,2026-06-17
PRED-865-RM,Wife gets cuckolded by power harassing boss [Uncensored L**ked],https://pic.javct.net/poster/05192026/a1715aeaf1.jpg,https://javct.net/v/pred-865-rm,123,2026-06-17
326FCT-223,"[Main story] Yuzu-chan is so young, but she cries out and cries repeatedly. Her gestures and attitude are appropriate for her age. Creampie sex video shoot.",https://pic.javct.net/poster/05192026/98cfd4ed7a.jpg,https://javct.net/v/326fct-223,100,2026-06-17
HONB-298-RM,"Yuuki Hiiragi, Who Has Become A Real M, Is Paralyzed And Made Use Of... [Uncensored L**ked]",https://pic.javct.net/poster/20230206/1686539934.jpg,https://javct.net/v/honb-298-rm,66,2026-06-17
SIRO-5686,I tried to verify the urban legend that gals are erotic. A super masochistic gal exposes her sexual fetishes and is on the verge of erupting due to the vaginal pressure that tightens the man's penis [First shot] AV application online AV experience shooting 2574,https://pic.javct.net/poster/05192026/b73d807a11.jpg,https://javct.net/v/siro-5686,65,2026-06-17
HMGL-182-RM,Embarrassing Body Shortcut Sex Idol Aoi Tojo [Uncensored L**ked],https://pic.javct.net/poster/04112026/d608ddd076.jpg,https://javct.net/v/hmgl-182-rm,130,2026-06-17
HALT-029-RM,Extreme Kawa Too Thin Daddy Active JD Rio-chan Sinking Into A Big Penis [Uncensored L**ked],https://pic.javct.net/poster/20230206/1686973223.jpg,https://javct.net/v/halt-029-rm,120,2026-06-17
SDAB-146-RM,First Experience And Cum Big Cock! Super Piss! 3P! All Life First Special Youth Era Asuka Momose [Uncensored L**ked],https://pic.javct.net/poster/05192026/835ce9d3cc.jpg,https://javct.net/v/sdab-146-rm,125,2026-06-17
