code,title,image_url,page_url,views,date_scraped
FSDSS-058-SUB,"The Culmination Of Emergency Transfer Sora, Please See Sora Amagawa [English Subtitle]",https://pic.javct.net/poster/04112026/1776934392.jpg,https://javct.net/v/fsdss-058-sub,145,2026-06-15
YST-296-RM,I'm A Pervert Who Drips Pussy Juice Even Though My Father-in-law Treats Me As A Mouth. Umino Firefly [Uncensored L**ked],https://pic.javct.net/poster/20230205/1685072262.jpg,https://javct.net/v/yst-296-rm,104,2026-06-15
ROYD-095-RM,"Would You Like To Try It With Me? Mizuki, A Small Devil Who Picks Up And Eats Her Best Friend's Boyfriend. Natural Mizuki [Uncensored L**ked]",https://pic.javct.net/poster/20220406/1656053563.jpg,https://javct.net/v/royd-095-rm,150,2026-06-15
SKMJ-759-RM,"To All The Cute Working Girls At The Shop!! ""Would You Take My Virginity During A Break From Work!?"" Listening To The Virgin's Troubles During A Break Awakens Your Maternal Instincts And Makes Your Vagina Tingle And Blush With Arousal (^^;) ""Is It Okay If I'm... His First?"" A Miraculous Turn Of Events Lol A Special Episode Of Raw, Continuous Cumming Inside Sex As He Loses His Virginity During Work Hours [Uncensored L**ked]",https://pic.javct.net/poster/05192026/13633b8a96.jpg,https://javct.net/v/skmj-759-rm,232,2026-06-15
STSK-077-RM,Group Obscenity Of Hotel Women ~A Female Room Attendant Destroyed By Devilish Acts~ [Uncensored L**ked],https://pic.javct.net/poster/20230205/1685598826.jpg,https://javct.net/v/stsk-077-rm,178,2026-06-15
UBUG-014-RM,"Virgin From Hakata, A Pure And Innocent Documentary (tentative Title) [Uncensored L**ked]",https://pic.javct.net/poster/05192026/c196b22c07.jpg,https://javct.net/v/ubug-014-rm,217,2026-06-15
HONB-489-RM,A 35-year-old Gal Who Flirts While Working A Clinical Trial For An Aphrodisiac. [Uncensored L**ked],https://pic.javct.net/poster/05192026/cb6691c50f.jpg,https://javct.net/v/honb-489-rm,54,2026-06-15
ROYD-230-SUB,Is It Okay To Pay Rent With Pussy?! A Sudden Erotic Cohabitation With A Defenseless Runaway Girl!? A Slutty Girl In A Uniform Who Will Milk You With Her Sweet Cowgirl Position From Morning Till Night Has Come To Stay With Me. Anzu Koko [English Subtitle],https://pic.javct.net/poster/20250903/1742494108.jpg,https://javct.net/v/royd-230-sub,120,2026-06-15
JUY-946-RM,"Reiko Sawamura, A Newcomer Who Continues To Be Scolded While Working By A Woman Boss Who Is Changing Jobs [Uncensored L**ked]",https://pic.javct.net/poster/05192026/4874dc2194.jpg,https://javct.net/v/juy-946-rm,150,2026-06-15
SIRO-5689-RM,[A super tall slender beauty of 172 cm has arrived] Eroticism that you can't imagine from her baptized model body is here [First shot] AV application online AV experience shooting 2573 [Uncensored L**ked],https://pic.javct.net/poster/05192026/2e6532ef63.jpg,https://javct.net/v/siro-5689-rm,66,2026-06-15
MXBD-150-RM,The Rookie Of Mizusawa [Uncensored L**ked],https://pic.javct.net/poster/05192026/de3ec09eb8.jpg,https://javct.net/v/mxbd-150-rm,130,2026-06-15
ATYA-043-RM,"Lusty Wife, Too Carnivorous To Satisfy Her Husband Alone, Cheats On Him Following Her Instincts... Intense Mating With Perverted, Virile Older Men - Sayaka Tomoda [Uncensored L**ked]",https://pic.javct.net/poster/05192026/c34725c8d0.jpg,https://javct.net/v/atya-043-rm,120,2026-06-15
1P-061426-001,Welcome To Luxury Runa Hinata Saori Miyazawa,https://pic.javct.net/poster/05192026/04ea7782fc.jpg,https://javct.net/v/1p-061426-001,61,2026-06-15
NACR-929-SUB,"Unexpectedly, We Share A Room Together And I'm A Boring Boss, But I Have The Most Beautiful Subordinate In The Company... Aya Konami [English Subtitle]",https://pic.javct.net/poster/20250903/1742403316.jpg,https://javct.net/v/nacr-929-sub,117,2026-06-15
SIRO-5689,[A super tall slender beauty of 172 cm has arrived] Eroticism that you can't imagine from her baptized model body is here [First shot] AV application online AV experience shooting 2573,https://pic.javct.net/poster/05192026/2e6532ef63.jpg,https://javct.net/v/siro-5689,66,2026-06-15
CR-061426-001,Sensitive Marshmallow G-Cup,https://pic.javct.net/poster/05192026/a367792593.jpg,https://javct.net/v/cr-061426-001,61,2026-06-15
ROYD-093-RM,"My Older Step-sister Is A Gal Now And Lures Me In Temptation, She Gets Me Hard And Lusts For My Dick As I Spend 3 Days With Her To Lose My Virginity. Himari Kinoshita [Uncensored L**ked]",https://pic.javct.net/poster/20221904/1653023553.jpg,https://javct.net/v/royd-093-rm,154,2026-06-15
FC2PPV-4920416,[Amateur POV] Married woman being used as a toy both in the bathroom and on the bed,https://pic.javct.net/poster/05192026/ad22dbf628.jpg,https://javct.net/v/fc2ppv-4920416,50,2026-06-15
300MIUM-526-RM,"A working masochist. Case.29 Apparel materials trading company office/Mr. Kisaragi/24 years old Even before going to work, the office lady shows off an outrageous blowjob to an erect dick, but in return, a large amount of ejaculation is poured onto her casual clothes.The morning begins in the worst possible way.When she is called during her lunch break and fo**ed to have sex with her, she sticks out her ass and becomes a lewd masochist who indulges in sex during work. [Uncensored L**ked]",https://pic.javct.net/poster/05192026/6a7771b5f2.jpg,https://javct.net/v/300mium-526-rm,93,2026-06-15
PRED-764-SUB,"Muscle Bar NTR: A Story About A Girl Who Falls In Love With A Muscular, Athletic Guy And Becomes A Completely Submissive Female. Miyu Aizawa [English Subtitle]",https://pic.javct.net/poster/20250903/1744307988.jpg,https://javct.net/v/pred-764-sub,120,2026-06-15
OFJE-593-RM,Ai Hongo Retirement S1 Complete 19 Works 15 Hours Box [Uncensored L**ked],https://pic.javct.net/poster/12082025/1767481403.jpg,https://javct.net/v/ofje-593-rm,930,2026-06-15
ZUKO-013-RM,"Had Been Issued In The Orgy Of Our Secret, To Her Husband. [Uncensored L**ked]",https://pic.javct.net/poster/05192026/3195bd0b55.jpg,https://javct.net/v/zuko-013-rm,120,2026-06-15
HOKS-228-RM,Love And Money: A Dark Contract By Tae Kosaka [Uncensored L**ked],https://pic.javct.net/poster/05192026/ce5042e117.jpg,https://javct.net/v/hoks-228-rm,105,2026-06-15
DASD-835-SUB,The Story Of A Woman Who Wanted To Get Pregnant With Her Beloved Husband But Ended Up Being Impregnated By The Fertility Specialist! Yu Shinoda [English Subtitle],https://pic.javct.net/poster/20212709/1632967151.jpg,https://javct.net/v/dasd-835-sub,141,2026-06-15
