code,title,image_url,page_url,views,date_scraped
PXH-047-RM,[Full Version] Obo Girl 017 Iroha-chan (23) Stress Is Relieved By Etch The Best Ass Attack Sex Ichizu ← It's A Lie I'm Cheating Roar Nodo Mako [Uncensored L**ked],https://pic.javct.net/poster/20221202/1646758356.jpg,https://javct.net/v/pxh-047-rm,130,2026-06-20
VGD-186-RM,Newcomer 20 Years Old Sasaki Strawberry [Uncensored L**ked],https://pic.javct.net/poster/06032026/1775800602.jpg,https://javct.net/v/vgd-186-rm,100,2026-06-20
HMN-848-RM,"My Sex Friend Of Five Years, With Whom I Had The Best Physical Chemistry, Is Getting Married. I Know It's Wrong, But I Want To Have Sex With Her One Last Time, And Even Though I Know It's Wrong, I Want To Impregnate Her With My Sperm Rather Than Her Husband's, So I Thrust My Sperm In And Out. Natsu Tojo [Uncensored L**ked]",https://pic.javct.net/poster/05192026/98f75599c2.jpg,https://javct.net/v/hmn-848-rm,120,2026-06-20
FC2PPV-4919821-RM,"[Limited release] Musume in a box that has been pre-approved by the post office ♡ The elegant atmosphere completely collapses in front of the cock, and the pleasure recording video that finally starts shaking her hips [High-quality bonus included] [Uncensored L**ked]",https://pic.javct.net/poster/05192026/f13c0a4c3e.jpg,https://javct.net/v/fc2ppv-4919821-rm,39,2026-06-20
FC2PPV-4923612,[fntia Immediate Permanent BAN] A controversial work that records two consecutive vaginal cum shots of an I-cup breasted gravure idol close to hitting the uterus. This is a project that is absolutely impossible in Japan. [Creampie short video bonus included],https://pic.javct.net/poster/05192026/aadbe2b187.jpg,https://javct.net/v/fc2ppv-4923612,33,2026-06-20
NACT-141-RM,"A Woman With A Top-class G-cup Body Falls Into ""garage Tent Prostitution."" Masturbation And Instant Handjob Service In The Confines Of A Tent. Sasakura Aya [Uncensored L**ked]",https://pic.javct.net/poster/05192026/0176aa87a4.jpg,https://javct.net/v/nact-141-rm,120,2026-06-20
326FCT-222,"[Main story] Riku-chan, a C-cup girl who looks good with a short cut, whom I met on a certain SNS site, was a viewer of Gonzo videos, and when I negotiated for a photo shoot, she let me shoot her with a big creampie lol",https://pic.javct.net/poster/05192026/485f2eed6e.jpg,https://javct.net/v/326fct-222,93,2026-06-20
SNOS-256-RM,"My Cousin (who Is Married) Whom I Reunited With In My Hometown, Gives Off A Strong Vibe That She's Up For Anything, And She's Showing Off Her Bare Legs Right Next To Her Husband, Wanting To Put My Dick Inside Her. [Uncensored L**ked]",https://pic.javct.net/poster/05192026/7750c7b1cd.jpg,https://javct.net/v/snos-256-rm,120,2026-06-20
DSOD-032-RM,"No Way, Dad... The Day My Slender, Petite, Big-breasted Girlfriend Becomes A New Mother. Fujisaki Soa [Uncensored L**ked]",https://pic.javct.net/poster/05192026/bdb38a433c.jpg,https://javct.net/v/dsod-032-rm,150,2026-06-20
NACT-145,"Married Woman Transformation Club: A Beautiful Wife In Her Forties Is Publicly Trained In Front Of A Crowd, Squirting And Participating In A Threesome. A Perfect Wife From A Good Family Falls Into Depravity. Honami Hazuki",https://pic.javct.net/poster/05192026/e9aaac2176.jpg,https://javct.net/v/nact-145,120,2026-06-20
NACT-141,"A Woman With A Top-class G-cup Body Falls Into ""garage Tent Prostitution."" Masturbation And Instant Handjob Service In The Confines Of A Tent. Sasakura Aya",https://pic.javct.net/poster/05192026/0176aa87a4.jpg,https://javct.net/v/nact-141,120,2026-06-20
SNOS-257-RM,"Newcomer No. 1 Style: Hito-kiwa, 20-year-old Kyoto College Student Mitsu Konoha Makes Her AV Debut. [Uncensored L**ked]",https://pic.javct.net/poster/05192026/6235159c9d.jpg,https://javct.net/v/snos-257-rm,120,2026-06-20
SNOS-266-RM,"Is It Okay To Keep The Extremely Sensitive, Delicate Girl 'Hatsumi Nanoka' Cumming For 12 Hours Straight? [Uncensored L**ked]",https://pic.javct.net/poster/05192026/344e8f54d2.jpg,https://javct.net/v/snos-266-rm,120,2026-06-20
SNOS-341-RM,How About Using My Daughter's Body As A Substitute... I Got Involved With Loan Sharks And Repaid My Debts With My Cute Daughter. - Sakakibara Moe [Uncensored L**ked],https://pic.javct.net/poster/05192026/56a30882c1.jpg,https://javct.net/v/snos-341-rm,120,2026-06-20
DSOD-008-RM,"Dr**ged With An Aphrodisiac, She Becomes Sweaty And Aroused! She Naturally Spreads Her Legs Wide And Wets Herself Profusely! Shaking And Convulsing, Sensitive Hot Yoga Class - Mei Itsukaichi [Uncensored L**ked]",https://pic.javct.net/poster/05192026/018a8f1d20.jpg,https://javct.net/v/dsod-008-rm,130,2026-06-20
NACT-144,Bookings Are Pouring In! 100% Satisfaction Guaranteed! Mature Beauty Cosplay Delivery: Hikari Hime,https://pic.javct.net/poster/05192026/8882f2e74f.jpg,https://javct.net/v/nact-144,110,2026-06-20
SNOS-210-RM,"An Idol's First Experience, It's The Best! The Legendary Hakata Idol Candidate 'Shiraishi Touha''s First Time In 3 Real Sex Scenes, A Special Full Of Firsts That Will Make You Cum Like Crazy. [Uncensored L**ked]",https://pic.javct.net/poster/05192026/4d6c41611e.jpg,https://javct.net/v/snos-210-rm,140,2026-06-20
JUR-736-RM,"""She Was Actually Fo**ed Into It, Wasn't She...?"" My Aunt Kana, Whom I Secretly Harbored Feelings For, Had Already Been Seduced By Some Old Guy In The Neighborhood... Widow BSS ~I Was Supposed To Confess My Feelings On The First Anniversary Of Her Death, But She Had Already Been Taken Away From Me.~ [Uncensored L**ked]",https://pic.javct.net/poster/05192026/fe3d453f48.jpg,https://javct.net/v/jur-736-rm,100,2026-06-20
JUR-760-RM,"""You Want To Have Sex With Me, Don't You?"" The Usually Quiet, Unassuming, Bespectacled Housewife Librarian's True Nature Transforms The Moment You Enter A Hotel Into A Carnivorous, Secretly Perverted Slut. [Uncensored L**ked]",https://pic.javct.net/poster/05192026/9a9854b69c.jpg,https://javct.net/v/jur-760-rm,120,2026-06-20
HMN-864-RM,"I Was Playfully Fondling My Tomboyish Female Friend's Braless Boobs... And When I Kneaded Her Erect Nipples, She Came And Wet Herself, So I Followed Up With A Flurry Of Piston Thrusts And Cumming Inside Her Sensitive, Inexperienced Pussy, Turning Her Into A Slut (lol) Hinata Natsu [Uncensored L**ked]",https://pic.javct.net/poster/05192026/601b08ef4a.jpg,https://javct.net/v/hmn-864-rm,140,2026-06-20
SOE-957-SUB,"Aika Yumeno , Cum! [English Subtitle]",https://pic.javct.net/poster/20221108/1662023684.jpg,https://javct.net/v/soe-957-sub,148,2026-06-20
SNOS-251-RM,"A Rookie Sports Caster Is Assigned To A Popular Martial Artist By The Station, But She Can't Refuse... And Is Driven To The Brink Of Death By His Forceful, Screw-in Piston... [Uncensored L**ked]",https://pic.javct.net/poster/05192026/7f6993b7af.jpg,https://javct.net/v/snos-251-rm,130,2026-06-20
SNOS-255-RM,"Alone With My Strong-willed, Blue-collar Boss In A Shed Where We Took Shelter During A Torrential Downpour, I Felt Her Femininity In My Body, Drenched In Rain And Sweat, And We Devoured Each Other Instinctively Until Morning. [Uncensored L**ked]",https://pic.javct.net/poster/05192026/4c3c7c171a.jpg,https://javct.net/v/snos-255-rm,120,2026-06-20
FC2PPV-4923152,"[Face exposed] 18-year-old manager of a powerful baseball team who is a regular in the country'' Forbidden private creampie video [Over 80 minutes in total, full version available] * Only a few left",https://pic.javct.net/poster/05192026/5f7932d8d3.jpg,https://javct.net/v/fc2ppv-4923152,07,2026-06-20
