code,title,image_url,page_url,views,date_scraped
FC2PPV-4936042,"0421_001 Kano-chan, 18 years old, super cute, with a cute tongue, and a slender girl with small breasts in the process of development. On her 18th birthday, she impregnates her and makes her creampie AV debut (explosion)",https://pic.javct.net/poster/07052026/04f9896530.jpg,https://javct.net/v/fc2ppv-4936042,184,2026-07-10
SNOS-295-RM,"Miru's Gushing Pussy Can Make Any Man Squirt, Cum, And Squirt! Mega Squirting Fan Appreciation Festival [The Most Cum-inducing Orgasms And Urination In AV History With An Actress Who's Been Fucked By An Amateur!] [Uncensored L**ked]",https://pic.javct.net/poster/07052026/fdbb6954f2.jpg,https://javct.net/v/snos-295-rm,240,2026-07-10
SNOS-269-RM,"Called A High-class Escort Service And Miraculously Ran Into My Idol, Legendary Gravure Idol, Kiho Kanematsu, And We Ended Up Having A Secret Relationship... [Uncensored L**ked]",https://pic.javct.net/poster/07052026/6e762696a4.jpg,https://javct.net/v/snos-269-rm,160,2026-07-10
SNOS-324-RM,A Stunningly Beautiful Female Teacher Is Fo**ed By Her Students To Wear An Extremely Embarrassing High-leg Swimsuit That Barely Contains Her Curves. - Fuua Kaede [Uncensored L**ked],https://pic.javct.net/poster/07052026/c90bbe6d69.jpg,https://javct.net/v/snos-324-rm,150,2026-07-10
KSBJ-065-RM,Being Tempted By The Wife Of A Sexually Active Brother ... Kana Suruga [Uncensored L**ked],https://pic.javct.net/poster/04112026/8a1822886c.jpg,https://javct.net/v/ksbj-065-rm,120,2026-07-10
SNOS-258-RM,The Ultimate Heroine's Intense Fellatio And Massive Facial Cumshot: Kanna Seto [Uncensored L**ked],https://pic.javct.net/poster/07052026/60faee5565.jpg,https://javct.net/v/snos-258-rm,150,2026-07-10
JUY-351-RM,The Night My Hot Aunt Crashed At My Apartment... Kaori Mizusawa [Uncensored L**ked],https://pic.javct.net/poster/20221904/1651463919.jpg,https://javct.net/v/juy-351-rm,120,2026-07-10
PKPD-157-RM,Amateur Yen Woman Dating Creampie OK Black Pantyhose Black Hair Furari Girl Inori Dedication Nori [Uncensored L**ked],https://pic.javct.net/poster/05192026/f8c665752b.jpg,https://javct.net/v/pkpd-157-rm,140,2026-07-10
TEND-034-RM,My New Husband's Stepc**ld Was A Masochist...and Asked Me To Str**gle Him... Yuno Makikawa [Uncensored L**ked],https://pic.javct.net/poster/07052026/81ba451a8f.jpg,https://javct.net/v/tend-034-rm,148,2026-07-10
413INSTV-720-RM,"A working older sister negotiates to appear on the Internet broadcast program Tei, a documentary that even involves creampie sex. Kasumi (pseudonym) works at a bar. [Uncensored L**ked]",https://pic.javct.net/poster/07052026/7a5f9ad4cf.jpg,https://javct.net/v/413instv-720-rm,80,2026-07-10
FC2PPV-4918452,[First shot] The beautiful body of a fair-skinned slender 18-year-old is soiled. A pichi pichi girl who is filled with eroticism is irresistibly satisfied with the creampie from the insertion without a rubber band.,https://pic.javct.net/poster/07052026/1582855c21.jpg,https://javct.net/v/fc2ppv-4918452,79,2026-07-10
FC2PPV-4935791,"[No/Raw Creampie]**pyjpx*jsps A tall, slender, beautiful office lady with clear features stopped by to refresh herself after work. Please heal the fatigue of the day at our store.",https://pic.javct.net/poster/07052026/b92b958cd2.jpg,https://javct.net/v/fc2ppv-4935791,41,2026-07-10
SNOS-295,"Miru's Gushing Pussy Can Make Any Man Squirt, Cum, And Squirt! Mega Squirting Fan Appreciation Festival [The Most Cum-inducing Orgasms And Urination In AV History With An Actress Who's Been Fucked By An Amateur!]",https://pic.javct.net/poster/07052026/fdbb6954f2.jpg,https://javct.net/v/snos-295,240,2026-07-10
DASS-936,"I Gave My Slender, Busty Stepdaughter, Who Hates Men, An Aphrodisiac For A Week. Her Womb Ached, And She Lost Her Reason, And Despite Her Reluctance, She Began To Crave My Huge Cock. - Sumire Kuramoto",https://pic.javct.net/poster/07052026/2e25884034.jpg,https://javct.net/v/dass-936,140,2026-07-10
DSOD-014,"No Script, No Direction, No Acting Whatsoever. A 1-on-1 Encounter Where You Surrender To Your Instincts And Pleasure. Yuki Takeuchi",https://pic.javct.net/poster/07052026/1cfbcf5c0d.jpg,https://javct.net/v/dsod-014,180,2026-07-10
IPZZ-886,"[Warning: May Cause Trauma] My New Girlfriend, A Pure And Innocent Girl With A Divine Butt, Has Been Brainwashed By Her Ex-sex Partner And Now Spreads Her Legs Whenever He Calls. A Hopeless, Severely Masochistic Woman. - Sakura Wakana",https://pic.javct.net/poster/07052026/a80e71a483.jpg,https://javct.net/v/ipzz-886,120,2026-07-10
ROE-512,"PTA Affair With Unprotected Sex: I, Who Was Treated Like I Wasn't Even There At Home, Found A New Place To Belong - Sana Baba",https://pic.javct.net/poster/07052026/1e3eff5653.jpg,https://javct.net/v/roe-512,120,2026-07-10
SNOS-324,A Stunningly Beautiful Female Teacher Is Fo**ed By Her Students To Wear An Extremely Embarrassing High-leg Swimsuit That Barely Contains Her Curves. - Fuua Kaede,https://pic.javct.net/poster/07052026/c90bbe6d69.jpg,https://javct.net/v/snos-324,150,2026-07-10
SKMJ-765,"A Cute Nurse Who's Like An Angel In A White Coat! ""Could You Help This Virgin Guy Who's Suffering From Premature Ejaculation Improve His Condition?"" This Nurse, Who Seems Experienced With Male Organs But Is Surprisingly Innocent, Gets Turned On By The Virgin Guy Who Ejaculates Too Quickly And Gives Him A Raw, Unprotected First-time Sex Experience!",https://pic.javct.net/poster/07052026/ed578ea470.jpg,https://javct.net/v/skmj-765,224,2026-07-10
SNOS-269,"Called A High-class Escort Service And Miraculously Ran Into My Idol, Legendary Gravure Idol, Kiho Kanematsu, And We Ended Up Having A Secret Relationship...",https://pic.javct.net/poster/07052026/6e762696a4.jpg,https://javct.net/v/snos-269,160,2026-07-10
FWAY-098,HDK Idol Shiraishi Touha,https://pic.javct.net/poster/07052026/784f976aee.jpg,https://javct.net/v/fway-098,110,2026-07-10
SNOS-274,"A Junior Coworker From My Part-time Job Stayed Over At My Place Friday Night, And The Next Day We Had Sex After Waking Up, Watched TV, Ate Snacks, And Had Sex Again. It Was A Weekend Of Non-stop Sex That Continued Until Night. - Nozomi Araki",https://pic.javct.net/poster/07052026/cb1dc4b0c7.jpg,https://javct.net/v/snos-274,120,2026-07-10
NHDTC-222-RM,"A Woman With Beautiful Legs, Wearing Pantyhose Directly On Her Skin, Is Unable To Resist The Embarrassment Of Having Her Panties Pulled Off On The Train And Is Made To Orgasm Repeatedly. [Uncensored L**ked]",https://pic.javct.net/poster/07052026/c429bcf048.jpg,https://javct.net/v/nhdtc-222-rm,170,2026-07-10
IPZZ-870,"A Sweet And Gentle, Mature, Yet Cute Female Boss And A Passionate, Slobbery, Tongue-kissing Sex Session In The Office - Saho Shinozaki",https://pic.javct.net/poster/07052026/2c39da4a92.jpg,https://javct.net/v/ipzz-870,150,2026-07-10
