code,title,image_url,page_url,views,date_scraped
VOSS-161-RM,"""I Already Have A New Boyfriend!"" When Her Ex-Husband Started Stalking Her, The Lady Next Door Tried To Get Rid Of Him By Saying That She Was Dating Me, A Cherry Boy! When He Threatened Her, Saying, ""If You Two Are Lovers, Then Start Fucking, Right Here, Right Now!"" We Had To Start Fucking Furiously, And We Had To Make Sure He Didn't Realize I Was Getting My Cherry Popped! [Uncensored L**ked]",https://pic.javct.net/poster/05192026/d0c8ed0ad2.jpg,https://javct.net/v/voss-161-rm,95,2026-07-03
FC2PPV-4932368,Only 1 person with uncensored experience from Aomori Music college student 18 readers Model special value 115 160 cm 45 kg E cup Raw cock inserted just 6 months after losing virginity ⇒ Creampie,https://pic.javct.net/poster/05192026/1a006c0d78.jpg,https://javct.net/v/fc2ppv-4932368,67,2026-07-03
ADN-783-RM,The Story Of How I Had Sex With A Beautiful Married Woman Who Lived In The Same Apartment Building. (Hoshimiya Ichika) [Uncensored L**ked],https://pic.javct.net/poster/05192026/09a20244ff.jpg,https://javct.net/v/adn-783-rm,120,2026-07-03
BLOR-214-RM,An Elegant Lady Who Works At A Relaxation Salon An Intellectual And Humorous Slender Beauty Gets Fucked With An Unequaled Cock And Falls To A Screaming Female [Uncensored L**ked],https://pic.javct.net/poster/20230302/1679715442.jpg,https://javct.net/v/blor-214-rm,103,2026-07-03
GVH-845-RM,Forbidden Caregiving: Ayami Mori [Uncensored L**ked],https://pic.javct.net/poster/04112026/09a5f4838c.jpg,https://javct.net/v/gvh-845-rm,120,2026-07-03
DVAJ-610-RM,"Honor Student J Chan, Maika Hiizumi, Whose Memories Are Erased At Every Lep [Uncensored L**ked]",https://pic.javct.net/poster/20230302/1678507482.jpg,https://javct.net/v/dvaj-610-rm,124,2026-07-03
ABW-145-RM,Spocos Sweaty SEX 4 Production Athletic Association Yuiki Rumina Act.28 Exhilarating SEX With Sweat [Uncensored L**ked],https://pic.javct.net/poster/20212308/1631838759.jpg,https://javct.net/v/abw-145-rm,135,2026-07-03
719MAG-083-RM,Creampie matching with famous actress Hina Nitori [Uncensored L**ked],https://pic.javct.net/poster/05192026/6ae28dfd8c.jpg,https://javct.net/v/719mag-083-rm,90,2026-07-03
XVT-067-RM,Behind the Scenes/Interview I tried to verify how far I can go in a pressure interview. Mari Azusa [Uncensored L**ked],https://pic.javct.net/poster/05192026/006e27013f.jpg,https://javct.net/v/xvt-067-rm,76,2026-07-03
MFCS-213-RM,Renlen [Uncensored L**ked],https://pic.javct.net/poster/05192026/19c0051d0a.jpg,https://javct.net/v/mfcs-213-rm,43,2026-07-03
719MAG-084-RM,Creampie matching with famous actress Rika Tsubaki [Uncensored L**ked],https://pic.javct.net/poster/05192026/92432a2cbd.jpg,https://javct.net/v/719mag-084-rm,86,2026-07-03
YUJ-068,"""How About We Date Until You Give Me An Answer To Your Confession?"" On The Day I Confessed To The Girl I'd Liked For So Long, A Female Friend From University Confessed To Me... I Was So Engrossed In Her That I Forgot About The Girl I Liked, And We Had Sex Over And Over Again.",https://pic.javct.net/poster/05192026/3942e58fb7.jpg,https://javct.net/v/yuj-068,150,2026-07-03
SKMJ-416-RM,"Almost Zero To**ure Experience // A Super Naive Amateur Girl Is Alone With A M Man Ww ""Hey, Don't Put Out Sperm /// But Don't Put It Out On Your Own~"" ! ? Nipple Licking Handjobs, Face Sitting, Footjobs, Cursing To Stop Small Devils // Endless Erotic Waist Swinging In Pile Driving Cowgirl Straddling M Chin That Explodes... [Uncensored L**ked]",https://pic.javct.net/poster/20230804/1691750299.jpg,https://javct.net/v/skmj-416-rm,257,2026-07-03
JJDA-076,"My Classmate's Wife Came To Visit Me In The Hospital, Where I Had Been Accumulating A Lot Of Stress.",https://pic.javct.net/poster/05192026/34d2cb85c5.jpg,https://javct.net/v/jjda-076,120,2026-07-03
MIDA-695,"Unleashed: First Ever Unprotected Sex With Ejaculation Inside. Thorough Development Of The Cervix And G-spot In Her Still Immature Uterus And Slender Body, Leading To A Dripping Wet, Sensitive Pussy And An Orgasm With Ejaculation Inside. Kawaguchi Sakura",https://pic.javct.net/poster/05192026/8b3529660b.jpg,https://javct.net/v/mida-695,120,2026-07-03
MIDA-688,"NTR: My Fiancée Was Cheated On By Her Sleazy Boss Right Before Her Wedding. She Said No, But Her Body Didn't Refuse. - Yua Fukuda",https://pic.javct.net/poster/05192026/0aa22ea46e.jpg,https://javct.net/v/mida-688,140,2026-07-03
CLUB-915,First-class Hotel Woman's Elegant Pussy Gets Intensely Piston-fucked And Cummed Inside In A Gangbang Video,https://pic.javct.net/poster/05192026/7bb542d351.jpg,https://javct.net/v/club-915,110,2026-07-03
CAWB-005,"""From Harajuku To AV"": The Most Troublesome Fruit Idol, Momoko Fukatsu, Who Caused So Much Trouble She Was Kicked Out Of The Final Selection Round, Makes Her AV Debut.",https://pic.javct.net/poster/05192026/07c1dee7d7.jpg,https://javct.net/v/cawb-005,160,2026-07-03
CAWB-003,C**ld Manager Makes AV Debut: The Youngest Manager Working At A Diner Wants To Be Pleasured With Her Slender A-cup Breasts. Eri Moriya,https://pic.javct.net/poster/05192026/3cc6f5d07f.jpg,https://javct.net/v/cawb-003,130,2026-07-03
MIDA-683,Ooh Voice Burst Convulsions Trembling Unleashed Cumshot Orgasm Orgy Special Shiraishi Nami,https://pic.javct.net/poster/05192026/cdc9b2970b.jpg,https://javct.net/v/mida-683,150,2026-07-03
CAWB-001,A Submissive Swimming Ballerina: A Beautiful Ballet Girl Is R**ed By A Horny Swimming Club Boy Who Spreads Her Flexible Legs Wide Open.,https://pic.javct.net/poster/05192026/c9bdcce5b3.jpg,https://javct.net/v/cawb-001,160,2026-07-03
ADN-783,The Story Of How I Had Sex With A Beautiful Married Woman Who Lived In The Same Apartment Building. (Hoshimiya Ichika),https://pic.javct.net/poster/05192026/09a20244ff.jpg,https://javct.net/v/adn-783,120,2026-07-03
ATID-688,"A Beauty Influencer With A Toned, Hourglass Figure Goes To A Popular Oil Massage Parlor And Ends Up Experiencing A Full-blown Orgasm, Arching Her Back And Squirting Climax, Releasing All The Bodily Fluids In Her Body.",https://pic.javct.net/poster/05192026/76d1154dea.jpg,https://javct.net/v/atid-688,130,2026-07-03
MIDA-696,"I'm A Part-time Worker Who's Subjected To Humiliating Naked Training By A Perverted Store Manager, And I'm Fo**ed To Serve Customers Without A Bra Or Panties During The Late-night Shift.",https://pic.javct.net/poster/05192026/611fde1e64.jpg,https://javct.net/v/mida-696,120,2026-07-03
