code,title,image_url,page_url,views,date_scraped
SCOP-503-RM,"Despite Her Temptation Of A Close Friend Of A Bath, Desire Full Erection! !Prepare Yourself And Smile ● Massive Sperm Masses Are Launched In Large Quantities! ! [Uncensored L**ked]",https://pic.javct.net/poster/20230908/1695948527.jpg,https://javct.net/v/scop-503-rm,150,2026-06-30
AEGE-004-RM,Exhibitionist Sayaka I Was Taken Around Naked And Left Abandoned... Sayaka Megumi [Uncensored L**ked],https://pic.javct.net/poster/20230302/1679541444.jpg,https://javct.net/v/aege-004-rm,143,2026-06-30
476MLA-048-RM,[A lot of de S technique that overwhelms the actor  2 consecutive vaginal cum shot to a maid cafe clerk with overwhelming lewd potential] [Uncensored L**ked],https://pic.javct.net/poster/20212308/1631154396.jpg,https://javct.net/v/476mla-048-rm,74,2026-06-30
420ERK-105-RM,"Sana-chan (25) Amateur Hoi Hoi, Erotic Kyun, Amateur, Neat, Young Lady, Beautiful Breasts, Slender, Alcohol Lover, Shaved Pussy, Cosplay, Facial, Gonzo, Documentary [Uncensored L**ked]",https://pic.javct.net/poster/05192026/10380e09af.jpg,https://javct.net/v/420erk-105-rm,79,2026-06-30
SIMA-040-RM,Moe [Uncensored L**ked],https://pic.javct.net/poster/05192026/3b4a2a7aca.jpg,https://javct.net/v/sima-040-rm,72,2026-06-30
HAZU-035-RM,"An Embarrassing Exhibitionist Journey With Her Son's Classmate's Skinny Daughter. ""You Have A Cute Face, But Your Nipples Are Long And Obscene,"" She Says, Punishing Him By Relentlessly Playing With His Nipples. [Uncensored L**ked]",https://pic.javct.net/poster/05192026/54e1512f14.jpg,https://javct.net/v/hazu-035-rm,106,2026-06-30
HND-626,"20 Years Old First Time To Be Hilarious How To Imitate Literary Beauty Girls Delusion!I Went To The First Adult Shop, Vaginal Cum Shot And Purchased AV Immediately! ! Hundred Leaves Flower Sound",https://pic.javct.net/poster/05192026/fb08ea3104.jpg,https://javct.net/v/hnd-626,160,2026-06-30
OLM-332E-RM,A Refined Lady With F-cup Breasts And Beautiful Legs Who Loves To Please Men Loses Herself In Pleasure During Pantyhose Sex And Goes Wild With Orgasms! Akane Rei [Uncensored L**ked],https://pic.javct.net/poster/05192026/b08cea84d8.jpg,https://javct.net/v/olm-332e-rm,121,2026-06-30
SAN-471Z,"Prices Are So High I Can't Make Ends Meet! Even A Single Rice Ball At The Convenience Store Costs About 200 Yen, It's Just Impossible. 002 Marina, Riku",https://pic.javct.net/poster/05192026/69c2cd8c96.jpg,https://javct.net/v/san-471z,93,2026-06-30
OLM-332E,A Refined Lady With F-cup Breasts And Beautiful Legs Who Loves To Please Men Loses Herself In Pleasure During Pantyhose Sex And Goes Wild With Orgasms! Akane Rei,https://pic.javct.net/poster/05192026/b08cea84d8.jpg,https://javct.net/v/olm-332e,121,2026-06-30
SDAB-351,"18-year-old climax development, super sensitive A-chan has 3 first orgasms Aine Homura",https://pic.javct.net/poster/05192026/9b01e7e4b2.jpg,https://javct.net/v/sdab-351,153,2026-06-30
WANZ-328-RM,Limit Dimensions Stop Manzuri Sister Color Satosakura [Uncensored L**ked],https://pic.javct.net/poster/05192026/2328e9dbd5.jpg,https://javct.net/v/wanz-328-rm,150,2026-06-30
AKDL-120,"Amateur girl I met on Thursday 4 [Facial sex friend, slender, gonzo, beautiful breasts, new graduate office lady]",https://pic.javct.net/poster/05192026/ac64e3015e.jpg,https://javct.net/v/akdl-120,239,2026-06-30
200GANA-3407-RM,"When I asked out a 24-year-old esthetician on her way home from a secret job, she turned out to be the owner of a ""famous tool'' that makes her more sensitive than most people.A real softie, first shoot 2316 [Uncensored L**ked]",https://pic.javct.net/poster/05192026/f8010ef9a6.jpg,https://javct.net/v/200gana-3407-rm,57,2026-06-30
FSKT-009,De Transformation Duero 18-year-old Miracle Of Loss Of Virginity Suzu Makino Debut,https://pic.javct.net/poster/05192026/7a7ccca207.jpg,https://javct.net/v/fskt-009,124,2026-06-30
FC2PPV-4929790,"After work, a slutty office lady with an NTR old man and a black man are shared by two men and continue to be brought to their climax by rotating insertion, and their bodies are in a state of limit, and they are inseminated twice in a row [Overseas version] Bonus included",https://pic.javct.net/poster/05192026/7fe4a4313a.jpg,https://javct.net/v/fc2ppv-4929790,41,2026-06-30
FC2PPV-4929849,"[First shot/18 year old generation] Innocent real nursing school student (barely legal 3rd year student) with 1 experience teaching a man to an innocent girl in special training I was aiming to be a nurse, but instead I got an injection",https://pic.javct.net/poster/05192026/b8a0df3e1f.jpg,https://javct.net/v/fc2ppv-4929849,117,2026-06-30
ABF-353-RM,"With Umi Yakake's ""face'', you can enjoy it. [Uncensored L**ked]",https://pic.javct.net/poster/04112026/9632900574.jpg,https://javct.net/v/abf-353-rm,135,2026-06-30
FC2PPV-4919833,"[141] I'm so happy that you're such a charming, slender and beautiful lady who's greedy for erotica and makes me tremble over and over again with her body that makes me cum easily.",https://pic.javct.net/poster/05192026/48342445da.jpg,https://javct.net/v/fc2ppv-4919833,39,2026-06-30
PXH-051-RM,Obo Girl 019 Ten-chan (19) 19 Sai Innocent Ecchi Cuteness Full Toy Sommelier Rim Job Self-Licking Smile Heart A Hard Worker Who Will Do Anything [Uncensored L**ked],https://pic.javct.net/poster/20221904/1652270559.jpg,https://javct.net/v/pxh-051-rm,150,2026-06-30
SDAB-162-RM,"Even Though She Seems To Be Such An Adult, Her Head Is Full Of Naughty Delusions Art Student With Sensitive Slender Art Skin SOD Exclusive AV Debut Saya Kuriyama [Uncensored L**ked]",https://pic.javct.net/poster/05192026/dab14fa51a.jpg,https://javct.net/v/sdab-162-rm,210,2026-06-30
NMCH-016-RM,"Not A Sex Friend, Not A Girlfriend. A Secretly Perverted, Big-assed Beauty With A Full-on L**i Body Having A Blast Filming Our Sex! Rion-chan, Izumi Rion [Uncensored L**ked]",https://pic.javct.net/poster/05192026/f79840f03d.jpg,https://javct.net/v/nmch-016-rm,90,2026-06-30
HONB-491-RM,"Older Guy Who Loves Girls: A Hall Of Fame Pick-Up Trip, Absolutely Beautiful Girl, Dangerous Sex 14 [Uncensored L**ked]",https://pic.javct.net/poster/05192026/e5ae924ff1.jpg,https://javct.net/v/honb-491-rm,57,2026-06-30
200GANA-3407,"When I asked out a 24-year-old esthetician on her way home from a secret job, she turned out to be the owner of a ""famous tool'' that makes her more sensitive than most people.A real softie, first shoot 2316",https://pic.javct.net/poster/05192026/f8010ef9a6.jpg,https://javct.net/v/200gana-3407,57,2026-06-30
