code,title,image_url,page_url,views,date_scraped
SDAB-146-RM,First Experience And Cum Big Cock! Super Piss! 3P! All Life First Special Youth Era Asuka Momose [Uncensored L**ked],https://pic.javct.net/poster/05192026/835ce9d3cc.jpg,https://javct.net/v/sdab-146-rm,125,2026-06-16
SRS-069-RM,Shirout Hunter 2 · 46 [Uncensored L**ked],https://pic.javct.net/poster/05192026/ccfe37177d.jpg,https://javct.net/v/srs-069-rm,125,2026-06-16
EBOD-468-RM,Of Plump Cosplayers First Time Human Bullet Orgy Off Meeting Hatese Haruna [Uncensored L**ked],https://pic.javct.net/poster/04112026/1776665584.jpg,https://javct.net/v/ebod-468-rm,120,2026-06-16
XVSR-241-RM,Hard Sadistic In Succubus Asami Nagase [Uncensored L**ked],https://pic.javct.net/poster/04112026/1776222688.jpg,https://javct.net/v/xvsr-241-rm,120,2026-06-16
SVVRT-081-RM,"Amateur variety show only for female students! Pee around the world! If you can spin 360 degrees while squirting, you win a prize of 100,000 yen! An adult's big cock piston can't stop the continuous ejaculation of an immature pussy whose sensitivity has increased due to continuous ejaculation! ! [Uncensored L**ked]",https://pic.javct.net/poster/05192026/aaa0e0f6bc.jpg,https://javct.net/v/svvrt-081-rm,173,2026-06-16
DVDES-568-RM,Last Bus Bus Squirting Drunk Is Lawless!OL Super Sensitive To Out Entangled Momentum Usually Drunk To Serious [Uncensored L**ked],https://pic.javct.net/poster/05192026/c8184610ae.jpg,https://javct.net/v/dvdes-568-rm,160,2026-06-16
STARS-035-RM,18 Year Old's Lumpy Premature Omen Oko Gun Thrusting And Huge Cock Mekomi Waist Crushed Ikasa Yui Mahiro [Uncensored L**ked],https://pic.javct.net/poster/20243105/1719489445.jpg,https://javct.net/v/stars-035-rm,135,2026-06-16
CLUB-591-RM,Beauty Office 5 [Uncensored L**ked],https://pic.javct.net/poster/05192026/b96b439436.jpg,https://javct.net/v/club-591-rm,230,2026-06-16
SYKH-192-RM,A Leather-clad Woman With Dazzlingly Beautiful Legs; Seductive Legs That Bewitch Men; Honami Hazuki [Uncensored L**ked],https://pic.javct.net/poster/05192026/b16a8ebb78.jpg,https://javct.net/v/sykh-192-rm,120,2026-06-16
START-551,"5CORNER Nano Ogasawara enjoys all the sweat, tide, and drool of her exquisite body, which is dripping wet with bodily fluids.",https://pic.javct.net/poster/05192026/f76609bb6f.jpg,https://javct.net/v/start-551,160,2026-06-16
STARS-438-RM,"""Because The Back Menu Of Our Store Is The Squirting Of The Teacher, Come To Play? W"" Mahiro Tadai, A New Female Teacher Who Was Gangbanged By Students At The School Festival [Uncensored L**ked]",https://pic.javct.net/poster/20212709/1634549265.jpg,https://javct.net/v/stars-438-rm,135,2026-06-16
SGKI-093A,The ultimate psychological battle where piston vibrators are set against each other on 12 chairs Piston Vibrator Chair Game 3rd Tournament Preliminary Block A,https://pic.javct.net/poster/05192026/5b06a75eb4.jpg,https://javct.net/v/sgki-093a,99,2026-06-16
DANDYA-035-RM,"I Secretly Invited A Beautiful Flight Attendant Who Gave Me Amazing Service Back To My Hotel And Had Unprotected Sex With Her, And She Turned Out To Be A Slut Who Kept Asking For More. VOL.7 [Uncensored L**ked]",https://pic.javct.net/poster/05192026/bddcdd19c6.jpg,https://javct.net/v/dandya-035-rm,184,2026-06-16
KAWD-643-RM,Bichabicha Squirting Nurse 3 Sisters Gangbang SPECIAL Da~yo [Uncensored L**ked],https://pic.javct.net/poster/05192026/07f788f25d.jpg,https://javct.net/v/kawd-643-rm,180,2026-06-16
ONED-821-RM,Shou Nishino Incontinence Does Not Stop Barely [Uncensored L**ked],https://pic.javct.net/poster/05192026/6da5f81139.jpg,https://javct.net/v/oned-821-rm,120,2026-06-16
SGKI-092,Beautiful instructor shows off road lessons Public road acme driving,https://pic.javct.net/poster/05192026/a97694bd31.jpg,https://javct.net/v/sgki-092,92,2026-06-16
STAR-181-RM,Acme K**l Saori Hara Entertainer [Uncensored L**ked],https://pic.javct.net/poster/05192026/3663c4f0a7.jpg,https://javct.net/v/star-181-rm,125,2026-06-16
ONED-826-RM,Risa Kasumi Sex Barely NO.1 STYLE × Thick Net Re- [Uncensored L**ked],https://pic.javct.net/poster/20230206/1687956003.jpg,https://javct.net/v/oned-826-rm,120,2026-06-16
EKDV-634,"Mitsuki-chan, Aya Mitsuki",https://pic.javct.net/poster/05192026/28168ec116.jpg,https://javct.net/v/ekdv-634,120,2026-06-16
390JAC-238,"[It's been 3 weeks since I last cum in the premature ejaculation pussy of a glamorous J-cup world-class big-breasted half gal] [Emily-chan, the 108th gal millionaire]",https://pic.javct.net/poster/05192026/4825b82930.jpg,https://javct.net/v/390jac-238,114,2026-06-16
TIKB-221,"Infiltrating A Photoshoot Featuring Busty, Voluptuous Cosplayers Having Unprotected Sex And Cumming Inside! Their Lust Is On Full Display, And They're Addicted To Cock.",https://pic.javct.net/poster/05192026/3e66aef87d.jpg,https://javct.net/v/tikb-221,134,2026-06-16
MILK-045-RM,Tall Time!Roafta Aerial Pan Pen 2 Misaka Ria [Uncensored L**ked],https://pic.javct.net/poster/06032026/1773112726.jpg,https://javct.net/v/milk-045-rm,120,2026-06-16
HODV-21706,"Nampa Drinking At Home I Invited A Super-type Married Woman Who Lives In The Neighborhood To My House, ""Would You Like To Drink At Home?""",https://pic.javct.net/poster/05192026/3b14a9565f.jpg,https://javct.net/v/hodv-21706,240,2026-06-16
ROP-008-RM,[FANZA limited! ] Small Devil Beautiful Girl Tempted By Cosplay Hikaru Minazuki [Uncensored L**ked],https://pic.javct.net/poster/05192026/3a97162f3a.jpg,https://javct.net/v/rop-008-rm,120,2026-06-16
