code,title,image_url,page_url,views,date_scraped
DASS-970,She is given an aphrodisiac and starts sweating! Natural and vulgar crab crotch jobajoba peeing! Jerky and convulsive sensitive hot yoga class Minami Kojima,https://pic.javct.net/poster/05192026/28cb878391.jpg,https://javct.net/v/dass-970,150,2026-06-05
PGD-618-RM,"Pissing × Retirement, Angers Specials Squirting [Uncensored L**ked]",https://pic.javct.net/poster/06032026/1775800806.jpg,https://javct.net/v/pgd-618-rm,120,2026-06-05
STAR-767-SUB,Iori Furukawa Men's Beauty Salon Out In That Whisper Your Ear In Gently Dirty [English Subtitle],https://pic.javct.net/poster/06032026/1775114919.jpg,https://javct.net/v/star-767-sub,180,2026-06-05
BBAN-586,"Zero Romantic Experience. A Cheerful Younger Sister Teaches Her Shy, Unassuming Older Sister, Who Is Uncomfortable Around Men, About Sex. A Lesbian Sisters' First Sexual Experience. Yui Hina, Yura Kana",https://pic.javct.net/poster/05192026/4a39ad4b88.jpg,https://javct.net/v/bban-586,120,2026-06-05
DASS-980,"Give Me More Cock!! A Female Investigator, Sora Amakawa, Is Driven To Orgasm Repeatedly By A Humiliating, Super-fast Uterine Thrust, Squirting Copious Amounts Of Cum And Reaching The Climax Of A Low-class Man.",https://pic.javct.net/poster/05192026/9835f86442.jpg,https://javct.net/v/dass-980,110,2026-06-05
BBAN-590,"Genuine Lesbians! A Tomboyish Girl Who Likes Girls Makes Her AV Debut. I Want To Have A Great Lesbian Sex Session With A Lovely Older Sister! Miyasaka Umi, Nagasaki Yukine",https://pic.javct.net/poster/05192026/45c96ae891.jpg,https://javct.net/v/bban-590,130,2026-06-05
SNOS-250,"Unexpectedly Ran Into Miru, My Overly Serious Senior Colleague From The Accounting Department, At A Submissive-themed Escort Service! ""Hehe, I'll Use This As Leverage To Train You A Lot!"" (Me)",https://pic.javct.net/poster/05192026/b7d09cf3d9.jpg,https://javct.net/v/snos-250,150,2026-06-05
SNOS-206,"That Approachable, Voluptuous, Down-to-earth Older Sister Unleashes Her Adult Erotic Side—a Full-on Awakening Of Her Sensual Side. Suzuki Nozomi",https://pic.javct.net/poster/05192026/df50edb1c5.jpg,https://javct.net/v/snos-206,130,2026-06-05
NHDTC-212,"A Casual AV Appearance On The Magic Mirror Bus! ""If You Don't Film My Face..."" She Gets Fucked From Behind With A Butt Panel And Squirts! Breaking The Promise Of Just Ass Fucking, She Gets Unexpectedly Penetrated! The Frustrated Big-assed Girlfriend Gives In To The Unparalleled Pleasure Of A Stranger's Cock Being Thrust Into Her In Front Of Her Boyfriend And Allows Him To Cum Inside Her.",https://pic.javct.net/poster/05192026/a0d44b1ecc.jpg,https://javct.net/v/nhdtc-212,180,2026-06-05
MGTD-078-RM,Let's Play With The Penis. Vol.02 [Uncensored L**ked],https://pic.javct.net/poster/05192026/b7d09ed402.jpg,https://javct.net/v/mgtd-078-rm,297,2026-06-05
EBOD-212-SUB,Tear production SEX girl waking up to four tropical [English Subtitle],https://pic.javct.net/poster/06032026/1775366834.jpg,https://javct.net/v/ebod-212-sub,140,2026-06-05
EUUD-88,Sensitive mature body convulsions climax! ! Massive incontinence & urination & squirting & squirting orgasm super sex Konoe Tasaki,https://pic.javct.net/poster/05192026/6c7d2a27bd.jpg,https://javct.net/v/euud-88,111,2026-06-05
SDDE-766-RM,(For just 10 minutes) There really was a man who could stop time! ~I will dye your youth pure white. Irresponsible creampie edition for a disgusting J〇 [Uncensored L**ked],https://pic.javct.net/poster/05192026/4eaabc0be2.jpg,https://javct.net/v/sdde-766-rm,290,2026-06-05
WHX-032,"Full Say Te Is Fun And Full And Blowing SEX Is Too Comfortably Oma ○ Co-broken Has To Be, Because Be The Best Body To Mon Man Would Too Much Your Tide South Iori Students 18 Years Of Age",https://pic.javct.net/poster/05192026/f1630735b3.jpg,https://javct.net/v/whx-032,120,2026-06-05
NHDTC-209,NATURALHIGH Annual Best 2025: We Want To Tarnish Hinako Matsui Again And Again.,https://pic.javct.net/poster/05192026/2074e5bf04.jpg,https://javct.net/v/nhdtc-209,240,2026-06-05
FC2PPV-4912494,*This may be the last time* This is a female who has become addicted to the joy of having the best breasts of all time that I found. Limited release of complete private shooting | Review distribution is Gonzo data taken by smartphone,https://pic.javct.net/poster/05192026/9e39f220eb.jpg,https://javct.net/v/fc2ppv-4912494,55,2026-06-05
SSNI-892,"Breaking Through The limit Of High Sensitivity With A Drugs, Sticky Tease And Stopping Just Before She's Gonna Cum To Give Her The Biggest Orgasm Ever! Ichika Hoshimiya",https://pic.javct.net/poster/05192026/1e8cb7ed76.jpg,https://javct.net/v/ssni-892,170,2026-06-05
MIDD-421-RM,Shou Nishino Indecent Ass [Uncensored L**ked],https://pic.javct.net/poster/05192026/6b7e09edbf.jpg,https://javct.net/v/midd-421-rm,120,2026-06-05
300MIUM-1313-RM,"[A sullen boss who gets wet in the back of his throat] Frustrated boss with Chiko in his mouth, sat straight, deep-seated, with a neat face, a sullen and lewd model-like beauty shakes her hips and cums with convulsions and creampies [In-house affair] [Single man (subordinate) x married woman (boss)] case.23 [Uncensored L**ked]",https://pic.javct.net/poster/05192026/af1636dd9d.jpg,https://javct.net/v/300mium-1313-rm,57,2026-06-05
PLA-044-RM,After This And Fucked Sex Was Ai Uehara [Uncensored L**ked],https://pic.javct.net/poster/05192026/761c0f0075.jpg,https://javct.net/v/pla-044-rm,140,2026-06-05
NHDTC-211,"Sacrifice Impregnation Shame 2: A Dangerous Daytime Impregnation Plan To Impregnate A Strong-willed Beautiful Girl Who Absolutely Refuses To Let Anyone Touch Her, By Using Her Friend's Weakness To Trap Her.",https://pic.javct.net/poster/05192026/f975552145.jpg,https://javct.net/v/nhdtc-211,145,2026-06-05
MXGS-733-RM,Rapist ~ Woman Compel The Sexual Relationship To Others ~ Aso Nozomi [Uncensored L**ked],https://pic.javct.net/poster/05192026/cb9f8dc0e5.jpg,https://javct.net/v/mxgs-733-rm,120,2026-06-05
PGD-481,THE PREMIUM VIP Premium 5th Anniversary Special Work,https://pic.javct.net/poster/05192026/57cffcc3c6.jpg,https://javct.net/v/pgd-481,360,2026-06-05
SGKI-090,"Self-defense techniques to prevent indecent acts: ""Don't show your face that you're feeling it'' 2 If you're feeling it, you'll turn on the thugs! Unresponsive no matter what you do",https://pic.javct.net/poster/05192026/c164b61cf8.jpg,https://javct.net/v/sgki-090,186,2026-06-05
