code,title,image_url,page_url,views,date_scraped
FC2PPV-4927418,"The most perverted woman in Japan is this one. ""I want you to break it harder and harder. This perverted gal is waiting with all her might in a pose that you should use.''",https://pic.javct.net/poster/05192026/6edb87fd3f.jpg,https://javct.net/v/fc2ppv-4927418,52,2026-06-27
STARS-057-RM,Mahiro Yui 777 Hours Piston Until The Man Juice Overflowing By Abstinence & Temper Becomes Meringue [Uncensored L**ked],https://pic.javct.net/poster/20243105/1719741858.jpg,https://javct.net/v/stars-057-rm,135,2026-06-27
ZRK-004-RM,"Male Chauvinism, Throat To**ure, Gagging Hell: Throat Roar Edition By Misuzu Okuyama [Uncensored L**ked]",https://pic.javct.net/poster/05192026/968c977e8c.jpg,https://javct.net/v/zrk-004-rm,122,2026-06-27
DSJH-017-RM,Relentless Orgasm Training With Continuous Squirting Until All Bodily Fluids Are Drained - Another Kind Of Youth Experienced By Schoolgirl Beauties - [Uncensored L**ked],https://pic.javct.net/poster/05192026/1fb788ef32.jpg,https://javct.net/v/dsjh-017-rm,119,2026-06-27
MRJJ-013-RM,Coalescence Asami Yuma Full Rimozaiku In 4 Seconds Met [Uncensored L**ked],https://pic.javct.net/poster/05192026/5ed2ec0690.jpg,https://javct.net/v/mrjj-013-rm,120,2026-06-27
FSBK-024,"Tiny Ass, Loss Of Anal Virginity, **dnapping A 140cm L**i Beauty And Mercilessly Ejaculating Inside Her Unused Anus, Anal Beauty Karina, Tanida Karina",https://pic.javct.net/poster/05192026/8238d59b84.jpg,https://javct.net/v/fsbk-024,121,2026-06-27
MOOR-060,Haruno Ando Was So Sexy After The Shoot! I Got Permission To Release The Footage That I Accidentally Recorded During The Launch Party.,https://pic.javct.net/poster/05192026/66a9b91dba.jpg,https://javct.net/v/moor-060,120,2026-06-27
HODV-22080-RM,"The Best Girlfriend With Amazing Physical Compatibility, A Sweet And Slutty Gal, Kaho Shirahama, With Whom I Have A Passionate Sex Marathon. [Uncensored L**ked]",https://pic.javct.net/poster/05192026/d1050ed31e.jpg,https://javct.net/v/hodv-22080-rm,148,2026-06-27
MIDA-111-SUB,"G-spot Development With A Huge Cock, Orgasmic Vagina Chase Piston Squirting Awakening Orgasm, Tono Hanarin [English Subtitle]",https://pic.javct.net/poster/20250903/1743098307.jpg,https://javct.net/v/mida-111-sub,150,2026-06-27
MUCD-356-RM,"It Feels So Good, I Can't Stop!! The Best 4 Hours Of Squirting As The Body Of A Schoolgirl In Uniform Overflows With Pleasure. [Uncensored L**ked]",https://pic.javct.net/poster/05192026/ab789afa5c.jpg,https://javct.net/v/mucd-356-rm,240,2026-06-27
MIAE-358-SUB,"""You're Already Ejaculating"" Men's Esthetics Cum Shot / Pursue Man Tide! !Juice Squeezing Cum-top Course Shinoda Yu [English Subtitle]",https://pic.javct.net/poster/04112026/d359055d67.jpg,https://javct.net/v/miae-358-sub,120,2026-06-27
XVSR-258-RM,Rika Hatsumi Rin's Real Sex [Uncensored L**ked],https://pic.javct.net/poster/05192026/ea71c52a16.jpg,https://javct.net/v/xvsr-258-rm,120,2026-06-27
SAN-192-RM,A Squirting Wife Who Couldn't Get A Divorce From Her Shitty Husband And Was Fo**ed To Work In An Underground Sex Industry / Satsuki Toyooka [Uncensored L**ked],https://pic.javct.net/poster/20231711/1701105484.jpg,https://javct.net/v/san-192-rm,120,2026-06-27
GOJU-229-RM,Squirting Job Joba Wife In Chiba Sumire 47 Years Old [Uncensored L**ked],https://pic.javct.net/poster/20230104/1680409463.jpg,https://javct.net/v/goju-229-rm,125,2026-06-27
SVMGM-051,Magic mirror hard-boiled limited to modern female college students! First time adult toy experience review (Heart) Honest evaluation using everything from the classic electric massager and vibrator to the popular sucker! A complete change from! Handy toy challenge! The piston rubs the vaginal mucous membrane over and over again and the squirt doesn't stop! ! Prize money...,https://pic.javct.net/poster/05192026/ffbeba1e87.jpg,https://javct.net/v/svmgm-051,290,2026-06-27
HODV-22080,"The Best Girlfriend With Amazing Physical Compatibility, A Sweet And Slutty Gal, Kaho Shirahama, With Whom I Have A Passionate Sex Marathon.",https://pic.javct.net/poster/05192026/d1050ed31e.jpg,https://javct.net/v/hodv-22080,148,2026-06-27
LWQ-005,"Cute, Masochistic Onahole Girl Who Falls Into A State Of Ecstasy: Takemoto Mii",https://pic.javct.net/poster/05192026/984b116b61.jpg,https://javct.net/v/lwq-005,117,2026-06-27
NGD-077-RM,Re P Copy Eyes Acme Face In The Mirror Before Young Wife Of Freshly Married Seem Erotic Feeling Of Hugging Face Barre VIP ● ER Amateur Summary 18 (24 Years Old) Is Swinging Big Nipples Absence Of Husband [Uncensored L**ked],https://pic.javct.net/poster/05192026/0ce8a02e1f.jpg,https://javct.net/v/ngd-077-rm,120,2026-06-27
DSJH-017,Relentless Orgasm Training With Continuous Squirting Until All Bodily Fluids Are Drained - Another Kind Of Youth Experienced By Schoolgirl Beauties -,https://pic.javct.net/poster/05192026/1fb788ef32.jpg,https://javct.net/v/dsjh-017,119,2026-06-27
DVDMS-485-RM,Appearance MM No. Working Beauty Limited The Magic Mirror Beautiful Leg OL Working For A Major Company Is Wearing Her First Pantyhose Alive Experience! 2 Insert A Big Dick Into IntelliMa ○ Ko That Has Been Fingered In The Pantyhose And L**ked Continuously So That Wet Spots Can Be Made! ! In Ikebukuro [Uncensored L**ked],https://pic.javct.net/poster/05192026/07074a2deb.jpg,https://javct.net/v/dvdms-485-rm,240,2026-06-27
VAGU-032-RM,Nanako Mori - Sex Fantasy Of A Man Who Fell In Love With Mrs. Mannequin Doll ~ Uruwashi [Uncensored L**ked],https://pic.javct.net/poster/05192026/ba821a07ce.jpg,https://javct.net/v/vagu-032-rm,80,2026-06-27
MKCK-421-RM,"Orgasm Faces, Boob Jiggling, Point Of Penetration... 76 Extremely Lewd, Fleshy Angles, Low-angle Back Piston Shots That Will Make Your Dick Go Crazy. [Uncensored L**ked]",https://pic.javct.net/poster/05192026/a48191ed03.jpg,https://javct.net/v/mkck-421-rm,230,2026-06-27
SIRO-5692-RM,"A 170cm tall girl with an outstanding figure comes to us. When she gets excited, her face flushes, her heart rate increases, and her b**od pressure increases. She looks like a carnivore in front of the actor's big dick. [First shot] AV application online AV experience shooting 2578 [Uncensored L**ked]",https://pic.javct.net/poster/05192026/1148314cc5.jpg,https://javct.net/v/siro-5692-rm,63,2026-06-27
10-062526-01,A fairly relaxed gal squirting with a vibrating massager,https://pic.javct.net/poster/05192026/83302c480b.jpg,https://javct.net/v/10-062526-01,08,2026-06-27
