code,title,image_url,page_url,views,date_scraped
SVSHA-001-RM,Shame! Strong Before The Arrival Of The New Nurse In The Ward Medical Examination We Were Made To Be Experimental Subjects For Medical Intern 2022 Winter [Uncensored L**ked],https://pic.javct.net/poster/05192026/922d6314c5.jpg,https://javct.net/v/svsha-001-rm,218,2026-06-09
SGKI-089,"Asunaro Rehabilitation Association, A Clinic For Regenerative Treatment Of Ejaculation Addiction. Medical Professional Mr. O (married) Devotedly Helps Patients Reintegrate Into Society. Yuika Onosaka",https://pic.javct.net/poster/05192026/ef1184ba6b.jpg,https://javct.net/v/sgki-089,155,2026-06-09
SOE-318-RM,Risky Mosaic NO.1STYLE × Deadly! Facials Blow! Risa Kasumi [Uncensored L**ked],https://pic.javct.net/poster/20230206/1686983126.jpg,https://javct.net/v/soe-318-rm,120,2026-06-09
START-583,"It's Guaranteed To Make You Cum! Beyond The Peak Of Orgasm, A Truly Mind-blowing Trance Of Incontinence And Spasms, A Relentless, Hard Piston Thrust That Continues Even As You Cry And Scream, Tenjin Hagoromo",https://pic.javct.net/poster/05192026/e5067eee06.jpg,https://javct.net/v/start-583,115,2026-06-09
390JNT-120-RM,"[Unstoppable desire and overflowing tide] [Big ass short wife x creampie x 3P] [Adult immoral lingerie sex] Sexual desire increases as she gets older, no matter how hard she fucks even though she has a husband, it's not enough... Such a married woman has her first 3P in her life and overflows with the desire to collapse her rationality, squirt, squirt sex crazy, orgasm disordered, dripping wet creampie sex [3 years of marriage, Akine, 30 years old] #37 [Uncensored L**ked]",https://pic.javct.net/poster/05192026/3bd79b7efa.jpg,https://javct.net/v/390jnt-120-rm,119,2026-06-09
420HOI-397,"Magumi (23) Amateur Hoi Hoi Z, Amateur, Documentary, Gonzo, Beautiful Girl, Innocent, Slender, Masturbation, Electric Massager, Squirting, Facial",https://pic.javct.net/poster/05192026/d9cd16dfa9.jpg,https://javct.net/v/420hoi-397,91,2026-06-09
WHX-033,Sly Me Being From 2 People!'Cause You're Licked Oma Co ○ To Kissing ◇ Mon'm Feels Sooo!Pleasure Is 3 Times! Sakai Asahi OL 22-year-old,https://pic.javct.net/poster/05192026/6f27d1ddeb.jpg,https://javct.net/v/whx-033,140,2026-06-09
MOPA-020,"Of Cunnilingus Violence Tongue Slaves Service Cunnilingus, Fo**ed Cunnilingus And Fo**ed Holy Water Straight Drink Rion Nishikawa",https://pic.javct.net/poster/05192026/ff69820a6d.jpg,https://javct.net/v/mopa-020,104,2026-06-09
WHX-034,"And I'm Not Cool With SEX Love, Then AV Debut If Me Me Come By ◇ Osaka Daughter Proud Of G-cup Boobs Please Look Fujisawa Chiharu Students 18 Years Of Age",https://pic.javct.net/poster/05192026/83aad55c81.jpg,https://javct.net/v/whx-034,130,2026-06-09
XVSR-302,Giant Cum X Large Convulsions Agga Crazy Cum Shot GUKKBLE SEX Ryuuden Kotone,https://pic.javct.net/poster/05192026/7bd25d786c.jpg,https://javct.net/v/xvsr-302,120,2026-06-09
SOE-927,Aika Rookie Debut AV 乃 Dream NO.1 STYLE,https://pic.javct.net/poster/05192026/28fd7e8a82.jpg,https://javct.net/v/soe-927,120,2026-06-09
PRED-749-SUB,"Want To Thoroughly Humiliate This Elegant Female Announcer, So I'll Make Her Blush And Cum Again And Again! First Time 3 Scenes Waka Natsuki [English Subtitle]",https://pic.javct.net/poster/20250903/1741887541.jpg,https://javct.net/v/pred-749-sub,120,2026-06-09
SOE-241-RM,Akiho Yoshizawa In Vagina Woman Go Risky Mosaic [Uncensored L**ked],https://pic.javct.net/poster/05192026/c88161e968.jpg,https://javct.net/v/soe-241-rm,120,2026-06-09
GOJU-236-RM,Squirting Joba Joba Wife In Gotanda Asano 45 Years Old [Uncensored L**ked],https://pic.javct.net/poster/20230207/1688526775.jpg,https://javct.net/v/goju-236-rm,133,2026-06-09
MIDA-105-SUB,Bushy Pubic Hair And Pussy Showing Off In Embarrassing Costumes For A Soothing Hospitality. Service Tower Aoi Ichinose [English Subtitle],https://pic.javct.net/poster/20250903/1743098648.jpg,https://javct.net/v/mida-105-sub,150,2026-06-09
BBAN-586-RM,"Zero Romantic Experience. A Cheerful Younger Sister Teaches Her Shy, Unassuming Older Sister, Who Is Uncomfortable Around Men, About Sex. A Lesbian Sisters' First Sexual Experience. Yui Hina, Yura Kana [Uncensored L**ked]",https://pic.javct.net/poster/05192026/4a39ad4b88.jpg,https://javct.net/v/bban-586-rm,120,2026-06-09
BBAN-590-RM,"Genuine Lesbians! A Tomboyish Girl Who Likes Girls Makes Her AV Debut. I Want To Have A Great Lesbian Sex Session With A Lovely Older Sister! Miyasaka Umi, Nagasaki Yukine [Uncensored L**ked]",https://pic.javct.net/poster/05192026/45c96ae891.jpg,https://javct.net/v/bban-590-rm,130,2026-06-09
SIRO-5679,"Good sensitivity, good style, good charm. The woman I want to marry is ready to appear in an AV before getting married. I hold her like this every day, hold her, hold her close to her. [First shot] AV application online AV experience shooting 2568",https://pic.javct.net/poster/05192026/00b334207b.jpg,https://javct.net/v/siro-5679,59,2026-06-09
300MIUM-1380,"The most cute little devil with an unparalleled penis [Delicious-looking nipples] [Very sensitive] ""I feel sorry for you, even though your penis is so hard'' ""If you don't tell me, you won't find out'' I was writhing in shock for a long time, but when I realized that I was cumming right away, he was in control lol You can't resist something like this lol #Female style #Women's sex industry #Peeping: file.41",https://pic.javct.net/poster/05192026/9c19ecb897.jpg,https://javct.net/v/300mium-1380,119,2026-06-09
FC2PPV-4916375,[Big breasted office lady] Highly educated real estate office lady squirts and gets creampied covered in oil,https://pic.javct.net/poster/05192026/f62d9bdca9.jpg,https://javct.net/v/fc2ppv-4916375,59,2026-06-09
SVVRT-079-RM,"Amateur Variety Show: Only Big-Butted Office Ladies On The Street! If You Miss, You're Instantly Fucked And Cummed Inside In A Wall-butt Style Vibrator Challenge! Stimulated Deep Inside The Vagina With A Super Thick Vibrator, The Slutty Ass Is Exposed And The Cumming Spurts Are Unstoppable!! 4 [Uncensored L**ked]",https://pic.javct.net/poster/05192026/b740e07cb8.jpg,https://javct.net/v/svvrt-079-rm,282,2026-06-09
SSNI-828,Sex-loving Aika Yumeno's Eros Finally Awakens And Repeatedly Cums And Convulsions,https://pic.javct.net/poster/05192026/f8f58dfc0d.jpg,https://javct.net/v/ssni-828,150,2026-06-09
SOE-270-RM,Dirty Young Wife Seen Here Next To Sakura  Risky Mosaic Perfect Body [Uncensored L**ked],https://pic.javct.net/poster/20222612/1673891041.jpg,https://javct.net/v/soe-270-rm,180,2026-06-09
DRPT-047-RM,Fo**ed Nipples Visible From Under A Sailor Uniform On A Crowded Train Developed Colossal Tits Girl ○ Raw Yumi Shion [Uncensored L**ked],https://pic.javct.net/poster/20230207/1688877104.jpg,https://javct.net/v/drpt-047-rm,120,2026-06-09
