code,title,image_url,page_url,views,date_scraped
SVMGM-051-RM,Magic mirror hard-boiled limited to modern female college students! First time adult toy experience review (Heart) Honest evaluation using everything from the classic electric massager and vibrator to the popular sucker! A complete change from! Handy toy challenge! The piston rubs the vaginal mucous membrane over and over again and the squirt doesn't stop! ! Prize money... [Uncensored L**ked],https://pic.javct.net/poster/05192026/ffbeba1e87.jpg,https://javct.net/v/svmgm-051-rm,290,2026-06-28
FTHTD-018-RM,How Naughty Can You Be In Front Of Your Friends? Episode2 Feat. FALENOTUBE [Uncensored L**ked],https://pic.javct.net/poster/20230104/1681962810.jpg,https://javct.net/v/fthtd-018-rm,220,2026-06-28
REAL-603-RM,Demon Capitalize Ayumi Shinoda [Uncensored L**ked],https://pic.javct.net/poster/20253001/1741295720.jpg,https://javct.net/v/real-603-rm,120,2026-06-28
PGD-657-RM,Ray Birth [Uncensored L**ked],https://pic.javct.net/poster/04112026/a9b33856dd.jpg,https://javct.net/v/pgd-657-rm,120,2026-06-28
FC2PPV-4927999,"*I found a sweet potato [squirting] A 19-year-old agricultural college student was embarrassed by the gushing armpit sweat, and I planted a seed in her vagina as she ascended to heaven in a half-fainted state ♡",https://pic.javct.net/poster/05192026/b476107ee2.jpg,https://javct.net/v/fc2ppv-4927999,57,2026-06-28
770RABI-065-RM,Anal affair too masochist married woman climaxes [Uncensored L**ked],https://pic.javct.net/poster/05192026/1d10519e49.jpg,https://javct.net/v/770rabi-065-rm,60,2026-06-28
LWQ-005-RM,"Cute, Masochistic Onahole Girl Who Falls Into A State Of Ecstasy: Takemoto Mii [Uncensored L**ked]",https://pic.javct.net/poster/05192026/984b116b61.jpg,https://javct.net/v/lwq-005-rm,117,2026-06-28
TKI-017-RM,MASOTRONIX [Uncensored L**ked],https://pic.javct.net/poster/05192026/900e9556df.jpg,https://javct.net/v/tki-017-rm,125,2026-06-28
200GANA-3396,"Inviting an endangered type of young girl to a dangerous black commercial van... Is the destination in the mountains, a scrap factory, or a love road straight? A serious softie, first shot 2315",https://pic.javct.net/poster/05192026/774affd8ce.jpg,https://javct.net/v/200gana-3396,62,2026-06-28
DOCP-147-RM,"If You Look At The Elder Sister Of The Lower Milk Temptation Friend With Sexual Eyes, You Will Notice The Line Of Sight And If You Try To Apologize You Will Be Tempted By The Lower Milk Pigment While Smiling In Reverse [Uncensored L**ked]",https://pic.javct.net/poster/05192026/ba320511d6.jpg,https://javct.net/v/docp-147-rm,175,2026-06-28
FSKT-005,H Cup Mai-chan And JK Mania Shooting,https://pic.javct.net/poster/05192026/d61f9750e5.jpg,https://javct.net/v/fskt-005,139,2026-06-28
FSKI-005,"""I Can Not Say That I Am ..."" At The Esthetic Store That Has Been Working To Improve The Girl's Power, I Turned To A Female Practitioner And Replaced It With A Male Practitioner Even Though I Was Relieved! ?Erotic Oil Massage 2 Of Uniforms Girls Who Have Been Entrusted With Pleasure Without Being Put In The Car Of The Man In The Circle",https://pic.javct.net/poster/05192026/1c75a70571.jpg,https://javct.net/v/fski-005,230,2026-06-28
FC2PPV-4927098,[Personal shooting] First shot married woman document vol.23 Maya-san Love each other's creampie sex in a hotel in broad daylight [New product buy now campaign / Review special bonus gift],https://pic.javct.net/poster/05192026/c71b6aa049.jpg,https://javct.net/v/fc2ppv-4927098,82,2026-06-28
FUNK-017-RM,"★Monitoring★Verification Plan A Uniform J-Type Who Was Embarrassed Even Showing Her Pants Was Relentlessly Played With Her Unused Pussy And Feeled Sensitive To Twitching, And Crab Crotch Facesitting Cunnilingus Swinging Her Hips Incontinence! A Raw Fucking Creampie In A Wet Teenager Who Begs For A Real Cock! ! 180 Minutes J Series 4 People Included [Uncensored L**ked]",https://pic.javct.net/poster/20230104/1681529368.jpg,https://javct.net/v/funk-017-rm,180,2026-06-28
FLAV-321-RM,Cheerful Erection Charge Girl Who Encourages Cock Sensitive Erection Nipple Bing Sensual Big Ass Cheerleader [Uncensored L**ked],https://pic.javct.net/poster/20230104/1680924715.jpg,https://javct.net/v/flav-321-rm,180,2026-06-28
DRPT-044-RM,Shy Club Girl NATSUKA I've Only Ever Played Baseball [Uncensored L**ked],https://pic.javct.net/poster/20230104/1680750439.jpg,https://javct.net/v/drpt-044-rm,0,2026-06-28
CHUC-028-RM,Squirting Creampie Sex With A Neat And Clean Bitch Ichika (26 Years Old) Ichika Mogami [Uncensored L**ked],https://pic.javct.net/poster/20233001/1677466577.jpg,https://javct.net/v/chuc-028-rm,60,2026-06-28
FC2PPV-4927418,"The most perverted woman in Japan is this one. ""I want you to break it harder and harder. This perverted gal is waiting with all her might in a pose that you should use.''",https://pic.javct.net/poster/05192026/6edb87fd3f.jpg,https://javct.net/v/fc2ppv-4927418,52,2026-06-28
STARS-057-RM,Mahiro Yui 777 Hours Piston Until The Man Juice Overflowing By Abstinence & Temper Becomes Meringue [Uncensored L**ked],https://pic.javct.net/poster/20243105/1719741858.jpg,https://javct.net/v/stars-057-rm,135,2026-06-28
ZRK-004-RM,"Male Chauvinism, Throat To**ure, Gagging Hell: Throat Roar Edition By Misuzu Okuyama [Uncensored L**ked]",https://pic.javct.net/poster/05192026/968c977e8c.jpg,https://javct.net/v/zrk-004-rm,122,2026-06-28
DSJH-017-RM,Relentless Orgasm Training With Continuous Squirting Until All Bodily Fluids Are Drained - Another Kind Of Youth Experienced By Schoolgirl Beauties - [Uncensored L**ked],https://pic.javct.net/poster/05192026/1fb788ef32.jpg,https://javct.net/v/dsjh-017-rm,119,2026-06-28
MRJJ-013-RM,Coalescence Asami Yuma Full Rimozaiku In 4 Seconds Met [Uncensored L**ked],https://pic.javct.net/poster/05192026/5ed2ec0690.jpg,https://javct.net/v/mrjj-013-rm,120,2026-06-28
FSBK-024,"Tiny Ass, Loss Of Anal Virginity, **dnapping A 140cm L**i Beauty And Mercilessly Ejaculating Inside Her Unused Anus, Anal Beauty Karina, Tanida Karina",https://pic.javct.net/poster/05192026/8238d59b84.jpg,https://javct.net/v/fsbk-024,121,2026-06-28
MOOR-060,Haruno Ando Was So Sexy After The Shoot! I Got Permission To Release The Footage That I Accidentally Recorded During The Launch Party.,https://pic.javct.net/poster/05192026/66a9b91dba.jpg,https://javct.net/v/moor-060,120,2026-06-28
