code,title,image_url,page_url,views,date_scraped
VENU-093-RM,Fakecest Horny Stepmom Masturbates With Stepson's Pants Miku Hasegawa [Uncensored L**ked],https://pic.javct.net/poster/20220406/1656590101.jpg,https://javct.net/v/venu-093-rm,85,2026-07-12
GVH-308-RM,Son-in-Law Aiming For Big Tits Yuri Honma [Uncensored L**ked],https://pic.javct.net/poster/20212709/1634711416.jpg,https://javct.net/v/gvh-308-rm,124,2026-07-12
REAL-613-RM,Nailing My Stepmom To Pass The Time Nozomi Tanihara [Uncensored L**ked],https://pic.javct.net/poster/20220707/1657509652.jpg,https://javct.net/v/real-613-rm,129,2026-07-12
MCSR-203-RM,(With Bonus Footage) Creampie Stepmom Will Teach You - Her Son's White Sperm Dripping From Her Vagina [Uncensored L**ked],https://pic.javct.net/poster/20220707/1658325919.jpg,https://javct.net/v/mcsr-203-rm,156,2026-07-12
SPRD-526-SUB,"My Stepmother, Is Way Better Than My Wife... Yoshie Fujisawa [English Subtitle]",https://pic.javct.net/poster/20212011/1640830423.jpg,https://javct.net/v/sprd-526-sub,115,2026-07-12
SPRD-526-RM,"My Stepmother, Is Way Better Than My Wife... Yoshie Fujisawa [Uncensored L**ked]",https://pic.javct.net/poster/20212011/1640830423.jpg,https://javct.net/v/sprd-526-rm,115,2026-07-12
EBOD-228-SUB,[Uncensored] Dutiful Mother Tia [English Subtitle],https://static.javct.net/poster/ebod-228.jpg,https://javct.net/v/ebod-228-sub,119,2026-07-12
GVG-781-RM,A Man Wants His Mother-In-Law's Obscene Tits. Eri Takigawa [Uncensored L**ked],https://pic.javct.net/poster/20212709/1632995722.jpg,https://javct.net/v/gvg-781-rm,120,2026-07-12
XVSR-153-RM,"Erotic Novel, Stepmom Is 19-Year-Old Widow, Ecstatic Tears Of Joy, Suzu Harumiya [Uncensored L**ked]",https://pic.javct.net/poster/20220406/1655917797.jpg,https://javct.net/v/xvsr-153-rm,116,2026-07-12
OBA-381-RM,Cougar Hunter Vol. 2!! My Stepson is Amazing in Bed... Ayaka Makimura [Uncensored L**ked],https://pic.javct.net/poster/20221202/1646614728.jpg,https://javct.net/v/oba-381-rm,141,2026-07-12
SPRD-870-RM,Surrogate Mama Shihori Endo [Uncensored L**ked],https://pic.javct.net/poster/20212011/1641000918.jpg,https://javct.net/v/sprd-870-rm,116,2026-07-12
SPRD-1242-RM,The Surrogate Mother Mio Morishita [Uncensored L**ked],https://pic.javct.net/poster/20212011/1640918548.jpg,https://javct.net/v/sprd-1242-rm,123,2026-07-12
SPRD-1260-SUB,"Dear Stepmom, I, I Like You Better Than My Wife... Iroha Fukuyama [English Subtitle]",https://pic.javct.net/poster/20212011/1637801865.jpg,https://javct.net/v/sprd-1260-sub,106,2026-07-12
VENU-740-RM,This Stepmother And Son Will Start Fucking 2 Seconds After Stepdaddy Leaves For Work Kana Morisawa [Uncensored L**ked],https://pic.javct.net/poster/20221202/1645061130.jpg,https://javct.net/v/venu-740-rm,113,2026-07-12
AUKG-511-RM,"A Wife And Her Mother-In-Law Became Lesbian Lovers - This Horny Stepmom Fucked Her Daughter-In-Law After Watching Her Prancing Around With Her Guard Down, Flashing Panty Shot Action At Her Alice Otsu Shuri Yamaguchi [Uncensored L**ked]",https://static.javct.net/poster/aukg-511.jpg,https://javct.net/v/aukg-511-rm,121,2026-07-12
SPRD-1392-RM,Creampie Relations With My Kind Step Mother... Emi Toda [Uncensored L**ked],https://pic.javct.net/poster/20212011/1637462437.jpg,https://javct.net/v/sprd-1392-rm,108,2026-07-12
JUL-705-RM,After The Graduation Ceremony ... Your Stepmom Is Giving You A Gift To Celebrate Your Entry Into Adulthood ... A Madonna Label Exclusive Beautiful Mature Woman Actress Is Celebrating Your Launch Into The Real World With Her Alluring Eroticism. Maki Hojo [Uncensored L**ked],https://pic.javct.net/poster/20212308/1631256467.jpg,https://javct.net/v/jul-705-rm,124,2026-07-12
GVH-364-RM,"Son-In-Law Aiming For His Mother-In-Law's Too-Sexy Big Titties, With Kyoko Ichikawa [Uncensored L**ked]",https://pic.javct.net/poster/20212011/1644641824.jpg,https://javct.net/v/gvh-364-rm,120,2026-07-12
VENU-088-RM,Magic Mother: Taking Advantage Of Mom's Body While Daddy Is Not Home Asuka Yuki [Uncensored L**ked],https://pic.javct.net/poster/20220406/1656526601.jpg,https://javct.net/v/venu-088-rm,82,2026-07-12
JUL-673-RM,I Was Forbidden To Masturbate When My Wife Was Pregnant So I had Sex With My Mother-In-Law Maki Hojo [Uncensored L**ked],https://static.javct.net/poster/jul-673.jpg,https://javct.net/v/jul-673-rm,120,2026-07-12
ADN-165-US,"Forbidden Immoral Sex 3 An Excessively Young Mother-In-Law Saeko Matsushita [English Subtitle, Reducing Mosaic]",https://pic.javct.net/poster/20221202/1646177501.jpg,https://javct.net/v/adn-165-us,114,2026-07-12
SDMU-673-RM,SOD Romance x French Publishing Living Together I'm A Spoiled Brat Living With My Stepmom Sumire Shiraishi [Uncensored L**ked],https://pic.javct.net/poster/20221202/1648868830.jpg,https://javct.net/v/sdmu-673-rm,129,2026-07-12
SPRD-644-RM,"My Stepmother, Is Way Better Than My Wife... Mari Yonezaki [Uncensored L**ked]",https://pic.javct.net/poster/20212011/1641519219.jpg,https://javct.net/v/sprd-644-rm,115,2026-07-12
SPRD-1484-RM,"Step-mother-in-law, You're Much Better Than My Wife... Iori Nanase [Uncensored L**ked]",https://pic.javct.net/poster/20212011/1637815526.jpg,https://javct.net/v/sprd-1484-rm,139,2026-07-12
