code,title,image_url,page_url,views,date_scraped
NHDTA-916-RM,"My Mom Saw Me Fucking My Big Sister. There's No Way Out Of This Mess Now, So I Fucked Them Both And Creampied Them 3 [Uncensored L**ked]",https://pic.javct.net/poster/20221904/1653821075.jpg,https://javct.net/v/nhdta-916-rm,239,2026-06-19
MCSR-203-RM,(With Bonus Footage) Creampie Stepmom Will Teach You - Her Son's White Sperm Dripping From Her Vagina [Uncensored L**ked],https://pic.javct.net/poster/20220707/1658325919.jpg,https://javct.net/v/mcsr-203-rm,156,2026-06-19
GVG-395-RM,Naughty Nurses Miho Tono [Uncensored L**ked],https://pic.javct.net/poster/20220406/1655965148.jpg,https://javct.net/v/gvg-395-rm,124,2026-06-19
HUNTB-038-RM,"""Hey Big Stepsister, What Are You Doing!?"" When I Came To, My Big Stepsister Was Riding My Cherry Boy Cock, And Cumming Over And Over Again! My Super Excessively Protective Big Stepsister Has A Warped Sense Of Love, But That's How This Cherry Boy Popped His Cherry! [Uncensored L**ked]",https://static.javct.net/poster/huntb-038.jpg,https://javct.net/v/huntb-038-rm,217,2026-06-19
SDDE-494-RM,I'm The Only Girl In This Family Full Of Men I'm Busy Every Day With All The Housework In Addition To Getting Banged In The Mornings By My 10 Stepbrothers And My Stepdad Noa(The Eldest Daughter) [Uncensored L**ked],https://pic.javct.net/poster/20221108/1661443817.jpg,https://javct.net/v/sdde-494-rm,127,2026-06-19
SPRD-526-SUB,"My Stepmother, Is Way Better Than My Wife... Yoshie Fujisawa [English Subtitle]",https://pic.javct.net/poster/20212011/1640830423.jpg,https://javct.net/v/sprd-526-sub,115,2026-06-19
NHDTB-137-RM,"Opening The Door To The Bath, He Sees His Neat and Clean Big Stepsister Naked And Pissing! Seeing His Stepsisters Pussy For the First Time, This Horny Little Stepbrother Lunges Into Forbidden Fakecest With Her, Unable To Restrain Himself. 4 [Uncensored L**ked]",https://pic.javct.net/poster/20220707/1658016815.jpg,https://javct.net/v/nhdtb-137-rm,147,2026-06-19
RCT-520-SUB,"The Beautiful Host Of ""You're The Father, You Should Know Your Daughter's Body!"" Riri Koda's Operation Surprise Fakecest Part 2. Father, Brother, The Whole Family Plays The Creampie Game Edition [English Subtitle]",https://pic.javct.net/poster/20221108/1663465069.jpg,https://javct.net/v/rct-520-sub,109,2026-06-19
DVAJ-349-SUB,"My Stepsister Lets Me Put The First 3 cm In, Just Barely Not Fakecest Nanami Kawakami [English Subtitle]",https://pic.javct.net/poster/20220406/1656313947.jpg,https://javct.net/v/dvaj-349-sub,125,2026-06-19
SPRD-526-RM,"My Stepmother, Is Way Better Than My Wife... Yoshie Fujisawa [Uncensored L**ked]",https://pic.javct.net/poster/20212011/1640830423.jpg,https://javct.net/v/sprd-526-rm,115,2026-06-19
ROE-054-SUB,"After Everyone Else Had Already Left The Nest, I Spent My Days With My Stepmom, Luxuriating In Lust ... Yuka Mizuno [English Subtitle]",https://pic.javct.net/poster/20221202/1647623753.jpg,https://javct.net/v/roe-054-sub,131,2026-06-19
OBA-065-RM,"After Fighting, Stepmother And Son Make Up with Fakecest: Chiaki Takeshita [Uncensored L**ked]",https://pic.javct.net/poster/20221202/1646291530.jpg,https://javct.net/v/oba-065-rm,115,2026-06-19
JUFE-317-RM,"My Wife Went To Visit Her Hometown For 7 Days, Leaving Me All Alone With My Stepdaughter - Who Sure Is Growing! A Record Of How She Whipped Out Her Colossal Tits, Sweat-Slicked And Bouncing While We Banged Until She Told Me She Loved Me Rena Momozono [Uncensored L**ked]",https://static.javct.net/poster/jufe-317.jpg,https://javct.net/v/jufe-317-rm,155,2026-06-19
ROYD-084-RM,"I've Got A Pregnancy Fetish For Her, And I Swear I'm Going To Impregnate Her! I Always Loved My Big Stepsister, But Now She's Getting Married, So For The Next 72 Hours, I'm Going To Fuck Her Until She Gets Pregnant With My C**ld, And I Pumped Her With Every Last Drop Of My Semen! Misuzu Mifune [Uncensored L**ked]",https://pic.javct.net/poster/20221202/1645163644.jpg,https://javct.net/v/royd-084-rm,135,2026-06-19
SPRD-835-SUB,Fakecest: Stepmother And Son Fall For Each Other Rika Fujishita [English Subtitle],https://pic.javct.net/poster/20221108/1661225011.jpg,https://javct.net/v/sprd-835-sub,120,2026-06-19
GVG-805-RM,A Diary Of Elder Sister R**e Miki Sanada [Uncensored L**ked],https://pic.javct.net/poster/20221202/1648571277.jpg,https://javct.net/v/gvg-805-rm,134,2026-06-19
JUY-345-RM,"I Was In The Hospital And When I Asked My Auntie Who Works There To Help Me With My Rock Hard Cock, And She Secretly Decided To Service Me... Eriko Miura [Uncensored L**ked]",https://pic.javct.net/poster/20221904/1651453182.jpg,https://javct.net/v/juy-345-rm,120,2026-06-19
MCSR-260-RM,"*Bonus For Streaming Editions * F, Father, Please Stop It... My Stepson Is My Rival In Love She Is Secretly Fucking Her Father-In-Law Behind Her Husband's Back A Super Horny Sadistic Stepdaddy NTR Fakecest [Uncensored L**ked]",https://pic.javct.net/poster/20220707/1658193104.jpg,https://javct.net/v/mcsr-260-rm,159,2026-06-19
ROYD-075-RM,Sex Life Together with Your Too Vulnerable Big-Titted Younger Stepsister in an Extremely Cramped Studio Apartment With No Place to Look Away. Mei Satsuki [Uncensored L**ked],https://pic.javct.net/poster/20212709/1637307416.jpg,https://javct.net/v/royd-075-rm,124,2026-06-19
NSFS-007-SUB,Mature Stepmother 12  The Stepson Who Loved His Stepmother  Yuri Tadokoro [English Subtitle],https://static.javct.net/poster/nsfs-007.jpg,https://javct.net/v/nsfs-007-sub,116,2026-06-19
VENU-169-RM,Fakecest with My Hot Ass Mother Miki Sato [Uncensored L**ked],https://pic.javct.net/poster/20220707/1657755619.jpg,https://javct.net/v/venu-169-rm,81,2026-06-19
VENX-047-RM,"Stepmom Tempts Her Stepson Whith Whispers, So His Father Does Not Notice - Chitose Yuki [Uncensored L**ked]",https://static.javct.net/poster/1623493447.jpg,https://javct.net/v/venx-047-rm,116,2026-06-19
RTP-104-RM,"I Live Alone, And My Little Sister Came Over To Spend The Night We Hadn't Slept Next To Each Other In 10 Years, But When She Turned Over, I Could See Her Plump Titties! I Couldn't Resist, So I Secretly Started Masturbation, But When She Came Up From Behind And Whispered, ""You Were Jacking Off To My Tits, Weren't You...?"" And Then She Grabbed My Cock... [Uncensored L**ked]",https://pic.javct.net/poster/20212709/1635834935.jpg,https://javct.net/v/rtp-104-rm,125,2026-06-19
SPRD-801-RM,Ultra Authentic Carnal Fakecest Illustrated - Mother Massaged By Her Own Son Yoshie Mizuno [Uncensored L**ked],https://pic.javct.net/poster/20221108/1662965131.jpg,https://javct.net/v/sprd-801-rm,120,2026-06-19
