code,title,image_url,page_url,views,date_scraped
SNIS-262-RM,Shaved My Usami Of Shyness [Uncensored L**ked],https://pic.javct.net/poster/05192026/603923ccba.jpg,https://javct.net/v/snis-262-rm,150,2026-06-08
SOE-927,Aika Rookie Debut AV 乃 Dream NO.1 STYLE,https://pic.javct.net/poster/05192026/28fd7e8a82.jpg,https://javct.net/v/soe-927,120,2026-06-08
SIMW-008,Yumi & Ruka,https://pic.javct.net/poster/05192026/3aa8abab15.jpg,https://javct.net/v/simw-008,79,2026-06-08
NSPS-145-RM,Mother And Daughter Are Two Live-in Lover Netora The Ultimate Swap [Uncensored L**ked],https://pic.javct.net/poster/20233001/1676843314.jpg,https://javct.net/v/nsps-145-rm,88,2026-06-08
FOCS-072-RM,Debut Of A Young Lady With One New Experience-The Day When A Boxed Girl Awakens To Sexual Pleasure-Sara Yoshiki [Uncensored L**ked],https://pic.javct.net/poster/20220406/1655447639.jpg,https://javct.net/v/focs-072-rm,120,2026-06-08
SOE-241-RM,Akiho Yoshizawa In Vagina Woman Go Risky Mosaic [Uncensored L**ked],https://pic.javct.net/poster/05192026/c88161e968.jpg,https://javct.net/v/soe-241-rm,120,2026-06-08
NHDTB-797-RM,Raw Slut Group 6 Girls ○ Raw SP [Uncensored L**ked],https://pic.javct.net/poster/20230206/1687232028.jpg,https://javct.net/v/nhdtb-797-rm,185,2026-06-08
NSPS-144-RM,Do Whatever You Want To Realize The Dream Of Middle-aged Man Sex! Man And Woman Exist Without Special Edition [Uncensored L**ked],https://pic.javct.net/poster/20233001/1676843254.jpg,https://javct.net/v/nsps-144-rm,91,2026-06-08
REXD-473-RM,"Shibuya Hana, The Female Security Guard At The Underground Idol Handshake Event [Uncensored L**ked]",https://pic.javct.net/poster/20230206/1687494016.jpg,https://javct.net/v/rexd-473-rm,120,2026-06-08
GOJU-236-RM,Squirting Joba Joba Wife In Gotanda Asano 45 Years Old [Uncensored L**ked],https://pic.javct.net/poster/20230207/1688526775.jpg,https://javct.net/v/goju-236-rm,133,2026-06-08
CEMD-853-RM,"What Happens When You Get ""Kurosaki Hana"" Seriously Drunk? ~ A Real Sex Documentary Of Uncontrolled Sexual Desire [Uncensored L**ked]",https://pic.javct.net/poster/05192026/d33a6a3515.jpg,https://javct.net/v/cemd-853-rm,119,2026-06-08
JURA-70-RM,"First Shooting Married Woman, Again. Ichika Tokiwa [Uncensored L**ked]",https://pic.javct.net/poster/20230206/1688008343.jpg,https://javct.net/v/jura-70-rm,105,2026-06-08
FC2PPV-4916927,"[No] Black 3P party on the day of birthday Reina, a cute foreign office lady with outstanding charm Chapter 6: Intense 3P with 2 big cock black people on her birthday, to**ured to the limit and creampied 2 times in a row [Overseas version] Bonus included",https://pic.javct.net/poster/05192026/d8d5b87191.jpg,https://javct.net/v/fc2ppv-4916927,71,2026-06-08
AGAV-167-RM,"Multiple Loads Of Thick, Rich Semen From An Older Man Are Stored Inside Her Vagina! Nanase Honoka, The Woman Who Begs To Be Impregnated, Allows Herself To Be Filmed Getting Cummed Inside. [Uncensored L**ked]",https://pic.javct.net/poster/05192026/d5a9ae333f.jpg,https://javct.net/v/agav-167-rm,128,2026-06-08
TCD-334,"Newhalf - Tears, Nonstop, Intense Anal Sex 4 Mel",https://pic.javct.net/poster/05192026/e4f1fab783.jpg,https://javct.net/v/tcd-334,126,2026-06-08
HUNTC-428-RM,"""Bring Home A New, Healthy Cock Quickly! Otherwise, I'll Eat Your Pussy!"" I'm Fo**ed To Bring Home Men For My Sexually Insatiable Roommate. My Cute And Kind Roommate Has An Abnormally High Sex Drive! If I Don't Bring A Man Home Every Day, I'll Either Get Attacked Or My Boyfriend Will... [Uncensored L**ked]",https://pic.javct.net/poster/05192026/15437c5897.jpg,https://javct.net/v/huntc-428-rm,160,2026-06-08
XV-494-RM,Dirty Mouth Sayo Koi [Uncensored L**ked],https://pic.javct.net/poster/05192026/b1e4ae4d92.jpg,https://javct.net/v/xv-494-rm,120,2026-06-08
CESD-414-RM,I Tried Experimenting To Brainwash And Become Compliant 3 Aso Nozomi [Uncensored L**ked],https://pic.javct.net/poster/05192026/3f15728eb7.jpg,https://javct.net/v/cesd-414-rm,148,2026-06-08
JURA-69-RM,"First Shot Fifty Wife, Again. Aika Hayashi [Uncensored L**ked]",https://pic.javct.net/poster/20230206/1688008407.jpg,https://javct.net/v/jura-69-rm,115,2026-06-08
MXGS-171-RM,Female Teacher Akiho Yoshizawa M De Nasty Was Crime Spree [Uncensored L**ked],https://pic.javct.net/poster/05192026/8276acd178.jpg,https://javct.net/v/mxgs-171-rm,120,2026-06-08
REAL-643,Extreme Anal Hell Cum Inside Out,https://pic.javct.net/poster/05192026/8ef0cfc8a8.jpg,https://javct.net/v/real-643,140,2026-06-08
HUNTC-583-RM,"“I want to have sex with anyone today! *Voice from my heart” “I’m dying to have sex because it’s before my period!” *Voice of my heart"" ""I like big dicks, right? *Voice of my heart"" I have become able to understand the bitchy inner voices that I hear from my female classmates and female teachers, and now I can easily attract high-level girls...2 [Uncensored L**ked]",https://pic.javct.net/poster/05192026/18b6846cd1.jpg,https://javct.net/v/huntc-583-rm,221,2026-06-08
HSODA-126-RM,"School-mandated Obscenity Measurement. During Uniform Measurements, You Can Freely Play Naughty Tricks On Innocent Girls' Naughty Bodies!? [Uncensored L**ked]",https://pic.javct.net/poster/05192026/4c51faf593.jpg,https://javct.net/v/hsoda-126-rm,200,2026-06-08
EBOD-510,Ma ● Co!Anal!Nuqui Inserted!Whole Large Public! !The Ultimate Shame To Keep The Spotlight Of The Transformation The Population! !Naked Production Mana Plate Show From Morning Till Night Mayu Suzuki,https://pic.javct.net/poster/05192026/d3ab5d2bfd.jpg,https://javct.net/v/ebod-510,120,2026-06-08
