code,title,image_url,page_url,views,date_scraped
BTH-353-RM,It seems to me that the cold poisonous wife is a female pig who is highly rated in that area and is worth training. Satsuki Kirioka [Uncensored L**ked],https://pic.javct.net/poster/05192026/9d977d4efb.jpg,https://javct.net/v/bth-353-rm,47,2026-06-13
SRS-063-RM,Amateur Hunter 2 · 44 [Uncensored L**ked],https://pic.javct.net/poster/05192026/34e429c3ac.jpg,https://javct.net/v/srs-063-rm,135,2026-06-13
MIDA-663-RM,Acme Awakening Intensive Training 4 Main Events: Gorgeous And Cute Young Lady Imprisoned In A Dick Training Camp Nonstop 24-Hour FUCK - Mayu Misaki [Uncensored L**ked],https://pic.javct.net/poster/05192026/1af747fa3f.jpg,https://javct.net/v/mida-663-rm,170,2026-06-13
GVH-855,"We Were Dr**ged With Aphrodisiacs By Crazy Fans And Reduced To Two Ecstatic, Fleshy Sex Toys That Anyone Can Use On Us... Akari Niimura / Tsukasa Hibiki",https://pic.javct.net/poster/05192026/22e0e0ea43.jpg,https://javct.net/v/gvh-855,160,2026-06-13
ATYA-043,"Lusty Wife, Too Carnivorous To Satisfy Her Husband Alone, Cheats On Him Following Her Instincts... Intense Mating With Perverted, Virile Older Men - Sayaka Tomoda",https://pic.javct.net/poster/05192026/c34725c8d0.jpg,https://javct.net/v/atya-043,120,2026-06-13
NVH-081,Supernova Newhalf AV Debut Asahina Kou,https://pic.javct.net/poster/05192026/588401f950.jpg,https://javct.net/v/nvh-081,180,2026-06-13
MIDA-676-RM,"Arching Back Like A Shrimp! 703 Orgasms, 8215 Convulsions, 5809cc Of Cum, Orgasm Special, Abstinence Orgasm, Teased For A Month, 24 Hours Straight Of Big Dick FUCK, Chiharu Okui [Uncensored L**ked]",https://pic.javct.net/poster/05192026/a644bd2434.jpg,https://javct.net/v/mida-676-rm,120,2026-06-13
MRSS-188,"In This Corrupt Village, Unable To Bear A C**ld For My Beloved Wife, I Could Not Resist The Corrupt Customs Of The Village And Could Only Watch In Silence As She Was Impregnated By Men. - Shiori Imoto",https://pic.javct.net/poster/05192026/403469f8cd.jpg,https://javct.net/v/mrss-188,129,2026-06-13
FSTU-030,Lewd Bikini Black Acme Aina Ai,https://pic.javct.net/poster/05192026/482b6d3ba7.jpg,https://javct.net/v/fstu-030,113,2026-06-13
MNGS-062-RM,"S-class Slender Beauty Sora Amakawa Is Showcased In Stunning Visuals (recorded With 4K Equipment). After Years Of Abstinence, She Devours Male Actors As She Pleases, Becoming A Lusty Slut In 6 Segments With 14 Cumshots And Milking In This Special. [Uncensored L**ked]",https://pic.javct.net/poster/05192026/3ab6a2ff13.jpg,https://javct.net/v/mngs-062-rm,220,2026-06-13
SOAN-084-RM,A Mother Who Is Camping With Her Family Is Going To Live With Two Holes Today... A Real Apt Amateur Wife Who Appeared Without Permission Thinking Of Her Husband's Proclivity To Cuckold Yui Kawagoe (a Pseudonym) 29-year-old Shimobe Hot Spring Miscon Runner-up 29-year-old Cuckold Anal Consent [Uncensored L**ked],https://pic.javct.net/poster/20222109/1664602441.jpg,https://javct.net/v/soan-084-rm,157,2026-06-13
PRED-867-RM,I'm So Pissed That Izumi Is Going To Marry The Guy I Like! So... I'm Going To R**e Her And Cum Inside Her And Ruin Her Life! Yukimura Izumi [Uncensored L**ked],https://pic.javct.net/poster/05192026/f1159171de.jpg,https://javct.net/v/pred-867-rm,150,2026-06-13
SOAN-083-RM,"I Wanted To Fulfill My Younger Husband's Selfish NTR...I'm Going To Sleep In Two Holes From Monday...A Real Amateur Wife Who Appeared Without Permission Thinking Of Her Husband's Habit Of Cuckolding, Full-time Housewife Hotaru Mori (a Pseudonym) Cuckolding Anal Consent [Uncensored L**ked]",https://pic.javct.net/poster/20221108/1663390105.jpg,https://javct.net/v/soan-083-rm,170,2026-06-13
AWAW-024,"Girls Cheating On Each Other. Gen Z College Couples Having A House Party And Cheating. They Don't Care If They Get Caught And Continue Their Friendly Orgy, Cumming Inside Each Other!",https://pic.javct.net/poster/05192026/5d0f439d22.jpg,https://javct.net/v/awaw-024,86,2026-06-13
XVSR-309,Kirishima Sakura VS Eikawa 川 ノ Big Breasts Battle Royale ~ Non Stop Document ~,https://pic.javct.net/poster/05192026/f476f0e42e.jpg,https://javct.net/v/xvsr-309,120,2026-06-13
MVSD-695,"A Masochistic Wife Of The Upper Class, Fo**ed To Repay The Debt Of Her Vanished Husband With Her Body, Is Dragged Into A Hell Of Depravity. Imprisoned And Ab**ed Day After Day By Scumbag Men, Her Beautiful Naked Body Discovers The Pleasure Of Masochistic Orgasms. - Harumi Kyomoto",https://pic.javct.net/poster/05192026/0c35a6a264.jpg,https://javct.net/v/mvsd-695,150,2026-06-13
MUFR-008,I'm A Female Otaku Of Underground Idols. The Day I Crossed The Line With Just A Female Friend. ~I Was More Into My Close Female Friend Who Was Also A Fan Of The Same Idol Than The Idol I Was Supporting.~,https://pic.javct.net/poster/05192026/e92f50dadd.jpg,https://javct.net/v/mufr-008,140,2026-06-13
PPPE-419-RM,"""You Were Making Fun Of Us, Weren't You?"" The Grudge Of A Creepy Teacher Who Is Repulsive To Everyone... Silent Gangbang Instruction In A School Where Making Noise Is Strictly Forbidden. Gal Defeated And Taught A Lesson By A Cock With 12 Ejaculations. Karen Yuzuriha [Uncensored L**ked]",https://pic.javct.net/poster/05192026/5da1162a66.jpg,https://javct.net/v/pppe-419-rm,120,2026-06-13
BGN-042-RM,Rookie Prestige Exclusive Debut Mio Hinata [Uncensored L**ked],https://pic.javct.net/poster/05192026/a7c7ac4564.jpg,https://javct.net/v/bgn-042-rm,210,2026-06-13
DVDMS-957-RM,"Appearance MM No. Only Close Female Friends The Magic Mirror A Pair Of Female College Students Challenge The ""Virgin Brush Dropping Escape Game""! 2 Harlem 3P Of 2 JDs Who Got Excited About Virgin Cocks Who Were Shy But Shy And Scrambled For Dicks! The Last Is W Raw Vaginal Cum Shot! [Uncensored L**ked]",https://pic.javct.net/poster/20230206/1685693839.jpg,https://javct.net/v/dvdms-957-rm,240,2026-06-13
HODV-21606-RM,Ultimate Masochist Wants To Be Trained So Pain Makes Her Cum. Kana Tanaka [Uncensored L**ked],https://pic.javct.net/poster/20212308/1630841975.jpg,https://javct.net/v/hodv-21606-rm,128,2026-06-13
SUN-089-RM,Pissing Exposure L**kage Marking Date To Leave A Record In The Exposed Place Rio (24) [Uncensored L**ked],https://pic.javct.net/poster/20230206/1687058371.jpg,https://javct.net/v/sun-089-rm,127,2026-06-13
SRS-060-RM,Bimbo Document Runa-chan (21) 3-year University Faculty Of Education File.03 [Uncensored L**ked],https://pic.javct.net/poster/05192026/485dd355d0.jpg,https://javct.net/v/srs-060-rm,135,2026-06-13
328CNSTV-007-RM,"""An easy job that will get you fired up'' Introducing a simple part-time job to poor housewives who are struggling with living expenses due to the prolonged recession. [Uncensored L**ked]",https://pic.javct.net/poster/05192026/513dcb8049.jpg,https://javct.net/v/328cnstv-007-rm,125,2026-06-13
