code,title,image_url,page_url,views,date_scraped
NUBI-076-RM,Business Trip Men's Este Behind Op Hidden Shooting 6 Raw Blow Production Service Without Telling The Store Manager [Uncensored L**ked],https://pic.javct.net/poster/20230206/1687943189.jpg,https://javct.net/v/nubi-076-rm,133,2026-06-07
JUR-691-RM,"A Fleeting Glimpse Of Her Revealing Cleavage Shatters All Reason. Instant Sex With A Married Woman In An Overly Provocative, Loose-fitting Bra. [Uncensored L**ked]",https://pic.javct.net/poster/05192026/504f208d7c.jpg,https://javct.net/v/jur-691-rm,130,2026-06-07
DANDY-865-RM,"""Even If I Have C**ldren, I Still Want To Fall In Love..."" Yaritin Nursery Teacher Invites Kindergartener Moms Who Are Easier To Orgasm After Giving Birth To Drinking Sex At Home From Daytime VOL.1 [Complete Voyeur Angle Ver.] [Uncensored L**ked]",https://pic.javct.net/poster/20230206/1688255713.jpg,https://javct.net/v/dandy-865-rm,238,2026-06-07
200GANA-3403,"The moment we met at the bar, I was convinced we were going to have sex lol Active nurse Yuu is 22 years old, shaking her G cup and having fun at her first home drinking session.In the room of a seasoned pick-up artist, she is taken in and secretly filmed for sex 441",https://pic.javct.net/poster/05192026/3cfe1d2c0d.jpg,https://javct.net/v/200gana-3403,50,2026-06-07
CLUB-857-RM,"Busty Bikini Slut Beauty Salon That Seduces With Tiny Swimsuits, Twists And Turns Nipples, And Makes Them Cum Inside Raw [Uncensored L**ked]",https://pic.javct.net/poster/20241115/1732854944.jpg,https://javct.net/v/club-857-rm,220,2026-06-07
STSK-227-RM,"Betrayal And NTR Behind Your Best Friend's Back! Male Friendship Vs. Lust!? After A Drinking Party, He Misses The Last Train And Lets His Best Friend's Girlfriend Stay Over, Resulting In NTR Footage! Fueled By Alcohol And The Mood, They End Up Having Sex, And Their Physical Chemistry Is Amazing, Leading To A Decadent, Unprotected Sex Session Until Morning! A Woman Who Betrays Her Boyfriend X A Man Who Betrays His Best Friend [Uncensored L**ked]",https://pic.javct.net/poster/05192026/0728c9a388.jpg,https://javct.net/v/stsk-227-rm,226,2026-06-07
FUFU-027-RM,I Asked The Masseuse To The Familiar Erogenous In Secret To His Wife Chaste C**ld Annals Of C**ld ... T (38) R (24) [Uncensored L**ked],https://pic.javct.net/poster/05192026/c084d869a6.jpg,https://javct.net/v/fufu-027-rm,90,2026-06-07
HODV-21612-SUB,Female Fuck Buddy That Is Just Perfect. 8.5 Head To Toe With Luscious G-cup Tits On This Gal. Sarina Momonaga [English Subtitle],https://pic.javct.net/poster/20212709/1633176332.jpg,https://javct.net/v/hodv-21612-sub,149,2026-06-07
JJPP-164,This Is A DVD That Takes A Voyeur Of How A Handsome Man Brings A Mature Woman Into A Room And Brings It To SEX. 153 ~ I Forcibly Vaginal Cum Shot As It Is ~,https://pic.javct.net/poster/05192026/0629915a55.jpg,https://javct.net/v/jjpp-164,130,2026-06-07
JJPP-160,A DVD That Takes A Voyeur Of How A Handsome Man Brings A Mature Woman Into A Room And Brings It To SEX. 149 ~ I Forcibly Vaginal Cum Shot As It Is ~,https://pic.javct.net/poster/05192026/4bbdd1b225.jpg,https://javct.net/v/jjpp-160,125,2026-06-07
JUR-691,"A Fleeting Glimpse Of Her Revealing Cleavage Shatters All Reason. Instant Sex With A Married Woman In An Overly Provocative, Loose-fitting Bra.",https://pic.javct.net/poster/05192026/504f208d7c.jpg,https://javct.net/v/jur-691,130,2026-06-07
MIST-097-RM,Celebrity Wife Who Kayoitsumeru Women For Sex! Full Voyeur Luxury Secret Shop Drowning In Pleasure In The Aphrodisiac Este [Uncensored L**ked],https://pic.javct.net/poster/05192026/1bb125e35a.jpg,https://javct.net/v/mist-097-rm,160,2026-06-07
AVZG-046-RM,Voyeur beauty salon! Currently being distributed without permission! ! Big breasted sisters Emiri & Yu [Uncensored L**ked],https://pic.javct.net/poster/05192026/9574025f68.jpg,https://javct.net/v/avzg-046-rm,119,2026-06-07
STSK-227,"Betrayal And NTR Behind Your Best Friend's Back! Male Friendship Vs. Lust!? After A Drinking Party, He Misses The Last Train And Lets His Best Friend's Girlfriend Stay Over, Resulting In NTR Footage! Fueled By Alcohol And The Mood, They End Up Having Sex, And Their Physical Chemistry Is Amazing, Leading To A Decadent, Unprotected Sex Session Until Morning! A Woman Who Betrays Her Boyfriend X A Man Who Betrays His Best Friend",https://pic.javct.net/poster/05192026/0728c9a388.jpg,https://javct.net/v/stsk-227,226,2026-06-07
STSK-228,Desperate Situation! Heroine In Peril! The Captured Pink Ranger - The Person Inside The Suit For The Sentai Hero Show,https://pic.javct.net/poster/05192026/27868d22e4.jpg,https://javct.net/v/stsk-228,196,2026-06-07
HODV-21596-RM,I Filmed An AV! A Convenient Devilish Little Slut With G-cup Breasts - Yuka Hoshi [Uncensored L**ked],https://static.javct.net/poster/hodv-21596.jpg,https://javct.net/v/hodv-21596-rm,149,2026-06-07
JJPP-152,A DVD That Shows How A Handsome Man Brings A Mature Woman Into A Room And Brings It To SEX. 141 ~ I Forcibly Cummed Out ~,https://pic.javct.net/poster/05192026/9d2ea07411.jpg,https://javct.net/v/jjpp-152,125,2026-06-07
JJPP-150,A DVD That Shows How A Handsome Man Brings A Mature Woman Into A Room And Brings It To SEX. 139 ~ I Forcibly Cummed Out As It Is ~,https://pic.javct.net/poster/05192026/6f75512af6.jpg,https://javct.net/v/jjpp-150,120,2026-06-07
JJPP-151,A DVD That Shows How A Handsome Man Brings A Mature Woman Into A Room And Brings It To SEX. 140 ~ I Forcibly Cum Inside Out ~,https://pic.javct.net/poster/05192026/620df70bd1.jpg,https://javct.net/v/jjpp-151,120,2026-06-07
JJPP-146,A DVD That Voyeurs How A Handsome Guy Brings A Mature Woman To The Room And Brings It To SEX. 135 ~ I've Forcibly Pushed It Out ~,https://pic.javct.net/poster/05192026/eb4a667aba.jpg,https://javct.net/v/jjpp-146,125,2026-06-07
JJPP-145,A DVD That Voyeurs How A Handsome Guy Brings A Mature Woman To The Room And Brings It To SEX. 134 ~ I've Forcibly Cummed Out As It Is ~,https://pic.javct.net/poster/05192026/7bb0e308ba.jpg,https://javct.net/v/jjpp-145,120,2026-06-07
JJPP-153,A DVD That Shows How A Handsome Man Brings A Mature Woman Into A Room And Brings It To SEX. 142 ~ I Forcibly Cum Inside ~,https://pic.javct.net/poster/05192026/c471cdb2af.jpg,https://javct.net/v/jjpp-153,125,2026-06-07
JJPP-148,A DVD That Shows A Handsome Guy Taking A Mature Woman Into A Room And Bringing It To SEX. 137 ~ I Forcibly Cummed Out As It Is ~,https://pic.javct.net/poster/05192026/ff3631734a.jpg,https://javct.net/v/jjpp-148,125,2026-06-07
JJPP-144,A DVD That Voyeurs How A Handsome Guy Brings A Mature Woman To The Room And Brings It To SEX. 133 ~ I've Forcibly Cummed Out As It Is ~,https://pic.javct.net/poster/05192026/b19a1720d7.jpg,https://javct.net/v/jjpp-144,115,2026-06-07
