code,title,size,image_url,torrent_url,tags,actresses,date,page_url
FC2PPV4911951,FC2-PPV-4911951 【厳選美女】『Gカップ超美形ハーフモデル』人生初のピル無し子宮直撃生中出し。限定公開秘蔵映像。,2.1 GB,https://contents-thumbnail2.fc2.com/w1280/storage201000.contents.fc2.com/file/393/39269224/1780306448.88.jpg,https://onejav.com/torrent/fc2ppv4911951/download/17002282/onejav.com_fc2ppv4911951.torrent,"Amateur, Beautiful Girl, Big Tits, Blow, Breasts, Close Up, Creampie, FC2, POV, Slender",,2026-06-02,https://onejav.com/torrent/fc2ppv4911951
FC2PPV4909987,FC2-PPV-4909987 70％OFF【顔射】関西S級美人の再来。この顔面でGカップモデル体型は反則です。顔射で汚れる姿に勃起不可避でシタ。,2.8 GB,https://contents-thumbnail2.fc2.com/w1280/storage200000.contents.fc2.com/file/385/38454154/1780041834.83.jpg,https://onejav.com/torrent/fc2ppv4909987/download/62291698/onejav.com_fc2ppv4909987.torrent,"Amateur, Creampie, Facials, FC2, POV, Uncensored",,2026-06-02,https://onejav.com/torrent/fc2ppv4909987
300MIUM1364,エグい量の潮吹きしちゃう美少女JDww【愛嬌抜群アニメ声】【巨乳美尻の完璧ビジュ】性欲が限界突破してグッチョグチョ！家中に潮を撒き散らす痴態ぶり！！【ムラムラしたら、U●●rPenisでいーんじゃない？】,2.8 GB,https://image.mgstage.com/images/prestigepremium/300mium/1364/pb_e_300mium-1364.jpg,https://onejav.com/torrent/300mium1364/download/45854947/onejav.com_300mium1364.torrent,"Amateur, Big Tits, Butt, Female College Student, Planning, POV",,2026-06-02,https://onejav.com/torrent/300mium1364
START582,初ソープ研修 SOD新卒3年目シャカリキ奮闘ご奉仕 こあくまつなが発動！？アニメ声の気持ちよさにヤラレちまいなSP 松永あかり,7.0 GB,https://pics.dmm.co.jp/mono/movie/adult/1start582/1start582pl.jpg,https://onejav.com/torrent/start582/download/15108134/onejav.com_start582.torrent,"Big Tits, Lotion, OL, Prostitutes, Soapland","松永あかり, 岬さくら",2026-06-02,https://onejav.com/torrent/start582
START550,付き合ったばかりのるいと始めた丁寧な暮らし 時にはスローに時には情熱的に絶倫彼女に翻弄されるセックスライフ 一宮るい,5.9 GB,https://pics.dmm.co.jp/mono/movie/adult/1start550/1start550pl.jpg,https://onejav.com/torrent/start550/download/69873957/onejav.com_start550.torrent,"Breasts, Couple, Drama, Slender, Solowork",一宮るい,2026-06-02,https://onejav.com/torrent/start550
FC2PPV4910750,FC2-PPV-4910750 【合計３発射】意中のオトコにフラれてイメチェンしてきた魅惑の色白美巨乳ボディ。溜まった性欲を発散させるお泊りデート。,10.6 GB,https://contents-thumbnail2.fc2.com/w1280/storage200000.contents.fc2.com/file/286/28519270/1780360515.2.jpg,https://onejav.com/torrent/fc2ppv4910750/download/15471464/onejav.com_fc2ppv4910750.torrent,"Amateur, Creampie, FC2, POV, Uniform",,2026-06-02,https://onejav.com/torrent/fc2ppv4910750
FC2PPV4909701,FC2-PPV-4909701 【二週間50%OFF】【6連発射】スレンダーな美人音大生。複数の巨根を唾液たっぷりしゃぶり回して発情、中出し直後の連続生ハメ＆顔射で絶頂に連発！,4.1 GB,https://contents-thumbnail2.fc2.com/w1280/storage200000.contents.fc2.com/file/373/37213813/1780301315.42.png,https://onejav.com/torrent/fc2ppv4909701/download/22113260/onejav.com_fc2ppv4909701.torrent,"Amateur, Beautiful Girl, Blow, FC2, POV, Uncensored",,2026-06-02,https://onejav.com/torrent/fc2ppv4909701
FC2PPV4911585,FC2-PPV-4911585 『今のみ大特別価格』『完全顔出し』ハメ撮り用語知らない年代の女性はEカップだと逆にモテないみたい、、、ハメ撮り初体験してみて興奮してたと実際に言っていたのでマッサージしてあげたら気持ちよさそうだった,2.0 GB,https://contents-thumbnail2.fc2.com/w1280/storage201000.contents.fc2.com/file/410/40970911/1780269219.33.jpg,https://onejav.com/torrent/fc2ppv4911585/download/23837215/onejav.com_fc2ppv4911585.torrent,"Amateur, Beautiful Girl, Creampie, FC2, POV, Uncensored",,2026-06-02,https://onejav.com/torrent/fc2ppv4911585
200GANA3398,顔小っちゃ！スタイル良！！これが令和ギャルのガチイキS●Xだ！！ マジ軟派、初撮。 2304,2.9 GB,https://image.mgstage.com/images/nanpatv/200gana/3398/pb_e_200gana-3398.jpg,https://onejav.com/torrent/200gana3398/download/68532506/onejav.com_200gana3398.torrent,"Amateur, Beautiful legs, Nampa, Slut",,2026-06-02,https://onejav.com/torrent/200gana3398
FNS223,禁欲解放ドキュメント30日間のセックス＆オナニー禁止で高まりきった性欲を120分でブチ上げ発散し尽くすケダモノSEX 浜辺やよい,6.3 GB,https://faleno.jp/top/wp-content/uploads/2026/05/FNS-223_1200.jpg?output-quality=60,https://onejav.com/torrent/fns223/download/75983968/onejav.com_fns223.torrent,,浜辺やよい,2026-06-02,https://onejav.com/torrent/fns223
