code,title,size,image_url,torrent_url,tags,actresses,date,page_url
200GANA3392,【これぞワンナイト×アロマなおねぇさん】寂しさにつけ込み、相談に乗ってあげるフリ。可愛いケツのクイコミにぶちこみ、ソウルジ◯ムも濁っちゃう！ マジ軟派、初撮。 2309,2.5 GB,https://image.mgstage.com/images/nanpatv/200gana/3392/pb_e_200gana-3392.jpg,https://onejav.com/torrent/200gana3392/download/76800873/onejav.com_200gana3392.torrent,"Amateur, Butt, Nampa, Older Sister, Slender",,2026-06-15,https://onejav.com/torrent/200gana3392
FC2PPV4920874,FC2-PPV-4920874 ♡６/21日迄半額・新企画第二弾【無・完全素人】授業に集中できないくらいHなことで頭がいっぱいの19歳JD。陥没おっぱいを吸われ、うぶな肉体をおじさんに貪られ、ひぃ～ひぃ～悶えて、ぶっといち〇ぽでイカ,5.7 GB,https://contents-thumbnail2.fc2.com/w1280/storage201000.contents.fc2.com/file/392/39182810/1781402197.58.jpg,https://onejav.com/torrent/fc2ppv4920874/download/73016310/onejav.com_fc2ppv4920874.torrent,"Amateur, Anal, Back, Big Tits, Blow, Breasts, Cowgirl, Cunnilingus, Egg Vibrator, FC2, POV, Uncensored, Vibe",,2026-06-15,https://onejav.com/torrent/fc2ppv4920874
ANKB043,男の顔を見つめながらイク早漏ドM全身性感帯ビッチ,5.3 GB,https://pics.dmm.co.jp/mono/movie/adult/ankb043/ankb043pl.jpg,https://onejav.com/torrent/ankb043/download/65677741/onejav.com_ankb043.torrent,"Big Tits, Creampie, Facials, Hot Spring, Titty Fuck",,2026-06-15,https://onejav.com/torrent/ankb043
390JAC238,【3週間ご無沙汰のグラマラスJカップ！！ワールドクラスな爆乳ハーフギャルの早漏マ●コに連続ナマ中出しっ！！】  【ギャルしべ長者108人目 えみりちゃん】,4.8 GB,https://image.mgstage.com/images/jackson/390jac/238/pb_e_390jac-238.jpg,https://onejav.com/torrent/390jac238/download/95562371/onejav.com_390jac238.torrent,"Amateur, Big Tits, Creampie, Gal, Squirting, Titty Fuck",,2026-06-15,https://onejav.com/torrent/390jac238
FC2PPV4919927,FC2-PPV-4919927 ♀223 笑顔あふれる元気っこのおまんこはチョー気持ちよくて中だししちゃった ウォシュレット型アナル舐めと膣内カメラも！★特典で無修正と膣内カメラ,5.5 GB,https://contents-thumbnail2.fc2.com/w1280/storage200000.contents.fc2.com/file/376/37547480/1781235698.32.jpg,https://onejav.com/torrent/fc2ppv4919927/download/44526442/onejav.com_fc2ppv4919927.torrent,"Amateur, Creampie, FC2, Petite, Uncensored",,2026-06-15,https://onejav.com/torrent/fc2ppv4919927
FC2PPV4920948,FC2-PPV-4920948 友達の奥さんとお泊りセックスしました IMEDAMAFC2,4.2 GB,https://contents-thumbnail2.fc2.com/w1280/storage201000.contents.fc2.com/file/390/38979124/1781417410.01.gif,https://onejav.com/torrent/fc2ppv4920948/download/77189336/onejav.com_fc2ppv4920948.torrent,"Amateur, Date, FC2, Married Woman, POV",,2026-06-15,https://onejav.com/torrent/fc2ppv4920948
FC2PPV4920861,FC2-PPV-4920861 【駅弁・アマゾン・イラマ】【70%OFF】美乳・美尻の黒髪美女とデカチン黒人巨根で破壊して、生中出し孕ませ分からせSEXしてきた！,3.1 GB,https://contents-thumbnail2.fc2.com/w1280/storage201000.contents.fc2.com/file/372/37151217/1781424970.98.jpeg,https://onejav.com/torrent/fc2ppv4920861/download/80110005/onejav.com_fc2ppv4920861.torrent,"Amateur, Beautiful Girl, Blow, Butt, Conceived, Creampie, FC2, POV",,2026-06-15,https://onejav.com/torrent/fc2ppv4920861
FC2PPV4921059,FC2-PPV-4921059 本当に可愛くて、美乳・美尻のOLさらちゃんを黒人上司がホテルに呼び出し、分からせ生中出し孕ませSEXしてきた！【海外版】特典付,4.0 GB,https://contents-thumbnail2.fc2.com/w1280/storage200000.contents.fc2.com/file/402/40198932/1781436769.3.jpg,https://onejav.com/torrent/fc2ppv4921059/download/32519622/onejav.com_fc2ppv4921059.torrent,"Amateur, Beautiful Girl, Blow, Breasts, Butt, Creampie, FC2, OL, Pregnant, Slender, Titty Fuck",,2026-06-15,https://onejav.com/torrent/fc2ppv4921059
TIKB221,爆乳肉感レイヤーのオフパコ中出し撮影会に潜入！性欲剥き出しチ○ポ中毒,5.8 GB,https://pics.dmm.co.jp/mono/movie/adult/tikb221/tikb221pl.jpg,https://onejav.com/torrent/tikb221/download/53865931/onejav.com_tikb221.torrent,"Big Tits, Cosplay, Creampie, Huge Butt, Squirting",,2026-06-15,https://onejav.com/torrent/tikb221
NPS473,ガチナンパ！ 姉弟で野球拳！ 姉ちゃんで勃つかよwって強がっていた滅ボッキの弟！お互い発情した結果…22発！,14.1 GB,https://pics.dmm.co.jp/mono/movie/adult/h_021nps473/h_021nps473pl.jpg,https://onejav.com/torrent/nps473/download/78058363/onejav.com_nps473.torrent,"Amateur, Creampie, Incest, Nampa, Sister",,2026-06-15,https://onejav.com/torrent/nps473
