code,title,size,image_url,torrent_url,tags,actresses,date,page_url
FC2PPV4916037,FC2-PPV-4916037 【無修正】《3日間限定》清楚な⼥⼦⼤⽣がアナル舐めに初挑戦︕ チンぐりアナル舐め手コキで暴発不可避♥※未公開特典付き,6.2 GB,https://contents-thumbnail2.fc2.com/w1280/storage200000.contents.fc2.com/file/410/40976927/1780643970.08.jpg,https://onejav.com/torrent/fc2ppv4916037/download/97023967/onejav.com_fc2ppv4916037.torrent,"Amateur, Beautiful Girl, FC2, Female College Student, Slender, Uncensored",,2026-06-06,https://onejav.com/torrent/fc2ppv4916037
FC2PPV4901019,FC2-PPV-4901019 70％OFF【初撮り】１８歳！色白の初心ガール！愛くるしいカラダはクジラ体質。中出しでフィニッシュで大満足！！,6.7 GB,https://contents-thumbnail2.fc2.com/w1280/storage201000.contents.fc2.com/file/385/38454154/1778787056.76.jpg,https://onejav.com/torrent/fc2ppv4901019/download/34203584/onejav.com_fc2ppv4901019.torrent,"Amateur, Breasts, Butt, Creampie, Debut Production, FC2, POV, Shaved, Squirting, Uncensored",,2026-06-06,https://onejav.com/torrent/fc2ppv4901019
FNS216,悪徳セラピストに騙されて…オマ●コバカになるほどイカされまくるエビ反り潮吹き絶頂エステ 神喜ミア,6.4 GB,https://cdn.faleno.net/top/wp-content/uploads/2026/05/FNS-216_1200.jpg?output-quality=60,https://onejav.com/torrent/fns216/download/15482334/onejav.com_fns216.torrent,,神喜ミア,2026-06-06,https://onejav.com/torrent/fns216
FC2PPV4915846,FC2-PPV-4915846 【6/26迄1290pt】【初撮】【濃厚三発】Eカップ美乳アパレル店員。「帰っていいですか…？」ある条件込みで撮影成功。締まり強いぴちょマンコを叩き、愛液溢れる膣奥にしっかり中出し。,4.7 GB,https://contents-thumbnail2.fc2.com/w1280/storage105000.contents.fc2.com/file/370/36940995/1780649818.4.png,https://onejav.com/torrent/fc2ppv4915846/download/52787494/onejav.com_fc2ppv4915846.torrent,"Amateur, Blow, Breasts, Creampie, Cum, FC2, Uncensored",,2026-06-06,https://onejav.com/torrent/fc2ppv4915846
FC2PPV4915321,FC2-PPV-4915321 ♀221 色気むんむんのどへんたいせりかちゃんのイキっぷりがやばいｗ ウォシュレット型アナル舐めも！ ★特典で無修正,3.8 GB,https://contents-thumbnail2.fc2.com/w1280/storage201000.contents.fc2.com/file/376/37547480/1780585187.71.jpg,https://onejav.com/torrent/fc2ppv4915321/download/78824004/onejav.com_fc2ppv4915321.torrent,"Amateur, Creampie, FC2, Uncensored",,2026-06-06,https://onejav.com/torrent/fc2ppv4915321
FC2PPV4915289,FC2-PPV-4915289 すみれ(18)かわいいツインテールの３回目撮影。イラマとアナル舐めさせられ、膣に入れられた水をストローで飲まれてしまう。中出し、アナル貫通ATMもしています。,7.3 GB,https://contents-thumbnail2.fc2.com/w1280/storage200000.contents.fc2.com/file/261/26076760/1780580667.77.jpg,https://onejav.com/torrent/fc2ppv4915289/download/45469961/onejav.com_fc2ppv4915289.torrent,"Amateur, Anal, Beautiful Girl, Blow, Creampie, Deep Throating, FC2, Petite, Toy, Uncensored",,2026-06-06,https://onejav.com/torrent/fc2ppv4915289
HUNTC561,「えっ！？コレが実習？」スポーツインストラクター専門学校に入学したら男はボク1人！実習は体のライン丸分かりのエロ過ぎるピタ服女子と神密着！でハーレム乱交！,3.4 GB,https://pics.dmm.co.jp/mono/movie/adult/huntc561/huntc561pl.jpg,https://onejav.com/torrent/huntc561/download/71033855/onejav.com_huntc561.torrent,"Blow, Creampie, Handjob, Harem, Nasty, Hardcore",,2026-06-06,https://onejav.com/torrent/huntc561
FC2PPV4915947,FC2-PPV-4915947 ※再販修正版【限定復活】アイドル級美女ゆみちゃんと高級ホテルでお泊まりデート。優しい性格と極上の笑顔、さりげない仕草すべてが癒しをもたらす最高級美女。芸術的なスレンダーボディに興奮止まらず大量射精。,7.0 GB,https://contents-thumbnail2.fc2.com/w1280/storage105000.contents.fc2.com/file/286/28519270/1780649052.34.jpg,https://onejav.com/torrent/fc2ppv4915947/download/52539178/onejav.com_fc2ppv4915947.torrent,"Amateur, Beautiful Girl, Creampie, Facials, FC2, Slender",,2026-06-06,https://onejav.com/torrent/fc2ppv4915947
NGOD341,上京種付物語 旦那の連れ子の相性抜群なズル剥け巨根で孕まされて…,7.3 GB,https://pics.dmm.co.jp/mono/movie/adult/ngod341/ngod341pl.jpg,https://onejav.com/torrent/ngod341/download/08976286/onejav.com_ngod341.torrent,"Cuckold, Huge Cock, Incest, Married Woman, Solowork, Stepmother",椿りか,2026-06-06,https://onejav.com/torrent/ngod341
MKMP733,-実写版- 乙葉ちゃんとSEX サークル昼寝屋さんの看板ヒロイン、乙葉ちゃんがついに実写化！！美少女×巨人の超体格差セックスで累計売上7.5万部超えの人気作 南日菜乃,5.0 GB,https://pics.dmm.co.jp/mono/movie/adult/mkmp733/mkmp733pl.jpg,https://onejav.com/torrent/mkmp733/download/30385225/onejav.com_mkmp733.torrent,"Big Tits, M女, Nasty, Hardcore, Original Collaboration, School Girls, Solowork",南日菜乃,2026-06-06,https://onejav.com/torrent/mkmp733
