code,title,size,image_url,torrent_url,tags,actresses,date,page_url
SNOS274,バイト先の後輩が金曜夜にウチに泊まって、翌日起きてからエッチしてテレビ見て、お菓子食べて、またヤッて。夜までずっと続いた週末延々SEX。 新木希空,4.0 GB,https://pics.dmm.co.jp/mono/movie/adult/snos274/snos274pl.jpg,https://onejav.com/torrent/snos274/download/78911404/onejav.com_snos274.torrent,"Beautiful Girl, Female College Student, POV, Slender, Solowork, Subordinates, Colleagues",新木希空,2026-07-10,https://onejav.com/torrent/snos274
IPZZ903,,4.9 GB,https://pics.dmm.co.jp/mono/movie/adult/ipzz903/ipzz903pl.jpg,https://onejav.com/torrent/ipzz903/download/97261971/onejav.com_ipzz903.torrent,,,2026-07-10,https://onejav.com/torrent/ipzz903
SNOS252,水泳一筋 純情お姉さん しがない変態おじさんに喰われる。ぎとぎと初イキ・初体験3本番 園梨音,4.3 GB,https://pics.dmm.co.jp/mono/movie/adult/snos252/snos252pl.jpg,https://onejav.com/torrent/snos252/download/17281934/onejav.com_snos252.torrent,"3P, 4P, Acme · Orgasm, Athlete, Older Sister, Restraint, Solowork",園梨音,2026-07-10,https://onejav.com/torrent/snos252
IPZZ893,FIRST IMPRESSION 193 天性の愛らしさと洗練された気品 元芸能人お姉さん AV DEBUT 白石るな,5.4 GB,https://pics.dmm.co.jp/mono/movie/adult/ipzz893/ipzz893pl.jpg,https://onejav.com/torrent/ipzz893/download/54900169/onejav.com_ipzz893.torrent,"Debut Production, Facials, Idol, Older Sister, Solowork",白石るな,2026-07-10,https://onejav.com/torrent/ipzz893
IPZZ870,ほんわか癒し系のオトナっぽ可愛い女上司とオフィスでヨダレねっとり糸引く熱情ベロキス性交 篠崎沙帆,5.5 GB,https://pics.dmm.co.jp/mono/movie/adult/ipzz870/ipzz870pl.jpg,https://onejav.com/torrent/ipzz870/download/71630676/onejav.com_ipzz870.torrent,"Blow, Kiss, OL, Older Sister, Slender, Solowork",篠崎沙帆,2026-07-10,https://onejav.com/torrent/ipzz870
DSOD042,小悪魔未亡人の甘い誘惑と朝まで止まらないデカ尻騎乗位。深夜2時の背徳おつまみ。 桃園怜奈,7.2 GB,https://pics.dmm.co.jp/mono/movie/adult/dsod042/dsod042pl.jpg,https://onejav.com/torrent/dsod042/download/81503823/onejav.com_dsod042.torrent,"Big Tits, Cowgirl, Creampie, Huge Butt, Solowork, Widow",桃園怜奈,2026-07-10,https://onejav.com/torrent/dsod042
JUR782,掃除中の無防備尻を即ズボされてまさかのケツ穴剥き出しでイキ狂い、何度も何度も生ハメSEXに溺れた美しすぎる人妻デカ尻家政婦。 市来まひろ,3.4 GB,https://pics.dmm.co.jp/mono/movie/adult/jur782/jur782pl.jpg,https://onejav.com/torrent/jur782/download/42372294/onejav.com_jur782.torrent,"Butt, Creampie, Huge Butt, Married Woman, Mature Woman, Solowork",市来まひろ,2026-07-10,https://onejav.com/torrent/jur782
SNOS324,,4.8 GB,https://pics.dmm.co.jp/mono/movie/adult/snos324/snos324pl.jpg,https://onejav.com/torrent/snos324/download/56425901/onejav.com_snos324.torrent,,,2026-07-10,https://onejav.com/torrent/snos324
FC2PPV4923861,FC2-PPV-4923861 【7/25迄 1512pt迄】初めてのアナル開発♡エロすぎドMネキに好き放題の濃密性交。何度もイキまくる無限快楽。ついに二穴イキもできるように♡【顔出し/無修正/中出し】,5.5 GB,https://contents-thumbnail2.fc2.com/w1280/storage200000.contents.fc2.com/file/379/37807540/1782460647.43.png,https://onejav.com/torrent/fc2ppv4923861/download/20103298/onejav.com_fc2ppv4923861.torrent,"Amateur, Anal, Back, Blow, Breasts, Cowgirl, Creampie, FC2, Slender, Uncensored",,2026-07-10,https://onejav.com/torrent/fc2ppv4923861
ROYD334,,3.2 GB,https://pics.dmm.co.jp/mono/movie/adult/royd334/royd334pl.jpg,https://onejav.com/torrent/royd334/download/03270291/onejav.com_royd334.torrent,,,2026-07-10,https://onejav.com/torrent/royd334
