code,title,size,image_url,torrent_url,tags,actresses,date,page_url
FC2PPV4925245,,3.0 GB,https://contents-thumbnail2.fc2.com/w1280/storage200000.contents.fc2.com/file/393/39269224/1782118165.29.jpg,https://onejav.com/torrent/fc2ppv4925245/download/55175577/onejav.com_fc2ppv4925245.torrent,,,2026-06-24,https://onejav.com/torrent/fc2ppv4925245
FC2PPV4925855,FC2-PPV-4925855 【7/14迄1290pt】【初撮】笑顔もカラダも圧倒的透明感ムスメ。激ピストンで色白Gカップ美乳を揺らしながら「気持ちいい、イクゥ…！」 と絶頂を繰り返す感度抜群なボディ。理性を忘れて喘ぎ散らすコ作り,5.7 GB,https://contents-thumbnail2.fc2.com/w1280/storage201000.contents.fc2.com/file/370/36940995/1782205272.42.png,https://onejav.com/torrent/fc2ppv4925855/download/02367237/onejav.com_fc2ppv4925855.torrent,"Amateur, Beautiful Girl, Breasts, Creampie, FC2, Pregnant, Uncensored",,2026-06-24,https://onejav.com/torrent/fc2ppv4925855
FC2PPV4918885,FC2-PPV-4918885 【10日間限定セール】指、口、マ〇コ、19歳美女メンエス嬢のすべてを使用した極上エステ体験♡中出ししなけりゃもはや失礼！ 【無修正・中出し】,5.5 GB,https://contents-thumbnail2.fc2.com/w1280/storage201000.contents.fc2.com/file/381/38031442/1781090031.51.png,https://onejav.com/torrent/fc2ppv4918885/download/18217716/onejav.com_fc2ppv4918885.torrent,"Amateur, Beautiful Girl, Blow, Breasts, Butt, Creampie, FC2, POV, Uncensored",,2026-06-24,https://onejav.com/torrent/fc2ppv4918885
FC2PPV4926103,FC2-PPV-4926103 【駅弁・顔出し】【期間限定公開】【60%OFF】美乳・美尻の美女2人と生中出し孕ませ分からせ逆3Pしてきた！,3.4 GB,https://contents-thumbnail2.fc2.com/w1280/storage200000.contents.fc2.com/file/372/37151217/1782263503.77.jpg,https://onejav.com/torrent/fc2ppv4926103/download/37264329/onejav.com_fc2ppv4926103.torrent,"Amateur, Beautiful Girl, Breasts, Butt, Conceived, Creampie, FC2, POV",,2026-06-24,https://onejav.com/torrent/fc2ppv4926103
FC2PPV4924027,FC2-PPV-4924027 【初撮り】色白美巨乳１./０だい。推し活も良いけど、ホテルで固いチンポの押し活もスキ♡♡ 色白美巨乳１./０だいのマンコに特濃精液を注ぎ込む。,11.4 GB,https://contents-thumbnail2.fc2.com/w1280/storage201000.contents.fc2.com/file/286/28519270/1781880169.23.jpg,https://onejav.com/torrent/fc2ppv4924027/download/06863585/onejav.com_fc2ppv4924027.torrent,"Amateur, Breasts, Butt, Creampie, FC2, POV, Slender",,2026-06-24,https://onejav.com/torrent/fc2ppv4924027
FC2PPV4924999,FC2-PPV-4924999 【無】童顔黒髪で小柄で美乳すべてが良いです⤴さらに天然ヘアーがエロい！見た目に反して性には積極的でこんな女性に中だし二連発！　※特典高画質,2.7 GB,https://contents-thumbnail2.fc2.com/w1280/storage200000.contents.fc2.com/file/381/38003297/1782087727.88.jpg,https://onejav.com/torrent/fc2ppv4924999/download/62264198/onejav.com_fc2ppv4924999.torrent,"Amateur, Beautiful Girl, Big Tits, Blow, Creampie, FC2, POV, Uncensored",,2026-06-24,https://onejav.com/torrent/fc2ppv4924999
FC2PPV4925571,,5.6 GB,https://contents-thumbnail2.fc2.com/w1280/storage201000.contents.fc2.com/file/261/26076760/1782135295.65.jpg,https://onejav.com/torrent/fc2ppv4925571/download/35263386/onejav.com_fc2ppv4925571.torrent,,,2026-06-24,https://onejav.com/torrent/fc2ppv4925571
FC2PPV4925118,FC2-PPV-4925118 【無修正】変態中出しおじさんナンパシリーズ第8弾：黒髪清楚なスレンダーパイパン美人カフェ店員をナンパしてガチ生中出し,5.4 GB,https://contents-thumbnail2.fc2.com/w1280/storage200000.contents.fc2.com/file/411/41024541/1782103461.69.png,https://onejav.com/torrent/fc2ppv4925118/download/10528476/onejav.com_fc2ppv4925118.torrent,"Amateur, Black Hair, FC2, Shaved, Slender, Uncensored",,2026-06-24,https://onejav.com/torrent/fc2ppv4925118
