code,title,size,image_url,torrent_url,tags,actresses,date,page_url
FC2PPV4918471,FC2-PPV-4918471 【顔出し解禁】都内心療内科 ”1年目新卒美人看護師” 危険日ゴム無しガチハメ撮り限定公開映像。※残りわずか,6.2 GB,https://contents-thumbnail2.fc2.com/w1280/storage200000.contents.fc2.com/file/393/39269224/1781084168.21.jpg,https://onejav.com/torrent/fc2ppv4918471/download/49639639/onejav.com_fc2ppv4918471.torrent,"Amateur, Beautiful Girl, Big Tits, Breasts, Close Up, FC2, POV",,2026-06-11,https://onejav.com/torrent/fc2ppv4918471
ABF358,究極のぬるぬるオーガズム 涼森れむ,5.5 GB,https://image.mgstage.com/images/prestige/abf/358/pb_e_abf-358.jpg,https://onejav.com/torrent/abf358/download/30210945/onejav.com_abf358.torrent,"Big Tits, Breasts, Lotion, Solowork",Remu Suzumori,2026-06-11,https://onejav.com/torrent/abf358
FC2PPV4916530,FC2-PPV-4916530 70％OFF【S級美人】韓国風美人が大量中出しされてイキ狂い。スケベすぎて逆に枯らされそうになっちゃうほど大満足のハメ撮りです。,5.8 GB,https://contents-thumbnail2.fc2.com/w1280/storage201000.contents.fc2.com/file/385/38454154/1780731539.27.jpg,https://onejav.com/torrent/fc2ppv4916530/download/07682385/onejav.com_fc2ppv4916530.torrent,"Amateur, Creampie, FC2, POV, Slender, Uncensored",,2026-06-11,https://onejav.com/torrent/fc2ppv4916530
FC2PPV4918227,FC2-PPV-4918227 【6/30迄1290pt】Fカップ色白スレンダー美体型みずきちゃん。メイド姿で窓際立ちバックで顔を赤くさせ「あぁ…イク！」とビクビク痙攣。濡れマンコにたっぷり生中出し調教。,3.4 GB,https://contents-thumbnail2.fc2.com/w1280/storage200000.contents.fc2.com/file/370/36940995/1781000585.31.png,https://onejav.com/torrent/fc2ppv4918227/download/79151389/onejav.com_fc2ppv4918227.torrent,"Amateur, Breasts, Creampie, FC2, Maid, Pregnant, Slender, Uncensored",,2026-06-11,https://onejav.com/torrent/fc2ppv4918227
200GANA3386,ゲーマー女子は本当にエロいのか？！ゲームで彼氏を作ってきた超絶可愛いゲーマー女子がナンパにホイホイ付いてきて会話もエロもノリが良すぎる！ マジ軟派、初撮。 2307,2.4 GB,https://image.mgstage.com/images/nanpatv/200gana/3386/pb_e_200gana-3386.jpg,https://onejav.com/torrent/200gana3386/download/54180638/onejav.com_200gana3386.torrent,"Amateur, Nampa, Slender",,2026-06-11,https://onejav.com/torrent/200gana3386
ABF359,俺に沼ってる最高の女。-男本位の避妊なし中出しSEX- 野々浦暖,5.0 GB,https://image.mgstage.com/images/prestige/abf/359/pb_e_abf-359.jpg,https://onejav.com/torrent/abf359/download/17024388/onejav.com_abf359.torrent,"Breasts, Creampie, Deep Throating, Slender, Solowork",Non Nonoura,2026-06-11,https://onejav.com/torrent/abf359
FC2PPV4918663,FC2-PPV-4918663 【無】今月本指名数No.1！身も心も癒される最上級テク＆圧倒的ビジュのメンエス嬢が、旅行中のフランス人に極上プライベートサービス【海外版】特典付,3.0 GB,https://contents-thumbnail2.fc2.com/w1280/storage201000.contents.fc2.com/file/402/40198932/1781078073.24.jpg,https://onejav.com/torrent/fc2ppv4918663/download/57010018/onejav.com_fc2ppv4918663.torrent,"Amateur, Beautiful Girl, Blow, Breasts, Butt, FC2, Handjob, Slender, Uncensored",,2026-06-11,https://onejav.com/torrent/fc2ppv4918663
FNS225,デカチンばかりを惹きつけるデカ尻ジムトレーナーのバックピストン4SEX 篠宮るい,6.1 GB,https://cdn.faleno.net/top/wp-content/uploads/2026/05/FNS-225_1200.jpg?output-quality=60,https://onejav.com/torrent/fns225/download/84554610/onejav.com_fns225.torrent,,篠宮るい,2026-06-11,https://onejav.com/torrent/fns225
FC2PPV4917927,FC2-PPV-4917927 【個撮・野外フェラ&amp;セックス】 &lt;元地下アイドル黒髪&gt;「恥じらいながらもチンポを堪能するエロ女。色んな性癖を追求しながらのハメ撮りは最高です。やっぱり素人さんは興奮しますよ!!,2.6 GB,https://contents-thumbnail2.fc2.com/w1280/storage200000.contents.fc2.com/file/375/37456836/1780970965.44.jpg,https://onejav.com/torrent/fc2ppv4917927/download/87641218/onejav.com_fc2ppv4917927.torrent,"Amateur, Blow, Creampie, FC2, POV, Shaved, Uncensored",,2026-06-11,https://onejav.com/torrent/fc2ppv4917927
FC2PPV4915538,FC2-PPV-4915538 ★顔出し★素人さんがえっちな事をしにやってきた！ケース＃136　おもちゃ、イラマ多め！マウスファックもされちゃった！可愛すぎる妖精　みくちゃん（20）の場合,4.0 GB,https://contents-thumbnail2.fc2.com/w1280/storage201000.contents.fc2.com/file/368/36773637/1780589060.11.jpg,https://onejav.com/torrent/fc2ppv4915538/download/47308840/onejav.com_fc2ppv4915538.torrent,"Amateur, Back, Cosplay, Cowgirl, Creampie, FC2, Lingerie, Petite, POV, Sexy, Shaved, Toy, Uncensored",,2026-06-11,https://onejav.com/torrent/fc2ppv4915538
