code,title,size,image_url,torrent_url,tags,actresses,date,page_url
200GANA3392,【これぞワンナイト×アロマなおねぇさん】寂しさにつけ込み、相談に乗ってあげるフリ。可愛いケツのクイコミにぶちこみ、ソウルジ◯ムも濁っちゃう！ マジ軟派、初撮。 2309,2.5 GB,https://image.mgstage.com/images/nanpatv/200gana/3392/pb_e_200gana-3392.jpg,https://onejav.com/torrent/200gana3392/download/30431366/onejav.com_200gana3392.torrent,"Amateur, Butt, Nampa, Older Sister, Slender",,2026-06-15,https://onejav.com/torrent/200gana3392
390JAC238,【3週間ご無沙汰のグラマラスJカップ！！ワールドクラスな爆乳ハーフギャルの早漏マ●コに連続ナマ中出しっ！！】  【ギャルしべ長者108人目 えみりちゃん】,4.8 GB,https://image.mgstage.com/images/jackson/390jac/238/pb_e_390jac-238.jpg,https://onejav.com/torrent/390jac238/download/49906906/onejav.com_390jac238.torrent,"Amateur, Big Tits, Creampie, Gal, Squirting, Titty Fuck",,2026-06-15,https://onejav.com/torrent/390jac238
FC2PPV4920874,FC2-PPV-4920874 ♡６/21日迄半額・新企画第二弾【無・完全素人】授業に集中できないくらいHなことで頭がいっぱいの19歳JD。陥没おっぱいを吸われ、うぶな肉体をおじさんに貪られ、ひぃ～ひぃ～悶えて、ぶっといち〇ぽでイカ,5.7 GB,https://contents-thumbnail2.fc2.com/w1280/storage201000.contents.fc2.com/file/392/39182810/1781402197.58.jpg,https://onejav.com/torrent/fc2ppv4920874/download/74164032/onejav.com_fc2ppv4920874.torrent,"Amateur, Anal, Back, Big Tits, Blow, Breasts, Cowgirl, Cunnilingus, Egg Vibrator, FC2, POV, Uncensored, Vibe",,2026-06-15,https://onejav.com/torrent/fc2ppv4920874
FC2PPV4920948,FC2-PPV-4920948 友達の奥さんとお泊りセックスしました IMEDAMAFC2,4.2 GB,https://contents-thumbnail2.fc2.com/w1280/storage201000.contents.fc2.com/file/390/38979124/1781417410.01.gif,https://onejav.com/torrent/fc2ppv4920948/download/86141530/onejav.com_fc2ppv4920948.torrent,"Amateur, Date, FC2, Married Woman, POV",,2026-06-15,https://onejav.com/torrent/fc2ppv4920948
FC2PPV4919927,FC2-PPV-4919927 ♀223 笑顔あふれる元気っこのおまんこはチョー気持ちよくて中だししちゃった ウォシュレット型アナル舐めと膣内カメラも！★特典で無修正と膣内カメラ,5.5 GB,https://contents-thumbnail2.fc2.com/w1280/storage200000.contents.fc2.com/file/376/37547480/1781235698.32.jpg,https://onejav.com/torrent/fc2ppv4919927/download/91151943/onejav.com_fc2ppv4919927.torrent,"Amateur, Creampie, FC2, Petite, Uncensored",,2026-06-15,https://onejav.com/torrent/fc2ppv4919927
ANKB043,男の顔を見つめながらイク早漏ドM全身性感帯ビッチ,5.3 GB,https://pics.dmm.co.jp/mono/movie/adult/ankb043/ankb043pl.jpg,https://onejav.com/torrent/ankb043/download/04306275/onejav.com_ankb043.torrent,"Big Tits, Creampie, Facials, Hot Spring, Titty Fuck",,2026-06-15,https://onejav.com/torrent/ankb043
FC2PPV4920861,FC2-PPV-4920861 【駅弁・アマゾン・イラマ】【70%OFF】美乳・美尻の黒髪美女とデカチン黒人巨根で破壊して、生中出し孕ませ分からせSEXしてきた！,3.1 GB,https://contents-thumbnail2.fc2.com/w1280/storage201000.contents.fc2.com/file/372/37151217/1781424970.98.jpeg,https://onejav.com/torrent/fc2ppv4920861/download/87090190/onejav.com_fc2ppv4920861.torrent,"Amateur, Beautiful Girl, Blow, Butt, Conceived, Creampie, FC2, POV",,2026-06-15,https://onejav.com/torrent/fc2ppv4920861
FC2PPV4921059,FC2-PPV-4921059 本当に可愛くて、美乳・美尻のOLさらちゃんを黒人上司がホテルに呼び出し、分からせ生中出し孕ませSEXしてきた！【海外版】特典付,4.0 GB,https://contents-thumbnail2.fc2.com/w1280/storage200000.contents.fc2.com/file/402/40198932/1781436769.3.jpg,https://onejav.com/torrent/fc2ppv4921059/download/62091828/onejav.com_fc2ppv4921059.torrent,"Amateur, Beautiful Girl, Blow, Breasts, Butt, Creampie, FC2, OL, Pregnant, Slender, Titty Fuck",,2026-06-15,https://onejav.com/torrent/fc2ppv4921059
FC2PPV4917106,FC2-PPV-4917106 ※20日まで70％OFF※【個撮】元陸上選手にホテルで生ハメ！！ スレンダーな身体をオカしまくる！,1.4 GB,https://contents-thumbnail2.fc2.com/w1280/storage200000.contents.fc2.com/file/403/40214313/1780867894.63.jpg,https://onejav.com/torrent/fc2ppv4917106/download/83764775/onejav.com_fc2ppv4917106.torrent,"Amateur, Blow, Creampie, FC2, POV, Slender",,2026-06-15,https://onejav.com/torrent/fc2ppv4917106
FC2PPV4910477,FC2-PPV-4910477 妊婦さんのセルフヌード撮影風景《妊娠26週：マイクロビキニ》モデルKさん引退妊婦ヌードコレクション#02,4.1 GB,https://contents-thumbnail2.fc2.com/w1280/storage200000.contents.fc2.com/file/348/34717732/1780114489.2.jpg,https://onejav.com/torrent/fc2ppv4910477/download/35558991/onejav.com_fc2ppv4910477.torrent,"Amateur, Big Tits, FC2, Model, Pregnant, Shaved",,2026-06-15,https://onejav.com/torrent/fc2ppv4910477
