code,title,size,image_url,torrent_url,tags,actresses,date,page_url
FC2PPV4920291,FC2-PPV-4920291 【14日間限定セール】【緊急】某出張メンズエステの神乳嬢は金ちらつかせて果敢に口説けばガッツリはめ撮りし出来ちゃいます。 【無修正・中出し】,5.3 GB,https://contents-thumbnail2.fc2.com/w1280/storage200000.contents.fc2.com/file/381/38031442/1781267687.28.png,https://onejav.com/torrent/fc2ppv4920291/download/28053281/onejav.com_fc2ppv4920291.torrent,"Amateur, Beautiful Girl, Big Tits, Blow, Breasts, Butt, FC2, POV, Uncensored",,2026-07-11,https://onejav.com/torrent/fc2ppv4920291
300MIUM1392,活きが良すぎるエビ反りボディ【見惚れるデニム桃尻】【絶品スレンダー】カワイイ笑顔と際立つボディラインについてったら「肌綺麗な方がモテますよ～」って美容液を売りつけてきました。。問答無用でひん剥くとご馳走乳首がこんにちはwwしゃぶり尽くしたら潮でテカったシズルま●こにブチ込み猛ピス。イキ反るたび締まるキツキツま●こ最高でしたww ：case.66,2.8 GB,https://image.mgstage.com/images/prestigepremium/300mium/1392/pb_e_300mium-1392.jpg,https://onejav.com/torrent/300mium1392/download/05728228/onejav.com_300mium1392.torrent,"Amateur, Beautiful legs, Breasts, Butt, Electric Massager, POV, Squirting",,2026-07-11,https://onejav.com/torrent/300mium1392
FC2PPV4934753,FC2-PPV-4934753 [無修正・完全素人・中出し・潮吹き]＜元アスリート候補生　体つきがたまらなくシコいヨガ講師≫ハリのある巨乳&amp;美尻　鍛えられたクビレ　エロすぎる腰遣いの騎乗位は絶品　究極美BODYまんこに中出し,1.9 GB,https://contents-thumbnail2.fc2.com/w1280/storage201000.contents.fc2.com/file/398/39704516/1783592196.14.jpg,https://onejav.com/torrent/fc2ppv4934753/download/07295295/onejav.com_fc2ppv4934753.torrent,"Amateur, Back, Big Tits, Black Hair, Cowgirl, Creampie, FC2, Female College Student, Nasty, Hardcore, POV, Squirting, Uncensored, Uniform",,2026-07-11,https://onejav.com/torrent/fc2ppv4934753
FC2PPV4932682,,4.9 GB,https://contents-thumbnail2.fc2.com/w1280/storage201000.contents.fc2.com/file/385/38454154/1783738083.37.jpg,https://onejav.com/torrent/fc2ppv4932682/download/95512246/onejav.com_fc2ppv4932682.torrent,,,2026-07-11,https://onejav.com/torrent/fc2ppv4932682
FC2PPV4936069,,2.7 GB,https://contents-thumbnail2.fc2.com/w1280/storage201000.contents.fc2.com/file/404/40364366/1783672416.85.jpg,https://onejav.com/torrent/fc2ppv4936069/download/36421111/onejav.com_fc2ppv4936069.torrent,,,2026-07-11,https://onejav.com/torrent/fc2ppv4936069
FC2PPV4934258,FC2-PPV-4934258 【無】いつ見ても美しいビジュアルの長身スレンダー美女！久しぶりに会ったせいなのか何度も求められて三連発！ゴックン　大量顔射　中だし　※特典高画質,3.7 GB,https://contents-thumbnail2.fc2.com/w1280/storage201000.contents.fc2.com/file/381/38003297/1783319053.2.jpg,https://onejav.com/torrent/fc2ppv4934258/download/83805745/onejav.com_fc2ppv4934258.torrent,"Amateur, Beautiful Girl, Big Tits, Blow, Creampie, FC2, POV, Uncensored",,2026-07-11,https://onejav.com/torrent/fc2ppv4934258
FC2PPV4936585,FC2-PPV-4936585 ※在庫限り※【アナル調教特典付！】Iカップ神乳グラドルのサキュバスコスでマン屁連発2連中出しハメ撮り。撮影者マジギレ!!　トラブルでも調子乗ってて生意気なので、今回は撮影中の様子を無編集でそのまま公開,1.1 GB,https://contents-thumbnail2.fc2.com/w1280/storage201000.contents.fc2.com/file/410/40963021/1783658164.5.png,https://onejav.com/torrent/fc2ppv4936585/download/83169074/onejav.com_fc2ppv4936585.torrent,"Amateur, Anal, Big Tits, Cosplay, Creampie, FC2, Uncensored",,2026-07-11,https://onejav.com/torrent/fc2ppv4936585
FC2PPV4927744,,6.9 GB,https://contents-thumbnail2.fc2.com/w1280/storage201000.contents.fc2.com/file/370/36953929/1782440402.76.jpg,https://onejav.com/torrent/fc2ppv4927744/download/31882021/onejav.com_fc2ppv4927744.torrent,,,2026-07-11,https://onejav.com/torrent/fc2ppv4927744
SIRO5706,,2.1 GB,https://image.mgstage.com/images/shirouto/siro/5706/pb_e_siro-5706.jpg,https://onejav.com/torrent/siro5706/download/26695684/onejav.com_siro5706.torrent,,,2026-07-11,https://onejav.com/torrent/siro5706
GVH860,クソ生意気な巨乳女子マネージャーを完堕ちするまで徹底的にわからせる連続中出し逆襲レ×プ輪●。 黒島玲衣,7.4 GB,https://pics.dmm.co.jp/mono/movie/adult/gvh860/gvh860pl.jpg,https://onejav.com/torrent/gvh860/download/45526526/onejav.com_gvh860.torrent,"3P, 4P, Bloomers, Club Activities, Manager, Creampie, School Girls, Solowork",黒島玲衣,2026-07-11,https://onejav.com/torrent/gvh860
