code,title,size,image_url,torrent_url,tags,actresses,date,page_url
FC2PPV4915536,FC2-PPV-4915536 ギャップ萌え確定！【無】【中出し】幸薄顔だが美乳＆デカ尻。何でも言うことを聞く従順な彼女。フェラテクもあり、濡れやすい敏感な体に大量中出し。※特典あり,2.6 GB,https://contents-thumbnail2.fc2.com/w1280/storage200000.contents.fc2.com/file/391/39050133/1780588568.94.jpg,https://onejav.com/torrent/fc2ppv4915536/download/51434094/onejav.com_fc2ppv4915536.torrent,"Amateur, Big Tits, Blow, Breasts, Creampie, FC2, POV, Shaved, Uncensored",,2026-06-14,https://onejav.com/torrent/fc2ppv4915536
FC2PPV4918070,FC2-PPV-4918070 生活に疲れた若妻が性欲と承認欲求を満たす年下彼氏の家でいちゃいちゃ中出しSEX,4.9 GB,https://contents-thumbnail2.fc2.com/w1280/storage200000.contents.fc2.com/file/367/36631962/1780986452.67.jpg,https://onejav.com/torrent/fc2ppv4918070/download/83843621/onejav.com_fc2ppv4918070.torrent,"4K, Amateur, Beautiful Girl, Big Tits, Creampie, FC2, Married Woman, Nasty, Hardcore, Shaved",,2026-06-14,https://onejav.com/torrent/fc2ppv4918070
FC2PPV4919767,FC2-PPV-4919767 ♯44 ミニマム美女mikuちゃん。初めての生チンセックスはおじさんと♡　おっぱいもお尻もぷりんぷりん発育中♡【大容量原盤１７GB】,8.4 GB,https://contents-thumbnail2.fc2.com/w1280/storage201000.contents.fc2.com/file/407/40695380/1781194462.12.png,https://onejav.com/torrent/fc2ppv4919767/download/46967624/onejav.com_fc2ppv4919767.torrent,"Amateur, Beautiful Girl, Big Tits, Blow, Butt, FC2, POV",,2026-06-14,https://onejav.com/torrent/fc2ppv4919767
FC2PPV4919908,FC2-PPV-4919908 今まで彼氏がいたことがない、経験人数１人、１回のみ、◯８才、無垢、純粋、真面目、個撮５４７人目,18.0 GB,https://contents-thumbnail2.fc2.com/w1280/storage200000.contents.fc2.com/file/371/37077607/1781395812.63.jpg,https://onejav.com/torrent/fc2ppv4919908/download/10667643/onejav.com_fc2ppv4919908.torrent,"Amateur, Beautiful Girl, Beautiful legs, Blow, Breasts, Butt, Creampie, Deep Throating, FC2, POV, Uniform",,2026-06-14,https://onejav.com/torrent/fc2ppv4919908
FC2PPV4920344,FC2-PPV-4920344 超天使な塾生と生セックス！ 先生ちんこをフェラしながらマン汁が終始だらだらに... 制服に隠れる圧倒的美尻！ 清純美白のピュアな身体に ガチ危険日大量種付け孕ませ...,18.5 GB,https://contents-thumbnail2.fc2.com/w1280/storage200000.contents.fc2.com/file/385/38499350/1781273935.33.png,https://onejav.com/torrent/fc2ppv4920344/download/15059364/onejav.com_fc2ppv4920344.torrent,"Amateur, FC2",,2026-06-14,https://onejav.com/torrent/fc2ppv4920344
FC2PPV4920379,FC2-PPV-4920379 【完全シークレット版】【潮吹き】【淫乱】【音量注意】IカップOL美奈さん、半泣きしながらお潮が止まりません、脳やま〇こがバクる程に逝きまくる醜態性が晒されます【第6章】,7.3 GB,https://contents-thumbnail2.fc2.com/w1280/storage201000.contents.fc2.com/file/377/37664104/1781282139.74.jpg,https://onejav.com/torrent/fc2ppv4920379/download/40623432/onejav.com_fc2ppv4920379.torrent,"Amateur, Big Tits, Blow, FC2, M女, Nasty, Hardcore, OL, POV, Shaved, Squirting, Uncensored",,2026-06-14,https://onejav.com/torrent/fc2ppv4920379
FC2PPV4920416,FC2-PPV-4920416 ※19日まで初回限定60％OFF※【素人ハメ撮り】お風呂場でもベッドでも、おもちゃにされる人妻,3.8 GB,https://contents-thumbnail2.fc2.com/w1280/storage200000.contents.fc2.com/file/377/37682362/1781304639.1.jpg,https://onejav.com/torrent/fc2ppv4920416/download/37777967/onejav.com_fc2ppv4920416.torrent,"Affair, Amateur, Blow, Creampie, FC2, Married Woman, POV, Shaved, Slender",,2026-06-14,https://onejav.com/torrent/fc2ppv4920416
FC2PPV4920518,FC2-PPV-4920518 【無】色白爆乳Kカップ☆美女と濃厚中出しSEX♪,2.8 GB,https://contents-thumbnail2.fc2.com/w1280/storage200000.contents.fc2.com/file/411/41024993/1781322837.02.jpg,https://onejav.com/torrent/fc2ppv4920518/download/96266078/onejav.com_fc2ppv4920518.torrent,"Amateur, Beautiful Girl, Big Tits, Creampie, FC2, Gal, POV, Uncensored",,2026-06-14,https://onejav.com/torrent/fc2ppv4920518
FC2PPV4920538,FC2-PPV-4920538 【200本限定.価格】素人ちゃん、メンエス体験で気持ち良いコト一緒にしちゃお♪ 日々の疲れを癒してくれる美ボディ女に大量中出しでストレス解消ビデオｗ,4.8 GB,https://contents-thumbnail2.fc2.com/w1280/storage200000.contents.fc2.com/file/407/40666348/1781325024.83.png,https://onejav.com/torrent/fc2ppv4920538/download/71292534/onejav.com_fc2ppv4920538.torrent,"Amateur, Creampie, FC2, Uncensored",,2026-06-14,https://onejav.com/torrent/fc2ppv4920538
FC2PPV4920245,FC2-PPV-4920245 リアルガチ　ベロンベロンに酔った女教師　ホテルへ****持ち帰ってSEX,931.0 MB,https://contents-thumbnail2.fc2.com/w1280/storage200000.contents.fc2.com/file/274/27324139/1781259944.31.PNG,https://onejav.com/torrent/fc2ppv4920245/download/05691720/onejav.com_fc2ppv4920245.torrent,"Amateur, FC2, Female Teacher, Married Woman, Outdoors, POV",,2026-06-14,https://onejav.com/torrent/fc2ppv4920245
