code,title,size,image_url,torrent_url,tags,actresses,date,page_url
REBD1038,Yui8 The Magical Musical・波多野結衣,2.9 GB,https://pics.dmm.co.jp/mono/movie/adult/h_346rebd1038/h_346rebd1038pl.jpg,https://onejav.com/torrent/rebd1038/download/35209656/onejav.com_rebd1038.torrent,"AV女優, Big Tits, Image Video, Sexy, Solowork, Tall",Yui Hatano,2026-06-04,https://onejav.com/torrent/rebd1038
REBD1039,Sakura2 光の雫と刹那の呼吸・水卜さくら,2.5 GB,https://pics.dmm.co.jp/mono/movie/adult/h_346rebd1039/h_346rebd1039pl.jpg,https://onejav.com/torrent/rebd1039/download/04325191/onejav.com_rebd1039.torrent,"AV女優, Big Tits, Image Video, Sexy, Solowork",Sakura Miura,2026-06-04,https://onejav.com/torrent/rebd1039
REBD1040,Momo3 桃色の秘めごと・御園もも,2.6 GB,https://pics.dmm.co.jp/mono/movie/adult/h_346rebd1040/h_346rebd1040pl.jpg,https://onejav.com/torrent/rebd1040/download/10034213/onejav.com_rebd1040.torrent,"AV女優, Big Tits, Image Video, Sexy, Solowork",御園もも,2026-06-04,https://onejav.com/torrent/rebd1040
REBD1041,Alice2 ふれて、君。-another side-・釈アリス,3.4 GB,https://pics.dmm.co.jp/mono/movie/adult/h_346rebd1041/h_346rebd1041pl.jpg,https://onejav.com/torrent/rebd1041/download/99758592/onejav.com_rebd1041.torrent,"AV女優, Big Tits, Image Video, Sexy, Solowork, Tall",釈アリス,2026-06-04,https://onejav.com/torrent/rebd1041
SHIND112,粘着ス●●カーMの追跡・自宅●禁記録＃138・139,5.6 GB,https://pics.dmm.co.jp/mono/movie/adult/h_1560shind112/h_1560shind112pl.jpg,https://onejav.com/torrent/shind112/download/43288526/onejav.com_shind112.torrent,"Amateur, Big Tits, Creampie, Evil, Skirt",,2026-06-04,https://onejav.com/torrent/shind112
STSK227,親友に隠れて裏切りNTR！男同士の友情vs性欲！？飲み会の後、終電を逃して家に泊めた親友の彼女NTR映像！酔った勢いとノリでエッチまでしたら体の相性抜群で朝まで背徳の生中出し！彼氏を裏切る女×親友を裏切る男,7.1 GB,https://pics.dmm.co.jp/mono/movie/adult/h_1605stsk227/h_1605stsk227pl.jpg,https://onejav.com/torrent/stsk227/download/26804615/onejav.com_stsk227.torrent,"Amateur, Creampie, Cuckold, Drinking Party, Voyeur",,2026-06-04,https://onejav.com/torrent/stsk227
STSK228,絶対絶命！ヒロインピンチ！囚われたピンクレンジャー 戦隊ヒーローショーのスーツアクターの中の人,7.9 GB,https://pics.dmm.co.jp/mono/movie/adult/h_1605stsk228/h_1605stsk228pl.jpg,https://onejav.com/torrent/stsk228/download/54936599/onejav.com_stsk228.torrent,"Amateur, Cosplay, Creampie, Evil, Voyeur",,2026-06-04,https://onejav.com/torrent/stsk228
FC2PPV4910529,FC2-PPV-4910529 70％OFF【初撮り】ガードが硬い受付嬢は、乳首びんびんの隠れ巨乳のＦカップスレンダーでしたとさ。初撮りで初の激しめプレイで性の境地へ。最後はゴム無し中出しフィニッシュで無事開発！,5.8 GB,https://contents-thumbnail2.fc2.com/w1280/storage200000.contents.fc2.com/file/385/38454154/1780120469.36.jpg,https://onejav.com/torrent/fc2ppv4910529/download/78096216/onejav.com_fc2ppv4910529.torrent,"Amateur, Beautiful legs, Breasts, Butt, Creampie, Debut Production, FC2, POV, Receptionist, Shaved, Slender, Uncensored",,2026-06-04,https://onejav.com/torrent/fc2ppv4910529
FC2PPV4912104,FC2-PPV-4912104 ★顔出し★素人さんがえっちな事をしにやってきた！ケース＃135　爆乳Gカップに似合うバニーガールコスプレで野性的に大暴れしちゃう　かほちゃん（20）の場合,3.3 GB,https://contents-thumbnail2.fc2.com/w1280/storage200000.contents.fc2.com/file/368/36773637/1780319237.51.jpg,https://onejav.com/torrent/fc2ppv4912104/download/09904700/onejav.com_fc2ppv4912104.torrent,"Amateur, Big Tits, Bunny Girl, Cosplay, Creampie, FC2, Petite, Sexy, Toy, Uncensored, Vibe",,2026-06-04,https://onejav.com/torrent/fc2ppv4912104
FC2PPV4912492,FC2-PPV-4912492 【6/23迄1290pt】Fカップ色白の美容師アシスタントちゃん。泥スイして「入れてほしいです…」鬼ピストンで美尻をガン突き、巨根に跨り騎乗位喘ぎまくる。締め付けの超名器にたっぷり中出し。,4.6 GB,https://contents-thumbnail2.fc2.com/w1280/storage201000.contents.fc2.com/file/370/36940995/1780394797.95.png,https://onejav.com/torrent/fc2ppv4912492/download/76405000/onejav.com_fc2ppv4912492.torrent,"Amateur, Beautiful Girl, Blow, Breasts, Creampie, FC2, Pregnant, Uncensored",,2026-06-04,https://onejav.com/torrent/fc2ppv4912492
