code,title,size,image_url,torrent_url,tags,actresses,date,page_url
FC2PPV4938541,FC2-PPV-4938541 ＜無修正＞ちんぽが好き過ぎるネイル専門学校の講師❤1日働いた後の蒸れ蒸れマンコに生ハメ～淫乱口まんこに口内発射しちゃいました,3.1 GB,https://contents-thumbnail2.fc2.com/w1280/storage201000.contents.fc2.com/file/373/37232976/1783936856.26.jpg,https://onejav.com/torrent/fc2ppv4938541/download/32053447/onejav.com_fc2ppv4938541.torrent,"Amateur, Beautiful legs, Big Tits, Blow, FC2, Lingerie, Nasty, Hardcore, POV, Slender, Uncensored",,2026-07-15,https://onejav.com/torrent/fc2ppv4938541
FC2PPV4938580,FC2-PPV-4938580 【通い詰めてナンパ成功】お仕事中に制服姿で駐車場に点検という名目で呼び出して野外露出仁王立ちフェラ人が沢山来る中で立ちバック生中出し★レビュー特典有り★《デブ専/無修正/ぽっちゃり》,2.6 GB,https://contents-thumbnail2.fc2.com/w1280/storage201000.contents.fc2.com/file/372/37120110/1783944077.03.jpg,https://onejav.com/torrent/fc2ppv4938580/download/15744829/onejav.com_fc2ppv4938580.torrent,"Amateur, BBW, Car Sex, Cosplay, Creampie, FC2, Nampa, Planning, Uncensored, Uniform",,2026-07-15,https://onejav.com/torrent/fc2ppv4938580
FC2PPV4938863,,10.5 GB,https://contents-thumbnail2.fc2.com/w1280/storage201000.contents.fc2.com/file/393/39269224/1784021732.63.jpg,https://onejav.com/torrent/fc2ppv4938863/download/35250869/onejav.com_fc2ppv4938863.torrent,,,2026-07-15,https://onejav.com/torrent/fc2ppv4938863
FC2PPV4937567,FC2-PPV-4937567 ※再販修正版 70％OFF【初撮り】色白Ｆカップがたまんない！！清楚な見た目からは想像もつかないイキまくり体質で、喘ぎまくる姿に興奮したので***中出し！！,3.1 GB,https://contents-thumbnail2.fc2.com/w1280/storage201000.contents.fc2.com/file/385/38454154/1783752972.37.jpg,https://onejav.com/torrent/fc2ppv4937567/download/21080377/onejav.com_fc2ppv4937567.torrent,"Amateur, Breasts, Butt, Creampie, FC2, POV, Uncensored",,2026-07-15,https://onejav.com/torrent/fc2ppv4937567
FC2PPV4938589,FC2-PPV-4938589 ♀226 蔵出し！おまんこくぱあインタビュー5人分！全女中出しです（当たり前だよなあ？）,6.4 GB,https://contents-thumbnail2.fc2.com/w1280/storage201000.contents.fc2.com/file/376/37547480/1783946696.55.jpg,https://onejav.com/torrent/fc2ppv4938589/download/24825539/onejav.com_fc2ppv4938589.torrent,"Amateur, Creampie, FC2",,2026-07-15,https://onejav.com/torrent/fc2ppv4938589
MEKO403,「おばさんレンタル」サービスリターンズ119 お願いすればこっそり中出しセックスまでさせてくれるエロくて優しいおばさんともっとすげーセックスがしたくなったのでおかわりしてみた,7.4 GB,https://pics.dmm.co.jp/mono/movie/adult/h_1160meko403/h_1160meko403pl.jpg,https://onejav.com/torrent/meko403/download/35797358/onejav.com_meko403.torrent,"Amateur, Big Tits, Married Woman, Mature Woman",,2026-07-15,https://onejav.com/torrent/meko403
PTS548,,6.2 GB,https://pics.dmm.co.jp/mono/movie/adult/h_021pts548/h_021pts548pl.jpg,https://onejav.com/torrent/pts548/download/69924348/onejav.com_pts548.torrent,,,2026-07-15,https://onejav.com/torrent/pts548
PTS550,,12.5 GB,https://pics.dmm.co.jp/mono/movie/adult/h_021pts550/h_021pts550pl.jpg,https://onejav.com/torrent/pts550/download/60832972/onejav.com_pts550.torrent,,,2026-07-15,https://onejav.com/torrent/pts550
PTS551,親友同士の絆！根性！執念！が試される！ 我慢の限界でまさかの4P乱パに発展！,5.1 GB,https://pics.dmm.co.jp/mono/movie/adult/h_021pts551/h_021pts551pl.jpg,https://onejav.com/torrent/pts551/download/76486884/onejav.com_pts551.torrent,"3P, 4P, Big Tits, Facials, Older Sister, Shame",,2026-07-15,https://onejav.com/torrent/pts551
PYM570,今日は私で精子出してっ 自撮りちんしこ誘惑見せ合いオナニー,7.6 GB,https://pics.dmm.co.jp/mono/movie/adult/h_283pym570/h_283pym570pl.jpg,https://onejav.com/torrent/pym570/download/65005510/onejav.com_pym570.torrent,"4HR+, Big Tits, Breasts, Masturbation, Slut","天月あず, 谷村凪咲, 月乃ことね, 白雪美月, 森かおり, 碧那美海, 宇佐美すい, 朝妃りお, 山下紗和, 森亜秋",2026-07-15,https://onejav.com/torrent/pym570
