code,title,size,image_url,torrent_url,tags,actresses,date,page_url
FC2PPV4824142,FC2-PPV-4824142 ※大人を怒らせた末路がこの動画。許されることのない魔性の女ガチ可愛い女に成敗の４射精,7.3 GB,https://contents-thumbnail2.fc2.com/w1280/storage201000.contents.fc2.com/file/407/40666348/1767342128.84.jpg,https://onejav.com/torrent/fc2ppv4824142/download/74515561/onejav.com_fc2ppv4824142.torrent,"Amateur, FC2, POV, Uncensored",,2026-06-12,https://onejav.com/torrent/fc2ppv4824142
FC2PPV4916209,FC2-PPV-4916209 【6/21迄 983pt】極上Jカップ堪能♡揉んで！挟んで！揺らして！舐める！チンポを完全に包み込む夢のパイズリに大興奮！玉が空になるまで何度も絞り取られるっ♡【無・顔出し・中出し】,4.5 GB,https://contents-thumbnail2.fc2.com/w1280/storage200000.contents.fc2.com/file/379/37807540/1780661403.7.png,https://onejav.com/torrent/fc2ppv4916209/download/20933804/onejav.com_fc2ppv4916209.torrent,"Amateur, Beautiful Girl, Big Tits, Breasts, Creampie, FC2, POV, Titty Fuck, Uncensored",,2026-06-12,https://onejav.com/torrent/fc2ppv4916209
FC2PPV4917756,FC2-PPV-4917756 ♯43 「し、しぬゥゥヴおォォォまんゴイキまシュぅぅッ」寸止め地獄後のキ./メセクで小さな体がオホ声痙攣絶頂。,6.8 GB,https://contents-thumbnail2.fc2.com/w1280/storage200000.contents.fc2.com/file/407/40695380/1780922508.82.gif,https://onejav.com/torrent/fc2ppv4917756/download/00863635/onejav.com_fc2ppv4917756.torrent,"Amateur, Beautiful Girl, Blow, Creampie, FC2",,2026-06-12,https://onejav.com/torrent/fc2ppv4917756
FC2PPV4918768,FC2-PPV-4918768 人気朝ドラに出演していたあの元子役がウブな黒髪清楚な女子大生に性徴！初めてのP活で淫乱スイッチ全開で中出し懇願する貴重映像！,4.9 GB,https://contents-thumbnail2.fc2.com/w1280/storage201000.contents.fc2.com/file/388/38703450/1781101414.75.jpg,https://onejav.com/torrent/fc2ppv4918768/download/52378875/onejav.com_fc2ppv4918768.torrent,"Amateur, Black Hair, Creampie, FC2, Female College Student, POV, Uncensored",,2026-06-12,https://onejav.com/torrent/fc2ppv4918768
FC2PPV4919240,FC2-PPV-4919240 【無修正】セラピスト募集に⼥装男⼦が面接に！,2.4 GB,https://contents-thumbnail2.fc2.com/w1280/storage201000.contents.fc2.com/file/395/39456556/1781159126.37.jpg,https://onejav.com/torrent/fc2ppv4919240/download/81340416/onejav.com_fc2ppv4919240.torrent,"Amateur, Anal, FC2, Handjob, Uncensored, Uniform",,2026-06-12,https://onejav.com/torrent/fc2ppv4919240
FC2PPV4919133,FC2-PPV-4919133 ♡6/21日迄半額！【無/なま中出し】小柄でとても可愛いらしい、小悪魔なJDさんが新作マッサージ器具入荷メールでのご来店です。またもやオイル長めのご要望です。,3.5 GB,https://contents-thumbnail2.fc2.com/w1280/storage201000.contents.fc2.com/file/271/27020439/1781151822.21.jpg,https://onejav.com/torrent/fc2ppv4919133/download/79179434/onejav.com_fc2ppv4919133.torrent,"Amateur, Blow, Breasts, Butt, Creampie, Cunnilingus, FC2, Petite, Uncensored",,2026-06-12,https://onejav.com/torrent/fc2ppv4919133
HEYZO3867,,1.9 GB,https://www.heyzo.com/contents/3000/3867/images/player_thumbnail_en.jpg,https://onejav.com/torrent/heyzo3867/download/29390842/onejav.com_heyzo3867.torrent,,,2026-06-12,https://onejav.com/torrent/heyzo3867
EYAN224,離島を支える訪問看護師 週末婚6年目 孤島のナースは、断れない。 山科すずか 27歳,6.1 GB,https://pics.dmm.co.jp/mono/movie/adult/eyan224/eyan224pl.jpg,https://onejav.com/torrent/eyan224/download/10052794/onejav.com_eyan224.torrent,"Big Tits, Debut Production, Documentary, Married Woman, Nurse",,2026-06-12,https://onejav.com/torrent/eyan224
FPRE235,絶対に知られたくない弟の婚約者の弱みを握ったクズ兄貴の僕は ずっと嫌な顔されながらむっちり柔らかいパイパンマ○コに中出ししてやりました… 南見京,5.0 GB,https://pics.dmm.co.jp/mono/movie/adult/fpre235/fpre235pl.jpg,https://onejav.com/torrent/fpre235/download/14297201/onejav.com_fpre235.torrent,"Big Tits, Creampie, Cuckold, Cunnilingus, Shaved, Solowork",南見京,2026-06-12,https://onejav.com/torrent/fpre235
HJMO726,お仕事帰りのムレムレ黒パンストOLまんぐりイキ我慢チャレンジ！電マ＆指マンに耐えてポーズを10分間キープ出来たら100万円！罰ゲームは連続お漏らし痙攣が止まらない敏感マ○コブッ刺しデカチン激ピストン種付けプレス！,5.4 GB,https://pics.dmm.co.jp/mono/movie/adult/hjmo726/hjmo726pl.jpg,https://onejav.com/torrent/hjmo726/download/60535515/onejav.com_hjmo726.torrent,"Creampie, Humiliation, Pantyhose, Shame, Urination",,2026-06-12,https://onejav.com/torrent/hjmo726
