code,title,size,image_url,torrent_url,tags,actresses,date,page_url
FC2PPV4910243,FC2-PPV-4910243 【7日間限定セール】あどけなさの残る表情はたまらない♡エロスレンダーボディーでヌルズポ種搾りエステさせてきました。 【無修正・中出し】,5.3 GB,https://contents-thumbnail2.fc2.com/w1280/storage201000.contents.fc2.com/file/381/38031442/1780056652.67.png,https://onejav.com/torrent/fc2ppv4910243/download/54172534/onejav.com_fc2ppv4910243.torrent,"Amateur, Beautiful Girl, Blow, Breasts, Butt, Creampie, FC2, POV, Slender, Uncensored",,2026-06-17,https://onejav.com/torrent/fc2ppv4910243
FC2PPV4920811,FC2-PPV-4920811 【初撮り顔出し】田舎栃木から上京したての、清楚な音大生なこちゃん♡デブハゲキモオジの溜まりきった白濁汁を膣内に注ぎ込まれ受精不可避。,5.0 GB,https://contents-thumbnail2.fc2.com/w1280/storage200000.contents.fc2.com/file/377/37657565/1781381586.26.jpg,https://onejav.com/torrent/fc2ppv4920811/download/19032355/onejav.com_fc2ppv4920811.torrent,"Amateur, FC2",,2026-06-17,https://onejav.com/torrent/fc2ppv4920811
FC2PPV4921135,FC2-PPV-4921135 【オトナのエロス】麗しの色白スレンダーな小学校のピアノ講師。恋する乙女を応援する生チンポ逆レッスン,7.4 GB,https://contents-thumbnail2.fc2.com/w1280/storage201000.contents.fc2.com/file/286/28519270/1781606394.14.jpg,https://onejav.com/torrent/fc2ppv4921135/download/51230975/onejav.com_fc2ppv4921135.torrent,"Amateur, Breasts, Butt, Creampie, FC2, Long Hair, POV, Sexy, Toy",,2026-06-17,https://onejav.com/torrent/fc2ppv4921135
FC2PPV4921181,FC2-PPV-4921181 【無】高身長の美尻って良いですね～、長い手足に超ミニセーラーコスの紐パン！似合い過ぎ⤴　ゴックン　中だし　※特典高画質,3.1 GB,https://contents-thumbnail2.fc2.com/w1280/storage200000.contents.fc2.com/file/381/38003297/1781482899.6.jpg,https://onejav.com/torrent/fc2ppv4921181/download/52260682/onejav.com_fc2ppv4921181.torrent,"Amateur, Beautiful Girl, Big Tits, Blow, Creampie, FC2, POV, Uncensored",,2026-06-17,https://onejav.com/torrent/fc2ppv4921181
FC2PPV4921548,FC2-PPV-4921548 【無修正】変態中出しおじさんナンパシリーズ第5弾・パート2：スタイル抜群の黒髪清楚な美人受付嬢とほろ酔い濃密ナイト,8.8 GB,https://contents-thumbnail2.fc2.com/w1280/storage201000.contents.fc2.com/file/411/41024541/1781515151.55.png,https://onejav.com/torrent/fc2ppv4921548/download/50046221/onejav.com_fc2ppv4921548.torrent,"Amateur, Beautiful Girl, Black Hair, FC2, Uncensored",,2026-06-17,https://onejav.com/torrent/fc2ppv4921548
FC2PPV4921564,FC2-PPV-4921564 【初撮り】新人《3日間限定》陸上部元インターハイ準決勝出場選手 クラスのアイドルにスクールカースト底辺のデカチン突き上げ奥まで大量放出♥※未公開特典付き,9.1 GB,https://contents-thumbnail2.fc2.com/w1280/storage200000.contents.fc2.com/file/410/40976927/1781517418.06.png,https://onejav.com/torrent/fc2ppv4921564/download/08808938/onejav.com_fc2ppv4921564.torrent,"Amateur, Beautiful Girl, FC2, Slender, Uncensored",,2026-06-17,https://onejav.com/torrent/fc2ppv4921564
FC2PPV4921659,FC2-PPV-4921659 【シークレット版】【顔出し】【爆尻】都内ガールズバー勤務する「るな」さん、H100㎝超えの爆尻パンパン打ちつけ膣奥ガン突き絶頂SEX、こんなに突かれると頭おかしくなっちゃう！,4.1 GB,https://contents-thumbnail2.fc2.com/w1280/storage200000.contents.fc2.com/file/377/37664104/1781615639.04.jpg,https://onejav.com/torrent/fc2ppv4921659/download/34672009/onejav.com_fc2ppv4921659.torrent,"Amateur, Big Tits, Creampie, Electric Massager, FC2, Huge Butt, POV",,2026-06-17,https://onejav.com/torrent/fc2ppv4921659
FC2PPV4921673,FC2-PPV-4921673 【初アナル開拓】中出し後洗おうとしたので、アナルパールとデンマでお仕置き！旦那じゃ濡れないと豪語していた人妻の陰部からあふれ出る膣分泌液混ざり合う奥まで押し込まれた精液そのまま旦那のもとへ返される。,4.3 GB,https://contents-thumbnail2.fc2.com/w1280/storage200000.contents.fc2.com/file/377/37682362/1781559240.29.jpg,https://onejav.com/torrent/fc2ppv4921673/download/65338569/onejav.com_fc2ppv4921673.torrent,"Affair, Amateur, Blow, Creampie, Electric Massager, FC2, Married Woman, POV",,2026-06-17,https://onejav.com/torrent/fc2ppv4921673
FC2PPV4921859,FC2-PPV-4921859 6/30まで990pt‼自前のチャイナコス＆ランジェリーで誘惑してくるパチンコ女子(20)！オイルで引き立つ美乳美尻！オカネのためならノリノリで中出し許可♡,4.2 GB,https://contents-thumbnail2.fc2.com/w1280/storage200000.contents.fc2.com/file/379/37841587/1781576899.91.png,https://onejav.com/torrent/fc2ppv4921859/download/76795862/onejav.com_fc2ppv4921859.torrent,"Amateur, Blow, Breasts, Creampie, FC2, Pregnant, Shaved, Uncensored",,2026-06-17,https://onejav.com/torrent/fc2ppv4921859
MGOLD049,スマホで呼んだらいつでも即尺OK 玄関開けたら即エロがりおしゃぶりしてくれるデリバリー痴女 澪奈あすみ,5.6 GB,https://pics.dmm.co.jp/mono/movie/adult/1mgold049/1mgold049pl.jpg,https://onejav.com/torrent/mgold049/download/34444790/onejav.com_mgold049.torrent,"Blow, Deep Throating, Slut, Solowork, Various Professions",澪奈あすみ,2026-06-17,https://onejav.com/torrent/mgold049
