code,title,size,image_url,torrent_url,tags,actresses,date,page_url
SNOS248,新人NO.1STYLE 水泳一筋 純情なお姉さん 園梨音 AVデビュー,5.9 GB,https://pics.dmm.co.jp/mono/movie/adult/snos248/snos248pl.jpg,https://onejav.com/torrent/snos248/download/13688473/onejav.com_snos248.torrent,"Athlete, Debut Production, Facials, Older Sister, Slender, Solowork",園梨音,2026-06-05,https://onejav.com/torrent/snos248
FC2PPV4911951,FC2-PPV-4911951 【厳選美女】『Gカップ超美形ハーフモデル』人生初のピル無し子宮直撃生中出し。限定公開秘蔵映像。,2.1 GB,https://contents-thumbnail2.fc2.com/w1280/storage201000.contents.fc2.com/file/393/39269224/1780306448.88.jpg,https://onejav.com/torrent/fc2ppv4911951/download/00968722/onejav.com_fc2ppv4911951.torrent,"Amateur, Beautiful Girl, Big Tits, Blow, Breasts, Close Up, Creampie, FC2, POV, Slender",,2026-06-02,https://onejav.com/torrent/fc2ppv4911951
SNOS209,最強ヒロインが アナタのちんちん100％支配… 24時間犯してあげる 瀬戸環奈,6.9 GB,https://pics.dmm.co.jp/mono/movie/adult/snos209/snos209pl.jpg,https://onejav.com/torrent/snos209/download/52026439/onejav.com_snos209.torrent,"Big Tits, Blow, Cosplay, Handjob, Slut, Solowork",瀬戸環奈,2026-06-05,https://onejav.com/torrent/snos209
SNOS283,雨の日にコインランドリーに現れ、洗濯が終わるまでエッチな体が完全無防備な隙だらけお姉さん 楓ふうあ,5.6 GB,https://pics.dmm.co.jp/mono/movie/adult/snos283/snos283pl.jpg,https://onejav.com/torrent/snos283/download/42170893/onejav.com_snos283.torrent,"Beautiful Girl, OL, Other Fetish, Slender, Solowork, Tall",Fuua Kaede,2026-06-05,https://onejav.com/torrent/snos283
FC2PPV4909987,FC2-PPV-4909987 70％OFF【顔射】関西S級美人の再来。この顔面でGカップモデル体型は反則です。顔射で汚れる姿に勃起不可避でシタ。,2.8 GB,https://contents-thumbnail2.fc2.com/w1280/storage200000.contents.fc2.com/file/385/38454154/1780041834.83.jpg,https://onejav.com/torrent/fc2ppv4909987/download/33729154/onejav.com_fc2ppv4909987.torrent,"Amateur, Creampie, Facials, FC2, POV, Uncensored",,2026-06-02,https://onejav.com/torrent/fc2ppv4909987
SNOS234,グラビアアイドルの際どい水着は撮影スタッフのレ●プ欲を掻き立てる 紫堂るい,3.6 GB,https://pics.dmm.co.jp/mono/movie/adult/snos234/snos234pl.jpg,https://onejav.com/torrent/snos234/download/41606852/onejav.com_snos234.torrent,"Big Tits, Facials, Idol, Nasty, Hardcore, Solowork, Swimsuit",紫堂るい,2026-06-05,https://onejav.com/torrent/snos234
ABF357,男だらけのラーメン屋に三佳 詩、置いてきた。 三佳詩【限定特典映像10分付き】,5.2 GB,https://image.mgstage.com/images/prestige/abf/357/pb_e_abf-357.jpg,https://onejav.com/torrent/abf357/download/04769034/onejav.com_abf357.torrent,"Big Tits, Documentary, Facials, Shaved, Solowork",三佳詩,2026-06-04,https://onejav.com/torrent/abf357
SNOS172,新世代グラドル生々しく嘘のないリアル4セックス 博多彩葉,6.4 GB,https://pics.dmm.co.jp/mono/movie/adult/snos172/snos172pl.jpg,https://onejav.com/torrent/snos172/download/64399357/onejav.com_snos172.torrent,"3P, 4P, Acme · Orgasm, Beautiful Girl, Big Tits, Idol, Solowork",博多彩葉,2026-06-05,https://onejav.com/torrent/snos172
START582,初ソープ研修 SOD新卒3年目シャカリキ奮闘ご奉仕 こあくまつなが発動！？アニメ声の気持ちよさにヤラレちまいなSP 松永あかり,7.0 GB,https://pics.dmm.co.jp/mono/movie/adult/1start582/1start582pl.jpg,https://onejav.com/torrent/start582/download/89496692/onejav.com_start582.torrent,"Big Tits, Lotion, OL, Prostitutes, Soapland","松永あかり, 岬さくら",2026-06-02,https://onejav.com/torrent/start582
SNOS243,引き締まったクビレ…汗ばむ巨乳… 彼女の姉のクソエロ宅トレが僕の性癖にぶっ刺さる！ 安達夕莉,3.8 GB,https://pics.dmm.co.jp/mono/movie/adult/snos243/snos243pl.jpg,https://onejav.com/torrent/snos243/download/00237910/onejav.com_snos243.torrent,"Big Tits, Cowgirl, Older Sister, Other Fetish, Slender, Solowork",Yuri Adachi,2026-06-05,https://onejav.com/torrent/snos243
