code,title,size,image_url,torrent_url,tags,actresses,date,page_url
FC2PPV4921044,FC2-PPV-4921044 【7/6まで特別価格】すべてを手に入れた爆乳女社長の超絶フェラテクに悶絶。,1.0 GB,https://contents-thumbnail2.fc2.com/w1280/storage200000.contents.fc2.com/file/355/35406629/1781433675.26.jpg,https://onejav.com/torrent/fc2ppv4921044/download/29636198/onejav.com_fc2ppv4921044.torrent,"Amateur, Beautiful Girl, Big Tits, Blow, Cosplay, Creampie, FC2, Nasty, Hardcore, No Bra, POV, Secretary",,2026-06-20,https://onejav.com/torrent/fc2ppv4921044
START585,,3.6 GB,https://pics.dmm.co.jp/mono/movie/adult/1start585/1start585pl.jpg,https://onejav.com/torrent/start585/download/80750251/onejav.com_start585.torrent,,,2026-06-23,https://onejav.com/torrent/start585
300MIUM1363,,3.6 GB,https://image.mgstage.com/images/prestigepremium/300mium/1363/pb_e_300mium-1363.jpg,https://onejav.com/torrent/300mium1363/download/72583889/onejav.com_300mium1363.torrent,,,2026-06-21,https://onejav.com/torrent/300mium1363
DLDSS505,「女に興味ない」と言い続ける32年間『彼女無し』の友人に妻を1泊2日預けたら、不眠不休で11発中出しされて帰ってきた-。 与田りん,5.1 GB,https://pics.dmm.co.jp/mono/movie/adult/1dldss505/1dldss505pl.jpg,https://onejav.com/torrent/dldss505/download/14255045/onejav.com_dldss505.torrent,"Big Tits, Creampie, Cuckold, Married Woman, Mature Woman, Solowork",与田りん,2026-06-21,https://onejav.com/torrent/dldss505
DLDSS518,人妻秘書 机の下の密かなクンニ情事―。 小沢菜穂,5.4 GB,https://pics.dmm.co.jp/mono/movie/adult/1dldss518/1dldss518pl.jpg,https://onejav.com/torrent/dldss518/download/18229118/onejav.com_dldss518.torrent,"Creampie, Cunnilingus, Married Woman, Mature Woman, Secretary, Solowork",小沢菜穂,2026-06-20,https://onejav.com/torrent/dldss518
FC2PPV4924467,FC2-PPV-4924467 ※神作【お宝発見】超照れ屋で初心佐賀の残るｱｲﾄﾞﾙの原石。不安からｶﾞﾁ恋中出しまでの生々しい貴重な映像。。,4.7 GB,https://contents-thumbnail2.fc2.com/w1280/storage200000.contents.fc2.com/file/404/40364366/1781950296.73.jpg,https://onejav.com/torrent/fc2ppv4924467/download/91659495/onejav.com_fc2ppv4924467.torrent,"Amateur, Beautiful Girl, Creampie, FC2, POV, Slender, Uncensored",,2026-06-21,https://onejav.com/torrent/fc2ppv4924467
OFES033,,5.3 GB,https://pics.dmm.co.jp/mono/movie/adult/ofes033/ofes033pl.jpg,https://onejav.com/torrent/ofes033/download/61167107/onejav.com_ofes033.torrent,,,2026-06-26,https://onejav.com/torrent/ofes033
FC2PPV4926047,FC2-PPV-4926047 ★顔出し★素人さんがえっちな事をしにやってきた！ケース＃138　ぶっちゃけタイプ過ぎてガチで途中でイキそうになった…ｗ色白美マン　ユウカちゃん（20）の場合,4.8 GB,https://contents-thumbnail2.fc2.com/w1280/storage201000.contents.fc2.com/file/368/36773637/1782231604.65.png,https://onejav.com/torrent/fc2ppv4926047/download/35834061/onejav.com_fc2ppv4926047.torrent,"Amateur, Big Tits, Creampie, Electric Massager, FC2, Petite, POV, Slender, Toy",,2026-06-25,https://onejav.com/torrent/fc2ppv4926047
ABF363,完全主観×鬼イカせ イッても止めない激FUCK！！！追撃5.000ピストン 三佳詩【限定特典映像30分付き】,5.9 GB,https://image.mgstage.com/images/prestige/abf/363/pb_e_abf-363.jpg,https://onejav.com/torrent/abf363/download/81973443/onejav.com_abf363.torrent,"Big Tits, Cosplay, Shaved, Solowork, Subjectivity",三佳詩,2026-06-25,https://onejav.com/torrent/abf363
300MIUM1394,メロ潮ブッシャァアアw w【子宮でメロイキ】【店のチ●ポに沼るメスの本能】セラピストを前に自然と声が高くなるお客様、顔真っ赤にしながらマットレスまで到達するほど潮でビシャビシャに濡らしてしまう。。ww ：file.42,3.4 GB,https://image.mgstage.com/images/prestigepremium/300mium/1394/pb_e_300mium-1394.jpg,https://onejav.com/torrent/300mium1394/download/74884192/onejav.com_300mium1394.torrent,"Amateur, Big Tits, Electric Massager, Lotion, Squirting, Voyeur",,2026-06-20,https://onejav.com/torrent/300mium1394
