code,title,size,image_url,torrent_url,tags,actresses,date,page_url
SNOS274,バイト先の後輩が金曜夜にウチに泊まって、翌日起きてからエッチしてテレビ見て、お菓子食べて、またヤッて。夜までずっと続いた週末延々SEX。 新木希空,4.0 GB,https://pics.dmm.co.jp/mono/movie/adult/snos274/snos274pl.jpg,https://onejav.com/torrent/snos274/download/78911404/onejav.com_snos274.torrent,"Beautiful Girl, Female College Student, POV, Slender, Solowork, Subordinates, Colleagues",新木希空,2026-07-10,https://onejav.com/torrent/snos274
IPZZ903,,4.9 GB,https://pics.dmm.co.jp/mono/movie/adult/ipzz903/ipzz903pl.jpg,https://onejav.com/torrent/ipzz903/download/97261971/onejav.com_ipzz903.torrent,,,2026-07-10,https://onejav.com/torrent/ipzz903
FC2PPV4933213,,5.0 GB,https://contents-thumbnail2.fc2.com/w1280/storage201000.contents.fc2.com/file/395/39401321/1783117022.71.png,https://onejav.com/torrent/fc2ppv4933213/download/47267535/onejav.com_fc2ppv4933213.torrent,"Amateur, FC2",,2026-07-08,https://onejav.com/torrent/fc2ppv4933213
FC2PPV4934852,FC2-PPV-4934852 【7/28迄1290pt】【初撮】※19歳 グラビアアイドルに負けない美ボディムスメ。「あぁ、気持ちいい！」グチョグチョマンコに激ピストンで突っ込みまくり、喘ぎながらビクビク痙攣。締め付け膣奥に中出し,4.6 GB,https://contents-thumbnail2.fc2.com/w1280/storage201000.contents.fc2.com/file/370/36940995/1783415021.53.png,https://onejav.com/torrent/fc2ppv4934852/download/55537386/onejav.com_fc2ppv4934852.torrent,"Amateur, Beautiful Girl, Creampie, Cum, FC2, Pregnant, Uncensored",,2026-07-08,https://onejav.com/torrent/fc2ppv4934852
SNOS252,水泳一筋 純情お姉さん しがない変態おじさんに喰われる。ぎとぎと初イキ・初体験3本番 園梨音,4.3 GB,https://pics.dmm.co.jp/mono/movie/adult/snos252/snos252pl.jpg,https://onejav.com/torrent/snos252/download/17281934/onejav.com_snos252.torrent,"3P, 4P, Acme · Orgasm, Athlete, Older Sister, Restraint, Solowork",園梨音,2026-07-10,https://onejav.com/torrent/snos252
ABF367,涼森れむの「顔」で、ヌく。,5.0 GB,https://image.mgstage.com/images/prestige/abf/367/pb_e_abf-367.jpg,https://onejav.com/torrent/abf367/download/87179942/onejav.com_abf367.torrent,"Big Tits, Breasts, Facials, Solowork, Subjectivity",Remu Suzumori,2026-07-09,https://onejav.com/torrent/abf367
IPZZ893,FIRST IMPRESSION 193 天性の愛らしさと洗練された気品 元芸能人お姉さん AV DEBUT 白石るな,5.4 GB,https://pics.dmm.co.jp/mono/movie/adult/ipzz893/ipzz893pl.jpg,https://onejav.com/torrent/ipzz893/download/54900169/onejav.com_ipzz893.torrent,"Debut Production, Facials, Idol, Older Sister, Solowork",白石るな,2026-07-10,https://onejav.com/torrent/ipzz893
IPZZ870,ほんわか癒し系のオトナっぽ可愛い女上司とオフィスでヨダレねっとり糸引く熱情ベロキス性交 篠崎沙帆,5.5 GB,https://pics.dmm.co.jp/mono/movie/adult/ipzz870/ipzz870pl.jpg,https://onejav.com/torrent/ipzz870/download/71630676/onejav.com_ipzz870.torrent,"Blow, Kiss, OL, Older Sister, Slender, Solowork",篠崎沙帆,2026-07-10,https://onejav.com/torrent/ipzz870
DSOD042,小悪魔未亡人の甘い誘惑と朝まで止まらないデカ尻騎乗位。深夜2時の背徳おつまみ。 桃園怜奈,7.2 GB,https://pics.dmm.co.jp/mono/movie/adult/dsod042/dsod042pl.jpg,https://onejav.com/torrent/dsod042/download/81503823/onejav.com_dsod042.torrent,"Big Tits, Cowgirl, Creampie, Huge Butt, Solowork, Widow",桃園怜奈,2026-07-10,https://onejav.com/torrent/dsod042
FC2PPV4926279,FC2-PPV-4926279 ※再販修正版 70％OFF【初撮り】まだセックスを知ったばかりの１９歳にエロのイロハを叩き込む！精子飲ませた上に生中出し、潮吹きフィニッシュまでのフルコース！！,6.6 GB,https://contents-thumbnail2.fc2.com/w1280/storage201000.contents.fc2.com/file/385/38454154/1782241420.62.jpg,https://onejav.com/torrent/fc2ppv4926279/download/43341478/onejav.com_fc2ppv4926279.torrent,"Amateur, Breasts, Butt, Creampie, Debut Production, FC2, POV, Squirting, Uncensored",,2026-07-08,https://onejav.com/torrent/fc2ppv4926279
