code,title,size,image_url,torrent_url,tags,actresses,date,page_url
MIDA642,ズルい程、最高にエロいカラダ 普段はOL 副業AV DEBUT 1本限定 森下茉莉,5.5 GB,https://pics.dmm.co.jp/mono/movie/adult/mida642/mida642pl.jpg,https://onejav.com/torrent/mida642/download/52355698/onejav.com_mida642.torrent,"3P, 4P, Big Tits, Blow, Debut Production, Facials, Solowork",森下茉莉,2026-05-29,https://onejav.com/torrent/mida642
MIDA614,家に住み憑くワケアリ地味巨乳な幽霊を乳揉みセクハラ挑発していたら…毎晩俺に勝手に跨りこねくり腰振り 中出しをねだるエロメス狂いに豹変！ 百田光稀,6.2 GB,https://pics.dmm.co.jp/mono/movie/adult/mida614/mida614pl.jpg,https://onejav.com/torrent/mida614/download/50560197/onejav.com_mida614.torrent,"Big Tits, Creampie, Drama, Older Sister, Solowork, Titty Fuck",百田光稀,2026-05-29,https://onejav.com/torrent/mida614
CAWD987,いいなりセーラーぶっかけ当番。教師に大量顔射されまくる、本日は●●ちゃんの番です。 彩月七緒,5.2 GB,https://pics.dmm.co.jp/mono/movie/adult/cawd987/cawd987pl.jpg,https://onejav.com/torrent/cawd987/download/36102130/onejav.com_cawd987.torrent,"Beautiful Girl, Big Tits, Bukkake, Sailor Suit, Solowork, Titty Fuck",彩月七緒,2026-05-29,https://onejav.com/torrent/cawd987
START578,,3.3 GB,https://pics.dmm.co.jp/mono/movie/adult/1start578/1start578pl.jpg,https://onejav.com/torrent/start578/download/49189757/onejav.com_start578.torrent,,,2026-05-26,https://onejav.com/torrent/start578
NPJS268,ノーブラ新宿徘徊マゾ犬お散歩デート,7.2 GB,https://pics.dmm.co.jp/mono/movie/adult/npjs268/npjs268pl.jpg,https://onejav.com/torrent/npjs268/download/91240456/onejav.com_npjs268.torrent,"Acme · Orgasm, Big Tits, Creampie, Outdoors, Urination",,2026-05-29,https://onejav.com/torrent/npjs268
START576,新川空と初対面のイケメン男を2人きりの部屋に置いてきた ヤリたくなったらいつでもOK！赤面イチャイチャセックスを24時間モニタリング 新川空,11.9 GB,https://pics.dmm.co.jp/mono/movie/adult/1start576/1start576pl.jpg,https://onejav.com/torrent/start576/download/30147052/onejav.com_start576.torrent,"4HR+, Big Tits, Cosplay, Documentary, POV, Solowork",新川空,2026-05-26,https://onejav.com/torrent/start576
FC2PPV4907647,FC2-PPV-4907647 【80分超え】最強ビジュアル19歳『144cm ミニマム美女』子宮突きピル無し生中出し。80分超え生性行為映像。※売り切れ次第終了,5.8 GB,https://contents-thumbnail2.fc2.com/w1280/storage200000.contents.fc2.com/file/393/39269224/1779699975.96.png,https://onejav.com/torrent/fc2ppv4907647/download/66995687/onejav.com_fc2ppv4907647.torrent,"Amateur, Beautiful Girl, Big Tits, Blow, Breasts, Close Up, Creampie, FC2, POV, Slender",,2026-05-26,https://onejav.com/torrent/fc2ppv4907647
MIDA653,,5.8 GB,https://pics.dmm.co.jp/mono/movie/adult/mida653/mida653pl.jpg,https://onejav.com/torrent/mida653/download/94077771/onejav.com_mida653.torrent,,,2026-05-29,https://onejav.com/torrent/mida653
FC2PPV4907429,FC2-PPV-4907429 清純派黒髪のおしとやかさんが大きな巨チンに大興奮！激しいピストンに悶絶絶頂アクメ！,2.4 GB,https://contents-thumbnail2.fc2.com/w1280/storage200000.contents.fc2.com/file/410/40964074/1779643134.68.png,https://onejav.com/torrent/fc2ppv4907429/download/45209903/onejav.com_fc2ppv4907429.torrent,"Amateur, FC2",,2026-05-26,https://onejav.com/torrent/fc2ppv4907429
MIDA649,,5.6 GB,https://pics.dmm.co.jp/mono/movie/adult/mida649/mida649pl.jpg,https://onejav.com/torrent/mida649/download/48069306/onejav.com_mida649.torrent,,,2026-05-29,https://onejav.com/torrent/mida649
