code,title,size,image_url,torrent_url,tags,actresses,date,page_url
FC2PPV4921247,FC2-PPV-4921247 【顔出し解禁】”本物アイドル出身 神ビジュGカップ美女” 高額出資 顔出し出演。契約書から射精までの77分リアルハメ撮り映像』。※残りわずか,5.6 GB,https://contents-thumbnail2.fc2.com/w1280/storage201000.contents.fc2.com/file/393/39269224/1781511416.86.jpg,https://onejav.com/torrent/fc2ppv4921247/download/69125071/onejav.com_fc2ppv4921247.torrent,"Amateur, Beautiful Girl, Big Tits, Breasts, Close Up, FC2, POV",,2026-06-16,https://onejav.com/torrent/fc2ppv4921247
SNOS213,イキすぎちゃって、ごめんなさい…ウブなIcupボディに与えた怒涛の強●快楽と超痙攣オルガズム 早坂奏音,7.1 GB,https://pics.dmm.co.jp/mono/movie/adult/snos213/snos213pl.jpg,https://onejav.com/torrent/snos213/download/32270789/onejav.com_snos213.torrent,"Acme · Orgasm, Big Tits, Electric Massager, Nasty, Hardcore, Solowork, Squirting",早坂奏音,2026-06-19,https://onejav.com/torrent/snos213
300MIUM1369,【学会不倫】可愛い顔してどスケベすぎる歯科助手と密会中出し。黒スト美脚で限界まで搾り取ってくるどエロい騎乗位。仕事中とは立場逆転。甘サド痴女に責められる生ハメ不倫【既婚男性(歯科院長)×独身女性(歯科助手)】 case.24,3.3 GB,https://image.mgstage.com/images/prestigepremium/300mium/1369/pb_e_300mium-1369.jpg,https://onejav.com/torrent/300mium1369/download/48237965/onejav.com_300mium1369.torrent,"Affair, Amateur, Big Tits, Cosplay, Facials, POV, Slut",,2026-06-16,https://onejav.com/torrent/300mium1369
FC2PPV4912520,FC2-PPV-4912520 70％OFF【複数プレイ】Ｅカップのパイパンガールは「珍革連」専用のおもちゃ！やりたい放題で至高の快楽の連続！！あまりの雑な扱いで無気力に！？そんなことは気にせず、中出ししまくり！！！,4.5 GB,https://contents-thumbnail2.fc2.com/w1280/storage201000.contents.fc2.com/file/385/38454154/1780380738.36.jpg,https://onejav.com/torrent/fc2ppv4912520/download/49210596/onejav.com_fc2ppv4912520.torrent,"Amateur, Breasts, Butt, Creampie, FC2, POV, Shaved, Uncensored",,2026-06-13,https://onejav.com/torrent/fc2ppv4912520
SNOS257,新人NO.1STYLE ひ・と・き・わ20歳 京都の女子大生 蜜このはAVデビュー,5.0 GB,https://pics.dmm.co.jp/mono/movie/adult/snos257/snos257pl.jpg,https://onejav.com/torrent/snos257/download/20013742/onejav.com_snos257.torrent,"Big Tits, Debut Production, Facials, Slender, Solowork, Titty Fuck",蜜このは,2026-06-19,https://onejav.com/torrent/snos257
FC2PPV4919920,FC2-PPV-4919920 30日迄1490pt!!※早期特典【初/新人】 19歳。170cm。モデル顔負け圧倒的美女です。　全然使ってないおマン㋙いただきました,4.5 GB,https://contents-thumbnail2.fc2.com/w1280/storage200000.contents.fc2.com/file/359/35808353/1781513492.22.png,https://onejav.com/torrent/fc2ppv4919920/download/37731139/onejav.com_fc2ppv4919920.torrent,"Amateur, Back, Blow, Breasts, Cowgirl, FC2, Model, POV, Slender, Tall",,2026-06-16,https://onejav.com/torrent/fc2ppv4919920
SIRO5689,【172cmの超高身長スレンダー美女降臨！】洗礼されたモデル体型からは想像出来ないエロがここにあります！！ 【初撮り】ネットでAV応募→AV体験撮影 2573,2.4 GB,https://image.mgstage.com/images/shirouto/siro/5689/pb_e_siro-5689.jpg,https://onejav.com/torrent/siro5689/download/19638654/onejav.com_siro5689.torrent,"Amateur, Debut Production, Finger Fuck, POV, Slender, Tall",,2026-06-14,https://onejav.com/torrent/siro5689
START551,体液ズブ濡れでよがりイク極上のカラダ 汗・潮・涎全ての菜乃汁を味わい堪能する5CORNER 小笠原菜乃,6.2 GB,https://pics.dmm.co.jp/mono/movie/adult/1start551/1start551pl.jpg,https://onejav.com/torrent/start551/download/67036612/onejav.com_start551.torrent,"Beautiful Girl, Nasty, Hardcore, Solowork, Squirting, Sweat",小笠原菜乃,2026-06-16,https://onejav.com/torrent/start551
SNOS285,混ぜるな危険！眠剤×媚薬漬け ダウナー異常絶頂,5.4 GB,https://pics.dmm.co.jp/mono/movie/adult/snos285/snos285pl.jpg,https://onejav.com/torrent/snos285/download/11069710/onejav.com_snos285.torrent,"Acme · Orgasm, Breasts, Nasty, Hardcore, Solowork, Squirting, Tall",白上咲花,2026-06-19,https://onejav.com/torrent/snos285
SQTE692,いつでも使えるオナホ後輩 小野坂ゆいか,3.7 GB,https://pics.dmm.co.jp/mono/movie/adult/sqte692/sqte692pl.jpg,https://onejav.com/torrent/sqte692/download/90534109/onejav.com_sqte692.torrent,"Beautiful Girl, Blow, Creampie, Masturbation, Solowork",小野坂ゆいか,2026-06-13,https://onejav.com/torrent/sqte692
