code,title,image_url,page_url,views,date_scraped
FC2PPV-4914203,[First 3P Gal NTR] A gal with a boyfriend gets creampied in her first 3P. After her boyfriend ⚫︎ I can't be satisfied with chubby,https://pic.javct.net/poster/05192026/a52566efec.jpg,https://javct.net/v/fc2ppv-4914203,37,2026-06-15
FC2PPV-4920809,T〇under① [No face shown] Treasured sex friend 145cm young-faced beautiful big breasts raw creampie,https://pic.javct.net/poster/05192026/2d5dff2da4.jpg,https://javct.net/v/fc2ppv-4920809,28,2026-06-15
FC2PPV-4920449,0363_008 Misaki-chan (real name) 18 years old Private insemination sex just to impregnate an innocent sex friend who was swayed by the sweet atmosphere and was finally allowed to creampie is revealed to the public,https://pic.javct.net/poster/05192026/a9ef79834f.jpg,https://javct.net/v/fc2ppv-4920449,110,2026-06-15
FC2PPV-4920823,4 shots! Guaranteed to be the best masterpiece with a smile. Cum swallowing with a smile. Cleaning with the face and root in the mouth. Removal blowjob... This eroticism is already a foul!,https://pic.javct.net/poster/05192026/c089b810e9.jpg,https://javct.net/v/fc2ppv-4920823,132,2026-06-15
FC2PPV-4909883,"[Mermaid that colors early summer] A famous, highly educated, beautiful, big-breasted, JD, light club drummer forgets her boyfriend and goes wild with a big cock while being embarrassed.",https://pic.javct.net/poster/05192026/17041a4d5a.jpg,https://javct.net/v/fc2ppv-4909883,81,2026-06-15
SIRO-5689,[A super tall slender beauty of 172 cm has arrived] Eroticism that you can't imagine from her baptized model body is here [First shot] AV application online AV experience shooting 2573,https://pic.javct.net/poster/05192026/2e6532ef63.jpg,https://javct.net/v/siro-5689,66,2026-06-15
SIMA-039,Yuri,https://pic.javct.net/poster/05192026/3cd3ab1a80.jpg,https://javct.net/v/sima-039,59,2026-06-15
MAAN-1176,"[Masochist play with my favorite actor] It's been a long time since I've been horny and I can't stop looking for a deep masochist woman who keeps cumming while screaming w With a face covered in semen, I'm ready for the second round from the cock sucking, intense sex [Thanks Bitch] [Bookmark]",https://pic.javct.net/poster/05192026/bef3f7a373.jpg,https://javct.net/v/maan-1176,85,2026-06-15
586HNHU-0206,"A lustful woman who is immediately hot on SNS is destroyed by repeated creampies... A lustful woman with explosive desire, SNS meeting immediately at a hotel! Raw insertion ora ora fuck in the tightest masterpiece, jubo blowjob, butt sticking out, estrus vibrator & rotor to cum, continuous back grinding cowgirl position and being creampied repeatedly",https://pic.javct.net/poster/05192026/94bbac2bca.jpg,https://javct.net/v/586hnhu-0206,63,2026-06-15
567BEAF-218,"Yuki-chan, 22 years old, appears in an erotic video on a fan site for the man-con cast of a lewd bitch who is excited with a perverted costume with fully visible restraints and pussy juice. Yuki-chan, 22 years old",https://pic.javct.net/poster/05192026/be8500be4e.jpg,https://javct.net/v/567beaf-218,75,2026-06-15
326FCT-219,"[Main story] A short man with a round face and a short stature, out of curiosity, I allowed him to take a picture of me, enjoying the large E cup of the areola, and letting me cum inside him lol",https://pic.javct.net/poster/05192026/0435cbbb7c.jpg,https://javct.net/v/326fct-219,72,2026-06-15
348NTR-100,"[NTR] It's been talked about that just because she's a nursery teacher, it doesn't seem like she's ever had a romantic relationship, but Nagomi definitely follows that pattern lol",https://pic.javct.net/poster/05192026/e973acb533.jpg,https://javct.net/v/348ntr-100,60,2026-06-15
FC2PPV-4918070,A young wife tired of life has flirty creampie sex at her younger boyfriend's house to satisfy her sexual desire and desire for approval.,https://pic.javct.net/poster/05192026/23bff4c65b.jpg,https://javct.net/v/fc2ppv-4918070,47,2026-06-15
FC2PPV-4920379,"[Complete secret version] [Squirting] [Slutty] [Volume warning] Mina, an I-cup office lady, can't stop squirting while half-crying. Her abominable behavior is exposed to the point where her brain is shaking [Chapter 6]",https://pic.javct.net/poster/05192026/bf4cc14b75.jpg,https://javct.net/v/fc2ppv-4920379,101,2026-06-15
FC2PPV-4920518,[No] Fair-skinned big breasts K cup ☆ Intense creampie sex with a beautiful woman,https://pic.javct.net/poster/05192026/c97c77cab7.jpg,https://javct.net/v/fc2ppv-4920518,39,2026-06-15
FC2PPV-4920245,A real drunk female teacher takes her back to the hotel and has sex with her,https://pic.javct.net/poster/05192026/8995df840a.jpg,https://javct.net/v/fc2ppv-4920245,12,2026-06-15
FC2PPV-4920538,"Amateur-chan, let's have a pleasant experience together. A stress-relieving video with a large amount of creampie to a beautiful body woman who will heal your daily fatigue.",https://pic.javct.net/poster/05192026/40e55f216e.jpg,https://javct.net/v/fc2ppv-4920538,67,2026-06-15
FC2PPV-4920409,9P Part 1 with cute cute Yun-chan 3 consecutive creampies on a dangerous day ready for pregnancy Cusco after creampie Challenge to new vaginal observation_#32,https://pic.javct.net/poster/05192026/f6ee6d1e29.jpg,https://javct.net/v/fc2ppv-4920409,73,2026-06-15
FC2PPV-4920309,"[Youth generation/Main story appearance] Since it is possible to take a soft shoot without a real performance, the sperm that has been stored for more than 5 days is sucked out and swallowed.",https://pic.javct.net/poster/05192026/013f5262c4.jpg,https://javct.net/v/fc2ppv-4920309,38,2026-06-15
FC2PPV-4920353,"My favorite girl told me about her hometown, so I went out and had sex with her for the first time outside the store *Review bonus included",https://pic.javct.net/poster/05192026/566d77f03a.jpg,https://javct.net/v/fc2ppv-4920353,51,2026-06-15
FC2PPV-4920344,"Raw sex with a super angelic school student. While giving a blow job to the teacher's penis, her pussy juices are dripping all over... An overwhelmingly beautiful butt hidden behind the uniform. A pure body with pure white skin. Mass impregnation on a really dangerous day...",https://pic.javct.net/poster/05192026/6ede56c611.jpg,https://javct.net/v/fc2ppv-4920344,262,2026-06-15
FC2PPV-4920416,[Amateur POV] Married woman being used as a toy both in the bathroom and on the bed,https://pic.javct.net/poster/05192026/ad22dbf628.jpg,https://javct.net/v/fc2ppv-4920416,50,2026-06-15
FC2PPV-4915536,"Gap Moe Confirmed [No] [Creampie] Yuki has a pale face, but she has beautiful breasts and a big ass. She is obedient and will listen to anything you say. She also has blowjob techniques and a large amount of creampie on her sensitive body that gets wet easily. *Bonus included",https://pic.javct.net/poster/05192026/dbad4053e1.jpg,https://javct.net/v/fc2ppv-4915536,37,2026-06-15
FC2PPV-4918509,"Uncensored〈A black-haired bob 18 big breasted girl who is aiming for the Faculty of Education and C**ldcare〉 Her eyes shine when she sees someone else's cock, and she sucks it deep inside herself, masturbating so much that it makes her pussy so wet that it's completely exposed.",https://pic.javct.net/poster/05192026/fa4819316f.jpg,https://javct.net/v/fc2ppv-4918509,62,2026-06-15
