code,title,image_url,page_url,views,date_scraped
FC2PPV-4922764,Shafneet from Tochigi endless orgasm fuck and creampie bukkake on the verge of techno break,https://pic.javct.net/poster/05192026/21de407421.jpg,https://javct.net/v/fc2ppv-4922764,72,2026-06-18
FC2PPV-4921516,[First shot] A naughty dance instructor's sexual desire is infinite with an outdoor blow job and the cock is squeezed out by her pussy and seductive posture.,https://pic.javct.net/poster/05192026/11433ef212.jpg,https://javct.net/v/fc2ppv-4921516,90,2026-06-18
483TMG-003,"[Newcomer (Hinata: 21 years old)] ~ We are looking for women to appear in AV ~ A delicate, cute and sensitive beautiful girl who can easily squirt and cum!",https://pic.javct.net/poster/05192026/ea58ad700a.jpg,https://javct.net/v/483tmg-003,64,2026-06-18
SIRO-5688,Kintama Factory Sperm Mass Production Plump Ripe Beautiful Body [Iroha 35 years old] Boasts a man's bone with his sticky technique [First shot] AV application online AV experience shooting 2575,https://pic.javct.net/poster/05192026/42c8359ca8.jpg,https://javct.net/v/siro-5688,64,2026-06-18
FC2PPV-4922216,"[Uncensored/Complete amateur/Creampie/Squirting] Even though she's neat and clean, she has an ahegao face and has a thrilling orgasm regardless of her appearance. F-cup black hair, plump, 18 whole body convulsions orgasm. The best cum Creampie in a tight pussy for the first time in my life",https://pic.javct.net/poster/05192026/61b7907b24.jpg,https://javct.net/v/fc2ppv-4922216,21,2026-06-18
200GANA-3391,"A female college student with overk**l in sexual desire appears. She is so horny that her sensitivity is limited just by inserting a break tip, she convulses and reaches an astronomical number of climaxes that I can't count. She's an astronomical girl, Orihime-sama, and she made a milky way with a huge amount of squirt. Seriously soft, first shot 2310",https://pic.javct.net/poster/05192026/aba7af6de2.jpg,https://javct.net/v/200gana-3391,59,2026-06-18
FC2PPV-4899417,I received a lot from a very cute transsexual man for the first time IMEDAMAFC2,https://pic.javct.net/poster/05192026/2a175f2aba.jpg,https://javct.net/v/fc2ppv-4899417,36,2026-06-18
FC2PPV-4922072,[Individual shooting/Erotic chiropractor] Neat and clean housewife who looks like 〇〇 If you touch me that deep... My reason collapses as my too sensitive body is massaged and creampie raw massage,https://pic.javct.net/poster/05192026/c3aaa67340.jpg,https://javct.net/v/fc2ppv-4922072,41,2026-06-18
328HMDNV-897,"A middle-aged married woman who spent her 20s as an idol, abandoned her peaceful days after marriage and had an affair with a man with a big dick, creampie sex, in search of stimulation.",https://pic.javct.net/poster/05192026/27a38fbee2.jpg,https://javct.net/v/328hmdnv-897,80,2026-06-18
FC2PPV-4922412,"I thought it was tuna, but it turned out to be a natural product.The chubby Rimu/Sume of the sushi restaurant lies to her husband at lunchtime and uses someone else's dick to ascend to heaven.",https://pic.javct.net/poster/05192026/1916bc5a5a.jpg,https://javct.net/v/fc2ppv-4922412,67,2026-06-18
FC2PPV-4922306,"170cm tall, naturally healthy girl.She has the perfect amount of flesh and firmness from playing basketball.",https://pic.javct.net/poster/05192026/bef2002b2d.jpg,https://javct.net/v/fc2ppv-4922306,56,2026-06-18
FC2PPV-4917107,"[Individual video] Outdoor playback of a neat married woman, raw sex, raw creampie",https://pic.javct.net/poster/05192026/cf670c17c7.jpg,https://javct.net/v/fc2ppv-4917107,28,2026-06-18
259LUXU-1267,"Luxury TV 1261 In order to relieve her frustration, a beautiful tutor with a glamorous body catches the eye and appears in an AV. Her pent-up sexual desire increases her sensitivity, and she cums wildly while shaking her beautiful big breasts, which are full of destructive power that drives men crazy.",https://pic.javct.net/poster/05192026/03b623a967.jpg,https://javct.net/v/259luxu-1267,66,2026-06-18
FC2PPV-4919888,"Airi, a former volleyball player who is a true masochist, is 172cm tall, and her F-cup figure body is treated like a masturbator and creampied.",https://pic.javct.net/poster/05192026/565c68bb6f.jpg,https://javct.net/v/fc2ppv-4919888,91,2026-06-18
FC2PPV-4921972,[Uncensored] Perverted creampie uncle pick-up series 6th volume: Pick up a cute girl with big breasts and a shaved pussy who looks great in uniform cosplay and give her a real creampie,https://pic.javct.net/poster/05192026/ff0c39a55f.jpg,https://javct.net/v/fc2ppv-4921972,116,2026-06-18
FC2PPV-4921670,The friend who brought me the second healthy girl who is 170 cm tall has an I cup.,https://pic.javct.net/poster/05192026/2cdbe50282.jpg,https://javct.net/v/fc2ppv-4921670,54,2026-06-18
FC2PPV-4921564,[First shot] Newcomer [3 days only] Former Inter-High semi-finalist in the track and field club The idol of the class thrusts a large penis of the bottom of the school caste and releases a large amount deep inside ♥ *Undisclosed bonus included,https://pic.javct.net/poster/05192026/337f2b5977.jpg,https://javct.net/v/fc2ppv-4921564,88,2026-06-18
FC2PPV-4921902,"Uncensored Baby face, fair skin, F cup beauty, healthy body with big breasts Has participated in indoor high school, Physical beauty trained by volleyball, 18cm, pink, extremely narrow pussy spread - Oppai observation & masturbation super close-up close-up",https://pic.javct.net/poster/05192026/331648c200.jpg,https://javct.net/v/fc2ppv-4921902,20,2026-06-18
FC2PPV-4921544,Amelia Watson with her chubby thighs did some serious clear dildo masturbation with plenty of juice,https://pic.javct.net/poster/05192026/7777eacafe.jpg,https://javct.net/v/fc2ppv-4921544,49,2026-06-18
420HPT-059,"Nonoka (30) Amateur Hoi Hoi, Amateur Hoi Hoi Pet, Amateur, Black Hair, Super Masochistic, Obedient, Sensitive, Hedonist, Sex Friend, Jumping, Outdoors, Shame, Toy, Creampie, Gonzo, Documentary",https://pic.javct.net/poster/05192026/df3e8db048.jpg,https://javct.net/v/420hpt-059,104,2026-06-18
FC2PPV-4921548,"[Uncensored] Perverted creampie uncle pick-up series 5th volume, part 2: A tipsy and intense night with a neat and beautiful black-haired receptionist with outstanding style",https://pic.javct.net/poster/05192026/5b4c63d295.jpg,https://javct.net/v/fc2ppv-4921548,122,2026-06-18
FC2PPV-4921673,"[First anal exploration] After creampie, I tried to wash it, so the married woman boasted that she wouldn't get wet even if her husband punished her with anal pearls and denim.The semen pushed deep inside mixed with the vaginal secretions that overflowed from the private parts of the married woman and was returned to her husband as it was.",https://pic.javct.net/poster/05192026/858e1bba04.jpg,https://javct.net/v/fc2ppv-4921673,50,2026-06-18
FC2PPV-4920811,"[First photo shoot] Nako-chan, a neat and clean music college student who just moved to Tokyo from Tochigi in the countryside ♡ A fat bald old man's cloudy juice is poured into her vagina and fertilization is inevitable",https://pic.javct.net/poster/05192026/4c41378a19.jpg,https://javct.net/v/fc2ppv-4920811,58,2026-06-18
FC2PPV-4921135,"[Adult Eros] Beautiful, fair-skinned, slender elementary school piano teacher gives a raw cock reverse lesson to support a girl in love",https://pic.javct.net/poster/05192026/20e7f27adb.jpg,https://javct.net/v/fc2ppv-4921135,94,2026-06-18
