code,title,image_url,page_url,views,date_scraped
SIRO-5699,"The phantom silk breasts are real breasts The phantom breasts that the breast explorer Kada encountered are flexible and elastic that defy gravity, and the elasticity that envelops everything at the moment of contact.You will also encounter the miraculous treasure tromako that men have been pursuing since ancient times.You will be a witness to a miracle [First shot] AV application online AV experience shooting 2582",https://pic.javct.net/poster/05192026/bb2c55cda5.jpg,https://javct.net/v/siro-5699,67,2026-07-03
FC2PPV-4932391,"0392_0418_001 Kanna-chan, 20 years old, Miyu-chan, 19 years old. Her two real best friends' dirty PPKT sex friends are milking her in cowgirl position until her balls are empty. Pregnant creampie 3P orgy fuck (explosive)",https://pic.javct.net/poster/05192026/f92a511d88.jpg,https://javct.net/v/fc2ppv-4932391,138,2026-07-03
259LUXU-1889,"[Frustrated by her husband's cheating...Sexless young wife appears in AV] 27-year-old F-cup poster wife who has a sensitivity problem after a long time ""Treat me more like a woman..."" Pleasure revived with sweaty squirting, drooling deep throat blowjob Luxury TV 1876",https://pic.javct.net/poster/05192026/b6bb32cd45.jpg,https://javct.net/v/259luxu-1889,73,2026-07-03
MFCL-030,Ren.,https://pic.javct.net/poster/05192026/66082f73ee.jpg,https://javct.net/v/mfcl-030,87,2026-07-03
PASN-029,Sweaty and juicy summer real wet SEX,https://pic.javct.net/poster/05192026/a649bf0d3b.jpg,https://javct.net/v/pasn-029,121,2026-07-03
200GANA-3423,"When I gave a chocolate to a beautiful girl who looked like she was taking a selfie, I succeeded in bringing back the manga assistant.The gap in looks transformed her into a masochist perverted girl, and I was able to have the best sex lol.Maji soft-haired girl, first shoot 2318",https://pic.javct.net/poster/05192026/670bfdacc1.jpg,https://javct.net/v/200gana-3423,56,2026-07-03
FC2PPV-4931887,Behind-the-scenes course of a certain Kita-ku cosplay cafe ♥ A top ranking neat girl exposes her raw pussy in a private off-shot after an event & goes crazy in a lewd photo session,https://pic.javct.net/poster/05192026/38fe318f52.jpg,https://javct.net/v/fc2ppv-4931887,58,2026-07-03
FC2PPV-4931234,[Live streaming sex] Full face delivery SEX! A married woman who loves blowjobs is using a rotor,https://pic.javct.net/poster/05192026/2581f6d12b.jpg,https://javct.net/v/fc2ppv-4931234,40,2026-07-03
FC2PPV-4923490,"I left the remote control in my super cute and soothing girlfriend until she came to her room, and she wanted me to have her pussy flooded in full erotic mode, so I gave her a deep insemination [Face/Uncensored/Creampie]",https://pic.javct.net/poster/05192026/6afcaa3ca0.jpg,https://javct.net/v/fc2ppv-4923490,71,2026-07-03
FC2PPV-4932368,Only 1 person with uncensored experience from Aomori Music college student 18 readers Model special value 115 160 cm 45 kg E cup Raw cock inserted just 6 months after losing virginity ⇒ Creampie,https://pic.javct.net/poster/05192026/1a006c0d78.jpg,https://javct.net/v/fc2ppv-4932368,67,2026-07-03
FC2PPV-4932401,[No] Heir to a long-established store with a plump body,https://pic.javct.net/poster/05192026/bfb2286f0b.jpg,https://javct.net/v/fc2ppv-4932401,69,2026-07-03
892OERO-008,"A horny housewife nurse who wants to have sex without telling her husband has an affair with her. A big-assed big-breasted married woman who serves her sweetly, saying, ""I don't mind if you love me,"" is having an affair with a horny married woman who wants to have sex without telling her husband.The neat and elegant wife gets more and more stupid with pleasure, and she squirts repeatedly and cums inside that lewd pussy.",https://pic.javct.net/poster/05192026/f930afffd3.jpg,https://javct.net/v/892oero-008,69,2026-07-03
FC2PPV-4926586,"[Uncensored/Complete Amateur/Creampie/Squirting] Dirty perverted office lady, exciting squirts Unstoppable orgasmic squirting SEX, transcending the limits, 2 consecutive creampies in a flooded pussy that is absolutely l**king",https://pic.javct.net/poster/05192026/2780f9d51e.jpg,https://javct.net/v/fc2ppv-4926586,36,2026-07-03
FC2PPV-4923774,"A self-proclaimed manly man, but when he takes off his clothes he has a naughty H cup.",https://pic.javct.net/poster/05192026/260f2e408e.jpg,https://javct.net/v/fc2ppv-4923774,81,2026-07-03
SIRO-5697,A pervert fast food bitch appears. The sex that increases the sensitivity to the maximum with teasing play is the ultimate pleasure. The thought circuit is on the verge of being short-circuited by the orgasm that is repeated over and over again. [First shot] AV application online AV experience shooting 2581,https://pic.javct.net/poster/05192026/d719ffba5b.jpg,https://javct.net/v/siro-5697,62,2026-07-03
328CNSTV-019,[Verification of the established theory/Is it true that slender people are lewd?] Ripe wife raw sex special sex inside Ayano Kasumi 56 years old,https://pic.javct.net/poster/05192026/6313e9518a.jpg,https://javct.net/v/328cnstv-019,115,2026-07-03
FC2PPV-4930958,[First shot/SSS beautiful nude body] She is a member of a super famous talent fashion model agency and has an overwhelming style and sophisticated eroticism. She seduces men without telling her boyfriend and shoots semen inside her hot and tight vagina.,https://pic.javct.net/poster/05192026/c698ecaf07.jpg,https://javct.net/v/fc2ppv-4930958,90,2026-07-03
FC2PPV-4929915,[Cosplay] Night play with a cute rabbit with a fair skin and E cup. She wears a rabbit costume that is shocking and makes me feel so naughty that I can't stand it. I'm very excited and I'm very satisfied with the finish with two consecutive creampies.,https://pic.javct.net/poster/05192026/b9322e1dc9.jpg,https://javct.net/v/fc2ppv-4929915,60,2026-07-03
FC2PPV-4931634,"""Your dick is really disgusting! I got really horny after having sex with my best friend, so I exposed her inverted nipples and impregnated her with a creampie. Comes with 3 deluxe bonuses.",https://pic.javct.net/poster/05192026/77cdc2a77f.jpg,https://javct.net/v/fc2ppv-4931634,96,2026-07-03
FC2PPV-4931232,"[Face/Middle] I want it ♡ Please insert it ♡ A flirtatious battle with a G-cup beauty who wants a cock. At the end, she forgets the game and begs for creampie.",https://pic.javct.net/poster/05192026/eed2370a72.jpg,https://javct.net/v/fc2ppv-4931232,62,2026-07-03
FC2PPV-4931442,[First shoot] A beautiful body with transparent white skin and high potential is inseminated in a tight pussy that intensely seeks a man's big cock.,https://pic.javct.net/poster/05192026/f36f7c3c17.jpg,https://javct.net/v/fc2ppv-4931442,54,2026-07-03
FC2PPV-4931184,"Face Showing Case #139 where an amateur came to do naughty things - Haruna-chan (23), a beautiful office lady with an outstanding style who is good at blowjobs and gave me a lot of licking",https://pic.javct.net/poster/05192026/dcd27e8ae0.jpg,https://javct.net/v/fc2ppv-4931184,70,2026-07-03
FC2PPV-4930745,I took a picture of a beautiful married woman masseuse and it felt so good that I ejaculated.,https://pic.javct.net/poster/05192026/4f0549d7cd.jpg,https://javct.net/v/fc2ppv-4930745,96,2026-07-03
FC2PPV-4930925,"Although he says it's for the sake of a tall, slender woman he met on an app, it's mostly for the purpose of cock⁉ A large amount of creampie is made while making her sensitive pussy cum continuously with the insemination piston!!",https://pic.javct.net/poster/05192026/a67fd569f4.jpg,https://javct.net/v/fc2ppv-4930925,52,2026-07-03
