code,title,image_url,page_url,views,date_scraped
FC2PPV-4917073,[Opening sale] Perfect pussy is so tight and slimy that it's ruinous amateur JD gets creampied for the first time,https://pic.javct.net/poster/05192026/15e5a66c89.jpg,https://javct.net/v/fc2ppv-4917073,45,2026-06-10
FC2PPV-4916268,"[No Algae Bonus] Satsuki, a famous Hakata dialect CA with extremely cute and beautiful breasts, has 6 rounds of pistons to erect her uterus at her home where she lives with her boyfriend.",https://pic.javct.net/poster/05192026/2964fd60f9.jpg,https://javct.net/v/fc2ppv-4916268,74,2026-06-10
FC2PPV-4917072,"[Out of print] A fair-skinned, slender, black-haired, beautiful 18-year-old honor student has raw sex in a school uniform she has worn for three years during her youth ♥️ Her pink pussy is flooded with shame and excitement ♥️ At the end, she looks ecstatic with her first experience of facial cumshot and oral ejaculation ♥️",https://pic.javct.net/poster/05192026/a4f260e4d2.jpg,https://javct.net/v/fc2ppv-4917072,143,2026-06-10
FC2PPV-4917798,I did it with Poke◯ and canary E cup model canary naughty part 2,https://pic.javct.net/poster/05192026/fcd3a46227.jpg,https://javct.net/v/fc2ppv-4917798,88,2026-06-10
FC2PPV-4917815,[No facial appearance] [Individual shooting off-paco] Zezero even costume's big voice and lewd big breasts layer and individual shooting creampie sex [with review bonus],https://pic.javct.net/poster/05192026/6de9cfa60d.jpg,https://javct.net/v/fc2ppv-4917815,101,2026-06-10
FC2PPV-4915768,"[No] Twin tails that look great on you, a small face, too cute, and a slender body trained by cheerleaders, and a strong trunk riding a spider is unbearable... Massive facial cumshot and creampie *Bonus High resolution",https://pic.javct.net/poster/05192026/b369fe1943.jpg,https://javct.net/v/fc2ppv-4915768,43,2026-06-10
FC2PPV-4917934,"It's the reality of young people moving to Tokyo after falling ill. A girl from the countryside (family D type) trembles with nervousness as she applies for ""heavy thick semen. Creampie DE punishment.''",https://pic.javct.net/poster/05192026/3a4ea1f71e.jpg,https://javct.net/v/fc2ppv-4917934,52,2026-06-10
FC2PPV-4917853,*Office Barre [Yellow] A once-in-a-millennium angel ⓷ Overwhelmingly cute but attractive fair-skinned idol's raw sex,https://pic.javct.net/poster/05192026/da05cd13cf.jpg,https://javct.net/v/fc2ppv-4917853,42,2026-06-10
390JNT-120,"[Unstoppable desire and overflowing tide] [Big ass short wife x creampie x 3P] [Adult immoral lingerie sex] Sexual desire increases as she gets older, no matter how hard she fucks even though she has a husband, it's not enough... Such a married woman has her first 3P in her life and overflows with the desire to collapse her rationality, squirt, squirt sex crazy, orgasm disordered, dripping wet creampie sex [3 years of marriage, Akine, 30 years old] #37",https://pic.javct.net/poster/05192026/3bd79b7efa.jpg,https://javct.net/v/390jnt-120,119,2026-06-10
SIRO-5684,"A lewd perverted office lady applied to relieve her daily stress due to sexual harassment from her boss. She had built up too much stress and was releasing it through masturbation, but the office lady who was being pounded hard from behind was the sexiest one. [First shot] AV application online AV experience shooting 2570",https://pic.javct.net/poster/05192026/4775103160.jpg,https://javct.net/v/siro-5684,65,2026-06-10
300MIUM-1423,"[Until the proud beauty collapses, and then] A beautiful woman who is stalked and makes men fall in love with her soft boobs and buttocks...",https://pic.javct.net/poster/05192026/595f76dd54.jpg,https://javct.net/v/300mium-1423,65,2026-06-10
FC2PPV-4917450,"[Positive reaction] The strongest visual F cup 18 years old'' Serious creampie on a dangerous day, later found out pregnant Climax video of simultaneous double penetration * Only a few left",https://pic.javct.net/poster/05192026/dfd470f09d.jpg,https://javct.net/v/fc2ppv-4917450,44,2026-06-10
546EROFV-377,"My girlfriend doesn't work or do housework, but it's okay because I can have creampie sex as much as I want.",https://pic.javct.net/poster/05192026/59f52c32e6.jpg,https://javct.net/v/546erofv-377,70,2026-06-10
FC2PPV-4916214,"[Slender] A fair-skinned 18-year-old slender person eats something that suits her cosplay, and her sensitivity has awakened. Her beautiful body twists and turns, and she is extremely satisfied with continuous creampie and bukkake that reaches all the way to her face.",https://pic.javct.net/poster/05192026/0324c1bf6f.jpg,https://javct.net/v/fc2ppv-4916214,60,2026-06-10
FC2PPV-4917101,[Face showing] A busty housewife with unmeasurable K-cups who is played with in 3P actually loves sex and squirts a lot,https://pic.javct.net/poster/05192026/354074dffd.jpg,https://javct.net/v/fc2ppv-4917101,39,2026-06-10
FC2PPV-4916197,[Creampie] A married woman with a high sexual desire who has a sensual body that can reach climax without hesitation with another person's cock without any aftertaste.,https://pic.javct.net/poster/05192026/3d2cf25943.jpg,https://javct.net/v/fc2ppv-4916197,20,2026-06-10
FC2PPV-4917550,"[No]**, I was surprised that the daycare worker's behind-the-scenes face fetish video was allowed to go live [Download available in review]",https://pic.javct.net/poster/05192026/37f6beb934.jpg,https://javct.net/v/fc2ppv-4917550,45,2026-06-10
FC2PPV-4917039,"[Complete Amateur Creampie] A slender and very beautiful office lady likes to have her pussy licked, her big dick licked, and then ejaculated inside.Two raw creampies.",https://pic.javct.net/poster/05192026/631330dbd1.jpg,https://javct.net/v/fc2ppv-4917039,44,2026-06-10
FCH-124,[Completely private room personal] Close service leads to ejaculation...Muscle training sex man Vol.2,https://pic.javct.net/poster/05192026/b1e84f8908.jpg,https://javct.net/v/fch-124,214,2026-06-10
420HOI-397,"Magumi (23) Amateur Hoi Hoi Z, Amateur, Documentary, Gonzo, Beautiful Girl, Innocent, Slender, Masturbation, Electric Massager, Squirting, Facial",https://pic.javct.net/poster/05192026/d9cd16dfa9.jpg,https://javct.net/v/420hoi-397,91,2026-06-10
200GANA-3395,"[Breaking News] H-cup busty woman comes to perverted art exhibition, her body becomes work of art, first shot of a serious softie 2305",https://pic.javct.net/poster/05192026/13017d76f8.jpg,https://javct.net/v/200gana-3395,70,2026-06-10
FC2PPV-4916153,I haven't had sex in 1 year on a business trip to the local area. I took sex with a female accounting employee. The erotic moaning voice is the best,https://pic.javct.net/poster/05192026/fd8a3186ac.jpg,https://javct.net/v/fc2ppv-4916153,17,2026-06-10
FC2PPV-4916703,"A devilishly beautiful woman with big breasts and a fair-skinned beautiful body, her true identity is a former entertainment manager.The way she goes crazy after being injected with semen over and over again is a sight to behold.",https://pic.javct.net/poster/05192026/b45d65da75.jpg,https://javct.net/v/fc2ppv-4916703,96,2026-06-10
SIMW-008,Yumi & Ruka,https://pic.javct.net/poster/05192026/3aa8abab15.jpg,https://javct.net/v/simw-008,79,2026-06-10
