code,title,image_url,page_url,views,date_scraped
FC2PPV-4916209,"Enjoying the best J cup, rubbing, pinching, shaking, and licking the cock, the dream titty fuck that completely envelops the cock and squeezes out the excited balls over and over again until it's empty [faceless creampie]",https://pic.javct.net/poster/05192026/a60d08b317.jpg,https://javct.net/v/fc2ppv-4916209,49,2026-06-12
FC2PPV-4919133,"[No/Raw creampie] **pyjpx*jsps A small and very cute little devilish JD came to our store after receiving an email that new massage equipment was in stock.Once again, she requested a longer oil.",https://pic.javct.net/poster/05192026/99320c40e0.jpg,https://javct.net/v/fc2ppv-4919133,49,2026-06-12
200GANA-3386,"Are gamer girls really sexy? A super cute gamer girl who made a boyfriend through gaming comes along when I pick her up, and her conversation and eroticism are just too good. A real softie, first shoot 2307",https://pic.javct.net/poster/05192026/2e4aac0a59.jpg,https://javct.net/v/200gana-3386,60,2026-06-12
328HMDNV-930,A J-cup big-breasted married woman who works at a supermarket! A man comes to the store for her boobs and gets so excited that she has sex with him and has sex with him.,https://pic.javct.net/poster/05192026/ed3bdf4c2e.jpg,https://javct.net/v/328hmdnv-930,70,2026-06-12
SIRO-5685,"A beautiful woman, a young wife, and a super masochistic three-way erotic wife is so sexless that she can't hold back and applies for the job.Is her husband okay?She's even doing a self-cum on her own.She cums many times with the intense piston. [First shot] AV application online AV experience shooting 2571",https://pic.javct.net/poster/05192026/7e5e830f86.jpg,https://javct.net/v/siro-5685,62,2026-06-12
FC2PPV-4918471,[Face released] Tokyo psychosomatic clinic 1st year new graduate beautiful nurse Limited public video of dangerous day without rubber band * Only a few left,https://pic.javct.net/poster/05192026/66e6fd68ef.jpg,https://javct.net/v/fc2ppv-4918471,67,2026-06-12
FC2PPV-4918663,"[No] This month's No. 1 No. 1 No. 1 in this month's book nominations. Miss Menes, who has top-notch techniques and overwhelming visuals that will soothe your body and mind, offers the finest private service to traveling French people. [Overseas version] Bonus included",https://pic.javct.net/poster/05192026/61aaaf46ab.jpg,https://javct.net/v/fc2ppv-4918663,43,2026-06-12
FC2PPV-4917927,"[Individual shot/Outdoor blowjob & sex] <Former underground idol black hair> Erotic woman who enjoys cock even though she is shy. Gonzo shooting while pursuing various sexual habits is the best. After all, amateurs will be excited!!",https://pic.javct.net/poster/05192026/2d87d80f43.jpg,https://javct.net/v/fc2ppv-4917927,31,2026-06-12
FC2PPV-4918227,"F-cup, fair-skinned, slender, beautiful Mizuki-chan, wearing a maid outfit, stands by the window from behind and makes her face turn red, saying, ""Ah... I'm cumming and convulsing, and I'm training her to cum inside my wet pussy.''",https://pic.javct.net/poster/05192026/3dfc544a5c.jpg,https://javct.net/v/fc2ppv-4918227,48,2026-06-12
FC2PPV-4918003,[Super Dreadnought 18 Doku/Solid MIX] Japanese style restaurant staff who swallows every drop of ejaculation that has been stored for 5 days with a half-open mouth,https://pic.javct.net/poster/05192026/6a69b0257b.jpg,https://javct.net/v/fc2ppv-4918003,12,2026-06-12
FC2PPV-4917985,[Uncensored/Complete Amateur/Creampie/Squirting] An affair with a beautiful wife who is a former reader model She's actually a slut and a succubus ⤴ Wet her sensitive shaved pussy and do yoga,https://pic.javct.net/poster/05192026/7f76d075e0.jpg,https://javct.net/v/fc2ppv-4917985,33,2026-06-12
FC2PPV-4918442,[Uncensored] Awakening of masochistic instincts with big dick and spanking on the behind-the-scenes face of the top university pageant queen ♥ Over 100 minutes with undisclosed bonuses,https://pic.javct.net/poster/05192026/574d81c5ff.jpg,https://javct.net/v/fc2ppv-4918442,73,2026-06-12
FC2PPV-4918197,My first private sex video with a gal-style hostess! Continuous piston creampie finish deep inside the plump body with beautiful breasts and beautiful butt,https://pic.javct.net/poster/05192026/095c5aa45e.jpg,https://javct.net/v/fc2ppv-4918197,56,2026-06-12
FC2PPV-4917952,"[Limited to 200 pieces.Price] The beautiful Shotoka cosplay maid and cheerleader is a man's dream pervert, so I made her insides and face all messed up lol",https://pic.javct.net/poster/05192026/349328686a.jpg,https://javct.net/v/fc2ppv-4917952,70,2026-06-12
FC2PPV-4915538,"Case #136 where an amateur came to do naughty things with her face exposed. The case of Miku-chan (20), a cute fairy who was given a toy and a lot of mouth fuck.",https://pic.javct.net/poster/05192026/2e031dc88c.jpg,https://javct.net/v/fc2ppv-4915538,56,2026-06-12
FC2PPV-4918326,"[Falling in love with a random smile, the temptation of long black hair] Hitomi, 18 years old with divine style, is in agony for the first time with a big cock over 20 cm and has a large amount of creampie, and we have captured it on camera",https://pic.javct.net/poster/05192026/07035db15e.jpg,https://javct.net/v/fc2ppv-4918326,44,2026-06-12
FC2PPV-4916530,[S-class beauty] A Korean-style beauty is creampied in large quantities and is so horny that she is so satisfied that she almost dies.,https://pic.javct.net/poster/05192026/b348172ac8.jpg,https://javct.net/v/fc2ppv-4916530,81,2026-06-12
FC2PPV-4899293,Three consecutive creampies that impregnate a beautiful receptionist [Super value pack],https://pic.javct.net/poster/05192026/dde4359d8b.jpg,https://javct.net/v/fc2ppv-4899293,155,2026-06-12
FC2PPV-4911543,"""I'm sorry...'' ""Please let me cum...'' A pathetic 18-year-old girl who is licking the adult world is brutally trained by her uncle",https://pic.javct.net/poster/05192026/a5eda76e51.jpg,https://javct.net/v/fc2ppv-4911543,99,2026-06-12
200GANA-3404,"The most defenseless, fluffy college girl I want to protect is massaged to the point where she writhes lewdly with just one fingertip, the forbidden gap of a healing beauty, a real softie, first shot 2306",https://pic.javct.net/poster/05192026/74b3443b62.jpg,https://javct.net/v/200gana-3404,62,2026-06-12
420ERK-104,"Suzu-chan (21) Amateur Hoi Hoi, Erotic Kyun, Amateur, Shy, Big Tits, Urination, Wetting, Shaved, Cosplay, Facial, Gonzo, Documentary",https://pic.javct.net/poster/05192026/b2fa2f5a38.jpg,https://javct.net/v/420erk-104,84,2026-06-12
892OERO-003,"""I'm not the only one who's doing bad things."" At first, she was planning to get revenge on her husband, but then she realized that this dick was so good that she started shaking her hips and moaning. She mercilessly cums in her long-lost pussy, which has been left alone by her husband.",https://pic.javct.net/poster/05192026/ad22eb7175.jpg,https://javct.net/v/892oero-003,55,2026-06-12
FC2PPV-4914752,[Individual shooting] Sex with a slender beauty to your heart's content! SEX full of immorality!,https://pic.javct.net/poster/05192026/6d22d796ec.jpg,https://javct.net/v/fc2ppv-4914752,53,2026-06-12
FC2PPV-4917798,I did it with Poke◯ and canary E cup model canary naughty part 2,https://pic.javct.net/poster/05192026/fcd3a46227.jpg,https://javct.net/v/fc2ppv-4917798,88,2026-06-12
