code,title,image_url,page_url,views,date_scraped
FC2PPV-4923567,224 A former idol (with pubic hair) who is a hot topic on FC2!?I got a valuable vaginal camera video of her getting 2 shots inside.,https://pic.javct.net/poster/05192026/8edafb7ffe.jpg,https://javct.net/v/fc2ppv-4923567,50,2026-06-20
FC2PPV-4923516,[Creampie] A slutty wife who has been asking for a hard cock with both words and deeds. She stopped the verbal a**se and continued to shake the man's body as much as she wanted.,https://pic.javct.net/poster/05192026/ffa2e94860.jpg,https://javct.net/v/fc2ppv-4923516,32,2026-06-20
FC2PPV-4923612,[fntia Immediate Permanent BAN] A controversial work that records two consecutive vaginal cum shots of an I-cup breasted gravure idol close to hitting the uterus. This is a project that is absolutely impossible in Japan. [Creampie short video bonus included],https://pic.javct.net/poster/05192026/aadbe2b187.jpg,https://javct.net/v/fc2ppv-4923612,33,2026-06-20
FC2PPV-4923716,"[First shot/individual shot] A black-haired, neat, big-breasted lady❣ Tall, beautiful office lady with big breasts and H cup♡ Observation of live changing clothes with her beautiful naked body fully exposed. Raw insertion into a beautiful shaved pussy and continuous thick creampie ♡ [Bonus: High resolution] [Main story/No face mo.]",https://pic.javct.net/poster/05192026/82b3f38557.jpg,https://javct.net/v/fc2ppv-4923716,78,2026-06-20
FC2PPV-4923569,[Facial cumshot x cum swallowing] 22 minutes and 7 shots of 170cm tall (8 head and body) beautiful woman Ten giving her two things with semen,https://pic.javct.net/poster/05192026/c42e89ba86.jpg,https://javct.net/v/fc2ppv-4923569,21,2026-06-20
FC2PPV-4923256,"[Powerful POV Men-S 11] The best H-cup S-class beauty from a healthy store without nudes gives a close-up oil massage, the best titty fuck, and a teasing blowjob that blows away all reason!!",https://pic.javct.net/poster/05192026/70d61c6e32.jpg,https://javct.net/v/fc2ppv-4923256,19,2026-06-20
FC2PPV-4922865,A married nursery school teacher at a kindergarten with a cute smile and long black hair sometimes gets cuckolded by the big cock of a student's father.,https://pic.javct.net/poster/05192026/203968f75b.jpg,https://javct.net/v/fc2ppv-4922865,38,2026-06-20
FC2PPV-4923595,SEX to break off any regrets with an ex-boyfriend ♡ Apparel clerk who looks like Nana Komatsu ♡ Creampie with a sophisticated and neat beauty that can be seen even through the mask,https://pic.javct.net/poster/05192026/5d47244930.jpg,https://javct.net/v/fc2ppv-4923595,50,2026-06-20
FC2PPV-4923167,"I love to stroke my dick lovingly... I love it with my dick... I love it with my■ pucker thigh, Amelia Watson. I did it. Seriously, juice is plenty.",https://pic.javct.net/poster/05192026/a7c65356c9.jpg,https://javct.net/v/fc2ppv-4923167,97,2026-06-20
FC2PPV-4923504,"[Uncensored x personal photography] * * pyjpx * jsps Ara Furuki, a mature wife with pubic hair and gray hair, once again... her husband was absent from the pachinko, and the mature woman BBA cummed with the use of her first toy at the same time when she was lonely.",https://pic.javct.net/poster/05192026/fe4fa6deea.jpg,https://javct.net/v/fc2ppv-4923504,67,2026-06-20
FC2PPV-4923482,Carefully selected female gacha foreplay compilation of super cute amateur women's girls [uncensored],https://pic.javct.net/poster/05192026/c17745e318.jpg,https://javct.net/v/fc2ppv-4923482,74,2026-06-20
FC2PPV-4923525,"[First shot] A 152cm Starbucks employee with beautiful brown breasts gets violently penetrated by a foreigner-sized big cock, and squeezes the semen with her well-balanced beautiful body that sucks it in with a deep throat blowjob.",https://pic.javct.net/poster/05192026/a0da8408d4.jpg,https://javct.net/v/fc2ppv-4923525,68,2026-06-20
FC2PPV-4923025,Creampie sex education for a natural teenage young wife who came wearing a T-shirt with [First Precious Natural Shaved Pussy]*,https://pic.javct.net/poster/05192026/55a79efe1f.jpg,https://javct.net/v/fc2ppv-4923025,51,2026-06-20
FC2PPV-4921957,[No] First facial cumshot in my life A cute and fluffy beauty whose areolas are a little bigger and darker in color is erotic ⤴ A lot of it is applied and it's sticky ⤴ *Bonus High quality,https://pic.javct.net/poster/05192026/4702803f2d.jpg,https://javct.net/v/fc2ppv-4921957,53,2026-06-20
FC2PPV-4921922,"[First shoot] Adult sex is performed on a secret woman who is slightly interested in naughty things. In the first shoot, she feels pleasure from intense play for the first time. At the end, she is overwhelmed with emotion with the creampie finish without a rubber band.",https://pic.javct.net/poster/05192026/73be8b3982.jpg,https://javct.net/v/fc2ppv-4921922,101,2026-06-20
393OTIM-659,Without telling my husband...I take an extramarital day trip.,https://pic.javct.net/poster/05192026/dbfa62550f.jpg,https://javct.net/v/393otim-659,40,2026-06-20
393OTIM-660,Secretly from my husband... An affair day trip Leona,https://pic.javct.net/poster/05192026/0405d8bfc5.jpg,https://javct.net/v/393otim-660,39,2026-06-20
393OTIM-661,Without telling my husband... An affair day trip Rui,https://pic.javct.net/poster/05192026/9a6819dea0.jpg,https://javct.net/v/393otim-661,80,2026-06-20
393OTIM-662,Don't tell my husband... it should be an adulterous day trip,https://pic.javct.net/poster/05192026/d311c10da1.jpg,https://javct.net/v/393otim-662,80,2026-06-20
801SKEJ-078,Yume (Beautiful big breasted idol x creampie),https://pic.javct.net/poster/05192026/589b590a93.jpg,https://javct.net/v/801skej-078,76,2026-06-20
277DCV-305,"[Don't worry, Ryoko Hiro from that time was cute, had big breasts, had a good personality, and was erotic SP] A kiss and a blowjob made her possessed by an erotic devil. Her expression is ecstatic. The white of her eyes. The abnormal sexual desire and stamina of a former swimmer. Cowgirl position [S rank] Fucked [S rank] ⇒ S SS Rank Fellatio The man feels good, and it feels good for me too ⇒ I can't help but cum just by touching the erogenous zones of my entire body ⇒ 2 real orgasms... For the last resort that's still missing ⇒ ""We're looking for men and women who are watching this...'' Can I take you home? case.296",https://pic.javct.net/poster/05192026/eb1e63c13f.jpg,https://javct.net/v/277dcv-305,95,2026-06-20
200GANA-3397,"The birth of a sex friend that started with a Tamagotchi A beautiful woman was also attracted to cute things and ended up having serious sex, not a game lol Seriously soft, first shot 2311",https://pic.javct.net/poster/05192026/4f02ac7cdf.jpg,https://javct.net/v/200gana-3397,64,2026-06-20
FC2PPV-4923249,"0414_002 Kanna-chan, 18 years old, a young wife with a c**ld who can't stop having secret meetings even if her husband finds out about her last NTR sex video, and if he finds out, she'll walk the tightrope of divorce immediately, part 2 of creampie fuck (explosion)",https://pic.javct.net/poster/05192026/7864c4d1ea.jpg,https://javct.net/v/fc2ppv-4923249,167,2026-06-20
FC2PPV-4923358,[Uncensored/Creampie/Face exposed/Bonus included] A married woman who only knows men from her arranged marriage husband,https://pic.javct.net/poster/05192026/8136c9fa40.jpg,https://javct.net/v/fc2ppv-4923358,59,2026-06-20
