code,title,image_url,page_url,views,date_scraped
FC2PPV-4927279,"0407_002 Hana-chan, 21 years old, decided to make a series until she got pregnant during an AV shoot.She impregnated her desire to make her lewd H cup breasts bigger, and when the old man made it come true, she also made her stomach bigger (explosive)",https://pic.javct.net/poster/05192026/e8903ebfa4.jpg,https://javct.net/v/fc2ppv-4927279,178,2026-06-27
300MIUM-1373,"[Newcomer] There is nutrition that can only be obtained from the nakedness of a smart woman lol. She is an honor student and can take care of herself, so her body is super beautiful and her skin is smooth lol.",https://pic.javct.net/poster/05192026/45ac6f01e6.jpg,https://javct.net/v/300mium-1373,72,2026-06-27
200GANA-3401,"The moment a perfect woman collapses, she loses her reason at the tip of a finger and lets out a sweet gasp. The forbidden gap of a ""dekiru woman''. A serious softie, first shot 2314",https://pic.javct.net/poster/05192026/068eed382f.jpg,https://javct.net/v/200gana-3401,69,2026-06-27
FC2PPV-4925979,"[Commemorating the advance to the World Cup Final T] We gathered 3 women with no connection to each other, and they had no time to be shy and were attacked one after another, and their pussies were on the verge of breakdown. They were ejaculated so much that it was impossible to count the ejaculations. A party with a wide-open libido that won't stop.",https://pic.javct.net/poster/05192026/3b15b8b7d2.jpg,https://javct.net/v/fc2ppv-4925979,85,2026-06-27
FC2PPV-4926023,"[No] Beautiful F-cup big breasts with pure white smooth skin.She is tall and has long limbs, and she has an outstanding style⤴ Swallowing Creampie *Bonus High resolution",https://pic.javct.net/poster/05192026/3a3cdbb1be.jpg,https://javct.net/v/fc2ppv-4926023,52,2026-06-27
FC2PPV-4926190,*Big clit [first/none] A pachinko clerk who is dependent on gambling and has no money and is ready to perform. He impregnates the girlfriend with the maximum sensitivity of soufflé breasts and performs a final performance.,https://pic.javct.net/poster/05192026/0fba587d6b.jpg,https://javct.net/v/fc2ppv-4926190,43,2026-06-27
FC2PPV-4927418,"The most perverted woman in Japan is this one. ""I want you to break it harder and harder. This perverted gal is waiting with all her might in a pose that you should use.''",https://pic.javct.net/poster/05192026/6edb87fd3f.jpg,https://javct.net/v/fc2ppv-4927418,52,2026-06-27
FC2PPV-4927741,"[First shot] A beautiful big breasts and a whale-like constitution, a super sensitive beautiful body is pistoned deep into the vagina by a big dick for the first time in a while, and says, ""No, it hits the back...'' and continuous climax floods. Hot semen is injected into the highly sensitive pussy.",https://pic.javct.net/poster/05192026/06093cd8df.jpg,https://javct.net/v/fc2ppv-4927741,54,2026-06-27
FC2PPV-4927355,"[Uncensored x Personal Shooting] **pyjpx*jsps My mother-in-law found out about my red erotic lingerie. She told me to throw it away, but it was a waste, so I wore it today as a last memory lol",https://pic.javct.net/poster/05192026/ddcbe74ac4.jpg,https://javct.net/v/fc2ppv-4927355,56,2026-06-27
FC2PPV-4926813,"[Face, creampie] The extremely erotic *san who was popular last time gave a sticky blowjob, and her beautiful big breasts and beautiful pussy were pressed against her boner and she ejaculated.",https://pic.javct.net/poster/05192026/30f82d771d.jpg,https://javct.net/v/fc2ppv-4926813,69,2026-06-27
FC2PPV-4925840,"[First shoot / 2 shots] This is a sex battle with a fair-skinned beautiful naked woman who is a monster of sexual desire even though she is so cute. Even the cameraman can't resist and immediately joins in the fight, but he does his best to make you ejaculate in large quantities in seconds.",https://pic.javct.net/poster/05192026/b84a46fdfc.jpg,https://javct.net/v/fc2ppv-4925840,88,2026-06-27
FC2PPV-4925697,[No] Completely unprocessed 19 years old ♡ Has armpit hair and pubic hair ♡ Look at the natural secret zone on her delicate figure ♡ [SP additional benefits],https://pic.javct.net/poster/05192026/c97346930a.jpg,https://javct.net/v/fc2ppv-4925697,43,2026-06-27
FC2PPV-4923982,"She's a slender slender girl with small breasts that shows off her ribs when she's pussy-fucking, and 2 ejaculations are ejaculated with a strong piston on her slender body that's about to break. If you like plump things, it's better not to watch it. [Facial exposure/Uncensored/Creampie]",https://pic.javct.net/poster/05192026/f01da546f3.jpg,https://javct.net/v/fc2ppv-4923982,80,2026-06-27
FC2PPV-4925085,"Uncensored Super Cute ❤ Former Idol Research Student 18 ♡ Sequel Uniform twin tail loose socks, creampie in a narrow pussy with natural pubic hair without a rubber band\!",https://pic.javct.net/poster/05192026/979b470aff.jpg,https://javct.net/v/fc2ppv-4925085,53,2026-06-27
FC2PPV-4926354,"[43-year-old mother of two c**ldren] **pyjpx*jsps I forgot about being exposed and safe sex, and became just a female bitch who enjoys raw sex and creampie with her face exposed lol",https://pic.javct.net/poster/05192026/8efca51b1c.jpg,https://javct.net/v/fc2ppv-4926354,64,2026-06-27
FC2PPV-4926294,"[Single shot] When I handed the remote control vibrator to Yuka-chan, who loves everyone, it hit her huge clitoris and even more, she used a persistent vibrator to spray a large amount of semen inside and outside (SNN-54)",https://pic.javct.net/poster/05192026/98b626d72b.jpg,https://javct.net/v/fc2ppv-4926294,38,2026-06-27
FC2PPV-4927200,"[Fntia freezes because it's too extreme] **pyjpx*jsps An I-cup idol with divine breasts is exposed by the window and exposed! ""Absolutely not! People will see it! Two consecutive creampies in a sense of immorality!'' It's a video that can never be published as it was featured in a weekly magazine",https://pic.javct.net/poster/05192026/afff6d8bd6.jpg,https://javct.net/v/fc2ppv-4927200,34,2026-06-27
FC2PPV-4927068,[Raw Dollar / Uncensored] 2 consecutive raw insertions into the beautiful E-cup breasts!! Plenty of thick sperm from the plump BODY's hairy pussy!! Original version!!,https://pic.javct.net/poster/05192026/3781c0b131.jpg,https://javct.net/v/fc2ppv-4927068,44,2026-06-27
FC2PPV-4926055,Super cute and neat Chihiro-chan's gonzo debut,https://pic.javct.net/poster/05192026/cb8806ae5b.jpg,https://javct.net/v/fc2ppv-4926055,55,2026-06-27
SIRO-5692,"A 170cm tall girl with an outstanding figure comes to us. When she gets excited, her face flushes, her heart rate increases, and her b**od pressure increases. She looks like a carnivore in front of the actor's big dick. [First shot] AV application online AV experience shooting 2578",https://pic.javct.net/poster/05192026/1148314cc5.jpg,https://javct.net/v/siro-5692,63,2026-06-27
FC2PPV-4923369,[No] Top secret video of a former gravure idol with huge breasts having sex all day long Ana Kawai [High resolution with bonus] [24 hours limited sale],https://pic.javct.net/poster/05192026/974ba18e3d.jpg,https://javct.net/v/fc2ppv-4923369,132,2026-06-27
FC2PPV-4926632,[Amateur appearance] Beautiful new graduate nursery teacher with big breasts'' Rich blowjob & creampie extreme sexual act shooting Best continuous orgasm ever Treasured private individual shooting released * Only a few left,https://pic.javct.net/poster/05192026/56f80cddff.jpg,https://javct.net/v/fc2ppv-4926632,44,2026-06-27
FC2PPV-4926546,"[No] Transparent, fair-skinned, beautiful big breasts, beautiful woman with a beautiful face ☆ Semen overflows from her shaved pussy, wanting a creampie press",https://pic.javct.net/poster/05192026/a19cfd674d.jpg,https://javct.net/v/fc2ppv-4926546,50,2026-06-27
FC2PPV-4926471,"[Uncensored/Complete Amateur/Creampie/Squirting] Former 〇〇 Dome No. 1 Seller On the other side of the absolute orgasm with a crazy voice and repeated convulsions, I mercilessly thrust into her tight pussy and had my first creampie in my life.",https://pic.javct.net/poster/05192026/030b8c5826.jpg,https://javct.net/v/fc2ppv-4926471,24,2026-06-27
