code,title,image_url,page_url,views,date_scraped
FC2PPV-4927496,"[Uncensored] Kaori, a super masochist new wife who gets fucked raw with someone else's dick because her husband cheated on her",https://pic.javct.net/poster/05192026/51e5443940.jpg,https://javct.net/v/fc2ppv-4927496,59,2026-06-29
FC2PPV-1390632,"I filmed my ex-wife, who looks like Neko Matsushima and has an outstanding figure, who still comes to me for creampie even though we got divorced.",https://pic.javct.net/poster/05192026/b9295ad64a.jpg,https://javct.net/v/fc2ppv-1390632,14,2026-06-29
FC2PPV-4926396,"[No] I asked a cute 24-year-old girl who was alone after the last train to come to the pick-up room, and as a result, her eyes lit up and she immediately fucked him, and she was a real angel as she accepted the creampie with a smile [Overseas version] Bonus included",https://pic.javct.net/poster/05192026/ce5ff8188e.jpg,https://javct.net/v/fc2ppv-4926396,43,2026-06-29
FC2PPV-4929512,"[World Cup class ♡ Pussy & anal ✖️ The moment when her real face is disturbed by AF] 18 year old Nozomi takes on the challenge of her first creampie & agony anal SEX It feels so good to be throbbing in her ass ♡ Gentlemen, please enjoy the moment when she cums wildly with a big cock over 20 cm",https://pic.javct.net/poster/05192026/836c7fa81c.jpg,https://javct.net/v/fc2ppv-4929512,42,2026-06-29
FC2PPV-4929849,"[First shot/18 year old generation] Innocent real nursing school student (barely legal 3rd year student) with 1 experience teaching a man to an innocent girl in special training I was aiming to be a nurse, but instead I got an injection",https://pic.javct.net/poster/05192026/b8a0df3e1f.jpg,https://javct.net/v/fc2ppv-4929849,117,2026-06-29
FC2PPV-4929598,"Sumire (18) Anal licking, creampie, anal penetration ATM, and other unreleased scenes are included.",https://pic.javct.net/poster/05192026/6186e5b0c2.jpg,https://javct.net/v/fc2ppv-4929598,114,2026-06-29
FC2PPV-4925304,1 person experience Cute E cup plump female college student (20) with a short cut is pounded hard by her perverted boyfriend's big penis,https://pic.javct.net/poster/05192026/400a0d9b82.jpg,https://javct.net/v/fc2ppv-4925304,67,2026-06-29
FC2PPV-4929886,[Horse Riding Tongue Cum Swallowing] 19 year old JD stretches his tongue to the limit and enthusiastically welcomes sperm on the tongue red carpet. Tongue cum swallowing.,https://pic.javct.net/poster/05192026/c8f7c3f892.jpg,https://javct.net/v/fc2ppv-4929886,42,2026-06-29
FC2PPV-4919833,"[141] I'm so happy that you're such a charming, slender and beautiful lady who's greedy for erotica and makes me tremble over and over again with her body that makes me cum easily.",https://pic.javct.net/poster/05192026/48342445da.jpg,https://javct.net/v/fc2ppv-4919833,39,2026-06-29
FC2PPV-4929323,[Uncensored] Japanese boy vs. blonde girl. A blonde girl caught on SNS. She was a very erotic girl who suddenly asked for me as soon as I entered her room. I also creampied her in her ass hole d(*-*)b Review includes high quality ZIP,https://pic.javct.net/poster/05192026/59384c3f98.jpg,https://javct.net/v/fc2ppv-4929323,74,2026-06-29
FC2PPV-4929926,"#25-year-old science company employee, character-destructive orgasm...Intense madness that she can never show to her boyfriend",https://pic.javct.net/poster/05192026/063276df19.jpg,https://javct.net/v/fc2ppv-4929926,41,2026-06-29
FC2PPV-4929646,[No] 18 years old with plump big breasts and big butt ☆ Specialty ** Raw creampie at hotel,https://pic.javct.net/poster/05192026/3a8d0ae81c.jpg,https://javct.net/v/fc2ppv-4929646,40,2026-06-29
SIRO-5693,"Introducing a tattooed woman who can't hold back her sexual desire and openly has sex even in public. Check out her voluptuous nude body with a big boobs of ""Ai ga ga 1 cup'' [First shot] AV application online AV experience shooting 2579",https://pic.javct.net/poster/05192026/59575019c3.jpg,https://javct.net/v/siro-5693,62,2026-06-29
300MIUM-1366,"[I will lend you a super masochistic woman] ""Master'' is always one pattern... I want you to tease me more, but I want you to tease me more, but I'm a curious woman with a mouthful mouth. I don't stop even if I can't stop deep throating. I like it until it's time for a deep throat. I'm a hodai user. Hodai M is OK with anything because I'm a M... [Masochist's home Q delivery]",https://pic.javct.net/poster/05192026/382ffba956.jpg,https://javct.net/v/300mium-1366,105,2026-06-29
200GANA-3407,"When I asked out a 24-year-old esthetician on her way home from a secret job, she turned out to be the owner of a ""famous tool'' that makes her more sensitive than most people.A real softie, first shoot 2316",https://pic.javct.net/poster/05192026/f8010ef9a6.jpg,https://javct.net/v/200gana-3407,57,2026-06-29
MAAN-1179,"[Intense service from an I-cup beauty] A spectacular titjob where she swallows the tip with her sticky tongue and is bound to explode. Her mouth technique sucks on her erotic hips, and her big tits and big butt are shaking all over the place. She's covered in meat and licked to the hilt. [The most voluptuous woman who wants to be licked] [Sakura]",https://pic.javct.net/poster/05192026/a450ac0196.jpg,https://javct.net/v/maan-1179,93,2026-06-29
259LUXU-1888,"""Human physical beauty is profound.'' A teacher in a painting class who has sex with a student is restrained with duct tape and squirts repeatedly due to fingering and penetration.A continuous squirting climax that floods the room with water.Luxury TV 1875",,https://javct.net/v/259luxu-1888,72,2026-06-29
348NTR-104,"[NTR] Tayun Tayun's fair-skinned breasts are so amazing that I want to rub them every day~, come quickly lol",https://pic.javct.net/poster/05192026/ae5e6b6f39.jpg,https://javct.net/v/348ntr-104,63,2026-06-29
FC2PPV-4929080,[No] Pretty slender SSS class JD ☆ Creampie ejaculation in the beautiful waist and pre-butt entangled loose shaved pussy,https://pic.javct.net/poster/05192026/bc902c4419.jpg,https://javct.net/v/fc2ppv-4929080,48,2026-06-29
FC2PPV-4927642,"[Completely secret version] **pyjpx*jsps [Squirting] [Slutty] [Volume warning] Mina, an I-cup office lady, can't stop squirting while half-crying. Her abominable behavior is exposed to the point where her brain is shaking [Chapter 7]",https://pic.javct.net/poster/05192026/b8988c0483.jpg,https://javct.net/v/fc2ppv-4927642,108,2026-06-29
FC2PPV-4929324,"[New Divine Episode] Tashiro-chan, who has idol looks and SSS level, came back as an adult, so she decided to have creampie sex with her pregnancy confirmed.",https://pic.javct.net/poster/05192026/ec1db67416.jpg,https://javct.net/v/fc2ppv-4929324,41,2026-06-29
FC2PPV-4917598,"Let's seduce a casual sex partner with “Snow Milk” right on my desk. “Mmm, ahh, haah...”—I'm embarrassed by my own erotic moans.",https://pic.javct.net/poster/05192026/7f130ab2c5.jpg,https://javct.net/v/fc2ppv-4917598,20,2026-06-29
FC2PPV-4923443,"Last SEX before marriage with a super erotic beautiful sex friend who knows everything about each other's bodies ⇒ Creampie & Facial (Miki, 26 years old)",https://pic.javct.net/poster/05192026/bcc18ddf8e.jpg,https://javct.net/v/fc2ppv-4923443,60,2026-06-29
FC2PPV-4928634,"[Complete amateur creampie] An old man who enjoys various things with a wonderful office lady with a super high-level face and a super hot body, and of course she cums twice with his raw dick and is completely mesmerized by the mesmerizing gaze of the camera",https://pic.javct.net/poster/05192026/256e6dddc5.jpg,https://javct.net/v/fc2ppv-4928634,58,2026-06-29
