code,title,image_url,page_url,views,date_scraped
FNEO-070-RM,Make A Baby! A Transparent White-skinned Hidden Big-breasted Beautiful Girl Invites An Uncle To C**ld-making SEX With A Youthful Smile. Riko Hashimoto [Uncensored L**ked],https://pic.javct.net/poster/20230104/1681270638.jpg,https://javct.net/v/fneo-070-rm,139,2026-06-24
GMEM-095-RM,ULTRA SWEET Akagai Bishoujo Soldier Strong Horny Climax Training-Pleasant Pleasure Panic Innocent Flesh-Anka Suzune [Uncensored L**ked],https://pic.javct.net/poster/20230205/1684556462.jpg,https://javct.net/v/gmem-095-rm,125,2026-06-24
GMBM-015-RM,Um...why Is Your Wife Always Naked!? ? Apricot Komatsu [Uncensored L**ked],https://pic.javct.net/poster/20230104/1681270443.jpg,https://javct.net/v/gmbm-015-rm,123,2026-06-24
GHAT-140-RM,Taking The Bride's Friend Home From The After-Party [Uncensored L**ked],https://pic.javct.net/poster/20230104/1681962751.jpg,https://javct.net/v/ghat-140-rm,90,2026-06-24
FUNK-020-RM,"I Can't Put Up With The Big Butt In Uniform J*, And I'm Obsessed With Obscenity In The School After School. Repeated Vaginal Cum Shot For A Student Who Can't Resist The Big Penis Pleasure Mei Satsuki [Uncensored L**ked]",https://pic.javct.net/poster/20230104/1682739585.jpg,https://javct.net/v/funk-020-rm,145,2026-06-24
IZM-016-RM,"A Girl Who Wants To Be Bullied By An Amateur Mr. Nakata Works For A Creampie Consulting Company Arisa 25 Years Old An Erotic C**ld Who Gets Her Perverted Pussy Juice Dripping! Once You Hold It, You Will Be Addicted To The F-cup Horny Body Basic No Bra + Sometimes No Panties Perverted Woman! Arisa Tomioka [Uncensored L**ked]",https://pic.javct.net/poster/20230205/1683348992.jpg,https://javct.net/v/izm-016-rm,120,2026-06-24
EMBM-010-RM,A Serious Bride Who Has Sex In Front Of Her Masochist Husband Mio Ichijo [Uncensored L**ked],https://pic.javct.net/poster/20230104/1681962929.jpg,https://javct.net/v/embm-010-rm,89,2026-06-24
CHUC-024-RM,SEX Loving H Cup JD And Creampie Sex Yume (22) Yume Aikawa [Uncensored L**ked],https://pic.javct.net/poster/20222612/1672114426.jpg,https://javct.net/v/chuc-024-rm,60,2026-06-24
FMDL-001-RM,"Once I've Got A Cock In My Mouth, I Won't Let It Go Until I Ejaculate Ultimate Penis Love Mitsuki Yuina [Uncensored L**ked]",https://pic.javct.net/poster/05192026/c8964d223c.jpg,https://javct.net/v/fmdl-001-rm,127,2026-06-24
NNNC-021-RM,Genuine Cream Pie My Only Cute Saffle Is A Big Sensitive BODY Raw Fucking Nasty Girl 3 SEX [Uncensored L**ked],https://pic.javct.net/poster/20230104/1681270104.jpg,https://javct.net/v/nnnc-021-rm,116,2026-06-24
DORI-085-RM,"Paco Shooting No.85 ""Nipples... They're Really Hard ◆"" A G-cup, Big-breasted J ● Told Me, ""I Want To Fuck You Raw♪"", And I Cummed In Twice! [Uncensored L**ked]",https://pic.javct.net/poster/20230104/1681269214.jpg,https://javct.net/v/dori-085-rm,73,2026-06-24
MISM-144-RM,Emu Musume User K's Photographed Work Denim Has Been Having A Lot Of Meat Rod Training In Hot Springs For A Man Who Is Too Erotic About A Man Who Is Too Erotic. Long-distance Truck Driver Mei 27 Years Old [Uncensored L**ked],https://pic.javct.net/poster/05192026/7f27a91fe0.jpg,https://javct.net/v/mism-144-rm,170,2026-06-24
DFE-102-RM,Sexual Sensation Explosion Shrimp Arching Acme Salon Morisawa Kana [Uncensored L**ked],https://pic.javct.net/poster/20250606/1751044377.jpg,https://javct.net/v/dfe-102-rm,123,2026-06-24
CEMD-311-RM,Suddenly **dnapping A Very Ordinary Office Lady And Making Her A Sex Slave! 2 Kozue Fujita [Uncensored L**ked],https://pic.javct.net/poster/20230302/1679715258.jpg,https://javct.net/v/cemd-311-rm,120,2026-06-24
OIGS-050-RM,Rope Sick Married Woman Bondage Affair Ryokan Minori Hatsune [Uncensored L**ked],https://pic.javct.net/poster/20230104/1680926182.jpg,https://javct.net/v/oigs-050-rm,111,2026-06-24
MIBB-017-RM,Indecent Bewitching High Leg FUCK Sumire Kurokawa [Uncensored L**ked],https://pic.javct.net/poster/20230104/1681531015.jpg,https://javct.net/v/mibb-017-rm,120,2026-06-24
MISM-142-RM,Crazy Anal Fuck Mazo [Uncensored L**ked],https://pic.javct.net/poster/05192026/bb4e18d9a5.jpg,https://javct.net/v/mism-142-rm,220,2026-06-24
JSOP-025-RM,New And Beautiful Mature Woman Yuya Rich Soggy Luxury Soap Nao Yuki [Uncensored L**ked],https://pic.javct.net/poster/20230104/1682137536.jpg,https://javct.net/v/jsop-025-rm,130,2026-06-24
CHUC-023-RM,Churu Churu Amateur Beautiful Married Woman With Sexual Appeal And Affair Creampie SEX Tsukasa (28) Tsukasa Nagano [Uncensored L**ked],https://pic.javct.net/poster/20222311/1669515633.jpg,https://javct.net/v/chuc-023-rm,60,2026-06-24
JMTY-066-RM,Tadaman File 18 Hikaru 21 Years Old A Record Of Drinking And Vaginal Cum Shot With A Convenient Saffle [Uncensored L**ked],https://pic.javct.net/poster/20230205/1685605412.jpg,https://javct.net/v/jmty-066-rm,121,2026-06-24
GVG-814-RM,Forbidden Care Nurse Kudo Manami [Uncensored L**ked],https://pic.javct.net/poster/20240410/1730450175.jpg,https://javct.net/v/gvg-814-rm,120,2026-06-24
GAID-024-RM,Completely Subjective Wife Is A Schoolgirl Rio Natsuki [Uncensored L**ked],https://pic.javct.net/poster/20230104/1681270511.jpg,https://javct.net/v/gaid-024-rm,101,2026-06-24
GVG-815-RM,Busty Love Boyzuka 's Hood Prank Rinne Or What [Uncensored L**ked],https://pic.javct.net/poster/20241902/1709707415.jpg,https://javct.net/v/gvg-815-rm,135,2026-06-24
SCOP-805-RM,"Immediately After Remarriage, The In-law Family Who Is Not Accustomed To The Man Is Fascinated By The Erection Cock When He Wakes Up! A Stuffy Crotch That Can Be Seen Even From The Top Of The Pants! No Matter If You Get Up Or Ejaculate, The Sperm Always Drips From Your Mouth With A Follow-up Fellatio! ! [Uncensored L**ked]",https://pic.javct.net/poster/20230104/1680928001.jpg,https://javct.net/v/scop-805-rm,145,2026-06-24
