code,title,image_url,page_url,views,date_scraped
EBOD-459-RM,Bus Tour With A Bare-Naked Busty Guide Ami Tokunaga [Uncensored L**ked],https://pic.javct.net/poster/20221904/1651711385.jpg,https://javct.net/v/ebod-459-rm,119,2026-06-09
XV-483-RM,Saya Love Surreal Pleasure [Uncensored L**ked],https://pic.javct.net/poster/05192026/fce371fdb6.jpg,https://javct.net/v/xv-483-rm,120,2026-06-09
XV-439-RM,New Comer! Saya Love [Uncensored L**ked],https://pic.javct.net/poster/05192026/b92de83527.jpg,https://javct.net/v/xv-439-rm,59,2026-06-09
LZPL-061-RM,Throat Fuck Lesbian Bitch's Erogenous Zone Is Her Throat Yumi Saeki Akari Niimura [Uncensored L**ked],https://pic.javct.net/poster/20212709/1634971851.jpg,https://javct.net/v/lzpl-061-rm,147,2026-06-09
ONEZ-125-RM,Generalized Sensory Zone Anti-inflammation Premature Ejaculation L**kage Daughter Deviation AV Debut Teaching Practice Student Aina (21) [Uncensored L**ked],https://pic.javct.net/poster/05192026/14e937f407.jpg,https://javct.net/v/onez-125-rm,120,2026-06-09
IESP-135-RM,Chinami Sakai Barrage Horny Wife 20 Pies [Uncensored L**ked],https://pic.javct.net/poster/05192026/a89c6f504c.jpg,https://javct.net/v/iesp-135-rm,100,2026-06-09
URMT-006-RM,Petit Idol @ Momo-chan: L**ked Underground Video From Entertainment Production Company - Aspiring Idol Falls Into Darkness And Engages In Unlicensed Group Sex - Shinomiya Momo [Uncensored L**ked],https://pic.javct.net/poster/05192026/9c55a5dbca.jpg,https://javct.net/v/urmt-006-rm,105,2026-06-09
XRW-679-RM,Debut In The Throat Ma ● Co Pies Deep Throat Summer Wind [Uncensored L**ked],https://pic.javct.net/poster/05192026/48332e8c31.jpg,https://javct.net/v/xrw-679-rm,220,2026-06-09
HUNTC-391-RM,"""They're Not Big Enough To Hold Between My Breasts, But..."" I Reach Ecstasy With A Titjob From My C**ldhood Friend Who's Self-conscious About Her Small Breasts! I Pretend To Be Indifferent To My C**ldhood Friend's Complex About Her Small Breasts, But When I Forcefully Reach Out My Hand And Say, ""Maybe They'll Grow If I Rub Them?"", She Resists At First But Starts To Fidget And Her Body Begins To Feel Pleasure! [Uncensored L**ked]",https://pic.javct.net/poster/05192026/836f928796.jpg,https://javct.net/v/huntc-391-rm,160,2026-06-09
AVSA-439-RM,[Authentic Cumshot Documentary] Eight Real Cumshots Into A Current Nurse's Pregnancy-Desperate Pussy (Pregnancy Confirmed) Minato Haru [Uncensored L**ked],https://pic.javct.net/poster/05192026/2bb18587e1.jpg,https://javct.net/v/avsa-439-rm,146,2026-06-09
T28-407-RM,Sexual Release - Hot Sex Begging For Hot Smothering Kisses - Azumi Chino [Uncensored L**ked],https://pic.javct.net/poster/20220406/1657157637.jpg,https://javct.net/v/t28-407-rm,178,2026-06-09
T38-064-RM,"Big-breasted Schoolgirls On Their Way To School, Sakura Yuno And Yui Hina, Have Completely Fallen Prey To A Group Of Perverts. [Uncensored L**ked]",https://pic.javct.net/poster/05192026/ef18d4c22b.jpg,https://javct.net/v/t38-064-rm,120,2026-06-09
KSBJ-033-RM,The Naked Wife ERIKA [Uncensored L**ked],https://pic.javct.net/poster/20220707/1657526582.jpg,https://javct.net/v/ksbj-033-rm,127,2026-06-09
AVSA-294-RM,The Neat And Serious Mai Senior I Admire Is A Beastly Pervert Teacher Sex Slave Mai Arisu [Uncensored L**ked],https://pic.javct.net/poster/20241901/1707536990.jpg,https://javct.net/v/avsa-294-rm,129,2026-06-09
PKPD-421-RM,I'll Take The Virginity Of A New Actress With Internal Ejaculation. Shina Kiki [Uncensored L**ked],https://pic.javct.net/poster/05192026/dcaa38c23c.jpg,https://javct.net/v/pkpd-421-rm,120,2026-06-09
CHRV-221-RM,Too Sexy Boobs! Sending My Best Wishes For Your Dick! My Little Sister's Huge Boobs Are A Sight To Behold! Raw Cumshot In A Short-sleeved Sailor Uniform! H-cup 96cm Miipon [Uncensored L**ked],https://pic.javct.net/poster/05192026/92b44988f3.jpg,https://javct.net/v/chrv-221-rm,150,2026-06-09
SAN-180-RM,Big-breasted Wife Who Gets Messed With By Her Psychopathic Son / Maya Kikuchi [Uncensored L**ked],https://pic.javct.net/poster/20231011/1698722748.jpg,https://javct.net/v/san-180-rm,130,2026-06-09
RDVHJ-158-RM,The Night I Was Made To Ejaculate By Two Drunken Married Woman Bosses At A Bar And At My House... (2) [Uncensored L**ked],https://pic.javct.net/poster/20230206/1687839163.jpg,https://javct.net/v/rdvhj-158-rm,120,2026-06-09
NSFS-197-RM,Posted True Stories A Wife Involved In An Incident 4 ~A Wife Who Was Violated By Men At An Unscrupulous Renovation Company~ Mai Hanagari [Uncensored L**ked],https://pic.javct.net/poster/20230206/1687580864.jpg,https://javct.net/v/nsfs-197-rm,104,2026-06-09
SDDE-399-RM,Big Nurses Gently Sex Processing Ridge S**ta Sex Ward [Uncensored L**ked],https://pic.javct.net/poster/20221108/1660689877.jpg,https://javct.net/v/sdde-399-rm,220,2026-06-09
HMGL-168-RM,Nice Bottom Scandal Hydrangea Boobs Ichiruzu [Uncensored L**ked],https://pic.javct.net/poster/04112026/1776665521.jpg,https://javct.net/v/hmgl-168-rm,130,2026-06-09
DFE-071-RM,I Have My Daughter Feed Me. Ran Himeno [Uncensored L**ked],https://pic.javct.net/poster/20230804/1692933552.jpg,https://javct.net/v/dfe-071-rm,137,2026-06-09
COGM-052-RM,"I Can Still Forgive My Sister For Being A Nudist, But I'm Very Troubled Because She Masturbates Everywhere. [Uncensored L**ked]",https://pic.javct.net/poster/20230206/1688186517.jpg,https://javct.net/v/cogm-052-rm,115,2026-06-09
BBTU-078-RM,All Japan Titty Fuck Institute Tomoko Kamisaka [Uncensored L**ked],https://pic.javct.net/poster/20241703/1712976360.jpg,https://javct.net/v/bbtu-078-rm,148,2026-06-09
