code,title,image_url,page_url,views,date_scraped
APNS-091-RM,A Beautiful Woman Teacher Shameful Family Visit Rena Kiyomoto [Uncensored L**ked],https://pic.javct.net/poster/05192026/c8f6ca8851.jpg,https://javct.net/v/apns-091-rm,106,2026-06-26
OGPP-005-RM,Daughter-in-law Otonashi Fragrance That Matches The Unbelievable Happening In The Home Of Her Husband Went Home [Uncensored L**ked],https://pic.javct.net/poster/20243105/1718403960.jpg,https://javct.net/v/ogpp-005-rm,125,2026-06-26
URE-018-RM,Ai Uehara Heroine Love Original Pong Takahanada ! !Wife A Bud [Uncensored L**ked],https://pic.javct.net/poster/20220707/1658341338.jpg,https://javct.net/v/ure-018-rm,220,2026-06-26
HZ-3880,Bonus Special Vol.12 - Rin Hinami - Airi Mikumo - Satomi Ishikawa,https://pic.javct.net/poster/05192026/6d678e6eaa.jpg,https://javct.net/v/hz-3880,60,2026-06-26
DOKS-630-RM,An Komatsu [Uncensored L**ked],https://pic.javct.net/poster/20253001/1740903149.jpg,https://javct.net/v/doks-630-rm,127,2026-06-26
10-062626-01,Pussy to Mouth Sex: Hitomi Tanmura,https://pic.javct.net/poster/05192026/34c0171933.jpg,https://javct.net/v/10-062626-01,60,2026-06-26
CR-062626-001,Pampering and Training by a Motherly Younger Mother-in-Law,https://pic.javct.net/poster/05192026/22c33aa2ae.jpg,https://javct.net/v/cr-062626-001,61,2026-06-26
MUCD-356-RM,"It Feels So Good, I Can't Stop!! The Best 4 Hours Of Squirting As The Body Of A Schoolgirl In Uniform Overflows With Pleasure. [Uncensored L**ked]",https://pic.javct.net/poster/05192026/ab789afa5c.jpg,https://javct.net/v/mucd-356-rm,240,2026-06-26
DTSG-009-RM,Virgin And Obstetrician And Gynecologist My First-ever Sexual Harassment Examination With My Courage [Uncensored L**ked],https://pic.javct.net/poster/05192026/24b8a77acd.jpg,https://javct.net/v/dtsg-009-rm,115,2026-06-26
TAMEG-001-RM,Goro Tameike's Interview Therapy Part 1 Ayako Sato 46 years old Mai Fuyuki [Uncensored L**ked],https://pic.javct.net/poster/05192026/884a69a383.jpg,https://javct.net/v/tameg-001-rm,84,2026-06-26
FC2PPV-4920344-RM,"Raw sex with a super angelic school student. While giving a blow job to the teacher's penis, her pussy juices are dripping all over... An overwhelmingly beautiful butt hidden behind the uniform. A pure body with pure white skin. Mass impregnation on a really dangerous day... [Uncensored L**ked]",https://pic.javct.net/poster/05192026/6ede56c611.jpg,https://javct.net/v/fc2ppv-4920344-rm,262,2026-06-26
SCR-347-RM,Midsummer Nightmare: Female R**e And Internal Ejaculation - 4-Hour Video L**k [Uncensored L**ked],https://pic.javct.net/poster/05192026/00c1481dbc.jpg,https://javct.net/v/scr-347-rm,240,2026-06-26
WA-588-RM,"Amateur Wife Pick-Up, Unprotected Sex With All Of Them, 5 Hours, Celebrity DX 105 [Uncensored L**ked]",https://pic.javct.net/poster/05192026/fe29989cd0.jpg,https://javct.net/v/wa-588-rm,300,2026-06-26
UMSO-648-RM,"The Allure Of Glossy, Black, Beautiful Legs! Six Women Having Sex While Wearing Premium Pantyhose. [Uncensored L**ked]",https://pic.javct.net/poster/05192026/b7eb34f18c.jpg,https://javct.net/v/umso-648-rm,241,2026-06-26
HUNTB-533-RM,"""Even If It's Small, I Can Pinch It!"" My Younger Sister Who Was Made Fun Of Her Small Tits Desperately Fucking! It's Not Going To Be... Chiku Koki! But Chiku Koki Feels So Good That It Seems To Be Alive ... [Uncensored L**ked]",https://pic.javct.net/poster/20230104/1680843006.jpg,https://javct.net/v/huntb-533-rm,180,2026-06-26
CHRV-176-RM,Older Brother Bing Taro To A Younger Sister Who Masturbates By Reading A Sensual Novel! My Sister's Huge Breasts Are Worth Seeing! Sailor Uniform Raw Creampie! H Cup 99cm Walnut [Uncensored L**ked],https://pic.javct.net/poster/20230104/1680928953.jpg,https://javct.net/v/chrv-176-rm,150,2026-06-26
NASK-381-RM,"Bound By Her Father-in-law, The Daughter-in-law's Masochistic Tendencies Blossom Through Rope Bondage. Beautiful Wives Writhing And Moaning In Bondage. 4 Women, 4 Hours. [Uncensored L**ked]",https://pic.javct.net/poster/05192026/39bdad4861.jpg,https://javct.net/v/nask-381-rm,240,2026-06-26
FUNK-022-RM,"The Rumored Exhibitionist Teacher ""Did You Know The Bad Story About Class B's Mio-sensei? After Class, She Walked Around The School Naked."" Megu Mio [Uncensored L**ked]",https://pic.javct.net/poster/20230104/1682739459.jpg,https://javct.net/v/funk-022-rm,135,2026-06-26
MIGD-712-RM,Consecutive Creampies For A Pissing Girl Niko Ayuna [Uncensored L**ked],https://pic.javct.net/poster/20220406/1656988469.jpg,https://javct.net/v/migd-712-rm,119,2026-06-26
BBTU-087-RM,Big Breasted MM Aspiring Music College Graduate Returning Student Tied Up In A Closed Room Rin Hasumi [Uncensored L**ked],https://pic.javct.net/poster/20242108/1726282177.jpg,https://javct.net/v/bbtu-087-rm,97,2026-06-26
CEMD-315-RM,Sex Donna Runa Shimotsuki 3SEX X Masturbation [Uncensored L**ked],https://pic.javct.net/poster/20230302/1679718213.jpg,https://javct.net/v/cemd-315-rm,196,2026-06-26
MILK-142-RM,Married Woman Next Door Who Seems Quite Modest Gets Obsessed With This Younger Man's Cock And Squeezes Out Every Drop Of His Cum With Wild Blowjobs And Raw Fucking. Risa Mochizuki. [Uncensored L**ked],https://pic.javct.net/poster/20221904/1651726785.jpg,https://javct.net/v/milk-142-rm,109,2026-06-26
T28-447-RM,"Older Brother, Also Is Said With A Bath ... Good?I ... ~ Sister Who ~ Sunburn Came Into The Bath Still Innocently [Uncensored L**ked]",https://pic.javct.net/poster/20230104/1680596824.jpg,https://javct.net/v/t28-447-rm,160,2026-06-26
GVG-818-RM,Anal Device Bondage XIII Iron Restraint Anal To**ure Plow Stone [Uncensored L**ked],https://pic.javct.net/poster/05192026/642009b6bd.jpg,https://javct.net/v/gvg-818-rm,115,2026-06-26
