code,title,image_url,page_url,views,date_scraped
CR-071526-001,Anal Encyclopedia : Kanami Uno,https://pic.javct.net/poster/07052026/b41f1794bb.jpg,https://javct.net/v/cr-071526-001,18,2026-07-15
32ID-018-RM,Megumi Sister Sex Record 4 Hours [Uncensored L**ked],https://pic.javct.net/poster/07052026/3c9d489bc2.jpg,https://javct.net/v/32id-018-rm,240,2026-07-15
VEMA-030-RM,Busty Nurse Wife - Ai Airi [Uncensored L**ked],https://pic.javct.net/poster/07052026/287f47e571.jpg,https://javct.net/v/vema-030-rm,90,2026-07-15
ETQR-463-RM,Service Sex Chie Full Of Motherhood Of A Beautiful Girl In Uniform With Big Tits,https://pic.javct.net/poster/20233001/1676781468.jpg,https://javct.net/v/etqr-463-rm,80,2026-07-15
DOCP-180-RM,"I'm Gonna Get It! Add To The Weakness Of The Beauty Maid Who Has Been Dispatched In The Housekeeping Agency Service, And Follow-up Piston Fo**ed Out! 2 [Uncensored L**ked]",https://pic.javct.net/poster/07052026/fb498a3fa0.jpg,https://javct.net/v/docp-180-rm,235,2026-07-15
DASD-314-RM,First Anal Fuck Original Pies Zenana To Have Her Husband Chigusa [Uncensored L**ked],https://pic.javct.net/poster/07052026/aa18620f83.jpg,https://javct.net/v/dasd-314-rm,120,2026-07-15
CEMD-346-RM,Tears Of Non-Stop Super Squid Sex 28 Yuna Kitano,https://pic.javct.net/poster/20230206/1686374092.jpg,https://javct.net/v/cemd-346-rm,125,2026-07-15
ALDN-126-RM,Kyoko Maki Asked Her Father-In-Law To Get Pregnant Without Telling Her Husband,https://pic.javct.net/poster/20233001/1676084350.jpg,https://javct.net/v/aldn-126-rm,130,2026-07-15
CHRV-173-RM,Younger Sister's Tits That Ruin Her Brother! My Sister's Huge Breasts Are Worth Seeing! Sailor Uniform Raw Creampie! I Cup 98cm Saku-chan,https://pic.javct.net/poster/20233001/1676089247.jpg,https://javct.net/v/chrv-173-rm,150,2026-07-15
BUR-481-RM,Oma  This Instruction Manual [Uncensored L**ked],https://pic.javct.net/poster/20233001/1677605092.jpg,https://javct.net/v/bur-481-rm,197,2026-07-15
DVRT-016-RM,"I Want To Be A Naked Director When I Filmed My Mom As A Model, I Got Excited... Yuri Sasahara",https://pic.javct.net/poster/20233001/1675396751.jpg,https://javct.net/v/dvrt-016-rm,145,2026-07-15
DORI-080-RM,"Paco Shooting No.80 When I Cum, I Made The Colossal Tits J  Tighten My Cock  With A Man , ""This Chin  Is Really Good"", And I Cummed It Out 3 Times!",https://pic.javct.net/poster/20233001/1676171995.jpg,https://javct.net/v/dori-080-rm,81,2026-07-15
VEC-063-RM,Rei Aoki Incontinence Openly Can Not Stand Apartment Wife Peeing [Uncensored L**ked],https://pic.javct.net/poster/07052026/c243d5d9e7.jpg,https://javct.net/v/vec-063-rm,90,2026-07-15
MISM-163-RM,"Coming Out Look At Me Real. A Masochist With A Crazy Motherhood Appeared In A Series That She Admired, And She Wanted To Be Driven In And Out Of Her Mind And Body. AV Actress Manami Oura's Proclivity Confession Document",https://pic.javct.net/poster/20240807/1723826501.jpg,https://javct.net/v/mism-163-rm,150,2026-07-15
EUMD-002-RM,Only Affair SEX Wins The Father Of A Student Who Seduces With Sexy Lingerie G Cup Temptation BODY Private Tutor Emily,https://pic.javct.net/poster/20233001/1675606535.jpg,https://javct.net/v/eumd-002-rm,116,2026-07-15
DDFF-044-RM,Throat R**e X Nipple R**e Aesthetician Yuri Adachi,https://pic.javct.net/poster/09052025/1760723477.jpg,https://javct.net/v/ddff-044-rm,121,2026-07-15
MUDR-149-RM,Sweet Girls 345: Live-action Version - Rei Kuruki,https://static.javct.net/poster/mudr-149.jpg,https://javct.net/v/mudr-149-rm,120,2026-07-15
CEMD-347-RM,Tears Of Non-stop Super Squid SEX 29 Riku Ichikawa,https://pic.javct.net/poster/20230206/1686374032.jpg,https://javct.net/v/cemd-347-rm,126,2026-07-15
AEDS-167-RM,Battle Of Sexual Feeling Este Squirting Secret To The New Mom!! 2 «Annals Of The Squirting Voyeur Verification Of The First Time In My Life» [Uncensored L**ked],https://pic.javct.net/poster/07052026/d18015f266.jpg,https://javct.net/v/aeds-167-rm,90,2026-07-15
BACJ-047-RM,Play Bullying While Cursing With Sweet Toro Voice! De Sadistic Lady's Kimo Old Man And Confinement Training Marika Misono,https://pic.javct.net/poster/20233001/1676088138.jpg,https://javct.net/v/bacj-047-rm,130,2026-07-15
NNPJ-437-RM,My Lover Abandoned My Engagement ... * Daddy Activity With Sickness! I Forget Loneliness Every Time I'm Struck ... A Girl Who Begs For A Piston And Is Injured. [The Theory That A Weak Woman Loses Reason] [Uncensored L**ked],https://pic.javct.net/poster/07052026/3eb7af0c06.jpg,https://javct.net/v/nnpj-437-rm,120,2026-07-15
AKDL-087-RM,"Appearing after work! A lewd office lady who sucks dick until late at night, begging for a quick threesome #M girl #loves blowjobs #immediate orgasm convulsions 26 years old",https://pic.javct.net/poster/05192026/a5d94a0b45.jpg,https://javct.net/v/akdl-087-rm,69,2026-07-15
NYKD-124-RM,Maiko Nijo Takes Her Sixtieth Birthday For The First Time,https://pic.javct.net/poster/20233001/1675482952.jpg,https://javct.net/v/nykd-124-rm,122,2026-07-15
MIST-119-RM,"At ""An Old Traditional Titty Pub"" In The Biggest Entertainment District In Japan, New Girls Will Secretly Fuck Their Customers Raw In Order To Steal Them From The Veteran Girls 04",https://pic.javct.net/poster/01202026/1772176248.jpg,https://javct.net/v/mist-119-rm,145,2026-07-15
