code,title,image_url,page_url,views,date_scraped
T28-494-RM,Cosplayers Lesbian Orgy,https://pic.javct.net/poster/05192026/af4e95d0fd.jpg,https://javct.net/v/t28-494-rm,150,2026-07-16
SCOP-800-RM,"My Little Sister Who Can't Get Her Toys Is In Trouble! ! If You Try To Take It With Your Hand, You Will Cum And Cum! ? The Moment When I Inserted My Brother's Ji Po! ! The Reason Also Flies Along With The Toy And It's Full Of Raw Vaginal Cum Shot! !",https://pic.javct.net/poster/20233001/1676088385.jpg,https://javct.net/v/scop-800-rm,140,2026-07-16
XVSR-295-RM,H Cup Kachida Mao VS G Cup Mihara Honoka Beauty Big Tits Battle Loyal ~ 130 Minutes Non Stop Document ~,https://pic.javct.net/poster/05192026/23f45006f6.jpg,https://javct.net/v/xvsr-295-rm,130,2026-07-16
TUE-133-RM,Cowgirl Beginner Paipanro Ta Beautiful Girl Video Collection,https://pic.javct.net/poster/20233001/1675565597.jpg,https://javct.net/v/tue-133-rm,120,2026-07-16
GVG-835-RM,Ma ○ Ko Device Bondage VII Iron Restraint Ma Ko To**ure Cape Azusa [Uncensored L**ked],https://pic.javct.net/poster/07052026/b6de78e9f5.jpg,https://javct.net/v/gvg-835-rm,125,2026-07-16
ONEZ-168-RM,Impregnated Immediately For Dangerous Days Immediately Squirrel Instant Scroll After School Cum Inside One Night Trip Renshi [Uncensored L**ked],https://pic.javct.net/poster/07052026/f37f948cb6.jpg,https://javct.net/v/onez-168-rm,120,2026-07-16
XRW-779-RM,Female Teacher R**e - An After School Tragedy Where A Beautiful Teacher Gets Fucked 02,https://pic.javct.net/poster/10232025/1761436879.jpg,https://javct.net/v/xrw-779-rm,120,2026-07-16
XVSR-296-RM,Pissing On A Pretty Girl Who Is Seriously Blushing! ! Eikawa Ooa,https://pic.javct.net/poster/05192026/9ef0c6585d.jpg,https://javct.net/v/xvsr-296-rm,120,2026-07-16
292MY-1067-RM,Mizuki Fukuhara 1 [Uncensored L**ked],https://pic.javct.net/poster/07052026/ec109f35da.jpg,https://javct.net/v/292my-1067-rm,61,2026-07-16
STCVS-052-RM,[Walking Smartphone Monitor Who Polices Beautiful Girls With His Meat Stick] (1) Polices The Beautiful President's Daughter Who Is Studying With An App! (2) Crack Down On Kansai Dialect Office Ladies Who Are Making Rounds While Looking At The Map! (3) A Busty Girl Who Is Having A Message Session With Her Favorite Boyfriend Is Arrested In Front Of Her Boyfriend! [Delusion Erotic Man #Aoi & Sana & Mina] [Uncensored L**ked],https://pic.javct.net/poster/07052026/9080178b3d.jpg,https://javct.net/v/stcvs-052-rm,150,2026-07-16
BGN-055-RM,Rookie Prestige Exclusive Debut Big Dusty Yamato Ayako Fujitani Maho,https://pic.javct.net/poster/10232025/1763337600.jpg,https://javct.net/v/bgn-055-rm,175,2026-07-16
MFCS-215-RM,Thighs [Uncensored L**ked],https://pic.javct.net/poster/07052026/1dff5ff73a.jpg,https://javct.net/v/mfcs-215-rm,88,2026-07-16
XRW-780-RM,[Molester Gonzo] Erotic Manipulative Teacher Is A College Student Who Aims To Become A Physical Education Teacher To Drink Sleeping Pills And Pervert Sperm [Uncensored L**ked],https://pic.javct.net/poster/07052026/731de48cb5.jpg,https://javct.net/v/xrw-780-rm,98,2026-07-16
UMD-857-RM,"An Incident Occured During Incestuous Intercrural Sex! My Sister Wasn't Able To Endure It While Teaching Me How To Have Sex, She Couldn't Control Her Horniness And Ended Up Inserting My Dick Inside Her 01 [Uncensored L**ked]",https://pic.javct.net/poster/07052026/db0cda4889.jpg,https://javct.net/v/umd-857-rm,120,2026-07-16
MGNL-184-RM,"""Thorough Verification Of Whether College Students With Friends Cross The Line With Slippery Oils And Slippery Crotches☆"" Slender JD With A Dazzling Smile Develops Into A Raw Shark By Rubbing Slippery Oils And Crotches With A Seminar Friend Boy♪... Even Though He Has An Orgasm, He Does Not Stop Overwriting Continuous Creampie☆ [Street Corner Amateur Monitoring♯ Miku] [Uncensored L**ked]",https://pic.javct.net/poster/07052026/c3ab9eeabf.jpg,https://javct.net/v/mgnl-184-rm,87,2026-07-16
FEM-034-RM,Excavation Man's Daughter♂AVDebut Rui Amane,https://pic.javct.net/poster/07052026/9faf4dd18e.jpg,https://javct.net/v/fem-034-rm,121,2026-07-16
SUPD-053-RM,Kaela Uehara DIGITAL CHANNEL [Uncensored L**ked],https://pic.javct.net/poster/07052026/d12be6d53d.jpg,https://javct.net/v/supd-053-rm,220,2026-07-16
VRNC-099-RM,"Orgy Sex With 4 Cafe Girls With Amazing Styles! Let's Have A Drink At Home With The Four Heavenly Kings Who Have Everything: Beautiful Looks, Beautiful Breasts, Beautiful Legs, And Beautiful Butts! Men Who Can't Even Stand Up Because Of The Pheromones Are So Fucked Up! [Kanna/Meru/Akiho/Meisa] Ver Kanna & Mel [Uncensored L**ked]",https://pic.javct.net/poster/07052026/64ddd0c2c6.jpg,https://javct.net/v/vrnc-099-rm,85,2026-07-16
SORA-267-RM,"""Look At Me More..."" A Crazy Exhibitionist Female Teacher Who Can't Control Her Urge To Be Seen Fucking Toka Rinne",https://pic.javct.net/poster/20221108/1662372068.jpg,https://javct.net/v/sora-267-rm,144,2026-07-16
420HOI-401-RM,"Kirine (23) Amateur Hoi Hoi Z, Amateur, Documentary, Pov, Beautiful Girl, Beautiful Tits, Pale, Squirting, Facial [Uncensored L**ked]",https://pic.javct.net/poster/07052026/047cf688df.jpg,https://javct.net/v/420hoi-401-rm,93,2026-07-16
STCV-600-RM,Geek-friendly Gal Was Real!? The Middle Age Of Virginity Is Musha To Brown Big Tits! Imadoki Girl Is Squeezed With A Giant Dick She Has Been Holding For 35 Years♪ [DT + α # Anachan] [Uncensored L**ked],https://pic.javct.net/poster/07052026/e760793bff.jpg,https://javct.net/v/stcv-600-rm,89,2026-07-16
546EROFV-381-RM,"When a classmate who looked like a man meets again, she becomes a colorful pheromone female teacher and seduces me [Uncensored L**ked]",https://pic.javct.net/poster/07052026/6ecd8d0c8c.jpg,https://javct.net/v/546erofv-381-rm,65,2026-07-16
MVG-168-RM,Class In Chaos With A Hilarious Face! Pure J-pop Idol's Face Collapses In Ecstatic Climax! Shiori Mamiya,https://pic.javct.net/poster/07052026/65757dd765.jpg,https://javct.net/v/mvg-168-rm,165,2026-07-16
MGNL-180-RM,"""The Gentle Nurse Solves The Problems Of The Patient In Charge Of Premature Ejaculation & Virginity!♯?"" Omotori Giant Ass Nurse Grinds Down The Strong Meat Stick Of The Patient In Charge With A Raw Vagina... No Matter How Many Times You Ejaculate, You Can Instantly Resurrect The Virginity While Melodiously Waiting For Pregnancy!! [Street Corner Amateur Monitoring Is♯ 27 Years Old] [Uncensored L**ked]",https://pic.javct.net/poster/07052026/de1a832ca3.jpg,https://javct.net/v/mgnl-180-rm,0,2026-07-16
