code,title,image_url,page_url,views,date_scraped
SW-178-RM,Widow Next Door Who Had To Endure The Man Fell Easily With One Finger Of My Becoming Super Sensitive [Uncensored L**ked],https://pic.javct.net/poster/20242012/1737760943.jpg,https://javct.net/v/sw-178-rm,120,2026-06-22
MUDR-106-RM,A Real Copulation Of A Daughter Who Loves Uncle Who Can Not Keep Reason Because She Loves Etch Sober. Koharu Sakino [Uncensored L**ked],https://pic.javct.net/poster/05192026/a07d2c9aca.jpg,https://javct.net/v/mudr-106-rm,230,2026-06-22
HOIZ-130-RM,"Hoihoi Lover 22 ~ Konokono Hamedori ~ Amateur Hoihoi LOVER, Personal Shooting, Couple, Home, Amateur, Beautiful Girl, Female College Student, Gonzo, Big Breasts, Beautiful Breasts, Petite, Black Hair, Fair Skin, Facial, Cosplay, Chinese Dress, Slender, Waist [Uncensored L**ked]",https://pic.javct.net/poster/20240807/1721448606.jpg,https://javct.net/v/hoiz-130-rm,307,2026-06-22
URKK-104-RM,"At Least 10 Shots!! Big Tits Shaking As They Cum, And You Can Cum As Many Times As You Want In This Big Tits Rejuvenation And Aphrodisiac Salon Compilation II [Uncensored L**ked]",https://pic.javct.net/poster/20240807/1723256952.jpg,https://javct.net/v/urkk-104-rm,240,2026-06-22
WAWA-037-RM,Hawaii 3rd Anniversary Project: Discovered In A Foreign Country! A Tall Beauty From Northern Europe And A Japanese Boy Have Creampie Sex [Uncensored L**ked],https://pic.javct.net/poster/20252204/1747846986.jpg,https://javct.net/v/wawa-037-rm,152,2026-06-22
ABW-141-RM,"""Smooth"" Oil-covered 3 Production Asuna Kawai [Uncensored L**ked]",https://pic.javct.net/poster/20212308/1631237977.jpg,https://javct.net/v/abw-141-rm,235,2026-06-22
POMD-002-RM,"[Amateur POV] While staring at each other for a long time, I'm going to have a good time SEX. Adultery Diary Kodue Minami Engaging With A Young Wife With Beautiful Legs [Uncensored L**ked]",https://pic.javct.net/poster/05192026/ecd28c4547.jpg,https://javct.net/v/pomd-002-rm,125,2026-06-22
543TAXD-037-RM,"Furthermore, the whole story of evil deeds by a villainous taxi driver part.37 [Uncensored L**ked]",https://pic.javct.net/poster/20230206/1686402450.jpg,https://javct.net/v/543taxd-037-rm,58,2026-06-22
543TAXD-051-RM,Maki The whole story of the evil deeds of a villainous taxi driver part.51 [Uncensored L**ked],https://pic.javct.net/poster/20231011/1698405754.jpg,https://javct.net/v/543taxd-051-rm,63,2026-06-22
543TAXD-049-RM,Miho The whole story of the evil deeds of a villainous taxi driver part.49 [Uncensored L**ked],https://pic.javct.net/poster/20231011/1697371057.jpg,https://javct.net/v/543taxd-049-rm,61,2026-06-22
543TAXD-047-RM,Kana The whole story of evil deeds by a villainous taxi driver part.47 [Uncensored L**ked],https://pic.javct.net/poster/20230804/1691580306.jpg,https://javct.net/v/543taxd-047-rm,59,2026-06-22
FOCS-091-RM,Zensho: Seeding Diary With An Innocent Girl Futaba Kurumi: A Neighborhood Girl I'Ve Known From A Long Time Is A Loser Who Accepts All The Sexual Desires Of A Middle-Aged Uncle [Uncensored L**ked],https://pic.javct.net/poster/20222109/1665722493.jpg,https://javct.net/v/focs-091-rm,125,2026-06-22
DVRT-021-RM,To My Older Sister Who Can't See Anything When She Takes Off Her Bottle-bottomed Glasses... Iori Tsukimi [Uncensored L**ked],https://pic.javct.net/poster/20230104/1682688014.jpg,https://javct.net/v/dvrt-021-rm,135,2026-06-22
BONY-049-RM,Black Money Loan! ! Money Pig File.01 Icup Young Wife Miu [Uncensored L**ked],https://pic.javct.net/poster/20230205/1684466751.jpg,https://javct.net/v/bony-049-rm,160,2026-06-22
BLOR-218-RM,"A Funny Colossal Tits Clerk At A Laughing Izakaya ""I Can't Lose To Ji Po"" A Girl Who Plays Jokes Is Driven To Half Crying Acme With An Unequaled Cock [Uncensored L**ked]",https://pic.javct.net/poster/20230205/1684553760.jpg,https://javct.net/v/blor-218-rm,125,2026-06-22
BBTU-083-RM,My Dick Was Confined By A Big-breasted Gal. Kokoro Ayase [Uncensored L**ked],https://pic.javct.net/poster/20240807/1720839311.jpg,https://javct.net/v/bbtu-083-rm,110,2026-06-22
ALDN-167-RM,A Jerky Woman Miki Yoshii [Uncensored L**ked],https://pic.javct.net/poster/20230205/1684554674.jpg,https://javct.net/v/aldn-167-rm,105,2026-06-22
SW-134-RM,Amateur Mature Woman Creampie Raw Footage Riu 43 Years Old A Mature Woman In Her 40's Like A Kawahara's Erotic Book Too Vulgar White Breast Press... Riu Nagata [Uncensored L**ked],https://pic.javct.net/poster/20221108/1662099664.jpg,https://javct.net/v/sw-134-rm,130,2026-06-22
JRZE-147-RM,First Shooting Age Fifty Wife Document Akiko Goto [Uncensored L**ked],https://pic.javct.net/poster/20230205/1683775572.jpg,https://javct.net/v/jrze-147-rm,120,2026-06-22
DAVK-081-RM,[Miracle J Cup Beautiful Big Tits] Perverted Boyfriend's NTR Hobby Lent To A Gross Man And A Uniform Beautiful Girl's 100cm Super Soft Colossal Tits Titty Fuck Ejaculation Pai Pamma Co First Seen Man's Sperm 10 Or More Bukkake Creampie Body Fluid Pickled Super Orgy [Uncensored L**ked],https://pic.javct.net/poster/20230205/1683349114.jpg,https://javct.net/v/davk-081-rm,120,2026-06-22
CEMD-307-RM,"Shame, Ling, Tobikko Wearing, Downtown Date! 3 Yuna Mitake [Uncensored L**ked]",https://pic.javct.net/poster/20230302/1678509155.jpg,https://javct.net/v/cemd-307-rm,159,2026-06-22
MIST-105-RM,AV Actress To Be Squid In Front Of Friends [Uncensored L**ked],https://pic.javct.net/poster/05192026/45b27d8c6a.jpg,https://javct.net/v/mist-105-rm,160,2026-06-22
VOSS-092-RM,"This Mama Had An Itchy Crotch, So She Rubbed Some Cream On It, But It Turned Out To Be Aphrodisiac Cream Instead, So When She Rubbed It Into Her Pussy, She Got Hot And Horny! ""Fuck Me Hard, Please!"" Masturbation Alone Wasn't Enough To Satisfy Her, So She Spread Her Legs Wide And Begged Me To Shove My Cock Deep Into Her Pussy 2 [Uncensored L**ked]",https://pic.javct.net/poster/20221904/1653527451.jpg,https://javct.net/v/voss-092-rm,82,2026-06-22
DOTM-004-RM,"Local Young Wife Akari Who Gets Wet Other Than Her Husband A 25-Year-Old Osaka Resident ""My First Gokkun Was In 6th Grade"" A Newlywed Wife Semen 11 Semen Drinking Men On A Sperm Donation Bulletin Board [Uncensored L**ked]",https://pic.javct.net/poster/20230104/1682911406.jpg,https://javct.net/v/dotm-004-rm,135,2026-06-22
