code,title,image_url,page_url,views,date_scraped
STSK-153-RM,Cheerleader #youth #club Activities #fox Dance #creampie [Uncensored L**ked],https://pic.javct.net/poster/20242012/1735747015.jpg,https://javct.net/v/stsk-153-rm,223,2026-07-13
CR-071326-001,"The Story Of Luxury Spa Lady, Vol.154",https://pic.javct.net/poster/07052026/bca28f2f90.jpg,https://javct.net/v/cr-071326-001,56,2026-07-13
HUNBL-128-RM,"A Girl Was Supposed To Only Sell Pants, But She Was Taken To An Empty Place And Fo**ed To Fuck Her. [Uncensored L**ked]",https://pic.javct.net/poster/20230302/1678424960.jpg,https://javct.net/v/hunbl-128-rm,120,2026-07-13
BIJN-237-RM,THE Document Instinct Barely Climax SEX Colossal Breasts I Cup Frustrated Wife Hana Himesaki [Uncensored L**ked],https://pic.javct.net/poster/20233001/1675481467.jpg,https://javct.net/v/bijn-237-rm,113,2026-07-13
BACJ-045-RM,Big Ass Older Sister Who Pistons Pistons Until The Ball Is Empty After Dense Straddling Berokisu Mana Nagase [Uncensored L**ked],https://pic.javct.net/poster/20233001/1676088262.jpg,https://javct.net/v/bacj-045-rm,143,2026-07-13
HUNTB-500-RM,"Unlimited Insertion With Anyone! Used Car Dealer Edition As Long As You Pay A Fixed Monthly Fee, You Can Ride As Many People (female) As You Like At The Used Car Dealer! Unlimited Firing! ? [Uncensored L**ked]",https://pic.javct.net/poster/20230302/1678424712.jpg,https://javct.net/v/huntb-500-rm,150,2026-07-13
BASJ-003-RM,"Yurika Aoi, A Wife Who Awakens A Slut After Being Dated By Her Husband's NTR Propensity [Uncensored L**ked]",https://pic.javct.net/poster/20233001/1676084042.jpg,https://javct.net/v/basj-003-rm,126,2026-07-13
DRPT-042-RM,Big-ass Sister-in-law Who Seeks Anal Sex By Herself [Kurumi Tamaki Anal Ban! ! ] [Uncensored L**ked],https://pic.javct.net/poster/20230302/1678332455.jpg,https://javct.net/v/drpt-042-rm,135,2026-07-13
CHCH-030-RM,Grandma And Her Grandson Have A Soothing Colossal Breasted Beautiful Witch Who Can't Believe She Has A Grandc**ld Her Sperm Krappo Small Devil Rich Breast Sex Activity Hisako (56 Years Old/J Cup) [Uncensored L**ked],https://pic.javct.net/poster/20233001/1676689069.jpg,https://javct.net/v/chch-030-rm,110,2026-07-13
CEMD-341-RM,"""Misaki Sakura""'s Real Face-Creampie Ahegao Climax 4SEX- [Uncensored L**ked]",https://pic.javct.net/poster/20230205/1684561144.jpg,https://javct.net/v/cemd-341-rm,212,2026-07-13
VGD-210-RM,"Ass Nobleman Rena Asami, Mitsuha Higuchi [Uncensored L**ked]",https://pic.javct.net/poster/04112026/6d7ef31e60.jpg,https://javct.net/v/vgd-210-rm,130,2026-07-13
CHUC-045-RM,"Mari Ueto, A Minato Ward Married Woman Who Hides From Her Husband Working Overseas And Makes Her Cum Inside With Her Pocket Money (31 Years Old) [Uncensored L**ked]",https://pic.javct.net/poster/20230908/1695786555.jpg,https://javct.net/v/chuc-045-rm,60,2026-07-13
KSBJ-237-RM,A Sex-Dependent Wife Who Hunts Men Indiscriminately Izumi Sakuma [Uncensored L**ked],https://pic.javct.net/poster/20230302/1677902676.jpg,https://javct.net/v/ksbj-237-rm,120,2026-07-13
YMDD-314-RM,To Yoko **ds' Younger Sister Shigaru Pien-chan Adhesion Document Kozue Fujita Who Only Knows How To Fill The Void With Creampie H [Uncensored L**ked],https://pic.javct.net/poster/20230302/1677901207.jpg,https://javct.net/v/ymdd-314-rm,150,2026-07-13
JUAN-015-RM,"Ryoko Izumi, A Mother Who Lifts The Ban On Anal For Her Son [Uncensored L**ked]",https://pic.javct.net/poster/20233001/1676690456.jpg,https://javct.net/v/juan-015-rm,121,2026-07-13
MDTE-041-RM,Glittering Girls Who Are Sensitive To Fashion And Sex  Too Dangerous Backside Part-time Job 5 [Uncensored L**ked],https://pic.javct.net/poster/20233001/1676002397.jpg,https://javct.net/v/mdte-041-rm,195,2026-07-13
FOCS-119-RM,Licking And Sucking A Runaway Girl With Cloudy Body Fluids Slimy All Night Long Dense Creampie Sex Yuri Tenjin [Uncensored L**ked],https://pic.javct.net/poster/20230302/1679030367.jpg,https://javct.net/v/focs-119-rm,120,2026-07-13
CHUC-044-RM,Service-Type Office Lady Saffle Azusa (24) Azusa Misaki [Uncensored L**ked],https://pic.javct.net/poster/20230908/1695786618.jpg,https://javct.net/v/chuc-044-rm,60,2026-07-13
REAL-640-RM,Pole Blowjob Cum Drinking Heaven Fountain? [Uncensored L**ked],https://pic.javct.net/poster/05192026/facce8c06f.jpg,https://javct.net/v/real-640-rm,130,2026-07-13
BONY-037-RM,Pet With A Horse Stimulant Is Waiting For You Today. H Cup Yoga Instructor Edition Iori Tsukimi [Uncensored L**ked],https://pic.javct.net/poster/20233001/1675999045.jpg,https://javct.net/v/bony-037-rm,120,2026-07-13
MISM-159-RM,Honor student eventually becomes M. Uniform girl training record Rui Hiiragi [Uncensored L**ked],https://pic.javct.net/poster/20221904/1654165484.jpg,https://javct.net/v/mism-159-rm,128,2026-07-13
LULU-262-RM,"My Adult Younger Brother Was Irritated By The Defenseless Breasts Of A Big-breasted NEET Older Sister Who I Met For The First Time In Several Years, So I Impregnated Her Many Times As A Raw Masturbator And Instilled A Sense Of Responsibility In Her. Yuria Yoshine [Uncensored L**ked]",https://pic.javct.net/poster/20231912/1703829546.jpg,https://javct.net/v/lulu-262-rm,160,2026-07-13
XRW-774-RM,A Yakuza Widow Bears The Resentment Of Her Clan And Gets Fucked Hard - Kanna Misaki [Uncensored L**ked],https://pic.javct.net/poster/20221202/1647523957.jpg,https://javct.net/v/xrw-774-rm,109,2026-07-13
CEMD-343-RM,"""All Men In General! Please Make Me Cum!""-A Sex Documentary That An Amateur Man I Found On The Street Made Me Cum Until I Broke-Miku Misora [Uncensored L**ked]",https://pic.javct.net/poster/20230206/1686369391.jpg,https://javct.net/v/cemd-343-rm,138,2026-07-13
